issued_at,link,title,question,answer,fatwa_number,dar_ul_ifta,category_lvl_1,category_lvl_2
2013-05-17,https://almuftionline.com/2013/05/17/5382/,فرانس کی   کمپنی میں  کام کرنے کا حکم,<p>ہم ایک پلاسٹک  کی فیکٹری  چلا رہے ہیں جس میں  مختلف نیشنل  کمپنیوں کا کام  ہو تا ہے ،  کچھ عرصہ پہلے تک  ہم فرانس کی ایک کمپنی کا  بھی کام کرتے تھے ، لیکن     رسول اللہ صلی اللہ علیہ وسلم کی شان میں گستاخا نہ  خاکوں  کی اشاعت  اور  اس کے  متعلق  وہاں کے صدر کی ڈھٹائی   اور بد تمیزی کی وجہ سے   ہم نے اس کا کام بند کردیا ، اس کمپنی کی  طرف سے کافی  درخواست کی گئی  لیکن ہم نے کام   کو  دوبارہ شروع نہیں کیا ، اور  اب ان کے سٹی انچارج بھی بار بار   درخواست  کر رہے ہیں ، کہ باقی  تمام لوگ   کا م کر رہے ہیں  لیکن آپ نے   روک رکھا ہے ، براہ مہر بانی کام دو بارہ  شروع کریں۔</p><p>اب اس بارے  میں علما ء کرام کیا فرماتے  ہیں کام  دوبارہ   شروع کرنا چاہئے یا  نہیں ؟</p>,"<h4 class=""has-text-align-center"">اَلجَوَابْ بِاسْمِ مُلْہِمِ الصَّوَابْ

</h4><p>رسول  اللہ  صلی اللہ علیہ وسلم تمام انبیا  اور اولیا کے سردار ہیں ، اللہ تعالی کے نزدیک سب سے زیادہ  محبوب مکرم اورمعزز نبی ہیں ۔ آپ  صلی اللہ علیہ وسلم کی شان میں ادنی  درجہ  کی  گستاخی اللہ تعالی برداشت نہیں  فرماتے، ایسے  بد بخت کو  آخروی  سزا کے علاوہ  دنیا  میں بھی  ذلیل اور  رسوا فرماتے ہیں ۔رسول اللہ صلی اللہ علیہ وسلم کی شان میں گستاخی کرنے والا کوئی بھی   فردہو وہ ملعون ہے،اللہ اور  اس کے رسول  صلی اللہ علیہ  وسلم کا دشمن ہے ،مسلمان حکومت کی ذمہ داری ہے کہ  ایسے  ملعون کو گرفتار  کرکے کیفر کردار تک  پہنچائے ، اگروہ  گستاخ کسی کا فر ملک  کاباشندہ ہے ،تو بھی حکومت اسلامیہ کی ذمہ داری ہے کہ پوری قوت   استعمال کرکے اس کو گستاخی سے  روکے ۔  عام مسلمانوں کی اسلامی غیرت  اور حمیت کا تقاضہ  یہ ہے کہ ایسے شخص  سے میل جول نہ رکھے ،خوشی اور غم میں اس کا ساتھ نہ دے ،اس کے ساتھ خرید وفروخت اوردیگر  لین دین سے مکمل اجتناب کرے ۔اور اسےآیندہ  گستاخی سے روکنے اور سزادلانے کےلئے  اپنا ا ثر ورسوخ استعمال کرے۔</p><p>اس وضاحت کے بعد  آپ کے سوال کا جواب  یہ ہے کہ  جب آپ نے  کمپنی  کےذمہ داران کے سامنے  دینی  غیرت اور ہمیت کا مظاہرہ کیاااور گستاخی   کرنے والوں سے لاتعلقی کا اظہار کیا ، ان کا کام  بند کردیا اب تک بھی  بائیکاٹ  جاری  رکھا  تویہ آپ کے لئے  باعث اجر  وثواب ہے ، اور ان شاءاللہ تعالی قیامت کے روزرسول  اللہ  صلی اللہ  علیہ وسلم کی   شفاعت  حاصل ہونے کا  ذریعہ ہو گا۔ اب چونکہ  صورت حال مختلف ہے  وہ سلسلہ  کسی قدر رک گیا ہے ،لہذا آپ کے لئے دوبارہ اس کمپنی کا کام کرنےکی گنجائش ہے۔تاہم اگر کسی وقت  علما ء  صلحا  اور حکومت وقت  فرانس سے  شوشل بائیکاٹ  کااعلان کرے تو  آپ کی اورآپ کے ساتھیوں کی دینی اخلاقی ذمہ داری ہوگی کہ فرانسیسی کمپنی کا کام چھوڑ دیں ۔              </p>",5382,jameya-tur-rasheed,جائز و ناجائزامور کا بیان,بچوں وغیرہ کے نام رکھنے سے متعلق مسائل
2013-05-17,https://almuftionline.com/2013/05/17/5381/,مقدس  اوراق جانے کاحکم,<p>ایک شخص نے ایک  مصروف  گذرگا ﴿ ڈپوروڈ ،حویلیاں ﴾ کے ایک طرف  زمین پر   مقدس اوراق اور  دو عدد  قرآنی نسخے جلائے ۔ملزم کو جب  پولیس  کے حوالے  کیا  گیا تو اس کا یہ اعترافی بیان سامنے آیا کہ میں نے گیس  میٹر  پر  رکھے ہوئے مقدس  اوراق کو ٹھکانے لگانے   کے لئے آگ لگا ئی ۔ ان میں دو عدد  غیر  مجلد  قرآنی نسخے بھی تھے ،لیکن  اس سے  توہین مقصود نہ تھی۔لیکن  اب وہ اپنے اس عمل پر  نادم اور تائب ہے،وہ قرآنی نسخے مکمل  جل جانے سے بچالئے  گئے،اس افسوس ناک  واقعے پر عوام میں کافی  اشتعال کی کیفیت  ہے۔ آپ سے التماس  ہے کہ شریعت کی روشنی میں  رہنمائی  فرمائیں۔</p>,"<h4 class=""has-text-align-center"">اَلجَوَابْ بِاسْمِ مُلْہِمِ الصَّوَابْ

</h4><p>بوسیدہ  قرآن کریم کو جلانا  جائز نہیں ،اسی طرح اس کے ساتھ کسی  بھی  طرح کا بے ادبی کا معاملہ کرنا بھی  جائز نہیں ، قصدا جان بوجھ کر   اس کی  توہین کرنا  کفر  ہے ،لیکن  انجانی  میں غیر اختیاری   طور پر کوئی  بے  ادبی کا  عمل صادر  ہوجائے  تو   اس پر کفر کافتوی  نہیں لگایا جائے گا ۔ لہذا صورت  مسئولہ  میں جب   ملزمان  نے برملا  سب کے سامنے  اپنی  غلطی  کا اقرار کرکے توبہ  استغفار کرلیا ان پر کفر کا فتوی  لگاکر  کوئی  سزانہیں  دی  جائے گی  بلکہ ان کے  ساتھ عام مسلمانوں والا  معاملہ کیاجائے گا۔</p><p> نوٹ ؛مقدس اوراق کاحکم  یہ ہے کہ   ان  کو  کسی محفوظ بوری وغیرہ  میں بھر کر قبرستان یا  کسی ایسی  جگہ دفن کردیا جائے جو  بے ادبی سے محفوظ ہو ، یا اس بوری میں  پتھر ڈال کر  گہرے پانی میں ڈبودیا جائے ۔</p><p>یابوسیدہ  قرآن کریم  اوردیگر مقدس  اوراق کی ریسائیکلنگ   کا عمل  کرنے والی کمپنی کے حوالےکیاجائے  ۔</p><p>البتہ اس بات کاخیال رکھاجائے کہ  لکھائی  مٹانے کے لئے استعمال شدہ  پانی  کو گندے نالے  میں  نہ ڈالا جائے، بلکہ  ادب واحترام کو ملحوظ  رکھتے  ہوئے  دریا /کنویں  وغیرہ  میں  ڈالاجائے ، اس  سے تیار شدہ  کاغذ ات پر دوبارہ  قرآن  کریم  لکھے یا ان کاغذات  کو  کسی اور جائز  کام کے لئے استعمال  کرے  دونوں  صورتیں جائز  ہیں  ۔</p>",5381,jameya-tur-rasheed,جائز و ناجائزامور کا بیان,بچوں وغیرہ کے نام رکھنے سے متعلق مسائل
2013-05-17,https://almuftionline.com/2013/05/17/5380/,قادیانی مرتد کے ساتھ لین  دین کرنے کاحکم,<p>میر اجنرل اسٹور  ہے ، اس  میں خرید  وفروخت کا کام  کرتا ہوں ، اگر  دکاں میں  کوئی   قادیانی خرید اری کے لئے  آئے تو   اس کے ہاتھ مال فروخت کرنے کیا حکم ہےشرعا جائز  ہے  یا نہیں  ؟ آمدنی کا کیا حکم ہے ؟</p>,"<h4 class=""has-text-align-center"">اَلجَوَابْ بِاسْمِ مُلْہِمِ الصَّوَابْ

</h4><p>حضرت محمد مصطفی صلی اللہ علیہ وسلم اللہ تعالی کے آخری نبی ہیں آپ کے بعد   قیامت تک کوئی نیا نبی مبعوث نہیں ہوگا ، آپ   پر ایمان لانا  ہر مسلمان کے ایمان کاضروری حصہ ہے ،آپ علیہ السلام کے علاوہ کسی اور شخص کو نیا نبی تسلیم کرنا ایمان کے منافی ہے   </p><p>                                      ( سورة  الحزاب40)          مَا كَانَ مُحَمَّدٌ أَبَا أَحَدٍ مِنْ رِجَالِكُمْ وَلَكِنْ رَسُولَ اللَّهِ وَخَاتَمَ النَّبِيِّينَ وَكَانَ اللَّهُ بِكُلِّ شَيْءٍ عَلِيمً                                                                   </p><p>دلائل النبوة للبيهقي (7/ 482، بترقيم الشاملة آليا)</p><p>وإنه سيكون في أمتي كذابون ثلاثون كلهم يزعم أنه نبي ، وإني خاتم النبيين ، لا نبي بعدي » </p><p>قادیانی چونکہ  حضرت  محمد رسول اللہ صلی اللہ علیہ وسلم کو اللہ تعالی کا آخری  نبی تسلیم کرنے کی بجائے  مرزا غلام احمد کذّاب  کو نبی مانتے ہیں، اس لئے دائرہ اسلام سے خارج ہیں ۔</p><p>تمام مسلمانوں کے  اسلامی غیرت اور حمیت کا تقاضایہ ہے کہ قادیانیوں سے میل جول نہ رکھیں ،ان کی شادی بیاہ اور دیگر خوشی اور غمی کی تقریبات  میں شرکت نہ کریں ،ان سے تجارتی لین دین بھی نہ کریں ۔ البتہ اگر  دعوت وتبلیغ کی غرض  سے  میل جول رکھے تو اس  میں کوئی گناہ  نہیں ، بلکہ  ایسا شخص اجر  و ثواب  کاحقدار ہوگا ۔ان شاء اللہ تعالی ۔</p><p><span dir=""RTL"">        لہذا  صورت مسئولہ  میں  آپ  کو  چاہئے  کہ  قادیا  نی شخص  کے  ہاتھ مال  فروخت  نہ  کریں ، اگر شرعی  حکم سے  لاعلمی  کی بنیادپراس سے پہلے کسی قادیانی کو مال  فروخت کیا ہے تو یہ  عمل اسلامی غیرت اور حمیت کے خلا ف ہونے کے باوجود اس  </span></p>",5380,jameya-tur-rasheed,ایمان وعقائد,اسلامی فرقوں کابیان
2013-05-07,https://almuftionline.com/2013/05/07/5097/,اذان سے پہلے  صلو ة  وسلام پڑھنے کاحکم,<p>اذان  سے پہلے  صلوة وسلام پڑھنے کاکیاحکم ہے؟</p>,"<h4 class=""has-text-align-center"">اَلجَوَابْ بِاسْمِ مُلْہِمِ الصَّوَابْ

</h4><p>رسول اللہ  صلی اللہ  علیہ  وسلم  کی ذات  گرامی پر  درود بھیجنا   بہت  با برکت  اور اجر  وثواب  والا عمل  ہے ،لیکن  اس عمل کو بے محل اور بے وقت  نہیں کرنا چاہئے ۔ اذان کے ساتھ درود کا  موقع  اذان ختم ہونے کا بعد ہے ،رسول اللہ  صلی اللہ علیہ وسلم نے فرمایا  کہ  جس نے  اذان کے  بعد درود پڑھ کر اذان کی  دعا پڑھی اس کو  میری  شفاعت  حاصل ہوگی ۔</p><p><span dir=""RTL"">اذان سے پہلے  درود  شریف پڑھنا  رسول اللہ صلی اللہ  علیہ وسلم   صحابہ  تابعین   ائمہ دین رحمہم اللہ سے ثابت نہیں ،لہذا  اذان سے پہلے لازمی طورپر بلند آوازسے  درود پڑھنا  بدعت ہے ،اس کی بجائے   اذان کے بعد پڑھا جائے ۔ </span></p>",5097,jameya-tur-rasheed,جائز و ناجائزامور کا بیان,بچوں وغیرہ کے نام رکھنے سے متعلق مسائل
2013-04-18,https://almuftionline.com/2013/04/18/5694/,ٹورنا منٹ میں ہار جیت کی شرط کا حکم,<p>جناب  مفتی صاحب  عرض یہ ہے کہ  ہمارے  علاقے  میں کرکٹ   یا  دوسرے  کھیل کھلنے  والی ٹیمیں   آپس  میں  ٹور نامنٹ  میچ  کھیلتے ہیں ، اس میں  شرکت کے لئے ہر ٹیم  ایک  مخصوص  مقدار میں رقم  جمع کرواتی  ہے ،پھر  جو  ٹیمیں  جیتتی ہیں  انہیں  ان پیسوں  سے انعام دیا جاتاہے ، تو  شرعا   اس کا  کیا حکم  ہے ،ان پیسوں کا  کیا حکم ؟</p>,"<h4 class=""has-text-align-center"">اَلجَوَابْ بِاسْمِ مُلْہِمِ الصَّوَابْ

</h4><p>اگرکھیل کا مقصد  جسمانی  ورزش  یا ذہنی تکان دور  کرنا ہو  تو شرعا ایسے  کھیل کی گنجائش ہے، بشرطیکہ   اس  میں ایسا انہماک  نہ ہو کہ  فرائض  ،واجبات  نماز  وغیرہ  میں خلل   واقع ہو۔اس میں ہار  جیت  کی صورت میں    دونوں طرف  سے پیسوں   وغیرہ   انعام  کی شرط  بھی  نہ ہو۔</p><p>صورت  مسئولہ میں  چونکہ  تمام  ٹیموں سے    وصول کردہ رقم جیتنے  والی ٹیم کو بطور دیجاتی ہے جوکہ جوا کے حکم میں  داخل ہونے کی بناء پر  ناجائز ہے ۔لہذا اس طرح ہارجیت  کی شرط کے ساتھ کھیلنا جائز نہیں ،نیز یہ کہ اس طرح ٹورنامنٹ میچ منعقدکرنے  میں جواکی شرط کے علاوہ دیگر مفاسد بھی ہوتے ہیں مثلا نمازوں کو ضائع کرنا ،گھر  والوں کے حقوق  ادا نہ  کرنا  وغیرہ اس لئے  اس طریقے  سے ٹورنامنٹ کے انعقاد سےاجتناب کرنا چاہئے ۔</p><p>البتہ اس کے جواز کی یہ  صورت ہو سکتی ہے کہ  تما م ٹیموں سے  رقم  جمع کرکے  جیتنے  والی ٹیم کو انعام کے طور پر  دینے  کی بجائے  کوئی  تیسری  پارٹی  جو کھیل میں شریک نہیں  ہے ، وہ  سب ٹیموں  سے  بطور  فیس  رقم وصول کرے ، اس سے کھیل کے انتظامی  خرچہ  بھی  برداشت  کرے، اورجیتنے  والی  ٹیم کو انعام  بھی دے، تو  مذکورہ   بالا شرائط  کی رعایت کے ساتھ  اس کھیل  کی   گنجائش ہوگی ۔</p>",5694,jameya-tur-rasheed,جائز و ناجائزامور کا بیان,جائز و ناجائز کے متفرق مسائل
2013-04-17,https://almuftionline.com/2013/04/17/8038/,میراث  میں  جائداد  کےبدلے  نقدی  دینے کاحکم,<p>کیا فرماتے ہیں  علماء کرام اس مئلہ کے بارے میں  کہ  سیف اللہ  مرحوم کے   ورثاء میں ان کے پانچ  بیٹے  ،مشک  عالم مرحوم ، گل شاہ  عالم مرحوم،  حق نواز ،طالب جان اور محمد   عالم ہیں ،اور  دو لڑکیاں حنیفہ  اور  انوجانہ  بی بی  ہیں ، سیف اللہ مرحوم نے   اپنی زندگی میں   کسی کو بھی حصہ  نہیں دیا ، پھر   ان کو   جدائی   ﴿تقسیم﴾ کے   وقت  بھی   اپنی بہنوں  کو حصہ نہیں دیا ،حاجی گل شاہ عالم وفات پاچکے ہیں  ، کیا شریعت کی روسے  ان کے  بیٹے گل شاہ   عالم کے بہنوں  کو  حصہ دینے کے پابند ہونگے ۔اگر  ہونگے تو یہ وضاحت   کریں    کہ حنیفہ  مرحوم اور انو جانہ کے کتنے حصے ہونگےاور  ہرایک   بھائی کا   کتنا  حصہ ہوگا؟</p><p>اور  حنیفہ    بی بی  وفات پاچکی ہے ،اس کا   حصہ زمین کے بدلے نقد روپے کی  شکل میں دے سکتے  ہیں ؟</p>,"<h4 class=""has-text-align-center"">اَلجَوَابْ بِاسْمِ مُلْہِمِ الصَّوَابْ

</h4><p>شریعت نے مرنے  والے کی  میراث میں  لڑکوں کی طرح   لڑکیوں  کا حق بھی متعین کردیا   ہے ، لہذا باپ  کے انتقال کے بعد   لڑکوں کا میراث  کا  مال آپس میں بانٹ  لینا  اور   بہنوں کو میراث سے محروم کردینا  بڑا  سخت گناہ ہے،آخرت  میں سخت  وبال کا باعث  ہوگا ۔لہذا  مسئولہ  صورت میں  مرحوم   سیف اللہ کے  لڑکوں پر لازم ہے ،کہ پہلی تقسیم  کو توڑ  دیں   اور  دوبارہ    شریعت  کے مطابق  میراث تقسیم کریں  ۔</p><p> تقسیم کا طریقہ  یہ کہ</p><p>مرحو م سیف اللہ نےانتقال   کے وقت منقولہ غیر منقولہ   جائداد  ، سونا  چاندی  ،نقدی  اور  چھوٹا  بڑا  جو بھی سامان اپنی ملک  میں  چھوڑا  ہے ،  سب کا مجموعہ  مرحوم کا ترکہ ہے ، اس میں  سے اولا   مرحوم  کے  کفن دفن کا متوسط  خرچہ نکالا جائے ،اس کے بعد مرحوم  کے  ذمے اگر  کسی کا قرض  ہو اس کو کل مال سے ادا  کیاجائے ، اس کے بعد اگر  مرحوم  نے کوئی جائز   وصیت کی ہو  تو تہائی  مال کی حدتک اس پر عمل کیاجائے ۔ اس کے  بعد  مال  کو مساوی 12 حصوں  میں تقسیم کرکے  مرحوم کے چانچوں   لڑکوں  میں سے  ہر ایک کو    دو دو  حصے دئے جائیں  اور دونوں لڑکیوں  کو ایک ایک  حصہ دیاجائے ۔</p>",8038,jameya-tur-rasheed,میراث کے مسائل,مناسخہ کے احکام
