issued_at,link,title,question,answer,fatwa_number,dar_ul_ifta,category_lvl_1,category_lvl_2
2013-09-10,https://almuftionline.com/2013/09/10/9854/,ایک پلاٹ پر دو مرحومین  کے   ورثاء  کا تنازع,<p>کیافرماتے  ہیں علماء کرام  اس مسئلہ کے بارے میں   کہ   منظور   علی  ایک کمپنی    میں  ملازم تھا      2008 میں   اس کی   کمپنی    نے   پلاٹ کی ایک اسکیم اپنے ملازمین کے لے لاینچ  کی تھی ، اس کی فوری ادائیگی   جزوی طورپر   ایک  لاکھ بتیس ہزار   جمع کروانے کے لئے کمپنی نےکہا ،  لیکن    منظور علی کے پاس   رقم کاانتظام  نہ ہونے کی وجہ سے  اپنے قریبی رشتے دار محمد اکرم  سے تعاون کرنے کو  کہا ،اور پلاٹ کی پوری  رقم  محمد  اکرم سے  لیکر  جمع کروادی ،اور  نومینشن میں    محمد اکرم  کا اندراج کروا کر مکمل کاغذات  کی اصل فائل محمد  اکرم کے حوالے کردی  تاکہ  الائٹمنٹ  کا وقت آ ئے گا   توالائٹی  محمد  اکرم   کو کروادونگا کیونکہ   آنے والے وقت میں   بقایا جات   کی ادائیگی  بھی منظور  علی نے محمد  اکرم کے ذمے کردیا تھا ،اب 16سال کے بعد   کمپنی  نے بقایاجات کے لئے  آگاہی شروع کردی ۔واضح   ہوکہ   منظور علی کی وفات   2013  میں  ہوچکی  ہے ،اور محمد اکرم کی وفات  2020  ءکو ہوئی ہے ،اب دونوں مرحومین کے ورثاء  اس پلاٹ کے  دعوے دار   بن رہے ہیں ،منظور  علی کے ورثاء   شراکت داری   کا کہہ  رہے ہیں  لیکن  محمد   اکرم کے ورثاء   اس پر راضی نہیں ،ان کا کہنا   یہ ہے کہ     منظور   علی 2008 میں  ہی   محمد اکرم کے حق میں دست بردار ہوچکے تھے ، اس مسئلہ کو شریعت کے مطابق   حل کریں تاکہ فریقین   گنا ہگار   نہ ہوں  کسی فریق کی حق تلفی نہ  ہو۔</p>,"<h4 class=""has-text-align-center"">اَلجَوَابْ بِاسْمِ مُلْہِمِ الصَّوَابْ

</h4><p>سوال  کی تحریر  کے  مطابق پلاٹ  کی خریداری  کا حق    کمپنی نے منظور علی  کو دیا تھا  ،لیکن منظور علی  کے پاس  رقم  کاا نتظام   نہ   ہونے  کی  وجہ سے   اس نےمحمد اکرم سے  رقم لیکر کمپنی  میں جمع کروایا ، اور  نومینشن    میں  نام بھی   محمد  اکرم  کا  اندراج  کروایا  اور2008 ءمیں اپنا حق  محمد  اکرم کو دیدیا  تھا ، چنانچہ پلاٹ  کے حصول  کے لئے   ادا  شدہ   قسط  کی پوری  رقم  محمد اکرم   نے  ادا کی  اس کے  علاوہ الائٹی  میں  بھی نام محمد  اکرم  کا    لکھوایا  گیا   اور    پلاٹ کے مکمل کاغذات  بھی محمد اکرم کے حوالے  کئے  گئے تھے،اگر  سوال میں لکھی  ہوئی تمام  باتیں  درست  ہیں اور کمپنی  کے قوانین   کے  تحت  اس بات کی اجازت بھی ہو کہ  کوئی ملازم   اپنا حق   بالعوض یا بلا عوض کسی اور  کو منتقل   کرسکتا  ہے ،تو  ایسی  صورت میں  مذکورہ    پلاٹ محمد اکرم  کاہے، لہذا پلاٹ کے بقاجات  کی  ادائیگی   محمد اکرم  کے ورثاء  کے ذمے لازم ہے ،اور  اس پلاٹ کو  محمد اکرم کے   ترکے  میں  شامل کرکے انہیں کے  ورثاء میں   تقسیم کیاجائے گا  ۔</p><p>منظور علی کے  ورثا  ء کی طرف   سے اس پلاٹ  میں شرکت  کا دعوی  کرنا بھی   جائز  نہیں کیونکہ  سوال    کے مطابق    منظور علی   نے اس پلاٹ   کی خریداری   میں    اپنی  کوئی  رقم شامل  نہیں کی تھی ، البتہ   کمپنی  کی طرف سے  خریداری  کا  اس کو حق  حاصل  تھا ،  جو اس نے   محمد  اکرم  کی طرف   منتقل کر دیا  تھا،اوراس   حق  کی  منتقلی  کے حوالے سے   آپس میں  کوئی  معاہدہ  بھی     نہیں   ہوا   تھا   جس کی وجہ سے فریق ثانی   پر کوئی عوض  لازم   ہو  لہذا  یہ  منظور علی  کی   طرف سے  تبرع شمار ہوگا ، اس لئے منظور    علی کے   ورثا   ء   اس  پلاٹ  میں    شراکت  دار  نہیں  ہونگے ۔ ہاں اگر محمد   اکرم  کے ورثا  ء  کو  چاہئے  کہ منظور علی  کے ورثاء کو تبرعا    کچھ   دیدیں   یہ ان کی  طرف سے احسان ہوگا ۔</p>",9854,jameya-tur-rasheed,میراث کے مسائل,مناسخہ کے احکام
2013-09-10,https://almuftionline.com/2013/09/10/9828/,شادی  میں مہر  مقرر کرنے کاحکم,<p>السلام علیکم ورحمتہ اللہ وبرکاتہ: ایک شادی شده آدمی رشتہ کیلے میرے گھر آیا جو کئی سالوںسے مجھ سے اور میرے گھر والوں سے واقف تھا۔ میرے گھر میں آکراس آدمی نے مجھ سے کہا کہ تم مجھے پسند ہو، اور میں تم سے شادی کرنا چاہتا ہوں اور تم لوگ میری اس آفر کو قبول کرلو۔یعنی شادی کی درخواست کی۔ اس مجلس میں میرے ساتھ میری ماں اور گھر کی ایک اور عورت بھی شامل تھی۔ ( کوئی مرد نہیں تھا).میں نے جواب دیا کہ میں تم سے شادی کیلے راضی ہوں بشرطیکہ تم مجھے شادی سے پہلے دس لاکھ روپے اور سونے کا ہار وغیرہ دے دو۔اس آدمی نےجواب دیا کہ مجھے تیری یہ شرائط بالکل منظور ہے۔ میں نے جواب دیا اگر شرائط منظور ہے توپھر میں آپ سے شادی کیلے راضی ہوں، لیکن یہ شرائط تم نے شادی سے پہلے پورے کرنےہونگے۔اس کے علاوہ نہ تو نکاح  نام کا کوئی ذکر ہوا، اور نہ مجھ سے کسی نے یہ پوچھا کہ آیایہ آدمی تجھے اتنے مہر کے مقابل نکاح میں قبول ہے یا نہیں؛ میں نے صرف یہ کہا کہ میں تم سے شادی کرونگی بشرطیکہ تم شادی سے پہلے میری شرائط پوری کرو۔ اس کے چند دن بعد، یہ آدمی دوبارہ ہمارے گھر آیا، اور میری فیملی کے ساتھ ملاقات کی، میرے سارے فیملی ممبرزموجودتھے ، میرے بھائیوں نے اس آدمی سے کہا: ( اب چونکہ تم نے میری بہن کو شادی کیلے راضی کیاہے،  فلہذا تم نے جو میرے بہن کے ساتھ  وعدے کیے ہیں اسے پورے کرنے ہونگے،ہماری بہن کی رضا ہماری رضا ہے). اس آدمی نے دوبارہ شرائط پورے کرنے کی یقین دہانی کی۔اب تک تقریباً اس واقعے کو بارہ سال ہوگئے، لیکن اس آدمی نے جو میرے ساتھ وعدے  کیے</p><p>تھے وہ شرائط پوری نہیں کی۔(دس لاکھ میں سے دولاکھ دے ہیں اور ایک سونے کا ھار، بقیہ اٹھ لاکھ نہیں دے پا رہاہے)۔ اس آدمی نے کئی دفعہ وعدہ کیا کہ مجھے ایک مہینہ یا دو مہینے وقت دےدو، لیکن کئی دفعہ  کے وعدوں کے بعد  بھی اس نے میری شرائط  پوری  نہیں  کی۔ایک دفعہ تو اس آدمی نےمجھے فون پر یہ بھی کہ دیا کہ اگر میں نے ایک مہینے تک تیرے شرائط پوری نہیں کی تو تم میری طرف سے آزاد ہو۔میں ابھی تک اپنی ماں کے گھر پر ہوں، شادی نہیں  ہوئی ابھی تک۔ میں ابھی دو لاکھ اورسونا واپس کر نا چاہتی ہوں لیکن لڑکا اسرار کر رہا ہے کہ میں واپس نہیں لونگااور ہمارا نکاح  ہوا ہے۔ میرا آپ سے سوال یہ ہے کہ مندجہ بالا معلومات کی روشنی میں آیامیرا نکاح اس آدمی کے ساتھ ہوا ہے یا نہیں؟آپ کے جواب کا منتظر۔</p>,"<h4 class=""has-text-align-center"">اَلجَوَابْ بِاسْمِ مُلْہِمِ الصَّوَابْ

</h4><p>واضح ہوکہ     نکاح  منعقد ہونے  کے لئے شرعا  ضروری ہے کہ  نکاح  کی مجلس  میں    دو گواہوں  کی موجودگی میں  لڑکا  اور لڑکی  ایجاب اور قبول  کریں ،اس  طرح  نکاح کی شرائط  پوری  کرکے  ایجاب  وقبول  کرنے سے  دونوں   کے آپس میں نکاح منعقد ہوجاتا  ہے ،اس موقع پر اگر مہر کا ذکر  ہو اہو   تو   نکاح  منعقد ہونے سے  آدھا مہر لازم ہوجاتا  ہے اور  رخصتی ﴿  یعنی میاں  بیوی  کے آپس  میں  ازواجی   تعلق قائم ہوجانے﴾کی صورت  میں پورا مہر ادا  کرنا  لازم  ہوتا ہے ،</p><p>لہذا  صورت مسئولہ  میں اگر  صرف نکاح  کا وعدہ  ہوا  تھا   شرعی  قاعدہ  کے مطابق  نکاح نہیں  ہوا  تھا  جیسا  کہ سوال میں  مذکور ہے ،تو ایسی  صورت میں شخص مذکور کو نکاح پر  اصرار کرنے کا شرعا حق نہیں ،البتہ  عورت  نےنکاح کرنے کی شرط  پر جو رقم حاصل کی  ہے اس پر  وہ  رقم واپس کرنا لازم  ہے ، لہذا اگر عورت دوسری  جگہ  نکاح  کرنا  چاہے تو شرعا اس  کو  دوسری  جگہ  نکاح کرنے کی اجازت  ہوگی ۔</p>",9828,jameya-tur-rasheed,نکاح کا بیان,جہیز،مہر اور گھریلو سامان کا بیان
2013-07-29,https://almuftionline.com/2013/07/29/4392/,"""تم فارغ ہو”کے الفاظ سے طلاق کا حکم","<p>کیا فرماتے ہیں علمائےکرام و مفتیانِ عظام اس مسئلہ کے بارے میں کہ میرے اور شوہر کے درمیان لڑائی جھگڑا چل رہا تھا،میں ان سے ناراض تھی۔ایک دن ہم گاڑی میں  گھر سے باہر گئے تو دوران سفر  ہمارے درمیان تلخ کلامی ہوگئی۔اچانک میرے شوہر نے اس دوران کہا:تمہیں طلاق ہے۔پھر کچھ وقفے کے بعد کہا:اگر تم نے جانا ہو تو،پھر بات تبدیل ہوگئی اور دوسری باتوں پر ہماری بحث شروع ہوگئی۔</p><p>تھوڑی دیر بعد ہم گھر واپس آگئے تو میرے شوہر نے کمرے میں جا کر رونا شروع کر دیا اور مجھے کمرے سے باہر جانے کو کہا۔میں نے اپنے شوہر سے معافی مانگی ،پھر بھی وہ روتے رہے۔اس دوران میرے شوہر نے کہا کہ آپ مجھے اپنے اور میرے تعلق کے طعنے دیتی ہو۔آپ کو پتہ نہیں کہ میاں بیوی کا تعلق کیا ہونا چاہیے؟ میں قسم کھاتا ہوں کہ آپ کو ہاتھ نہیں لگاؤں گا،تم فارغ ہو۔بعد میں جب میرے شوہر نارمل ہوگئے تو میں نے ان سے ان الفاظ کا مطلب پوچھا تو انہوں نے جواب دیا کہ""میں آپ کو پسند نہیں تو آپ کے قریب بھی نہیں آؤں گا""۔پھر انہوں نے قسم توڑ دی اور نارمل ہوگئے۔اس کے بعد ہم دونوں میں میاں بیوی والے تعلقات پھر سے بحال ہوگئے اور ہم دونوں اگٹھے رہنے لگے۔کچھ عرصہ بعد مجھے معلوم ہوا کہ ان الفاظ سے طلاق بھی ہوتی ہے تو میرے پوچھنے پر شوہر نے کہا کہ میرا ہر گز یہ مطلب نہیں تھا اور نہ مجھے علم تھا کہ ان الفاظ سے طلاق ہوتی ہے اور میں اس پر قسم کھانے کو بھی تیار ہوں۔سوال یہ ہے کہ کیا ان الفاظ سے طلاق واقع ہوئی ہے؟ اوراگر ہم آئندہ اگٹھے رہنا چاہیں تو اس کا کیا حل ہے؟</p>","<h4 class=""has-text-align-center"">اَلجَوَابْ بِاسْمِ مُلْہِمِ الصَّوَابْ

</h4><p>شوہر نے جب پہلی مرتبہ کہا:""تمہیں طلاق ہے""تو اس سے ایک طلاقِ رجعی واقع ہو ئی۔اس کے کچھ دیربعد""اگر تم نے جانا ہو تو""کے الفاظ کہنےسے یہ حکم نہیں بدلتا۔پھر گھر میں جب شوہر نے ""تم فارغ ہو"" کہا اور اس سے اس کی نیت طلاق کی نہیں تھی تو اس سے طلاق واقع نہیں ہوئی۔</p><p>لہٰذا  ایک طلاقِ رجعی کے بعد آپ دونوں میں میاں بیوی والے تعلقات قائم ہونے  کی وجہ سے رجوع</p><p>ہو گیا،لہٰذا اب آپ دونوں کے درمیان نکاح باقی ہے۔البتہ شوہر کو آئندہ صرف دو طلاقوں کا اختیار ہوگا،اس لیے آئندہ احتیاط کریں۔</p>",4392,jameya-tur-rasheed,طلاق کے احکام,الفاظ کنایہ سے طلاق  کا بیان
2013-06-17,https://almuftionline.com/2013/06/17/8042/,غصے میں معلق  طلاق    کاحکم,<p>جناب  مفتی  صاحب  عرض  یہ ہے  کہ میرا بیٹا  ساڑھے    سولہ سال کا ہے ، اور  بیٹی  ساڑھے  انیس سال کا ، 2نومبر کورات کاکھانا نہیں  کھانا  چاہتے تھے چونکہ  صبح بھی کھانا  نہیں کھایا  تھا ،اس لئے زبردستی کی ، بیٹی  کھانا  ختم کرچکے  تھے،اور بیٹا   غصے میں کھا رہا  تھا  ،لیکن  آخری   لقمہ رہ  گیااس کو کھانے سے  منع کرنے لگا،میں  نے زبر دستی  اس کے منہ میں ڈالا  اس نے غصے میں  اٹھ کر مجھے لات  ماری  جو  میری  ٹانگ  میں لگی ۔میں کھانا سمیٹ کر   کمرے سے باہر آگئی  ،اندر کمرے  میں شور ہونے لگا  ،میرے شوہر نے  بچوں کی پیٹائی  کی اور باہر  آکر  مجھے  بھی مارا اور بیٹےکو  مارتے ہوئے کہا کہ آیندہ    اگرماں کو  مارا  ،اور کوئی ایسی حرکت  کی  بہت مارونگا  میرے سامنے   بالکل  نہیں ہونا چاہئے ۔اکیلے  میں تیری  جو مرضی آئے  کر۔</p><p>اگلے  دن 3نومبر کو  سب  معمول  کے مطابق   کام پر  اور بچے کالج  چلے گئے ۔شام  کو آئے  میرے شوہرنے غصے میں فون کرکے  میرے  ماں باپ کو   بلانے کو  کہا  ،پھر  کچھ دیر کے بعد منع کردیا  ،بچوں سے پوچھا ،کہ  اپنی  ماں کے ساتھ رہنا ہے  یا میرے ساتھ  ؟ یہ سن کربچے رو رہے تھے ،پھر بچوں  کو گواہ بنا  کر میرا   نام لیکر تین بار یہ جملہ کہاکہ ﴿میں تمہیں  طلاق دیتا   ہوں اگر دوبارہ  ایسا ہوا  جیسا  کل ہواتھا  ۔ ﴾  اور  شوہر نے  فون پر بتایا   کہ    اس  پورے  جملے  کو   تین فعہ  دہرایا  ہے ۔</p><p> پھر   4 نومبر  کو  بچہ  کالج سے  واپس آیا   تو  میں نے   پوچھا  کہ رکشہ  میں دوسرا بچہ کون  تھا ،  کیونکہ  میرا بیٹا  اکیلا  آتا جاتا  ہے ،اس سوال  پر بیٹا نارض  ہو گیا  اور   بولنا شروع  کردیا کہ  اس کے  گھر  والوں  نے  بھی یہ رکشہ  لگالیا  ہے،کیا   ہر بات پر بولنا  ضروری ہے؟ میں  نےپھر پوچھا   بابا  ﴿  والد ﴾  کو  معلوم ہے  تو  غصے میں   بولنے  لگا  آپ کو کیا مسئلہ ہے ؟ بڑ بڑ اتا  ہو اباتھ  روم کے  سامنے  چپل  پھنکتا  ہو ا اندر    چلا  گیا  ، میں  باہر آگئی  تا کہ  زیادہ   بدتمیزی نہ ہو ۔شام  کو  بچوں   نے بتا یا   آج ایسا  کچھ  نہیں ہوا   جو   2نومبر  کو ہوا تھا، وہ  غصے کی  کیفیت الگ تھی  آج   غصہ نہیں تھا،  نار  مال  حالت میں  تھے۔</p><p>5 نومبر   کو  میرے شوہر نے  گھر سے باہر جاتے ہوئے  بیٹی  کو گواہ  بناکر کہا   کہ میں نے مفتیان کرام سے مسئلہ پوچھا    ہے  دیکھو وہ   کیا کہتے ہیں  ،  تین بار کہا   کہ میں  اپنے  الفاظ اور جملے واپس   لیتا  ہوں ۔اب مفتیان  کرام  جیسے بتائیں  گے  اس پر عمل ہوگا ۔</p><p>اب  میرے  شوہر پریشان ہے ، بڑی  غلطی  ہوگئی ہے ،اور  حلفیہ   بیان  دے رہا ہے  کہ ان  کا کوئی ایسا   ارادہ نہیں  کہ موقع  پر کچھ کر گزرے ،لہذا  آپ مفتی صاحبان   سے فتوی  درکار ہے ۔</p>,"<h4 class=""has-text-align-center"">اَلجَوَابْ بِاسْمِ مُلْہِمِ الصَّوَابْ

</h4><p>واضح  ہو کہ مفتی کو غیب کا علم نہیں  ہوتا ،بلکہ سوال  میں لکھی ہوئی  تحریر کے  مطابق  ہی  جواب  لکھا جاتا ہے،باقی  سوال میں  صحیح  بات لکھنے  کی تمام تر ذمے داری  سائل پر عائد ہوتی ہے ، لہذا اگر کوئی شخص  تین طلاق دینے سے بیوی کے حرام  ہونے کے بعد غلط بیانی کے ذریعہ کسی دارالا فتاء   سےطلاق واقع نہ ہونے کا فتوی حاصل کرے ،اور پھراس طرح  تین طلاق یافتہ عورت کو بیوی بناکر گھر میں بسائے او ر  دونوں میاں  بیوی  کی حیثیت  سے زندگی  گذار ے ،تو  شرعا یہ  حرام کاری  ،زنا کاری،  بدکاری کے  حکم میں داخل  ہے ،لہذا اگر  میاں  بیوی میں  جھگڑے  کے دوران  طلاق کے الفاظ  استعمال ہوئے  ہوں ، تو خوب  دیانتداری  کے ساتھ واقعہ  بیان   کرکے مسئلہ  کا حکم معلوم  کرکے عمل کرنا  چاہئے  ۔</p><p>مسئولہ صورت میں سوال  کی تحریر کے مطابق   مذکورہ  خاتون  کو 3نومبر 2022 کو ایک ہی   مجلس  میں  تین  مرتبہ  معلق طلاق  دی گئی ہیں ،کہ اگر  لڑکے نےدوبارہ  ایسی   بد تمیزی کی حرکت  کی  جو  2 نومبر کو کی  تھی تو  طلاق  واقع ہوگی۔  اور شوہر  خوداس بات  کا اقرار  کررہا ہے  کہ  شرط  وجزا ء کے  ساتھ  تین  مرتبہ یہ  جملہ  دہرایا   ہے ،  اگر   حقیقت میں  ایسا ہی ہوا  ہے کہ شوہر  نے  شرط وہ  جزا کے ساتھ   پورے  جملے کو  تین مرتبہ  دہرایا  ہے ،  تو مسئلہ کاحکم  یہ ہے کہ اس  معلق طلاق کے بعد اگر لڑکے کی طرف سے  ماں  پر  ہاٹھ اٹھانے  کا واقعہ   اب تک دوبارہ پیش نہیں آیا تو   طلاق  واقع نہیں ہوئی  ،اور  نکاح برقرار  ہے ،دونوں  کے لئے  ازدوا جی زندگی  بحال  رکھنا  جائز ہے ۔لیکن آیندہ  کسی بھی   وقت اگرلڑکا   ماں  پرہاتھ اٹھانے کی   بدتمیزی کرےگا  توتینوں معلق   طلاقیں  واقع ہوجائیں گی ۔ اس لئے  لڑکے کو  بھی خوب احتیاظ کرنا لازم ہے، تاکہ  ماں باپ  کی زندگی خراب  نہ  ہو ۔ ویسے بھی ایک  بیٹے کے لئے اس سے بڑی بد بختی کیا ہوگی  کہ  وہ  اپنی  ماں پر  ہاتھ  اٹھائے ، لہذا  لرکے کو  چاہئے  کہ جو غلظی ہوگئی  اس پر والدین سے معافی مانگے اور استغفار  بھی کرے ۔</p>",8042,jameya-tur-rasheed,طلاق کے احکام,الفاظ کنایہ سے طلاق  کا بیان
