issued_at,link,title,question,answer,fatwa_number,dar_ul_ifta,category_lvl_1,category_lvl_2
2020-01-19,https://almuftionline.com/2020/01/19/2734/,گاؤں میں جمعہ کا حکم,<p>ہمارےگاؤں مونگن میں مقامی علماءکی رائے سے جمعہ ہوتاہے (اس گاؤں کی آبادی تقریبا تین ساڑھے تین ہزار ہوگی۔اس  گاؤں میں کریانےکےدس دکانیں ہیں اور6دکانیں درزی کی ہیں، تین پرائیویٹ سکول ہیں اورپنچائیت کانظام بھی ہے، اسکےعلاوہ دوڈاکٹربیٹھتے ہیں۔ اس گاؤں کےتقریباتین چارسوگھراورروزمرہ کی جملہ ضروریات میں سےاکثرتومل جاتی ہیں کچھ چیزیں نہیں ملتی مثلا:فوٹو سٹیٹ اوربل جمع کرناوغیرہ)۔</p><p>اس گاؤں کےمضافات  میں ایک محلہ ہے(نکہ)اس محلےکے22گھر ہیں اورتقریبا35،40مردہیں اس محلے میں کوئی دکان ،اورروزمرہ کی جملہ اشیاء موجودنہیں ہیں، نیز یہ محلہ گاؤں سے تقریبا1 کلو میٹر کے فاصلے پر ہے ،  اور اس محلہ  کا مستقل نام  اور مستقل حیثیت ہے ۔محلےکےلوگ کہہ رہےہیں کہ یہاں بھی جمعہ کی نماز  ہونی چاہیےآیااس محلےمیں جمعہ قائم کرنادرست ہے کہ نہیں اس کی وضاحت فرمائیں۔ اورجمعہ کےقائم کرنے کی شرائط بھی بھیج دیں۔</p>,"<h4 class=""has-text-align-center"">اَلجَوَابْ بِاسْمِ مُلْہِمِ الصَّوَابْ</h4><p>جمعہ قائم کرنے کے لیے شہر یا قصبہ ہونا شرط ہے،  آثار وعلامات کے اعتبار سے شہر کی تعریف یوں کی جاتی ہے: ایسی جگہ  جہاں گلی کوچے ہوں، محلے ہوں، ضروری پیشہ ور رہتے ہوں، ڈاکخانہ ہو،شفاخانہ ہو یاحکیم یا ڈاکٹرہو، نزاعات کا فیصلہ کرنے کے لیے حاکم ہو، روز مرہ  کی ضروریات کے لیے باقاعدہ بازار ہو ۔</p><p>جو محلہ سوال میں مذکور ہے ، وہ نہ شہر ہے، نہ  قصبہ  نہ بڑا گاؤں ہے، لہٰذا  وہاں جمعہ صحیح نہیں ہے۔</p><p><strong>جمعہ کی شرائط :</strong></p><p>       کسی شخص پر  جمعہ  واجب ہونے کی6 شرطیں ہیں:</p><p>(1)آزاد ہونا      (2) مذکر ہونا     (3) مقیم ہونا     (4)صحت مند ہونا                                                                                   ( 5) پاؤں کا سلامت ہونا                                           (6) آنکھوں کا صحیح سالم ہونا۔</p><p>          جبکہ  نماز جمعہ قائم کرنے کے لیے درج ذیل 7 شرائط ہوتے  ہیں:</p><p>(1)مصرکا ہونا                                                                                                                                  (2)سلطان یا  اس کے نائب کا ہونا         <span dir=""LTR"">)</span>اگر اسلامی ریاست ہو تو یہ شرط ہے  ، لیکن اگر اسلامی ریاست نہ ہو تو پھر مسلمان  جمع ہوکر ایک شخص کو مقرر کرلیں اور وہ جمعہ پڑھادے)                             (3)نماز ظہر کا وقت ہونا          (4)خطبہ دینا                                                    (5)خطبہ کا  نماز سے مقدم ہونا          (6)جماعت کا ہونا                                                           (7)اذن عام ہونا۔</p><h6 class=""has-text-align-right"">حوالہ جات</h6><h5>قال العلامة الكاساني رحمه الله: أما بيان شرائط الجمعة.فللجمعة شرائط، بعضها يرجع إلى المصلي، وبعضها يرجع إلى غيره.أما الذي يرجع إلى المصلي فستة: العقل، والبلوغ، والحرية والذكورة، والإقامة، وصحة البدن فلا تجب الجمعة على المجانين والصبيان والعبيد إلا بإذن مواليهم، والمسافرين والزمنى، والمرضى. ... وأما الشرائط التي ترجع إلى غير المصلي فخمسة في ظاهر الروايات، المصر الجامع، والسلطان، والخطبة، والجماعة، والوقت.(بدائع الصنائع :1/ 258، 259)
قال العلامة الحصكفي رحمه الله:(ويشترط لصحتها) سبعة أشياء:الأول: المصر...وفناؤہ...الثاني:السلطان...الثالث: وقت الظهر...الرابع: الخطبة فيه... الخامس:كونها قبلها....السادس:الجماعة... السابع: الإذن العام.(الدر المختار:5-25)
 وقال أيضا:وروي عن أبي حنيفة :أنه بلدة كبيرة فيها سكك، وأسواق، ولها رساتيق، وفيها وال يقدر على إنصاف المظلوم من الظالم بحشمه ،وعلمه ،أو علم غيره ،والناس يرجعون إليه في الحوادث ،وهو الأصح. (بدائع الصنائع  :1/ 260)
قال العلامة ابن عابدين رحمه الله: قال في شرح المنية:و الحد الصحيح[للمصر] ما اختاره صاحب الهداية، أنه الذي له أمير، وقاض ينفذ الأحكام، ويقيم الحدود ،وتزييف صدر الشريعة له عند اعتذاره عن صاحب الوقاية، حيث اختار الحد المتقدم بظهور التواني في الأحكام ،مزيف بأن المراد القدرة على إقامتها على ما صرح به في التحفة عن أبي حنيفة: أنه بلدة كبيرة فيها سكك، وأسواق، ولها رساتيق ،وفيها وال يقدر على إنصاف المظلوم من الظالم بحشمته، وعلمه، أو علم غيره، يرجع الناس إليه فيما يقع من الحوادث، وهذا هو الأصح. اهـ. إلا أن صاحب الهداية ترك ذكر السكك ،والرساتيق ؛لأن الغالب أن الأمير والقاضي الذي شأنه القدرة على تنفيذ الأحكام وإقامة الحدود لا يكون إلا في بلد كذلك. اهـ. (رد المحتار:2/ 137)
وقال أيضا:وعبارة القهستاني: تقع فرضا في القصبات ،والقرى الكبيرة التي فيها أسواق. قال أبوالقاسم: هذا بلا خلاف إذا أذن الوالي أو القاضي ببناء المسجد الجامع وأداء الجمعة ؛لأن هذا مجتهد فيه فإذا اتصل به الحكم صار مجمعا عليه، وفيما ذكرنا إشارة إلى أنه لا تجوز في الصغيرة التي ليس فيها قاض، ومنبر، وخطيب، كما في المضمرات .والظاهر أنه أريد به الكراهة؛ لكراهة النفل بالجماعة؛ ألا ترى أن في الجواهر لو صلوا في القرى لزمهم أداء الظهر، وهذا إذا لم يتصل به حكم، فإن في فتاوى الديناري: إذا بني مسجد في الرستاق بأمر الإمام فهو أمر بالجمعة اتفاقا على ما قال السرخسي. اهـ. فافهم. والرستاق: القرى، كما في القاموس. (رد المحتار:2/ 138)
قال العلامة ابن عابدين رحمه الله:فلو الولاة كفارا يجوز للمسلمين إقامة الجمعة، ويصير القاضي قاضيا بتراضي المسلمين، ويجب عليهم أن يلتمسوا واليا مسلما. اهـ. (رد المحتار:2/ 144)
وفي الهندية:والي مصر مات، فصلى بهم خليفة الميت ،أو صاحب الشرط، أو القاضي جاز، فإن لم يكن ثمة واحد منهم، واجتمع الناس على رجل، فصلى بهم جاز.كذا في السراجية. (1/ 146)
</h5><h6 class=""has-text-align-center"">واللہ سبحانہ وتعالی اعلم</h6><figure class=""wp-block-table""><table><tbody><tr><td><h3>مجیب</h3></td><td>متخصص</td><td><h3>مفتیان</h3></td><td>ابولبابہ شاہ منصور صاحب / شہبازعلی صاحب</td></tr></tbody></table></figure>",2734,jameya-tur-rasheed,نماز کا بیان,جمعہ و عیدین کے مسائل
2020-01-18,https://almuftionline.com/2020/01/18/2808/,میزان بینک سے مضاربت پر ملنے والےنفع کا حکم,<p>میزان بینک میں مضاربت پر 2لاکھ روپے رکھ دیے جاتے ہیں تو اس پرماہانہ تقریبا12یا13سوتک نفع آتارہتاہے،لیکن پوچھنایہ ہے کہ یہ کیسا کاروبار کرتے ہیں کہ اس میں کبھی نقصان ہی نہیں ہوتا،جبکہ رب المال نفع ونقصان دونوں میں شریک ہوتا ہےاور یہاں صرف نفع ہی ملتاہےتو کیا اس صورت میں یہ مضاربت صحیح ہوگی؟</p>,"<h4 class=""has-text-align-center"">اَلجَوَابْ بِاسْمِ مُلْہِمِ الصَّوَابْ</h4><p>میزان بینک کےساتھ مضاربت کرتے ہوئےمعاہدہ میں یہ بات طے کرلی جاتی ہے کہ مضارب اور رب المال نفع ونقصان دونوں میں شریک ہوں گے،البتہ میزان بینک والے اپنے گاہک کااعتمادبرقرار رکھنے کےلیے ایساکاروبارکرتے ہیں  جس سے عموما نفع ہی ہوتا ہے،اس لیے یہ مضاربت کی بنیاد پر جو نفع ملتاہے،وہ جائز ہے۔</p><h6 class=""has-text-align-right"">حوالہ جات</h6><h5><h5>قال العلامۃ علاء الدین السمرقندی رحمہ اللہ تعالی:وأما تفسير المضاربة :فهو دفع المال إلى غيره ليتصرف فيه ،ويكون الربح بينهما على ما شرطا فيكون الربح لرب المال بسبب ماله ؛لأنه نماء ماله، وللمضارب باعتبار عمله الذي هو سبب وجود الربح.(تحفۃ الفقھاء :3/19)</h5>
<h5>         قال العلامۃ الکاسانی رحمہ اللہ تعالی:وأما ركن العقد فالإيجاب والقبول، وذلك بألفاظ تدل عليهما فالإيجاب :هو لفظ المضاربة ،والمقارضة، والمعاملة، وما يؤدي معاني هذه الألفاظ، بأن يقول رب المال: خذ هذا المال مضاربة، على أن ما رزق اللہ عز وجلأو أطعم اللہ تعالى منه من ربح، فهو بيننا على كذا من نصف أو ربع أو ثلث أو غير ذلك من الأجزاء المعلومة، وكذا إذا قال: مقارضة أو: معاملة ،ويقول المضارب: أخذت أو: رضيت أو: قبلت ،ونحو ذلك فيتم الركن بينهما، أما لفظ المضاربة فصريح مأخوذ من الضرب في الأرض، وهو السير فيها، سمي هذا العقد مضاربة؛ لأن المضارب يسير في الأرض، ويسعى فيها لابتغاء الفضل.     (بدائع الصنائع:6/80)                    </h5>
<h5>المضاربة: مشتقة من الضرب في الأرض؛ سمي بها لأن المضارب يستحق الربح بسعيه وعمله، وهي مشروعة للحاجة إليها، فإن الناس بين غني بالمال غبي عن التصرف فيه، وبين مهتد في التصرف صفر اليد عنه، فمست الحاجة إلى شرع هذا النوع من التصرف لينتظم مصلحة الغبي والذكي والفقير والغني. وبعث النبي صلى الله عليه وسلم والناس يباشرونه فقررهم عليه وتعاملت به الصحابة، ثم المدفوع إلى المضارب أمانة في يده لأنه قبضه بأمر مالكه لا على وجه البدل والوثيقة، وهو وكيل فيه لأنه يتصرف فيه بأمر مالكه، وإذا ربح فهو شريك فيه لتملكه جزءا من المال بعمله، فإذا فسدت ظهرت الإجارة حتى استوجب العامل أجر مثله، وإذا خالف كان غاصبا لوجود التعدي منه على مال غيره.(الھدایۃ:3/200)</h5>
</h5><p>٫٫٫٫</p><h6 class=""has-text-align-center"">واللہ سبحانہ وتعالی اعلم</h6><figure class=""wp-block-table""><table><tbody><tr><td><h3>مجیب</h3></td><td>متخصص</td><td><h3>مفتیان</h3></td><td>ابولبابہ شاہ منصور صاحب / شہبازعلی صاحب</td></tr></tbody></table></figure>",2808,jameya-tur-rasheed,مضاربت کا بیان,متفرّق مسائل
2020-01-18,https://almuftionline.com/2020/01/18/2787/,قبر کی زیارت کا مسنون طریقہ,<p>قبرکی زیارت کا مسنون طریقہ کیا ہے؟شرع کی روشنی میں وضاحت فرمائیں۔</p>,"<h4 class=""has-text-align-center"">اَلجَوَابْ بِاسْمِ مُلْہِمِ الصَّوَابْ</h4><p> قبرکی زیارت کا مستحب طریقہ یہ ہے کہ جب قبرستان پہنچے تو اپنے جوتے اتارلے میت کے  چہرے کی طرف رخ کرکے کھڑا ہوکر سلام پیش کرے،اگر مسلمانوں كا قبرستان ہے تو ان الفاظ سےسلام پیش کرے:</p><p>""السلام عليكم يا أھل القبور !يغفر اللہ لنا، ولكم أنتم لنا سلف ،ونحن بالأثر"".</p><p>اور اگر شہیدوں کا قبرستان ہے تو ان الفاظ سے سلام پیش کرے:</p><p>""سلام علیکم بما صبرتم فنعم عقبی الدار"".اور اگر مخلوط قبرستان(کافر،مسلمان)ہو تو ان الفاظ سے سلام پیش کرے:""السلام علی من اتبع الھدی""،پھر قبلہ کی طرف رخ کرکے دعاکرے اور قرآن پاک کی تلاوت کرے،مثلا:سورۃ الفاتحہ اور آیۃ الکرسی کی تلاوت کر کے ایصال ثواب کردے۔</p><h6 class=""has-text-align-right"">حوالہ جات</h6><h5>وفي الھندية:وإذا أراد زيارة القبور يستحب له أن يصلي في بيته ركعتين، يقرأ في كل ركعة الفاتحة، وآية الكرسي مرة واحدة ،والإخلاص ثلاث مرات، ويجعل ثوابها للميت يبعث اللہ تعالى إلى الميت في قبره نورا ويكتب للمصلي ثوابا كثيرا ثم لا يشتغل بما لا يعنيه في الطريق فإذا بلغ المقبرة يخلع نعليه ثم يقف مستدبر القبلة مستقبلا لوجه الميت، ويقول السلام عليكم يا أهل القبور، ويغفر اللہ لنا ،ولكم أنتم لنا سلف ونحن بالأثر كذا في الغرائب. وإذا أراد الدعاء، يقوم مستقبل القبلة ،كذا في خزانة الفتاوى. وإن كان شهيدا يقول سلام عليكم بما صبرتم فنعم عقبى الدار.
وإذا كان قبور المسلمين مختلطة بقبور الكفار يقول السلام على من اتبع الهدى ثم يقرأ سورة الفاتحة وآية الكرسي ثم يقرأ سورة {إذا زلزلت} [الزلزلة: 1] وألهاكم التكاثر، كذا في الغرائب.(5/350)
قال العلامۃالحصکفی رحمہ اللہ تعالی :ويقول: السلام عليكم دار قوم مؤمنين، وإنا إن شاء اللہ بكم لاحقون، ويقرأ يس. وفي الحديث :من قرأ الإخلاص أحد عشرمرة، ثم وهب أجرها للأموات ، أعطي من الأجر بعدد الأموات.
قال العلامة ابن عابدين رحمه اللہ تعالي:قوله: )وبزيارة القبور) أي لا بأس بها، بل تندب ،كما في البحر عن المجتبى. فكان ينبغي التصريح به؛ للأمر بها في الحديث المذكور كما في الإمداد.وتزار في كل أسبوع كما في مختارات النوازل. قال في شرح لباب المناسك :إلا أن الأفضل يوم الجمعة والسبت والاثنين والخميس، فقد قال محمد بن واسع: الموتى يعلمون بزوارهم يوم الجمعة ويوما قبله ويوما بعده، فتحصل أن يوم الجمعة أفضل. وفيه يستحب أن يزور شهداء جبل أحد؛ لما روى ابن أبي شيبة أن النبي  صلى اللہ عليه وسلم كان يأتي قبور الشهداء بأحد على رأس كل حول فيقول: السلام عليكم بما صبرتم فنعم عقبى الدار.والأفضل أن يكون يوم الخميس متطهرا مبكرا؛ لئلا تفوته الظهر بالمسجد النبوي. 
وفي شرح اللباب للمنلا على القارئ: ثم من آداب الزيارة ما قالوا من أنه يأتي الزائر من قبل رجلي المتوفى لا من قبل رأسه؛ لأنه أتعب لبصر الميت، بخلاف الأول؛ لأنه يكون مقابل بصره، لكن هذا إذا أمكنه،وإلا فقد ثبت أنه عليه الصلاة والسلام قرأ أول سورة البقرة عند رأس ميت، وآخرها عند رجليه.  ومن آدابها: أن يسلم بلفظ: السلام عليكم على الصحيح، لا عليكم السلام؛ فإنه ورد: السلام عليكم دار قوم مؤمنين، وإنا إن شاء اللہ بكم لاحقون، ونسأل اللہ لنا ،ولكم العافية.ثم يدعو قائما طويلا، وإن جلس يجلس بعيدا ،أو قريبا بحسب مرتبته في حال حياته.(ردالمحتار مع الدر المختار:3/151)
</h5><h6 class=""has-text-align-center"">واللہ سبحانہ وتعالی اعلم</h6><figure class=""wp-block-table""><table><tbody><tr><td><h3>مجیب</h3></td><td>متخصص</td><td><h3>مفتیان</h3></td><td>ابولبابہ شاہ منصور صاحب / شہبازعلی صاحب</td></tr></tbody></table></figure>",2787,jameya-tur-rasheed,جنازے کےمسائل,مردوں اور قبر کے حالات کا بیان
2020-01-18,https://almuftionline.com/2020/01/18/2741/,صدقات کے مصارف,<p>بعض لوگ ہمارے مدرسہ کو صدقات وخیرات ، صدقہ فطر وغیرہ  دیتے ہیں، اس کو مدرسہ کے کس کس مد میں خرچ  کیا جاسکتا ہے؟ اور کیا تعمیر وغیرہ میں خرچ کیا جاسکتا ہے؟</p>,"<h4 class=""has-text-align-center"">اَلجَوَابْ بِاسْمِ مُلْہِمِ الصَّوَابْ</h4><p>      زکاۃ اور صدقات واجبہ فقراء ومساکین کو تملیکا دینا ضروری ہیں،ورنہ زکاۃ اور صدقات واجبہ ادا نہیں ہونگے۔ مدرسے یا مسجد کی تعمیر وغیرہ میں لگانا جائز نہیں ہے، جبکہ نفلی صدقات کسی بھی خیر کے کام میں خرچ کیے جاسکتے ہیں ۔</p><h6 class=""has-text-align-right"">حوالہ جات</h6><h5>قال العلامة الكاساني رحمه الله: وأما ركن الزكاة: فركن الزكاة هو إخراج جزء من النصاب إلى الله تعالى، وتسليم ذلك إليه، يقطع المالك يده عنه بتمليكه من الفقير، وتسليمه إليه،  أو إلى يد من هو نائب عنه،  وهو المصدق،  والملك للفقير يثبت من الله تعالى،  وصاحب المال نائب عن الله تعالى في التمليك والتسليم إلى الفقير. والدليل...وقد أمر الله تعالى الملاك بإيتاء الزكاة... والإيتاء هو التمليك؛ ولذا سمى الله تعالى الزكاة صدقة ... والتصدق تمليك ... وعلى هذا يخرج صرف الزكاة إلى وجوه البر من بناء المساجد، والرباطات والسقايات، وإصلاح القناطر، وتكفين الموتى ،ودفنهم ، أنه لا يجوز؛ لأنه لم يوجد التمليك أصلا.
(بدائع الصنائع :2/ 39)
وفي الهندية: ولا يجوز أن يبني بالزكاة المسجد، وكذا القناطر والسقايات، وإصلاح الطرقات، وكري الأنهار ،والحج، والجهاد، وكل ما لا تمليك فيه. (الفتاوى الهندية :1/ 188)
وفي الهندية: ولا يدفع إلى بني هاشم، ... هذا في الواجبات كالزكاة ،والنذر، والعشر، والكفارة، فأما التطوع فيجوز الصرف إليهم، كذا في الكافي. (1/ 189)
</h5><h6 class=""has-text-align-center"">واللہ سبحانہ وتعالی اعلم</h6><figure class=""wp-block-table""><table><tbody><tr><td><h3>مجیب</h3></td><td>متخصص</td><td><h3>مفتیان</h3></td><td> فیصل احمد صاحب / شہبازعلی صاحب</td></tr></tbody></table></figure>",2741,jameya-tur-rasheed,زکوة کابیان,مستحقین زکوة کا بیان
