issued_at,link,title,question,answer,fatwa_number,dar_ul_ifta,kitab,bab,fasal
26-02-2024,https://www.banuri.edu.pk/readquestion/nabi-sallallahu-alaihi-wasallam-ki-umar-mibarka-144508101276/26-02-2024,نبی صلی اللہ علیہ وسلم کی عمر مبارک,کسی نے بتایا ہے کہ آپ صلی اللہ علیہ وسلم کی عمر مبارکہ 95 سال ہے،لیکن آپ صلی اللہ علیہ وسلم کی عمر مبارک تو 63 سال ہے ،براہ مہربانی کر کے اس پر ذرا روشنی ڈالیں۔,"<p><p style=""text-align:justify;""> واضح رہے کہ چاند کے حساب سے  جناب رسول اکرم صلی اللہ علیہ وسلم   کی عمر مبارک تریسٹھ  (63) سال ہے، اور شمسی حساب  (یعنی: عیسوی  کلینڈر کے حساب ) سے  جناب رسول اکرم صلی اللہ علیہ وسلم کی عمر مبارک اکسٹھ (61)  سال  ہے۔لہٰذا صورت مسئولہ میں کسی  صاحب کا یہ کہنا کہ نبی کریم صلی اللہ علیہ وسلم کی عمر مبارک (95)  سال تھی، یہ بات درست نہیں۔</p><p class=""indent"" style=""text-align:justify;""><span class=""ar_writing"">""وبذلك يكون الرسول -صلوات الله وسلامه عليه- قد مضى في هذه الدنيا ثلاثًا وستين سنة قمرية وثلاثة أيام، وهو يوازي بالسنين الشمسية واحدًا وستين عامًا وأربعة وثمانين يومًا..</span></p><p class=""indent"" style=""text-align:left;""><span class=""ar_writing"">(القول المبين في سيرة سيد المرسلين ص: 396، ط. دار الندوة الجديدة بيروت)</span></p><p style=""text-align:justify;"">التحرير والتنوير  میں ہے:</p><p class=""indent"" style=""text-align:justify;""><span class=""ar_writing"">""فالتفاوت بين أيام السنة القمرية وأيام السنة الشمسية يحصل منه سنة قمرية كاملة في كل ثلاث وثلاثين سنة شمسيةً ، فيكون التفاوت في مائة سنة شمسيةٍ بثلاث سنين زائدة قمرية"" .</span></p><p class=""indent"" style=""text-align:left;""><span class=""ar_writing"">(التحرير والتنوير «تحرير المعنى السديد وتنوير العقل الجديد من تفسير الكتاب المجيد» لمحمد الطاهر بن محمد بن محمد الطاهر بن عاشور التونسي :  تفسير قوله تعالى: وَلَبِثُواْ فِى كَهْفِهِمْ ثَلاثَ مِئَةٍ سِنِينَ وَازْدَادُواْ تِسْعًا 15/ 301، ط. دار سحنون للنشر والتوزيع - تونس - 1997 م)</span></p><p class=""indent"" style=""text-align:left;"">فقط واللہ اعلم</p></p>",144508101276,banuri,"('تاریخ و سیر', 'tareekh-o-siyar')","('سیرت', 'seerat')","('ذاتی احوال و معلومات / نسب / خاندان', 'zati-ahwal-o-malomaat-nasab-khandan')"
28-02-2024,https://www.banuri.edu.pk/readquestion/aasmani-kutub-ka-quran-me-zikr-144508101515/28-02-2024,آسمانی کتب کا قرآن میں ذکر,نام کی تخصیص کے ساتھ قرآن پاک میں کتنی آسمانی کتابوں کا ذکر ہے؟,"<p><p style=""text-align:justify;"">آسمانی کتابیں چار ہیں ۱) قرآن، ۲) توراۃ، ۳) انجیل، ۴) زبور۔ چاروں کا ذکر قران میں موجود ہے۔ ہر ایک کتاب کے لیے ایک ایک آیت  ذیل  میں مذکور ہے:</p><p>سورۃ التوبۃ میں ہے:</p><p class=""indent"" style=""text-align:justify;""><span class=""ar_writing"">‌""إِنَّ اللَّهَ اشْتَرى مِنَ الْمُؤْمِنِينَ أَنْفُسَهُمْ وَأَمْوالَهُمْ بِأَنَّ لَهُمُ الْجَنَّةَ يُقاتِلُونَ فِي سَبِيلِ اللَّهِ فَيَقْتُلُونَ وَيُقْتَلُونَ وَعْداً عَلَيْهِ حَقًّا فِي التَّوْراةِ وَالْإِنْجِيلِ وَالْقُرْآنِ وَمَنْ أَوْفى بِعَهْدِهِ مِنَ اللَّهِ فَاسْتَبْشِرُوا بِبَيْعِكُمُ الَّذِي بايَعْتُمْ بِهِ وَذلِكَ هُوَ الْفَوْزُ الْعَظِيمُ.""</span></p><p class=""indent"" style=""text-align:left;"">(آیت نمبر ۲۰۴)</p><p>سورۃ آل عمران میں ہے:</p><p class=""indent"" style=""text-align:justify;""><span class=""qr_writing"">""‌وَيُعَلِّمُهُ الْكِتابَ وَالْحِكْمَةَ وَالتَّوْراةَ وَالْإِنْجِيلَ""</span></p><p class=""indent"" style=""text-align:left;"">(آیت نمبر ۴۸)</p><p style=""text-align:justify;"">سورۃ النساء میں ہے:</p><p class=""indent"" style=""text-align:justify;""><span class=""ar_writing"">""إِنَّا أَوْحَيْنا إِلَيْكَ كَما أَوْحَيْنا إِلى نُوحٍ وَالنَّبِيِّينَ مِنْ بَعْدِهِ وَأَوْحَيْنا إِلى إِبْراهِيمَ وَإِسْماعِيلَ وَإِسْحاقَ وَيَعْقُوبَ وَالْأَسْباطِ وَعِيسى وَأَيُّوبَ وَيُونُسَ وَهارُونَ وَسُلَيْمانَ وَآتَيْنا داوُدَ زَبُوراً.""</span></p><p class=""indent"" style=""text-align:left;"">(آیت نمبر ۱۶۳)</p><p class=""indent"" style=""text-align:left;"">فقط واللہ اعلم</p></p>",144508101515,banuri,"('علوم و فنون', 'uloom-funoon')","('متعلقات قرآن کریم', 'quran-kareem')","('ترجمہ و تفسیر ، تعارف اور اقسام', 'tarjama-o-tafseer-taaruf-aur-aqsaam')"
28-02-2024,https://www.banuri.edu.pk/readquestion/kia-halat-e-ghusal-me-40-qadam-se-zaid-chal-sakte-hen-144508101574/28-02-2024,کیا حالتِ غسل میں 40 قدم سے زائد چل سکتے ہیں؟,حالتِ غسل میں 40 قدم سے زیادہ لے سکتے ہیں؟,"<p><p style=""text-align:justify;"">صورتِ مسئولہ میں حالتِ غسل میں 40 قدم سے زیادہ  لینے سے مراد اگر چلنا ہے تو اس کی گنجائش ہے ، البتہ جنابت لاحق ہونے کے بعد بہتر یہی ہے کہ غسل کرنے میں زیادہ تاخیر نہ کی جائے،بلاتاخیر غسل کرکے پاکی حاصل کرلی جائے ۔</p><p style=""text-align:justify;"">فتاوی ہندیہ میں ہے:</p><p class=""indent"" style=""text-align:justify;""><span class=""ar_writing"">""الجنب إذا أخر الاغتسال إلى وقت الصلاة لا يأثم. كذا في المحيط. قد نقل الشيخ سراج الدين الهندي الإجماع على أنه لا يجب الوضوء على المحدث والغسل على الجنب والحائض والنفساء قبل وجوب الصلاة أو إرادة ما لا يحل إلا به.""</span></p><p class=""indent"" style=""text-align:left;""><span class=""ar_writing"">(كتاب الطهارة، ج:1، ص:16، ط:دار الفكر)</span></p><p class=""indent"" style=""text-align:left;""><span class=""ar_writing"">فقط واللہ اعلم</span></p></p>",144508101574,banuri,"('طہارت', 'taharat')","('غسل', 'ghusl')","('مستحبات و آدابِ غسل', 'mustahabbaat-o-aadaab-e-gusal')"
29-02-2024,https://www.banuri.edu.pk/readquestion/meezan-bank-men-raqam-rakhwa-kr-manafe-wasool-krny-ka-hukam-144508101657/29-02-2024,میزان بینک میں رقم رکھوا کر منافع وصول کرنے کا حکم,کیا میزان بینک میں پیسے جمع کر کے منافع لے سکتے ہیں؟,"<p><p style=""text-align:justify;"">میزان بینک یا کسی بھی(مروجہ اسلامی یا غیر اسلامی ) بینک میں پیسے جمع کر کے( سیونگ اکاؤنٹ  کھلوانا اور اس پر)منافع لینا شرعاً جائز نہیں ۔</p><p dir=""rtl""><span lang=""er"" xml:lang=""er""> </span>الدر مع الرد میں ہے:</p><p class=""indent"" style=""text-align:justify;""><span class=""ar_writing"">""وفي الأشباه: ‌كلُّ ‌قرضٍ ‌جرَّ نفعاً حرامٌ ....</span></p><p class=""indent"" style=""text-align:justify;""><span class=""ar_writing"">(قوله: ‌كلُّ ‌قرضٍ ‌جرَّ نفعاً حرامٌ) أي إذا كان مشروطاً كما عُلم مما نقله عن البحر وعن الخلاصة"".</span></p><p class=""indent"" style=""text-align:left;""><span class=""ar_writing"">(الدر مع الرد،کتاب البیوع، باب المرابحۃ والتولیۃ، مطلب کل قرض جرّنفعاً حرامٌ،ج:۵،ص:۱۶۶،ط:سعید)</span></p><p>فتاوی ہندیہ میں ہے:</p><p class=""indent"" style=""text-align:justify;""><span class=""ar_writing"">""(الفصلُ السّادس في تفسير الرِّبا وأحكامه) وهو في الشرع عبارةٌ عن فضلِ مالٍ ‌لا ‌يُقابله ‌عوضٌ في معاوضة مالٍ بمالٍ وهو محرَّمٌ في كلِّ مكيلٍ وموزونٍ بِيعَ مع جنسه وعلّتُه القدر والجنس"".</span></p><p class=""indent"" style=""text-align:left;""><span class=""ar_writing"">(کتاب البیوع، الباب التاسع، الفصل السادس،ج:۳،ص:۱۱۷،ط:دار االفکر)</span></p><p class=""indent"" style=""text-align:left;""><span class=""ar_writing"">فقط واللہ اعلم</span></p></p>",144508101657,banuri,"('معاملات', 'muamlat')","('سود / بینکاری / انشورنس / شیئرز', 'sood-bankari-insurance-shares')","('اسلامی بینکاری', 'islami-bankari')"
28-02-2024,https://www.banuri.edu.pk/readquestion/saria-nam-rahkna-144508101600/28-02-2024,ساریہ نام کا معنیٰ اور اس کے رکھنے کا حکم,ساریہ نام رکھنا کیسا ہے ، اور کیا  اس کا مطلب درست ہے ؟,"<p><p style=""text-align:justify;"">""ساریہ"" کا معنٰی ہے: ""ستون""، ""رات کو آنے والا بادل""، نیز یہ دو صحابۂ رسول ""ساریہ بن اوفٰی"" اور ""ساریہ بن زنیم"" کا نام بھی ہے، لہٰذا یہ نام رکھنا جائز ہے۔</p><p style=""text-align:justify;"">الصحاح تاج اللغۃ وصحاح العربیۃ میں ہے:</p><p class=""indent"" style=""text-align:justify;""><span class=""ar_writing"">""والسارية: الأسطوانة. والسارية: السحابة التي تأتي ليلا.""</span></p><p class=""indent"" style=""text-align:left;""><span class=""ar_writing"">(حرف الواو والياء، فصل: السين، 2376/6، ط: دار العلم للملايين)</span></p><p style=""text-align:justify;"">اسد الغابۃ فی معرفۃ الصحابۃ میں ہے:</p><p class=""indent"" style=""text-align:justify;""><span class=""ar_writing"">""سارية بن أوفى</span></p><p class=""indent"" style=""text-align:justify;""><span class=""ar_writing"">س: سارية بن أوفى وفد إلى النبي صلى الله عليه وسلم فعقد له النبي، فسار إلى بني مرة، فعرض عليهم الإسلام، فأبطئوا عليه، فعرض عليهم السيف، فلما أسرف في القتل أسلموا، وأسلم من حولهم من قيس، فسار إلى النبي صلى الله عليه وسلم في ألف.""</span></p><p class=""indent"" style=""text-align:left;""><span class=""ar_writing"">(حرف السين، باب السين مع الألف، سارية بن أوفى، 380/2، ط: دار الكتب العلمية)</span></p><p style=""text-align:justify;""><span class=""ar_writing"">وفیہ ایضًا:</span></p><p class=""indent"" style=""text-align:justify;""><span class=""ar_writing"">""سارية بن زنيم</span></p><p class=""indent"" style=""text-align:justify;""><span class=""ar_writing"">س: سارية بن زنيم بن عمرو بن عبد الله ابن جابر بن محمية بن عبد بن عدي بن الديل بن بكر بن عبد مناة بن كنانة.</span></p><p class=""indent"" style=""text-align:justify;""><span class=""ar_writing"">كان من أشد الناس حضرا، وهو الذي ناداه عمر بن الخطاب رضي الله عنه: يا سارية الجبل.""</span></p><p class=""indent"" style=""text-align:left;""><span class=""ar_writing"">(حرف السين، باب السين مع الألف، سارية بن زنيم، 380/2، ط: دار الكتب العلمية)</span></p><p class=""indent"" style=""text-align:left;""><span class=""ar_writing"">فقط واللہ اعلم</span></p></p>",144508101600,banuri,"('حظر و اباحت', 'mamnooaat-mubahat')","('نام، لقب، کنیت', 'asaami')","('ناموں کے معانی اور احکام', 'namoun-ke-mani-or-ahkaam')"
03-01-2024,https://www.banuri.edu.pk/readquestion/halal-o-haram-144506101880/03-01-2024,جس ریسٹورنٹ میں اکثر مشینی ذبیحہ کی مرغی پکتی ہو وہاں کوئی اور ڈش کھانے کا حکم/ کیا گوشت کے مشینی ذبیحہ نہ ہونے میں دکان دار کے قول کا اعتبار کیا جائے گا؟,1. یہاں ایڈیلیڈ آسٹریلیا میں حلال ریسٹورنٹ میں اکثر مشینی ذبیحہ کی چکن ہوتی ہے، تو وہاں سے چکن کے علاوہ کوئی ڈش کھا سکتے ہیں؟2. اسی طرح شاورمہ کی دکان میں اگر چکن اور بھیڑ کا شاورمہ ملتا ہو اور دونوں گوشت کے لیے ایک ہی برتن اور چمچہ استعمال ہوتا ہو تو وہاں سے بھیڑ کا شاورمہ کھا سکتے ہیں اگر چکن مشینی ذبیحہ کی ہو؟3. گوشت کی دوکان میں سے جب گوشت لیتے ہیں تو چکن کے حوالے سے پوچھ لیتے ہیں کہ چکن مشینی ذبیحہ تو نہیں، کیا دوکاندار کے بتانے سے کہ یہ مشینی ذبیحہ نہیں ہے وہ چکن استعمال کر سکتے ہیں؟,"<p><p style=""text-align:justify;"">1، 2.واضح رہے کہ مروجہ مشینی ذبیحہ میں ذبح شرعی کی شرائط نہیں پائی جاتیں اس بناء پر مشینی ذبیحہ حلال نہیں ہے لہذا صورتِ مسئولہ میں حلال چیزوں کے لیے بھی ضروری ہے کہ وہ پاک برتنوں میں پکائی گئی ہوں اور تیاری کے دوران کسی مرحلے پر ان میں کوئی ناجائز و حرام عنصر شامل نہ ہو، لہذا جس ریسٹورنٹ میں مشینی ذبیحہ کی چکن کھلائی جاتی ہو اس ریسٹورنٹ میں کوئی حلال کھانا کھانے سے پہلے یہ اطمینان کرنا ضروری ہے کہ جس برتن اور آئل میں مشینی ذبیحہ کی چکن پکائی جاتی ہے اسی میں ہی حلال گوشت یاسبزی وغیرہ نہ پکائی جاتی ہو، اگر اس بات کا اطمینان ہو کہ دونوں کے پکانے کے لیے الگ الگ برتن اور آئل استعمال کیے جاتے ہیں تو ایسے ریسٹورنٹ میں کوئی حلال ڈش یا بھیڑ کا شاورما کھانا جائز ہوگا اور اگر اس بات کا اطمینان نہ ہو یا یقینی طور پر معلوم ہو کہ دونوں کے پکانے کے لیے ایک ہی برتن اور آئل استعمال کیا جاتا ہے تو پھر ایسے ریسٹورنٹ میں کوئی حلال ڈش کھانا جائز نہیں ہوگا۔ </p><p style=""text-align:justify;"">3.اگر دکان دار دیانت دار مسلمان ہو تو گوشت کے حلال ہونے میں اس کی بات کا اعتبار کیا جائے گا اور اگر کافر ہو تو جب تک کسی اور معتبرذریعہ سے گوشت کے حلال ہونے کا یقین نہ ہوجائے تب تک صرف اس کی بات پر اعتماد نہیں کیا جائے گا۔</p><p style=""text-align:justify;""> الفتاوى الهنديةمیں ہے:</p><p class=""indent"" style=""text-align:justify;""><span class=""ar_writing"">""(الفصل الأول في الإخبار عن أمر ديني) نحو الإخبار عن نجاسة الماء وطهارته، والإخبار عن حرمة المحل وإباحته وما يتصل بذلك من تعارض الخبرين في نجاسة الماء وطهارته، وفي حرمة العين وإباحته. خبر الواحد يقبل في الديانات كالحل والحرمة والطهارة والنجاسة إذا كان مسلما عدلا ذكرا أو أنثى حرا أو عبدا محدودا أو لا، ولا يشترط لفظ الشهادة والعدد، كذا في الوجيز للكردري، وهكذا في محيط السرخسي والهداية، ولا يقبل قول الكافر في الديانات إلا إذا كان قبول قول الكافر في المعاملات يتضمن قوله في الديانات، فحينئذ تدخل الديانات في ضمن المعاملات فيقبل قوله فيها ضرورة هكذا في التبيين.""</span></p><p class=""indent"" style=""text-align:left;""><span class=""ar_writing"">(كتاب الكراهية، الباب الأول في العمل بخبر الواحد، 5/ 308، ط: رشيدية)</span></p><p style=""text-align:justify;"">البحر الرائق شرح كنز الدقائق میں ہے:</p><p class=""indent"" style=""text-align:justify;""><span class=""ar_writing"">""الحل والحرمة من الديانات ولا يقبل قول الكافر في الديانات، وإنما يقبل قوله: في المعاملات خاصة للضرورة.""</span></p><p class=""indent"" style=""text-align:left;""><span class=""ar_writing"">(كتاب الكراهية، فصل في الأكل والشرب، 8/ 212، ط: دارالكتاب الإسلامي بيروت)</span></p><p class=""indent"" style=""text-align:left;""><span class=""ar_writing"">فقط واللہ اعلم</span></p></p>",144506101880,banuri,"('حظر و اباحت', 'mamnooaat-mubahat')","('ماکولات / مشروبات', 'makoolat-mashroobat')","('کھانے پینے کی حلال و حرام ، مکروہ و مباح اشیاء', 'khanay-penay-ki-halal-o-haram-makroh-o-mubah-ashya')"
28-02-2024,https://www.banuri.edu.pk/readquestion/minha-name-rakhna-kasa-ha-144508101489/28-02-2024,بچی کا نام منہا رکھنا کیسا ہے؟ کیا یہ نام بدیل کر لیا جائے؟,اللہ پاک نے مجھے  بیٹی کی رحمت سے نوازا اور ہم نے ان کا نام منہا(Minha) رکھا، میری بیٹی اب دو سال اور کچھ ماہ کی ہو گئی ہے لیکن وہ اکثر کسی چیز سے ڈر جاتی ہیں یا بیمار ہو جاتی ہیں۔ اس لیے میں دم کروانے کے لیے مولانا صاحب کے پاس لے گیا انہوں نے یہ مشورہ دیا ہے مجھے اپنی بیٹی کا نام تبدیل کرنا چاہیے ؟,"<p><p style=""text-align:justify;""> صورت  مسئولہ میں معنی کے اعتبار سے منھا   نام رکھنا درست نہیں ، سائل اپنی  بیٹئ کا نام ’’منہا‘‘ کے بجائے  ’’منحہ‘‘  منتخب کرلے  اور اس کا درست تلفظ ’’منحہ‘‘ (مِنْحَہ)ہے، اور  ’’مِنحہ‘‘  کے معنی گفٹ، تحفہ کے ہیں۔</p><p style=""text-align:justify;""><span style=""text-align:right;"">المعجم الوسیط  میں ہے:</span></p><p class=""indent"" style=""text-align:justify;""><span class=""ar_writing"">""المنحة: العطية"".</span> ( ج:۲، صفحہ:  ۸۸۸، ط:  دار الدعوة)</p><p style=""text-align:justify;"">یا اس کے علاوہ صحابیات کے ناموں  سے یا  کسی اچھے معنی والے لفظ کا انتخاب کرلے۔فقط واللہ اعلم</p></p>",144508101489,banuri,"('حظر و اباحت', 'mamnooaat-mubahat')","('نام، لقب، کنیت', 'asaami')","('ناموں کے معانی اور احکام', 'namoun-ke-mani-or-ahkaam')"
