issued_at,link,title,question,answer,fatwa_number,dar_ul_ifta,kitab,bab,fasal
26-02-2024,https://www.banuri.edu.pk/readquestion/shab-e-barat-ki-haqeeqat-144508101323/26-02-2024,شب براءت کی حقیقت,شب براءت کی کیا حقیقت ہے ؟,"<p><p style=""text-align:justify;"">شعبان کی پندرہویں شب کو شب برأت کہتے ہیں، برأت کہنے کی وجہ یہ ہے کہ اس رات میں اللہ تعالی  کی طرف سے عام مغفرت کا اعلان کیا جاتا ہے اور مخلوق کو گناہوں سے معاف  کردیا جاتا ہے۔</p><p style=""text-align:justify;"">متعدد روایات میں اس رات کی فضیلت وارد ہوئی  ہے۔</p><p style=""text-align:justify;"">ذیل میں چند احادیث ملاحظہ فرمائیں:</p><p class=""indent"" style=""text-align:justify;""><span class=""ar_writing"">1۔""عن علي بن أبي طالب، قال: قال رسول الله صلى الله عليه وسلم: ""إذا كانت ‌ليلة ‌النصف ‌من ‌شعبان، فقوموا ليلها، وصوموا نهارها، فإن الله ينزل فيها لغروب الشمس إلى سماء الدنيا، فيقول: ألا من مستغفر لي فأغفر له، ألا مسترزق فأرزقه، ألا مبتلى فأعافيه، ألا كذا ألا كذا، حتى يطلع الفجر.""</span></p><p class=""indent"" style=""text-align:left;""><span class=""ar_writing"">(سنن ابن ماجه،‌‌ أبواب إقامة الصلوات والسنة فيها، باب ما جاء في ليلة النصف من شعبان،ج:2، ص:399، ط: دار الرسالة العالمية)</span></p><p class=""indent"" style=""text-align:justify;"">""حضرت علی رضی اللہ عنہ سے  منقول ہے کہ رسول  اللہ صلی اللہ علیہ وسلم نے فرمایا:<span dir=""rtl"" lang=""ar-sa"" xml:lang=""ar-sa"">جب نصف شعبان کی رات ہو(يعنی  شب بر أت )تو رات میں نماز پڑھو  ا د ر اس کے  دن میں  روز رکھو، اس لئے کہ اللہ جل شانہ  اس رات میں آفتاب چھپنے کے وقت   آسمان دنیا پر نزول فرماتا  (یعنی اپنی رحمت عام کے ساتھ متوجہ ہوتاہے) اور( دنیا والوں سے فرماتا ہے)   کہ آگاہ! ہے کوئی بخشش چاہنے والا کہ میں اسے بخشوں؟ آگاہ!  ہے کوئی رزق مانگنے والا  کہ میں اسے رزق دوں؟  ہے کوئی  گرفتارمصیبت   کہ میں اسے   عافیت بخشوں؟   ہے کوئی ایسا اور  ایسا ؟ ( یعنی اس طرح اللہ تعالی ہر ضرورت اور ہر تکلیف کا نام لے کراپنے بندوں کو پکارتا رہتا ہے ، مثلا فرماتا ہے کوئی مانگنے والا کہ میں عطا کروں؟ کوئی غمگین کہ میں اسے خوشی اور مسرت کے خزانے بخشوں ؟ وغیرہ وغیرہ)  یہاں تک کہ فجر طلوع ہو جاتی ہے۔""  (مظاہر حق)</span></p><p class=""indent"" style=""text-align:justify;""><span class=""ar_writing"">2.""عن عائشة، قالت: فقدت النبي صلى الله عليه وسلم ذات ليلة فخرجت أطلبه، فإذا هو بالبقيع، رافع رأسه إلى السماء، فقال: ""يا عائشة، أكنت تخافين أن يحيف الله عليك ورسوله؟ "" قالت: قد قلت، وما بي ذلك، ولكني ظننت أنك أتيت بعض نسائك، فقال: ""إن الله تعالى ينزل ليلة النصف من شعبان إلى السماء الدنيا، فيغفر لأكثر من عدد شعر غنم كلب.""</span></p><p class=""indent"" style=""text-align:left;""><span class=""ar_writing"">(سنن ابن ماجه،‌‌ أبواب إقامة الصلوات والسنة فيها، باب ما جاء في ليلة النصف من شعبان،ج:2، ص: 400، ط: دار الرسالة العالمية)</span></p><p class=""indent"" style=""text-align:justify;""><span dir=""rtl"" lang=""ar-sa"" xml:lang=""ar-sa"">""حضرت عائشہ رضی اللہ عنہا فرماتی ہیں ایک مرتبہ (اپنی باری میں ) رات کو  میں نے سرتاج  دو عالم صلی اللہ علیہ وسلم کو   بستر پر نہ   پایا، جب ميں نے  تلاش كيا تو يكايك كيا  دیکھتی ہوں کہ آپ بقیع میں موجود هيں ،(مجھے ديكھ كر )</span><span dir=""rtl"" lang=""ar-sa"" xml:lang=""ar-sa""> آپ نے فرمایا: اے  عائشہ ! کیا تمہیں اس بات كا خوف تها  کہ اللہ اور اس کا رسول تم پر  ظلم کریں گے ؟</span><span dir=""rtl"" lang=""ar-sa"" xml:lang=""ar-sa"">  میں نے عرض کیا:  مجھے  ایسا کوئی خیال نہ تھا بلکہ میں نے سمجھا کہ آپ اپنی کسی اہلیہ کے ہاں  گئے ہوں گے۔ تو آپ نے فرمایا: اللہ تعالیٰ نصف شعبان کی شب آسمان دنیا (يعنی پہلے آسمان )پر نزول فرماتا ہے اور قبيله  بنو کلب (کی بکریوں) كے ريوڑ كے بالوں سے بھی زیاده تعداد ميں گناه بخشتا ہے۔""(مظاهر حق)</span></p><p class=""indent"" style=""text-align:justify;""><span class=""ar_writing"">3.""عن أبي موسى الأشعري، عن رسول الله صلى الله عليه وسلم قال: ""إن الله ليطلع في ليلة النصف من شعبان، فيغفر لجميع خلقه، إلا لمشرك أو مشاحن.""</span></p><p class=""indent"" style=""text-align:left;""><span class=""ar_writing"">(أيضاّ)</span></p><p class=""indent"" style=""text-align:justify;""><span dir=""rtl"" lang=""ar-sa"" xml:lang=""ar-sa"">""حضرت ابوموسیٰ اشعری رضی اللہ تعالی عنہ سے  راوی ہیں  کہ سرتاج دو عالم  اللہ صلی اللہ علیہ وسلم نے ارشاد  فرمایا : اللہ تعالیٰ نصف شعبان کی رات (یعنی شب برأت) میں دنیا والوں کی طرف متوجہ ہوتا  ہے اور مشرک اور کینہ رکھنے والے کے علاوہ اپنی  تمام مخلوق کی بخشش فرما تا  ہے۔"" (مظاہر حق)</span></p><p style=""text-align:justify;"">مذکورہ روایات اور دیگر احادیث سے اس رات کی اہمیت اور فضیلت ثابت ہوتی ہے، لہذا اس رات کو  انفرادی عبادت میں گزارنا اور اگلے دن کا روزہ رکھنا مستحب ہے۔</p><p style=""text-align:justify;"">العرف الشذی میں ہے:</p><p class=""indent"" style=""text-align:justify;""><span class=""ar_writing"">""هذه الليلة ليلة البراءة وصح الروايات في فضل ليلة البراءة، وأما ما ذكر أرباب الكتب من الضعاف والمنكرات فلا أصل لها.""</span></p><p class=""indent"" style=""text-align:left;""><span class=""ar_writing"">(باب ما جاء في ليلة النصف من شعبان، ج:2، ص 172، ط: دار التراث العربی)</span></p><p style=""text-align:justify;""><span class=""ur_writing"">مرقاۃ المفاتیح میں ہے:</span></p><p class=""indent"" style=""text-align:justify;""><span class=""ar_writing"">""والحاصل أن هذا الوقت زمان التجليات الرحمانية، والتنزلات الصمدانية، والتقربات السبحانية الشاملة للعام والخاص، وإن كان الحظ الأوفى لأرباب الاختصاص، فالمناسب الاستيقاظ من نوم الغفلة والتعرض لنفحات الرحمة.""</span></p><p class=""indent"" style=""text-align:left;""><span class=""ar_writing"">‌‌(باب قيام شهر رمضان، ج:3، ص:964، ط: دار الفکر)</span></p><p class=""indent"" style=""text-align:left;""><span class=""ar_writing"">فقط واللہ اعلم</span></p></p>",144508101323,banuri,"('نماز', 'salat')","('سنن و نوافل', 'nawafil')","('تہجد', 'tahajjud')"
18-02-2024,https://www.banuri.edu.pk/readquestion/sath-muharm-u-haram-ko-mehandi-lagane-ka-rasm-144508100555/18-02-2024,7 محرم الحرام کو مہندی لگانے کا رسم,کیا حضرت قاسم  کی کربلا میں شادی ہوئی تھی ؟ اگر نہیں ہوئی تھی تو شیعہ حضرات 7 محرم کو حضرت قاسم کی مہندی کیوں نکالتے ہیں ؟براہ کرم وضاحت فرما دیں ۔,"<p><p style=""text-align:justify;"">واضح رہے کہ   7 محرم  الحرام میں رسمِ مہندی کی وجہ یہ بیان کی جاتی ہے کہ میدان کربلا میں امام قاسم رحمہ اللہ کا نکاح ہوا،   اور سات محرم کو انہیں مہندی لگائی گئی تھی، یہ اسی کی یاد گار ہے جوبشکلِ  جلوس منائی جاتی ہے، شرعا اس کا کوئی ثبو ت نہیں بلکہ مردوں کے لیے بلا عذر مہندی لگانا ہی درست نہیں ہے،جبکہ مہندی لگانے کو حضرت قاسم رحمہ اللہ کی شادی پر موقوف کرنا  من گھڑت واقعات اور رسوم  میں سے ہے ۔</p><p style=""text-align:justify;"">فتاوی ہندیہ میں ہے:</p><p class=""indent"" style=""text-align:justify;""><span class=""ar_writing"">""ولا ينبغي أن يخضب يدي الصبي الذكر ورجله إلا عند الحاجة ويجوز ذلك للنساء كذا في الينابيع.""</span></p><p class=""indent"" style=""text-align:left;""><span class=""ar_writing""> (الباب العشرون في الزينة، ج:5 ص:359 ط: دار الفکر)</span></p><p style=""text-align:justify;"">فتاوی محمودیہ میں ہے:</p><p class=""indent"" style=""text-align:justify;"">""سوال:شادی سے  کچھ دن  پہلے لڑکے کو مہندی لگاتے ہیں،اور ابٹن لگاتے ہیں،اورابٹن دانا چلا کر بنایا جاتا ہےمثلاً جو۔</p><p class=""indent"" style=""text-align:justify;"">جواب:یہ بھی کوئی شرعی چیز نہیں ،قابل ترک رسم  ہے،اور اس میں عورتوں کے ساتھ تشبہ ہے جس کی ممانعت آئی ہے۔""</p><p class=""indent"" style=""text-align:left;"">(کتاب النکاح، باب ما یتعلق بالرسوم عند الزفاف، ج:11  ص:192،194 ط:دار الافتاء جامعہ فاروقیہ کراچی)</p><p class=""indent"" style=""text-align:left;"">فقط واللہ اعلم</p></p>",144508100555,banuri,"('حظر و اباحت', 'mamnooaat-mubahat')","('مختلف مجالس و بدعات', 'mukhtalif-majalis-o-bidaat')","('بدعت / رسومات پر مشتمل مجالس و محافل', 'bidat-rusoomaat-par-mushtamil-majaalis-o-mahaafil')"
08-01-2024,https://www.banuri.edu.pk/readquestion/haj-trevil-aijent-ka-logo-ki-raqam-ko-apny-istemal-mai-lany-ka-hukum-144506102381/08-01-2024,حج اسکیم کے تحت لوگوں کی حج کی بقایا رقم کو اپنے استعمال میں لانے کا حکم,"بندہ ایک ایسے مدرسہ کو چلا رہا ہے جہاں صرف تعلیم بالغاں کا اہتمام ہوتا ہے، ہمارے ہاں صرف پڑھا لکھا طبقہ آتا ہے، اس لیے مختلف کورسز وغیرہ کروائے جاتے ہیں، جس میں ان سے فیس بھی لی جاتی ہے۔ عرض یہ ہے کہ  اس سال حج کا قافلہ لے کر جانے کا ارادہ ہے ،سوال یہ ہے کہ کیا بندہ اس حج پیکج سےاپنے لیے کچھ نفع رکھ سکتا ہے؟ تاکہ اس قافلہ کے ساتھ  خود بھی حج پر جا سکوں،جب کہ صرف  نام مدرسے کا استعمال ہو رہا ہے۔تنقیح:سائل اس بات کی وضاحت کرے کہ لوگوں سے کیا کہہ کر  یا کیا  طے کرکے رقم جمع کی جاتی ہے؟اور کیا طریقۂ کار ہوتا ہے؟مکمل وضاحت کے ساتھ دوبارہ سوال لکھ کر ارسال کریں،ان شاء اللہ جواب دے دیا جاۓ گا۔جواب ِ تنقیح:جیسا کہ عرض کیا کہ بندہ  ادارہ کا متولی ہے، اور ادارے  کی جانب سے لوگوں کو علماء کی زیر ِ نگرانی حج کے قافلہ کی صورت میں لے کرحج پر جا رہے ہیں،اس گروپ کاعنوان ""علماء کرام کے ساتھ حج کیجیے"" ہے،ہماری طرف سے لوگوں کو فراہم کیا جانے والا حج پیکج فکس ہے،جس میں ہماری طرف سے انتظامات اور سہولیات فراہم کیے جانے  کےعوض مخصوص رقم لی جاۓ گی اور بچنے والی رقم واپس نہیں کی جائے گی،توکیامیرے لئے اس میں سے رقم بطور نفع کما کر اسی رقم سے حج پر جانا درست ہے؟یہ انتظام ہماری طرف سے ہے ،بس نام مدرسے کا ہے۔","<p><p style=""text-align:justify;"">صورتِ مسئولہ میں اگر حج اسکیم واقعتاًآپ کی جانب سے ہے اور آپ نےاس اسکیم کے تحت لوگوں سے رقوم لے کر انہیں حج پر لے جانے کا انتظام کیاہے تو ایسی صورت میں بقیہ جتنی رقم  اخراجات میں صرف ہونے کے بعد بطور نفع کے آپ کو حاصل ہو،اس رقم کا استعمال آپ کے لیے جائز ہوگا اورآپ اس رقم سے حج پرجاسکتے ہیں۔</p><p style=""text-align:justify;"">فتاوی شامی میں ہے:</p><p class=""indent"" style=""text-align:justify;""><span class=""ar_writing"">""(فالأول من يعمل لا لواحد) كالخياط ونحوه (أو يعمل له عملا غير مؤقت) كأن استأجره للخياطة في بيته غير مقيدة بمدة كان أجيرا مشتركا وإن لم يعمل لغيره (أو موقتا بلا تخصيص)... (ولا يستحق المشترك الأجر حتى يعمل).""</span></p><p class=""indent"" style=""text-align:left;""><span class=""ar_writing"">(کتاب الأجارۃ، باب ضمان الأجیر، ج:6، ص:64، ط:سعيد)</span></p><p style=""text-align:justify;"">فتاوی عالمگیری میں ہے:</p><p class=""indent"" style=""text-align:justify;""><span class=""ar_writing"">""ونوع ‌يرد ‌على ‌العمل كاستئجار المحترفين للأعمال كالقصارة والخياطة والكتابة وما أشبه ذلك، كذا في المحيط.""</span></p><p class=""indent"" style=""text-align:left;""><span class=""ar_writing"">(كتاب الإجارة،‌‌ الباب الأول تفسير الإجارة وركنها وألفاظها وشرائطها، ج:4، ص:409، ط:رشیدیة)</span></p><p style=""text-align:justify;"">بدائع الصنائع میں ہے:</p><p class=""indent"" style=""text-align:justify;""><span class=""ar_writing"">""والأجير قد يكون خاصا وهو الذي يعمل لواحد وهو المسمى بأجير الواحد، وقد يكون مشتركا وهو الذي ‌يعمل ‌لعامة ‌الناس وهو المسمى بالأجير المشترك.""</span></p><p class=""indent"" style=""text-align:left;""><span class=""ar_writing"">(كتاب الإجارة،‌‌ ج:4، ص:174، ط:دارالكتب العلمية)</span></p><p class=""indent"" style=""text-align:left;""><span class=""ar_writing"">فقط والله أعلم</span></p></p>",144506102381,banuri,"('غصب', 'gasab')","('مغصوبہ شے کا تملک / انتفاع', 'magsooba-shayi-ka-tamalluk-intefaa')","('غصب کے منافع کا حکم', 'gasab-ke-manaafe-ka-hukum')"
29-02-2024,https://www.banuri.edu.pk/readquestion/balgham-me-khoon-aane-se-wazo-totne-ka-hukum-144508101717/29-02-2024,بلغم میں خون آنے سے وضو ٹوٹنے کا حکم,کھانستے ہوئے میرے بلغم ریشے میں خون آ رہا ہے، کیا اس سے میرا وضو قائم رہے گا یا ٹوٹ جائے گا؟,"<p><p style=""text-align:justify;"">صورتِ مسئولہ میں اگر بلغم کے ریشے  میں خون آرہا ہے، تو اگر خون بہت کم ہے اور تھوک کا رنگ سفید یا زردی مائل ہے تو وضو نہیں ٹوٹے گا، اور اگر خون زیادہ ہے یا برابر ہے اور رنگ سرخی مائل ہے تو وضو ٹوٹ جائے گا، یعنی جو چیز غالب ہوگی اس کا حکم لگے گا، اگر خون غالب ہوگا تو وضو ٹوٹ جائے گا اور اگر تھوک غالب ہوگا تو وضو نہیں ٹوٹے گا۔</p><p style=""text-align:justify;"">فتاوی شامی میں ہے:</p><p class=""indent"" style=""text-align:justify;""><span class=""ar_writing"">""(و) ينقضه (دم) مائع من جوف أو فم  (غلب على بزاق) حكما للغالب (أو ساواه) احتياطا (لا) ينقضه (المغلوب بالبزاق) والقيح كالدم والاختلاط بالمخاط كالبزاق.""</span></p><p class=""indent"" style=""text-align:left;""><span class=""ar_writing"">(كتاب الطهارة، ج:1، ص:139، ط:سعید)</span></p><p style=""text-align:justify;"">البحر الرائق میں ہے:</p><p class=""indent"" style=""text-align:justify;""><span class=""ar_writing"">""قوله: (أو دما غلب عليه البصاق) ...أي لا ينتقض الدم الخارج من الفم المغلوب بالبصاق؛ لأن الحكم للغالب ، فصار كأنه كله بزاق قيد بغلبة البزاق؛ لأنه لو كان مغلوبا والدم غالب نقض؛ لأنه سال بقوة نفسه، وإن استويا نقض أيضا؛ لاحتمال سيلانه بنفسه، أو أساله غيره فوجد الحدث من وجه فرجحنا جانب الوجود احتياطا ...قالوا: علامة كون الدم غالبا أو مساويا أن يكون أحمر، وعلامة كونه مغلوبا أن يكون أصفر، وقيدنا بكونه خارجا من الفم إلخ.""</span></p><p class=""indent"" style=""text-align:left;""><span class=""ar_writing"">(کتاب الطہارۃ، ج:1، ص:37، ط:دار الكتاب الإسلامي)</span></p><p class=""indent"" style=""text-align:left;""><span class=""ar_writing"">فقط واللہ اعلم</span></p></p>",144508101717,banuri,"('طہارت', 'taharat')","('وضو', 'wuzu')","('نواقض وضو', 'nawaaqz-e-wazu')"
26-02-2024,https://www.banuri.edu.pk/readquestion/easal-sawab-ka-tariqah-or-esal-krny-wlay-kay-ajar-sy-kuch-kam-nahian-hoga-144508101264/26-02-2024,ایصال ثواب کا طریقہ اور ایصال کرنے والے کے اجر سے کچھ کم نہیں ہوگا,میری والدہ محترمہ وفات پاگئی ہیں، اس کے لیے ایصالِ ثواب کے لیےکچھ بھیجنا چاہتا ہوں جیسے نفل، صدقہ یا تبلیغ وغیرہ میں جانا تو میں ایک دفعہ یہ نیت کروں  کہ آدھا ثواب میرا اور آدھا میری والدہ محترمہ کے لیے ، اس میں راہ نمائی درکار ہے، کیا میں ایسا کرسکتا ہوں؟,"<p><p style=""text-align:justify;"">واضح رہے کہ ہر قسم کی بدنی ومالی عبادت کا ثواب میت کو پہنچانا جائز اور صحیح ہے، بلکہ مسحتسن امر ہے جس کا طریقہ یہ ہے کہ کوئی بدنی عبادت یا مالی عبادت کر کے اللہ سے دعا مانگے کہ اے اللہ! میری اس عبادت کا ثواب فلاں کو پہنچادے۔</p><p style=""text-align:justify;"">نیز اگر عبادت کا مکمل ثواب بھی میت کو بخشے تو اللہ کی رحمت سے امید ہے اس ثواب بخشنے والے کے اجر میں سے بھی کچھ کم نہیں ہوگا۔   </p><p style=""text-align:justify;"">فتاوی شامی میں ہے:</p><p class=""indent"" style=""text-align:justify;""><span class=""ar_writing"">""الأفضل لمن يتصدق نفلًا أن ينوي لجميع المؤمنين و المؤمنات؛ لأنها تصل إليهم و لاينقص من أجره شيء. اهـ هو مذهب أهل السنة و الجماعة.</span></p><p class=""indent"" style=""text-align:justify;""><span class=""ar_writing"">سئل ابن حجر المكي عما لو قرأ لأهل المقبرة الفاتحة هل يقسم الثواب بينهم أو يصل لكل منهم مثل ثواب ذلك كاملًا. فأجاب بأنه أفتى جمع بالثاني، و هو اللائق بسعة الفضل.""</span></p><p class=""indent"" style=""text-align:left;""><span class=""ar_writing"">(کتاب الصلاة، باب صلاة الجنازة، ج:2، ص:243، 244، ط:سعيد)</span></p><p style=""text-align:justify;"">کفایت المفتی میں ہے:</p><p class=""indent"" style=""text-align:justify;"">""تقسیم ہو کر ملنے کا قول باعتبار دلیل راجح ہے اور وسعت رحمت اس کی مقتضی ہے کہ پورے قرآن مجید کا ثواب ملے"".</p><p class=""indent"" style=""text-align:left;"">(کتاب الجنائز، ج:4، ص:135، ط:دار الاشاعت)</p><p class=""indent"" style=""text-align:left;"">فقط واللہ اعلم</p></p>",144508101264,banuri,"('جنائز', 'janaiz')","('ایصالِ ثواب', 'ieesaal-e-sawaab')","('ایصالِ ثواب کے احکام و مسائل', 'esaal-e-sawab-ke-ahkaam-o-masael')"
26-02-2024,https://www.banuri.edu.pk/readquestion/gp-fund-ke-manafe-ka-hukum-144508101261/26-02-2024,جی پی فنڈ کے منافع کا حکم,جی پی فنڈ کا منافع لینا جائز ہے؟,"<p><p style=""text-align:justify;"">جی پی ’’فنڈ‘‘ سے مراد وہ رقم ہے جو ہر ماہ سرکاری ملازمین کی تنخواہوں سے حکومت کاٹتی ہے اور پھر ان کی ریٹائرمنٹ پر کاٹی ہوئی رقم اضافی رقم کےساتھ انہیں دیتی ہے۔</p><p style=""text-align:justify;"">اگر یہ حکومت کی جانب سے جبری طور پر کٹوتی کی جاتی ہے تو  ملازمین کے  لیے اصل اور اضافی رقم بھی لینا اور اپنے استعمال میں لانا اور اس سے سامان وغیرہ خریدنا جائز ہوگا۔</p><p style=""text-align:justify;"">اور اگر یہ کٹوتی جبری اور لازمی نہیں ہے، بلکہ اختیاری ہے تو اس صورت میں تنخواہ سے کٹی ہوئی رقم اور کمپنی نے جو اس میں اپنی طرف سے ملائی ہے ان دونوں کے مجموعی رقم کو لینا جائز ہوگا اور اس پر انشورنس کمپنی وغیرہ جو زائد رقم دیتی ہے وہ سود ہونے کی وجہ سے لینا اور استعمال کرنا اور اس سے کوئی چیز خریدنا جائز نہیں ہوگا۔</p><p class=""indent"" style=""text-align:left;""><span class=""ur_writing"">(ماخوذ از تجارت کے مسائل کا انسائیکلوپیڈیا: 3/ 152، 153، ط: بیت العمار)</span></p><p>جواہر الفقہ میں ہے:</p><p class=""indent"" style=""text-align:justify;""><span class=""ur_writing"">محکمہ پراویڈنٹ فنڈ کی رقم پر جو زیادتی اپنی طرف سے دے رہا ہے اس پر شرعی اعتبار سے ربا کی تعریف صادق نہیں آتی خواہ محکمہ نے اس کو سود کا نام لے کردیا ہو۔  اختیاری صورت میں تشبہ بالربوٰ بھی ہے اور یہ خطرہ بھی کہ لوگ اس کو سود خوری کا ذریعہ بنالیں اس لیے اختیاری صورت میں اس پر جو رقم بنام سود دی جاتی ہے اس سے اجتناب کیا جائے۔ </span></p><p class=""indent"" style=""text-align:left;""><span class=""ur_writing"">(رسالہ: پراويڈنٹ فنڈ پر سود كا مسئلہ، 3/ 277، ط: دار العلوم کراچی)</span></p><p class=""indent"" style=""text-align:left;""><span class=""ur_writing"">فقط واللہ اعلم</span></p></p>",144508101261,banuri,"('معاملات', 'muamlat')","('سود / بینکاری / انشورنس / شیئرز', 'sood-bankari-insurance-shares')","('پراویڈنٹ فنڈ', 'provident-fund')"
