issued_at,link,title,question,answer,fatwa_number,dar_ul_ifta,kitab,bab,fasal
29-05-2019,https://www.banuri.edu.pk/readquestion/غصب-شدہ-زمین-پر-نماز-ادا-کرنا/29-05-2019,ہائی والٹیج تاروں کے نیچے نماز پڑھنا،غصب شدہ زمین پر نماز ادا کرنا,کیا جہاں سے ہائی وولٹیج بجلی کے تار گزرتے ہوں جس کے نیچے جان کا خطرہ ہو ایسی جگہ نماز ادا کرنا درست ہے؟اور غصب کی ہوئی جگہ مسجد بناکر اور اس میں نماز ادا کرنے سے نماز ہو جاتی ہے؟ایسے میں اگر کوئی اکیلے گھر  میں نماز پڑھے تو کیسا ہے؟,"<p><p style=""text-align:justify;"">1۔ نماز ادا ہوجائے گی، تاہم جان کو خطرہ میں ڈالنا درست نہیں، ایسی جگہ پر نماز ادا کرنی چاہیے جہاں دھیان و یک سوئی میسر ہو، یہی وجہ ہے کہ رسولِ اکرم صلی اللہ علیہ وسلم نے جہاں اونٹ باندھے گئے ہوں وہاں نماز ادا کرنے سے منع کیا ہے، شراحِ حدیث نے اس ممانعت کی وجوہات میں سے ایک وجہ اونٹ کے بدکنے کے خوف کا ہونے کو قرار دیا ہے، جس سے یہ ثابت ہوتا ہے کہ ایسی جگہ نماز ادا کرنی چاہیے جہاں یک سوئی میسر ہو۔</p><p style=""text-align:justify;"">لہٰذا ہائی وولٹیج تار جہاں سے گزر رہے ہوں، ان کے نیچے کھلی فضا میں نماز ادا کرنا خود کو خطرے میں ڈالنا ہے، لیکن اگر مسجد پختہ اور محفوظ طور پر تعمیر ہو اور ماہرین و اہلِ تجربہ کی رائے میں خطرہ نہ ہو تو ایسی جگہ نماز ادا کرنے میں کوئی حرج نہیں ہوگا، جیساکہ بہت سے مقامات پر شہری آبادیوں کے درمیان اور مرکزی شاہراہوں اور پلوں کے اوپر سے ہائی وولٹیج تار گزرتے ہیں، اور حکومت اور متعلقے محکمے اپنے تئیں تحفظ کی تدابیر اختیار کرتے ہوئے لگاتے ہیں، ایسی صورت میں صرف خطرے کے اندیشے کی وجہ سے جماعت کی نماز چھوڑنے کی اجازت نہیں ہوگی۔</p><p style=""text-align:justify;"">2۔ کسی کی شخصی زمین پر مالک کی اجازت کے بغیر مسجد  بنانے کی شرعاً اجازت نہیں ہے، اگر کسی جگہ مسجد کی ضرورت ہو تو پہلے مالک سے اجازت لے لیں، اور مالکِ زمین کو چاہیے  کہ وہ اجازت دے دے، اس کی اجازت سے مسجد بننے کی صورت میں اس کے لیے صدقہ جاریہ ہوگا، اور موت کے بعد راحت کا ذریعہ ہوگا، تاہم شخصی زمین پر مالک کی  اجازت کے بغیر مسجد بنانے کی صورت میں بنانے والا گناہ گار ہوگا، اور آخرت میں حساب دینا ہوگا۔</p><p style=""text-align:justify;"">لہٰذا صورتِ مسئولہ میں غصب کی ہوئی زمین پر جان بوجھ کر کسی مجبوری کے بغیر نماز ادا کرنا مکروہ ہے، اگرچہ نماز ادا ہوجائے گی۔ اور اگر سوال میں غصب کی ہوئی جگہ سے مراد غیر آباد سرکاری زمین ہے، جس میں عوام کا اجتماعی حق ہے اور وہ کسی کی شخصی ملکیت نہیں ہے، تو اس کے حکم میں تفصیل ہے، وہاں نماز ادا کرنا مطلقاً مکروہ نہیں ہوگا، بعض صورتوں میں مکروہ ہوگا اور بعض میں اجازت ہوگی۔</p><p style=""text-align:justify;"">مراقی الفلاح میں ہے:</p><p style=""text-align:justify;""><span class=""ar_writing"">""و تكره في أرض الغير بلا رضاه، و إذا ابتلي بالصلاة في أرض الغير و ليست مزروعةً أو الطريق إن كانت لمسلم صلى فيها، و إن كانت لكافر صلى في الطريق"". ( كتاب الصلاة، فصل في المكروهات، ص: ٣٥٨)</span></p><p style=""text-align:justify;"">طحطاوی علی مراقی الفلاح میں ہے:</p><p style=""text-align:justify;""><span class=""ar_writing""><strong>""( قوله: صلى فيها) لأن الظاهر أنه يرضي به لأنه ينال أجراً من غير اكتساب منه"". ( كتاب الصلاة، فصل في المكروهات، ص: ٣٥٨، ط: قديمي)</strong></span></p><p style=""text-align:justify;"">فتاوی ہندیہ میں ہے:</p><p style=""text-align:justify;""><span class=""ar_writing"">""الصلاة في أرض مغصوبة جائزة و لكن يعاقب بظلمه، فكما كان بينه و بين الله تعالى يثاب، و ما كان بينه و بين العباد يعاقب، كذا في مختار الفتوي"". ( كتاب الصلاة، الباب السابع، الفصل الثاني فيما يكره في الصلاة و ما لا يكره فيها، ١/ ١٠٩)</span></p><p style=""text-align:justify;"">فتاوی شامی میں ہے:</p><p style=""text-align:justify;""><span class=""ar_writing""><strong>""و في الواقعات: بنى مسجداً على سور المدينة لاينبغي أن يصلي فيه؛ لأنه حق العامة فلم يخلص  الله تعالى، كالمبني في أرض مغصوبة"". ( كتاب الصلاة، مطلب في الصلاة في الأرض المغصوبة. و دخول البساتين و بناء المسجد في ارض الغصب، ١/ ٣٨١، ط: سعيد) </strong></span>فقط واللہ اعلم</p></p>",144008201661,banuri,"('نماز', 'salat')","('مکروہاتِ نماز', 'makrohat-e-namaz')","('مکروہات نماز', 'makrohat-e-namaz')"
30-05-2019,https://www.banuri.edu.pk/readquestion/رؤیت-ہلال-کمیٹی-کی-جانب-سے-رمضان-کا-اعلان-نہ-ہونے-کی-صورت-میں-رمضان-کا-چاند-خود-دیکھنے-والا-روزہ-رکھے-یا-نہیں/30-05-2019,رؤیت ہلال کمیٹی کی جانب سے رمضان کا اعلان نہ ہونے کی صورت میں رمضان کا چاند خود دیکھنے والا روزہ رکھے یا نہیں؟,یہ سوال میرے دوست کا ہے جو خیبر ایجنسی سے تعلق  رکھتا ہے،  میں نے رمضان المبارک کا چاند دیکھ لیا،  لیکن رؤیت  ہلال کمیٹی نے اعلان نہیں کیا ۔ سوال یہ ہے کہ کیا میں چاند دیکھ کر روزہ رکھوں یا رؤیت ہلال کمیٹی کے ساتھ چلوں؟,"<p><p style=""margin-left:0;margin-right:0;text-align:justify;"">جس آدمی نے خود رمضان المبارک کا چاند دیکھا، لیکن قاضی / رؤیت ہلال کمیٹی نے رمضان کے چاند کا اعلان نہیں کیا تو اس پر لازم ہے کہ وہ چاند دیکھنے کی وجہ سے خود رمضان کا روزہ رکھے، اگر اس نے روزہ نہیں رکھا تو اس پر رمضان کے بعد اس روزے کی قضا کرنا لازم ہے۔</p><p style=""margin-left:0;margin-right:0;text-align:justify;""><span class=""ar_writing"">الدر المختار وحاشية ابن عابدين (رد المحتار) (2/ 384):</span></p><p style=""margin-left:0;margin-right:0;text-align:justify;""><span class=""ar_writing"">""(رأى) مكلف (هلال رمضان أو الفطر ورد قوله) بدليل شرعي (صام) مطلقاً وجوباً، وقيل: ندباً (فإن أفطر قضى فقط) فيهما لشبهة الرد. (واختلف) المشايخ لعدم الرواية عن المتقدمين (فيما إذا أفطر قبل الرد) لشهادته (والراجح عدم وجوب الكفارة).</span></p><p style=""margin-left:0;margin-right:0;text-align:justify;""><span class=""ar_writing""> (قوله: رأى مكلف) أي مسلم بالغ عاقل ولو فاسقاً كما في البحر عن الظهيرية، فلايجب عليه لو صبياً أو مجنوناً، وشمل ما لو كان الرائي إماماً فلايأمر الناس بالصوم، ولا بالفطر إذا رآه وحده، ويصوم هو، كما في الإمداد، وأفاد الخير الرملي أنه لو كانوا جماعةً وردت شهادتهم لعدم تكامل الجمع العظيم فالحكم فيهم كذلك (قوله: بدليل شرعي) هو إما فسقه أو غلطه، نهر، وفي القهستاني: بفسقه لو السماء متغيمة أو تفرده لو كانت مصحيةً (قوله: صام) أي صوماً شرعياً؛ لأنه المراد حيث أطلق شرعاً، ويدل عليه ما بعده، وفيه إشارة إلى رد قول الفقيه أبي جعفر: إن معناه في هلال الفطر لايأكل ولايشرب، ولكن ينبغي أن يفسده؛ لأنه يوم عيد عنده وإلى رد قول بعض مشايخنا من أنه يفطر فيه سراً كما في البحر، وإليه أشار الشارح بقوله: مطلقاً أي في هلال رمضان والفطر.</span></p><p style=""margin-left:0;margin-right:0;text-align:justify;""><span class=""ar_writing"">[تنبيه] : لو صام رائي هلال رمضان وأكمل العدة لم يفطر إلا مع الإمام؛ لقوله عليه الصلاة والسلام: «صومكم يوم تصومون وفطركم يوم تفطرون». رواه الترمذي وغيره. والناس لم يفطروا في مثل هذا اليوم فوجب أن لايفطر، نهر، (قوله: وجوباً، وقيل: ندباً) قال في البدائع: المحققون قالوا: لا رواية في وجوب الصوم عليه، وإنما الرواية أنه يصوم وهو محمول على الندب احتياطاً. اهـ.</span></p><p style=""margin-left:0;margin-right:0;text-align:justify;""><span class=""ar_writing"">قال في التحفة: يجب عليه الصوم. وفي المبسوط: عليه صوم ذلك اليوم، وهو ظاهر استدلالهم في هلال رمضان بقوله تعالى: {فمن شهد منكم الشهر فليصمه} [البقرة: 185]- وفي العيد بالاحتياط، نهر، وما في البدائع مخالف لما في أكثر المعتبرات من التصريح بالوجوب، نوح.</span></p><p style=""margin-left:0;margin-right:0;text-align:justify;""><span class=""ar_writing"">قلت: والظاهر أن المراد بالوجوب المصطلح لا الفرض؛ لأن كونه من رمضان ليس قطعياً، ولذا ساغ القول بندب صومه وسقطت الكفارة بفطره ولو كان قطعياً للزم الناس صومه. على أن الحسن وابن سيرين وعطاء قالوا: لايصوم إلا مع الإمام، كما نقله في البحر، فافهم (قوله: قضى فقط) أي بلا كفارة"".</span>فقط واللہ اعلم</p></p>",144008201726,banuri,"('روزہ', 'soum')","('روزہ', 'roza')","('رؤیت ہلال', 'ro-yat-e-hilal')"
23-04-2019,https://www.banuri.edu.pk/readquestion/ایزی-پیسہ-اپلیکشن-کے-ذریعے-ملنے-والی-سہولیات/23-04-2019,ایزی پیسہ ایپلیکشن کے ذریعے ملنے والی سہولیات,"ایک ایپ ہے ”ایزی پیسہ“،  جس کے انسٹال کرنے پر ""150"" والا پیکج ""80""روپے میں ہو جاتا ہے، اسی طرح ایزی لوڈ کرنے پر پچاس فی صد خرچ ہوتے ہیں۔ اس سے مذکورہ فوائد حاصل کرنا کیسا ہے؟","<p><p style=""text-align:justify;"">""ایزی پیسہ اکاؤنٹ  "" ایک ایسی سہولت ہے جس میں آپ اپنی جمع کردہ رقوم  سے کئی قسم کی سہولیات حاصل کرسکتے ہیں، مثلاً: بلوں کی ادائیگی، یا رقوم کا تبادلہ، موبائل وغیرہ میں بیلنس کا استعمال وغیرہ ۔ نیز تحقیق کرنے پر یہ بھی معلوم ہوا ہے کہ ان کی پشت پر ایک بینک ہوتا ہے، telenor micro-financing bank ، یہ بھی ایک قسم کا بینک ہی ہے کہ جس میں عام طور پر چھوٹے سرمایہ داروں کی رقوم سود پر رکھی جاتی ہیں اور اس میں سے چھوٹے کاروباروں کے لیے سود پر قرض بھی دیا جاتا ہے۔</p><p style=""text-align:justify;"">اس کی فقہی حیثیت یہ ہے کہ اس اکاؤنٹ میں جمع کردہ رقم قرض ہے ، اور  چوں کہ قرض دے کر اس سے کسی بھی قسم کا نفع اٹھانا جائز نہیں ہے؛ اس لیے اس قرض کے بدلے کمپنی کی طرف سے دی جانے والی سہولیات وصول کرنا اور ان کا استعمال کرنا جائز نہیں ہے، لہذا   کمپنی  اکاؤنٹ ہولڈر کو اس مخصوص رقم جمع کرانے کی شرط پر  یومیہ فری منٹس اور میسیجز وغیرہ کی سہولت فراہم کرتی ہے یا رقم کی منتقلی پر ڈسکاؤنٹ وغیرہ دیتی ہے تو  ان کا استعمال جائز نہیں ہوگا، اس لیے کہ اس اکاؤنٹ میں رقم رکھوانا درحقیقت  قرض ہے، اور  قرض دینا تو فی نفسہ جائز ہے، لیکن کمپنی اس پر جو  مشروط منافع دیتی  ہے، یہ  شرعاً ناجائز ہے؛ اس لیے کہ قرض پر شرط لگا کر نفع  کے لین دین  کو نبی کریم ﷺ نے سود قرار دیا ہے۔ (مصنف بن أبی شیبہ، رقم:۲۰۶۹۰ )</p><p style=""text-align:justify;""> نیز   چوں کہ اس میں  مذکورہ اکاؤنٹ کھلوانا ناجائز معاملے کےساتھ مشروط ہے ؛ اس لیے یہ اکاؤنٹ کھلوانا یا کھولنا  بھی جائز نہیں ہوگا۔</p><p style=""text-align:justify;"">اگر کوئی ""ایزی پیسہ اکاؤنٹ""  کھلواچکاہو تو اس کے لیے یہ حکم ہے کہ وہ صرف اپنی جمع کردہ رقم واپس لے سکتاہے، یا صرف جمع کردہ رقم کے برابر استفادہ کرسکتاہے، اس رقم پر ملنے والے اضافی فوائد حاصل کرنا اس کے لیے جائز نہیں ہوں گے۔ فقط واللہ اعلم</p><p style=""text-align:justify;"">نوٹ: ہماری معلومات کے مطابق ’’ایزی پیسہ اکاؤنٹ‘‘ اور ’’ایزی پیسہ ایپ‘‘  کا طریقہ کار  یک ساں ہے، اگر ’’ایزی پیسہ ایپ‘‘ کی شرائط و ضوابط میں فرق ہو تو دوبارہ وضاحت تفصیلاً ارسال کرکے جواب معلوم کرسکتے ہیں۔</p></p>",144008200405,banuri,"('معاملات', 'muamlat')","('سود / بینکاری / انشورنس / شیئرز', 'sood-bankari-insurance-shares')","('سود کی تعریف اور احکام', 'sood-ki-tareef-or-ahkam')"
16-04-2019,https://www.banuri.edu.pk/readquestion/زکو-ۃ-نکالنے-کا-طریقہ-تجارتی-پلاٹ-کی-زکو-ۃ/16-04-2019,زکاۃ نکالنے کا طریقہ / تجارتی پلاٹ کی زکاۃ,1-  میں ایک تنخواہ دار ملازم ہوں، اگر میں نے اپنی آمدنی کی زکاۃ  ادا کرنی ہو تو میں حساب کیسے کروں گا؟  اس وقت میرا معمول یہ ہے کہ  ہر رمضان المبارک  کی  15 تاریخ تک جتنے  پیسے میرے پاس نقد یا بینک میں ہوں، سب کی زکاۃ  ادا کرتا ہوں.2- میرے پاس دو پلاٹ بھی ہیں، ایک گھر بنانے کے ارادے سے لیا ہے، دوسرا مستقبل میں بیچنے کی غرض سے. دونوں پر ابھی ایک سال نہیں گزرا. کیا ان پر زکاۃ فرض ہوگی؟,"<p><p style=""text-align:justify;"">1- صورتِ مسئولہ میں آپ کی سالانہ زکاۃ  نکالنے کی تاریخ (15 رمضان) کو آپ کے ذمہ اس تاریخ تک جو واجب الادا اخراجات (مثلاً قرض، بجلی، راشن وغیرہ کے بل وغیرہ) ہیں ان کو  آپ کی ملکیت میں جو کچھ سونا، چاندی، نقدی، مال تجارت، قرض پر دی ہوئی رقم (جس کی واپسی کی امید ہو)، امانت میں دی ہوئی رقم ہے، اس سے  منہا کرنے کے بعد جو رقم بچتی ہے، اگر ان سب کی مالیت  ساڑھے باون تولہ چاندی کی قیمت کے برابر یا اس سے زیادہ ہو تو آپ پر  ان کی مالیت کا ڈھائی فیصد بطورِ زکاۃ  ادا کرنا لازم ہوگا، یعنی آپ اپنے کل قابل زکاۃ (سونا، چاندی، نقدی اور مالِ تجارت جیسے نفع پر بیچنے کی نیت سے لیا گیا پلاٹ)  مال کو جمع کریں، اس میں واجب الادا  اخراجات منہا کریں، حاصل رقم کو چالیس سے تقسیم کردیں،  اس سے جو رقم آئے وہ آپ کو زکاۃ  میں دینا لازم ہوگی۔</p><p style=""text-align:justify;"">2- جو  پلاٹ گھر بنانے کی نیت سے لیا ہے، اس پر زکاۃ  لازم نہیں ہے، اور جو  پلاٹ فروخت کرنے کی نیت سے لیا ہے اس کی زکاۃ ادا کرنا لازم ہے، اور جب آپ کی زکاۃ  نکالنے کی تاریخ ہو، اس میں اس پلاٹ کی  بھی موجودہ مارکیٹ ویلیو کی رقم کا حساب کیا جائے، اس پرالگ سے سال گزرنا شرط نہیں ہے۔فقط واللہ اعلم</p></p>",144008200213,banuri,"('زکات', 'zakat')","('زکوٰۃ / صدقات', 'zakat-sadaqat')","('ادائے زکوٰۃ', 'adaye-zakat')"
29-05-2019,https://www.banuri.edu.pk/readquestion/تجارتی-مال-کی-زکو-ۃ-اور-اس-کے-حساب-کا-طریقہ/29-05-2019,تجارتی مال کی زکوٰۃ اور اس کے حساب کا طریقہ,کیا دکان دار،  دکان کے مال پر زکاۃ  جو ادا کرے گا وہ بیچنے والے ریٹ پر دے گا؟  اگر یہ بات درست ہے تو مہربانی اس کے طریقے کو واضح طور پر بتا دیا جائے!,"<p><p style=""text-align:justify;"">تجارتی مال کی زکاۃ ادا کرنے میں قیمتِ خرید کا اعتبار  نہیں ہے، بلکہ قیمتِ فروخت کا اعتبار ہے،  یعنی زکاۃ  نکالتے  وقت بازار میں  سامان کو فروخت کرنے کی جو قیمت ہے اسی قیمت سے ڈھائی فیصد زکاۃ ادا کرنا ضروری ہے۔</p><p style=""margin-left:9pt;margin-right:10.3pt;text-align:justify;"">اس کا طریقہ یہ ہے کہ جس دن آپ صاحبِ نصاب ہوں چاند کی وہ تاریخ نوٹ کرلیں، اور اگر صاحب نصاب ہوئے عرصہ گزرگیا ہو اور آپ کو اندازا نہ ہو کہ آپ چاند کی کس تاریخ کو صاحبِ نصاب ہوئے تھے، تو اندازے سے ایک تاریخ مقرر کرلیں( مثلاً: یکم رمضان المبارک طے کرلیں کہ یہ آپ کی زکاۃ کا سال مکمل ہونے کا دن ہے) پھر ہر سال اس دن اپنے دیگر قابلِ زکاۃ  اثاثوں کے ساتھ  پوری دکان کے قابلِ فروخت  سامان کا جائزہ لے کر مارکیٹ میں  قیمتِ فروخت کے حساب سے اس کی مالیت کی تعیین کریں، اس میں سے اپنے اوپر واجب الادا اخراجات مثلاً جو ادائیگیاں باقی ہیں یا دیگر قرض وغیرہ منہا کریں،  اور اس کے بعد جتنی مالیت بچے اس کا چالیسواں حصہ یعنی ڈھائی فیصد زکاۃ ادا کردیں۔</p><p style=""margin-left:9pt;margin-right:10.3pt;text-align:justify;"">دکان کے اسٹاک کی قیمت لگانے میں یہ سہولت ہے کہ جس چیز کا اسٹاک ہو اس چیز کی مارکیٹ میں اتنے اسٹاک کی جو قیمت بنتی ہو اس کے اعتبار سے مالیت لگاکر ڈھائی فی صد زکاۃ ادا کی جاسکتی ہے۔ </p><p style=""margin-left:9pt;margin-right:10.3pt;text-align:justify;"">تاہم اگر پوری کوشش کے باوجود  کسی وجہ سے دکان کا  مکمل حساب کرنا ممکن  نہ ہوتو  اندازا  لگاکر اس میں  کچھ اضافہ کرکے زکاۃ  ادا کرے ، تاکہ زکاۃ واجب مقدار سے  کم ادا نہ ہو۔فقط واللہ اعلم</p></p>",144008201687,banuri,"('زکات', 'zakat')","('زکوٰۃ / صدقات', 'zakat-sadaqat')","('ادائے زکوٰۃ', 'adaye-zakat')"
13-04-2019,https://www.banuri.edu.pk/readquestion/زکو-ۃ-کی-نیت-سے-رقم-الگ-کرنے-کے-بعد-کچھ-رقم-ضائع-ہوگئی-تو-زکو-ۃ-کا-حکم/13-04-2019,زکاۃ کی نیت سے رقم الگ کرنے کے بعد کچھ رقم ضائع ہوگئی تو زکاۃ کا حکم,زکاۃ  کی نیت سے میں نے بیس ہزار روپے  الگ کیے اور پھر ان میں سے چار ہزار  ایک غریب کو دیے، اور بقایا سولہ ہزار روپے  گم ہوگئے تو آیا جو پیسے الگ کیے  اور ابھی کچھ گم ہوگئے تو سب20000 کی زکاۃ اداہوگئی یا صرف وہ4000کی؟,"<p><p style=""text-align:justify;"">صورتِ مسئولہ میں زکاۃ  کی نیت سے بیس ہزار روپے الگ کرکے چار ہزار مستحق کو دے دیے  تو وہ  چار ہزار تو زکاۃ  میں ادا ہوگئے، باقی سولہ ہزار جو گم ہوگئےوہ زکاۃ  میں ادا نہیں ہوئے ، اس قدر رقم کی دوبارہ زکاۃ ادا کرنا لازم ہوگا۔</p><p style=""text-align:justify;""><span class=""ar_writing"">الدر المختار وحاشية ابن عابدين (رد المحتار) (2/ 270):<br/>
""ولايخرج عن العهدة بالعزل بل بالأداء للفقراء. </span></p><p style=""text-align:justify;""><span class=""ar_writing"">(قوله: ولايخرج عن العهدة بالعزل) فلو ضاعت لاتسقط عنه الزكاة، ولو مات كانت ميراثاً عنه، بخلاف ما إذا ضاعت في يد الساعي؛ لأن يده كيد الفقراء، بحر عن المحيط"". </span>فقط واللہ اعلم</p></p>",144008200145,banuri,"('زکات', 'zakat')","('زکوٰۃ / صدقات', 'zakat-sadaqat')","('ادائے زکوٰۃ', 'adaye-zakat')"
