issued_at,link,title,question,answer,fatwa_number,dar_ul_ifta,kitab,bab,fasal
10-05-2019,https://www.banuri.edu.pk/readquestion/کمپنی-کی-شراکت-داری-پر-زکوۃ/10-05-2019,کمپنی کی شراکت داری پر زکاۃ,میں نے ایک دوائی کی کمپنی میں انویسٹمنٹ کی ہے پانچ لاکھ  کی، جس میں سے ایک لاکھ ادھار لیے  ہیں اور چار لاکھ میرے اپنے  ہیں۔ کمپنی ہر تین ماہ بعد نفع دیتی ہے۔سوال یہ ہے کہ میں اس کی زکاۃ  کیسے ادا کروں؟ یہ میرے علم میں نہیں ہے کہ کمپنی کے کتنے اثاثے ہیں؟,"<p><p style=""text-align:justify;"">جتنی رقم لگا کر آپ نے کمپنی میں شراکت داری حاصل کی ہے، یہ رقم آپ کی ملکیت ہے اور اس رقم  سے کمپنی نے جتنا سامانِ تجارت خریدا  ہےاور جتنا کیش ہے یا واجب الوصول رقوم ہیں، اس پر زکاۃ  ہے۔</p><p style=""text-align:justify;"">لہذا  آپ کمپنی سے ان کے حسابات حاصل کرکے  ان تمام مدات میں اپنے حصے کے بقدر زکاۃ ادا کریں، البتہ جو  ایک لاکھ  روپے آپ نے ادھار لیے ہیں یہ رقم اپنے اثاثوں میں سے سے منہا کر کے بقیہ اثاثوں کی زکاۃ  ادا کریں۔</p><p style=""text-align:justify;"">اگر حتمی طور پر ملکیت کا تعین نہ ہو تو کمپنی کے ذمہ داران سے معلومات کرکے تقریبی اندازا لگالیں اور احتیاطاً کچھ زیادہ رقم زکاۃ میں ادا کردیں۔ فقط واللہ اعلم</p></p>",144008200880,banuri,"('زکات', 'zakat')","('زکوٰۃ / صدقات', 'zakat-sadaqat')","('سامان تجارت', 'saaman-e-tijarat')"
14-04-2019,https://www.banuri.edu.pk/readquestion/غیر-شادی-شدہ-مرد-کے-ترکہ-کی-تقسیم-کا-طریقہ-جبکہ-والدین-بھی-زندہ-نہ-ہوں/14-04-2019,غیر شادی شدہ مرد کے ترکہ کی تقسیم کا طریقہ ( جب کہ والدین بھی زندہ نہ ہوں),غیر شادی شدہ مرد کاترکہ اس کے زندہ بہن بھائیوں میں کیسے تقسیم ہوگا جب کہ اس کے والدین پہلے فوت ہو چکے ہوں؟  اور کیا پہلے سے فوت شدہ حقیقی بہن بھائی کی اولاد کو  حصہ ملے گا?اگر ملے گا تو کتنا ملے گا؟,"<p><p style=""margin-left:0;margin-right:0;text-align:justify;"">غیر شادی شدہ مرد جس کے والدین بھی فوت ہوچکے ہوں اس کا ترکہ حقیقی بہن بھائیوں کی موجودگی میں صرف اس کے ان حقیقی بہن بھائیوں کو ملے گا جو اس کی وفات کے وقت زندہ تھے،اس کے جو بہن بھائی اس کی وفات سے پہلے فوت ہو چکے ہوں ان کا یا ان کی اولاد کا اس کے ترکہ میں کوئی حق نہیں ہے، ترکہ کی تقسیم کا شرعی طریقہ یہ ہوگا کہ  سب سے پہلے مرحوم کی کل جائیداد منقولہ و غیر منقولہ میں سے مرحوم کے   حقوقِ متقدمہ یعنی تجہیز و تکفین کے اخراجات نکالنے اور اگر مرحوم کے ذمہ کوئی قرضہ ہو  تو قرضہ کی ادائیگی کے بعد، اور اگر مرحوم نے کوئی جائز وصیت کی ہو تو ایک تہائی مال میں سے وصیت کو نافذ کرنے کے بعد باقی کل جائیداد منقولہ و غیر منقولہ کو بہن بھائیوں میں اس طرح تقسیم کیا جائے کہ ہر بھائی کو بہن کے مقابلہ میں دوگناہ حصہ ملے۔ فقط واللہ اعلم</p></p>",144008200173,banuri,"('معاملات', 'muamlat')","('وراثت / وصیت', 'wirasat-wasyat')","('ورثاء اور ان کے حصص', 'wurasa-or-un-k-hisas')"
08-06-2019,https://www.banuri.edu.pk/readquestion/میت-پہ-زکواتہ-خرچ-کرنا/08-06-2019,میت پہ زکاۃ خرچ کرنا,میت پر زکاۃخرچ کی جا سکتی ہے؟,"<p><p style=""text-align:justify;"">زکاۃ کی ادائیگی کے لیے ضروری ہے کہ کسی زندہ شخص کو بلاعوض اللہ کی رضا کے لیے مالک بناکر دی جائے؛ میت پر خرچ کرنے سے زکاۃ ادا نہیں ہوگی، کیوں کہ میت مالک بننے کی صلاحیت نہیں رکھتا۔ فقط واللہ اعلم</p></p>",144008201999,banuri,"('زکات', 'zakat')","('زکوٰۃ / صدقات', 'zakat-sadaqat')","('ادائے زکوٰۃ', 'adaye-zakat')"
08-06-2019,https://www.banuri.edu.pk/readquestion/سجدہ-میں-یاد-آیا-کہ-رکوع-چھوٹ-گیا/08-06-2019,سجدہ میں یاد آیا کہ رکوع چھوٹ گیا,اگر نماز میں رکوع چھوٹ جائے اور سجدہ میں چلا جائے پھر یاد آئے تو کیا حکم ہے ؟,"<p><p style=""margin-right:0;text-align:justify;"">اگر نماز میں رکوع چھوٹ جائے اور اسی رکعت کے سجدہ میں یاد آجائے تو یاد آتے ہی کھڑے ہوکر فوت شدہ رکوع ادا کرلے اور دوبارہ سجدہ کرلے؛ کیوں کہ رکوع سے پہلے کیا گیا سجدہ معتبر نہیں ہے۔ تاہم منفرد ہونے (تنہا نماز پڑھنے) کی صورت میں نماز کے آخر میں سجدہ سہو کرلے۔</p><p style=""margin-right:0;text-align:justify;""><span class=""ar_writing"">""وبقي من الفروض تمييز المفروض، وترتيب القيام على الركوع،والركوع على السجود"".</span> (فتاوی شامی، ۱/۴۴۹، سعید)</p><pre style=""margin-right:0;text-align:justify;""><span class=""ar_writing"">""(قوله: وترتيب القيام على الركوع إلخ) أي تقديمه عليه، حتى لو ركع ثم قام لم يعتبر ذلك الركوع، فإن ركع ثانياً صحت صلاته؛ لوجود الترتيب المفروض، ولزمه سجود السهو؛ لتقديمه الركوع المفروض، وكذا تقديم الركوع على السجود؛ حتى لو سجد ثم ركع، فإن سجد ثانياً صحت لما قلنا"". (فتاوی شامی، ۱/۴۴۹، سعید)
""(ورعاية الترتيب) بين القراءة والركوع و (فيما يتكرر) أما فيما لايتكرر ففرض كما مر"".(فتاوی شامی، ۱/۴۶۰، سعید)</span></pre><p style=""text-align:justify;""><span class=""ar_writing"">""بخلاف الترتيب بين الركوع والسجود مثلاً فإنه فرض، حتى لو سجد قبل الركوع لم يصح سجود هذه الركعة، لأن أصل السجود يشترط ترتبه على الركوع في كل ركعة كترتب الركوع على القيام"". </span>(فتاوی شامی، ۱/۴۶۱، سعید)</p><p style=""text-align:justify;""><span class=""ar_writing"">""قلت: أجاب في البحر بأن قولهم هنا: إن الترتيب شرط، معناه أن الركن الذي قدمه يلغو ويلزمه إعادته مرتباً، حتى إذا سجد قبل الركوع لايعتد بهذا السجود بالإجماع كما صرح به في النهاية؛ فيشترط إعادته"".</span> (فتاوی شامی، ۱/۴۶۱، سعید) فقط واللہ اعلم</p></p>",144008202014,banuri,"('نماز', 'salat')","('نماز کی شرائط', 'namaz-ki-sharait')","('نماز اور اس کی شرائط و ارکان ، سنن و آداب', 'namaz-or-us-ki-sharait-o-arkaan-sunan-o-aadab')"
06-06-2019,https://www.banuri.edu.pk/readquestion/سوشل-میڈیا-پر-تبلیغ-میں-گئے-شوہر-کی-بیوی-سے-متعلق-چلنے-والے-فتوی-کی-کیا-حقیقت-ہے/06-06-2019,سوشل میڈیا پر تبلیغ میں گئے شوہر کی بیوی سے متعلق چلنے والے فتوی کی کیا حقیقت ہے؟,آج کل ایک فتوی سوشل میڈیا پر گردش کر رہا ہے کہ جس عورت کا شوہر چار ماہ سے زیادہ عرصہ کے لیے تبلیغ پر گیا ہوا ہو  اس کی بیوی کے لیے غیر مرد سے تعلقات قائم کرنے کی اجازت ہے، کیا یہ فتوی صحیح ہے؟,"<p><p style=""text-align:justify;"">سوشل میڈیا پر ایک دینی ادارے کے لیٹر پیڈ پر گردش کرنے والا مذکورہ فتوی فتنہ پرور افراد کی جانب سے جعل سازی پر مشتمل ہے، جس کا شریعت سے کوئی تعلق نہیں،  ایسا کوئی فتویٰ کسی بھی ادارے سے شائع نہیں ہوا ، نیز مذکورہ ادارہ کی جانب سے باقاعدہ  تردید شائع کی جاچکی ہے۔ فقط واللہ اعلم</p></p>",144008201961,banuri,"('حقوق و آدابِ معاشرت', 'huqooq-muashret')","('حقوق', 'bahmi-huqooq')","('میاں ، بیوی کے حقوق', 'mian-biwi-k-huqooq')"
07-06-2019,https://www.banuri.edu.pk/readquestion/ایک-مرتبہ-جنازہ-کی-نماز-ہو-جانے-کے-بعد-کیا-جنازہ-کی-نماز-دوبارہ-پڑھی-جا-سکتی-ہے/07-06-2019,ایک مرتبہ جنازہ کی نماز ہوجانے کے بعد کیا جنازہ کی نماز دوبارہ پڑھی جا سکتی ہے؟,ایک میت کے کتنے جنازے جائِز ہیں؟  یعنی کیا ایک سے زائِد جنازے ہوسکتے ہیں؟  اگر اُس کےشرعی ولی، بیٹے​ یا تعلُق والے زیادہ ہوں، کُچھ ایک جگہ اور کُچھ دوسری جگہ ہوں  تو کیا حکم ہے؟ اور یہ لازمی بتائیں کے پہلا جنازہ جس میں کوئی ایک ولی بھی ہو، اس کے بعد دوسرے  جنازے(جس میں کوئی دوسرا ولی یا بیٹا بھی شامل ہو) کا شرعی حکم کیا ہوگا؟  یعنی دو جنازوں کی صورت میں دوسرے کا کیا حکم ہوگا؟,"<p><p style=""text-align:justify;"">ایک دفعہ حاکمِ وقت کی اجازت سے یا اولیاءِ میت میں سے کسی ایک کی اجازت سے جنازہ کی نماز ادا ہو جانے کے بعد دوبارہ جنازہ کی نماز ادا کرنے کی شرعاً اجازت نہیں، چاہے دوسرے اولیاء نے نماز دا کی ہو یا نہ کی ہو، البتہ اگر پہلی مرتبہ جنازے کی نماز ولی کی اجازت و شرکت کے بغیر ہوئی ہو تو ایسی صورت میں میت کے ولی کو دوبارہ جنازہ کی نماز ادا کرنے کی اجازت ہوگی۔</p><p style=""text-align:justify;"">فتاوی ہندیہ میں ہے:</p><p style=""text-align:justify;""><span class=""ar_writing"">""وَلَا يُصَلَّى عَلَى مَيِّتٍ إلَّا مَرَّةً وَاحِدَةً وَالتَّنَفُّلُ بِصَلَاةِ الْجِنَازَةِ غَيْرُ مَشْرُوعٍ، كَذَا فِي الْإِيضَاحِ. وَلَا يُعِيدُ الْوَلِيُّ إنْ صَلَّى الْإِمَامُ الْأَعْظَمُ أَوْ السُّلْطَانُ أَوْ الْوَالِي أَوْ الْقَاضِي أَوْ إمَامُ الْحَيِّ؛ لِأَنَّ هَؤُلَاءِ أَوْلَى مِنْهُ وَإِنْ كَانَ غَيْرُ هَؤُلَاءِ لَهُ أَنْ يُعِيدَ، كَذَا فِي الْخُلَاصَةِ. وَإِنْ صَلَّى عَلَيْهِ الْوَلِيُّ لَمْ يَجُزْ لِأَحَدٍ أَنْ يُصَلِّيَ بَعْدَهُ وَلَوْ أَرَادَ السُّلْطَانُ أَنْ يُصَلِّيَ عَلَيْهِ فَلَهُ ذَلِكَ؛ لِأَنَّهُ مُقَدَّمٌ عَلَيْهِ، وَلَوْ صَلَّى عَلَيْهِ الْوَلِيُّ وَلِلْمَيِّتِ أَوْلِيَاءُ أُخَرُ بِمَنْزِلَتِهِ لَيْسَ لَهُمْ أَنْ يُعِيدُوا، كَذَا فِي الْجَوْهَرَةِ النَّيِّرَةِ. فَإِنْ صَلَّى غَيْرُ الْوَلِيِّ أَوْ السُّلْطَانِ أَعَادَ الْوَلِيُّ إنْ شَاءَ، كَذَا فِي الْهِدَايَةِ"". ( كتاب الصلاة، الباب الحادي و العشرون في الجنائز، الْفَصْلُ الْخَامِسُ فِي الصَّلَاةِ عَلَى الْمَيِّتِ، ١/ ١٦٣ - ١٦٤) </span></p><p style=""text-align:justify;""><span class=""ar_writing"">مراقي الغلاح مع حاشية الطحطاوي</span>میں ہے:</p><p style=""text-align:justify;""><span class=""ar_writing"">""فإن صلى غيره"" أي غير من له حق التقدم بلا إذن ولم يقتد به ""أعادها"" هو ""إن شاء"" لعدم سقوط حقه وإن تأدى الفرض بها ""ولا"" يعيد ""معه"" أي مع من له حق التقدم ""من صلى مع غيره"" لأن التنفل بها غير مشروع  قوله: ""فإن صلى غيره الخ"" شمل ما إذا صلى عليه ولى القرابة وأراد السلطان أن يصلي عليه فله ذلك لأنه مقدم عليه كما في الجوهرة يعني إذا كان حاضرا وقت الصلاة ولم يصل مع الولي ولم يأذن لاتفاق كلمتهم على أنه لا حق للسلطان عند عدم حضوره نهر قوله: ""بلا إذن ولم يقتد به"" أما إذا أذن له أو لم يأذن ولكن صلى خلفه فليس له أن يعيد لأنه سقط حقه بالأذن أو بالصلاة مرة وهي لا تتكرر ولو صلى عليه الولي وللميت أولياء آخرون بمنزلته ليس لهم أن يعيدوا لأن ولاية الذي صلى متكاملة"". ( حاشية الطحطاوي علي المراقي ،كتاب الصلاة، باب أحكام الجنائز، فصل بعد فصل، ص: ٥٩١)</span></p><p style=""text-align:justify;"">تنویر الابصار مع الدر المختار میں ہے:</p><p style=""text-align:justify;""><span class=""ar_writing"">""(فَإِنْ صَلَّى غَيْرُهُ) أَيْ الْوَلِيِّ (مِمَّنْ لَيْسَ لَهُ حَقُّ التَّقْدِيمِ) عَلَى الْوَلِيِّ (وَلَمْ يُتَابِعْهُ) الْوَلِيُّ (أَعَادَ الْوَلِيُّ) وَلَوْ عَلَى قَبْرِهِ قُلْنَا: لَيْسَ لِمَنْ صَلَّى عَلَيْهَا أَنْ يُعِيدَ مَعَ الْوَلِيِّ لِأَنَّ تَكْرَارَهَا غَيْرُ مَشْرُوعٍ (وَإِلَّا) أَيْ وَإِنْ صَلَّى مَنْ لَهُ حَقُّ التَّقَدُّمِ كَقَاضٍ أَوْ نَائِبِهِ أَوْ إمَامِ الْحَيِّ أَوْ مَنْ لَيْسَ لَهُ حَقُّ التَّقَدُّمِ وَتَابَعَهُ الْوَلِيُّ (لَا) يُعِيدُ لِأَنَّهُمْ أَوْلَى بِالصَّلَاةِ مِنْهُ. (وَإِنْ صَلَّى هُوَ) أَيْ الْوَلِيُّ (بِحَقٍّ) بِأَنْ لَمْ يَحْضُرْ مَنْ يُقَدَّمُ عَلَيْهِ (لَا يُصَلِّي غَيْرُهُ بَعْدَهُ) وَإِنْ حَضَرَ مَنْ لَهُ التَّقَدُّمُ لِكَوْنِهَا بِحَقٍّ"". (شامي، كتاب الصلاة، باب صلاة الجنازة، مطلب تعظيم اولي الامر واجب، ٢/ ٢٢٢ - ٢٢٣) </span>فقط واللہ اعلم</p></p>",144008201976,banuri,"('جنائز', 'janaiz')","('نماز جنازہ', 'namaz-e-jinazah')","('جنازہ اور نماز جنازہ کے احکام (فرائض، سنن، مستحبات، مکروہات)', 'janaza-or-namaz-e-janaza')"
25-04-2019,https://www.banuri.edu.pk/readquestion/کیا-شیعہ-سے-سنی-خاتون-کا-نکاح-ہو-سکتا-ہے/25-04-2019,کیا شیعہ سے سنی خاتون کا نکاح ہو سکتا ہے؟,میرا نام سیما ہے، اور مجھے طلاق ہوئے 14 سال ہوچکے ہیں، میرا ایک 13 سال کا بیٹا بھی ہے، میں اپنے والد کے پاس رہتی ہوں، میرے کئی رشتہ آئے مگر کسی کو میرے بیٹے سے مسئلہ رہا تو کسی کو مجھ میں کمی دکھی، جس کی وجہ سے بات شادی تک نہ پہنچ سکی، میں نوکری کرتی ہوں، وہاں ایک صاحب ہیں، جن کی اپنی بیوی سے علیحدگی ہو چکی ہے ان کے دو بچے ہیں، وہ مجھ سے شادی کرنا چاہتے ہیں، مگر ان کی والدہ اس رشتہ پر راضی نہیں ہیں، جس کی وجہ سے وہ کہتے ہیں کہ ہم خفیہ نکاح کر لیتے ہیں بعد میں بتا دیں گے، اور وہ صاحب مذہب کے اعتبار سے شیعہ ہیں، لیکن ختم نبوت پر ایمان رکھتے ہیں، بضد ہیں نکاح کرنے کے لیے، از راہِ کرم بتائیے کہ کیا میں ان سے نکاح کرسکتی ہوں؟,"<p><p style=""text-align:justify;"">شیعہ اثنا عشریہ سے سنی خاتون یا مرد کا نکاح جائز نہیں ہے، لہذا اگر مذکورہ شخص کا تعلق اسی فرقے سے ہے تو اس سے نکاح نہ کریں۔ (فتاوی شامی، کتاب النکاح، فصل فی الحرمات، ٣ / ٤٦، ط: سعید)  فقط واللہ اعلم</p></p>",144008200450,banuri,"('نکاح', 'nikah')","('نکاح فاسد و باطل', 'nikah-e-fasid-o-batil')","('دوسرے کی بیوی سے نکاح', 'nikah-sahih-o-fasid')"
06-06-2019,https://www.banuri.edu.pk/readquestion/کیا-بغیر-وضو-کے-قرآن-مجید-کی-تلاوت-بذریعہ-موبائل-کر-سکتے-ہیں-لیٹ-کر-موبائل-سے-قرآن-مجید-پڑھنے-کا-کیا-حکم-ہے/06-06-2019,کیا بغیر وضو کے قرآن مجید کی تلاوت بذریعہ موبائل کر سکتے ہیں؟ / لیٹ کر موبائل سے قرآن مجید پڑھنے کا کیا حکم ہے؟,کیا بغیر وضو کے موبائل میں قرآن مجید پڑھنا جائز ہے؟موبائل میں دیکھ کر لیٹ کر قرآن مجید پڑھنا کیسا ہے؟,"<p><p style=""text-align:justify;"">1۔ جب موبائل میں قرآنک ایپلیکیشن ڈسپلے ہو تو اس وقت بغیر وضو کے اسکرین چھونے کی اجازت نہیں ہے، البتہ اسکرین کے علاوہ موبائل کے دیگر حصوں کو بلاوضو چھوسکتے ہیں؛ لہذا اسکرین کو ہاتھ لگائے بغیر بغیر وضو کے تلاوت کرنا جائز ہے۔</p><p style=""text-align:justify;"">2۔ قرآنِ مجید کی تلاوت کے آداب میں سے ہے کہ با وضو ہو کر پاک جگہ پر بیٹھ کر تلاوت کی جائے، لیٹ کر تلاوت کرنا (اگر لباس اور ستر کا اہتمام کیا جائے تو) جائز ہے، البتہ بغیر کسی مجبوری کے لیٹ کر تلاوت کرنا خلافِ ادب ہے؛ لہذا سائل کو چاہیے کہ خوب اہتمام کے ساتھ تلاوتِ کلامِ مجید کی عادت بنائے ۔ فتاویٰ ہندیہ میں ہے:</p><p style=""text-align:justify;""><span class=""ar_writing"">’’لابأس بقراء القرآن إذا وضع جنبه علی الأرض، ولکن ینبغي أن یضم رجلیه عند القراءة، کذا في المحیط. لا بأس بالقراء ة مضطجعاً إذا أخرج رأسه من اللحاف؛ لأنه یکون کاللبس، وإلا فلا، کذا في القنیة‘‘. (الفتاوی الهندیة، کتاب الکراهية، الباب الرابع في الصلاة والتسبیح وقراءة القرآن والذکر...، (5/ 316) ط: رشیدیة)</span></p><p style=""text-align:justify;""><span class=""ar_writing"">{الَّذِينَ يَذْكُرُونَ اللَّهَ قِيَامًا وَقُعُودًا وَعَلَى جُنُوبِهِمْ} ذكر تعالى ثلاث هيئات لايخلو ابن آدم منها في غالب أمره، فكأنها تحصر زمانه. ومن هذا المعنى قول عائشة رضي الله عنها : كان رسول الله صلى الله عليه وسلم يذكر الله على كل أحيانه. أخرجه مسلم . (الجامع لأحکام القرآن، للقرطبي)</span>فقط واللہ اعلم</p></p>",144008201967,banuri,"('علوم و فنون', 'uloom-funoon')","('متعلقات قرآن کریم', 'quran-kareem')","('تجوید اور ترتیب قرآنی', 'tajweed-aur-tarteeb-e-quraani')"
