issued_at,link,title,question,answer,fatwa_number,dar_ul_ifta,kitab,bab,fasal
17-04-2019,https://www.banuri.edu.pk/readquestion/تحریری-طور-پر-ایک-طلاق-اور-اس-کی-عدت-کا-حکم/17-04-2019,تحریری طور پر ایک طلاق اور اس کی عدت کا حکم,میرے شوہر نے مجھے ۱۴ جنوری کو تحریری طور پر اسٹیمپ پیپر پر ایک طلاق بھیجی۔ میں اپنے تین بچوں کے ساتھ اپنی والدہ کے گھر رہتی ہوں۔ ہمارے درمیان گزشتہ ۷ ماہ سے بات چیت اورکسی قسم کا کوئی  ازدواجی تعلق نہیں، اب ہم دونوں کا مزید  رشتے کو نبھانے کا کوئی ارادہ نہیں۔ معلوم یہ کرنا ہے کہ ۱۴ جنوری ۲۰۱۹سے اب تک ہم نے رجوع نہیں کیا اور نہ ہی کرنے کا ارادہ ہے، اس دوران میں دو ماہ واری سے فارغ بھی ہوچکی ہوں۔ ایسے میں کیا میری دو طلاقیں ہو چکی ہیں؟ میری عدت کب سے کب تک ہوگی؟ نیز یہ کہ میں نے عدالت میں خلع کے لیے کیس دائر کیا ہوا ہے، وہاں جج کے سامنے شوہر نے خلع دینے پر رضامندی ظاہر کردی ہے۔ میں اپنا جہیز بھی واپس لا چکی ہوں، عدالت سے ۲۰ اپریل تک خلع کاآرڈر بھی آجائے  گا۔ اس صورت میں خلع کی کیا صورت حال ہوگی؟,"<p><p style=""text-align:justify;""> اگر شوہر نے تحریری طور پر ایک طلاق لکھ کر بھیجی ہے تو یہ ایک ہی طلاق شمار ہوگی، ہرماہ دوسری طلاق واقع نہیں ہوگی۔ مذکورہ صورت میں عدت تین ماہ واریاں ہے؛ لہذا شوہر کے طلاق دینے کے بعد دو ماہ واریاں گزری ہیں تو ابھی عدت باقی ہے، ایک ماہ واری اور گزارنی ہوگی، مزید ایک ماہ واری گزرجائے اور اس دوران رجوع نہیں کیا گیا تو نکاح ختم ہوجائے گا۔ اس کے بعد سائلہ اپنی مرضی سے دوسری جگہ نکاح کرنے میں آزاد ہوگی، اور باہمی رضامندی سے شوہر سے نئے مہر کے ساتھ نکاحِ جدید کی بھی اجازت ہوگی، البتہ اس صورت میں شوہر کو صرف دو طلاق کا اختیار ہوگا۔ </p><p style=""text-align:justify;"">اگر عدالت نے اسی عدت کی مدت میں شوہر کی رضامندی سے خلع کرادی تو یہ مجموعی اعتبار سے دو طلاقِ بائن ہوجائیں گی، پھر رجوع کا حق نہیں رہے گا۔ اور اگر عدالت نے عدت کی مدت ختم ہونے کے بعدخلع کرائی تو اس سے مزید کوئی طلاق واقع نہیں ہوگی۔ اور جدائی کے لیے خلع کی ضرورت بھی نہیں رہے گی۔ فقط واللہ اعلم</p></p>",144008200260,banuri,"('طلاق', 'talaaq')","('وقوع طلاق وعدم وقوع طلاق', 'wuqoo-e-talaq-o-adme-wuqoo-e-talaq')","('طلاق - وقوع اور عدم وقوع', 'talaq-wuqo-or-adm-e-wuqo')"
30-05-2019,https://www.banuri.edu.pk/readquestion/زیر-ناف-بال-کاٹنے-کی-حد-کا-بیان-اور-اس-حد-سے-زیادہ-بال-کاٹنے-کا-حکم/30-05-2019,زیر ناف بال کاٹنے کی حد کا بیان اور اس حد سے زیادہ بال کاٹنے کا حکم,زیرِ ناف بالوں کو صاف کرنے کی شرعی حد کیا ہے؟  اور کیا اس حدِ زائد بھی صاف کر سکتے ہیں؟  آسان لفظوں میں اور تفصیل سے سمجھا دیں!,"<p><p style=""margin-left:0;margin-right:0;text-align:justify;""><span style=""background-color:#fff;"">مثانہ سے نیچے  پیڑوں  کی ہڈی  سے لے کررانوں کی جڑوں تک</span><span style=""background-color:#fff;"">اور پیشاب پاخانہ کی جگہ کے اِردگرد زیرِناف بال مونڈنے چاہییں، رانوں اور سرین کے بالوں پر جہاں نجاست لگنے کا زیادہ امکان رہتاہے وہاں تک بال کاٹیں، اس کے علاوہ رانوں کے بال کاٹنے کی ضرورت نہیں۔ </span> مرد کے لیے اس حد سے زائد ٹانگوں (یعنی پنڈلیوں اور گھٹنے سے اوپر حصے) کے بال کاٹنا جائز تو ہے، البتہ بہتر یہ ہے کہ بلا ضرورت نہ کاٹے۔ فتاویٰ ہندیہ کی درج ذیل عبارت کو مدنظر رکھ کر بعض جید مفتیانِ کرام کی رائے یہ ہے کہ زیرِ ناف بال ناف کے متصل نیچے سے ہی صاف کرلینے چاہییں۔ </p><p style=""margin-left:0;margin-right:0;text-align:justify;""><span class=""ar_writing""><span style=""color:#323232;"">""ويبتدئ في حلق العانة من تحت السرة، ولو عالج بالنورة في العانة يجوز، كذا في الغرائب"". </span></span><span class=""ar_writing""><span style=""color:#323232;""> (الفتاوی الهندیة، کتاب الکراهیة، الباب التاسع عشر في الختان والخصاء وحلق المرأة شعرها ووصلها شعر غيرها (5/358</span><span style=""color:#323232;"">)</span></span></p><p style=""margin-left:0;margin-right:0;text-align:justify;""><span class=""ar_writing""><span style=""color:#323232;"">""</span><span style=""color:#323232;"">وأما الاستحداد فهو حلق العانة سمي استحداداً؛ لاستعمال الحديدة وهي الموسى، وهو سنة، والمراد به نظافة ذلك الموضع، والأفضل فيه الحلق، ويجوز بالقص والنتف والنورة، والمراد بالعانة: الشعر الذي فوق ذكر الرجل وحواليه وكذاك الشعر الذي حوالي فرج المرأة"". </span></span><span class=""ar_writing""><span style=""color:#323232;"">(شرح النووي علی مسلم، کتاب الطهارة، باب خصال الفطرة (3/148) ط: دار إحياء التراث العربي - بيروت)</span></span></p><p style=""margin-left:0;margin-right:0;text-align:justify;""><span class=""ar_writing""><span style=""color:#323232;"">""والعانة: الشعر القريب من فرج الرجل والمرأة، ومثلها شعر الدبر، بل هو أولى بالإزالة ؛ لئلا يتعلق به شيء من الخارج عند الاستنجاء بالحجر"". </span></span><span class=""ar_writing""><span style=""color:#323232;"">(رد المحتار علی الدر المختار، کتاب الحج، فصل في الإحرام و صفة المفرد (2/481) ط: سعید</span><span style=""color:#323232;"">) </span></span>فقط واللہ اعلم</p></p>",144008201721,banuri,"('حقوق و آدابِ معاشرت', 'huqooq-muashret')","('لباس / وضع قطع', 'libass-waza-qata')","('بالوں کے احکام و آداب', 'baloon-k-ahkam-o-aadab')"
29-05-2019,https://www.banuri.edu.pk/readquestion/کمپیوٹر-سافٹویئر-غیر-قانونی-طور-پر-ہیک-کرنا/29-05-2019,کمپیوٹر سافٹویئر غیر قانونی طور پر ہیک کرنا,انٹرنیٹ پر کچھ کمپیوٹر سافٹ ویئر ایسے ہوتے ہیں جن کو خریدنے کے بعد استعمال کرنا پڑتا ہے (چند دن مفت استعمال کے لیے  دیتے ہیں اس کے بعد وہ کام کرنا چھوڑ دیتے ہیں جب تک کہ ان کی قیمت ادا کر کے خرید نہ لیا جائے) مثلاً انٹرنیٹ ڈاؤن لوڈ منیجر، مائیکرو سافٹ آفس، کچھ لوگ انٹرنیٹ پر ایسے سافٹ ویئر کو ایکٹیویٹ کرنے کے طریقے بتاتے ہیں جس سے وہ سافٹ ویئر بنا ادائیگی کے ایکٹیویٹ ہو جاتا ہے اور بعینہ ویسے کام کرنے لگتا ہے جیسا کہ ادائیگی کے بعد. اکثر بتائے گئے طریقے سے سافٹ ویئر کی اس فائل (جس میں ادائیگی ہوگئی ہے یا نہیں، اگر ہوئی ہے تو اس کی معلومات محفوظ ہوتی ہیں) کو اڑا دیا جاتا ہے یا اس میں جعلی معلومات درج کر کے اس کو مطمئن کر دیا جاتا ہے، پھر وہ فائل سافٹ ویئر کے چلنے میں رکاوٹ نہیں بنتی.  کیوں کہ ادائیگی بیرونی کرنسی میں کرنی ہو تی ہے جو پاکستان کی کرنسی میں نسبتاً مہنگا ہوتا ہے. لہذا لوگ جعلی طریقے سے ایکٹیویٹ کر کے کام چلاتے ہیں۔ کیا ایسا کرنا شرعاً جائز ہے؟,"<p><p style=""text-align:justify;"">صورتِ مسئولہ میں کاپی رائٹ سافٹ ویئر کو بریک کرنا، یا ہیک کرکے استعمال کرنا  قانونا جرم ہے، اور یہ دھوکا دہی کے زمرے میں آتا ہے، جوکہ شرعاً حرام ہے، کمپنی پالیسی کی خلاف ورزی کرنا اور قانوناً جرم کام کو اختیار کرنا شرعاً جائز نہیں، لہذا ایسے اقدام سے اجتناب لازم ہے۔ فقط واللہ اعلم</p></p>",144008201706,banuri,"('حظر و اباحت', 'mamnooaat-mubahat')","('تفریح / کھیل', 'tafreeh-khel')","('ٹی وی / وی سی آر / سینما / انٹرنیٹ/تصویر سازی', 'tv-vcr-cinema-internet-taswer-sazi')"
30-05-2019,https://www.banuri.edu.pk/readquestion/پاکستان-میں-رہنے-والے-شخص-کا-سعودیہ-عرب-کے-ساتھ-رمضان-شروع-کرنا/30-05-2019,پاکستان میں رہنے والے شخص کا سعودیہ عرب کے ساتھ  رمضان شروع کرنا,زید پاکستان میں رہتا ہے اس نے اپنا پہلا روزہ سعودی عرب کے ساتھ رکھا ہے، اور پاکستان کے روزے بھی پورے رکھے، اب پوچھنا یہ ہے سعودیہ عرب والا پہلا روزہ نفلی ہوگا یا ویسے ہی ہوگا؟,"<p><p style=""text-align:justify;"">پاکستان میں رہنے والا شخص جب پاکستان میں ہو تو اس کے لیے پاکستان میں چاند کی رؤیت کے مطابق روزہ رکھنا ضروری ہے، سعودیہ کی رؤیت کے مطابق روزہ رکھنا درست نہیں ہے، لہذا اس شخص کا پہلا روزہ وہی ہوا جو اس نے پاکستان میں چاند نظر آنے کے بعد رکھا ہے، اس سے پہلے جو ایک دن روزہ رکھا ہے اگر اس کو رمضان کا روزہ سمجھ کر رکھا ہو تو یہ عمل مکروہِ تحریمی ہوا، اگر نفل کی نیت سے رکھا اور یہ شخص اہلِ علم میں سے ہے، یا اس شخص کی پورے شعبان کے مہینہ میں روزہ رکھنے کی عادت تھی یا پیر اور جمعرات کے روزہ کا معمول تھا اور تیس شعبان انہی دنوں میں آیا تو اس کے لیے اس دن روزہ رکھنا درست تھا اور یہ نفلی روزہ شمار ہوگا۔</p><p style=""text-align:justify;""><span class=""ar_writing"">الدر المختار وحاشية ابن عابدين (رد المحتار) (2/ 381):<br/>
""(ولايصام يوم الشك) هو يوم الثلاثين من شعبان وإن لم يكن علة أي على القول بعدم اعتبار اختلاف المطالع؛ لجواز تحقق الرؤية في بلدة أخرى، وأما على مقابله فليس بشك ولايصام أصلاً شرح المجمع للعيني عن الزاهدي (إلا نفلاً) ويكره غيره (ولو صامه لواجب آخر كره) تنزيهاً ولو جزم أن يكون عن رمضان كره تحريماً (ويقع عنه في الأصح إن لم تظهر رمضانيته وإلا) بأن ظهرت (فعنه) لو مقيماً (والتنفل فيه أحب) أي أفضل اتفاقاً (إن وافق صوماً يعتاده) أو صام من آخر شعبان ثلاثة فأكثر لا أقل لحديث: «لاتقدموا رمضان بصوم يوم أو يومين». وأما حديث: «من صام يوم الشك فقد عصى أبا القاسم» فلا أصل له، (وإلا يصومه الخواص ويفطرغيرهم بعد الزوال) به يفتى، نفياً لتهمة النهي (وكل من علم كيفية صوم الشك فهو من الخواص وإلا فمن العوام، والنية) المعتبرة هنا (أن ينوي التطوع) على سبيل الجزم (من لايعتاد صوم ذلك اليوم) .</span></p><p style=""text-align:justify;""><span class=""ar_writing"">(قوله: كره تحريماً) للتشبه بأهل الكتاب؛ لأنهم زادوا في صومهم، وعليه حمل حديث النهي عن التقدم بصوم يوم أو يومين بحر (قوله: ويقع عنه) أي عن الواجب وقيل: يكون تطوعاً هداية، (قوله: إن لم تظهر رمضانيته) في السراج: إذا صامه بنية واجب آخر لايسقط؛ لجواز أن يكون من رمضان فلايكون قضاءً بالشك اهـ فأفاد أنه لو لم يظهر الحال لايكفي عما نوى، فكان على المصنف أن يقول كما قال في الهداية: إن ظهر أنه من شعبان أجزأه عما نوى في الأصح وإن ظهر أنه من رمضان يجزيه لوجود أصل النية. اهـ.<br/>
(قوله: فعنه) أي عن رمضان (قوله: لو مقيماً) قيد لقوله: كره تنزيهاً، ولقوله: فعنه، قال في السراج: ولو كان مسافراً فنوى فيه واجباً آخر لم يكره؛ لأن أداء رمضان غير واجب عليه فلم يشبه صومه الزيادة ويقع عما نوى، وإن بان أنه من رمضان، وعندهما يكره كالمقيم ويجزى عن رمضان إن بان أنه منه (قوله: إن وافق صوماً يعتاده) كما لو كان عادته أن يصوم يوم الخميس أو الاثنين فوافق ذلك يوم الشك، سراج. وهل تثبت العادة بمرة كما في الحيض تردد فيه بعض الشافعية"". </span>فقط واللہ اعلم</p></p>",144008201728,banuri,"('روزہ', 'soum')","('روزہ', 'roza')","('روزہ - حقیقت و مصالح', 'roza-haqiqat-o-masaleh')"
01-04-2019,https://www.banuri.edu.pk/readquestion/زکات-کی-رقم-سے-بیت-الخلاء-بنانا/01-04-2019,زکات کی رقم سے بیت الخلا بنانا,کیا واش روم بنوانے کے لیے زکاۃ  کے پیسوں کا استعمال کرنا درست ہے یا نہیں؟,"<p><p style=""text-align:justify;"">کسی رفاہی ادارے یا مدرسے کی تعمیرات یا بیت الخلا  کی تعمیر میں زکاۃ  کی رقم لگانا جائزنہیں ہے۔ زکاۃ کی ادائیگی کے لیے شرعاً ضروری ہے کہ کسی غریب کو مالک بنا کر دی جائے۔ البتہ اگر کوئی غریب شخص زکاۃ  وصول کرکے اپنی ضرورت کے لیے گھر یا  بیت الخلا وغیرہ بنائے یا بغیر کسی دباؤ کے دلی رضامندی سے مسجد یا مدرسے میں عطیہ دے اور اس سے بیت الخلا تعمیر کیا جائے تو یہ جائز ہے۔ فقط واللہ اعلم</p></p>",144007200491,banuri,"('زکات', 'zakat')","('زکوٰۃ / صدقات', 'zakat-sadaqat')","('ادائے زکوٰۃ', 'adaye-zakat')"
27-05-2019,https://www.banuri.edu.pk/readquestion/اٹیچ-باتھ-روم-میں-وضو-و-غسل-کرنے-کا-حکم/27-05-2019,اٹیچڈ باتھ روم میں وضو و غسل کرنے کا حکم,ایسا اٹیچڈ باتھ روم جس میں وضو و غسل کا پانی بیت الخلا  کے پلیٹ کے ہی اندر گرتا ہو وضو و غسل کرنا کیسا ہے؟,"<p><p style=""margin-left:0;margin-right:0;text-align:justify;""><span style=""color:#000;""><span style=""background-color:#fff;""><span style=""color:#000;"">بہتر یہ ہے کہ قضائے حاجت کی جگہ اور وضو وغسل کی جگہ مستقل طور پر جدا جدا ہوں، لیکن چوں کہ موجودہ زمانہ میں جگہ کی تنگی ہوسکتی ہے، لہذا قضائے حاجت کی نشست اور غسل خانہ ایک ہی چار دیواری میں بنانے کی گنجائش ہے، تاہم یک جا بنانے کی صورت میں بھی اولاً کوشش کی جائے کہ دونوں کے درمیان کوئی فاصل/ آڑ  ہو، اگر کسی بھی ذریعہ سے فاصل ممکن نہ ہو تو  کم از کم اتنا اہتمام کیا جائے کہ وضو اور غسل کے پانی کی نکاسی کی لائن  اور بیت الخلا کے پانی کی نکاسی کی لائن جدا جدا ہو، اور دونوں کی جگہ کے درمیان کچھ فاصلہ ہو</span><span style=""color:#000;"">؛  </span></span></span>ناپاک جگہ پر وضو کرنے کو فقہاءِ کرام نے مکروہ لکھا ہے؛ اس لیے کہ وضو کے پانی کو ایک گونہ حرمت حاصل ہے، اسے براہِ راست بیت الخلا کے نجس پانی میں گرانا مناسب نہیں ہے؛  لہٰذا ایسے اٹیچڈ باتھ روم میں وضو کرنا مکروہِ تنزیہی ہوگا جس میں وضو کا پانی ناپاک (پیشاب، پاخانے والی) جگہ پر گرتا ہو۔</p><p style=""text-align:justify;""> </p><p style=""margin-left:0;margin-right:0;text-align:justify;""><span class=""ar_writing"">الدر المختار وحاشية ابن عابدين (رد المحتار) (1/ 133):</span></p><p style=""margin-left:0;margin-right:0;text-align:justify;""><span class=""ar_writing"">""ومن منهياته: التوضؤ بفضل ماء المرأة وفي موضع نجس؛ لأن لماء الوضوء حرمة"".</span></p><p style=""margin-left:0;margin-right:0;text-align:justify;""><span class=""ar_writing"">الدر المختار وحاشية ابن عابدين (رد المحتار) <span style=""color:#000;""><span style=""background-color:#fff;""><span style=""color:#000;"">(1/ 344):</span></span></span></span></p><p style=""margin-left:0;margin-right:0;text-align:justify;""><span class=""ar_writing""><span style=""color:#000;""><span style=""background-color:#fff;""><span style=""color:#000;"">""(وأن يبول قائماً أو مضطجعاً أو مجرداً من ثوبه بلا عذر أو) يبول (في موضع يتوضأ) هو (أو يغتسل فيه)؛ لحديث: «لا يبولن أحدكم في مستحمه فإن عامة الوسواس منه».</span></span></span></span></p><p style=""margin-left:0;margin-right:0;text-align:justify;""><span class=""ar_writing""><span style=""color:#000;""><span style=""background-color:#fff;""><span style=""color:#000;"">و في الرد: ""(قوله: لحديث إلخ) لفظه كما في البرهان عن أبي داود: «لايبولن أحدكم في مستحمه ثم يغتسل أو يتوضأ فيه، فإن عامة الوسواس منه». والمعنى موضعه الذي يغتسل فيه بالحميم، وهو في الأصل الماء الحار، ثم قيل للاغتسال بأي مكان استحمام؛ وإنما نهي عن ذلك إذا لم يكن له مسلك يذهب فيه البول أو كان المكان صلباً فيوهم المغتسل أنه أصابه منه شيء فيحصل به الوسواس، كما في نهاية ابن الأثير. اهـ. مدني"".</span></span></span></span></p><p style=""margin-left:0;margin-right:0;text-align:justify;""><span class=""ar_writing""><span style=""color:#000;""><span style=""background-color:#fff;""><span style=""color:#000;"">حاشية الطحطاوي على مراقي الفلاح شرح نور الإيضاح (ص: 54):</span></span></span></span></p><p style=""margin-left:0;margin-right:0;text-align:justify;""><span class=""ar_writing""><span style=""color:#000;""><span style=""background-color:#fff;""><span style=""color:#000;"">""قوله: "" ويكره في محل التوضؤ"" لقوله صلى الله عليه وسلم: ""لايبولن أحدكم في مستحمه ثم يغتسل فيه أو يتوضأ فإن عامة الوسواس منه"" قال ابن ملك: لأن ذلك الموضع يصير نجساً فيقع في قلبه وسوسة بأنه هل أصابه منه رشاش أم لا اهـ حتى لو كان بحيث لايعود منه رشاش أو كان فيه منفذ بحيث لايثبت فيه شيء من البول لم يكره البول فيه؛ إذ لايجره إلى الوسوسة حينئذٍ؛ لأمنه من عود الرشاش إليه في الأول؛ ولطهر أرضه في الثاني بأدنى ماء طهور يمر عليها، كذا في شرح المشكاة"". </span></span></span></span> فقط واللہ اعلم</p></p>",144008201596,banuri,"('طہارت', 'taharat')","('وضو', 'wuzu')","('وضو،فرائض،سنن،آداب اور وضو توڑنے والی اشیاء', 'wuzo-faraidh-sunan-aadab-or-wuzo-tornay-wali-ashya')"
30-05-2019,https://www.banuri.edu.pk/readquestion/کیا-ہم-لوک-کھانا-جائز-ہے/30-05-2019,کیا ہم لوک کھانا جائز ہے؟,ہم لوک  پھل کھانا جائز ہے کہ نہیں؟ مجھ سے کسی نے کہا تھا کہ جو پھل یا سبزی جو حضور ﷺ کے زمانے میں نہیں یا دو تین یا زیادہ تجربات کر کے انسانوں نے ایجاد کی ہے،  جو اپنے اصل سے الگ ہو جیسے چائنیز لوگ تجربات کر کے سبزیاں پھل بنا رہے ہیں وہ نہیں کھانے چاہییں؛  کیوں کہ ان کو اللہ نے اس طرح نہیں بنایا تھا۔اور جو موسم کا پھل یا سبزی نہیں وہ بھی نہیں کھانا چاہیے؛ کیوں کہ اس کو بھی انسان نے تجربات کرکے بنا موسم کے ایجاد کیا ہے، وہ بھی حرام ہے؟ برائے مہربانی مسئلے کا حل بتائیں!,"<p><p style=""text-align:justify;"">سبزی اور پھل کی تمام اقسام میں اصل حلال ہونا  ہے، رہی بات یہ کہ کوئی پھل کئی پھلوں کے بیج ملانے کے تجربہ کی بنا پر وجود میں آئے تو اس کے بارے میں یہ کہنا کہ یہ اللہ نے نہیں بنایا، غلط فلسفہ ہے، اس لیے کہ انسان کا تجربہ اس وقت کامیاب ہوتا ہے جب اللہ وجود بخش دے۔ رسول اللہ ﷺ کے زمانے میں بھی کھجور کے درختوں میں پیوند کاری کا ثبوت صحیح احادیث میں موجود ہے، کھجور کی سینکڑوں اقسام اسی طرح مختلف درختوں کو ملانے سے ہی وجود میں آئی ہیں، اس لیے پیوند کاری یا مختلف بیج ملانے سے جو نیا پھل یا سبزی وجود میں آئے اسے حرام کہنے کی کوئی وجہ نہیں ہے۔  خلاصہ یہ کہ رسولِ اکرم صلی اللہ علیہ وسلم کے زمانے میں جو پھل یا سبزیاں موجود نہیں تھیں، ان کو حرام سمجھنا  یا نہ کھانا بے اصل بات ہے،  جیسے حرام کو حلال سمجھنا گناہ ہے اور خطرے کی بات ہے، اسی طرح حلال کو بغیر قطعی دلیل کے حرام کہنا بھی گناہ اور خطرے کی بات ہے۔</p><p style=""text-align:justify;"">اسی طرح بے موسم کے پھل و سبزیاں بھی کھانا جائز ہے۔</p><p style=""text-align:justify;"">ہاں! اگر نو ایجاد یا بے موسم پھل، سبزی  یا نبات صحت کے لیے مضر ہو تو اس سے پرہیز کا حکم شریعت میں طبی اصول کی بنیاد پر ہوگا، نہ کہ نفسِ اس نبات کی حرمت کے اعتبار سے۔</p><p style=""text-align:justify;"">یہ بھی ملحوظ رہے کہ حضور ﷺ کے زمانے میں حجازِ مقدس میں تمام پھل، سبزیاں اور نباتات موجود نہیں تھے، اس لیے جس پھل یا سبزی وغیرہ کا ذکر کتبِ حدیث یا تاریخ میں نہ ملے تو اس کے بارے میں یہ بھی نہیں کہا جاسکتا کہ یہ حضور ﷺ کے زمانے میں موجود نہیں تھا، ممکن ہے کہ وہ دنیا کے کسی خطے میں موجود ہو اور ہم تک اس کا ذکر نہ پہنچا ہو۔ فقط واللہ اعلم</p></p>",144008201755,banuri,"('حظر و اباحت', 'mamnooaat-mubahat')","('ماکولات / مشروبات', 'makoolat-mashroobat')","('کھانے پینے کی حلال و حرام ، مکروہ و مباح اشیاء', 'khanay-penay-ki-halal-o-haram-makroh-o-mubah-ashya')"
