issued_at,link,title,question,answer,fatwa_number,dar_ul_ifta,kitab,bab,fasal
14-04-2019,https://www.banuri.edu.pk/readquestion/حاملہ-بیوی-کو-یہ-کہنے-اگر-تم-نے-مجھے-ہمارا-بچہ-ہونے-تک-فون-کیا-تو-تم-میرے-پر-طلاق-سے-طلاق-کا-حکم/14-04-2019,حاملہ بیوی کو یہ کہنے ’’ اگر تم نے مجھے  ہمارا بچہ ہونے تک فون کیا تو تم میرے پر طلاق‘‘ سے طلاق کا حکم,میں سعودی عرب میں رہتاہوں،  مجھ سے غصے میں بیوی کو یہ نکل گیا کہ اگر تم نے مجھے  ہمارا بچہ ہونے تک فون کیا تو تم میرے پر طلاق، ابھی میری بیوی ساتویں مہینے کی حاملہ ہے. ابھی مجھے ڈر ہوتا ہے، اسے عادت ہے مجھے فون کرنے کی واٹس ایپ یا میسنجر پر. اگر اس سے غلطی سے کال مل گئی واٹس ایپ یا میسنجر پر ، مگر میں اس کو  نہ اٹھاؤں، اور وہ مس کال ہوجائے،  اس صورت میں طلاق واقع ہوسکتی ہے؟,"<p><p style=""margin-left:0;margin-right:0;text-align:justify;"">صورتِ مسئولہ میں اگر آپ کی بیوی نے بچہ پیدا ہونے سے پہلے آپ کو فون کیا تو اس پر ایک طلاق رجعی واقع ہوجائے گی، چاہے آپ نے فون اٹھایا یا نہیں اٹھایا ، اور عدت کے اندر رجوع کرنے کی صورت میں آپ کا نکاح باقی رہے گا، ورنہ عدت گزرنے کے بعد نکاح ختم ہوجائے گا اور بیوی بائنہ ہوجائے گی، پھر دوبارہ ساتھ رہنے کے لیے جانبین کی رضامندی سے نئے مہر کے ساتھ دو گواہوں کی موجودگی میں نکاحِ جدید  کرنا پڑے گا، لیکن آپ کے پاس پھر مزید صرف دو طلاقوں کا اختیار باقی رہ جائے گا۔ فقط واللہ اعلم</p></p>",144008200159,banuri,"('طلاق', 'talaaq')","('وقوع طلاق وعدم وقوع طلاق', 'wuqoo-e-talaq-o-adme-wuqoo-e-talaq')","('طلاق - وقوع اور عدم وقوع', 'talaq-wuqo-or-adm-e-wuqo')"
04-06-2019,https://www.banuri.edu.pk/readquestion/زکوۃ-کی-رقم-گم-ہوجانے-کی-صورت-میں-زکوۃ-کی-ادائیگی-کا-حکم/04-06-2019,زکاۃ کی رقم گم ہوجانے کی صورت میں زکاۃ کی ادائیگی کا حکم,زکاۃ  کی رقم گم ہوجانے کا حکم کیا ہے؟,"<p><p style=""margin-left:0;margin-right:0;text-align:justify;"">اگر آپ کے سوال کا مطلب یہ ہے کہ صاحبِ نصاب شخص نے زکاۃ ادا کرنے کے لیے جو رقم الگ کر کے رکھی ہو   اس رقم کے گم ہونے کی صورت میں اس شخص کے ذمہ سے زکاۃ  کی ادائیگی ساقط ہوجائے گی یا اس کے ذمہ بدستور زکاۃ  کی ادائیگی لازم رہے گی، تو اس  کا حکم یہ ہے کہ زکاۃ  کی ادائیگی کی نیت سے رکھی گئی رقم گم ہوجانے کی صورت میں زکاۃ  کی ادائیگی ذمہ سے ساقط نہیں ہوگی، بلکہ مزید رقم کے ذریعہ زکاۃ ادا کرنا لازم ہوگا۔ </p><p style=""margin-left:0;margin-right:0;text-align:justify;"">اور اگر یہ مطلب ہے کہ کسی صاحبِ نصاب شخص نے دوسرے کو زکاۃ کی ادائیگی کا وکیل بنایا، اور اس کے پاس سے وہ رقم گم ہوگئی، تو اس کا بھی یہی حکم ہے کہ مالک کی زکاۃ ادا نہیں ہوگی، وکیل کو چاہیے کہ مالک کو حقیقی صورتِ حال سے آگاہ کردے؛ تاکہ وہ اپنی زکاۃ ادا کردے۔</p><p style=""margin-left:0;margin-right:0;text-align:justify;""><span class=""ar_writing"">الدر المختار وحاشية ابن عابدين (رد المحتار) (2/ 270):</span></p><p style=""margin-left:0;margin-right:0;text-align:justify;""><span class=""ar_writing"">"" ولايخرج عن العهدة بالعزل بل بالأداء للفقراء.</span></p><p style=""margin-left:0;margin-right:0;text-align:justify;""><span class=""ar_writing""> (قوله: ولايخرج عن العهدة بالعزل) فلو ضاعت لاتسقط عنه الزكاة ولو مات كانت ميراثاً عنه، بخلاف ما إذا ضاعت في يد الساعي؛ لأن يده كيد الفقراء، بحر عن المحيط"".</span>فقط واللہ اعلم</p></p>",144008201913,banuri,"('زکات', 'zakat')","('زکوٰۃ / صدقات', 'zakat-sadaqat')","('ادائے زکوٰۃ', 'adaye-zakat')"
07-06-2019,https://www.banuri.edu.pk/readquestion/ایڈوانس-بیلنس-لینے-کا-حکم/07-06-2019,موبائل سم میں ایڈوانس بیلنس لینے کا حکم,بیلنس ایڈوانس لینا جائز ہے یا نہیں؟,"<p><p style=""text-align:justify;"">موبائل کمپنی اگرزائد رقم خدمت مہیا کرنے کے عوض وصول کرتی ہے (یعنی سروس چارجز کی مد میں زائد رقم لیتی ہے) تو ایڈوانس لینا جائز ہے، بیلنس ختم ہونے کے بعد بعض موبائل کمپنیاں جو مسیج بھیجتی ہیں اس سے معلوم ہوتا ہے کہ کمپنی ایڈوانس کی سہولت دے کر  اس پر جو کچھ رقم کاٹتی ہے وہ سروس چارجز کی مد میں کاٹتی ہے، لہذا ایسی موبائل کمپنیوں سے ایڈوانس بیلنس کی سہولت حاصل کرنا جائز ہے، تاہم اگر کوئی شخص  احتیاط کے درجہ میں اس سے بچتا ہے تو یہ زیادہ بہتر ہےاور اگر کمپنی بطورِ قرض دے کر زائد رقم وصول کرے تو پھر ایڈوانس لون لینا ناجائز ہوگا۔ فقط واللہ اعلم</p></p>",144008201987,banuri,"('معاملات', 'muamlat')","('سود / بینکاری / انشورنس / شیئرز', 'sood-bankari-insurance-shares')","('متفرقات سود', 'mutafarriqat-e-sood')"
28-05-2019,https://www.banuri.edu.pk/readquestion/وضو-کے-بعد-چمڑے-کے-موزے-یا-خشک-زخم-سے-پٹی-اتارنے-کی-صورت-میں-دوبارہ-وضو-کرنا-ضروری-ہے-یا-نہیں/28-05-2019,وضو کے بعد پاؤں کی کھال اتر جائے یا زخم کے اوپر سے کھال اتر جائے تو وضو دوبارہ کرنا ہوگا؟,اگر وضو کرنے کے بعد پاؤں سے چمڑی اتار دیں یا پھر خشک زخم کے اوپر سے چمڑی اتار دیں تو کیا وضو دوبارہ کرنا ہو گا؟,"<p><p style=""margin-left:0;margin-right:0;text-align:justify;"">پاؤں یا جسم کے کسی حصے سے (خون نکلے بغیر) صرف چمڑی (جلد) کا کچھ حصہ کر اتارنے سےوضو نہیں ٹوٹتا ہے، اسی طرح خشک زخم کے اوپر کی چمڑی (جلد) اکھاڑنے سے بھی وضو نہیں ٹوٹتا ہے، اس لیے وضو کے بعد پیر یا خشک زخم سے چمڑی (کھال ) اتارنے کی صورت میں دوبارہ وضو کرنے کی ضرورت نہیں ہے۔  فقط واللہ اعلم</p></p>",144008201631,banuri,"('طہارت', 'taharat')","('تیمم', 'tayammum')","('تیمم/موزوں پر مسح', 'tayammum')"
17-05-2019,https://www.banuri.edu.pk/readquestion/قرآن-مجید-کی-قسم-کھا-کر-توڑدینے-کا-کفارہ/17-05-2019,قرآن مجید کی قسم کھا کر توڑدینے کا کفارہ,"اگر آپ کسی وجہ سے قرآنِ پاک کی قسم لے لیتے ہیں کہ آپ یہ کام نہیں کریں گے, اور اس کے بعد آپ سے وہ کام ہو جاتا ہے تو اس کا حل کیا ہو گا ؟","<p><p style=""text-align:justify;"">مستقبل میں کسی کام کے نہ کرنے پر اگر قرآن کی قسم اٹھائی اور اس کے بعد وہ کام کرلیا تو قسم کا کفارہ دینا لازم ہوگا۔  قسم کا کفارہ یہ ہے کہ دس مسکینوں کو صبح و شام کھانا کھلایا جائے،چاہے تو ہر مسکین کو ایک صدقہ فطر کی مقدار (پونے دو سیر گندم یا اس کی قیمت) بھی دے سکتا ہے یا دس مسکینوں کو ایک ایک جوڑا کپڑا دیا جائے، اور اگر ان میں سے کسی چیز کے ذریعہ بھی کفارہ ادا کرنے کی طاقت نہ ہو تو قسم کے کفارہ کی نیت سے لگاتار تین روزہ رکھے۔</p><p style=""margin-left:9pt;margin-right:10.3pt;text-align:justify;""><strong> النتف للفتاوی میں ہے:</strong></p><p style=""margin-left:9pt;margin-right:10.3pt;text-align:justify;""><span class=""ar_writing"">""قال: وكفارة كل يمين ثلاثة أشياء إلا أن يكون بطلاق أو عتق وهو عتق رقبة أو إطعام عشرة مساكين أو كسوتهم، والمكفر فيها مخير، والكتاب به ناطق، فان عجز عنها فيصوم ثلاثة أيام تباعاً"". (النتف في الفتاوى للسغدي (1 / 383) کتاب الایمان والکفارات، ط: مؤسسة الرسالة،بیروت) </span> فقط واللہ اعلم</p></p>",144008201136,banuri,"('حظر و اباحت', 'mamnooaat-mubahat')","('قسم / منت', 'qasam-mannat')","('قسم و کفارات', 'qasam-o-kaffarat')"
03-06-2019,https://www.banuri.edu.pk/readquestion/کیا-عورت-اپنے-معتکف-جائے-اعتکاف-سے-نکل-سکتی-ہے/03-06-2019,کیا عورت اپنے معتکف ( جائے اعتکاف) سے نکل سکتی ہے؟,عورت کے لیے اعتکاف کے دوران ایک جگہ چھوڑ کر دوسری جگہ میں جانا کیسا ہے؟ اور اگر کوئی عورت چلی گئی تو وہ کیا کرے؟,"<p><p style=""text-align:justify;"">واضح رہے کہ خاتون اگر مسنون اعتکاف بیٹھنا چاہتی ہو تو  اپنے گھر کے اس مقام کو اپنا معتکف ( اعتکاف کی جگہ) قرار دے دے جو نماز و دیگر عبادات کے لیے مخصوص ہو، اگر گھر میں کوئی جگہ نماز کے لیے مخصوص نہ ہو تو گھر کا کوئی کمرہ یا کمرے میں کوئی حصہ پردہ وغیرہ لگا کر مخصوص کردے،  اور اس مقام کی حیثیت اعتکاف کرنے والی خاتون کے حق میں ویسے ہی ہوگی جیسے اعتکاف کرنے والے مردوں کے حق میں مسجد کی ہوتی ہے، پس اس خاتون کے لیے  شرعی یا طبعی ضرورت ( وضو، پیشاب یا پاخانے کے لیے  جانا) کے بغیر اس مقام سے نکلنے کی اجازت نہ ہوگی۔ اگر ان ضروریات کے علاوہ کوئی عورت نکل گئی تو اس کا اعتکاف فاسد ہوجائے گا، اور روزے کی نیت کے ساتھ ایک رات اور دن کا اعتکاف بطورِ قضا کرنا لازم ہوگا۔ فتاوی ہندیہ میں ہے:</p><p style=""text-align:justify;""><span class=""ar_writing"">""وَالْمَرْأَةُ تَعْتَكِفُ فِي مَسْجِدِ بَيْتِهَا إذَا اعْتَكَفَتْ فِي مَسْجِدِ بَيْتِهَا فَتِلْكَ الْبُقْعَةُ فِي حَقِّهَا كَمَسْجِدِ الْجَمَاعَةِ فِي حَقِّ الرَّجُلِ لَاتَخْرُجُ مِنْهُ إلَّا لِحَاجَةِ الْإِنْسَانِ كَذَا فِي شَرْحِ الْمَبْسُوطِ لِلْإِمَامِ السَّرَخْسِيِّ"". (الْبَابُ السَّابِعُ فِي الِاعْتِكَافِ، ١/ ٢١١)</span></p><p style=""text-align:justify;"">فتاوی ہندیہ میں ہے:<span class=""ar_writing""></span></p><p style=""text-align:justify;""><span class=""ar_writing"">""سُئِلَ أَبُو حَنِيفَةَ - رَحِمَهُ اللَّهُ تَعَالَى - عَنْ الْمُعْتَكِفِ إذَا احْتَاجَ إلَى الْفَصْدِ أَوْ الْحِجَامَةِ هَلْ يَخْرُجُ فَقَالَ: لَا"".  (الْبَابُ الْخَامِسُ فِي آدَابِ الْمَسْجِدِ وَالْقِبْلَةِ وَالْمُصْحَفِ وَمَا كُتِبَ فِيهِ شَيْءٌ مِنْ الْقُرْآنِ نَحْوُ الدَّرَاهِمِ وَالْقِرْطَاسِ أَوْ كُتِبَ فِيهِ اسْمُ اللَّهِ تَعَالَى، ٥ / ٣٢٠- ٣٢١)</span></p><p style=""text-align:justify;""><span class=""ar_writing"">مراقي الفلاح</span>میں ہے:</p><p style=""text-align:justify;""><span class=""ar_writing"">""ولا يخرج منه"" أي من معتكفه فيشمل المرأة المعتكفة بمسجد بيتها ""إلا لحاجة شرعية"" كالجمعة والعيدين فيخرج في وقت يمكنه إدراكها مع صلاة سنتها قبلها ثم يعود وإن أتم اعتكافه في الجامع صح وكره ""أو"" حاجة ""طبيعية"" كالبول والغائط وإزالة نجاسة واغتسال من جنابة باحتلام لأنه عليه السلام كان لا يخرج من معتكفه إلا لحاجة الإنسان ""أو"" حاجة ""ضرورية كانهدام المسجد"". (حاشية الطحطاوي علي مراقي الفلاح، باب الاعتكاف، ١/ ٧٠٢)</span></p><p style=""text-align:justify;"">فتاوی ہندیہ میں ہے:</p><p style=""text-align:justify;""><span class=""ar_writing"">""(وَأَمَّا مُفْسِدَاتُهُ) فَمِنْهَا الْخُرُوجُ مِنْ الْمَسْجِدِ فَلَا يَخْرُجُ الْمُعْتَكِفُ مِنْ مُعْتَكَفِهِ لَيْلًا وَنَهَارًا إلَّا بِعُذْرٍ، وَإِنْ خَرَجَ مِنْ غَيْرِ عُذْرٍ سَاعَةً فَسَدَ اعْتِكَافُهُ فِي قَوْلِ أَبِي حَنِيفَةَ - رَحِمَهُ اللَّهُ تَعَالَى - كَذَا فِي الْمُحِيطِ"". ( کتاب الصوم، الْبَابُ السَّابِعُ فِي الِاعْتِكَافِ، ١/ ٢١٢) </span>فقط واللہ اعلم</p></p>",144008201885,banuri,"('روزہ', 'soum')","('روزہ', 'roza')","('اعتکاف', 'aetikaf')"
07-05-2019,https://www.banuri.edu.pk/readquestion/شوگر-کے-مریض-کے-لیے-روزے-کا-حکم-2/07-05-2019,شوگر کے مریض کے لیے روزے کا حکم,مجھے 14 سال کی عمر سے شوگر کی بیماری ہے اور اور شوگر لو ہو جاتی ہیں، انسولین استعمال کرتا ہوں۔ بہت کوشش کی کہ روزہ رکھوں، لیکن درمیان میں کچھ کھانا پڑ جاتا ہے،  پہلے روزے میں میں نے خوب خوب سحری کی، لیکن دن کے درمیان میں شوگر چیک کی تو سنتالیس تھی جو کہ بہت کم ہے؛ لہذا آپ بتائیں میرے لیے کیا حکم ہے؟,"<p><p style=""text-align:justify;"">انسولین لگانے سے روزہ نہیں ٹوٹتا؛ لہذا اگر آپ روزے میں انسولین لگائیں اور شوگر کنٹرول میں رہے تو روزہ رکھیں، لیکن اگر صرف انسولین لگانے سے شوگر کنٹرول نہیں رہتی، بلکہ کچھ کھانا بھی ضروری ہوتا ہے تو آپ کسی ماہر دین دار ڈاکٹر کے مشورے کے بعد روزہ چھوڑ سکتے ہیں، اور اگر ڈاکٹر کی رائے یہی ہے کہ مستقبل میں آپ کی صحت کی بحالی کی توقع نہیں ہے تو اس صورت میں آپ کو ہر ہر روزے کے عوض میں فدیہ ادا کرنا پڑے گا جس کی مقدار صدقہ فطر (پونے دو کلو گندم، یا اس کا آٹا یا اس کی قیمت) کے برابر ہے۔ فقط واللہ اعلم</p></p>",144008200783,banuri,"('روزہ', 'soum')","('روزہ', 'roza')","('روزہ کی قضاء', 'rozay-ki-qaza')"
21-05-2019,https://www.banuri.edu.pk/readquestion/طوطے-پالنا/21-05-2019,طوطے پالنا,طوطا پالنا کیسا ہے؟  بعض لوگوں کا یہ کہنا ہے کہ اگر ان پرندوں کو گھر میں پالتے ہیں تو یہ بد دعا دیتے ہیں تو کیا اس بات کی کوئی حقیقت ہے؟,"<p><p style=""text-align:justify;"">طوطا یا اسی طرح دیگر پرندے پالنا شرعاً جائز ہے بشرطیکہ ان کی بھر پور دیکھ بھال (خوراک وغیرہ اور بیمار ہونے کی صورت میں علاج معالجہ) کا بندوبست کیا جائے، خود پرندوں کو یا ان سے گردوپیش دیگر افراد کو کسی قسم کی اذیت نہ ہو۔ حضرت انس رضی اللہ عنہ کے چھوٹے بھائی سے پرندہ پالنا ثابت ہے، بعد ازاں وہ مرگیا تو وہ افسردہ رہتے تھے، بنا بریں آں حضرت ﷺ ان سے اس حوالے سے دل لگی بھی فرماتے تھے۔فقط واللہ اعلم</p></p>",144008201329,banuri,"('حقوق و آدابِ معاشرت', 'huqooq-muashret')","('حقوق', 'bahmi-huqooq')","('جانوروں کے حقوق', 'janwaron-ky-hoqoq-')"
22-04-2019,https://www.banuri.edu.pk/readquestion/غیر-مسلما-کو-مسلمان-کرنا/22-04-2019,غیر مسلم کو مسلمان کرنا,ہمارے ہاں ایک مسلمان ہے، اس کی کسی وجہ سے یاداشت چلی گئی، اسے اور لوگوں نے گم راہ کر کے غیر مسلم بنادیا، جب اسے بتایاگیا کہ وہ مسلمان تھا اور وہ مسلم بھی ہونا چاہتاہے تو کیا کرنا چاہیے،  ‎کیاوہ پہلے سے مسلم ہے یا کوئی اور حکم ہے؟ علماءِ کرام کیا فرماتے ہیں؟,"<p><p style=""text-align:justify;"">آپ کے سوال کے مطابق مذکورہ شخص پہلے مسلمان تھا، پھر یاد داشت جانے کے بعد اس کو غیر مسلم بنایا گیا، تو اس کو فوراً کلمہ پڑھوایا جائے اور مسلمان کیا جائے، اگر شادی شدہ ہو تو  احتیاطاً اس کے نکاح کی تجدید کروالی جائے۔</p><p style=""text-align:justify;""><span class=""ar_writing"">الدر المختار مع رد المحتار (۱۱۲/۳):</span></p><p style=""text-align:justify;""><span class=""ar_writing"">""ثم ذكر أن قاضيخان أفتى بأنه لايجب بالعقد الثاني شيء ما لم يقصد به الزيادة في المهر ... أقول: بقي ما إذا جدد بمثل المهر الأول ومقتضى ما مر من القول باعتبار تغيير الأول إلى الثاني أنه لايجب بالثاني شيء هنا إذ لا زيادة فيه وعلى القول الثاني يجب المهران.<br/>
(تنبيه) في القنية: جدد للحلال نكاحاً بمهر يلزم إن جدده لأجل الزيادة لا احتياطاً اھ أي لو جدده لأجل الاحتياط لاتلزمه الزيادة بلا نزاع، كما في البزازية"". </span>فقط واللہ اعلم</p></p>",144008200388,banuri,"('متفرق کتب', 'mutafarriq-kutub')","('متفرق ابواب', 'mutafarriq-abwab')","('متفرق فصول', 'mutafarriq-fusool')"
30-04-2019,https://www.banuri.edu.pk/readquestion/بیوہ-دو-بیٹوں-میں-میراث-کی-تقسیم/30-04-2019,بیوہ دو بیٹوں میں میراث کی تقسیم,"ایک شخص فوت ہو جائے اور اس کے دو بیٹے ہیں, اور ایک بیوہ۔  ان میں میراث کس طرح تقسیم کی جائے گی؟  کیا باقی رشتہ دار بھی میراث میں شریک ہیں یا نہیں ؟","<p><p style=""text-align:justify;"">اگرمرحوم کے والدین حیات نہ ہو ں تو مرحوم کے ترکہ کا ساڑھے بارہ فی صد  (12.5)بیوہ کو  ملے گا، اور باقی ترکہ دونوں بیٹوں کے درمیان برابر تقسیم ہوگا۔باقی رشتہ دار وں کاترکہ میں حق نہیں ہے۔ اگر والدین دونوں یا کوئی ایک موجود ہو تو ان کا بھی حصہ ہوگا، اس صورت میں بیٹوں کے حصے میں فرق ہوگا۔ فقط واللہ اعلم </p></p>",144008200579,banuri,"('معاملات', 'muamlat')","('وراثت / وصیت', 'wirasat-wasyat')","('ورثاء اور ان کے حصص', 'wurasa-or-un-k-hisas')"
