issued_at,link,title,question,answer,fatwa_number,dar_ul_ifta,kitab,bab,fasal
04-03-2019,https://www.banuri.edu.pk/readquestion/موبائل-میں-دیکھ-کر-قرآن-مجید-پڑھنا/04-03-2019,موبائل میں دیکھ کر قرآن مجید پڑھنا,کیا بغیر وضو کے موبائل میں دیکھ کر قرآن مجید پڑھنا جائز ہے؟,"<p><p style=""text-align:justify;"">موبائل میں قرآنِ مجید پڑھنا جائز ہے، البتہ قرآنک اپلی کیشن اسکرین پر ڈسپلے ہونے کی صورت میں  اسکرین چھونے کے لیے باوضو ہونا ضروری ہے۔ فقط واللہ اعلم</p></p>",144004201543,banuri,"('طہارت', 'taharat')","('وضو', 'wuzu')","('وضو،فرائض،سنن،آداب اور وضو توڑنے والی اشیاء', 'wuzo-faraidh-sunan-aadab-or-wuzo-tornay-wali-ashya')"
20-02-2019,https://www.banuri.edu.pk/readquestion/ٹیلی-نار-ایزی-پیسہ-اکاؤنٹ-میں-۱۰۰۰-روپے-رکھنے-پر-ملنے-والے-نفع-اور-۱۰۰۰-روپے-نکالنے-پر-ہونے-والی-کٹوتی-کا-حکم/20-02-2019,ٹیلی نار ایزی پیسہ اکاؤنٹ میں ۱۰۰۰ روپے رکھنے پر ملنے والے نفع اور ۱۰۰۰ روپے نکالنے پر ہونے والی کٹوتی کا حکم,ٹیلی نار ایزی پیسہ اکاؤ نٹ میں  ١٠٠٠ روپیہ رکھنے پر ٥٠فری منٹ اور ایم بی دیے جاتے ہیں جب کہ پیسے اکاؤنٹ سے نکالنے پر ١٠٠٠ پر بیس روپے بھی کٹتے ہیں، شرعی حکم کیا ہے؟,"<p><p style=""margin-left:0;margin-right:0;text-align:justify;"">اگر کمپنی کی طرف سے مذکورہ اضافی ۵۰ منٹس یا ۵۰ ایس ایم ایس یا ۵۰ ایم بی یا کوئی بھی دوسرا اضافی نفع   اکاؤنٹ میں لوڈ کروانے یا اکاؤنٹ میں مخصوص رقم ( مثلاً ۱۰۰۰ روپے ) رکھنے کی شرط پر دیے جاتے ہیں تو یہ قرض کی بنیاد پر حاصل ہونے والا مشروط نفع ہونے کی وجہ سے سود میں داخل ہوگا اور اس اضافی نفع ( منٹس وغیرہ ) کا استعمال کرنا جائز نہیں ہوگا۔ اکاؤنٹ سے پیسے نکالنے  کی وجہ سے اگرکمپنی صارف سے سروس چارجز کی مد میں کچھ رقم کاٹے تو یہ جائز ہے۔</p><p style=""margin-left:9pt;margin-right:10.3pt;text-align:justify;""><span class=""ar_writing"">الدر المختار وحاشية ابن عابدين (رد المحتار) (5/ 166):</span></p><p style=""margin-left:9pt;margin-right:10.3pt;text-align:justify;""><span class=""ar_writing"">""وفي الأشباه كل قرض جر نفعاً حرام"". </span><span class=""ar_writing""><span style=""color:#000;"">(قوله: كل قرض جر نفعا حرام) أي إذا كان مشروطاً"".</span></span></p><p style=""margin-left:0;margin-right:0;text-align:justify;""><span style=""color:#e74c3c;""><strong>نوٹ:</strong></span><span style=""color:#323232;"">’’ٹیلی نار‘‘سے قطع نظر  کوئی بھی کمپنی اگر رقم رکھنے کے عوض کوئی مشروط نفع (مثلاً: فری منٹس، انٹرنیٹ ایم بی ، میسج وغیرہ) نہ دیتی ہو تو اس حد تک اس اکاؤنٹ کااستعمال درست ہوگا، اکاؤنٹ سے رقم نکالنے یا دوسری جگہ بھجوانے/ منتقلی کی صورت میں اگر کمپنی صارف سے کچھ رقم (بطورِ سروس چارجز) وصول کرے تو یہ بھی درست ہوگا۔</span></p><p style=""margin-left:0;margin-right:0;text-align:justify;""><span style=""color:#323232;"">لیکن  اگر  کمپنی  اکاؤنٹ ہولڈر کو اس مخصوص رقم جمع کرانے کی شرط پر  یومیہ فری منٹس اور میسیجز وغیرہ کی سہولت فراہم کرتی ہے تو چوں کہ ایزی پیسہ اکاؤنٹ میں رقم رکھوانا درحقیقت  قرض ہے، اور  قرض دینا تو فی نفسہ جائز ہے، لیکن کمپنی اس پر جو  مشروط منافع دیتی  ہے، یہ  شرعاً ناجائز ہے؛ اس لیے کہ قرض پر شرط لگا کر نفع  کے لین دین  کو نبی کریم ﷺ نے سود قرار دیا ہے۔ (مصنف بن أبی شیبہ، رقم:</span><span style=""color:#323232;"">۲۰۶۹۰) </span><span style=""color:#323232;"">اور   چوں کہ اس صورت میں  مذکورہ اکاؤنٹ کھلوانا ناجائز معاملے کےساتھ مشروط ہے ؛ اس لیے یہ اکاؤنٹ کھلوانا یا کھولنا جائز نہیں ہوگا۔</span></p><p style=""margin-left:0;margin-right:0;text-align:justify;""><span style=""color:#323232;"">واضح رہے کہ عموماً ’’ایزی پیسہ اکاؤنٹ‘‘ دوسری صورت کا ہوتاہے؛ لہٰذا ایسا اکاؤنٹ کھلوانا  جائز نہیں  ہوگا، البتہ اگر کمپنی پہلی صورت کے مطابق ’’ایزی پیسہ اکاؤنٹ‘‘ کی سہولت دے تو ایسا اکاؤنٹ کھولنے اور اس کے استعمال کی اجازت ہوگی۔ فقط واللہ اعلم</span></p></p>",144004201345,banuri,"('معاملات', 'muamlat')","('سود / بینکاری / انشورنس / شیئرز', 'sood-bankari-insurance-shares')","('متفرقات سود', 'mutafarriqat-e-sood')"
09-03-2019,https://www.banuri.edu.pk/readquestion/عقیقہ-کب-کرنا-سنت-ہے/09-03-2019,عقیقہ کب کرنا سنت ہے؟,عقیقہ کب کرنا سنت ہے؟  اگر تاخیر سے کیا جائے تو سنت ادا ہو جائے گی یا نفل ہو گا؟,"<p><p style=""text-align:justify;"">بچے کی پیدائش پر شکرانہ کے طور پر جو قربانی کی جاتی ہے اسے ’’عقیقہ‘‘ کہتے ہیں،عقیقہ کرنا سنت نہیں، بلکہ مستحب ہے، عقیقہ کا مستحب وقت یہ ہے کہ پیدائش کے ساتویں دن عقیقہ کرے، اگر ساتویں دن عقیقہ نہ کرسکے تو چودھویں (14)  دن ، ورنہ اکیسویں (۲۱) دن کرے،  اس کے بعد عقیقہ کرنا مباح ہے،اگر کرلے تو ادا ہوجاتا ہے،  تاہم جب بھی عقیقہ کرے بہتر یہ ہے کہ پیدائش کے دن  کے حساب سے ساتویں دن کرے۔</p><p style=""text-align:justify;""><strong>المستدرک  میں ہے: </strong></p><p style=""text-align:justify;""><span class=""ar_writing"">’’عن عطاء، عن أم كرز، وأبي كرز، قالا: نذرت امرأة من آل عبد الرحمن بن أبي بكر إن ولدت امرأة عبد الرحمن نحرنا جزوراً، فقالت عائشة رضي الله عنها: «لا بل السنة أفضل عن الغلام شاتان مكافئتان، وعن الجارية شاة تقطع جدولاً، ولايكسر لها عظم فيأكل ويطعم ويتصدق، وليكن ذاك يوم السابع، فإن لم يكن ففي أربعة عشر، فإن لم يكن ففي إحدى وعشرين». هذا حديث صحيح الإسناد ولم يخرجاه"".  ( المستدرک علی الصحیحین للحاکم(4/ 266) رقم الحدیث: 7595،  کتاب الذبائح، ط: دار الكتب العلمية – بيروت)</span></p><p style=""text-align:justify;""><strong>اعلاء السنن میں ہے:</strong></p><p style=""text-align:justify;""><span class=""ar_writing"">’’ أنها إن لم تذبح في السابع ذبحت في الرابع عشر، وإلا ففي الحادي والعشرین، ثم هکذا في الأسابیع‘‘.</span> (17/117، باب العقیقہ، ط: ادارۃ القرآن والعلوم الاسلامیہ) فقط واللہ اعلم</p></p>",144007200009,banuri,"('عبادات', 'ebadat')","('ذبیحہ / قربانی', 'zabiha-qurbani')","('عقیقہ اور اس کے احکام', 'aqiqa-or-us-k-ahkam')"
04-03-2019,https://www.banuri.edu.pk/readquestion/محرم-کی-عدم-موجودگی-میں-عورت-کا-بھتیجی-کے-شوہر-کے-ساتھ-حج-پر-جانے-کا-حکم/04-03-2019,محرم کی عدم موجودگی میں عورت کا بھتیجی کے شوہر کے ساتھ حج پر جانے کا حکم,کیا ایک خاتون محرم کی عدم دست یابی کی صورت میں اپنی بھتیجی کے شوہر کے ساتھ حج پر جا سکتی ہے؟,"<p><p style=""margin-left:0;margin-right:0;text-align:justify;"">عورت کے لیے محرم کے بغیر سفرِ شرعی کے لیے گھر سے نکلنا جائز نہیں ہے، چاہے سفر حج کا ہو  یا کوئی دوسرا سفر ہو، اور چاہے عورت جوان ہو یا بوڑھی ہو، لہٰذا کسی بھی عورت کا محرم کے بغیر حج کا سفر کرنا جائز نہیں ہے، محرم کے بغیر حج کے سفر پر جانے سے عورت سخت گناہ گار ہوگی، عورت پر حج کی ادائیگی لازم ہونے کے لیے اس کے صاحبِ استطاعت ہونے کے ساتھ ساتھ، محرم مرد یاشوہر کا ہونا بھی شرط ہے، اگرکسی  عورت کے پاس اتنا مال ہے جس سے صرف وہ خود  حج کرسکے (اور اس کے محرم پر حج فرض نہیں ہے) تو اس عورت پر حج کی ادائیگی فرض نہیں، جب تک کہ ساتھ جانے والے محرم کا خرچ بھی پاس نہ ہو،اسی طرح اگر کسی عورت کا  نہ تو شوہر موجود ہو اور نہ ہی کوئی محرم موجود ہو اس پر بھی حج کی ادائیگی لازم نہیں ہوگی۔</p><p style=""margin-left:0;margin-right:0;text-align:justify;"">حضرت عبد اللہ بن عباس رضی اللہ تعالیٰ عنہ فرماتے ہیں کہ  انہوں نے آپ ﷺ  کو یہ ارشاد فرماتے ہوئے سنا :  کوئی عورت کسی مرد سے تنہائی میں نہ ملے اور نہ کوئی عورت  بغیر محرم کے سفر کرے۔ تو حاضرین میں سے ایک آدمی کھڑا ہوا اور اس نے کہا : اے اللہ کے رسول!  میں نے فلاں جہاد کے سفر میں جانے کے لیے اپنا نام لکھوایا ہے، جب کہ میری بیوی حج کرنے جارہی ہے، تو آپ ﷺ نے فرمایا : جاؤ اپنی بیوی کے ساتھ حج کرو۔</p><p><span class=""ar_writing"">"" عن ابن عباس رضي الله عنهما، أنه: سمع النبي صلى الله عليه وسلم، يقول: «لا يخلونّ رجل بامرأة، ولا تسافرنّ امرأة إلا ومعها محرم»، فقام رجل فقال: يا رسول الله، اكتتبتُ في غزوة كذا وكذا، وخرجت امرأتي حاجةً، قال: «اذهب فحجّ مع امرأتك»"". (صحيح البخاري (4/ 59)</span><br/>
مذکورہ روایت میں غور کریں تو معلوم ہوتا ہے کس قدر تاکید سے  عورت کے لیے محرم کے بغیر سفر کرنے کی ممانعت آئی ہے کہ شوہر کو  رسول اللہ ﷺ کے زمانے میں جہاد جیسے مقدس فریضہ  کے بجائے اس کی بیوی کے ساتھ حج کرنے کو کہا جارہا ہے۔</p><p style=""margin-left:0;margin-right:0;text-align:right;"">لہٰذا صورتِ مسئولہ میں مذکورہ عورت کا بھتیجی کے شوہر کے ساتھ حج پر جانا جائز نہیں ہے، کیوں کہ بھتیجی کا شوہر محرم نہیں ہوتا،  چنانچہ  جب تک محرم کا انتظام نہ ہو اللہ پاک سے اس خواہش کی تکمیل کے اسباب کے لیے دعامانگی جائے،  اگر خدانخواستہ ساری زندگی کوئی صورت نہ بن سکی تو حجِ  بدل کی وصیت ضروری ہوگی۔</p><p style=""margin-left:0;margin-right:0;text-align:right;""><span class=""ar_writing"">الدر المختار وحاشية ابن عابدين (رد المحتار) (2/ 458):</span></p><p style=""margin-left:0;margin-right:0;text-align:right;""><span class=""ar_writing"">""والنوع الثاني: شروط الأداء وهي التي إن وجدت بتمامها مع شروط الوجوب، وجب أداؤه بنفسه، وإن فقد بعضها مع تحقق شروط الوجوب، فلا يجب الأداء بل عليه الإحجاج أو الإيصاء عند الموت وهي خمسة: سلامة البدن، وأمن الطريق وعدم الحبس، والمحرم أو الزوج للمرأة وعدم العدة لها"". </span> فقط واللہ اعلم</p></p>",144004201538,banuri,"('حج', 'haj')","('حج / عمرہ', 'hajj-umrah')","('عورت کے لیے حج کی خاص شرائط', 'aurat-kay-liye-haj-ki-khas-sharaait')"
24-02-2019,https://www.banuri.edu.pk/readquestion/قبلہ-اول-کی-طرف-پاؤں-کرکے-سونا/24-02-2019,قبلہ اول کی طرف پاؤں کرکے سونا,قبلہ اول کی طرف پیر کر کے سونے کے بارے میں کیا حکم ہے؟,"<p><p style=""text-align:justify;"">بیت المقدس پہلے قبلہ تھا، بعد میں وہ منسوخ ہوگیا ہے، لہذا  بے ادبی کے قصد کے بغیر اس کی طرف پاؤں کرکے سونا جائز ہے۔ فقط واللہ اعلم</p></p>",144004201408,banuri,"('حقوق و آدابِ معاشرت', 'huqooq-muashret')","('آدابِ معاشرت', 'akhlaq-aadab')","('اٹھنے، بیٹھنے، سونے، چلنے پھرنے کے آداب', 'uthnay-bethnay-chalnay-phirnay-k-aadab')"
28-02-2019,https://www.banuri.edu.pk/readquestion/چالیس-سال-سے-کم-عمر-والا-شخص-بالوں-کو-ڈارک-براو-ن-کلر-کرنا/28-02-2019,چالیس سال سے کم عمر والا شخص بالوں کو ڈارک براوُن کلر کرنا,کیا چالیس سال سے کم عمر والا شخص بالوں کو ڈارک براوُن (Dark Brown) کلر کر سکتا ہے ؟,"<p><p style=""text-align:justify;"">کرسکتا ہے۔</p><p style=""text-align:justify;""><span class=""ar_writing"">سنن النسائي (8/ 138):</span></p><p style=""text-align:justify;""><span class=""ar_writing"">"" أخبرنا عبد الرحمن بن عبيد الله الحلبي، عن عبيد الله وهو ابن عمرو، عن عبد الكريم، عن سعيد بن جبير، عن ابن عباس، رفعه أنه قال: «قوم يخضبون بهذا السواد آخر الزمان كحواصل الحمام، لايريحون رائحة الجنة»"".</span></p><p style=""text-align:justify;""><span class=""ar_writing"">صحيح مسلم (3/ 1663):</span></p><p style=""text-align:justify;""><span class=""ar_writing"">"" وحدثني أبو الطاهر، أخبرنا عبد الله بن وهب، عن ابن جريج، عن أبي الزبير، عن جابر بن عبد الله، قال: أتي بأبي قحافة يوم فتح مكة ورأسه ولحيته كالثغامة بياضاً، فقال رسول الله صلى الله عليه وسلم: «غيروا هذا بشيء، واجتنبوا السواد»"".</span></p><p style=""text-align:justify;""><span class=""ar_writing"">الفتاوى الهندية (5/ 359):</span></p><p style=""text-align:justify;""><span class=""ar_writing"">""اتفق المشايخ رحمهم الله تعالى أن الخضاب في حق الرجال بالحمرة سنة وأنه من سيماء المسلمين وعلاماتهم وأما الخضاب بالسواد فمن فعل ذلك من الغزاة ليكون أهيب في عين العدو فهو محمود منه، اتفق عليه المشايخ رحمهم الله تعالى ومن فعل ذلك ليزين نفسه للنساء وليحبب نفسه إليهن فذلك مكروه وعليه عامة المشايخ"". </span>فقط واللہ اعلم</p></p>",144004201464,banuri,"('متفرق کتب', 'mutafarriq-kutub')","('متفرق ابواب', 'mutafarriq-abwab')","('متفرق فصول', 'mutafarriq-fusool')"
03-03-2019,https://www.banuri.edu.pk/readquestion/بچے-کو-دودھ-پلانے-کی-عمر-2/03-03-2019,بچے کو دودھ پلانے کی عمر,بچی کو دودھ پلانے اور بچے کو دودھ پلانے کی عمر کیا ہے؟,"<p><p style=""text-align:justify;"">بچہ اوربچی دونوں کی دودھ پلانے کی مدت میں کوئی فرق نہیں، شرعاً دونوں کی مدت رضاعت (یعنی دودھ پلانے کی مدت) دوسال ہے، دوسال کی عمرہونےپر بچے/ بچی  کا دودھ چھڑا دیاجائے ۔  اگر کوئی بچہ یا بچی  زیادہ کم زور ہو تو اُسے ضرورۃً ڈھائی سال تک بھی دودھ پلایا جاسکتا ہے۔</p><p style=""text-align:justify;""><span class=""ar_writing"">الدر المختار وحاشية ابن عابدين (رد المحتار) (3/ 209):</span></p><p style=""text-align:justify;""><span class=""ar_writing"">""باب الرضاع (هو) لغةً بفتح وكسر: مص الثدي. وشرعاً: (مص من ثدي آدمية) ولو بكراً أو ميتةً أو آيسةً، وألحق بالمص الوجور والسعوط (في وقت مخصوص) هو (حولان ونصف عنده وحولان) فقط (عندهما، وهو الأصح) فتح، وبه يفتى كما في تصحيح القدوري عن العون،  لكن في الجوهرة أنه في الحولين ونصف، ولو بعد الفطام محرم وعليه الفتوى. واستدلوا لقول الإمام بقوله تعالى: {وحمله وفصاله ثلاثون شهراً} [الأحقاف: 15] أي مدة كل منهما ثلاثون غير أن النقص في الأول قام بقول عائشة: لايبقى الولد أكثر من سنتين ومثله لايعرف إلا سماعاً، والآية مؤولة لتوزيعهم الأجل على الأقل والأكثر فلم تكن دلالتها قطعيةً، على أن الواجب على المقلد العمل بقول المجتهد وإن لم يظهر دليله كما أفاده في رسم المفتى، لكن في آخر الحاوي: فإن خالفا قيل: يخير المفتي، والأصح أن العبرة لقوة الدليل.</span></p><p style=""text-align:justify;""><span class=""ar_writing""> (قوله: لكن إلخ) استدراك على قوله: وبه يفتى. وحاصله أنهما قولان، أفتى بكل منهما ط ... (قوله: والأصح أن العبرة لقوة الدليل) قال في البحر: ولايخفى قوة دليلهما، فإن قوله تعالى: {والوالدات يرضعن} [البقرة: 233] الآية يدل على أنه  لا رضاع بعد التمام. وأما قوله تعالى: {فإن أرادا فصالاً عن تراض منهما} [البقرة: 233] فإن ما هو قبل الحولين بدليل تقييده بالتراضي والتشاور، وبعدهما لايحتاج إليهما. وأما استدلال صاحب الهداية للإمام وقوله تعالى: {وحمله وفصاله ثلاثون شهراً} [الأحقاف: 15] بناء على أن المدة لكل منهما كما مر، فقد رجع إلى الحق في باب ثبوت النسب من أن الثلاثين لهما للحمل ستة أشهر والعامان للفصال"". اهـ.</span> فقط واللہ اعلم</p></p>",144004201526,banuri,"('حقوق و آدابِ معاشرت', 'huqooq-muashret')","('حقوق', 'bahmi-huqooq')","('اولاد کے حقوق', 'olad-ky-hoqoq')"
07-03-2019,https://www.banuri.edu.pk/readquestion/مسبل-ازار-کے-پیچھے-نماز/07-03-2019,مسبل ازار کے پیچھے نماز,کیا کسی ایسے امام کے پیچھے نماز ہو جائے گی جس کا ٹخنہ چھپا ہوا ہو ، کیوں کہ اب بعض کے نزدیک شلوار اوپر چڑھانا یا پنٹ فولڈ کرنا جائز نہیں تو ان کے امام بھی اپنے پائنچے ٹخنوں سے نیچے رکھتے ہیں. اور اگر نہیں تو پھر اگر کبھی ایسی جگہ جہاں کوئی اور مسجد نہ ہو یا دور ہو، جماعت کے وقت کیا کرنا چاہیے؟  نماز پڑھ لی جائے؟  اور اگر نماز ایسے امام کے پیچھے پڑھی تو کیا دوہرانی پڑے گی؟,"<p><p style=""text-align:justify;"">پائنچوں کا ٹخنوں سے نیچے  رکھنا مکروہِ تحریمی ہے۔جو امام اس حالت میں نماز پڑھا رہا ہو اس کی نماز بھی مکروہ ہے اور اس کی اقتدا بھی ۔ البتہ  اگر کسی نے اس کی اقتدا کی تو اس کو  اعادے کی ضرورت نہیں، اس لیے  کہ یہ کراہت نماز کی ماہیت وحقیقت میں سے نہیں ہے۔</p><p style=""margin-left:0;margin-right:0;text-align:justify;""><span class=""ar_writing"">            "" عَنِ ابْنِ مَسْعُوْدٍ قَالَ: سمعتُ رسولَ اللّٰه صلی الله علیه وسلم یقولُ: مَنْ أَسْبَلَ ازَارَه فِيْ صَلاَتِه خُیَلاَءَ فَلَیْسَ مِنَ اللّٰه جَلَّ ذِکْرُه فِيْ حِلٍ وَلاَ حَرَامٍ""․ (ابوداوٴد، کتاب الصلاة، باب الإسبال في الصلاة، حدیث نمبر: ۶۳۷)</span></p><p style=""margin-left:0;margin-right:0;text-align:justify;""><span class=""ar_writing""><strong>      ""عَنْ أبي هرَیْرَة قال: بینما رجلٌ یصلي مُسْبِلاً إزارَه، إذْ قَالَ لَه رسولُ اللّٰه صلی الله علیه وسلم: اذْهبْ فَتَوَضَّأَ ثُمَّ جَاءَ، ثم قال: اذْهبْ فَتَوَضَّأَ، فَذَهبَ فَتَوَضَّأَ ثُمَّ جَاءَ فَقَالَ لَه رَجُلٌ: یارسولَ اللّٰه صلی الله علیه وسلم! مَا لَکَ أَمَرْتَه أنْ یَّتَوَضَّأَ؟ قال: إنَّه کَانَ یُصَلِّيْ وَهوَ مُسْبِلٌ إزَارَه، وَإنَّ اللّٰه جَلَّ ذِکْرُه لاَ یَقْبِلُ صَلاَةَ رَجُلٍ مُسْبِلٍ إزَارَه"".</strong></span></p><p style=""margin-left:0;margin-right:0;text-align:justify;""><span class=""ar_writing""> </span>         ترجمہ:  حضرت ابو ہریرہرضی اللہ عنہ روایت کرتے ہیں کہ ایک شخص اپنی ازار ٹخنوں سے نیچے لٹکائے ہونے کی حالت میں نماز پڑھ رہا تھا، رسول اللہ صلی اللہ علیہ وسلم نے اس سے فرمایا: جاوٴ، دوبارہ وضو کر کے آوٴ!تو وہ شخص وضو کر کے آیا، پھر آپ صلی اللہ علیہ وسلم نے ارشاد فرمایا: جاوٴ،وضو کر کے آوٴ! وہ شخص گیا اور وضو کر کے آیا، ایک شخص نے رسول اللہ صلی اللہ علیہ وسلم کی خدمت میں عرض کیا: آپ صلی اللہ علیہ وسلم نے اسے وضو کرنے کا حکم کیوں فرمایا؟ آپ صلی اللہ علیہ وسلم نے ارشاد فرمایا: وہ اپنی ازار ٹخنوں سے نیچے لٹکائے ہونے کی حالت میں نماز پڑھ رہا تھا اور اللہ تعالیٰ اس شخص کی نماز قبول نہیں فرماتے ،جو اپنی ازار ٹخنوں کے نیچے لٹکائے ہوئے ہو۔(ابوداوٴد، کتاب الصلاۃ،  باب الاسبال فی الصلاۃ، حدیث نمبر: ۶۳۸)</p><p style=""margin-left:0;margin-right:0;text-align:justify;""><span class=""ar_writing""><strong>الدر المختار وحاشية ابن عابدين (رد المحتار) (1/ 457):</strong></span></p><p style=""text-align:justify;""><span class=""ar_writing"">""وكذا كل صلاة أديت مع كراهة التحريم تجب إعادتها.</span></p><p style=""text-align:justify;""><span class=""ar_writing"">(قوله: وكذا كل صلاة إلخ) ... إ<strong>لا أن يدعي تخصيصها بأن مرادهم بالواجب والسنة التي تعاد بتركه ما كان من ماهية الصلاة وأجزائها، فلا يشمل الجماعة؛ لأنها وصف لها خارج عن ماهيتها "" ...</strong> الخ</span></p><p style=""text-align:justify;""><span class=""ar_writing"">""وَاطَالَةُ الذَّیْلِ مَکْرُوْهةٌ عِنْدَ أبِيْ حَنِیْفَةَ وَالشَّافِعِيِّ فِي الصَّلاَةِ وَغَیْرِها""․ (مرقاة المفاتیح،باب الستر، الفصل الثانی ۲/۶۳۴، حدیث:۷۶۱)</span>فقط واللہ اعلم</p></p>",144004201608,banuri,"('نماز', 'salat')","('نماز کی جماعت', 'namaz-ki-jamat')","('جماعت / امامت', 'jamat-imamat')"
