issued_at,link,title,question,answer,fatwa_number,dar_ul_ifta,kitab,bab,fasal
14-10-2018,https://www.banuri.edu.pk/readquestion/حجر-اسود-کی-تاریخ-اور-فضیلت/14-10-2018,حجرِ اسود کی تاریخ اور فضیلت,حجرِ اسود کی فضیلت اور تاریخ کیا ہے؟ اور ایک بات یہ بھی پوچھنی تھی کہ میں نے یہ سنا ہے کہ قیامت کی نشانیوں میں سے ایک نشانی یہ ہے کہ جب حجرِ اسود کالا ہو جائے گا تو قیامت آ جائے گی، کیا یہ بات صحیح ہے؟,"<p><p style=""margin-left:0;margin-right:0;text-align:justify;"">حجرِ اسود جنت کے یاقوتوں میں سے ایک ہے جسے سیدنا آدم علیہ السلام اپنے ساتھ جنت سے لائے تھے, اور تعمیر بیت اللہ کے وقت ایک گوشہ میں نصب فرمایا تھا۔</p><p style=""margin-left:0;margin-right:0;text-align:justify;"">طوفانِ نوح  علیہ السلام میں آدم علیہ السلام کا تعمیر کردہ بیت اللہ آسمانوں پر اُٹھائے جاتے وقت اس متبرک پتھر کو شکمِ جبلِ ابی قبیس میں امانت رکھ دیا گیا تھا، پھر تعمیر ابراہیمی کے وقت جبرئیل علیہ السلام نے اللہ تعالیٰ کے حکم سے سیدنا ابراہیم خلیل اللہ علیہ السلام  کی خدمتِ عالیہ میں پیش کردیا تھا، اس طرح اُسے پھر اسی جگہ کی زینت بنادیا گیا جہاں پہلے رونق افروز تھا۔(تفسیر قرطبی)  </p><p style=""margin-left:0;margin-right:0;text-align:justify;""> اس کے فضائل اور اوصاف میں حضورنبی کریم صلی اللہ علیہ وسلم  کے بہت سے ارشادات حدیث اور تاریخ کی کتابوں کی زینت بنے ہوئے ہیں، لیکن جنت کا یہ انمول موتی، عالی مرتبت، مقدس ومتبرک یاقوت،  گردشِ ایام کی ستم رانیوں سے محفوظ نہ رہ سکا، متعدد بار اُسے فساق وفجار ظالموں کے ہاتھوں تختۂ مشق بننا پڑا، بارہا حوادثات کا شکار ہوا اور اس کے نازنین بدن پر کتنی ہی مرتبہ زخم آئے۔     ۳۱۷ھ میں جب مکہ مکرمہ قرامطہ کے دستِ تصرف میں آیا، تو ابوطاہر سلیمان بن الحسن نے جو قرامطہ کا سردار تھا، حرم محترم میں خون کی ہولی کھیلی۔ ۸/ذو الحجہ ۳۱۷ھ کو اس قدر قتل عام کیا کہ حجاج کی لاشوں سے چاہِ زمزم بھر گیا، شہر اور مضافات کے تیس ہزار بے قصور افراد کو موت کی نیند سلادیا، جن میں سترہ سو حاجی اور سات سو طواف کرنے والے بھی شہید ہوگئے، اس نے یہ سارا کھیل میزابِ رحمت یعنی کعبہ شریف کا پرنالہ جو سونے کا تھا، اُکھاڑنے، مقامِ ابراہیم اور حجرِ اسود چوری کرنے کی نامشکور جسارت کے لیے کھیلا تھا۔     دو آدمی اس مذموم حرکت کے لیے کعبہ شریف پر چڑھے، مگر آن واحد میں سر کے بل زمین پر گرکر واصلِ جہنم ہوگئے، مقامِ ابراہیم تو اس کے دست تصرف سے مامون رہا، کیوں کہ خدام حرم نے اُسے پہاڑ کی گھاٹی میں کہیں چھپا دیاتھا، مگر ۱۴/ ذو الحجہ ۳۱۷ھ بروزِ اتوار عصر کے وقت جعفر بن حلاج نے ابوطاہر کے حکم سے حجرِ اسود کو کدال سے اُکھاڑلیا، اس پر کئی ضربیں لگائیں جس سے کچھ ریزے ٹوٹ گئے اور اپنے ساتھ بحرین لے گئے، اور اس کی جگہ خالی رہ گئی۔</p><p style=""margin-left:0;margin-right:0;text-align:justify;"">تقریباً بائیس سال کا طویل زمانہ گزرجانے کے بعد بحرین کے شہر ’’ہجر‘‘ سے بروز بدھ ۱۰/ ذو الحجہ ۳۳۹ھ کو یہ مبارک پتھر واپس ہوا، واپسی بھی معجزنما تھی، قرامطیوں سے باربار واپسی کا مطالبہ جب زور پکڑ گیا تو انہوں نے یہ عذرِ لنگ پیش کیا کہ وہ پتھر تو دوسرے پتھروں میں مل جل گیاہے، ان میں سے اسے الگ کرنا ہمارے بس کا روگ نہیں، اگر تمہارے پاس اس کی کوئی علامت ہے تو تلاش کرلو، چنانچہ علماءِ کرام سے استفسار کیاگیا تو انہوں نے ارشاد فرمایا : ان سب پتھروں کو آگ میں ڈالا جائے، جو پتھر آگ میں پگھل یا پھٹ جائیں وہ حجرِ اسود نہیں، حجرِ اسود کو آگ متاثر نہیں کر سکتی؛ کیوْں کہ یہ جنت کا پتھر ہے۔ اس طرح اس مقدس پتھر کی برتری اور مقبولیت کا لوہا منواکر اُسے واپس لوٹایا گیا اور پھر سے کعبہ شریف کی زینت بنادیا گیا۔</p><p style=""margin-left:0;margin-right:0;text-align:justify;"">علامہ جلال الدین سیوطی  رحمہ اللہ نے لکھا ہے کہ:’’ یہ ظالم ابوطاہر چیچک کے عارضہ میں مبتلا ہوا، اس کا جسم پھٹ گیا اور نہایت ذلت کے ساتھ مرا۔ ‘‘       (اعلام الاعلام، ص:۱۶۵، مرقات،ج:۵،ص:۳۲۰)</p><p style=""margin-left:0;margin-right:0;text-align:justify;"">علامہ قطب الدین رحمہ اللہ فرماتے ہیں:</p><p style=""margin-left:0;margin-right:0;text-align:justify;"">’’ابوطاہر قرامطی بدبخت کو ابرہہ کی طرح بیت اللہ کی بجائے اپنے شہر ’’ہجر‘‘ میں حج کا اجتماع کرانے کا جنون دماغ میں پیدا ہوا، اس نے اس غرض سے ایک عالی شان محل بنوایا جس کا نام ’’دارالہجرہ‘‘ رکھا، چناں چہ ۳۱۷ ھ میں حج کے ایام میں ایک لشکرِ جرار لے کر مکہ مکرمہ پر حملہ آور ہوا، طواف کرنے والوں، نماز پڑھنے والوں اور احرام کی حالت میں حاجیوں پر دستِ ستم دراز کیا، حد یہ کہ حرمِ محترم کے اندر بھی بے دریغ قتل کیا، شہر کے علاوہ گرد ونواح میں قتلِ عام کا بازار گرم کیا، تیس ہزار بے گناہ انسانوں کے خون سے اپنے ہاتھ رنگین کیے، اس قدر روح فرسا واقعہ کبھی رونما نہیں ہوا تھا، وہ ظالم کہتے تھے کہ تم مسلمان کہتے ہو: <span class=""ar_writing"">’’من دخله کان آمناً‘‘</span> (یعنی جو حرم میں داخل ہوگیا وہ مامون ہوگیا) بتاؤ اب امن کہاں گیا؟‘‘</p><p style=""margin-left:0;margin-right:0;text-align:justify;"">علامہ ابن خلدون رحمہ اللہ  رقم طراز ہیں:</p><p style=""margin-left:0;margin-right:0;text-align:justify;"">’’ابوطاہر نے کعبۃ اللہ کا دروازہ اکھاڑ پھینکا، غلافِ کعبہ کے ٹکڑے ٹکڑے کرکے اپنے فوجیوں میں بانٹ دیا، حجرِ اسود کو اکھاڑکے ساتھ لے گیا، اہلِ مکہ کے گھر بار اور مال ومتاع کو لوٹ لیا، اس نے روانگی کے وقت یہ اعلان کردیا کہ آئندہ سے حج اس کے ہاں ہوا کرے گا۔‘‘</p><p style=""margin-left:0;margin-right:0;text-align:justify;"">خلافتِ مستکفی کے امراء نے بے حد کوشش کی کہ کسی طرح حجرِ اسود واپس آجائے، انہوں نے پچاس ہزار دینارسرخ کی پیش کش بھی کی، مگر قرامطی ٹس سے مس نہ ہوئے۔ وہ (ابوطاہر) اس خیالِ فاسد پر قائم تھا کہ یہ ناپاک جسارت اپنے امام عبید اللہ المہدی والی افریقہ کی خوشنودی کے لیے کررہا ہے، لیکن جب منصور اسماعیل نے قیروان سے حجرِ اسود کی واپسی کا مطالبہ شدت سے کیا اور ادھر عبید اللہ المہدی نے بھی ابوطاہر کو سختی سے ڈانٹا کہ اگر حجرِ اسود واپس نہ کروگے تو پھر جنگ کے لیے تیار ہوجاؤ، اس لیے مجبوراً ۳۳۹ھ میں واپس کرنا پڑا، جب کہ اس سے قبل خلافتِ مستکفی کی جانب سے پچاس ہزار دینار کے عوض بھی واپسی کا مطالبہ مسترد کردیاگیا تھا۔ (ابن خلدون،ج:۵،ص:۱۹۶)</p><p style=""margin-left:0;margin-right:0;text-align:justify;"">طواف کی ابتدا  حجرِ اسود کے استلام سے ہوتی ہے، یہ جنت کا پتھر ہے جس میں اللہ تعالیٰ نے انسانوں کے گناہ جذب کرنے کی عجیب تاثیر رکھی ہے، چناں چہ نبی اکرم صلی اللہ علیہ وسلم نے ارشاد فرمایا:<br/><span class=""ar_writing"">’’نَزَلَ الْحَجْرُ الأَسْوَدُ مِنَ الْجَنَّة وَهو اَشَدُّ بَیَاضاً مِنَ اللَّبَنِ، فَسَوَّدَتْه خَطَایَا بَنِيْ اٰدَمَ‘‘.</span> (رواہ الترمذی ۸۷۷، الترغیب والترہیب: ۲۷۰)<br/>
ترجمہ: جس وقت حجر اسود جنت سے اترا تو وہ دودھ سے زیادہ سفید تھا، پھر آدمیوں کے گناہوں نے اسے سیاہ کردیا۔<br/>
اور ترمذی شریف کی ایک روایت میں ہے کہ ’’حجرِ اسود اور مقامِ ابراہیم جنت کے یاقوتوں میں دو یاقوت ہیں، اگر اللہ تعالیٰ ان کی روشنی کو ختم نہ فرماتے تو یہ پوری زمین وآسمان کو روشن کردیتے‘‘۔( ترمذی شریف :۸۸۷، الترغیب والترہیب : ۲۷۰)<br/>
نیز یہ بھی مروی ہے کہ حجرِ اسود قیامت کے دن اپنے بوسہ لینے اور استلام کرنے والوں کے حق میں سفارش کرے گا اور اس دن اللہ تعالیٰ اس کو زبان اور ہونٹ عطا فرمائیں گے۔</p><p style=""margin-left:0;margin-right:0;text-align:justify;"">نبی اکرم صلی اللہ علیہ وسلم نے ارشاد فرمایا:<br/><span class=""ar_writing"">’’أَشْهِدُوْا هذا الْحَجَرَ خَیَراً؛ فَإِنَّه یَوْمَ الْقِیَامَة شَافِعٌ یَشْفَعُ، لَه لِسَانٌ وَشَفَتَانِ یَشْهد لِمَنْ اِسْتَلَمَه‘‘.</span> (رواہ الطبرانی فی الاوسط عن عائشۃؓ، الترغیب والترہیب: ۲۷۰)<br/>
ترجمہ: اس حجرِ اسود کو اپنے عملِ خیر کا گواہ بنالو؛ کیوں کہ قیامت کے دن یہ سفارشی بن کر (اللہ کے دربار میں) اپنے استلام کرنے والوں کے لیے سفارش کرے گا، اس کی ایک زبان اور دو ہونٹ ہوں گے۔<br/>
پیغمبر علیہ السلام  سےحجرِ اسود کا بوسہ دیتے وقت رقت وزاری بھی ثابت ہے، نیز آپ صلی اللہ علیہ وسلم نے  اس کی تقبیل واستلام کو گویاکہ اللہ تعالیٰ سے مصافحہ کرنا قرار دیا ہے، آپ صلی اللہ علیہ وسلم کا ارشاد ہے:<br/><span class=""ar_writing"">’’مَنْ فَاوَضَه؛ فَاِنَّمَا یُفَاوِضُ یَدَ الرَّحْمٰنِ‘‘.</span> (رواہ ابن ماجہ ۲۹۵۷، الترغیب والترہیب: ۲۶۸)<br/>
ترجمہ: جو شخص حجرِ اسود کو ہاتھ لگائے تو گویا وہ اللہ تعالیٰ سے مصافحہ کررہا ہے۔<br/>
بریں بنا حجرِ اسود کی تقبیل/ استلام کا کمالِ استحضار کے ساتھ اہتمام کرنا چاہیے، بھیڑ کا موقع نہ ہو اور سہولت سے بوسہ لینا ممکن ہو تو قریب جاکر بوسہ لیں، اور اگر بھیڑ زیادہ ہو تو دور ہی سے استلام کرلیں، اس سے بھی بوسہ کے برابر ہی ثواب ملتا ہے۔</p><p style=""margin-left:0;margin-right:0;text-align:justify;"">باقی حجرِ اسود کے رنگ سے متعلق احادیث میں جو وارد ہے اس کا بیان اوپر آ چکا ہےکہ بنی آدم کے گناہوں نے اس کا رنگ کالا کر دیا۔  لیکن ہمیں ایسی کوئی حدیث نہیں ملی جس میں یہ صراحت ہو کہ حجرِ اسود کے رنگ کا کالا ہونا قیامت کی نشانیوں میں سے ہے۔ فقط واللہ اعلم</p></p>",144001200538,banuri,"('حج', 'haj')","('حج / عمرہ', 'hajj-umrah')","('مقامات متبرکہ', 'maqamat-e-mutabarrakah')"
24-12-2018,https://www.banuri.edu.pk/readquestion/اولاد-کے-درمیان-ھبہ-میں-برابری/24-12-2018,اولاد کے درمیان ھبہ میں برابری,1۔میرے والد کی دوکنال جگہ تھی، اس میں سے ایک کنال میرے نام کردی، میرے دوسرے بہن بھائیوں سے پوچھے بغیر کیا اس طرح ٹھیک ہے؟2۔  اگر کوئی ڈائریکٹ جگہ خرید کر  اپنے بیٹوں کے نام کر دے  تو کیا اس میں بچیوں کا حصہ بنتا ہے کہ نہیں؟,"<p><p style=""text-align:justify;"">1۔ اگر آپ کے والد صاحب نے زمین صرف آپ کے نام کی ہے (جیساکہ بعض اوقات قانونی تقاضوں یا دیگر مصالح کے پیش نظر کردیا جاتاہے) مالکانہ حقوق کے ساتھ قبضہ نہیں دیا تو صرف نام کرنے سے وہ آپ کی ملکیت نہیں ہوگی، بلکہ وہ والد صاحب کی ملکیت ہوگی، وہ زندگی میں جس طرح چاہیں اس میں جائز تصرف کرسکتے ہیں، اور ان کی وفات کی صورت میں مکمل زمین ان کی میراث شمار ہوگی۔</p><p style=""text-align:justify;"">اور اگر والد صاحب نے مالکانہ حقوق کے ساتھ زمین پر قبضہ دے دیا تو مذکورہ زمین آپ کی ملکیت میں آجائے گی، لیکن زندگی میں اولاد کو جائے داد دینے کے حوالے سے شرعی احکام کی تفصیل درج ذیل ہے: </p><p style=""text-align:justify;"">والد اپنی خوشی سے اپنی جائے داد میں سے اگر  اولاد کو کچھ دے تو شرعاً یہ معاملہ ہبہ (گفٹ) کہلاتا ہے ، اور اولاد کو ہبہ کرنے میں میں شریعت کا حکم یہ ہے کہ سب کے درمیان برابری اور انصاف کا پہلو اختیار کرے ،رسول اللہ ﷺ نے اولاد کے درمیان ہبہ کرنے میں برابری کرنے کا حکم دیا ، جیساکہ نعمان بن بشیر رضی اللہ تعالی عنہ کی  روایت میں ہے:</p><p style=""text-align:justify;""><span class=""ar_writing"">""وعن النعمان بن بشير أن أباه أتى به إلى رسول الله صلى الله عليه وسلم فقال: إني نحلت ابني هذا غلاماً، فقال: «أكل ولدك نحلت مثله؟» قال: لا قال: «فأرجعه» . وفي رواية ...... قال: «فاتقوا الله واعدلوا بين أولادكم»"". (مشکاة المصابیح، 1/261، باب العطایا، ط: قدیمی)</span></p><p style=""text-align:justify;""><strong><em>ترجمہ:</em></strong>حضرت نعمان ابن بشیر  رضی اللہ عنہ سے روایت ہے کہ (ایک دن ) ان کے والد (حضرت بشیر رضی اللہ عنہ) انہیں رسول کریمﷺ کی خدمت میں لائے اور عرض کیا کہ میں نے  اپنے اس بیٹے کو ایک غلام ہدیہ کیا ہے، آپ ﷺ نے فرمایا : کیا آپ نے اپنے سب بیٹوں کو اسی طرح ایک ایک غلام دیا ہے؟، انہوں نے کہا :  ”نہیں “، آپ ﷺ نے فرمایا: تو پھر (نعمان سے بھی ) اس غلام کو واپس لے لو۔ ایک اور روایت میں آتا ہے کہ ……  آپ ﷺ نے فرمایا: اللہ تعالی سے ڈرو اور اپنی اولاد کے درمیان انصاف کرو۔(مظاہر حق، 3/193، باب العطایا، ط: دارالاشاعت)</p><p style=""text-align:justify;"">البتہ  کسی بیٹے یا  بیٹی کو  کسی معقول شرعی وجہ کی بنا پر  دوسروں کی بہ نسبت   کچھ زیادہ  دینا چاہے تو دےسکتا ہے،  یعنی کسی کی دین داری یا یا زیادہ خدمت گزار ہونے کی بنا پر اس کو  دوسروں کی بہ نسبت کچھ زیادہ دے تو اس کی اجازت ہے، لیکن بعض کو دینا اور بعض کو محروم رکھنا یا بلا وجہ کم زیادہ دینا یہ شرعاً سخت گناہ ہے، اس سے بچنا لازم ہے۔</p><p style=""text-align:justify;"">لہٰذا اگر آپ کے والد صاحب کی گنجائش ہے کہ وہ آپ کی طرح دیگر بیٹے بیٹیوں کو جائے داد میں سے آپ کے برابر یا شرعاً مقبول ومعقول حصہ دے سکتے ہیں تو مذکورہ زمین آپ کے پاس رہنے دیں اور دیگر اولاد کو بھی حصہ دے دیں۔ لیکن اگر دوسرے بچوں کو اتنی جائے داد دینے کی استطاعت نہیں ہے، تو آپ اور آپ کے والد صاحب کو چاہیے کہ اس ہبہ (گفٹ) کو واپس کریں۔ پھر اگر زندگی میں ہبہ کرنا چاہتے ہیں تو شرعی حکم کے مطابق تقسیم کریں۔</p><p style=""text-align:justify;"">2۔ اس کا حکم ماقبل والا ہے، اور اولاد میں بیٹے بیٹیاں دونوں شامل ہیں۔ فقط واللہ اعلم</p></p>",144004200261,banuri,"('حقوق و آدابِ معاشرت', 'huqooq-muashret')","('حقوق', 'bahmi-huqooq')","('اولاد کے حقوق', 'olad-ky-hoqoq')"
01-12-2018,https://www.banuri.edu.pk/readquestion/جھگڑے-کے-وقت-قرآنی-حکم-صبر-کی-تلقین-کے-جواب-میں-صبر-کرنے-سے-انکار-کا-حکم/01-12-2018,جھگڑے کے وقت قرآنی حکم صبر کی تلقین کے جواب میں صبر کرنے سے انکار کا حکم,"بیوی قرآن کی تلاوت کر رہی تھی اور شوہر سے کسی بات پر غصہ آگیا، اب شوہر نے قرآن کی ایک آیت کی طرف اشارہ کر کے کہا : دیکھو اللہ نے صبر کرنے کو کہا ہے تو تم بھی صبر کرو، جس پر بیوی نے غصہ کی حالت میں کہا: "" میں صبر نہیں کرتی""۔سوال یہ ہے کہ کیا ایسے کہنے سے بیوی قرآن کی آیت کے انکارکی مرتکب ہوکر ایمان سے تو محروم نہیں ہوئی ؟ اور کیا اس سے نکاح تو نہیں ٹوٹ گیا؟ بندہ بہت پریشاں ہے، جواب جلد عنایت فرمائیں!","<p><p style=""margin-left:0;margin-right:0;text-align:justify;"">صورتِ مسئولہ میں چوں کہ بیوی نے قرآن میں مذکور ایک حکم پر عمل کرنے سے انکار کیا ہے، قرآن کی آیت اور حکم کا انکار نہیں کیا ہے، اس لیے اس جملہ ’’میں صبر نہیں کرتی‘‘ سے بیوی دائرہ اسلام سے خارج نہیں ہوئی اور نہ ہی اس سے نکاح ٹوٹا ہے۔نیز ہر وقت ہر معاملہ میں صبر کرنا (اگرچہ مستحب ہو) لیکن فرض نہیں ہوتا، اور بظاہربیوی نے کسی خاص معاملہ ( جو دونوں کے درمیان تنازعہ کا سبب تھا) پر صبر کرنے سے انکار کیا تھا، مطلقاً صبر کا انکار مقصود نہیں تھا۔ </p><p style=""margin-left:0;margin-right:0;text-align:justify;"">البتہ پھر بھی آئندہ کے لیے اس طرح کے جملے کہنے سے احتیاط کرنی چاہیے۔ نیز جب دینِ اسلام کا کوئی حکم پیش کیا جائے تو مسلمان کو اس کے سامنے سرتسلیم خم کرنا چاہیے۔ فقط واللہ اعلم</p></p>",144003200350,banuri,"('ایمان و عقائد', 'aqaed')","('اسلامی عقائد', 'islami-aqaed')","('آسمانی کتابیں', 'aasmani-kitabayn')"
