issued_at,link,title,question,answer,fatwa_number,dar_ul_ifta,kitab,bab,fasal
25-12-2018,https://www.banuri.edu.pk/readquestion/عدالتی-یکطرفہ-خلع/25-12-2018,یک طرفہ خلع عدالتی خلع کا حکم اور اس کے بعد پنچائیت سے فیصلہ کروانا,لڑکی نے اپنے شوہر  سے طلاق مانگی، لڑکے نے انکار کیا، خلع پر بھی راضی نہ ہوا،  لڑکی نے کورٹ کا رخ کیا، کورٹ نے تفریق کردی، اس تفریق کی شرعاً  کیا حیثیت ہے؟ اور اب لڑکا پنجائت میں آکر لڑکی والوں سے فیصلہ چاہتا ہے، اب پنجائت میں ہم کیا فیصلہ کریں؟,"<p><p style=""text-align:justify;"">سوال میں یہ واضح نہیں کہ عدالت میں بیوی نے کیا دعوی دائر کیا تھا؟ اور عدالت نے کس بنیاد پر تفریق کی؟ اگر خلع کے مطالبہ کا دعوی تھا اور عدالت نے شوہر کی رضامندی کے بغیر خلع کا فیصلہ دیا تھا تو شرعاً ایسی خلع معتبر نہیں، اور نہ ہی اس سے نکاح ختم ہوا۔ لہذا  پنچایت کو چاہیے کہ میاں بیوی کے اختلافات ختم کراکردونوں کو  نباہ پر راضی کرنے کی کوشش کرے ،بصورتِ دیگر باہمی رضامندی سے خلع یا طلاق دلاکر دونوں میں تفریق کرادے۔اگر بیوی کو شوہر سے کوئی معقول شرعی شکایت ہے تو پنچایت شوہر سے اس شکایت کو دور کرنے کا کہے اور آئندہ کے لیے اسے حقوق کی ادائیگی کا پابند بنائے۔اگر بیوی کسی معقول عذر کے بغیر عدالت گئی تھی تو اسے شوہر کے ساتھ رہنے اور نباہ کی ترغیب دے۔فقط واللہ اعلم</p></p>",144004200272,banuri,"('طلاق', 'talaaq')","('فسخ و تفریق', 'faskh-o-tafreeq')","('فسخ و تفریق', 'faskh-o-tafreeq')"
19-12-2018,https://www.banuri.edu.pk/readquestion/ایزی-پیسہ-20/19-12-2018,ایزی پیسہ اکاؤنٹ کھلوانے کا حکم,آج کل موبائل کی سم والے یہ اکاؤنٹ دے رہے ہیں ’’جاز‘‘ اور ’’ٹیلینور‘‘ ایزی پیسہ والے؟ کیا یہ اکاؤنٹ کھلوانا جائز ہے؟,"<p><p>""ایزی پیسہ اکاؤنٹ  "" ایک ایسی سہولت ہے جس میں آپ اپنی جمع کردہ رقوم  سے کئی قسم کی سہولیات حاصل کرسکتے ہیں، مثلاً: بلوں کی ادائیگی، یا رقوم کا تبادلہ، موبائل وغیرہ میں بیلنس کا استعمال وغیرہ ۔ نیز تحقیق کرنے پر یہ بھی معلوم ہوا ہے کہ ان کی پشت پر ایک بینک ہوتا ہے، telenor micro-financing bank ، یہ بھی ایک قسم کا بینک ہی ہے کہ جس میں عام طور پر چھوٹے سرمایہ داروں کی رقوم سود پر رکھی جاتی ہیں اور اس میں سے چھوٹے کاروباروں کے لیے سود پر قرض بھی دیا جاتا ہے۔</p><p>اس کی فقہی حیثیت یہ ہے کہ اس اکاؤنٹ میں جمع کردہ رقم قرض ہے ، اور  چوں کہ قرض دے کر اس سے کسی بھی قسم کا نفع اٹھانا جائز نہیں ہے ؛ اس لیے اس قرض کے بدلے کمپنی کی طرف سے دی جانے والی سہولیات وصول کرنا اور ان کا استعمال کرنا جائز نہیں ہے، لہذا   کمپنی  اکاؤنٹ ہولڈر کو اس مخصوص رقم جمع کرانے کی شرط پر  یومیہ فری منٹس اور میسیجز وغیرہ کی سہولت فراہم کرتی ہے یا رقم کی منتقلی پر ڈسکاؤنٹ وغیرہ دیتی ہے تو  ان کا استعمال جائز نہیں ہوگا، اس لیے کہ اس اکاؤنٹ میں رقم رکھوانا درحقیقت  قرض ہے، اور  قرض دینا تو فی نفسہ جائز ہے، لیکن کمپنی اس پر جو  مشروط منافع دیتی  ہے، یہ  شرعاً ناجائز ہے؛ اس لیے کہ قرض پر شرط لگا کر نفع  کے لین دین  کو نبی کریم ﷺ نے سود قرار دیا ہے۔ (مصنف بن أبی شیبہ، رقم:۲۰۶۹۰ )</p><p> نیز   چوں کہ اس میں  مذکورہ اکاؤنٹ کھلوانا ناجائز معاملے کےساتھ مشروط ہے ؛ اس لیے یہ اکاؤنٹ کھلوانا یا کھولنا  بھی جائز نہیں ہوگا۔</p><p>اگر کوئی 'ایزی پیسہ اکاؤنٹ' کھلواچکاہو تو اس کے لیے یہ حکم ہے کہ وہ صرف اپنی جمع کردہ رقم واپس لے سکتاہے، یا صرف جمع کردہ رقم کے برابر استفادہ کرسکتاہے، اس رقم پر ملنے والے اضافی فوائد حاصل کرنا اس کے لیے جائز نہیں ہوں گے۔ فقط واللہ اعلم</p></p>",144004200179,banuri,"('معاملات', 'muamlat')","('سود / بینکاری / انشورنس / شیئرز', 'sood-bankari-insurance-shares')","('سودی قرضہ کی لین دین', 'soodi-qarzay-ki-layn-dayn')"
06-01-2019,https://www.banuri.edu.pk/readquestion/نقد-میں-خرید-کر-ادھار-میں-بیچنے-کا-کاروبار-کرنا/06-01-2019,رقم پر ہرماہ متعین فیصد نفع لینا,میرے ایک رشتہ دار نے ایک نیا کاروبار شروع کیا ہے، اور وہ کاروبار کچھ اس طرح ہے کہ وہ مارکیٹ سے کوئی بھی چیز نقد میں خرید کر لوگوں کو قسطوں پر چیزیں فروخت کرتا ہے، اس نے مجھے اپنے کاروبار میں شرکت کی دعوت دی ہے، اس کا طریقہ کار اس نے یہ رکھا ہے کہ میں کسی بھی طور رقم کو کاروبار میں اس کے ساتھ شامل کروں تو وہ مجھے ماہانہ 4 پرسنٹ کے حساب سے منافع دے گا، اس معاملہ کو طے کرانے میں ہمارے بیچ ایک اور شخص درمیان میں ہے جس کا کہنا ہے کہ چار پرسنٹ نہیں، وہ مجھے 3 پرسنٹ دے گا، اور ایک پرسنٹ خود رکھے گا ؛ کیوں کہ  حساب کتاب کی جواب داری اسی کی ہو گی۔میرا مسئلہ یہ ہے کہ میں یہ جاننا چاہتا ہوں کہ آیا اس کاروبار کے اندر کوئی سود کا عنصر تو نہیں آتا ؟کہیں ہم کسی طریقے سے غیر شرعی کام میں تو نہیں جارہے ؟  اس کاروبار کے بارے میں چوں کہ جو کاروبار کررہا ہے اس کا کہنا یہ ہے کہ یہ میری مرضی اور منشا کے مطابق ہے کہ میں کوئی چیز خرید کر اس چیز کا مالک بن جاتا ہوں، آیا میری مرضی اس کو میں کسی بھی دام فروخت کر سکتا ہوں۔شرع محمدﷺ  اس بارے میں کیا کہتی ہے؟ ذرا مجھے اس بات کا جواب دے دیں  کہ مجھے یہ اس کام میں حصہ لینا چاہیے یا نہیں لینا چاہیے؟,"<p><p style=""text-align:justify;"">چار پرسنٹ کامطلب اگر یہ ہےکہ آپ کی طرف سے کاروبار میں لگائی گئی رقم کا چارپرسنٹ آپ کو ہرماہ دے گا تو یہ کاروبار ناجائز ہے اور آپ کا اس کو رقم دینا اور نفع لینا حرام ہے؛ کیوں کہ اس صورت میں نفع رقم دے کر اس پر نفع متعین کرلیا گیا ہے۔</p><p style=""text-align:justify;"">اور اگر صورت یہ ہےکہ وہ قسطوں پر کاروبار کرے گا اور جو نفع ہوگا اس نفع کاچارپرسنٹ آپ کو دے گا تو نفع اس طرح طے کرنا جائز ہے، مگر اس میں شبہ یہ ہےکہ قسطوں کے کاروبار میں نفع  آخر میں جاکر ظاہر ہوتا ہے؛  اس لیے تردد یہ ہے کہ وہ شروع کے مہینوں میں کس طرح آپ کو ادائیگی کرے گا؟آیا وہ اپنی جیب سے دے گا اور پھر اس کے بدلے میں آخر میں آپ کانفع خود رکھ لے گا یا کوئی اور صورت ہوگی ؟اس کی وضاحت کردیں۔ اس کے بعد اس کا جواب دے دیا جائے گا۔ فقط واللہ اعلم</p></p>",144004200467,banuri,"('معاملات', 'muamlat')","('بیع / تجارت', 'bay-tijarat')","('نقد اور ادھار خرید و فروخت کے احکام', 'naqd-o-udhar-khareed-o-farokht-k-ahkam')"
07-01-2019,https://www.banuri.edu.pk/readquestion/مردوں-کے-لئے-مہندی-لگانے-کا-حکم-2/07-01-2019,مردوں کے لیے مہندی لگانے کا حکم,مرد کے لیے مہندی کا کیا حکم ہے، آیا جائز ہے مکروہ ہے یا حرام ہے؟,"<p><p style=""text-align:justify;"">مرد کے لیے سر اور داڑھی کے بالوں میں سیاہ رنگ کے علاوہ مہندی کا خضاب لگانا درست ہے۔</p><p style=""text-align:justify;"">ہاتھوں اور پیروں پر مہندی لگانا عام حالات میں خواتین کے ساتھ خاص ہے، جب کہ مردوں کے لیے خواتین کی مشابہت اختیار کرنا اور ہاتھ پیر میں مہندی لگانا درست نہیں۔ البتہ مجبوری کی صورت میں (مثلاً بطورِ علاج) مرد کے لیے ہاتھ اور پاوٴں میں مہندی لگانے کی اجازت ہے۔ فقط واللہ تعالیٰ اعلم</p></p>",144004200492,banuri,"('حقوق و آدابِ معاشرت', 'huqooq-muashret')","('لباس / وضع قطع', 'libass-waza-qata')","('زیب و زینت کی اشیاء', 'zayb-o-zeenat-ki-ashya')"
08-01-2019,https://www.banuri.edu.pk/readquestion/مقطوع-اللحیہ-کی-امامت-کے-بارے-میں-مفتی-بہ-قول/08-01-2019,مقطوع اللحیہ کی امامت کے بارے میں مفتی بہ قول,مقطوع اللحیہ کی امامت کے بارے میں مفتی بہ قول کیا ہے نماز کا اعادہ ہے یا نہیں؟,"<p><p style=""text-align:justify;"">ایک مشت داڑھی رکھنا شرعاًواجب ہے اور اس سے کم کرانا یا منڈاناناجائز اور گناہ ہے، جو شخص داڑھی منڈاتا یا ایک مشت سے کم کراتا ہو وہ فاسق ہے اور فاسق کی امامت مکروہ ہے ،البتہ اگر  نماز پڑھالے تو شرعاً اعادہ واجب نہیں۔</p><p style=""text-align:justify;""><span class=""ar_writing"">حاشية رد المختار على الدر المختار (1/ 559):<br/>
""قال: فكره لهم التقدم، ويكره الاقتداء بهم تنزيهاً، فإن أمكن الصلاة خلف غيرهم فهو أفضل، وإلا فالاقتداء أولى من الانفراد"". </span>فقط واللہ اعلم</p></p>",144004200508,banuri,"('نماز', 'salat')","('نماز کی جماعت', 'namaz-ki-jamat')","('جماعت / امامت', 'jamat-imamat')"
15-12-2018,https://www.banuri.edu.pk/readquestion/40-دن-کے-بعد-نفاس/15-12-2018,بچہ جننے کے 40 دن کے بعد آنے والے خون کا حکم,میری بیگم جس نے 53 دن پہلے بیٹے کو جنا اور 40 دن بعد غسل کر کے نمازیں شروع کیں پر 50 وے دن تھوڑا سا براؤن رنگ کا خون آنے لگا بیگم نے نماز ترک کردی اس کے بعد 52 دن لال رنگ کا خون آنے لگا اور 53 دن دوبارہ براؤن رنگ کا خون آیا اور بند ہوگیا تو اس حالت میں کیا کریں، نماز پڑھنی چاہیے یا نہیں؟ کیا یہ ماہواری ہے؟,"<p><p style=""text-align:justify;"">نفاس یعنی ولادت کے بعد خون آنے کی مدت  صرف 40 دن ہی ہو تی اس سے زیادہ نہیں۔  اور کم سے کم طہر کی مدت 15 دن کی ہے۔لہذا  اگر آپ کی اہلیہ کو چالیس دن تک خون آیا تھا ور چالیس دن پورے ہونے پر غسل کیا تھا تو اب 40 کے بعد جو خون آیا خواہ وہ کسی بھی رنگ کا ہو وہ استحاضہ ہے ان دنوں کی نمازیں واجب ہیں۔</p><p style=""text-align:justify;"">البتہ نفاس کا خون بند ہوجانے کے  15 دن گزرنے کے بعد اگرخون آیا ہے تو وہ ماہ واری ہے۔ ان دنوں کی نمازیں واجب نہیں۔</p><p style=""text-align:justify;""><span class=""ar_writing"">""عن أم سلمة رضي اللّٰه عنها قالت: کانت النفساء تقعد علی عهد رسول اللّٰه صلی اللّٰه علیه وسلم أربعین یوماً"". (شامی بیروت ۱؍۴۳۲،)</span></p><p style=""text-align:justify;""><span class=""ar_writing""> <a href=""http://www.elmedeen.com/read-book-2988&amp;page=841&amp;q=%D8%B7%DB%81%D8%B1%20%D9%85%D8%AF%D8%AA?book=2988"">سنن دارمی </a></span></p><p style=""text-align:justify;""><span class=""ar_writing"">""أَخْبَرَنَا مُحَمَّدُ بْنُ يُوسُفَ قَالَ: قَالَ سُفْيَانُ: الطُّهْرُ خَمْس عَشْرَةَ"".</span><br/>
ترجمہ: سفیان فرماتے ہیں طہر کی مدت پندرہ دن ہے۔ فقط واللہ اعلم</p></p>",144004200101,banuri,"('طہارت', 'taharat')","('حیض، نفاس، استحاضہ', 'hayz-nifas-istihaza')","('جنابت ، حیض اور نفاس کے احکام', 'janabat-hayz-or-nifas-k-ahkam')"
14-12-2018,https://www.banuri.edu.pk/readquestion/مسلمان-کا-قادیانی-کے-پاس-ملازمت-کرنا/14-12-2018,مسلمان کا قادیانی کے پاس ملازمت کرنا,قادیانی کے پاس مسلمان ملازمت کرسکتا ہے؟,"<p><p style=""text-align:justify;"">قادیانی چوں کہ  شرعی احکام کی رو سے مرتد اور زندیق اورملکی آئین کی روسےغیرمسلم ہیں، اس بنا پر   قادیانیوں /مرزائیوں سے خریدوفروخت ،تجارت، لین دین ،سلام و کلام ، ملنا جلنا، کھانا پینا ، شادی و غمی میں شرکت ، جنازہ میں شرکت ،تعزیت ،عیادت،ان کے ساتھ تعاون یاملازمت سب شریعتِ اسلامیہ میں سخت ممنوع اور حرام ہیں۔ قادیانیوں کا مکمل بائیکاٹ ان کو توبہ کرانے میں بہت بڑا علاج اور ان کی اصلاح اور ہدایت کا بہت بڑا ذریعہ اور ہر مسلمان کا اولین ایمانی فریضہ ہے، اور رسول اﷲ صلی اﷲ علیہ وسلم سے محبت کی نشانی ہے ، لہذا  ان کے ہاں ملازمت کرنا یا کاروباری معاملات  کرنا نا جائز اور حرام  ہے۔فقط واللہ اعلم</p></p>",144004200071,banuri,"('ایمان و عقائد', 'aqaed')","('باطل مذاہب اور فرقے', 'mazahib-masalik')","('قادیانی', 'qadiyaniat')"
04-11-2018,https://www.banuri.edu.pk/readquestion/منہال-اور-مناہل-کا-معنی/04-11-2018,منہال اور مناہل کا معنی,منہال اور مناہل کا معنی بتادیں!,"<p><p style=""text-align:justify;""><span class=""ar_writing"">’’مَنَاهِلْ‘‘ </span>(میم اور نون کے زبر کے ساتھ )  عربی زبان کا لفظ ہے  اور لفظ <span class=""ar_writing"">’’مَنْهَلْ‘‘</span>  کی جمع ہے،<span class=""ar_writing"">’’مَنْهَلْ‘‘ </span>کے معنی ہیں: پانی کا گھاٹ،  سیرابی حا صل کرنے کا مقام، پانی کا چشمہ۔ "" جیسا کہ ''معجم الرائد'' میں ہے:   <span class=""ar_writing"">’’مناهل: جمع منهل، عين الماء، نبع‘‘. </span>اسی  طرح <span class=""ar_writing"">’’مِنْهَال‘‘</span> کا ماخذ بھی یہی ہے۔<span class=""ar_writing"">’’مَنَاهِلْ‘‘ </span> اور <span class=""ar_writing"">’’مِنْهَال‘‘ </span>نام رکھنا شرعاً درست ہے، اس نام کا استعمال لڑکیوں کے ناموں کے لیے ہوتا ہے،  یعنی: وہ لڑکی/ عورت جو آئندہ چل کر خیر وبھلائی کا چشمہ ہو، اور نفعِ عام کا ذریعہ بنے۔فقط واللہ اعلم</p></p>",144001200858,banuri,"('متفرق کتب', 'mutafarriq-kutub')","('متفرق ابواب', 'mutafarriq-abwab')","('متفرق فصول', 'mutafarriq-fusool')"
04-12-2018,https://www.banuri.edu.pk/readquestion/جامع-مسجد-میں-جہاں-نماز-ادا-کی-جاتی-ہو-وہاں-کمرہ-یا-اسٹور-بنانا/04-12-2018,جامع مسجد میں جہاں نماز ادا کی جاتی ہو وہاں کمرہ یا اسٹور بنانا,کیا جامع مسجد میں جہاں نماز ادا کی جاتی ہو وہاں کمرہ یا اسٹور بنانا اس انداز پر کہ وہاں کمرہ یا اسٹور بننے کے بعد جماعت سے نماز ادا نہ کی جا سکے، کیا ایسا کرنا جائز ہے؟,"<p><p style=""text-align:justify;"">وہ  جگہ جو  مسجد ِ شرعی کے لیے وقف ہو جائے،اس کو نماز کے علاوہ کسی اور کام کے لیے خواہ مسجد کی مصالح ہی کے لیے ہو ، استعمال کرنا درست نہیں ، اس لیے اس جگہ  مستقل کمرہ بنانا  جائز نہیں ، البتہ اگر کوئی جگہ نہ ہو اوراس  جگہ  چٹائیاں رکھی ہوں اور نماز کے لیے وافر جگہ ہو تو اس میں گنجائش ہے۔</p><p style=""text-align:justify;""><span class=""ar_writing"">الجوهرة النيرة (3/ 292):<br/>
’’( وَإِذَا صَحَّ الْوَقْفُ عَلَى اخْتِلَافِهِمْ خَرَجَ مِنْ مِلْكِ الْوَاقِفِ ) حَتَّى لَوْ كَانُوا عَبِيدًا فَأَعْتَقَهُمْ لَا يَعْتِقُونَ قَوْلُهُ: ( وَلَمْ يَدْخُلْ فِي مِلْكِ الْمَوْقُوفِ عَلَيْهِ ) ؛ لِأَنَّهُ لَوْ دَخَلَ فِي مِلْكِهِ نَفَذَ بَيْعُهُ فِيهِ كَسَائِرِ أَمْلَاكِهِ‘‘.</span></p><p style=""text-align:justify;""><span class=""ar_writing"">شرح فتح القدير (6/ 220):<br/>
’’وإذا صح الوقف أي لزم، وهذا يؤيد ما قدمناه في قول القدوري: وإذا صح الوقف خرج عن ملك الواقف، ثم قوله: لم يجز بيعه ولا تمليكه هو بإجماع الفقهاء‘‘.</span></p><p style=""text-align:justify;""><span class=""ar_writing"">""الفقه الإسلامي وأدلته""</span>میں ہے:</p><p style=""text-align:justify;""><span class=""ar_writing"">’’إذا صحّ الوقف خرج عن ملک الواقف، وصار حبیسًا علی حکم ملک الله تعالی، ولم یدخل في ملک الموقوف علیه، بدلیل انتقاله عنه بشرط الواقف (المالک الأول) کسائر أملاکه، وإذا صحّ الوقف لم یجز بیعه ولا تملیکه ولا قسمته ‘‘. (الفقه الإسلامي وأدلته ۱۰/۷۶۱۷ ، الباب الخامس الوقف ، الفصل الثالث حکم الوقف) </span>فقط واللہ ا علم</p></p>",144003200398,banuri,"('نماز', 'salat')","('مسجد کے آداب و احکام', 'masjid-k-aadab-o-ahkaam')","('مسجد کے آداب و احکام', 'masjid-k-aadab-o-ahkam')"
29-10-2018,https://www.banuri.edu.pk/readquestion/فرسٹ-حبیب-مضاربہ-میں-نوکری-کرنا-2/29-10-2018,فرسٹ حبیب مضاربہ  میں نوکری کرنا,کیا فرسٹ حبیب مضاربہ  میں نوکری کرنا جائز ہے یا نہیں ؟,"<p><p style=""margin-left:0;margin-right:0;text-align:justify;"">فرسٹ حبیب مضاربہ کا طریقہِ تجارت غیر شرعی ہے، اس  وجہ سے اس میں نوکری کرنا جائز نہیں ہے۔فقط واللہ اعلم</p></p>",144001200774,banuri,"('معاملات', 'muamlat')","('سود / بینکاری / انشورنس / شیئرز', 'sood-bankari-insurance-shares')","('اسلامی بینکاری', 'islami-bankari')"
04-12-2018,https://www.banuri.edu.pk/readquestion/مسجد-کے-پرانے-قالین-کسی-دوسری-مسجد-میں-دینا/04-12-2018,مسجد کے پرانے قالین کسی دوسری مسجد میں دینا,مسجد کا متولی مسجد کے پرانے قالین دوسری مسجد میں بلاکسی عوض دے سکتا ہے ،جب کہ موجودہ مسجد کے لیے نئے قالین لاۓ گئے ہیں ؟,"<p><p style=""text-align:justify;"">صورتِ مسئولہ میں مذکورہ مسجد کے پرانے قالین کی اگر اب اس مسجد کو ضرورت نہیں ہے تو مسجد کا  متولی کمیٹی کے مشورہ سے اس کو قریبی دوسری مسجد میں بلاعوض بھی دے سکتا ہے۔ </p><p style=""text-align:justify;""><span class=""ar_writing"">رد المحتار - (17 / 229):<br/>
""( حَشِيشُ الْمَسْجِدِ وَحُصْرُهُ مَعَ الِاسْتِغْنَاءِ عَنْهُمَا وَ ) كَذَا ( الرِّبَاطُ وَالْبِئْرُ إذَا لَمْ يُنْتَفَعْ بِهِمَا فَيُصْرَفُ وَقْفُ الْمَسْجِدِ وَالرِّبَاطِ وَالْبِئْرِ ) وَالْحَوْضِ ( إلَى أَقْرَبِ مَسْجِدٍ أَوْ رِبَاطٍ أَوْ بِئْرٍ ) أَوْ حَوْضٍ ( إلَيْهِ )"". </span>فقط واللہ اعلم</p></p>",144003200392,banuri,"('نماز', 'salat')","('مسجد کے آداب و احکام', 'masjid-k-aadab-o-ahkaam')","('مسجد کے آداب و احکام', 'masjid-k-aadab-o-ahkam')"
29-12-2018,https://www.banuri.edu.pk/readquestion/جمعہ-کی-سنتیں-وقت-سے-پہلے-ادا-کرنا/29-12-2018,جمعہ کی سنتیں وقت سے پہلے ادا کرنا,سعودی عرب میں جمعہ کے دن جمعہ کی اذان کے فوراً بعد خطبہ شروع کردیا جاتا ہے، چار سنت رکعات کی ادائیگی کا وقت نہیں دیا جاتا تو اکثر افراد وقت سے پہلے سنت ادا کرتے ہیں۔ اور مکروہ وقت کا خیال بھی نہیں کیا جاتا۔مکروہ اوقات میں سنت یا نفل ادا کرنا کیسا ہے؟,"<p><p style=""text-align:justify;""> وقت سے پہلے یا  مکروہ  وقت میں نماز ادا کرنا درست نہیں،  البتہ اگر نماز سے پہلے سنت نہ پڑھ سکا تو  جمعہ کے بعد  ادا کرلے ۔ فقط واللہ اعلم</p></p>",144004200322,banuri,"('نماز', 'salat')","('جمعہ کی نماز', 'jumaa')","('جمعہ و عیدین', 'juma-o-eidayn')"
26-12-2018,https://www.banuri.edu.pk/readquestion/دو-شخصوں-کا-ایک-ساتھ-ایک-دوسرے-کو-سلام-کرنا/26-12-2018,دو شخصوں کا ایک ساتھ ایک دوسرے کو سلام کرنا,اگر دو آپس میں ملنے والے لوگ ایک ساتھ ایک دوسرے کو سلام کریں تو دونو ں کے اوپر جو سلام کا جواب واجب تھا وہ ادا ہوگیا یا دوبارہ جواب دینا ضروری ہے؟,"<p><p style=""text-align:justify;"">جب دوآدمی بوقتِ ملاقات ایک ہی وقت میں ایک دوسرے کو ""السلام علیکم"" کہیں تو ہرایک پر جواب ""وعلیکم السلام"" واجب ہوجائے گا۔</p><p style=""text-align:justify;""><span class=""ar_writing"">مرقاة المفاتيح شرح مشكاة المصابيح (7/ 2944):<br/>
""وإذا تلاقى رجلان وسلم كل واحد منهما على صاحبه دفعةً واحدةً، أو أحدهما بعد الآخر، فقال القاضي حسين وصاحبه أبو سعيد المتولي: يصير كل واحد منهما مبتدئاً بالسلام، فيجب على كل واحد أن يرد على صاحبه. وقال الشاشي: فيه نظر، فإن هذا اللفظ يصلح للجواب، فإذا كان أحدهما بعد الآخر كان جواباً، وإن كانا دفعةً لم يكن جواباً. قال: وهو الصواب"". </span> فقط واللہ اعلم</p></p>",144004200291,banuri,"('حقوق و آدابِ معاشرت', 'huqooq-muashret')","('آدابِ معاشرت', 'akhlaq-aadab')","('سلام کے احکام و آداب', 'salam-or-musafeh-k-ahkam-o-aadab')"
