issued_at,link,title,question,answer,fatwa_number,dar_ul_ifta,kitab,bab,fasal
08-01-2019,https://www.banuri.edu.pk/readquestion/کالے-کپڑے-پہننا/08-01-2019,کالے کپڑے پہننا,کالے کپڑے پہننے کے بارے  میں تفصیلی فتوی درکار ہے، مرد عورت دونوں کے بارے  میں وضاحت کریں۔   نیز شلوار قمیص ٹوپی مکمل لباس اگر کوئی زیب تن کرے تو اس کے بارے  میں کیا حکم ہے؟,"<p><p style=""text-align:justify;"">نبی کریم صلی اللہ علیہ وسلم سے کالے رنگ کی چادر اوڑھنا اور سیاہ عمامہ باندھنا ثابت ہے، البتہ مکمل کالا لباس پہننا ثابت نہیں، تاہم سیاہ لباس پہننے کی ممانعت کے حوالہ سے کوئی روایت بھی نہیں ملی، اس لیے فی نفسہ کالا لباس پہننا مرد و عورت دونوں کے لیے جائز ہے، لیکن اس زمانے میں خاص طور پر محرم کے مہینے میں کالے رنگ کا لباس پہننا روافض کا شعار بن چکا ہے، اس لیے جن ایام میں یہ لوگ سیاہ لباس پہنتے ہیں اس دوران اس طبقے کے ساتھ مشابہت سے بچنے کے لیے سیاہ لباس سے اجتناب لازم ہے، نیز فوتگی یا کسی غم کے موقع پر اظہارِ غم کے طور پر سیاہ لباس زیب تن کرنا بے اصل و بدعت ہے، جس سے اجتناب کرنا ضروری ہے۔ واللہ اعلم</p></p>",144004200518,banuri,"('حقوق و آدابِ معاشرت', 'huqooq-muashret')","('لباس / وضع قطع', 'libass-waza-qata')","('لباس ، احکام و آداب', 'libas-ahkam-o-aadab')"
05-12-2018,https://www.banuri.edu.pk/readquestion/میت-کو-غسل-دینے-کا-طریقہ-اور-غسل-دینے-والے-کا-بعد-میں-غسل-کرنا-2/05-12-2018,میت کو غسل دینے کا طریقہ اور غسل دینے والے کا بعد میں غسل کرنا,(1)میت کو غسل دینے کا طریقہ کیا ہے؟(2)کیا غسل دینے کے بعد آدمی کوغسل کرنا اور کپڑے تبدیل کر نا ضروری ہیں؟,"<p><p style=""text-align:justify;"">(1) میت کو غسل دینے کے لیے ،سب سے پہلے کسی تخت یا بڑے تختے کا انتظام کرلیں ، اس کو اگر بتی یا عود ، لوبان ، وغیرہ سے تین دفعہ یا پانچ دفعہ یا سات دفعہ چاروں طرف دھونی دے کر میت کو اس پر لٹادیں اور کوئی موٹا کپڑا ناف سے لے کر زانو تک اڑھاکر میت کے بدن سے کپڑے اتار لیں، (بایں طور کہ میت کا ستر بھی نہ کھلے اور کپڑا اتنا باریک نہ ہو کہ گیلا ہونے کے بعد ستر نظر آئے) پھر میت کو استنجا کرائیں ، لیکن اس کی رانوں اور شرم گاہ کو ہاتھ نہ لگائیں اور نہ اس پر نگاہ ڈالیں؛ بلکہ اپنے ہاتھ میں کوئی موٹا کپڑا لپیٹ لیں اور میت پر جو کپڑا پڑا ہے اس کے اندر ہاتھ ڈال کر استنجا کرائیں۔<br/>حدیث میں ہے کہ نبی کریم صلی اللہ علیہ وسلم نے حضرت علی رضی اللہ عنہ سے فرمایا کہ:<span class=""ar_writing"">’’ لا تبرز فخذک، ولا تنظر إلی فخذ حي ولا میت‘‘</span>( اپنی ران کسی کے سامنے نہ کھولو اور نہ کسی زندہ یا مردہ کی ران کی طرف نظرکر و )۔نیز حدیث میں ہے کہ حضرت نبی کریم صلی اللہ علیہ وسلم کے وصال کے بعد جب حضرت علی رضی اللہ عنہ نے آپ کو غسل دیا تو اپنے ہاتھوں پر کپڑا لپیٹ لیا تھا۔</p><p style=""text-align:justify;"">پھر  میت کو وضو کرائیں جیسے نماز کے لیے وضو کیا جاتا ہے ۔ رسول اللہ ﷺ کی صاحب زادی حضرت زینب رضی اللہ عنہا کا انتقال ہوا تو حضرت ام عطیہ رضی اللہ عنہا اور ان کے ساتھ کچھ خواتین نے غسل دیا، نبی کریم صلی اللہ علیہ وسلم نے ان کو حکم دیا کہ پہلے وضو کے اعضاء  سے غسل شروع کریں۔ مگر کلی کرانے اور ناک میں پانی ڈالنے کی ضرورت نہیں، ہاں اگر میت حیض ، نفاس یا جنابت کی حالت میں ہے تو کلی کرانا اور ناک میں پانی ڈالنا چاہیے، (اس کا طریقہ یہ ہے کہ نرم کپڑا یا روئی گیلی کرکے جس قدر سہولت سے ہوسکے منہ اور ناک کا اندرونی حصہ تر کردیا جائے)، پہلےچہرہ پھر کہنیوں سمیت ہاتھ دھلائیں پھر سر کا مسح کرائیں، پھر پیر دھلائیں اور کپڑے کو تر کرکے دانتوں کو صاف کریں اور ناک کے سوراخوں میں کپڑا پھیر دیں،ناک ، منہ اور کان میں روئی رکھ دیں؛ تاکہ پانی اندر نہ جانے پائے ، پھر سر کو صابن وغیرہ سے اچھی طرح دھودیں، پھر میت کو بائیں کروٹ پر لٹاکر بیری کے پتے ڈال کر، پکایا ہوا پانی نیم گرم، تین دفعہ سر سے پیر تک ڈالیں، یہاں تک کہ وہ پانی تخت کو لگے ہوئے میت کے جسم تک پہنچ جائے، پھر دا ہنی کروٹ پر لٹاکر ، اسی طرح تین مرتبہ پانی ڈالیں ، پھر میت کو کوئی شخص اپنے بدن سے ٹیک لگا کر بٹھائے اور پیٹ کو آہستہ آہستہ ملے اور دبائے، اگر نجاست نکلے تو اس کو صاف کردے ، پھر میت کو بائیں کروٹ پر لٹاکر، کافور پڑا ہوا پانی سر سے پیر تک تین دفعہ ڈالیں اور کسی صاف کپڑے سےبدن کو صاف کر دیں ۔</p><p style=""text-align:justify;"">حدیث میں ہے کہ حضرت نبی کریم صلی اللہ علیہ وسلم نے اپنی صاحب زادی رضی اللہ عنہا کے انتقال پر حضرت ام عطیہ رضی اللہ عنہا   اور ان کے ساتھ غسل دینے والے عورتوں کو حکم دیا کہ تین دفعہ یا پانچ دفعہ یا اس سے زیادہ اس کو غسل دو اور ہو سکے تو بیری کے پتوں اور پانی سے غسل دو اور آخری دفعہ کافور بھی اس میں ڈا ل دو۔</p><p style=""text-align:justify;"">(2) میت کو غسل دینے والے کے لیے میت کو غسل دینے کے بعد  خود بھی غسل کرنا ضروری نہیں، البتہ غسل کرنا مستحب ہے۔ اور اسی طرح بہتر ہے کہ کپڑے بھی تبدیل کرلے، تاہم اگر کپڑوں میں کوئی نجاست نہ ہو تو کپڑے تبدیل کرنے کی ضرورت نہیں۔ فقط واللہ اعلم</p></p>",144003200407,banuri,"('جنائز', 'janaiz')","('نماز جنازہ', 'namaz-e-jinazah')","('جنازہ اور نماز جنازہ کے احکام (فرائض، سنن، مستحبات، مکروہات)', 'janaza-or-namaz-e-janaza')"
30-12-2018,https://www.banuri.edu.pk/readquestion/ایک-مسجد-میں-دوسری-جماعت-کرانے-کا-حکم/30-12-2018,ایک مسجد میں دوسری جماعت کرانے کا حکم,ایک مسجد میں دوسری جماعت کر اسکتے ہیں؟جیسا کےدورانِ سفر میں،یا اپنے شہر پہنچ کر اپنی مسجد میں؟,"<p><p style=""text-align:justify;"">واضح رہے کہ محلہ کی وہ مسجد جس میں باقاعدہ امام و مؤذن مقرر ہو  ایسی مسجد میں ایک بار جماعت سے نماز ہوجانے کے بعد دوسری جماعت کرانا جائز نہیں ہے، البتہ راستہ کی وہ مسجد جس میں امام اور مؤذن مقرر نہ ہوں, وہاں دوسری جماعت کرانے میں حرج نہیں ہے۔فقط واللہ اعلم</p></p>",144004200355,banuri,"('نماز', 'salat')","('نماز کی جماعت', 'namaz-ki-jamat')","('جماعت / امامت', 'jamat-imamat')"
20-12-2018,https://www.banuri.edu.pk/readquestion/اولیاء-کرام-کے-مزارات-کی-زیارت-روحانی-فیوض-کے-حصول-کی-نیت-سے-کرنا/20-12-2018,اولیاء کرام کے مزارات کی زیارت روحانی فیوض  کے حصول کی نیت سے کرنا,کیا اولیاءِ کرام کے مزارات کی زیارت روحانی فیوض ورحمت کے حصول کی نیت سے کرنا جائز ہے؟نیز کسی ولی اللہ کی قبر کی زیارت کی بہترین نیت کیا ہوسکتی ہے؟,"<p><p style=""text-align:justify;"">قبروں کی زیارت یا اولیائے کرام کے مزارات پر  جانے کی بہترین نیت وہی ہےجس کا ان  احادیثِ مبارکہ میں اشارہ ملتا ہے جن میں آں حضرت ﷺ نے امت کو قبروں پر جانے کی ترغیب دی ہے، یعنی موت کی یاد اور آخرت کی یاد دہانی ملاحظہ ہو:</p><p style=""margin-left:0;margin-right:0;text-align:justify;"">حضرت ابو ہریرہ رضی اللہ عنہ سے مروی ہے کہ حضور نبی اکرم صلی اللہ علیہ وآلہ وسلم نے فرمایا :                                </p><p style=""margin-left:0;margin-right:0;text-align:justify;"">’’تم قبروں کی زیارت کیا کرو؛ کیوں کہ یہ موت کی یاد دلاتی ہے۔‘‘</p><p style=""margin-left:0;margin-right:0;text-align:justify;""><span class=""ar_writing"">1. مسلم، الصحيح، کتاب الجنائز، باب استئذان النبي صلي الله عليه وآله وسلم ربه عزوجل في زيارة قبر أمه، 2 : 671، رقم : 976<br/>
2. حاکم، المستدرک، 1 : 531، رقم : 1390<br/>
3. أحمد بن حنبل، المسند، 2 : 441، رقم : 9686</span></p><p style=""margin-left:0;margin-right:0;text-align:justify;"">2۔ حضرت انس بن مالک رضی اللہ عنہ سے روایت ہے کہ حضور نبی اکرم صلی اللہ علیہ وآلہ وسلم نے فرمایا :</p><p style=""margin-left:0;margin-right:0;text-align:justify;""><span class=""ar_writing"">""نَهَيْتُکُمْ عَنْ زِيَارَةِ الْقُبُوْرِ؛ فَزُوْرُوْهَا؛ فَإِنَّهَا تُذَکِّرُکُمُ الْمَوْتَ"".</span></p><p style=""margin-left:0;margin-right:0;text-align:justify;"">ترجمہ:’’میں نے تمہیں زیارتِ قبور سے منع کیا تھا، اب تم اُن کی زیارت کیا کرو؛ کیوں کہ وہ تمہیں موت کی یاد دلاتی ہے۔‘‘</p><p style=""margin-left:0;margin-right:0;text-align:justify;"">حاکم، المستدرک، 1 : 531، رقم : 1388</p><p style=""margin-left:0;margin-right:0;text-align:justify;"">3۔ حضرت بریدہ بن حصیب اسلمی رضی اللہ عنہ سے مروی ہے کہ حضور نبی اکرم صلی اللہ علیہ وآلہ وسلم نے فرمایا :</p><p style=""margin-left:0;margin-right:0;text-align:justify;""><span class=""ar_writing"">""قَدْ کُنْتُ نَهَيْتُکُمْ عَنْ زِيَارَةِ الْقُبُوْرِ، فَقَدْ أذِنَ لِمُحَمَّدٍ فِي زِيَارَةِ قَبْرِ أمِّهِ، فَزُوْرُوْهَا؛ فَإِنَّهَا تُذَکِّرُ الْآخِرَةَ"".</span></p><p style=""margin-left:0;margin-right:0;text-align:justify;"">روحانی فیوض کے حصول کے لیے اولیاء کے مزارات پر جانے کی فی نفسہ اجازت تو ہے، لیکن چوں کہ اس کا تعلق خواص سے ہے ، اس مسئلہ کی باریکیاں نہ سمجھنے کی وجہ سے  عوام کے غلط عقائد میں پڑ جانے کا خطرہ غالب ہے نیز اس بات کا اندیشہ ہے کہ ادب وتعظیم میں حدود سے تجاوز ہوکر مشرکانہ افعال یا اعتقاد اس کے ساتھ نہ مل جائیں؛ اس لیےاس مسئلے کو خواص تک محدود رکھاجائے۔  اور اس کی عمومی تشہیر و ترغیب سے اجتناب کیا جائے۔فقط واللہ اعلم</p></p>",144004200190,banuri,"('ایمان و عقائد', 'aqaed')","('اسلامی عقائد', 'islami-aqaed')","('روح، برزخ اور قبر کے احوال', 'qabr-o-aakhrat')"
27-12-2018,https://www.banuri.edu.pk/readquestion/نوافل-میں-قعدہ-اولی-کاحکم/27-12-2018,نوافل میں قعدہ اولی کاحکم,چار رکعت نفل نماز کی نیت کی، قعدہ اولیٰ نہیں کیا اور نہ سجدہ سہو کیا،  اس کی نمازکے متعلق حکم بیان کریں.نیز دو رکعت کے بعد(نفلوں میں) قعدہ فرض ہے یا واجب؟,"<p><p style=""text-align:justify;"">مذکورہ بالا صورت میں آخر میں سجدہ سہو کرلینا چاہیے تھا، اس صورت میں چاروں رکعت درست ہو جاتیں، لیکن سجدہ سہو نہ کرنے کی وجہ سے پہلی دو رکعت فاسد ہوگئیں، باقی اگلی دو رکعت درست ہوگئی ؛ اس لیے کہ نوافل میں ہر دو رکعت علیحدہ شمار ہوتی ہیں؛ اس لیے اگلی دو رکعتوں کی صحت پر اثر نہیں پڑے گا، وہ درست ہیں، باقی اگرچہ اس قاعدہ  کی رو سے قعدہ اولی کو فرض کہنا چاہیے تھا،لیکن قعدہ کے اعتبار سے فقہاء نے اس کو ایک ہی نماز شمار کیا ہے؛ اس لیے صحیح قول کے مطابق قعدہ اولی  فرض نہیں ہے۔</p><p style=""text-align:justify;""><span class=""ar_writing"">الدر المختار وحاشية ابن عابدين (رد المحتار) (1/ 458):</span></p><p style=""text-align:justify;""><span class=""ar_writing"">""(وضم) أقصر (سورة) كالكوثر أو ما قام مقامها، هو ثلاث آيات قصار ... (في الأوليين من الفرض) وهل يكره في الأخريين؟ المختار لا (و) في (جميع) ركعات (النفل)؛ لأن كل شفع منه صلاة.</span></p><p style=""text-align:justify;""><span class=""ar_writing""><span class=""ar_writing""> (قوله: </span>لأن كل شفع منه صلاة) كأنه والله أعلم لتمكنه من الخروج على رأس الركعتين، فإذا قام إلى شفع آخر كان بانياً صلاةً على تحريمة صلاة، ومن ثمة صرحوا بأنه لونوى أربعاً لايجب عليه بتحريمتها سوى الركعتين في المشهور عن أصحابنا، وأن القيام إلى الثالثة بمنزلة تحريمة مبتدأة، حتى أن فساد الشفع الثاني لايوجب فساد الشفع الأول، وقالوا: يستحب الاستفتاح في الثالثة والتعوذ، وتمامه في الحلية، وسيأتي أيضاً في باب الوتر والنوافل. قال ح: ولا ينافيه عدم افتراض القعدة الأولى فيه الذي هو الصحيح؛ لأن الكل صلاة واحدة بالنسبة إلى القعدة، كما في البحر عند قول الكنز: فرضها التحريمة"".</span>فقط واللہ اعلم</p></p>",144004200303,banuri,"('نماز', 'salat')","('سنن و نوافل', 'nawafil')","('سنن و نوافل', 'sunan-o-nawafi')"
08-12-2018,https://www.banuri.edu.pk/readquestion/بیوی-کو-یہ-میری-طرف-سے-فارغ-ہے-کہنے-کا-حکم-2/08-12-2018,"بیوی کو ""یہ میری طرف سے فارغ ہے"" کہنے کا حکم","میری اپنی بیوی کے ساتھ بحث ہو رہی تھی جس پر میں نے اپنی ماں اور بہن کے سامنے کہا کہ ""یہ میری طرف سے فارغ ہے""۔  مجھے یاد نہیں کہ کتنی بار یہ الفاظ کہے، اس واقعہ کو چھ ماہ ہو چکے ہیں ، اب میں گہرائی  سے سوچ رہا ہوں کہ کہیں اس سے طلاق تو نہیں ہوگئی؟دوسری بات یہ پوچھنی ہے کہ میری ایک کلیک ہے، جس سے میں بہت محبت کرتا ہوں اور ہم شادی کرنا چاہتے ہیں، مگر مسئلہ یہ ہے کہ وہ کہتی ہے کہ پہلی بیوی کو طلاق دے دوں، لیکن میں ایسا نہیں کرنا چاہتا کیوں کہ اسے طلاق دینے کا مطلب یہ ہوگا کہ میں اپنے بچوں کو بھی چھوڑ دوں جب کہ میں اپنے بچوں کو چھوڑنا نہیں چاہتا، میں کافی پریشانی کا شکار ہوں برائے کرم میری راہ نمائی فرمائیں!","<p><p style=""text-align:justify;"">1۔ صورتِ مسئولہ میں اگر سائل نے اپنی بیوی کو طلاق کی نیت سے "" یہ میری طرف سے فارغ ہے"" کہا تھا تو اس سے ایک طلاقِ بائن واقع ہوگئی ہے، رجوع جائز نہیں، البتہ باہمی رضامندی سے تجدیدِ نکاح کرنا جائز ہوگا، اور چوں کہ مذکورہ واقعہ چھ ماہ قبل ہوا ہے اس وجہ سے غالب یہی ہے کہ عدت مکمل ہوچکی ہے لہٰذا تجدیدِ نکاح کے بغیر میاں بیوی کی حیثیت سے رہنا جائز نہ ہوگا۔ </p><p style=""text-align:justify;"">تاہم اگر سائل نے طلاق کی نیت سے مذکورہ الفاظ نہیں کہے تھے تو ان الفاظ سے کوئی طلاق واقع نہیں ہوگی، اور دونوں کا نکاح بدستور قائم رہے گا۔</p><p style=""text-align:justify;"">اگر لفظ فارغ سے طلاق کی نیت نہ تھی مگر طلاق کی گفتگو کے وقت یہ الفاظ ادا کیے تھے توپھر بھی ایک طلاقِ بائن واقع ہوگئی ہے۔</p><p style=""text-align:justify;"">2۔ اگر آپ دونوں بیویوں کے درمیان نان و نفقہ رہائش کی فراہمی لباس و شب باشی و دیگر تمام معاملات میں برابری کرنے کی طاقت رکھتے ہوں تو اس صورت میں آپ کے لیے دوسرے نکاح کی اجازت ہوگی،  لیکن دوسری شادی جس خاتون سے کرنا چاہتے ہیں اس کا پہلی بیوی چھوڑنے کا مطالبہ کرنا شرعاً حلال نہیں، مناسب  طریقے سے شرعی حدود میں اسے سابقہ بیوی کی موجودگی میں نکاح پر آمادہ کریں۔ رسولِ اکرم صلی اللہ علیہ وسلم نے ایسا کرنے سے منع فرمایا ہے۔ جیساکہ صحیح البخاری و صحیح مسلم میں حضرت ابو ہریرہ رضی اللہ عنہ کی روایت میں ہے:</p><p style=""text-align:justify;""><span class=""ar_writing"">""عَنْ أَبِى هُرَيْرَةَ رضي الله عنه عَنِ النَّبِيِّ صلى الله عليه وسلم قَالَ : (لاَ يَحِلُّ لاِمْرَأَةٍ تَسْأَلُ طَلاَقَ أُخْتِهَا لِتَسْتَفْرِغَ صَحْفَتَهَا ، فَإِنَّمَا لَهَا مَا قُدِّرَ لَهَا"". رواه البخاري ( 4857 ) -واللفظ له - ومسلم ( 1413 )</span><br/>
 ترجمہ: نبی کریم صلی اللہ علیہ وسلم نے ارشاد فرمایا: کسی عورت کے لیے حلال نہیں ہے کہ وہ اپنی بہن (سوکن) کی طلاق کا مطالبہ کرے ۔۔۔"""" الخ</p><p style=""text-align:justify;"">اگر وہ اس پر آمادہ نہیں ہوتی، یا دوسرے نکاح کی صورت میں دونوں میں برابری قائم نہ رکھنے کا اندیشہ ہے تو آپ کے لیے دوسرے نکاح کی اجازت نہیں ہوگی، اور آپ کے لیے اجنبیہ لڑکی سے تعلق رکھنا بھی شرعاً درست نہیں ہوگا، ان حالات میں آپ کے لیے بہتر ہے کہ کسی قریبی مستند متبعِ سنت عالمِ دین سے اصلاح و مشورے کا تعلق قائم رکھیں۔ فقط واللہ اعلم</p></p>",144003200452,banuri,"('طلاق', 'talaaq')","('وقوع طلاق وعدم وقوع طلاق', 'wuqoo-e-talaq-o-adme-wuqoo-e-talaq')","('طلاق صریح اور کنائی', 'talaq-e-sarih-or-kinai')"
22-12-2018,https://www.banuri.edu.pk/readquestion/مغرب-کی-نماز-کب-تک-ادا-کی-جاسکتی-ہے/22-12-2018,مغرب کی نماز کب تک ادا کی جاسکتی ہے؟,مغرب کی نماز کا وقت کب تک ہوتا ہے؟  روشنی رہنے  تک پڑھ لیں، اس کے بعد قضا میں آجاتا ہے یا عشاء تک ہوتا ہے؟ جیسے ہر نماز کاوقت دوسری نماز تک ہوتا ہے؟,"<p><p style=""margin-left:0;margin-right:0;text-align:justify;"">مغرب کی نماز کا وقت سورج غروب ہوجانے کے بعد سے لے کر آسمان پر جو سرخی ہوتی ہے اس کے ختم ہونے کے بعد جو سفیدی آتی ہے، اس تک باقی رہتا ہے، اس کے فوراً بعد عشاء کی نماز کا وقت شروع ہوجاتا ہے۔</p><p style=""margin-left:0;margin-right:0;text-align:justify;"">باقی مغرب کی نماز جلدی یعنی سورج غروب ہوتے ہی فوراً پڑھنا افضل ہے، اور بلاعذر تاخیر کرنا مکروہ ہے، البتہ وقت ختم ہونے (شفقِ ابیض) سے پہلے پہلے پڑھنے سے نماز ادا شمار ہوگی۔</p><p style=""text-align:justify;"">نمازوں کے اوقات کے نقشوں میں  پروفیسر عبد اللطیف صاحب کا تیار کیا گیا نقشہ معتبر ہے، اس سے مدد لی  جاسکتی ہے،نیز ہماری ویب سائٹ کے سرِ ورق پر نمازوں کے اوقات کا نقشہ موجود ہے، اس میں مطلوبہ شہر کا نام منتخب کرکے جامعہ علوم اسلامیہ کے معیار کے مطابق تمام نمازوں کے اوقات معلوم کیے جاسکتے ہیں۔ فقط واللہ اعلم</p></p>",144004200234,banuri,"('نماز', 'salat')","('نمازوں کے اوقات', 'namazon-k-auqat')","('نمازوں کے اوقات', 'namazon-k-auqat')"
29-12-2018,https://www.banuri.edu.pk/readquestion/فرض-نماز-کی-تیسری-چوتھی-رکعت-میں-سورہ-فاتحہ-کے-بعد-سورت-پڑھ-لی/29-12-2018,فرض نماز کی تیسری چوتھی رکعت میں سورہ فاتحہ کے بعد سورت پڑھ لی,اگر کوئی  فرض نماز کی  تیسری  اور چوتھی رکعت میں یا صرف تیسری  رکعت میں فاتحہ کے ساتھ بھول کوئی سورت ملائی  تو کیا سجدہ سہو لازم ہے یا نہیں؟ اور اگر سورت پڑھتے ہوئےیاد آجائے تو کیا کرے؟,"<p><p style=""text-align:justify;"">صورتِ مسئولہ میں سجدہ سہو لازم نہیں ہوگا، البتہ فرض کی تیسری یا چوتھی رکعت میں فاتحہ کے بعد قصداً سورت نہیں پڑھی چاہیے۔</p><p style=""text-align:justify;""> نیز تیسری یا چوتھی رکعت میں سورت پڑھتے ہوئے جیسے احساس ہو وہیں قراء ت روک کر رکوع کرلے۔ فقط واللہ اعلم</p></p>",144004200327,banuri,"('نماز', 'salat')","('سجدہ سہو', 'sajda-sahv')","('سجدہ تلاوت / سجدہ سہو', 'sajda-tilawat-sajda-sahw')"
29-12-2018,https://www.banuri.edu.pk/readquestion/کیا-مرد-کڑھائی-والا-لباس-پہن-سکتا-ہے/29-12-2018,کیا مرد کڑھائی والا لباس پہن سکتا ہے؟,کیا مرد کڑھائی والے کپڑے پہن سکتے ہیں،  جو آج کل قمیص پر کوئی ڈیزائن بنے ہوتے ہیں؟  یا گلے اور آستین پر کوئی ڈیزائن بنے ہوتے ہیں یاگلے پر کڑھائی وغیرہ کی ہوتی ہے؟,"<p><p style=""text-align:justify;"">لباس کے سلسلہ میں اصل حکم یہ ہے کہ مرد کا لباس عورتوں کے لباس کے مشابہ نہ ہو اور نہ عورتوں کا لباس مرد کے لباس کے مشابہ ہو۔ نیز ایسا لباس نہ ہو جو غیر مسلموں کا شعار شمار ہوتا ہو۔ اسی طرح لباس کا ساتر ہونا (ستر چھپانے والا ہونا) اور چست نہ ہونا شرعاً  ضروری ہے، پس صورت مسئولہ میں ایسے کڑھائی یا ڈیزائن والے کپڑے جو عورتوں کے مشابہ نہ ہوں مردوں کے لیے پہننا شرعاً جائز ہے۔ فقط واللہ اعلم</p></p>",144004200345,banuri,"('حقوق و آدابِ معاشرت', 'huqooq-muashret')","('لباس / وضع قطع', 'libass-waza-qata')","('لباس ، احکام و آداب', 'libas-ahkam-o-aadab')"
