issued_at,link,title,question,answer,fatwa_number,dar_ul_ifta,kitab,bab,fasal
09-01-2019,https://www.banuri.edu.pk/readquestion/پرائز-بانڈ-اور-بیمہ-کا-حکم/09-01-2019,پرائز بانڈ اور بیمہ کا حکم,پرائز بانڈ کے ذریعے انعام میں جیتی گئی رقم کی شرعی حیثیت کیا ہے؟ نیز  انشورنس بیمہ پالیسی کروانا کیسا ہے؟,"<p><p style=""text-align:justify;"">1۔  پرائز بانڈ پر ملنے والا انعام درحقیقت سود ہوتا ہے جسے لینا شرعاّ جائز نہیں، اگر زائد رقم انعام کے نام پر وصول کرلی ہو تو ثواب کی نیت کے بغیر مستحقِ زکاۃ پر صدقہ کر نا ضروری ہوگا۔</p><p style=""text-align:justify;"">2۔ انشورنس یا بیمہ چوں کہ ’’جوا‘‘ اور ’’سود‘‘ پر مشتمل عقد ہے، اس وجہ سے ایسی کوئی بھی پالیسی حاصل کرنا شرعاً جائز نہیں۔ فقط واللہ اعلم</p></p>",144004200527,banuri,"('معاملات', 'muamlat')","('سود / بینکاری / انشورنس / شیئرز', 'sood-bankari-insurance-shares')","('بیمہ زندگی / انشورنس / تکافل', 'bima-zindagi-insurance-takaful')"
04-11-2018,https://www.banuri.edu.pk/readquestion/عورت-پر-نظر-پڑ-جانے-سے-وضو-کا-حکم/04-11-2018,عورت کا کوئی مستور عضو کھل جائے تو وضو کا حکم,اگر خواتین کا جسم نظر آ جائے، مثلاً: سر کے بال، ہاتھ یا پاؤں کے اوپر کا حصہ تو اس سے وضو ٹوٹ جاتا ہے یا نہیں؟,"<p><p style=""text-align:justify;"">عورت کے اعضاء ظاہر ہونے سے  نہ تو عورت کا وضو ٹوٹتا ہے، اور نہ ہی مرد کی نگاہ اس عضو پر پڑجانے سے اس کا وضو ٹوٹتاہے۔فقط واللہ اعلم</p></p>",144001200852,banuri,"('طہارت', 'taharat')","('وضو', 'wuzu')","('وضو،فرائض،سنن،آداب اور وضو توڑنے والی اشیاء', 'wuzo-faraidh-sunan-aadab-or-wuzo-tornay-wali-ashya')"
24-10-2018,https://www.banuri.edu.pk/readquestion/ویڈیو-کال-پر-بیوی-کا-جسم-دیکھنا/24-10-2018,ویڈیو کال پر بیوی کا جسم دیکھنا,میا ں بیوی اگر دور ہوں اور شوہر کا بہت دل کر رہا ہو تو وہ اور کسی عورت کے بجا ئے اپنے بیوی کو ویوڈیو کال کر کے اس کے سا تھ پیا ر کر سکتا ہے؟ویڈیو پر صرف اوپر کا جسم دیکھ کر اپنے آپ کو دوسری عورت کےپا س جا نے سے روک سکتا ہے ۔تو اس بات کی وضاحت کر دیں کہ ویڈیو کال کر کے شو ہر دوسرے گنا ہ سے بچ جا ئے تو اس با ت کی اجا زت اسلام دیتا ہے؟,"<p><p style=""text-align:justify;"">ویڈیو کال کرکے بیوی کے جسم کو دیکھنے کی  شرعاًاجازت نہیں ہے، اگر شوہر کےلیےدور رہ کر کام کرنا مشکل ہے تو یا بیوی کو اپنے پاس بلائے یا خود اپنے علاقہ میں محنت کرے۔ جب تک اس کے وسائل نہ ہوں تو کثرت سے روزے رکھے؛ تاکہ نفسانی خواہشات قابو میں رہٰیں، اور نیک لوگوں کی صحبت میں رہے؛ تاکہ گناہوں کی طرف دھیان نہ جائے۔فقط واللہ اعلم</p></p>",144001200687,banuri,"('متفرق کتب', 'mutafarriq-kutub')","('متفرق ابواب', 'mutafarriq-abwab')","('متفرق فصول', 'mutafarriq-fusool')"
23-09-2018,https://www.banuri.edu.pk/readquestion/پوسٹیج-اسٹامپ-کی-خرید-و-فروخت/23-09-2018,پوسٹیج اسٹامپ کی خرید و فروخت,کیا پوسٹیج  اسٹامپ بیچنا حلال ہے؟ کچھ لوگ قدیم اسٹامپ کے لیے بڑی بڑی قیمت دینے کو تیار ہوتے ہیں، مگر اکثر اسٹامپ پر جان دار کی تصویر ہوتی ہیں، کیا تصویر کے چھوٹی بڑی ہونے سے حکم میں کوئی فرق آئے گا؟,"<p><p style=""text-align:justify;"">’’پوسٹیج اسٹامپ‘‘  کی خرید و فروخت میں چوں کہ مقصود تصویر کا خریدنا نہیں ہوتا، بلکہ مقصدِ اصلی ڈاک ٹکٹ کی خرید و فروخت ہوتا ہے، اس وجہ سے اس کی خرید و فروخت کی گنجائش ہے، البتہ جہاں مقصد تصویر ہی کی خرید و فروخت ہو تو تصویر کے چھوٹے یا بڑے ہونے کی وجہ سے حکم میں کوئی فرق نہیں ہوگا۔</p><p style=""text-align:justify;"">شرح السیر الکبیر(لشمس الائمۃ السرخسی) میں ہے:</p><p style=""text-align:justify;""><span class=""ar_writing"">’’ أَلَا تَرَى أَنَّ الْمُسْلِمِينَ يَتَبَايَعُونَ بِدَرَاهِمِ الْأَعَاجِمِ فِيهَا التَّمَاثِيلُ بِالتِّيجَانِ، وَلَايَمْتَنِعُ أَحَدٌ عَنْ الْمُعَامَلَةِ بِذَلِكَ. وَإِنَّمَا يُكْرَهُ هَذَا فِيمَا يُلْبَسُ أَوْ يُعْبَدُ مِنْ دُونِ اللَّهِ مِنْ الصَّلِيبِ وَنَحْوِهَا‘‘. (٣/ ٢٣٣)</span></p><p style=""text-align:justify;"">کفایت المفتی میں ہے:</p><p style=""text-align:justify;"">’’با تصویر اشیاء،بچوں کے باجے اور بانسری وغیرہ کی خرید و فروخت کا حکم:</p><p style=""text-align:justify;"">""البتہ ایسی اشیاءجن میں تصویر کا خریدنا بیچنا مقصود نہ ہو ،جیسے دیا سلائی کے بکس کہ ان پر تصویر بنی ہوتی ہے،مگر تصویر کی بیع و شراءمقصود نہیں ہوتی تو ایسی چیزوں کا خریدنا بیچنا مباح ہو سکتا ہے""۔ (١١/ ۱۱۲/ ط:ادارۃالفاروق۔کراچی) فقط واللہ اعلم</p></p>",144001200213,banuri,"('معاملات', 'muamlat')","('بیع / تجارت', 'bay-tijarat')","('بیع صحیح ، فاسد اور باطل', 'bay-sahih-fasid-or-batil')"
15-11-2018,https://www.banuri.edu.pk/readquestion/جماعت-ثانیہ-کا-حکم/15-11-2018,مسجد میں جماعتِ ثانیہ کا حکم,ایک جماعت قبرستان سے واپس آرہی تھی ، راستے میں مسجد دیکھی اور سب نماز کے لیے رکے تو ایک بندے نے نماز پڑھائی جب کہ مسجد میں پہلے سے نماز ہوچکی تھی ، اب یہ دوبارہ جماعت کرانا کیسا ہے ؟ اور جن لوگوں نے نماز پڑھی ان کی نماز ہوئی یانہیں ؟,"<p><p style=""text-align:justify;"">جس مسجد میں پنج وقتہ نماز باجماعت  ادا کی جاتی ہو اور وہاں امام ومؤذن مقرر ہو  وہاں ایک جماعت ہوجانے کے بعد دوبارہ جماعت کرانا مکروہِ تحریمی ہے، مذکورہ صورت میں ان لوگوں کا دوبارہ جماعت  کرنا درست نہ تھا، ایسی صورت میں جماعت کا ثواب حاصل  کرنے کے لیے مسجد سے باہر جماعت کرالینی چاہیےتھی، البتہ وہ نماز ہوگئی، دہرانے کی ضرورت نہیں۔ فقط واللہ اعلم </p></p>",144003200098,banuri,"('نماز', 'salat')","('نماز کی جماعت', 'namaz-ki-jamat')","('جماعت / امامت', 'jamat-imamat')"
04-11-2018,https://www.banuri.edu.pk/readquestion/بالوں-کے-لیے-بلیچ-کریم-کا-استعمال/04-11-2018,بالوں کے لیے بلیچ کریم کا استعمال,بالوں کےلیے بلیج استعمال کرنا کیسا ہے مرد اور عورت دونوں کے لیے؟,"<p><p style=""text-align:justify;"">بالوں میں خالص سیاہ رنگ کے علاوہ باقی کلر کا استعمال جائز ہے، بشرط یہ کہ اس میں کوئی حرام اجزاء شامل نہ ہوں، اور بطورِ فیشن اور ریا ونمود نہ کیا جائے۔ خواتین کے لیے اس بات کا لحاظ بھی ضروری ہے کہ شوہر کی خاطر زینت ہو،  اورغیر محارم نہ دیکھیں ۔ فقط واللہ اعلم</p></p>",144001200856,banuri,"('حقوق و آدابِ معاشرت', 'huqooq-muashret')","('لباس / وضع قطع', 'libass-waza-qata')","('بالوں کے احکام و آداب', 'baloon-k-ahkam-o-aadab')"
02-11-2018,https://www.banuri.edu.pk/readquestion/احتلام-کی-حالت-میں-مسنون-دعائیں-اور-اذکار-کرنا/02-11-2018,احتلام کی حالت میں مسنون دعائیں اور اذکار کرنا,اگر احتلام ہو جائے تو اسی حالت میں کیا مسنون دعائیں اذکار کیے جا سکتے ہیں؟,"<p><p style=""text-align:justify;"">جنابت کی حالت میں تلاوتِ قرآنِ کریم کے علاوہ دیگر ذکر اذکار ،مسنون دعائیں پڑھی جاسکتی ہیں۔فقط واللہ اعلم</p></p>",144001200829,banuri,"('طہارت', 'taharat')","('حیض، نفاس، استحاضہ', 'hayz-nifas-istihaza')","('جنابت ، حیض اور نفاس کے احکام', 'janabat-hayz-or-nifas-k-ahkam')"
27-09-2018,https://www.banuri.edu.pk/readquestion/صمد-بونڈ-استعمال-کرنا/27-09-2018,صمد بونڈ استعمال کرنے اور اس کے ڈبے کی حفاظت کا حکم,"کیا ""صمد بونڈ""  استعمال کرکے اس کا ڈبہ حفاظت سے رکھنا چاہیے کہ اللہ تعالی کا نام ہے یا اس کو استعمال ہی نہ کریں؟","<p><p style=""text-align:justify;"">""صمد بونڈ""  کو استعمال کرنے میں کوئی حرج نہیں ہے۔  البتہ لفظ ’’صمد‘‘ کا احترام چاہیے، اسے مٹادیں یا کاٹ دیں وغیرہ(شامی 271-5)۔ فقط واللہ اعلم</p></p>",144001200289,banuri,"('متفرق کتب', 'mutafarriq-kutub')","('متفرق ابواب', 'mutafarriq-abwab')","('متفرق فصول', 'mutafarriq-fusool')"
01-10-2018,https://www.banuri.edu.pk/readquestion/سگریٹ-کا-کاروبارکرنےوالے-کی-دعوت-کھانا/01-10-2018,سگریٹ کا کاروبارکرنےوالے کی دعوت کھانا,سگریٹ کا کاروبار حرام ہے تو  کیا ایسا لوگوں کے گھر کھانا کھانا جائز ہے؟ جب کہ آپ جانتے ہیں کہ جن پیسوں سے دعوت کھلائی جارہی ہے وہ سگریٹ کے کاروبار سے آئی ہے؟,"<p><table align=""center"" cellpadding=""5"" cellspacing=""3"" style=""width:100%;""><tbody><tr><td colspan=""2""><p>سگریٹ کا کاروبار  حرام نہیں؛ لہذا اس  کی کمائی بھی حرام نہیں۔اگر سگریٹ کاکاروبار کرنے والا دعوت کرےتو اس کے گھر کھا نا کھانا بھی درست ہے۔</p><p><span class=""ar_writing"">الدر المختار وحاشية ابن عابدين (رد المحتار) (6/ 454):</span></p><p><span class=""ar_writing"">’’(قَوْلُهُ: وَصَحَّ بَيْعُ غَيْرِ الْخَمْرِ) أَيْ عِنْدَهُ خِلَافًا لَهُمَا فِي الْبَيْعِ وَالضَّمَانِ، لَكِنَّ الْفَتْوَى عَلَى قَوْلِهِ فِي الْبَيْعِ، وَعَلَى قَوْلِهِمَا فِي الضَّمَانِ إنْ قَصَدَ الْمُتْلِفُ الْحِسْبَةَ وَذَلِكَ يُعْرَفُ بِالْقَرَائِنِ، وَإِلَّا فَعَلَى قَوْلِهِ كَمَا فِي التَّتَارْخَانِيَّة وَغَيْرِهَا.</span></p><p><span class=""ar_writing"">ثُمَّ إنَّ الْبَيْعَ وَإِنْ صَحَّ لَكِنَّهُ يُكْرَهُ، كَمَا فِي الْغَايَةِ. وَكَانَ يَنْبَغِي لِلْمُصَنِّفِ ذِكْرُ ذَلِكَ قُبَيْلَ الْأَشْرِبَةِ الْمُبَاحَةِ‘‘. </span>فقط واللہ اعلم</p></td></tr></tbody></table></p>",144001200347,banuri,"('معاملات', 'muamlat')","('بیع / تجارت', 'bay-tijarat')","('بیع صحیح ، فاسد اور باطل', 'bay-sahih-fasid-or-batil')"
15-12-2018,https://www.banuri.edu.pk/readquestion/گزشتہ-جواب-کی-مزید-وضاحت/15-12-2018,طلاق سے متعلق سابقہ جواب کی مزید وضاحت,مسئولہ سوال جس کا حوالہ نمبر 144003200471 ہے، اس کے دیے گئے جواب میں برائے مہربانی مزید وضاحت فرما دیں .1: جو طلاق واقع ہو گی وہ ایک ہو گی یا تین؟2: اگرجس کو طلاق واقع ہوئی ہے تو کیا اسی سے تجدیدِ نکاح ہو گا یا اس کا کسی دوسرے مرد سے نکاح ضروری ہو گا ؟3: کیا ایک نکاح کے بعد طلاق واقع ہونے پر یہ شرط مکمل ہو گئی اور اب وہ اس شرط سے آزاد ہے کیا؟اور کہیں بھی شادی کر سکتا ہے کوئی طلاق واقع نہیں ہو گی؟,"<p><p style=""text-align:justify;"">1۔ مذکورہ صورتِ حال میں ایک طلاق واقع ہو گی۔</p><p style=""text-align:justify;"">2۔ محض تجدیدِِ نکاح کافی ہو گا، یعنی میاں بیوی کے درمیان مہر مقرر کرکے شرعی گواہان کی موجودگی میں نکاح ہوگا، کسی دوسرے مرد سے نکاح کرنا ضروری نہیں ہو گا۔</p><p style=""text-align:justify;"">3۔ جی ہاں! اب وہ کسی عورت سے بھی شادی کر سکتا ہے، کوئی طلاق واقع نہیں ہو گی۔ فقط واللہ اعلم</p></p>",144004200095,banuri,"('طلاق', 'talaaq')","('تعلیقِ طلاق (مشروط طلاق دینا)', 'talaq-ki-taleeq')","('طلاق کو معلق کرنا', 'talaq-ko-muallaq-karna')"
02-10-2018,https://www.banuri.edu.pk/readquestion/امام-سے-اخلتاف-کی-صورت-میں-اس-کے-پیچھے-نماز-پڑھنا/02-10-2018,امام سے اختلاف کی صورت میں اس کے پیچھے نماز پڑھنا,امام سے اختلاف کی صورت میں اس کے پیچھے نماز پڑھنا حلال ہے؟ جب کہ اختلاف  بغض کی حد تک ہو اور امام کو نکالنے کے درپے ہوں؟,"<p><p style=""text-align:justify;"">امام سے اگر مسئلے میں اختلاف ہوجائے خواہ امام کی غلطی ہو یا مقتدی کی، اس کے پیچھے پڑھی ہوئی نماز صحیح ہے، اس کو نہیں لوٹایا جائے گا۔</p><p style=""text-align:justify;"">لیکن مقتدیوں اور امام کے مابین اس نوعیت کا اختلاف ہونا بہت برا ہے۔ اگر اختلاف کی کوئی ٹھوس بنیاد نہ ہو  یا ذاتی بنیاد پر مقتدی اختلاف کریں اور امام کے پیچھے نماز نہ پڑھنا چاہیں تو پھر مقتدی لائقِ اصلاح ہیں، انہیں اپنے امام کی قدر  کرنی چاہیے۔  مقتدی غلطی پر ہوں اور وہ امام کے پیچھے نماز نہ پڑھنا چاہیں تو وہ گناہ گار ہوں گے۔</p><p style=""text-align:justify;"">اور اختلاف کی بنیاد مضبوط  ہو تو  اس کو حل کرنے کی کوشش کرنی چاہیے، نہ یہ کہ امام ہی کو نکالنے کی فکر کی جائے۔ اور اگر اختلاف کی واقعۃً کوئی شرعی وجہ ہو تو اہلِ علم کے ذریعہ امام کی اصلاح کی کوشش کرنی چاہیے۔ ایسی صورت میں جب کہ امام شرعاً غلطی پر ہو اور اکثر مقتدیوں کے نہ چاہتے ہوئے امامت کرے تو اس کے لیے یہ مکروہ ہے، تاہم مقتدیوں اور امام سب کی نماز ادا ہوجائے گی۔</p><p style=""text-align:justify;""><span class=""ar_writing"">’’و الأحق بالإمامة ... الأعلم بأحکام الصلاة...‘‘ الخ (در مختار)</span></p><p style=""text-align:justify;""><span class=""ar_writing"">’’و الخیار إلی القوم، فإن اختلفوا اعتبر أکثرهم، و لو قدموا غیر الأولی أساؤا بلا إثم‘‘. (در مختار)</span></p><p style=""text-align:justify;""><span class=""ar_writing"">’’صلی خلف فاسق أو مبتدع نال فضل الجماعة‘‘. (در مختار)</span></p><p style=""text-align:justify;""><span class=""ar_writing"">’’أفاد أن الصلاة خلفهما أولی من الانفراد، لکن لاینال کما ینال خلف تقي ورع‘‘. (شامي، ص:۵۴۵ ج:1)</span>فقط واللہ اعلم</p></p>",144001200364,banuri,"('نماز', 'salat')","('نماز کی جماعت', 'namaz-ki-jamat')","('جماعت / امامت', 'jamat-imamat')"
04-08-2018,https://www.banuri.edu.pk/readquestion/ےسی-sessi-ای-او-بی-آئی-فنڈز-eobi-کا-حکم/04-08-2018,سےسی (SESSI) ای او بی آئی فنڈز (EOBI)  کا  حکم,ہر فیکٹری والے کچھ رقوم ملازمین کی تنخواہ سے کاٹتے ہیں،  جیسے: سےسی (SESSI) ای او بی آئی فنڈز (EOBI) ان کا کیا حکم ہے؟,"<p><p style=""margin-left:0;margin-right:0;text-align:justify;"">(SESSI) حکومتِ سندھ کی زیر نگرانی   ایک سوشل سکیورٹی ادارہ ہے جس کا مقصد بیماری، ملازم  کی چوٹ، موت، معذوری وغیرہ کی صورت میں متاثر کارکنوں اور ان کے زیرِ کفالت افراد کو طبی دیکھ بھال اور نقدی انعامات وغیرہ ادا کرنا ہے۔ اس کے  متعین ہسپتال ہیں جہاں جاکر یہ ملازمین مفت علاج کراسکتے ہیں ۔</p><p style=""margin-left:0;margin-right:0;text-align:justify;"">اس کی آمدنی کے لیے کمپنیاں  خود اپنے ملازمین کے لیے کچھ رقم ہر ماہ جمع کراتی ہیں، اس میں کٹوتی ملازمین سے نہیں کی جاتی، بلکہ صرف ادارہ ہی کرتا ہے، اس کی مقدار  ہر ملازم کی تنخواہ کا 6 فیصد ہوتی ہے۔</p><p style=""margin-left:0;margin-right:0;text-align:justify;"">اس کا فقہی حکم یہ ہے کہ اگر یہ ادارہ کمپنیوں کی اس رقم کو کسی سودی سرمایہ کاری میں لگاکر اضافہ کرتا ہے، تو ان کا یہ عمل ناجائز ہے۔ لیکن چوں کہ ملازم کا اس طریقہ میں کوئی عمل دخل نہیں، لہذا اس  کے لیے اس کی سہولیات حاصل  کرنا جائز ہے۔</p><p style=""margin-left:0;margin-right:0;text-align:justify;"">(EOBI) حکومتِ پاکستان کی طرف سے پنشن اور بڑھاپے  کی انشورنس کی سہولت کے لیے قائم فنڈ کا ادارہ ہے جو ملازمین اور ان کے ورثاء کو ان کی سروس کی مدت کے مطابق پنشن و دیگر منفعت دیتا ہے۔کمپنیاں ملازمین کی تنخواہ میں سے کچھ پیسے کاٹ کر ڈالتی ہیں اور اپنی طرف سے بھی اتنا ہی اس میں دیتی ہیں۔اس رقم کی  انویسٹ منٹ  سودی  سرمایہ کاری  کے اداروں میں بھی کی جاتی ہے۔</p><p style=""margin-left:0;margin-right:0;text-align:justify;"">اس کا فقہی حکم بھی یہ ہے کہ سرمایہ  کاری کا مذکورہ طریقہ کار تو ناجائز ہے، لیکن اگر یہ کٹوتی جبری ہو ، ملازم کو اس میں اختیار نہ ہو تو  اس صورت میں جو منافع ملازمین کو ملتے ہیں ، جائز ہے۔</p><p style=""margin-left:0;margin-right:0;text-align:justify;"">مذکورہ اداروں کے تعارف اور طریقہ کار کی معلومات درج ذیل لنکس پر ملاحظہ کی جاسکتی ہیں۔ فقط واللہ اعلم</p><p style=""margin-left:0;margin-right:0;text-align:justify;"">(http://www.sessi.gov.pk)</p><p style=""margin-left:0;margin-right:0;text-align:justify;"">: (http://www.sessi.gov.pk/functions.htm)۔ http://www.sessi.gov.pk/cashbenefits.htm</p><p style=""margin-left:0;margin-right:0;text-align:justify;"">(http://www.eobi.gov.pk)</p><p style=""margin-left:0;margin-right:0;text-align:justify;""> http://www.eobi.gov.pk/introduction/Pension.html</p><p style=""margin-left:0;margin-right:0;text-align:justify;"">http://www.eobi.gov.pk/investment/Invest-one.jpg</p><p style=""margin-left:0;margin-right:0;text-align:justify;"">http://www.eobi.gov.pk/investment/Placement-T-Bills-Funds.pdf</p><p style=""margin-left:0;margin-right:0;text-align:justify;""> http://www.eobi.gov.pk/investment/ndx-eobi-inv.html </p><p style=""margin-left:0;margin-right:0;text-align:justify;"">: http://www.eobi.gov.pk/investment/Placement-T-Bills-Funds.pdf</p></p>",143909201696,banuri,"('معاملات', 'muamlat')","('سود / بینکاری / انشورنس / شیئرز', 'sood-bankari-insurance-shares')","('سودی فنڈز', 'soodi-funds')"
