issued_at,link,title,question,answer,fatwa_number,dar_ul_ifta,kitab,bab,fasal
10-09-2018,https://www.banuri.edu.pk/readquestion/پیشاب-سے-پہلے-سفید-قطرے-آنا/10-09-2018,پیشاب سے پہلے سفید قطرے آنا,چھوٹاپیشاب کرنے سے پہلے چند سفید قطرے آنے سے کیا مجھے بار بار غسل کرنا چاہیے؟ اور یہ قطرے کیوں آتے ہیں؟ طبِ نبوی میں اس کا علاج ہے تو مہربانی کرکے مجھے بتا دیں!,"<p><p style=""margin-left:0;margin-right:0;text-align:justify;"">پیشاب کے دوران یا اس سے پہلے آنے والےسفید قطرے  ودی کہلاتے ہیں۔ اس  سےغسل واجب نہیں ہوتا ۔ البتہ اگر شہوت کے ساتھ ہوں اور اچھل کر خروج ہوتو  پھر یہ منی ہے اس صورت میں غسل واجب ہوگا ۔ فقط واللہ اعلم</p></p>",143909202364,banuri,"('طہارت', 'taharat')","('نجاست اور اس سے پاکی', 'najasat-aur-us-ki-paki')","('نجاست سے پاکی', 'nijasat-aur-us-ki-paki')"
14-06-2018,https://www.banuri.edu.pk/readquestion/عدالت-خلع-و-طلاق/14-06-2018,عدالتی خلع و طلاق,فی زمانہ خلع کے کیس میں اگر شوہر بارہا کے عدالتی نوٹسز کے باوجود کسی بھی طور سے عدالت حاضر نہ ہو اور عدالت یک طرفہ کارروائی کرتے ہوئے بیوی کو طلاق دے تو کیا طلاق واقع ہو جائے گی؟  نیز اگر شوہر عدالت میں حاضر ہو اور عدالت مصالحت کرتے ہوئے شوہر کو بیوی کےساتھ رہنے کا مشورہ دے اور بیوی بھی ساتھ رہنے کے لیے تیار، لیکن شوہر بیوی کو نہ رکھنا چاہے تو پھر عدالت شوہر سے بیان لے، دونوں میں تفریق کروادے تو کیا ایسی طلاق ہو جائے گی، حال آں کہ شوہر نے عدالت میں طلاق نہ تو زبانی دی اور نہ تحریری؟,"<p><p style=""text-align:justify;"">خلع اور طلاق  دونوں ہی شوہر کا اختیار ہے اور وہی دے سکتا ہے، عدالت  شوہر کی رضامندی  کے بغیر خلع دینے یا طلاق دینے  کا اختیار نہیں رکھتی ۔</p><p style=""text-align:justify;"">البتہ اگر شوہر کی  جانب سے بیوی پر ظلم ہو  جیسے نفقہ وغیرہ نہ دینا اور بیوی اس کو گواہوں کے ذریعے ثابت کردے   تو مسلمان قاضی عدالت میں  اس کے خلاف  جدائیگی کا فیصلہ کرسکتاہے۔</p><p style=""text-align:justify;"">اگر شوہر بیوی کو نہیں رکھنا چاہتا اور وہ عدالت کو طلاق دینے کا وکیل بنا دیتاہے، تو وکالت کے احکام کی رعایت ہونے کی صورت میں عدالت طلاق واقع کرسکتی ہے۔لیکن عدالت کی جانب سے جاری کردی  کسی مخصوص ڈگری پر فتوی اسی وقت دیا جاسکتا ہے جب کہ عدالت کی کروائی اور اس کی ڈگری مفتی  کے سامنے ہو۔  فقط واللہ اعلم</p></p>",143909200787,banuri,"('طلاق', 'talaaq')","('خلع', 'hulaa')","('خلع کا ثبوت، حکمت اور اسباب', 'khula')"
22-05-2018,https://www.banuri.edu.pk/readquestion/ڈپازٹ-deposit-کےطور-پردی-ہوئ-رقوم-پر-زکوة/22-05-2018,ڈپازٹ (deposit)کےطور پردی ہوئی رقوم کا حکم اور ان پر زکات,ڈپازٹ (deposit)کےطور پردی ہوئی رقوم پر زکاۃ واجب ہے یا نہیں؟ ہمارے یہاں مکان کرایہ پر لینےکےوقت اگرمعتد بہ بڑی رقم ڈپازٹ(deposit) کےطورپر مالک مکان کو دیں تو کرایہ بڑی حد تک کم کر دیاجاتاہے.جب کرایہ داری ختم کریں گے تو وہ رقم کرایہ دار کو واپس مل جاتی ہے.اب سوال یہ ہے کہ ڈپازٹ (deposit)میں دی گئی ر قم سے کرایہ میں تخفیف کا فائدہ اٹھانا جائز ہے یا نہیں؟  ڈپازٹ (deposit)کی رقم مالک مکان کے ہاتھ  میں  امانت ہوگی یا دین ہوگی؟ جب  کہ مالک مکان ان رقوم کو خرچ کرتے ہیں  اور تجارت میں لگا کر منافع حاصل کرتے ہیں.یہ بات عرفاً معروف و مشہور بھی ہے کہ مالکِ مکان اس رقم کے تصرف کا مجازہے جب تک کرایہ داری ختم نہ ہو.مدلل جواب سے نوازیں! مہربانی ہوگی.دوسرا اہم سوال یہ ہے کہ  ڈپازٹ (deposit)کی رقم پر زکات واجب ہےیا نہیں؟  ایسے کرایہ دار کو زکات دینا جائز ہے یا نہیں جب کہ آمدنی بہت معمولی ہی رکھتا ہو تنگی کے ساتھ زندگی گزار رہاہو ؟مدلل جواب عنایت فرمائیں!,"<p><p style=""text-align:justify;"">  اگر کرایہ داری کے معاملہ میں کم کرایہ اس شرط کے ساتھ مشروط ہو کہ اتنی رقم قرض کے طور پر دی جائیگی تو یہ درحقیقت اجارہ کے معاملہ میں ایک فاسد شرط لگانا ہے،  جو کہ جائز نہیں۔</p><p style=""text-align:justify;"">البتہ اگر اس قسم کی شرط نہ لگائی گئی ہو اور ویسے ہی ایڈوانس رقم لی جائے جو کہ بسا اوقات اس نیت سے لی جاتی ہے کہ کرایہ دار املاک کو نقصان پہنچائے تو وصول کیا جاسکے تو یہ جائز ہے۔</p><p style=""text-align:justify;"">نیز اگر مالکِ مکان اگر چہ زیادہ ایڈوانس کی وجہ سے کرایہ کم کردیتا ہے؛ اس لیے کہ اس کے ہاتھ میں یک  مشت ایک بڑی رقم آجاتی ہے  اس نفع کی وجہ سے وہ کم کرایہ  پربھی راضی ہوجاتا  ہے،  جب معاملہ طے کرتے وقت ایک کرایہ اور ایک متعین ایڈوانس کی رقم طے ہوگئی تو  یہ معاملہ جائز ہے۔</p><p style=""text-align:justify;"">اس رقم کی عرفی  حیثیت انتہاءً قرض ہی کی ہے، اگر چہ اس کو ڈپازٹ کہا جاتا ہے، لیکن لینے والا اس کو بہر صورت استعمال کرنے  کا جواز سمجھتا ہے، نیز یہ رقم مدت ختم ہونے پر واپس کرنا لازم بھی سمجھا جاتا ہے۔لہذا اس پر قرض والے احکامات ہی جاری ہوں گے، یعنی اس کی زکاۃ مقرض (قرض دینے والے) پر ہی لازم ہوگی۔ اور اس کرایہ دار کی  کل  مالیت اس ایڈوانس کو ملا کر  زکاۃ کے نصاب کے برابر نہ بنتی ہو  تو اس کرایہ دار کو زکاۃ دے سکتے ہیں ورنہ نہیں۔</p><p style=""text-align:justify;""><span class=""ar_writing"">""و محل الفساد أیضاً فیما إذاکان الشرط مقارناً للعقد أي مذکوراً في صلبه، فلو ألحق الشرط الفاسد بالعقد، قیل: یلتحق عند الإمام، ص، وقیل: لا،  وهو الصحیح.</span></p><p style=""text-align:justify;""><span class=""ar_writing"">وقال الفاضل ابن عابدین في رد المحتار: ""و أشار أي صاحب التنویر بقوله: ولا بیع بشرط إلی أنه لا بد من کونه مقارناً للعقد؛ لأن الشرط الفاسد لو التحق بعد العقد، قیل: یلتحق عند أبي حنیفة، و قیل: لا، و هو الأ صح … ثم نقل عن جامع الفصولین أیضاً أنه لو ذکر البیع بلا شرط ثم ذکر الشرط علی وجه العدة جاز البیع ولزم الوفاء بالوعد؛ إذ المواعید قد تکون لازمةً، فیجعل لازماً لحاجة الناس اهـ و یظهر لي أنه متی وقع الشرط بعد العقد لایکون إلا علی وجه العدة، و حکمہ أنه یجب الوفاء به … وأنت علی علم بأن کلمتهم قد اتفقت أن الشرط إنما یکون مفسداً للعقد إذا کان مقارناً له، ولهذا قالوا: إنه لو باع مطلقاً، ثم أجل الثمن إلی أجل مجهول کالدیاس والقطاف صح التاجیل ولا یفسد البیع، مع أنه في حکم الشرط الفاسد، کما في رد المحتار"". بقی ما إذا ذکر الشرط قبل العقد ثم عقد خالیاً عن الشرط، و قد ذکره في الثامن عشر من جامع الفصولین حیث قال: شرطا شرطاً فاسداً قبل العقد، ثم عقدا لم یبطل العقد، و یبطل لو تقارن"". (شرح المجلة، ص 61 ج 2)</span></p><p style=""text-align:justify;""><span class=""ar_writing"">""هو فقیر وهو من له أدنی شيء، أي دون نصاب أو قدر نصاب. ومسکین من لا شيء له، فیحتاج إلی المسألة لقوته، وما یواري بدنه"". (تنویر الأبصار علی الدر المختار ۲؍۳۳۹ کراچی)</span> فقط واللہ اعلم</p></p>",143909200093,banuri,"('زکات', 'zakat')","('زکوٰۃ / صدقات', 'zakat-sadaqat')","('ادائے زکوٰۃ', 'adaye-zakat')"
23-06-2018,https://www.banuri.edu.pk/readquestion/مدرسہ-انتظامیہ-کا-داخلہ-کے-وقت-طلبہ-اور-ان-کے-سرپرستوں-سے-زکوۃ-کی-وصولی-اور-طلبہ-پر-خرچ-کرنے-کے-وکالت-نامہ-پر-دستخط-لینا/23-06-2018,مدرسہ انتظامیہ کا داخلہ کے وقت طلبہ اور ان کے سرپرستوں سے زکوۃ کی وصولی اور طلبہ پر خرچ کرنے کے وکالت نامہ پر دستخط لینا,مسئلہ یہ ہے کہ ہمارے ہاں ایک دینی مدرسہ ہے جب کسی کا داخلہ کیا جاتا ہے تو داخلہ فارم پر بچے اور اسکے سر پرست سے اس بات کے دستخط کرالئے جاتے ہیں کہ آپ ہمیں اس بات کا وکیل بناتے ہیں کہ مدرسہ میں جس قسم کے عطیات آئیں گے ہم آپ کے بچے پر خرچ کریں گے ۔پھر مدرسے والے بغیر تملیک بچوں پر خرچ کرتے ہیں کیا ہمارے زکوة فطرانہ مدرسہ میں دینے سے  ادا ہوجائیں گے؟,"<p><p style=""margin-left:0;margin-right:0;text-align:justify;""><span style=""background-color:#fff;""><span style=""color:#323232;""><span style=""color:#000;text-align:right;"">واضح رہے کہ سائل کے سوال کے دو پہلو ہیں: ایک یہ کہ مدارس میں زکوٰۃ اور فطرہ دینے سے وہ ادا ہوجاتاہے یا نہیں؟ اور دوسرا یہ کہ مدارس انتظامیہ کا تملیک کے بغیر صرف مذکورہ وکالت نامے کی بنیاد پر غیر مصارف میں زکوٰۃ صرف کرنا۔ پہلے سوال کا جواب یہ ہے کہ مدارس کے ذمہ داران طلبہ کے نمائندے اور وکیل ہیں لہٰذا ان کے پاس رقم جمع کراتے ہی زکوٰۃ دینے والوں کی زکوٰۃ ادا ہوجائے گی۔ البتہ ان کے لیے مذکورہ وکالت نامے کی بنیاد پر باقاعدہ تملیک کے بغیر زکوٰۃ و فطرے کی رقم کو غیر مصارف میں صرف کرنا جائز نہیں ہے۔</span></span></span></p><p style=""margin-left:0;margin-right:0;text-align:justify;""><span style=""background-color:#fff;""><span style=""color:#323232;"">تفصیل اس کی یہ ہے کہ زکوۃ کی ادائیگی کے درست ہونے کے لیے تملیک ضروری ہے، یعنی جس کو زکاۃ دی جا رہی ہو  اس کو اس چیز میں تصرف کرنے کا مکمل اختیار دے کر   مالک بنا دیا جائے، جب کہ مدرسہ میں داخلہ کے وقت داخلہ فارم پر بچے اور اس کے سرپرست سے  وصولی زکاۃ اور خرچ کے وکالت نامہ پر دستخط کرا لینے اور وکالت نامہ  کے ذریعہ مدرسہ کے مہتمم و منتظم کا طلبہ کا وکیل بن کر زکاۃ وصول کرنے کے بعد باقاعدہ طلبہ کو قبضہ دے کر مالک بنائے بغیر اپنے قبضہ کو طلبہ کے قبضہ  کے قائم مقام سمجھ کر ان پر خرچ کرنے میں چوں کہ تملیکِ زکاۃ کی  صورت نظر نہیں آتی؛ اس لیے اس طرح کا حیلہ کرنا جائز نہیں ہے، بلکہ ایسے حیلے پر مشتمل وکالت نامہ  (جس کے تحت وکیل کو وصولی زکاۃ و صدقہ اور ان کے خرچ کے اختیارات  حاصل ہوتے ہیں ) پر بے شمار فقہی اعتراضات وارد ہوتے ہیں اور بہت سی وجوہِ فاسدہ پائی جاتی ہیں جو کہ مندرجہ ذیل ہیں:</span></span></p><p style=""margin-left:0;margin-right:0;text-align:justify;"">۱)مدارسِ عربیہ کی بیشتر آمدنی (زکاۃ و صدقاتِ واجبہ وغیرہ) رمضان المبارک میں جمع ہوجاتی ہے، جب کہ طلبہ کا داخلہ شوال میں ہوتا ہے، تو وکالت نامہ پر دستخط تو بعد میں لیا جارہا ہے جب کہ زکاۃ وغیرہ کا بیشتر حصہ پہلے ہی سے مدرسہ کے فنڈ میں جمع ہو چکا ہوتا ہے، اس پر اشکال یہ ہے کہ وکالتِ لاحقہ یا اجازتِ لاحقہ وصول شدہ زکاۃ و صدقات کے وصول و خرچ کے لیے تملیک کا فائدہ کیسے دے سکتی ہے؟</p><p style=""margin-left:0;margin-right:0;text-align:justify;"">۲)اس طرح کے وکالت نامہ پر دستخط سے فقہی طور سے وکالت کا مفہوم اور روح نہیں پائی جاتی، کیوں کہ  مذکورہ وکالت نامہ میں نہ تو یہ تعیین ہوتی ہے کہ مہتممینِ مدرسہ یا انتظامیہ کتنی مقدارِ زکاۃ وصول کریں گے؟ جن افراد سے مالِ زکاۃ و صدقات وصول کیا جائے گا وہ افراد و اشخاص کون ہیں؟ اور کن کن مصارف میں کتنا کتنا خرچ کریں گے؟ تو اتنی جہالت پر مبنی توکیل ( وکالت نامہ اور اس پر دستخط) کیسے درست ہوگا؟</p><p style=""margin-left:0;margin-right:0;text-align:justify;"">۳)بذریعہ وکالت نامہ طلبہ کے نام پر زکاۃ و صدقات کی جو رقم وصول ہوگئی اس رقم میں سے جتنی خرچ ہونے کے بعد بچ جائے وہ ان طلبہ کی ملکیت ہوگی، لہٰذا اس رقم کے ختم ہونے سے پہلے جو طلبہ مدرسہ سے فارغ ہوکر جارہے ہوں وہ بقیہ رقم ان طلبہ کو واپس ملنی چاہیے، لیکن وہ واپس نہیں ملتی، بلکہ مدرسہ میں ہی رہ جاتی ہے،  اور اگر  وہ وکالت نامہ میں مدرسہ کو فاضل رقم کا مالک بھی بنا دیں تو اس پر یہ اشکال ہوگا کہ شے مجہول کی تملیک کیسے ہوگی؟ کیوں کہ وکالت نامہ پر دستخط کرتے وقت یہ بات معلوم ہی نہیں ہوتی کہ کتنی رقم وصول ہوگی؟ کتنی خرچ ہوگی؟ اور کتنی اس میں سے بچ جائے گی؟ اس لیے اس طرح کے مجہول  اجازت نامے اور وکالت نامے سے نہ تو تملیک ثابت ہوگی اور نہ ہی یہ حیلہ تملیک کے قائم مقام ہو سکتا ہے۔</p><p style=""margin-left:0;margin-right:0;text-align:justify;"">۴)طلبہ سے  جو  وکالت نامہ پر  دستخط کروا کر توکیل کروائی جاتی ہے وہ و جبر و اکراہ پر مبنی ہوتی ہے، دلیل اس کی یہ ہے کہ وکالت نامہ پر دستخط داخلہ کے وقت  داخلہ فارم پر کروائے جاتے ہیں اور جو طالب علم دستخط نہ کرے اسے مدرسہ میں داخلہ نہیں دیا جاتا، چناں چہ طالب علم چاہے یا نہ چاہے اسے داخلہ لینے کے لیے ہر حال میں وکالت نامہ پر دستخط کرنے پڑتے ہیں، جو کہ ایک قسم کا جبر و اکراہ ہوا، لہٰذا ایسے جبر و اکراہ پر مشتمل توکیل کے ذریعہ سے حاصل شدہ اختیار کی شرعاً  کیا حیثیت ہوگی ؟</p><p style=""margin-left:0;margin-right:0;text-align:justify;"">۵)اس طرح کے حیلہ بہانے کا سلسلہ نہ تو نبی کریم ﷺ کے زمانے میں تھا اور نہ بعد میں خیر القرون کے کسی دور میں تھا، بلکہ ہمارے اکابرین علمائے دیوبند (حضرت مولانا محمد قاسم نانوتوی رحمہ اللہ ، حضرت مولانا رشید احمد گنگوہی رحمہ اللہ، حضرت مولانا خلیل احمد سہارنپوری رحمہ اللہ، حضرت مولونا اشرف علی تھانوی رحمہ اللہ وغیرہ ) میں سے بھی کسی نے اس قسم کے خیالات کا کبھی تصور بھی نہیں کیا، بلکہ انہوں نے مدارسِ عربیہ کے لیے شدید مجبوری کے وقت جو حیلہ تملیک تجویز کیا ہے وہ تمام مدارسِ عربیہ میں سو سال سے زائد مدت سے جاری  و ساری ہے کہ مستحق طلبہ کو مالکانہ قبضہ دے کر ان سے  ان کے کھانے وغیرہ کا انتظام کرنے کے لیے  بطورِ توکیل واپس لے لیا جاتا ہے یا مدرسہ کے دیگر اخراجات میں خرچ کرنے کے لیے بطور چندہ مانگ لیا جاتا ہے، اس طرح زکاۃ کی شرطِ تملیک بھی پوری ہوجاتی ہے اور مستحق طلبہ اس حیلہ تملیک کے ذریعہ مدرسہ میں چندہ دینے کا ثواب بھی حاصل کر تے ہیں اور کوئی اور ذریعہ آمدن نہ ہونے کی صورت میں اس طرح کرنے سے مدرسہ کی ضروریات بھی پوری ہوجاتی ہیں۔</p><p style=""margin-left:0;margin-right:0;text-align:justify;"">خلاصہ یہ ہے کہ  باقاعدہ تملیک کیے بغیر صرف داخلہ کے وقت وکالت نامہ پر دستخط کرواکر زکاۃ کے مال کو طلبہ پر یا مدرسہ کی دیگر ضروریات پر خرچ کرنا درست نہیں ہے۔  (مستفاد از جواہر الفتاویٰ ( ج:۲<strong> / </strong> ۲۴۸ )</p><p style=""margin-left:0;margin-right:0;text-align:justify;""><span class=""ar_writing"">الدر المختار وحاشية ابن عابدين (رد المحتار) (2/ 344):</span></p><p class=""indent"" style=""margin-left:0;margin-right:0;text-align:justify;""><span class=""ar_writing"">""ويشترط أن يكون الصرف (تمليكاً) لا إباحةً، كما مر (لا) يصرف (إلى بناء) نحو (مسجد و) لا إلى (كفن ميت وقضاء دينه).</span></p><p class=""indent"" style=""margin-left:0;margin-right:0;text-align:justify;""><span class=""ar_writing"">وفي التمليك إشارة إلى أنه لا يصرف إلى مجنون وصبي غير مراهق إلا إذا قبض لهما من يجوز له قبضه كالأب والوصي وغيرهما، ويصرف إلى مراهق يعقل الأخذ، كما في المحيط قهستاني"".</span></p><p class=""indent"" style=""margin-left:0;margin-right:0;text-align:left;"">فقط واللہ اعلم</p></p>",143909200980,banuri,"('زکات', 'zakat')","('زکوٰۃ / صدقات', 'zakat-sadaqat')","('ادائے زکوٰۃ', 'adaye-zakat')"
11-05-2018,https://www.banuri.edu.pk/readquestion/مقروض-کو-زکاۃ-دینا-2/11-05-2018,بہن کو زکاۃ دینے کا حکم,ایک عورت کے پاس2 تولہ سونا ہے،  اور اس کے شوہر کے اوپر 6لاکھ کے قریب قرضہ ہے اور وہ قرضہ ادا کرنے کی حالت میں نہیں ہے اور وہ کاروبار چھوٹا سا کرتا ہے جس میں ان کا گزارا ہوتا ہے، شوہر کے پا س جو سامان ہے وہ تقریباً 80000کا ہے، عورت کے پاس سونا کے ساتھ خرچہ کے پیسے بھی ہوتے ہیں ،اب ایسی صورت میں اس عورت کو زکاۃ اس عورت کا اپنا بھائی دے یا کوئی اور دے تو زکا ۃ ادا ہوگی کہ نہیں؟,"<p><p style=""margin-left:0;margin-right:0;text-align:justify;"">خرچہ کے پیسے تو شوہر کے ہوتے ہیں؛ اس لیے خرچے کے پیسے  نکالنے کے بعد  اگر مذکورہ عورت کے پاس چھ تولہ سونے کے علاوہ ضرورت سے زائد مزید مال نہیں ہے تو اس کے لیے زکات وصول کرنا جائز ہے، اگر اس کا بھائی اس کو زکاۃ دے گا تو زکاۃ ادا ہو جائے گی۔ فقط واللہ اعلم</p></p>",143908200842,banuri,"('زکات', 'zakat')","('زکوٰۃ / صدقات', 'zakat-sadaqat')","('ادائے زکوٰۃ', 'adaye-zakat')"
06-09-2018,https://www.banuri.edu.pk/readquestion/وراثت-کی-تقسیم-6/06-09-2018,وراثت کی تقسیم,کیا فرماتے ہیں علماءِ کرام ومفتیانِ عظام اس مسئلے کے بارے میں کہ میری حقیقی والدہ فوت ہو چکی ہیں، والد نے دوسری شادی کرلی ہے،  اور اب میرے والد صاحب بھی فوت ہو گئے ہیں،کچھ اولاد پہلی والدہ سے  بھی ہے،اور کچھ اولاد سوتیلی والدہ سے  بھی۔آیا میراث میں میری حقیقی والدہ اور سوتیلی والدہ کا کتنا حصہ ہے؟,"<p><p style=""margin-left:0;margin-right:0;text-align:justify;"">چوں کہ آپ کی والدہ کا انتقال آپ کے والد کی حیات میں ہی ہوچکاتھا؛ اس لیے والد کے ترکہ میں مرحومہ والدہ کا حصہ نہیں ہے۔البتہ پہلی اہلیہ کی اولاد اور دوسری اہلیہ سے ہونے اولاد نیز دوسری اہلیہ (آپ کی سوتیلی والدہ)یہ  والد مرحوم کے ترکہ میں حصہ دار ہوں گے۔تمام ورثاء کی تعداد لکھ کر دوبارہ ترکہ کی تقسیم پوچھ لیں ۔فقط واللہ اعلم</p></p>",143909202285,banuri,"('معاملات', 'muamlat')","('وراثت / وصیت', 'wirasat-wasyat')","('ورثاء اور ان کے حصص', 'wurasa-or-un-k-hisas')"
