issued_at,link,title,question,answer,fatwa_number,dar_ul_ifta,kitab,bab,fasal
17-05-2018,https://www.banuri.edu.pk/readquestion/قرآن-پاک-میں-فی-سبیل-اللہ-کی-مراد/17-05-2018,قرآن پاک میں فی سبیل اللہ کی مراد,قران پاک میں جہاں بھی فی سبیل اللہ آیا ہے اس سے کیا مراد ہے?,"<p><p style=""text-align:justify;"">سوال انتہائی عمومی نوعیت کا ہے، آپ کا مقصد اس سے زکاۃ کے مصرف میں جو ''سبیل اللہ''  وارد ہوا ہے  وہ ہے یا دیگر اللہ کے راستہ کے جو فضائل بیان ہوئے ہیں وہ مراد ہے؟</p><p style=""text-align:justify;"">لفظ  '' فی سبیل اللہ'' ایک و سیع ا لمعنیٰ لفظ ہے ، دین کی خا طر اور اللہ تعا لیٰ کی ر ضا کے لیے جو محنت و مشقت کی جا ئے وہ اس کے مفہو م میں دا خل ہے، لہذا دین کے تما م شعبوں میں کا م کر نے وا لے افر اد اس کا مصد اق ہیں۔اور اس کے علاوہ دیگر قرآئن ، سیاق وسباق سے بھی اس کے مصداق و مفہوم میں فرق آتا ہے،  عام طور پر جب یہ مطلق بولا جائے تو اس سے  جہاد فی سبیل اللہ مراد ہوتا ہے۔</p><p style=""text-align:justify;"">البتہ زکاۃ کےباب میں دیگر نصوص کی بنا پر زکاۃ کے مصرف میں فقر اور تملیک کی قید بھی ملحوظ ہے،  اور اس باب  میں ''فی سبیل اللہ'' کے مفہوم میں حضرت امام ابوحنیفہ اور امام ابویوسف رحمہما اللہ نے صرف ''فقیرغازی''  کو داخل کیاہے، اور حضرت امام مالک  اورامام شافعی رحمہما اللہ نے غازی فقیر اور غازی غنی دونو ں کو داخل فرمایا ہے، لیکن غزاۃ کی شرط کے ساتھ مقید کیاہے، اور امام احمد بن حنبل ، اسحاق بن راہویہ اور امام محمد بن حسن شیبانی رحمہم اللہ کے نزدیک غازی کے ساتھ ساتھ محتاج حاجی بھی بنصِ حدیث داخل ہے ، اور صاحبِ درمختار نے محتاج غازی ، حاجی اور طالب علم کو بھی شامل فرمایا ہے، لیکن جہاں جہاں عمومیت کی  بات ہے وہاں فقرو احتیاج کی بھی قید ہے ۔</p><p style=""text-align:justify;""><span class=""ar_writing"">بدائع الصنائع في ترتيب الشرائع (2/ 45):<br/>
"" وأما قوله تعالى: ﴿ وَفِيْ سَبِيْلِ اللهِ ﴾ [التوبة: 60] عبارة عن جميع القرب، فيدخل فيه كل من سعى في طاعة الله وسبيل الخيرات إذا كان محتاجاً. وقال  أبو يوسف: المراد منه فقراء الغزاة ؛ لأن سبيل الله إذا أطلق في عرف الشرع يراد به ذلك، وقال محمد: المراد منه الحاج المنقطع ؛ لما روي: «أن رجلاً جعل بعيراً له في سبيل الله فأمره النبي صلى الله عليه وسلم أن يحمل عليه الحاج»، وقال الشافعي: يجوز دفع الزكاة إلى الغازي وإن كان غنياً.<br/>
وأما عندنا فلا يجوز إلا عند اعتبار حدوث الحاجة، واحتج بما روي عن أبي سعيد الخدري - رضي الله عنه - عن النبي صلى الله عليه وسلم أنه قال: «لا تحل الصدقة لغني إلا في سبيل الله أو ابن السبيل أو رجل له جار مسكين تصدق عليه فأعطاها له». وعن عطاء بن يسار عن النبي صلى الله عليه وسلم أنه قال: «لا تحل الصدقة إلا لخمس: العامل عليها، ورجل اشتراها، وغارم، وغاز في سبيل الله، وفقير تصدق عليه فأهداها إلى غني». نفى حل الصدقة للأغنياء واستثنى الغازي منهم، والاستثناء من النفي إثبات فيقتضي حل الصدقة للغازي الغني. ولنا قول النبي صلى الله عليه وسلم : «لا تحل الصدقة لغني»، وقوله  صلى الله عليه وسلم : «أمرت أن آخذ الصدقة من أغنيائكم وأردها في فقرائكم»، جعل الناس قسمين: قسماً يؤخذ منهم، وقسماً يصرف إليهم، فلو جاز صرف الصدقة إلى الغني لبطلت القسمة، وهذا لا يجوز.<br/>
وأما استثناء الغازي فمحمول على حال حدوث الحاجة، وسماه غنياً على اعتبار ما كان قبل حدوث الحاجة، وهو أن يكون غنياً ثم تحدث له الحاجة بأن كان له دار يسكنها ومتاع يمتهنه وثياب يلبسها وله مع ذلك فضل مائتي درهم حتى لا تحل له الصدقة، ثم يعزم على الخروج في سفر غزو فيحتاج إلى آلات سفره وسلاح يستعمله في غزوه ومركب يغزو عليه وخادم يستعين بخدمته على ما لم يكن محتاجاً إليه في حال إقامته، فيجوز أن يعطى من الصدقات ما يستعين به في حاجته التي تحدث له في سفره وهو في مقامه غني بما يملكه؛ لأنه غير محتاج في حال إقامته فيحتاج في حال سفره فيحمل قوله: «لا تحل الصدقة لغني إلا لغاز في سبيل الله» على من كان غنياً في حال مقامه فيعطى بعض ما يحتاج إليه لسفره لما أحدث السفر له من الحاجة إلا أنه يعطى حين يعطى وهو غني، وكذا تسمية الغارم غنياً في الحديث على اعتبار ما كان قبل حلول الغرم به وقد حدثت له الحاجة بسبب الغرم وهذا ؛ لأن الغني اسم لمن يستغنى عما يملكه وإنما كان كذلك قبل حدوث الحاجة فأما بعده فلا"".</span>فقط واللہ اعلم</p></p>",143908201039,banuri,"('علوم و فنون', 'uloom-funoon')","('متعلقات قرآن کریم', 'quran-kareem')","('ترجمہ و تفسیر ، تعارف اور اقسام', 'tarjama-o-tafseer-taaruf-aur-aqsaam')"
27-05-2018,https://www.banuri.edu.pk/readquestion/منکر-حدیث-کے-ساتھ-تعلقات-2/27-05-2018,منکر حدیث کے ساتھ تعلقات,"میرے ایک بہنوئی ہیں "" سید آصف""  جو کچھ عرصے سے ایسے دعوے کر رہے ہیں جو عقیدہ اہلِ سنت والجماعت سے نہیں ہیں۔ پانچ سال پہلے انہوں نے مجھے کچھ پوسٹ بھیجی تھیں جو انکارِ حدیث کا تاثر دے رہی تھیں۔ اس وقت انہیں سمجھانے کی کوشش کی گئی، لیکن وہ اپنی بات پر مصر رہے۔ بہر حال اس وقت ان سے رابطے ختم کردیے۔ اب پانچ سال بعد پھر سے اس شخص نے رابطہ کیا واٹس ایپ پر۔ اور اپنے نظریات کی طرف ببانگِ دھل دعوت دے رہا ہے ۔ اس کے دعوے درج ذیل ہیں:1) قرآن کریم ایک مکمل ضابطہ حیات کی کتاب ہے۔ احادیث اور فقہ سے احکام کا استدلال کرنا قرآن کا انکار کرنا ہے اور اس سے کفر کرنا ہے۔2) صرف انبیاء کی ذات ہر گناہ اور جھوٹ سے پاک ہے۔ اور باقی کسی کے بارے میں یہ نہیں کہا جاسکتا کہ اس نے زندگی میں کبھی کوئی گناہ نہ کیا ہو، کبھی جھوٹ نہیں کہا ہو۔تو پھر ان راویوں پر کس بات کا بھروسہ کیا جاسکتا ہے کہ انہوں نے صحیح قول نبی پہنچایا ہے۔3) قرآن کی حفاظت کا وعدہ اللہ نے اپنے ہی ذمے لیا ہے جب کہ باقی کسی بھی آثار ،حدیث، سنت کا ذمہ نہیں لیا۔4) امام بخاری و مسلم نے کئی لاکھ احادیث جمع کیں اور پھر خود کئی احادیث کو مسترد کردیا اور کچھ احادیث جو ان کے نظریے میں درست تھیں انہیں لے لیا۔5) سنیوں کے 4 امام اور شیعوں کے 12 امام سب کے سب ایرانی تھے۔ اس سے سازش کی بو نہیں آتی کیا؟6) اطیعو الرسول سے مراد قرآن ہی ہے ۔ احادیث سے مراد بھی صرف قرآن ہے کیوں کہ قرآن آپ صلی اللہ علیہ وسلم کے ہی منہ مبارک سے پہنچا۔ اس کے علاوہ کو حدیث سمجھنا درست نہیں۔یہ شخص ایک مبلغ ہے اس نے ایک بہت بڑا گروپ بنایا ہوا ہے واٹس ایپ پر ۔ پہلے اس پر عام وڈیوز اور آڈیوز بھیجتا ہے جو عام طور سب ہی ایک دوسرے کو بھیجتے ہیں صحت۔ انمول باتیں۔ سائنس وغیرہ کے بارے میں پھر جب لوگ بے خبر ہوتے ہیں تو یہ ان کی آہستہ آہستہ ذہن سازی کرتا ہے۔ مجھے بھی اس گروپ میں شامل کیا تھا، لیکن جب میں نے دیکھا کہ اس میں مرد و خواتین کا اختلاط ہے تو میں نے اس گروپ کو چھوڑدیا تھا۔ میرے چھوڑنے کے دو ہفتے بعد اس شخص نے مجھے ان باکس میں تبلیغ کرنا شروع کردی۔آپ حضرات سے سوال یہ ہے کہ اس شخص کے بارے کیا حکم ہے؟ اس کے ساتھ روابط جاری رکھنے کا کیا حکم ہے؟ اس کی بیوی کو شریعت کیا حکم دیتی ہے؟ جو لوگ اس کی حقیقت جان چکے، لیکن اس کے عقیدے کی پرواہ نہ کرتے ہوئے اس کے ساتھ میل ملاپ جاری رکھیں تو ایسے لوگوں کے بارے میں شریعت کا کیا حکم ہے؟ اور ایسے لوگوں کے ساتھ روابط رکھنے کا بھی کیا حکم ہے؟ برائے مہربانی راہ نمائی فرمائیں!","<p><p style=""margin-left:0;margin-right:0;text-align:justify;"">مذکورہ شخص خود بھی گم راہ ہے اور دوسروں کو بھی گم راہ کرنے کی کوشش میں لگا ہوا ہے؛ اس لیے  آپ کو اور اس کے دیگر متعلقین کو چاہیے کہ اس کے ساتھ کسی قسم کا کوئی رابطہ اور تعلق نہ رکھیں اور نہ ہی اس کی باتیں سنیں، ورنہ آپ لوگوں کے بھی گم راہ ہونے کا خطرہ ہے، دوسری بات یہ بھی ہے کہ اس طرح قطع تعلقی میں اس کی اس گم راہی سے نفرت کا بھی اظہار ہے جو کہ ایمان کا آخری درجہ ہے، البتہ اگر اس کو دعوت دینے اور سیدھے راستے کی طرف لانے کی نیت سے کوئی اس کے ساتھ تعلق رکھتا ہے ( بشرطیکہ وہ اس پر قادر بھی ہو اور خود اپنے گم راہ ہونے کا خطرہ بھی نہ ہو ) تو اس کی گنجائش بلکہ ضرورت ہے۔ البتہ غیر محرم سے اختلاط وروابط شرعاً ممنوع ہیں؛ لہٰذا آپ تو بہر صورت ان سے رابطہ نہ رکھیں، کوئی صاحبِ علم مرد ہی اصلاح وتبلیغ کی ذمہ داری ادا کرے۔</p><p style=""margin-left:0;margin-right:0;text-align:justify;"">اگر مذکورہ شخص نفسِ حدیث رسول ﷺ کے حجت ہونے کا ہی منکر ہے، یعنی وہ نبی ﷺ کی کہی ہوئی بات (حدیث) کو ہی حجت نہیں مانتا تو یہ شخص کافر ہے، اور اس کی بیوی کا اس کے ساتھ نکاح باقی نہیں رہے گا، لہٰذا اس کی بیوی کو اس سے فوراً علیحدہ ہو جانا چاہیے۔</p><p style=""margin-left:0;margin-right:0;text-align:justify;"">البتہ اگر مذکورہ شخص نفسِ حدیث کی حجیت کا منکر نہیں، بلکہ کتابوں میں موجود معتبر ذخیرہ احادیث پر شکوک و شبہات کا اظہار کرتا ہے اور ان احادیث کو مشکوک قرار دے کر ان کا انکار کرتا ہے تو پھر یہ شخص شریعت کی نظر میں فاسق وگم راہ ہے، لیکن چوں کہ مذکورہ عقیدہ کی بنیاد پر اس شخص کو کافر قرار نہیں دیا جا سکتا ہے؛ اس لیے اس کی بیوی کا نکاح ختم نہیں ہوگا، اس صورت میں اس کی بیوی کو چاہیے کہ اس کو سیدھے راستے پر لانے کی کوشش کرتی رہے، لیکن اگر اسے خود اپنے گم راہ ہونے کا ڈر پیدا ہو جائے تو وہ طلاق لے کر اس سے الگ ہوسکتی ہے۔ فقط واللہ اعلم</p></p>",143909200273,banuri,"('ایمان و عقائد', 'aqaed')","('باطل مذاہب اور فرقے', 'mazahib-masalik')","('منکرین حدیث', 'munkireen-e-hadees')"
25-05-2018,https://www.banuri.edu.pk/readquestion/کنڈے-چوری-کی-بجلی-استعمال-کرنا-2/25-05-2018,چوری کی بجلی استعمال کرنا,صورتِ مسئلہ یہ ہے کہ ہمارا کرائے کا گھر ہے جس میں تین چار ماہ پہلے تک سرکاری بجلی (میٹر ) لگا ہوا نہیں تھا،  تو ہمیں مالک مکان نے کنڈا لگا کر دیا تھا جس کا ہم کنڈا بل بھر رہے تھے جو کہ سرکار کے پاس نہیں جاتا، بلکہ کسی کنڈا مافیا کے پاس جاتا ہے،ابھی میٹر لگ گئے ہیں، مگر مالک مکان کہتا ہے کہ کم سے کم یونٹ استعمال کرو،  زیادہ تر کنڈے کی بجلی استعمال میں رکھو ،جب کہ کرایہ کے علاوہ کنڈا اور سرکاری بل دونوں ہمارے ذمے ہے ، سوال یہ ہے کہ اس بجلی کے استعمال کا حکم کیا ہے شرعاً ؟,"<p><p style=""margin-left:0;margin-right:0;text-align:justify;"">کنڈے اور چوری کی بجلی کا استعمال سراسر ناجائز اور حرام ہے،<span style=""background-color:#fff;""><span style=""color:#444;"">یہ جانتے ہوئے کہ یہ بجلی چوری کی ہے  پھر بھی اس کو استعمال کرنا ناجائزہے۔ حدیث شریف میں آتا ہے کہ جو شخص کسی مسروقہ ( چوری شدہ) چیز کو خریدے حال آں کہ وہ جانتا ہو کہ یہ چیز چوری کی ہے تو وہ عار اور گناہ میں اس چور کے ساتھ شریک ہو گیا۔بہرحال مالک کے کہنے پر کنڈے کی بجلی استعمال کرنا جائز نہیں ہے۔</span></span></p><p style=""margin-left:0;margin-right:0;text-align:justify;""><span class=""ar_writing""><span style=""background-color:#fff;""><span style=""color:#444;"">""عن أبي هریرة عن النبي ﷺ أنه قال: من اشتریٰ سرقةً و هو یعلم أنه سرقة فقد شرک في عارها و إثمها"". (المستدرک للحاکم، مکتبه نزار مصطفی الباز، بیروت</span></span><span style=""background-color:#fff;""><span style=""color:#444;"">۳/۸۵۲</span></span><span style=""background-color:#fff;""><span style=""color:#444;"">، رقم:</span></span><span style=""background-color:#fff;""><span style=""color:#444;"">۲۲۵۳)</span></span></span>فقط واللہ اعلم</p></p>",143909200221,banuri,"('متفرق کتب', 'mutafarriq-kutub')","('متفرق ابواب', 'mutafarriq-abwab')","('متفرق فصول', 'mutafarriq-fusool')"
