issued_at,link,title,question,answer,fatwa_number,dar_ul_ifta,kitab,bab,fasal
01-08-2018,https://www.banuri.edu.pk/readquestion/ہر-شخص-کو-اپنے-مال-میں-تصرف-کا-حق-حاصل-ہے/01-08-2018,باپ حکم دے کہ بیٹا اپنے مال میں تصرف نہیں کرسکتا,اگر ایک والد اپنے بیٹے کو کہے کہ تمہاری ہر چیز پر میرا حق ہے ، میرے حکم کے بغیر تم اپنے مال سے زمین جائیداد گاڑی وغیرہ نہیں خرید سکتے ۔کیا بیٹا اپنے مال سے زمین، جائیداد ، گاڑی وغیرہ  خریدے تو وہ باپ کی نافرمانی میں آجائے گا !,"<p><p style=""text-align:justify;"">شریعتِ مطہرہ نے ہر شخص کو اپنے مال میں تصرف کا پورا اختیار دیا ہے اور شرعی حدود میں رہتے ہوئے اپنی مرضی سے تصرف کی مکمل آزادی دی ہے، جیسا کہ شرح مجلۃ الأحکام میں ہے:</p><p style=""text-align:justify;""><span class=""ar_writing"">""كل يتصرف في ملكه كيف شاء"". ( رقم المادة: ١١٩٢)</span></p><p style=""text-align:justify;"">لہذا صورتِ مسئولہ میں اگر مذکورہ شخص عاقل بالغ ہے، اور کاروباری سمجھ بوجھ رکھتا ہے اور نفع نقصان کی تمیز کرسکتا ہے تو ایسی صورت میں وہ والدین کے حقوق کی ادائیگی کے ساتھ اپنے مال سے گاڑی یا گھر وغیرہ خرید سکتا ہے، بطورِ مشورہ اپنے والد کے مشورہ پر بھی عمل کرسکتا ہے، تاہم والد کا یہ کہنا کہ بیٹے کے مال و اسباب پر اس کا حق ہے اور اس کی مرضی کے بغیر بیٹا کچھ نہیں کرسکتا، شرعاً درست نہیں۔</p><p style=""text-align:justify;"">ملحوظ رہے کہ یہ جواب اس صورت میں ہے جب کہ مال و اسباب بیٹے کا ہی ہو والد کا نہ ہو۔ لیکن اگر اصل مال کا مالک والد ہی ہو اور بیٹا اس کا کاروبار چلارہاہو تو اس کی مرضی کے بغیر بیٹے کو کسی تصرف کا حق شرعاً نہیں ہوگا۔ فقط واللہ اعلم</p></p>",143909201640,banuri,"('معاملات', 'muamlat')","('بیع / تجارت', 'bay-tijarat')","('بیع صحیح ، فاسد اور باطل', 'bay-sahih-fasid-or-batil')"
12-08-2018,https://www.banuri.edu.pk/readquestion/قربانی-کا-وجوب-4/12-08-2018,ایک لاکھ سرمایہ ہونے کی صورت میں قربانی کا وجوب,"کیا فرما تے ہیں مفتیان کرام اس مسئلے کے بارے میں کہ :ایک شخص کا ذاتی کاروبار ہو جس کی مالیت 800,000 (آٹھ لاکھ) ہو, لیکن اس میں اس شخص کا سرمایہ صرف ایک لاکھ ہو. اور کاروبار سے آمدن ماہانہ 10000 ہو  تو آیا اس شخص پر قربانی واجب ہے?","<p><p style=""text-align:justify;"">سرمایہ اگر نقد کی صورت میں ہے یا مالِ تجارت کی صورت میں ہے تو اس پر قربانی واجب ہے, بشرطیکہ اس شخص پر اتنے قرض کی ادائیگی لازم نہ ہو کہ اسے سرمایہ سے منہا کر دینے سے سرمایہ کی مالیت ساڑھے باون تولہ چاندی کی قیمت  سے کم  ہو جائے۔</p><p style=""text-align:justify;"">اسی طرح اگر مذکورہ شخص کے پاس مالِ تجارت تو نصاب سے کم ہو لیکن ضرورت سے زائد اتنا مال یا سامان موجود ہے جس کی قیمت ساڑھے باون تولہ چاندی کی مالیت کے برابر ہو تو بھی اس پر قربانی واجب ہوگی۔ فقط واللہ اعلم</p></p>",143909201847,banuri,"('عبادات', 'ebadat')","('ذبیحہ / قربانی', 'zabiha-qurbani')","('قربانی ، وجوب اور عدم وجوب ، مستحبات و آداب', 'qurbani-wujoob-or-adm-e-wujoob-mustahabbat-o-aadab')"
12-06-2018,https://www.banuri.edu.pk/readquestion/بکرے-کے-سر-میں-رسولی-ہونے-کی-صورت-میں-عقیقہ-کا-حکم-2/12-06-2018,بکرے کے سر میں رسولی ہونے کی صورت میں عقیقہ کا حکم,اگر کسی بکرےکےسرمیں رسولیاں ہوں اوروہ ان کی وجہ سےبےہوش بھی ہوجاتاہو، اگرچہ تھوڑی دیر بعد خودہی ہوش میں بھی آجاتاہو ایسےجانورکاعقیقہ درست ہےیانہیں؟,"<p><p style=""text-align:justify;"">صورتِ مسئولہ میں مذکورہ بکرے کو عقیقہ میں ذبح کرنا شرعاً درست ہے۔</p><p style=""text-align:justify;""><span class=""ar_writing"">""کل عیب یزیل المنفعة علی الکمال أو الجمال علی الکمال یمنع الأضحیة، ومالایکون بهذه الصفة لایمنع"". (الهندیة، 300/5)</span><span class=""ar_writing""></span>فقط واللہ اعلم</p></p>",143909200732,banuri,"('عبادات', 'ebadat')","('ذبیحہ / قربانی', 'zabiha-qurbani')","('عقیقہ اور اس کے احکام', 'aqiqa-or-us-k-ahkam')"
28-05-2018,https://www.banuri.edu.pk/readquestion/گزشتہ-سالوں-کا-صدقہ-فطر-کس-اعتبار-سے-ادا-کیا-جائے-2/28-05-2018,گزشتہ سالوں کا صدقہ فطر کس اعتبار سے ادا کیا جائے؟,1995 سے 2010  تک فطرہ کی رقم کیا تھی؟,"<p><p style=""margin-left:0;margin-right:0;text-align:justify;"">اگر آپ گزشتہ سالوں کے فطرے کی رقم اس لیے معلوم کررہے ہیں کہ ان سالوں کے فطرے کی ادائیگی نہیں کی اور اب کرنا چاہ رہے ہیں توصدقہ فطر کی ادائیگی میں آج کی قیمت کا اعتبار ہوگا، گزشتہ سالوں کی قیمت کا لحاظ نہیں ہوگا۔لہذا آپ اس  سال  کی رقم کے اعتبار سے گزشتہ سالوں کا فطرہ اداکریں۔</p><p style=""margin-left:0;margin-right:0;text-align:justify;""><span class=""ar_writing"">الدر المختار مع رد المحتار (2/ 285):</span></p><p style=""margin-left:0;margin-right:0;text-align:justify;""><span class=""ar_writing"">""(وجاز دفع القيمة <span style=""color:#000;"">في زكاة وعشر وخراج وفطرة ونذر وكفارة غير الإعتاق) وتعتبر القيمة يوم الوجوب، وقالا: يوم الأداء. وفي السوائم يوم الأداء إجماعا، وهو الأصح، ويقوم في البلد الذي المال فيه ولو في مفازة ففي أقرب الأمصار إليه، فتح"".</span></span></p><p style=""margin-left:0;margin-right:0;text-align:justify;""><span class=""ar_writing"">الفتاوى الهندية (1/ 192):</span></p><p style=""margin-left:0;margin-right:0;text-align:justify;""><span class=""ar_writing"">""وإن أخروها عن يوم الفطر لم تسقط، وكان عليهم إخراجها، كذا في الهداية"".</span> فقط واللہ اعلم</p></p>",143909200324,banuri,"('زکات', 'zakat')","('زکوٰۃ / صدقات', 'zakat-sadaqat')","('صدقۃ الفطر', 'sadaqa-tul-fitr')"
25-10-2018,https://www.banuri.edu.pk/readquestion/عرس-میں-شرکت/25-10-2018,عرس میں شرکت کا حکم,کیا اللہ کے ولی کے عرس میں شرکت جائز ہے؟,"<p><p style=""text-align:justify;"">واضح رہے کہ رسولِ اکرم صلی اللہ علیہ وسلم نے قبروں پر میلہ دھیلہ کرنے اور قبر پرستی سے منع فرمایا ہے، یہاں تک کہ اپنی قبر مبارک پر بھی میلہ کرنے سے سختی سے منع فرمایا ہے؛ لہذا جب نبی اکرم صلی اللہ علیہ وسلم کے روضہ مبارک پر عرس یا میلہ کرنا ممنوع ہے تو کسی امتی (خواہ وہ ولی اللہ ہو) کی قبر پر عرس کی اجازت کیسے ہوسکتی ہے! </p><p style=""text-align:justify;"">لہذا صورتِ مسئولہ میں مروجہ عرس بدعت ہے اور بدعت کا حصہ بننا شرعاً جائز نہیں۔<span class=""ar_writing"">مرقاة المفاتيح شرح مشكاة المصابيح:</span></p><p style=""text-align:justify;""><span class=""ar_writing"">"" 926 - وعنه ، قال : سمعت رسول الله صلى الله عليه وسلم يقول : "" لا تجعلوا بيوتكم قبوراً ، ولا تجعلوا قبري عيداً ، وصلّوا علي ، فإنّ صلاتكم تبلغني حيث كنتم "". رواه النسائي .</span></p><p style=""text-align:justify;""><span class=""ar_writing"">( "" ولا تجعلوا قبري عيداً "" ): هو واحد الأعياد ، أي : لا تجعلوا زيارة قبري عيداً ، أو لا تجعلوا قبري مظهر عيد، فإنه يوم لهو وسرور، وحال الزيارة خلاف ذلك، وقيل: محتمل أن يكون المراد الحث على كثرة زيارته، ولايجعل كالعيد الذي لايأتي في العام إلا مرتين. قال الطيبي: نهاهم عن الاجتماع لها اجتماعهم للعيد نزهةً وزينةً، وكانت اليهود والنصارى تفعل ذلك بقبور أنبيائهم، فأورثهم الغفلة والقسوة، ومن عادة عبدة الأوثان أنهم لايزالون يعظمون أمواتهم حتى اتخذوها أصناماً ، وإلى هذا أشار لقوله: "" اللّٰهم لا تجعل قبري وثناً يعبد ""، فيكون المقصود من النهي كراهة أن يتجاوزوا في قبره غاية التجاوز، ولهذا ورد: "" اشتدّ غضب الله على قوم اتخذوا قبور أنبيائهم مساجد"".</span>فقط واللہ اعلم</p></p>",144001200707,banuri,"('ایمان و عقائد', 'aqaed')","('بدعات اور رسوم', 'bidaat-rasoomat')","('بدعت اور اس کی اقسام', 'bidaat-aur-us-ki-aqsaam')"
26-10-2018,https://www.banuri.edu.pk/readquestion/ٹیٹو-بنوانے-کا-کیا-حکم-ہے-اور-ٹیٹو-کے-ساتھ-نماز-ہوجاتی-ہے/26-10-2018,ٹیٹو بنوانے کا کیا حکم ہے؟ اور ٹیٹو کے ساتھ نماز ہوجاتی ہے؟,اسلام میں ٹیٹو بنوانے کا کیا حکم ہے؟ کیا اس کے بنوانے پہ نماز نہیں پڑھی جا سکتی؟ کیا اسلام میں جسم پہ ٹیٹو بنوانا حرام ہے؟,"<p><p style=""text-align:justify;"">صورتِ مسئولہ میں جسم کے کسی حصہ پر ٹیٹو بنوانا شرعاً حرام اور گناہِ کبیرہ ہے، اور ٹیٹو بنانے اور بنوانے والوں پر اللہ رب العزت کی جانب سے لعنت کی گئی ہے، جیساکہ صحیح البخاری میں ہے:</p><p style=""text-align:justify;""><span class=""ar_writing"">""عن ابن عمر -رضي الله عنه- عن النبي صلّى الله عليه وسلّم، حيث قال: لعَنَ اللَّهُ الواصلةَ والمُستوصِلةَ، والواشمةَ والمُستوشِمة"". ( رواه البخاري، عن عبد الله بن عمر، الرقم: 5937)</span></p><p style=""text-align:justify;""><span class=""ar_writing"">""المنهاج شرح صحیح مسلم بن الحجاج""</span>میں ہے:<span class=""ar_writing""></span></p><p style=""text-align:justify;""><span class=""ar_writing"">"" الوشم وهي أن تغرز إبرة أو مسلة أو نحوهما في ظهر الکف أو المعصم أو الشفة أو غیر ذلک من بدن المرأة حتی یسیل الدم، ثم تحشو ذلک الموضع بالکحل أو النورة فیخضر ... فإن طلبت فعل ذلک بها فهي مستوشمة، وهو حرام علی الفاعلة والمفعول بها باختیارها والطالبة له ... وسواء في هذا کله الرجل والمرأة . والله أعلم"". (۷/۲۳۱ ، کتاب اللباس والزینة ، باب تحریم فعل الواصلة والمستوصلة والواشمة والمستوشمة ، تحت الرقم :۲۱۲۵)</span></p><p style=""text-align:justify;"">لہذا صورتِ مسئولہ میں جسم پر ٹیٹو بنانے کی قطعاً اجازت نہیں ہے، اور اگر کسی نے جسم پر ٹیٹو بنوا رکھے ہوں تو اسے چاہیے کہ وہ اللہ کے حضور سچے دل سے توبہ کرے، اور اگر اسے زائل کرنا ممکن ہو تو  بذریعہ علاج جسم سے اسے ختم کروائے، جیساکہ ""فتح الباری شرح صحیح البخاری"" میں ہے:</p><p style=""text-align:justify;""><span class=""ar_writing"">""إلا بالجرح فإن خاف منه التلف، أو فوات عضو، أو منفعة عضو، أو حدوث شين فاحش في عضو ظاهر، لم تجب إزالته وتكفي التوبة في هذه الحالة، وإن لم يخف شيئاً من ذلك ونحوه لزمه إزالته ويعصي بتأخيره، وسواء في ذلك كله الرجل والمرأة"". ( ١٠/ ٣٧٢)</span></p><p style=""text-align:justify;""><span class=""ar_writing"">""يستفاد مما مرّ حكم الوشم في نحو اليد، وهو أنه كالاختضاب أو الصبغ المتنجس؛ لأنه إذا غرزت اليد أو الشفة مثلاً بإبرة، ثمّ حشي محلها بكحل أو نيلة ليخضر، تنجس الكحل بالدم، فإذا جمد الدم، والتأم الجرح بقي محله أخضر، فإذا غسل طهر؛ لأنه أثر يشق زواله؛ لأنه لايزول إلا بسلخ الجلد أو جرحه، فإذا كان لايكلف بإزالة الأثر الذي يزول بماء حار أو صابون فعدم التكليف هنا أولى. وقد صرح به في القنية فقال: ولو اتخذ في يده وشماً لايلزمه السلخ ..."" الخ (ردالمحتار على الدر المختار، كتاب الطهارة، باب الأنجاس، مطلب في حكم الوشم، (1/330) ط: سعيد)</span></p><p style=""text-align:justify;"">رہی بات نماز کی تو ٹیٹو کے ساتھ نماز ہوجاتی ہے ، البتہ جان دار کی شکل ہونے کی صورت میں کراہت کے ساتھ ادا ہوگی۔ فقط واللہ اعلم</p></p>",144001200720,banuri,"('نماز', 'salat')","('مکروہاتِ نماز', 'makrohat-e-namaz')","('مکروہات نماز', 'makrohat-e-namaz')"
27-10-2018,https://www.banuri.edu.pk/readquestion/e-code-کیا-ہیں/27-10-2018,E code کیا ہیں؟,Ecodeکی حقیقت کیا ہے ؟,"<p><p style=""text-align:justify;"">کھانے پینے کی اشیاء کے اجزائے ترکیبی کی پہچان کے لیے ہر جز کے لیے مخصوص کوڈ عالمی سطح پر وضع کیے گئے ہیں، انہیں ""ای کوڈ"" کہا جاتاہے۔اب ان کو وضع کیوں کیا گیا ہے، مقاصد کیا ہیں  اور طریقہ کار کیا ہے یہ بات تو وضع کرنے  والا ادارہ بتاسکتا۔</p><p style=""text-align:justify;"">البتہ اگر مخصوص کوڈ کا شرعی حکم معلوم کرنا ہو تو اس کی تفصیل لکھ بھیجیں۔ فقط واللہ اعلم</p></p>",144001200727,banuri,"('متفرق کتب', 'mutafarriq-kutub')","('متفرق ابواب', 'mutafarriq-abwab')","('متفرق فصول', 'mutafarriq-fusool')"
07-09-2018,https://www.banuri.edu.pk/readquestion/دوراں-حج-شوہر-کے-انتقال-کی-صورت-میں-عدت-کا-حکم/07-09-2018,دورانِ حج شوہر کے انتقال کی صورت میں عدت کا حکم,زوجین حج کرنے گئے اور دورانِ حج شوہر کا انتقال ہوگیا تو اب بیوی کی عدت کا کیا حکم ہے؟ اور روضہ اقدس پے حاضری دے سکتی ہے یا نہیں؟ جواب باحوالہ مطلوب ہے!,"<p><p style=""margin-left:0;margin-right:0;text-align:justify;"">اگر کوئی عورت اپنے محرم کے ساتھ سفرِ حج کے لیے روانہ ہو اور راستے میں اس کے محرم کا انتقال ہو جائے تو اس کی مختلف صورتیں ہو سکتی ہیں:</p><p style=""margin-left:0;margin-right:0;text-align:justify;""> اگر یہ حادثہ ایسی جگہ پیش آیا ہے کہ  اس عورت اور مکہ کے درمیان مسافتِ سفر باقی ہو یعنی 48 میل سے زائد کا سفر ہو تو ایسی عورت کے لیے حکم یہ ہے کہ وہ اپنے گھر واپس آ جائے اور سفرِ حج جاری نہ رکھے۔</p><p style=""margin-left:0;margin-right:0;text-align:justify;"">اگر یہ حادثہ ایسی جگہ پیش آیا کہ مکہ مکرمہ وہاں سے مسافتِ سفر سے کم ہے ، اور اس کا گھر مسافتِ سفر پر واقع ہے ، تو اس کو چاہیے کہ مکہ کی طرف اپنا سفر جاری رکھے ، اور اپنے افعالِ حج پورے کر لے۔</p><p style=""margin-left:0;margin-right:0;text-align:justify;"">اوراگر شوہرکا انتقال مدینہ منورہ میں ہوا تو اصل مسئلہ یہ ہے کہ یہ خاتون مدینہ منورہ ہی میں اپنی عدت پوری کرے اور حج کو نہ جائے؛ کیوں کہ یہ عدت میں ہے، لیکن اگر خاتون کے لیے مدینہ منورہ میں عدت گزارنے کا کوئی انتظام نہ ہو سکے اور اتنی مدت تک ٹھہرنے کی قانوناً اجازت نہ ہو تو اس اضطراری صورت میں بدرجہ مجبوری اس کو اپنے قافلے کے ساتھ مکہ مکرمہ جانے اور افعال حج ادا کرنے کی اجازت ہو گی، پھر یہ خاتون ارکانِ حج ادا کرے گی؛ کیوں کہ مکہ مکرمہ پہنچنے سے پہلے (جب کہ مکہ مکرمہ مسافتِ سفرسے کم ہو)اس کو ارکانِ حج ادا کرنے کے لیےمکہ مکرمہ جانے کی اجازت ہے تو مکہ مکرمہ پہنچنے کے بعد بدرجہ اولی اجازت ہوگی ، اور حج سے فارغ ہونے کے بعد اس کو  مکہ مکرمہ ہی میں اپنے قیام گاہ پر عدت گزارنی ہو گی ۔ لیکن اگر یہ ناممکن ہو جیسا کہ آج کل  قانوناً اس کو ٹھہرنے کی اجازت نہیں اور پورا قافلہ اپنے وقت پر روانہ ہو جا ئے گا  تو اس اضطراری حالت میں بدرجہ مجبوری حج کے بعد اپنے وطن واپس چلی جانے کی گنجائش ہے، پھر وطن جا کر عدت کے بقیہ ایام پورے کرنا لازم ہے۔</p><p style=""margin-left:0;margin-right:0;text-align:justify;"">واضح رہے کہ جس عورت کو دورانِ عدت افعالِ حج کی اجازت ہے اس کو اس بات کا خیال رکھنا نہایت ضروری ہے کہ وہ بلا ضرورت اپنی رہائش گاہ سے باہر نہ نکلے بلکہ عدت کی تمام پابندیوں کا خوب اہتمام کرے، نماز یں بھی رہائش گاہ ہی میں پڑھے،  روضہ اقدس پر حاضری دینا ایک قول کے مطابق واجب ہے؛ اس لیے دورانِ عدت بھی اگر روضہ اقدس پر حاضری دینا چاہے تو  اس قول کے مطابق روضہ اقدس پر حاضری دے سکتی ہے۔</p><p style=""margin-left:0;margin-right:0;text-align:justify;""><span class=""ar_writing"">الدر المختار وحاشية ابن عابدين (رد المحتار) (2/ 626):</span></p><p style=""margin-left:0;margin-right:0;text-align:justify;""><span class=""ar_writing"">""وزيارة قبره مندوبة، بل قيل: واجبة لمن له سعة.</span></p><p style=""text-align:justify;""><span class=""ar_writing"">""(قوله: مندوبة) أي بإجماع المسلمين، كما في اللباب.</span></p><p style=""text-align:justify;""><span class=""ar_writing"">(قوله: بل قيل واجبة) ذكره في شرح اللباب، وقال: كما بينته في [الدرة المضيئة في الزيارة المصطفوية] وذكره أيضاً الخير الرملي في حاشية المنح عن ابن حجر وقال: وانتصر له، نعم، عبارة اللباب والفتح  وشرح المختار أنها قريبة من الوجوب لمن له سعة"".</span></p><p style=""margin-left:0;margin-right:0;text-align:justify;""><span class=""ar_writing"">بدائع الصنائع</span>میں ہے <span class=""ar_writing"">:</span></p><p style=""margin-left:0;margin-right:0;text-align:justify;""><span class=""ar_writing"">""وإن کان إلی مکة أقل من مدة سفر وإلی منزلها مدة سفر مضت إلی مکة؛ لأنها لا تحتاج إلی محرم في أقل مدة من سفر"". (بدائع ۲/۳۰۱)</span>فقط واللہ اعلم</p></p>",143909202307,banuri,"('حج', 'haj')","('حج / عمرہ', 'hajj-umrah')","('متفرقات حج و عمرہ', 'mutafarriqat-e-haj-o-umrah')"
03-06-2018,https://www.banuri.edu.pk/readquestion/گھر-میں-تراویح-میں-محرم-اور-نامحرم-کے-ساتھ-جماعت-کرنا/03-06-2018,گھر میں تراویح میں محرم اور نامحرم کے ساتھ جماعت کرنا,گھر میں گھر ہی کے مرد و مستورات مرد امام (جوکے گھر ہی  کا فرد ہو)کی اقتدا  میں باجماعت تراویح ادا  کرسکتے  ہیں یا نہیں ؟اور اگر محلہ سے مستورات آنے کی صورت میں ایک کمرے میں مرد اور دوسرے میں مستورات ہوں  تو پھر باجماعتِ تراویح کا حکم کیا ہوگا؟واضح رہے کہ  دونوں کمرے آگے پیچھے نہیں ہیں کہ  جس میں مردوں کی صفیں آگے اور مستورات کی پیچھے ہوں، بلکہ دونوں کمرے دائیں بائیں ہیں  کہ اس صورت میں مردوں اور مستورات کی صفیں برابر ہی ہوں گی، البتہ الگ الگ کمرے میں ہوں گی، صرف بیچ میں دیوار ہوگی ۔,"<p><p style=""text-align:justify;"">اگر مرد گھر میں تراویح کی امامت کرے اور اس کے پیچھے کچھ مرد ہوں اور گھر کی ہی کچھ عورتیں پردے میں اس کی اقتدا میں ہوں، باہر سے عورتیں نہ آتی ہوں، اور امام عورتوں کی امامت کی نیت کرے تو یہ نماز شرعاً درست ہے، اس میں کوئی قباحت نہیں۔</p><p style=""text-align:justify;"">اوراگر امام تنہا ہو اور مقتدی سب عورتیں ہوں اور عورتوں میں امام کی کوئی محرم خاتون بھی موجود ہو  ، امام عورتوں کی امامت کی نیت بھی  کرے  تو اس صورت میں بھی تراویح درست ہے، امام کی نامحرم خواتین پردہ کا اہتمام کرکے شریک ہوں ۔</p><p style=""text-align:justify;"">اور اگر  امام تنہا ہو اور مقتدی سب عورتیں ہوں ، اور عورتوں میں امام کی کوئی محرم خاتون یا بیوی نہ ہو،  تو ایسی صورت  امام کے لیے عورتوں کی امامت کرنا مکروہ ہوگا؛ لہٰذا ایسی صورت سے اجتناب کیا جائے۔</p><p style=""text-align:justify;"">واضح رہے کہ موجودہ پرفتن دور میں غیر محرم خواتین کو باہر سے اہتمام سے آکر تراویح میں شرکت کی اجازت نہیں ہے، عورتیں اپنے اپنے گھروں میں نماز ادا کریں یہی ان کے لیے فضیلت کا باعث ہے۔</p><p style=""text-align:justify;"">باقی درمیان میں اگر دیوار حائل ہو  اور دونوں  الگ الگ کمرے برابر میں ہوں تو مذکورہ صورتوں میں سے جن صورتوں میں نماز جائز ہے ان صورتوں میں نماز ادا ہوجائے گی۔</p><p style=""text-align:justify;"">''فتاوی شامی'' میں ہے:</p><p style=""text-align:justify;""><span class=""ar_writing"">"" تكره إمامة الرجل لهن في بيت ليس معهن رجل غيره ولا محرم منه) كأخته (أو زوجته أو أمته، أما إذا كان معهن واحد ممن ذكر أو أمهن في المسجد لا) يكره، بحر""</span>۔ (1/ 566 ، باب الامامۃ، ط: سعید)<br/><span class=""ar_writing"">الفتاوى الهندية (1/ 88):<br/>
""لو كان بين صف النساء وصف الرجال سترة قدر مؤخر الرجل كان ذلك سترة للرجال ولا تفسد صلاة واحد منهم، وكذلك لو كان بينهم حائط قدر الذراع، وإن كان أقل من ذلك لا يكون سترة"".</span> فقط واللہ اعلم</p></p>",143909200514,banuri,"('نماز', 'salat')","('تراویح', 'taraweeh')","('تراویح', 'taraweeh')"
