issued_at,link,title,question,answer,fatwa_number,dar_ul_ifta,kitab,bab,fasal
22-06-2018,https://www.banuri.edu.pk/readquestion/جہاد-کی-شرائط/22-06-2018,جہاد کی شرائط,جہاد کی شرائط بھیج دیں۔,"<p><p style=""margin-left:0;margin-right:0;text-align:justify;"">جہاد کا مقصودِ اصلی  رسوم و قواعدِ کفریہ کو محو کر کے اعزازِ اسلام اور اعلاءِ کلمۃ اللہ ہے، اسلام اور مسلمانوں کی ذلت اور حقارت کسی صورت میں  بھی قابل برداشت نہیں ہے؛ اس لیے فقہاءِ کرام نے  جہاد کے واجب ہونے کی چند شرائط بیان کی ہیں:</p><p style=""margin-left:0;margin-right:0;text-align:justify;"">۱)مسلمانوں کی تعداد اتنی کثیر ہو جس سے شان و شوکت پیدا ہو۔</p><p style=""margin-left:0;margin-right:0;text-align:justify;"">۲)پوری جماعت کے مصارف بھی مہیا ہوں۔</p><p style=""margin-left:0;margin-right:0;text-align:justify;"">۳)مسلمانوں کی جماعت کا کوئی ایساامیر ہو جو ان کی قوت کو ایک مرکز پر جمع رکھ سکتا ہو، اور یہ شرط جہاد کے لیے بمنزلہ روح کے ہے۔</p><p style=""margin-left:0;margin-right:0;text-align:justify;"">۳)مسلمانوں کا کوئی ایسا مامون و محفوظ مرکز بھی ہو کہ جہاں کفار کے شر سے نجات حاصل ہوجائے اور بوقتِ ضرورت  وہاں پناہ حاصل کی جاسکے۔</p><p style=""margin-left:0;margin-right:0;text-align:justify;"">۴)مسلمانوں کو غلبہ حاصل ہونے کی امید ہو، اگر غالب گمان ہو کہ کفار غالب اور مسلمان مغلوب ہوجائیں گے تو پھر جہاد فرضِ عین  نہیں ہوگا۔</p><p style=""margin-left:0;margin-right:0;text-align:justify;"">(مستفاد از ""فتاویٰ عبد الحئی ""، ص: ۲۶۱  )اور( اسلام اورسیاست، ص: ۱۴۱)</p><p style=""margin-left:0;margin-right:0;text-align:justify;""><span class=""ar_writing"">الفتاوى الهندية (2/ 188)</span></p><p style=""margin-left:0;margin-right:0;text-align:justify;""><span class=""ar_writing"">""(وأما شرط إباحته) فشيئان: أحدهما: امتناع العدو عن قبول ما دعي إليه من الدين الحق، وعدم الأمان والعهد بيننا وبينهم، والثاني: أن يرجو الشوكة والقوة لأهل الإسلام باجتهاده أو باجتهاد من يعتقد في اجتهاده ورأيه، وإن كان لا يرجو القوة والشوكة للمسلمين في القتال، فإنه لا يحل له القتال؛ لما فيه من إلقاء نفسه في التهلكة"".</span></p><p style=""margin-left:0;margin-right:0;text-align:justify;""><span class=""ar_writing"">الدر المختار وحاشية ابن عابدين (رد المحتار) (4/ 127)</span></p><p style=""margin-left:0;margin-right:0;text-align:justify;""><span class=""ar_writing"">""(ولا بد) لفرضيته (من) قيد آخر وهو (الاستطاعة)، فلا يخرج المريض الدنف، أما من يقدر على الخروج، دون الدفع ينبغي أن يخرج؛ لتكثير السواد إرهاباً، فتح. وفي السراج: وشرط لوجوبه: القدرة على السلاح، لا أمن الطريق، فإن علم أنه إذا حارب قتل وإن لم يحارب أسر، لم يلزمه القتال"".</span></p><p style=""margin-left:0;margin-right:0;text-align:justify;""><span class=""ar_writing""> (قوله: وشرط لوجوبه القدرة على السلاح) أي وعلى القتال وملك الزاد والراحلة، كما في قاضي خان وغيره، قهستاني. وقدمنا عنه اشتراط العلم أيضاً، (قوله: لا أمن الطريق) أي من قطاع أو محاربين، فيخرجون إلى النفير، ويقاتلون بطريقهم أيضاً حيث أمكن، وإلا سقط الوجوب؛ لأن الطاعة بحسب الطاقة تأمل.</span></p><p style=""margin-left:0;margin-right:0;text-align:justify;""><span class=""ar_writing"">مطلب: إذا علم أنه يقتل يجوز له أن يقاتل بشرط أن ينكي فيهم، وإلا فلا، بخلاف الأمر بالمعروف. (قوله: لم يلزمه القتال) يشير إلى أنه لو قاتل حتى قتل جاز، لكن ذكر في شرح السير: أنه لا بأس أن يحمل الرجل وحده وإن ظن أنه يقتل إذا كان يصنع شيئاً بقتل أو بجرح أو بهزم، فقد فعل ذلك جماعة من الصحابة بين يدي رسول الله صلى الله عليه وسلم يوم أحد، ومدحهم على ذلك، فأما إذا علم أنه لا ينكي فيهم فإنه لا يحل له أن يحمل عليهم؛ لأنه لا يحصل بحملته شيء من إعزاز الدين، بخلاف نهي فسقة المسلمين عن منكر إذا علم أنهم لا يمتنعون بل يقتلونه؛ فإنه لا بأس بالإقدام، وإن رخص له السكوت؛ لأن المسلمين يعتقدون ما يأمرهم به، فلا بد أن يكون فعله مؤثراً في باطنهم بخلاف الكفار"".</span></p><p style=""margin-left:0;margin-right:0;text-align:justify;""><span class=""ar_writing"">البحر الرائق شرح كنز الدقائق ومنحة الخالق وتكملة الطوري (5/ 78)</span></p><p style=""margin-left:0;margin-right:0;text-align:justify;""><span class=""ar_writing"">""(قوله: وفرض عين إن هجم العدو فتخرج المرأة، والعبد بلا إذن زوجها وسيده) ؛ لأن المقصود عند ذلك لا يحصل إلا بإقامة الكل، فيفترض على الكل فرض عين، فلا يظهر ملك اليمين ورق النكاح في حقه، كما في الصلاة والصوم، بخلاف ما قبل ذلك؛ لأن بغيرهما مقنعاً ولا ضرورة إلى إبطال حق المولى والزوج، وأفاد خروج الولد بغير إذن والديه بالأولى، وكذا الغريم يخرج إذا صار فرض عين بغير إذن دائنه، وأن الزوج والمولى إذا منعا أثما، كذا في الذخيرة. ولا بد من قيد آخر وهو الاستطاعة في كونه فرض عين فخرج المريض المدنف أما الذي يقدر على الخروج دون الدفع ينبغي أن يخرج لتكثير السواد؛ لأن فيه إرهاباً، كذا في فتح القدير"".</span></p><p style=""margin-left:0;margin-right:0;text-align:justify;""><span class=""ar_writing"">الدر المختار وحاشية ابن عابدين (رد المحتار) (4/ 145)</span></p><p style=""margin-left:0;margin-right:0;text-align:justify;""><span class=""ar_writing"">""قال في الملتقى: وينبغي للإمام أن يعرض الجيش عند دخول دار الحرب؛ ليعلم الفارس من الراجل"". قال  في شرحه: ""وأن يكتب أسماءهم وأن يؤمر عليهم من كان بصيراً بأمور الحرب وتدبيرها ولو من الموالي، وعليهم طاعته؛ لأن مخالفة الأمير حرام، إلا إذ اتفق الأكثر أنه ضرر، فيتبع"". اهـ.</span></p><p style=""margin-left:0;margin-right:0;text-align:justify;""><span class=""ar_writing"">بدائع الصنائع في ترتيب الشرائع (7/ 99)</span></p><p style=""margin-left:0;margin-right:0;text-align:justify;""><span class=""ar_writing"">""منها: أن يؤمر عليهم أميراً ؛ لأن النبي عليه الصلاة والسلام ما بعث جيشاً إلا وأمر عليهم أميراً، ولأن الحاجة إلى الأمير ماسة؛ لأنه لا بد من تنفيذ الأحكام وسياسة الرعية، ولا يقوم ذلك إلا بالأمير؛ لتعذر الرجوع في كل حادثة إلى الإمام"".</span> فقط واللہ اعلم</p></p>",143909200963,banuri,"('متفرق کتب', 'mutafarriq-kutub')","('متفرق ابواب', 'mutafarriq-abwab')","('متفرق فصول', 'mutafarriq-fusool')"
07-08-2018,https://www.banuri.edu.pk/readquestion/ایک-مشت-داڑھی-رکھنا/07-08-2018,ایک مشت داڑھی رکھنا,داڑھی ایک مشت کے برابر رکھنے کے حوالے سے کوئی حدیث ہو تو بتا دیں۔داڑھی (بہت بڑی ہو تو برابر کرنے کےلیے یا بہت چھوٹی کردینے میں)کاٹنے میں گناہ تو نہیں ہے؟,"<p><p style=""text-align:justify;""> مکمل داڑھی رکھنا سنت ہے، کنپٹی کے نیچے جو ابھری ہوئی ہڈی ہے وہاں سے داڑھی کی حد شروع ہوتی ہے، داڑھی ایک مشت ہونی چاہیے، اس سے کم رکھنا یا کتروانا یا منڈوانا ناجائز اور گناہِ کبیرہ ہے۔ (امداد الفتاویٰ ج:۴ ص:۲۱۲)البتہ جو بال ایک مشت سے زائد ہوں وہ کاٹ سکتے ہیں، حدیث شریف میں ہے:</p><p style=""text-align:justify;""><span class=""ar_writing"">""عَنْ عَبْدِ اللّٰه بْنِ عَمْرٍو أَنَّ النَّبِیَّ ﷺ کَانَ یَأخُذُ مِنْ لِحْیَتِه مِنْ عَرْضِهَا وَطُوْلِهَا"". (ترمذی)</span></p><p style=""text-align:justify;"">ترجمہ: حضرت عبداللہ بن عمرو رضی اللہ عنہما سے روایت ہے کہ نبی کریم صلی اللہ علیہ وسلم اپنی داڑھی طول اور عرض میں درست فرماتے تھے۔</p><p style=""text-align:justify;""><span class=""ar_writing""> ""کَانَ ابْنُ عُمَرَ إِذَا حَجَّ أَوِ اعْتَمَرَ قَبَضَ عَلٰی لِحْیَتِه فَمَا فَضَلَ أَخَذَه"". (بخاری)</span></p><p style=""text-align:justify;"">ترجمہ: حضرت ابن عمر رضی اللہ عنہما جب حج یا عمرہ کرتے تو اپنی داڑھی کو مشت میں لیتے، جو مشت سے زائد ہوتی اسے کاٹ دیتے تھے۔ فقط واللہ اعلم</p></p>",143909201752,banuri,"('حقوق و آدابِ معاشرت', 'huqooq-muashret')","('لباس / وضع قطع', 'libass-waza-qata')","('بالوں کے احکام و آداب', 'baloon-k-ahkam-o-aadab')"
31-08-2018,https://www.banuri.edu.pk/readquestion/ہم-دونوں-میں-سے-کسی-ایک-کو-منتخب-کرلو-کہنے-کا-حکم/31-08-2018,’’ہم دونوں میں سے کسی ایک کو منتخب کرلو‘‘ کہنے کا حکم,اگر شوہر اپنی بیوی کو بولے کہ آج ہم دونوں میں سے کسی ایک کو منتخب کرو،  پہلا خود شوہر ہے اور دوسرا بیوی کی پہلے شوہر سے بیٹی ہے، کیا شوہر کا اپنی بیوی کو ایسے الفاظ بولنے سے نکاح میں فرق تو نہیں آتا؟,"<p><p style=""margin-left:9pt;margin-right:10.3pt;text-align:justify;"">سوال میں مذکورہ جملہ ’’ آج ہم دونوں میں سے کسی ایک کو منتخب کرو‘‘ سے نکاح پر کوئی فرق نہیں پڑے گا۔فقط واللہ اعلم</p></p>",143909202151,banuri,"('طلاق', 'talaaq')","('وقوع طلاق وعدم وقوع طلاق', 'wuqoo-e-talaq-o-adme-wuqoo-e-talaq')","('طلاق - وقوع اور عدم وقوع', 'talaq-wuqo-or-adm-e-wuqo')"
07-08-2018,https://www.banuri.edu.pk/readquestion/شریعت-مطہرہ-میں-میاں-اور-بیوی-کے-حقوق/07-08-2018,شریعت مطہرہ میں میاں اور بیوی  کے حقوق,شریعتِ مطہرہ میں شوہر کے کیا حقوق ہیں اور بیوی کے کیا حقوق ہیں ؟,"<p><p style=""margin-left:9pt;margin-right:10.3pt;text-align:justify;"">شریعتِ مطہرہ میں میاں بیوی کے باہمی حقوق کو بہت اہمیت کے ساتھ بیان کیا گیا ہے اور  دونوں کو ایک دوسرے کے حقوق کے بہت تاکید کی گئی ہے، اس بارے میں چند احادیث مندرجہ ذیل ہیں:</p><p style=""margin-left:9pt;margin-right:10.3pt;text-align:justify;"">شوہر کے حقوق: </p><p style=""margin-left:9pt;margin-right:10.3pt;text-align:justify;"">احادیث مبارکہ میں جو عورت شوہر کے نافرمانی کرے ایسی عورت کے بارے میں   سخت وعیدیں آئی ہیں، اور جو عورت شوہر کی فرماں برداری  اور اطاعت کرے اس کی بڑی فضیلت  بیان  کی گئی ہے۔</p><p style=""margin-left:9pt;margin-right:10.3pt;text-align:justify;"">         <strong>حدیث مبارک میں ہے:</strong><span class=""ar_writing"">""قال رسول الله صلى الله عليه وسلم: «إذا دعا الرجل امرأته إلى فراشه فأبت فبات غضبان لعنتها الملائكة حتى تصبح»"".</span>(مشکاۃ المصابیح، 2/280،  باب عشرۃ النساء، ط: قدیمی)</p><p style=""margin-left:9pt;margin-right:10.3pt;text-align:justify;""><strong>ترجمہ: </strong>رسول کریم ﷺ نے فرمایا: اگر کوئی مرد اپنی عورت کو ہم بستر ہونے کے لیے بلائے اور وہ انکار کردے، اور پھر شوہر (اس انکار کی وجہ سے) رات بھر غصہ کی حالت میں رہے  تو فرشتہ اس عورت پر صبح تک لعنت بھیجتے  رہتے ہیں۔</p><p style=""margin-left:9pt;margin-right:10.3pt;text-align:justify;"">(مظاہر حق، 3/358، ط؛  دارالاشاعت)</p><p style=""margin-left:9pt;margin-right:10.3pt;text-align:justify;"">         <strong>ایک اور حدیث مبارک میں ہے:</strong><span class=""ar_writing"">""قال رسول الله صلى الله عليه وسلم: «لو كنت آمر أحداً أن يسجد لأحد لأمرت المرأة أن تسجد لزوجها» . رواه الترمذي"".</span>(مشکاۃ المصابیح، 2/281،  باب عشرۃ النساء، ط: قدیمی)</p><p style=""margin-left:9pt;margin-right:10.3pt;text-align:justify;""><strong>ترجمہ: </strong>رسول کریم ﷺ نے فرمایا: اگر میں کسی کو یہ حکم کرسکتا کہ  وہ کسی (غیر اللہ) کو سجدہ کرے تو میں یقیناً عورت کو حکم کرتا کہ وہ اپنے خاوند کو سجدہ کرے۔(مظاہر حق، 3/366، ط؛  دارالاشاعت)</p><p style=""margin-left:9pt;margin-right:10.3pt;text-align:justify;""><strong>ایک اور حدیث مبارک میں ہے:</strong><span class=""ar_writing"">""قال رسول الله صلى الله عليه وسلم: «المرأة إذا صلت خمسها وصامت شهرها وأحصنت فرجها وأطاعت بعلها فلتدخل من أي  أبواب الجنة شاءت» . رواه أبو نعيم في الحلية"".</span>(مشکاۃ المصابیح، 2/281،  باب عشرۃ النساء، ط: قدیمی)</p><p style=""margin-left:9pt;margin-right:10.3pt;text-align:justify;""><strong>ترجمہ: </strong> حضرت انس  رضی اللہ عنہ  کہتے ہیں کہ رسول کریم ﷺ نے فرمایا: جس عورت نے  (اپنی پاکی کے  دنوں میں پابندی کے ساتھ) پانچوں وقت کی نماز پڑھی،  رمضان کے  (ادا اور قضا) رکھے،  اپنی شرم گاہ کی حفاظت کی  اور اپنے خاوند  کی فرماں برداری کی  تو (اس عورت کے لیے یہ بشارت ہےکہ) وہ جس دروازہ سے چاہے جنت میں داخل ہوجائے۔(مظاہر حق، 3/366، ط: دارالاشاعت)</p><p style=""margin-left:9pt;margin-right:10.3pt;text-align:justify;""> بیو ی کے حقوق:   </p><p style=""margin-left:9pt;margin-right:10.3pt;text-align:justify;"">قرآن کریم اور احادیث مبارکہ میں عورتوں کے حقوق بھی  بڑی اہمیت کے ساتھ بیان کیے گئے ہیں ، شوہر پر  عورت کے حقوق ادا کرنا بھی بہت ضروری ہے۔</p><p style=""margin-left:9pt;margin-right:10.3pt;text-align:justify;"">         <strong>ارشاد باری تعالیٰ ہے:</strong><span class=""ar_writing"">﴿ وَعَاشِرُوهُنَّ بِالْمَعْرُوفِ فَإِنْ كَرِهْتُمُوهُنَّ فَعَسَى أَنْ تَكْرَهُوا شَيْئًا وَيَجْعَلَ اللَّهُ فِيهِ خَيْرًا كَثِيرًا﴾ [النساء: 19]</span></p><p style=""margin-left:9pt;margin-right:10.3pt;text-align:justify;""><strong>ترجمہ: </strong>اور ان عورتوں کے ساتھ خوبی  کے  ساتھ گزران کرو،  اور اگر وہ تم کو ناپسند ہوں تو  ممکن ہے  کہ تم ایک شے  کو ناپسند کرو  اور اللہ تعالیٰ اس کے اندر  کوئی  بڑی منفعت رکھ دے۔(ازبیان القرآن)</p><p style=""margin-left:9pt;margin-right:10.3pt;text-align:justify;"">         <strong>حدیث مبارک میں ہے:</strong><span class=""ar_writing"">""قال رسول الله صلى الله عليه وسلم: «أكمل المؤمنين إيماناً أحسنهم خلقاً، وخياركم خياركم لنسائهم» . رواه الترمذي"".</span>(مشکاۃ المصابیح، 2/282،  باب عشرۃ النساء، ط؛ قدیمی)</p><p style=""margin-left:9pt;margin-right:10.3pt;text-align:justify;""><strong>ترجمہ: </strong>رسول کریم ﷺ نے فرمایا: مؤمنین میں سے  کامل ترین ایمان اس شخص کا ہے جو ان میں سے بہت زیادہ خوش اخلاق ہو،  اور تم  میں بہتر وہ شخص ہے جو  اپنی عورتوں کے حق میں بہتر ہے۔(مظاہر حق، 3/370، ط؛  دارالاشاعت)</p><p style=""margin-left:9pt;margin-right:10.3pt;text-align:justify;""><strong>ایک اور حدیث مبارک میں ہے:</strong><span class=""ar_writing"">""قال رسول الله صلى الله عليه وسلم: «خيركم خيركم لأهله وأنا خيركم لأهلي"".</span>(مشکاۃ المصابیح، 2/281،  باب عشرۃ النساء، ط: قدیمی)</p><p style=""margin-left:9pt;margin-right:10.3pt;text-align:justify;""><strong>ترجمہ:</strong>رسول کریم ﷺ نے فرمایا: تم میں بہترین شخص وہ ہے جو اپنے اہل (بیوی، بچوں، اقرباء اور خدمت گزاروں) کے حق میں بہترین ہو، اور میں اپنے اہل کے حق میں تم میں  بہترین ہوں۔(مظاہر حق، 3/365، ط؛  دارالاشاعت)</p><p style=""margin-left:9pt;margin-right:10.3pt;text-align:justify;""><strong>ایک اور حدیث مبارک میں ہے:</strong><span class=""ar_writing"">""قال رسول الله صلى الله عليه وسلم: «لا يفرك مؤمن مؤمنةً إن كره منها خلقاً رضي منها آخر» . رواه مسلم"".</span>(مشکاۃ المصابیح، 2/280،  باب عشرۃ النساء، ط: قدیمی)</p><p style=""margin-left:9pt;margin-right:10.3pt;text-align:justify;""><strong>ترجمہ: </strong>رسول کریم ﷺ نے فرمایا: کوئی مسلمان مرد کسی مسلمان عورت سے بغض نہ رکھے،  اگر  اس کی نظر میں اس عورت کی کوئی  خصلت وعادت ناپسندیدہ ہوگی  تو  کوئی دوسری خصلت وعادت پسندیدہ بھی ہوگی۔ (مظاہر حق، 3/354، ط: دارالاشاعت)</p><p style=""margin-left:9pt;margin-right:10.3pt;text-align:justify;"">         خلاصہ یہ ہے کہ بیوی کو چاہیے  کہ وہ اپنے شوہر کو اپنے سے بالاتر سمجھے،  اس کی وفادار اور فرماں بردار رہے، اس کی خیرخواہی اور رضا جوئی میں کمی نہ کرے، اپنی دنیا  اور آخرت کی بھلائی  اس کی خوشی سے وابستہ سمجھے،  اور شوہر کو چاہیے کہ  وہ اپنی بیوی کو اللہ کی عطا کی ہوئی نعمت سمجھے،  اس  کی قدر اور اس سے محبت  کرے، اگر اس سے غلطی ہوجائے تو چشم پوشی  سے کام لے، صبروتحمل اور دانش مندی سے اس کی  اصلاح کی کوشش کرے،  اپنی استطاعت کی حد تک اس کی ضروریات اچھی طرح پوری کرے، اس کی راحت رسانی اور دل جوئی کی کوشش کرے۔فقط واللہ اعلم</p></p>",143909201749,banuri,"('حقوق و آدابِ معاشرت', 'huqooq-muashret')","('حقوق', 'bahmi-huqooq')","('میاں ، بیوی کے حقوق', 'mian-biwi-k-huqooq')"
10-09-2018,https://www.banuri.edu.pk/readquestion/رؤف-نام-رکھنے-کا-حکم/10-09-2018,رؤف نام رکھنے کا حکم,"میں نے اپنے بیٹے کا نام  ""رؤف"" رکھاہے ۔اس کے بارے میں وضاحت کریں۔","<p><p style=""text-align:justify;"">رؤف کا معنیٰ ""مہربان"" ہے، یہ نام اللہ تعالیٰ کے اسماء حسنیٰ میں سے ہے اور اللہ تعالیٰ نے قرآن پاک میں رسول اللہ صلی اللہ علیہ وسلم کے لیے بھی یہ لفظ استعمال فرمایا ہے؛ لہذا اچھا نام ہے، رکھنا بھی درست ہے۔</p><p style=""text-align:justify;"">""معارف القرآن"" میں ہے:</p><p style=""text-align:justify;"">’’اسماءِ حسنٰی میں سے بعض نام ایسے ہیں جن کا خود قرآن و حدیث میں دوسرے لوگوں کے لیے استعمال کیا گیا ہے، اور بعض وہ ہیں جن کو سوائے اللہ تعالی کے اور کسی کے لیے استعمال کرنا قرآن و حدیث سے ثابت نہیں ۔تو جن ناموں کا استعمال غیر اللہ کے لیے قرآن و حدیث سے ثابت ہے وہ نام اوروں کے لیے بھی استعمال ہو سکتے ہیں، جیسے: رحیم ، رشید، علی ، کریم ، عزیز وغیرہ۔ اور اسماءِ حسنٰی میں سے وہ نام جن کا غیر اللہ کے لیے استعمال کرنا قرآن و حدیث سے ثا بت نہیں وہ صرف اللہ تعالی کے لیے مخصوص ہیں ان کو غیر اللہ کے لیے استعمال کر نا ناجائز اور حرام ہے، مثلاً:  رحمٰن ، سبحان، رزاق ،خالق ، غفار، قدوس وغیرہ ‘‘۔( معارف القرآن :۴/۱۳۳ )</p><p><span class=""ar_writing"">الدر المختار وحاشية ابن عابدين (رد المحتار) (6/ 417)<br/>
""وجاز التسمية بعلي ورشيد من الأسماء المشتركة، ويراد في حقنا غير ما يراد في حق الله تعالى.</span></p><p style=""text-align:justify;""><span class=""ar_writing"">(قوله: وجاز التسمية بعلي إلخ) الذي في التتارخانية عن السراجية: التسمية باسم يوجد في كتاب الله تعالى كالعلي والكبير والرشيد والبديع جائزة..."" إلخ</span> فقط واللہ اعلم</p></p>",143909202357,banuri,"('حقوق و آدابِ معاشرت', 'huqooq-muashret')","('حقوق', 'bahmi-huqooq')","('اولاد کے حقوق', 'olad-ky-hoqoq')"
