issued_at,link,title,question,answer,fatwa_number,dar_ul_ifta,kitab,bab,fasal
13-09-2018,https://www.banuri.edu.pk/readquestion/قربانی-کا-گوشت-غیر-مسلم-کو-دینے-کا-حکم/13-09-2018,قربانی کا گوشت غیر مسلم کو دینے کا حکم,قربانی کا گوشت غیر مسلم کو دینا جائز ہے؟,"<p><p style=""margin-left:9pt;margin-right:10.3pt;text-align:justify;"">غیر مسلم کو قربانی کا گوشت بلا اجرت دینا جائز ہے، البتہ غریب مسلمانوں کو دینے کا ثواب زیادہ ہے، کیوں کہ یہ مستحب ہے؛ اس لیے قربانی کا گوشت مسلمانوں  کو دینے کی کوشش کرنی چاہیے، اگر کوئی مصلحت ہو تو غیر مسلم کو قربانی کا گوشت دے سکتے ہیں، مگر بہتر نہیں ہے ؛ کیوں کہ مسلمانوں میں بھی غرباء کی کمی نہیں ہے۔</p><p style=""margin-left:9pt;margin-right:10.3pt;text-align:justify;""><span class=""ar_writing"">الفتاوى الهندية (5/ 300)</span></p><p style=""margin-left:9pt;margin-right:10.3pt;text-align:justify;""><span class=""ar_writing"">""ويستحب أن يأكل من أضحيته ويطعم منها غيره، والأفضل أن يتصدق بالثلث، ويتخذ الثلث ضيافةً لأقاربه وأصدقائه، ويدخر الثلث، ويطعم الغني والفقير جميعاً، كذا في البدائع. ويهب منها ما شاء للغني والفقير والمسلم والذمي، كذا في الغياثية"".</span> فقط واللہ اعلم</p></p>",144001200040,banuri,"('عبادات', 'ebadat')","('ذبیحہ / قربانی', 'zabiha-qurbani')","('قربانی کا گوشت اور اس کے احکام', 'qurbani-ka-gosht-or-us-k-ahkam')"
21-06-2018,https://www.banuri.edu.pk/readquestion/بینک-کو-خدمات-فراہم-کرنا-2/21-06-2018,بینک کو خدمات فراہم کرنا,بنک کو ٹریول ایجنسی کی سروس فراہم کرنا کیسا ہے؟,"<p><p style=""text-align:justify;"">بینک سے خدمات کے عوض معاوضہ وصول کرنے میں کراہت ہے۔فقط واللہ اعلم</p></p>",143909200909,banuri,"('معاملات', 'muamlat')","('بیع / تجارت', 'bay-tijarat')","('بیع صحیح ، فاسد اور باطل', 'bay-sahih-fasid-or-batil')"
17-08-2018,https://www.banuri.edu.pk/readquestion/منی-کے-قیام-کے-اوقات-میں-مزدلفہ-میں-خیمے-لگانا/17-08-2018,منیٰ کے قیام کے اوقات میں مزدلفہ میں خیمے لگانا,کیا مزدلفہ منیٰ کی حدود میں شامل ہے? یعنی قیام منیٰ کے وقت اگر مزدلفہ میں خیمے لگائے جائیں تو صحیح ہے?,"<p><p style=""text-align:justify;"">مزدلفہ منیٰ کی حدود میں شامل نہیں ہے، بلکہ مزدلفہ منیٰ سے بالکل الگ جگہ کا نام ہے، لہٰذا جن اوقات میں منیٰ میں قیام کرنا اور رات گزارنا سنت ہے ان اوقات میں مزدلفہ کی حدود میں قیام کرنے سے سنت ادا نہیں ہوگی۔  چناں چہ اگر منیٰ میں جگہ ہو تو منیٰ کے قیام کے وقت منیٰ کی جگہ مزدلفہ میں خیمے لگا کر وہاں قیام کرنا درست نہیں، لیکن اگر مجمع کے زیادہ ہونے اور منیٰ میں جگہ  کی تنگی ہونے کے باعث منیٰ کے قیام کے اوقات میں مزدلفہ میں خیمے لگائے جائیں تو اس کی گنجائش ہوگی۔فقط واللہ اعلم</p></p>",143909201949,banuri,"('حج', 'haj')","('حج / عمرہ', 'hajj-umrah')","('مناسک حج ، واجبات اور سنن', 'manasik-haj-wajibaat-or-sunan')"
08-08-2018,https://www.banuri.edu.pk/readquestion/کافر-پڑوسی-کے-حقوق/08-08-2018,کافر پڑوسی کے حقوق,ایک مسلمان پر کافر پڑوسی کے کیا ٖحقوق ہیں؟,"<p><p style=""text-align:justify;"">پڑوسیوں کے حقوق، ان کے اکرام ، ان کی رعایت اور ان کے ساتھ حسنِ سلوک کی جو تاکید قرآن وحدیث میں مذکور ہے ان میں غیرمسلم بھی داخل ہے، ایک روایت میں ہے:</p><p style=""text-align:justify;""><span class=""ar_writing"">شعب الإيمان (12/ 105)<br/>
""قال رسول الله صلى الله عليه وسلم: "" الجيران ثلاثة: فمنهم من له ثلاثة حقوق، ومنهم من له حقان، ومنهم من له حق، فأما الذي له ثلاثة حقوق فالجار المسلم القريب له حق الجار ، وحق الإسلام، وحق القرابة، وأما الذي له حقان فالجار المسلم له حق الجوار، وحق الإسلام، وأما الذي له حق واحد فالجار الكافر له حق الجوار ""</span></p><p style=""text-align:justify;"">ترجمہ: رسول اللہ صلی اللہ علیہ وسلم نے فرمایا: پڑوسی تین طرح کے ہیں: ایک وہ پڑوسی جس کے تین حقوق ہیں، اور دوسرا وہ پڑوسی جس کے دو حق ہیں، اور تیسرا وہ پڑوسی جس کا ایک حق ہے۔</p><p style=""margin-left:0;margin-right:0;text-align:justify;"">تین حق والا پڑوسی وہ ہے جو پڑوسی بھی ہو، مسلمان بھی اور رشتہ دار بھی ہو، تو اس کا ایک حق مسلمان ہونے کا، دوسرا پڑوسی ہونے کا اور تیسرا قرابت داری کا ہوگا۔ اور دو حق والا وہ پڑوسی ہے جو پڑوسی ہونے کے ساتھ مسلم دینی بھائی ہے، اس کا ایک حق مسلمان ہونے کا دوسرا حق پڑوسی ہونے کا ہوگا۔ اور ایک حق والا غیر مسلم پڑوسی ہے (جس سے کوئی قرابت ورشتہ داری نہ ہو) اس کے لیے صرف پڑوسی ہونے کا حق ہے۔</p><p style=""margin-left:0;margin-right:0;text-align:justify;"">جامع ترمذی وغیرہ میں حضرت عبداللہ بن عمرو بن العاص رضی اللہ عنہما کا واقعہ مذکور ہے کہ ایک دن ان کے گھر بکری ذبح ہوئی، انہوں نے گھر والوں سے کہا: <span class=""ar_writing"">""أهديتم لجارنا اليهودي؟ أهديتم لجارنا اليهودي؟ سمعت رسول الله صلى الله عليه وسلم يقول: مازال جبرئيل يوصيني بالجار حتى ظننت أنه سيورثه""</span>کیا تم لوگوں نے ہمارے یہودی پڑوسی کے لیے بھی ہدیہ بھیجا ہے؟ کیا تم نے ہمارے یہودی پڑوسی کے لیے بھی ہدیہ بھیجا ہے؟ میں نے رسول اللہ صلی اللہ علیہ وسلم کو ارشاد فرماتے ہوئے سناکہ: جبرئیل مجھے پڑوسی کے حقوق کی مسلسل تاکید کرتے رہے کہ مجھے خیال ہونے لگاکہ وہ اس کو وارث قرار دے دیں گے۔</p><p style=""text-align:justify;"">حضرت ابوہریرہ رضی اللہ عنہ روایت کرتے ہیں کہ رسول اللہ صلی اللہ علیہ وسلم نے ارشاد فرمایا: اللہ کی قسم (کامل) مؤمن نہیں ہے، اللہ کی قسم (کامل) مؤمن نہیں ہے، اللہ کی قسم (کامل) مؤمن نہیں ہے۔ پوچھاگیا: اے اللہ کے رسول (ﷺ) کون مؤمن نہیں ہے؟ فرمایا: وہ شخص جس کا پڑوسی اس کے شرور اور تکلیفوں سے محفوظ نہ ہو۔(بخاری، مسلم)</p><p style=""text-align:justify;"">حضرت انس رضی اللہ عنہ روایت کرتے ہیں کہ رسول اللہ صلی اللہ علیہ وسلم نے ارشاد فرمایا: جنت میں داخل نہیں ہوگا وہ شخص جس کا پڑوسی اس کی تکلیفوں اور شرور سے محفوظ نہ ہو۔ (مسلم)</p><p style=""text-align:justify;"">احادیثِ مبارکہ میں پڑوسیوں کے ساتھ حسنِ سلوک کی بہت زیادہ ترغیب دی گئی ہے، اور ان میں کہیں مسلمان کی صراحت نہیں کہ مسلمان ہو ، تب یہ حکم ہے بلکہ صرف پڑوسی کا لفظ ہے،  ِ نیز آں حضرت ﷺ کا کافر پڑوسیوں کے ساتھ  بھی حسنِ سلوک کا معمول تھا ؛ اس لیے پڑوسی خواہ کافر کیوں نہ ہو شریعت اس کے ساتھ بھی حسنِ سلوک کی تعلیم دیتی ہے ،دکھ درد میں اس کے کام آنا ، کسی بھی قسم کی اس کو  تکلیف پہنچانے سے گریز کرنا وغیرہ وغیرہ ۔فقط واللہ اعلم</p></p>",143909201784,banuri,"('حقوق و آدابِ معاشرت', 'huqooq-muashret')","('حقوق', 'bahmi-huqooq')","('غیر مسلموں کے حقوق', 'gher-muslimon-k-huqoq')"
23-06-2018,https://www.banuri.edu.pk/readquestion/مجلس-نکاح-میں-دلہا-اور-دلہن-کا-نام-اور-ولدیت-کا-ذکر-کرنا-ضروری-ہے-یا-نہیں-نکاح-کے-گواہ-بننے-کی-شرائط/23-06-2018,مجلس نکاح میں دلہا اور دلہن کا نام اور ولدیت کا ذکر کرنا ضروری ہے یا نہیں؟ نکاح کے گواہ بننے کی شرائط,شریعت میں نکاح کے جو دو گواہ ہوتے ہیں اس کی کیا شرط ہے؟ یعنی کیا گواہوں کے لیے دلہا اور دلہن کے نام اور ولدیت جاننا ضروری ہے؟ اور کیا دلہا اور دلہن کا بھی گواہوں کے نام اور ولدیت بھی جاننا ضروری ہے؟ یا کوئی بھی اجنبی آدمی بھی نکاح کا گواہ بن سکتا ہے جب کہ دلہا اور دلہن گواہان کے سامنے ایک مجلس میں حاضر ہوں؟ شریعت میں نکاح کے گواہ مانے جانے کی کیا شرائط ہیں ؟,"<p><p style=""margin-left:0;margin-right:0;text-align:justify;"">دلہا اور دلہن میں سے جو بھی مجلسِ نکاح میں موجود ہو اور خود ایجاب و قبول کرے یا اس کا وکیل اس کی طرف اشارہ کر کے ایجاب و قبول کرے تو اس صورت میں گواہوں کے لیے ان کا نام اور ولدیت جاننا ضروری نہیں، یعنی مجلسِ عقد میں ان کا نام لینا ضروری نہیں۔</p><p style=""margin-left:0;margin-right:0;text-align:justify;"">دلہا اور دلہن میں سے جو بھی مجلسِ عقد میں موجود نہ ہو  یا موجود ہو، لیکن نہ تو خود ایجاب و قبول کریں اور نہ ہی ان کی طرف اشارہ کر کے ایجاب و قبول کیا جائے تو اس صورت میں اگر نکاح کے گواہ ان کو پہلے سے جانتے ہوں تو نکاح کے وقت گواہان کے سامنے صرف ان کا نام لینا بھی کافی ہے، لیکن اگر گواہان ان دونوں کو پہلے سے نہیں جانتے ہوں تو پھر مجلسِ نکاح میں ان کا نام اور  ان کے والد اور دادا کا نام لینا بھی ضروری ہوگا، ورنہ نکاح درست نہیں ہوگا۔</p><p style=""margin-left:0;margin-right:0;text-align:justify;"">دلہا اور دلہن کے لیے گواہوں کے نام اور ولدیت کا جاننا ضروری نہیں، اجنبی آدمی بھی گواہ بن سکتا ہے۔</p><p style=""margin-left:0;margin-right:0;text-align:justify;"">عقدِ نکاح کا گواہ بننے کے لیے گواہ  میں مذکورہ  صفات کا پایا جانا شرط ہے:</p><p style=""margin-left:0;margin-right:0;text-align:justify;"">آزاد ہونا، عاقل و بالغ ہونا، مسلمان ہونا (اگر نکاح کسی مسلمان عورت کا ہو )، گواہوں کو یہ علم ہونا کہ یہ مجلس عقدِ نکاح کی ہے، گواہوں کا ایجاب و قبول کو سننا۔</p><p style=""margin-left:0;margin-right:0;text-align:justify;""><span class=""ar_writing"">الدر المختار وحاشية ابن عابدين (رد المحتار) (3/ 15)</span></p><p style=""margin-left:0;margin-right:0;text-align:justify;""><span class=""ar_writing"">""(قوله: ولا المنكوحة مجهولة) فلو زوج بنته منه وله بنتان لا يصح إلا إذا كانت إحداهما متزوجةً، فينصرف إلى الفارغة، كما في البزازية، نهر. وفي معناه ما إذا كانت إحداهما محرمةً عليه، فليراجع، رحمتي. وإطلاق ""قوله: لا يصح"" دال على عدم الصحة، ولو جرت مقدمات الخطبة على واحدة منهما بعينها لتتميز المنكوحة عند الشهود؛ فإنه لا بد منه، رملي.</span></p><p style=""margin-left:0;margin-right:0;text-align:justify;""><span class=""ar_writing"">قلت: وظاهره أنها لو جرت المقدمات على معينة وتميزت عند الشهود أيضاً يصح العقد، وهي واقعة الفتوى؛ لأن المقصود نفي الجهالة، وذلك حاصل بتعينها عند العاقدين والشهود، وإن لم يصرح باسمها كما إذا كانت إحداهما متزوجةً، ويؤيده ما سيأتي من أنها لو كانت غائبةً وزوجها وكيلها، فإن عرفها الشهود وعلموا أنه أرادها كفى ذكر اسمها، وإلا لا بد من ذكر الأب والجد أيضاً، ولا يخفى أن قوله: زوجت بنتي، وله بنتان، أقل إبهاماً من قول الوكيل: زوجت فاطمة، ويأتي تمام ذلك عند قوله: وحضور شاهدين حرين، وعند قوله: غلط وكيلها..."" إلخ.</span></p><p style=""margin-left:0;margin-right:0;text-align:justify;""><span class=""ar_writing"">الدر المختار وحاشية ابن عابدين (رد المحتار) (3/ 21)</span></p><p style=""margin-left:0;margin-right:0;text-align:justify;""><span class=""ar_writing"">""(و) شرط (حضور) شاهدين (حرين) أو حر وحرتين (مكلفين سامعين قولهما معاً) على الأصح (فاهمين) أنه نكاح على المذهب، بحر. (مسلمين لنكاح مسلمة ولو فاسقين أو محدودين في قذف).</span></p><p style=""margin-left:0;margin-right:0;text-align:justify;""><span class=""ar_writing"">أشار بقوله فيما مر: ""ولا المنكوحة مجهولة"" إلى ما ذكره في البحر هنا بقوله: ولا بد من تمييز المنكوحة عند الشاهدين؛ لتنتفي الجهالة، فإن كانت حاضرةً منتقبةً كفى الإشارة إليها، والاحتياط كشف وجهها.</span></p><p style=""margin-left:0;margin-right:0;text-align:justify;""><span class=""ar_writing"">قال في البحر: وإن كانت غائبةً ولم يسمعوا كلامها، بأن عقد لها وكيلها فإن كان الشهود يعرفونها كفى ذكر اسمها إذا علموا أنه أرادها، وإن لم يعرفوها لابد من ذكر اسمها واسم أبيها وجدها. وجوز الخصاف النكاح مطلقاً، حتى لو وكلته فقال بحضرتهما: زوجت نفسي من موكلتي أو من امرأة جعلت أمرها بيدي فإنه يصح عنده. قال قاضي خان: والخصاف كان كبيراً في العلم يجوز الاقتداء به، وذكر الحاكم الشهيد في المنتقى كما قال الخصاف. اهـ.</span></p><p style=""margin-left:0;margin-right:0;text-align:justify;""><span class=""ar_writing"">قلت: في التتارخانية عن المضمرات: أن الأول هو الصحيح، وعليه الفتوى، وكذا قال في البحر في فصل الوكيل والفضولي: إن المختار في المذهب خلاف ما قاله الخصاف، وإن كان الخصاف كبيراً. اهـ. وما ذكروه في المرأة يجري مثله في الرجل، ففي الخانية: قال الإمام ابن الفضل: إن كان الزوج حاضراً مشاراً إليه جاز، ولو غائباً فلا ما لم يذكر اسمه واسم أبيه وجده، قال: والاحتياط أن ينسب إلى المحلة أيضاً، قيل له: فإن كان الغائب معروفاً عند الشهود؟ قال: وإن كان معروفاً لا بد من إضافة العقد إليه، وقد ذكرنا عن غيره في الغائبة إذا ذكر اسمها لا غير وهي معروفة عند الشهود وعلم الشهود أنه أراد تلك المرأة يجوز النكاح. اهـ.</span></p><p style=""margin-left:0;margin-right:0;text-align:justify;""><span class=""ar_writing"">والحاصل: أن الغائبة لا بد من ذكر اسمها واسم أبيها وجدها، وإن كانت معروفةً عند الشهود على قول ابن الفضل، وعلى قول غيره يكفي ذكر اسمها إن كانت معروفةً عندهم، وإلا فلا، وبه جزم صاحب الهداية في التجنيس، وقال: لأن المقصود من التسمية التعريف وقد حصل، وأقره في الفتح والبحر. وعلى قول الخصاف يكفي مطلقاً، ولا يخفى أنه إذا كان الشهود كثيرين لا يلزم معرفة الكل، بل إذا ذكر اسمها وعرفها اثنان منهم كفى، والظاهر أن المراد بالمعرفة أن يعرفها أن المعقود عليها هي فلانة بنت فلان الفلاني، لا معرفة شخصها، وإن ذكر الاسم غير شرط، بل المراد الاسم أو ما يعينها مما يقوم مقامه؛ لما في البحر: لو زوجه بنته ولم يسمها وله بنتان لم يصح؛ للجهالة، بخلاف ما إذا كانت له بنت واحدة، إلا إذا سماها بغير اسمها ولم يشر إليها فإنه لا يصح، كما في التنجيس. اهـ.</span></p><p style=""margin-left:0;margin-right:0;text-align:justify;""><span class=""ar_writing""> (قوله: حرين إلخ) قال في البحر: وشرط في الشهود: الحرية، والعقل، والبلوغ، والإسلام، فلا ينعقد بحضرة العبيد والمجانين والصبيان والكفار في نكاح المسلمين؛ لأنه لا ولاية لهؤلاء"".</span></p><p style=""margin-left:0;margin-right:0;text-align:justify;""><span class=""ar_writing"">الدر المختار وحاشية ابن عابدين (رد المحتار) (3/ 26)</span></p><p style=""margin-left:0;margin-right:0;text-align:justify;""><span class=""ar_writing"">""(غلط وكيلها بالنكاح في اسم أبيها بغير حضورها لم يصح)؛ للجهالة وكذا لو غلط في اسم بنته إلا إذا كانت حاضرةً وأشار إليها فيصح.</span></p><p style=""margin-left:0;margin-right:0;text-align:justify;""><span class=""ar_writing""> (قوله: لم يصح)؛ لأن الغائبة يشترط ذكر اسمها واسم أبيها وجدها، وتقدم أنه إذا عرفها الشهود يكفي ذكر اسمها فقط، خلافاً لابن الفضل، وعند الخصاف يكفي مطلقاً، والظاهر أنه في مسألتنا لا يصح عند الكل؛ لأن ذكر الاسم وحده لايصرفها عن المراد إلى غيره، بخلاف ذكر الاسم منسوباً إلى أب آخر، فإن فاطمة بنت أحمد لا تصدق على فاطمة بنت محمد، تأمل، وكذا يقال فيما لو غلط في اسمها، (قوله: إلا إذا كانت حاضرةً إلخ) راجع إلى المسألتين: أي فإنها لو كانت مشاراً إليها وغلط في اسم أبيها أو اسمها لا يضر؛ لأن تعريف الإشارة الحسية أقوى من التسمية؛ لما في التسمية من الاشتراك لعارض، فتلغو التسمية عندها، كما لو قال: اقتديت بزيد هذا فإذا هو عمرو، فإنه يصح"".</span> فقط واللہ اعلم</p></p>",143909200982,banuri,"('نکاح', 'nikah')","('نکاح کی اہمیت اور حکم', 'nikah-ki-ahmiyat-aur-hukum')","('نکاح کا حکم', 'nikah-k-ahkam-sharait-sunan-or-aadab')"
25-08-2018,https://www.banuri.edu.pk/readquestion/حالت-احرام-میں-ایک-دوسرے-سے-حلق-کرنا/25-08-2018,حالتِ احرام میں ایک دوسرے سے حلق کرنا,ہم حج کرنے گئے تھے، وہاں میرے ساتھ کمرے کے چار ساتھیوں نے ایک دوسرے کا سر گنجا کیا، اب ایک صاحب کا کہنا ہے کہ دو لوگوں کودم دینا ہوگا، آپ وضاحت سے جواب دیجیے گا ۔ ان کہنا تھا کہ بال کاٹنے والے حلاق  سے حلق کرانا چاہیےتھا ۔ہم اس وقت سارے ارکان پورے کرکے آئے تھے۔صرف حلق ہی باقی تھا۔,"<p><p style=""margin-left:0;margin-right:0;text-align:justify;""><span style=""background-color:#fff;""><span style=""background-color:#fff;"">اگر تمام ارکان سے فارغ ہوچکے ہوں، صرف حلق ہی باقی ہو، تو اس وقت  محرم اپنا حلق کرانے سے پہلے دوسرے محرم کا حلق کرسکتا ہے ؛ لہذا صورتِ مسئولہ میں کسی پر دم واجب نہ ہوگا۔</span></span> فقط واللہ اعلم</p></p>",143909202064,banuri,"('حج', 'haj')","('حج / عمرہ', 'hajj-umrah')","('متفرقات حج و عمرہ', 'mutafarriqat-e-haj-o-umrah')"
28-08-2018,https://www.banuri.edu.pk/readquestion/قریب-المرگ-کے-پاس-کیا-پڑھے/28-08-2018,قریب المرگ کے پاس کیا پڑھے؟,جب انسان دنیا سے رخصت ہونے کے قریب ہو تو اس کے پاس کیا پڑھنا چاہیے ؟,"<p><p style=""margin-left:0;margin-right:0;text-align:justify;""><span style=""background-color:#fff;""><span style=""background-color:#fff;"">1۔ قریب المرگ شخص کے پاس کلمہ پڑھے۔ </span></span></p><p style=""margin-left:0;margin-right:0;text-align:justify;""><span style=""background-color:#fff;""><span style=""background-color:#fff;""><span style=""color:#444;"">حضرت ابوسعید اور حضرت ابوہریرہ  رضی اللہ عنہما کہتے ہیں کہ رسول کریم ﷺ نے فرمایا:  "" جو لوگ قریب المرگ ہوں انہیں (کلمہ) ""لاالہ الا اللہ""  کی تلقین کرو""۔ (مسلم</span></span><span style=""background-color:#fff;"">)</span></span></p><p style=""margin-left:0;margin-right:0;text-align:justify;""><span style=""background-color:#fff;""><span style=""background-color:#fff;""><span style=""color:#444;"">تلقین سے مراد قریب المرگ کے رو برو کلمہ ""لا الہ الا اللہ"" پڑھنا ہے؛ تاکہ وہ بھی سن کر پڑھے، مگر قریب المرگ سے نہ کہا جائے کہ یہ تم بھی پڑھو، مبادا کہ شدتِ مرض یا بدحواسی کے سبب اس کے منہ سے انکار نکل جائے۔</span></span></span></p><p style=""margin-left:0;margin-right:0;text-align:justify;""><span style=""background-color:#fff;""><span style=""background-color:#fff;""><span style=""color:#444;"">2۔ سورۃ یٰسین کی تلاوت کرے۔</span></span></span></p><p style=""margin-left:0;margin-right:0;text-align:justify;""><span style=""background-color:#fff;""><span style=""background-color:#fff;""><span style=""color:#444;"">حضرت معقل بن یسار رضی اللہ عنہ راوی ہیں کہ نبی کریم ﷺ نے فرمایا: جو شخص اللہ رب العزت کی رضا و خوشنودی کی طلب میں سورت یٰسین پڑھتا ہے تو اس کے وہ گناہ بخش دیے جاتے ہیں جو اس نے پہلے کیے ہیں؛ لہٰذا اس سورت کو اپنے مردوں کے سامنے پڑھو۔ (بیہقی)</span></span></span>فقط واللہ اعلم</p></p>",143909202103,banuri,"('جنائز', 'janaiz')","('نماز جنازہ', 'namaz-e-jinazah')","('جنازہ اور نماز جنازہ کے احکام (فرائض، سنن، مستحبات، مکروہات)', 'janaza-or-namaz-e-janaza')"
24-08-2018,https://www.banuri.edu.pk/readquestion/حالت-احرام-میں-وضو-کرتے-ہوئے-وقفے-وقفے-سے-دس-بال-گر-جائیں/24-08-2018,حالتِ احرام میں وضو کرتے ہوئے وقفے وقفے سے دس بال گر جائیں,حالتِ احرام میں وضو کرتے ہوئے وقفے وقفے سے دس بال گر جائیں تو کیا حکم ہے؟,"<p><p style=""text-align:justify;"">مذکورہ صورت میں صدقہ فطر کی مقدار(تقریباً پونے دو کلو گندم یا اس کی قیمت) صدقہ کرنا کافی ہے۔فقط واللہ اعلم</p></p>",143909202047,banuri,"('حج', 'haj')","('حج / عمرہ', 'hajj-umrah')","('حج کی غلطیاں اور اس کے احکام', 'haj-ki-ghalatiyan-or-us-k-ahkam')"
