issued_at,link,title,question,answer,fatwa_number,dar_ul_ifta,kitab,bab,fasal
04-09-2018,https://www.banuri.edu.pk/readquestion/بعض-نمازوں-میں-جہری-اور-بعض-میں-سری-قرأت-کی-وجہ-اور-پس-منظر-2/04-09-2018,بعض نمازوں میں جہری اور بعض میں سری قراء ت کی وجہ اور پس منظر,ہم تین نمازیں قراء ت کے ساتھ اور دو نمازیں بغیر قراءت کے کیوں پڑہتے ہیں؟,"<p><p style=""margin-left:9pt;margin-right:10.3pt;text-align:justify;"">محترم! کوئی بھی نماز قرأت کے بغیر نہیں ہو تی، ہر نماز قرأت کے ساتھ ہی پڑھی جاتی ہے، البتہ تین نمازوں (یعنی فجر، مغرب اور عشاء کی باجماعت فرض نماز ) میں قرأت جہراً ( یعنی بلند آواز سے ) کی جاتی ہے اور دو نمازوں ( یعنی ظہر اور عصر کی باجماعت فرض نماز ) میں قرأت سراً ( یعنی آہستہ آواز میں ) کی جاتی ہے، اصل وجہ تو اس کی یہ ہے کہ اللہ تعالیٰ کا حکم اور رسول اللہ ﷺ کا طریقہ یہی ہے۔ البتہ پس منظر اس کا یہ ہے کہ  ابتدا میں رسول اللہ ﷺ تمام نمازوں میں جہری قرأت کرتے تھے تو مشرکین  قرآن کی آواز سن کر آجاتے تھے اور آپ ﷺ کو تکلیف پہنچانے اور تنگ کرنے کے لیے خوب شور مچاتے، زور زور سے اشعار پڑھتے، الٹی سیدھی بکواس کرتے اور گالم گلوچ کرتے تھے، اور وہ اپنے لوگوں کو ایسا کرنے کی باقاعدہ ترغیب دیتے تھے ، تاکہ جب قرآن پڑھا جائے تو وہ لوگ شور شرابا کر کے غالب آجائیں اور آپ ﷺ خاموش ہوجائیں، کیوں کہ قرآن میں توحید کا بیان ہوتا تھا، جس کا سننا ان لوگوں سے برداشت نہیں ہوتا تھا، چناں چہ اللہ تعالیٰ نے قرآن کی یہ آیت نازل کی : <span class=""ar_writing"">﴿وَلَا تَجْهَرْ بِصَلاتِكَ وَلَا تُخَافِتْ بِهَا وَابْتَغِ بَيْنَ ذٰلِكَ سَبِيْلًا﴾ </span> [<span class=""ar_writing"">الإسراء: 110</span>] اور اس آیت میں اللہ تعالیٰ نے حضور پاک ﷺ کو یہ حکم دیا کہ  آپ نہ تو ساری نمازوں میں جہری قرأت کریں اور نہ ہی ساری نمازوں میں سری قرأت کریں، بلکہ درمیانی صورت اختیار کریں یعنی اندھیرے میں پڑھی جانے والی نمازوں (فجر، مغرب اور عشاء) میں جہری قرأت کریں، جب کہ دن کی روشنی میں پڑھی جانے والی نمازوں (ظہر اور عصر) میں سری قرأت کریں، لہٰذا اس آیت کے نازل ہونے کے بعد آپ ﷺ ظہر اور عصر کی نمازوں میں سری قرأت فرمایا کرتے تھے، کیوں کہ ان اوقات میں مشرکین تکلیف پہنچانے کے لیے بالکل تیار ہوتے تھے، جب کہ مغرب، عشاء اور فجر میں جہری قرأت فرمایا کرتے تھے، کیوں کہ مغرب میں وہ لوگ کھانا کھانے میں مشغول ہوتے تھے، اور عشاء و فجر میں وہ لوگ سو رہے ہوتے تھے، بعد میں اگرچہ اللہ تعالیٰ نے مسلمانوں کو قوت اور شان و شوکت عطا کردی اور کفار کی یہ جرأت نہ  رہی، لیکن مذکورہ حکم باقی رہا  (جیسا کہ طواف میں رمل  ) اور آپ ﷺ دنیا سے پردہ فرمانے تک اسی پر عمل پیرا رہے اور آپ ﷺ کے بعد امت کا یہی عمل متوارث رہا، لہٰذا آپ ﷺ کی اس مواظبت کے سبب فقہاء نے امام کے لیے فجر، مغرب اور عشاء میں جہری قرأت اور ظہر و عصر میں سری قرأت کرنے کو نماز کے واجبات میں سے شمار کیا ہے۔</p><p style=""margin-left:9pt;margin-right:10.3pt;text-align:justify;""><span class=""ar_writing"">حاشية الطحطاوي على مراقي الفلاح شرح نور الإيضاح (ص: 253)</span></p><p style=""margin-left:9pt;margin-right:10.3pt;text-align:justify;""><span class=""ar_writing"">"" والأصل في الجهر والإسرار أن النبي صلى الله عليه وسلم كان يجهر بالقراءة في الصلوات كلها في الإبتداء، وكان المشركون يؤذونه، ويقولون لأتباعم: إذا سمعتموه يقرأ فارفعوا أصواتكم بالأشعار والأراجيز وقابلوه بكلام اللغو، حتى تغلبوه فيسكت، ويسبون من أنزل القرآن، ومن أنزل عليه، فأنزل الله تعالى: ﴿وَلَا تَجْهَرْ بِصَلاتِكَ وَلا تُخَافِتْ بِهَا﴾ [الإسراء: 110] أي لا تجهر بصلاتك كلها، ولا تخافت بها كلها، وابتغ بين ذلك سبيلاً: بأن تجهر بصلاة الليل، وتخافت بصلاة النهار، فكان بعد ذلك يخافت في صلاة الظهر والعصر؛ لاستعدادهم بالإيذاء فيهما، ويجهر في المغرب؛ لاشتغالهم بالأكل، وفي العشاء والفجر؛ لرقادهم، وفي الجمعة والعيدين؛ لأنه أقامهما بالمدينة، وما كان للكفار قوة. (وقوله: وفي العشاء والفجر؛ لرقادهم) وجهه في الفجر ظاهر، وفي العشاء أن السنة تأخيرها إلى ثلث الليل، وهذا إنما يظهر في زمن الشتاء، أما في غيره فالعذر فيها كالمغرب فيما يظهر"".</span></p><p style=""margin-left:9pt;margin-right:10.3pt;text-align:justify;""><span class=""ar_writing"">بدائع الصنائع في ترتيب الشرائع (1/ 160)</span></p><p style=""margin-left:9pt;margin-right:10.3pt;text-align:justify;""><span class=""ar_writing"">""(ومنها): الجهر بالقراءة فيما يجهر، وهو الفجر والمغرب والعشاء في الأوليين، والمخافتة فيما يخافت، وهو الظهر والعصر إذا كان إماماً.</span></p><p style=""margin-left:9pt;margin-right:10.3pt;text-align:justify;""><span class=""ar_writing"">والجملة فيه أنه لا يخلو إما أن يكون إماماً أو منفرداً، فإن كان إماماً يجب عليه مراعاة الجهر فيما يجهر، وكذا في كل صلاة من شرطها الجماعة كالجمعة والعيدين والترويحات، ويجب عليه المخافتة فيما يخافت، وإنما كان كذلك؛ لأن القراءة ركن يتحمله الإمام عن القوم فعلاً، فيجهر؛ ليتأمل القوم ويتفكروا في ذلك، فتحصل ثمرة القراءة وفائدتها للقوم، فتصير قراءة الإمام قراءة لهم تقديراً، كأنهم قرءوا. وثمرة الجهر تفوت في صلاة النهار؛ لأن الناس في الأغلب يحضرون الجماعات في خلال الكسب والتصرف والانتشار في الأرض، فكانت قلوبهم متعلقة بذلك، فيشغلهم ذلك عن حقيقة التأمل فلايكون الجهر مفيداً بل يقع تسبيباً إلى الإثم بترك التأمل، وهذا لا يجوز، بخلاف صلاة الليل؛ لأن الحضور إليها لا يكون في خلال الشغل، وبخلاف الجمعة والعيدين؛ لأنه يؤدى في الأحايين مرةً على هيئة مخصوصة من الجمع العظيم وحضور السلطان وغير ذلك؛ فيكون ذلك مبعثة على إحضار القلب والتأمل؛ ولأن القراءة من أركان الصلاة والأركان في الفرائض تؤدى على سبيل الشهرة دون الإخفاء، ولهذا «كان النبي صلى الله عليه وسلم يجهر في الصلوات كلها في الابتداء» إلى أن قصد الكفار أن لا يسمعوا القرآن، وكادوا يلغون فيه، فخافت النبي صلى الله عليه وسلم بالقراءة في الظهر والعصر؛ لأنهم كانوا مستعدين للأذى في هذين الوقتين، ولهذا كان يجهر في الجمعة والعيدين؛ لأنه أقامهما بالمدينة، وما كان للكفار بالمدينة قوة الأذى، ثم وإن زال هذا العذر بقيت هذه السنة كالرمل في الطواف ونحوه؛ ولأنه واظب على المخافتة فيهما في عمره فكانت واجبة؛ ولأنه وصف صلاة النهار بالعجماء وهي التي لا تبين، ولا يتحقق هذا الوصف لها إلا بترك الجهر فيها، وكذا واظب على الجهر فيما يجهر، والمخافتة فيما يخافت، وذلك دليل الوجوب، وعلى هذا عمل الأمة، ويخفي القراءة فيما سوى الأوليين؛ لأن الجهر صفة القراءة المفروضة، والقراءة ليست بفرض في الأخريين؛ لما بينا فيما تقدم"".</span> فقط واللہ اعلم</p></p>",143909202251,banuri,"('نماز', 'salat')","('نماز کی جماعت', 'namaz-ki-jamat')","('جماعت / امامت', 'jamat-imamat')"
26-06-2018,https://www.banuri.edu.pk/readquestion/شرعي-مسئله-السلام-علیکم-محترم-جناب-مفتی-صاحب-اگر-داڑھی-منڈا-اگر-امامت-کرائے-اور-مقتدی-بھی-داڑھی-کٹانے-والے-ہوں-تو-کیا-نماز-درست-ہوجائے-گی-2/26-06-2018,مقتدی اور امام دونوں داڑھی مونڈھے ہوں تونماز کا حکم,داڑھی منڈا اگر امامت کرائے اور مقتدی بھی داڑھی کٹانے والے ہوں تو کیا نماز درست ہوجائے گی؟,"<p><p style=""text-align:justify;"">اگر داڑھی منڈا شخص امامت کرائے اور مقتدی بھی داڑھی کٹانے والے ہوں تونماز<strong> درست ہے۔</strong></p><p style=""text-align:justify;""><span class=""ar_writing"">""هذا إن وجد غیرهم وإلا فلا کراهة.</span></p><p style=""text-align:justify;""><span class=""ar_writing"">(قوله:هذا) أي ما ذکر من کراهة إمامة المذکورین"". (الدر المختار مع ردالمحتار،  358/2 )</span></p><p style=""text-align:justify;""><span class=""ar_writing"">""عن عائشة قالت: قال رسول الله صلى الله عليه وسلم: "" عشر من الفطرة: قص الشارب، وإعفاء اللحية، و السواك، واستنشاق الماء، وقص الأظفار، وغسل البراجم، ونتف الإبط، وحلق العانة، وانتقاص الماء"". (الصحیح لمسلم:۱؍۱۲۹، رقم الحدیث:۵۶- (۲۶۱)،کتاب الطهارة، باب خصال الفطرة)</span> فقط واللہ اعلم</p></p>",143909201056,banuri,"('نماز', 'salat')","('نماز کی جماعت', 'namaz-ki-jamat')","('جماعت / امامت', 'jamat-imamat')"
25-08-2018,https://www.banuri.edu.pk/readquestion/خلع-لینے-والی-عورت-کی-عدت/25-08-2018,خلع لینے والی عورت کی عدت,میں نے اپنے شوہر سے آج خلع لیا ہے ، مہر واپس کردیا ہے۔میرے لیے عدت کی مدت کتنی ہوگی ؟ اور دوران عدت میکے میں بیٹھ سکتی ہوں؟,"<p><p style=""margin-left:0;margin-right:0;text-align:justify;""><span style=""background-color:#fff;"">جس <span style=""background-color:#fff;"">عورت کو ایام آتے ہوں اس کے لیے طلاق یا خلع  کی صورت میں  عدت کی مدت تین ماہواریاں ہوں گی ، البتہ اگرعورت حاملہ ہوتو عدت بچے کی پیدائش پر ختم ہوگی۔</span></span></p><p style=""margin-left:0;margin-right:0;text-align:justify;""><span style=""background-color:#fff;""><span style=""background-color:#fff;"">جس عورت کی ماہواری بند ہوجائے، اُس کی عدتِ طلاق/ خلع  مہینوں کے اعتبار سے تین ماہ میں پوری ہوگی۔</span></span></p><p style=""margin-left:0;margin-right:0;text-align:justify;""><span style=""background-color:#fff;""><span style=""background-color:#fff;"">خلع کی عدّت کے ایام شوہر کے گھرمیں نامحرم کی طرح  گزارے، لیکن شوہر اگر وہاں رضامندی سے عدت نہ گزارنے دے یا وہاں رہ کر پردہ وغیرہ کی دشواری ہو تو   عدت اپنے والدین کے گھرمیں  گزارسکتی ہے ۔ فقط واللہ اعلم</span></span></p></p>",143909202058,banuri,"('طلاق', 'talaaq')","('عدت', 'iddat')","('عدت', 'iddat')"
05-09-2018,https://www.banuri.edu.pk/readquestion/سرمایہ-کی-حفاظت-کی-یقین-دہانی/05-09-2018,سرمایہ کی حفاظت کی یقین دہانی,"""نیشنل بینک""  کی شریعت کے مطابق ایک سرمایہ داری کی اسکیم ہے کہ جس میں سرمایہ کی حفاظت کی یقین دہانی ہوتی ہے۔ سوال  یہ ہے کہ  کیا یہ اسلامی ہو سکتی ہے کہ آپ کا سرمایہ پر نقصان کا خطرہ نہ ہو؟ میرے خیال سے تو یہ حلال نہیں۔ کیا میں اس میں مال لگا سکتا ہوں؟","<p><p style=""text-align:justify;"">اسلام میں  سرمایہ کاری کے مجوزہ طریقوں میں یہ لازم ہے کہ سرمایہ دار نفع کے ساتھ ساتھ ممکنہ نقصان میں بھی اپنے سرمایہ کے بقدر شراکت  کرے۔ اگر کسی بھی سرمایہ داری کے عقد میں نقصان سے حفاظت کی شرط لگائی جائے تو  بہر حال یہ  شرط فاسد ہے۔  ایسے معاملے میں سرمایہ کاری کرنا جائز نہیں۔</p><p style=""text-align:justify;"">آپ  نے جس اسکیم کی نشان دہی کی ہے اگر اس  میں ایسا ہی ہے تو اس کا بھی یہی حکم ہے۔  ورنہ اس اسکیم کی مکمل تفصیلات  بتا کر اس اسکیم کے بارے میں سوال کیا جاسکتا ہے۔</p><p style=""text-align:justify;""><span class=""ar_writing"">""اشترکا فجاء أحدهما بألف والآخر بألفین علی أن الربح والوضیعة نصفان، فالعقد جائز، والشرط في حق الوضیعة باطل، فإن عملا وربحا، فالربح علی ما شرطا، وإن خسرا فالخسران علی قدر رأس في مالهما"". ( الفتاوى الهندية، کتاب الشرکة، الباب الثالث في شرکة العنان، الفصل الثاني، زکریاجدید ۲/۳۲۶، قدیم ۲/۳۲۰</span>)</p><p style=""text-align:justify;""><span class=""ar_writing"">""عن جابر بن زید (رضي الله عنه) قال: الربح علی ما اصطلحوا علیه، والوضیعة علی المال، هذا في الشریکین، فإن هذا بمائة، وهذا بمأتین"". (مصنف عبد الرزاق، البیوع، باب نفقة المضارب، ووضیعته، المجلس العلمي۸/۲۴۸، رقم:۱۵۰۸۹)</span> فقط واللہ اعلم</p></p>",143909202278,banuri,"('معاملات', 'muamlat')","('سود / بینکاری / انشورنس / شیئرز', 'sood-bankari-insurance-shares')","('سودی فنڈز', 'soodi-funds')"
01-08-2018,https://www.banuri.edu.pk/readquestion/عورت-کی-حکمرانی-سے-متعلق-ایک-روایت/01-08-2018,عورت کی حکمرانی سے متعلق ایک روایت,کیا ایسی کوئی حدیث ہے کہ عورت اگر حکومت میں آجائے تو اس کی اتباع ضروری ہے؟,"<p><p style=""text-align:justify;"">سوال میں ذکر کردہ الفاظ  تلاش کے باوجود  کسی روایت میں نہیں مل سکے۔ </p><p style=""text-align:justify;"">البتہ اس کے برخلاف ایسی روایات ملتی ہیں جن سے معلوم ہوتا ہے کہ عورت حکمرانی کی اہل نہیں، اور عورت کی حکمرانی فتنوں کے لیے راستہ ہموار کرنا ہے ،جیسا کہ سنن الترمذی میں ہے:</p><p style=""text-align:justify;""><span class=""ar_writing"">""حَدَّثَنَا أَحْمَدُ بْنُ سَعِيدٍ الأَشْقَرُ قَالَ: حَدَّثَنَا يُونُسُ بْنُ مُحَمَّدٍ، وَهَاشِمُ بْنُ القَاسِمِ، قَالَا: حَدَّثَنَا صَالِحٌ المُرِّيُّ، عَنْ سَعِيدٍ الجُرَيْرِيِّ، عَنْ أَبِي عُثْمَانَ النَّهْدِيِّ، عَنْ أَبِي هُرَيْرَةَ قَالَ: قَالَ رَسُولُ اللَّهِ صَلَّى اللَّهُ عَلَيْهِ وَسَلَّمَ: «إِذَا كَانَ أُمَرَاؤُكُمْ خِيَارَكُمْ، وَأَغْنِيَاؤُكُمْ سُمَحَاءَكُمْ، وَأُمُورُكُمْ شُورَى بَيْنَكُمْ فَظَهْرُ الأَرْضِ خَيْرٌ لَكُمْ مِنْ بَطْنِهَا، وَإِذَا كَانَ أُمَرَاؤُكُمْ شِرَارَكُمْ وَأَغْنِيَاؤُكُمْ بُخَلَاءَكُمْ، وَأُمُورُكُمْ إِلَى نِسَائِكُمْ فَبَطْنُ الأَرْضِ خَيْرٌ لَكُمْ مِنْ ظَهْرِهَا»"" (أبواب الفتن، رقم الحديث: ٢٢٦٦)</span></p><p style=""text-align:justify;"">ترجمہ: حضرت ابو ہریرہ رضی اللہ عنہ سے روایت ہے کہ رسول اللہ صلی علیہ وسلم نے فرمایا: جب تک تمہارے حکمران بہترین لوگوں میں سے ہوں گے اور تمہارے مال دار سخی اور بخشش کرنے والے ہوں گے اور تمہارے معاملات باہمی مشورہ سے طے پائیں گے تو تمہارے واسطے زمین کے اوپر رہنا قبر میں جانے سے بہتر ہوگا، اور جب تمہارے حکمران تمہارے بد ترین لوگ ہوں اور مال دار بخیل ہوجائیں اور تمہاری سربراہی و حکمرانی عورتوں کے سپرد کردی جائے تو تمہارے لیے زمین کے اوپر رہنے سے قبر میں چلے جانا بہتر ہوگا۔ ""صحیح البخاری"" میں ہے: <span class=""ar_writing"">""حدثنا عثمان بن الهيثم حدثنا عوف عن الحسن عن أبي بكرة قال: ""لقد نفعني الله بكلمة سمعتها من رسول الله صلى الله عليه وسلم أيام الجمل بعد ما كدت أن ألحق بأصحاب الجمل، فأقاتل معهم قال: لما بلغ رسول الله صلى الله عليه وسلم أن أهل فارس قد ملكوا عليهم بنت كسرى، قال: «لن يفلح قوم ولّوا أمرهم امرأة»"". ( كتاب المغازي، باب كتاب النبي صلي الله عليه وسلم إلى كسرى و قيصر، رقم الحديث ٤١٦٣)</span></p><p style=""text-align:justify;"">ترجمہ: حضرت ابو بکرہ رضی اللہ عنہ فرماتے ہیں کہ جنگ جمل کے زمانے میں اللہ نے مجھے ایک فرمان کی وجہ سے نفع پہچایا جو میں نے رسول اکرم صلی اللہ علیہ وسلم سنا تھا ۔۔۔ وہ یہ کہ جب رسول اکرم صلی اللہ علیہ وسلم کو خبر ملی کہ اہلِ فارس نے کسری کی بیٹی کو سلطنت کی حکمرانی دے دی ہے تو رسولِ اکرم صلی اللہ علیہ وسلم نے فرمایا: وہ قوم کبھی کامیاب نہیں ہوسکتی جس نے حکمرانی کسی عورت کے سپرد کی ہو۔</p><p style=""text-align:justify;"">فتح الباری شرح صحیح البخاری میں ہے:</p><p style=""text-align:justify;""><span class=""ar_writing"">""قال الخطابي : في الحديث أن المرأة لا تلي الإمارة ولا القضاء ... والمنع من أن تلي الإمارة والقضاء قول الجمهور"".</span></p><p style=""text-align:justify;"">ترجمہ: امام خطابی نے فرمایا کہ امارت (حکمرانی) اور قضا کے منصب پر عورت فائز نہیں ہوسکتی، اور یہی جمہور کا قول ہے۔</p><p style=""text-align:justify;"">شرح السنۃ للبغوی میں ہے:</p><p style=""text-align:justify;""><span class=""ar_writing"">""قال الإمام: اتفقوا أن المرأة لا تصلح أن تكون إماماً و لا قاضياً؛ لأن الإمام يحتاج إلى الخروج لإقامة أمر الجهاد و القيام بأمر المسلمين، و القاضي يحتاج البررز لفصل الخصومات، و المرأة عورة لا تصلح للبروز، و تعجز لضعفها عند القيام بأكثر الأمور؛ و لأن المرأة ناقصة، و الإمامة و القضاء من كمال الولاية، فلا يصلح لها إلا الكامل من الرجال"". (١/ ٧٧)</span></p><p style=""text-align:justify;"">البتہ وہ امور جن میں عورت کی گواہی شرعاً  قابلِ قبول ہوتی ہے ان امور کی انجام دہی کی ذمہ داری اور ایسے شعبہ کی ذمہ دار عورت کو بنایا جا سکتا ہے اور اس شعبہ کی ذمہ دار خاتون کی بات نہ صرف معتبر سمجھی جائے گی، بلکہ اس کی پاس داری دوسروں پر بھی لازم ہوگی، بشرطیکہ نصوص شرعیہ کے خلاف کوئی فیصلہ یا حکم نامہ جاری نہ کرے۔</p><p style=""text-align:justify;"">فتح الباری شرح صحیح البخاری میں ہے:</p><p style=""text-align:justify;""><span class=""ar_writing"">""وعن أبي حنيفة تلي الحكم فيما تجوز فيه شهادة النساء"" . (کتاب المغازی، باب کتاب النبي صلي الله عليه وسلم إلى كسري و قيصر)</span>فقط واللہ اعلم</p></p>",143909201638,banuri,"('علوم و فنون', 'uloom-funoon')","('حدیث و سنت', 'hadees-sunnat')","('حدیث کا معنی، مفہوم اور اقسام', 'hadees-ka-mana-mafhom-aur-aqsaam')"
