issued_at,link,title,question,answer,fatwa_number,dar_ul_ifta,kitab,bab,fasal
16-08-2018,https://www.banuri.edu.pk/readquestion/طواف-زیارت-کا-آخری-وقت/16-08-2018,طوافِ زیارت کا آخری وقت,طوافِ زیارت کون سی تاریخ تک کر سکتے ہیں؟,"<p><p style=""text-align:justify;"">طوافِ زیارت دس ذوالحجہ کی صبح صادق سے بارہ ذوالحجہ کے غروب آفتاب تک کیا جاسکتا ہے ۔اگر بلاعذرِ شرعی اس وقت میں طواف نہیں کیا تو بعد میں بھی کرنا ہوگا، یہ ذمہ پر رہے گا، البتہ تاخیر کی وجہ سے دم واجب ہوگا۔  ہاں اگرعورت حیض یا نفاس میں تھی اس وجہ سے طوافِ زیارت میں مذکورہ ایام سے تاخیر ہوئی تو اس تاخیر کی وجہ سے عورت پر کوئی دم لازم نہیں ہوگا۔ فقط واللہ اعلم  </p></p>",143909201927,banuri,"('حج', 'haj')","('حج / عمرہ', 'hajj-umrah')","('مناسک حج ، واجبات اور سنن', 'manasik-haj-wajibaat-or-sunan')"
16-08-2018,https://www.banuri.edu.pk/readquestion/رخصتی-سے-پہلے-طلاق-ہوجانے-پر-عدت-کا-حکم/16-08-2018,رخصتی سے پہلے طلاق ہوجانے پر عدت کا حکم,اگر لڑکی کی رخصتی نہیں ہوئی اور نکاح ہوگیاہے اس دوران طلاق ہوگی.اور وہ دوسرے کےساتھ شادی کرنا چاہتی ہے اس کے لیے عدت لازمی ہے؟,"<p><p style=""text-align:justify;"">اگرصرف نکاح ہوا اور رخصتی نہیں ہوئی اور نہ ہی  نکاح کے بعد کبھی لڑکا لڑکی نے تنہائی میں ایسی ملاقات کی ہو جس میں جسمانی تعلق قائم کرنا ممکن ہو  اور طلاق ہوگئی تو اس عورت پر عدت لازم نہیں ،دوسری جگہ نکاح کرسکتی ہے۔ فقط واللہ اعلم</p></p>",143909201929,banuri,"('طلاق', 'talaaq')","('عدت', 'iddat')","('عدت', 'iddat')"
13-08-2018,https://www.banuri.edu.pk/readquestion/سودی-کاروبار-کرنے-کا-حکم-2/13-08-2018,سودی کاروبار کرنے کا حکم,سودی کاروبار کرنا کیساہے؟,"<p><p style=""margin-left:9pt;margin-right:10.3pt;text-align:justify;"">سود ی کاروبار کرنا قرآن اور حدیث کی روشنی میں سراسر حرام اور ناجائز ہے، بلکہ سودی کاروبار کرنا وہ کبیرہ گناہ ہے  جس  کا ارتکاب کرنے والوں کے ساتھ اللہ تعالیٰ نے قرآن پاک میں  جنگ کا اعلان فرمایا ہے۔قرآن کریم  میں ہے:</p><p style=""margin-left:9pt;margin-right:10.3pt;text-align:justify;""><span class=""ar_writing"">﴿ يَاأَيُّهَا الَّذِينَ آمَنُوا اتَّقُوا اللَّهَ وَذَرُوا مَا بَقِيَ مِنَ الرِّبَا إِنْ كُنْتُمْ مُؤْمِنِينَ (278) فَإِنْ لَمْ تَفْعَلُوا فَأْذَنُوا بِحَرْبٍ مِنَ اللَّهِ وَرَسُولِهِ وَإِنْ تُبْتُمْ فَلَكُمْ رُءُوسُ أَمْوَالِكُمْ لَا تَظْلِمُونَ وَلَا تُظْلَمُونَ ﴾ [البقرة: 278، 279]</span></p><p style=""margin-left:9pt;margin-right:10.3pt;text-align:justify;"">ترجمہ: اے ایمان والو! اللہ سے ڈرو اور چھوڑ دو جو باقی رہ گیا سود میں سے اگر تم مؤمن ہو۔ سو اگر تم ایسا نہیں کروگے تو سن لو اعلانِ جنگ اللہ اور اس کے رسول کی طرف سے، اور اگر تم توبہ کرو تو تمہارے اصل اموال تمہارے لیے ہیں نہ تم ظلم کروگے کسی پر اور نہ تم پر ظلم کیا جائے گا۔</p><p style=""margin-left:9pt;margin-right:10.3pt;text-align:justify;""><span class=""ar_writing"">صحيح البخاري (3/ 59)</span></p><p style=""margin-left:9pt;margin-right:10.3pt;text-align:justify;""><span class=""ar_writing"">''حدثنا آدم، حدثنا ابن أبي ذئب، حدثنا سعيد المقبري، عن أبي هريرة، عن النبي صلى الله عليه وسلم، قال: «ليأتين على الناس زمان، لا يبالي المرء بما أخذ المال، أمن حلال أم من حرام»۔</span></p><p style=""margin-left:9pt;margin-right:10.3pt;text-align:justify;""><span style=""background-color:#fff;""><span style=""color:#444;"">ترجمہ:</span></span><span style=""background-color:#fff;""><span style=""color:#444;"">حضرت ابوہریرہ رضی اللہ عنہ نبی اکرم ﷺ سے روایت کرتے ہیں، آپ نے فرمایا :لوگوں پر ایسا زمانہ آئے گا کہ لوگ اس کی پرواہ نہیں کریں گے کہ حلال یا حرام کس ذریعہ سے مال حاصل کیا ہے۔</span></span></p><p style=""margin-left:9pt;margin-right:10.3pt;text-align:justify;""><span class=""ar_writing"">صحيح البخاري (3/ 59)</span></p><p style=""margin-left:9pt;margin-right:10.3pt;text-align:justify;""><span class=""ar_writing"">''حدثنا موسى بن إسماعيل، حدثنا جرير بن حازم، حدثنا أبو رجاء، عن سمرة بن جندب رضي الله عنه، قال: قال النبي صلى الله عليه وسلم: ""رأيت الليلة رجلين أتياني، فأخرجاني إلى أرض مقدسة، فانطلقنا حتى أتينا على نهر من دم فيه رجل قائم، وعلى وسط النهر رجل بين يديه حجارة، فأقبل الرجل الذي في النهر، فإذا أراد الرجل أن يخرج رمى الرجل بحجر في فيه، فرده حيث كان، فجعل كلما جاء ليخرج رمى في فيه بحجر، فيرجع كما كان، فقلت: ما هذا؟ فقال: الذي رأيته في النهر آكل الربا۔ ""</span></p><p style=""margin-left:9pt;margin-right:10.3pt;text-align:justify;""><span style=""background-color:#fff;""><span style=""color:#444;"">ترجمہ :موسی بن اسماعیل، جریر بن حازم، ابورجاء، سمرہ بن جندب سے روایت کرتے ہیں نبی ﷺ نے فرمایا :میں نے دو آدمیوں کو خواب میں رات کو دیکھا کہ میرے پاس آئے اور مجھے ارض مقدس کی طرف لے چلے، وہ دونوں بھی چلے یہاں تک کہ ہم ایک خون کی نہر کے پاس پہنچے جس میں ایک شخص کھڑا تھا اور نہر کے بیچ میں ایک آدمی تھا جس کے سامنے پتھر رکھے ہوئے تھے، تو وہ شخص جو نہر میں تھا آنے لگا جب اس نے باہر نکلنے کا ارادہ کیا تو اس شخص نے اسے پتھر مارا جو کنارے پر تھا، چناں چہ وہ وہیں لوٹ گیا جہاں پہلے تھا اور جب بھی وہ نکلنا چاہتا تو وہ اس کو پتھر مارتا ہے اور اس کو وہیں واپس کر دیتا جہاں وہ پہلے تھا، میں نے پوچھا یہ کیا ہے؟ تو اس شخص نے جواب دیا کہ کہ جس کو آپ نے نہر میں دیکھا ہے وہ سود کھانے والا ہے۔</span></span>فقط واللہ اعلم</p></p>",143909201869,banuri,"('معاملات', 'muamlat')","('سود / بینکاری / انشورنس / شیئرز', 'sood-bankari-insurance-shares')","('متفرقات سود', 'mutafarriqat-e-sood')"
08-08-2018,https://www.banuri.edu.pk/readquestion/شیئرز-اور-پرائز-پانڈ-کی-خرید-و-فروخت/08-08-2018,شیئرز اور پرائز پانڈ کی خرید و فروخت,کیا شیئرز کا کاروبار کرنا جائز ہے؟  نیز پرائز بانڈ پر ملنے والی انعامی رقم استعمال کرنا حلال ہے؟,"<p><h3 style=""text-align:justify;""><span style=""color:#27ae60;""><strong>١) شیئرز کی خرید وفروخت کا حکم:</strong></span></h3><p style=""text-align:justify;"">شیئرزکی خریدوفروخت میں اگر مندرجہ ذیل شرائط کا لحاظ رکھاجاتاہوتوجائزہے، ورنہ نہیں:</p><p style=""text-align:justify;"">1۔ جس کمپنی کے شیئرز کی خرید و فروخت کی جارہی ہو، خارج میں اس کمپنی کا وجود ہو، صرف کاغذی طور پر رجسٹرڈ نہ ہو، اور نہ ہی اس کمپنی کے کل اثاثے نقد کی شکل میں ہوں، بلکہ اس کمپنی کی ملکیت میں جامد اثاثے بھی موجود ہوں۔</p><p style=""text-align:justify;"">2۔ کمپنی کا کل یا کم از کم اکثر سرمایہ حلال ہو۔</p><p style=""text-align:justify;"">3۔ کمپنی کا کاروبار جائز ہو، حرام اشیاء کے کاروبار پر مشتمل نہ ہو۔</p><p style=""text-align:justify;"">4۔ شیئرز کی خرید و فروخت میں، خرید و فروخت کی تمام شرائط کی پابندی ہو۔ (مثلاً: شیئرز خریدنے کے بعد وہ مکمل طورپرخریدار کی ملکیت میں  آجائیں، اس کے بعد انہیں آگے فروخت کیا جائے، خریدار کی ملکیت مکمل ہونے اور قبضے سے پہلے شیئرز آگے فروخت کرنا جائز نہیں ہوگا، اسی طرح فرضی خریدوفروخت نہ کی جائے)</p><p style=""text-align:justify;"">5۔ حاصل شدہ منافع کل کا کل شیئرز ہولڈرز میں تقسیم کیا جاتا ہو، (احتیاطی) ریزرو کے طور پر نفع کا کچھ حصہ محفوظ نہ کیا جاتا ہو۔</p><p style=""text-align:justify;"">6۔ شیئرز کی خرید و فروخت کے دوران بالواسطہ یا بلاواسطہ سود اور جوے کے کسی معاہدے کا حصہ بننے سے احتراز کیا جاتا ہو۔</p><p style=""text-align:justify;"">اگر شیئرز کے کاروبار میں ان شرائط کی رعایت رکھی جائے تو  کاروبار جائز ہوگا، ورنہ نہیں۔</p><h3 style=""text-align:justify;""><strong><span style=""color:#27ae60;"">٢) پرائز بانڈ  پر ملنے والی انعامی رقم کا حکم:</span></strong></h3><p style=""text-align:justify;"">پرائز بانڈ چوں کہ سود اور جوے  پر مشتمل ہوتا ہے، اس وجہ سے اس کی خرید و فروخت جائز نہیں ہے، اور نہ ہی اس پر ملنے والی انعامی رقم لینا جائز ہے، پس اگر انعامی رقم مل جائے تو بانڈ کی اصل رقم کے علاوہ انعامی رقم ثواب کی نیت کے بغیر مستحقِ زکاۃ کو دینا شرعاً ضروری ہے۔فقط واللہ اعلم</p></p>",143909201771,banuri,"('معاملات', 'muamlat')","('سود / بینکاری / انشورنس / شیئرز', 'sood-bankari-insurance-shares')","('حصص / شیئرز', 'hisas-shares')"
12-08-2018,https://www.banuri.edu.pk/readquestion/سوتیلی-ماں-کی-بیٹی-سے-نکاح/12-08-2018,سوتیلی ماں کی بیٹی سے نکاح,ایک عورت کی لڑکی ہے اور ایک آ دمی کا لڑکا، اب یہ دونوں عورت اور مرد آ پس میں نکاح کر لیں تو اس لڑکی اور لڑکے کا آ پس میں نکاح ہو سکتا ہے؟,"<p><p style=""text-align:justify;"">بصورتِ مسئولہ مذکورہ لڑکی اور لڑکے کا آپس میں حرمت کا کوئی رشتہ نہیں ہے، لہٰذا دونوں کا  نکاح جائز ہوگا۔ فقط واللہ اعلم</p></p>",143909201842,banuri,"('نکاح', 'nikah')","('محرمات و غیر محرمات', 'muharramat-o-gher-muharramat')","('نسبی محرمات', 'muharramat')"
15-08-2018,https://www.banuri.edu.pk/readquestion/تبلیغ-میں-چار-ماہ-لگانا/15-08-2018,تبلیغ میں چار ماہ لگانا,تبلیغ میں چار ماہ لگانا کیسا ہے؟,"<p><p style=""text-align:justify;""> تبلیغ میں چار ماہ لگانا انسان کی  اپنی اصلاح اور دین کی دعوت کے احساس کے اجاگر کرنے میں بہت مفید ہے؛ دعوت وتبلیغ میں وقت لگانے کے ساتھ ساتھ  علماء کرام ومفتیان عظام سے جوڑ رکھنا چاہیے، اور  درپیش مسائل میں ان سے رجوع کرتے رہنا چاہیے۔  البتہ گھر والوں اور دیگر متعلقین کے حقوق کا خیال رکھ کر نکلنا چاہیے۔فقط واللہ اعلم</p></p>",143909201887,banuri,"('متفرق کتب', 'mutafarriq-kutub')","('متفرق ابواب', 'mutafarriq-abwab')","('متفرق فصول', 'mutafarriq-fusool')"
14-08-2018,https://www.banuri.edu.pk/readquestion/نماز-میں-خیالات-کا-آنا/14-08-2018,نماز میں خیالات کا آنا,جب میں نماز پڑھتا ہوں تو مجھےدنیا کے خیالات دماغ میں آتے ہیں،کیا کروں؟,"<p><p style=""margin-left:0;margin-right:0;text-align:justify;"">نماز میں خیالات آنے سے نماز فاسد نہیں ہوتی۔  نماز میں جان بوجھ کر دنیا کے خیالات لانا منع ہے، غیر اختیاری وساوس اور خیالات آنے پر مؤاخذہ بھی نہیں ہے، البتہ حتی الامکان خیالات اور وساوس کو دفع کرناچاہیے۔جہاں تک ہوسکے قراءت ،اور تسبیح وغیرہ  کی ادائیگی اور ان کلمات کے معانی ومفہوم کی جانب دھیان رکھا کریں، نیز اللہ تعالیٰ کی عظمت اور جلال کاتصور کرکے نماز اداکیا کریں کہ وہ مجھے دیکھ رہاہے، اور جو رکن ادا کررہے ہوں پوری توجہ اس کی طرف ہو، یعنی سنتوں اور مستحبات کی رعایت رکھتے ہوئے اسے ادا کریں اور یہ دھیان ہو کہ اس کے بعد فلاں عمل کرنا ہے، آہستہ آہستہ عادت پختہ ہوجائے گی اور خیالات دور ہوجائیں گے،اپنے ارادہ سے دوسرے طرف خیال نہ کیا کریں۔فقط واللہ اعلم(امدادالاحکام ،جلد اول ،ص:487)فقط واللہ اعلم</p></p>",143909201883,banuri,"('نماز', 'salat')","('نماز کی شرائط', 'namaz-ki-sharait')","('نماز اور اس کی شرائط و ارکان ، سنن و آداب', 'namaz-or-us-ki-sharait-o-arkaan-sunan-o-aadab')"
17-08-2018,https://www.banuri.edu.pk/readquestion/قربانی-کا-جانور-وزن-کرکے-خریدنا/17-08-2018,قربانی کا جانور وزن کرکے خریدنا,ایک بندہ قربانی کا جانور خریدتے وقت وزن کرکے خریدتاہےکہ اتنا گوشت ہونا چاہیے، جتنا گوشت ہوا اتنی قیمت لگا کر خریدتا  ہے، شریعت میں اس کا کیا حکم  ہے؟ کیا اس طرح قربانی جائز ہے یا نہیں؟,"<p><p style=""text-align:justify;"">موجودہ دور میں بہت سی جگہوں میں یہ رواج ہے کہ  جانوروں کو  وزن کرکے فروخت کرتے ہیں ،  اگر یہ خرید فروخت باہمی رضامندی سے ہو اور جانور کا گوشت وزن کرکے نقد رقم یا غیر جنس کے عوض خریدا جائے تو یہ  جائز ہے اور  ایسی قربانی  بھی بلاشبہ درست ہے، البتہ اِس بات کا لحاظ ضروری ہے کہ خریدتے ہوئے قربانی ہی کو مقصود اور پیشِ نظر رکھاجائے، گوشت کے حصول کی نیت نہ ہو ۔( ماہنامہ بینات ذوا لقعدہ ۱۴۲۹ھ۔ قربانی کے مسائل کاانسائیکلوپیڈیا،  ص: 175) فقط واللہ اعلم</p></p>",143909201940,banuri,"('عبادات', 'ebadat')","('ذبیحہ / قربانی', 'zabiha-qurbani')","('قربانی کا جانور', 'qurbani-ka-janwar')"
