issued_at,link,title,question,answer,fatwa_number,dar_ul_ifta,kitab,bab,fasal
17-04-2018,https://www.banuri.edu.pk/readquestion/کیا-یتیم-پوتی-کا-میراث-میں-حق-ہے/17-04-2018,کیا یتیم پوتی کا میراث میں حق ہے؟,اسلم صاحب کی کل اولاد  پانچ بیٹے اور 2 بیٹیاں ہیں،  مگر اسلم صاحب کی زندگی میں ہی ان کے ایک بیٹے کا انتقال ہو گیا تھا  جس کی دو بیٹیاں ہیں ، سوال یہ ہے کہ کیا اسلم صاحب کی ان دو یتیم پوتیوں کا اسلم صاحب کی متروکہ جائیداد میں کچھ حصہ ہوگا؟ اگر نہیں ہوگا تو کیا اخلاقاً ان کو  کچھ دینا ہوگا؟,"<p><p>واضح رہے کہ میراث کا حق دار ہونے کے لیے وارث کا  مورث ( جس سے میراث ملنی ہے) کی موت کے وقت زندہ ہونا شرعاً ضروری ہے ، صورتِ مسئولہ میں اسلم صاحب کی موت سے پہلے جس بیٹے کا انتقال ہو گیا تھا  وہ اسلم صاحب  کی میراث کا شرعاً  حق دار نہیں ہوا جس کی وجہ سے اس کی بیٹیاں بھی اپنے دادا کی میراث کی  شرعاً  حق دار نہیں ہوئیں،  البتہ تقسیمِ میراث کے وقت مرحوم اسلم صاحب کے چار بیٹے اور دو بیٹیاں اپنی مرضی اور خوشی سے اپنے مرحوم بھائی کی یتیم بیٹیوں کو  کچھ دینا چاہیں تو شرعاً یہ پسندیدہ ہے، سورہ نساء میں ہے:</p><p><span class=""ar_writing"">﴿ وَاِذَا حَضَرَ الْقِسْمَةَ اُولُو الْقُرْبٰی وَالْیَتٰمٰی وَالْمَسٰکِیْنُ فَارْزُقُوْهُمْ مِّنْهُ وَقُوْلُوْا لَهُمْ قَوْلاً مَّعْرُوْفاً ﴾</span>  [النساء:8]</p><p>ترجمہ: اور جب میراث کی تقسیم کے وقت (وہ) قریبی رشتہ دار (جن کا میراث میں شرعی حصہ مقرر نہیں ہو) اور یتیم اور مساکین حاضر ہوں تو انہیں ترکے میں سے کچھ بطورِ رزق دے دو اور ان سے اچھی بات کہو۔ فقط واللہ اعلم</p></p>",143908200003,banuri,"('حقوق و آدابِ معاشرت', 'huqooq-muashret')","('حقوق', 'bahmi-huqooq')","('اولاد کے حقوق', 'olad-ky-hoqoq')"
04-05-2018,https://www.banuri.edu.pk/readquestion/کیا-خرگوش-حلال-ہے-2/04-05-2018,کیا خرگوش حلال ہے؟,کیا خرگوش حلال ہے ؟,"<p><p>خرگوش کھانا حلال ہے، نبی کریم صلی اللہ علیہ و سلم کی خدمت میں خرگوش پیش کیا گیا، آپ ﷺ نے اسے قبول فرمایا۔</p><p><span class=""ar_writing"">"" عن هشام بن زيد بن أنس قال : سمعت أنساً يقول : أنفجنا أرنباً بمر الظهران فسعى أصحاب النبي صلى الله عليه و سلم خلفهتا فأدركتها فأتيت بها أبوطلحة فذبحها بمروة فبعث معي بفخذها أو بوركها إلى النبي صلى الله عليه و سلم فأكله، قال: قلت: أكله ؟ قال: قبله""۔ (سنن الترمذي ، أبواب الأطمعة، باب في أكل الأرنب 4 / 251 ط:داراحياء التراث)</span>فقط واللہ اعلم</p></p>",143908200185,banuri,"('حظر و اباحت', 'mamnooaat-mubahat')","('ماکولات / مشروبات', 'makoolat-mashroobat')","('کھانے پینے کی حلال و حرام ، مکروہ و مباح اشیاء', 'khanay-penay-ki-halal-o-haram-makroh-o-mubah-ashya')"
23-04-2018,https://www.banuri.edu.pk/readquestion/نماز-جمعہ-کی-سنتیں-2/23-04-2018,نماز جمعہ کی سنتیں,نمازِ جمعہ کی کل کتنی سنتیں ہیں؟خطبہ سے پہلے کتنی اور فرض کے بعد کتنی?,<p><p>نمازِ جمعہ سے قبل چار سنتیں ہیں، اور نماز کے بعد چھے سنتیں ہیں، جن میں پہلے چار پڑھے اور اس کے بعد دو پڑھے، یوں نمازِ جمعہ کی کل دس سنتیں ہوئیں۔ فقط واللہ اعلم </p></p>,143908200024,banuri,"('نماز', 'salat')","('سنن و نوافل', 'nawafil')","('سنن و نوافل', 'sunan-o-nawafi')"
05-05-2018,https://www.banuri.edu.pk/readquestion/مرغیوں-کی-دمچیاں-کھانے-کا-حکم-2/05-05-2018,مرغیوں کی دمچیاں کھانے کا  حکم,مرغیوں کی دمچیاں کھانے کا کیا حکم ہے؟,<p><p>اگر مرغیوں کی دمچیوں سے مراد اس کی دم کا وہ حصہ (یعنی شرم گاہ) ہے جہاں سے فضلہ نکلتا ہے تو  اس حصے کا کھانا جائز نہیں ہے۔فقط واللہ اعلم</p></p>,143908200326,banuri,"('حظر و اباحت', 'mamnooaat-mubahat')","('ماکولات / مشروبات', 'makoolat-mashroobat')","('کھانے پینے کی حلال و حرام ، مکروہ و مباح اشیاء', 'khanay-penay-ki-halal-o-haram-makroh-o-mubah-ashya')"
15-01-2018,https://www.banuri.edu.pk/readquestion/دھوبی-سے-کپڑے-دھلوانے-کا-حکم-2/15-01-2018,دھوبی سے کپڑے دھلوانے کا حکم,(1)  دھوبی سےناپاک کپڑادھلوانےسے کیا کپڑاپاک ہو جائے گا؟(2) اور کیا اس میں نماز درست ہو جاۓ گی ؟(3) اگر دھوبی غیر مسلم ہو تو اس کا کیا حکم ہے؟,<p><p> 1-دھوبی سے کپڑے دھلوانا صحیح ہے، خواہ پاک کپڑے دھلوائے جائیں خواہ ناپاک، عموماً دھوبی پانی کی اتنی مقدار استعمال کرتے ہیں جس سے ناپاک کپڑے پاک ہوجاتے ہیں۔ البتہ بہتر یہ ہے کہ ناپاک کپڑے پاک کرکے دھوبی کو دھلنے کے لیے دیے جائیں اور دھوبی کو بھی چاہیے کہ وہ دھلائی کے دوران کم از کم آخری مرتبہ بالکل صاف  اور پاک پانی سے کپڑے نکالے ؛ تاکہ کسی قسم کا شبہ باقی نہ رہے۔</p><p>2- ان کپڑوں میں نماز ہوجائے گی۔</p><p>3-  دھوبی غیر مسلم ہو، لیکن کپڑے عام معروف طریقے سے دھوتا ہو تب بھی یہی حکم ہے۔ فقط واللہ اعلم</p></p>,143904200093,banuri,"('طہارت', 'taharat')","('نجاست اور اس سے پاکی', 'najasat-aur-us-ki-paki')","('نجاست سے پاکی', 'nijasat-aur-us-ki-paki')"
05-05-2018,https://www.banuri.edu.pk/readquestion/بلی-کو-مارنے-کا-حکم-2/05-05-2018,بلی کو مارنے کا حکم,کیا بلی کو مارنا جائز ہے یا نہیں؟,<p><p>عام حالات میں بلی یا کسی بھی جانور کو ستانا درست نہیں، بلکہ ایسا کرنا گناہ کا کام ہے۔ تاہم اگر کوئی بلی ایسی ہو جو موذی ہو اور تکلیف کا باعث بنتی ہو تو ایسی بلی کو مار دینا جائز ہے، لیکن اس میں اس بات کا خیال رکھنا نہایت ضروری ہے کہ اس کو اس طریقے سے مارا جائے کہ اس کو زیادہ تکلیف نہ ہو، مثلاً تیز دھار چھری یاگولی سے مار دیا جائے۔ فقط واللہ اعلم</p></p>,143908200348,banuri,"('حظر و اباحت', 'mamnooaat-mubahat')","('علاج / معالجہ', 'ilaj-mualaja')","('علاج معالجہ کے آداب و حدود', 'ilaj-mualja-k-aadab-o-hudood')"
