issued_at,link,title,question,answer,fatwa_number,dar_ul_ifta,kitab,bab,fasal
04-11-2016,https://www.banuri.edu.pk/readquestion/وضو-کے-بعد-آسمان-کی-طرف-اشارہ-کرنا/04-11-2016,وضو کے بعد آسمان کی طرف اشارہ کرنا,کچھ لوگ وضو کے بعد والی دعا پڑھتے وقت آسمان کی طرف دیکھ کر دعا پڑھتے ہیں کیا یہ سنت ہے؟ اور کچھ لوگ تو اس وقت آسمان کی طرف شہادت والی انگلی سے اشارہ بھی کرتے ہیں کیا یہ سنت ہے یا احناف کی کسی مستند فتوی کی کتاب میں وضو کے بعد ایسا کرنے کا لکھا ہے؟,<p><p>وضو کے بعد کی دعا حدیث سے ثابت اور سنت ہے اور اس وقت آسمان کی طرف دیکھنا بھی سنن ابی داؤد کی روایت میں مذکور ہے، لیکن انگلی سے اشارہ کرنا حدیث سے  ثابت نہیں ہے۔ البتہ  فقہ حنفی کی مستند کتاب حاشیۃ الطحطاوی علی مراقی الفلاح میں وضو کے بعد کلمہ شہادت پڑھتے وقت آسمان کی طرف دیکھنے کے ساتھ شہادت کی انگلی سے اشارہ کرنے کا ذکر بھی ہے. اسی طرح حضور صلی اللہ علیہ وسلم سے خطبات وغیرہ میں شہادتین کے کلمات ادا کرتے وقت شہادت کی انگلی سے اشارہ ثابت ہے۔</p><p>بنا بریں وضو کے بعد  کلمہ شہادت پڑھتے وقت انگلی کے اشارے کوسنت تونہیں کہاجائے گا، لیکن اگر کوئی کلمہ شہادت پڑھتے وقت آسمان کی طرف نگاہ کرنے کے ساتھ شہادت کی انگلی سے اشارہ بھی کرے تو اسے منع بھی نہیں کیا جائے گا۔ فقط واللہ اعلم</p></p>,143802200015,banuri,"('طہارت', 'taharat')","('وضو', 'wuzu')","('وضو،فرائض،سنن،آداب اور وضو توڑنے والی اشیاء', 'wuzo-faraidh-sunan-aadab-or-wuzo-tornay-wali-ashya')"
22-10-2016,https://www.banuri.edu.pk/readquestion/قبر-کے-سرہانے-اور-پائنتی-جانب-سورہ-بقرہ-کا-ابتدائی-وآخری-حصہ-پڑھنے-کا-حکم/22-10-2016,قبر کے سرہانے اور پائنتی  جانب سورہ بقرہ کا ابتدائی وآخری حصہ پڑھنے کا حکم,دفنانے کے بعد سر کی طرف سورہ بقرہ کا اول رکوع اور پاؤں کی طرف آخری رکوع پڑھنا ثابت ہے؟ سر اور پاؤں ہی کی طرف کھڑے ہوکر پڑھنا ہے؟ پہلا رکوع مکمل پڑھا جائے گا یا واولئک ھم المفلحون تک؟,<p><p>1:تدفین کے موقع پر قبر کے سرہانے کی طرف سورہ بقرہ کا ابتدائی حصہ اور پائنتی  جانب آخری حصہ پڑھنا احادیث سے ثابت ہے، حضرت عبداللہ بن عمر رضی اللہ عنہ کی روایت ہے کہ:  نبی کریم صلی اللہ علیہ وسلم نے فرمایا: جب کوئی شخص مرجائے تو اسے (زیادہ دیر تک) روکے نہ رکھو،  اسے جلدی اس کی قبر تک پہنچاؤ، اور اس کے سر کی طرف سورہ بقرہ کا ابتدائی اور پاؤں کی طرف سورت کا آخری حصہ پڑھاجائے۔ (مشکاۃ المصابیح، باب دفن المیت) چوں کہ حدیث میں قبر کے سرہانے اور پائنتی جانب ہی پڑھنے کا ذکر ہے؛ اس لیے یہی سنت ہے۔</p><p>2: تلاوت کی مذکورہ مقدار کھڑے ہوکر پڑھی جائے گی۔</p><p>3:قبر کے سرہانے کی جانب سورہ بقرہ کی ابتدا سے واولئک ھم المفلحون تک اور پائنتی کی جانب آمن الرسول سے آخر تک پڑھا جائے گا۔ فقط واللہ اعلم</p></p>,143801200032,banuri,"('جنائز', 'janaiz')","('نماز جنازہ', 'namaz-e-jinazah')","('جنازہ اور نماز جنازہ کے احکام (فرائض، سنن، مستحبات، مکروہات)', 'janaza-or-namaz-e-janaza')"
12-09-2016,https://www.banuri.edu.pk/readquestion/بریلوی-امام-کی-اقتدا-میں-نماز-کا-حکم/12-09-2016,بریلوی امام کی اقتدا میں نماز کا حکم,"ہم ایک ایسی مسجد میں نماز ارا کرتے ہیں جہاں امام بریلوی مسلک کے ہیں، امام نے پچھلےہفتے دعا میں تین دفعہ ""یا غوث اعظم دستگیر ""کہا اور عربی میں""یارسواللہ انظر الینا ""اکثر کہتے ہیں.ہم لوگ جس سوسائٹی میں رہتے ہیں اس کی 5000 کی آبادی میں صرف یہی ایک مسجد ہے، ہم لوگ دعوت اور تبلیغ کے کام سے منسلک ہیں، مسجد میں دعوت کے کام کی اجازت نہیں، اس نیت سے کہ جوڑ رہے اور نئے ساتھیوں پر محنت ہو اسی امام کے پیچھے نماز پڑھتے ہیں، کیا اس امام کے پیچھے نماز پڑھنا جائز ہے؟ اگر نہیں تو ہم کیا صورت اختیار کریں؟",<p><p>امام صاحب کے الفاظ موہمِ شرک ہیں، لیکن ہمارے اکابر علمائے دیوبند ایسے الفاظ کی بنا پر مشرک قرار نہیں دیتے، بلکہ  انہیں بدعتی اور گمراہ کہا جاسکتا ہے، اس لیے ان کے پیچھے نماز مکروہ تحریمی ہے، کوشش کیجیے کہ کوئی صحیح العقیدہ امام دستیاب ہوجائے، نیز اتنی آبادی میں دوسری مسجد بھی قائم کی جاسکتی ہے. فقط واللہ اعلم</p><p> </p></p>,143712200007,banuri,"('نماز', 'salat')","('نماز کی جماعت', 'namaz-ki-jamat')","('جماعت / امامت', 'jamat-imamat')"
03-01-2017,https://www.banuri.edu.pk/readquestion/سجدہ-تلاوت-کا-طریقہ-ایک-رکعت-میں-متعددسورتیں-پڑھنا/03-01-2017,سجدہ تلاوت کا طریقہ،ایک رکعت میں متعددسورتیں پڑھنا,مجھے آخرکی بیس سورتیں یاد ہیں،اور میں نمازمیں ترتیب سے یہ سورتیں پڑھتی ہوں ، ان میں چھوٹی سورتیں بھی ہیں اور بڑی بھی ،کیانمازمیں ترتیب سے پڑھی جاسکتی ہیں؟مثلاً: پہلی رکعت میں چھوٹی سورت اور پھراگلی رکعت میں اس سے طویل سورت پڑھ سکتی ہوں؟دوسراسوال یہ ہے کہ: کیاایک رکعت میں ایک سے زائدسورتیں پڑھی جاسکتی ہیں؟تیسراسوال یہ ہے: جب نمازمیں کسی سورت کی تلاوت کررہی ہوتی ہوں اور اس میں سجدہ آجائے توکیاکیاجائے؟کس طرح سجدہ کریں ؟اس وقت توقیام میں ہوتے ہیں؟,<p><p>۱۔دوسری رکعت میں بہ نسبت پہلی رکعت کی قرأت کے تین آیتوں سے زیادہ طویل کرنامکروہ ہے،اخیر کی مختصرسورتوں میں اکثرسورتیں حروف وکلمات کی تعدادمیں قریب قریب ہیں ، اس لیے اگرپہلی رکعت میں مثلاً سورۂ اخلاص اور دوسری رکعت میں سورۂ فلق پڑھ لی تب بھی درست ہے۔</p><p>2۔بہتریہ ہے کہ فرض نمازکی ایک رکعت میں سورہ فاتحہ کے بعد ایک ہی سورۃ پڑھی جائے ، دو یازیادہ سورتیں نہ پڑھی جائیں،البتہ اگرکسی نے دوسورتیں ملاکرپڑھ لیں تب بھی نمازدرست ہوجائے گی۔</p><p>3۔نمازمیں اگرسجدہ تلاوت والی آیت پڑھ لی توسجدہ کرنے کاطریقہ یہ ہے کہ اس آیت کے بعد اللہ اکبرکہتے ہوئے سجدے میں چلی جائیں،سجدے کی تسبیح سبحان ربی الاعلیٰ تین مرتبہ پڑھیں اور پھراللہ اکبرکہتے  ہوئے قیام کی طرف لوٹ آئیں اور جہاں سے تلاوت چھوڑیتھی وہیں سے پڑھنا شروع کردیں۔فقط واللہ اعلم</p></p>,143804200007,banuri,"('نماز', 'salat')","('نماز کی شرائط', 'namaz-ki-sharait')","('نماز اور اس کی شرائط و ارکان ، سنن و آداب', 'namaz-or-us-ki-sharait-o-arkaan-sunan-o-aadab')"
02-01-2017,https://www.banuri.edu.pk/readquestion/قرا-ن-خوانی-کے-عوض-کھانا-کھلانا/02-01-2017,قرآن خوانی کے عوض کھانا کھلانا,اگر گھر یا دکان کی برکت کے لیے مدرسہ کے طلبہ کو بلا کر قرآن خوانی کرائی جائے تو کیا اس کے عوض بھی  کھاناکھلانا پلانااور پیسے دینا جائز نہیں؟,<p><p>برکت کے حصول کے لیے قرآن خوانی کرنا اور اس کے بعد کھاناکھلانا جائز ہے۔ فقط واللہ اعلم</p><p> </p></p>,143804200005,banuri,"('علوم و فنون', 'uloom-funoon')","('متعلقات قرآن کریم', 'quran-kareem')","('تلاوت کے احکام اور آداب', 'tilawat-k-ahkaam-aur-aadab')"
03-01-2017,https://www.banuri.edu.pk/readquestion/شوہر-والد-اور-والدہ-میں-میراث-کی-تقسیم/03-01-2017,شوہر،والد اور والدہ میں میراث کی تقسیم,"میری خالہ کی بیٹی کا انتقال ہو گیا ہے، مرحومہ کی کوئی وصیت موجود نہیں ہے, مرحومہ کی کوئی اولادبھی  نہیں ہے, البتہ ان کے  والدین (دونوں)، خاوند، ایک بھائی اور ایک بہن الحمداللّہ حیات ہیں۔ مرحومہ کے مزید کوئی بھائی  بہن نہیں تھے۔ مرحومہ کی عمر 27 سال تھی۔ آپ سے گزارش ہے کے ان کے ورثا ء کی میراث کا تعین کر دیں۔",<p><p>مرحومہ کے کل ترکہ کو چھ حصوں میں تقسیم کیاجائے گا،شوہرکوتین حصے ،والدہ کوایک حصہ اوروالد کودوحصے دیے جائیں گے۔بہن بھائی وراثت سے محروم رہٰیں گے۔</p><p>یعنی سوروپے میں سے پچاس روپے مرحومہ کے شوہرکو،33.33روپے والدکو اور 16.66روپے مرحومہ کی والدہ کو ملیں گے۔فقط واللہ اعلم</p></p>,143804200006,banuri,"('معاملات', 'muamlat')","('وراثت / وصیت', 'wirasat-wasyat')","('ورثاء اور ان کے حصص', 'wurasa-or-un-k-hisas')"
02-01-2017,https://www.banuri.edu.pk/readquestion/فرشتوں-جیسے-نام-بچوں-کے-رکھنا/02-01-2017,فرشتوں جیسے نام بچوں کے رکھنا,"حدیث پاک میں آتا ہے کہ: ""تسموا بأسماء الأنبیاء ولا تسموا بأسماء الملائکۃ"" تو کیا یہ حدیث صحیح ہے؟ فرشتوں جیسے نام بچوں یا بچیوں کے لیے رکھنا جائز ہے کہ نہیں؟","<p><p>مذکورہ بالاحدیث کو امام بخاری رحمہ اللہ نے اپنی کتاب''التاریخ الکبیر''میں نقل کیاہے،اور پھرلکھاہے:''فی اسنادہٖ نظر''کہ اس حدیث کی سندمیں کلام ہے۔(التاریخ الکبیر5/35،ط:بیروت) لہٰذا سندکے اعتبارسے یہ حدیث ضعیف ہے،تاہم حدیث کاجومضمون ہے کہ ""انبیاء علیہم السلام کے ناموں پر نام رکھاجائے اورفرشتوں کے ناموں پرنام رکھنے سے بچاجائے""،اس حدیث کی بناپربعض اہل علم سے فرشتوں کے ناموں پر نام رکھنے کی کراہت منقول ہے۔اور اکثر علماء کے نزدیک فرشتوں کے ناموں پر نام رکھنادرست ہے، لیکن اس بات کاخدشہ ہے کہ لوگ مذاق نہ بنادیں؛ اس لیے اس سے گریز بہترہے۔</p><p> نام رکھنے سے متعلق دیگر احادیث مبارکہ میں انبیاء علیہم السلام کے ناموں پرنام رکھنے کی صراحت کی گئی ہے،چناں چہ سنن نسائی کی روایت میں ہے:’’ حضرت ابووہب رضی اللہ تعالیٰ عنہ روایت کرتے ہیں کہ: رسول کریم صلی اللہ علیہ وآلہ وسلم نے ارشاد فرمایا: تم لوگ (بچوں کے نام) حضرات انبیاء علیہم السلام کے نام پر رکھو۔ اور اللہ تعالیٰ کے نزدیک سب سے زیادہ پسندیدہ نام عبداللہ، عبدالرحمن ہیں۔ ‘‘اس لیے  انبیاء علیہم السلام ،صحابہ کرام رضی اللہ عنہم اورصلحائے امت کے ناموں پر نام رکھنازیادہ بہترہے۔</p><p>نیز فرشتوں کے ناموں پر لڑکیوں کانام رکھنا بھی درست نہیں؛ کیوںکہ اللہ تعالی نے فرشتوں کو مؤنث نہیں بنایا ہے، فرشتوں کامؤنث(لڑکیاں)ہونایہ جاہلیت کا عقیدہ تھا،قرآن کریم نے اسے سختی کے ساتھ رد کیا ہے۔فقط واللہ اعلم</p></p>",143804200003,banuri,"('حقوق و آدابِ معاشرت', 'huqooq-muashret')","('حقوق', 'bahmi-huqooq')","('اولاد کے حقوق', 'olad-ky-hoqoq')"
04-11-2016,https://www.banuri.edu.pk/readquestion/مسبوق-کا-مغرب-کی-نماز-میں-پہلا-قعدہ-بھول-جانا/04-11-2016,مسبوق کا مغرب کی نماز میں پہلا قعدہ بھول جانا,مسبوق مغرب کی نماز کی آخری رکعت میں پہنچا۔ امام کے سلام کے بعد کھڑے ہوکر جو دو رکعات پڑھنی تھیں ان میں سے پہلی میں دو سجدوں کے بعد التحیات کے لیےنہ بیٹھا۔1: اگر غلطی میں نہ بیٹھا تھا تو اس پر سجدہ سہو واجب ہوا یا نہیں؟ 2: اگر جان بوجھ کر نہ بیٹھا تھا تو کیا حکم ہے؟,<p><p>مذکورہ صورت میں اگرغلطی سے نہیں بیٹھا تو آخرمیں سجدہ سہو کرنے سے نماز درست ہوجائے گی۔اگر جان بوجھ کرنہیں بیٹھا تھا تو گناہ گارہ ہوا،سجدہ سہو واجب تھااور سجدہ سہو نہ کرنے کی صورت میں وقت کے اندر نماز دوبارہ پڑھی جائے گی۔فقط واللہ اعلم</p></p>,143802200022,banuri,"('نماز', 'salat')","('سجدہ سہو', 'sajda-sahv')","('سجدہ تلاوت / سجدہ سہو', 'sajda-tilawat-sajda-sahw')"
01-01-2017,https://www.banuri.edu.pk/readquestion/سزا-کے-طور-پر-مالی-جرمانہ-عائدکرنا/01-01-2017,سزا کے طور پر مالی جرمانہ عائدکرنا,لوگوں کے درمیان لڑائی جھگڑا ہوتا ہے تو ہماری برادری کے بڑے لوگ بیٹھ کر فیصلہ کرتے ہیں۔اگر  ایک آدمی کسی کو لوہے کا ہتھوڑا پیٹھ پر مارتا ہے جس سے زخم ہوتا ہے اس زخم پر کچھ ٹانکے لگتے ہیں تو اب برادری والے فیصلہ میں ان پر دو یا تین لاکھ روپے جرمانہ لگا سکتے ہیں ؟تاکہ وہ بھی آئندہ ایسی حرکت نہ کریں اور دوسروں کو بھی سبق مل جائے؟ ایسے ہی ایک آدمی نے دوسرے کی ران پر گولی ماری جو آر پار نکل گئی اس پر مالی جرمانہ لگانا جائز ہے کہ نہیں؟ اگر جائز ہے پھر تو ٹھیک ہے ایسا ہی کرتے ہیں۔ اگر جائز نہیں تو پھر اس طرح مالی جرمانہ کا فیصلہ کرنے والے پر گناہ ہے یا نہیں؟ اور ناجائز کی صورت میں جنہوں نے مالی جرمانہ لیا ہے وہ پیسہ حلال ہے یا حرام؟ ان کو واپس کرنا لازم ہے یا نہیں؟,"<p><p>مالی جرمانہ( جسے تعزیربالمال اور غرامۃ مالیہ کہاجاتاہے) جائزنہیں ہے،اس لیے اگربطور زجروتنبیہ مالی جرمانہ لیاجائے تواسے واپس کردیناچاہیے،مالی جرمانہ عائدکرنایاوصولی کی صورت میں اسے خرچ کرنا،استعمال میں لانادونوں صورتوں ناجائزہیں۔کسی شخص کے جرم کی بناپرمالی جرمانہ عائدکرکے جرائم سے روکناناممکن ہے ،شرعی اعتبارسے جرائم کی صورت میں بقدرجرم جوسزائیں عائدکی گئی ہیں ان سزاوں کے نفاذ سے ہی جرائم کاخاتمہ ہوسکتاہے,ان سزاؤں میں جہاں ہاتھ کے بدلے ہاتھ اورکان کے بدلے  کان یعنی قصاص کااصول ہے وہیں قصاص کے بدلے دیت لینے اور مصالحت کی بھی گنجائش ہے; اس لیے شرعی دیت  پر یا بطور صلح دونوں فریقین کی رضامندی سے دیت کے بجائے مال کی کسی مقدار پر فیصلہ کیا جاسکتا ہے۔</p><p>واضح رہے کہ انسانی جان اور اس کے جسم کے مختلف حصوں کی دیت کی مقدار شرعاً متعین ہے، جسم کے کسی حصے پر جنایت کا مسئلہ درپیش ہو تو  علماء کرام سے رجوع کرکے متاثرہ عضو کی دیت کی مقدار معلوم کرلی جائے۔ فقط واللہ اعلم</p></p>",143804200002,banuri,"('معاملات', 'muamlat')","('حدود / قصاص', 'hudood-qisas')","('تعزیری سزائیں', 'ta-zeeri-sazayen')"
30-12-2016,https://www.banuri.edu.pk/readquestion/چندہ-سے-مسجد-کا-وضوخانہ-تعمیر-کرنا/30-12-2016,چندہ سے مسجد کا وضوخانہ تعمیر کرنا,کیامسجدکی تعمیرات میں (وضو خانہ بنانے میں)اجتماعی پیسے جوچندے میں جمع ہوتے ہیں وہ استعمال کرسکتے ہیں؟تعمیرات میں کون سے مال کااستعمال جائزہے اورکون سے مال کااستعمال ناجائزہے؟,<p><p>مسجد کا وضوخانہ مسجدکی ضروریات اور مصالح میں داخل ہے؛ اس لیے اجتماعی چندہ وضوخانے کی تعمیر میں لگاسکتے ہیں۔مسجدکاعمومی چندہ (زکاۃ اور واجب صدقات کے علاوہ)مسجدکی تمام ضروریات بشمول مسجداور وضوخانہ وغیرہ کی تعمیرات میں لگاناجائزہے۔ فقط واللہ اعلم</p></p>,143803200040,banuri,"('نماز', 'salat')","('مسجد کے آداب و احکام', 'masjid-k-aadab-o-ahkaam')","('مسجد کے آداب و احکام', 'masjid-k-aadab-o-ahkam')"
28-12-2016,https://www.banuri.edu.pk/readquestion/ہیلتھ-میرج-اور-ایجوکیشن-انشورنس-کا-حکم/28-12-2016,ہیلتھ ،میرج اور ایجوکیشن انشورنس کا حکم,ہیلتھ انشورنس،ایجوکیشن انشورنس اور شادی انشورنس کا کیا حکم ہے؟,<p><p>انشورنس کی مروجہ تمام اقسام (بشمول ہیلتھ انشورنس،ایجوکیشن انشورنس اورمیرج  انشورنس کے )سوداورجوئے پرمشتمل ہونے کی بناپرناجائزہیں۔فقط واللہ اعلم</p></p>,143803200038,banuri,"('معاملات', 'muamlat')","('سود / بینکاری / انشورنس / شیئرز', 'sood-bankari-insurance-shares')","('بیمہ زندگی / انشورنس / تکافل', 'bima-zindagi-insurance-takaful')"
27-12-2016,https://www.banuri.edu.pk/readquestion/قبضہ-سے-پہلے-خریدی-ہوئی-چیز-آگے-فروخت-کرنا/27-12-2016,قبضہ سے پہلے خریدی ہوئی چیز آگے فروخت کرنا,ہم اپنے شہر کے کسی رائس مل والے سے موبائل پر بات کرکے ان سے ایک ٹرک بھرا ہوا چاول کے لیے سودا طے کرلیتے ہیں،پھر دوسرے شہر بات کرکے کچھ منافع پر فروخت کردیتے ہیں۔ اپنے شہر والے رائس مل والے کو فون کرکے کہتے ہیں کہ: ہمارے چاول کا ٹرک بھر کر فلاں شہر ،فلاں آدمی کے نام بھیج دو۔ کیا اس طرح کرنا جائز ہے؟,<p><p>شرعی اعتبارسے خریدی ہوئی چیز مکمل قبضہ سے پہلے  کسی دوسرے شخص کے ہاتھ پربیچناجائزنہیں ہے، لہذا جب تک چاول آپ کے قبضے میں نہ آجائیں اس وقت تک صرف فون پر معاملہ کرکے اس طرح کسی دوسرے شخص کے ہاتھ فروخت نہیں کرسکتے ،ذکرکردہ طریقہ درست نہیں،البتہ اگرآپ کی طرف سے کوئی شخص رائس مل سے چاول خریدکراس پر قبضہ کرلے اورپھر آپ اسے  آگے فروخت کردیں توجائز ہوگا۔فقط واللہ اعلم</p></p>,143803200037,banuri,"('معاملات', 'muamlat')","('بیع / تجارت', 'bay-tijarat')","('بیع صحیح ، فاسد اور باطل', 'bay-sahih-fasid-or-batil')"
24-12-2016,https://www.banuri.edu.pk/readquestion/بالوں-کی-پیوندکاری-کا-حکم/24-12-2016,بالوں کی پیوندکاری کا حکم,علماءکرام سے اس مسئلہ کی بابت معلوم کرنا ہے کہ کیا بالوں کی پیوند کاری جائز ہے؟ ایسے بال لگوانا جو جڑ سمیت لگائے جاتے ہیں اور عام بالوں کی طرح بڑھتے رہتے ہیں جائز ہے؟,<p><p>کسی شخص کے سر یا جسم کے  ایک حصہ کے بال لے کراُسی شخص کے سرکے دوسرے حصہ پر بذریعہ آپریشن اس طرح لگادیناکہ وہ عام بالوں کی طرح بڑھتے بھی رہیں اوراس طرح پیوست ہوں کہ علیحدہ نہ کیے جاسکتے ہوں تواس طرح کی پیوندکاری کی گنجائش ہے۔تاہم گنجپن دورکرنے کے لیے اس طرح پیوندکاری اور آپریشن کی مشقت اٹھاناکسی خاص ضرورت یاشرعی مجبوری کے تحت داخل نہیں؛ اس لیے اگراس قسم کے آپریشن سے بچاجائے توبہترہے۔ترمذی شریف میں حضرت عمران بن حصین رضی اللہ عنہ سےمنقول ہے:کہ رسول اللہ صلی اللہ علیہ وآلہ وسلم نے داغنے سے منع فرمایا۔ راوی کہتے ہیں:پس جب ہم بیمار ہوئے تو ہم نے داغ لگایا، لیکن ہم نے مرض سے چھٹکارا نہیں پایا اور نہ ہی کامیاب ہوئے۔</p><p>اور اگر کسی دوسرے شخص کے بال لگائے جائیں تو اس طرح کی پیوند کاری شرعاً جائزنہیں ہے۔ فقط واللہ اعلم</p></p>,143803200033,banuri,"('حظر و اباحت', 'mamnooaat-mubahat')","('علاج / معالجہ', 'ilaj-mualaja')","('اعضاء کی پیوندکاری', 'a-aza-ki-pewand-kari')"
16-11-2016,https://www.banuri.edu.pk/readquestion/وطن-اقامت-میں-اتمام-ضرروی-ہے/16-11-2016,وطن اقامت میں اتمام ضرروی ہے,میں اپنے گھرسے 80کلومیٹردور ڈی جی خان میں اپنے ایک عزیزکے گھر اپنی بیوی اورامی کے ساتھ رہتاہوں،یہاں ہم نے دوسال رہناہے،اورہم ہرہفتے اپنے گھرتونسہ جاتے ہیں،توکیاہم یہاں ڈی جی خان میں پوری نمازپڑھیں گے یاقصرکریں گے؟,"<p><p>ڈی جی خان میں دوسال  اقامت اختیارکرتے وقت اگر یہ نیت تھی کہ ہر ہفتہ ڈی جی خان سے تونسہ جائیں گے تواس صورت میں آپ ڈی جی خان میں مسافر ہوں گے  اور قصر نماز ادا کریں گے.اوراگرڈی جی خان میں دوسال کی  اقامت اختیارکرتے وقت  ہرہفتہ تونسہ جانے کی  نیت نہیں تھی, بلکہ بعد میں ضرورت کی بنا پرہرہفتہ تونسہ جانے کی نوبت آتی ہے تو پھر آپ ڈی جی خان میں مقیم ہیں،مکمل نمازاداکریں گے۔فقط واللہ اعلم</p></p>",143802200047,banuri,"('نماز', 'salat')","('مسافر کی نماز', 'musafir-ki-namaz')","('مسافر کی نماز', 'musafir-ki-namaz')"
