issued_at,link,title,question,answer,fatwa_number,dar_ul_ifta,kitab,bab,fasal
01-02-2016,https://www.banuri.edu.pk/readquestion/حدیث-میں-عورت-کی-محبوبیت-کے-ذکر-کی-حکمت/01-02-2016,حدیث میں عورت کی محبوبیت کے ذکر کی حکمت,حضرت انس بن مالک سے روایت ہے کہ رسول اللہ نے فرمایا، مجھے دنیا میں عورتوں اور خوشبو سے محبت دی گئی اور میری آنکھوں کی ٹھنڈک نماز میں رکھی گئی، حضرت حسن سے روایت ہےکہ رسول اللہ صلی اللہ علیہ وسلم نے فرمایا، میں دنیا کی عیش میں سوائے عورتوں اور خوشبو کے کچھ نہیں چاہتا۔ میموں سے روایت ہے  رسول اللہ صلی اللہ علیہ وسلم  نے دنیا کی عیش میں سے سوائے عورت اور خوشبو کے کچھ حاصل نہیں کیا۔ حضرت عائشہ رضی اللہ عنہا سے روایت ہے کہ نبی کریم صلی اللہ علیہ وسلم کو دنیا کی تیں چیزیں پسند تھیں، کھانا، عورتیں اور خوشبو، آپ نے دو چیزیں پائیں، ایک نہیں پائی، عورتیں اور خوشبو پائی، کھانا نہیں پایا۔سوال یہ ہے کہ  ایک  ملحد نے ان احادیث کوسامنے رکھتے ہوئے نبی کریم صلی اللہ علیہ وسلم کی شان میں گستاخی کی ہے ،میں اسے کیسے ان باتوں پرقائل کروں یاسمجھاوں؟,<p><p>مذکورہ احادیث اوراس طرح کی دیگرروایات سرکاردوعالم صلی اللہ علیہ وسلم سے مروی ہیں۔اوران کاحاصل یہ ہے کہ آپ صلی اللہ علیہ وسلم کے محبوب امورمیں سے ایک عورتیں بھی تھیں،ازواج مطہرات کی کثرت موجودتھی اورخوشبوتوخودآپ صلی اللہ علیہ وسلم کی ذات میں تھی،مگرکھانے پینے کے اعتبارسے قلت ضرورتھی،غزوہ خیبرتک تومہینوں مہینوں صرف کھجوراورپانی پرگزارہ ہوتاتھا،خیبرکے بعدکچھ سہولت ہوئی توسخاوت اورجودوایثارکی وجہ سے باوجودفراخی کے اپنی ذات کوکچھ فائدہ نہیں پہنچاتے تھے ،جوآتاسب دوسروں پرتقسیم ہوجاتاتھا،سائلوں کواورضرورت مندوں کودے دیاجاتاتھا،خودنبی کریم صلی اللہ علیہ وسلم بہت کم اس سے مستقیدہوپاتے تھے،یہی مطلب ہے مندرجہ بالاحدیث میں حضرت عائشہ رضی اللہ عنہاکے اس قول کاکہ آپ کھانانہیں پاسکے۔جہاں تک عورتوں سے محبت کے ذکرکی بات ہے تویہ سمجھناچاہیے کہ عورتوں سے محبت کی وجہ جہاں انسانی فطری خواہشات کی تکمیل ہوتی ہے وہاں خانگی ضرورت،گھریلوسہولتیں وغیرہ بھی ان سے ملتی ہیں،گھرکاپورانظام ان عورتوں سے قائم رہتاہے،رنجم وغم میں شریک ہی نہیں بلکہ ان کے برتاوسے زندگی کی الجھنیں ،پریشانیاں دورہونے میں بھی تعاون حاصل رہتاہے،غرض کہ دنیامیں صالح عورتیں جنت کی طرح راحت کاباعث ہوتی ہیں ،اس بناپرآپ کوعورتیں محبوب تھیں۔اعداء اسلام اورملحدین عرصے سے اس طرح کی باتوں کوبنیادبناکراسلام اورپیغمبراسلام پراعتراضات کرتے رہے ہیں یہ کوئی انوکھی بات نہیں،اس سلسلہ میں مفتی اعظم پاکستان مولانامفتی محمدشفیع رحمہ اللہ کی مذکورہ مسئلہ سے متعلق ایک تحریرنقل کی جاتی ہے ،امیدہے کہ تشفی بخش ہوگی:</p><p> '' رسول اللہ صلی اللہ علیہ وآلہ وسلم کی زاہدانہ زندگی اور اس کے ساتھ تعدد ازواج کا مسئلہ:</p><p>اعداء اسلام نے ہمیشہ مسئلہ تعدد ازواج اور خصوصاً رسول اللہ صلی اللہ علیہ وآلہ وسلم کی کثرت ازواج کو اسلام کی مخالفت میں موضوع بحث بنایا ہے، لیکن رسول اللہ صلی اللہ علیہ وآلہ وسلم کی پوری زندگی کو سامنے رکھا جائے تو کسی شیطان کو بھی شان رسالت کے خلاف وسوسہ پیدا کرنے کی گنجائش نہیں رہتی۔ جس سے ثابت ہے کہ آپ نے سب سے پہلا نکاح پچیس سال کی عمر میں حضرت خدیجہ سے کیا، جو بیوہ سن رسیدہ صاحب اولاد اور دو شوہروں کے نکاح میں رہنے کے بعد آئی تھیں، اور پچاس سال کی عمر تک صرف اسی ایک سن رسیدہ بیوی کے ساتھ شباب کا پورا زمانہ گزارا۔ یہ پچاس سالہ دور عمر مکہ کے لوگوں کے سامنے گزرا۔ چالیس سال کی عمر میں اعلان نبوت کے بعد شہر میں آپ کی مخالفت شروع ہوئی، اور مخالفین نے آپ کے ستانے اور آپ پر عیب لگانے میں کوئی کسر اٹھا نہیں رکھی، ساحر کہا، شاعر کہا، مجنون کہا، مگر کبھی کسی دشمن کو بھی آپ کی طرف کوئی ایسی چیز منسوب کرنے کا موقع نہیں مل سکا، جو تقویٰ و شہارت کو مشکوک کر سکے۔پچاس سال عمر شریف کے گزرنے اور حضرت خدیجہ کی وفات کے بعد حضرت سودہ نکاح میں آئیں یہ بھی بیوہ تھیں ۔ہجرت مدینہ اور عمرشریف چون سال ہو جانے کے بعد ۲ ہجری میں حضرت صدیقہ عائشہ کی رخصتی آنحضرت صلی اللہ علیہ وآلہ وسلم کے گھر میں ہوئی۔ اس کے ایک سال بعد حضرت حفصہ سے اور کچھ دنوں کے بعد حضرت زنیب بنت خزیمہ سے نکاح ہوا۔ یہ حضرت زینب چند ماہ کے بعد وفات پا گئیں ۔ ٤ ہجری میں حضرت ام سلمہ جو صاحب اولاد بیوہ تھیں آپ کے نکاح میں آئیں ۔ ۵ ہجری میں حضرت زینب بنت جحش سے بحکم خداوندی نکاح ہوا ، جس کا ذکر سورہ احزاب کے شروع میں آ چکا ہے۔ اس وقت آپ کی عمر شریف اٹھاون سال تھی۔ آخری پانچ سال میں باقی ازواج مطہرات آپ کے حرم میں داخل ہوئیں ۔ پیغمبر کی خانگی زندگی اور گھریلو معاملات سے متعلق احکام دین کا ایک بہت بڑا حصہ ہوتے ہیں ۔ ان نو ازواج مطہرات سے جس قدر دین کی اشاعت ہوئی اس کا اندازہ صرف اس سے ہو سکتا ہے کہ صرف حضرت صدیقہ عائشہ سے دو ہزار دو سو دس احادیث اور حضرت ام سلمہ سے تین سو اڑسٹھ احادیث کی روایت معتبر کتب حدیث میں جمع ہیں ۔ حضرت ام سلمہ نے جو احکام و فتاویٰ لوگوں کو بتلائے ان کے متعلق حافظ ابن قیم نے اعلام الموقعین میں لکھا ہے کہ اگر ان کو جمع کر لیا جائے تو ایک مستقل کتاب بن جائے، دو سو سے زیادہ حضرات صحابہ حضرت صدیقہ عائشہ کے شاگرد ہیں، جنہوں نے حدیث اور فقہ و فتاویٰ ان سے سیکھے ہیں ۔</p><p>اور بہت سی ازواج کو حرم نبوی میں داخل کرنے میں ان کے خاندان کو اسلام کی طرف لانے کی حکمت بھی تھی۔ رسول اللہ صلی اللہ علیہ وآلہ وسلم کی زندگی کے اس اجمالی نقشہ کو سامنے رکھیں تو کیا کسی کو یہ کہنے کی گنجائش رہ سکتی ہے کہ یہ تعدد اور کثرت ازواج معاذ اللہ کسی نفسانی اور جنسی خواہش کی تکمیل کے لئے ہوا تھا، اگر یہ ہوتا تو ساری عمر تجرد یا ایک بیوہ کے ساتھ گزارنے کے بعد عمر کے آخری حصہ کو اس کام کے لئے کیوں منتخب کیا جاتا۔ یہ مضمون پوری تفصیل کے ساتھ، نیز اصل مسئلہ تعدد ازواج پر شرعی اور عقلی، فطری اور اقتصادی حیثیت سے مکمل بحث معارف القرآن جلد دوم سورہ نساء کی تیسری آیت کے تحت میں آ چکی ہے وہاں دیکھا جائے۔ (معارف جلد دوم، ص ۵۸۲ تا ۲۹۲)''</p><p>فقط واللہ اعلم</p></p>,143704200021,banuri,"('علوم و فنون', 'uloom-funoon')","('حدیث و سنت', 'hadees-sunnat')","('حدیث کا معنی، مفہوم اور اقسام', 'hadees-ka-mana-mafhom-aur-aqsaam')"
02-02-2016,https://www.banuri.edu.pk/readquestion/بوجہ-مجبوری-حرام-روزگار-کو-اختیار-کرنا/02-02-2016,بوجہ مجبوری حرام روزگار کو اختیار کرنا,آپ نے فرمایا تھا کہ کسی بھی اسلامی بینک میں نوکری درست نہیں، پوچھنا یہ ہے کہ اگر کسی اور جگہ نوکری نہ مل رہی ہو تو پھر اس صورت میں کسی اسلامی یا سودی بینک میں نوکری کی جاسکتی ہے؟,<p><p>اگر کسی اور جگہ نوکری نہ مل رہی ہو، اور حالات اس قدر خراب ہو جائیں کے انتہائی سخت مشقت اور مجبوری میں پڑجانے کا خوف ہو، تو بوجہ مجبوری صرف وقتی طور پر بینک میں نوکری کی جاسکتی ہے۔ تاہم اس نوکری کے ساتھ ساتھ حلال روزگار کے حصول کی تلاش بھی جاری رکھنا ضروری ہے، یہ نہ ہو کہ اسی نوکری پر تکیہ کر کے حلال روزگار کی تلاش میں کسی قسم کی کوتاہی یا غفلت برتی جائے۔</p></p>,143704200022,banuri,"('معاملات', 'muamlat')","('سود / بینکاری / انشورنس / شیئرز', 'sood-bankari-insurance-shares')","('اسلامی بینکاری', 'islami-bankari')"
20-01-2016,https://www.banuri.edu.pk/readquestion/نماز-میں-رفع-یدین-کا-حکم/20-01-2016,نماز میں رفع یدین کا حکم,کیافرماتے ہیں مفتیان کرام رفع الیدین کے بارے میں ؟ رفع الیدین سنت ہے یاواجب؟ اور بغیر رفع الیدین کے نماز ہوتی ہے یا نہیں؟ مفصل جواب تحریر کریں ۔,<p><p><strong>رفع یدین کامسئلہ صحابہ کرام رضی اللہ عنہم کے زمانہ سے مختلف فیہ ہے،حضورصلی اللہ علیہ وسلم کے وصال کے بعد بعض صحابہ کرام رفع یدین کرتے تھے اوربعض نہیں کرتے تھے۔اسی وجہ سے مجتہدین امت میں بھی اس مسئلہ میں اختلاف ہواہے،امام ابوحنیفہ رحمہ اللہ نے ترک رفع یدین والی روایات کوراجح قراردیاہے،کئی اکابرصحابہ کرام کامعمول ترک رفع کاتھا،اوریہی نبی کریم صلی اللہ علیہ وسلم کاآخری عمل ہے۔ احناف کے نزدیک  ترک رفع یدین ہی  سنت ہے۔فقط واللہ اعلم</strong></p></p>,143704200008,banuri,"('نماز', 'salat')","('نماز کی شرائط', 'namaz-ki-sharait')","('نماز اور اس کی شرائط و ارکان ، سنن و آداب', 'namaz-or-us-ki-sharait-o-arkaan-sunan-o-aadab')"
20-01-2016,https://www.banuri.edu.pk/readquestion/4بیٹوں-اور5بیٹیوں-میں-میراث-کی-تقسیم/20-01-2016,4بیٹوں اور5بیٹیوں میں میراث کی تقسیم,کچھ دن پہلے میری نانی کاانتقال ہوااوران کے ورثاء میں 5 بیٹیاں اور4 بیٹے ہیں،اورایک بہن ہے۔میری نانی کے پاس کچھ کیش تھا جومیرے نانا8 سال پہلے اپنی وصیت میں میری نانی کودے کرگئے تھے ان کے اخراجات کے لیے۔بتایئے کہ ان کے اس اثاثے کوکس طرح ان کے ورثاء میں تقسیم کیاجائے۔,<p><p>مرحوم نانا کاکل متروکہ مال 13حصوں میں تقسیم کرکے 2،2 حصے ہرایک بیٹے کودیئے جائیں گے اورایک ،ایک حصہ ہرایک بیٹی کودیاجائے گا۔یعنی سوروپے میں سے 15.38روپے  ہرایک بیٹے کواور7.69روپے ہرایک بیٹی کوملیں گے۔</p><p>اگر نانا اور نانی کے ورثاء یہی ہوں اور اس کے علاوہ کوئی اور نہ ہو تو جو کیش رقم نانا نے نانی کو دینے کی وصیت کی تھی وہ بھی درج بالا تناسب سے تقسیم کردی جائے۔</p><p> </p></p>,143704200007,banuri,"('معاملات', 'muamlat')","('وراثت / وصیت', 'wirasat-wasyat')","('ورثاء اور ان کے حصص', 'wurasa-or-un-k-hisas')"
16-01-2016,https://www.banuri.edu.pk/readquestion/بیوی-کے-ساتھ-شوہر-کا-حسن-سلوک/16-01-2016,بیوی کے ساتھ شوہر کا حسن سلوک,کیایہ بات درست ہے کہ قیامت کے دن ترازو میں سب سے پہلے خاوند کابیوی سے سلوک تولاجائے گا،اوراگربیوی سے سلوک اچھانہ ہواتووہ جہنم میں جائے گا۔,<p><p>قرآن کریم میں یہ حکم دیاگیاہے ’’عورتوں کے ساتھ اچھی طرح زندگی بسرکرو‘‘۔(النساء:۱۹)</p><p>اورحدیث میں نبی کریم صلی اللہ علیہ وسلم کاارشادگرامی ہے:’’تم میں سے بہتروہ ہے جواپنے گھروالوں کے لیے بہترہےاورمیں اپنے گھروالوں کے لیے بہترہوں‘‘۔</p><p>اس سے معلوم ہواکہ بیویوں کے ساتھ حسن سلوک اوران کے ساتھ خوش اسلوبی سے پیش آناقرآن وسنت کے احکامات میں شامل ہے،حسن سلوک اورحسن اخلاق کی اہمیت اورقیامت کے دن اعمال کے ترازومیں اس کے وزنی ہونے سے متعلق ترمذی شریف میں مندرجہ ذیل حدیث موجودہے: ’’حضرت ابوالدرداء رضی اللہ عنہ سے روایت ہے رسول اللہ صلی اللہ علیہ وسلم سے نقل فرماتے  ہیں کہ آپ نے ارشادفرمایاقیامت کے دن مومن کی میزان عمل میں سب سے زیادہ وزنی اوربھاری چیزجورکھی جائے  گی وہ اس کے اچھے اخلاق ہوں گے‘‘۔</p><p>قیامت میں سب سے پہلے سوال کس چیزسے متعلق کیاجائے گا؟اس بارے میں مختلف احادیث میں علماء کرام نے یہ تطبیق دی ہے کہ  حقوق اللہ میں سب سے پہلے نمازکاسوال کیاجائے گا۔حقوق العباد میں سب سے پہلا فیصلہ خون ناحق کاکیاجائے گا،اورمعاشرت کے باب میں میاں بیوی کاایک دوسرے کے ساتھ سلوک سے متعلق سوال ہوگا۔فقط واللہ اعلم</p></p>,143704200005,banuri,"('حقوق و آدابِ معاشرت', 'huqooq-muashret')","('حقوق', 'bahmi-huqooq')","('میاں ، بیوی کے حقوق', 'mian-biwi-k-huqooq')"
12-12-2015,https://www.banuri.edu.pk/readquestion/نمازمیں-دوسرے-کے-بتانے-پر-عمل-کرنا/12-12-2015,نمازمیں دوسرے کے بتانے پر عمل کرنا,دو آدمی نمازپڑھ رہے تھے جس میں سے ایک امام اوردوسرا مقتدی تھا کسی تیسرے آدمی نے آکران دونوں کے کان میں ایک ایک کرکے بولاکہ امام آپ تھوڑا آگے ہوجائیں ، اورمقتدی سے کہاکہ آپ تھوڑاپیچھے ہوجائیں،تاکہ  میں بھی آپ کے ساتھ نمازمیں شریک ہوجاوں،تواس صورت میں امام اورمقتدی نے ان کالقمہ قبول کرلیا تو ان کی نمازہوجائے گی یاٹوٹ جائے گی؟,<p><p><strong>صورت مسئولہ میں اگرامام اورمقتدی نمازسے خارج آدمی کی بات پرعمل کرتے ہوئے  آگے پیچھے ہوئے توان کی نمازٹوٹ گی۔اس لیے کہ اگرکوئی نمازی نمازکے اندردوسرے کے بتانے پرعمل کرتاہے تونمازفاسدہوجاتی ہے۔ایسی صورت میں نمازی کوچاہئے کہ تھوڑی دیروقفہ کرے اورپھراپنی مرضی سے وہ کام کرے۔(فتاویٰ شامی،1/622،کتاب الصلوۃ،ط:سعید)فقط واللہ اعلم</strong></p><p> </p></p>,143702200032,banuri,"('نماز', 'salat')","('نماز توڑنے والی چیزیں', 'namaz-torney-wali-chezen')","('نماز توڑنے والی اشیاء', 'namaz-tornay-wali-ashya')"
23-01-2016,https://www.banuri.edu.pk/readquestion/مشترکہ-فلیٹ-کی-شرعی-تقسیم/23-01-2016,مشترکہ فلیٹ کی شرعی تقسیم,میں نے اپنے والد کے ساتھ مل کر کراچی میں ایک فلیٹ خریدا تھا، جس کی قیمت اب پینسٹھ لاکھ ہے۔ اس رقم میں ہم دونوں شریک تھے، میرا حصہ اس میں زیادہ تھا، فلیٹ میرے ہی نام پر ہے، اور میری شادی کے وقت میرے والدین نے مجھے ہی اس فلیٹ کے مالک کے طور پر نامزد کیا تھا، لیکن یہ بات واضح طور پر نہیں تھی۔ اب ہم یہ فلیٹ بیچنا چاہ رہے ہیں اور اس کی بجائے دوسرافلیٹ خریدنا چاہ رہے ہیں۔ میری والدہ اور میری بہنیں اپنا حصہ مانگ رہی ہیں۔ اب مجھے معلوم نہیں کہ میں انہیں ان کا حصہ کس طرح ادا کروں۔ میری ایک بیوی اور ایک بیٹی ہے، کیا ان کو بھی اس فلیٹ میں حصہ ملے گا؟ میری بہن بھی شادی شدہ ہے، اور میری والدہ میرے ساتھ رہ رہی ہیں، اور ان کی دیکھ بھال میں ہی کر رہا ہوں۔ مجھے بتا دیجیے کہ یہ فلیٹ جو میرے اور میرے والد کا مشترکہ ہے، اس کی تقسیم کس طرح ہو گی؟,<p><p>اس مشترکہ فلیٹ میں جس قدر رقم آپ کے والد کی تھی، اسی تناسب سے اس فلیٹ کی موجودہ مالیت کے اعتبار سے جو رقم بنتی ہو، اس کے مالک آپ کے والد  تھے۔ چنانچہ ان کی وفات کے بعد یہ رقم ان کے شرعی ورثا میں تقسیم ہوگی۔ آپ کے سوال کے متن میں ان ورثا کی تعداد واضح نہیں ہے، ان ورثا کی تعداد بھیج دیں، تب ہی ان کے شرعی حصوں کی وضاحت کی جاسکتی ہے تاہم اگر والد کے ورثاء ٰمیں صرف آپ اور آپ کی بہن  اور آپ کی والدہ ہوں تو پھر ساڑھے بارہ فیصد والدہ کا اور بقیہ میں بہن کے مقابلہ میں دوگنا آپ کا ہے ۔آپ کی بیوی اور بیٹی کا فلیٹ میں حصہ نہیں۔</p></p>,143704200017,banuri,"('معاملات', 'muamlat')","('وراثت / وصیت', 'wirasat-wasyat')","('ورثاء اور ان کے حصص', 'wurasa-or-un-k-hisas')"
23-01-2016,https://www.banuri.edu.pk/readquestion/جامعہ-میں-داخلہ/23-01-2016,جامعہ میں داخلہ,جامعہ میں داخلے کب شروع ہوتے ہیں، اور طریق کار کیا ہوتا ہےَ؟,<p><p>جامعہ کے شعبہ حفظ میں داخلے سال بھر ہوتے ہیں، اور شعبہ کتب میں داخلے شوال کے ابتدا  میں ہوتے ہیں۔ طریق کار کی بابت تفصیل دفتر اہتمام تشریف لا کر معلومات حاصل کی جاسکتی ہیں۔</p></p>,143704200015,banuri,"('علوم و فنون', 'uloom-funoon')","('امر بالمعروف و نہی عن المنکر', 'tableegh-tadrees')","('مروجہ تبلیغ کا حکم', 'murawwaja-tabligh-ka-hukum')"
21-01-2016,https://www.banuri.edu.pk/readquestion/انشورنس-کمپنی-میں-ملازمت-کرنے-کا-حکم-جب-کہ-تنخواہ-کسی-جائز-ذریعہ-آمدن-سے-دی-جائے/21-01-2016,انشورنس کمپنی میں ملازمت کرنے کا حکم جب کہ تنخواہ کسی جائز ذریعہ آمدن سے دی جائے,میں جس کمپنی میں کام کرتا ہوں اس کی ایک انشورنس کمپنی بھی ہے،  کچھ دن پہلے میرے مینیجر نے مجھ کو کہا کہ ہم تمہارا ٹرانسفر انشورنس کمپنی میں کر رہے ہیں تو میں نے کہا کہ انشورنس کمپنی سے جو سیلری  آئے گی وہ تو میں قبول نہیں کرسکتا، کیوں کہ وہ کاروبار سود میں چلتا ہے تو میرے مینیجر نے کہا کہ ٹھیک ہے تم انشورنس کمپنی کا کام کرو اور تنخواہ تم کو اسی کمپنی سے ملے گی جو حلال کام کرتی ہے، اس کا سودی کاروبار نہیں ہے ،جس میں میں کام کرتا آرہا ہوں۔ کیا میرے لیے انشورنس کمپنی میں کام کرتے ہوئے جائز کاروبار کرنے والی کمپنی سے تنخواہ لینا جائز ہوگا؟,<p><p>آپ کو ملنے والی تنخواہ آپ کی ان خدمات کے عوض ہو گی جو خدمات آپ انشورنس کمپنی میں پیش کرتے ہیں اور انشورنس کمپنی کو خدمات جائز نہیں ہے، چاہے تنخواہ کسی جائز ذرائع سے ہی  حاصل کر کے کیوں نہ دی جائے۔</p></p>,143704200013,banuri,"('معاملات', 'muamlat')","('سود / بینکاری / انشورنس / شیئرز', 'sood-bankari-insurance-shares')","('بیمہ زندگی / انشورنس / تکافل', 'bima-zindagi-insurance-takaful')"
20-01-2016,https://www.banuri.edu.pk/readquestion/ناجائز-ملازمت-میں-ملوث-ہونا/20-01-2016,ناجائز ملازمت میں ملوث ہونا,آج کل حلال روزگار کا حصول بہت مشکل ہوگیا ہے، اور حلال نوکری نہیں مل رہی ہے، کیا ایسی صورت میں اسلامی بینک یا کسی ایسی ملٹی نیشنل کمپنی میں جو حرام قسم کی پراڈکٹس تیار کرتی ہو، نوکری کرنا کیسا ہےَ جب کہ کوئی دوسرا ذریعہ آمدن نہ ہو؟,<p><p>حلال روزگار کا حصول مشکل ضرور ہے، ناممکن نہیں، بظاہر معیار زندگی کے غیر معمولی طور پر بڑھ جانے کی وجہ سے انسانی خواہشات بھی ضروریات کی طرح شمار کی جانے لگی ہیں، جس کے باعث باکفایت حلال روزگار کے حصول ہی کو مشکل یا ناممکن سمجھا جانے لگا ہے۔ اس لیے کسی بھی بینک یا حرام پروڈکٹ تیار کرنے والی کمپنی میں ملازمت جائز نہیں۔اگر کوئی اس حد تک مجبور ہو کہ فاقوں کی نوبت ہو تو اس کے لیے پھر مذکورہ ملازمت جائز ہوگی۔</p></p>,143704200009,banuri,"('متفرق کتب', 'mutafarriq-kutub')","('متفرق ابواب', 'mutafarriq-abwab')","('متفرق فصول', 'mutafarriq-fusool')"
08-01-2016,https://www.banuri.edu.pk/readquestion/امام-سجدے-میں-ہو-تو-جماعت-میں-کب-شریک-ہو/08-01-2016,امام سجدے میں ہو تو جماعت میں کب شریک ہو؟,جماعت میں شریک ہوتے وقت اگر امام سجدے میں ہو تو  کیا سجدے میں ہی جماعت میں شریک ہوجانا چاہیے یا اٹھنے کا انتظار کرنا چاہیے؟ بعض لوگ امام کے اٹھنے کا  انتظار کرتے ہیں، کیا یہ درست ہے؟,<p><p>مذکورہ صورت میں امام کے ساتھ سجدے میں ہی شریک ہونا چاہیے، امام کے اٹھنے کا انتظار نہیں کرنا چاہیئے، اگرچہ رکوع سے اٹھنے کے بعد کسی حالت میں نماز میں شریک ہونے سے وہ رکعت شمار نہیں ہوتی، لیکن ایک سجدہ بھی انسان کے اجروثواب میں اضافے کا باعث ہے،حدیث میں بھی اس کی ترغیب آئی ہے۔ واللہ اعلم</p></p>,143703200021,banuri,"('نماز', 'salat')","('نماز کی جماعت', 'namaz-ki-jamat')","('جماعت / امامت', 'jamat-imamat')"
