issued_at,link,title,question,answer,fatwa_number,dar_ul_ifta,kitab,bab,fasal
20-01-2016,https://www.banuri.edu.pk/readquestion/پیغمبرکی-طرف-غلطی-کی-نسبت-کرنا/20-01-2016,پیغمبرکی طرف غلطی کی نسبت کرنا,میں نے سنا ہے کہ رسول اللہ صلی اللہ علیہ وسلم کی زبانِ مبارک سے نکلا ہوا ہر لفظ وحی کے حکم میں نہیں تھا بلکہ قرآن کریم اور حدیث اور احکام کے معاملات میں آپ ﷺ کی بات وحی کے حکم میں ہے اور عام بشری زندگی میں آپ ﷺ کا قول وحی کے حکم میں نہیں ہے اور اس میں غلطی بھی ہو سکتی ہے اور بعض معاملات میں غلطی ہوئی بھی ہے. میں نے یہ بات پہلے کبھی نہیں سنی، اس بارے میں رہنمائی فرمائیں کہ اس بات کی کیا حقیقت ہے؟,<p><p>                وحی کی کئی اقسام ہیں ،جن میں قرآن واحادیث مقدسہ شامل ہیں،ان کے علاوہ زندگی کے دیگرمعاملات میں حسب عادت بشری کاروباردنیاویہ وغیرہ کے بارے میں آپ صلی اللہ علیہ وسلم ارشادات صادرفرماتے تھے،جن کاتعلق دینیات ،تفسیرکلام اللہ اورتبلیغ عن اللہ سے نہیں تھا،ان میں اجتہادی خطا کاامکان توتھا مگرانبیاء علیہم السلام چونکہ معصوم ہوتے ہیں اس لیے فوراً ہی اللہ تعالیٰ کی طرف سے اصلاح کردی جاتی ہے،انبیاء کرام علیہم السلام اپنی اجتہادی خطاپرقائم نہیں رہتے۔لہذا ایسی نسبت انبیاء کرام علیہم السلام کی طرف کرنانامناسب ہے۔</p><p>اس سلسلہ میں سابق مفتی اعظم پاکستان مفتی محمدشفیع رحمہ اللہ کی تحریرنقل کی جاتی ہے جوانہوں نے معارف القرآن ،سورہ نجم کی تفسیرمیں لکھی ہے::</p><p>''یعنی رسول اللہ صلی اللہ علیہ وسلم اپنی طرف سے باتیں بناکراللہ کی طرف منسوب کریں اس کاقطعاً کوئی امکان نہیں،بلکہ آپ جوکچھ فرماتے ہیں وہ سب اللہ تعالیٰ کی طرف سے وحی کیاہواہوتاہے،وحی کی بہت سی اقسام احادیث بخاری سے ثابت ہیں،ان میں ایک قسم وہ ہے جس کے معنی اورالفاظ سب حق تعالیٰ کی طرف سے نازل ہوتے ہیں،جس کانام قرآن ہے،دوسری وہ کہ صرف معنی اللہ تعالیٰ کی طرف سے نازل ہوتے ہیں ،آنحضرت صلی اللہ علیہ وسلم اس معنی کواپنے الفاظ میں ادافرماتے ہیں ،اس کانام حدیث اورسنت ہے،پھرحدیث میں جومضمون حق تعالیٰ کی طرف سے آتاہے کبھی وہ کسی معاملہ کاصاف اورواضح فیصلہ اورحکم ہوتاہے ،کبھی کوئی قاعدہ کلیہ بتلایاجاتاہے،جس سے احکام رسول اللہ صلی اللہ علیہ وسلم اپنے اجتہادسے نکالتے اوربیان کرتے ہیں،اس اجتہادمیں اس کاامکان رہتاہے کہ کوئی غلطی ہوجائے ۔مگررسول اللہ صلی اللہ علیہ وسلم اورتمام انبیاء کی یہ خصوصیت ہے کہ جواحکام وہ اپنے اجتہادسے بیان فرماتے ہیں ان میں اگرکوئی غلطی ہوجاتی ہے تو اللہ تعالیٰ کی طرف سے بذریعہ وحی اس کی اصلاح کردی جاتی ہے ،وہ اپنے غلط اجتہادپرقائم نہیں رہ سکتے۔بخلاف دوسرے علماء ومجتہدین کے کہ ان سے اجتہادمیں خطاہوجائے تو وہ اس پرقائم رہ سکتے ہیں اوران کی یہ خطابھی عنداللہ صرف معاف ہی نہیں بلکہ دین کے سمجھنے میں جواپنی پوری توانائی وہ خرچ کرتے ہیں اس پربھی ان کوایک ثواب ملتاہے۔(معارف القرآن ،8/195،ط:مکتبہ معارف القرآن کراچی)</p><p>البتہ جہاں تک اس بات کاتعلق ہے کہ دنیاوی احکام میں رسول اللہ صلی اللہ علیہ وسلم کے ارشادات کی کیاحیثیت ہے؟اس بارے میں محدثین نے تفصیلی بحث کی ہے،جس کا خلاصہ یہ ہے کہ اموردنیامیں وہ رائے جس میں آپ صلی اللہ علیہ وسلم نے یہ تصریح فرمادی ہوکہ میں نے بطورمشورہ اپنے خیال کااظہارکیاہے ،اوریہ رائے اس مقدمہ سے متعلق ہو جودین کے احکام سےے تعلق نہ رکھتاہو اس میں امت کواختیاردیاگیاہے کہ اپنی صوابدیدپرعمل کرسکتے ہیں ،جیسے کھجوروں کوگابہہ کرنے سے متعلق مسلم شریف کی روایت میں ہےکہ'' آپ نے فرمایامیں توبشرہوں جب میں تمہیں دین کی بات بتاوں تو اس پرکاربندہوجاواورجب کوئی بات میں اپنی رائے سے بتاوں تومیں بھی انسان ہوں''۔باقی جتنے بھی اوامرہوں یانواہی خواہ وہ دین سے متعلق ہوں یادنیاسے ان سب میں نبی کریم صلی اللہ علیہ وسلم کی اتباع ضروری ہے کسی کوروگردانی اوررائے زنی کاحق حاصل نہیں ہے۔مفتی اعظم ہندمفتی کفایت اللہ رحمہ اللہ اسی طرح کے ایک سوال کے جواب میں لکھتے ہیں:</p><p>''سوال:رسول اللہ صلی اللہ علیہ وسلم نے دنیاوی کاموں میں امت کواختیاردیاہے؟</p><p>جواب:جوامورکہ خالص دنیوی حیثیت رکھتے ہیں اورشریعت سے کسی طرح ٹکرائے نہیں ان میں امت کواختیارہے کہ جوچاہے اپنے لیے پسندکرے۔(کفایت المفتی1/86)</p><p>اس مسئلہ سے متعلق مزیدتفصیل کے لیے شیخ الاسلام مفتی محمد تقی عثمانی دامت برکاتہم کی کتاب''حجیت حدیث''صفحہ90 تا 98  ملاحظہ فرمائیں۔</p><p>فقط واللہ اعلم</p></p>,143704200012,banuri,"('ایمان و عقائد', 'aqaed')","('اسلامی عقائد', 'islami-aqaed')","('انبیاء و رسل علیہم السلام', 'anbiya-o-rusul-alayhim-us-salam')"
08-02-2016,https://www.banuri.edu.pk/readquestion/خلع-کی-تعریف-حکم-اور-عدت-کابیان/08-02-2016,خلع کی تعریف،حکم اور عدت کابیان,خلع  کیا ہوتی ہے، اسلام میں خلع جائز ہے کیا؟اور خلع کی عدت کیسے ہوتی ہے؟,<p><p>شریعت میں عقدنکاح کوختم کرنے کے جوطریقے ہیں ان میں ایک طریقہ خلع بھی ہے،اگرعورت شوہرکے ساتھ رہنے پرراضی نہیں ہے اورشوہراسے طلاق بھی نہیں دیتاتواسے اختیارہے کہ اپناحق مہرواپس کرکے یاکچھ مال بطورفدیہ دے کر شوہرکورضامند کرکے خلع حاصل کرے،جیساکہ ارشاد باری تعالیٰ ہے جس کاترجمہ یہ ہے:</p><p>''سواگرتم لوگوں کو(یعنی میاں بیوی کو)یہ احتمال ہوکہ وہ دونوں ضوابط خداوندی کوقائم نہ کرسکیں گے تودونوں پرکوئی گناہ نہیں ہوگاکہ اس(مال لینے دینے میں )جس کردے کرعورت اپنی جان چھڑالے''۔(بیان القرآن،سورۃ البقرۃ،1/133)</p><p>خلع کے لیے میاں بیوی دونوں کی رضامندی ضروری ہے،اگردونوں میں سے ایک بھی رضامند نہ ہو توپھرخلع واقع نہیں ہوگا۔جس طرح طلاق کے بعد عدت ہوتی ہےاسی طرح خلع کے بعدبھی عدت لازم ہے،اوروہ عورت جسے ماہوری آتی ہوخلع یاطلاق کی صورت میں جدائی کے بعداس کی عدت تین ماہواریاں ہے،اگرماہواری نہ آتی ہوتوقمری حساب سے تین مہینے عدت گزارنا لازم ہے۔۔فقط واللہ اعلم</p></p>,143704200034,banuri,"('طلاق', 'talaaq')","('فسخ و تفریق', 'faskh-o-tafreeq')","('فسخ و تفریق', 'faskh-o-tafreeq')"
08-02-2016,https://www.banuri.edu.pk/readquestion/بے-وضو-ہونے-کی-حالت-میں-قرآن-کی-تلاوت-کرنا/08-02-2016,بے وضو ہونے کی حالت میں قرآن کی تلاوت کرنا,کیابے وضوہونے کی حالت میں قرآن کریم کی تلاوت مصحف کوہاتھ لگائے بغیرکرسکتے ہیں؟کیابے وضوہونے کی حالت میں تفسیر،حدیث اورفقہ کی  کتابیں پڑھ سکتے ہیں؟,<p><p><strong>بے وضوہونے کی حالت میں قرآن کریم کی زبانی تلاوت جائزہے ،البتہ بغیروضوکے قرآن کریم کوچھونا،ہاتھ لگاناجائزنہیں ہے۔</strong></p><p><strong>کتب تفسیروفقہ کوبغیروضوہاتھ لگانادرست ہے،لیکن جہاں قرآنی آیات لکھی ہوں ان کوہاتھ نہ لگایاجائے ،بہتر یہ ہے کہ ان کتب کوبھی باوضوہاتھ لگایاجائے کیونکہ یہ کتب قرآنی آیات سے خالی نہیں ہوتیں۔</strong></p></p>,143704200033,banuri,"('علوم و فنون', 'uloom-funoon')","('متعلقات قرآن کریم', 'quran-kareem')","('ترجمہ و تفسیر ، تعارف اور اقسام', 'tarjama-o-tafseer-taaruf-aur-aqsaam')"
04-02-2016,https://www.banuri.edu.pk/readquestion/حضرت-عائشہ-رضی-اللہ-عنہا-کالقب-حمیراء/04-02-2016,حضرت عائشہ رضی اللہ عنہا کالقب حمیراء,مشہورہے کہ سیدہ عائشہ رضی اللہ عنہاکالقب حمیراء ہے،کیایہ درست ہے؟,<p><p><strong>کتب احادیث میں ام المؤمنین سیدہ عائشہ رضی اللہ عنہاسے منقول بعض روایات میں آپ کالقب ’’حمیراء‘‘ثابت ہے۔چنانچہ ’’سنن ابن ماجہ‘‘ میں کتاب الرھون ،باب المسلمون شرکاء فی ثلاث کے تحت ایک حدیث میں ہے کہ:سرکاردوعالم صلی اللہ علیہ وسلم نے فرمایا:’’.....حمیراء جس شخص نے کسی کوآگ دی تواس نے گویاوہ تمام چیزیں بطورصدقہ دیں جواس آگ پرپکائی گئیں،اسی طرح جس نے کسی کونمک دیا گویااس نے وہ تمام چیزیں بطورصدقہ دیں جنہیں اس نمک نے ذائقہ داربنایااورپانی کی اہمیت توتم جانتی ہو.....الخ‘‘۔اس حدیث کوسنن ابن ماجہ ہی کے حوالہ سے صاحب مشکوۃ نے بھی ’’باب احیاء الموات والشرب‘‘کے ذیل میں نقل کیاہے۔اسی طرح سنن الکبری للنسائی ،سنن الدارقطنی اورالمستدرک علی الصحیحین للحاکم میں بھی بعض احادیث میں حضرت عائشہ رضی اللہ عنہاکالقب ’’حمیراء‘‘مذکورہے۔فقط واللہ اعلم</strong></p></p>,143704200024,banuri,"('تاریخ و سیر', 'tareekh-o-siyar')","('تاریخ', 'tareekh')","('تاریخِ اسلام', 'tareekh-e-Islam')"
17-12-2015,https://www.banuri.edu.pk/readquestion/وقت-سحر-افطار-کے-لیے-طریق-اعلان/17-12-2015,وقت سحر افطار کے لیے طریق اعلان,روزہ افطار کرنے کے وقت عوام کو مطلع کرنے کے لیے حضرت محمد صلی اللہ علیہ وسلم کے دور میں اور حضرات شیخین کے دور میں کیا طریقہ اختیار کیا جاتا تھا۔ برائے مہربانی حوالے ساتھ تحریر فرمادیں۔,<p><p> کتب تفسیر وحدیث میں تلاش کے بعد افطار یا سحر کے وقت کی ابتدا اور اختتام کے عنوان سے تو کوئی خاص معمول مذکورہ ادوار میں تو نہیں ملا،  البتہ اس سلسلے میں دو باتیں ملتی ہیں:</p><p>۱: ایک یہ کہ جن تک اذان کی آواز پہنچتی ہو ان کے لیے تو افطار وسحر کی اطلاع کے لیے اذان ہی کو معیار بنایا جاتا تھا، چنانچہ بخاری ومسلم کی ایک روایت میں نبی کریم صلی اللہ علیہ وسلم کا ارشاد منقول ہے کہ تم میں سے کسی کو (سیدنا) بلال کی اذان سحری کرنے سے نہ روکے اس لیے کہ وہ تو رات کو اس لیے پکارتے ہیں کہ تم میں سے جو سویا ہو وہ جاگ جائے اور جو رات بھر قیام (اللیل) میں مصروف ہو  وہ لوٹ جائے (کہ سحری کر لے یا آخری پہر تھوڑا  آرام کر لے)۔ اس حدیث سے معلوم ہوتا ہے کہ عوام کی اطلاع کے لیے اذان کو معیار بنانے کا عرف رائج تھا۔ </p><p>۲: اور دوسرا یہ کہ جن تک اذان کی آواز نہ پہنچتی ہو وہ اپنے مشاہدے  اور علم کے مطابق فیصلہ کرتے تھے۔ جیسا کہ صحیح مسلم کی روایت میں سیدنا عدی بن حاتم کے متعلق منقول ہے کہ جب سورہ بقرہ کی آیت ۱۸۷ نازل ہوئی جس میں سفید دھاگے اور  کالے دھاگے سے ممتاز ہوجانے کے وقت کو سحر قرار دیا گیا ہے، تو انہوں نے اپنے آپ اس وقت کے معلوم کرنے کا ایک طریقہ اختیار کیا تھا، جس کی غلطی کی بعد ازاں نشان دہی کر دی گئی تھی۔ اس روایت سے معلوم ہوتا ہے کہ جن تک اذان کی آواز نہ پہنچتی تھی وہ اپنے مشاہدے کے مطابق فیصلہ کیا کرتے تھے۔</p><p>المدخل جو بدعات کی تردید میں بے نطیر کتاب ہے اس میں سحری کے وقت مختلف بلاد وامصار میں جو طریقے رائج ہیں ان کی تردید کی گئی ہے۔ان کا کلام سحری کے متعلق ہے اس لیے ہمارے موضوع کے متعلق ان کاکلام بہت صاف نہیں تاہم اس سے رہنمائی ضرور ملتی ہے ۔ </p></p>,143703200010,banuri,"('روزہ', 'soum')","('روزہ', 'roza')","('رؤیت ہلال', 'ro-yat-e-hilal')"
25-12-2015,https://www.banuri.edu.pk/readquestion/وحی-کی-اقسام-اور-انبیاء-علیہم-السلام-کااجتہاد/25-12-2015,وحی کی اقسام اور انبیاء علیہم السلام کااجتہاد,کل میں ایک عالم کابیان سن رہاتھاتوانہوں نے کہاکہ رسول اللہ صلی اللہ علیہ وسلم کی زبان سے نکلا ہوا ہرلفظ وحی نہیں تھا بلکہ قرآن اوراحکامات کے معاملہ  میں انہوں نے جو بتایاوہ وحی تھا،اورعام زندگی میں ان کاقول وحی کے حکم میں نہیں ہے،اوراس میں غلطیاں بھی ہوسکتی ہیں،اورانہوں نے کہاکہ یہ بات احادیث سے ثابت ہے۔ یہ بات میں نے پہلے نہیں سنی،کیایہ صحیح ہے؟انہوں نے کہاکہ جو آیت میں آیاہے کہ ''یہ نبی اپنی طرف سے کچھ نہیں کہتاصرف وہی کہتے ہیں جووحی کرتے ہیں  اس کایہی مطلب ہے۔,<p><p><strong>وحی کی کئی اقسام ہیں ،جن میں قرآن واحادیث مقدسہ شامل ہیں،ان کے علاوہ زندگی کے دیگرمعاملات میں حسب عادت بشری کاروباردنیاویہ وغیرہ کے بارے میں آپ صلی اللہ علیہ وسلم ارشادات صادرفرماتے تھے،جن کاتعلق دینیات ،تفسیرکلام اللہ اورتبلیغ عن اللہ سے نہیں تھا،ان میں اجتہادی خطا کاامکان توتھا مگرانبیاء علیہم السلام چونکہ معصوم ہوتے ہیں اس لیے فوراً ہی اللہ تعالیٰ کی طرف سے اصلاح کردی جاتی ہے،انبیاء کرام علیہم السلام اپنی اجتہادی خطاپرقائم نہیں رہتے۔اس سلسلہ میں سابق مفتی اعظم پاکستان مفتی محمدشفیع رحمہ اللہ کی تحریرنقل کی جاتی ہے جوانہوں نے معارف القرآن ،سورہ نجم کی تفسیرمیں لکھی ہے:</strong></p><p><strong>''یعنی رسول اللہ صلی اللہ علیہ وسلم اپنی طرف سے باتیں بناکراللہ کی طرف منسوب کریں اس کاقطعاً کوئی امکان نہیں،بلکہ آپ جوکچھ فرماتے ہیں وہ سب اللہ تعالیٰ کی طرف سے وحی کیاہواہوتاہے،وحی کی بہت سی اقسام احادیث بخاری سے ثابت ہیں،ان میں ایک قسم وہ ہے جس کے معنی اورالفاظ سب حق تعالیٰ کی طرف سے نازل ہوتے ہیں،جس کانام قرآن ہے،دوسری وہ کہ صرف معنی اللہ تعالیٰ کی طرف سے نازل ہوتے ہیں ،آنحضرت صلی اللہ علیہ وسلم اس معنی کواپنے الفاظ میں ادافرماتے ہیں ،اس کانام حدیث اورسنت ہے،پھرحدیث میں جومضمون حق تعالیٰ کی طرف سے آتاہے کبھی وہ کسی معاملہ کاصاف اورواضح فیصلہ اورحکم ہوتاہے ،کبھی کوئی قاعدہ کلیہ بتلایاجاتاہے،جس سے احکام رسول اللہ صلی اللہ علیہ وسلم اپنے اجتہادسے نکالتے اوربیان کرتے ہیں،اس اجتہادمیں اس کاامکان رہتاہے کہ کوئی غلطی ہوجائے ۔مگررسول اللہ صلی اللہ علیہ وسلم اورتمام انبیاء کی یہ خصوصیت ہے کہ جواحکام وہ اپنے اجتہادسے بیان فرماتے ہیں ان میں اگرکوئی غلطی ہوجاتی ہے تو اللہ تعالیٰ کی طرف سے بذریعہ وحی اس کی اصلاح کردی جاتی ہے ،وہ اپنے غلط اجتہادپرقائم نہیں رہ سکتے۔بخلاف دوسرے علماء ومجتہدین کے کہ ان سے اجتہادمیں خطاہوجائے تو وہ اس پرقائم رہ سکتے ہیں اوران کی یہ خطابھی عنداللہ صرف معاف ہی نہیں بلکہ دین کے سمجھنے میں جواپنی پوری توانائی وہ خرچ کرتے ہیں اس پربھی ان کوایک ثواب ملتاہے۔</strong></p><p><strong>(معارف القرآن ،8/195،ط:مکتبہ معارف القرآن کراچی)فقط واللہ اعلم</strong></p></p>,143703200018,banuri,"('ایمان و عقائد', 'aqaed')","('اسلامی عقائد', 'islami-aqaed')","('انبیاء و رسل علیہم السلام', 'anbiya-o-rusul-alayhim-us-salam')"
