issued_at,link,title,question,answer,fatwa_number,dar_ul_ifta,kitab,bab,fasal
01-01-2010,https://www.banuri.edu.pk/readquestion/aap-sallallaho-alayhi-wa-sallm-ki-tarekh-e-paidaish-or-wafat-ka-rajeh-qool/01-01-2010,آپﷺ کی تاریخ پیدائش اوروفات کا راجح قول,نبی کریم صلی اللہ علیہ وسلم کی تاریخِ پیدائش اور تاریخِ وفات کیا ہے ؟ راجح قول کیا ہے؟,"<p><p style=""text-align:justify;"">سردارِ دوجہاں حضرت محمد صلی اللہ علیہ وسلم کی پیدائش واقعۂ فیل کےپچاس یا پچپن روزکے بعد بتاریخ ۸ ربیع الاول بروز پیر مطابق ماہِ اپریل 570ء مکہ مکرمہ میں صبح صادق کے وقت ابوطالب کے مکان میں ہوئی۔ ولادت باسعادت کی تاریخ میں مشہوریہ ہے کہ حضورصلی اللہ علیہ وسلم 12 ربیع الاول کو پیدا ہوئے، لیکن جمہور محدثین اور مورخین کے نزدیک راجح اور مختار قول یہ ہے کہ حضور صلی اللہ علیہ وسلم 8 ربیع الاول کوپیداہوئے۔</p><p class=""indent"" style=""text-align:left;""> (سیرت المصطفیٰ 149،ج،5،ط :مکتبہ عثمانیہ لاہور، ناقلاعن زرقانی شرح مواہب اللدنیہ)</p><p style=""text-align:justify;"">تاریخِ  وفات میں بھی اختلاف ہے،  محدثین ومؤرخین کا اتفاق ہے کہ آپ ﷺ کی وفات بروز  پیر ہوئی ہے، اور وفات کا مہینہ ربیع  الاول کا تھا، البتہ  تاریخ کی  تعیین  کے بارے میں مختلف اقوال منقول ہیں،  جن میں زیادہ مشہور  قول 12 ربیع الاول کا ہے۔  تاہم یہ قول محلِ اشکال ہے؛  اس لیے کہ اس پر سب کا اتفاق ہےکہ 9  ذی الحجہ 10ھ    یومِ عرفہ جمعہ کا دن تھا ،  اور اس کے بعد آپ تین ماہ بقید حیات رہے، ان تین ماہ میں چار  احتمالات ہیں:</p><p class=""indent"">1- تینوں مہینے (ذی الحجہ، محرم، صفر) 30 دن کے ہوں۔</p><p class=""indent"">2- دو مہینے 30 دن کے ہوں، اور ایک مہینہ 29 دن کا ہو۔</p><p class=""indent"">3-دو مہینے 29 دن کے ہوں، اور ایک مہینہ 30 دن کا ہو۔</p><p class=""indent"">4- تینوں مہینے (ذی الحجہ، محرم، صفر) 29 دن کے ہوں۔ (اور یہی احتمال محققین کے نزدیک راجح ہے)۔</p><p style=""text-align:justify;"">ان چاروں احتمالات میں سے کسی بھی احتمال سے آپ کی وفات 12 ربیع الاول کو ثابت نہیں ہوتی، بلکہ محققین کے نزدیک آپ ﷺ کی تاریخ وفات 2 ربیع الاول ہے، اگرچہ اس میں 7 اور 8 کے اقوال بھی ملتے ہیں، اور  بارہ ربیع الاول کا قول علامہ ابن کثیر رحمہ اللہ نے نقل کیا ہے اور اس کا مدار ابن کثیر رحمہ اللہ نے اختلافِ مطالع پر رکھا ہے کہ اختلافِ مطالع کی وجہ سے تاریخ میں فرق آیا ہے، تاہم یہ توجیہ قوی نہیں ہے،  راجح قول دو ربیع الاول کا ہی ہے،  فلکیات کے ماہرین بھی حسابی اصولوں کے مطابق یکم یا دو کو ہی درست قرار دیتے ہیں، حافظ ابن حجر رحمہ اللہ نے بارہ تاریخ کی شہرت کا سبب یہ بتایا ہے کہ بعض کتب میں <span class=""ar_writing"">""ثاني شهر ربیع الأول""</span> لکھا گیا تھا، جسے<span class=""ar_writing""> ""ثاني عشر""</span>پڑھ لیا گیا، یوں وفاتِ نبوی کے متعلق بارہ ربیع الاول کی شہرت ہوگئی، اسی 2 ربیع الاول کے قول کو علامہ سہیلی نے روضۃ الانف میں اور علامہ ابن حجر نے فتح الباری میں راجح قرار دیا ہے۔ بارہ ربیع الاول کے قول کی شہرت کی بنیاد  پر بعض اکابرین کی کتابوں میں بھی یہ درج ہوگیا ہے۔</p><p class=""indent"" style=""text-align:justify;"">’’حضور صلی اللہ علیہ وسلم بروز دوشنبہ دوپہر کے وقت 12 ربیع الاول کو دنیاسے پردہ فرماگئے ۔‘‘</p><p class=""indent"" style=""text-align:left;"">(سیرۃ المصطفیٰ :2263،ط : مکتبہ عثمانیہ لاہور)</p><p style=""text-align:justify;"">حکیم الامت مولانا اشرف علی تھانوی رحمہ اللہ بہشتی زیور میں لکھتے ہیں:</p><p class=""indent"" style=""text-align:justify;"">’’پھر بدھ کے روزصفرکے مہینے کے دودن رہے تھے آپ صلی اللہ علیہ وسلم بیمارہوئےاورربیع الاول کی بارہ تاریخ پیرکے روزچاشت کے وقت تریسٹھ 63کی عمرمیں وفات پاگئے۔‘‘</p><p class=""indent"" style=""text-align:left;"">(بہشتی زیور آٹھواں حصہ 381،ط :العریب بپلشرز)</p><p class=""indent"" style=""text-align:left;"">فقط واللہ اعلم</p></p>",143101200014,banuri,"('ایمان و عقائد', 'aqaed')","('اسلامی عقائد', 'islami-aqaed')","('انبیاء و رسل علیہم السلام', 'anbiya-o-rusul-alayhim-us-salam')"
01-01-2010,https://www.banuri.edu.pk/readquestion/salam-ka-masnoon-tareqa/01-01-2010,سلام کا مسنون طریقہ,حضرت مجھے یہ بتائیں کہ ان مین سے صحیح سلام کرنے کا طریقہ کیا ہے ؟اورنیچے دی گئیں معلومات صحیح ہیں یا غلط؟السلام وعلیکم تم پر سلامتی ہوسام و علیکم تم بربادہوالسام و علیکم تم کو موت آئےالسائیکم تم خوشی کو،ترسوسلا لیکم تم پرلعنت ہواورآج کل لوگ ای میل میں اور چیٹنگ میں شورٹ فام مختصرالفاظمیں سلام اس طرح کرتے ہیںکیا اس طرح صحیح ہےwasاورجواب اس طرح AOA.مہربانی فرماکر اس کے بارے میں بھی بتادیں اللہ تعالیٰ آپ حضرات کو جزائے خیر عطافرمائے۔آمین۔,<p><p>1۔ صورت مسئولہ میں کسی بھی مسلمان کو سلام کا مسنون طریقہ یہ ہے کہ سلام مکمل الفاظ سے کیا جائے الفاظ یہ ہیں السلام علیکم ورحمۃ اللہ وبرکاتہ، اور جواب ان الفاظ سے ہو، وعلیکم السلام ورحمۃ اللہ وبرکاتہ۔ اگر السلام علیکم اور جواب میں وعلیکم السلام ، پر اکتفاء کیا جائے، تویہ بھی جائز ہے، اس کے علاوہ السلام وعلیکم مسنون طریقہ نہیں ،سلام وعلیکم، السام وعلیکم وغیرہ کے الفاظ بددعآء کے ہیں، سلام میں اس کے کہنے سے اجتناب کیا جائے ۔ السائیکم اورسلالیکم، سلام کے الفاظ نہیں اورمعنوی لحاظ سے بھی صحیح نہیں اس لیے ان الفاظ کے کہنے سے احتراز کیا جائے۔ 2۔مختصراً الفاظ سے سلام مثلاً AOA اورمختصر الفاظ سے جواب WAS نہ سلام ہے اور نہ ہی سلام کا جواب ہے ،اس طرح سلام وجواب صحیح نہیں۔ فقط واللہ اعلم</p></p>,143101200270,banuri,"('حقوق و آدابِ معاشرت', 'huqooq-muashret')","('آدابِ معاشرت', 'akhlaq-aadab')","('سلام کے احکام و آداب', 'salam-or-musafeh-k-ahkam-o-aadab')"
01-01-2010,https://www.banuri.edu.pk/readquestion/sehr-or-jado-ka-hukum/01-01-2010,سحر اور جادو کا حکم,سحر اور جادو کا کیا حکم ہے ؟,<p>ہرایک کا حکم، الگ الگ تفصیل ہے، جو صورت درپیش ہو اس کی تفصیلات ذکر فرماکر جواب کے لیے رجوع فرماسکتے ہیں۔ فقط واللہ اعلم</p>,143101200526,banuri,"('حظر و اباحت', 'mamnooaat-mubahat')","('تعویذات / عملیات', 'taweezat-amlyat')","('سحر / جادو کی حقیقت و احکام', 'sehr-jado-ki-haqiqat-o-ahkam')"
01-01-2010,https://www.banuri.edu.pk/readquestion/mayyat-ka-qaraz/01-01-2010,میت کاقرض,میرے والد نے دوسری شادی کی اور حال ہی میں ان کا انتقال ہواہے ، دوسری شادی کے وقت میں نے بحیثیت بیٹے ان کی اہلیہ کیلئے سونے کی رقم دی تھی ، میرے والدنے وہ رقم مجھے واپس نہیں لوٹائی جو انہوں نے اپنی اہلیہ کے سونے کیلئے ادھارلی تھی ، میراسوال یہ ہے کہ اس سونے کا مالک کون ہے ؟,<p>مذکورہ سوناتو مرحوم کی اہلیہ کی ملکیت ہی رہے گا البتہ اس مد میں سائل کے والد نے جو رقم سائل سے لی تھی میراث کی تقسیم سے قبل اتنی ہی رقم سائل اپنے والد مرحوم کی میراث سے لینے کا حق رکھتاہے ۔فقط واللہ اعلم<br/></p>,143101200678,banuri,"('معاملات', 'muamlat')","('وراثت / وصیت', 'wirasat-wasyat')","('میت کے قرض اور امانت', 'mayyit-k-qarz-or-amanat')"
01-01-2010,https://www.banuri.edu.pk/readquestion/nifas-ki-aksar-muddat-per-khon-band-no-ho-to-namaz-rozay-ka-hukum/01-01-2010,نفا س کی اکثر مدت پر خون بند نہ ہو تونما زروزہ کا حکم,محترم مفتی صاحب السلام علیکم نفاس سے چالیس دن کے بعد بھی خون بند نہ ہوتونماز ، رمضان کے روزے رکھنے کا کیا حکم ہے؟ اور کب تک رکھے ؟,<p>نفا س کی اگر کو ئی مد ت مقرر نہیں ہےتو زیادہ زیادہ چالیس دن کی مدت نفا س کی شمار ہوگی اس کے بعد عورت پاکی حاصل کرکے نماز روزہ شروع کردے گی ، واضح رہے کہ یہ ضروری نہیں کہ نفاس کی مدت چالیس دن ہی ہولیکن اگر عورت پہلے سے صاحبِ اولاد ہے اور چالیس دن سے کم میں خون بند ہونے کی عادت ہے تو عادت کے موافق دن پورے کرکے نماز روزہ شروع کردے گی۔</p>,143101200015,banuri,"('طہارت', 'taharat')","('حیض، نفاس، استحاضہ', 'hayz-nifas-istihaza')","('جنابت ، حیض اور نفاس کے احکام', 'janabat-hayz-or-nifas-k-ahkam')"
01-01-2010,https://www.banuri.edu.pk/readquestion/mushtaraka-baitul-khala-o-wuzo-khana-may-wuzu-ki-duaen-parhnay-ka-hukum/01-01-2010,مشترکہ بیت الخلاءوغسل خانہ میں وضوء کی دعائیں پڑھنے کا حکم,مفتی صاحب، میرا سوال وضو کے دوران مسنون دعاؤں سے متعلق ہے۔ آج کل اکثر مکانات میں کمرےسے منسلک باتھ رومواش رومبیت الخلاء بنانے کا رواج ہے۔عموماً ایک کونے میں نہانے کیلئے ٹب، ساتھ میں ہاتھ دھونے اور وضو کرنےکیلئے واش بیسن، ساتھ ہی رفعِ حاجت کیلئے کموڈ اور ایک کونے میں کپڑے تبدیل کرنے کیلئے ڈریسنگ کارنر۔اب اس صورت میں دیکھا جائے تو وضو توڑنے اور وضو کرنے کیلئے ایک ہی جگہ استعمال کی جارہی ہے۔میرا سوال یہ ہے کہ اس جگہ واش بیسن پر وضو کرتے وقت کیا بسم اللہ اور دیگر مسنون دعائیں یا شش کلمے وغیرہ پڑھے جاسکتے ہیں یا نہیں؟ اور کیا اس سے کچھ فرق پڑھتا ہے کہ اوقات اور نیت الگ الگ کرلی جائے۔۔یعنی بندہ وضو توڑنے کیلئے الگ سے جائے اور بیت الخلا میں داخل ہونے والی دعا پڑھے اور وضو کرنے کیلئے الگ سے جائے جس کیلئے بیت الخلا والی دعا پڑھنے کی ضرورت نہیں اور وضو والی دعائیں پڑھی جاسکتی ہو؟,<p>صورت مسئولہ میں مشترکہ غسل خانہ اوربیت الخلاء جس میں داخل ہونےکے لیے ایک ہی دروازہ ہوتاہے اس قسم کے غسل خانوں میں وضوء کے دوران جودعاء پڑھی جاتی ہےوہ نہ پڑھی جائے کیونکہ یہ بیت الخلاء میں پڑھنا شمارہوگااوربیت الخلاء میں اذکار پڑھنےسے شریعت نے منع کیا ہے۔ فقط واللہ اعلم</p>,143101200271,banuri,"('حقوق و آدابِ معاشرت', 'huqooq-muashret')","('آدابِ معاشرت', 'akhlaq-aadab')","('اٹھنے، بیٹھنے، سونے، چلنے پھرنے کے آداب', 'uthnay-bethnay-chalnay-phirnay-k-aadab')"
01-01-2010,https://www.banuri.edu.pk/readquestion/tafreh-ke-liay-sahil-smandar-jane-ka-hukum/01-01-2010,تفریح کے لیے ساحل سمندر وغیرہ جانے کاحکم,شریعت کے مطابق تفریح کی غرض سے کسی ساحل سمندر پر جانا کیسا ہے؟ یا روز مرہ کی مصروفیت سے اکتا کر تبدیلی کی غرض سے ؟,<p>اگرکسی شرعی امرکی خلاف ورزی نہ ہوتو جائزہے۔ شریعت جائزتفریحات کومنع نہیں کرتی بلکہ صحت افزاء تفریح مطلوب ہے لیکن ساحل یادیگرتفریحی مقامات پرجہاں برھنگی کےحیاء سوزمناظرعام ہوں، لغویات اوربدنظری کے گناہ میں مبتلا ہونے کا غالب اندیشہ ہو،تفریحی مناظرمیں منہمک ہوکر نمازاوردیگرفرائض میں تاخیراورغفلت کا ارتکاب لازم آتاہوتوایسی تفریح اورتفریحی مقامات پرجانا شرعاً درست نہیں ہوگا۔ فقط واللہ اعلم</p>,143101200527,banuri,"('حظر و اباحت', 'mamnooaat-mubahat')","('تفریح / کھیل', 'tafreeh-khel')","('تیراکی / تیر اندازی / گھڑ سواری', 'tayraki-teerandazi-ghurr-sawari')"
01-01-2010,https://www.banuri.edu.pk/readquestion/mujassmy-numa-khilony/01-01-2010,مجسمے نما کھلونے,آج کل شہر میں مختلف سگنلز پر بکری کے بچے کی صورت نما روئی اور کپڑے سے بنے ہوئے کھلونے ملتے ہیں جس میں کپڑے وغیرہ سے ان جانوروں کی آنکھیں کان ناک وغیرہ بنائے جاتے ہیں ایسے کھلونے خریدنا اور استعمال کرنا گھر میں لانا جائز ہے یا نہیں؟ اگر ان کھلونے سے ان کی آنکھیں ختم کردی جائیں تو پھر استعمال کی گنجائش ہے یا نہیں؟ اگر کسی قسم کی گنجائش نہیں تو پھر جس نے ایسے کھلونے خرید لیے ہوں تو اب وہ ان کا کیا کرے ؟ کس کو دے ؟,<p>مذکورہ کھلونے تصویر اور مجسمہ کے حکم میں ہیں ، اسلئے ان کا خریدنا ، استعمال کرنا ، گھر میں لانا جائز نہیں ہے ، ان کھلونوں کی آنکھیں ختم کرنے کے بعد بھی چونکہ ان کی شکل واضح رہتی ہے ، اسلئے اس کے بعد بھی استعمال کی گنجائش نہیں ہے ، ایسے کھلونوں کو کھول کر کسی اور استعمال میں لایاجاسکتاہو،تو استعمال کرلیں اور اگر کسی اور استعمال میں لانا ممکن نہ ہو تو ضائع کردیاجائے ۔فقط واللہ اعلم<br/></p>,143101200679,banuri,"('حظر و اباحت', 'mamnooaat-mubahat')","('تفریح / کھیل', 'tafreeh-khel')","('ٹی وی / وی سی آر / سینما / انٹرنیٹ/تصویر سازی', 'tv-vcr-cinema-internet-taswer-sazi')"
01-01-2010,https://www.banuri.edu.pk/readquestion/لفظ-خدا-کا-استعمال/01-01-2010,لفظ خدا کا استعمال,قرآن و سنت کی روشنی میں یہ بتائیں کہ لفظ خدا کا استعمال کیا غلط ہے؟ بعض لوگ اس کا استعمال غلط کہتے ہیں، جب کہ بعض اسے عجمی سازش کہتے ہیں۔ اس کی کیا حقیقت ہے؟,<p><p>اللہ تعالیٰ کے لیے  لفظ  خدا کا استعمال جائز ہے اور صدیوں سے اکابر دین اس کو استعمال کرتے آئے ہیں۔ اور کبھی کسی نے اس پر نکیر نہیں کی۔ اب کچھ لوگ پیدا ہوئے ہیں جن کے ذہن پر عجمیت کا وہم سوار ہے۔ انہیں بالکل سیدھی سادی چیزوں میں عجمی سازش نظر آتی ہے، یہ ذہن غلام احمد پرویز اور اس کے ہمنواؤں نے پیدا کیا۔ اور بہت سے پڑھے لکھے شعوری وغیر شعوری طور پر اس کا شکار ہوگئے۔ اسی کا شاخسانہ یہ بحث ہے جو آپ نے لکھی ہے۔ عربی میں لفظ رب ،مالک اور صاحب کے معنیٰ میں ہے۔ اسی کا ترجمہ فارسی میں لفظ خداکے ساتھ کیا گیا ہے۔ چنانچہ جس طرح لفظ رب  کا اطلاق بغیر اضافت کے غیر اللہ پر نہیں کیا جاتا۔ اسی طرح لفظ  خدا جب بھی مطلق بولاجائے تو اس کا اطلاق صرف اللہ تعالیٰ پرہوتاہے۔ کسی دوسرے کو خدا کہنا جائز نہیں۔ غیاث اللغات میں ہے: خدا بالضم بمعنی مالک و صاحب۔ چوں لفظ  خدا مطلق باشدبر غیر ذاتِ باری تعالیٰ اطلاق نکند، مگر در صورتیکہ بچیزے مضاف شود، چوں کہ خدا، ودہ خدا۔ ٹھیک یہی مفہوم اور یہی استعمال عربی میں لفظ  رب کا ہے۔ آپ کو معلوم ہوگا کہ اللہ تو حق تعالیٰ شانہ کا ذاتی نام ہے۔ جس کا نہ کوئی ترجمہ ہوسکتاہے نہ کیا جاتاہے۔ دوسرے اسمائے الہٰیہ صفاتی نام ہیں جن کا ترجمہ دوسری زبانوں میں ہوسکتاہے اور ہوتاہے۔ اب اگر اللہ تعالیٰ کے پاک ناموں میں سے کسی بابرکت نام کا ترجمہ غیر عربی میں کردیا جائے۔ اور اہل زبان اس کو استعمال کرنے لگیں تو اس کے جائز نہ ہونے اور اس کے استعمال کے ممنوع ہونے کی آخر کیا وجہ ہوسکتی ہے؟ اور جب لفظ  خداصاحب اور مالک کے معنی میں ہے۔ اور لفظ  رب کے مفہوم کی ترجمانی کرتاہے تو آپ ہی بتائیے کہ اس میں مجوسیت یا عجمیت کا کیا دخل ہوا۔ کیا انگریزی میں لفظ  رب کا کوئی ترجمہ نہیں کیا جائے گا؟ اور کیا اس ترجمہ کا استعمال یہودیت یا نصرانیت بن جائے گا؟ افسوس ہے کہ لوگ اپنی ناقص معلومات کے بل بوتے پر خود رائی میں اس قدر آگے بڑھ جاتے ہیں کہ انہیں اسلام کی پوری تاریخ سیاہ نظر آنے لگتی ہے۔ اور وہ چودہ صدیوں کے تمام اکابر کو گمراہ یا کم سے کم فریب خوردہ تصور کرنے لگتے ہیں۔ یہی خودرائی انہیں جہنم کے گڑھے میں دھکیل دیتی ہے۔ اللہ تعالیٰ اپنی پناہ میں رکھیں ۔ فقط واللہ اعلم</p></p>,143101200016,banuri,"('ایمان و عقائد', 'aqaed')","('اسلامی عقائد', 'islami-aqaed')","('ذات و صفات و اسماء باری تعالیٰ', 'zat-o-sifat-0-asmae-bari-taala')"
01-01-2010,https://www.banuri.edu.pk/readquestion/islami-banks-say-hasil-nafa-ka-hukum/01-01-2010,اسلامی بینکوں سے حاصل نفع کا حکم,میرا سوال یہ ہے کہ کیا اسلامی بینکوں کا نفع حلال ہے ؟,<p>مروجہ اسلامی بینکوں کے رائج کردہ مال کاری کے طریقوں سے حاصل ہونے والا نفع حلال نہیں ہے۔ فقط واللہ اعلم</p>,143101200272,banuri,"('معاملات', 'muamlat')","('سود / بینکاری / انشورنس / شیئرز', 'sood-bankari-insurance-shares')","('اسلامی بینکاری', 'islami-bankari')"
01-01-2010,https://www.banuri.edu.pk/readquestion/darhi-sharii-hudod-se-kam-rakhne-wale-ka-hukum/01-01-2010,داڑھی شرعی حدود سے کم رکھنے والے کا حکم,جس حافظ قرآن کی داڑھی پوری نہ ہواور کترواتا ہو اس کے پیچھے فرض نماز کاکیا حکم ہے، جبکہ پیچھے شرعی داڑھی والے ہوں ؟,<p>ایسے شخص کو امام بنانا مکروہ تحریمی ہے، البتہ جونمازیں اس کے پیچھے پڑھی جاچکی ہیں وہ ادا ہوگئیں ان کے اعادہ کی ضرورت نہیں۔ فقط واللہ اعلم</p>,143101200528,banuri,"('نماز', 'salat')","('نماز کی جماعت', 'namaz-ki-jamat')","('جماعت / امامت', 'jamat-imamat')"
01-01-2010,https://www.banuri.edu.pk/readquestion/kabotar-bazy-karna/01-01-2010,کبوتر بازی کرنا,كبوتر بازى كى شرعی حیثیت کیاہے کیاکبوترپالنا بھی گناہ ہے ؟,<p>کبوتربازی بہت سے مفاسد پر مشتمل ہونے کی وجہ سے ناجائزہے ، البتہ کبوتر پالنے کی گنجائش ہے بشرطیکہ اس کی ضروریات کا خیال رکھا جائے ۔<br/></p>,143101200680,banuri,"('حظر و اباحت', 'mamnooaat-mubahat')","('تفریح / کھیل', 'tafreeh-khel')","('مختلف قسم کے کھیل', 'mukhtalif-qism-k-khel')"
01-01-2010,https://www.banuri.edu.pk/readquestion/pani-ki-adm-dastiyabi-ki-sorat-may-kapray-pak-karne-ka-tariqa/01-01-2010,پانی کی عدم دستیابی کی صورت میں کپڑے پاک کرنے کا طریقہ,سوال یہ ہے کہ جس طرح کسی شخص پر غسل واجب ہواور پانی آسانی سے دستیاب نہ ہو تو شریعت میں تیمم کی سہولت ہے ،اگر کپڑے ناپاک ہو جائیں اور پانی بھی دستیاب نہ ہو تو ایسی صورت میں کپڑے کیسے پاک کیے جائیں ؟ اس کا متبادل کیا ہو گا ؟۔,<p>کپڑے پاک کرنے کے لیے اگر پانی دستیاب نہ ہو تو اس کی پاکی کا ذریعہ بھی مٹی ہے یعنی کپڑے کے جس حصے پر نجاست لگی ہوگی اسے مٹی پر اچھی طرح رگڑ لیا جائے یہا ں تک کے ظاہر ی طور پر دکھائی دینے والی نجاست اور اس کے اثرات نظر نہ آئیں تو کپڑا پاک ہو جائے گا</p>,143101200017,banuri,"('طہارت', 'taharat')","('نجاست اور اس سے پاکی', 'najasat-aur-us-ki-paki')","('نجاست سے پاکی', 'nijasat-aur-us-ki-paki')"
