issued_at,link,title,question,answer,fatwa_number,dar_ul_ifta,kitab,bab,fasal
01-01-2010,https://www.banuri.edu.pk/readquestion/aema-karam-ki-itiba/01-01-2010,ائمہ کرام کی اتباع,صحیح حدیث میں جگہ جگہ رفع یدین اورجہری آمین اورامام کےپیچھے سورہ فاتحہ پڑھنے کا حکم ہے توہم (حنفی دیوبندی) کیوں نہیں کرتے؟,<p>اولاً اس امرکوذہن نشین کرلینا ضروری ہے کہ اس وقت دنیا میں چارأئمہ کرام یعنی امام اعظم ابوحنیفہ رحمہ اللہ امام شافعی رحمہ اللہ امام احمدبن حنبل رحمہ اللہ اورامام مالک کےمسلک کے پیروکارہیں، ان أئمہ کرام کواللہ تبارک وتعالیٰ نے علوم ومعارف کا بیش بہاچشمہ عطافرمانےکےعلاوہ اجتہاد کا ملکہ بھی عطافرمایا، جس کےبل بوتےان حضرات نے اصول دین قرآن وسنت سےمسائل کااستخراج واستنباط کیا۔ جس امام کوجودلیل وحدیث زیادہ مضبوط معلوم ہوئی اس کےمطابق انہوں نےمسئلہ کا حکم وضع فرمایا اوریہ بھی ملحوظ رہےکہ ان چاروں کےدرمیان شریعت کےجن امورمیں اختلاف ہےاس کاتعلق فروعی مسائل سےہےاصول وعقائدمیں کسی کاکوئی اختلاف نہیں، غرضیکہ ان کا یہ اختلاف نفسانی خواہش ذاتی غرض وغایت کی بنیادپرنہیںبلکہ دلائل کی بنیادپرہے، لہذااگرکوئی حنفی ہےاوروہ امام ابوحنیفہ کے مسلک ان کےسمجھے ہوئے دین کے مسائل پراعتماد کرکےان کی تقلیدکرناتوعین قرآن وسنت کی تقلیدہےاوراگرکوئی شافعی المسلک ہے امام شافعی کےمسلک پرعمل کرتاہےتویہ بھی عین قرآن وسنت کی اطاعت ہے، اس مختصرتمہیدکےبعدواضح رہےکہ حنفی حضرات کا تکبیرتحریمہ کےعلاوہ بقیہ جگہوںپررفع الیدین پرعمل نہ کرنا،امام کی اقتداء میں سورہ فاتحہ کانہ پڑھنا،زورسےآمین نہ کہناوغیرہ تویہ بھی قرآن وسنت کی پیروی ہے،احادیث مبارکہ،اقوال صحابہ وافعال صحابہ رضی اللہ عنھم اجمعین کی اتباع واطاعت ہے، اس لیےکہ جس طرح رسول اللہ صلی اللہ علیہ وسلم سےرفع الیدین وغیرہ کاثبوت ملتاہےتواسی طرح رسول اللہ صلی اللہ علیہ وسلم سےترک رفع الیدین امام کے پیچھےسورہ فاتحہ نہ پڑھنےکا حکم اورزورسےآمین نہ کہنابھی احادیث مبارکہ اقوال صحابہ واعمال صحابہ سےثابت ہے۔ اوراحناف کےنزدیک عدم رفع الیدین، عدم فاتحہ خلف الامام، اورآمین بالسروالی احادیث بنسبت دوسری احادیث کے زیادہ قوی اورمضبوط ہیں، نیزدیگروجوہات کی بناء پربھی رفع الیدین وغیرہ کاترک اولیٰ ہے، بہرکیف سائل اس امرکوملحوظ رکھےکہ دونوں طرف کےحضرات اپنی اپنی جگہ پرحق پرہیں اوردونوں طرف کے حضرات کاعمل رسول اللہ صلی اللہ علیہ وسلم کی احادیث مبارکہ پرعمل کہلائےگااوردونوں طرف کےدلائل کتب احادیث میں مذکورہیں۔ فقط واللہ اعلم</p>,143101200417,banuri,"('علوم و فنون', 'uloom-funoon')","('اجتہاد اور تقلید', 'ijtihad-aur-taqleed')","('ائمہ اربعہ اور دیگر مجتہدین کے طرقِ استدلال', 'aaima-arbaa-aur-digar-mujtahideen')"
01-01-2010,https://www.banuri.edu.pk/readquestion/aik-ehram-say-5-umray-ada-karna/01-01-2010,ایک احرام سے پانچ عمرے ادا کرنا,کیا فرماتے ہیں مفتیان کرام اس مسئلہ کے بارے میں کہ ایک آدمی ایک احرام سے پانچ عمرے ادا کرتا ہے اور ہر عمرہ کے بعد وہ حلق بھی کراتا ہے لیکن احرام نہیں کھولتا ۔ اور ہر دفغہ مسجد عائشہ پہنچ کر ازسرنو نیت عمرہ کی کرتا ہے۔ کیا ایسے شخص پر دم آئے گا یا نہیں۔ اور کتنے دم آئیں گے ۔ اگر دم آتا ہے تو کیا پاکستان میں ادا کیا جاسکتا ہے یا سعودی عرب میں ہی ادا کرنا ہوگا اور اگر اس پر پانچ دم آتے ہیں تویہ پانچ بکرے دم میں ادا کرے یا ایک ہی گائے میں دم ادا کردے۔,<p>واضح رہے کہ : احرام دو چادروں کے باندھ لینے کا نام نہیں ہے بلکہ حج یا عمرے کی نیت کرنے اورتلبیہ پڑھ لینے سے آدمی احرام میں داخل ہو جا تا ہے ، ہاں نیت کر لینے کے بعد عام لباس اتار کر اَن سیلی چادریں پہننا لا زم ہو جاتا ہے ، اور پھر ارکان حج یا عمرہ ادا کرنے کے بعد حلق یا قصر کراکے احرام اور اس کی پابندیوں سے آزاد ہو جاتا ہے۔ لہٰذا صورت مسئولہ میں جو شخص پانچ عمرہ کرتا ہے اور ہر عمرے کے لئے مسجد عائشہ جا کر نیت کرتا ہے اسی طرح ہر عمرے کے آخر میں حلق کراتا ہے تو وہ اگر چہ احرام کی چادریں نہ کھولے اس کا ہر عمرہ مکمل ہو جاتا ہے اور اس پر کسی قسم کا کوئی دم لا زم آ تا۔ فقط واللہ اعلم</p>,143101200162,banuri,"('حج', 'haj')","('حج / عمرہ', 'hajj-umrah')","('عمرہ ، فرائض ، واجبات اور سنن', 'umrah-faraidh-wajibat-or-sunan')"
01-01-2010,https://www.banuri.edu.pk/readquestion/haj-o-umrah-travel-agents-k-sath-dar-pesh-masail-ka-hukum/01-01-2010,حج وعمرہ ٹریول ایجنٹس کے ساتھ درپیش مسائل کا حکم,گزارش آپ کی خدمت میں عرض کرنا چاہتا ہوں جس کا جواب شریعت مطہرہ کے مطابق درکارہےہم ٹریول ایجنٹس حضرات جو حج و عمرہ کا کام کرتے ہیں اکثر اوقات مسائل ہمیں درپیش ہوتے ہیں جن کا شرعی حل ہمارے سامنے نہیں ہوتا جو درجہ ذیل ہیں:۱: سعودی حکومت اور ہر عمرہ پر جانے والے کے درمیان ایک عہد نامہ ویزہ ہو تا ہے جس کی شرائط میں یہ شامل ہو تا ہے کہ عمرہ ویزہ پر آنے والا نہ تو نوکری کرسکتا ہے اور نہ ہی حج کے لئے رک سکتا ہے۔عہد شکنی کی صورت میں کیا اس کا حج اللہ کے ہاں قابل قبول ہو گا۔اگر نوکری کرے گا تو کیا وہ رزق حلال ہو گا؟ نوکری کرنے یا حج کے ارادے سے رکنے پر یہاں ٹریول ایجنٹس پر سعودی حکومت جرمانہ عائد کرتی ہے جو کہ ایک بھاری رقم ہے، اس جرمانے کا ذمے دار کسے ہو نا چاہئے؟۲:۔ جو خواتین کسی غیر محرم کو محرم بناکر سفر عمرہ ادا کرتی ہیں کیا یہ شرعا جائز ہے؟ کیا ان کا یہ عمل اللہ کے ہاں قابل قبول ہے؟,<p>1:واضح رہے کہ عمرہ کرنے والوں کا وہاں جاکر غیر قانونی طور پر چوری چھپے کام کرنا ، یا موسم حج تک قیام کرکے حج کرنا یہ معاہدہ کی خلاف ورزی کے ساتھ ساتھ بغیر اجازت کے قیام کرنا ہے ،جو کہ شرعاو قانونا جرم ہے۔ البتہ جہاں تک حج کی ادائیگی کا تعلق ہے تو چونکہ حج تو افعال کی ادائیگی کا نام ہے، لہٰذا اگر حج فرض تھا تو اس کا فرض ادا ہوگیا۔ اگر چہ خلافِ قانون ہونے کی وجہ سے اس کے اجر و ثواب کا معاملہ اللہ کے سپر د ہے۔ جیسا کہ فتاویٰ تاتار خانیہ میں ہے فشرائط الاداء ثلاثۃ:۔ الاحرام، والمکان وھو البقعۃ العظمۃ، والزمان وھو اشہر الج۔۔۔ وشرائط وجوبہ خمس ،الاستطاعۃ، والحریۃ، والعقل، والبلوغ ،والوقت، وفی الکافی، الاسلام ۔ فتاویٰ تاتارخانیہ:۲۹۲۴، ط: اداۃرۃ القرآن کراچی۔ اور جو معاہدہ کی خلاف ورزی کرکے خلافِ قانون رہائش اختیار کرکے، کام کرکے مال کمایا وہ اگرچہ حلال تھا مگر مذکورہ گناہوں کی وجہ سے کراہت سے خالی نہ ہو گا۔ 2: اگر مذکورہ جرم میں ٹریولز ایجنٹس کا کوئی دخل نہیں تھا اور ان کو معلوم بھی نہیں تھا کہ یہ شخص وہاں جاکر خلافِ قانون قیام کرے گا تو اس صورت میں مجرم وہی شخص ہو گا،نہ کے ٹریولز ایجنٹس۔البتہ اگر کوئی شخص جاتا ہی وہاں کام کرنے کے لئے یا عمرہ کے ویزہ پر حج تک قیام کرنے کے لئے اور یہ ٹریولز ایجنٹس کو معلوم ہو تو اس صورت سعودی حکومت کے معاہدے کے مطابق مواخذہ ٹریولز ایجنٹ سے ہوگا۔ 3: عورت کو بغیر محرم کے حج پر نہیں جانا چاہیئے اگر چہ بوڑھی عورت ہی کیوں نہ ہو۔ جیسا کہ فتاویٰ شامی میں ہے۔ ومع زوج او محرم ۔۔ ولو عجوزا ۔۔۔ ولو حجت بلا محرم جاز مع الکراہۃ۔ شامی:۲۵۶۴، ط: سعید کراچی لیکن اگر حج کر لیا تو فرض ادا ہو جائے گا مگر کراہت تحریمی کے ساتھ۔ فقط واللہ اعلم</p>,143101200163,banuri,"('حج', 'haj')","('حج / عمرہ', 'hajj-umrah')","('متفرقات حج و عمرہ', 'mutafarriqat-e-haj-o-umrah')"
01-01-2010,https://www.banuri.edu.pk/readquestion/gher-muslim-ke-khane-wale-bartan-istimal-ka-hukum/01-01-2010,غیر مسلم کے کھانے والا برتن استعمال کا حکم,اگر کسی برتن میں غیرمسلم نے کھانا کھایاہوتو اس برتن کے استعمال کےبارے میں کیا حکم ہے؟,<p>اگرکوئی ناپاک چیزمثلاً شراب یاخنزیریاکوئی اورحرام چیزاس برتن میں نہ کھائی ہوتواس برتن کو استعمال کرسکتے ہیں اوراگرکوئی ناپاک یاحرام چیز استعمال کی ہوتوجب تک برتن کودھوکرپاک نہ کرلیا جائے اس وقت تک اس برتن کا استعمال ممنوع ہے۔ فقط واللہ اعلم</p>,143101200419,banuri,"('حظر و اباحت', 'mamnooaat-mubahat')","('ماکولات / مشروبات', 'makoolat-mashroobat')","('کھانے پینے کی حلال و حرام ، مکروہ و مباح اشیاء', 'khanay-penay-ki-halal-o-haram-makroh-o-mubah-ashya')"
01-01-2010,https://www.banuri.edu.pk/readquestion/doran-haml-biwi-ke-sath-suhbat-ka-hukum/01-01-2010,دورانِ حمل بیوی کے ساتھ صحبت کا حکم,کیا میں اپنی بیوی کےساتھ صحبت کرسکتاہوں جب کہ وہ حمل سے ہو؟ کیاطبی اوراسلامی لحاظ سےیہ صحیح ہے؟اگرمنع نہیں ہےتوکیا حمل کے سارےمہینوں میں منع نہیں ہےیاکچھ مہینوں میں منع ہے؟,"<p><p style=""text-align:justify;"">حمل کی کل مدت میں کسی بھی وقت اپنی بیوی سے صحبت کرنےمیں شرعاً کوئی ممانعت نہیں۔  البتہ  اگر طبی لحاظ  سے  نقصان دہ ہو تو احتیاط کرنا چاہیے،  تاہم اس حوالے سے کسی ماہر مسلمان دین دار ڈاکٹر سے مشورہ کر لیا جائے۔ فقط واللہ اعلم</p></p>",143101200164,banuri,"('حظر و اباحت', 'mamnooaat-mubahat')","('علاج / معالجہ', 'ilaj-mualaja')","('علاج معالجہ کے آداب و حدود', 'ilaj-mualja-k-aadab-o-hudood')"
01-01-2010,https://www.banuri.edu.pk/readquestion/bank-men-raqam-rakhne-ki-behtar-sorat/01-01-2010,بینک میں رقم رکھنے کی بہتر صورت,پیشگی معذرت کہ بینکاری کےمتعلق کچھ سوالات صفحہ پردرج ہیں پھربھی میں نےسوال پوچھنے کی جسارت کی ، اصل میں اطمینان نصیب نہیں ہوا، میرا سوال یہ ہےکہ پاکستان میں کس بینک میں اورکس قسم کا اکاؤنٹ کھولوں تاکہ میں سودکی نحوست اورگناہ سے بچ سکوں؟,<p>اگراکاؤنٹ کھلوانے کی واقعی ضرورت ہوتوکسی بھی بینک میں کرنٹ اکاؤنٹ کھلوانے کی گنجائش ہےگوکہ اس اکاؤنٹ میں جمع شدہ رقم بھی بینک اپنےسودی معاملات میں استعمال کرتاہےلیکن اکاؤنٹ ہولڈر کو سود میں شامل نہیں کیا جاتا اس لیے ضرورت کے وقت کرنٹ اکاؤنٹ بنسبت کسی اورکے بہتررہتاہے دوسری صورت یہ ہےکہ بینک کا لاکرخریدکر اپنی رقم وغیرہ محفوظ کرلی جائے ، یہ صورت سب سے بہتر ہے کہ اس صورت میں بینک آپ کی رقم استعمال نہیں کرے گا۔ فقط واللہ اعلم</p>,143101200420,banuri,"('معاملات', 'muamlat')","('سود / بینکاری / انشورنس / شیئرز', 'sood-bankari-insurance-shares')","('متفرقات سود', 'mutafarriqat-e-sood')"
01-01-2010,https://www.banuri.edu.pk/readquestion/mobile-screen-per-mojod-quran-karim-ki-ayat-pr-bagher-wazoo-hath-lagana/01-01-2010,موبائل اسکرین پر موجود قرآن کریم کی آیت پر بغیر وضو ہاتھ لگانا۔,کیا موبائل فون کی اسکرین پرجوقرآن کریم کی آیات آتی ہیں ان کو بغیر وضو کےہاتھ لگایا جاسکتاہے؟,<p>ایسے موبائل فون کوہاتھ میں پکڑا توجاسکتاہے لیکن اسکرین پرجب قرآن کریم کی آیات نظرآرہی ہوں تو اسکرین کو بغیروضو کے ہاتھ نہیں لگاسکتے۔ فقط واللہ اعلم</p>,143101200165,banuri,"('علوم و فنون', 'uloom-funoon')","('متعلقات قرآن کریم', 'quran-kareem')","('تلاوت کے احکام اور آداب', 'tilawat-k-ahkaam-aur-aadab')"
01-01-2010,https://www.banuri.edu.pk/readquestion/peshab-ke-bad-mani-nikalne-par-gusal-wajib-hone-ka-hukum/01-01-2010,پیشاب کے بعد منی نکلنے پر غسل واجب ہونے کا حکم,پیشاب کے بعد منی نکل آئے توغسل واجب ہوتاہے یا نہیں ؟,<p>منی نکلنے سے غسل واجب ہونے کی شرط یہ ہےکہ منی شہوت کےساتھ اچھل کرنکلے، اگرنہ شہوت ہو اورنہ اچھل کر نکلےمثلاً کسی بیماری کی وجہ سےیا کمزوری کی وجہ سے مذکورہ شرط کے بغیر منی نکلے توغسل واجب نہیں ہوتا۔ فقط واللہ اعلم</p>,143101200421,banuri,"('طہارت', 'taharat')","('غسل', 'ghusl')","('غسل،فرائض،سنن،آداب اور غسل واجب کرنے والی اشیاء', 'ghusl-faraidh-sunan-aadab-or-ghusl-wajib-karne-wali-ashya')"
01-01-2010,https://www.banuri.edu.pk/readquestion/haj-k-liye-insurance-k-paison-k-ewaz-qarz-lena/01-01-2010,حج کے لئے انشورنس کے پیسوں کے عوض قرض لینا,میں پوچھنا چاہتا ہوں کہ اس سال میرے والدین چاہتے ہیں کہ میں ان کے ساتھ حج پر جاؤ ۔ ان کے اپنے لئے ان کے پاس پیسہ ہیں اور میرے علاوہ کوئی اور محرم نہیں۔ تو وہ یہ چاہتے ہیں کہ وہ اپنے انشورنس کے پیسے جو کہ وہ چار سال سے جمع کر وارہے ہیں اس کے عوض قرض لیں اور میرے ساتھ حج پر جائیں ۔ آپ سے گزارش ہے کہ اس مسئلے میں میری رہنمائی فرمائیں کیا یہ پیسہ جو میری والدہ کے ہیں ، وہ میرے لئے قرض لینا چاہتی ہے کیا یہ صحیح ہے؟ اور میں ان کے ساتھ حج پر جاسکتاہوں۔ اللہ آپ کو مجھ سمیت تمام مسلمانوں کو ہدایت اور راہِ حق کی توفیق عطاء فرمائیں۔ آمین,<p>آپ کے سوال کا جواب تیار کیا جارہا ہے۔</p>,143101200166,banuri,"('حج', 'haj')","('حج / عمرہ', 'hajj-umrah')","('فرضیت وشرائط حج', 'fardhiyat-o-sharaait-haj')"
01-01-2010,https://www.banuri.edu.pk/readquestion/mansab-o-iqtidar-or-qaza-per-orton-ko-faiz-karna/01-01-2010,منصب اقتدار و قضاء پر عورتوں کو فائز کرنا,کیافرماتے ہیں علمائے دین اس مسئلے کے بارے میں کہ اسلامی جمہوریہ پاکستان کے قانون تنسیخ نکاح ایکٹ 1962ء کے تحت فیملی کورٹ میں خاتون جج ہونا ضروری ہے، چونکہ فسخ نکاح اورخلع کے کیس فیملی کورٹ میں پیش کیے جاتے ہیں اور ہمارے بعض علماء کرام کے نزدیک اسلام منصب اقتداراورمنصب قضاء پرعورت کوبرداشت نہیں کرتا، ان سوالات کے جوابات دے کر تشفی فرمائیں۔1۔ کیا اسلامی شریعت میں عورت(خاتون) کوبطور جج منصب قضاء پر فائزکرناجائزہے؟2۔ اگرخاتون کوجج بنانا جائزنہیںتو فیملی کورٹ میں خواتین ججزکی طرف سے دئیے جانےوالے فسخ نکاح کے فیصلوں کی شرعی حیثیت کیا ہوگی؟۔ اگرخاتون کو جج بنانا جائزنہیں ہے تواس سےپہلے خاتون ججز فسخ نکاح اورخلع کے جو فیصلے دے چکی ہیں اوران خواتین نے انہی فیصلوں کی بنیاد پر دوسری شادیاں بھی کرلی ہیں ان فیصلوں اوران کےدوسرے نکاح کی شرعی حیثیت کیاہوگی؟4۔ اگرکوئی مردجج میسرنہ ہواورخانگی مسائل کے باعث طلاق لیے بغیرکوئی دوسراراستہ بھی نہ ہوتوخاتون فسخ نکاح کےلیے کیا طریقہ اختیارکرے؟,<p>واضح رہے کہ عورت اپنی طبعی، عقلی اوردینی کمزوری کی بناء پرمنصب اقتدارکی اہل شمارنہیں ہوتی اورمنصب قضاء کی مکمل طورپر تفویض عورت کو درست نہیں، اس کے باوجوداگرعورت کومنصب قضاء تفویض کردیا جائےتوگوکہ شرعاً تفویض کنندگان گناہگار ہونگے لیکن حدودوقصاص کےعلاوہ باقی معاملات میں عورت کی قضاء اوراس کا فیصلہ معتبرہے، اس لیے کہ شرعاً ہروہ شخص جوشہادت کا اہل ہےوہ قضاء کابھی اہل ہے اورعورت ذات حدودوقصاص کے علاوہ دیگرامورمیں شہادت کی اہل ہے اس لیے قضاء کی بھی اہل ہے، اس تمہید کے بعد سائل کے دیگرسوالات حل ہوجاتے ہیں کہ عورت چونکہ قضاء کی فی الجملہ اہلیت رکھتی ہے اورشریعت اس کے کیے گئے فیصلوں کا اعتبار بھی کرتی ہے اس لیےفیملی کورٹ کے مختلف مسائل میں اگرخاتون جج شرعی ضوابط کے مطابق فیصلہ کرتی ہے تواس کا فیصلہ شرعاً معتبرہے۔ فقط واللہ اعلم</p>,143101200422,banuri,"('معاملات', 'muamlat')","('عدالتی معاملات', 'adalti-muamlat')","('قضاء اور اس کی حدود و آداب', 'qaza-or-us-ki-hudood-o-aadab')"
