issued_at,link,title,question,answer,fatwa_number,dar_ul_ifta,kitab,bab,fasal
21-09-2024,https://www.banuri.edu.pk/readquestion/sulah-owr-sela-rahmi-kay-fazayal-144603102092/21-09-2024,صلح اور صلہ رحمی کے فضائل,میرے بھائی کی شادی ماموں زاد بہن سے ہوئی تھی، ایک سال بعد ان کے ہاں بچہ کی ولادت ہوئی، پھر اس کےبعد   کچھ اختلافات کی وجہ سے زوجین  میں طلاق ہو گئی تھی جس کی وجہ سے دونوں گھرانوں کے تعلقات خراب ہوگئے، اب میرے بیٹے کی شادی ہو رہی ہے  اور میں چاہتی ہوں کہ سب رشتہ داروں کو اس میں دعوت دوں تاکہ صلح ہو جائے، لیکن میرے والدین  ماموں کے گھرانے والوں کو بلانے پر راضی نہیں ہیں۔قرآن وحدیث کی رو شنی میں صلح کے فضائل بتا دیں تاکہ فریقین آپس میں صلح کر لیں۔,"<p><p style=""text-align:justify;""><span dir=""rtl"" lang=""ar-sa"" xml:lang=""ar-sa"">شریعتِ مطہرہ میں صلہ رحمی کی ترغیب دی  گئی ہے اور اس کے فضائل بھی بیان کئے گئے ہیں اور قطع رحمی سے روکنے لیے قطع رحمی کرنے والوں کے لیے وعیدیں سنائی گئی ہیں،  لہٰذا صورتِ مسؤلہ  میں  آپ کے بھائی کے  طلاق دینے کی  وجہ سے قطع تعلقی ہو گئی تھی تو اب اس کو طول دینے کے بجائے صلح کرلینی چاہیے کیوں کہ شرعاً قطع تعلقی کرنا  درست نہیں ہے، اور آپ کا اپنے بیٹے کی شادی کے موقع پر دونوں خاندانوں کو جوڑنے کی  خاطر ماموں  کے گھر والوں کو بھی  مدعو کرنا ایک اچھا اقدام ہے، اگر آپ کے والدین صلح کے لیے رضامند نہ ہوں تو آپ ان کو صلہ رحمی اور صلح کے  متعلق مندرجہ ذیل آیتیں اوراحادیث  سنائیں اور خاندان کے بااثر لوگوں کے ذریعہ ان کو  منانے کی کوشش کریں تاکہ دونوں خاندانوں میں صلح ہوجائے،چناں چہ ارشادِ باری تعالی ہے : </span></p><p class=""indent"" style=""text-align:justify;""><span dir=""rtl"" lang=""ar-sa"" xml:lang=""ar-sa""><span class=""qr_writing"">""فَاتَّقُوا اللَّهَ وَأَصْلِحُوا ذَاتَ بَيْنِكُمْ وَأَطِيعُوا اللَّهَ وَرَسُولَهُ إِنْ كُنتُمْ مُؤْمِنِينَ (1)""</span><span class=""ar_writing"">(</span></span><span class=""ar_writing""><span dir=""rtl"" lang=""ar-sa"" xml:lang=""ar-sa"">سورة</span>الأَنفال : 1)</span></p><p style=""text-align:justify;""><span dir=""rtl"" lang=""ar-sa"" xml:lang=""ar-sa"">ترجمہ :</span></p><p class=""indent"" style=""text-align:justify;"">""سو تم اللہ سے ڈرو اور اپنے باہمی تعلقات کی اصلاح کرو اور اللہ کی اور اس کے رسول کی اطاعت کرو اگر تم ایمان والے ہو۔"" (ازبیان القرآن)</p><p style=""text-align:justify;"">دوسری جگہ اللہ تعالی فرماتے ہیں:</p><p class=""indent"" style=""text-align:justify;""><span class=""qr_writing""><span dir=""rtl"" lang=""ar-sa"" xml:lang=""ar-sa"">"" إِنَّمَا الْمُؤْمِنُونَ إِخْوَةٌ فَأَصْلِحُوا بَيْنَ أَخَوَيْكُمْ وَاتَّقُوا اللَّهَ لَعَلَّكُمْ تُرْحَمُونَ (10)""<span class=""ar_writing"">(</span></span><span class=""ar_writing"" dir=""rtl"" lang=""ar-sa"" xml:lang=""ar-sa"">سورة الحجرات :10)</span></span></p><p style=""text-align:justify;""><span dir=""rtl"" lang=""ar-sa"" xml:lang=""ar-sa"">ترجمہ :</span></p><p class=""indent"" style=""text-align:justify;""><span dir=""rtl"" lang=""ar-sa"" xml:lang=""ar-sa"">""</span>مسلمان تو سب بھائی ہیں سو         اپنے دو بھائیوں کے درمیان صلح کر ادیا کرو اور اللہ سے ڈرتے رہا کرو تا کہ تم پر رحمت کی جائے "".ـ(از بیان القرآن) </p><p style=""text-align:justify;"">امام رازی رحمۃ اللہ علیہ اس آیت کی تفسیر کرتے ہوئے فرماتے ہیں :</p><p class=""indent"" style=""text-align:justify;""><span class=""ar_writing"">""لو كان بين رجلين من المسلمين أدنى اختلاف فاسعوا في الإصلاح"".</span></p><p class=""indent"" style=""text-align:justify;"">یعنی اگر دو آدمیوں کے درمیان معمولی سا  اختلاف بھی ہو جائے تو ان کی آپس میں صلح کرنے کی کوشش کرو۔</p><p style=""text-align:justify;"">اسی طرح متعدد احادیث میں صلہ رحمی اور صلح کے فضائل بیان کئے گئے ہیں اور قطع تعلقی پر وعیدیں بیان کی گئی ہیں۔</p><p style=""text-align:justify;"">مشكاة المصابيح میں نبی کریم صلی اللہ علیہ وسلم کا ارشاد  مبارک ہے :</p><p class=""indent"" style=""text-align:justify;""><span class=""ar_writing"">""وعن أنس قال: قال رسول الله صلى الله عليه وسلم: من أحب أن يبسط له في رزقه وينسأ له في أثره فليصل رحمه . متفق عليه""</span></p><p style=""text-align:justify;"">ترجمہ :</p><p class=""indent"" style=""text-align:justify;"">""اور حضرت انس کہتے ہیں کہ رسول کریم ﷺ نے فرمایا جو شخص چاہتا ہے کہ اس کے رزق میں وسعت و فراخی اور اس کی موت میں تاخیر کی جائے یعنی اس کی عمر دراز ہو تو اس کو چاہئے کہ وہ اپنے رشتہ داروں کے ساتھ حسن سلوک اور احسان کرے۔"" (بخاری و مسلم )</p><p style=""text-align:justify;""><span class=""ar_writing"">وفيها ايضا :</span></p><p class=""indent"" style=""text-align:justify;""><span class=""ar_writing"">""وعن جبير بن مطعم قال: قال رسول الله صلى الله عليه وسلم: لا يدخل الجنة قاطع . متفق عليه""</span></p><p style=""text-align:justify;"">ترجمہ :</p><p class=""indent"" style=""text-align:justify;"">""اور حضرت جبیر بن مطعم کہتے ہیں کہ رسول کریم صلی اللہ علیہ وسلم نے فرمایا۔ قطع رحم کرنے والا جنت میں داخل نہیں ہو گا۔"" (بخاری ومسلم )</p><p style=""text-align:justify;""><span class=""ar_writing"">وفيها ايضا :</span></p><p class=""indent"" style=""text-align:justify;""><span class=""ar_writing"">""وعن ابن عمرو قال: قال رسول الله صلى الله عليه وسلم: ليس الواصل بالمكافىء ولكن الواصل الذي إذا قطعت رحمه وصلها . رواه البخاري""</span></p><p style=""text-align:justify;"">ترجمہ :</p><p class=""indent"" style=""text-align:justify;"">""اور حضرت ابن عمر کہتے ہیں کہ رسول کریم صلی اللہ علیہ وسلم  نے فرمایا کامل صلہ رحمی  کرنے والا وہ شخص نہیں ہے جو بدلہ چکائے، بلکہ کامل صلہ رحمی کرنے والا وہ ہے کہ جب اس کی قرابت کو منقطع کیا جائے تو وہ اس قرابت کو قائم رکھے ۔ "" (بخاری )</p><p style=""text-align:justify;""><span class=""ar_writing"">وفيها ايضا :</span></p><p class=""indent"" style=""text-align:justify;""><span class=""ar_writing"">""وعن عبدالله بن أبي أوفى قال: سمعت رسول الله صلى الله عليه وسلم يقول: لا تنزل الرحمة على قوم فيهم قاطع الرحم. رواه البيهقي في شعب الإيمان""</span></p><p class=""indent"" style=""text-align:left;""><span class=""ar_writing"">(‌‌كتاب الآداب، باب البر والصلة، ‌‌ج : 2، ص : 433، رحمانیة)</span></p><p style=""text-align:justify;"">ترجمہ :</p><p class=""indent"" style=""text-align:justify;"">""اور حضرت عبداللہ ابن ابی اوفی کہتے ہیں کہ میں نے رسول کریم صلی اللہ علیہ وسلم کو یہ فرماتے ہوئے سنا کہ اس قوم پر رحمت نازل نہیں ہوتی جس میں ناتا توڑنے والا ہو۔ (بیہقی )</p><p style=""text-align:justify;"">تشریح : ""قوم"" سے مراد پوری قوم نہیں ہے، بلکہ محض وہ لوگ مراد ہیں جو ناتا توڑنے والے کی مدد و حمایت کریں یا اس کو اپنے ناتے داروں کے ساتھ بد سلوکی کے ذریعہ ناتا توڑنے سے منع نہ کریں۔</p><p style=""text-align:justify;"">یہ بھی احتمال ہے کہ رحمت سے باران رحمت مراد ہو یعنی جس قوم یا جس آبادی کے اندر ناتا توڑنے والا کوئی شخص ہوتا ہے تو ناتا نا توڑے جانے کی نحوست سے اس قوم یا آبادی کو بارش سے محروم رکھا جاتا ہے۔</p><p style=""text-align:justify;""><span class=""ar_writing"">وفيها ايضا :</span></p><p class=""indent"" style=""text-align:justify;""><span class=""ar_writing"">""عن أبي أيوب الأنصاري قال: قال رسول الله صلى الله عليه وسلم: لا يحل للرجل أن يهجر أخاه فوق ثلاث ليال يلتقيان فيعرض هذا ويعرض هذاوخيرهما الذي يبدأ بالسلام . متفق عليه""</span></p><p style=""text-align:justify;"">ترجمہ :</p><p class=""indent"" style=""text-align:justify;"">""حضرت ابوایوب انصاری کہتے ہیں کہ رسول کریم صلی اللہ علیہ وسلم نے فرمایا۔ ” یہ کسی شخص کے لئے حلال نہیں ہے کہ وہ تین دن سے زیادہ اپنے مسلمان بھائی سے ملنا جلنا چھوڑے رکھے اور صورت یہ ہو کہ ( جب وہ کہیں ایک دوسرے کے سامنے آئیں تو یہ اپنا منہ ادھر کو پھیر لے اور وہ اپنا منہ دوسری طرف پھیر لے (یعنی دونوں ہی ایک دوسر سے سلام و کلام اور ملاقات سے احتراز کریں) اور ان دونوں میں بہتر شخص وہ ہےجو( خفگی کو دور کرنے کے لئے اور بحالی تعلقات کی خاطر) سلام میں پہل کرے۔“ (بخاری ومسلم)</p><p style=""text-align:justify;"">تشریح :  تین دن سے زیادہ کی قید کی بنا پر یہ سمجھا گیا ہے کہ اگر کسی وجہ سے اظہار خفگی کی خاطر تین دن تک ملنا جلنا چھوڑاجائے تو یہ حرام نہیں ہے، کیونکہ انسان کی طبیعت میں غیظ و غضب، غیرت وحمیت اور تندی و بے صبری کا جو مادہ ہے وہ بہر حال اپنا اثر ضرور ظاہر کرتا ہے ،اس لئے اس قدر مدت معاف کر دی گئی ہے، تاکہ انسان کے ان جذبات کی بھی کچھ تسکین ہو جایا کرے اور اس تین دن کے عرصہ میں خفگی و ناراضگی اور بغض در بغض و نفرت کے جذبات بھی ختم ہو جائیں یا کم سے کم ہلکے پڑ جائیں اور صلح و صفائی ہو جائے۔ بہر حال حدیث کی مراد یہ ہے کہ اجتماعی طور پر ایک جگہ رہنے سہنے اور روز مرہ کے باہمی معاملات کی وجہ سے آپس میں تنازع ہو جایا کرتا ہے۔ اور ایک دوسرے سے کوئی شکایت پیدا ہو جانے کی وجہ سے خفگی و نار اضگی کی صورت پیش آجاتی ہے، مثلاً ایک شخص نے کسی کی غیبت کر دی ۔ اس کو برا بھلا کہہ دیا اور یا اس کو اس شخص سے خیر خواہی کی امید تھی مگر اس نے خیر خواہی نہیں کی۔ تو اس طرح کی صورتوں میں اگر آپس میں ناراضگی و خفگی ہو جائے اور ترک ملاقات کی نوبت آجائے تو اس خفگی اور ترک ملاقات کو تین دن سے زیادہ نہیں رہنے دینا چاہئے۔</p><p style=""text-align:justify;""><span class=""ar_writing"">وفيها ايضا :</span></p><p class=""indent"" style=""text-align:justify;""><span class=""ar_writing"">""وعن أبي الدرداء قال: قال رسول الله صلى الله عليه وسلم: ألا أخبركم بأفضل من درجة الصيام والصدقة والصلاة؟قلنا: بلى. قال: إصلاح ذات البين وفساد ذات البين هي الحالقة. رواه أبو داود والترمذي وقال: هذا حديث صحيح""</span></p><p class=""indent"" style=""text-align:left;""><span class=""ar_writing"">(‌‌كتاب الآداب، باب ما ينهى عنه من التهاجر والتقاطع واتباع العورات، ‌‌الفصل الأول، ج : 2، ص : 441/42)</span></p><p style=""text-align:justify;"">ترجمہ :</p><p class=""indent"" style=""text-align:justify;"">""اور حضرت ابودرداء کہتے ہیں کہ (ایک دن) رسول کریم صلی اللہ علیہ وسلم  نے فرمایا۔ ""کیا میں تمہیں ایک ایسا عمل نہ بتادوں جس کے ثواب کا درجہ ، روزے، صدقے اور نماز کے ثواب سے زیادہ ہے۔"" ابو درداء کہتے ہیں کہ ہم نے یہ سن کر عرض کیا کہ ہاں (ضرور بتائیے) آپ صلی اللہ علیہ وسلم نے فرمایا۔ ” آپس میں دشمنی رکھنے والے دو شخصوں کے درمیان صلح کرانا۔ اس کے بعد فرمایا کہ اور دو آدمیوں کے درمیان فساد و نفاق پیدا کرنا ایک ایسی خصلت ہے جو مونڈنے والی ہے(انسان کے دین کو مونڈ کر صاف کردیتی ہے)، یعنی اس خصلت کی وجہ سے مسلمانوں کے معاملات اور دین میں نقصان و خلل پیدا ہوتا ہے اس روایت کو ترمذی ابو داؤد نے نقل کیا ہے اور کہا کہ یہ حدیث غریب ہے۔""</p><p class=""indent"" style=""text-align:left;"">فقط واللہ اعلم</p></p>",144603102092,banuri,"('حقوق و آدابِ معاشرت', 'huqooq-muashret')","('اَخلاقیات', 'akhlaaqiyaat')","('قطع رحمی و صلہ رحمی', 'sila-rehmi-or-qata-rehmi')"
10-09-2024,https://www.banuri.edu.pk/readquestion/atay-our-chawal-may-jo-keray-ro-jatay-hen-us-ka-shari-hukum-144603100536/10-09-2024,آٹےاورچاول میں جوکیڑےصاف کرنےکےبعدبھی غلطی سےرہ جائے،اس کا شرعی حکم,اگر چاول میں سسری لگی ہویعنی وہ جو سرخ سے رنگ کے کیڑے ہوتے ہیں اور چاول اپنی طرف سے صحیح سے صاف کر کے پکاۓ جائیں ، اس کے باوجود کوئی چند کیڑے انسانی غلطی سے رہ جائیں اور چاولوں کے ساتھ پک جائیں تو ایسے چاولوں کو کھانے کا شرعی حکم کیاہے؟نیز آٹے کے حوالے سے بھی یہی سوال ہے، آٹے میں دو طرح کے کیڑے ہوتے ہیں، ایک چاولوں جیسے اور ایک ہلکے بھورے سے رنگ کےجوکہ نسبتالمبا پتلا سا کیڑاہوتا ہے،اس کا شرعی حکم بتا دیں۔,"<p><p style=""text-align:justify;"">صورتِ مسئولہ میں ایسےچاول پاک ہیں،ضرورت کی وجہ سےاسےکھاسکتےہیں،نیزآٹےکابھی یہی حکم ہے،پہلےتواسےمکمل صاف کرناضروری ہے،پھراگرصاف کرنے کےباجودبھی اس میں کیڑےرہ جائیں توضرورت کی وجہ سےاس قدرمعاف ہے،کیڑےنکالنےکےبعداستعمال کی گنجائش ہے۔</p><p style=""text-align:justify;"">مرقات المفاتیح میں ہے:</p><p class=""indent"" style=""text-align:justify;""><span class=""ar_writing"">""(وعن أنس رضي الله عنه قال: ""أتي النبي صلى الله عليه وسلم بتمر عتيق ) : أي قديم (فجعل) : أي شرع (يفتشه ويخرج السوس منه) : وهو دود في الطعام والصوف، وقد قيل في حكمة وجوده: لولا السوس ما خرج المدسوس...وفيه ‌أن ‌الطعام ‌لا ‌ينجس ‌بوقوع ‌الدود ‌فيه ‌ولا ‌يحرم ‌أكله.""</span></p><p class=""indent"" style=""text-align:left;""><span class=""ar_writing"">(كتاب الأطعمة، ج:7، ص:2723، ط:دار الفكر)</span></p><p>شرح سنن ابی داؤد لابن الرسلان میں ہے:</p><p class=""indent"" style=""text-align:justify;""><span class=""ar_writing"">""عن أنس بن مالك قال: أتي النبي صلى الله عليه وسلم بتمر عتيق ‌فجعل ‌يفتشه ‌يخرج ‌السوس ‌منه .</span></p><p class=""indent"" style=""text-align:justify;""><span class=""ar_writing"">وقد قال أصحابنا في الدود المتولد من الفواكه والجبن والخل والباقلاء والبطيخ والحبوب ونحوها أنه إذا مات فيما تولد منه ينجس بالموت على المذهب، وفي حل أكله ثلاثة أوجه، أصحها: حل أكله مع ما تولد منه لا منفردا.والثاني: يحل مطلقا. والثالث: يحرم مطلقا، فعلى الصحيح يكون نجسا لا ضرر في أكله، ويحل أكله معه، كما يحل أكل العسل نفسه وفيه فراخ؛ لأن التحرز من ذلك مشق، لكن الأحسن إخراجه منه حيا أو ميتا.""</span></p><p class=""indent"" style=""text-align:left;""><span class=""ar_writing"">(كتاب الأطعمة، باب في تفتيش التمر المسوس عند الأكل، ج:15، ص:485، الناشر: دار الفلاح)</span></p><p>فتاوی ہندیہ میں ہے:</p><p class=""indent"" style=""text-align:justify;""><span class=""ar_writing"">""أكل دود القز قبل أن ينفخ فيه الروح لا بأس به، كذا في الذخيرة.أكل دود الزنبور قبل أن ينفخ فيه الروح لا بأس به، كذا في السراجية.""</span></p><p class=""indent"" style=""text-align:left;""><span class=""ar_writing"">(كتاب الكراهية، الباب الحادي عشر في الكراهة في الأكل وما يتصل به، ج:5، ص:339، ط:دار الفكر)</span></p><p>فتاوی شامی میں ہے:</p><p class=""indent"" style=""text-align:justify;""><span class=""ar_writing"">""وكل ما لا دم له فهو مكروه أكله إلا الجراد كالزنبور والذباب أتقاني. ولا بأس بدود الزنبور قبل أن ينفخ فيه الروح لأن ما لا روح له لا يسمى ميتة خانية وغيرها: قال ط:<span style=""text-decoration:underline;"">ويؤخذ منه أن ‌أكل ‌الجبن أو الخل أو الثمار كالنبق بدوده لا يجوز إن نفخ فيه الروح</span>.""</span></p><p class=""indent"" style=""text-align:left;""><span class=""ar_writing"">(كتاب الذبائح ، ج:6، ص:306، ط: دار الفكر)</span></p><p>امدادالفتاوی میں ہے:</p><p class=""indent"" style=""text-align:justify;"">""اشیائے خوردنی میں کیڑےپڑجاویں ،اس کاحکم:</p><p class=""indent"" style=""text-align:justify;"">سوال : کیا فرماتے ہیں علمائے دین اور مفتیان شرع متین کہ جس  اناج یا آٹے میں کیڑے پیدا ہو جا دیں اس کا کھانا، اور جس گولر میں بُھنگے ہوں یا جس شربت اور تر چیز میں چینوٹے گر کر مر جاویں اس کا کھانا پینا شرعاً حرام  ہے یا حلال ؟</p><p class=""indent"" style=""text-align:justify;"">الجواب ۔ ان کو نکال کر پھر کھانا پینا حلال ہے ۔</p><p class=""indent"" style=""text-align:justify;"">ايضا سوال : سرکہ یا پھل مثل گولر وغیرہ میں جو کیڑے پیدا ہو جاتے ہیں ان کیڑوں کا کھاناجائزہ ہے یا نہیں ؟ بہتیرے سرکہ میں گل کر مختلط ہو جاتے ہیں جن سے احترانہ نا ممکن ہے ؟</p><p class=""indent"" style=""text-align:justify;"">الجواب:<span class=""ar_writing"">( في الشامى عن الطحطاوي و يوخذ منه ان اكل الجبن او المخل او الثمارکا لنبق بدودة لا يجوزان نفخ فيه الروح اھ جلده ص ۲۹۹‘ ۲۹۹)</span></p><p class=""indent"" style=""text-align:justify;"">اس سے معلوم ہوا کہ ایسے کیڑوں کا کھانا جائز نہیں، اور جو مخلوط ہو گئے وہ ضرورت کی وجہ سے عفو ہیں۔""</p><p class=""indent"" style=""text-align:left;"">(جلد:4، ص:104/103، مکتبہ دار العلوم کراچی )</p><p class=""indent"" style=""text-align:left;"">فقط واللہ اعلم</p></p>",144603100536,banuri,"('حظر و اباحت', 'mamnooaat-mubahat')","('ماکولات / مشروبات', 'makoolat-mashroobat')","('کھانے پینے کی حلال و حرام ، مکروہ و مباح اشیاء', 'khanay-penay-ki-halal-o-haram-makroh-o-mubah-ashya')"
