issued_at,link,title,question,answer,fatwa_number,dar_ul_ifta,kitab,bab,fasal
21-10-2019,https://www.banuri.edu.pk/readquestion/درزی-کا-ٹخنوں-سے-نیچے-تک-شلوار-یا-پتلون-سینا-144102200140/21-10-2019,درزی کا ٹخنوں سے نیچے تک شلوار یا پتلون سینا,1۔ میں درزی کا کام کرتا ہوں، جہاں مجھے آڈر کے مطابق مردانہ کپڑے سینے ہوتے ہیں،  کام میں شلوار قمیص،  پینٹ شرٹ،  کورٹ، ٹائی سب سینے ہوتے ہیں،  کیا میرے  لیے یہ سب کام لینا اور سی کر دینا اور اجرت لینا جائز ہے؟2۔ عام طور پر درزی شلوار یا پینٹ کا ناپ بڑھتا ہوا  ہی لیتے ہیں، یعنی زمین تک کا سائز لیتے ہیں، البتہ اگر کسٹومر ٹخنوں سے اوپر تک سائز لینے کا کہتا ہے تو ہم درزی ٹخنوں سے اوپر تک سائز لے لیتے ہیں، کیا اس معاملہ میں درزی ذمہ دار ہوگا؟ یعنی اس کی کمائی حلال ہوگی کہ نہیں؟,"<p><p style=""text-align:justify;"">1۔  کپڑے سی کر سلائی کی مد میں اجرت لینا جائز ہے، تاہم خلاف شرع لباس سینے سے اجتناب ضروری ہے، ٹائی یا پینٹ پہننا اگرچہ حرام نہیں، تاہم ٹائی پہننا کراہت سے خالی بھی نہیں، جس کی وجہ سے ٹائی کی سلائی کی اجرت اگرچہ حرام تو نہیں تاہم گوں نا گوں  کراہت سے خالی بھی نہیں۔</p><p style=""text-align:justify;"">2۔  ٹخنوں سے نیچے پائنچے رکھنا مکروہ تحریمی ہے،  اس گناہ سے اجتناب کرنا ضروری ہے، اگرچہ ٹخنے چھپانا ہر ایک کا اپنا فعل ہے، جس کا گناہ اسے ہی ہوتا ہے، کسی اور کو نہیں ہوتا، تاہم ٹخنوں سے نیچے شلوار یا پتلون سینا گناہ کے کام میں ایک قسم کی معاونت کے قبیل سے ہے، جس کی وجہ کمائی میں بھی اجرت کا اتنا حصہ کراہت سے خالی نہیں رہتا، لہذا درزی کے پیشے سے وابستہ افراد کو اس معاونت سے اجتناب کرنا چاہیے۔</p><p style=""text-align:justify;"">فتاوي شامي میں ہے:</p><p class=""indent"" style=""text-align:justify;""><span class=""ar_writing"">""وَيُكْرَهُ لِلرِّجَالِ السَّرَاوِيلُ الَّتِي تَقَعُ عَلَى ظَهْرِ الْقَدَمَيْنِ عَتَّابِيَّةٌ."" (فَصْلٌ فِي اللُّبْسِ ، ٦ / ٣٥١) ۔</span></p><p class=""indent"" style=""text-align:left;"">فقط واللہ اعلم</p></p>",144102200140,banuri,"('معاملات', 'muamlat')","('ملازمت', 'ملازمت')","('اوقات ملازمت', 'owqat-e-mulazimat')"
11-09-2024,https://www.banuri.edu.pk/readquestion/teen-talaq-ka-hkm-144603100664/11-09-2024,تین طلاق کا حکم,ہمارے بہنوئی نے ہماری بہن کو تین طلاقیں دی ہیں، جو تحریری شکل میں ہے، تحریری طلاق اس نے خود سسر کے گھر پہنچائی ہیں، سوال یہ ہے کہ اس طرح طلاق واقع ہو جاتی ہے یانہیں؟ہمیں اس بارے میں کچھ علم نہیں کہ وہ اس نے خود لکھی ہے یا کسی اور نے لکھی ہے، البتہ وہ اس طلاق نامہ کو دینے خود آئے تھے، اور تکیہ کے نیچے رکھ کر چلے گئے، طلاق نامہ کو پڑھنے کے بعد معلوم ہوا کہ اس پر دستخط نہیں ہے۔,"<p><p style=""text-align:justify;"">صورتِ مسئولہ میں اگر شوہر نے طلاق کے کاغذ خود بنائے ہیں یا اس کے کہنے پر بنائے گئے ہیں تو اس کی بیوی پر تین طلاقیں واقع ہو گئی ہیں، نکاح ختم ہو گیا ہے، اب ساتھ رہنا جائز نہیں ہے۔</p><p dir=""rtl"" style=""text-align:justify;""><span lang=""er"" xml:lang=""er"">قرآن کریم میں ارشادباری تعالی  ہے:</span></p><p class=""indent"" dir=""rtl"" style=""text-align:justify;""><span class=""qr_writing""><span lang=""er"" xml:lang=""er"">""الطَّلاَقُ مَرَّتَانِ فَإِمْسَاكٌ بِمَعْرُوفٍ أَوْ تَسْرِيحٌ بِإِحْسَانٍ ۔۔۔ فَإِن طَلَّقَهَا فَلاَ تَحِلُّ لَهُ مِن بَعْدُ حَتَّىَ تَنكِحَ زَوْجًا غَيْرَهُ</span><span lang=""er"" xml:lang=""er""> ""</span><span lang=""ar-sa"" xml:lang=""ar-sa"">(البقرة: </span><span dir=""ltr"">(229.230</span></span></p><p class=""indent"" dir=""rtl"" style=""text-align:justify;""><span lang=""er"" xml:lang=""er"">"" وہ طلاق دو مرتبہ (کی )ہے ، پھر خواہ رکھ لینا قاعدے کے موافق، خواہ چھوڑدینا خوش عنوانی کے ساتھ ...  پھر اگر کوئی (تیسری) طلاق دے دے عورت کو تو پھر وہ اس کے لئے حلال نہ رہے گی اس کے بعد یہاں تک کہ وہ اس کے سوا ایک اور خاوند کے ساتھ (عدت کے بعد) نکاح کرے۔""</span><span lang=""er"" xml:lang=""er"">  </span><span dir=""ltr"">)</span><span lang=""er"" xml:lang=""er""> ترجمہ از بیان القرآن)</span></p><p dir=""rtl"" style=""text-align:justify;"">حدیث مبارک میں ہے:</p><p class=""indent"" dir=""rtl"" style=""text-align:justify;""><span class=""ar_writing""><span lang=""er"" xml:lang=""er"">""</span><span lang=""er"" xml:lang=""er"">عن عائشة أن رجلا طلق امرأته ثلاثا فتزوجت فطلق فسئل النبي صلى الله عليه وسلم أتحل للأول قال: لا حتى يذوق عسيلتها كما ذاق الأول</span><span lang=""er"" xml:lang=""er"">.""</span></span></p><p align=""right"" class=""indent"" dir=""rtl"" style=""text-align:left;""><span class=""ar_writing""><span lang=""ar-sa"" xml:lang=""ar-sa"">(</span><span lang=""er"" xml:lang=""er"">صحيح البخاری ، </span>كتاب الطلاق ، باب من أجاز طلاق الثلاث ، 2/ 300 ، ط : رحمانية)</span></p><p class=""indent"" dir=""rtl"" style=""text-align:justify;""><span lang=""ar-sa"" xml:lang=""ar-sa"">ترجمہ: ""حضرت عائشہ رضی اللہ عنہا سے روایت ہے کہ ایک شخص نے اپنی بیوی کو تین طلاقیں دیں، عورت نے دوسری جگہ نکاح کیا اور دوسرے شوہر نے بھی طلاق دے دی، پھر آپ صلی اللہ علیہ وسلم سے پوچھا گیا کہ کیا یہ عورت پہلے شوہر کے لیے حلال ہوگئی ہے؟ آپ </span>صلی اللہ علیہ وسلم نے فرمایا: نہیں! یہاں تک کہ دوسرا شوہر بھی اس کی لذت چکھ لے جیساکہ پہلے شوہر نے چکھی ہے۔""</p><p style=""text-align:justify;"">فتاوی عالمگیری میں ہے :</p><p class=""indent"" style=""text-align:justify;""><span class=""ar_writing"">""وإن كان الطلاق ثلاثا في الحرة وثنتين في الأمة لم تحل له حتى تنكح زوجا غيره نكاحا صحيحا ويدخل بها ثم يطلقها أو يموت عنها كذا في الهداية ولا فرق في ذلك بين كون المطلقة مدخولا بها أو غير مدخول بها كذا في فتح القدير ويشترط أن يكون الإيلاج موجبا للغسل وهو التقاء الختانين هكذا في العيني شرح الكنز.""</span></p><p class=""indent"" style=""text-align:left;""><span class=""ar_writing"">(کتاب الطلاق ، الباب السادس ، فصل فیما تحل به الطلقة ، 1/ 473 ، ط : رشیدیة)</span></p><p class=""indent"" style=""text-align:left;""><span class=""ar_writing"">فقط واللہ اعلم</span></p></p>",144603100664,banuri,"('طلاق', 'talaaq')","('وقوع طلاق وعدم وقوع طلاق', 'wuqoo-e-talaq-o-adme-wuqoo-e-talaq')","('تین طلاق', 'teen-talaqayn')"
10-09-2024,https://www.banuri.edu.pk/readquestion/dalaal-ki-ujrat-mutaein-na-ho-to-ujrat-r-misal-milay-gi-144603100389/10-09-2024,بروکری متعین نہ ہو تو اجرت مثل ملے گی,کینیڈا میں ایک کمپنی ہے جس کا فرنیچر کا کاروبار ہے، ان کا طریقہ یہ ہے کہ وہ اپنے سامان کی تصاویر ایک شخص کوبھیجتے ہیں، وہ دوسرا شخص ایک تیسرے کو بھیجتا ہے، وہ تیسرا شخص ان تصاویر کو Face book Market place میں اپ لوڈ کرتا ہے اور جس شہر کی لوکیشن وہ ڈالتا ہے اسی شہر والوں کے پاس وہ تصاویر چلی جاتی ہیں، کسٹمر تصاویر دیکھ کر پسند کرتا ہے،  جو چیز پسند آجائے وہ کمپنی کو بتا دیتا ہے، پھر کمپنی مطلوبہ چیز فراہم کرتی ہے، اور کمپنی اس خریدار سے رقم وصول کرتی ہے۔کمپنی کی طرف سے کمیشن کی رقم طے اور متعین ہے، کمپنی وہ رقم اس دوسرے شخص کو دیتی ہے، پھر وہ دوسرا شخص ہماری (تیسرے شخص کی) حُسن کاکردگی کے مطابق ہمیں رقم دیتا ہے، یعنی اگر ہم نے کثیر تعداد میں گاہک فراہم کیے اور ان کا کاروبار خوب چلا، تو وہ دوسرا شخص پورا کمیشن ہمیں دے دیتا ہے، لیکن جب زیادہ مال نہ بکے تو اس کمیشن کی رقم میں سے کچھ اپنے لیے رکھ کر بقیہ رقم ہمیں دیتا ہے۔سوال یہ ہے کہ  اس  طریقہ سے حاصل شدہ نفع جائز ہے؟,"<p><p style=""text-align:justify;"">صورتِ مسئولہ میں جب کمپنی نے ایک شخص کو اپنا سامان فروخت کرنے کے لیے خریدار ڈھونڈنے کا کام سپرد کیا، تو اس شخص کی حیثیت بروکر کی ہوگئی، بروکر کی اجرت کے جائز ہونے کے لیے یہ شرط ہے کہ اجرت  متعین ہو، اگر اجرت متعین نہ ہوگی ، تو معاملہ فاسد اور ناجائز ہوگا،لہذا مذکورہ صورت میں کمپنی اور دوسرے شخص کے درمیان اجرت متعین ہونے کی وجہ سے ان دونوں کا آپس میں معاملہ جائز ہے، اور دوسرے شخص کے لیے اجرت لینا درست ہے، البتہ دوسرے اور تیسرے   شخص کے مابین اجرت مجہول ہے کہ کبھی زیادہ رقم ملتی ہے کبھی کم، لہذا یہ صورت فاسد ہے، ان دونوں کو چاہیے کہ اجرت متعین کرلیں، اجرت کی تعیین میں یا تو ایک رقم طے کریں کہ اتنی مخصوص رقم تیسرے شخص کو بہر صورت ملے گی، یا پھر کوئی فیصد متعین کرلیں کہ ایک گاہک لانے پر یا ایک پروڈکٹ فروخت کرنےپر اتنا فیصد کمیشن ملے گا، الغرض سائل یعنی تیسرے بروکر کے لیے نفع کی قیمت مجہول نہ ہو۔</p><p style=""text-align:justify;"">باقی اب تک معاملہ فاسد ہونے کی وجہ سے جو اجرت سائل لیتے رہے ہیں، اس رقم میں سے اجرتِ مثل(عرف میں اس کام کی جتنی رقم بنتی ہے) اپنے پاس رکھ کر بقیہ زائد رقم دوسرے شخص کو واپس کرنا ضروری ہے،نیز اس میں یہ بھی ضروری ہےکہ سائل کسٹمر کے ساتھ سودا نہ کرے بلکہ صرف کمپنی تک آرڈر پہنچانے میں واسطے کا کردار ادا کرے۔</p><p>فتاوی شامی میں ہے:</p><p class=""indent"" style=""text-align:justify;""><span class=""ar_writing"">""قال في التتارخانية: وفي الدلال والسمسار يجب أجر المثل، وما تواضعوا عليه أن في كل عشرة دنانير كذا فذاك حرام عليهم. وفي الحاوي: سئل محمد بن سلمة عن أجرة السمسار، فقال: أرجو أنه لا بأس به وإن كان في الأصل فاسدا لكثرة التعامل وكثير من هذا غير جائز، فجوزوه لحاجة الناس إليه كدخول الحمام وعنه قال: رأيت ابن شجاع يقاطع نساجا ينسج له ثيابا في كل سنة.""</span></p><p class=""indent"" style=""text-align:left;""><span class=""ar_writing"">(کتاب الإجارة، باب إجارة الفاسدة، ج: 5، ص: 63، ط: دار الفکر)</span></p><p>المبسوط للسرخسی میں ہے:</p><p class=""indent"" style=""text-align:justify;""><span class=""ar_writing"">""قال - رحمه الله - ذكر حديث قيس بن أبي غرزة الكناني قال: ""كنا نبتاع الأوساق بالمدينة ونسمي أنفسنا السماسرة فخرج علينا رسول الله - صلى الله عليه وسلم - فسمانا باسم هو أحسن من اسمنا قال: - صلى الله عليه وسلم - يا معشر التجار إن البيع يحضره اللغو والحلف فشوبوهبالصدقة"" والسمسار اسم لمن يعمل للغير بالأجر بيعا وشراء ومقصوده من إيراد الحديث بيان جواز ذلك؛ ولهذا بين في الباب طريق الجواز... وإن استأجره يوما إلى الليل بأجر معلوم ليبيع له، أو ليشتري له فهذا جائز؛ لأن العقد يتناول منافعه هنا وهو معلوم ببيان المدة والأجير قادر على إيفاء المعقود عليه.""</span></p><p class=""indent"" style=""text-align:left;""><span class=""ar_writing"">(باب السمسار، ج:15، ص:115، ط: دار المعرفة)  </span></p><p>البحر الرائق میں ہے:</p><p class=""indent"" style=""text-align:justify;""><span class=""ar_writing"">""قال رحمه الله (وإن أطلق له أن يستأجر غيره) لأن الواجب عليه عمل مطلق في ذمته ويمكن الإيفاء بنفسه وبغيره كالمأمور بقضاء الدين.""</span></p><p class=""indent"" style=""text-align:left;""><span class=""ar_writing"">(تكملة البحر الرائق، كتاب الاجارة، ج:8، ص:9، ط: دار الكتاب الاسلامي)</span></p><p>دررالحکام میں ہے:</p><p class=""indent"" style=""text-align:justify;""><span class=""ar_writing"">"" لو أعطى أحد ماله لدلال، وقال بعه بكذا دراهم فإن باعه الدلال بأزيد من ذلك فالفضل أيضا لصاحب المال، وليس للدلال سوى الأجرة. لو أعطى أحد مالا للدلال، وقال بعه اليوم بكذا قرشا فإن باعه الدلال بأزيد من ذلك فالفضل أيضا لصاحب المال؛ لأن هذا الفضل بدل مال ذلك الشخص، فكما أن ذلك المبدل كان ماله فالبدل يلزم أن يكون كذلك، وليس للدلال سوى أجرة الدلالة (علي أفندي بزيادة) وإذا لم تسلم له أجرة فله أجر المثل بالغا ما بلغ، وإذا أعطى أحد مالا للدلال قائلا: إذا بعت المال بزيادة عن كذا فلك الزيادة فالإجارة فاسدة .""</span></p><p class=""indent"" style=""text-align:left;""><span class=""ar_writing"">(الکتاب الثانی: الاجارۃ، الفصل الرابع، المادۃ:578، ج:1، ص:662، ط: دار الجیل)</span></p><p class=""indent"" style=""text-align:left;"">فقط واللہ أعلم</p></p>",144603100389,banuri,"('اجارہ', 'ijaarah')","('بروکری و دلالی', 'brokery-o-dalaaly')","('بروکری / دلالی کے احکام', 'brokery-dalaaly-ka-ahkaam')"
22-09-2024,https://www.banuri.edu.pk/readquestion/pablik-transpurt-may-farz-nmaz-ada-krna-kasa-hay-144603102113/22-09-2024,پبلک ٹرانسپورٹ یعنی گاڑیوں میں فرض نمازاداکرناکیسا ہے؟,پبلک ٹرانسپورٹ یعنی گاڑیوں میں  فرض نماز ادا کرنا کیسا ہے ؟,"<p><p style=""text-align:justify;"">فرض نماز  کی ادائیگی کے لیے قیام ضروری ہے، اگر تن درست آدمی بیٹھے بیٹھے نماز پڑھے تو نماز درست نہ  ہوگی، نیز گاڑی میں قبلہ رخ رہنا بھی ممکن نہیں ہے، لہذا گاڑی رکوا کر اتر کر نماز ادا کی جائے، اگر کسی نے چلتی کار، وین وغیرہ میں قیام کے بغیر یا قبلہ کا رخ کیے بغیر فرض نماز ادا کرلی تو اس کو دہرانا لازم ہوگا۔</p><p style=""text-align:justify;"">”بس“ کے بارے میں ذرا تفصیل ہے کہ اگر شہر  سے باہر لمبا سفر ہو اور بس ڈرائیور کہنے کے باوجود بس نہ روکے اور نماز کا وقت نکل رہا ہو، تو دیکھا جائے گا کہ اگر بس کے اندر  قبلہ رُخ ہوکر قیام، رکوع اور سجدے کے ساتھ نماز ادا کی جاسکتی ہے تو اس طرح نماز ادا کرے۔ چنانچہ اگر بس قبلہ رخ چل رہی ہو یا مخالف سمت جارہی ہو اور سیٹوں کے درمیان فاصلہ ہو تو قیام، رکوع اور سجود کے ساتھ نماز ادا کی جاسکتی ہے، اس صورت میں اگرقیام(کھڑے ہونے) کے لیے سہارا لینا پڑے تو اس کی اجازت ہوگی، اگرپورے قیام کے دوران سہارا لینا پڑے اور ہاتھ نہ باندھ سکے تب بھی قیام نہ چھوڑے ، سہارا لے کرقیام ، رکوع اورسجدےکے ساتھ نماز ادا کرے۔</p><p style=""text-align:justify;"">اگر بس کے زیادہ حرکت کرنے یاچکرآنے کی وجہ سے قیام نہ کرسکے تواسی راہ داری میں بیٹھ کربس کے فرش(زمین) پرسجدہ کرتے ہوئے نماز اداکرے، البتہ اگر بس شمالاً جنوباً (پاکستان وغیرہ میں) جارہی ہو تو یہ کیا جاسکتاہے کہ سیٹ کی طرف رخ کر کے قیام اور رکوع کیا جائے اور سجدے کے لیے سیٹ پر بیٹھ کر سامنے والی سیٹ پر سجدہ کرلیا جائے۔</p><p style=""text-align:justify;"">اور اگر بس میں مذکورہ صورتوں کے مطابق نماز ادا نہ کی جاسکتی ہو (مثلاً: قیام ہی ممکن نہ ہو، یا قیام تو ممکن ہو لیکن قبلہ رخ نہ ہوسکے، یا سجدہ نہ کیا جاسکتاہو، یا کار وغیرہ کا ڈرائیور گاڑی نہ روکے) اور نماز کا وقت نکل رہا ہو تو فی الحال ""تشبہ بالمصلین"" (نمازیوں کی مشابہت اختیار) کرتے ہوئے نماز پڑھ لے ، پھر جب گاڑی سے اتر جائے تو فرض اور وتر کی ضرور قضا کرے۔</p><p style=""text-align:justify;"">البحرالرائق میں ہے:</p><p class=""indent"" style=""text-align:justify;""><span class=""ar_writing"">""وفي الخلاصة: وفتاوی قاضیخان وغیرهما: الأیسر في ید العدو إذا منعه الکافر عن الوضوء والصلاة یتیمم ویصلي بالإیماء، ثم یعید إذا خرج … فعلم منه أن العذر إن کان من قبل الله تعالی لاتجب الإعادة، وإن کان من قبل العبد وجبت الإعادة."" </span></p><p class=""indent"" style=""text-align:left;""><span class=""ar_writing"">(الکتاب الطهارة، باب التیمم، ج:1، ص:142، ط: رشیديه)</span></p><p style=""text-align:justify;"">احسن الفتاوی میں ہے:</p><p class=""indent"" style=""text-align:justify;"">”سوال : ریل گاڑی یا بس کے سفر میں نماز کیسے پڑھے؟ اگر ڈرائیور بس نہ روکے اور بس اسٹاپ یا اسٹیشن تک پہنچنے میں وقت نکل جانےکا خطرہ ہو ، اگر کھڑا نہ ہو سکتا ہو تو بیٹھ کر نماز ہو جائے گی ؟ اور قبلہ کی طرف رخ نہ ہو سکے تو کیا کرے ؟</p><p class=""indent"" style=""text-align:justify;"">جواب:ریل گاڑی اور بس میں کھڑے ہو کر قبلہ رخ نماز پڑھیں، گرنے کا خطرہ ہو تو کسی چیز سے ٹیک لگا کر یا ہاتھ سے کوئی چیز پکڑ کر کھڑے ہوں ، حالت قیام میں ہاتھ باندھنا سنت ہے فرض نہیں اور قیام فرض ہے ، اس لیے بوقت ضرورت ہاتھ چھوڑ کر کسی چیز کو پکڑ کر کھڑاہو ، اگر قبلہ رخ ہونے کی گنجائش نہ ہو تو دو نشستوں کے درمیان قبلہ رخ کھڑا ہو کر قیام و رکوع کا فرض ادا کر ے اور سجدہ کے لئے پچھلی نشست پر کرسی کی طرح بیٹھ جائے یعنی پاؤں نیچے ہی رہیں اور سامنے کی نشست پر سجدہ کرے ، اس صورت میں بحالت سجدہ گھٹنے کسی چیز پر نہیں ٹکیں گے مگر سجدہ میں گھٹنے رکھنا فرض نہیں بلکہ واجب یا سنت ہے بوقت غذر اس کے ترک سے نماز ہو جائے گی ، اگر کسی وجہ سے قیام یا استقبال قبلہ کا فرض کسی بھی طرح ادانہ ہوسکےتواس وقت جیسےبھی ممکن ہونمازپڑھ لےمگربعدمیں ایسی نمازکااعادہ کرے۔“</p><p class=""indent"" style=""text-align:left;"">(احسن الفتاوی، ج:4، ص:88، ط:ایچ ایم سعید) </p><p style=""text-align:justify;"">فتاوی محمودیہ میں ہے:</p><p class=""indent"" style=""text-align:justify;"">”کیا فرماتے ہیں علماء دین ومفتیان شرع متین اس مسئلہ کے بارے میں کہ چلتی گاڑی میں نماز پڑھنا کیسا ہے؟ آیا بیٹھ کر نماز پڑھنا جائز ہے یا کھڑے ہو کر پڑھنا ضروری ہے؟</p><p class=""indent"" style=""text-align:justify;"">ج بسم الله الرحمن الرحیم ۔ گاڑی میں کھڑے ہو کر ہی نماز پڑھنا ضروری ہے ، ہاں اگر کوئی شخص کھڑے ہو کر گاڑی میں نماز نہ پڑھ سکے اور اسٹیشن پر اتر کر نماز پڑھنے کی کوئی صورت نہ بن سکے تو ایسی صورت میں بوجہ عذر کے بیٹھ کر نماز پڑھنا درست ہو گا ۔“</p><p class=""indent"" style=""text-align:left;"">(فتاوی محمودیہ، ج:2، ص:816، ط:جمعیت پبلیکیشنز)</p><p class=""indent"" style=""text-align:left;"">فقط واللہ اعلم</p></p>",144603102113,banuri,"('نماز', 'salat')","('نماز کی شرائط', 'namaz-ki-sharait')","('استقبال قبلہ', 'istiqbaal-e-qibla')"
13-08-2022,https://www.banuri.edu.pk/readquestion/ysal-lrki-ka-nam-rkhana-144401100959/13-08-2022,یشل لڑکی کا نام رکھنا,یشل لڑکی کا نام رکھنا کیسا ہے؟,"<p><p style=""text-align:justify;"">یشل نام   کا معنی ملا نہیں ،لہذا یہ نام رکھنا درست نہیں، لہذا لڑکی کے لیے صحابیت  کے ناموں میں سے کوئی نام رکھ لیا جائے ۔فقط واللہ اعلم</p></p>",144401100959,banuri,"('حقوق و آدابِ معاشرت', 'huqooq-muashret')","('حقوق', 'bahmi-huqooq')","('اولاد کے حقوق', 'olad-ky-hoqoq')"
