issued_at,link,title,question,answer,fatwa_number,dar_ul_ifta,kitab,bab,fasal
31-10-2023,https://www.banuri.edu.pk/readquestion/mahram-khaten-ki-tafsel-jn-se-nkah-jaiz-nh-h-144504101485/31-10-2023,محرم خواتین کی تفصیل جن سے نکاح کرنا جائز نہیں ہے,محرم اور غیر محرم رشتے کون سے ہیں جن سے شادی کی جاسکتی ہو، رہنمائی فرمائیں؟,"<p><p style=""text-align:justify;"">کسی عورت کا کسی کے  لیے محرمہ  ہونے کے درجِ ذیل  آٹھ اسباب ہیں، جن کے ہوتے ہوئے متعلقہ خاتون سے نکاح جائز نہیں ہے:</p><p style=""text-align:justify;""><span style=""color:#2dc26b;"">(1) حرمت بسبب نسب(نسبی رشتہ داری کی وجہ سے حرمت):</span></p><p class=""indent"" style=""text-align:justify;"">جیسے اپنی اولاد یعنی بیٹی/ پوتی/ پڑپوتی/ نواسی، اسی طرح ماں/ دادی/ پردادی/ نانی/ پر نانی، اسی طرح بہن/ خالہ/ پھوپھی/ بھتیجی/ بھانجی سے نکاح کرنا جائز نہیں ہے۔</p><p style=""text-align:justify;""><span style=""color:#2dc26b;"">(2)حرمت بسبب مصاہرت(سسرالی رشتہ داری کی وجہ سے حرمت):</span></p><p class=""indent"" style=""text-align:justify;"">جیسے  ساس یعنی بیوی کی ماں/ باپ کی ماں/ بیٹے کی بیوی/ پوتے کی بیوی سے نکاح جائز نہیں ہے۔</p><p style=""text-align:justify;""><span style=""color:#2dc26b;"">(3) حرمت بسبب رضاع(دودھ پلانے کی وجہ سے حرمت):</span></p><p class=""indent"" style=""text-align:justify;"">جتنے رشتے نسب کے اعتبار سے حرام ہے وہ رشتے دودھ پینے کی وجہ سے بھی حرام ہیں یعنی دودھ پینے والے بچے کے لئے دودھ پلانے والی خاتون اور اس کی بیٹیوں سے نکاح جائز نہیں۔ ہے۔</p><p style=""text-align:justify;""><span style=""color:#2dc26b;"">(4) حرمت  بسبب جمع بین الاختین(محرم عورتوں سے اکٹھے نکاح کرنا ):</span></p><p class=""indent"" style=""text-align:justify;"">جب ایک بہن نکاح میں ہو تو اس کی دوسری بہن سے نکاح کرنا جائز نہیں ہے، اسی طرح جب تک یہ نکاح میں ہے، تو اس کی خالہ/ پھوپھی/ بھتیجی/ بھانجی وغیرہ سے نکاح جائز نہیں ہے۔</p><p style=""text-align:justify;""><span style=""color:#2dc26b;"">(5) حرمت بسبب تعلق حق الغیر:</span></p><p class=""indent"" style=""text-align:justify;"">جیسے  منکوحہ اور معتده ، ان سے نکاح کرنا جائز نہیں ہے۔</p><p style=""text-align:justify;""><span style=""color:#2dc26b;""> (6) تین طلاقِ مغلظہ کی وجہ سے حرمت:</span></p><p class=""indent"" style=""text-align:justify;"">جب کسی خاتون کو تین طلاقِ مغلظہ دی جائے، تو اس دوران اس سے نکاح کرنا جائز نہیں ہے، تاوقتے کہ اس کا  کسی اور جگہ نکاح ہوجائے اور وہاں سے ازدواجی تعلق کے بعد اس کو طلاق  ہوجائے   یادوسرے شوہر کاانتقال ہوجائے۔</p><p style=""text-align:justify;""><span style=""color:#2dc26b;"">(7) کسی آسمانی دین کے قائل نہ ہونے سے حرمت:</span></p><p class=""indent"" style=""text-align:justify;"">جیسے مجوسیہ اور بت پرست خاتون سے نکاح جائز نہیں ہے۔</p><p style=""text-align:justify;""><span style=""color:#2dc26b;""> (8) پہلے سےچار عورتوں کا نکاح میں ہونے کی وجہ سے حرمت :</span></p><p class=""indent"" style=""text-align:justify;"">جب تک چار خواتین نکاح یا عدت میں پہلے سے موجود ہو، تو پانچوی خاتون سے نکاح کرنا جائز نہیں ہے۔</p><p style=""text-align:justify;"">اور اس کے علاوہ جتنے بھی رشتہ ہیں وہ غیر محرم ہیں، اور ان سے نکاح کرنا جائز ہے۔</p><p style=""text-align:justify;"">البحر الرائق شرح كنز الدقائق میں ہے:</p><p class=""indent"" style=""text-align:justify;""><span class=""ar_writing"">""انتفاء محلية المرأة للنكاح شرعا بأسباب تسعة: الأول المحرمات بالنسب: وهن فروعه وأصوله وفروع أبويه وإن نزلوا وفروع أجداده وجداته إذا انفصلوا ببطن واحد. الثاني المحرمات بالمصاهرة: وهن فروع نسائه المدخول بهن وأصولهن وحلائل فروعه وحلائل أصوله، والثالث المحرمات بالرضاع وأنواعهن كالنسب، والرابع حرمة الجمع بين المحارم وحرمة الجمع بين الأجنبيات كالجمع بين الخمس، والخامس حرمة التقديم وهو تقديم الحرة على الأمة جعله في النهاية والمحيط قسما على حدة وأدخله الزيلعي في حرمة الجمع، فقال: وحرمة الجمع بين الحرة والأمة والحرة متقدمة وهو الأنسب، والسادس المحرمة لحق الغير كمنكوحة الغير ومعتدته والحامل بثابت النسب، والسابع المحرمة لعدم دين سماوي كالمجوسية والمشتركة، والثامن المحرمة للتنافي كنكاح السيدة مملوكها، والتاسع لم يذكره الزيلعي وكثير وهو المحرمة بالطلقات الثلاث ذكره في المحيط والنهاية"".</span></p><p class=""indent"" style=""text-align:left;""><span class=""ar_writing"">(کتاب النکاح، فصل في المحرمات في النكاح، ج:3، ص:98، ط:دارالکتاب الاسلامی)</span></p><p class=""indent"" style=""text-align:left;"">فقط واللہ اعلم</p></p>",144504101485,banuri,"('نکاح', 'nikah')","('محرمات و غیر محرمات', 'muharramat-o-gher-muharramat')","('نسبی محرمات', 'muharramat')"
02-11-2023,https://www.banuri.edu.pk/readquestion/mazi-ki-waja-se-ghusal-awar-is-ka-kaprho-par-lagney-ka-hukum-144504101781/02-11-2023,مذی کی وجہ سے غسل اور اس کا کپڑوں پر لگنے کا حکم,جماع سے پہلے بیوی کے ساتھ بوس و کنار(رومانس) کرنے سے مرد کے عضو خاص سے سفید پانی(مذی) نکلتا ہے ، اس پانی سے بچہ پیدا نہیں ہوتا، اب پوچھنا یہ ہے کہ   :1۔اگرمحض بوس وکنار(رومانس ) کیا اور جماع( دخول وغیرہ) نہیں کیاتوکیا اس پانی (مذی) کے نکلنے کی وجہ سے مکمل غسل کرنا پڑے گا یا صرف اس جگہ (جہاں پانی لگا ہو) کو دھونا کافی ہوگا؟2۔ اگر یہ پانی (مذی) کپڑوں پر لگ جائے تو اس کا کیا حکم ہے؟,"<p><p style=""text-align:justify;"">1۔واضح رہے کہ بیوی کے ساتھ بوس وکنار(رومانس) کرتے وقت عضو خاص سے ایک قسم کالیس دار پانی نکلتا ہے جو پانی کی طرح  ہوتاہے، جو  شہوت کے وقت نکلتا  ہے، لیکن  اس کے نکلنے  پر شہوت  ختم نہیں ہوتی، بلکہ شہوت میں  مزید اضافہ ہوجاتا ہے، اس پانی کو مذی کہتے ہیں، اس کا حکم یہ ہے کہ اگر جماع (دخول وغیرہ ) نہیں کیا ہو تو صرف اس کے  نکلنے کی صورت میں وضو ٹوٹ جاتاہے،  غسل فرض نہیں ہوتا،نماز ادا کرنے سے پہلے وضو کرنا لازم ہوگا۔</p><p style=""text-align:justify;"">2۔مذی  نجاست غلیظہ ہے،اوراس کاحکم یہ ہے کہ نجاستِ  غلیظہ اگرایک درہم (ہاتھ کی ہتھیلی کے گڑھے)کی مقداریااس سے کم مقدارمیں کپڑے پرلگی ہوتو (اگرچہ اس مقدارمیں بھی نجاست کودھولیناچاہیے تاہم ) وہ معاف ہے ،یعنی نمازکراہت کے ساتھ ہوجائے گی،  اوراگرایک درہم کی مقدارسےزائدہو تو ایسے کپڑے میں نمازنہیں ہوگی۔</p><p style=""text-align:justify;"">حاشیۃ الطحطاوی میں ہے:</p><p class=""indent"" style=""text-align:justify;""><span class=""ar_writing"">""منها مذي.... وهو ماء أبيض رقيق يخرج عند شهوة لا بشهوة ولا دفق ولا يعقبه فتور وربما لا يحس بخروجه وهو أغلب في النساء من الرجال.ويسمى في جانب النساء قذى بفتح القاف والدال المعجمة. ""و"" منها ""ودي"" بإسكان الدال المهملة وتخفيف الياء وهو ماء أبيض كدر ثخين لا رائحة له يعقب البول وقد يسبقه أجمع العلماء على أنه لايجب الغسل بخروج المذي والودي.""</span></p><p class=""indent"" style=""text-align:left;""><span class=""ar_writing"">(‌‌كتاب الطهارة، فصل: عشرة أشياء لا يغتسل منها مذي، ج:1، ص:100۔101، ط: دار الكتب العلمية)</span></p><p style=""text-align:justify;"">فتاویٰ شامی میں ہے:</p><p class=""indent"" style=""text-align:justify;""><span class=""ar_writing"">""(لا) عند (مذي أو ودي) بل ‌الوضوء ‌منه ومن البول جميعا على الظاهر....(قوله: لا عند مذي) أي لا يفرض الغسل عند خروج مذي كظبي بمعجمة ساكنة وياء مخففة على الأفصح، وفيه الكسر مع التخفيف والتشديد، وقيل هما لحن ماء رقيق أبيض يخرج عند الشهوة لا بها، وهو في النساء أغلب، قيل هو منهن يسمى القذى بمفتوحتين نهر.</span></p><p class=""indent"" style=""text-align:justify;""><span class=""ar_writing"">(قوله: أو ودي) بمهملة ساكنة وياء مخففة عند الجمهور، وحكى الجوهري كسر الدال مع تشديد الياء. قال ابن مكي: ليس بصواب. وقال أبو عبيد إنه الصواب وإعجام الدال شاذ: ماء ثخين أبيض كدر يخرج عقب البول نهر.</span></p><p class=""indent"" style=""text-align:justify;""><span class=""ar_writing"">(قوله: بل ‌الوضوء ‌منه إلخ) أي بل يجب ‌الوضوء ‌منه أي من الودي ومن البول جميعا، وهذا جواب عما يقال إن الوجوب بالبول السابق على الودي فكيف يجب به. وبيان الجواب أن وجوبه بالبول لا ينافي الوجوب بالودي بعده.""</span></p><p class=""indent"" style=""text-align:left;""><span class=""ar_writing"">(كتاب الطهارة، مطلب سنن الغسل، ج:1، ص:165، ط:سعيد)</span></p><p style=""text-align:justify;""><span class=""ar_writing"">وفيه أيضاً:</span></p><p class=""indent"" style=""text-align:justify;""><span class=""ar_writing"">""( وعفا ) الشارع ( عن قدر درهم ) وإن كره تحريماً، فيجب غسله وما دونه تنزيهاً فيسن، وفوقه مبطل ( وهو مثقال ) عشرون قيراطاً ( في ) نجس ( كثيف ) له جرم ( وعرض مقعر الكف ) وهو داخل مفاصل أصابع اليد ( في رقيق من مغلظة كعذرة ) آدمي وكذا كل ما خرج منه موجبا لوضوء أو غسل مغلظ.""</span></p><p class=""indent"" style=""text-align:left;""><span class=""ar_writing"">(‌‌كتاب الطهارة، ‌‌باب الأنجاس، ج:1، ص:316، ط:سعيد)</span></p><p class=""indent"" style=""text-align:left;""><span class=""ar_writing"">فقط والله أعلم</span></p></p>",144504101781,banuri,"('طہارت', 'taharat')","('وضو', 'wuzu')","('نواقض وضو', 'nawaaqz-e-wazu')"
01-09-2023,https://www.banuri.edu.pk/readquestion/yktarfa-sart-lagany-kahukm-144502101140/01-09-2023,جو ئے کی ایک صورت,میں ایک ایپ میں کام کرتی ہوں rrt میں،(وہ) فٹ بال میچ والو ں کی ہی ہے تو اس پہ ایپ والے ہمیں سکور بھیجتے ہیں ،ہم اس کی شرط لگاتے ہیں، جب وہ میچ جیتتے ہیں، تو وہ ہمیں منافع دیتے ہیں، اگر ہار جاتے ہیں تو نہیں دیتے ،مطلب  جتنا ہم نے انویسٹمنٹ کیا ہوتا اس کے مطابق ہمیں پر وفٹ دیتے ہیں ،ا گر ان کی ٹیم میچ ہار ے تو ہمیں کوئی نقصان نہیں ہو تا ۔,"<p><p style=""text-align:justify;"">صورت مسئولہ میں  مذکورہ ایپ میں پیسے انویسٹ کر کے   میچ کے اسکور پر شرط لگانا اور  اس سے  نفع کمانا    یہ جوا ہے، لہذا اس ایپ سے پیسے کمانا جائز نہیں ہے ۔  </p><p style=""text-align:justify;"">فتاوی شامی میں ہے : </p><p class=""indent"" style=""text-align:justify;""><span class=""ar_writing"">""(قوله: لأنه يصير قمارًا) لأن ‌القمار من القمر الذي يزداد تارة وينقص أخرى، وسمي ‌القمار قمارا لأن كل واحد من المقامرين ممن يجوز أن يذهب ماله إلى صاحبه، ويجوز أن يستفيد مال صاحبه وهو حرام بالنص، و لا كذلك إذا شرط من جانب واحد لأن الزيادة و النقصان لاتمكن فيهما بل في أحدهما تمكن الزيادة، وفي الآخر الانتقاص فقط فلاتكون مقامرة لأنها مفاعلة منه زيلعي (قوله: يتوهم أن يسبقهما) بيان لقوله كفء، لفرسيهما أي يجوز أن يسبق أو يسبق (قوله: وإلا لم يجز) أي إن كان يسبق أو يسبق لا محالة لايجوز لقوله صلى الله عليه وسلم: "" «من أدخل فرسًا بين فرسين و هو لايأمن أن يسبق فلا بأس به و من أدخل فرسًا بين فرسين و هو آمن أن يسبق فهو قمار»، رواه أحمد وأبو داود وغيرهما زيلعي (قوله: ثم إذا سبقهما إلخ) صورته أن يقال: إن سبقهما أخذ منهما ألفا إنصافا، وإن لم يسبق لم يعطهما شيئا، وإن سبق كل منهما الآخر فله مائة من مال الآخر فلايعطيهما شيئًا إن لم يسبقهما، ويأخذ منهما الجعل إن سبقهما ويجوز أن يعكس التصوير أخذا وإعطاء وفيما بينهما أيهما سبق أخذ من صاحبه ما شرط له؛ وإن سبقاه وجاءا معا فلا شيء لواحد منهما وإن سبق المحلل مع أحدهما ثم جاء الآخر فلا شيء على من مع المحلل بل له ما شرطه الآخر له كما لو سبق، ثم جاء المحلل ثم جاء الآخر ولا شيء للمحلل اهـ غرر الأفكار. قال الزيلعي: وإنما جاز هذا لأن الثالث لا يغرم على التقادير كلها قطعا ويقينا وإنما يحتمل أن يأخذ أو لا يأخذ فخرج بذلك من أن يكون قمارًا، فصار كما إذا شرط من جانب واحد، لأن ‌القمار هو الذي يستوي فيه الجانبان في احتمال الغرامة على ما بينا اهـ.""</span></p><p class=""indent"" style=""text-align:left;""><span class=""ar_writing""><span style=""font-family:Nafees,sans-serif;font-size:18px;font-weight:400;"">(کتاب الحظر والاباحۃ ، 6/ 403،سعید)</span></span></p><p style=""text-align:justify;"">تفسير حدائق الروح والريحان   میں ہے  :</p><p class=""indent"" style=""text-align:justify;""><span class=""ar_writing"">""والقمار كل لعب يشترط فيه أن يأخذ الغالب من المغلوب شيئًا سواء كان بالورق، أو بغيره كالقداح."" </span></p><p class=""indent"" style=""text-align:left;"">(8/ 55،دار طوق النجاة)</p><p style=""text-align:justify;"">الموسوعة الفقهية الكويتية  میں ہے :</p><p style=""text-align:justify;"">""التعريف:</p><p class=""indent"" style=""text-align:justify;""><span class=""ar_writing"">1 - الميسر لغة: قمار العرب بالأزلام، وقال صاحب القاموس هو اللعب بالقداح أو هو النرد، أو كل قمار. ولا يخرج المعنى الاصطلاحي عن المعنى اللغوي. وقال ابن حجر المكي: الميسر: القمار بأي نوع كان، وقال المحلي: صورة القمار المحرم التردد بين أن يغنم وأن يغرم.</span><br/><span class=""ar_writing"">وقال مالك: الميسر: ميسران، ميسر اللهو وميسر القمار فمن ميسر اللهو النرد والشطرنج والملاهي كلها، وميسر القمار ما يتخاطر الناس عليه. وبمثل ذلك قال ابن تيمية.""</span></p><p class=""indent"" style=""text-align:left;""> (میسر،39/ 404،طبع الوزارة)</p><p class=""indent"" style=""text-align:left;"">فقط واللہ اعلم </p></p>",144502101140,banuri,"('معاملات', 'muamlat')","('سود / بینکاری / انشورنس / شیئرز', 'sood-bankari-insurance-shares')","('جوئے کے احکام', 'joey-k-ahkam')"
03-09-2022,https://www.banuri.edu.pk/readquestion/bazan-naam-rakhna-144402100498/03-09-2022,باذان نام رکھنا,کیا ہم بچے کاُنام “باذان” رکھ سکتے ہیں؟ کیا یہ نام اسلامک ہے اور اس کا مطلب کیا ہے؟,"<p><p style=""text-align:justify;"">’’باز‘‘ (ز کے ساتھ)  ایک پرندے کا نام ہے، اسی سے ’’بازان‘‘ ہے، نیز بعض حضرات کے بقول یہ فارسی زبان کا لفظ ہے، بہرکیف!کسی صحابی کانام ہونا تلاش بسیار کے باوجود ہمیں نہیں مل سکا۔</p><p style=""text-align:justify;"">مغني المحتاج إلى معرفة ألفاظ المنهاج میں ہے :</p><p class=""indent"" style=""text-align:justify;""><span class=""ar_writing"">""نَحْوِ ( بَازٍ ) مِنْ أَشَدِّ الْحَيَوَانِ وَأَضْيَقِهِ خَلْقًا ، وَهُوَ مُذَكَّرٌ ، وَيُقَالُ فِي التَّثْنِيَةِ بَازَانِ ، وَفِي الْجَمْعِ بُزَاةٌ"".</span> (18/183)</p><p style=""text-align:justify;"">البتہ ’’باذان‘‘  حرف ’’ذ‘‘ کے ساتھ ، ایک تابعی کا نام ہے،  نیز سیرت کی کتب میں  ہے کہ  فارس کے بادشاہ کسریٰ کی جانب سے یمن کے  جوگورنر مقرر تھے ان کانام بھی ’’باذان‘‘  تھا،اور رسول اللہ ﷺکے خط مبارک کے ملنے پر یہ اسلام لے آئے تھے،  اور اپنے اسلام کی اطلاع بھی رسول کریم صلی اللہ علیہ وسلم کو بھجوائی تھی، لیکن  ان کارسول اللہ  صلی اللہ علیہ وسلم کی زیارت کرنا ثابت نہیں ہے،اس لیے باذان کی بجائے کسی اور اچھے معنی والے لفظ سے نام رکھا جائے۔</p><p style=""text-align:justify;"">تفسیرقرطبی میں ہے :</p><p class=""indent"" style=""text-align:justify;""><span class=""ar_writing"">""اسمه باذام، وقيل: باذان، بمعجمة بين ألفين. يروي عن علي وابن عباس ومولاته ام هاني، كما في تهذيب التهذيب.""</span></p><p class=""indent"" style=""text-align:left;"">(باب ما جاء من الوعيد في تفسير القرآن بالرأى، والجرأة على ذلك، جلد 1 ص:36، ط: دار الکتب المصریۃ)</p><p style=""text-align:justify;"">الاصابہ فی تمییزالصحابہ میں ہے :</p><p class=""indent"" style=""text-align:justify;""><span class=""ar_writing"">""بعث النبي صلى الله عليه و سلم عبد الله بن حذافة إلى كسرى بكتابه يدعوه إلى الإسلام فلما قراه شقق كتابه ثم كتب إلى عامله على اليمن باذان أن ابعث إلى هذا الرجل برجلين جلدين فليأتياني به فبعث باذان قهرمانة بأبويه وكان كاتباً حاسباً وبعث معه رجلاً من الفرس يقال له: خسرة إلى النبي صلى الله عليه و سلم يأمره أن ينصرف معهما إلى كسرى وقال لبابويه: ويلك انظر إلى الرجل ما هو وائتني بخبره فقدما الطائف ثم قدما المدينة فكلمه بأبويه إن شاهنشاه كسرى كتب إلى الملك باذان يأمره أن يبعث إليه من يأتيه بك فإن اجبت كتبت معك ما ينفعك عنده وإن أبيت فإنه مهلكك ومهلك قومك ومخرب بلادك فقال لهما ارجعا حتى تأتياني غدا فأوحي إلى النبي صلى الله عليه و سلم أن الله سلط على كسرى ولده فقتله في ساعة كذا من ليلة كذا من شهر كذا فلما اصبحا أخبرهما بذلك فقالا: نكتب بذلك عنك إلى باذان قال: نعم وقولا له: إن أسلمت أقرك على ملكك ثم أعطي خسرة منطقة فيها ذهب وفضة فرجعا إلى باذان فأخبراه الخبر فقال: ما هذا بكلام ملك ولئن كان ما قال حقاً فإنه لنبي مرسل فلم يلبث أن قدم عليه كتاب شيرويه يخبره بقتل كسرى ويامره بأخذ الطاعة ممن قبله ولايتعرض للرجل الذي كتب إليك كسرى في أمره قال: فأسلم باذان وأسلمت الأبناء من فارس ممن كان منهم باليمن وكان بأبويه قد قال لباذان ما علمت أحدا كان أهيب عندي منه.... باذان آخره نون ويقال ميم الفارسي من الأبناء الذي بعثهم كسرى إلى اليمن وكان ملك اليمن في زمانه وأسلم باذان لما هلك كسرى وبعث بإسلامه إلى النبي صلى الله عليه و سلم فاستعمله على بلاده ثم مات فاستعمل ابنه شهر بن باذان على بعض عمله ذكر ذلك بن إسحاق وابن هشام والواقدي والطبري وذكره في الصحابة الباوردي وغيره وسيأتي له ذكر في ترجمة جد جميرة في حرف الجيم واخباره مذكورة في التاريخ والسير قال الثعلبي: هو أول من أسلم من ملوك العجم وأول من أمر في الإسلام على اليمن وقال الفاكهي: حدثنا يحيى بن أبي طالب حدثنا علي بن عاصم حدثنا داود عن الشعبي قال: كتب النبي صلى الله عليه و سلم إلى كسرى فمزق كتابه وكتب إلى باذان أرسل إليه من يأمره بالرجوع إلى دين قومه فإن أبي فقاتله فذكر الحديث وفيه قال: فخرج باذان من اليمن إلى النبي صلى الله عليه و سلم فلحقه العنسي الكذاب فقتله"".</span></p><p class=""indent"" style=""text-align:left;"">(جلد1 ص:338، ط: دار الجیل)</p><p style=""text-align:justify;"">البدایہ والنھایہ میں ہے :</p><p class=""indent"" style=""text-align:justify;""><span class=""ar_writing"">""وفي بعض الروايات: أن رسول الله صلى الله عليه وسلم قال لرسول باذان: إن ربي قد قتل الليلة ربك فكان كما قال رسول الله صلى الله عليه وسلم قتل تلك الليلة بعينها، قتله بنوه لظلمه بعد عدله بعدما خلعوه وولوا ابنه شيرويه فلم يعش بعد قتله أباه إلا ستة أشهر أو دونها. وفي هذا يقول خالد بن حق الشيباني:</span></p><p class=""indent"" style=""text-align:justify;""><span class=""ar_writing"">وكسرى إذ تقسمه بنوه * بأسياف كما اقتسم اللحام تمخضت المنون له بيوم * ألا ولكل حاملة تمام</span></p><p class=""indent"" style=""text-align:justify;""><span class=""ar_writing"">قال الزهري: فلما بلغ ذلك باذان بعث بإسلامه وإسلام من معه من الفرس إلى رسول الله صلى الله عليه وسلم"".</span></p><p class=""indent"" style=""text-align:left;"">(جلد2،ص:226، ط: دار احیاء التراث العربی)</p><p class=""indent"" style=""text-align:left;"">فقط واللہ اعلم</p></p>",144402100498,banuri,"('حظر و اباحت', 'mamnooaat-mubahat')","('نام، لقب، کنیت', 'asaami')","('ناموں کے معانی اور احکام', 'namoun-ke-mani-or-ahkaam')"
