issued_at,link,title,question,answer,fatwa_number,dar_ul_ifta,kitab,bab,fasal
14-07-2023,https://www.banuri.edu.pk/readquestion/youtube-ki-kamai-ka-hukum-144412101015/14-07-2023,یوٹیوب کی کمائی کا حکم,کیا یوٹیوب کی کمائی حلال ہے یا حرام؟,"<p><p style=""text-align:justify;"">یوٹیوب سے پیسے کمانے میں شرعًا بہت سے مفاسد ہیں، اس کی تفصیل یہ ہے کہ :یوٹیوب پر چینل بناکر ویڈیو اَپ لوڈ کرنے کی صورت میں اگر اس چینل کے فالوورز زیادہ ہوں تو یوٹیوب چینل ہولڈر کی اجازت سے اس میں اپنے مختلف کسٹمر کے اشتہار چلاتا ہے، اور اس کی ایڈور ٹائزمنٹ اور مارکیٹنگ کرنے پر ویڈو اَپ لوڈ کرنے والے کو بھی پیسے دیتا ہے۔ اس کا شرعی حکم یہ ہے کہ اگر چینل پر ویڈیو اَپ لوڈ کرنے والا:</p><p style=""text-align:justify;"">1۔ جان د ار کی تصویر والی ویڈیو اپ لوڈ کرے، </p><p style=""text-align:justify;"">2۔ یا اس ویڈیو میں میوزک اور موسیقی ہو۔</p><p style=""text-align:justify;"">3۔ یا اشتہار غیر شرعی ہو ۔</p><p style=""text-align:justify;"">4۔ یا کسی بھی غیر شرعی شے کا اشتہار ہو۔</p><p style=""text-align:justify;"">5۔ یا اس کے لیے کوئی غیر شرعی معاہدہ کرنا پڑتا ہو۔</p><p dir=""rtl"" style=""text-align:justify;"">تو اس کے ذریعے پیسے کمانا جائز نہیں ہے، نیز عام طور پر اگر ویڈیو میں مذکورہ خرابیاں نہ بھی ہوں تب بھی یوٹیوب کی طرف سے لگائے جانے والے اشتہار میں یہ خرابیاں پائی جاتی ہیں، اور ہماری معلومات کے مطابق یوٹیوب کو  اگر  کمرشل بنیاد پر استعمال کیا جائے تو یوٹیوب انتظامیہ اس پر  اشتہار چلاتی ہے، اور یہ اشتہار  ملکوں کے  حساب سے مختلف ہوتے ہیں، بلکہ سرچنگ کی لوکیشن اور ڈیوائس کی سرچ بیس پر یہ مختلف ہوتے ہیں،  مثلاً اگر پاکستان میں اسی ویڈیو پر وہ کوئی اشتہار چلاتے ہیں، مغربی ممالک میں اس پر وہ کسی اور قسم کا اشتہار چلاتے ہیں، جس میں بسااوقات حرام اور ناجائز چیزوں کی تشہیر بھی کرتے ہیں، ان تمام مفاسد کے پیشِ نظر یوٹیوب پر ویڈیو اپ لوڈ کرکے پیسے کمانے کی شرعاً اجازت نہیں ہے۔لہذا صورت مسئولہ میں یوٹیوب کے ذریعہ پیسہ کمانا شرعا جائز نہیں ہے۔</p><p dir=""rtl"" style=""text-align:justify;"">مزید تفصیل کے لیے درج ذیل لنک ملاحظہ کیجیے:</p><p dir=""rtl"" style=""text-align:justify;""><a href=""?menu=darulifta&amp;page=fileprint&amp;id=78917&amp;code=&amp;action="" title=""https://panel.banuri.edu.pk/?menu=darulifta&amp;page=fileprint&amp;id=78917&amp;code=&amp;action="">یوٹیوب کے ذریعہ پیسے کمانا</a></p><p dir=""rtl"" style=""text-align:justify;"">احکام القرآن للجصاص میں ہے:</p><p class=""indent"" dir=""rtl"" style=""text-align:justify;""><span class=""ar_writing"">""وقوله تعالى وتعاونوا على البر والتقوى يقتضي ظاهره إيجاب التعاون على كل ما كان تعالى لأن البر هو طاعات الله وقوله تعالى ولا تعاونوا على الإثم والعدوان نهي عن معاونة غيرنا على معاصي الله تعالى.""</span></p><p class=""indent"" dir=""rtl"" style=""text-align:left;""><span class=""ar_writing"">(المائدۃ: 2 جلد 3 ص: 296 ط: داراحیاء التراث العربي ۔ بیروت)</span></p><p dir=""rtl""><span style=""text-align:justify;"">فتاوی عالمگیری میں ہے:</span></p><div><p class=""indent"" dir=""rtl"" style=""text-align:justify;""><span class=""ar_writing"">""ومنها أن يكون مقدور الاستيفاء - حقيقة أو شرعا فلا يجوز استئجار الآبق ولا الاستئجار على المعاصي؛ لأنه استئجار على منفعة غير مقدورة الاستيفاء شرعا.......ومنها أن تكون المنفعة مقصودة معتادا استيفاؤها بعقد الإجارة ولا يجري بها التعامل بين الناس فلا يجوز استئجار الأشجار لتجفيف الثياب عليها.""</span></p><p class=""indent"" dir=""rtl"" style=""text-align:left;""><span class=""ar_writing"">(كتاب الإجارة ، الباب الأول في تفسير الإجارة و ركنها و ألفاظها و شرائطها جلد 4 ص: 411 ط: دارالفكر)</span></p><p dir=""rtl"" style=""text-align:justify;"">در المختار میں ہے:</p><p class=""indent"" dir=""rtl"" style=""text-align:justify;""><span class=""ar_writing"">""قال ابن مسعود صوت اللهو والغناء ينبت النفاق في القلب كما ينبت الماء النبات. قلت: وفي البزازية استماع صوت الملاهي كضرب قصب ونحوه حرام لقوله عليه الصلاة والسلام«استماع الملاهي معصية والجلوس عليها فسق والتلذذ بها كفر» أي بالنعمة.""</span></p><p class=""indent"" dir=""rtl"" style=""text-align:left;""><span class=""ar_writing"">(کتاب الحظر و الإباحة جلد 6 ص: 348 ، 349 ط: دارالفکر)</span></p><p class=""indent"" dir=""rtl"" style=""text-align:left;"">فقط و اللہ اعلم</p></div></p>",144412101015,banuri,"('معاملات', 'muamlat')","('بیع / تجارت', 'bay-tijarat')","('اجارہ اور کرایہ کے احکام', 'ijara-or-kiraya-k-ahkam')"
06-08-2023,https://www.banuri.edu.pk/readquestion/kisi-waaris-ka-taraka-ke-bajai-raqam-maangne-ka-hukm-144501101674/06-08-2023,کسی وارث کا ترکہ کے بجائے رقم مانگنے کا حکم,سوال یہ ہے کہ کوئی وارث ترکہ میں  حصہ کے طور پر رقم مانگ رہا ہو تو اسے اپنے پاس سے رقم دے سکتے ہیں ؟ یا پھر ترکہ میں سے ہی ادا کرنا ضروری ہے ؟,"<p><p style=""text-align:justify;"">واضح رہے کہ میت کے متروکہ مال وجائیداد میں ورثاء اپنے اپنے شرعی حصص کے بقدر مستحق ہوتے ہیں،اگر کوئی وارث ترکہ سے اپنا حصہ لینے کے بجائے حصے کی قیمت/رقم لینا چاہتا ہو، تو اس کی ادائیگی کی دو صورتیں ہیں، یا تو تمام ورثاء اس کے حصے کی مالیت لگاکر اس کی قیمت دے کر وہ حصے اپنی طرف کرلیں، یا کوئی ایک وارث اس کا حصہ خرید کر اپنی طرف سے رقم ادا کردے، دونو ں صورتیں شرعا جائز ہیں۔ نیز اگر یہ صورت اختیار کی جائے کہ مرحوم کے ترکے کی رقم یا ترکے کی کوئی چیز دے کربقیہ ترکہ سے دستبرداری کا معاہدہ کرلیں جس کو شریعت کی اصطلاح میں تخارج کہا جاتا ہے، تو اس کی بھی شرعا گنجائش ہے۔ </p><p dir=""rtl"">فتاوی عالمگیری میں ہے:</p><p class=""indent"" style=""text-align:justify;""><span class=""ar_writing"">""إذا كانت التركة بين ورثة فأخرجوا أحدهما منها بمال أعطوه إياه والتركة عقار أو عروض صح قليلا كان ما أعطوه أو كثيرا"".</span></p><p class=""indent"" style=""text-align:left;""><span class=""ar_writing""> (كتاب الفرائض، الباب الخامس، 4/ 268، ط: دار الفكر بيروت)</span></p><p style=""text-align:justify;"">البحر الرائق میں ہے:</p><p class=""indent"" style=""text-align:justify;""><span class=""ar_writing"">""قال - رحمه الله - (يبدأ من تركة الميت بتجهيزه) المراد من التركة ‌ما ‌تركه ‌الميت خاليا عن تعلق حق الغير بعينه"".</span></p><p class=""indent"" style=""text-align:left;""><span class=""ar_writing"">(کتاب الفرائض، 8/ 557، ط: دار الكتاب الإسلامي)</span></p><p style=""text-align:justify;"">تبیین الحقائق میں ہے:</p><p class=""indent"" style=""text-align:justify;""><span class=""ar_writing"">""قال - رحمه الله - (فإن وقع عن مال بمال بإقرار اعتبر بيعا)؛ لأن معنى البيع ‌قد ‌وجد فيه، وهو مبادلة المال بالمال عن تراض فتجري فيه أحكام البيوع، وهذا؛ لأن الأصل في الصلح أن يحمل على أشبه العقود له فتجري عليه أحكامه"".</span></p><p class=""indent"" style=""text-align:left;""><span class=""ar_writing"">(كتاب الصلح، 5/ 31، ط: دار الكتاب الإسلامي)</span></p><p class=""indent"" style=""text-align:left;""><span class=""ar_writing"">فقط والله اعلم</span></p></p>",144501101674,banuri,"('فرائض', 'faraez')","('ترکہ اور اس کا استحقاق', 'tarka-or-is-ka-istehaqaaq')","('مختلف فنڈز میں میراث کا اجراء', 'mukhtalif-funds-men-meeraas-ka-ijraa')"
05-08-2023,https://www.banuri.edu.pk/readquestion/gher-u-llah-ki-qasam-khaney-ka-hukum-144501101583/05-08-2023,اللہ کے علاوہ کی قسم کھانے کا حکم,کیا اللہ کے علاوہ کسی اپنی محبوب چیز کی قسم کھائی جا سکتی ہے ؟ اگر کھائی جا سکتی ہےتو کس حدیث سے ثابت ہے ؟,"<p><p style=""text-align:justify;"">واضح رہے کہ بلاضرورت قسم کھانا پسندیدہ عمل نہیں ہے، اگر کوئی ضرورت یا مجبوری ہو، تو صرف اللہ تبارک وتعالیٰ کے نام کی ہی قسم اٹھانا جائز ہے، اللہ تعالیٰ کے علاوہ کسی بھی چیز  کی قسم کھانا جائز  نہیں ہے، اگرچہ وہ کتنی ہی محبوب چیز ہی کیوں نہ ہو،   احادیثِ مبارکہ میں اللہ تعالیٰ کے علاوہ کسی کی قسم اٹھانے سے منع کیا گیا ہے، اگر کوئی شخص  اللہ تعالیٰ کے علاوہ کسی  کی قسم اٹھا لے تو وہ قسم درست ہی نہیں ہوتی اور  ایسی قسم توڑنے کی صورت میں کوئی کفارہ بھی لازم نہیں ہوتا، تاہم  اللہ تعالیٰ کے علاوہ  کسی چیز کی قسم کھانے پر توبہ و استغفار کرنا چاہیے۔</p><p style=""text-align:justify;"">فتاوی شامی میں ہے :</p><p class=""indent"" style=""text-align:justify;""><span class=""ar_writing"">""(لا) يقسم (بغير الله تعالى كالنبي والقرآن والكعبة) قال الكمال: ولايخفى أن الحلف بالقرآن الآن متعارف فيكون يمينًا.</span></p><p class=""indent"" style=""text-align:justify;""><span class=""ar_writing"">و في الرد : (قوله: لايقسم بغير الله تعالى) عطف على قوله والقسم بالله تعالى: أي لاينعقد القسم بغيره تعالى أي غير أسمائه وصفاته ولو بطريق الكناية كما مر، بل يحرم كما في القهستاني، بل يخاف منه الكفر في نحو وحياتي وحياتك كما يأتي.</span><br/><span class=""ar_writing"">مطلب في القرآن:</span><br/><span class=""ar_writing"">(قوله: قال الكمال إلخ) مبني على أن القرآن بمعنى كلام الله، فيكون من صفاته تعالى كما يفيده كلام الهداية حيث قال: ومن حلف بغير الله تعالى لم يكن حالفا كالنبي والكعبة، لقوله عليه الصلاة والسلام: ""من كان منكم حالفًا فليحلف بالله أو ليذر""، وكذا إذا حلف بالقرآن؛ لأنه غير متعارف اهـ. فقوله: ""وكذا"" يفيد أنه ليس من قسم الحلف بغير الله تعالى، بل هو من قسم الصفات، و لذا علله بأنه غير متعارف، ولو كان من القسم الأول كما هو المتبادر من كلام المصنف والقدوري لكانت العلة فيه النهي المذكور أو غيره؛ لأن التعارف إنما يعتبر في الصفات المشتركة لا في غيرها. وقال في الفتح: وتعليل عدم كونه يمينًا بأنه غيره تعالى؛ لأنه مخلوق؛ لأنه حروف وغير المخلوق هو الكلام النفسي منع بأن القرآن كلام الله منزل غير مخلوق. ولايخفى أن المنزل في الحقيقة ليس إلا الحروف المنقضية المنعدمة، وما ثبت قدمه استحال عدمه، غير أنهم أوجبوا ذلك؛ لأن العوام إذا قيل لهم: إن القرآن مخلوق تعدوا إلى الكلام مطلقًا. اهـ. وقوله: ولايخفى إلخ رد للمنع.</span><br/><span class=""ar_writing"">وحاصله: أن غير المخلوق هو القرآن بمعنى كلام الله الصفة النفسية القائمة به تعالى لا بمعنى الحروف المنزلة غير أنه لايقال: القرآن مخلوق لئلايتوهم إرادة المعنى الأول. قلت: فحيث لم يجز أن يطلق عليه أنه مخلوق ينبغي أن لايجوز أن يطلق عليه أنه غيره تعالى بمعنى أنه ليس صفة له؛ لأن الصفات ليست عينًا ولا غيرًا كما قرر في محله، ولذا قالوا: من قال بخلق القرآن فهو كافر. ونقل في الهندية عن المضمرات: وقد قيل هذا في زمانهم، أما في زماننا فيمين وبه نأخذ ونأمر ونعتقد. وقال محمد بن مقاتل الرازي: إنه يمين، وبه أخذ جمهور مشايخنا اهـ فهذا مؤيد لكونه صفة تعورف الحلف بها كعزة الله وجلال"".</span></p><p class=""indent"" style=""text-align:left;""><span class=""ar_writing"">(کتاب الأیمان،ج:3،ص:712، ط:سعید)</span></p><p class=""indent"" style=""text-align:left;""><span class=""ar_writing"">فقط واللہ اَعلم</span></p></p>",144501101583,banuri,"('حظر و اباحت', 'mamnooaat-mubahat')","('قسم / منت', 'qasam-mannat')","('قسم و کفارات', 'qasam-o-kaffarat')"
22-07-2023,https://www.banuri.edu.pk/readquestion/bety-ki-sas-bap-ki-rabibah-sy-nikah-ka-hukum-144501100256/22-07-2023,بیٹے کی ساس/باپ کی ربیبہ سے نکاح کا حکم,ایک آدمی نے اپنے بیٹے کا نکاح اس کی خالہ کی بیٹی سے کرنا طے کیا تھا، بیٹے کے نکاح سے پہلے اس آدمی کی بیوی کا انتقال ہو گیا، اب یہ اپنا نکاح اپنے بیٹے کی اسی خالہ سے کرنا چاہ رہا ہے اور اسی کی بیٹی سے اپنے بیٹے کا نکاح کرنا چاہ رہا ہے، کیا ایسا کرنا درست ہے؟,"<p><p style=""text-align:justify;"">صورتِ مسئولہ میں باپ کا اپنے بیٹے کی خالہ یعنی اپنی سالی سے نکاح کرنا جائز ہے، اسی طرح بیٹے کا نکاح اس کی خالہ زاد کے ساتھ جائز ہے۔</p><p style=""text-align:justify;"">فتاویٰ شامی میں ہے:</p><p class=""indent"" style=""text-align:justify;""><span class=""ar_writing"">""قال الخير الرملي: ولا تحرم بنت زوج الأم ولا أمه ولا أم زوجة الأب <span style=""text-decoration:underline;"">ولا بنتها ولا ‌أم ‌زوجة ‌الابن</span> ولا بنتها ولا زوجة الربيب ولا زوجة الراب.""</span></p><p class=""indent"" style=""text-align:left;""><span class=""ar_writing"">(كتاب النكاح، فصل في المحرمات، ج:3، ص:31، ط: سعيد)</span></p><p style=""text-align:justify;"">فتاویٰ ہندیہ میں ہے:</p><p class=""indent"" style=""text-align:justify;""><span class=""ar_writing"">""وهن الأمهات والبنات والأخوات والعمات والخالات وبنات الأخ وبنات الأخت فهن محرمات نكاحا ووطئا ودواعيه على التأبيد.""</span></p><p class=""indent"" style=""text-align:left;""><span class=""ar_writing"">(كتاب النكاح، الباب الثالث في بيان المحرمات، القسم الأول المحرمات بالنسب، ج:1، ص:273، ط: رشيدية)</span></p><p class=""indent"" style=""text-align:left;""><span class=""ar_writing"">فقط والله أعلم</span></p></p>",144501100256,banuri,"('نکاح', 'nikah')","('محرمات و غیر محرمات', 'muharramat-o-gher-muharramat')","('غیر محرمات', 'gher-muharramat')"
01-08-2023,https://www.banuri.edu.pk/readquestion/aqeqa-key-leye-janwar-ka-do-dant-hona-zarori-hey-144501101261/01-08-2023,عقیقہ کے لیے جانور کا دو دانت ہونا ضروری ہے؟,عقیقہ کے لیے گاۓ  یابیل کا دو دانت ہونا ضروری ہے؟,"<p><p style=""text-align:justify;"">واضح رہے کہ عقیقہ کےجانور کی بھی وہی شرائط ہیں جو قربانی کے جانور کی ہیں، لہذا صورت مسئولہ  گاۓ یا بیل کا دوسال کا ہونا ضروری ہے، چاہے دو دانت ہوں یا نہ ہوں ،چناں چہ اگر عقیقہ میں   گاۓ یا بیل کوذبح کیا جاۓ اور اس کی عمر دو سال یا دو سال سے زائد ہو  چاہے گاۓ یا بیل   کےدو دانت ہوں یا نہ ہوں بہر حال عقیقہ صحیح ہوجاۓ گا۔</p><p style=""text-align:justify;"">اعلاء السنن میں ہے:</p><p class=""indent"" style=""text-align:justify;""><span class=""ar_writing"">""من ولد له غلام ""فليعق عنه من الإبل أو البقر أو الغنم"" دليل على جواز العقيقة ببقرة كاملة أو ببدنة كاملة كذالك.""</span></p><p class=""indent"" style=""text-align:left;""><span class=""ar_writing"">(كتاب الذبائح، باب افضلية ذبح الشاة في العقيقة، 117/17، ط: ادارة القرآن)</span></p><p style=""text-align:justify;"">الفقہ الاسلامی وادلتہ میں ہے:</p><p class=""indent"" style=""text-align:justify;""><span class=""ar_writing"">""حكم اللحم كالضحايا، يؤكل من لحمها، ويتصدق منه، ولا يباع شيء منها. ويسن طبخها، ويأكل منها أهل البيت وغيرهم في بيوتهم.""</span></p><p class=""indent"" style=""text-align:left;""><span class=""ar_writing"">(‌‌‌‌الباب الثامن: الأضحية والعقيقة،‌‌‌‌الفصل الثاني:‌‌ العقيقة وأحكام المولود،‌‌المبحث الأول ـ العقيقة،2749/4، ط:دار الفكر)</span></p><p style=""text-align:justify;"">فتاوی ہندیہ میں ہے:</p><p class=""indent"" style=""text-align:justify;""><span class=""ar_writing"">""(وأما سنه) فلا يجوز شيء مما ذكرنا من الإبل والبقر والغنم عن الأضحية إلا الثني من كل جنس.""</span></p><p class=""indent"" style=""text-align:left;""><span class=""ar_writing"">(كتاب الأضحية،الباب الخامس في بيان محل إقامة الواجب،297/5، ط: رشیدیة)</span></p><p class=""indent"" style=""text-align:left;""><span class=""ar_writing"">فقط والله اعلم</span></p></p>",144501101261,banuri,"('عبادات', 'ebadat')","('ذبیحہ / قربانی', 'zabiha-qurbani')","('عقیقہ اور اس کے احکام', 'aqiqa-or-us-k-ahkam')"
