issued_at,link,title,question,answer,fatwa_number,dar_ul_ifta,kitab,bab,fasal
03-08-2024,https://www.banuri.edu.pk/readquestion/qarz-ke-badle-leptop-bech-kar-dubara-kharedna-144601102329/03-08-2024,قرض کے بدلے لیپ ٹاپ بیچ کر دو ماہ بعد دوبارہ خریدنا/ بیع وفا,ایک بندے نے میرا 5000 روپیہ قرض دینا تھا مگر وہ دو ماہ سے مجھے ٹال رہا تھا تیسری دفعہ جب میں نے زور دیا کہ پیسے دو تو اس نے اپنا لیپ ٹاپ بغیر کسی شرط کے مجھے 5000 روپے میں بیچ دیا پھر دو ماہ بعد اسے لیپ ٹاپ کی ضرورت ہوئی تو اس نے مجھ سے مانگا تو میں نے 15000 قیمت بتائی اور وہ راضی ہو گیا لیکن اسی وقت اس نے پیسے نہیں دیے بلکہ دو ماہ کا ٹائم لے لیا۔ میں نے لیپ ٹاپ اسے دے دیا اور دو ماہ بعد اس سے 15000 لے لیے ؟ کیا یہ حلال ہونگے؟,"<p><p style=""text-align:justify;"">صورتِ مسئولہ میں اگر آپ نے اپنے مقروض کے ساتھ صراحۃً یا اشارۃً لیپ ٹاپ واپس خریدنے کی شرط لگائی تھی تو مذکورہ معاملہ فاسد شرط لگانے کی وجہ سے شرعاً ناجائز تھا، البتہ اگر واقعۃً کسی شرط کے بغیر مذکورہ شخص نے آپ کو اپنا لیپ ٹاپ فروخت کر دیا پھر دو ماہ بعد اس کی ضرورت پر آپ نے وہ لیپ ٹاپ اسے زیادہ قیمت پر فروخت کر دیا تو یہ معاملہ شرعا جائز ہے۔</p><p style=""text-align:justify;"">فتاویٰ شامی میں ہے:</p><p class=""indent"" style=""text-align:justify;""><span class=""ar_writing"">""هذا وفي الخيرية فيما لو أطلق البيع ولم يذكر الوفاء إلا أنه عهد إلى البائع أنه إن أوفى مثل الثمن يفسخ البيع معه أجاب: هذه المسألة اختلف فيها مشايخنا على أقوال. ونص في الحاوي الزاهدي أن الفتوى في ذلك أن البيع إذا أطلق ولم يذكر فيه الوفاء إلا أن المشتري عهد إلى البائع أنه إن أوفى مثل ثمنه فإنه يفسخ معه البيع يكون باتا حيث كان الثمن ثمن المثل أو بغبن يسير اهـ وبه أفتى في الحامدية أيضا، فلو كان بغبن فاحش مع علم البائع به فهو رهن، وكذا لو وضع المشتري على أصل المال ربحا، أما لو كان بمثل الثمن أو بغبن يسير بلا وضع ربح فبات؛ لأنا إنما نجعله رهنا بظاهر حاله أنه لا يقصد البات عالما بالغبن أو مع وضع الربح أفاده في البزازية"".</span></p><p class=""indent"" style=""text-align:left;""><span class=""ar_writing"">(كتاب البيوع، تذنيب في بيع العينة، مطلب في بيع الوفاء قبيل كتاب الكفالة، 5/ 277، ط:سعيد)</span></p><p style=""text-align:justify;"">البنایہ شرح الہدایہ میں ہے:</p><p class=""indent"" style=""text-align:justify;""><span class=""ar_writing"">""لأن القياس أن لا يصح هذا البيع أصلا كما قال زفر: لأنه بيع شرط فيه إقالة فاسدة، وهي إقالة معلقة بالشرط، والبيع ‌بشرط ‌الإقالة الصحيحة باطل فبشرط الإقالة الفاسدة أولى"".</span></p><p class=""indent"" style=""text-align:left;""><span class=""ar_writing"">(‌‌كتاب البيوع، باب خيار الشرط، 8/ 54، ط: دار الكتب العلمية)</span></p><p style=""text-align:justify;"">فتاویٰ ہندیہ میں ہے:</p><p class=""indent"" style=""text-align:justify;""><span class=""ar_writing"">""وإن كان الشرط شرطا لم يعرف ورود الشرع بجوازه في صورته وهو ليس بمتعارف إن كان لأحد المتعاقدين فيه منفعة أو كان للمعقود عليه منفعة والمعقود عليه من أهل أن يستحق حقا على الغير فالعقد فاسد كذا في الذخيرة"".</span></p><p class=""indent"" style=""text-align:left;""><span class=""ar_writing"">(كتاب البيوع، الباب العاشر في الشروط التي تفسد البيع والتي لا تفسده، 3/ 134، ط: رشيدية)</span></p><p class=""indent"" style=""text-align:left;"">فقط واللہ اعلم</p></p>",144601102329,banuri,"('بیوع', 'buyoo')","('بیع فاسد و باطل', 'bayee-faased-o-baatil')","('شرط فاسد کی وجہ سے بیع کا فساد', 'shart-e-faased-ki-waja-bayee-ka-fasaad')"
03-08-2024,https://www.banuri.edu.pk/readquestion/maa-ka-no-molood-bache-ko-tahneek-karana-144601102328/03-08-2024,ماں کا نومولد بچے کو گھٹی دینا,جب بچے کی پیدائش ہوتی ہے؟ کیا نومولود کو گھٹی اس کی ماں دے سکتی ہے؟,"<p><p style=""text-align:justify;"">کسی میٹھی چیز کو چپا کر نومولود بچے کے تالو سے لگانا سنت عمل ہے ، اس کو تحنیک کرانا اور گھٹی دینا کہا جاتا ہے۔صورتِ مسئولہ میں مستحب یہ ہے کہ بچے کی تحنیک کسی نیک صالح متبع سنت بزرگ سے کروائی جائے تاہم اگر بچہ کی والدہ  بچے کی تحنیک کر دے تب بھی سنت ادا ہو جائے گی۔</p><p style=""text-align:justify;"">صحیح مسلم میں ہے:</p><p class=""indent"" style=""text-align:justify;""><span class=""ar_writing"">"" (2147) حدثنا ‌أبو بكر بن أبي شيبة ، حدثنا ‌عبد الله بن نمير ، حدثنا ‌هشام، (يعني ابن عروة )، عن ‌أبيه ، عن ‌عائشة : أن رسول الله صلى الله عليه وسلم « كان يؤتى بالصبيان فيبرك عليهم ‌ويحنكهم "".</span></p><p class=""indent"" style=""text-align:left;""><span class=""ar_writing"">(‌‌‌‌كتاب الآداب، باب استحباب تحنيك المولود عند ولادته، 6/ 176 ط : دار الطباعة العامرة)</span></p><p style=""text-align:justify;"">ابن القیم رحمہ اللہ کی کتاب تحفۃ المودود باحکام المولود میں ہے:</p><p class=""indent"" style=""text-align:justify;""><span class=""ar_writing"">""وقال الخلال: أخبرني محمد بن علي، قال سمعت أم ولد أحمد ابن حنبل تقول: لما أخذني الطلق وكان مولاي نائما، فقلت له: يا مولاي! هو ذا أموت! فقال: يفرج الله، فما هو إلا أن قال: يفرج الله، حتى ولدت سعيدا، فلما ولدته قال: هاتوا ذلك التمر ـ لتمر كان عندنا من تمر مكة ـ فقلت لأم علي: امضغي هذا التمر وحنكيه، ففعلت"".</span></p><p class=""indent"" style=""text-align:left;""><span class=""ar_writing"">(‌‌الباب الخامس: في استحباب تحنيكه، ص40 ، ط : دار ابن حزم)</span></p><p class=""indent"" style=""text-align:left;"">فقط واللہ اعلم</p></p>",144601102328,banuri,"('حقوق و آدابِ معاشرت', 'huqooq-muashret')","('حقوق', 'bahmi-huqooq')","('اولاد کے حقوق', 'olad-ky-hoqoq')"
27-07-2024,https://www.banuri.edu.pk/readquestion/kisi-kay-kahnay-par-usay-gana-bhaijnay-ya-us-kay-liay-gana-down-load-karnay-ka-hukum-144601101644/27-07-2024,کسی کے کہنے پر اسے گانا بھیجنے یا اسے ڈاؤن لوڈ کر کے دینے کا حکم,اگر کوئی ہم سے یہ کہے کہ فلاں گانا میرے لیے ڈاؤن لوڈ کردو یا مجھے بھیج دو تو اگر اس کے کہنے پر ہم اسے وہ گانا ڈاؤن لوڈ کر کے دے دیں یا اسے بھیج دیں تو کیا جب بھی وہ شخص اس گانے کو سنے گا تو ہمیں بھی گناہ ملے گا؟,"<p><p style=""text-align:justify;"">واضح رہے کہ موسیقی، گانا بجانا اور سننا کسی بھی آلہ کے ذریعہ سے ہو  شریعت میں  حرام ہے۔لہٰذا کسی کے کہنے پر اسے گانا وغیرہ کوئی بھی ناجائز چیز ڈاؤن لوڈ کر کے دینا یا اسے بھیجنا جائز نہیں ہے، اللہ تعالیٰ نے قرآنِ پاک میں ہمیں گناہ کے کاموں میں ایک دوسرے کی مدد کرنے سے منع فرمایا ہے، اگر کوئی کسی کو گانا وغیرہ کوئی ناجائز چیز ڈاؤن لوڈ کر کے دے گا یا اسے بھیجے گا تو یہ اس کے لیے گناہِ جاریہ کا باعث ہوگا یعنی جب بھی لوگ اس گانے کو سنیں گے تو ان کے ساتھ ساتھ آپ کو بھی اس کا گناہ ملتا رہے گا؛ کیوں کہ آپ ان کے اس گناہ کا ذریعہ بنیں گے، اور حدیثِ شریف کی رُو سے کسی بھی برائی ،گناہ وغیرہ کا ذریعہ بننے والا بھی گناہ کرنے والے کے ساتھ گناہ میں شریک ہوتا ہے۔</p><p style=""text-align:justify;"">اللہ تعالی کا ارشادپاک ہے:</p><p class=""indent"" style=""text-align:justify;""><span class=""qr_writing"">""﴿ وَمِنَ النَّاسِ مَنْ يَّشْتَرِي لَهْوَ الْحَدِيثِ لِيُضِلَّ عَنْ سَبِيلِ اللهِ بِغَيْرِ عِلْمٍ وَيَتَّخِذَهَا هُزُوًا أُولَئِكَ لَهُمْ عَذَابٌ مُهِينٌ ﴾.""</span> <span class=""ar_writing"">[ لقمان : 6 ]</span></p><p class=""indent"" style=""text-align:justify;"">ترجمہ:"" اور بعض لوگ ایسے  بھی ہیں جو ان باتوں کے خریدار بنتے ہیں جو اللہ سے غافل کرنے والی ہیں، تاکہ اللہ کی یاد سے بے سمجھے گم راہ کرے اور اس کی ہنسی اڑائے ، ایسے لوگوں کے لیے ذلت کا عذاب ہے۔""</p><p style=""text-align:justify;""><span class=""ar_writing"">المصنف - ابن أبي شيبة""</span>میں ہے:</p><p class=""indent"" style=""text-align:justify;""><span class=""ar_writing"">""قال: وقال مجاهد: {ومن الناس من يشتري ‌لهو ‌الحديث} [لقمان: 6]: (هو) الغناء.""</span></p><p class=""indent"" style=""text-align:left;""><span class=""ar_writing"">(في هذه الآية: {ومن الناس من يشتري لهو الحديث}،535/11، ط: دار كنوز)</span></p><p style=""text-align:justify;"">الأدب المفرد للإمام البخاري میں ہے:</p><p class=""indent"" style=""text-align:justify;""><span class=""ar_writing"">"" حدثنا حفص بن عمر قال: أخبرنا خالد بن عبد الله قال: أخبرنا عطاء بن السائب، عن سعيد بن جبير، عن ابن عباس: {ومن الناس من يشتري ‌لهو ‌الحديث} [لقمان: 6] ، قال: الغناء وأشباهه.""</span></p><p class=""indent"" style=""text-align:left;""><span class=""ar_writing"">(‌‌باب الغناء واللهو،ص: 274، ط: المطبعة السلفية)</span></p><p style=""text-align:justify;""><span class=""ar_writing"">عمدة القاري شرح صحيح البخاري""</span> میں ہے: </p><p class=""indent"" style=""text-align:justify;""><span class=""ar_writing"">""{ومن الناس من يشتري ‌لهو ‌الحديث} جاء في التفسير أن المراد به الغناء وفي فردوس الأخبار "" عن جابر رضي الله تعالى عنه أنه قال إحذروا الغناء فإنه من قبل إبليس وهو شرك عند الله ولا يغني إلا الشيطان "" ولا يلزم من إباحة الضرب بالدف في العرس ونحوه إباحة غيره من الآلات كالعود ونحوه وسئل أبو يوسف عن الدف أتكرهه في غير العرس مثل المرأة في منزلها والصبي قال فلا كراهة وأما الذي يجيء منه اللعب الفاحش والغناء فإني أكرهه.""</span></p><p class=""indent"" style=""text-align:left;""><span class=""ar_writing"">(باب الحراب والدرق يوم العيد،271/6، ط: دار إحياء التراث العربي)</span></p><p style=""text-align:justify;""> ارشاد باری تعالی ہے:</p><p class=""indent"" style=""text-align:justify;""><span class=""qr_writing"">""{وَتَعَاوَنُوا عَلَى الْبِرِّ وَالتَّقْوَىٰ ۖ وَلَا تَعَاوَنُوا عَلَى الْإِثْمِ وَالْعُدْوَانِ ۚ وَاتَّقُوا اللَّهَ ۖ إِنَّ اللَّهَ شَدِيدُ الْعِقَابِ}</span> .""<span class=""ar_writing"">[ المائدة:2]</span></p><p style=""text-align:justify;"">احکام القرآن للجصاص میں ہے:</p><p class=""indent"" style=""text-align:justify;""><span class=""ar_writing"">""وقَوْله تَعَالَى:</span><span class=""qr_writing"">{وَتَعاوَنُوا عَلَى الْبِرِّ وَالتَّقْوى}</span><span class=""ar_writing"">يَقْتَضِي ظَاهِرُهُ إيجَابَ التَّعَاوُنِ عَلَى كُلِّ مَا كان تَعَالَى؛ لِأَنَّ الْبِرَّ هُوَ طَاعَاتُ اللَّهِ وقَوْله تعالى:</span><span class=""qr_writing"">{وَلاتَعاوَنُوا عَلَى الْإِثْمِ وَالْعُدْوانِ}</span><span class=""ar_writing"">نَهْيٌ عَنْ مُعَاوَنَةِ غَيْرِنَا عَلَى مَعَاصِي اللَّهِ تَعَالَى.""</span></p><p class=""indent"" style=""text-align:left;""><span class=""ar_writing"">(المائدة: آية: 2، ج:3 / 296، ط: دار إحياء التراث العربي)</span></p><p style=""text-align:justify;"">تفسیر ابن کثیر میں ہے:</p><p class=""indent"" style=""text-align:justify;""><span class=""ar_writing"">""وقوله :</span><span class=""qr_writing"">{وتعاونوا على البر والتقوى ولاتعاونوا على الإثم والعدوان}</span><span class=""ar_writing"">يأمر تعالى عباده المؤمنين بالمعاونة على فعل الخيرات، وهو البر، وترك المنكرات وهو التقوى، وينهاهم عن التناصر على الباطل، والتعاون على المآثم والمحارم."" [المائدة، رقم الأية: ٢]</span></p><p style=""text-align:justify;"">سنن ابن ماجہ  میں ہے:</p><p class=""indent"" style=""text-align:justify;""><span class=""ar_writing"">""205 - حدثنا عيسى بن حماد المصري قال: أنبأنا الليث بن سعد، عن يزيد بن أبي حبيب، عن سعد بن سنان، عن أنس بن مالك، عن رسول الله صلى الله عليه وسلم: أنه قال: «أيما داع دعا إلى ضلالة فاتبع، فإن له مثل أوزار من اتبعه، ولا ينقص من أوزارهم شيئا، وأيما داع دعا إلى هدى فاتبع، فإن له مثل أجور من اتبعه، ولا ينقص من أجورهم شيئا».""</span></p><p class=""indent"" style=""text-align:left;""><span class=""ar_writing"">(باب من سن سنة حسنة أو سيئة،1/ 75، ط: دار احياء الكتب العربية )</span></p><p style=""text-align:justify;"">مستخرج ابی عوانہ میں ہے:</p><p class=""indent"" style=""text-align:justify;""><span class=""ar_writing"">""5823 - حدثنا محمد بن يحيى، قثنا ابن أبي مريم، قثنا محمد بن جعفر، ح وثنا محمد بن يحيى، أيضا قثنا الحميدي، قال: أنبا عبد العزيز بن أبي حازم، قال: حدثني العلاء، وقال محمد بن جعفر: أخبرني العلاء، عن أبيه، عن أبي هريرة، أن رسول الله صلى الله عليه وسلم قال: «من دعا إلى هدى كان له من الأجر مثل أجور من اتبعه لا ينقص ذلك من أجورهم شيئا، ومن دعا إلى ضلالة كان عليه من الإثم مثل آثام من اتبعه لا ينقص ذلك من آثامهم شيئا» وفي حديث عبد العزيز «ومن دعا إلى ضلالة، فعليه من الإثم» بمثله.""</span></p><p class=""indent"" style=""text-align:left;""><span class=""ar_writing"">(كتاب الوصايا، ‌‌بيان انقطاع العمل عن الميت، إلا من ثلاثة من صدقة حبيسة جارية، ومن علم ينتفع به ومن ولد صالح يدعو له،3/ 494، ط: دار المعرفة)</span></p><p style=""text-align:justify;""><span class=""ar_writing"">حجة الله البالغة""</span>میں ہے:</p><p class=""indent"" style=""text-align:justify;""><span class=""ar_writing"">""الإعانة في المعصية وترويجها وتقريب الناس إليها معصية وفساد في الأرض.""</span></p><p class=""indent"" style=""text-align:left;""><span class=""ar_writing"">(مبحث في البيوع المنهي عنها: 2/ 109، ط: میر محمد)</span></p><p class=""indent"" style=""text-align:left;""><span class=""ar_writing"">فقط واللہ اعلم</span></p></p>",144601101644,banuri,"('حظر و اباحت', 'mamnooaat-mubahat')","('معصیت اور توبہ', 'maasiyat-o-tooba')","('گناہوں کی حدود، صورتیں اور اقسام', 'gunahoon-ki-hudood-soorten')"
16-03-2024,https://www.banuri.edu.pk/readquestion/rozy-ki-halat-men-heez-any-ka-hukam-144509100546/16-03-2024,روزے کی حالت میں حیض آنے کا حکم,مجھے حالتِ روزہ میں بعد از ظہر حیض آ گیا تھا تو میرے روزے کا کیا حکم ہے؟اور سنا ہے کہ مغرب تک پھر بھی کھانا پینا درست نہیں ہوتا؟,"<p><p style=""text-align:justify;"">روزہ  کی  حالت  میں حیض آنے  سے روزہ  فاسد ہو جاتا ہے اور  حائضہ کو اس کے بعد باقی دن میں کھانے پینے کی اجازت ہوتی ہے، اور   پاکی کے بعد حیض کے بقیہ ایام کے فوت شدہ روزوں کے ساتھ اس دن کے روزے کی بھی قضا رکھنا لازم ہوتی ہے۔</p><p style=""text-align:justify;""><span class=""ar_writing"">بدائع الصنائع في ترتيب الشرائع (ج:2، ص:94، ط:دار الكتب العلمية):</span></p><p class=""indent"" style=""text-align:justify;""><span class=""ar_writing"">""ولو حاضت المرأة ونفست بعد طلوع الفجر فسد صومها؛ لأن الحيض والنفاس منافيان للصوم لمنافاتهما أهلية الصوم شرعًا بخلاف القياس بإجماع الصحابة -رضي الله عنهم- على ما بينا فيما تقدم بخلاف ما إذا جن إنسان بعد طلوع الفجر، أو أغمي عليه. و قد كان نوى من الليل إن صومه ذلك اليوم جائز لما ذكرنا أن الجنون، والإغماء لاينافيان أهلية الأداء وإنما ينافيان النية، بخلاف الحيض والنفاس، والله أعلم.""</span></p><p style=""text-align:justify;"">البتہ اس کے برعکس اگر حائضہ عورت رمضان المبارک میں دن میں پاک ہوگئی تو اب دن کے بقیہ حصہ میں اس کے لیے  کھانے پینے کی اجازت نہیں ہو گی،روزہ داروں کی طرح رہنا ضروری ہوگا، یہ بھوکا پیاسا رہنا رمضان المبارک کے احترام اور صائمین سے تشبہ (روزہ داروں کی مشابہت) کی وجہ سے ہے، بقیہ دن بھوکا پیاسا رہنے کو روزہ نہیں کہاجائے گا، لہٰذا بعد میں قضا کی نیت سے روزہ رکھنا لازم ہوگا۔ </p><p style=""text-align:justify;""><span class=""ar_writing"">وفي الدر المختار وحاشية ابن عابدين :</span></p><p class=""indent"" style=""text-align:justify;""><span class=""ar_writing"">""(كمسافر أقام وحائض ونفساء طهرتا ومجنون أفاق ومريض صح) ومفطر ولو مكرها أو خطأ (وصبي بلغ وكافر أسلم وكلهم يقضون) ما فاتهم (إلا الأخيرين) وإن أفطرا لعدم أهليتها في الجزء الأول من اليوم وهو السبب في الصوم.</span></p><p class=""indent"" style=""text-align:justify;""><span class=""ar_writing"">(قوله: لعدم أهليتهما) أي لأصل الوجوب بخلاف الحائض فإنها أهل له وإنما سقط عنها وجوب الأداء فلذا وجب عليها القضاء ومثلها المسافر والمريض والمجنون.""</span></p><p class=""indent"" style=""text-align:left;"">( فتاوی شامی،2/ 408،ط: سعيد )</p><p>مراقی الفلاح میں ہے :</p><p class=""indent"" style=""text-align:justify;""><span class=""ar_writing"">""يجب"" على الصحيح وقيل: ‌يستحب ""‌الإمساك بقية اليوم على من فسد صومه ولو بعذر ثم زال ""وعلى حائض ونفساء طهرتا بعد طلوع الفجر.""</span></p><p class=""indent"" style=""text-align:left;""><span class=""ar_writing"">(مراقي الفلاح شرح نور الإيضاح» (ص255)، ط: الناشر: المكتبة العصرية)</span></p><p class=""indent"" style=""text-align:left;""><span class=""ar_writing"">فقط واللہ اعلم</span></p></p>",144509100546,banuri,"('روزہ', 'soum')","('روزہ', 'roza')","('روزہ توڑنے والی اشیاء', 'roza-tornay-wali-ashya')"
16-03-2024,https://www.banuri.edu.pk/readquestion/burhapy-ki-wja-sy-rozon-ka-fidya-deny-ka-hukam-144509100545/16-03-2024,بڑھاپے کی وجہ سے روزوں کے فدیے کا حکم,میری دادی  صاحبہ کی عمر نوے سال کے قریب ہے، وہ بہت زیادہ بوڑھی ہیں ، تو مجھے یہ معلوم کرنا ہے کہ کوئی بوڑھا شخص اگر روزہ نہ رکھ پائے تو کیا ان پر فدیہ دینا لازم ہو گا؟اور اگر لازم ہو گا تو ہم کب ادا کر سکتے ہیں ؟,"<p><p style=""text-align:justify;"">صورتِ مسئولہ میں اگر سائلہ کی دادی بڑھاپے کی وجہ سے روزہ رکھنے پر بالکل قادر نہیں، یعنی سال کے مختصر اور ٹھنڈے ایام میں بھی روزے کی قضا نہیں کرسکتی، تو ایسی صورت میں ان کے لیے روزوں کا فدیہ ( رمضان  شروع ہونے کے بعد   جب بھی دینا چاہے ) دینا جائز ہے۔</p><p style=""text-align:justify;"">اور ایک روزے  کا فدیہ  ایک صدقۃ الفطر  کے برابر  یعنی پونے دو کلو گندم یا اس کی موجودہ قیمت ہے۔ لہذا مہینے میں  جتنے روزے ہوں 29 یا 30 اتنے ہی فدیہ ادا کرنے ہوں گے۔</p><p style=""text-align:justify;""><span class=""ar_writing"">الدر المختار وحاشية ابن عابدين (رد المحتار) (2/ 427)ط:سعید:</span></p><p class=""indent"" style=""text-align:justify;""><span class=""ar_writing"">""(وللشيخ الفاني العاجز عن الصوم الفطر ويفدي) وجوباً، ولو في أول الشهر.""</span></p><p class=""indent"" dir=""rtl"" style=""text-align:left;""><span class=""ar_writing""> فقط واللہ اعلم</span></p></p>",144509100545,banuri,"('روزہ', 'soum')","('روزہ کی قضا، کفارہ اور فدیہ', 'roza-ki-qaza-kaffara-aur-fidya')","('روزہ کا فدیہ', 'roza-ka-fidya')"
