issued_at,link,title,question,answer,fatwa_number,dar_ul_ifta,kitab,bab,fasal
28-07-2024,https://www.banuri.edu.pk/readquestion/amr-e--mobah-pa-qsam-khanye-me-gonh-nhi-he-144601101814/28-07-2024,ضروت کے وقت کسی معاملہ میں قسم کھانے پر گناه نہیں ہے,"گزشتہ کچھ عرصہ سے ہمارے خاندان پر آسیب و جنات کے اثرات ظاہر ہو رہے تھے ، کبھی ایک بھائی پر جناتی اثرات ظاہر ہو تے تو کبھی بہن پر، اس طرح پورے خاندان والے اس پر یشانی میں مبتلا تھے،  اور جب یہ اثرات ظاہر ہوتے تو وہ اپنے آپ کو تکلیف پہنچانے، یہاں تک کہ خودکشی پر تیار ہو جاتا۔اس سلسلے میں جب ہم  نے عاملوں سے رجوع کیا تو انہوں  نے بتایا کہ تمہارے ایک عامل رشتہ دار جو تمہارا چچازاد لگتا ہے اس نے تم سب پر جادو کیا ہے۔انہی ایام میں ایک بھائی پر جب جن ظاہر ہوا تو اس نے بھی اس رشتہ دار کی نشاندہی کی،  اور بتایا کہ مجھے فلاں ( جس نے جادو کیا تھا ) نے بھیجا ہے، پھر آسیب زدہ بھائی نے کہا کہ فلاں ( جس نے جادو کیا تھا ) کو ہمارے سامنے حاضر کرو، جب وہ آیا تو پہلے اس سے کہاکہ: آپ ہم سے معافی مانگو، یہ سب آپ نے کیا ہے، اس نے معافی مانگنے سے انکار کیا تو آسیب زدہ بھائی نے ( اسی اثرات کی حالت میں ) اس سےکہا کہ: اگر آپ معافی نہیں مانگتے تو پھر ہم سب مل کر قرآن پر ہاتھ رکھ کر قسم اٹھائیں گے، واضح رہے کہ آسیب زدہ بھائی نے جنات کی زبان میں حلف اٹھانے کا اس لیے کہا تھا کہ اگر اس عامل رشتہ دارسے حلف نہ لیاجائے  تو سب بھائیوں پر یہ اثرات ظاہر ہوں گے، چناں چہ ہم نے اس طرح قسم اٹھائی کہ"" قرآن کی قسم نہ ماضی میں ہم نے اس خاندان پر جادو کیا،  اور نہ آئندہ جادو کریں گے ""سب نے انہیں الفاظ کے ساتھ حلف اٹھا یا، لیکن عامل رشتہ دار جس پر جادو کرنے کی نشاندہی کی گئی تھی،  اس نے ان الفاظ سے حلف اٹھایا کہ ""قرآن کی قسم اس خاندان پر آئندہ جادونہیں کروں گا""، اس نے اپنے حلف میں ماضی کا ذکر نہیں کیا، حلف کے واقعے کے بعد الحمد للہ سب کچھ عرصہ کے لئے ٹھیک ہو گئے۔1. اب مسئلہ یہ ہے کہ مذکورہ بالا تفصیل کے مطابق ہم سب نے قرآن پر ہاتھ رکھ کر جو حلف اٹھایا، وہ ٹھیک اور درست تھا کہ نہیں ، اس لیے کہ ہمارے لوگوں میں یہ مشہور ہے کہ قرآن پر حلف اٹھوانا خواہ حق پر ہو یا ناحق،کسی بھی صورت میں صحیح نہیں، اور سب ہمیں طعنہ دے رہے ہیں کہ علماء و تبلیغ سے جڑے ہو کر بھی اس طرح کام کرتے ہو، تو کیا ہمارا اس طرح حلف اٹھانا درست تھا یا نہیں؟2. اس واقعہ کے بعد اس عامل رشتہ دار اور اس کے گھر والوں نے ہم سے قطع تعلقی کر لی ہے ، اگر ہم سلام کرتے ہیں تو جواب نہیں دیتے اور ہم سے میل ملاقات بھی نہیں رکھتے، ان کا کہنا ہے کہ خوشی  غمی میں آپ ہمارے ساتھ شریک نہ ہوں، شرعا اس قطع تعلقی کاکیاحکم ہے اور ہمیں کیا کرنا چاہیے ؟","<p><p style=""text-align:justify;"">1.واضح رہےکہ شرعی شہادت کے بغیر محض کسی عامل سےغیب کےبارےمیں رجوع کرنااورعامل کایہ کہناکہ فلاں رشتہ دار نے جادو کیاہےشرعاًغلط ہے، اوراس کی بات پراعتماد کرکے آپس میں لڑناجھگڑنابھی شرعاًناجائز ہے، چناں چہ حضرت تھانوی ؒ عملیات وتعویذات نامی کتاب میں لکھتےہیں:</p><p class=""indent"" style=""text-align:justify;"">""اللہ تعالی کا فرمان ہے، <span class=""qr_writing"">{ولاتقف مالیس لك به علم}</span></p><p class=""indent"" dir=""rtl""><span lang=""er"" xml:lang=""er"">(جس چیز کا تم کوصحیح علم نہ ہواس کے پیچھے مت پڑو)</span></p><p class=""indent"" dir=""rtl"" style=""text-align:justify;""><span lang=""er"" xml:lang=""er"">اس آیت سےمعلوم ہوا کہ کسی صحیح دلیل کے بغیرجس کا صحیح ہونا قواعد شرعیہ سے ثابت ہوکسی امرکا خواہ وہ اخبارہویا انشاء(یعنی کسی بات کی خبرہویاکسی امرکا حکم ہواس کا) اعتقاد درست نہیں۔</span></p><p class=""indent"" dir=""rtl"" style=""text-align:justify;""><span lang=""er"" xml:lang=""er"">اب عاملوں کو دیکھا جاتا ہے کہ وہ خاص طریقوں سے فال کھولتے ہیں۔ اورگذشتہ یا آئندہ کے متعلق خبردیتے ہیں، یاچور وغیرہ معلوم کرنے کے لیے لوٹا گھمانے کا عمل کرتے ہیں اورکسی کا نام بتلادیتے ہیں اوراس کے مطابق خود بھی یقین کرلیتے لیں۔ اوردوسروں کو بھی یقین دلاتے ہیں۔یا ایسا کوئی عمل جس سے کوئی خواب نظرآئے بتلاکرجوکچھ خواب میں نظرآئے اس پرپورا اعتماد کرلیتے ہیں اوراس کا نام استخارہ رکھتے ہیں، یہ سب غیب کی خبروں کا دعوی ہے کیوں کہ شریعت نے ان واسطوں کے ذریعہ کسی خبر کے علم کومفید اورمعتبرنہیں قراردیا، بخلاف طب (علاج معالجہ) کے کہ خود سنت میں اس کا اعتبار وارد ہے۔ گودرجہ (اگر وصول کرلیا ہے)ظن ہی میں سہی، مذکوہ آیت ایسے امور کو باطل کرتی ہے، اسی طرح حدیث بھی ان سب کو باطل کرتی ہے، چناں چہ ارشاد ہے۔</span></p><p class=""indent"" dir=""rtl"" style=""text-align:justify;""><span lang=""er"" xml:lang=""er""><span class=""ar_writing"">""قال رسول اللہ ﷺ:من أتی عرافا فسئله عن شیئ لم تقبل له صلوة أربعین لیلة""</span></span></p><p class=""indent"" dir=""rtl"" style=""text-align:justify;""><span lang=""er"" xml:lang=""er"">حضورﷺ نے ارشاد فرمایا کہ جوشخص عراف (یعنی غیب کی خفیہ باتیں بتانے والے )کے پاس آیا اوراس سے کچھ پوچھا ایسے شخص کی چالیس روزتک نماز قبول نہ کی جائے گی۔""</span><span style=""text-align:left;"">(ص:112، ط:ادارہ تالیفات اشرفیہ)</span></p><p style=""text-align:justify;"">نیزیہ بھی واضح رہےکہ کسی بھی معاملےمیں قسم کھانےاورکھلانےسےاجتناب ہی بہترہے، اگرچہ یہ قسم کھانایاکھلاناحق پرہی کیوں نہ ہو، کیوں کہ اس میں اللہ کےنام کی بےحرمتی کااندیشہ ہوتاہے، اورجھوٹی قسم کااحتمال رہتاہے، خصوصاًجب یہ قسم کھانااورکھلانااجتماعی صورت میں ہو، تاہم حق پرقسم کھانےیامدعیٰ علیہ سےقسم کھلانےپرکوئی وعیدبھی نہیں ہے۔</p><p style=""text-align:justify;"">لہذاصورتِ مسئولہ میں سحرزدہ شخص کےبھائیوں نےجوقسم کھائی ہےکہ ’’قرآن کی قسم نہ ماضی میں ہم نے اس خاندان پر جادو کیا اور نہ آئندہ جادو کریں گے‘‘ اس میں شرعاًکوئی قباحت نہیں ہے، اسی طرح مدعیٰ علیہ  سےانہوں نےجوقسم کھلوائی ہے اس میں بھی ان پرشرعاًکوئی ملامت کی بات نہیں ہے، لہذالوگوں کا اس بات پر طعنےدینابےجاہے۔</p><p style=""text-align:justify;"">2. رشتہ داروں کاآپس میں قطع تعلقی کرناسخت گناہ کی بات ہے، احادیث میں قطع تعلقی پربڑی وعیدیں آئی ہیں، اس لیےآپ حضرات ہرممکن طریقےسےانہیں راضی کرنےکی کوشش کریں، کیوں کہ صلہ رحمی بھی یہی ہےکہ جورشتہ دارتعلقات ختم کرچکےہوں ان سےبھی میل ملاپ جاری رکھا جائے، اگرآپ لوگ یہی کوشش جاری رکھیں، توایک دن وہ بھی مجبورہوکر اپنےعمل سےبازآجائیں گے، ورنہ آپ لوگوں کو گناہ نہیں ہوگا۔</p><p style=""text-align:justify;"">مشكاة المصابيح ميں ہے:</p><p class=""indent"" style=""text-align:justify;""><span class=""ar_writing"">""وعن أبي قتادة قال: قال رسول الله صلى الله عليه وسلم: إياكم وكثرة الحلف في البيع فإنه ينفق ثم يمحق. رواه مسلم.""</span></p><p class=""indent"" style=""text-align:left;""><span class=""ar_writing"">(كتاب البيوع، ‌‌باب المساهلة في المعاملات، الفصل الأول، 850/2، المكتب الإسلامي)</span></p><p style=""text-align:justify;"">مرقاۃ المفاتیح میں ہے:</p><p class=""indent"" style=""text-align:justify;""><span class=""ar_writing"">""(وعن أبي قتادة قال: قال رسول الله صلى الله عليه وسلم: "" وإياكم وكثرة الحلف في البيع "") أي: اتقوا كثرتها ولو كنتم صادقين، لأنه ربما يقع كذبا...وفيه أن جواز قلتها مع صدقها مجمع عليها.""</span></p><p class=""indent"" style=""text-align:left;""><span class=""ar_writing"">(كتاب البيوع، ‌‌باب المساهلة في المعاملات، الفصل الأول، 1908/5، ط:دار الفکر)</span></p><p style=""text-align:justify;"">سنن ترمذی میں ہے:</p><p class=""indent"" style=""text-align:justify;""><span class=""ar_writing"">""عن عمرو بن شعيب ، عن أبيه ، عن جده أن النبي صلى الله عليه وسلم قال في خطبته: البينة ‌على ‌المدعي، واليمين على المدعى عليه.""</span></p><p class=""indent"" style=""text-align:left;""><span class=""ar_writing"">(‌‌أبواب الأحكام، باب ما جاء في أن البينة على المدعي واليمين على المدعى عليه، 18/3، ط:دار الغرب الإسلامي)</span></p><p style=""text-align:justify;"">فتاویٰ شامی میں ہے:</p><p class=""indent"" style=""text-align:justify;""><span class=""ar_writing"">""(وصلة الرحم واجبة ولو) كانت (بسلام وتحية وهدية) ومعاونة ومجالسة ومكالمة وتلطف وإحسان ويزورهم غبا ليزيد حبا بل يزور أقرباءه كل جمعة أو شهر ولا يرد حاجتهم لأنه من القطيعة في الحديث إن الله يصل من وصل رحمه ويقطع من قطعها.</span></p><p class=""indent"" style=""text-align:justify;""><span class=""ar_writing"">(قوله: وصلة الرحم واجبة) نقل القرطبي في تفسيره اتفاق الأمة على وجوب صلتها وحرمة قطعها للأدلة القطعية من الكتاب والسنة على ذلك قال في تبيين المحارم: واختلفوا في الرحم التي يجب صلتها قال قوم: هي قرابة كل ذي رحم محرم وقال آخرون. كل قريب محرما كان أو غيره اهـ والثاني ظاهر إطلاق المتن قال النووي في شرح مسلم: وهو الصواب واستدل عليه بالأحاديث. نعم تتفاوت درجاتها ففي الوالدين أشد من المحارم، وفيهم أشد من بقية الأرحام وفي الأحاديث إشارة إلى ذلك كما بينه في تبيين المحارم (قوله: ولو كانت بسلام إلخ) قال في تبيين المحارم: وإن كان غائبا يصلهم بالمكتوب إليهم، فإن قدر على المسير إليهم كان أفضل وإن كان له والدان لا يكفي المكتوب إن أرادا مجيئه وكذا إن احتاجا إلى خدمته، والأخ الكبير كالأب بعده وكذا الجد وإن علا والأخت الكبيرة والخالة كالأم في الصلة، وقيل العم مثل الأب وما عدل هؤلاء تكفي صلتهم بالمكتوب أو الهدية اهـ. وتمامه فيه.</span></p><p class=""indent"" style=""text-align:justify;""><span class=""ar_writing"">ثم اعلم أنه ليس المراد بصلة الرحم أن تصلهم إذا وصلوك لأن هذا مكافأة بل أن تصلهم وإن قطعوك فقد روى البخاري وغيره ليس الواصل بالمكافئ ولكن الواصل الذي إذا قطعت رحمه وصلها.""</span></p><p class=""indent"" style=""text-align:left;""><span class=""ar_writing"">(کتاب الحظر و الإباحة، 411/6، ط:سعید)</span></p><p class=""indent"" dir=""rtl"" style=""text-align:left;""><span class=""ar_writing"" lang=""er"" xml:lang=""er"">فقط واللہ أعلم</span></p></p>",144601101814,banuri,"('اَیمان و نذور', 'ayman-o-nuzoor')","('قسم کے احکام', 'qasam-ke-ahkaam')","('قسم کے الفاظ و شرائط', 'qasam-ke-alfaaz-o-sharaet')"
02-07-2024,https://www.banuri.edu.pk/readquestion/tarikah-ki-taqseem-or-aek-waris-ka-matrookah-makaan-khareednaa-digar-wurasaa-ki-razaamandi-sy-144512101270/02-07-2024,ترکہ کی تقسیم اور ایک وارث کا دیگر ورثاء کی رضامندی سے متروکہ مکان خریدنا,1۔میری والدہ کا انتقال ہوا، بوقتِ وفات ان کے ورثاء میں شوہر، تین بیٹے اور ایک بیٹی ہے، اس کے بعد شوہر یعنی ہمارے والد صاحب کا انتقال ہوا، ورثاء میں تین بیٹے اور ایک بیٹی چھوڑے، ترکہ میں ایک مکان ہے، اب اس کی تقسیم کس طرح ہوگی؟2۔نیز میں یہ مکان خریدنا چاہتاہوں، اور میرے بہن بھائی بھی اس پر راضی ہیں کہ یہ مکان میں خریدوں، تو اس صورت میں مذکورہ مکان کو کس قیمت کے اعتبار سے خریدوں؟ اور میں کس طرح اپنی بہن بھائیوں کو ان کا حصّہ دوں؟3۔ ہماری ایک بہن کا انتقال والدین مرحومین کی حیات ہی میں ہوگیا تھا، اور ان کا ایک بیٹا اور دو بیٹیاں ہیں، کیا شرعًا مذکورہ مکان میں مرحومہ بہن اور اس کے بچوں کا حصّہ بنتا ہے یا نہیں؟4۔ ہماری والدہ نے ترکہ میں زیور بھی چھوڑا، جس کی مالیت تقریبًا 22 لاکھ روپے ہے، اس کی شرعی تقسیم مذکورہ ورثاء کےدرمیان کس طرح ہوگی؟ اور اس پر زکوٰۃ کب سے لازم ہوگی؟ کیوں کہ ہماری والدہ کا انتقال 2018ء میں ہوا تھا، اور کیا اس زیور میں مرحومہ بہن اور ان کے بچوں کا شرعًا حصّہ ہوگا یا نہیں؟,"<p><p style=""text-align:justify;"">1۔ صورتِ مسئولہ میں سائل کے مرحوم والدین کے ترکہ کو ان کے ورثاء کے درمیان  تقسیم کا شرعی طریقہ یہ ہے کہ دونوں مرحومین کے حقوقِ متقدمہ یعنی تجہیز و تکفین کا خرچہ نکالنے کے بعد، اگر ان مرحومین کے ذمّہ کوئی قرض ہو تو کل ترکہ سے اس کی ادائیگی کے بعد، اگر انہوں نے کوئی جائز وصیت کی ہوں تو اس کو باقی مال کے ایک تہائی سے نافذ کرنے کے بعد باقی کل ترکہ منقولہ و غیر منقولہ کو 7 حصّوں  میں تقسیم کرکے 2، 2 حصّے مرحومین کے ہر ایک بیٹے کو اور ایک حصّہ بیٹی کو ملے گا۔ صورتِ تقسیم یہ ہے:</p><p style=""text-align:justify;"">میت:(والدین مرحومین)7</p><table border=""1"" style=""height:124px;width:100.64%;""><tbody><tr><td style=""text-align:center;"">بیٹا</td><td style=""text-align:center;"">بیٹا</td><td style=""text-align:center;"">بیٹا</td><td style=""text-align:center;"">بیٹی</td></tr><tr><td style=""text-align:center;"">2</td><td style=""text-align:center;"">2</td><td style=""text-align:center;"">2</td><td style=""text-align:center;"">1</td></tr></tbody></table><p style=""text-align:justify;""> اور فیصد کے اعتبار سے %28.57 ہر ایک بیٹے کو اور %14.29 بیٹی کو ملے گا۔</p><p style=""text-align:justify;"">2۔ سائل کا اپنے تمام بھائی بہن کی باہمی رضامندی سے قیمت مقرر کر کے مذکورہ مکان کو خریدنا درست ہے ۔</p><p style=""text-align:justify;"">رہی بات سائل کا مذکورہ مکان خریدنے کی صورت میں وہ اپنے بھائی بہن کو ان کا حصّہ کس طرح دے گا؟ تو اس بارے میں حکم یہ ہے کہ مذکورہ مکان کی جو بھی قیمت باہمی رضامندی سے طے ہو، پھر مندرجہ بالا حصص اور تناسب کے اعتبار اسے تمام ورثاء کے درمیان تقسیم کیا جائے۔(جس میں سائل خود بھی شامل ہوگا)</p><p style=""text-align:justify;"">3۔ واضح رہے کہ جب بیٹا یا بیٹی میں سے کسی ایک کا انتقال والدین کی زندگی میں ہوجائے، تو وہ والدین  کے وارث نہیں رہتے، اور جب والدین کی دیگر نرینہ اولاد موجود ہو  تو فوت شدہ بیٹا یا بیٹی کی اولاد کو بھی  اپنے دادا، دادی یا نانا نانی کی جائیداد میں سے شرعًا حصّہ نہیں ملتا۔</p><p style=""text-align:justify;"">لہٰذا صورتِ مسئولہ میں مرحوم والدین کی جس بیٹی کا انتقال ان کی زندگی میں ہی ہوچکا تھا ان کی اولاد کو مرحومین کی جائیداد میں سے کوئی حصّہ نہیں ملے گا، کیوں کہ ان کے دیگر بیٹے اور بیٹیاں بھی موجود ہیں اور ان کی موجودگی میں نواسے اور نواسیاں وارث نہیں ہوتے، لہٰذا شرعی طور پر انہیں نانا نانی کی ترکہ میں سےکوئی حصّہ نہیں ملے گا۔ البتہ تمام ورثاء باہمی رضامندی سے انہیں کچھ دے دیں تو باعث اجر ہے، بالکل محروم کرنا مناسب عمل نہیں۔</p><p style=""text-align:justify;"">4۔ سائل کی والدہ کی مذکورہ ترکہ (زیور جس کی مالیت 22 لاکھ روپے ہے) بھی مندرجہ بالا حصص اور تناسب کے مطابق ورثاء کے درمیان تقسیم کیا جائے گا۔</p><p style=""text-align:justify;"">نیز ترکہ کی تقسیم سے پہلے سائل پر اور نہ مرحومہ کے دیگر ورثاء پر اس کی زکوٰۃ لازم نہیں ہوگی، بلکہ بعد از تقسیم جس  جس وارث کے حصّے میں جتنی رقم آئے اگر وہ وارث پہلے سے صاحبِ نصاب ہے تو ایسی صورت میں دیگر اموال کے ساتھ ملاکر وہ اس کی زکوٰۃ ادا کرےگا۔ اور اگر کوئی وارث صاحبِ نصاب نہ ہو تو  اگر اس کے حصّے میں آنے والی  رقم  بقدرِ نصاب ہو اور تقسیم کے بعد اس وارث کے پاس اس مال پر مکمل سال بھی گزر جائے تب اس کی زکوٰۃ لازم ہوگی، لہذا تقسیم سے پہلے اس ترکہ پر جتنے سال گذرے ہیں ان سالوں کی زکوٰۃ واجب نہیں۔</p><p style=""text-align:justify;"">اور جس بیٹی کا انتقال والدین کی زندگی ہی میں ہوگیا تھا اسے اور اس کی اولاد کو شرعی طور پر ان زیورات میں سے بھی کوئی حصّہ نہیں ملےگا، تاہم اگر دیگر ورثاء اپنی مرضی سے مرحومہ بیٹی کی اولاد کو تبرعاً کچھ دینا چاہے تو دے سکتے ہیں۔</p><p style=""text-align:justify;"">فتاویٰ شامی میں ہے:</p><p class=""indent"" style=""text-align:justify;""><span class=""ar_writing"">""(وكل) من شركاء الملك (أجنبي) في الامتناع عن تصرف مضر (في مال صاحبه) لعدم تضمنها الوكالة (فصح له بيع حصته ولو من غير شريكه بلا إذن.</span></p><p class=""indent"" style=""text-align:justify;""><span class=""ar_writing"">وفي الرد: فبيع كل منهما نصيبه شائعا جائز من الشريك والأجنبي.""</span></p><p class=""indent"" style=""text-align:left;""><span class=""ar_writing"">(كتاب الشركة، ج:4، ص:300، ط:ايج ايم سعيد)</span></p><p style=""text-align:justify;""><span class=""ar_writing"">وفيه أيضاً:</span></p><p class=""indent"" style=""text-align:justify;""><span class=""ar_writing"">""وشروطه: ثلاثة: موت مورث حقيقةً، أو حكمًا كمفقود، أو تقديرًا كجنين فيه غرة و وجود وارثه عند موته حيًّا حقيقةً أو تقديرًا كالحمل والعلم بجهة إرثه، وأسبابه وموانعه سيأتي.""</span></p><p class=""indent"" dir=""rtl"" style=""text-align:left;""><span class=""ar_writing"">(كتاب الفرائض، شرائط الميراث، ج:6، ص:758، ط:ايج ايم سعيد)</span></p><p style=""text-align:justify;"">بدائع الصنائع میں ہے:</p><p class=""indent"" style=""text-align:justify;""><span class=""ar_writing"">""‌وأما ‌الدين ‌الضعيف فهو الذي وجب له بدلا عن شيء سواء وجب له بغير صنعه كالميراث، أو بصنعه كما لوصية، أو وجب بدلا عما ليس بمال كالمهر، وبدل الخلع، والصلح عن القصاص، وبدل الكتابة ولا زكاة فيه ما لم يقبض كله ويحول عليه الحول بعد القبض.""</span></p><p class=""indent"" style=""text-align:left;""><span class=""ar_writing"">(كتاب الزكوة، فصل الشرائط اللتي ترجع إلى المال، ج:2، ص:10، ط:دار الكتب العلمية بیروت)</span></p><p class=""indent"" style=""text-align:left;""><span class=""ar_writing"">فقط والله أعلم</span></p></p>",144512101270,banuri,"('فرائض', 'faraez')","('ترکہ کی تقسیم', 'taraka-ki-taqseem')","('ترکہ کی تقسیم کا طریقہ', 'taraka-ki-taqseem-ka-tareqa')"
