issued_at,link,title,question,answer,fatwa_number,dar_ul_ifta,kitab,bab,fasal
23-03-2023,https://www.banuri.edu.pk/readquestion/farookh-shuda-makan-ko-aagy-farookht-karna-144409100050/23-03-2023,فروخت شدہ مکان کو آگے بیچنا,میری والدہ کے ترکہ میں ایک عددگھر اوردومکان پگڑی کے اور120 گزکاپلاٹ اسکیم 33 کی فائل ہے، ہم تین بھائی  ہیں ،جب کہ دوبہنوں کاانتقال والدہ سے پہلے ہواہے،سن 2008 میں جس گھر میں ہم رہتے تھے، میرے بھائی سے میراسوداطے پایاتھاچودہ لاکھ کا،جس کاایک لاکھ روپے میں نے ایڈ وانس اداکیاتھا،بعد میں میرے بھائیوں نے اس فروخت شدہ گھر کابیس لاکھ میں کسی اورسے سوداکیا،اورپچاس ہزاربیعانہ بھی وصول کیا،بعد میں یہ سوداختم کردیاگیا،اوربھائیوں کی مشاورت سے وہ پچاس ہزارکابیعانہ میرے بچوں نے واپس کیا،پھراس گھر کی حالت بہت خراب تھی،ساری چھت اوربیم گرنے لگی، اس وجہ سے پولیس بھی اٹھانے آئی،تو سب بھائیوں نے فیصلہ کیاکہ گھرکوازسر ِنو تعمیرکریں گے،جس پرتقریباـً تیس لاکھ تک کاخرچہ ہوا،جوکہ میری اہلیہ نے اپنے والد سے ملنے والی میراث اورایک ہائی روف گاڑی اورزیور سے کیا۔اب سوال یہ ہےکہ میں نے بطورِایڈوانس جو ایک لاکھ روپے اداکئے،اورمیرے بچوں نےجو پچاس ہزارروپے بیعانہ اداکیا،اورمیری اہلیہ نے جو تیس لاکھ گھر کی تعمیرمیں دییے،ترکہ تقسیم کرتے وقت ہم اس کامطالبہ کرسکتے ہیں؟,"<p><p style=""text-align:justify;"">واضح رہےکہ جب سائل نے مذکورہ میراث کے مکان کودیگر ورثاء سے ان کی رضامندی سے خریدا،اوربیعانہ بھی اداکیا،توسائل اس گھر کامالک ہوگیا،اوردیگر ورثاء اس کی قیمت کے حق دارہوگئے؛لہذا اب دیگر ورثاء کااس فروخت شدہ مکان کوپہلے سوداکوختم کئے بغیرآگے فروخت کرنادرست نہیں تھا،کیوں کہ یہ مکان توسائل کی ملکیت ہوچکاتھا،اورسائل نےایک لاکھ بیعانہ  دیاتھا،اس کے بعد سائل مزیدرقم دینے کاپابند ہے،اوراہلیہ نے جوگھر کی تعمیرکاخرچہ کیاہے،وہ چوں کہ اپنے ہی  مکان کی تعمیرمیں کیاہے،دیگر ورثاء اس کے ذمہ دارنہیں،  البتہ سائل کے بچوں نے جودوسرے سودے کابیعانہ واپس کیاہے،سائل کو اپنے بھائیوں سےیہ  رقم واپس لینے کاحق حاصل ہے۔</p><p style=""text-align:justify;"">البحرالرائق میں ہے:</p><p class=""indent"" style=""text-align:justify;""><span class=""arwriting""><strong><span dir=""rtl"" lang=""ar-sa"" style=""font-size:17.5pt;line-height:107%;font-family:'Times New Roman',serif;"" xml:lang=""ar-sa""><span class=""ar_writing"">""(ولو أخرجت الورثة أحدهم عن عرض أو عقار بمال أو عن ذهب بفضة أو على العكس صح قل أو كثر) حملا على المبادلة لا إبراء إذ هو عن الأعيان باطل.""</span></span></strong></span></p><p class=""indent"" style=""text-align:left;""><span class=""ar_writing""><span dir=""rtl"" lang=""ar-sa"" xml:lang=""ar-sa"">[كتاب الصلح،باب الصلح في الدين،فصل في صلح الورثة، ٧/٢٦١ ط:دار الكتاب الإسلامي]</span></span></p><p style=""text-align:justify;""><span dir=""rtl"" lang=""ar-sa"" xml:lang=""ar-sa"">البحر الرائق میں ہے:</span></p><p class=""indent"" style=""text-align:justify;""><span class=""ar_writing""><span dir=""rtl"" lang=""ar-sa"" xml:lang=""ar-sa"">""قوله (ومن باع ملك غيره فللمالك أن يفسخه، ويجيزه إن بقي العاقدان، والمعقود عليه، وله، وبه لو عرضا) يعني أنه صحيح موقوف على الإجازة بالشرائط الأربعة.""</span></span></p><p class=""indent"" style=""text-align:left;""><span class=""ar_writing"" dir=""rtl"" lang=""ar-sa"" xml:lang=""ar-sa"">[كتاب البيوع، فصل في بيع الفضولي،١٦٠/٦، ط: دارالكتب الإسلامي]</span></p><p class=""indent"" style=""text-align:left;""><span class=""ar_writing"" dir=""rtl"" lang=""ar-sa"" xml:lang=""ar-sa"">فقط والله أعلم</span></p></p>",144409100050,banuri,"('بیوع', 'buyoo')","('بیع موقوف', 'bayee-mauqoof')","('فضولی کی بیع', 'fazooli-ki-bayee')"
21-03-2023,https://www.banuri.edu.pk/readquestion/tarana-me-mojod-jumla-saya-khuday-zoljalal-ki-tahqeeq-144408102437/21-03-2023,"ترانہ میں جملہ ""سایۂ خدائے ذو الجلال"" کا حکم","ایک بڑے مفتی صاحب نے فرمایاکہ:پاکستان کے قومی ترانہ میں جو""سایہ خدائے ذوالجلال""کے الفاظ ہیں ،یہ کفریہ ہیں،آیا یہ بات درست ہے؟","<p><p style=""text-align:justify;"">واضح رہے کہ ترانہ میں موجود لفظِ سایہ کاجس طرح ایک معروف معنی( یعنی کسی وجود والی چیزکاپرتو ،اورعکس)ہے، اسی طرح سایہ کالفظ ،کسی کی حمایت اورحفاظت میں آنے کے لئے بھی استعمال ہوتاہے،اوراحادیث میں جہاں لفظِ"" ظل ""استعمال ہواہے،تو وہ بھی اس دوسرے معنی میں ہے؛لہذاترانہ میں موجودسایہ کی نسبت جو اللہ کی طرف ہوئی ہے،وہ اس دوسرے معنی کے لحاظ سے ہے،جوکہ بالکل درست ہے۔</p><p style=""text-align:justify;"">صحيح البخاری"" ميں ہے:</p><p class=""indent"" style=""text-align:justify;""><span class=""ar_writing"">""عن ‌أبي هريرة، عن النبي صلى الله عليه وسلم قال: «سبعة ‌يظلهم ‌الله في ظله يوم لا ظل إلا ظله: الإمام العادل، وشاب نشأ في عبادة ربه، ورجل قلبه معلق في المساجد، ورجلان تحابا في الله اجتمعا عليه وتفرقا عليه، ورجل طلبته امرأة ذات منصب وجمال، فقال إني أخاف الله، ورجل تصدق، أخفى حتى لا تعلم شماله ما تنفق يمينه، ورجل ذكر الله خاليا ففاضت عيناه.""</span></p><p class=""indent"" style=""text-align:left;""><span class=""ar_writing"">(كتاب الاذان،باب من جلس في المسجد ينتظر الصلاة وفضل المساجد،ج:1،ص:133،ط:دار طوق النجاة)</span></p><p class=""indent"" style=""text-align:justify;""><span class=""ur_writing"">ترجمہ:""حضرت ابوہریرہ رضی اللہ عنہ سے مروی ہے کہ میں نے رسول اللہ صلی اللہ علیہ وسلم سے سنا، فرماتے تھے: سات طرح کے لوگوں کو اللہ تعالیٰ اپنے سایہ میں اس دن جگہ دے گا جس دن اس کے سایہ کے سوا کوئی اور سایہ نہ ہوگا: 1:- امام عادل، 2:- وہ جوان جس کی نشو ونما ہی اللہ تعالیٰ کی عبادت میں ہوئی،3:- وہ شخص جس کا دل مسجدوں میں اَٹکا ہوا ہو، 4:- وہ دو شخص جو آپس میں اللہ کے لیے محبت رکھتے ہیں، اسی محبت پر ملتے اور اسی پر جدا ہوتے ہیں، 5:-وہ شخص جس کو کسی جاہ وجمال والی عورت نے(بدکاری کےلئے) بلایا اور اس نے کہہ دیا کہ میں تو اللہ سے ڈرتا ہوں، 6:- وہ شخص جس نے اس طرح چھپا کر صدقہ دیا کہ اس کے بائیں ہاتھ کو بھی پتہ نہ چل سکا کہ دائیں ہاتھ نے کیا خرچ کیا، 7:- وہ شخص جس نے تنہائی میں اللہ کو یاد کیا اور اس کی آنکھوں سےآنسو بہنے لگ گئیں۔""</span></p><p style=""text-align:justify;"">فتح الباری شرح صحیح البخاری میں ہے:</p><p class=""indent"" style=""text-align:justify;""><span class=""ar_writing"">""قوله في ظله قال عياض إضافة الظل إلى الله إضافة ملك وكل ظل فهو ملكه كذا قال وكان حقه أن يقول إضافة تشريف ليحصل امتياز هذا على غيره كما قيل للكعبة بيت الله مع أن المساجد كلها ملكه وقيل المراد بظله كرامته وحمايته كما يقال فلان ‌في ‌ظل الملك.""</span></p><p class=""indent"" style=""text-align:left;""><span class=""ar_writing"">(باب من جلس في المسجد ينتظر الصلاة،ج:2،ص:144،ط:دار المعرفة)</span></p><p style=""text-align:justify;"">مجمع الانھر شرح ملتقی الابحر میں ہے:</p><p class=""indent"" style=""text-align:justify;""><span class=""ar_writing"">""(ثم إن ألفاظ الكفر أنواع) (الأول فيما يتعلق بالله تعالى) إذا وصف الله تعالى بما لا يليق به أو سخر باسم من أسمائه أو بأمر من أوامره أو أنكر صفة من صفات الله تعالى أو أنكر وعده أو وعيده أو جعل له شريكا أو ولدا أو زوجة أو نسبه إلى الجهل أو العجز أو النقص أو أطلق على المخلوق من الأسماء المختصة بالخالق نحو القدوس والقيوم والرحمن وغيرها يكفر.""</span></p><p class=""indent"" style=""text-align:left;""><span class=""ar_writing"">(باب المرتد،الفاظ الكفر انواع،ج:1،ص:690،ط:دار احياء التراث العربي)</span></p><p class=""indent"" style=""text-align:left;""><span class=""ar_writing"">فقط والله أعلم</span></p></p>",144408102437,banuri,"('ایمان و عقائد', 'aqaed')","('اسلامی عقائد', 'islami-aqaed')","('ذات و صفات و اسماء باری تعالیٰ', 'zat-o-sifat-0-asmae-bari-taala')"
22-03-2023,https://www.banuri.edu.pk/readquestion/bihn-ho-144408102606/22-03-2023,بیوی کو دو پتھر دے کر کہنا تم میری بہن ہو,میرا اپنی بیوی کے ساتھ جھگڑا ہو ا، رات کے وقت، تو مجھے بہت غصہ آیا، اور باہر جا کردو عدد پتھر لے کر دے دیئے، اور بولا آج کے بعد سے تم میری بہن ہو، اس کے بعد بیوی اپنے گھر چلی گئی، اور میں نے واپس آنے کو بولا، تو اس کے والد نے بولا طلاق ہوگئی ، نیت اس وقت میری طلاق کی تھی ، اب اس سے کتنی طلاقیں واقع ہوئی ہیں ؟,"<p><p style=""text-align:justify;"">صورتِ مسئولہ میں سائل کا اپنی بیوی کو دو پتھر لا کر دے کر یہ کہنا کہ تم میری بہن ہو، اس سے کوئی طلاق واقع نہیں ہوئی،دونوں کا نکاح بدستور قائم ہے  ، بشرطیکہ نکاح کے ٹوٹنے کا کوئی دوسرا سبب نہ پایا گیاہو، البتہ اپنی بیوی کو ماں اور بہن کہنا شریعت کی رو سے درست نہیں ہے، فقہائے کرام نے لکھا ہے کہ اپنی بیوی کو ماں، بہن یا بیٹی کہنا مکروہ ہے۔ </p><p style=""text-align:justify;"">فتاوی شامی میں ہے :</p><p class=""indent"" style=""text-align:justify;""><span class=""ar_writing"">""وعرفه في التحرير بما يثبت حكمه الشرعي بلا نية وأراد ب ما اللفظ أو ما يقوم مقامه من الكتابة المستبينة أو الإشارة المفهومة فلا يقع بإلقاء ثلاثة أحجار إليها أو بأمرها بحلق شعرها وإن اعتقد الإلقاء والحلق طلاقا كما قدمناه لأن ركن الطلاق اللفظ أو ما يقوم مقامه مما ذكر كما مر""<span style=""font-family:arabic_font;font-size:23px;font-weight:600;"">۔</span></span></p><p class=""indent"" style=""text-align:left;"">(ج:3،ص:247،ط:سعید)</p><p style=""text-align:justify;"">وفیہ ایضاً:</p><p class=""indent"" style=""text-align:justify;""><span class=""ar_writing"">'' ( وإن نوى بأنت علي مثل أمي ) أو كأمي وكذا لو حذف علي، خانية ( براً أو ظهاراً أو طلاقاً صحت نيته ) ووقع ما نواه؛ لأنه كناية ( وإلا ) ينو شيئاً أو حذف الكاف، ويكره قوله: أنت أمي ويا ابنتي ويا أختي ونحوه۔</span></p><p class=""indent"" style=""text-align:justify;""><span class=""ar_writing"">(قوله:حذف الكاف ) بأن قال أنت أمي، ومن بعض الظن جعله من باب زيد أسد، در منتقى عن القهستاني، قلت: ويدل عليه ما نذكره عن الفتح من أنه لا بد من التصريح بالأداة، (قوله: لغا )؛ لأنه مجمل في حق التشبيه، فما لم يتبين مراد مخصوص لا يحكم بشيء، فتح (قوله: ويكره الخ ) جزم بالكراهة تبعاً للبحر و النهر، والذي في الفتح: وفي أنت أمي لا يكون مظاهراً، وينبغي أن يكون مكروهاً، فقد صرحوا بأن قوله لزوجته: يا أخية مكروه، وفيه حديث رواه أبو داود أن رسول الله سمع رجلاً يقول لامرأته: يا أخية، فكره ذلك ونهى عنه، ومعنى النهي قربه من لفظ التشبيه، ولولا هذا الحديث لأمكن أن يقول: هو ظهار؛ لأن التشبيه في أنت أمي أقوى منه مع ذكر الأداة، ولفظ يا أخية استعارة بلا شك، وهي مبنية على التشبيه، لكن الحديث أفاد كونه ليعين ظهاراً حيث لم يبين فيه حكماً سوى الكراهة والنهي، فعلم أنه لا بد في كونه ظهاراً من التصريح بأداة التشبيه شرعاً، ومثله أن يقول لها: يا بنتي أو يا أختي ونحوه ''۔</span></p><p class=""indent"" style=""text-align:left;"">(ج:3،ص:470،ط:سعید)</p><p class=""indent"" dir=""rtl"" style=""text-align:left;"">فقط واللہ اعلم</p></p>",144408102606,banuri,"('طلاق', 'talaaq')","('وقوع طلاق وعدم وقوع طلاق', 'wuqoo-e-talaq-o-adme-wuqoo-e-talaq')","('طلاق - وقوع اور عدم وقوع', 'talaq-wuqo-or-adm-e-wuqo')"
22-03-2023,https://www.banuri.edu.pk/readquestion/main-ne-is-ke-sath-khatam-kardia-kehne-se-talaq-ka-hukum-144408102600/22-03-2023,میں نے اس کے ساتھ ختم کردیا کہنے سے طلاق کا حکم,میں نے اپنی بیوی سے کہا : ” میں نے اس کے ساتھ  ختم کردیا“  اور نیت طلاق دینے کی تھی، یہ الفاظ دو  دفعہ کہے، اور پھر تقریباً 15 دن بعد کہا : میں نے رجوع کرلیا، اب اس کا کیا حکم ہے؟ طلاق واقع ہوئی  یا نہیں ہوئی؟ رجوع کرنا درست ہے یا نہیں ہے، اب میرا نکاح ختم ہوگیا یا باقی ہے؟,"<p><p style=""text-align:justify;"">صورتِ مسئولہ میں آپ نے  اپنی بیوی کو  طلاق کی نیت سے جو یہ الفاظ کہے کہ : ” میں نے اس کے ساتھ  ختم کردیا“   تو اس سے  بیوی پر  ایک طلاقِ بائن واقع ہوگئی ہے،   نکاح ختم ہوگیا ہے،اس کے بعد دوبارہ جو  یہی الفاظ استعمال کیے تو اس سے مزید کوئی طلاق واقع نہیں ہوئی، چوں کہ نکاح ختم ہوگیا تھا؛اس لیے   15 دن بعد جو آپ نے رجوع  کے الفاظ استعمال کیے ، اس سے رجوع نہیں ہوا،  البتہ اگر اب دونوں  میاں بیوی  باہمی رضامندی سے دوبارہ  ایک ساتھ رہنا چاہتے ہیں تو نئے مہر اور شرعی گواہان کے روبرو  از سرِ نو ایجاب وقبول کرکے  دوبارہ ساتھ رہ سکتے ہیں،   اور تجدیدِ نکاح کے بعد  آئندہ کے لیے  آپ  کو دو   طلاق کا اختیار حاصل   ہوگا ۔</p><p style=""text-align:justify;"">فتاوی عالمگیری میں ہے:</p><p class=""indent"" style=""text-align:justify;""><span class=""ar_writing"">""وفي الفتاوى لم يبق بيني وبينك عمل ونوى يقع كذا في العتابية.""</span></p><p class=""indent"" style=""text-align:left;""><span class=""ar_writing""> (1 / 376، کتاب الطلاق، الفصل الخامس في الكنايات في الطلاق، ط: رشیدیة)</span></p><p style=""text-align:justify;"">     فتاوی شامی میں ہے:</p><p class=""indent"" style=""text-align:justify;""><span class=""ar_writing"">""(لا) يلحق البائن (البائن) إذا أمكن جعله إخباراً عن الأول كأنت بائن بائن، أو أبنتك بتطليقة فلا يقع؛ لأنه إخبار، فلا ضرورة في جعله إنشاء.</span></p><p class=""indent"" style=""text-align:justify;""><span class=""ar_writing"">و في الرد : (قوله: لا يلحق البائن البائن) المراد بالبائن الذي لا يلحق هو ما كان بلفظ الكناية؛ لأنه هو الذي ليس ظاهراً في إنشاء الطلاق، كذا في الفتح.""</span></p><p class=""indent"" style=""text-align:left;""><span class=""ar_writing""> (3/ 308، باب الکنایات، ط: سعید)</span></p><p class=""indent"" style=""text-align:left;""><span class=""ar_writing"">فقط واللہ أعلم</span></p></p>",144408102600,banuri,"('طلاق', 'talaaq')","('وقوع طلاق وعدم وقوع طلاق', 'wuqoo-e-talaq-o-adme-wuqoo-e-talaq')","('طلاقِ کنایہ', 'talaq-e-kinaya')"
21-03-2023,https://www.banuri.edu.pk/readquestion/masjid-ki-liye-waqf-zamin-bech-kr-raqm-dosri-masjid-me-kharch-krne-ka-hukm-144408102470/21-03-2023,مسجد کے لیے وقف زمین کو بیچ کر رقم دوسری مسجد پر خرچ کرنے کا حکم,ایک شخص نے ایک ٹرسٹ ادارہ کو ایک جگہ مسجد  کے لیے وقف کی مگر اس جگہ کی نوعیت ایسی تھی کہ جلدی بنانا مشکل تھا۔ جس کا سبب آبادی کا نہ ہونا اور پانی و بجلی کا نہ ہونا تھا۔ کافی عرصہ کے بعد اس وقف جگہ کے بالکل قریب ایک مسجد بن گئی۔ جس کی وجہ سے اس مقام پر اب مسجد کی ضرورت باقی نہیں رہی۔ اور اس ٹرسٹ ادارہ کو مسجد کے لیے ایک اور جگہ وقف ہوئی جہاں مسجد تعمیر ہورہی ہے اور بچوں کے پڑھنے کا انتظام بھی ہوگا۔دریافت یہ کرنا ہے کہ پہلی وقف جگہ کہ جہاں مسجد کی خاص ضرورت بھی نہیں اور ادارہ کے پاس فی الحال وسائل بھی نہیں تو کیا اس پہلی وقف شدہ جگہ کو فروخت کر کے اس کی رقم ادارہ کو وقف شدہ دوسری جگہ جہاں مسجد کی تعمیر جاری ہے صرف کی جاسکتی ہے یا نہیں؟وضاحت: مسجد کے لیے وقف کی تھی، مسجد کی ضرورت کے لیے وقف نہیں کی تھی اور نہ ہی صراحۃ تبدیلی کی اجازت دی تھی۔,"<p><p style=""text-align:justify;"">واضح رہے کہ جب کوئی زمین حد بندی کر کے مسجد کے لیے وقف کردی جائے تو وقف کرتے ہی وہ جگہ واقف کی ملکیت سے نکل کر ہمیشہ ہمیشہ کے لیے اللہ تعالی کی ملکیت میں داخل ہوجاتی ہے۔ اس کے بعد  نہ اس کو فروخت کیا جاسکتا ہے اور نہ کسی اور مصرف میں استعمال کی جاسکتی ہے لہذا صورتِ مسئولہ میں جب مذکورہ شخص نے ایک جگہ مسجد کے لیے وقف کر کے ٹرسٹ کے حوالہ کردی تو وہ جگہ شرعا مسجد کے لیے وقف ہو گئی ، اب اس کو فروخت کرنا یا تبدیل کرنا جائز نہیں ہے۔ ٹرسٹ کو چاہیے کہ جب اس کے پاس رقم مہیا ہو تو  اس جگہ کو تعمیر کر کے مسجد  کی شکل دے دیں اور جب تک رقم مہیا نہ ہو تو وہاں پانچ وقت کی نماز کی جو ممکنہ صورت ہو اس کو اختیار کر لیا جائے تاکہ مذکورہ مسجد بھی نمازوں سے آباد رہے۔  </p><p>فتاوی شامی میں ہے:</p><p class=""indent"" style=""text-align:justify;""><span class=""ar_writing"">""و (بقوله جعلته مسجدا) عند الثاني</span></p><p class=""indent"" style=""text-align:justify;""><span class=""ar_writing"">(قوله: وشرط محمد والإمام الصلاة فيه)....«وأنه لو قال وقفته مسجدا، ولم يأذن بالصلاة فيه ولم يصل فيه أحد أنه لا يصير مسجدا بلا حكم وهو بعيد كذا في الفتح ملخصا. ولقائل أن يقول: إذا قال جعلته مسجدا فالعرف قاض، وماض بزواله عن ملكه أيضا غير متوقف على القضاء، وهذا هو الذي ينبغي أن لا يتردد فيه نهر.</span></p><p class=""indent"" style=""text-align:justify;""><span class=""ar_writing"">قلت يلزم على هذا أن يكتفى فيه بالقول عنده، وهو خلاف صريح كلامهم تأمل وفي الدر المنتقى وقدم في التنوير والدرر والوقاية وغيرها قول أبي يوسف وعلمت أرجحيته في الوقف والقضاء.""</span></p><p class=""indent"" style=""text-align:left;"">(کتاب الوقف ج نمبر ۴ ص نمبر ۳۵۶، ایچ ایم سعید)</p><p style=""text-align:justify;"">فتاوی ہندیہ میں ہے:</p><p class=""indent"" style=""text-align:justify;""><span class=""ar_writing"">""وإذا سلم المسجد إلى متول يقوم بمصالحه يجوز وإن لم يصل فيه، وهو الصحيح، كذا في الاختيار شرح المختار وهو الأصح كذا في محيط السرخسي وكذا إذا سلمه إلى القاضي أو نائبه، كذا في البحر الرائق.""</span></p><p class=""indent"" style=""text-align:left;"">(کتاب الوقف، باب حادی عشر، فصل اول ج نمبر ۲ ص نمبر ۴۵۵، دار الفکر)</p><p><span style=""text-align:justify;"">فتاوی ہندیہ میں ہے:</span></p><p class=""indent"" style=""text-align:justify;""><span class=""ar_writing"">""وإذا خرب المسجد واستغنى أهله وصار بحيث لا يصلى فيه عاد ملكا لواقفه أو لورثته حتى جاز لهم أن يبيعوه أو يبنوه دارا وقيل: هو مسجد أبدا وهو الأصح، كذا في خزانة المفتين.""</span></p><p class=""indent"" style=""text-align:left;""><span class=""ar_writing""><span style=""font-family:Nafees,sans-serif;font-size:18px;font-weight:400;text-align:left;"">(کتاب الوقف، باب حادی عشر، فصل اول ج نمبر ۲ ص نمبر ۴۵۸، دار الفکر)</span></span></p><p>وفیہ ایضاً:</p><p class=""indent"" style=""text-align:justify;""><span class=""ar_writing"">""في فتاوى الحجة لو صار أحد المسجدين قديما وتداعى إلى الخراب فأراد أهل السكة بيع القديم وصرفه في المسجد الجديد فإنه لا يجوز، أما على قول أبي يوسف - رحمه الله تعالى - فلأن المسجد وإن خرب واستغنى عنه أهله لا يعود إلى ملك الباني، وأما على قول محمد - رحمه الله تعالى -: وإن عاد بعد الاستغناء ولكن إلى ملك الباني وورثته، فلا يكون لأهل المسجد على كلا القولين ولاية البيع والفتوى على قول أبي يوسف - رحمه الله تعالى - أنه لا يعود إلى ملك مالك أبدا، كذا في المضمرات.""</span></p><p class=""indent"" style=""text-align:left;""><span style=""text-align:left;"">(کتاب الوقف، باب حادی عشر، فصل اول ج نمبر ۲ ص نمبر ۴۵۸، دار الفکر)</span></p><p class=""indent"" style=""text-align:left;""><span style=""text-align:left;"">فقط واللہ اعلم</span></p></p>",144408102470,banuri,"('وقف', 'waqf')","('مساجد کے احکام', 'masaajid-ke-ahkaam')","('مسجد شرعی و غیر شرعی', 'masjid-e-sharee-o-ger-sharee')"
