issued_at,link,title,question,answer,fatwa_number,dar_ul_ifta,kitab,bab,fasal
21-03-2023,https://www.banuri.edu.pk/readquestion/crypto-currency-ki-shri-hesiyat-kia-hay-144408102418/21-03-2023,کرپٹو کرنسی کی شرعی حیثیت کیا ہے؟,مفتی صاحب میراسوال کرپٹوکرنسی کے حوالے سے ہے، آج کل انٹرنیٹ میں اس کی مارکیٹنگ بہت ہے ، یہ ٹریڈنگ ایپ ہے ،جس میں لوگ ڈالرخریدکرجب ریٹ اوپر جاتےہیں تووہ سیل کرکے اپنا(profit) کماتےاورآگے اور(invest) کرتے ہیں،اوراس میں نفع اورنقصان کے ذمہ داربھی خود ہوتےہیں ، میں یہ پوچھناچاہتاہوں ، کیایہ کمائی حلال ہے یاحرام ؟ کیوں کہ یہ ایک طریقہ سے(ganbling) جیسانظرآتاہے ، لیکن کچھ لوگ(log term) (invest) کرتےہیں ، اوراس سے پیسے کماتے ہیں، کچھ ملکوں میں یہ حلال ہے ، اگریہ حلال ہے توکوئی شرائط کے طورپر ہے ؟ میں ابھی اس پر(resarch) کررہاہوں ، آپ اس کی تفصیل فرمادیں۔(bitcoin forex) اوربھی بہت سی ایپس ہیں ۔,"<p><p style=""text-align:justify;"">واضح رہے کہ آج کل جو عالمی مارکیٹ میں کرپٹو کرنسی رائج ہے وہ ایک فرضی کرنسی ہے ،اس میں حقیقی کرنسی کے بنیادی اوصاف اور شرائط بالکل موجود نہیں ہیں؛  لہذا کرپٹو کرنسی  کی خرید و فروخت کے نام سے جو الیکٹرونک  مارکیٹ میں کاروبار چل رہا ہے وہ  حلال اور جائز  نہیں ہے،اس کرنسی میں حقیقت میں کوئی مبیع یعنی مادی چیز نہیں ہوتی اور  اس میں قبضہ بھی نہیں ہوتا صرف اکاونٹ  میں کچھ  حساب کتا ب کے  عدد آجاتے ہیں؛  لہذا کرپٹو کرنسی کے لین دین سے کلی طور  پر اجتناب   کیا جائے،اور اگر بالفرض یہ حقیقی کرنسی ہوتی تو بھی مجلس عقد میں دونوں جانب سے قبضہ نہ ہونے کی وجہ سے جائز نہیں ہوتا۔</p><p style=""text-align:justify;"">فتاوی شامی میں ہے:</p><p class=""indent"" style=""text-align:justify;""><span class=""ar_writing"">""(قوله: مالا أو لا) إلخ، المراد بالمال ما يميل إليه الطبع ويمكن ادخاره لوقت الحاجة، والمالية تثبت بتمول الناس كافة أو بعضهم، والتقوم يثبت بها وبإباحة الانتفاع به شرعا؛ فما يباح بلا تمول لايكون مالًا كحبة حنطة وما يتمول بلا إباحة انتفاع لا يكون متقوما كالخمر، وإذا عدم الأمران لم يثبت واحد منهما كالدم بحر ملخصًا عن الكشف الكبير.</span></p><p class=""indent"" style=""text-align:justify;""><span class=""ar_writing"">وحاصله أن المال أعم من المتمول؛ لأن المال ما يمكن ادخاره ولو غير مباح كالخمر، والمتقوم ما يمكن ادخاره مع الإباحة، فالخمر مال لا متقوم،» ... وفي التلويح أيضًا من بحث القضاء: والتحقيق أن المنفعة ملك لا مال؛ لأن الملك ما من شأنه أن يتصرف فيه بوصف الاختصاص، والمال ما من شأنه أن يدخر للانتفاع وقت الحاجة، والتقويم يستلزم المالية عند الإمام والملك ... وفي البحر عن الحاوي القدسي: المال اسم لغير الآدمي، خلق لمصالح الآدمي وأمكن إحرازه والتصرف فيه على وجه الاختيار، والعبد وإن كان فيه معنى المالية لكنه ليس بمال حقيقة حتى لايجوز قتله وإهلاكه.""</span></p><p class=""indent"" style=""text-align:left;""><span class=""ar_writing"">(کتاب البیوع ج نمبر ۴ ص نمبر ۵۰۱،ایچ ایچ سعید)</span></p><p class=""indent"" style=""text-align:left;""><span class=""ar_writing"">فقط واللہ اعلم</span></p></p>",144408102418,banuri,"('بیوع', 'buyoo')","('صرف', 'sarf')","('ڈیجیٹل کرنسی کی خرید و فروخت', 'digital-currency-ki-kharid-o-farokht')"
20-03-2023,https://www.banuri.edu.pk/readquestion/karachi-say-jeddah-tak-bila-mahram-safar-karna-144408102338/20-03-2023,کراچی سے جدہ تک بلا محرم سفر کرنا,میں عمرہ پر جانا چاہتی ہوں،میرا شوہر دبئی میں ہے،پروگرام کے مطابق میں یہاں سےاکیلی جدہ ائرپورٹ پہونچوں گی،میراشوہروہاں ائرپورٹ پر موجود ہوگا،اور ہم دونوں جدہ سے مکہ عمرہ کرنےچلےجائیں گے،اب سوال یہ ہےکہ کیا میرا کراچی سےجدہ اکیلے عمرہ کےلیے سفر کرنا شرعی طور پر جائز ہے؟اگر جائز نہیں پھر بھی میں اکیلی چلی جاؤں  تو میرا عمرہ ادا ہوجائے گا؟میں ماہ شوال میں جانا چاہتی ہوں،اگر میں شوال میں عمرہ ادا کرتی ہوں تو مجھ پردم لگے گایانہیں؟اگردم ہےتوپھر مکہ کی حدود میں دینا ہوگایاکراچی آکر دےسکتی ہوں؟,"<p><p style=""text-align:justify;""><span class=""ur_writing"">واضح رہے کہ عورت خواہ جوان ہویابوڑھی اس کےلیےشرعی سفر پرجانے كےليےمحرم کی رفاقت شرط ہےشرعی سفرکی مقدار48 میل یعنی سواستترکلومیٹرہے،لہٰذا صورتِ مسئولہ میں سائلہ کاکراچی سےجدہ تک بغیرشوہر اورمحرم کےسفرجائزنہیں ہے،شوہر یا محرم کا ساتھ ہونا ضروری ہے۔ اگرسائلہ بغیر محرم کے عمرہ کےلیے چلی جاتی ہے تو  عمرہ توادا ہوجائےگا،لیکن سائلہ گناہ گارہوگی،نیزماہ شوال میں عمرہ ادا کرنے سے کسی قسم کاکوئی دم لازم نہیں آئےگا۔</span></p><p style=""text-align:justify;""><span class=""ur_writing"">صحیح مسلم میں ہے:</span></p><p class=""indent"" style=""text-align:justify;""><span class=""ar_writing"">""عن أبي سعيد الخدري، قال: قال رسول الله صلى الله عليه وسلم۔ لا ‌يحل ‌لامرأة تؤمن بالله واليوم الآخر، أن تسافر سفرا يكون ثلاثة أيام فصاعدا، إلا ومعها أبوها أو ابنها أو زوجها أو أخوها أو ذو محرم منها.""</span></p><p class=""indent"" style=""text-align:left;""><span class=""ar_writing"">(كتاب الحج، باب سفرالمرأة مع محرم إلى حج وغيره، ج:2، ص:977، ط: دار إحياء التراث العربي ببيروت)</span></p><p style=""text-align:justify;""><span class=""ur_writing"">فتاویٰ ہندیہ میں ہے:</span></p><p class=""indent"" style=""text-align:justify;""><span class=""ar_writing"">""ومنها المحرم للمرأة شابة كانت أو عجوزا إذا كانت بينها وبين مكة مسيرة ثلاثة أيام هكذا في المحيط.""</span></p><p class=""indent"" style=""text-align:left;""><span class=""ar_writing"">(كتاب المناسك، الباب الأول في تفسير الحج وفرضيته ووقته وشرائطه وأركانه، ج:1، ص:218، ط: دار الفكر بيروت)</span></p><p style=""text-align:justify;""><span class=""ur_writing"">فتاویٰ شامی میں ہے:</span></p><p class=""indent"" style=""text-align:justify;""><span class=""ar_writing"">""‌ولو حجت بلا محرم جاز مع الكراهة.""</span></p><p class=""indent"" style=""text-align:left;""><span class=""ar_writing"">(كتاب الحج، ج:2، ص:465، ط: سعيد)</span></p><p class=""indent"" style=""text-align:left;""><span class=""ar_writing"">فقط والله أعلم</span></p></p>",144408102338,banuri,"('حج', 'haj')","('حج / عمرہ', 'hajj-umrah')","('عورت کے لیے حج کی خاص شرائط', 'aurat-kay-liye-haj-ki-khas-sharaait')"
20-03-2023,https://www.banuri.edu.pk/readquestion/qarz-lekar-tabligi-jamaat-mein-jana-kaise-144408102330/20-03-2023,قرض لے کر تبلیغی جماعت میں جانا کیسا ہے؟,کیا قرض لے کر تبلیغی جماعت میں جانا ٹھیک ہے؟,"<p><p style=""text-align:justify;""> تبلیغ میں جانے کے لیے کسی سے قرض وصول کرنا بہتر نہیں  ، ایسی صورت میں مذکورہ شخص  اپنے مقام پر رہتے ہوئے  محنت کرتا رہے جب اللہ تعالی اسباب پیدا فرمادیں  تب جماعت میں چلا جائے۔حدیث شریف میں قرض کے غلبہ سےپناہ مانگی گئی ہے،حضرت ابو سعید خدری  رضی اللہ عنہ کہتے ہیں کہ رسول اللہ صلیٰ اللہ علیہ وسلم ایک دن مسجد میں داخل ہوئے تو اچانک آپ کی نظر ایک انصاری پر پڑی جنہیں ابوامامہ رضی اللہ عنہ کہا جاتا تھا، آپ صلی اللہ علیہ وسلم نےان سے کہا: ابوامامہ! کیا وجہ ہے کہ میں تمہیں نماز کے وقت کے علاوہ بھی مسجد میں بیٹھا دیکھ رہا ہوں؟ انہوں نے عرض کیا: اللہ کے رسول! غموں اور قرضوں نے مجھے گھیر لیا ہے، آپ صلی اللہ علیہ وسلم  نے فرمایا: کیا میں تمہیں ایسے کلمات نہ سکھاؤں کہ جب تم انہیں کہو تو اللہ تم سے تمہارے غم غلط اور قرض ادا کر دے ، میں نے کہا: ضرور، اللہ کے رسول! آپ صلی  اللہ علیہ وسلم نے  فرمایا: صبح و شام یہ کہا کرو :</p><p class=""indent"" style=""text-align:justify;""><span class=""qr_writing"">""اللَّهُمَّ إِنِّي أَعُوذُ بِكَ مِنَ الْهَمِّ وَالْحَزَنِ، وَأَعُوذُ بِكَ مِنَ الْعَجْزِ وَالْكَسَلِ، وَأَعُوذُ بِكَ مِنَ ‌الْجُبْنِ وَالْبُخْلِ، وَأَعُوذُ بِكَ مِنْ غَلَبَةِ الدَّيْنِ، وَقَهْرِ الرِّجَالِ "".</span></p><p class=""indent"" style=""text-align:justify;"">اے اللہ! میں غم اور حزن سے تیری پناہ مانگتا ہوں، عاجزی و سستی سے تیری پناہ مانگتا ہوں، بزدلی اور کنجوسی سے تیری پناہ مانگتا ہوں اور قرض کے غلبہ اور لوگوں کے تسلط سے تیری پناہ مانگتا ہوں۔ ابوامامہ رضی اللہ عنہ کہتے ہیں: میں نے یہ پڑھنا شروع کیا تو اللہ نے میرا غم دور کردیا اور میرا قرض ادا کروا دیا۔</p><p style=""text-align:justify;"">سنن ابی داؤد  شریف میں ہے:</p><p class=""indent""><span class=""ar_writing"">""عن أبي سعيد الخدري، قال: دخل رسول صلى عليه وسلم ذات يوم المسجد، فإذا هو برجل من الأنصار، يقال له: أبو أمامة، فقال: «يا أمامة، ما لي أراك جالسا في المسجد في غير وقت الصلاة؟»، قال: هموم لزمتني، وديون يا رسول الله، قال: «أفلا أعلمك كلاما إذا أنت قلته أذهب عز وجل همك، وقضى عنك دينك؟»، قال: قلت: بلى، يا رسول، قال: "" قل إذا أصبحت، وإذا أمسيت: اللهم إني أعوذ بك من الهم والحزن، وأعوذ بك من العجز والكسل، وأعوذ بك من ‌الجبن والبخل، وأعوذ بك من غلبة الدين، وقهر الرجال ""، قال: ففعلت ذلك، فأذهب الله عز وجل همي، وقضى عني ديني""</span></p><p class=""indent"" style=""text-align:left;"">(سنن ابی داؤد،رقم الحدیث:1555،ص:93ج:2،ط:المکتبۃ العصریۃ)</p><p class=""indent"" style=""text-align:left;"">فقط واللہ اعلم </p></p>",144408102330,banuri,"('بیوع', 'buyoo')","('قرض', 'qarz')","('قرض کے احکام', 'qarz-ke-ahkaam')"
08-03-2023,https://www.banuri.edu.pk/readquestion/masbooq-ka-imam-ka-sath-sajda-sahu-me-salam-phernay-ka-hukam-144408100942/08-03-2023,مسبوق کاامام کے ساتھ سجدہ سہو میں سلام پھیرنے کا حکم,جماعت کے ساتھ  نماز کے دوران کسی کی  رکعت ر ہ جائے پھر امام سجدہ سہو کرلے ، جس کا نماز باقی رہ  گیا وہ بھی سلام پھیر سکتا ہے؟,"<p><p style=""text-align:justify;"">    واضح رہے کہ مسبوق(جس سے جماعت کے ساتھ نماز پڑھتے ہوئے کچھ رکعت رہ جائے ) کو اگر یاد ہو کہ اس کے ذمے کچھ رکعات باقی ہیں،اس کے باوجود وہ سجدہ سہو سے پہلےوالے سلام پر امام کے ساتھ سلام پھیردے تو اس  کی نماز فاسد ہوجائے گی ،نئے سرے سے نماز ادا کرنا لازم ہوگا۔لیکن اگر اس نے بھولے سے امام  سے پہلے یا امام کے ساتھ سلام پھیردیا تو نماز فاسد نہیں ہوگی،اور نہ ہی اس سلام کی وجہ سے سجدہ سہو لازم ہوگا۔کیوں کہ مسبوق سجدہ سہو کے سلام کے وقت مقتدی ہے اور مقتدی کے سہو کی وجہ سے سجدہ سہو واجب نہیں ہوگا،لیکن اگر امام کے سلام  پھیرنے کے بعد مقتدی نے بھولے سے  سلام پھیردیا تو ایسی صورت میں  مقتدی پر سجدہ سہو کرنا لازم ہوگا ۔</p><p style=""text-align:justify;"">فتاوی شامی میں ہے :</p><p class=""indent"" style=""text-align:justify;""><span class=""ar_writing"">""(والمسبوق يسجد مع إمامه مطلقا) سواء كان السهو قبل الاقتداء أو بعده </span></p><p class=""indent"" style=""text-align:justify;""><span class=""ar_writing"">(قوله والمسبوق يسجد مع إمامه) قيد بالسجود لأنه لا يتابعه في السلام، بل يسجد معه ويتشهد فإذا سلم الإمام قام إلى القضاء، فإن سلم فإن كان عامدا فسدت وإلا لا، ولا سجود عليه إن سلم سهوا قبل الإمام أو معه؛ وإن سلم بعده لزمه لكونه  منفردا حينئذ بحر، وأراد بالمعية المقارنة وهو نادر الوقوع كما في شرح المنية. وفيه: ولو سلم على ظن أن عليه أن يسلم فهو سلام عمد يمنع البناء"".</span></p><p class=""indent"" style=""text-align:left;"">(کتاب الصلاۃ،باب سجود السہو،ج:2،ص:82،سعید)</p><p class=""indent"" style=""text-align:left;"">فقط واللہ  اعلم</p></p>",144408100942,banuri,"('نماز', 'salat')","('سجدہ سہو', 'sajda-sahv')","('سجدہ سہو کا وجوب و عدم وجوب', 'sajda-sahoo-ka-wujoob-o-adme-wujoob')"
18-05-2022,https://www.banuri.edu.pk/readquestion/shor-ka-hoqaq-144310100611/18-05-2022,بیوی کا شوہر کو گالی دینا گناہ ہے؟,اگر بیوی شوہر کو گالی دے تو کیا حکم ہے؟,"<p><p style=""text-align:justify;""><span class=""ur_writing""> کسی بھی مسلمان کو گالی دینا گناہِ کبیرہ ہے، اور شوہر کا بیوی پر بہت بڑا حق ہے، حدیثِ پاک میں ہے کہ اگر میں کسی کو  دوسرے کو سجدے کا حکم دیتا تو بیوی کو حکم دیتا کہ وہ شوہر کو سجدہ کرے۔ لہذا شوہر کے لیے  ایسے الفاط کے استعمال سے بیوی سخت گناہ گار ہے، اسے سچے دل سے اللہ تعالیٰ کے حضور بھی توبہ کرنی چاہیے، اور اپنے شوہر سے بھی معافی مانگنی چاہیے،باقی شوہر کو بھی ایسا کوئی کام نہیں کرنا چاہئے  جس کی وجہ سے عورت کے جذبات اس حد تک مجروح ہوجائیں کہ وہ گالم گلوچ  پر اتر آئے ۔</span></p><p style=""text-align:justify;""><span class=""ur_writing"">حدیث شریف میں ہے:</span></p><p class=""indent"" style=""text-align:justify;""><span class=""ar_writing"">""حدثنا محمود بن غيلان قال: حدثنا النضر بن شميل قال: أخبرنا محمد بن عمرو، عن أبي سلمة، عن أبي هريرة، عن النبي صلى الله عليه وسلم قال: «لو كنت آمرا أحدا أن يسجد لأحد لأمرت المرأة أن تسجد لزوجها» .""</span></p><p class=""indent"" style=""text-align:left;""><span class=""ar_writing"">(سنن الترمذی، باب ما جاء في حق الزوج على المرأة، ج: 3، صفحہ: 457، رقم الحدیث: 1159، ط: شركة مكتبة ومطبعة مصطفى البابي الحلبي - مصر)</span></p><p class=""indent"" style=""text-align:left;""><span class=""ur_writing"">فقط واللہ اعلم</span></p></p>",144310100611,banuri,"('حقوق و آدابِ معاشرت', 'huqooq-muashret')","('حقوق', 'bahmi-huqooq')","('میاں ، بیوی کے حقوق', 'mian-biwi-k-huqooq')"
20-03-2023,https://www.banuri.edu.pk/readquestion/12c198d66ed91460441b93d860a5e5f8-144408102331/20-03-2023,قومی بچت اسکیم میں سرمایہ کاری کا حکم,میری والدہ جو کہ بیوہ ہیں، تعلیمی اخراجات اٹھانے کی نیت سے اگر اپنے پیسے قومی بچت سکیم کے ادارے میں کچھ رقم منافع حاصل کرنے کے لیے رکھواتی ہیں تو کیا اس کو استعمال کرنا شرعاً ممنوع ہے؟ واضح رہے کہ وہ بتاتے نہیں یہ منافع ہم کون سے کاروبار میں لگاکر کر دے رہے ہیں، والدہ کو پنشن ملتی ہے اور میں ملازمت کرتا ہوں اور ہم قومی بچت سے اس لیے منافع لینا چاہ رہے ہیں کہ میرا بھائی جو کیڈٹ کالج میں پڑھتا ہے اس کی ساڑھے تین لاکھ روپے سالانہ فیس جاتی ہے اس کی فیس جاتی رہے اور ہمارے اخراجات بھی متاثر نہ ہوں۔,"<p><p style=""text-align:justify;"">قومی بچت اسکیم سے حاصل ہونے والا نفع شرعاً سود ہے،اس لیے کہ  قومی بچت اسکیم کے ذریعہ جو سرمایہ کاری کی جاتی اس میں شرعی اصولوں کی رعایت نہیں کی جاتی، جو رقم اس مد میں جاتی ہے، اس کی حیثیت قرض کی ہوتی ہے اور اس پر جو منافع ملتا ہے  وہ سود ہے؛  اس لیے نیشنل سیونگ میں سرمایہ کاری جائز نہیں ہے، اور اس کا نفع حلال نہیں ہے ۔</p><p style=""text-align:justify;"">تعلیمی اخراجات پورے کرنے کے لیے کوئی حلال اور جائز ذریعۂ آمدن اختیار کیا جائے اور سود اور اس کے شائبے سے احتراز کیا جائے، تعلیمی اخراجات مکمل نہ ہونے کی وجہ سے اگر تعلیم نامکمل رہ جائے تو آخرت میں اس کا کوئی وبال نہیں ہوگا لیکن اگر سود لے کر تعلیمی اخراجات پورے کرلیے گئے تو تعلیم تو مکمل ہوجائے گی مگر آخرت میں سود کا وبال ہوگا، لہذا چند روزہ دنیوی زندگی کے فائدے کے لیے اپنی آخرت (جو کہ دائمی ہے) خراب کرناعقل مندی نہیں ہے۔ </p><p style=""text-align:justify;"">مزید تفصیل اور اس کے متبادل طریقوں سے متعلق تفصیل کے لیے  جامعہ کی ویب سائٹ پر شائع شدہ فتوی نمبر : 144108200631 ملاحظہ فرمائیں، جس کا لنک درج ذیل ہے:</p><p style=""text-align:justify;""><a href=""https://www.banuri.edu.pk/readquestion/qomi-bacht-scheem-ka-munafa-haram-he-to-na-tajur-be-kar-retired-aadmi-kia-kare-144108200631/04-04-2020"">قومی بچت اسکیم کا منافع حرام ہے تو ناتجربہ کار ریٹائرڈ آدمی کیا کرے؟</a></p><p class=""indent"" style=""text-align:left;"">فقط واللہ اعلم</p></p>",144408102331,banuri,"('معاملات', 'muamlat')","('سود / بینکاری / انشورنس / شیئرز', 'sood-bankari-insurance-shares')","('متفرقات سود', 'mutafarriqat-e-sood')"
