issued_at,link,title,question,answer,fatwa_number,dar_ul_ifta,kitab,bab,fasal
04-04-2023,https://www.banuri.edu.pk/readquestion/mu-mai-aansoo-dakhil-honay-ke-soorat-mai-rozy-ka-hukum-144409101199/04-04-2023,منہ میں آنسو داخل ہونے کی صورت میں روزے کاحکم,سائنس کہتی ہے کہ آنسو آ نکھ میں بننے کے بعد براستہ ناک گلے میں اترتے ہیں یعنی یہ تحقیق سے ثابت ہے ، اب سوال یہ ہے کہ اگر روزے میں انسان کے آنسو منھ میں آئے بغیر براہِ راست  گلے میں اتریں اور  منھ میں داخل  نہ ہوئے ہوں، ( واضح رہے کہ ایک بھی آنسو منھ میں نہ گیا ہو یعنی منھ کے راستے حلق میں نہ پہنچے ہوں) تو پھر ایسی صورت میں کیا روزہ  ٹوٹ جاتا ہے؟,"<p><p style=""text-align:justify;""><span lang=""ar-sa"" xml:lang=""ar-sa"">واضح رہےکہ  انسان کو شریعت کی پابندی کا مکلف بنایاگیاہے ،سائنسی تحقیقات کا نہیں ،شریعت چوں کہ ظاہر پر حکم لگاتی ہے ،لہذا آنسو بننے کے بعد اگر براہ راست حلق میں اتر جائیں(منہ میں آئے بغیر )تواس سے روزہ نہیں ٹوٹے گا، اور  اگر منہ کے راستے حلق میں اترے تو  ایک دو قطروں سے تو روزہ فاسدنہ ہوگا،اور اگربہت زیادہ آنسو منہ  میں جمع ہو گئے اس طرح  کہ اس کی نمکینی منہ میں محسوس ہو پھر اس ان کو نگل لیا تو  روزہ  فاسد  ہوجائے گا۔</span></p><p><span lang=""ar-sa"" xml:lang=""ar-sa"">کنزالعمال میں ہے:</span></p><p class=""indent"" style=""text-align:justify;""><span class=""ar_writing"" lang=""ar-sa"" xml:lang=""ar-sa"">""‌لقد ‌تركتكم على البيضاء ليلها كنهارها لا يزيغ عنها بعدي إلا هالك ومن يعش منكم فسيرى اختلافا كثيرا فعليكم بما عرفتم من سنتي وسنة الخلفاء المهديين الراشدين وعليكم بالطاعة وإن كان عبدا حبشيا عضوا عليها بالنواجذ فإنما المؤمن كالجمل الأنف حيثما قيد انقاد"". (حم طب عن العرباض)."" </span></p><p class=""indent"" style=""text-align:left;""><span class=""ar_writing"" lang=""ar-sa"" xml:lang=""ar-sa"">(‌‌الكتاب الأول من حرف الهمزة: في الإيمان والإسلام،‌‌الباب الثاني: في الاعتصام بالكتاب والسنة،٢١٢/١،ط:مؤسسة الرسالة)</span></p><p><span lang=""ar-sa"" xml:lang=""ar-sa"">فتاویٰ عالمگیری میں ہے:</span></p><p class=""indent"" style=""text-align:justify;""><span class=""ar_writing""><span lang=""ar-sa"" xml:lang=""ar-sa"">""</span><span lang=""ar-sa"" xml:lang=""ar-sa"">الدموع اذا دخلت فم الصائم ان كان قليلا كالقطرة والقطرتين او نحوها لا يفسد صومه وان كان كثيرا حتى وجد ملوحته في جميع فمه ، واجتمع شيء كثير فابتلعه يفسد صومه، و كذا عرق الوجه اذا دخل فم الصائم كذا في الخلاصة.""</span></span></p><p class=""indent"" style=""text-align:left;""><span class=""ar_writing""><span lang=""ar-sa"" xml:lang=""ar-sa"">‌‌(كتاب الصوم،‌‌النوع الأول ما يوجب القضاء دون الكفارة،٢٠٢/١،ط :</span>دارالفكر بيروت وغيرها)</span></p><p><span lang=""ar-sa"" xml:lang=""ar-sa"">فتاوی شامی میں ہے:</span></p><p class=""indent"" style=""text-align:justify;""><span class=""ar_writing"" lang=""ar-sa"" xml:lang=""ar-sa""><span lang=""ar-sa"" xml:lang=""ar-sa"">""وفي الامداد عن خط المقدسي أن القطرة لقلتها لا يجد طعمها في الحلق لتلاشيها قبل الوصول ، ويشهد لذلك مافي الواقعات للصدر الشهيد : إذا دخل الدمع في فم الصائم إن كان قليلا نحو القطرة أو القطرتين لايفسد صومه لأن التحرز عنه غير</span><span lang=""ar-sa"" xml:lang=""ar-sa""> </span><span lang=""ar-sa"" xml:lang=""ar-sa"">ممكن،</span><span lang=""ar-sa"" xml:lang=""ar-sa"">و إن كان كثيرا حتى وجد ملوحته في جميع فمه وابتلعه فسد صومه، و كذا الجواب في عرق الوجه اه. ملخصا.""</span></span></p><p class=""indent"" style=""text-align:left;""><span class=""ar_writing"" lang=""ar-sa"" xml:lang=""ar-sa""><span lang=""ar-sa"" xml:lang=""ar-sa"">(‌‌كتاب الصوم،‌‌باب ما يفسد الصوم وما لا يفسده،٤٠٤/٢،ط:دار الفكر - بيروت)</span></span></p><p class=""indent"" style=""text-align:left;""><span lang=""ar-sa"" xml:lang=""ar-sa""><span lang=""ar-sa"" xml:lang=""ar-sa"">فقط والله اعلم</span></span></p></p>",144409101199,banuri,"('روزہ', 'soum')","('روزہ توڑنے والی چیزیں', 'roza-torne-wali-chezen')","('غذا اور دوا کے علاوہ اشیاء سے روزہ ٹوٹنا', 'giza-aur-dawa-ke-ilawa-ashya-se-roza-totna')"
06-04-2023,https://www.banuri.edu.pk/readquestion/sdaqa-e-fitr-ada-na-karny-par-gunah-ka-bayan-144409101346/06-04-2023,صدقہ فطر ادا نہ کرنے پر گناہ کا بیان,صدقہ فطر ادا نہ کر نے سے گناہ ہوگا؟,"<p><p style=""text-align:justify;""><span class=""ur_writing"">صدقہ فطر ادا کرنا واجب ہے، لیکن عید کے دن عید گاہ جانے سے پہلے پہلے صدقہ فطر ادا کرلینا مستحب  ہے، البتہ اگر کسی نے عیدگاہ جانے سے پہلے یا عید کے پہلے دن ادا نہیں کیا،  تب بھی صدقہ فطر ادا نہ کرنے پر گناہ گار نہیں کہلائے گا، وجوب ذمہ پر رہے گا ،اور جب بھی ادا کرے گا ،تو صدقہ فطر ادا ہوجائے گا، اور صدقہ فطر کی ادائیگی کا ثواب بھی ملے گا،  اس کے علاوہ اگر  زندگی میں  صدقہ فطر ادا نہیں کیا، تو اگر وصیت کی ہے،تو  ایک تہائی  سے ادا کرنا ضروری ہے،اور  اگر  وصیت نہیں کی تو  ورثاء  اجتماعی یا انفرادی طور پر میت کی طرف سے ادا کر سکتے ہیں،اور یہ میت پر احسان ہوگا،اور اگر ورثاء بھی ادا نہ کرے ،تو   گناہ گار ہو گا،اور  ایک واجب عمل    کے چھوڑنے پر  جتنا گناہ ہوتا ہے اتنا گناہ  ملے گا۔</span></p><p style=""text-align:justify;""><span class=""ur_writing"">رد المحتار میں ہے:</span></p><p class=""indent"" style=""text-align:justify;""><span class=""ar_writing"">""وأمر بها في السنة التي فرض فيها رمضان قبل الزكاة، وكان عليه الصلاة والسلام يخطب قبل الفطر بيومين يأمر بإخراجها، ذكره الشمني، (تجب) وحديث «فرض رسول الله صلى الله عليه وسلم زكاة الفطر» معناه قدر للإجماع على أن منكرها لايكفر (موسعاً في العمر) عند أصحابنا، وهو الصحيح، بحر عن البدائع معللاً بأن الأمر بأدائها مطلق الزكاة على قول كما مر.</span></p><p class=""indent"" style=""text-align:justify;""><span class=""ar_writing""> (قوله: وهو الصحيح) هو ما عليه المتون بقولهم: وصح لو قدم أو أخر (قوله: مطلق) أي عن الوقت فتجب في مطلق الوقت وإنما يتعين بتعيينه فعلاً أو آخر العمر، ففي أي وقت أدى كان مؤدياً لا قاضياً كما في سائر الواجبات الموسعة غير أن المستحب قبل الخروج إلى المصلى؛ لقوله عليه الصلاة والسلام: «أغنوهم عن المسألة في هذا اليوم» بدائع، (قوله: كما مر) عند قول المتن: وافتراضها عمري إلخ (قوله: جاز) في الجوهرة: إذا مات من عليه زكاة أو فطرة أو كفارة أو نذر لم تؤخذ من تركته عندنا إلا أن يتبرع ورثته بذلك وهم من أهل التبرع ولم يجيزوا عليه وإن أوصى تنفذ من الثلث. اهـ. (قوله: وقيل: مضيقاً) مقابل الصحيح، وهو قول الحسن بن زياد وقت أدائها يوم الفطر من أوله إلى آخره، فإذا لم يؤدها حتى مضى اليوم سقطت كالأضحية، بدائع، ومثله في شروح الهداية وغيرها، ورجح المحقق ابن الهمام في التحرير أنها من قبيل المقيد بالوقت لا المطلق؛ لقوله عليه الصلاة والسلام: «أغنوهم في هذا اليوم عن المسألة»، فبعده قضاء، وتبعه العلامة ابن نجيم في بحره، لكنه قال في شرحه على المنار: إنه ترجيح لما قابل الصحيح. اهـ.قلت: والظاهر أن هذا قول ثالث خارج عن المذهب؛ لأن وقوعها قضاء بمضي يومها غير القول بسقوطها به. وقد رده العلامة المقدسي بأنهم كانوا يعجلون في زمنه صلى الله عليه وسلم وأنه كان بإذنه وعلمه صلى الله عليه وسلم كما قاله ابن الهمام نفسه، فدل ذلك على عدم التقييد باليوم؛ إذ لو تقيد به لم يصح قبله كما في الصلاة وصوم رمضان والأضحية. اهـ.وما قيل في الجواب: إنه تعجيل بعد وجود السبب فيجوز كتعجيل الزكاة بعد ملك النصاب، فهو مؤكد للاعتراض لدلالته على جواز التعجيل وعلى عدم التوقيت إذ لو كان مؤقتاً لم يجز تعجيله قبل وقته وإن وجد سببه؛ لأن الوقت شرطه كما لايجوز تعجيل الحج قبل وقته وإن وجد سببه وهو البيت، على أن قياس تعجيل الفطرة على الزكاة لا يصح؛ لأن حكم الأصل مخالف للقياس كما سنذكره عن الفتح، فافهم.""</span></p><p class=""indent"" style=""text-align:left;""><span class=""ar_writing"">(كتاب الزكاة،باب صدقة الفطر، ج:2 ص:358 ط:سعید)</span></p><p class=""indent"" style=""text-align:left;""><span class=""ar_writing"">فقط واللہ اعلم</span></p></p>",144409101346,banuri,"('زکات', 'zakat')","('صدقہ فطر', 'sadqa-fitr')","('صدقہ فطر کی ادائیگی', 'sadaqa-fitr-ki-adaegi')"
29-03-2023,https://www.banuri.edu.pk/readquestion/kya-lip-tinting-ka-istimal-karna-sheran-jaiz-hai-144409100604/29-03-2023,کیاہونٹ ٹنٹ Lip tinting کا استعمال کرنا شرعاً جائز ہے؟,ہونٹ ٹنٹ(Lip tinting) کا کیا حکم ہے؟ کیا یہ جائز ہے؟,"<p><p style=""text-align:justify;"">ہونٹوں کو رنگنے کے لیے استعمال کیا جانے والا مائع یا جیل نما ایک  کاسمیٹک پروڈکٹ ""ہونٹ ٹنٹ""(lip tinting) جس کے رنگ کا داغ لپ اسٹک سے زیادہ دیر تک رہتا ہے،اس کے اجزاء میں اگر ناپاک چیز شامل ہو تو عورتوں کے لیے اس کا لگانا جائز  نہیں ہے، اوراگر ناپاک چیز شامل نہ ہو تو عورتوں کے لیےاس کا لگانا جائز ہے۔باقی مذکورہ ""ہونٹ ٹنٹ""(lip tinting) کی ماہیت ایسی ہو کہ وہ جلد تک پانی پہنچنے میں رکاوٹ بنے، تو اس کو اتارے بغیر وضو  اور غسل صحیح نہیں ہوگا،اوراگر""ہونٹ ٹنٹ""(lip tinting)کی ماہیت ایسی ہو کہ جلد تک پانی پہنچنے میں رکاوٹ نہ بنے ، تو اسے اتارے بغیر بھی وضو  اور غسل درست ہوجائے گا۔</p><p style=""text-align:justify;"">فتاوی شامی میں ہے:</p><p class=""indent"" style=""text-align:justify;""><span class=""ar_writing"">""وكذا الزيت لو اختلط مع ودك الميتة أو الخنزير لا ينتفع به على كل حال إلا إذا غلب الزيت، لكن لا يحل أكله بل يستصبح به أو يبيعه مع بيان عيبه أو يدبغ به الجلود ويغسلها لأن المغلوب تبع للغالب ولا حكم للتبع"".</span></p><p class=""indent"" style=""text-align:left;""><span class=""ar_writing"">(كتاب الخنثى،مسائل شتى،ج:6۔ص:736،ط: سعيد)</span></p><p style=""text-align:justify;""><span class=""ar_writing"">وفيه ايضاً:</span></p><p class=""indent"" style=""text-align:justify;""><span class=""ar_writing"">.ولا یمنع الطہارة ونیم وحناء ودرن ۔۔۔۔۔وقیل: إن صلبًا منع وہو الأصح"".</span></p><p class=""indent"" style=""text-align:justify;""><span class=""ar_writing"">""(قوله: إن ‌صلبا) بضم الصاد المهملة وسكون اللام وهو الشديد حلية: أي إن كان ‌ممضوغا مضغا متأكدا، بحيث تداخلت أجزاؤه وصار له لزوجة وعلاكة كالعجين شرح المنية؛ لامتناع نفوذ الماء مع عدم الضرورة والحرج "".</span></p><p class=""indent"" style=""text-align:left;""><span class=""ar_writing"">(كتاب الطهارة،فرض الغسل،ج:1،ص154،ط:سعيد)</span></p><p style=""text-align:justify;"">المحیط البرہانی میں ہے:</p><p class=""indent"" style=""text-align:justify;""><span class=""qr_writing ar_writing"">""وكذلك الزيت إذا وقع فيه ودك الميت، فإن كان الزيت غالباً جاز بيعه، وإن كان الودك غالباً لم يجز، والمراد من الانتفاع حال عليه الحلال الانتفاع في غير الأبدان، وأما في الأبدان فلا يجوز الانتفاع به"".</span></p><p class=""indent"" style=""text-align:left;""><span class=""ar_writing"">(كتاب البيع،الفصل السادس:فيما يجوز ومالايجوزبيعه،ج:6،ص:350،ط:دار الكتب العلمية)</span></p><p style=""text-align:justify;"">فتاوی عالمگیری میں ہے:</p><p class=""indent"" style=""text-align:justify;""><span class=""ar_writing"">""لو كان عليه جلد سمك او خبز ممضوغ قدجف فتوضا ولم يصل الماء إلى ماتحته لم يجز لأن التحرز عنه ممكن، كذا فى المحيط "".</span></p><p class=""indent"" style=""text-align:left;""><span class=""ar_writing"">كتاب الطهارة،الفصل الأول في فرائض الوضوء،ج:1،ص:5،ط: دار الفكر)</span></p><p style=""text-align:justify;"">شرعی غذائی احکام میں ہے:</p><p class=""indent"" style=""text-align:justify;"">""اگر مرکب میں نجس شامل ہے تو پورا مرکب نجس ہے اور اس کا خوردنی استعمال جائز نہیں ۔اگر نجاست مغلوب ہے تو اس سے انتفاع جائز ہے ،مگر بدن پر اس کا استعمال جائز نہیں ہے(ص:122)"".</p><p class=""indent"" style=""text-align:left;""><span class=""ar_writing"">فقط واللہ اعلم</span></p></p>",144409100604,banuri,"('حظر و اباحت', 'mamnooaat-mubahat')","('زیب و زینت', 'zayb-o-zeenat')","('زیب و زینت کی اشیاء', 'zaieb-o-zeenat-ki-ashya')"
30-03-2023,https://www.banuri.edu.pk/readquestion/rozey-ki-halat-me-fahash-film-dekhney-ki-waja-sey-inzal-ka-hukum-144409100747/30-03-2023,روزے کی حالت  میں فحش فلم دیکھنے کی وجہ سے انزال کا حکم,روزے کی حالت میں اگر فحش فلم دیکھنے سے انزال ہو جائے توکیا روزہ ٹوٹ جائےگا؟,"<p><p style=""text-align:justify;"">واضح رہے کہ فلم دیکھنا گناہ ہے،اور فحش فلم دیکھنا دہرا گناہ ہے ،اور یہ دونو ں ناجائز کام اگر رمضان میں ہو تو زیادہ گناہ ہے اور روزے کے اجروثواب ختم کرنے کاذریعہ ہے ،کیوں کہ جس طرح رمضان میں نیکیوں کا ثواب زیادہ ہے اس طرح اس مبارک مہینے میں گناہ پر پکڑ کا خطرہ بھی زیادہ ہے،اس لیے اگر  واقعتاً کسی سے مذکورہ فعل سرزد ہوا ہوتو اس کو صدقِ دل سے توبہ واستغفار کرنا چاہیے، البتہ جہاں تک روزےکی بات ہے تو  اگر انزال میں  اپنے  عمل کا دخل نہ تھا، صرف دیکھنے سے ہی انزال ہوگیا تھا مشت زنی وغیرہ شامل نہ تھی ،تو اس صورت   میں روزہ نہیں ٹوٹتا، بصورتِ دیگر روزہ ٹوٹ جائے گا۔</p><p style=""text-align:justify;"">تحفۃ الفقہاء میں ہے:</p><p class=""indent"" style=""text-align:justify;""><span class=""ar_writing"">""وكذلك لو نظر إلى فرج امرأة شهوة فأمنى أو تفكر فأمنى لايفسد صومه؛ لأنه حصل الإنزال لا بصنعه فلايكون شبيه الجماع لا صورةً ولا معنىً.""</span></p><p class=""indent"" style=""text-align:left;""><span class=""ar_writing"">(‌‌كتاب الصوم، ج:1، ص:353، ط: دار الكتب العلمية)</span></p><p>بدائع الصنائع میں ہے:</p><p class=""indent"" style=""text-align:justify;""><span class=""ar_writing"">""ولو ‌نظر إلى امرأة وتفكر فأنزل لم يفطره...ولنا أنه لم يوجد الجماع لا صورة ولا معنى لعدم الاستمتاع بالنساء فأشبه الاحتلام بخلاف المباشرة.""</span></p><p class=""indent"" style=""text-align:left;""><span class=""ar_writing"">(كتاب الصوم، فصل أركان الصيام، ج:2، ص:239، ط: دار إحياء التراث العربي)</span></p><p>تبیین الحقائق میں ہے:</p><p class=""indent"" style=""text-align:justify;""><span class=""ar_writing"">""وأما إذا أنزل بنظر فلعدم المباشرة وقال مالك إن أنزل بالنظرة الأولى لا يفسد صومه وإن أنزل بالثانية يفسد لقوله - عليه الصلاة والسلام - لعلي «لا تتبع النظرة النظرة فإنما الأولى لك والأخرى عليك» ولأن النظرة الأولى تقع بغتة فلا يستطاع الامتناع عنها بخلاف الثانية ولنا أن النظر مقصور عليه غير متصل بها فصار كالإنزال بالتفكر والمراد بما روي في حق الإثم ولأن ما يكون مفطرا لا يشترط التكرار فيه وما لا يكون مفطرا لا يفطر بالتكرار.""</span></p><p class=""indent"" style=""text-align:left;""><span class=""ar_writing"">(كتاب الصوم، باب ما يفسد الصوم وما لا يفسده، ج:1، ص:322، ط: دار الكتاب الإسلامي)</span></p><p> البحر الرائق میں ہے:</p><p class=""indent"" style=""text-align:justify;""><span class=""ar_writing"">""أنزل بنظر) أي لا يفطر...أطلق في النظر فشمل ما إذا ‌نظر إلى وجهها أو فرجها كرر النظر أو لا.""</span></p><p class=""indent"" style=""text-align:left;""><span class=""ar_writing"">(كتاب الصوم، باب ما يفسد الصوم وما لا يفسده، ج:2، ص:293، ط: دار الكتاب الإسلامي)</span></p><p>فتاوی شامی میں ہے:</p><p class=""indent"" style=""text-align:justify;""><span class=""ar_writing"">""(أو احتلم أو أنزل بنظر) ولو إلى فرجها مرارا (أو بفكر) وإن طال مجمع...(لم يفطر) جواب الشرط.""</span></p><p class=""indent"" style=""text-align:justify;""> </p><p class=""indent"" style=""text-align:left;""><span class=""ar_writing"">‌‌(كتاب الصوم، ‌‌باب ما يفسد الصوم وما لا يفسده، ج:2، ص:394ـ400، ط: سعيد)</span></p><p class=""indent"" style=""text-align:left;""><span class=""ar_writing"">فقط والله أعلم</span></p></p>",144409100747,banuri,"('روزہ', 'soum')","('روزہ توڑنے والی چیزیں', 'roza-torne-wali-chezen')","('روزہ نہ توڑنے والی چیزیں', 'roza-na-torne-wali-chezen')"
02-04-2023,https://www.banuri.edu.pk/readquestion/taraweeh-ki-jamat-ka-hukum-144409101048/02-04-2023,تراویح کی جماعت کا حکم,تراویح کے لئے جماعت  ضروری ہے؟,"<p><p style=""text-align:justify;"">مردوں کے لیے تراویح کی نماز جماعت سے پڑھنا سنت مؤکدہ علی الکفایہ ہے،  جو مرد انفرادی تراویح پڑھے گا  اس کی تراویح کی سنت تو ادا ہوجائے گی، لیکن جماعت کے ثواب سے  محروم ہے گا،اور عورتوں  کے لیے جماعت  سنتِ مؤکدہ  کفایہ نہیں ہے، بلکہ عورتوں کے لیے گھر میں تنہا  پڑھنے میں زیادہ ثواب ہے۔</p><p style=""text-align:justify;"">فتاوی شامی  میں ہے:</p><p class=""indent"" style=""text-align:justify;""><span class=""ar_writing"">""(والجماعة فيها سنة على الكفاية) في الأصح، فلو تركها أهل مسجد أثموا إلا لو ترك بعضهم.</span></p><p class=""indent"" style=""text-align:justify;""><span class=""ar_writing"">(قوله: والجماعة فيها سنة على الكفاية إلخ) أفاد أن أصل التراويح سنة عين، فلو تركها واحد كره، بخلاف صلاتها بالجماعة فإنها سنة كفاية، فلو تركها الكل أساءوا؛ أما لو تخلف عنها رجل من أفراد الناس وصلى في بيته فقد ترك الفضيلة، وإن صلى أحد في البيت بالجماعة لم ينالوا فضل جماعة المسجد، وهكذا في المكتوبات، كما في المنية، وهل المراد أنها سنة كفاية لأهل كل مسجد من البلدة أو مسجد واحد منها أو من المحلة؟ ظاهر كلام الشارح الأول. واستظهر ط الثاني. ويظهر لي الثالث، لقول المنية: حتى لو ترك أهل محلة كلهم الجماعة فقد تركوا السنة وأساءوا. اهـ"".  </span></p><p class=""indent"" style=""text-align:left;""><span class=""ar_writing"">(2/ 45، باب الوتر والنوافل، ط: سعید)</span></p><p class=""indent"" style=""text-align:left;""><span class=""ar_writing"">فقط والله أعلم</span></p></p>",144409101048,banuri,"('نماز', 'salat')","('تراویح', 'taraweeh')","('تراویح کی جماعت', 'taraveeh-ki-jamaat')"
