issued_at,link,title,question,answer,fatwa_number,dar_ul_ifta,kitab,bab,fasal
02-04-2023,https://www.banuri.edu.pk/readquestion/nikah-khwan-ka-khud-gawah-banna-awar-dosra-gawah-mawjod-na-honey-ka-hukum-144409101067/02-04-2023,نكاح خواں کا خود گواہ بننا اور دوسرا گواہ موجود نہ ہونے کا حکم,کیا نکاح پڑھانے والا مولانا صاحب نکاح میں گواہ بن سکتا ہے ،اس طور پر کہ ایک گواہ نکاح پڑھانے والا(مولانا صاحب) ہو اور دوسرا دلہا اور دلہن ایک دوسرے کے لیے گواہ بن جائے؟اس طرح نکاح ہوسکتا ہے؟,"<p><p style=""text-align:justify;"">واضح رہے کہ شرعاً  نکاح کے  منعقد ہونے کےلیےعاقدین (دلہا اور دلہن) کے علاوہ دو مسلمان مرد گواہو ں یا ایک مرد اور دوعورتوں کے سامنے زبان سے ایجاب وقبول کرنا ضروری ہے، بغیر گواہوں کے ایجاب وقبول نکاح کے لیے کافی نہیں ہے؛ اس سے شرعاً نکاح منعقدنہیں ہوتا، اور  اگر نکاح خواں عاقدین (دلہا اور دلہن )میں سے کسی کا وکیل نہ ہو تو خود گواہ بن سکتا ہے،  صورتِ مسئولہ میں  ایک گواہ نکاح خواں ہےلیکن دوسرا گواہ موجود نہیں ہے اور دلہا ، دلہن  ایک دوسرے کے لیے گواہ نہیں بن سکتے ہیں ، لہذا یہ نکاح  شرعاً منعقد نہیں ہوگا۔</p><p>بدائع الصنائع میں ہے:</p><p class=""indent"" style=""text-align:justify;""><span class=""ar_writing"">""ومنها العدد فلا ينعقد النكاح بشاهد واحد لقوله: - صلى الله عليه وسلم - «لا نكاح إلا بشهود» وقوله: «لا نكاح إلا بشاهدين».""</span></p><p class=""indent"" style=""text-align:left;""><span class=""ar_writing"">(كتاب النكاح، فصل النكاح بشاهد واحد، ج:2، ص:255، ط: دار الكتب العلمية)</span></p><p style=""text-align:justify;"">تبیین الحقائق میں ہے:</p><p class=""indent"" style=""text-align:justify;""><span class=""ar_writing"">""قال - رحمه الله - (عند حرين أو حر وحرتين عاقلين بالغين مسلمين، ولو فاسقين أو محدودين أو أعميين أو ابني العاقدين) يعني ينعقد بتلك الألفاظ التي تقدم ذكرها إذا وجدت عند رجلين حرين أو رجل حر وامرأتين حرتين يعني به حضور الشهود ولا ينعقد إلا بحضورهم.""</span></p><p class=""indent"" style=""text-align:left;""><span class=""ar_writing"">(كتاب النكاح، شروط النكاح وأركانه، ج:2، ص:98، ط: دار الكتاب الإسلامي</span></p><p style=""text-align:justify;"">فتاوی عالمگیریہ میں ہے:</p><p class=""indent"" style=""text-align:justify;""><span class=""ar_writing"">""والأصل في هذا الباب أن كل من يصلح أن يكون وليا في النكاح بولاية نفسه صلح أن يكون شاهدا، ومن لا فلا.كذا في الخلاصة ‌ويشترط ‌العدد فلا ينعقد النكاح بشاهد واحد هكذا في البدائع ولا يشترط وصف الذكورة حتى ينعقد بحضور رجل وامرأتين، كذا في الهداية ولا ينعقد بشهادة المرأتين بغير رجل وكذا الخنثيين إذا لم يكن معهما رجل هكذا في فتاوى قاضي خان.""</span></p><p class=""indent"" style=""text-align:left;""><span class=""ar_writing"">(كتاب النكاح، الباب الأول في تفسير النكاح شرعا وصفته وركنه وشرطه وحكمه، ج:1، ص:267، ط: دار الفكر)</span></p><p>فتاوی شامی میں ہے:</p><p class=""indent"" style=""text-align:justify;""><span class=""ar_writing"">""‌والأصل عندنا أن كل من ملك قبول النكاح بولاية نفسه انعقد بحضرته...(قوله: ‌والأصل عندنا إلخ) عبارة النهر قال الإسبيجابي: ‌والأصل أن كل من صلح أن يكون وليا فيه بولاية نفسه صلح أن يكون شاهدا فيه.""</span></p><p class=""indent"" style=""text-align:left;""><span class=""ar_writing"">(‌‌كتاب النكاح، ج:  3، ص:24، ط: سعيد)</span></p><p class=""indent"" style=""text-align:left;""><span class=""ar_writing"">فقط والله أعلم</span></p></p>",144409101067,banuri,"('نکاح', 'nikah')","('نکاح صحیح', 'nikah-e-sahih')","('نکاح کے گواہ', 'nikah-k-gawah')"
02-04-2023,https://www.banuri.edu.pk/readquestion/fidya-dene-se-aajiz-shakhs-ka-hukum-144409101070/02-04-2023,فدیہ  دینے  سے  عاجز  شخص  کا  حکم,اگر کوئی شیخ فانی روزے کی فدیہ دینے کی بھی طاقت نہیں رکھتا تو اس صورت میں کیا کرنا چاہیے؟,"<p><p style=""text-align:justify;"">اگر  کوئ  شیخ  فانی  فدیہ  ادا  کرنے  پر  بھی  قادر  نہ  ہو  تو  اس  کیلئے  حکم  یہ  ہے  کہ  جب  تک  روزو  ں  کی  قضاء  یا  فدیہ  دینے  پر  قدرت  نہ  ہوجائے ،اللہ  تعالی  سے  توبہ  و  استغفار  کرتا  رہے ۔</p><p>الدر المختار شرح تنوير الأبصار  میں  ہے  :</p><p class=""indent"" style=""text-align:justify;""><span class=""ar_writing"">""(وللشيخ الفاني العاجز عن الصوم الفطر ويفدي) وجوبًا ولو في أول الشهر وبلا تعدد فقير كالفطرة لو موسرًا و إلا فيستغفر الله"".</span></p><p class=""indent"" style=""text-align:left;"">(ج نمبر ۲، ص نمبر ۴۲۷، مکتبہ و مطبعہ مصطفی الحلبی)</p><p>البحر الرائق شرح كنز الدقائق   میں  ہے  :</p><p class=""indent"" style=""text-align:justify;""><span class=""ar_writing"">""ولأن الفدية لاتجوز إلا عن صوم هو أصل بنفسه لا بدل عن غيره فجازت عن رمضان وقضائه والنذر، حتى لو نذر صوم الأبد فضعف عن الصوم لاشتغاله بالمعيشة له أن يطعم ويفطر، لأنه استيقن أن لايقدر على قضائه وإن لم يقدر على الإطعام لعسرته يستغفر الله تعالی"".</span></p><p class=""indent"" style=""text-align:left;"">(ج نمبر ۲، ص نمبر ۳۰۸، دار الکتب الاسلامی)</p><p class=""indent"" style=""text-align:left;""><span class=""ar_writing"">فقط  واللہ  اعلم</span></p></p>",144409101070,banuri,"('روزہ', 'soum')","('روزہ کی قضا، کفارہ اور فدیہ', 'roza-ki-qaza-kaffara-aur-fidya')","('روزہ کا فدیہ', 'roza-ka-fidya')"
12-03-2023,https://www.banuri.edu.pk/readquestion/begair-gawah-ke-nikah-phir-talaq-ka-hukm-144408101485/12-03-2023,بغیر گواہ کے نکاح پھر طلاق کا حکم,"میں نے ایک لڑکی کے ساتھ  میسج پر  مہرطے کیااور  اگلے دن  وائس میسج پر بغیر گواہ نکاح  کیا، میری نیت دھوکا دینے  کی تھی، میں نے فیک (جعلی) نکاح نامہ بنایا اور اس پہ خود دستخط کیااور خود مہر لکھا۔اس وقت میرا  ایک دوست میرے ساتھ موجود تھااس کو پتہ تھا کہ یہ دھوکہ ہے۔اس کے بعد میں دوسرے دوست کے گھر گیا اس کو بھی  جعلی نکاح نامے کے بارے میں بتایا اور یہ  کہ سب دھوکاہے۔پھر میں نےاس دوست کو مجبور کیا  کہ وائس میسج پر لڑکی کو  بولو   کہ ہمارا نکاح ہوگیا (دوست نے میرا نام نہیں لیا تھا ۔)اور میرے کہنے پر میرے دوست نے اس لڑکی کو وائس میسیج پر  3 دفعہ بولا کہ ہم نے اس لڑکے کو آپ کے ساتھ نکاح میں باندھا ۔اور  یہ بھی کہا کہ آپ وہاں سے وائس میسج پہ 3 دفعہ قبول ہے بولو ،پھر لڑکی نے وائس میسج پر قبول ہے، قبول ہے، قبول ہے بولا (لڑکی نے میرا نام نہیں لیا تھا)، اس کے 3 دن بعد میرا وہ دوست میرے ساتھ تھا اس سے چھپ کر میں نے لڑکی سے نکاح نامے پر جلدی جلدی خود دستخط لیا اب،اور  زبان سےکچھ  نہیں بولا  ۔ پھر کچھ دنوں بعد میں نے اس کو 3 طلاق شرط کی صورت میں دی: "" اگر تم نے اس سے بات کی تو تم مجھ پر 3 دفعہ طلاق ہوگی ""۔ کیا ہمارا نکاح اور طلاق ہوگئی  یا نہیں؟ کیا ابھی میں اس لڑکی سے نکاح کرسکتا ہوں؟ کیا نکاح کے بعد طلاق کی شرط کی کوئی حیثیت ہو گی؟ اگر نکاح کے بعد اس نے یہ کام کیا اس سے  نکاح تو ختم نہیں ہوگا؟","<p><p style=""text-align:justify;"">واضح رہے کہ     مسلمان کو دھوکا  دینا   حرام ہے  اور سخت گناہ ہے اور ایسے شخص  کے متعلق آپ ﷺ نے ارشاد فرمایا : ""<span class=""ar_writing"">من غشنا فليس منا ""</span>،  ترجمہ :"" جو ہمیں دھوکا دے وہ ہم میں سے نہیں  ""، نیز نکاح کے متعلق آپ ﷺ نے فرمایا :""<span class=""ar_writing"">أعلنوا النكاح</span>""،ترجمہ:""نکاح کا اعلان  کرو   ""،لہذا دھوکا  دیتے ہوئے،چھپ چھپا کر  نکاح کرنا   اللہ تعالی کی ناراضی  کا سبب ہے،   نکاح جو کہ سنت ہے اسے سنت طریقے سے کرنا چاہیے،نیز نکاح کے بغیر اجنبی لڑکی کے ساتھ تعلقات رکھنا بھی حرام ہے  ۔</p><p style=""text-align:justify;"">نیز واضح رہے کہ شرعی اعتبار  سے نکاح منعقد ہونے کے لیے  مجلس نکاح میں شرعی گواہان (دو عاقل بالغ مرد یا ایک مرد اوردو عورتوں )  کی موجودگی میں   لڑکا اور  لڑکی یا  ان کے وکیل کا ایجاب و قبول کرنا ضروری ہوتا ہے ، لہذا صورتِ مسئولہ  میں  ایک دو ست کی موجودگی میں    فون پر ایجاب و قبول کرنے میں مذکورہ دونوں شرائط نہ پائی جانے  کی وجہ سے نکاح نہیں ہوا تھا ،اور یہی حکم سائل کا نکاح  نامے پر چھپ کر     دستخط کرنے کا ہے ،چنانچہ جب نکاح ہی منعقد نہیں ہوا تو  مذکورہ معلق  طلاق بھی لغوہے ۔</p><p style=""text-align:justify;"">اب آئندہ سائل اگر مذکورہ لڑکی سے نکاح کرنا چاہتا ہے تو تمام شرائط و آداب کو ملحوظ رکھتے ہوئے کرسکتا ہے،اور  گزشتہ طلاق کی شرط پائے جانے سے نکاح میں کوئی فرق نہیں پڑے گا۔تاہم ملحوظ رہے کہ چھپ کر نکاح کرنے کے بجائے والدین کی رضامندی سے علی الاعلان نکاح کیا جائے۔</p><p>صحیح مسلم میں ہے :</p><p class=""indent""><span class=""ar_writing"">""حدثنا ‌قتيبة بن سعيد ، حدثنا ‌يعقوب، وهو ابن عبد الرحمن القاري ، (ح) وحدثنا ‌أبو الأحوص محمد بن حيان ، حدثنا ‌ابن أبي حازم كلاهما، عن ‌سهيل بن أبي صالح ، عن ‌أبيه ، عن ‌أبي هريرة أن رسول الله صلى الله عليه وسلم قال:  ‌من حمل علينا السلاح فليس منا، ومن ‌غشنا فليس منا .""</span></p><p class=""indent"" style=""text-align:left;""><span class=""ar_writing"">(‌‌كتاب الإيمان،‌‌باب قول النبي صلى الله عليه تعالى وسلم: من غشنا فليس منا،ج 1، ص69 ،رقم 101 ،ط :دار الطباعة العامرة)</span></p><p>سنن ترمزی میں ہے:</p><p class=""indent"" style=""text-align:justify;""><span class=""ar_writing"">""حدثنا ‌أحمد بن منيع، قال: حدثنا ‌يزيد بن هارون، قال: أخبرنا ‌عيسى بن ميمون الأنصاري ، عن ‌القاسم بن محمد ، عن ‌عائشة قالت: قال رسول الله صلى الله عليه وسلم: «‌أعلنوا هذا ‌النكاح واجعلوه في المساجد»، واضربوا عليه بالدفوف.</span><span class=""ar_writing"">هذا حديث غريب حسن في هذا الباب، وعيسى بن ميمون الأنصاري يضعف في الحديث، وعيسى بن ميمون الذي يروي عن ابن أبي نجيح التفسير هو ثقة.""</span></p><p class=""indent"" style=""text-align:left;""><span class=""ar_writing"">( ‌‌أبواب النكاح من رسول الله صلى الله عليه وسلم ، باب ما جاء في إعلان النكاح، ج2، ص384، رقم 1089، ط: دار الغرب الإسلامي)</span></p><p style=""text-align:justify;"">صحیح ابن حبان میں ہے :</p><p class=""indent"" style=""text-align:justify;""><span class=""ar_writing"">""أخبرنا عبد الله بن محمد الأزدي، حدثنا إسحاق بن إبراهيم، أخبرنا عبد الرزاق، أخبرنا معمر، عن ابن طاوس يعني عن أبيه، عن ابن عباس، ما رأيت شيئا أشبه باللمم مما قال أبو هريرة، قال رسول الله صلى الله عليه وسلم: ""كتب الله على ابن آدم حظه من الزنا، أدرك ذلك لا محالة: ‌فزنى ‌العين ‌النظر، وزنى اللسان النطق، والنفس تتمنى ذلك وتشتهي، ويصدق ذلك الفرج أو يكذبه.""</span></p><p class=""indent"" style=""text-align:left;""><span class=""ar_writing"">(‌‌القسم الثالث من أقسام السنن ،‌‌النوع الثالث والعشرون،‌‌ذكر وصف زنى ‌العين واللسان على ابن آدم،ج4، ص470، رقم 3787 ،ط: دار ابن حزم</span>)</p><p style=""text-align:justify;"">ہدایہ میں ہے :</p><p class=""indent"" style=""text-align:justify;""><span class=""ar_writing"">"" ولا ينعقد نكاح المسلمين إلا بحضور ‌شاهدين حرين عاقلين بالغين مسلمين رجلين أو رجل وامرأتين عدولا كانوا أو غير عدول أو محدودين في القذف.""</span></p><p class=""indent"" style=""text-align:left;""><span class=""ar_writing"">(كتاب النكاح ،ج1 ،ص185 ، ط:دار إحياء التراث العربي)</span></p><p>بدائع الصنائع میں ہے :</p><p class=""indent"" style=""text-align:justify;""><span class=""ar_writing"">""شرط الإنعقاد فنوعان.....(وأما) الذي يرجع إلى مكان العقد فهو إتحاد المجلس إذا كان العاقدان حاضرين وهو أن يكون الإيجاب والقبول في مجلس واحد حتى لو اختلف المجلس لا ينعقد النكاح.""</span></p><p class=""indent"" style=""text-align:left;""><span class=""ar_writing"">(كتاب النكاح، فصل شرائط الركن أنواع منها شرط الإنعقاد، ج2، ص232، ط: دار الكتب العلمية)</span></p><p style=""text-align:justify;"">بدائع الصنائع میں ہے :</p><p class=""indent"" style=""text-align:justify;""><span class=""ar_writing"">""(فصل) وأما الذي يرجع إلى المرأة فمنها الملك أو علقة من علائقه؛ فلا يصح الطلاق إلا في الملك أو في علقة من علائق الملك وهي عدة الطلاق أو مضافا إلى الملك</span>.""</p><p class=""indent"" style=""text-align:left;""><span class=""ar_writing"">(فصل في شرائط ركن الطلاق وبعضها يرجع إلى المرأة ، ج3، ص106، ط: دار الكتب العلمية)</span></p><p class=""indent"" style=""text-align:left;"">فقط واللہ اعلم</p></p>",144408101485,banuri,"('طلاق', 'talaaq')","('وقوع طلاق وعدم وقوع طلاق', 'wuqoo-e-talaq-o-adme-wuqoo-e-talaq')","('عدمِ وقوعِ طلاق', 'adme-wuqoo-e-talaq')"
02-04-2023,https://www.banuri.edu.pk/readquestion/inshirah-hana-zarwa-aur-yashfa-naam-rakhna-144409101084/02-04-2023,انشراح،حانہ،زروا اور یشفہ نام رکھنا,انشراح،حانہ،یشفہ اور زروا میں سےلڑکی کے لیے کون سا نام اچھا ہے؟,"<p><p style=""text-align:justify;"">1)لفظ انشراح عربی اور اردو دونوں میں مستعمل ہے،جس کا معنی ہےکشادگی،فرحت ،شگفتگی، اور کنایۃً یہ لفظ ،اللہ تعالیٰ کا کسی کا دل، حق کو قبول کرنے کے لیے کھول دینے کے لیے استعمال ہوتا ہے،لہٰذا یہ نام رکھنا درست ہے۔</p><p style=""text-align:justify;"">2)حانہ کا لفظ اردو میں تو بالکل مستعمل نہیں،ہاں عربی میں حانہ اس جگہ کو کہا جاتاہے جہاں شراب بیچی جاتی ہے،لہٰذا یہ نام رکھنادرست نہیں ہے۔</p><p style=""text-align:justify;"">3)یشفہ کا لفظ بھی اردو میں مستعمل نہیں اور عربی میں یشفہ ( آخر میں ہاء کے ساتھ)مستعمل نہیں بلکہ یشفیٰ(آخرمیں یاءمدہ کے ساتھ )مستعمل ہے،یہ فعل ہے،اس کےبجائے بہتر یہ ہے کہ""شفاء""نام رکھا جائے جس کے معنیٰ ہیں:صحتیابی،تندرستی اور اچھا ہونا۔</p><p style=""text-align:justify;"">4)'زروا' کا لفظ اردو اور عربی دونوں لغات میں نہیں مل سکا،ہاں عربی میں زروا کے بجائے' ذَِروۃ'( ذال کے زبر اور زیر دونوں کے ساتھ) موجود ہے،جس کے معنیٰ،مال و دولت،آسودگی اور بلندی کے آتے ہیں،لہٰذا یہ نام رکھا بھی شرعاً درست ہے۔</p><p style=""text-align:justify;"">باقی انشراح،شفاء اور ذروۃ میں سے جو نام باعتبارِ مطلب سمجھ آئے اور اچھا لگے وہ ہی رکھ لیا جائے،تاہم بہتر یہ ہے کہ بچوں اور بچیوں کے نام، انبیاء کرام علیہم الصلوات والتسلیمات،صحابہ،صحابیات رضوان اللہ علیہم اجمعین،تابعین اور دیگر بزرگوں کے نام پر رکھے جائیں۔</p><p style=""text-align:justify;"">تاج العروس میں ہے:</p><p class=""indent"" style=""text-align:justify;""><span class=""ar_writing"">""و من المجاز: شرح الشيءمثل قولهم: شرح الله صدره لقبول الخير يشرحه شرحا فانشرح، أي وسعه لقبول الحق فاتسع.""</span></p><p class=""indent"" style=""text-align:left;""><span class=""ar_writing"">(ص:503،ج:6،تحت لفظ:شرح،ط:دارإحياء التراث العربي)</span></p><p>وفیہ ایضاً:</p><p class=""indent"" style=""text-align:justify;""><span class=""ar_writing"">""والحانية: الخمر، منسوبة إلى الحانة. والحانة: موضع بيعها،وهو موضع الخمار؛ عن كراع.وقال أبو حنيفة: أظنها فارسية، وأن أصلها خانه.""</span></p><p class=""indent"" style=""text-align:left;""><span class=""ar_writing"">(ص:474،ج:34،تحت لفظ:حین،ط:دارإحياء التراث العربي)</span></p><p>وفیہ ایضاً:</p><p class=""indent"" style=""text-align:justify;""><span class=""ar_writing"">""الشفاء ، ككساء:الدواء ؛ وأصله البرء من المرض، ثم وضع موضع العلاج والدواء؛ ومنه قوله تعالى :فيه شفاء للناس.وقال الراغب: الشفاء من المرض موافاة شفاء السلامة، وصار اسما للبرء.""</span></p><p class=""indent"" style=""text-align:left;""><span class=""ar_writing"">(ص:382،ج:38،تحت لفظ:شفی،ط:دارإحياء التراث العربي)</span></p><p>وفیہ ایضاً:</p><p class=""indent"" style=""text-align:justify;""><span class=""ar_writing"">""ذروة: أي ثروة، وهي الجدة والمال.""</span></p><p class=""indent"" style=""text-align:left;""><span class=""ar_writing"">(ص:91،ج:38،تحت لفظ:ذرو،ط:دارإحياء التراث العربي)</span></p><p>وفیہ ایضاً:</p><p class=""indent"" style=""text-align:justify;""><span class=""ar_writing"">""وذروة الشيء، بالضم والكسر: أعلاه.""</span></p><p class=""indent"" style=""text-align:left;""><span class=""ar_writing"">(ص:87،ج:38،تحت لفظ:ذرو،ط:دارإحياء التراث العربي)</span></p><p class=""indent"" style=""text-align:left;""><span class=""ar_writing"">فقط واللہ أعلم</span></p></p>",144409101084,banuri,"('حظر و اباحت', 'mamnooaat-mubahat')","('نام، لقب، کنیت', 'asaami')","('ناموں کے معانی اور احکام', 'namoun-ke-mani-or-ahkaam')"
03-04-2023,https://www.banuri.edu.pk/readquestion/pasab-ka-kapro-par-lagnay-sa-gosa-ka-hokum-144409101091/03-04-2023,پیشاب کے کپڑوں پر لگنے سے غسل کا حکم,پیشاب کے قطرے نکلے لیکن جسم پر نہیں پڑے، صرف کپڑوں پر ہی لگے ہیں، اس صورت میں غسل واجب ہو گیا  ِیانہیں ؟,"<p><p style=""text-align:justify;""><span class=""ur_writing"">  صورت مسئولہ میں  سائل کے ذمہ غسل کرنالازم نہیں ہیں ،کیونکہ پیشاب کے قطرے جسم یاکپڑوں پر لگنے سے غسل لازم نہیں ہوتاہےبلکہ   اس جگہ کو دھونا اوروضو کر نا لازمی ہو تاہے،جہاں پیشاب لگا ہوا ہو۔</span></p><p style=""text-align:justify;""><span class=""ur_writing"">بدائع الصنائع""میں ہے:</span></p><p class=""indent"" style=""text-align:justify;""><span class=""ar_writing"">""(أما) الأول فالجنابة تثبت بأمور بعضها مجمع عليه، وبعضها مختلف فيه (أما) المجمع عليه فنوعان أحدهما خروج المني عن شهوة دفقا من غير إيلاج بأي سبب حصل الخروج كاللمس، والنظر، والاحتلام، حتى يجب ‌الغسل بالإجماع لقوله - صلى الله عليه وسلم - «الماء من الماء» ، أي: الاغتسال من المني، ثم إنما وجب غسل جمي""تع البدن بخروج المني.""</span></p><p class=""indent"" style=""text-align:left;""><span class=""ar_writing"">(كتاب الطهارة، ج:1، ص:36، ط:دارالكتب العلمية)</span></p><p style=""text-align:justify;""><span class=""ur_writing"">""تحفةالفقهاء""میں ہے:</span></p><p class=""indent"" style=""text-align:justify;""><span class=""ar_writing"">""أما الأول فنقول وجوب الغسل يتعلق بأحد معان ثلاثة الجنابة والحيض والنفاس.""</span></p><p class=""indent"" style=""text-align:left;""><span class=""ar_writing"">(كتاب الطهارة،1/2،ط:دارالكتب العلمية)</span></p><p class=""indent"" style=""text-align:left;""><span class=""ar_writing"">فقط واللہ أعلم</span></p></p>",144409101091,banuri,"('طہارت', 'taharat')","('وضو', 'wuzu')","('نواقض وضو', 'nawaaqz-e-wazu')"
