issued_at,link,title,question,answer,fatwa_number,dar_ul_ifta,kitab,bab,fasal
06-03-2023,https://www.banuri.edu.pk/readquestion/tanqeeh-144408100791/06-03-2023,تین طلاق  سے کم کی صورت میں تجدید ملک کا حکم,ایک شخص نے اپنی بیوی کو دو طلاق دے دی ،اس کے بعداس لڑکی نے دوسرے لڑکے سے نکاح کرلیا، اس دوسرے لڑکے نے بھی طلاق دےدی ،اس کے بعد پھر پہلے والےشخص سے نکاح کرلیا، اب یہ معلوم کرنا ہے کہ جس شخص نے پہلے دو طلاقیں دے دی تھی، آیا اس شخص کے پاس ایک طلاق کا حق باقی رہے گا،یا ازسرنو تین طلاقوں کا حق ہوگا؟,"<p><p style=""text-align:justify;"">واضح رہے کہ اگر کوئی شخص اپنی بیوی کو تین سے کم طلاقیں دے دے اور پھر وہ عورت عدت گزارنے کےبعد دوسرے شخص سے نکاح کرلے اور اس کے ساتھ ازدواجی تعلق قائم کرنے کے بعد اس سے طلاق لے اور اس کی عدت گزار کر پہلے شوہر سےد وبارہ نکاح کرلے تو اس صورت میں راجح  قول کے مطابق وہ پہلے شوہر کے پاس نئی ملکیت کے ساتھ آئے گی یعنی اس کو تین طلاقوں کا اختیار ہوگا اور اگر دوسرے شوہر کے ساتھ ازدواجی تعلق قائم  کرنے سے پہلے اس سے طلاق لے کر پہلے شوہر کے پاس آجائے تو اس صورت میں پہلے شوہر کو بالاتفاق صرف مابقیہ ایک طلاق کا حق حاصل ہوگا ۔</p><p style=""text-align:justify;"">ہدایہ مع فتح القدیر میں ہے :</p><p class=""indent"" style=""text-align:justify;""><span class=""ar_writing"">""(وإذا طلق الحرة تطليقة أو تطليقتين وانقضت عدتها وتزوجت بزوج آخر ثم عادت إلى الزوج الأول عادت بثلاث تطليقات ويهدم الزوج الثاني ما دون الثلاث كما ‌يهدم ‌الثلاث. وهذا عند أبي حنيفة وأبي يوسف رحمهما الله. وقال محمد - رحمه الله -: لا يهدم ما دون الثلاث)</span></p><p class=""indent"" style=""text-align:justify;""><span class=""ar_writing"">(قوله ويهدم الزوج الثاني الطلقة والطلقتين) يعني إذا كان دخل بها، ولو لم يدخل لا يهدم بالاتفاق، وتقييده في صورة المسألة بالحرة لوضعها في هدم الطلقة والطلقتين ولا يتحقق في الأمة إلا هدم طلقة واحدة، لا لأنه لا هدم في الأمة أصلا.""</span></p><p class=""indent"" style=""text-align:left;""><span class=""ar_writing"">(كتاب الطلاق ،  باب الرجعة ، 4 / 183 ، ط: دارالفکر)</span></p><p style=""text-align:justify;"">فتاوی شامی میں ہے :</p><p class=""indent"" style=""text-align:justify;""><span class=""ar_writing"">""(قوله وهي مسألة الهدم الآتية) أي في آخر باب الرجعة، وهي أن الزوج الثاني يهدم ما دون الثلاث كما ‌يهدم ‌الثلاث، فمن طلق امرأته واحدة أو أكثر ثم عادت إليه بعد زوج آخر عادت إليه بملك جديد فيملك عليها ثلاث طلقات، وهذا عندهما. وعند محمد إنما يهدم الثاني الثلاث فقط لا ما دونها.""</span></p><p class=""indent"" style=""text-align:left;""><span class=""ar_writing"">(كتاب الطلاق ، 3/ 337، ط: سعید)</span></p><p style=""text-align:justify;"">فتاوی ہندیہ میں ہے :</p><p class=""indent"" style=""text-align:justify;""><span class=""ar_writing"">""وإذا طلق امرأته طلقة أو طلقتين وانقضت عدتها وتزوجت بزوج آخر ودخل بها ثم طلقها وانقضت عدتها ثم تزوجها الأول عادت إليه بثلاث تطليقات ويهدم الزوج الثاني الطلقة والطلقتين كما ‌يهدم ‌الثلاث كذا في الاختيار شرح المختار وهو الصحيح كذا في المضمرات.""</span></p><p class=""indent"" style=""text-align:left;""><span class=""ar_writing"">(كتاب الطلاق ، الباب السادس ، 1/ 475، ط: رشیدیه)</span></p><p class=""indent"" style=""text-align:left;""><span class=""ar_writing"">فقط واللہ اعلم </span></p></p>",144408100791,banuri,"('طلاق', 'talaaq')","('رجوع', 'rujoo')","('ایک یا دو طلاق کے بعد رجوع', 'ek-ya-do-talaq-ke-bad-rujoo')"
02-04-2023,https://www.banuri.edu.pk/readquestion/taraweeh-ka-hkm-aur-beger-taraweeh-k-roza-144409101051/02-04-2023,تراویح کا حکم اور بغیر تراویح کے روزہ,رمضان میں تراویح پڑھنے کا کیا حکم ہے؟ اور بغیر تراویح کے روزہ رکھنے کا کیا حکم ہے؟,"<p><p style=""text-align:justify;"">تراویح  کی نماز مردوں اور عورتوں دونوں کے لیےسنت موکدہ  اور باعثِ اجر ہے،بلا عذر اس کو چھوڑنے والا نافرمان اور گناہ گار ہے۔</p><p style=""text-align:justify;"">تاہم اگر کوئی روزہ رکھے اور تراویح نہ پڑھے تو اس کا روزہ ہوجاتا ہے۔</p><p style=""text-align:justify;"">''فتاوی شامی'' میں ہے:</p><p class=""indent"" style=""text-align:justify;""><span class=""ar_writing"">""(التراويح سنة) مؤكدة لمواظبة الخلفاء الراشدين (للرجال والنساء) إجماعا.""</span></p><p class=""indent"" style=""text-align:left;"">(كتاب الصلاة، باب الوتر والنوافل، ج2، ص43، سعيد)</p><p class=""indent"" style=""text-align:left;"">فقط والله أعلم</p></p>",144409101051,banuri,"('نماز', 'salat')","('تراویح', 'taraweeh')","('تراویح کی مشروعیت', 'taraveeh-ki-mashrooiyat')"
02-04-2023,https://www.banuri.edu.pk/readquestion/quran-e-karim-k-telawt-k-dawran-ju-tohuk-mun-mai-jama-hujaye-to-use-negalne-se-roza-nahi-tothta-144409101075/02-04-2023,قرآنِ کریم کی تلاوت کے دوران جو تھوک منہ میں جمع ہوجائے تو اسے نگلنے  سے روزہ نہیں ٹوٹتا,روزے کی حالت میں قرآن کی تلاوت کرتے ہوئے منہ میں بار بار جو تھوک جمع ہوجاتا ہے اُس کو نگلنے کا کیا حکم ہے؟,"<p><p dir=""rtl"" style=""text-align:justify;""><span lang=""ar-sa"" xml:lang=""ar-sa"">منہ میں پیدا ہونے والی تھوک نگلنے سے روزہ نہیں ٹوٹتا  ،  لہذا   روزہ میں  قرآنِ کریم کی تلاوت کرتے ہوئے اگر منہ میں تھوک جمع ہوجائے تو اسے نگلنے  سے روزہ نہیں ٹوٹتا ہے،البتہ زیادہ مقدار میں جمع ہو جائے تواسے باہر پھینک دے۔</span></p><p dir=""rtl""><span lang=""ar-sa"" xml:lang=""ar-sa"">فتاوى شامى</span><span lang=""er"" xml:lang=""er""> میں ہے:</span></p><p class=""indent"" dir=""rtl"" style=""text-align:justify;""><span class=""ar_writing"" lang=""ar-sa"" xml:lang=""ar-sa"">""إذا بقي بعد المضمضة ماء فابتلعه بالبزاق لم يفطر لتعذر الاحتراز .""</span></p><p class=""indent"" dir=""rtl"" style=""text-align:left;""><span lang=""ar-sa"" xml:lang=""ar-sa""><span class=""ar_writing"">(كتاب الصوم،  ‌‌باب ما يفسد الصوم وما لا يفسده، ج:2، ص:396، ط:سعيد)</span></span></p><p dir=""rtl""><span lang=""ar-sa"" xml:lang=""ar-sa""><span class=""ar_writing"">البناية شرح الهداية</span>  میں  ہے:</span></p><p class=""indent"" dir=""rtl"" style=""text-align:justify;""><span class=""ar_writing"" lang=""ar-sa"" xml:lang=""ar-sa"">""ولو ‌ابتلع ريقه لا يفسد بإجماع الأمة.ولو استشم مخاطه فأخرجه من فيه لا يفسد كريقه.""</span></p><p class=""indent"" dir=""rtl"" style=""text-align:left;""><span class=""ar_writing"" lang=""ar-sa"" xml:lang=""ar-sa"">(كتاب الصوم، باب ما لا يفطر الصائم،  فصل ابتلاع الصائم الشيء اليسير، ج:4، ص:49، ط:</span><span lang=""ar-sa"" xml:lang=""ar-sa""><span class=""ar_writing"">دار الكتب العلمية)</span></span></p><p dir=""rtl""><span lang=""er"" xml:lang=""er""><span class=""ar_writing"">النهاية شرح الهداية</span>  میں ہے:</span></p><p class=""indent"" dir=""rtl"" style=""text-align:justify;""><span class=""ar_writing"" lang=""er"" xml:lang=""er"">""(ولنا أن القليل تابع لأسنانه بمنزلة ريقه)؛ (لأنه لا يستطاع). الامتناع عنه فإن من تسحر بالسويق، فلابد من أن يبقى بين أسنانه، ولهاته شيء فإذا أصبح يدخل ذلك في حلقه مع ريقه، ثم ما يبقى بين الأسنان تبع لريقه، فكما أنه إذا ‌ابتلع ريقه لم يضره فكذلك ما هو تبع له، وهذا إذا كان صغيرا يبقى بين الأسنان  عادة.""</span></p><p class=""indent"" dir=""rtl"" style=""text-align:left;""><span class=""ar_writing""><span lang=""er"" xml:lang=""er"">(</span><span lang=""ar-sa"" xml:lang=""ar-sa"">كتاب الصوم، ‌‌باب ما يوجب القضاء والكفارة،  ج:5، ص:144، ط:</span></span><span lang=""ar-sa"" xml:lang=""ar-sa""><span class=""ar_writing"">مركز الدراسات الإسلامية ام القرى)</span></span></p><p dir=""ltr"" style=""text-align:right;"">:النهر الفائق  میں ہے</p><p class=""indent"" dir=""rtl"" style=""text-align:justify;""><span class=""ar_writing"" lang=""ar-sa"" xml:lang=""ar-sa"">""ولو ابتلع ريقه أونخامته لم  يفطر.""</span></p><p class=""indent"" dir=""rtl"" style=""text-align:left;""><span class=""ar_writing"" lang=""ar-sa"" xml:lang=""ar-sa"">(كتاب الصوم ،  ‌‌باب ما يفسد الصوم وما لا يفسده، ج:2، ص:18، ط:دارالكتب العلمية)</span></p><p dir=""rtl""><span lang=""ar-sa"" xml:lang=""ar-sa""><span class=""ar_writing"">الفتاوى الهندية</span>   میں ہے:</span></p><p class=""indent"" dir=""rtl"" style=""text-align:justify;""><span class=""ar_writing"" lang=""ar-sa"" xml:lang=""ar-sa"">""ولو بقي بلل بعد المضمضة فابتلعه مع البزاق لم يفطره، ولو دخل المخاط أنفه من رأسه ثم استشمه فأدخل حلقه عمدا لم يفطره؛ لأنه بمنزلة ريقه كذا في محيط السرخسي.""</span></p><p class=""indent"" dir=""rtl"" style=""text-align:left;""><span class=""ar_writing"" lang=""ar-sa"" xml:lang=""ar-sa"">(كتاب الصوم، ‌‌الباب الرابع فيما يفسد وما لا يفسد، ج:1، ص:203، ط:دارالفكر)</span></p><p class=""indent"" dir=""rtl"" style=""text-align:left;""><span class=""ar_writing"" lang=""ar-sa"" xml:lang=""ar-sa""><span lang=""ar-sa"" xml:lang=""ar-sa"">فقط والله أعلم</span></span></p></p>",144409101075,banuri,"('روزہ', 'soum')","('روزہ توڑنے والی چیزیں', 'roza-torne-wali-chezen')","('روزہ نہ توڑنے والی چیزیں', 'roza-na-torne-wali-chezen')"
03-04-2023,https://www.banuri.edu.pk/readquestion/bajamat-taraveh-ki-chouti-hue-rakat-witar-kay-baad-ada-krna-144409101098/03-04-2023,باجماعت تراویح کی چھوٹی ہوئی رکعات وتر کے بعد ادا کرنا,اگر کسی سے باجماعت تراویح کی دو یا چار رکعات چھوٹ جائے ،تو کیا وہ آدمی تراویح کی  ان رکعات کو وتربا جماعت ادا کرنے کے بعد ادا کر سکتا ہے ؟,"<p><p style=""text-align:justify;"">رمضان المبارک میں وترکی نماز جماعت کے ساتھ ادا کرنا افضل ہے،چناچہ جس شخص کی تراویح کی چند رکعات چھوٹ جائیں ،اور اگر وہ ان میں مشغول ہوتا ہوتووتر کی جماعت فوت ہوتی ہو تو ایسی صورت میں وہ پہلے وتر کی نماز باجماعت پڑھ لے،پھر اپنی تراویح کی چھوٹی ہوئی رکعات پڑھ لے،لیکن اگر وتر کی جماعت فوت ہونے کا خوف نہ ہو ،تو پھر پہلے تراویح کی رکعات مکمل کرلے ،اس کے بعد وتر کی جماعت میں شریک ہوجائے۔</p><p style=""text-align:justify;"">مراقی الفلاح میں ہے:</p><p class=""indent"" style=""text-align:justify;""><span class=""ar_writing"">""ويوتر بجماعة"" استحبابا ""في رمضان فقط"" عليه إجماع المسلمين لأنه نفل من وجه والجماعة في النفل في غير التراويح مكروهة فالاحتياط تركها في الوتر خارج رمضان.""</span></p><p class=""indent"" style=""text-align:left;""><span class=""ar_writing"">(کتاب الصلاۃ ،باب الوتر،ص:386،ط:المکتبہ العصریہ)</span></p><p style=""text-align:justify;"">فتاوی ہندیہ میں ہے:</p><p class=""indent"" style=""text-align:justify;""><span class=""ar_writing"">""وإذا فاتته ترويحة أو ترويحتان فلو اشتغل بها يفوته الوتر بالجماعة يشتغل بالوتر ثم يصلي ما فات من التراويح وبه كان يفتي الشيخ الإمام الأستاذ ظهير الدين.""</span></p><p class=""indent"" style=""text-align:left;""><span class=""ar_writing"">(الباب التاسع ،فصل فی التراویح ،ج:1،ص:117،ط:دار الفکر) </span></p><p style=""text-align:justify;"">فتاوی شامی میں ہے:</p><p class=""indent"" style=""text-align:justify;""><span class=""ar_writing"">""(ووقتها بعد صلاة العشاء) إلى الفجر (قبل الوتر وبعده) في الأصح، فلو فاته بعضها وقام الإمام إلى الوتر أوتر معه ثم صلى ما فاته.""</span></p><p class=""indent"" style=""text-align:left;""><span class=""ar_writing"">(کتاب الصلاۃ ،باب الوتر والنوافل،ج:2،ص:43،ط:سعید)</span></p><p class=""indent"" style=""text-align:left;""><span class=""ar_writing"">فقط واللہ اعلم </span></p></p>",144409101098,banuri,"('نماز', 'salat')","('تراویح', 'taraweeh')","('تراویح', 'taraweeh')"
10-03-2023,https://www.banuri.edu.pk/readquestion/roze-ki-halat-mein-biwi-ke-sath-kin-afal-ki-ijaajat-hai-biwi-ke-mathe-aur-hothon-ko-bosa-dene-ka-kya-hukum-hai-144408101325/10-03-2023,روزے کی حالت میں بیوی کے ساتھ کن افعال کی اجازت ہے،نیز بیوی کے ماتھے اور ہونٹوں کو بوسہ دینے کا کیا حکم ہے؟,روزے کی حالت میں بیوی کے ساتھ کن افعال کی اجازت ہے؟ نیز بیوی کے ماتھے کو یا ہونٹوں کو بوسہ دینا کیسا ہے؟,"<p><p style=""text-align:justify;"">روزے  کی حالت میں میاں بیوی کا ایک بستر میں لیٹنا جائز ہے، تاہم بے لباس لیٹنا یا بغیر حائل کے جسم ملانا، یا اپنے اوپر اعتماد نہ ہونے کے باوجود بوس و کنار کرنا،ماتھے  یا ہونٹوں پر بوسہ لینا یا ایک دوسرے کے اعضاءِ مستورہ کو چھونا  مکروہ ہے۔ نیز روزے کی حالت میں بوس و کنار کی وجہ سے اگر منی خارج ہوجائے تو روزہ فاسد ہوجائے گا، قضا لازم آئے گی۔  تاہم اگر اس دوران جماع   یعنی ہم بستری کرلی تو قضا کے ساتھ کفارہ بھی لازم آئے گا۔</p><p style=""text-align:justify;"">اسی طرح روزے کی حالت میں بیوی کے پستان چوسنا مکروہ عمل ہے، یہ انسان کو جماع کی طرف لے جاسکتاہے، جو روزے میں ناجائز اور حرام ہے؛ اس لیے اس عمل سے اجتناب ضروری ہے، تاہم  اگر کسی نے ایسا کیا اور کسی قسم کا مادہ منہ میں آکر حلق سے نہیں اترا اور مرد کو انزال بھی نہیں ہوا تو روزہ فاسد  نہیں ہوگا، اور اگر اس عمل کے دوران مرد کو انزال ہوگیا تو روزہ فاسد ہوجائے گا اور قضا لازم ہوگی اور اگر اس عمل کے دوران  دودھ یا پانی منہ میں آیا اور حلق تک پہنچ گیا تو روزہ فاسد ہوجائے گا قضا اور کفارہ دونوں لازم ہوں گے ۔بہرحال خود پر اعتماد نہ ہو  تو روزے کے دوران بوس وکنار اور پستان چوسنے سے اجتناب کرنا چاہیے۔</p><p style=""text-align:justify;"">فتاوی شامی  میں ہے:</p><p class=""indent"" style=""text-align:justify;""><span class=""ar_writing"">""(و) كره (قبلة) ومس ومعانقة ومباشرة فاحشة (إن لم يأمن) المفسد وإن أمن لا بأس.</span><br/><span class=""ar_writing"">(قوله: وكره قبلة إلخ) جزم في السراج بأن القبلة الفاحشة بأن يمضغ شفتيها تكره على الإطلاق أي سواء أمن أو لا، قال في النهر: والمعانقة على التفصيل في المشهور، وكذا المباشرة الفاحشة في ظاهر الرواية، وعن محمد كراهتها مطلقاً، وهو رواية الحسن، قيل: وهو الصحيح. اهـ. واختار الكراهة في الفتح، وجزم بها في الولوالجية بلا ذكر خلاف، وهي أن يعانقها وهما متجردان ويمس فرجه فرجها، بل قال في الذخيرة: إن هذا مكروه بلا خلاف؛ لأنه يفضي إلى الجماع غالباً. اهـ. وبه علم أن رواية محمد بيان لكون ما في ظاهر الرواية من كراهة المباشرة ليس على إطلاقه، بل هو محمول على غير الفاحشة، ولذا قال في الهداية: والمباشرة مثل التقبيل في ظاهر الرواية، وعن محمد أنه كره المباشرة الفاحشة اهـ وبه ظهر أن ما مر عن النهر من إجراء الخلاف في الفاحشة ليس مما ينبغي، ثم رأيت في التتارخانية عن المحيط: التصريح بما ذكرته من التوفيق بين الروايتين وأنه لا فرق بينهما، ولله الحمد"".</span></p><p class=""indent"" style=""text-align:left;""><span class=""ar_writing"">  (2/ 417، کتاب الصوم، باب ما یفسد الصوم وما لا یفسده، ط: سعید) </span></p><p>فتاوی ہندیہ میں ہے:</p><p class=""indent"" style=""text-align:justify;""><span class=""ar_writing"">""ولا بأس بالقبلة إذا أمن على نفسه من الجماع والإنزال ويكره إن لم يأمن والمس في جميع ذلك كالقبلة كذا في التبيين.</span></p><p class=""indent"" style=""text-align:justify;""><span class=""ar_writing"">وأما القبلة الفاحشة، وهي أن يمص شفتيها فتكره على الإطلاق، والجماع فيما دون الفرج والمباشرة كالقبلة في ظاهر الرواية. قيل إن المباشرة الفاحشة تكره، وإن أمن هو الصحيح كذا في السراج الوهاج. والمباشرة الفاحشة أن يتعانقا، وهما متجردان ويمس فرجه فرجها، وهو مكروه بلا خلاف هكذا في المحيط. ولا بأس بالمعانقة إذا لم يأمن على نفسه أو كان شيخا كبيرا هكذا في السراج الوهاج"".</span></p><p class=""indent"" style=""text-align:left;""><span class=""ar_writing"">(كتاب الصوم، الباب الثالث ،1/ 200ط:دارالفکر)</span></p><p class=""indent"" style=""text-align:left;""><span class=""ar_writing""> فقط واللہ اعلم</span></p></p>",144408101325,banuri,"('روزہ', 'soum')","('روزے کی اقسام اور احکام', 'roze-ki-aqsaam-aur-ahkaam')","('روزہ کی شرائط', 'roza-ki-sharaet')"
