issued_at,link,title,question,answer,fatwa_number,dar_ul_ifta,kitab,bab,fasal
19-12-2022,https://www.banuri.edu.pk/readquestion/betu-lkhla-me-jaty-wqt-mun-m-rakhi-hui-chiz-ka-hukm-144405101531/19-12-2022,بیت الخلاء میں داخل ہونے کے بعد منہ میں رکھی ہوئی کھانے کی چیز کا حکم,کیا ہم باتھ روم میں کوئی چیز کھا سکتے ہیں یا پی سکتے ہیں؟  اگر منہ میں کوئی  چیز ہو تو کیا اس کو نگل سکتے ہیں؟,"<p><p style=""text-align:justify;"">بیت الخلاء میں کھانا پینا  آداب کے خلاف ہے جو کہ نسیان( بھول جانے کی بیماری) کا سبب بھی ہے، لہذا ایسے فعل سے اجتناب کرنا چاہیے، اگر بیت الخلاء جاتے وقت منہ میں کوئی کھانے کی چیز ہے، تو بیت الخلاء میں جانے سے پہلے کھالینی چاہیے۔</p><p style=""text-align:justify;""><span class=""ar_writing"">الجامع لاحکام القرآن (تفسير القرطبي )</span>  میں ہے:</p><p class=""indent"" style=""text-align:justify;""><span class=""ar_writing"">""(وليس عليكم جناح فيما أخطأتم به ولكن ما تعمدت قلوبكم ولكن ما تعمدت قلوبكم) أي فعليكم الجناح. والله أعلم. ولذلك قال بعده: (وكان الله غفورا رحيما) أي (غفورا) للعمد و (رحيما) برفع إثم الخطأ"".</span></p><p class=""indent"" style=""text-align:left;""><span class=""ar_writing"">(سورۃ الاحزاب، رقم الآیۃ:5، ج:14، ص:120، ط:دارالفکر)</span></p><p style=""text-align:justify;"">شرح البخاری للسفیری میں ہے:</p><p class=""indent"" style=""text-align:justify;""><span class=""ar_writing"">""ومن آدابه أن لا يأكل ولا ‌يشرب ‌في الخلاء، كما قاله القاضي زكريا عن المحب الطبري"".</span></p><p class=""indent"" style=""text-align:left;""><span class=""ar_writing"">(المجلس الثاني الأربعون في آداب الخلاء و مستحباته، ج:2، ص:322، ط:دار الكتب العلمية)</span></p><p style=""text-align:justify;""><span class=""ar_writing"">حاشية الجمل ( فتوحات الوهاب بتوضيح شرح منهج الطلاب)</span>میں ہے:</p><p class=""indent"" style=""text-align:justify;""><span class=""ar_writing"">""(قوله: وبقيت آداب إلخ) منها أن لا يأكل ولا يشرب ولا يستاك لأنه يورث النسيان"".</span></p><p class=""indent"" style=""text-align:left;""><span class=""ar_writing"">(کتاب الطہارۃ، باب الاحداث، (فصل) في آداب الخلاء وفي الاستنجاء، ج:1، ص:92، ط:دارالفکر)</span></p><p class=""indent"" style=""text-align:left;""><span class=""ar_writing"">فقط واللہ اعلم</span></p></p>",144405101531,banuri,"('حظر و اباحت', 'mamnooaat-mubahat')","('ماکولات / مشروبات', 'makoolat-mashroobat')","('کھانے پینے کی حلال و حرام ، مکروہ و مباح اشیاء', 'khanay-penay-ki-halal-o-haram-makroh-o-mubah-ashya')"
17-03-2023,https://www.banuri.edu.pk/readquestion/mazoori-zahir-karny-waly-faqeer-ki-imdad-ka-hukum-144408102111/17-03-2023,معذوری ظاہر کرنے والے فقیر کی امداد کا حکم,اپنی معذوری ظاہر کر کے بھیک مانگنے والے فقیر کو بھیک دینا کیسا ہے؟,"<p><p style=""text-align:justify;"">واضح رہے کہ جس آدمی کے پاس ایک دن کا کھانا ہو اور ستر ڈھانکنے کےلیے  کپڑا ہو اس کے لیے لوگوں سے مانگنا جائز نہیں ہے، اسی طرح جو آدمی کمانے پر قادر ہو اس  کے لیے بھی سوال کرنا جائز نہیں، البتہ اگر کسی آدمی پر فاقہ ہو ،یا وہ معذور ہو اور کمانے پر قدرت نہ ہو یا واقعی کوئی سخت ضرورت پیش آگئی ہو جس کی وجہ سے وہ انتہائی مجبوری کی بنا پر سوال کرے تو اس کی گنجائش ہے، لیکن مانگنے کو عادت اور پیشہ بنالینا بالکل بھی جائز نہیں ہے۔</p><p style=""text-align:justify;"">لہٰذا سوال کرنے والا شخص اگر واقعتاً معذور ہو اور کمانے سے عاجز ہو ،اور غالب گمان یہ ہو  کہ اس کے پاس ایک دن رات کا کھانا نہیں ہے  تو اس کی ضرورت کےبقدراس کی امداد کرنا جائز اورمستحب ہے، البتہ جو تندرست شخص حلال کمانے سے جی چراتا ہو  اور معذوری ظاہر کرکے لوگوں سےسوال کرتا ہو توایسےشخص کےساتھ تعاون کرنا بالکل درست نہیں ہے، تعاون کرنے والا گناہ کے کام میں تعاون کرنے والا شمار ہوگا۔</p><p style=""text-align:justify;"">تفسیر ِ ماوردی میں ہے:</p><p class=""indent"" style=""text-align:justify;""><span class=""ar_writing"">""{وفي أموالهم حق للسائل والمحروم} أما السائل فهو من يسأل الناس لفاقته.""</span></p><p class=""indent"" style=""text-align:left;""><span class=""ar_writing"">(سورة الذاريات، الآية:19، ط: دار الكتب العلمية،بيروت)</span></p><p style=""text-align:justify;"">الدر المختار میں ہے:</p><p class=""indent"" style=""text-align:justify;""><span class=""ar_writing"">""ولا ‌يحل ‌أن يسأل ‌شيئامن القوت من ‌له قوت يومه بالفعل أو بالقوة كالصحيح المكتسب، ويأثم معطيه إن علم بحاله لاعانته على المحرم ....فروع: يندب دفع ما يغنيه يومه عن السؤال، واعتبار حاله من حاجة وعيال.""</span></p><p class=""indent"" style=""text-align:left;""><span class=""ar_writing"">(کتاب الزکوٰۃ، باب المصرف، ص:139، ط: دار الكتب العلمية،بيروت)</span></p><p class=""indent"" style=""text-align:left;""><span class=""ar_writing"">فقط والله أعلم</span></p></p>",144408102111,banuri,"('حظر و اباحت', 'mamnooaat-mubahat')","('متفرقات', 'mutafarriqaat')","('متفرقات ممنوعات و مباحات', 'muatafarriqaat-e-mamnooaat-o-mubahaat')"
09-03-2023,https://www.banuri.edu.pk/readquestion/sootay-waqt-wozoo-ka-hukum-144408101089/09-03-2023,سوتے وقت وضو کا حکم,رسول ﷺ نے فرمایا رات کو باوضو ہو کر سویا کرو   ، کیا نماز عشاء کے وضو کے ساتھ سو سکتے ہیں یا پھر  سونے کے لیے نیا وضو کرنا ضروری ہے؟,"<p><p dir=""rtl"" style=""text-align:justify;""> نئے وضو کی ضرورت نہیں ، صرف  وضو کا ہونا  مسنون ہے چاہے عشاء کی   نماز کا ہو یا پھر عشاء کے نماز کے بعد دوبا رہ وضو  کیا ہو۔</p><p>شرح المسلم النووی میں ہے:</p><p class=""indent"" style=""text-align:justify;""><span class=""ar_writing"">""56 :(2710)   إذا أخذت مضجعك فتوضأ وضو ءك للصلاة ثم إضطجع علی شقك الأیمن   .</span></p><p class=""indent"" style=""text-align:justify;""><span class=""ar_writing"">(إحداھا):الوضوء عند إرادة النوم فإن کان متوضأ  کفاه ذالك الوضوء لأن المقصود النوم علي طھارة مخافة أن یموت فی لیلته و لیکون أصدق لرویاہ وأبعد من تلعب الشیطان به فی منامه و ترویعه إیاه.""</span></p><p class=""indent"" style=""text-align:left;""><span class=""ar_writing"">(شرح المسلم للنووي، کتاب الذکر و الدعاء والتوبة والإستعفار، باب الدعاء و النوم،  ج:17  ص:27  ط: دار الکتب العلمیة)</span><br/>فقط و اللہ اعلم </p></p>",144408101089,banuri,"('طہارت', 'taharat')","('وضو', 'wuzu')","('مواقع وضو', 'mawaaq-e-wazu')"
16-02-2023,https://www.banuri.edu.pk/readquestion/17sal-bad-wusool-hony-waly-qarz-pr-zakat-144407102089/16-02-2023,سترہ سال بعد وصول ہونے والے  قرض  پر زکاۃ,میرایک آدمی کے ذمے قرض تھا جس کے ملنے کی کوئی امید نہیں تھی، چنانچہ سترہ سال کا طویل عرصہ گزرا، اس طویل عرصہ کے بعد کچھ زور زبردستی کرکے ایک پلاٹ کی صورت میں وصول کی کوئی صورت بن گئی ،وہ بھی اس طرح کہ اسی مقروض کے ذمہ  ایک دوسرے آدمی کابھی قرض تھا اور مقروض نے اس کو اس قرض کےعوض ایک پلاٹ دیا تھا، مگر عملًا  قبضہ نہ  دیتا تھا ،ہم نے جب مجبور کیا تو وہی پلاٹ یہ کہہ کرہمیں دیا کہ اس دوسرے قرض خواہ سے خود نمٹ لو ،ہم نے اس دوسرے قرض خواہ سے کہا کہ پلاٹ ہمیں دے دو اور تمہاری جورقم اس کے ذمہ  ہے وہ ہم تمہیں  دے دیں گے، اس نے موقع کو غنیمت جانااور اس پر راضی ہو ا۔ ہم نےاس کواس کی قرض کی رقم  دے دی اور پلاٹ پر قبضہ کرلیا ۔یادرہے کہ مقروض نے دوسرے قرض خواہ کو اسٹام پیپر بھی لکھ دیا تھا ،اب وہ پلاٹ ہم نے ساڑھے اکیس لاکھ میں بیچ دیا اور  ھمارا اصل  قرض  سات  لاکھ  روپیہ  تھا ، اب  سوال  یہ ہے کہ اس سات لاکھ روپے  کی سترہ سال کی زکوٰۃ ہمارے ذمے ہے یا نہیں؟ یاد رہے  کہ ہمیں اس طویل عرصہ سے جو نقصان ہوا اس کا اندازہ اس سے لگایا جاسکتا ہے کہ جو رقبہ سترہ سال پہلے دولاکھ میں ایک بیگہ فروخت ہوتا تھا آج وہ دولاکھ میں مرلہ بک رہا ہے۔,"<p><p style=""text-align:justify;"">صورتِ  مسئولہ میں اگر سائل نے  قرض  کی رقم  کی زکاۃ ادا  نہیں کی تھی تو اب اس رقم کے وصول ہونے کے بعد  گزشتہ سالوں کی زکاۃ ادا کرنا لازم ہے ۔</p><p style=""text-align:justify;"">       فتاوی شامی میں ہے:</p><p class=""indent"" style=""text-align:justify;""><span class=""ar_writing"">""(و) اعلم أن الديون عند الإمام ثلاثة: قوي، ومتوسط، وضعيف؛ (فتجب) زكاتها إذا تم نصاباً وحال الحول، لكن لا فوراً بل (عند قبض أربعين درهماً من الدين) القوي كقرض (وبدل مال تجارة) فكلما قبض أربعين درهماً يلزمه درهم.""</span></p><p class=""indent"" style=""text-align:left;""><span class=""ar_writing""> (2/ 305،  کتاب الزکاۃ،باب زکاۃ المال، ط: سعید)</span></p><p class=""indent"" style=""text-align:left;"">فقط واللہ اعلم</p></p>",144407102089,banuri,"('زکات', 'zakat')","('وجوب زکوٰۃ', 'wujoob-zakat')","('قرض اور مالِ ضمار پر زکوٰۃ', 'qarz-aur-maal-e-zimaar-par-zakat')"
08-10-2022,https://www.banuri.edu.pk/readquestion/muqtadi-ka-imam-ky-piche-sana-parhny-ka-hukum-144403100872/08-10-2022,مقتدی کا امام کے پیچھے ثنا پڑھنے کا حکم,میرے سوالات باجماعت نماز میں ثناء کے متعلق کچھ ہیں۔ جو درجہ ذیل ہیں:۱: اگر مقتدی ابھی نیت کر رہا ہو اور امام صاحب قراءت شروع کر دے۔ تو کیا مقتدی ثناء پڑھے؟۲:- اگر مقتدی ثناء پڑھ رہا ہو اور امام قرت شروع کر دے تو ثناء کو پورا کرنا چاہیے یا قراءت کو سنے؟,"<p><p dir=""rtl"" style=""text-align:justify;"">1۔اگر امام جہری نماز میں  قراء ت شروع کردے اور مقتدی نے اب تک نماز شروع نہیں کی ہے، تو مقتدی کو اس وقت  نیت باندھ کر خاموش کھڑا ہوجانا چاہیے، ثنا نہ پڑھنی چاہیے، اور اگر امام نے ابھی قراء ت شروع نہیں کی ہے  تو ثنا پڑھ لینی چاہیے۔</p><p dir=""rtl"" style=""text-align:justify;"">2۔ اگر مقتدی ثنا پڑھ رہا تھا کہ امام نے  جہری نماز میں تلاوت شروع کردی تو مقتدی کو اسی وقت خاموش ہوجانا چاہیے،جتنی ثنا پڑھ لی بس اُسی قدر کا فی ہے۔</p><p dir=""rtl"" style=""text-align:justify;"">باقی سری نماز  میں  جب بھی قیام کی حالت میں  مقتدی امام کے ساتھ نماز میں شامل ہو جائے اس وقت ثناء پڑھ لے، خواہ امام نے قراءت شروع کی ہو یا نہ کی ہو اور چاہے مقتدی کو امام کی قراءت شروع کرنے کا علم ہو یا نہ ہو۔</p><p style=""text-align:justify;"">فتاوى هندیہ میں ہے:</p><p class=""indent"" style=""text-align:justify;""><span class=""ar_writing"">""(الفصل السابع في المسبوق واللاحق) المسبوق من لم يدرك الركعة الأولى مع الإمام وله أحكام كثيرة، كذا في البحر الرائق.</span><br/><span class=""ar_writing"">(منها) أنه إذا أدرك الإمام في القراءة في الركعة التي يجهر فيها لايأتي بالثناء، كذا في الخلاصة، هو الصحيح، كذا في التجنيس، وهو الأصح، هكذا في الوجيز للكردري، سواء كان قريبًا أو بعيدًا أو لا يسمع لصممه، هكذا في الخلاصة، فإذا قام إلى قضاء ما سبق يأتي بالثناء ويتعوذ للقراءة، كذا في فتاوى قاضي خان والخلاصة والظهيرية،وفي صلاة المخافتة يأتي به. هكذا في الخلاصة ويسكت المؤتم عن الثناء إذا جهر الإمام هو الصحيح. كذا في التتارخانية في فصل ما يفعله المصلي في صلاته.""</span></p><p class=""indent"" style=""text-align:left;"">(کتاب الصلاۃ،الباب الخامس في الإمامة،ج1،ص90۔91،ط؛دار الفکر)</p><p class=""indent"" style=""text-align:left;"">فقط واللہ اعلم</p></p>",144403100872,banuri,"('نماز', 'salat')","('نماز کا طریقہ', 'namaz-ka-tariqah')","('نماز کی سنتیں', 'namaz-ki-sunnaten')"
