issued_at,link,title,question,answer,fatwa_number,dar_ul_ifta,kitab,bab,fasal
20-12-2022,https://www.banuri.edu.pk/readquestion/imamt-traweh-144405101631/20-12-2022,تراویح میں گھر میں خواتین کی امامت کرنا,میں قرآن کریم حفظ کررہا ہوں اور اس رمضان میں میں کچھ پارے تراویح میں سنانا چاہتا ہوں تو اس کے لیے کسی مسجد کا ملنا مشکل ہے ،اس لیے میں گھر میں ہی تراویح کا اہتمام کرکے قرآن سناؤں گا، تو میرا سوال یہ ہے کہ گھر میں کچھ نامحرم خواتین بھی ہوں گی کیوں کہ ہماری  جوائنٹ فیملی ہے ،تو اس سلسلے میں تراویح کی جماعت کروانا صحیح ہوگا یا نہیں ؟اور اگر صحیح  ہے تو پھر میں خود وتر اور فرائض مسجد میں پڑھوں گا یا گھر میں خواتین کے ساتھ ہی تراویح کی طرح جماعت کرواسکتا ہوں؟,"<p><p style=""text-align:justify;"">صورتِ مسئولہ میں اگر آپ گھر میں تراویح کی امامت کریں اور آپ کی اقتداء میں کچھ مرد ہوں اور گھر کی ہی کچھ عورتیں پردے میں اقتدا کررہی ہوں، باہر سے عورتیں نہ آتی ہوں، اور آپ عورتوں کی امامت کی نیت بھی کریں تو اس صورت میں یہ نماز تراویح شرعاً درست ہے۔ البتہ اس صورت میں عورتیں مردوں کی صفوں سے پیچھے صف بنائیں۔</p><p style=""text-align:justify;"">اوراگر آپ تنہا امامت کروائیں کوئی مرد آپ کے پیچھے موجود نہ ہو، مقتدی سب عورتیں ہوں اور عورتوں میں آپ کی کوئی محرم خاتون بھی موجود ہو  ، تو اس صورت میں بھی تراویح درست ہے، نامحرم خواتین پردہ کا اہتمام کرکے شریک ہوں ۔</p><p style=""text-align:justify;"">اور اگر  مقتدی سب عورتیں ہوں ، اور عورتوں میں کوئی محرم خاتون نہ ہو،  تو ایسی صورت  آپ کے لیے عورتوں کی امامت کرنا مکروہ ہوگا؛ لہٰذا ایسی صورت سے اجتناب کیا جائے۔</p><p style=""text-align:justify;"">جن صورتوں میں گھر میں تراویح کی جماعت کی اجازت ہے ان صورتوں میں بھی مردوں کے لیے لازم ہے کہ مسجد میں باجماعت نماز پڑھ  کر گھر میں  آکر تراویح  اور وتر باجماعت ادا کریں ،اس لیے کہ  مردوں کے لیے حالتِ صحت وتندرستی  اور عام حالات میں مساجد میں باجماعت نماز ادا کرنا حکماً واجب کے درجہ میں ہے ۔</p><p style=""text-align:justify;"">’’فتاوی شامی‘‘ میں ہے:</p><p class=""indent"" style=""text-align:justify;""><span class=""ar_writing"">"" تكره إمامة الرجل لهن في بيت ليس معهن رجل غيره ولا محرم منه) كأخته (أو زوجته أو أمته، أما إذا كان معهن واحد ممن ذكر أو أمهن في المسجد لا) يكره، بحر"".</span></p><p class=""indent"" style=""text-align:left;"">(ج:1،ص:566، باب الإمامة، ط: سعید)</p><p style=""text-align:justify;"">چنانچہ اعلاء السنن میں ہے :</p><p class=""indent"" style=""text-align:justify;""><span class=""ar_writing"">""قلت دلالته علی الجزء الأول ظاهرة حیث بولغ في تهدید من تخلّف عنها وحکم علیه بالنفاق، ومثل هذا التهدید لایکون إلا في ترك الواجب، ولایخفی أن وجوب الجماعة لو کان مجردًا عن حضور المسجد لما هم رسول اﷲ ﷺ بإضرام البیوت علی المتخلفین لاحتمال أنهم صلوها بالجماعة في بیوتهم؛ فثبت أن إتیان المسجد أیضًا واجب کوجوب الجماعة، فمن صلاها بجماعة في بیته أتی بواجب وترك واجبًا آخر ... و أما مایدل علی وجوبها في المسجد فإنهم اتفقوا علی أن إجابة الأذان واجبة لما في عدم إجابتها من الوعید ..."".</span></p><p class=""indent"" style=""text-align:left;"">(ج:4،ص:186،باب وجوب إتیان الجماعة في المسجد عند عدم العلة، إدارة القرآن کراچی)</p><p class=""indent"" style=""text-align:left;"">فقط واللہ اعلم</p></p>",144405101631,banuri,"('نماز', 'salat')","('تراویح', 'taraweeh')","('تراویح کی جماعت', 'taraveeh-ki-jamaat')"
14-02-2023,https://www.banuri.edu.pk/readquestion/sheraaz-name-mathlab-144407101931/14-02-2023,شیراز نام کا مطلب,شیرازنام کا مطلب بتا دیں؟,"<p><p style=""text-align:justify;"">اردو لغت میں ہے:</p><p style=""text-align:justify;"">شیراز:(1) ایران کا مشہور شہر جو وہاں کے مشہور شاعر حافظ شیرازی اورشیخ   سعدی کا مسکن تھا-</p><p style=""text-align:justify;"">شیراز (2):نچڑا ہوا دہی،پنیر،شیراز  وہ دہی کہ جس کا پانی ٹپکالیا گیاہو۔</p><p class=""indent"" style=""text-align:left;"">(حرف شین،شیراز،ج:12،ص:799،ط:اردو لغت بورڈ کراچی)</p><p>یہ نام رکھنا اگرچہ درست ہے، لیکن بہتر ہے کہ بچے کے نام  انبیاء کرام علیہم السلام اور صحابہ کرام رضوان اللہ علیہم اجمعین کے اسماء گرامی میں سے یا اچھے معنی اور اچھی نسبت والا کوئی نام رکھا جائے۔</p><p class=""indent"" style=""text-align:left;"">فقط واللہ اعلم</p></p>",144407101931,banuri,"('حظر و اباحت', 'mamnooaat-mubahat')","('نام، لقب، کنیت', 'asaami')","('ناموں کے معانی اور احکام', 'namoun-ke-mani-or-ahkaam')"
18-01-2023,https://www.banuri.edu.pk/readquestion/kisi-ke-kam-se-khush-ho-kar-usy-pesy-dena-rishwat-nai-144406101981/18-01-2023,کسی کے کام سے خوش ہوکر اسے پیسے دینا رشوت نہیں,سال میں دو دفعہ واپڈا پینشنر کا بائیومیٹرک ہوتا ہے،یعنی حکومت دیکھتی ہے کہ کون زندہ ہے یا فوت چکا ہے،ہماری والدہ کی پینشن ہے جو کہ پیسکو میں ہے،یعنی کہ پشاور میں ،ہمارا علاقہ چونکہ پشاور سے بہت دور ہے،واپڈا کا پینشن آفس کا ایک کلرک ہمارے علاقہ میں سے تقریبا 22 کلومیٹر کے فاصلہ پر رہتا ہے،چونکہ اس کا علاقہ ہمارے لیے پشاور جانے کے لیے فاصلہ کم پڑتا ہے،اس لیے اس نے ڈیوائس خرید ی ہے،میں اپنی والدہ کو ساتھ لیکر جاتا ہوں اس کا بائیومیٹرک  اس کے علاقہ ہی میں ہوتا ہے،چونکہ وہ اپنی طرف سے پیسے وغیرہ نہیں لیتا اس دفعہ میں نے تقریبا 500 روپے اس کو دیے تھے جوکہ اس نے مانگے نہیں تھے۔سوال یہ ہے کہ اس کے لیے ایسا کرنا جائز ہے؟جو ایک خدمت ہے کیونکہ ان میں ایسے پینشنر حضرات بھی ہیں جو ضعیف اور بیمار ہوتے ہیں پشاور جا نہیں سکتے ۔دوسرا سوال یہ ہے اسے کوئی چیز یا پیسے دینا جو کہ اس دفعہ ہیں جو 500 اور اس کے بچے کے لیے 100 روپے دیے ہیں،کیا یہ پیسے اس کو دینا جائز ہے؟رشوت تو نہیں ہے؟بائیومیٹرک سال میں دو دفعہ  جنوری اور جولائی میں ہوتا ہے۔,"<p><p style=""text-align:justify;"">1۔ اگراس طرح ڈیوائس اپنے پاس رکھ کر سہولت دینے میں واپڈا کے قوانین کی خلاف ورزی نہ ہورہی ہوتوایسا کرنے میں شرعا کوئی حرج نہیں ہے،بلکہ اگر بیمار اور ضعیف لوگوں کی خدمت وغیرہ کی نیت ہو تو اس پر اجر وثواب بھی ملے گا۔</p><p style=""text-align:justify;"">2۔آپ نے جو رقم اپنی خوشی سے اس کو اور اس کے بچے کو دی  وہ آپ کی طرف سے اس کے اور اس کے بچے کے لیے ہدیہ،اور ہدیہ لینا دینا تو مسلمانوں میں باہمی الفت ومحبت کا ذریعہ ہے۔یہ رشوت نہیں ہے،کیونکہ رشوت کہتے ہیں کہ جو کام اس کے ذمہ ادارے کی طرف سے لازم ہے اس کے کرنے پر معاوضہ  لینا،جب کہ آپ نے جو رقم اسے دی  ہے وہ کام کے معاوضہ کے طور پر نہیں دی،نیز اس نے  کسی قسم کا مطالبہ بھی نہیں کیا،  بلکہ  آپ اپنی خوشی سے دی ہے،لہذا اس میں شرعًا کوئی حرج نہیں ہے ۔</p><p style=""text-align:justify;"">تفسیر البحر المحیط میں ہے:</p><p class=""indent"" style=""text-align:justify;""><span class=""ar_writing"">""هذه آية نهي عن الرشا وأخذ الأموال على ترك ما يجب على الآخذ فعله، أو ‌فعل ‌ما ‌يجب ‌عليه تركه.""</span></p><p class=""indent"" style=""text-align:left;"">(سورۃ النحل،ج6،ص591،ط؛دار الفکر)</p><p style=""text-align:justify;"">کفایت المفتی میں ہے:</p><p class=""indent"" style=""text-align:justify;""><span style=""text-decoration:underline;""><strong>""رشوت کی تعریف:</strong></span></p><p class=""indent"" style=""text-align:justify;"">""جو کام کہ خود اس پر کرنا لازم ہے اس کے کرنے پر اجرت لینایا حق کو رشوت  لے کر ناحق کردینا یہ رشوت ہے۔""</p><p class=""indent"" style=""text-align:left;"">(کتاب القضاء والافتاء،ج2،ص274،ط؛دار الاشاعت)</p><p class=""indent"" style=""text-align:left;"">فقط واللہ اعلم</p></p>",144406101981,banuri,"('حظر و اباحت', 'mamnooaat-mubahat')","('مالِ حرام اور اس کا مصرف', 'maal-e-haraam-o-masrafa')","('رشوت / بھتہ', 'rishwat-bhatta')"
08-03-2023,https://www.banuri.edu.pk/readquestion/ehtiatan-tjdeed-e-nikah-ke-lie-gawahan-shart-hen-144408101023/08-03-2023,احتیاطا تجدید نکاح کے لیے گواہان شرط ہیں؟,اگر کوئی میاں بیوی احتیاطاً نکاح کی تجدید کرتے ہیں( احتیاطاً کا مطلب یہ ہے کہ ان سے کوئی بھی کلمہء کفر صادر نہیں ہوا وہ محض بس احتیاط کے طور ہر مہینے تجدیدِ نکاح  کرتے ہیں) تو اب کیا جب جب وہ تجدیدِ نکاح کریں گے،تو اس میں گواہوں کا ہونا لازمی ہوگا؟ کیوں کہ اس سے تو حرج لازم آئے گا ، تو گواہوں کا کیا حکم ہوگا؟,"<p><p style=""text-align:justify;"">نکاح کے درست ہونے کے لیے گواہ اور مہر کا ہونا شرط ہے، تاہم اگر احتیاطاً تجدیدِ نکاح کیا جائے  یعنی جب  تفریق کے اسباب میں سے کسی سبب کےبغیر تجدیدِ نکاح کیا جائے ،تو اس  میں  نیا مہر مقرر کرنا لازم نہیں ہے، البتہ گواہان کی موجودگی شرط ہے، اس کے بغیر تجدیدِ نکاح درست نہیں ہوگا، آپ کی بالغ اولاد، گھر کے افراد و دیگر رشتہ دار بھی نکاح کے گواہ بن سکتے ہیں ، اس لیے گواہان کی شرط میں  حرج نہیں ہے ، ہاں  مہر کی شرط میں حرج پایا جا رہا تھا اس لیے احتیاطا  تجدیدِ نکاح میں مہر کی شرط کو ساقط کر دیا گیا ہے جب کہ  گواہان کی شرط کو باقی رکھا گیا ہے۔</p><p style=""text-align:justify;""><span class=""ar_writing"">""الدر المختار مع رد المحتار""</span> میں ہے:</p><p class=""indent"" style=""text-align:justify;""><span class=""ar_writing"">""(و) شرط (حضور) شاهدين (حرين) أو حر وحرتين (مكلفين سامعين قولهما معا) على الأصح (فاهمين)أنه نكاح على المذهب بحر (مسلمين لنكاح مسلمة ولو فاسقين أو محدودين في قذف أَوْ أو أعميين أو ابني الزوجين أو ابني أحدهما، وإن لم يثبت النكاح بهما) بالابنين (إن ادعى القريب.</span></p><p class=""indent"" style=""text-align:justify;""><span class=""ar_writing"">(قوله: وإن لم يثبت النكاح بهما) أي بالابنين أي بشهادتها، فقوله: بالابنين بدل من الضمير المجرور، وفي نسخة لهما أي للزوجين، وقد أشار إلى ما قدمناه من الفرق بين حكم الانعقاد، وحكم الإظهار أي ينعقد النكاح بشهادتهما، وإن لم يثبت بها عند التجاحد وليس هذا خاصا بالابنين كما قدمناه.</span></p><p class=""indent"" style=""text-align:justify;""><span class=""ar_writing"">(قوله: إن ادعى القريب) أي لو كانا ابنيه وحده أو ابنيها وحدها فادعى أحدهما النكاح وجحده الآخر لا تقبل شهادة ابني المدعي له بل تقبل عليه، ولو كانا ابنيهما لا تقبل شهادتهما للمدعي، ولا عليه لأنها لا تخلو عن شهادتهما لأصلهما، وكذا لو كان أحدهما ابنها والآخر ابنه لا تقبل أصلا كما في البحر.""</span></p><p class=""indent"" style=""text-align:left;""><span class=""ar_writing"">(كتاب النكاح، ج:3، ص:21-24، ط:سعید)</span></p><p style=""text-align:justify;""><span class=""ar_writing"">""رد المحتار ""</span>میں ہے:</p><p class=""indent"" style=""text-align:justify;""><span class=""ar_writing"">""والاحتياط أن ‌يجدد ‌الجاهل إيمانه كل يوم ويجدد ‌نكاح امرأته عند شاهدين في كل شهر مرة أو مرتين، إذ الخطأ وإن لم يصدر من الرجل فهو من النساء كثير.""</span></p><p class=""indent"" style=""text-align:left;""><span class=""ar_writing"">(مقدمة، ج:1، ص:42، ط:سعيد)</span></p><p class=""indent"" style=""text-align:left;""><span class=""ar_writing"">فقط والله أعلم</span></p></p>",144408101023,banuri,"('نکاح', 'nikah')","('نکاح صحیح', 'nikah-e-sahih')","('تجدیدِ نکاح', 'tajdeed-e-nikah')"
16-03-2023,https://www.banuri.edu.pk/readquestion/rishtey-key-ley-mujarrab-amal-144408101989/16-03-2023,رشتے کے لیے مجرب عمل,میں بہت سالوں سے رشتے کے سلسلے میں پریشان ہوں  والدین بھی پریشان ہیں ،لوگ آتےہیں اور واپس چلے جاتےہیں بات نہیں بنتی،کوئی عمل بتادیں۔,"<p><p style=""text-align:justify;"">مناسب رشتے کے لیے صدقِ دل سے نمازوں کے بعد اور تہجد کے وقت دعامانگیں،اور صلاۃ الحاجت کا اہتمام کریں، مندرجہ ذیل معمولات میں سے کوئی ایک یا سب اختیار کرسکتے ہیں۔</p><p style=""text-align:justify;"">1۔<span class=""qr_writing"">{ رَبِّ إِنِّي لِمَاأَنزَلْتَ إِلَيَّ مِنْ خَيْرٍ فَقِيرٌ}</span> کا کثرت سے ورد کریں۔</p><p style=""text-align:justify;"">2۔نمازِ عشاء  کے بعد اول وآخر گیارہ گیارہ مرتبہ درود شریف اوردرمیان میں گیارہ سومرتبہ ""<span class=""qr_writing"">یاَلَطِیْفُ</span>""پڑھ کراللہ تعالیٰ سے دعاکرنا بھی مجرب ہے۔</p><p style=""text-align:justify;"">3۔نمازِ عشاء کے بعد تنہائی میں دو رکعت صلاۃ الحاجت پڑھ کر اُس کے بعد اول وآخر 7 دفعہ درود شریف اور درمیان میں <span class=""qr_writing"">""یَابَدِیْعَ الْعَجَائِبِ بِالْخَیِْر یَا بَدِیْعُ""</span>101 مرتبہ پڑھ کر اللہ تعالٰی سے دعا کیاکریں۔</p><p style=""text-align:justify;"">4۔روزانہ سورۂ ""<span class=""ar_writing"">یسن</span>"" کی تلاوت کر نے  کے بعد اللہ تعالٰی سے یقین کے ساتھ دعاء کیا کریں۔</p><p style=""text-align:justify;"">5۔ فجر اور مغرب کی نمازوں کے بعد ایک ایک مرتبہ سورۃ واقعہ اور سورۃ طارق پڑھنے کا معمول بنائیں۔</p><p style=""text-align:justify;"">کنز العمال میں ہے:</p><p class=""indent"" style=""text-align:justify;""><span class=""ar_writing"">""اقرأوا ""يس""؛ فإن فيها عشر بركات ما قرأها جائع إلا شبع وما قرأها عار إلا اكتسى وما قرأها أعزب إلا تزوج وما قرأها خائف إلا أمن وما قرأها محزون إلا فرح وما قرأها مسافر إلا أعين على سفره وما قرأها رجل ضلت له ضالة إلا وجدها وما قرئت على ميت إلا خفف عنه وما قرأها عطشان إلا روی وما قرأها مريض إلا برء.""</span></p><p class=""indent"" style=""text-align:left;""><span class=""ar_writing"">(حرف الهمزة، الكتاب الثاني من حرف  الهمزة في الأذكار من قسم الأقوال، الباب السابع في تلاوة القرآن وفضائله، الفصل الثاني في فضائل السور،  فضائل السور الباقية من الإكمال، ج:ص:590-589،  ط: مؤسسة الرسالة)</span></p><p><span style=""text-align:justify;"">آپ کے مسائل اور اُن کا حل میں ہے:</span></p><p class=""indent"" style=""text-align:justify;"">"" نماز عشاء کے بعد اول و آخر گیارہ گیارہ مرتبہ درود شریف اور درمیان میں گیارہ سو مرتبہ ""یا لطیف"" پڑھ کر اللہ تعالٰی سے دعا کریں، اللہ رب العزت آپ کی مشکل آسان فرمائے۔""</p><p class=""indent"" style=""text-align:left;"">( اوراد و وظائف، بعنوان: رشتہ کے لیے وظیفہ،ج:4، ص:251،  ط: مکتبہ لدھیانوی )</p><p style=""text-align:justify;""><span class=""ar_writing"">وفيه ايضاً:</span></p><p class=""indent"" style=""text-align:justify;"">""رشتہ کے لیے وظیفہ:</p><p class=""indent"" style=""text-align:justify;"">سوال: میں ایک بیوہ عورت ہوں، میری ایک بیٹی ہے، جس کا رشتہ کافی سالوں کی کوشش کے باوجود نہیں ہورہا ہے، میری خواہش ہے کہ اس کا رشتہ کسی صالح اور دین گھرانے میں ہوجائے، اُس کے لیے کوئی وظیفہ ارشاد فرمائیں۔۔۔۔۔</p><p class=""indent"" style=""text-align:justify;"">جواب: دل سے دعا کرتا ہوں، نماز عشاء کے بعد اول وآخر گیارہ گیارہ مرتبہ درود شریف اور درمیان میں گیارہ سو مرتبہ ""یاَلَطِیْفُ"" پڑھ کر اللہ تعالٰی سے دعا کریں، اللہ رب العزت آپ کی مشکل کو آسان فرمائے''۔</p><p class=""indent"" style=""text-align:left;"">(اوراد و وظائف، عنوان: رشتہ کے لیے وظیفہ، ج:4، ص:21، ط : مکتبہ لدھیانوی)</p><p style=""text-align:justify;"">فتاوٰی محمودیہ میں ہے:</p><p class=""indent"" style=""text-align:justify;"">""شادی ہونے کے لیے عمل:</p><p class=""indent"" style=""text-align:justify;"">سوال: حنیف خان کا لڑکا معین خان ہے، جو اس وقت بالغ ہے، لیکن ایک آنکھ خراب ہونے کی وجہ سے اس کی شادی نہیں ہوتی ہے، آپ دعا کیجیے، اور ایک تعویذ لکھ لیجیے۔</p><p class=""indent"" style=""text-align:justify;"">الجواب حامدًا ومصلیًا: معین کو بتادیں کہ وہ بعد عشاء تنہائی میں دو رکعت نمازِ حاجت پڑھ کر ""یَابَدِیْعَ الْعَجَائِبِ بِالْخَیِْر یَا بَدِیْعُ"" 101 دفعہ ، اول آخر درود شریف 7 دفعہ پڑھ کر دعاء کیا کریں، حق تعالٰی کا میاب فرمائے۔فقط واللہ اعلم""</p><p class=""indent"" style=""text-align:left;"">(بقیۃ کتاب الحظر والا باحۃ، باب مایتعلق بالسحرۃ والعوذۃ، الفصل الثالث فی العملیات والوظائف والاوراد، شادی ہونے کے لیے عمل،ج:20ص:89-90،  ط: ادار ۃ الفاروق)</p><p class=""indent"" style=""text-align:left;"">فقط واللہ أعلم</p></p>",144408101989,banuri,"('علوم و فنون', 'uloom-funoon')","('دعائیں، اوراد اور وظائف', 'adeya-azkar')","('اوراد ووظائف', 'aurad-o-wzaif')"
