issued_at,link,title,question,answer,fatwa_number,dar_ul_ifta,kitab,bab,fasal
08-10-2022,https://www.banuri.edu.pk/readquestion/hamnah-aashir-azlan-naam-rakhna-144403100880/08-10-2022,حمنہ، عاشر، اذلان نام رکھنا,میری بیٹی کا نام حمنہ بلال (چھے سال) اور بیٹے کا نام محمد عاشر بلال (تین سال) ہے۔برائے مہربانی ان کے نام کے درست معنی بتا دیں ۔اور دوسرے بیٹے کا نام محمد اذلان بلال رکھا ہے۔ اس نام کے معنی کے بارے میں بھی رہنمائی فرما دیں۔,"<p><p style=""text-align:justify;""><strong>حمنہ:</strong> حا  کے  زبر ، اور میم کے سکون اور نون کے زبر  کے ساتھ ہے،اس کا معنیٰ   "" چھوٹی چیچڑیاں"" کے ہیں۔( مصباح اللغات ص: ۱۷۸)</p><p style=""text-align:justify;"">امّ المومنین حضرت زینب بنتِ جحش رضی اللہ عنہا کی بہن،  حضور صلی اللہ علیہ وسلم کی سالی کا نام تھا،  یہ نام رکھ سکتے ہیں، کیوں  صحابہ و صحابیات کے ناموں پر نام رکھنے میں  صحابیت  کی  نسبت  برکت کا باعث  ہونے کے لیے  کافی ہوتی ہے،لہذا صحابہ کرام رضوان اللہ علیہم اجمعین کے  ناموں میں   معنیٰ کی طرف نظر کرنے کی ضرورت نہیں، لہذا رکھا ہوا نام بدلنے کی ضرورت نہیں ، البتہ اگر نام رکھا نہ ہو ، تو بہتر  ہوگا  کہ  ایسا نام رکھا جائے جو  صحابیات رضوان اللہ علیہن   کے ناموں میں سے  ہو اور اس کا معنیٰ بھی اچھا ہو۔ </p><p style=""text-align:justify;""><span class=""ar_writing"">اسد الغابة في معرفة الصحابة </span>میں ہے: </p><p class=""indent"" style=""text-align:justify;""><span class=""ar_writing"">"" حمنة بنت جحش وقد تقدم نسبها في أخويها: عبد الله وعبيد، قال أبو نعيم: حمنة بنت جحش بن رياب، تكنى أم حبيبة.</span></p><p class=""indent"" style=""text-align:justify;""><span class=""ar_writing"">وقال ابن منده: حمنة بنت جحش، وقيل: حبيبة.</span></p><p class=""indent"" style=""text-align:justify;""><span class=""ar_writing"">قال أبو عمر: حمنة بنت جحش، كانت تستحاض هي وأختها أم حبيبة بنت جحش، وهي أخت زينب بنت جحش أم المؤمنين زوج النبي صلى الله عليه وسلم حمنة زوج مصعب بن عمير، فقتل عنها يوم أحد، فتزوجها طلحة بن عبيد الله، فولدت له محمدا وعمران ابني طلحة.</span></p><p class=""indent"" style=""text-align:justify;""><span class=""ar_writing"">وأمها أميمة بنت عبد المطلب، عمة رسول الله صلى الله عليه وسلم وكانت ممن قال في الإفك على عائشة رضي الله عنها، فعلت ذلك حمية لأختها زينب، إلا أن زينب رضي الله عنها لم تقل فيها شيئا، فقال بعضهم: إنها جلدت مع من جلد فيه، وقيل: لم يجلد أحد، وكانت من المهاجرات وشهدت أحدا فكانت تسقي العطشى، وتحمل الجرحى وتداويهم.</span></p><p class=""indent"" style=""text-align:justify;""><span class=""ar_writing"">روت عن النبي صلى الله عليه وسلم روى عنها ابنها عمران بن طلحة."" </span></p><p class=""indent"" style=""text-align:left;""><span class=""ar_writing"">( حرف الحاء، ٦٨٥٧- حمنة بنت جحش، ٧ / ٧١، ط: دار الكتب العلمية)</span></p><p style=""text-align:justify;""><span class=""ar_writing"">لسان العرب</span>میں ہے:</p><p class=""indent"" style=""text-align:justify;""><span class=""ar_writing"">""حمن: الحمن والحمنان: صغار القردان، واحدته حمنة وحمنانة. وأرض محمنة: كثيرة الحمنان. والحمنان: ضرب من عنب الطائف، أسود إلى الحمرة . قليل الحبة، وهو أصغر العنب حبا، وقيل: الحمنان الحب الصغار التي بين الحب العظام. وقال الجوهري: الحمنانة قراد، وفي التهذيب: القراد أول ما يكون وهو صغير لا يكاد يرى من صغره، يقال له قمقامة، ثم يصير حمنانة، ثم قرادا، ثم حلمة، زاد الجوهري: ثم عل وطلح.""</span></p><p class=""indent"" style=""text-align:left;""><span class=""ar_writing"">(حرف النون، فصل الحاء المهملة، ١٣ / ١٢٨، ط: دار صادر۔بيروت)</span></p><p style=""text-align:justify;"">مصباح اللغات میں ہے:</p><p class=""indent"" style=""text-align:justify;"">""<span class=""ar_writing"">الحمن والحمنان</span>: چھوٹی چیچڑیاں، واحد:<span class=""ar_writing"">حمنة و حمنانة</span>،اصمعی نے کہا کہ چیچڑی جب بہت چھوٹی ہو تو اس کو "" <span class=""ar_writing"">قمقامة</span>"" کہتےہیں، پھر ""<span class=""ar_writing"">حمنان</span> ""پھر ""<span class=""ar_writing"">قُراد</span>"" پھر ""<span class=""ar_writing"">حَلَمة</span>"" پھر ""<span class=""ar_writing"">عَلَّ</span>"" پھر ""<span class=""ar_writing"">وطلح</span>"".""</p><p class=""indent"" style=""text-align:left;"">( مادہ:ح۔ م ۔ ل،صفحہ نمبر: ۱۷۸،ط:قدیمی کتب خانہ)</p><p style=""text-align:justify;""><strong>عاشر:</strong> کے معنی مل جل کر رہنے والے کے آتے ہیں،  لہذا محمد عاشر بلال نام رکھنا درست ہے،نیز  قدیم اہل علم میں عاشر نام ملتا ہے۔</p><p style=""text-align:justify;""><span class=""ar_writing"">معجم اللغة العربية المعاصرة </span>میں ہے:</p><p class=""indent"" style=""text-align:justify;""><span class=""ar_writing"">""عاشر يعاشر، معاشرة، فهو معاشر، والمفعول معاشر</span></p><p class=""indent"" style=""text-align:justify;""><span class=""ar_writing""> عاشر فلانا: خالطه وصاحبه رافقه وتعامل معه ""عاشر العلماء/ جيرانه- معاشرة الصالحين طيبة- قل لي من تعاشر أقل لك من أنت-</span></p><p class=""indent"" style=""text-align:justify;""><span class=""ar_writing"">وعاشر بمعروف وسامح من اعتدى ... وفارق ولكن بالتي هي أحسن- {وعاشروهن بالمعروف} "".</span></p><p class=""indent"" style=""text-align:justify;""><span class=""ar_writing""> عاشر زوجته: جامعها.""</span></p><p class=""indent"" style=""text-align:left;""><span class=""ar_writing"">( ع ش ر، ٢ / ١٥٠١، ط: عالم الكتب )</span></p><p style=""text-align:justify;""><span class=""ar_writing"">دليل الحيران على مورد الظمآن </span> میں ہے:</p><p class=""indent"" style=""text-align:justify;""><span class=""ar_writing"">"" عبد الواحد بن عاشر، هو أبو محمد بن عبد الواحد بن أحمد بن عاشر الأنصاري الأندلسي، المغربي الفاسي.</span></p><p class=""indent"" style=""text-align:justify;""><span class=""ar_writing"">هاجر أجداده من الأندلس إلى المغرب، وبعد مدة سكنت أسرته مدينة فاس العلمية.</span></p><p class=""indent"" style=""text-align:justify;""><span class=""ar_writing"">مولده:</span></p><p class=""indent"" style=""text-align:justify;""><span class=""ar_writing"">ولد عبد الواحد بن عاشر بمدينة فاس سنة ٩٩٠هـ الموافق سنة ١٥٨١م، في أسرة علمية، وذات فضل وعلم ووقار وورع، فنشأ على حب العلم، ومكارم الأخلاق، فتربى تربية دينية ملتزمة، في فقه وعلم وأدب.""</span></p><p class=""indent"" style=""text-align:left;""><span class=""ar_writing"">( نشوء المدارس الخاصة بالقراءات القرآنية، العالم الفقيه المقرئ عبد الواحد بن عاشر، ص: ٢٣، ط: دار الحديث- القاهرة)</span></p><p style=""text-align:justify;""> <strong>اذلان:</strong>اردو، عربی اور فارسی تینوں زبانوں کی لغت کی کتابوں میں  تلاش کرنے کے باوجود  ""اذلان""   کا معنی نہیں مل سکا، البتہ یہ ترکی زبان کا لفظ ہے جسے  فارسی زبان میں مستعمل ""ارسلان"" سے منتقل کیا گیا ہے، جس کے معنی: شیر کے ہیں، اور مجازا بہادر  و شجاعت کے معنی لیے جاتے ہیں، اسی طرح ملائی زبان میں بھی اس کا استعمال پایا جاتاہے۔</p><p style=""text-align:justify;"">بہرحال ''اذلان'' نام رکھنا جائز تو ہے، لیکن بہتر یہ ہے کہ بچوں کے نام حضرات انبیاء کرام علیہم السلام  یا صحابہ کرام رضوان اللہ علیہم اجمعین کے ناموں پر رکھے جائیں یا کم از کم عربی کے اچھے معنی والے نام رکھے جائیں۔</p><p style=""text-align:justify;"">دیکھیے: <a href=""https://www.banuri.edu.pk/readquestion/%D8%B1%D9%88%D8%B2%D8%A7%D9%86-%DB%8C%D8%A7-%D8%A7%D8%B0%D9%84%D8%A7%D9%86-%D9%86%D8%A7%D9%85-%D8%B1%DA%A9%DA%BE%D9%86%D8%A7/07-02-2019"">روزان یا اذلان نام رکھنا</a></p><p style=""text-align:justify;""><span class=""ar_writing"">المحيط البرهاني في الفقه النعماني</span> میں ہے:</p><p class=""indent"" style=""text-align:justify;""><span class=""ar_writing"">"" روي عن رسول الله صلى الله عليه وسلم، قال: «سموا أولادكم أسماء الأنبياء وأحب الأسماء إلى الله تعالى؛ عبد الله، وعبد الرحمن» قال الفقيه أبو الليث: لا أحب للعجم أن يسموا عبد الرحمن عبد الرحيم؛ لأن العجم لا يعرفون تفسيره، فيسمونه بالتصغير، وروي عن النبي عليه السلام: أنه نهى أن يسمى المملوك نافعا أو بركة، أو ما أشبه ذلك، قال الراوي:؛ لأنه لم يحب أن يقال: ليس ههنا بركة، ليس ههنا نافع إذا طلبه إنسان، وفي الأثر: «لا يقول الرجل عبدي وأمتي، بل يقول: فتاي وفتاتي» .</span></p><p class=""indent"" style=""text-align:justify;""><span class=""ar_writing"">وفي «الفتاوى» : التسمية باسم لم يذكره الله تعالى في كتابه ولا ذكره رسول الله عليه السلام، ولا استعمله المسلمون تكلموا فيه، والأولى أن لا تفعل.""</span></p><p class=""indent"" style=""text-align:left;""><span class=""ar_writing"">( كتاب الاستحسان والكراهية، الفصل الرابع والعشرون في تسمية الأولاد وكناهم، ٥ / ٣٨٢، ط: دار الكتب العلمية، بيروت - لبنان)</span></p><p class=""indent"" style=""text-align:left;"">فقط واللہ اعلم </p></p>",144403100880,banuri,"('حظر و اباحت', 'mamnooaat-mubahat')","('نام، لقب، کنیت', 'asaami')","('ناموں کے معانی اور احکام', 'namoun-ke-mani-or-ahkaam')"
09-03-2023,https://www.banuri.edu.pk/readquestion/jawab-nama-me-salam-ka-jawab-pehle-deya-jaey-144408101093/09-03-2023,جواب نامہ میں سلام کا جواب پہلے دیا جائے,"کسی سوال کے شروع میں سائل کی طرف سے سلام لکھا ہوا ہوتا ہے ،تو اب مفتی صاحب پہلے سلام کا جواب لکھیں گے یا پہلے سوال کا جواب لکھیں گے؟ اور اس سلسلے میں بہتر طریقہ کون سا ہے؟ یعنی جواب  تحریر کرنے سے پہلے سلام لکھنا چاہیے یا نہیں؟ مفتی زید صاحب کا کہنا ہے کہ "" السلام قبل الکلام"" کے تحت پہلے سلام کا جواب لکھا جائے پھر سوال کا جواب لکھا جائے؟","<p><p style=""text-align:justify;""><span class=""ur_writing"">سلام کے جواب کو  کلام سے مقدم رکھناچاہیے؛لہذاکسی خط اورسوال کے جواب نامہ میں بھی پہلے سلام کاجواب دیاجائے۔</span></p><p align=""right"" style=""text-align:justify;""><span class=""ur_writing"" dir=""rtl"" lang=""er"" xml:lang=""er"">مرقاۃ المفاتیح میں ہے:</span></p><p align=""right"" class=""MsoNormal indent"" style=""text-align:justify;""><span dir=""rtl"" lang=""ar-sa"" style=""font-size:16pt;line-height:107%;font-family:'Times New Roman',serif;"" xml:lang=""ar-sa""><span class=""ar_writing"">""(وعن جابر - رضي الله تعالى عنه - قال: قال رسول الله صلى الله عليه وسلم: «السلام قبل الكلام» ) . لأنه تحية يبدأ به فيفوت بافتتاح الكلام كتحية المسجد، فإنها قبل الجلوس، وقد روى القضاعي عن أنس مرفوعا: "" «السلام تحية لملتنا وأمان لذمتنا» "". (رواه الترمذي، وقال: هذا حديث منكر) أي: إسنادا، وإلا فهو معروف من جهة صحة المعنى كما قررناه.""</span></span></p><p align=""right"" class=""MsoNormal indent"" style=""text-align:left;""><span dir=""rtl"" lang=""ar-sa"" style=""font-size:16pt;line-height:107%;font-family:'Times New Roman',serif;"" xml:lang=""ar-sa""><span class=""ar_writing"">[كتاب الأداب،باب السلام، ٧/٢٩٤٨، ط:دارالفكر]</span></span></p><p align=""right""><span dir=""rtl"" lang=""er"" xml:lang=""er"">التنویر شرح الجامع الصغیر میں ہے:</span></p><p align=""right"" class=""MsoNormal indent"" style=""text-align:justify;""><span dir=""rtl"" lang=""ar-sa"" style=""font-size:16pt;line-height:107%;font-family:'Times New Roman',serif;"" xml:lang=""ar-sa""><span class=""ar_writing"">""(السلام قبل الكلام) لأن الابتداء به تفاؤلا بالسلامة وإيناسا لمن يخاطبه وتبركا بسم الله تعالى وهذا يشمل المخاطبة والمكاتبة والمراد أن السنة لمن أراد أن يكلم أحدا أن يبدأه بالسلام.</span></span></p><p align=""right"" class=""indent"" style=""text-align:justify;""><span class=""ar_writing"" dir=""rtl"" lang=""ar-sa"" xml:lang=""ar-sa""> قال ابن القيم: ويذكر عن المصطفى أنه كان لا يأذن لمن لا يبدأ بالسلام. (ت) عن جابر) قال الترمذي: إنه منكر...</span></p><p align=""right"" class=""indent"" style=""text-align:justify;""><span class=""ar_writing""><span dir=""rtl"" lang=""ar-sa"" xml:lang=""ar-sa"">(السلام قبل الكلام، ولا تدعوا أحدا إلى الطعام حتى يسلم) لأن الدعاء إلى الطعام إكرام للمدعوا ومن أعرض عن السلام لم يستحق الإكرام. عن جابر) قال الهيثمي: في إسناده من لم أعرفه قال ابن القيم: هذا وإن كان إسناده وما قبله ضعيفا فالعمل عليه وقد اعتضد بإسناد حسن وهو الحديث الآتي :</span></span></p><p align=""right"" class=""indent"" style=""text-align:justify;""><span class=""ar_writing""><span dir=""rtl"" lang=""ar-sa"" xml:lang=""ar-sa"">(السلام قبل السؤال، فمن بدأكم بالسؤال) عن أي شيء. (قبل السلام فلا تجيبوه) لأنه لا يستحق الجواب لإعراضه عن السنة فيعرض عنه. (ابن النجارعن عمر) وقد أخرجه أحمد عن عمر.""</span></span></p><p align=""right"" class=""indent"" style=""text-align:left;""><span class=""ar_writing"" dir=""rtl"" lang=""er"" xml:lang=""er""><span lang=""ar-sa"" xml:lang=""ar-sa""> <span dir=""rtl"">[حرف السين المعرف باللام، ٦/٤٨٤، ط:دارالسلام ،رياض]</span></span><br/></span></p><p align=""right""><span dir=""rtl"" lang=""er"" xml:lang=""er"">المسالک فی شرح موطاً مالک میں ہے:</span></p><p align=""right"" class=""indent"" style=""text-align:justify;""><span class=""ar_writing""><span dir=""rtl"" lang=""ar-sa"" xml:lang=""ar-sa"">""أجمع العلماء على أنّ الابتداء بالسّلام سُنَّةٌ، وان الرَّدِّ فرضٌ، لقوله: {فَحَيُّوا بِأَحْسَنَ مِنْهَا أَوْ رُدُّوهَا}</span><span dir=""rtl"" lang=""ar-sa"" xml:lang=""ar-sa"">.....</span> <span dir=""rtl"" lang=""ar-sa"" xml:lang=""ar-sa"">وقال الطّحاويُّ: ""ردُّ السّلام من الفُروض المتَعيّنة على كلِّ إنسانٍ بنفسه، لا ينوبُ عنه فيها أحدٌ غيره"" فجعله فرض عين، وهذا ما لم يقله أحدٌ من العلماء، وإنّما قالوا: إنّه من فروضِ الكفايةِ، إذا قام به البعض سقط عن الباقين.</span></span></p><p align=""right"" class=""indent"" style=""text-align:justify;""><span class=""ar_writing"" dir=""rtl"" lang=""ar-sa"" xml:lang=""ar-sa"">وروى أبو عيسى التَّرمذيّ حديثًا مُنْكَرًا ضعيفًا، عن جابر، قال: قال رسول الله صلّى الله عليه وسلم: ""السَّلامُ قبلَ الكَلَامِ"" وإن كان ليس بصحيحٍ فله معنى صحيح؛ لأنّ السَّلام فرضٌ.""</span></p><p align=""right"" class=""indent"" style=""text-align:left;""><span class=""ar_writing""><span dir=""rtl"" lang=""ar-sa"" xml:lang=""ar-sa"">[جامع ماجاء في الطعام والشراب،العمل في السلام، ٧/٥١٠، ط:دارالغرب الإسلامي]</span></span></p><p align=""right"" class=""indent"" style=""text-align:left;""><span class=""ar_writing""><span dir=""rtl"" lang=""ar-sa"" xml:lang=""ar-sa"">فقط والله أعلم</span></span></p></p>",144408101093,banuri,"('حقوق و آدابِ معاشرت', 'huqooq-muashret')","('حقوق', 'bahmi-huqooq')","('عام مسلمانوں کے حقوق', 'aam-musalmanon-k-huqoq')"
21-03-2023,https://www.banuri.edu.pk/readquestion/sas-ko-zkat-dyny-ka-hukum-144408102498/21-03-2023,ساس کو زکاۃ دینے کو حکم,کیا ساس کو زکاۃ دے سکتے ہیں ؟جب کہ وہ بیوہ ہیں ،ایک بیٹا دبئی میں ہے ،جس کی آمدن بہت کم ہونے کی وجہ سے گھر کا خرچہ مشکل سے چلتا ہے ،اور ایک بیٹا آوارہ ہے ۔,"<p><p style=""text-align:justify;"">صورتِ مسئولہ میں اگر واقعۃ  سائل کی ساس زکوۃ کی  مستحق ہیں (یعنی  ان کی ملکیت میں  ساڑھے باون تولہ چاندی یا اس کی مالیت کے بقدر رقم  یا ضرورت و استعمال سے زائد اتنی مالیت کا  سامان موجود نہیں ہے  اور وہ  ہاشمی یعنی سید یا عباسی وغیرہ بھی نہیں ہیں)  تو  ان کو زکاۃ  دینا جائز ہے۔</p><p>سنن ترمذی میں ہے :</p><p class=""indent"" style=""text-align:justify;""><span class=""ar_writing"">""عن ‌حفصة بنت سيرين،عن ‌الرباب،عن عمها ‌سلمان بن عامر يبلغ به النبي صلى الله عليه وسلم قال: ‌الصدقة ‌على ‌المسكين صدقة، وهي على ذي الرحم ثنتان:صدقةوصلة.""</span></p><p class=""indent"" style=""text-align:left;""><span class=""ar_writing"">(باب ماجاءفي الصدقةعلي ذي القرابة،ج :2،ص:39،ط :دارالغربالاسلامي)</span></p><p>بدائع الصنائع میں ہے :</p><p class=""indent"" style=""text-align:justify;""><span class=""ar_writing"">""‌ويجوز ‌دفع ‌الزكاة إلى من سوى الوالدين والمولودين مسان الأقارب ومن الإخوة والأخوات وغيرهم.""</span></p><p class=""indent"" style=""text-align:left;""><span class=""ar_writing"">(كتاب الزكاة،فصل حولان الحول هل هومن شرائط اداءالزكاة،ج :2،ص :50،ط :دارالكتب العلمىة)</span></p><p>فتاوی شامی میں ہے :</p><p class=""indent"" style=""text-align:justify;""><span class=""ar_writing"">""باب المصرف أي مصرف الزكاة والعشر، وأما خمس المعدن فمصرفه كالغنائم (هو فقير، وهو من له أدنى شيء) أي دون نصاب أو قدر نصاب غير نام مستغرق في الحاجة.""</span></p><p class=""indent"" style=""text-align:left;""><span class=""ar_writing"">(كتاب الزكاه،باب مصرف الزكاة والعشر،ج :2،ص :341،ط :سعيد)</span></p><p style=""text-align:right;"">ہدایہ شریف میں ہے :</p><p class=""indent"" style=""text-align:justify;""><span class=""ar_writing"">""ويجوز ‌دفعها إلى من يملك أقل من ذلك وإن كان صحيحا مكتسبا "" لأنه فقير والفقراء هم المصارف ولأن حقيقة الحاجة لا يوقف عليها فأدير الحكم على دليلها وهو فقد النصاب.""</span></p><p class=""indent"" style=""text-align:left;""><span class=""ar_writing"">(كتاب الزكاة ،باب من يجوز الدفع إليه الصدقة ومن لايجوز،ج :1،ص :112،ط :دار إحياءالتراث العربي)</span></p><p class=""indent"" style=""text-align:left;""><span class=""ar_writing"">فقط والله أعلم</span></p></p>",144408102498,banuri,"('زکات', 'zakat')","('مصارف', 'masaaref')","('رشتہ داروں کو زکوٰۃ دینا', 'rishtedaron-ko-zakat-dena')"
15-02-2023,https://www.banuri.edu.pk/readquestion/baiti-ky-lye-rumaisa-nam-rakhna-144407102037/15-02-2023,بیٹی کے لیے رمیصاء نام رکھنا,"بیٹی کا نام ""رُمَیصاء"" رکھنا چاہتا ہوں، کیا یہ نام درست ہے؟","<p><p style=""text-align:justify;"">""رُمَیصاء""  بعض صحابیات رضوان اللہ عنہن کا نام ہے، لہٰذا یہ نام رکھنا جائز ہے۔</p><p style=""text-align:justify;"">اسد الغابۃ فی معرفۃ الصحابۃ میں ہے:</p><p class=""indent"" style=""text-align:justify;""><span class=""ar_writing"">""الرميصاء أم أنس بن مالك</span></p><p class=""indent"" style=""text-align:justify;""><span class=""ar_writing"">د ع: الرميصاء وقيل الغميصاء وهي أم أنس بن مالك. روت عنها عائشة، وأم سلمة، وابنها أنس بن مالك، وغيرهم. وهي امرأة أبي طلحة، وهي بكنيتها أشهر، وكنيتها أم سليم.</span></p><p class=""indent"" style=""text-align:justify;""><span class=""ar_writing"">(2258) أخبرنا أبو الفضل المخزومي الفقيه، بإسناده عن أبي يعلى، حدثنا صالح بن مالك، حدثنا عبد العزيز بن أبي سلمة، عن محمد بن المنكدر، عن جابر، قال: قال رسول الله صلى الله عليه وسلم: "" أريت أني دخلت الجنة، فإذا أنا بالرميصاء امرأة أبي طلحة.""</span></p><p class=""indent"" style=""text-align:left;""><span class=""ar_writing"">(كتاب النساء، حرف الراء، الرميصاء، 120/7، ط: دار الكتب العلمية)</span></p><p style=""text-align:justify;"">وفیہ ایضًا:</p><p class=""indent"" style=""text-align:justify;""><span class=""ar_writing"">""الرميصاء</span></p><p class=""indent"" style=""text-align:justify;""><span class=""ar_writing"">د ع: الرميصاء وقيل الغميصاء شكت زوجها إلى النبي صلى الله عليه وسلم سليمان بن يسار، عن عبد الله بن العباس، قال: جاءت الرميصاء أو الغميصاء إلى رسول الله صلى الله عليه وسلم تشكو زوجها، وتزعم أنه لا يصل إليها.</span></p><p class=""indent"" style=""text-align:justify;""><span class=""ar_writing"">فما كان إلا يسيرا حتى جاء زوجها، فزعم أنها كاذبة، ولكنها تريد أن ترجع إلى زوجها الأول، فقال لها رسول الله صلى الله عليه وسلم: "" ليس لك ذلك حتى يذوق عسيلتك رجل غيره.""</span></p><p class=""indent"" style=""text-align:left;""><span class=""ar_writing"">(كتاب النساء، حرف الراء، الرميصاء، 120/7، ط: دار الكتب العلمية)</span></p><p class=""indent"" style=""text-align:left;"">فقط واللہ اعلم</p></p>",144407102037,banuri,"('حظر و اباحت', 'mamnooaat-mubahat')","('نام، لقب، کنیت', 'asaami')","('ناموں کے معانی اور احکام', 'namoun-ke-mani-or-ahkaam')"
