issued_at,link,title,question,answer,fatwa_number,dar_ul_ifta,kitab,bab,fasal
18-10-2022,https://www.banuri.edu.pk/readquestion/spalni-nami9-jari-botui-ku-nazre-bad-kai-lie-jalana-144403101717/18-10-2022,سپیلنی نامی جڑی بوٹی کو نظر بد کے لیے جلانا,"""سپیلنی"" نام کی جڑی بوٹی جو نظر بد دور کرنے  کے لیے جلائی جاتی ہے٫اور دھواں کرتی ہے ،تو کیا یہ روایات سے ثابت ہے؟","<p><p style=""text-align:justify;"">  نظر بد سے حفاظت کی غرض سے مذکورہ جڑی بوٹی کو استعمال کیے  جانے کا عمل  شریعت و سنت سے ثابت تو نہیں ،البتہ لوگوں کے تجربات میں سے ہوسکتا ہے، اس لئے بطور علاج اسے اختیار کرنے میں کوئی حرج نہیں ہے، البتہ اسے سنت  سمجھ کر کرنا درست نہیں ہے،نظر بد سے حفاظت اور اس کا اثر ختم کرنے کے کئی طریقے احادیثِ مبارکہ سے معلوم ہوتے ہیں ، جن میں سے کچھ مندرجہ ذیل ہیں ،ان پر عمل کرلیا جائے تو ان شاء اللہ نظر بد کا اثر ختم ہوجائے گا:</p><p style=""text-align:justify;"">1۔سورۂ فاتحہ ، آیۃ الکرسی ،معوذتین اور مندرجہ ذیل دعاپڑھیں:</p><p class=""indent"" style=""text-align:justify;""><span class=""ar_writing"">"" أَعُوذُ بِكَلِمَاتِ اللّٰهِ التَّامَّةِ مِنْ كُلِّ شَيْطَانٍ وَهَامَّةٍ ، وَمِنْ كُلِّ عَيْنٍ لاَمَّةٍ.""</span>  (اسوۂ رسول اکرم صلی اللہ علیہ وسلم)</p><p style=""text-align:justify;"">2۔  جس کو نظرِبد لگ جائے تواس کو رسول اللہ صلی اللہ علیہ وسلم کے اس قولِ مبارک سے دم کیا جائے :</p><p class=""indent"" style=""text-align:justify;""><span class=""ar_writing""> ""بِسْمِ اللّٰهِ  اَللّٰهُمَّ أَذْهِبْ حرَّهَا وَبَردَهَا وَوَصْبَهَا."" </span></p><p style=""text-align:justify;"">ترجمہ :اللہ کے نام پر، اے اللہ تواس (نظربد)کے گرم وسرد کو اوردکھ درد کو دورکردے ۔</p><p style=""text-align:justify;"">اس کے بعد یہ کلما ت کہے :</p><p class=""indent"" style=""text-align:justify;""><span class=""ar_writing""> ""قُمْ بِـإِذنِ اللّٰهِ.""</span></p><p class=""indent""> ترجمہ : اللہ کے حکم سے کھڑا ہو جا ۔(حصن حصین )</p><p class=""indent"" style=""text-align:left;"">فقط و اللہ اعلم </p></p>",144403101717,banuri,"('حظر و اباحت', 'mamnooaat-mubahat')","('علاج / معالجہ', 'ilaj-mualaja')","('علاج معالجہ کے آداب و حدود', 'ilaj-mualja-k-aadab-o-hudood')"
19-10-2022,https://www.banuri.edu.pk/readquestion/beton-ki-mojodgi-mai-poton-ko-hissa-nai-milyga-144403101795/19-10-2022,بیٹوں کی موجودگی میں پوتوں کو حصہ نہیں ملے گا,والد سے پہلے اگر بیٹا مر جائے تو اس کے بیٹوں کو جائيداد میں حصہ کیوں نہیں ملتا؟,"<p><p style=""text-align:justify;"">واضح رہے کہ شریعت نے  حقِ وراثت کا مدار  قوتِ قرابت داری پر رکھا  ہے، اللہ رب العزت نے ورثہ اور ان کے احوال وسہام کی تفصیل بتانے کے بعد واضح انداز میں فرمادیا ہے :<span class=""qr_writing"">آبَاؤُكُمْ وَأَبْنَاؤُكُمْ لَا تَدْرُونَ أَيُّهُمْ أَقْرَبُ لَكُمْ نَفْعًا فَرِيضَةً مِّنَ اللَّهِ إِنَّ اللَّهَ كَانَ عَلِيمًا حَكِيمًا ﴿النساء: ١١﴾</span>”تمہارے باپ دادا اور بیٹے تم نہیں جانتے کہ نفع رسانی کے لحاظ سے کون سا رشتہ تم سے زیادہ قریب ہے (اللہ تعالی کی حکمتِ بالغہ ہی اس کا فیصلہ کرسکتی ہے)اللہ تعالی نے یہ حصے ٹھہرادیے ہیں اور وہ (اپنے بندوں کی مصلحت کا) جاننے والا ہے(اپنے تمام احکام میں) حکمت والا ہے“۔پس میت کے ساتھ رشتہ میں جو زیادہ قریب ہوگا وہ استحقاقِ وراثت میں مقدم بھی ہوگا، اور اس کی موجودگی میں دیگر وہ رشتہ دار جو قرابت داری میں دور ہوں گے وہ محروم قرار پائیں گے،بیٹا چوں کہ پوتے کے مقابلہ میں اقرب (زیادہ قریب) ہے؛ اس لیے اصولاً وہی مستحق وراثت ہے؛ البتہ اگر میت کی وفات کے وقت اس کا کوئی بیٹا حیات نہ ہو اور پوتے پوتیاں حیات ہوں تو پوتے پوتیاں اس کے وارث بنتے؛ کیوں کہ اب ان سے اقرب کوئی موجود نہیں،لہذا پوتا علی الاطلاق محروم نہیں ہوتا، بلکہ اس وقت محروم ہوتا ہے جب کہ دادا کی دیگر مذکر اولاد موجود ہو۔ یہ تو  شریعت کا قانون  ہے۔</p><p style=""text-align:justify;"">البتہ انسان کو اپنی زندگی میں آثارِ موت ومرضِ وفات سے پہلے اپنے کل مال میں تصرف کا حق حاصل ہے، نیز موت کے بعد ایک تہائی مال کی وصیت کا حق بھی حاصل ہے، لہٰذا جو رشتہ دار شرعی طور پر وارث نہ بن رہے ہوں لیکن وہ مستحق و ضرورت مند ہوں تو آدمی اپنی زندگی میں انہیں ہبہ کرسکتاہے اور مرنے کے بعد ایک تہائی ترکے کے اندر اندر ان کے لیے وصیت بھی کرسکتاہے۔ لہٰذا ایسی صورت میں اخلاقی طور پر دادا کی یہ ذمہ داری بنتی ہے کہ وہ پوتوں کی گزر بسر کے لیے کوئی انتظام کرکے جائے، خواہ وہ رجسٹرڈ وصیت کی شکل میں ہو یا زندگی میں ہبہ کے ذریعہ ہو۔ نیز چچا کا بھی یہ فرض ہے کہ وہ اپنے بھتیجوں اور بھتیجیوں کے ساتھ شفقت وہم دردی اور ایثار کا معاملہ کرے، اور یتیموں کی کفالت کے متعلق جو بشارتیں آئیں ہیں ان کا مستحق بنے۔ لہٰذا یہ کہنا درست نہیں ہوگا کہ شریعت نے یتیم پوتے، پوتی کے حقوق کا خیال نہیں رکھا ہے، بلکہ یہ اسلامی احکام کا حسن ہے کہ ہر ایک کو اپنی حیثیت کے مطابق اس کا حق دیا گیاہے۔</p><p style=""text-align:justify;"">البسوط للسرخسی میں ہے:</p><p class=""indent"" style=""text-align:justify;""><span class=""ar_writing"">""وهذا الباب لبيان من هو عصبة بنفسه وهو الذكر الذي لا يفارقه الذكور في نسبة إلى الميت فأقرب العصبات الابن، ثم ابن الابن، وإن سفل، ثم الأب، ثم الجد أب الأب، وإن علا، ثم الأخ لأب وأم، ثم الأخ لأب، ثم ابن الأخ لأب وأم، ثم ابن الأخ لأب، ثم العم لأب وأم، ثم العم لأب، ثم ابن العم لأب وأم، ثم ابن العم لأب ثم عم الأب لأم، ثم عم الأب لأب، ثم ابن عم الأب لأب وأم، ثم ابن عم الأب لأب، ثم عم الجد هكذا والأصل فيه قوله - عليه الصلاة والسلام - «ما أبقت الفرائض فلأولى رجل ذكر» معناه فلأقرب رجل ذكر.""</span></p><p class=""indent"" style=""text-align:left;"">(کتاب الفرائض،باب اصحاب المواریث،ج29،ص174،ط؛دار المعرفۃ)</p><p style=""text-align:justify;"">الہذب فی علم اصول الفقہ المقارن میں ہے:</p><p class=""indent"" style=""text-align:justify;""><span class=""ar_writing"">""وأمثلة وقوع الإجماع كثيرة، ومنها:1 - الاجماع على حرمة شحم الخنزير كلحمه.2 - الإجماع على ‌حجب ‌ابن ‌الابن بالابن.....الخ.""</span></p><p class=""indent"" style=""text-align:left;"">(‌‌المطلب الثاني في إمكان الإجماع،ج2،ص847،ط؛مکتبۃ الرشد)</p><p class=""indent"" style=""text-align:left;"">فقط واللہ اعلم</p></p>",144403101795,banuri,"('فرائض', 'faraez')","('عصبات و ذوی الارحام', 'asabaat-o-zawil-arhaam')","('عصابات کا حصہ', 'asabaat-ka-hissa')"
03-07-2021,https://www.banuri.edu.pk/readquestion/yaseen-naam-ka-sahih-talaffuz-aur-yeh-naam-rakhne-ka-hukum-144211201123/03-07-2021,یاسین نام کا صحیح تلفظ اور یہ نام رکھنے کا حکم,یاسین نام کا صحیح تلفظ کیا ہے، اور یہ نام رکھنا کیسا ہے؟,"<p><p style=""text-align:justify;"">’’یاسین‘‘ نام (حروف کے اظہار کے ساتھ) رکھنا بالاتفاق جائز ہے۔ البتہ ’’یٰسٓ‘‘ نام کے مختلف معانی ہیں؛ اس میں یہ بھی احتمال ہے کہ آنحضرت صلی اللہ علیہ و سلم کا نام ہو جیسا کہ بعض مفسرین کی رائے ہے، اور یہ بھی احتمال ہے کہ یہ اللہ تعالیٰ کے اُن ناموں میں سے ہو جن کا انسانوں کے لیے رکھنا جائز نہیں؛ اس وجہ سے ’’یٰسٓ‘‘ نام نہ رکھنا بہتر ہے۔</p><p style=""text-align:justify;""><span class=""ar_writing""> أحكام القرآن لابن العربي (ج:4، ص:18-19، ط: دار الكتب العلمية، بيروت - لبنان):</span></p><p class=""indent"" style=""text-align:justify;""><span class=""ar_writing"">""المسألة الثانية: اختلف الناس في معناه على أربعة أقوال: الأول: أنه اسم من أسماء الله تعالى؛ قاله مالك، روى عنه أشهب قال: سألت مالكا هل ينبغي لأحد أن يسمي يس؟ قال: ما أراه ينبغي، لقول الله: {<span class=""qr_writing"">يس</span>} [يس: 1] {<span class=""qr_writing"">والقرآن الحكيم</span>} [يس: 2] يقول: هذا اسمي يس. </span><span class=""ar_writing"">الثاني: قال ابن عباس: يس يا إنسان بلسان الحبشة، وقولك يا طه: يا رجل. وعنه رواية أنه اسم الله، كما قال مالك. </span><span class=""ar_writing"">الثالث: أنه كني به عن النبي - صلى الله عليه وسلم - قيل له يا يس أي يا سيد. </span><span class=""ar_writing"">الرابع: أنه من فواتح السور. وقد روي عن ابن عباس أنه قال: «قال رسول الله - صلى الله عليه وسلم -:</span></p><p class=""indent"" style=""text-align:justify;""><span class=""ar_writing"">سماني الله في القرآن سبعة أسماء: محمدا، وأحمد، وطه، ويس، والمزمل والمدثر، وعبد الله». وهذا حديث لا يصح، وقد جمعنا أسماءه من القرآن والسنة في كتاب النبي.</span></p><p class=""indent"" style=""text-align:justify;""><span class=""ar_writing"">[مسألة العبد يجوز له أن يتسمى باسم الله إذا كان فيه معنى منه]</span></p><p class=""indent"" style=""text-align:justify;""><span class=""ar_writing"">المسألة الثالثة: رواية أشهب عن مالك: لا يسمى أحد يس؛ لأنه اسم الله كلام بديع؛ وذلك أن العبد يجوز له أن يتسمى باسم الله إذا كان فيه معنى منه، كقوله: عالم، وقادر، ومريد، ومتكلم؛ وإنما منع مالك من التسمية بهذا، لأنه اسم من أسماء الله لا يدرى معناه، فربما كان معناه ينفرد به الرب، فلا يجوز أن يقدم عليه العبد إذا كان لا يعرف هل هو اسم من أسماء الباري فيقدم على خطر منه، فاقتضى النظر رفعه عنه، والله أعلم. </span><span class=""ar_writing"">فإن قيل: فقد قال الله تعالى: {<span class=""qr_writing"">سلام على إل ياسين</span>} [الصافات: 130]. </span><span class=""ar_writing"">قلنا: ذلك مكتوب بهجاء فيجوز التسمية به، وهذا الذي ليس بمتهجى هو الذي تكلم مالك عليه لما فيه من الإشكال. والله أعلم.""</span></p><p class=""indent"" style=""text-align:left;""><span class=""ar_writing"">فقط والله أعلم</span></p></p>",144211201123,banuri,"('حظر و اباحت', 'mamnooaat-mubahat')","('نام، لقب، کنیت', 'asaami')","('ناموں کے معانی اور احکام', 'namoun-ke-mani-or-ahkaam')"
13-08-2022,https://www.banuri.edu.pk/readquestion/school-qawaneen-ki-khilaaf-warzi-karna-144401100880/13-08-2022,اسکول قوانین کی خلاف ورزی کرنا,سکول میں ہیڈ ماسٹر نے موبائل کا استعمال منع کیا ہوا ہے۔ جبکہ دوسرے اساتذہ کرتے ہیں۔ اس صورت میں سائل کے لئے کیا حکم ہے؟,"<p><p style=""text-align:justify;""> اسکول کے نظم کی پابندی ضروری ہے، دیگر اساتذہ کا فعل دلیل نہیں، یہ معاہدہ کی خلاف ورزی ہوگی۔</p><p style=""text-align:justify;"">حدیث شریف میں ہے:</p><p class=""indent"" style=""text-align:justify;""><span class=""ar_writing"">""عن أنس، قال: خطبنا رسول الله صلى الله عليه وسلم، فقال: "" لا إيمان لمن لا أمانة له، ولا دين لمن لا عهد له.""</span></p><p class=""indent"" style=""text-align:left;""><span class=""ar_writing"">(شعب الإیمان للبیہقی، 4/ 78 ،رقم الحدیث: 4045، ط: مكتبة الرشد)</span></p><p style=""text-align:justify;"">الدر المختارمیں ہے:</p><p class=""indent"" style=""text-align:justify;""><span class=""ar_writing"">"" المسلمون عند شروطهم.""</span></p><p class=""indent"" style=""text-align:left;""><span class=""ar_writing"">(كتاب الجهاد، باب المستأمن، 4/ 166، ط: سعيد)</span></p><p class=""indent"" style=""text-align:left;""><span class=""ar_writing"">فقط واللہ اعلم</span></p></p>",144401100880,banuri,"('حقوق و آدابِ معاشرت', 'huqooq-muashret')","('اَخلاقیات', 'akhlaaqiyaat')","('وعدہ خلافی', 'wada-khilafi')"
22-01-2023,https://www.banuri.edu.pk/readquestion/soyam-aur-chaliswain-ka-hkm-144406102207/22-01-2023,سوئم اور چالیسویں کا حکم,کیا اپنے مرحومین کا سوئم اور چالیسواں وغیرہ کرنا اور اس موقع پر خیرات وغیرہ کا اہتمام کرنا جائز ہے؟,"<p><p style=""text-align:justify;"">غم کے موقع پر غیر شرعی رسومات و بدعات (مثلاً: تیجہ، چالیسواں، اجرت کے عوض تلاوتِ قرآن پاک ، نوحہ وغیرہ)   ناجائز ہیں،میت کے لیے  ایصالِ ثواب تو  ہر وقت ، ہر موقعہ پر کرنا جائز ہے، اور میت کو اس کا فائدہ پہنچتا ہے،  اس لیے گھر میں ہی جو افراد  جمع ہوں اور دن اور تاریخ لازم سمجھنے کے  بغیر اپنی خوشی سے کچھ پڑھ لیں، اور قرآن پڑھنے کے عوض اجرت کا لین دین نہ ہو تو اس کی اجازت ہے،  لیکن اس کے لیے تیسرے دن، اور چالیسویں دن ،اور سال کی تخصیص کرنا شرعاً  ثابت نہیں ہے،اور اس کو لازم سمجھنا جائز نہیں ہے۔  نیز موجودہ زمانہ میں تیجہ ، چالیسواں اور برسی یا عرس میں اور بھی کئی مفاسد پائے جاتے ہیں، اسے ضروری سمجھا جاتاہے، شرکت نہ کرنے والوں کو طعن وتشنیع کا سامنا کرنا پڑتاہے؛ لہذا  یہ بدعت ہے اور ناجائز ہے،   ایسی تقریبات میں شرکت کرنا اور  کھانا  کھانا بھی درست نہیں۔ </p><p style=""text-align:justify;"">فتاوی شامی میں ہے:</p><p class=""indent"" style=""text-align:justify;""><span class=""ar_writing"">""یکره اتخاذ الضیافة من الطعام من أهل المیت؛ لأنه شرع في السرور لا في الشرور وهي بدعة مستقبحة، وقوله: ویکره اتخاذ الطعام في الیوم الأول والثالث وبعد الأسبوع، ونقل الطعام إلی القبرفي المواسم، واتخاذ الدعوة لقراءة القرآن وجمع الصلحاء والقرّآء للختم أو لقراء ة سورة الإنعام أوالإخلاص"".</span></p><p class=""indent"" style=""text-align:left;""><span class=""ar_writing"">(ردالمحتار على الدر المختار ، کتاب الصلاة ، باب صلاة الجنازة، مطلب في كراهة الضیافة من أهل المیت، کراچی ۲/۲۴۰)</span></p><p class=""indent"" style=""text-align:left;""><span class=""ar_writing"">فقط والله أعلم</span></p></p>",144406102207,banuri,"('ایمان و عقائد', 'aqaed')","('بدعات اور رسوم', 'bidaat-rasoomat')","('بدعت اور اس کی اقسام', 'bidaat-aur-us-ki-aqsaam')"
15-03-2023,https://www.banuri.edu.pk/readquestion/musataqil-bimari-ki-waja-se-rozon-ka-fidya-ada-karna-144408101847/15-03-2023,مستقل بیماری کی وجہ سے روزوں کا فدیہ ادا کرنا,میری شریک حیات گردوں کے مرض کی وجہ سے روزے نہیں رکھ سکتی۔ 2022 اور 2023 کے روزوں کا فدیہ کتنا ہوگا؟,"<p><p style=""text-align:justify;""> اگر ماہر دین دار ڈاکٹر کی رائے کے مطابق آپ کی شرک حیات  گردوں کے مرض کی وجہ سے روزے رکھنے پر بالکل قادر نہیں ہے، روزے رکھنے کی صورت میں مرض کے بڑھنے کا اندیشہ ہے، اور اس کے صحت مند ہونے کا امکان بھی نہیں ہے تو اس صورت میں فدیہ دینا جائز ہے یعنی ہر روزے کے بدلے صدقہ فطر کی مقدار (پونے دوکلو گندم یا اس کی قیمت)فقراء و مساکین پرصدقہ کرنا واجب ہوگا۔</p><p style=""text-align:justify;"">فتاوی ہندیہ میں ہے :</p><p class=""indent"" style=""text-align:justify;""><span class=""ar_writing"">""(ومنها المرض) المريض إذا خاف على نفسه التلف أو ذهاب عضو يفطر بالإجماع، وإن خاف زيادة العلة وامتدادها فكذلك عندنا، وعليه القضاء إذا أفطر كذا في المحيط. ثم معرفة ذلك باجتهاد المريض والاجتهاد غير مجرد الوهم بل هو غلبة ظن عن أمارة أو تجربة أو بإخبار طبيب مسلم غير ظاهر الفسق كذا في فتح القدير. والصحيح الذي يخشى أن يمرض بالصوم فهو كالمريض هكذا في التبيين۔۔۔۔(ومنها: كبر السن) فالشيخ الفاني الذي لا يقدر على الصيام يفطر ويطعم لكل يوم مسكينا كما يطعم في الكفارة كذا في الهداية. والعجوز مثله كذا في السراج الوهاج. وهو الذي كل يوم في نقص إلى أن يموت كذا في البحر الرائق. ثم إن شاء أعطى الفدية في أول رمضان بمرة، وإن شاء أخرها إلى آخره كذا في النهر الفائق.ولو قدر على الصيام بعد ما فدى بطل حكم الفداء الذي فداه حتى يجب عليه الصوم هكذا في النهاية.""</span></p><p class=""indent"" style=""text-align:left;"">(کتاب الصوم ،الباب الخامس فی الاعذار اللتی تبیح الإفطار ،ج1،ص207،دارالفکر)</p><p class=""indent"" style=""text-align:left;"">فقط واللہ اعلم</p></p>",144408101847,banuri,"('روزہ', 'soum')","('روزہ کی قضا، کفارہ اور فدیہ', 'roza-ki-qaza-kaffara-aur-fidya')","('روزہ کا فدیہ', 'roza-ka-fidya')"
03-04-2021,https://www.banuri.edu.pk/readquestion/lakar-hary-ki-bivi-ka-khany-ky-waqt-chari-sath-rakhny-waly-waqia-ki-tahqeeq-144208200978/03-04-2021,لکڑہارے کی بیوی کا کھانے کے وقت چھڑی ساتھ رکھنے والے واقعہ کی تحقیق,ایک لکڑ ہارے کی بیوی  کھانا کھاتے وقت اپنے پاس  چھڑی اس وجہ سے رکھا کرتی تھی کہ اگر میرے شوہر کو کھانا نا پسند ہو  اور مجھےزد و کوب کرنا ہوتو اس  کو اٹھنے کی زحمت نہ ہو ۔کیا یہ واقعہ کسی حدیث  سے ثابت ہے ؟,"<p><p style=""text-align:justify;"">حدیث کی کتابوں میں تلاش کے باوجود ہمیں یہ واقعہ نہیں مل سکا، لہذا اِ س واقعه كو حدیث کی نسبت سے بیان کرنے سے احتراز کیا جائے۔</p><p class=""indent"" style=""text-align:left;""><span class=""ar_writing"">فقط والله أعلم</span></p></p>",144208200978,banuri,"('علوم و فنون', 'uloom-funoon')","('حدیث و سنت', 'hadees-sunnat')","('موضوع احادیث', 'mozoo-ahadees')"
