issued_at,link,title,question,answer,fatwa_number,dar_ul_ifta,kitab,bab,fasal
11-03-2023,https://www.banuri.edu.pk/readquestion/5-tola-sony-par-zakat-ka-hukam-144408101364/11-03-2023,5 تولہ سونے پرزکاۃ کاحکم,میں سرکاری نوکر ہوں،  تنخوا ہ پر  مشکل سے گزارا کر رہا ہوں، میرے اوپرکچھ تھوڑا سا قرضہ بھی ہے اور بچے بھی اسکول میں پڑھتے ہیں، میری بیگم کے پاس 5 تولہ سونا ہے اور پیسے نہیں ہیں اس کے پاس،کیا اس پر زکاۃلازم ہے؟,"<p><p style=""text-align:justify;"">واضح رہے کہ سونے پر زکاۃ واجب ہونے کے لیے    سونے  کا   ساڑھےسات تولہ ہونا شرعاً ضروری ہوتا ہے، اس سے کم سونے پر زکاۃ واجب نہیں ہوتی۔</p><p style=""text-align:justify;"">البتہ اگر سونے کے ساتھ کچھ چاندی یا  ضرورت سے زائد نقد رقم بچت میں موجود ہے  (خواہ معمولی ہو) تو زکاۃ واجب ہونے کے لیے ساڑھے سات تولہ سونا ہونا ضروری نہیں، بلکہ مذکورہ اموال (سونا،چاندی ،نقد رقم)کی مالیت اگر ساڑھے باون تولہ چاندی کی مالیت کے برابر یا اس سے زائد تک پہنچتی ہےتو زکاۃ کا نصاب مکمل تصور کرکے  سال گزرنے پر  کل مال میں سے ڈھائی فیصد زکاۃ ادا کرنا لازم ہوگا۔ </p><p style=""text-align:justify;"">صورت مسئولہ میں اگر آپ کی اہلیہ کی ملکیت میں صرف پانچ تولہ سونا ہے اس کے علاوہ چاندی یا نقدر رقم (خواہ معمولی ہو)کچھ بھی نہیں ہےتو اس پر زکواۃ واجب نہیں ہے ۔</p><p style=""text-align:justify;"">بدائع الصنائع میں ہے:</p><p class=""indent"" style=""text-align:justify;""><span class=""ar_writing"">""فأما إذا كان له ذهب مفرد فلا شيء فيه حتى يبلغ عشرين مثقالا فإذا بلغ عشرين مثقالا ففيه نصف مثقال؛ لما روي في حديث عمرو بن حزم والذهب ما لم يبلغ قيمته مائتي درهم فلا صدقة فيه فإذا بلغ قيمته مائتي درهم ففيه ربع العشر  وكان الدينار على عهد رسول الله صلى الله عليه وسلم مقوما بعشرة دراهم.وروي عن النبي صلى الله عليه وسلم أنه قال لعلي: «ليس عليك في الذهب زكاة ما لم يبلغ عشرين مثقالا فإذا بلغ عشرين مثقالا ففيه نصف مثقال» وسواء كان الذهب لواحد أو كان مشتركا بين اثنين أنه لا شيء على أحدهما ما لم يبلغ نصيب كل واحد منهما نصابا عندنا، خلافاً للشافعي.""</span></p><p class=""indent"" style=""text-align:left;""><span class=""ar_writing"">(كتاب الزكاة،فصل كان له ذهب مفرد(2/ 18):دارالكتب العلمية)</span></p><p style=""text-align:justify;""> بدائع الصنائع میں ہے:</p><p class=""indent"" style=""text-align:justify;""><span class=""ar_writing"">""فأما ‌إذا ‌كان ‌له ‌الصنفان ‌جميعا فإن لم يكن كل واحد منهما نصابا بأن كان له عشرة مثاقيل ومائة درهم فإنه يضم أحدهما إلى الآخر في حق تكميل النصاب عندنا.</span><span class=""ar_writing"">وعند الشافعي لا يضم أحدهما إلى الآخر بل يعتبر كمال النصاب من كل واحد منهما على حدة.""</span></p><p class=""indent"" style=""text-align:left;""><span class=""ar_writing"">(كتاب الزكاة، فصل: مقدار الواجب في زكاة الذهب(2 /19) ط: دارالکتب العلمیة)</span></p><p style=""text-align:justify;"">فتاوی ھندیہ میں ہے:</p><p class=""indent"" style=""text-align:justify;""><span class=""ar_writing"">""وتضم قيمة العروض إلى الثمنين والذهب إلى الفضة قيمة كذا في الكنز...لكن يجب أن يكون التقويم بما هو ‌أنفع ‌للفقراء قدرا ورواجا.""</span></p><p class=""indent"" style=""text-align:left;""><span class=""ar_writing"">(كتاب الزكاة، الباب الثالث، الفصل الثاني في العروض (179/1)ط:دارالکتب العلمیة) </span></p><p class=""indent"" style=""text-align:left;""><span class=""ar_writing"">فقط واللہ اعلم</span></p></p>",144408101364,banuri,"('زکات', 'zakat')","('وجوب زکوٰۃ', 'wujoob-zakat')","('سونا، چاندی اور نقدی', 'sona-chandi-aur-naqdi')"
10-04-2021,https://www.banuri.edu.pk/readquestion/rewayat-aamalukum-ummalukum-ki-tehqiq-144208201377/10-04-2021,روایت : أعمالكم عمالكم کی تحقیق,أعمالكم عمالكم.یہ حدیث ہے یا کسی کا قول؟ اور ضعیف  ہے یا موضوع؟,"<p><p>یہ مرفوع حدیث نہیں ہے، بلکہ اس طرح کے جملےبعض صحابہ کرام رضی اللہ تعالٰی عنہم، اور تابعین کے کلام میں ملتے  ہیں۔ حافظ سخاوی (ت 902 ھ) "" <span class=""ar_writing"">المقاصد الحسنة"" </span>میں حديث<span class=""ar_writing""> ""كما تكونون يولى عليكم أو يؤمر عليكم"" </span>کے تحت فرماتے ہیں :</p><p class=""indent"">          <span class=""ar_writing"">وعند الطبراني معناه من طريق عمر، و كعب أحبار و الحسن البصري أنه سمع رجلا يدعو على الحجاج فقال له :لا تفعل إنما نخاف إن عزل الحجاج أو مات أن يستولي عليكم القردة و الخنازير فقد روي أن أعمالكم عمالكم وكما تكونون يولى عليكم.</span></p><p class=""indent"" style=""text-align:left;""><span class=""ar_writing"">(المقاصد الحسنة للسخاوي، حرف الكاف، رقم الحديث: ٨٤٥ ، ٢/ ٢٨١، جائزة دبي الدولية للقرآن الكريم ١٤٤٠)</span></p><p>یعنی اس حدیث کا ہم معنی کلام امام طبرانی کے ہاں حضرت عمر، کعب أحبار اور حسن بصری رحمہم اللہ تعالیٰ کی سند سے  ملتا ہے اور حسن بصری رحمہ اللہ تعالیٰ نے یہ تب کہا تھا جب آپ نے ایک شخص کو دیکھا کہ وہ حجاج کو بد دعا دے رہا ہے ، تو آپ نے فرمایا:  ایسا مت کرو ، یہ تمہارے ہی اعمال کا نتیجہ ہے، ہمیں ڈر ہے اگر حجاج معزول ہو گیا یا مر گیا  تو تم پر بندر اور خنزیروں کو مسلط کر دیا جائے ، کیوں کہ مروی ہے کہ <span class=""ar_writing"">أعمالكم عمالكم، وكما تكونون يولى عليكم،</span> مطلب جيسے: اعمال ویسے امراء""۔</p><p>اسی طرح محدث عجلونی (ت 1162ھ) رحمہ اللہ تعالیٰ لکھتے  ہیں : </p><p class=""indent"">            ""<span class=""ar_writing"">وأقول: رواه الطبراني عن الحسن البصري أنه سمع رجلاً يدعو على الحجاج، فقال له : لا تفعل، إنما نخاف إن عزل الحجاج أو مات و يتولى عليكم القردة و الخنازير، فقد روي أن أعمالكم عمالكم، وكما تكونوا يولى عليكم"". (كشف الخفاء ومزيل الإلباس للعجلوني، باب الهمزة مع العين، ١/ ١٤٧، مؤسسة مناهل العرفان)</span></p><p>        اور یہی کلام امام مناوی رحمہ اللہ  (ت ١٠٣١ھ) نے  <span class=""ar_writing"">فیض القدی</span>ر میں اور ملا علی قاری رحمہ اللہ ( ت 1014ھ) نے  <span class=""ar_writing"">مرقاۃ  المفاتیح شرح مشکاۃ المصابیح</span>  میں ذکر کیا ہے، ملاحظہ فرمائیے: (<span class=""ar_writing"">فيض القدير شرح جامع الصغير للمناوي، تحت حرف الكاف في شرح حديث: كما تكونوا يولى عليكم، ٦/ ٣١٧، دار الحديث القاهرة، ١٤٣١- المرقاة شرح المشكاة لعلي القاري ، كتاب الإمارة والقضاء، الفصل الثالث، في شرح حديث: كما تكونون كذلك يؤمر عليكم، ٧ / ٢٢٨، المكتبه الإمدادية، ملتان)</span></p><p>حافظ سخاوی اور محدث عجلونی رحمہما اللہ تعالیٰ کے کلام میں اگرچہ  یہ صراحت نہیں کہ یہ ان حضرات کا اپنا کلام ہے ، یا وہ حضور صلی اللہ علیہ سے نقل کرتے ہیں، یا پھر کوئی اسرائیلی روایت ہے، البتہ اتنا ضرور ہے کہ یہ کلام اور اس طرح کا مفہوم قرن اول میں ہی مشہور تھا، خلاصہ یہ ہے کہ اگرچہ یہ بات فی نفسہ درست ہے، لیکن  جب تک کوئی معتبر سند نہ مل جائے ، اس جملے کو بطورِ حدیثِ مرفوع نبی کریم صلی اللہ علیہ وسلم کی جانب نسبت کرکے بیان کرنے میں احتیاط ضروری ہے۔</p><p class=""indent"" style=""text-align:left;"">فقط  واللہ اعلم</p></p>",144208201377,banuri,"('علوم و فنون', 'uloom-funoon')","('حدیث و سنت', 'hadees-sunnat')","('تخریجِ احادیث', 'takhreej-e-ahadees')"
12-03-2023,https://www.banuri.edu.pk/readquestion/zowhaan-naam-rakhny-ka-hukam-144408101526/12-03-2023,زوحان نام رکھنے کا حکم,کیازوحان نام رکھناجائزہے؟,"<p><p style=""text-align:justify;"">""زَوْحَان"" عربی زبان کا لفظ ہے، اس کے معنی ہیں: ہٹنا، الگ ہونا۔اس معنی کے اعتبار سے یہ نام رکھنا درست نہیں ہے، لہذااِس کے بجائے کسی اچھے معنی والا نام رکھنا چاہیے،  بہتریہ ہے کہ اپنے بچے/ بچیوں کے نام  انبیاۓ کرام علیہم السلام ،صحابہ کرام رضوان اللہ علیہم اجمعین،اَزواجِ مطہرات اور صحابیات مکرمات رضوان اللہ علیہن اجمعین کے ناموں میں سے کسی نام پررکھے جائیں، اس سلسلے میں ہماری ویب سائٹ پر ""اسلامی نام ""کے عنوان سے بہت سارے نام موجود ہیں ، اسلامی ناموں سے  متعلق اس  سے استفادہ کیا جا سکتاہے۔</p><p><a href=""https://www.banuri.edu.pk/islamic-name?cat=&amp;word=0-+&amp;gender="">اسلامی نام</a></p><p>فتاوی ہندیہ میں ہے:</p><p class=""indent"" style=""text-align:justify;""><span class=""ar_writing"">""وفي الفتاوى التسمية باسم لم يذكره الله تعالى في عباده ولا ذكره رسول الله صلى الله عليه وسلم و لا استعمله المسلمون تكلموا فيه والأولى أن لايفعل، كذا في المحيط.""</span></p><p class=""indent"" style=""text-align:left;""><span class=""ar_writing"">(کتاب الكراهية،  ج:5، ص:362،ط: سعید)</span></p><p>القاموس المحیط میں ہے:</p><p class=""indent"" style=""text-align:justify;""><span class=""ar_writing"">""زحن، كمنع: أبطأ، كتزحن، وـ فلانا، عن المكان: أزاله.""</span></p><p class=""indent"" style=""text-align:left;""><span class=""ar_writing"">(باب النون، فصل الزاء،ص:1203، ط:مؤسسة الرسالة)</span></p><p>تاج العروس میں ہے:</p><p class=""indent"" style=""text-align:justify;""><span class=""ar_writing"">""‌‌زحن: (زحن، كمنع) يزحن زحنا: (أبطأ، كتزحن) ، كما في الصحاح، أي عن الأمر والعمل.</span></p><p class=""indent"" style=""text-align:justify;""><span class=""ar_writing"">(و) زحن (فلانا عن المكان: أزاله) عنه؛ كما في المحكم.""</span></p><p class=""indent"" style=""text-align:left;""><span class=""ar_writing"">(بحث زحن،ج:35، ص:141،ط:دارالهداية)</span></p><p class=""indent"" style=""text-align:left;""><span class=""ar_writing"">فقط والله اعلم</span></p></p>",144408101526,banuri,"('حظر و اباحت', 'mamnooaat-mubahat')","('نام، لقب، کنیت', 'asaami')","('ناموں کے معانی اور احکام', 'namoun-ke-mani-or-ahkaam')"
11-02-2023,https://www.banuri.edu.pk/readquestion/arham-nam-rkhna-144407101589/11-02-2023,ارحم نام رکھنا,ارحم نام رکھنا کیسا ہے ؟اور اس کا معنیٰ کیا ہے ؟,"<p><p style=""text-align:justify;"">""ارحم"" کا معنی ہے: زیادہ رحم دل، ایک حدیث میں حضرت ابوبکر رضی اللہ عنہ کو ""ارحم امتی"" یعنی امت کا سب سے زیادہ رحیم شخص کہا گیا ہے،  اور ایک اور حدیث میں ہے حضرت انسں بن مالک فرماتے ہیں کہ میں نے  آپ صلی اللہ علیہ وسلم سے زیادہ کسی اور کو اپنے اہل وعیال پر رحم کرنے والا نہیں دیکھا، یہاں آپ صلی اللہ علیہ وسلم کے لیے بھی ""ارحم"" کا لفظ استعمال کیا  گیاہے،  اس لیے ""ارحم"" نام رکھنا جائز ہے اور اس میں شرعاً کوئی قباحت نہیں ہے۔</p><p style=""text-align:justify;"">اگر کسی کو یہ شبہ ہو کہ ""ارحم"" نام رکھنا اس لیے مناسب نہیں کیوں کہ ""اَرحم"" زیادہ رحم کرنے والے کو کہتے ہیں، اور وہ ذات اللہ رب العزت کی ہے، تو یہ شبہ درست نہیں ہے ؛ اس لیے کہ ""ارحم"" اسم تفضیل کا صیغہ ہے اور یہ  مشترکہ اسماء میں سے ہے، اور اللہ کے علاوہ اور مخلوق کے لیے بھی اس کا  استعمال کیا گیا ہے، نیز عام طور پر اللہ کے لیے یہ لفظ جب استعمال ہوتا ہے تو  ""ارحم الراحمین""  استعمال ہوتا ہے۔ </p><p style=""text-align:justify;"">ارشاد باری تبارک وتعالی ہے:</p><p class=""indent"" style=""text-align:justify;""><span class=""qr_writing"">""وَأَيُّوْبَ إِذْ نَادٰى رَبَّه ٓأَنِّيْ مَسَّنِيَ الضُّرُّ وَأَنْتَ أَرْحَمُ الرَّاحِمِيْنَ .""[الأنبياء: 83]</span></p><p class=""indent"" style=""text-align:justify;""><span class=""qr_writing"">""لَا تَثْرِيبَ عَلَيْكُمُ الْيَوْمَ، يَغْفِرُ اللَّهُ لَكُمْ وَهُوَ أَرْحَمُ الرَّاحِمِينَ .""[يوسف: 92] </span></p><p style=""text-align:justify;"">مصنف ابن ابی شیبۃ میں ہے :</p><p class=""indent"" style=""text-align:justify;""><span class=""ar_writing"">""عبد الله بن نمير قال: حدثنا سفيان، قال: حدثنا سلمة بن كهيل، عن أبي الزعراء، عن عبد الله ... قال: ثم يقول: أنا أرحم الراحمين، قال: فيخرج من النار أكثر مماأخرج من جميع الخلق برحمته حتى ما يترك فيها أحداً فيه خير."" </span></p><p class=""indent"" style=""text-align:left;""><span class=""ar_writing"">(كتاب الفتن ، 7/ 511،ط:مكتبة الرشد)</span></p><p style=""text-align:justify;"">سنن ترمذی میں ہے :</p><p class=""indent""><span class=""ar_writing"">""عن أنس بن مالك، قال: قال رسول الله صلى الله عليه وسلم: أرحم أمتي بأمتي أبو بكر."" </span></p><p class=""indent"" style=""text-align:left;""><span class=""ar_writing""> (أبواب المناقب ، 5/ 664،ط:مصطفي البابي الحلبي )</span></p><p style=""text-align:justify;"">صحیح مسلم میں ہے :</p><p class=""indent"" style=""text-align:justify;""><span class=""ar_writing"">""عن أنس بن مالك، قال: «ما رأيت أحداً كان أرحم بالعيال من رسول الله صلى الله عليه وسلم.""</span></p><p class=""indent"" style=""text-align:left;""><span class=""ar_writing""> (كتاب الفضائل،4/ 1808،ط:دارإحياء التراث العربي )</span></p><p style=""text-align:justify;"">فتاوی شامی میں ہے:</p><p class=""indent"" style=""text-align:justify;""><span class=""ar_writing"">""وجاز التسمية بعلي ورشيد من الأسماء المشتركة ويراد في حقنا غير ما يراد في حق الله تعالى. </span></p><p class=""indent"" style=""text-align:justify;""><span class=""ar_writing""> (قوله: وجاز التسمية بعلي إلخ) الذي في التتارخانية عن السراجية التسمية باسم يوجد في كتاب الله تعالى كالعلي والكبير والرشيد والبديع جائزة إلخ، ومثله في المنح عنها وظاهره الجواز ولو معرفاً بأل.""</span></p><p class=""indent"" style=""text-align:left;""><span class=""ar_writing""> (كتاب الحظر والإباحة،6/ 417،ط: سعيد)</span></p><p class=""indent"" style=""text-align:left;"">فقط واللہ اعلم</p></p>",144407101589,banuri,"('حقوق و آدابِ معاشرت', 'huqooq-muashret')","('حقوق', 'bahmi-huqooq')","('اولاد کے حقوق', 'olad-ky-hoqoq')"
13-03-2023,https://www.banuri.edu.pk/readquestion/rasty-ko-teehk-karny-k-liy-chandah-ki-hoi-raqam-ko-zarorat-na-rehny-par-kisi-dosry-masraf-men-kharach-karny-ka-hukam-144408101630/13-03-2023,راستے کو ٹھیک کرنے کے لیے چندہ کی ہوئی رقم کو ضرورت نہ رہنے پر کسی دوسرے مصرف میں خرچ کرنے کا حکم,مفتی صاحب اگر راستے کو ٹھیک کرنے کے لیےچندہ کیا جاۓ اور بعد میں وہ راستہ حکومت ازخود ٹھیک کردے، تو اس چندہ کی رقم کاکیا کیا جاۓ ، مگر یاد رہے کے چندہ راستے میں چارپائی پر کیا گیا تھا، جو کہ اب تمام لوگوں کو واپس کرنا ناممکن ہے، اور اجازت لینا بھی ممکن نہیں ہے، لہذا اب مذکورہ رقم کو مسجد میں لگاسکتے ہیں یا نہیں؟,"<p><p style=""text-align:justify;"">صورتِ مسئولہ میں چوں کہ مذکورہ چندہ کی رقم لوگوں نے اس خاطر دی تھی کہ اس سے راستہ ٹھیک کیاجائے،تو اسے راستے کی درستگی میں ہی استعمال کرنا ضروری تھا،البتہ اب اگر واقعۃً راستہ حکومت نے درست کردیا ہےاور یہ رقم ضرورت سے زائد ہےتو جن لوگوں نے چندہ دیا تھاان کی اجازت سے مسجد میں لگاسکتے ہیں،البتہ چندہ دینے والے ہر ایک فرد سے اجازت لینا ناممکن ہوتو جس جگہ اور مقام میں چندہ کیاگیاتھا،وہاں کے لوگوں کو  حتی الامکان اطلاع دے کر اجازت لے کر پھر مسجد میں یہ رقم لگائی جائے،جیسے ضرورت پر مانگا ایسے ہی اعلان کر کے ان کو واپس کریں۔</p><p style=""text-align:justify;"">فتاوی محمودیہ میں ہے:</p><p class=""indent"" style=""text-align:justify;"">""سوال: ایک لاورث شخص مرگیا، جس کے کفن کے لیے چندہ کیاگیا ہے، بعد کفن دفن کچھ چندہ بچ گیا تو اس کو مسجد میں خرچ کرسکتے ہیں یا نہیں ؟</p><p class=""indent"" style=""text-align:justify;""><span class=""ar_writing"">الجواب حامداً و مصلياً:</span></p><p class=""indent"" style=""text-align:justify;"">جن لوگوں نے چندہ دیا ہے ان کی اجازت سے مسجد میں بھی خرچ کرسکتے ہیں۔فقط واللہ تعالیٰ اعلم۔""</p><p class=""indent"" style=""text-align:left;"">(کتاب الوقف، باب الحکام المساجد،ج:15،ص:167، ط: ادارۃ الفاروق)</p><p style=""text-align:justify;"">دررالحکام شرح مجلۃ الاحکام میں ہے:</p><p class=""indent"" style=""text-align:justify;""><span class=""ar_writing"">""ولا يجوز ‌التصرف ‌في ‌ملك الغير بدون إذنه سواء كان هذا التصرف مضرا بصاحب الملك أو غير مضر ، ما لم يوجد ضرورة في التصرف بملك الغير.""</span></p><p class=""indent"" style=""text-align:left;""><span class=""ar_writing"">(الكتاب العاشر، الباب الثالث، الفصل الأول، ج:3، ص:301،ط:دارالجيل)</span></p><p class=""indent"" style=""text-align:left;""><span class=""ar_writing"">فقط والله اعلم</span></p></p>",144408101630,banuri,"('وقف', 'waqf')","('اوقاف کے عمومی احکام', 'awqaaf-ke-umoomi-ahkaam')","('وقف کا استبدال', 'waqf-ka-istebdaal')"
