issued_at,link,title,question,answer,fatwa_number,dar_ul_ifta,kitab,bab,fasal
16-03-2023,https://www.banuri.edu.pk/readquestion/sheaya-ka-mal-bila-ijazat-khana-144408101918/16-03-2023,شیعہ کامال بلااجازت کھانا,شیعہ کی بکری روز ہمارے پڑوسی کے گھر آتی تھی اور نقصان کرتی تھی، اس پڑوسی کو کسی نے بتایا تھا کہ شیعہ کا مال مالِ غنیمت ہوتا ہے، بکری  بیچ کے کھا جاؤ،اس پر ہمارے مقامی امام صاحب نے منع فرمایا کہ اس طرح کسی کا مال بیچنا جائز نہیں ہے۔1۔کیا شیعہ کا مال مالِ غنیمت ہے؟2۔کیا شیعہ کا مال اس کی اجازت کے بغیر بیچنا جائز ہے؟3۔ کیا اس کے اوپر زبردستی کرنا اپنا مال بیچنے پر ، جائز ہے؟,"<p><p style=""text-align:justify;"">شیعہ کا مال مال غنیمت نہیں ہے ،وہ شیعہ کی ملکیت ہے ،بلااجازت شیعہ کا مال کھانا ،بیچنا یا شیعہ کو اس کے اپنے مال کے بیچنے پر مجبور کرنا شرعا جائز نہیں ہے ۔</p><p style=""text-align:justify;""><span class=""ar_writing"">وفي مرقاة المفاتيح شرح مشكاة المصابيح :</span></p><p class=""indent"" style=""text-align:justify;""><span class=""ar_writing"">""وعن أبي حرة الرقاشي، عن عمه - رضي الله عنه - قال: قال رسول الله - صلى الله عليه وسلم - "" «ألا لا تظلموا، ألا ‌لا ‌يحل ‌مال ‌امرئ إلا بطيب نفس منه» . رواه البيهقي في "" شعب الإيمان ""، والدارقطني في "" المجتبى .</span></p><p class=""indent"" style=""text-align:justify;""><span class=""ar_writing"">("" ‌لا ‌يحل ‌مال ‌امرئ "") أي: مسلم أو ذمي ("" إلا بطيب نفس "") أي: بأمر أو رضا منه. رواه البيهقي في "" شعب الإيمان ""، والدارقطني في "" المجتبى.""</span></p><p class=""indent"" style=""text-align:left;""><span class=""ar_writing"">(كتاب البيوع، باب الغصب والعارية، 5/ 1974 الناشر: دار الفكر، بيروت - لبنان)</span></p><p class=""indent"" style=""text-align:left;""><span class=""ar_writing"">فقط واللہ أعلم</span></p></p>",144408101918,banuri,"('غصب', 'gasab')","('غصب', 'gasab')","('غصب کی تفسیر / شرائط / احکام', 'gasab-ki-tafseer-sharaet-ahkaam')"
06-03-2023,https://www.banuri.edu.pk/readquestion/tnqyh-144408100782/06-03-2023,نابالغ کی امامت,اگر کوئی سامع نہ مل رہا ہو ،تو کیا ایک 2 بالغ کے ساتھ یا ایک نابالغ بچہ   تروایح پڑھا یا سن سکتا ہے؟,"<p><p style=""text-align:justify;"">صورتِ  مسئولہ  میں نابالغ  بچہ  بالغ لوگوں کا امام نہیں بن سکتا، البتہ سامع بن سکتا ہے۔نابالغ بچہ نابالغ بچوں کا امام بن سکتاہے۔</p><p style=""text-align:justify;""><span class=""ar_writing"">في الإختيار لتعليل المختار:</span></p><p class=""indent"" style=""text-align:justify;""><span class=""ar_writing"">""قال: (ولاتجوز إمامة النساء والصبيان للرجال) أما النساء فلقوله عليه الصلاة والسلام: «أخروهنّ من حيث أخرهنّ الله»، وإنه نهي عن التقديم. وأما الصبيّ فلأنّ صلاته تقع نفلاً فلايجوز الاقتداء به، وقيل: يجوز في التراويح؛ لأنها ليست بفرض، والصحيح الأول؛ لأنّ نفله أضعف من نفل البالغ فلايبتنى عليه"".</span></p><p class=""indent"" style=""text-align:left;""><span class=""ar_writing"">(كتاب الصلاة،باب صلاة الجماعة،ج:1،ص:58،ط:دار الكتب العلمية،بيروت)</span></p><p style=""margin:0 0 30px;color:#323232;line-height:36px;font-weight:bold;font-size:17px;font-family:Nafees,'Helvetica Neue',Helvetica,Arial,sans-serif;background-color:#fff;text-align:justify;""><span class=""ar_writing"">في الدرالمختار وحاشية ابن عابدين:</span></p><p class=""indent"" style=""text-align:justify;""><span class=""ar_writing"">""(ولا يصح اقتداء رجل بامرأة) وخنثى (وصبي مطلقا) ولو في جنازة.</span></p><p class=""indent"" style=""text-align:justify;""><span class=""ar_writing"">ومن هذا يظهر أنه لا تصح إمامته في الجنازة أيضا وإن قلنا بصحة صلاته وسقوط الواجب بها عن المكلفين لأن الإمامة للبالغين من شروط صحتها البلوغ، هذا ما ظهر لي في تقرير هذا المحل، فاغتنمه فإنك لا تظفر به في غير هذا الكتاب، والحمد لله الملك الوهاب.""</span></p><p class=""indent"" style=""text-align:left;""><span class=""ar_writing"">(كتاب الصلاة،باب الإمامة،ج:1،ص:576،577،ط: سعيد)</span></p><p style=""margin:0 0 30px;color:#323232;line-height:36px;font-weight:bold;font-size:17px;font-family:Nafees,'Helvetica Neue',Helvetica,Arial,sans-serif;background-color:#fff;""><span class=""ar_writing"">في الفتاوى الهنديه:</span></p><p class=""indent"" style=""text-align:justify;""><span class=""ar_writing"">""وإمامة ‌الصبي المراهق لصبيان مثله يجوز. كذا في الخلاصة وعلى قول أئمة بلخ يصح الاقتداء بالصبيان في التراويح والسنن المطلقة. كذا في فتاوى قاضي خان المختار أنه لا يجوز في الصلوات كلها. كذا في الهداية وهو الأصح. هكذا في المحيط وهو قول العامة وهو ظاهر الرواية. هكذا في البحر الرائق.""</span></p><p class=""indent"" style=""text-align:left;""><span class=""ar_writing"">(كتاب الصلاة،الباب الخامس في الإمامة،الفصل الثالث في بيان من يصلح إماما لغيره،ج:1،ص:85،ط:رشيديه)</span></p><p class=""indent"" style=""text-align:left;""><span class=""ar_writing"">فقط واللہ أعلم</span></p></p>",144408100782,banuri,"('نماز', 'salat')","('امامت کا بیان', 'imamat')","('نابالغ کی امامت', 'nabaalig-ki-imamat')"
16-03-2023,https://www.banuri.edu.pk/readquestion/yameen-e-faur-ka-hukum-144408101965/16-03-2023,يمينِ فور كا حكم,"سائل کی بیوی عرصہ پانچ سال سے ناراض ہو کر اپنے والدین کی ہاں قیام پذیر ہے۔یہ واضح رہے کہ اس عرصہ میں سائل کا بیوی کے پاس ان کے والدین کے گھرآنا ،جانا اوراس کے ساتھ میل جول اورازدواجی تعلق قائم رہا ہے،  سائل  8 اکتوبر 2022 کو   ان کے گھر میں گیا اور بیوی سے جو دوسرے روم تھی کو ایس ایم ایس پر کہا کہ  ""آپ میرے پاس  اگر نہ آئیں  (پاس سے میری مراد روم میں) تو میری طرف سے طلاق ہے طلاق ہے طلاق ہے۔"" اس پر وہ اسی ٹائم میرے پاس آئی اور مزید یہ کہ اس بات کے بعد بھی جنوری 2023تک ہمارا ازدواجی تعلق قائم رہا ہے۔ ماہ جنوری 2023 کے دوران سائل کی بیوی نے اس حوالہ سے دریافت کیاکہ کیا آپ نے درج بالا الفاظ کہے تھے؟ کیا اس سے ہماری طلاق ہو گئی ہے؟ جس کے جواب میں سائل نے  وضاحت کے طور پر جواب دیا :کہ جہاں تک میرا علم و فہم ہے رشتہ ختم نہیں ہوا،  کیوں کہ آپ  فورًا  ہی  میرے پاس کمرے میں  آگئی تھیں، البتہ آپ پھربھی اپنی تسلی کے  لیے کسی مفتی صاحب سے دریافت کریں اور میں بھی راہنمائی حاصل کرتا ہوں۔ شرعی اعتبار سے معاملہ کی بابت راہنما ئی فرمائیں  کہ کیا اس سے طلاق واقع ہوئی ہے یا نہیں ؟","<p><p style=""text-align:justify;"">صورتِ مسئولہ میں  سائل نے جب مذکورہ الفاظ""آپ اگر میرے پاس کمرے میں   نہ آئی تو میری طرف سے طلاق ہے ،طلاق ہے ،طلاق ہے ""کہا اور سائل کی بیوی فورًا  سائل کے کہنے سے اس کے پاس کمرے میں  آگئی تھی ،تو اس سے سائل  کی بیوی  پر  مذکورہ  الفاط سے کو ئی طلاق واقع نہیں ہوئی ،دونوں  کا نکاح برقرار ہے ،دونوں میاں بیوی کی حیثیت سے   باہم رہ سکتے ہیں ۔</p><p style=""text-align:justify;"">فتاوی شامی میں ہے :</p><p class=""indent""><span class=""ar_writing"">""( وشرطه للحنث في ) قوله: ( إن خرجت مثلاً ) فأنت طالق أو إن ضربت عبدك فعبدي حر ( لمريد الخروج ) والضرب ( فعله فوراً ) لأن قصده المنع عن ذلك الفعل عرفاً، ومدار الأيمان عليه، وهذه تسمى يمين الفور تفرد أبو حنيفة رحمه الله بإظهارها ولم يخالفه أحد"". </span></p><p class=""indent""><span class=""ar_writing"">""وفي طلاق الأشباه: إن للتراخي إلا بقرینة الفور ․․․․ فإذا قال لها: إن خرجت فکذا، وخرجت فوراً أو بعد یوم مثلاً حنث"".</span></p><p class=""indent"" style=""text-align:left;""><span class=""ar_writing"">(کتاب الطلاق،مطلب في يمين الفور،ج: 3،ص: 763،ط:سعید) </span></p><p>فتاوی ہندیہ میں ہے :</p><p class=""indent"" style=""text-align:justify;""><span class=""ar_writing"">""وإذا أضافه إلى الشرط وقع ‌عقيب ‌الشرط اتفاقا مثل أن يقول لامرأته: إن دخلت الدار فأنت طالق.""</span></p><p class=""indent"" style=""text-align:left;""><span class=""ar_writing"">(كتاب الطلاق ،الفصل الثالث في تعليق الطلاق بكلمة ان واذاوغيرهما، ج:1، ص: 420، ط: دارالفكر)</span></p><p>البحر الرائق میں ہے  :</p><p class=""indent"" style=""text-align:justify;""><span class=""ar_writing"">""‌يقع ‌الطلاق ‌بعد ‌وجود ‌الشرط.""</span></p><p class=""indent"" style=""text-align:left;""><span class=""ar_writing"">(كتاب الطلاق ،باب تعليق الطلاق ،ج :ص،8،ط :دارالكتاب الاسلامي)</span></p><p class=""indent"" style=""text-align:left;""><span class=""ar_writing"">فقط والله أعلم</span></p></p>",144408101965,banuri,"('طلاق', 'talaaq')","('تعلیقِ طلاق (مشروط طلاق دینا)', 'talaq-ki-taleeq')","('طلاق کی یمین', 'talaq-ki-yameen')"
06-03-2023,https://www.banuri.edu.pk/readquestion/fajar-our-asar-ke-oqat-main-faresto-ke-dewtin-ka-tabadeel-hona-our-aamal-ka-pesh-karna-144408100792/06-03-2023,فجر اورعصر کے اوقات میں فرشتوں کی ڈیوٹیاں کا تبدیل ہونا اور اعمال کا پیش کرنا,فرشتوں کی تبدیلی کا فکس وقت بتائیں کونسا ہے؟ تاکہ اس وقت کوئی گناہ نہ کیا جاۓ،سنا ہے کہ جب فرشتوں کی ڈیوٹی تبدیل ہو تو بندہ نیکی یا گناہ جو بھی کرہا ہو وہ نیکی،گناہ ڈیوٹی پر آنے والے اور جانے والے دونوں فرشتے نوٹ کر لیتے ہیں، اس لیےمیں چاہتا ہوں مجھے اس وقت کا آپ بتائیں (عصر کا وقت ہے غروب آفتاب کا یا سورج طلوع کا ؟)تاکہ اس وقت کوئی گناہ نہ کیا جاۓ اور دونوں ڈیوٹی والے فرشتے گناہ کی بجاۓ نیکی لکھ لیں ۔,"<p><p style=""text-align:justify;"">فرشتوں کےتبدیلی کےاوقات فجراورعصرکی نمازکاوقت ہے،فجرمیں آنےوالےفرشتےعصرکی نمازکےوقت چلے جاتےہیں اورعصرمیں آنےوالےفرشتےفجرمیں چلےجاتےہیں، جیساکہ حضرت ابوہریرہ رضی اللہ عنہ کی روایت سےثابت ہے کہ جناب رسول اللہ صلی اللہ علیہ وسلم نے ارشاد فرمایا:</p><p class=""indent"" style=""text-align:justify;"">""رات اور دن میں فرشتوں کی  ذمہ داریاں بدلتی رہتی ہیں اور فجر اور عصر کی نمازوں میں ان (ڈیوٹی پر آنے والوں اورجانے والوں) فرشتوں کا اجتماع ہوتا ہے، پھر تمہارے رات والے فرشتے جب اوپر چڑھتے ہیں تو اللہ   ان سے پوچھتا ہے   (حال آں کہ وہ ان سے بہت زیادہ اپنے بندوں کے متعلق جانتا ہے)    کہ میرے بندوں کو تم نے کس حال میں چھوڑا؟ وہ کہتےہیں کہ ہم نے جب انہیں چھوڑا تو وہ (فجر کی) نماز پڑھ رہے تھے اور  جب ان کے پاس گئے تب بھی وہ (عصر کی) نماز پڑھ رہے تھے۔""</p><p style=""text-align:justify;"">لہذامذکورہ اوقات میں عبادت میں مشغول ہوناچاہیےتاکہ آنےجانےوالےفرشتےنیکیاں لکھ کراللہ کی بارگاہ میں پیش کرے۔</p><p style=""text-align:justify;"">نیزمذکورہ اوقات کےعلاوہ بھی گناہوں سےاجتناب کرناچاہیے،اس لیےکہ اللہ کی ذات ہروقت انسان کو دیکھتی ہے،لہذاایساکوئی لمحہ نہ آئےجواللہ کی نافرمانی ،گناہ  میں گزرجائےاورآخرت میں عتاب وسزاکاباعث بنے۔</p><p style=""text-align:justify;"">صحیح بخاری میں ہے :</p><p class=""indent"" style=""text-align:justify;""><span class=""ar_writing"">""عن أبي هريرة: أن رسول الله صلى الله عليه وسلم قال: "" ‌يتعاقبون ‌فيكم ملائكة بالليل وملائكة بالنهار، ويجتمعون في صلاة الفجر وصلاة العصر، ثم يعرج الذين باتوا ‌فيكم، فيسألهم وهو أعلم بهم: كيف تركتم عبادي؟ فيقولون: تركناهم وهم يصلون، وأتيناهم وهم يصلون .""</span></p><p class=""indent"" style=""text-align:left;""><span class=""ar_writing"">(باب فضل صلاة العصر،ج : 1 ص : 115 ط : السلطانية)</span></p><p style=""text-align:justify;"">المفاتیح فی شرح المصابیح لمظہرالدین الزیدانی میں ہے :</p><p class=""indent"" style=""text-align:justify;""><span class=""ar_writing"">""وأراد بقوله: ""ملائكة"" هنا: الملائكة الذين ‌يكتبون ‌أعمال ‌العباد. ""ويجتمعون في صلاة الفجر وصلاة العصر""؛ يعني: يكتب (1) الملائكة الذين يكونون مع الناس في الليل حتى يجيء الملائكة الذين يكونون معهم في النهار؛ أي: في النهار عند صلاة الصبح، فإذا جاء الذين يكونون معهم في النهار وقت صلاة الصبح يعرج الذين كانوا معهم في الليل، وإذا كان وقت العصر يجيء الذين يكونون معهم في الليل ويعرج الذين جاؤوا وقت الصبح.</span></p><p class=""indent"" style=""text-align:justify;""><span class=""ar_writing"">والمراد بهذا الحديث تحريض الناس على المواظبة على هاتين الصلاتين.</span></p><p class=""indent"" style=""text-align:justify;""><span class=""ar_writing"">قولهم: ""تركناهم وهم يصلون""؛ أي: تركناهم في هذه الساعة وهم يصلون الصبح.</span></p><p class=""indent"" style=""text-align:justify;""><span class=""ar_writing"">""وأتيناهم"" أي: لما نزلنا بهم كانوا يصلون العصر.""</span></p><p class=""indent"" style=""text-align:left;""><span class=""ar_writing"">(كتاب الصلاة،باب تعجيل الصلاة،فصل ج : 2 ص : 34 ط : دارالنوادر)</span></p><p style=""text-align:justify;"">شرح النووی میں ہے :</p><p class=""indent"" style=""text-align:justify;""><span class=""ar_writing"">""وأما اجتماعهم في الفجر والعصر فهو من لطف الله تعالى بعباده المؤمنين وتكرمة لهم أن جعل اجتماع الملائكة عندهم ومفارقتهم لهم في أوقات عباداتهم واجتماعهم على طاعة ربهم ، فيكون شهادتهم لهم بما شاهدوه من الخير. وأما قوله صلى الله عليه و سلم: فيسألهم ربهم -وهو أعلم بهم-كيف تركتم عبادي فهذا السؤال على ظاهره وهو تعبد منه لملائكته كما أمرهم بكتب الأعمال وهو أعلم بالجميع. قال القاضي عياض رحمه الله: الأظهر وقول الأكثرين أن هؤلاء الملائكة هم الحفظة الكتاب، قال: وقيل: يحتمل أن يكونوا من جملة الملائكة بجملة الناس غير الحفظة.""</span></p><p class=""indent"" style=""text-align:left;""><span class=""ar_writing"">(باب فضل صلاتي الصبح والعصر والمحافظة عليهم،ج : 5 ص : 133 ط : دار إحياء التراث العربي، بيروت)</span></p><p class=""indent"" style=""text-align:left;""><span class=""ar_writing"">فقط واللہ أعلم</span></p></p>",144408100792,banuri,"('ایمان و عقائد', 'aqaed')","('اسلامی عقائد', 'islami-aqaed')","('فرشتے', 'farishtay')"
12-02-2023,https://www.banuri.edu.pk/readquestion/qabr-mein-utar-kr-mayyat-ka-munh-dekhny-ka-hukm-144407101709/12-02-2023,قبر میں اتار کر میت کا منہ دیکھنے کا حکم,اگر جنازے کاوقت مقررکردیا جاۓ اس کے بعد اس مرحوم کابیٹا یا رشتےدار باہر سے آرہے ہوں، تو کیا قبر میں میت اتار کر منہ دکھانے کےلیے اس کو چھوڑا جا سکتا ہے کچھ وقت کےلیے؟,"<p><p style=""text-align:justify;"">نمازِ جنازہ کی ادائیگی کے بعد میت کو جلد دفن کرنے کا حکم   حدیث مبارک میں وارد ہے، لہٰذا قبر میں میت کو اتارنے کے بعد   چہرہ دکھانا قلیل تاخیر کو مستلزم ہونے کی وجہ سے مناسب نہیں ہے۔</p><p style=""text-align:justify;"">حاشیۃ السندی علی سنن ابن ماجہ میں ہے:</p><p class=""indent"" style=""text-align:justify;""><span class=""ar_writing"">""حدثنا محمد بن إسمعيل بن سمرة حدثنا محمد بن الحسن حدثنا أبو شيبة عن أنس بن مالك قال «لما قبض إبراهيم ابن النبي صلى الله عليه وسلم قال لهم النبي صلى الله عليه وسلم ‌لاتدرجوه في أكفانه حتى أنظر إليه فأتاه فانكب عليه و بكى».</span></p><p class=""indent"" style=""text-align:justify;""><span class=""ar_writing"">قوله: (‌لا ‌تدرجوه) من الإدراج أي لا تدخلوه والحديث يدل على أن من يريد النظر فلينظر إليه قبل الإدراج فيؤخذ منه أن النظر بعد ذلك لا يحسن ويحتمل أنه قال ذلك لأن النظر بعده يحتاج إلى مؤنة الكشف.""</span></p><p class=""indent"" style=""text-align:left;""><span class=""ar_writing"">(كتاب الجنائز، باب ما جاء في النظر إلى الميت إذا أدرج في أكفانه، ج: 1، ص: 45، ط: دار الجيل بيروت)</span></p><p style=""text-align:justify;"">فتاویٰ شامی میں ہے:</p><p class=""indent"" style=""text-align:justify;""><span class=""ar_writing"">""(قوله ‌ويسرع ‌في جهازه) لما رواه أبو داود «عنه صلى الله عليه وسلم لما عاد طلحة بن البراء وانصرف قال ما أرى طلحة إلا قد حدث فيه الموت فإذا مات فآذنوني حتى أصلي عليه وعجلوا به فإنه لا ينبغي لجيفة مسلم أن تحبس بين ظهراني أهله» والصارف عن وجوب التعجيل الاحتياط للروح الشريفة فإنه يحتمل الإغماء.""</span></p><p class=""indent"" style=""text-align:left;""><span class=""ar_writing"">(كتاب الصلاة، باب صلاة الجنازة، ج: 2، ص: 193، ط: دار الفكر بيروت)</span></p><p class=""indent"" style=""text-align:left;""><span class=""ar_writing"">فقط والله أعلم</span></p></p>",144407101709,banuri,"('جنائز', 'janaiz')","('تدفین', 'tadfeen')","('میت دفن کرنے کے احکام', 'mayyat-dafan-karne-ke-ahkaam')"
