issued_at,link,title,question,answer,fatwa_number,dar_ul_ifta,kitab,bab,fasal
01-11-2022,https://www.banuri.edu.pk/readquestion/walid-ny-bety-ky-nikah-me-apny-makan-ka-aek-kamrah-muqarrar-kia-144404100401/01-11-2022,والد نے بیٹے کے نکاح کا مہر اپنے مکان کا ایک کمرہ مقرر کیا,میری شادی 2014 میں ہوئی اور دونوں خاندانوں کی رضامندی سے ہوئی ، دونوں خاندانوں کے بزرگوں میں کچھ تنازعات تھے جن کی بنا پر 2016 میں رات کے 2 بجے مجھے میری بیوی اور 3 ماہ کی بچی کے ساتھ میری والدہ اور بہنوں نے گھر سے نکال دیا ،،جب مجھے گھر سے نکالا گیا تو میری بیگم کا جہیز کا تمام سامان اسی گھر میں اس کمرے میں پڑا ہوا تھا  جو میرے والدین نے اپنی باہمی رضا مندی کے ساتھ اس گھر میں سے ایک کمرہ حدود اربعہ کے ساتھ اپنی بہو کے نکاح نامے میں بطورِ حق مہر میں لکھ دیا تھا  ،ہم نے اس کمرے کو لاک کر دیا تھا اور آج تک لاک ہے،میرے والد مرحوم نے معاملات کو درست کرنے کی بے حد کوشش کی اور 2019 میں والد محترم کا انتقال ہوگیا، والدہ اور والد مرحوم کی پراپرٹی کے تمام ڈاکومنٹس میری والدہ بہنوں اور بہنوئیوں نے ضبط کیے ہوئے ہیں ، وہ اب چاہتے ہیں کہ جو کمرہ میرے والدین نے اپنی باہمی رضامندی سے اپنی بہو کے نکاح میں بطورِ حق مہر میں لکھا  ہے وہاں سے ہم اپنا سارا سامان اٹھا لیں ،کمرے کا قبضہ چھوڑ دیں تاکہ وہ اس کو یا تو سیل کروا دیں یا اپنے نام پر ٹرانسفر کروا لیں۔ان 7 سالوں میں مجھ پر کئی  جھوٹے مقدمات تھانوں میں درج کروائےگئے ،، بہت سی جائیداد انہوں نے دو نمبر طریقے سے بیچ ڈالی،میری والدہ کی ایک ہی ضد ہےکہ اپنی بیوی کو چھوڑ دے نہیں تو وراثت کو بھول جا، میرا رب گواہ ہے مجھے کچھ نہیں چاہیے وراثت میں سے ،میرے والد مرحوم 16 گریڈ سے ریٹائر ہوئے ،ان کی پینشن میری والدہ اور میری لالچی بہنیں اور بہنوئی  اور ان کے بچے 2016 سے کھا رہے ہیں، میں اس کمرے کا قبضہ اس وجہ سے نہیں چھوڑ رہا  کہ جن مخالف قوتوں نے ان کے اکلوتے بیٹے اور اس کے بیوی بچی کو اس گھر میں نہیں رہنے دیا ،وہ میرا قبضہ چھوڑنے کے بعد کہیں  میری والدہ کو بھی اس گھر سے نہ نکال دیں یا اپنے نام کروا لیں یا سیل کروا دیں یہ میرے کچھ خدشات ہیں۔سوال یہ ہے کہ میرے والدین نے اپنی باہمی رضامندی سے اپنی بہو کے نام پر جو کمرہ کیا شریعت میں اس کی کیا حیثیت ہے؟ وارث ہونے کے ناطے اور بیوی کے نکاح نامے جو کمرہ نام کیا گیا اس کے ناطے اور میری ماں کے حوالے سے جو خدشات ہیں ان کو مدنظر رکھتے ہوئے مجھے عدالت عظمیٰ سے رجوع کرنا چاہیے ؟ برائے مہربانی اس معاملے میں شریعت کے مطابق مجھے حل بتائیں۔,"<p><p style=""text-align:justify;"">صورتِ مسئولہ میں جب سائل کے والد نے اپنی مرضی سے   اپنے مکان کا ایک کمرہ سائل  کے بیوی کے حق مہر میں لکھوایا تھا اور    نکاح کے بعد    وہ کمرہ سائل کی بیوی  کو دیدیا  تھا تو    سائل کی بیوی اس کمرہ کی مالک  بن گئی تھی   ،اب سائل کی  والدہ ،بہنوں اور بہنوئیوں کے لیے  اس  کمرہ کا قبضہ ختم کرنے کا مطالبہ کرنا اور اس کے لئے کسی قسم کا دباؤ ڈالنا شرعا جائز نہیں ہے ۔</p><p style=""text-align:justify;"">باقی  سائل کے والد مرحوم کے انتقال کے بعد ان کے ترکہ میں تمام ورثاء کا حق ہے ،سائل کی والدہ اور بہنوں کا سائل کو  والد کی میراث سے محروم  رکھنا  اور خود تمام جائیداد پر قبضہ کرنا شرعا ناجائز اور حرام ہے ،والدہ اور بہنوں پر لازم ہے کہ وہ  سائل کے والد  کی میراث میں سے سائل کا حق و حصہ دیں ،اگر دنیا میں نہیں دیں گے تو آخرت میں دینا ہوگا اور آخرت میں دینا بہت مشکل ہے ،باقی اگر سائل اپنے حق کے  لیے عدالت سے رجوع کرنا چاہے تو کرسکتا ہے۔</p><p dir=""rtl"" style=""text-align:justify;""><span lang=""er"" xml:lang=""er"">قرآن مجید میں ہے :</span></p><p class=""indent"" dir=""rtl"" style=""text-align:justify;""><span lang=""ar-sa"" xml:lang=""ar-sa""><span class=""ar_writing qr_writing"">""{ وَمَنْ يَعْصِ اللَّهَ وَرَسُولَهُ وَيَتَعَدَّ حُدُودَهُ يُدْخِلْهُ نَارًا خَالِدًا فِيهَا وَلَهُ عَذَابٌ مُهِينٌ }"" [النساء:</span><span class=""ar_writing"">14</span><span class=""ar_writing qr_writing"">]</span></span></p><p class=""indent"" dir=""rtl"" style=""text-align:justify;""><span lang=""ar-sa"" xml:lang=""ar-sa"">ترجمہ:۔’’جو اس میراث کے حوالے سے اللہ اور اس کے رسول کی نافرمانی کرتا ہے اور اس کے بیان کردہ حدود سے تجاوز کرتاہے، اللہ اس کو آگ میں داخل کردیں گے، جہاں وہ ہمیشہ رہے گااور اس کے لئے ذلت آمیز عذاب ہو گا‘‘۔</span></p><p dir=""rtl"" style=""text-align:justify;""><span lang=""er"" xml:lang=""er"">حدیث میں ہے :</span></p><p class=""indent"" dir=""rtl"" style=""text-align:justify;""><span lang=""ar-sa"" xml:lang=""ar-sa""><span class=""ar_writing"">""من قطع میراث وارثه قطع الله ميراثه من الجنة يوم القيامة.""</span></span></p><p class=""indent"" dir=""rtl"" style=""text-align:left;""><span lang=""ar-sa"" xml:lang=""ar-sa"">(مشکوۃ ، ج:</span><span lang=""fa"" xml:lang=""fa"">۱</span><span lang=""ar-sa"" xml:lang=""ar-sa"">، ص:</span><span lang=""fa"" xml:lang=""fa"">۲۶۶</span><span lang=""ar-sa"" xml:lang=""ar-sa"">، ط: قدیمی)</span></p><p class=""indent"" dir=""rtl"" style=""text-align:justify;""><span lang=""er"" xml:lang=""er"">ترجمہ :’’جو شخص اپنے وارث کو میراث سے محروم کر ے گا اللہ تعالیٰ قیامت کے دن اس کو جنت کی وارثت سے محروم رکھے گا۔‘‘</span></p><p style=""text-align:justify;""><span class=""ar_writing"">وفي الفتاوى الهندية :</span></p><p class=""indent"" style=""text-align:justify;""><span class=""ar_writing"">""وإذا تزوجها على هذا العبد وهو ملك الغير أو على هذه الدار وهي ملك الغير فالنكاح جائز والتسمية صحيحة فبعد ذلك ينظر إن أجاز صاحب الدار وصاحب العبد ذلك فلها عين المسمى.""</span></p><p class=""indent"" style=""text-align:left;""><span class=""ar_writing"">(كتاب النكاح,الباب السابع في المهر  ,الفصل الأول في بيان مقدار المهر وما يصلح مهرا وما لا يصلح1/ 303ط:دار الفكر)</span></p><p class=""indent"" style=""text-align:left;""><span class=""ar_writing"">فقط واللہ اعلم</span></p></p>",144404100401,banuri,"('نکاح', 'nikah')","('مہر', 'meher')","('مہر کا حکم', 'mehr-jehez-barat')"
02-02-2023,https://www.banuri.edu.pk/readquestion/zikr-mai-lafz-e-allah-kay-alif-ko-khainch-kar-parhnaa-144407100968/02-02-2023,ذکر میں لفظ اللہ کے الف کو کھینچ کر پڑھنا,لفظِ اللہ سے پہلے الف کو مد کر کے ذکر کرنا جائز ہے؟,"<p><p style=""text-align:justify;"">لفظِ اللہ  ""اِلٰہ""یا ""الالٰہ"" سے بنا ہے، اور اس کا صحیح تلفظ یہ ہے کہ اس کے شروع میں ہمزہ کو کھینچا نہ جائے، بلکہ بغیر کھینچےلام کے ساتھ ملایا جائے اور اگر ہمزہ  کو کھینچا جائے  اور یوں پڑھاجائے: ""آللہ"" تو اس کے شروع میں ہمزہ استفہام کا اضافہ ہوجائے گا، جس کا معنی ہوگا: کیا اللہ۔۔۔؟ اور یہ جملہ ناقص رہ جائے گا، جس کا کوئی معنی نہیں ہوگا.</p><p style=""text-align:justify;"">البتہ اگر نماز میں کوئی شخص اللہ اکبر کی جگہ  قصداً ""آللہ اکبر"" پڑھ لے، تو ایسا شخص دائرہ اسلام سے خارج ہوجائے گا اور اگر قصداً نہ پڑھے، بلکہ بھولے سے پڑھ لے، تو کافر تو نہیں ہوگا، لیکن نماز فاسد ہوجائے گی۔</p><p style=""text-align:justify;"">روح المعانی میں ہے:</p><p class=""indent"" style=""text-align:justify;""><span class=""ar_writing"">""«والله» أصله الاعلالي إله كما في الصحاح أو الإله كما في الكشاف- ولكل وجهة- فحذفت الهمزة اعتباطا (3) على الأظهر وعوض عنها الألف واللام.""</span></p><p class=""indent"" style=""text-align:left;""><span class=""ar_writing"">(سورة الفاتحة، ج:1، ص:57، ط:دار الكتب العلمية)</span></p><p style=""text-align:justify;"">فتاوی عالمگیری میں ہے:</p><p class=""indent"" style=""text-align:justify;""><span class=""ar_writing"">""ولو قال: الله أكبر مع ألف الاستفهام لايصير شارعًا بالاتفاق، كذا في التتارخانية ناقلًا عن الصيرفية.""</span></p><p class=""indent"" style=""text-align:left;""><span class=""ar_writing"">(کتاب الصلاۃ، ج:1، ص:68، ط:دار الفکر)</span></p><p style=""text-align:justify;"">الدر المختار مع رد المحتار میں ہے:</p><p class=""indent"" style=""text-align:justify;""><span class=""ar_writing"">""اعلم أنّ المدّ إن كان في الله، فإما في أوله أو وسطه أو آخره، فإن كان في أوله لم يصر به شارعا وأفسد الصلاة لو في أثنائها، ولايكفر إن كان جاهلًا؛ لأنه جازم.""</span></p><p class=""indent"" style=""text-align:left;""><span class=""ar_writing"">(کتاب الصلاۃ، ج:1، ص:480، ط:سعید)</span></p><p class=""indent"" style=""text-align:left;""><span class=""ar_writing"">فقط واللہ اعلم</span></p></p>",144407100968,banuri,"('نماز', 'salat')","('دعاء و اذکار', 'dua-o-azkaar')","('نماز کے بعد کے ذکر و اذکار', 'namaz-ke-bad-ke-zikr-o-azkaar')"
03-02-2023,https://www.banuri.edu.pk/readquestion/sir-par-sadqa-ghumane-ka-hukam-144407101014/03-02-2023,سر پر صدقہ گھمانے کا حکم,صدقہ سر سے پھیر کے دینا کیسا ہے؟ عموماً جس طرح آج کل لوگ کرتے ہیں ۔,"<p><p style=""text-align:justify;"">صدقہ کرنے  سے پہلے سر پر صدقہ  گھمانا بے اصل عمل ہے۔اس سے گریز کرنا چاہیے۔واللہ اعلم</p><p style=""text-align:justify;"">موسوعۃ فقہیۃ کویتیۃ میں ہے :</p><p class=""indent"" style=""text-align:justify;""><span class=""ar_writing"">""الصدقة قربة؛ لأنها تمليك بلا عوض، لأجل ثواب الآخرة، فلا بد فيها من النية، وقد ورد في الحديث أن النبي صلى الله عليه وسلم قال: إنما الأعمال بالنيات (2) ويستحب في الصدقة أن ينوي المتصدق ثوابها لجميع المؤمنين والمؤمنات"".</span></p><p class=""indent"" style=""text-align:left;"">(ج:26،ص:339،دارالصفوۃ)</p><p class=""indent"" style=""text-align:left;"">فقط واللہ اعلم</p></p>",144407101014,banuri,"('ایمان و عقائد', 'aqaed')","('بدعات اور رسوم', 'bidaat-rasoomat')","('معاشرہ میں رائج مختلف بدعات', 'muashray-may-raaij-mukhtalif-bidaaat')"
27-12-2022,https://www.banuri.edu.pk/readquestion/masjid-aor-mosalla-main-i-atekaf-ka-hukm-144406100249/27-12-2022,مسجد اور مصلیٰ میں اعتکاف کرنے کا حکم,ایک بلڈنگ جس کے نیچے دوکانیں اور گودام ہیں اور اس کی بالائی منزل پر مسجد بنائی گئی ہے اور اس میں پنج وقتہ نماز اور جمعہ وعیدین بھی ہوتے ہیں،آیا ایسی مسجد میں اعتکاف کرسکتے ہیں یا نہیں؟ براہِ کرم قرآن وسنت کی روشنی میں جواب عنایت فرمائیں ۔,"<p><p style=""text-align:justify;""><span lang=""ar-sa"" xml:lang=""ar-sa"">صورتِ مسئولہ میں اگر مذکورہ گودام اور دکانیں اسی طرح مسجد كے اوپر والا حصہ سب مسجد کےلیے وقف کیے گئے ہیں تو یہ مسجد شرعی کے حکم میں ہوگی،جس میں اعتکاف کرنا درست ہوگا اور اگر بلڈنگ ميں صرف بالائی منزل ( پہلی منزل ) مسجد كے ليے وقف کی گئی ہےاور اس میں مسجد بنائی گئی ہے،اور نیچے کی دوکانیں اور گودام مسجد کے لیے وقف نہیں ہیں تو یہ شرعی مسجد کے حکم میں نہیں ہوگی،بلکہ مصلیٰ کہلائے گی،جس میں اعتکاف کرنا درست نہیں ہوگا۔</span></p><p style=""text-align:justify;"">البحرالرائق میں ہے:</p><p class=""indent"" style=""text-align:justify;""><span class=""ar_writing"">""(قوله ومن جعل مسجدا ‌تحته ‌سرداب أو فوقه بيت وجعل بابه إلى الطريق وعزله أو اتخذ وسط داره مسجدا وأذن للناس بالدخول فله بيعه ويورث عنه) لأنه لم يخلص لله تعالى لبقاء حق العبد متعلقا به والسرداب بيت يتخذ تحت الأرض لغرض تبريد الماء وغيره كذا في فتح القدير وفي المصباح السرداب المكان الضيق يدخل فيه والجمع سراديب. وحاصله أن شرط كونه مسجدا أن يكون سفله وعلوه مسجدا لينقطع حق العبد عنه لقوله تعالى {وأن المساجد لله} [الجن: 18]"".</span></p><p class=""indent"" style=""text-align:left;""><span class=""ar_writing""> (‌‌كتاب الوقف،‌‌شرائط الوقف،‌‌فصل اختص المسجد بأحكام تخالف أحكام مطلق الوقف،ج:5،ص:271،ط:دار الكتاب الإسلامي)</span></p><p style=""text-align:justify;"">فتاویٰ عالمگیری میں ہے:</p><p class=""indent"" style=""text-align:justify;""><span class=""ar_writing"">""(وأما شروطه) فمنها النية حتى لو اعتكف بلا نية لايجوز بالإجماع، كذا في معراج الدراية. ومنها مسجد الجماعة فيصح في كل مسجد له أذان وإقامة هو الصحيح، كذا في الخلاصة.""</span></p><p class=""indent"" style=""text-align:left;""><span class=""ar_writing""> (‌‌كتاب الصوم،الباب السابع في الاعتكاف،ج:1،ص:211،ط:رشيديه)</span></p><p class=""indent"" style=""text-align:left;""><span class=""ar_writing"">فقط والله اعلم</span></p></p>",144406100249,banuri,"('روزہ', 'soum')","('اعتکاف', 'etekaaf')","('اعتکاف کی شرائط', 'etekaaf-ki-sharaet')"
02-02-2023,https://www.banuri.edu.pk/readquestion/awrat-ki-sharamgah-say-niklanay-wali-ratoobat-ka-hukam-144407100979/02-02-2023,عورت کی شرمگاہ سے نکلنے والی رطوبت کا حکم,عورت کی شرمگاہ سے سفید پانی نکلنے سے کیا عورت ناپاک ہو جاتی ہے؟,"<p><p style=""text-align:justify;"">عورت کی شرمگاہ سے نکلنے والی رطوبت  ناپاک ہے، اس کے نکلنے سے وضو ٹوٹ جائے گا اور اگر کپڑے یا جسم پر لگ جائے  تو  اس حصہ کو دھونا ضروری ہوگا، اگر اس کی مقدار ایک درہم  سے زیادہ ہے اور اس کو دھویا نہیں تو  نماز درست نہیں ہوگی، اور اگر اس کی مقدار ایک درہم یا اس سے کم ہے تو نماز ہوجائے گی لیکن جان بوجھ کر دھوئے  بغیر نماز پڑھنا مکروہ ہے۔</p><p style=""text-align:justify;"">تاہم  اگر یہ بیماری کسی کو اتنی زیادہ ہوکہ کسی نماز کے مکمل وقت میں اسے اتنا وقفہ بھی نہ ملے جس میں وہ وضو کرکے پاکی کی حالت میں  اس وقت کی فرض نماز ادا کرسکے تو وہ معذور کے حکم میں ہوگی،اور معذور کا حکم یہ ہے کہ ہر نماز کا وقت داخل ہونے  کے بعد ایک مرتبہ وضو کرلے اورپھر اس میں جتنی چاہے نماز پڑھے ، اگر وضو کے  بعد اس رطوبت کے  علاوہ کوئی اور وضو توڑنے والی چیز  صادر ہو تو دوبارہ وضو کرے ورنہ دوبارہ  وضو کرنے کی ضرورت نہیں ہوگی، اور نماز کا وقت ختم ہوتے ہی اس کا وضو ختم ہوجائے گا، اگلی نماز کے وقت کے لیے دوسرا وضو کرنا ہوگا، اور اگر کسی بھی نماز کا مکمل وقت اس عذر (رطوبت نکلنے) کے بغیر گزر جائے تو اب یہ خاتون شرعی معذور نہیں رہے گی۔</p><p style=""text-align:justify;"">باقی  کپڑا اور جسم پاک کرنے کے حکم میں یہ تفصیل  ہے کہ اگر اتنا وقفہ ملتاہو کہ کپڑا و جسم دھوکرنماز پڑھے تو نماز کے درمیان میں وہ دوبارہ ناپاک نہ ہوتا ہو تب تو اس کے ذمے دھونا واجب ہوگا ، اوراگر یہ حالت ہو کہ اس کو دھو کر نماز پڑھنے کے درمیان وہ پھرناپاک ہوجاتا ہو تو دھوناواجب نہیں ہوگا۔</p><p style=""text-align:justify;"">الدر المختار مع رد المحتار میں ہے:</p><p class=""indent"" style=""text-align:justify;""><span class=""ar_writing"">""(وصاحب عذر من به سلس) بول لا يمكنه إمساكه (أو استطلاق بطن أو انفلات ريح أو استحاضة) أو بعينه رمد أو عمش أو غرب، وكذا كل ما يخرج بوجع ولو من أذن وثدي وسرة (إن استوعب عذره تمام وقت صلاة مفروضة)</span></p><p class=""indent"" style=""text-align:justify;""><span class=""ar_writing"">بأن لا يجد في جميع وقتها زمنا يتوضأ ويصلي فيه خاليا عن الحدث (ولو حكما) لأن الانقطاع اليسير ملحق بالعدم (وهذا شرط) العذر (في حق الابتداء، وفي) حق (البقاء كفى وجوده في جزء من الوقت) ولو مرة (وفي) حق الزوال يشترط (استيعاب الانقطاع) تمام الوقت (حقيقة) لأنه الانقطاع الكامل، ونحوه (لكل فرض) اللام للوقت كما في - {لدلوك الشمس}- (ثم يصلي) به (فيه فرضا ونفلا) فدخل الواجب بالأولى (فإذا خرج الوقت بطل) أي: ظهر حدثه السابق، حتى لو توضأ على الانقطاع ودام إلى خروجه لم يبطل بالخروج ما لم يطرأ حدث آخر.</span></p><p class=""indent"" style=""text-align:justify;""><span class=""ar_writing"">(وإن سال على ثوبه) فوق الدرهم (جاز له أن لا يغسله إن كان لو غسله تنجس قبل الفراغ منها) أي: الصلاة (وإلا) يتنجس قبل فراغه (فلا) يجوز ترك غسله، هو المختار للفتوى.""</span></p><p class=""indent"" style=""text-align:left;""><span class=""ar_writing"">(كتاب الطهارة، باب الحيض، مطلب في احكام المعذور، ج:1، ص: 306، ط: سعيد)</span></p><p class=""indent"" style=""text-align:left;""><span class=""ar_writing"">فقط والله اعلم</span></p></p>",144407100979,banuri,"('طہارت', 'taharat')","('شرعی معذورین کے احکام', 'sharee-mazoreen-k-ahkam')","('معذورین کے احکام', 'ma-zoron-k-ahkam')"
02-02-2023,https://www.banuri.edu.pk/readquestion/yashfen-name-rakhna-144407100980/02-02-2023,یشفین نام رکھنا,یشفین نام رکھنا کیسا ہے، میں نے اپنی بیٹی کا نام رکھا ہے، لیکن کچھ علماء کرام کا کہنا ہے کہ معنی اچھا نہیں ہے، دوسرا رکھیں، مہربانی کر کے راہ نمائی فرما دیں۔,"<p><p style=""text-align:justify;"">”یشفین “ کلمہ   قرآن مجید کی اس آیت میں  مذکور ہے:   <span class=""qr_writing"">{وَإِذَا مَرِضْتُ فَهُوَ يَشْفِينِ} [الشعراء: 80]</span>(ترجمه : جب  میں بیمار ہوتا ہوں تو وہ  (اللہ )مجھے شفا دیتا ہے)،  اور <span class=""ar_writing"">""يَشْفِينِ""</span> بھی اصل میں ""<span class=""ar_writing"">یشفینی""</span> ہے ، یہ  متکلم کی طرف نسبت ہے، اس میں فعل <span class=""ar_writing"">""یشفي""</span> ہے، جس کے معنی ہیں: ’’وہ شفا دیتا ہے‘‘اور ""نی "" مفعول ہے جس کا معنی ہے ""مجھے ""،  اس تفصیل سےمعلوم ہوا کہ  یہ مستقل جملہ ہے ،   فعل (Verb)   اور مفعول کے ساتھ ؛ اس لیے نام رکھنے کے لیے  یہ مناسب نہیں ہے، اس کے بجائے صحابیات  رضی اللہ عنہن  یا دیگر نیک مسلمان خواتین   میں سے کسی  کے نام پر  بچی کا نام رکھ لیں، ہماری ویب سائٹ کے اسلامی ناموں کے سیکشن سے بھی اچھے بامعنی نام منتخب کیے جاسکتے ہیں۔ فقط واللہ اعلم</p></p>",144407100980,banuri,"('حظر و اباحت', 'mamnooaat-mubahat')","('نام، لقب، کنیت', 'asaami')","('ناموں کے معانی اور احکام', 'namoun-ke-mani-or-ahkaam')"
