issued_at,link,title,question,answer,fatwa_number,dar_ul_ifta,kitab,bab,fasal
03-02-2023,https://www.banuri.edu.pk/readquestion/bank-me-acaount-kholna-bank-cards-ka-istimal-atm-card-or-cheek-book-ka-istimal-144407101086/03-02-2023,بینک میں اکاؤنٹ کھولنا / بینک کارڈز کا استعمال /اے ٹی ایم کارڈ اور چیک بک کا استعمال,1۔ کیا بینک اکاؤنٹ کھولنا حلال ہے؟ اور اگر ہاں تو کن بینکوں کو ترجیح دی جاتی ہے؟2۔کیا بینک کارڈز پر دی جانے والی رعایت سے فائدہ اٹھانے کی اجازت ہے؟3۔ کیا بینک کی سہولیات جیسے کہ اے ٹی ایم کارڈ اور چیک بک کا استعمال حلال ہے؟,"<p><p style=""text-align:justify;"">1۔اگر کوئی شخص اپنی رقم کی حفاظت کا  بندوبست خود کرسکتا ہےتو  اس کے لیے زیادہ بہتر یہی ہے کہ بینک کے کسی بھی  اکاؤنٹ کا  استعمال نہ کرے، تاہم اگرواقعی ضروت ہو تو ایسی صورت میں کسی بھی بینک میں  کرنٹ اکاؤنٹ کھلوانے کی گنجائش ہے۔اس میں کسی  بینک کو ترجیح  نہیں ہے ،جہاں اکاؤنٹ  کھولنے میں سہولت ہو وہاں کھلوا لیا جائے ۔</p><p style=""text-align:justify;"">2۔بینک کارڈز  کا حکم یہ ہے کہ  ضرورت کی بنا پربینک کا    ڈیبٹ  کارڈ بنانا اور اس کے ذریعہ ادائیگیاں  کرنا جائز ہے، لیکن کریڈٹ کارڈ بنوانا  اور اس کا ااستعمال کرنا سودی معاہدہ پر مشتمل ہونے کی وجہ  سے  جائز ہی نہیں ہے۔</p><p style=""text-align:justify;"">پھر  ڈیبٹ    کارڈ کے استعمال پر ملنے والے ڈسکاؤنٹ کے جائز اور ناجائز ہونے میں درج ذیل تفصیل ہے:</p><ul><li style=""text-align:justify;"">  کارڈ کے ذریعہ ادائیگی کی صورت میں کچھ   پیسوں کی رعایت (Discount)  اگر  بینک کی طرف سے ملتی ہوتو اس صورت میں اس رعایت کا حاصل کرنا شرعاً ناجائز ہوگا، کیوں کہ یہ رعایت بینک کی طرف سے کارڈ ہولڈر کو اپنے بینک اکاؤنٹ کی وجہ سے مل رہی ہے جو شرعاً قرض کے حکم میں ہے اور جو فائدہ قرض کی وجہ  سے حاصل ہوتا ہے وہ سود کے زمرے میں آتا ہے۔</li><li style=""text-align:justify;""> اگر یہ رعایت  اس ادارے کی جانب سے ہو جہاں سے کچھ خریدا گیاہے یاوہاں کھاناکھایاگیاہے تو یہ  ان کی طرف سے تبرع واحسان ہونے کی وجہ سے جائز ہوگا۔</li><li style=""text-align:justify;""> رعایت نہ تو بینک کی طرف سے ہو اور نہ ہی جس ادارے سے خریداری ہوئی ہے اس کی طرف سے ہو، بلکہ   کارڈ بنانے والے ادارے کی طرف سے رعایت ہو، تو اگر اس ادارے کے تمام یا اکثر معاملات جائز ہوں اور ان کی آمدن کل یا کم از کم اکثر حلال ہو تو اس صورت میں ڈسکاؤنٹ سے مستفید ہونے کی اجازت ہوگی۔</li><li style=""text-align:justify;""> اگر معلوم نہ ہوکہ یہ رعایت کس کی طرف سے ہے تو پھر اجتناب کرنا چاہیے ۔</li></ul><p style=""text-align:justify;"">3۔بینک کے اے ٹی ایم کارڈ اور چیک بک کا استعمال جائز ہے ؛ اس لیے کہ بینک میں رکھی رقم قرض کے حکم میں ہے اور  قرض دینے والے کو مقروض سے اس قرض کے حصول کی اجازت ہوتی ہے ، اے ٹی ایم کارڈ اور چیک بک  اس قرض کی وصولی  اور اس قرض  کی تحویل اور ارسال کو آسان بنانے کی مختلف صورتیں ہیں  ،یہ قرض کے علاوہ کوئی ایسی  مشروط اضافی چیز نہیں ہیں  جن کا حصول قرض دینے والے کے لیے ممنوع ہو ۔</p><p style=""text-align:justify;"">فتاوی شامی میں ہے:</p><p class=""indent"" style=""text-align:justify;""><span class=""ar_writing"">""وفي الأشباه ‌كل ‌قرض جر نفعا حرام.</span></p><p class=""indent"" style=""text-align:justify;""><span class=""ar_writing"">(قوله : ‌كل ‌قرض جر نفعًا حرام) أي إذا كان مشروطا كما علم مما نقله عن البحر، وعن الخلاصة: وفي الذخيرة وإن لم يكن النفع مشروطًا في القرض، فعلى قول الكرخي لا بأس به ويأتي تمامه.""</span></p><p class=""indent"" style=""text-align:left;""><span class=""ar_writing"">(کتاب البیوع،  باب المرابحة،  فصل فی القرض (5/166، ط: ایچ ایم سعید)</span></p><p style=""text-align:justify;"">مرقاة المفاتيح شرح مشكاة المصابيح میں ہے:</p><p class=""indent"" style=""text-align:justify;""><span class=""ar_writing"">"" وعن النعمان بن بشير - رضي الله عنهما - قال: قال رسول الله صلى الله عليه وسلم: "" «الحلال بين والحرام بين، وبينهما مشتبهات لايعلمهن كثير من الناس، فمن اتقى الشبهات استبرأ لدينه وعرضه، ومن وقع في الحرام كالراعي يرعى حول الحمى يوشك أن يرتع فيه، ألا وإن لكل ملك حمى، ألا وإن حمى الله محارمه، ألا وإن في الجسد مضغة إذا صلحت صلح الجسد كله، وإذا فسدت فسد الجسد كله، ألا وهي القلب» "". متفق عليه.</span></p><p class=""indent"" style=""text-align:justify;""><span class=""ar_writing"">(وبينهما مشتبهات) : بكسر الموحدة أي: أمور ملتبسة غير مبينة لكونها ذات جهة إلى كل من الحلال والحرام.""</span></p><p class=""indent"" style=""text-align:left;""><span class=""ar_writing"">(کتاب البیوع باب الکسب و طلب الحلال،ج نمبر ۵ ص نمبر ۱۸۹۱،دار الفکر)</span></p><p class=""indent"" style=""text-align:left;""><span class=""ar_writing"">فقط اللہ اعلم</span></p></p>",144407101086,banuri,"('بیوع', 'buyoo')","('ربا و قمار', 'riba-o-qemaar')","('کریڈٹ کارڈ اور ڈیبٹ کارڈ', 'credit-card-or-debit-card')"
04-02-2023,https://www.banuri.edu.pk/readquestion/motaddatul-wafat-ka-apny-baiton-k-ghar-jana-kesa-hai-144407101123/04-02-2023,معتدۃ الوفات کا اپنے بیٹوں کے گھر جانا کیسا ہے؟,متوفی عنھا زوجھا کا عدت کے دوران میں اپنے بیٹوں کے پاس جانا کیسا ہے؟ جو مختلف گھروں میں ہیں۔,"<p><p style=""text-align:justify;"">واضح رہے کہ متوفی عنہا زوجہا کے لیے دوران عدت کسی شرعی عذر (مثلاً شدید بیماری کی وجہ سے ڈاکٹر کے پاس جانا ہو، یا گھر منہدم ہونے کا خطرہ ہو، یا کرایہ نہ ہونے کے صورت میں مکان خالی کرنا ہو وغیرہ) کے بغیر گھر سے باہر نکلنا جائز نہیں ہے، صورتِ مسئولہ میں اپنے بیٹوں کے مختلف گھروں میں جانا اگر کسی شرعی عذر کی بنا پر ہے تو درست ہے، اور اگر صرف ملنے کے لیے جانا ہے تو درست نہیں ہے۔</p><p style=""text-align:justify;"">فتاوی شامی میں ہے:</p><p class=""indent"" style=""text-align:justify;""><span class=""ar_writing"">""(وتعتدان) أي معتدة طلاق وموت (في بيت وجبت فيه) ولا يخرجان منه (إلا أن تخرج أو يتهدم المنزل، أو تخاف) انهدامه، أو (تلف مالها، أو لا تجد كراء البيت) ونحو ذلك من الضرورات فتخرج لأقرب موضع إليه.""</span></p><p class=""indent"" dir=""rtl"" style=""text-align:left;""><span class=""ar_writing"">(كتاب الطلاق، ج: 3، ص: 536، ط: دار الفكر بيروت)</span></p><p class=""indent"" dir=""rtl"" style=""text-align:left;""><span class=""ar_writing"">فقط والله أعلم</span></p></p>",144407101123,banuri,"('طلاق', 'talaaq')","('عدت', 'iddat')","('عدتِ وفات', 'iddat-e-wafaat')"
17-01-2023,https://www.banuri.edu.pk/readquestion/video-grapy-k-zareye-tution-parhana-144406101866/17-01-2023,ویڈیو گرافی کے ذریعہ ٹیوشن پڑھانا,ہم چند ماہر ٹیچر حضرات زوم ایپ یا کسی دوسری ایپلیکیشن پرآن لائن کلاس پڑھانا شروع کر رہے ہیں ، جس میں ویڈیو گرافی ہوگی ، وہ ویڈیو محفوظ کرلی جاتی ہے، تاکہ طلبہ لیکچر دوبارہ سن سکیں، اس آن لائن کلاس میں تختہ سیاہ کے ساتھ ٹیچر بھی نظر آئے گا، پڑھانے والے مرد حضرات ہیں اور پڑھنے والے بھی لڑکے ہی ہیں، یہ آن لائن کلاس بہت ہی کم فیس میں شروع کی جارہی ہے؛ تاکہ پورے ملک میں کسی بھی خطہ کا غریب سے غریب طالب علم اس کلاس سے ٹیوشن پڑھ کر عصری اعلی تعلیم حاصل کر کے ڈاکٹر ،انجینئر اور افسر بن سکے، اس کلاس کے شروع کرنے کا مقصد یہ ہے کہ مسلم طلبہ عصری تعلیم میں عبور حاصل کر سکیں ، ہر جگہ بہتر ٹیوشن کلاس یا کوچنگ سینٹر نہیں ہوتا ہے، اگر کہیں  ہوتا بھی ہے تو فیس بہت زیادہ ہوتی ہے، جس کو طلبہ برداشت نہیں کر سکتے ؛ لہذا آپ سے سوال ہے کہ اس طرح ویڈیوگرافی کےذریعہ طلبہ کو آن لائن ٹیوشن پڑھانا جائز ہے؟ اس کی آمدنی کا کیا حکم ہے؟,"<p><p style=""text-align:justify;"">واضح رہے کہ  شریعت مطہرہ میں کسی  بھی  جان دار  چیز کی تصویر کشی   کرنا حرام ہے ، خواہ وہ  تصویر کشی کسی ڈیجیٹل کیمرے کے ذریعہ سے ہو یا غیر ڈیجیٹل کیمرے سے ، بہر صورت ناجائز اور حرام ہے، زوم ایپ کا استعمال بھی شرعاً تصویر کشی کے حکم میں ہے؛اس لیے آن لائن  تعلیم وتد ریس کےلیے  یہ بنیادی شرط ہے کہ تعلیم  محض صوتی یعنی صرف آواز ( آڈیو کال )  کے ذریعہ ہو ،ایک  دوسرے کی تصویر  نظر نہ آئے یعنی تعلیم کیمرے(ویڈیوکال ،لائیو ویڈیووغیرہ )کے ذریعہ  نہ  ہو ،اگر دوران تدریس  کیمرے کا استعمال ہو تو  کیمرے کا رخ ( فوکس )غیرجاندار  چیز ( بورڈ ، کتاب وغیرہ )   پر ہو ،کیمرے کے سامنے  استاد یا طالب علم/طلبہ کا آنا جائز نہیں ہے ۔</p><p style=""text-align:justify;"">لہذا صورت ِ مسئولہ میں ویڈیو گرافی کے ذریعہ  مذ کورہ طریقہ کے مطابق طلبہ کو آن لائن ٹیوشن پڑھانا شرعاً ناجائز ہے ،اور اس کی آمدنی حلال طیب نہیں ہے ۔</p><p style=""text-align:justify;"">البحر الرائق میں ہے :</p><p class=""indent"" style=""text-align:justify;""><span class=""ar_writing"">""وظاهر كلام النووي في شرح مسلم الإجماع على تحريم تصويره صورة الحيوان وأنه قال: قال أصحابنا وغيرهم من العلماء: ‌تصوير ‌صور ‌الحيوان حرام شديد التحريم وهو من الكبائر لأنه متوعد عليه بهذا الوعيد الشديد المذكور في الأحاديث يعني مثل ما في الصحيحين عنه - صلى الله عليه وسلم - «أشد الناس عذابا يوم القيامة المصورون يقال لهم أحيوا ما خلقتم» ثم قال وسواء صنعه لما يمتهن أو لغيره فصنعته حرام على كل حال لأن فيه مضاهاة لخلق الله تعالى وسواء كان في ثوب أو بساط أو درهم ودينار وفلس وإناء وحائط وغيرها اهـ. فينبغي أن يكون حراما لا مكروها إن ثبت الإجماع أو قطعية الدليل لتواتره.""</span></p><p class=""indent"" style=""text-align:left;"">(باب مایفسد الصلاۃ وما یکرہ فیہا ،ج:2،ص:29،دارالکتاب الاسلامی)</p><p style=""text-align:justify;"">الموسوعۃ الفقہیۃ الکویتیۃ میں ہے :</p><p class=""indent"" style=""text-align:justify;""><span class=""ar_writing"">""الإجارۃ علی المنافع المحرمۃ کالزنی والنوح والغناء والملاہی محرمۃ وعقدہا باطل لا یستحق بہٖ أجرۃ۔ ولا یجوز استئجار کاتب لیکتب لہٗ غنائً ونوحًا ، لأنہٗ انتفاع بمحرم۔ وقال أبو حنیفۃ : یجوز ، ولا یجوز الاستئجار علی حمل الخمر لمن یشربہا ، ولا علی حمل الخنزیر.""</span></p><p class=""indent"" style=""text-align:left;"">(کتاب الاجارۃ،الاجارۃ علی المعاصی ،ج:1،ص:290،دارالسلاسل)</p><p style=""text-align:justify;"">بدائع الصنائع میں ہے :</p><p class=""indent"" style=""text-align:justify;""><span class=""ar_writing"">"" فأما صورة ما لا حياة له كالشجر ونحو ذلك فلايوجب الكراهة؛ لأن عبدة الصور لايعبدون تمثال ما ليس بذي روح، فلا يحصل التشبه بهم، وكذا النهي إنما جاء عن تصوير ذي الروح لما روي عن علي - رضي الله عنه - أنه قال: من صور تمثال ذي الروح كلف يوم القيامة أن ينفخ فيه الروح، وليس بنافخ.........الخ</span></p><p class=""indent"" style=""text-align:left;""><span class=""ar_writing"">(کتاب الصلاۃ،فصل شرائط ارکان الصلاۃ،ج:1،ص:116،دارالكتب العلمية)</span></p><p class=""indent"" style=""text-align:left;"">فقط والله اعلم</p></p>",144406101866,banuri,"('حظر و اباحت', 'mamnooaat-mubahat')","('متفرقات', 'mutafarriqaat')","('متفرقات ممنوعات و مباحات', 'muatafarriqaat-e-mamnooaat-o-mubahaat')"
24-05-2021,https://www.banuri.edu.pk/readquestion/cancer-ka-roohani-ilaj-be-at-ka-hukum-144210200355/24-05-2021,کینسر کا روحانی علاج / بیعت کا حکم,۱۔ کیا قرآن یا حدیث میں کہیں کینسر کے علاج کا ذکر ہے ؟۲۔ کیا اسلام میں بیعت کی اجازت ہے،  اگر ہاں تو پھر کس سے اور کیسے کی جاسکتی ہے؟,"<p><p style=""text-align:justify;"">۱۔ قرآن و حدیث میں باقاعدہ کینسر کا علاج  تو کہیں مذکور نہیں ہے البتہ  ذیل میں  کچھ معمولات ذکر کیے جاتے ہیں ، جن میں سے کسی ایک پر یا ہوسکے تو سب پر عمل کرلیجیے ان شاء اللہ تعالیٰ فائدہ ہوگا:</p><p class=""indent"" style=""text-align:justify;"">     1- دن میں تین یا سات مرتبہ سورۃ الرحمن پڑھا کریں۔</p><p class=""indent"" style=""text-align:justify;"">     2- سورہ یس 41 مرتبہ اور سورہ تغابن 41  مرتبہ  پڑھ  کر پانی  پر دم کرکے رکھ لیا جائے اور مریض کو وہی پانی پلایا جائے۔(کئی افراد مل کر بھی یہ تعداد پوری کرسکتے ہیں) </p><p class=""indent"" style=""text-align:justify;"">     3۔ کثرت کے ساتھ درج ذیل دعا کا اہتمام کریں:</p><p class=""indent"" style=""text-align:justify;""><span class=""qr_writing"">اَللّهمَّ إِنِّي أَعُوْذُ بِكَ مِنَ البَرصِ وَ الْجُنُونِ وَ الْجُذَامِ وَ مِنْ سَيْئِ الأسْقَامِ.</span></p><p style=""text-align:justify;"">۲۔ واضح رہے کہ ہر انسان پر اپنے نفس کی اصلاح واجب ہے، اس کے لیے جس طرح دیگر ذرائع ہیں اسی طرح کسی سے بیعت ہوجانا بھی ایک مؤثر اور کامیاب ذریعہ ہے، اب ہر ایک کے لیے یہ ضروری تو نہیں ہے، لیکن انسان اگر خود رائی کو  وطیرہ بنالے تو  ذاتی و اجتماعی، دینی و دنیاوی معاملات میں اس سے غلطی کا احتمال زیادہ رہتاہے، جب کہ کسی متبعِ شریعت بزرگ کو اپنا بڑا بناکر اس کی راہ نمائی اور مشورے سے امور انجام دینے میں غلطی اور نقصان کا امکان بہت کم ہوجاتاہے، لہٰذا اگر کسی کو ایسے دین دار اساتذہ اور والدین میسر ہیں جو اس کی ہر موڑ پر راہ نمائی کرتے ہوں، اور وہ ان کا فرماں بردار ہو اور ان سے گہرا ربط رکھتاہو تو اسے باقاعدہ بیعت ہونے کی ضرورت نہیں ہے، لیکن یہ بات شاذ ونادر کسی کو میسر ہوتی ہے، لہذا بہتر  یہ ہے کہ کسی متبعِ سنت و شریعت کے پابند بزرگ کے ہاتھ میں ہاتھ دیکر باقاعدہ ان سے اصلاحی تعلق قائم کرلیاجائے، اور اگر کوئی سمجھتا ہے کہ اس کی اصلاح صرف کسی سے بیعت ہوکر یعنی کسی کی مریدی اختیار کرلینے سے ہی ہوسکتی ہے تو ایسے شخص کے لیے تو کسی متبعِ سنت بزرگ سے بیعت ہونا ضروری ہے اور اگر وہ سمجھتا ہے کہ کسی سے بیعت ہوئے بغیر  کسی معتبر شرعی ذریعہ سے اس کی اصلاح ہوسکتی ہے تو اس کے لیے ضروری ہے کہ اس ذریعہ کو اختیار کرے۔</p><p style=""text-align:justify;"">اس لیے نہ تو بیعت (پیری مریدی) کو مطلقاً لازم اور ضروری کہا جاسکتا ہے اور نہ ہی بالکلیہ اس کی اہمیت و افادیت کا انکار کیا جاسکتا ہے،  ہر شخص کے احوال کے اعتبار سے اس کا حکم مختلف ہوگا۔</p><p style=""text-align:justify;"">چوں کہ  بیعت کا مقصد رشد و ہدایت اور اصلاح نفس ہے، اس لیے شیخ ( جس سے بیعت کی جائے ) میں مندرجہ ذیل صفات کا ہونا ضروری ہے:</p><ol style=""text-align:justify;""><li><p>کتاب و سنت کا ضروری علم رکھتا ہو خواہ  پڑھ کر یا علماء سے سن کر۔</p></li><li><p>عدالت و تقوی میں پختہ ہو، کبائر سے اجتناب کرتا ہو، صغائر پر مصر نہ ہو۔</p></li><li><p> دنیا سے بے رغبت ہو (حبِ مال و حبِ جاہ سے خالی ہو)، آخرت میں رغبت رکھتاہو، طاعاتِ مؤکدہ و اذکار منقولہ کا پابند ہو۔</p></li><li><p> نیکیوں کا حکم کرتا ہو، برائیوں سے روکتا ہو۔</p></li><li><p> سلوک، تزکیۂ باطن کو معتبر مشائخ سے حاصل کیا ہو، اور ان کی صحبت میں طویل عرصہ رہا ہو۔</p></li></ol><p style=""text-align:justify;""><span class=""ar_writing"">تلازم الشریعة  والطریقة </span>میں ہے؛</p><p class=""indent"" style=""text-align:justify;""><span class=""ar_writing"">""فشرط من ياخذ البيعة أمور، أحدها: علم الكتاب والسنة... والشرط الثاني: العدالة والتقوى، فيجب أن يكون مجتنبًا عن الكبائر غير مصر علي الصغائر... والشرط الثالث: أن يكون زاهدًا في الدنيا راغبًا في الأخرة، مواظبًا على الطاعات المؤكدة والأذكار المأثورة... والشرط الرابع: أن يكون آمرًا بالمعروف ناهيًا عن المنكر... والشرط الخامس: أن يكون صحب المشائخ وتأدب بهم دهرًا طويلًا وأخذ منهم النور الباطن والسكينة.""</span></p><p class=""indent"" style=""text-align:left;""><span class=""ar_writing"">(ص:130، از  شیخ الحدیث مولانا محمد زکریا کاندہلوی رحمه اللہ، ط:مکتبہ حرمین، دبئی)</span></p><p style=""text-align:justify;"">لہذا اگر کسی شیخ میں مندرجہ بالا شرائط موجود ہوں تو ان سے بیعت کی جاسکتی ہے۔ </p><p style=""text-align:justify;"">اور  چوں کہ بیعت کا مقصد اپنے نفس کی اصلاح ہے توسب سے پہلے یہ بھی دیکھ لیا جائے کہ ذاتی طور پر کن بزرگ سے اپنی مناسبت محسوس ہوتی ہے ، پھر جس بزرگ سے مناسبت اور انسیت ہوجائے ان کے پاس جاکر ان سے درخواست کی جائے اور ان کے ہاتھ پر اپنا ہاتھ دے کر بیعت کرلی جائے اور بیعت کرتے وقت تمام گناہوں سے سچی توبہ کرتے ہوئے آئندہ کسی قسم کا گناہ نہ کرنے کا پختہ عزم کیا جائے ، اور جیسے جیسے شیخ اعمال و ورود کی تلقین کریں ، ان پر پاندی سے عمل کیا جائے اور اپنے ذاتی احوال ان کے سامنے بغیر کسی حائل اور جھجھک کے پیش کیے جائیں تاکہ ان احوال کے مطابق وہ اصلاح و تربیت کرسکیں ، اسی طرح بیعت کا مقصد پوری طرح حاصل ہوگا۔</p><p style=""text-align:justify;"">باقی جہاں تک بیعت کرنے کا طریقہ کار کا سوال ہے تو اس کےلیے ہر سلسلہ کے بزرگ کا اپنا طریقہ کار ہوتا ہے جو سلسلہ کے اکابرین سے چلتا آرہا ہوتا ہے ۔فقط واللہ اعلم  </p></p>",144210200355,banuri,"('علوم و فنون', 'uloom-funoon')","('دعائیں، اوراد اور وظائف', 'adeya-azkar')","('اوراد ووظائف', 'aurad-o-wzaif')"
