issued_at,link,title,question,answer,fatwa_number,dar_ul_ifta,kitab,bab,fasal
25-01-2023,https://www.banuri.edu.pk/readquestion/pyano-krayh-pr-dyna-kysa-hy-144407100240/25-01-2023,پیانو کرایہ پر دینا کیساہے؟,"میں ایک جگہ کام کرتا ہوں ،وہاں کمپنی کا ایک ساتھی ""پیانو"" کرایہ پر دیتا ہے تو ہمیں لانے اور لے جانے کے لیے ساتھ لے جاتا ہے اور اس کی مزدوری دیتا ہے ،کیا یہ ہمارے لئے حرام ہے؟ اگر ہے، تو اس کا کفارہ کیا ہوگا ؟کیونکہ میں کئی دفعہ اس کے ساتھ جا چکا ہوں ۔","<p><p style=""text-align:justify;"">واضح رہے کہ ""پیانو"" کرایہ پر دینا شرعاً ناجائز و حرام ہے اور حرام ذرائع کو آمدن کا ذریعہ بنانا اور ایسی آمدن کو استعمال کرناسب ہی حرام ہے؛ لہذا صورتِ مسئولہ میں  سائل کا اپنی ساتھی کے پیانو کو کرایہ پردیتے وقت  اس کے ساتھ لانے اور لے جانے  میں معاونت کرنا یہ ناجائزہے اور اس معاونت کے بدلہ اس کوجو مزدوری ملی ہے وہ بھی حرام اورناجائزہے،لہذا سائل نے اب تک جتنی مزدوری اس کے ذریعہ سے حاصل کی ہے وہ سب کی سب بغیر نیتِ ثواب کے صدقہ کردے اور سچے دل سے توبہ و استغفار بھی کرےاور آئندہ کے لیے اس قسم کی کمائی سے دور رہے ۔</p><p style=""margin:0 0 30px;color:#323232;line-height:36px;font-weight:bold;font-size:17px;font-family:Nafees,'Helvetica Neue',Helvetica,Arial,sans-serif;background-color:#fff;text-align:justify;""><span class=""ar_writing"">في أحكام القرآن للجصاص <span style=""font-size:12px;"">رح</span>:</span></p><p class=""indent"" style=""text-align:justify;""><span class=""ar_writing"">""وقوله تعالى: وتعاونوا على البر والتقوى يقتضي ظاهره إيجاب التعاون على كل ما كان تعالى لأن البر هو طاعات الله وقوله تعالى ولا تعاونوا على الإثم والعدوان نهي عن معاونة غيرنا على معاصي الله تعالى.""</span></p><p class=""indent"" style=""text-align:left;""><span class=""ar_writing"">(سورہ مائدہ،ج:3،ص:296،ط:دار احیاء التراث)</span></p><p style=""text-align:justify;""><span class=""ar_writing""> في البحر الرائق:</span></p><p class=""indent"" style=""text-align:justify;""><span class=""ar_writing"">""(ولايجوز على الغناء والنوح والملاهي)؛ لأن المعصية لايتصور استحقاقها بالعقد فلايجب عليه الأجرة من غير أن يستحق عليه؛ لأن المبادلة لاتكون إلا عند الاستحقاق وإن أعطاه الأجر وقبضه لا يحل له ويجب عليه رده على صاحبه.""</span></p><p class=""indent"" style=""text-align:left;""><span class=""ar_writing"">(کتاب الإجارۃ،باب الإجارة الفاسدة،ج:8،ص:23،ط: دار الكتاب الإسلامي)</span></p><p style=""margin:0 0 30px;color:#323232;line-height:36px;font-weight:bold;font-size:17px;font-family:Nafees,'Helvetica Neue',Helvetica,Arial,sans-serif;background-color:#fff;text-align:justify;""><span class=""ar_writing"">في الإختیار لتعلیل المختار:</span></p><p class=""indent"" style=""text-align:justify;""><span class=""ar_writing"">""والملك الخبيث ‌سبيله ‌التصدق به.""</span></p><p class=""indent"" style=""text-align:left;""><span class=""ar_writing"">(كتاب  الغصب ،ج:3،ص:61ط:دارالفكر)</span></p><p class=""indent"" style=""text-align:left;""><span class=""ar_writing"">فقط والله أعلم</span></p></p>",144407100240,banuri,"('حظر و اباحت', 'mamnooaat-mubahat')","('متفرقات', 'mutafarriqaat')","('متفرقات ممنوعات و مباحات', 'muatafarriqaat-e-mamnooaat-o-mubahaat')"
22-01-2023,https://www.banuri.edu.pk/readquestion/ticket-booking-ki-ujrat-le-na-144406102221/22-01-2023,ٹکٹ بکنگ  کی اجرت لینا,ہمارے شھر خانپور مھر سے گھوٹکی 25 کلومیٹر دور  ریل اسٹیشن پر بکنگ کی سہولت موجود ہے، لیکن میں اپنے شھر اپنے دوکان پر لوگوں کو موبائل پر ریل کے ٹکٹ بک کر کے دوں  اور اضافی چارجز باہمی اتفاق سے ٹکٹ پر 100 یا 150 لوں تو کیا اس طرح کاروبار کرنا جائز ہے؟ مثلا گھوٹکی سے کراچی تک رقم 1350 ہے، میں 1500 روپے لوں تو جائز ہوگا ؟,"<p><p style=""text-align:justify;"">صورتِ مسئولہ میں ٹکٹ بکنگ کرنے کی خدمت(سروس) فراہم کرنے پر  اگر  سائل  الگ سے  اجرت 100 یا 150 روپے  طے کرلیتا ہے  یااجرت  سے متعلق سائل نے دکان پر لکھ کر لگا دیا ہے کہ ٹکٹ  بکنگ کی  سہولت 100یا 150 روپے  اجرت /چارجز  کے ساتھ میسر ہے    تو  یہ  اجرت  وصول کرنا سائل  کے لیے درست ہوگا۔</p><p style=""text-align:justify;"">درر الحکام فی شرح مجلۃ الاحکام میں ہے:</p><p class=""indent"" style=""text-align:justify;""><span class=""ar_writing"">""(إذا شرطت الأجرة في الوكالة وأوفاها الوكيل استحق الأجرة، وإن لم تشترط ولم يكن الوكيل ممن يخدم بالأجرة كان متبرعا. فليس له أن يطالب بالأجرة) يستحق في الإجارة الصحيحة الأجرة المسمى. وفي الفاسدة أجر المثل ... لكن إذا لم يشترط في الوكالة أجرة ولم يكن الوكيل ممن يخدم بالأجرة كان متبرعا، وليس له أن يطلب أجرة. أما إذا كان ممن يخدم بالأجرة يأخذ أجر المثل ولو لم تشترط له أجرة"". </span></p><p class=""indent"" style=""text-align:left;""><span class=""ar_writing"">(الکتاب الحادی عشر الوکالة، الباب الثالث،الفصل االاول،المادة:1467 ،ج:3؍573،ط:دارالجیل) </span></p><p class=""indent"" style=""text-align:left;""><span class=""ar_writing"">فقط والله أعلم</span></p></p>",144406102221,banuri,"('اجارہ', 'ijaarah')","('اجرت', 'ujrat')","('اجرت کی شرائط', 'ujrat-ki-sharaet')"
30-01-2023,https://www.banuri.edu.pk/readquestion/imam-k-qada-akheera-k-doraniyay-k-mutaliq-144407100585/30-01-2023,امام کے قعدہ اخیرہ کے دورانیے کے متعلق,امام صاحب کو آخری التحیات پڑھ کر کتنی دیر بعد سلام پھیرنا چاہیے؟,"<p><p style=""text-align:justify;"">صورت مسئولہ میں قعدۂ اخیرہ یعنی آخری رکعت کے قعدہ میں امام التحیات پڑھ کر درود شرف پڑھے پھر ""رب جعلنی الخ"" یا اور کوئی مسنون دعا پڑھ کر سلام پھیرے۔</p><p style=""text-align:justify;"">فتاوی شامی میں ہے:</p><p class=""indent"" style=""text-align:justify;""><span class=""ar_writing"">""وحاصله أنه يقرأ بقدر حال القوم مطلقا: أي ولو دون القدر المسنون، وفيه نظر؛ أما أولا فلأنه مخالف للمنقول عن السراج والمضمرات كما مر؛ وأما ثانيا فلأن القدر المسنون لا يزيد على صلاة أضعفهم لأنه كان يفعله - صلى الله عليه وسلم - مع علمه بأنه يقتدي به الضعيف والسقيم ولا يتركه إلا وقت الضرورة؛ وأما ثالثا فلأن قراءة «معاذ لما شكاه قومه إلى النبي - صلى الله عليه وسلم - وقال أفتان أنت يا معاذ» إنما كانت زائدة على القدر المسنون. قال الكمال في الفتح: وقد بحثنا أن التطويل: هو الزيادة على القراءة المسنونة، فإنه - صلى الله عليه وسلم - نهى عنه وقراءته هي المسنونة فلا بد من كون ما نهى عنه غير ما كان دأبه إلا لضرورة، وقراءة معاذ لما قال له - صلى الله عليه وسلم - ما قال كانت بالبقرة على ما في مسلم «أن معاذا افتتح بالبقرة فانحرف رجل فسلم ثم صلى وحده وانصرف» وقوله - صلى الله عليه وسلم - «إذا أممت بالناس فاقرأ بالشمس وضحاها - وسبح اسم ربك الأعلى - واقرأ باسم ربك - والليل إذا يغشى» - "" لأنها كانت العشاء، وإن قوم معاذ كان العذر متحققا فيهم لا كسلا منهم فأمر فيهم بذلك لذلك، كما ذكر «أنه - صلى الله عليه وسلم - قرأ بالمعوذتين في الفجر، فلما فرغ قالوا له أوجزت، قال: سمعت بكاء صبي فخشيت أن تفتن أمه» اهـ ملخصا.</span></p><p class=""indent"" style=""text-align:justify;""><span class=""ar_writing"">فقد ظهر من كلامه أنه لا ينقص عن المسنون إلا لضرورة كقراءته بالمعوذتين لبكاء الصبي، وظهر من حديث معاذ أنه لا ينقص عن المسنون لضعف الجماعة لأنه لم يعين له دون المسنون في صلاة العشاء بل نهاه عن الزيادة عليه مع تحقق العذر في قومه، فما استظهره الشرنبلالي من الحديث وحمل عليه كلام الكمال غير ظاهر، نعم ذكر في البحر في باب الوتر والنوافل عند الكلام على التراويح معزيا إلى المجتبى أن الحسن روى عن الإمام أنه إذا قرأ في المكتوبة بعد الفاتحة ثلاث آيات فقد أحسن ولم يسئ اهـ لكنه لا ينافي ما قلنا لأنه أحسن بقراءة القدر الواجب ولم يسئ: أي لم يصل إلى كراهة شديدة فتأمل.""</span></p><p class=""indent"" style=""text-align:left;""><span class=""ar_writing"">(كتاب الصلاة، باب الإمامة، ج1، ص564، سعيد)</span></p><p class=""indent"" style=""text-align:left;""><span class=""ar_writing"">فقط والله أعلم</span></p></p>",144407100585,banuri,"('نماز', 'salat')","('نماز کا طریقہ', 'namaz-ka-tariqah')","('نماز کے آداب', 'namaz-ke-aadab')"
01-02-2023,https://www.banuri.edu.pk/readquestion/zameen-do-man-gandum-ky-ewaz-kraye-p-ly-k-aagy-teen-man-gandum-ky-ewaz-kraye-pr-de-na-144407100802/01-02-2023,زمین دومن گندم  کے عوض کرایہ پر لے کر آگے تین من گندم کے عوض کرایہ پر دینا,عمر نے زید سے زمین دو من گندم پر اجارہ پر لی اب عمر وہی زمین خالد کو تین من گندم پر اجارہ پر دے سکتا ہے ؟,"<p><p style=""text-align:justify;"">صورت مسئولہ میں اگر زید آگے خالد  کو زمین گندم کے عوض کرایہ پردینا چاہتا ہے تو اس کے لیے ضروری ہے کہ پہلے کرایہ سے زیادہ کرایہ وصول نہ کرے ،یعنی اگر زید نے  دومن گندم کرایہ پر لی ہے تو  خالد کو بھی دو من گندم ہی کے عوض کرایہ پر دے سکتا ہے ،دو من سے زیادہ کرایہ وصول کرنا شرعا جائز نہیں ہے ،البتہ اگر گندم کے علاوہ کسی اور جنس میں خالد کو کرایہ پر دیتا ہے ،مثلا روپے ،چاول وغیرہ ، تو اس میں جتنا مرضی چاہے کرایہ طے کرسکتا ہے ۔</p><p style=""text-align:justify;"">نوٹ :اگر سوال میں اجارہ سے مراد مزارعت ہے ،تو سائل معاملہ کی مکمل تفصیل لکھ کر سوال دوبارہ بھیج کر جواب معلو  م کرلے ۔</p><p style=""text-align:justify;"">فتاوی شامی میں ہے:</p><p class=""indent"" style=""text-align:justify;""><span class=""ar_writing"">""(وله السكنى بنفسه وإسكان غيره بإجارة وغيرها) وكذا كل ما لا يختلف بالمستعمل يبطل التقييد؛ لأنه غير مفيد، بخلاف ما يختلف به كما سيجيء، ولو آجر بأكثر تصدق بالفضل إلا في مسألتين: إذا آجرها بخلاف الجنس أو أصلح فيها شيئا.""</span></p><p class=""indent"" style=""text-align:left;""><span class=""ar_writing""> (كتاب الإجارة6/ 28ط:سعيد)</span></p><p class=""indent"" style=""text-align:left;""><span class=""ar_writing"">فقط واللہ اعلم </span></p><p style=""text-align:justify;""> </p></p>",144407100802,banuri,"('مزارعت', 'muzaareat')","('مزارعت', 'muzaareat')","('مزارعت کی تفسیر ، شرائط ، ارکان اور احکام', 'muzaareat-ki-tafseer-sharaet-arkaan-ahkaam')"
01-02-2023,https://www.banuri.edu.pk/readquestion/jawa-eye-app-men-paisy-invest-krny-ka-hukum-144407100814/01-02-2023,جاوا آئی میں پیسہ انویسٹ کرنے کا حکم,جاوا آئی ( Jawa Eye ) ایک آن لائن ارننگ پلیٹ فارم ہے، جو کہ بیک وقت فلم انڈسٹری کے ساتھ شامل ہوتا ہے،  کام کا طریقہ کار کچھ ایسا ہے کہ اس میں بندے کو پیسے انویسٹ کرنے پڑتے ہیں،  انویسٹمنٹ کرنے پر آپ کو پانچ سے دس ڈالر کا بونس دیا جائے گا، فلموں کی ٹکٹس خرید کر فلم ختم ہونے کے فوراً بعد ہی آپ کو ٹکٹس کے حساب سےبھی بونس دیا جائے گا، جب کہ مزید ممبرز کو شامل کروانے پر بھی مزید بونس دیا جائے گا، فی ممبر ایڈ کرنے پر پانچ ڈالر تک بونس ملتا ہے۔مثال کے طور پر آپ نے پچاس ڈالر کی انویسٹمنٹ کی، جس پر آپ کو دس ڈالر کا بونس ملا، اب ٹوٹل ساٹھ ڈالر ہوگئے، تین ممبرز ایڈ کروائے، فی ممبر پر پانچ ڈالرملے، تو اب ٹوٹل پچھتر ڈالر ہوگئے، ایک فلم کی پانچ ٹکٹس خریدنے پر ایک ڈالر کا نفع ملتا ہے، یعنی یہ  کل ملا کر دیکھیں تو چھہتر ڈالر ہوگئے، اب پوچھنا یہ ہے کہ  کیا اس طرح کے پلیٹ فارم پر انویسٹمنٹ کرنا جائز ہے یا نہیں ؟ اس سے کمائی گئی رقم حلال ہوگی یا حرام ؟,"<p><p style=""text-align:justify;"">واضح رہے کہ فلموں کا کام کرنا یا اس کی ترویج میں حصہ لینا جائز نہیں اور نہ ہی اس کی آمدنی حلال ہے؛ کیوں کہ اس میں گناہ کی معاونت ہے، اور گناہ کےکام  میں تعاون کرنا بھی گناہ ہے، نیز اس صورت میں  جو تنخواہ  ملے گی، وہ بھی حرام  آمدن سے ملے گی، تو اس وجہ سے بھی  اس کے وہ تنخواہ حلال نہیں ہوگی۔</p><p style=""text-align:justify;"">لہذا صورتِ مسئولہ میں جاوا آئی ( Jawa Eye )نامی ایپ میں پیسے انویسٹ کرنا در حقیقت فلموں کی ترویج میں حصہ لینا ہے، اور اس کام تعاون علی المعصیت بھی ہورہا ہے؛ اسی لیے اس ایپ میں پیسے انویسٹ کرنا یا اس کے ذریعے پیسہ کمانا دونوں ناجائز اور حرام ہے۔</p><p style=""text-align:justify;"">قرآن کریم میں اللہ رب العزت کا ارشادی ہے:</p><p class=""indent"" style=""text-align:justify;""><span class=""qr_writing"">""و تعاونوا على البر و التقوى و لاتعاونوا على الاثم و العدوان.""</span></p><p class=""indent"" style=""text-align:left;""><span class=""ar_writing"">(المآئدة :2)</span></p><p style=""text-align:justify;"">احکام القرآن للجصاص میں ہے:</p><p class=""indent"" style=""text-align:justify;""><span class=""qr_writing"">""{ولا تعاونوا على الاثم والعدوان}</span> <span class=""ar_writing"">نهى عن معاونة غیرنا علی معاصی الله تعالیٰ.""</span></p><p class=""indent"" style=""text-align:left;""><span class=""ar_writing"">(مطلب البیان من اللہ تعالیٰ علی وجھین، ج: 2، ص: 381، ط: دار الكتب العلمية بيروت)</span></p><p style=""text-align:justify;"">تفسیر ابن کثیر میں ہے:</p><p class=""indent"" style=""text-align:justify;"">""{<span class=""qr_writing"">ولا تعاونوا على الاثم و العدوان</span>}، <span class=""ar_writing"">یأمر تعالی عبادہ المؤمنین بالمعاونة علی فعل الخیرات وهوالبر و ترك المنکرات و هو التقوی، و ینهاهم عن التناصر علی الباطل و التعاون علی المآثم والمحارم.""</span></p><p class=""indent"" dir=""rtl"" style=""text-align:left;""><span class=""ar_writing"">(تفسیر ابن کثیر، الآیة: 1،  ج: 2، ص: 12، ط: دار طيبة)</span></p><p style=""text-align:justify;"">الفقہ الاسلامی وادلّتہ  میں ہے:</p><div style=""text-align:justify;""><p class=""indent"" style=""text-align:justify;""><span class=""ar_writing"">""ولایجوز الاستئجار علی المعاصي کاستئجار الإنسان للعب و اللهو المحرم ... لأنه استئجار علی المعصیة والمعصیة لاتستحق بالعقد.""</span></p><p class=""indent"" style=""text-align:left;""><span class=""ar_writing"">(شروط صحة الإجارة، ج:5، ص:3817، ط:دارالفكر)</span></p><p style=""text-align:justify;"">فتاوی شامی میں ہے</p><p class=""indent"" style=""text-align:justify;""><span class=""ar_writing"">""وماکان سببًا لمحظور محظور... و نظیره کراهة بیع المعازف لان المعصیة تقام بها عینها.""</span></p><p class=""indent"" style=""text-align:left;""><span class=""ar_writing"">(كتاب الحظر والإباحة، ج:6، ص:350، ط: سعید) </span></p><p style=""text-align:justify;"">فتاویٰ ہندیہ میں ہے:</p></div><p class=""indent"" style=""text-align:justify;""><span class=""ar_writing"">""ولا تجوز الإجارة على شيء من الغناء والنوح والمزامير والطبل وشيء من اللهو وعلى هذا الحداء وقراءة الشعر وغيره ولا أجر في ذلك وهذا كله قول أبي حنيفة وأبي يوسف ومحمد رحمهم الله تعالى.""</span></p><p class=""indent"" style=""text-align:left;""><span class=""ar_writing"">(كتاب الإجارة، الباب السادس عشر في مسائل الشيوع، ج: 4، ص: 449، ط: دارالفکر)</span></p><p class=""indent"" style=""text-align:left;"">فقط واللہ اعلم</p></p>",144407100814,banuri,"('بیوع', 'buyoo')","('بیع کی کچھ خاص اور مروج صورتیں', 'bayee-ki-kuch-khas-murawwaj-surtain')","('آن لائن خرید و فروخت', 'online-khareed-o-farukht')"
29-01-2023,https://www.banuri.edu.pk/readquestion/witr-mai-dua-w-qunoot-kay-liay-takbeer-kehna-wajib-hay-144407100547/29-01-2023,وتر میں دعائے قنوت کے لیے تکبیر کہنا واجب ہے,وتر کی نماز میں دعائے قنوت کی تکبیر کہنا بھول جائے اور نماز کے بعد بھی یاد نہ آئے اور سجدہ سہو بھی نہ کیا ہو، تو نماز ہو جائے گی؟,"<p><p style=""text-align:justify;"">وتر کی نماز میں دعائے قنوت کے لیے تکبیر کہنا واجب ہے، لہٰذا اگر کوئی وتر میں دعائے قنوت کے لیے تکبیر کہنا بھول جائے اور سجدہ سہو بھی نہ کرے، تو اس پر وقت کے اندر  وتر کا اعادہ ضروری ہے، البتہ وقت گزرجانے کے بعد اعادہ لازم  نہیں ہے، بلکہ مستحب ہے، لہٰذا  بہتر یہ ہے کہ اعادہ کرلیا جائے، تاکہ نماز بلا کراہت ادا ہوجائے۔</p><p style=""text-align:justify;"">فتاوی عالمگیری میں ہے:</p><p class=""indent"" style=""text-align:justify;""><span class=""ar_writing"">""ولو ترك ‌التكبيرة ‌التي بعد القراءة قبل القنوت سجد للسهو؛ ولأنها بمنزلة تكبيرات العيد، كذا في التبيين.""</span></p><p class=""indent"" style=""text-align:left;""><span class=""ar_writing"">(كتاب الصلاة، ج:1، ص:128، ط:دارالفكر)</span></p><p style=""text-align:justify;"">حاشية الطحطاوي على مراقي الفلاح شرح نور الإيضاح میں ہے:</p><p class=""indent"" style=""text-align:justify;""><span class=""ar_writing"">""كل صلاة أديت مع كراهة التحريم تعاد أي وجوبا في الوقت وأما بعده فندبا.""</span></p><p class=""indent"" style=""text-align:left;""><span class=""ar_writing"">(كتاب الصلاة، ص:440، ط:دار الكتب العلمية بيروت)</span></p><p class=""indent"" style=""text-align:left;""><span class=""ar_writing"">فقط والله اعلم</span></p></p>",144407100547,banuri,"('نماز', 'salat')","('وتر و قنوت', 'witr-o-qunot')","('وتر', 'witar')"
30-01-2023,https://www.banuri.edu.pk/readquestion/hsna-nam-rkhna-144407100695/30-01-2023,حسنہ نام رکھنا,حسنہ نام رکھنا کیسا ہے میں اپنی بیٹی کا نام رکھنا چاہتا ہوں۔,"<p><p style=""text-align:justify;""> حسنہ صحابیہ کانام ہے  آپ اپنی بیٹی کا نام حسنہ  رکھ سکتے ہیں ۔</p><p style=""text-align:justify;"">الاصابۃ فی تمییز الصحابہ میں ہے :</p><p class=""indent"" style=""text-align:justify;""><span class=""ar_writing"">""ذكره ابن إسحاق، وموسى بن عقبة، عن ابن شهاب، في مهاجرة الحبشة، وكانت معه امرأته ‌حسنة وهي والدة شرحبيل.""</span></p><p class=""indent"" style=""text-align:left;"">(109/3،دار الكتب العلمية)</p><p class=""indent"" style=""text-align:left;"">فقط واللہ اعلم </p></p>",144407100695,banuri,"('حقوق و آدابِ معاشرت', 'huqooq-muashret')","('حقوق', 'bahmi-huqooq')","('اولاد کے حقوق', 'olad-ky-hoqoq')"
