issued_at,link,title,question,answer,fatwa_number,dar_ul_ifta,kitab,bab,fasal
19-01-2023,https://www.banuri.edu.pk/readquestion/masjid-me-namaz-e-janaza-ada-kr-na-144406102059/19-01-2023,مسجد میں نماز جنازہ ادا کرنا,ہمارے ملک برطانیہ میں بہت ساری جگہوں پر اب جنازہ کی نماز مسجد کے اندر ادا کی جا رہی ہے اور اس کے لیے ان کے پاس بظاہر کوئی شرعی عذر یا مجبوری نہیں ہے، اس سلسلے میں ایک طالب علمانہ سوال ہے کہ جب نمازِ جنازہ کا مقصد مرحوم کی مغفرت کے لیے سفارش کرنا ہے، تو کیا بلا کسی مجبوری کے مسجد کے اندر نماز جنازہ پڑھ کر کراہیت والے کام کا ارتکاب کرنا مناسب ہے؟ ایک طرف تو ہم اللہ تعالی سے سفارش کر رہے ہیں کہ  آپ میت کی مغفرت کیجیے ،لیکن سفارش کرتے ہوئے ایسے کام کررہے ہیں جو اللہ تعالی کو نا پسند ہو؟ کیا فرماتے ہیں مفتیان کرام اس سلسلے میں کہ  نماز جنازہ کو بلا مجبوری مسجد میں ادا کریں تو اس کا کیا حکم ہوگا؟,"<p><p style=""text-align:justify;"">کسی شرعی عذر کے بغیر مسجد میں نماز جنازہ پڑھنا  مکروہ ہے ، البتہ اگر کوئی عذر ہو مثلاً شدید بارش یا برفباری ہو   یاکوئی متبادل جگہ موجود نہ ہوتو اس صورت میں مسجد میں نماز جنازہ ادا کرنے کی گنجائش ہے۔</p><p style=""text-align:justify;"">فتاویٰ شامی  میں ہے:</p><p class=""indent"" style=""text-align:justify;""><span class=""ar_writing"">""إنما تكره في المسجد بلا عذر، فإن كان فلا، و من الأعذار المطر كما في الخانية و الاعتكاف كما في المبسوط، كذا في الحلية وغيرها.""</span></p><p class=""indent"" style=""text-align:left;""><span class=""ar_writing"">(‌‌‌‌كتاب الصلاة، باب صلاة الجنازة 226/2 ط: سعيد)</span></p><p class=""indent"" style=""text-align:left;""><span class=""ar_writing"">فقط واللہ أعلم </span></p></p>",144406102059,banuri,"('جنائز', 'janaiz')","('نماز جنازہ', 'namaz-e-jinazah')","('مسجد میں نمازِ جنازہ', 'masjid-me-namaz-e-jenazah')"
25-09-2022,https://www.banuri.edu.pk/readquestion/ahsan-u-alftawa-ke-ek-masiala-ke-mutalliq-ishkal-ka-jawab-144402101883/25-09-2022,احسن الفتاوی کے ایک مسئلہ کے متعلق اشکال کا جواب,حضرات مفتیانِ  کرام اس مسئلہ میں دوبارہ تحقیق فرمائیں کہ  رضاعی ماں کے دوسرےشوہر کا کیا حکم ہے؟ کیوں کہ احسن الفتاوی ج:5، ص :78 ،پر یہی مسئلہ’’ ربیبہ رضاعیہ‘‘ کے عنوان کے تحت مذکورہے اور  وہاں مفتی رشید احمد صاحب رحمہ اللہ نے ربیبہ رضاعیہ کو محرم لکھا ہے ،مہربانی فرما کر مسئلہ کو ضرور حل فرمائیں!,"<p><p style=""text-align:justify;"">احسن الفتاوی میں<strong>  ’’ربیبہ  رضاعیہ ‘‘   </strong>کے عنوان کے تحت  جو مسئلہ مذکور ہے،  وہ مسئلہ تحقیق و حوالے کے اعتبار سے صحیح اور درست ہے، باقی سہولت اور تفہیم کی غرض سے مذکور ہ فتویٰ  نقل کرکے   اس پر مستزاد چند سطور  لکھی جاتی ہیں:</p><p class=""indent"" style=""text-align:justify;"">احسن الفتاوی میں حضرت مفتی صاحب سے سوال ہواہے:</p><p class=""indent"" style=""text-align:justify;"">’’ اگر کسی شخص نے عورت ذاتِ لبن کو طلاق دی، اس عورت نے کسی دوسری لڑکی کو دودھ پلایا،پھر اس مرضعہ نے زوجِ ثانی سے نکاح کیا، تویہ رضعیہ زوجِ ثانی کےلیے حلال ہوگی؟قیاس تو حرمت کو چاہتاہے، کیونکہ لبن اگرچہ زوجِ ثانی سے نہیں ہے، مگر یہ رضعیہ زوجِ ثانی کے لیے ربیبہ کے حکم میں ہے،شامیہ ،ج:2،ص:422پر درِمختارکی یہ عبارت ""<span class=""ar_writing"">طلق ذات لبن فاعتدت وتزوجت بآخرفحبلت وأرضعت فحكمه من الأول ،لأنه منه باليقين فلايزول بالشك ويكون ربيبا للثاني</span> ""بھی اسی پر دال ہے،مگرشامیہ میں اسی موقع پر (قولہ فتح)کے تحت صورتِ مسئولہ میں حلت تحریر فرمائی ہے:۔۔۔""<span class=""ar_writing"">وأن ما في الخلاصة من أنها لو رضعت لا بلبن الزاني ‌تحرم ‌على ‌الزاني. مردود لأن المسطور في الكتب المشهورة أن الرضيعة بلبن غير الزوج لا تحرم على الزوج كما تقدم في قوله طلق ذات لبن إلخ. وكلام الخلاصة يقتضي تحريمها بالأولى</span>""نیزشامی نے طلق ذات لبن الخ سے حلت ثابت کی ہے، حالاں کہ اسی عبارت سے حرمت ثابت ہوتی ہے ، کیو نکہ اس عبارت میں زوجِ ثانی کےلیے زبیب ہونے کی تصریح ہے۔‘‘</p><p style=""text-align:justify;"">حضرت مفتی صاحب نے مذکورہ سوال کا جواب دیتے ہوئے فرمایاہے:</p><p class=""indent"" style=""text-align:justify;"">’’ یہ لڑکی زوجِ ثانی کے لیے ربیبہ ہے، اس لیے بیوی سے وطی کے بعد اس پر حرام  ہوجائے گی، قبل الدخول حرام نہیں،<span class=""ar_writing"">و أن المسطورفي الكتب المشهورة الخ</span>""میں حرمتِ لبنِ فحل کی نفی مقصود ہے،ربیبہ ہونے کی وجہ سے بعد الدخول حرمت ثابت ہوجائے گی۔۔۔الخ""</p><p style=""text-align:justify;"">مذکورہ جواب کاخلاصہ یہ ہے کہ مذکورہ لڑکی زوجِ ثانی کے حق میں ربیبہ کے حکم میں ہے، اور ربیبہ زوجِ ثانی پر تب حرام ہوجاتی ہے، جب زوجِ ثانی اس کی والدہ سے وطی کرے ،وطی کرنے سے پہلے اس پر حرام نہیں ہوتی،مذکورہ عبارت  ""<span class=""ar_writing"">لأن المسطور في الكتب المشهورة أن الرضيعة بلبن غير الزوج لا تحرم على الزوج كما تقدم في قوله طلق ذات لبن إلخ</span>""کامقصدبھی یہی ہے کہ زوجِ ثانی نے جب اس بچی  کی والدہ سے نکاح کرلیاتو چوں کہ مذکورہ لڑکی اس کی منکوحہ بیوی کی بیٹی ہے اور اس کی منکوحہ بیوی نے ہی دودھ پلائی ہے، لیکن چوں کہ یہ دودھ اس کے علاوہ دوسرے شوہر سے ہے، لہذا  کسی دوسرے کے دودھ کی وجہ سے یہ لڑکی زوجِ ثانی پر حرام نہیں ہوگی ،جب تک زوجِ ثانی نے اس کی ماں سے وطی نہیں کی ۔</p><p class=""indent"" style=""text-align:left;"">فقط واللہ اعلم</p></p>",144402101883,banuri,"('رضاعت', 'razaat')","('رضاعت کے احکام', 'razaat-k-ahkaam')","('رضاعت کے متفرق احکام', 'razaat-k-mutafarriq-ahkam')"
23-11-2022,https://www.banuri.edu.pk/readquestion/wazu-mai-halq-tak-pani-ponchane-ka-hukam-144404102044/23-11-2022,وضو میں حلق تک پانی پہنچانے کا حکم,وضو میں حلق تک پانی پہنچانا فرض ہے  یا نہیں ؟,"<p><p style=""text-align:justify;""> واضح رہے کہ وضو کے فرائض چار ہیں :چہرے کا دھونا،دونوں ہاتھوں کو کہنیوں سمیت دھونا ،چوتھائی سر کا مسح کرنا ،اور دونوں پاؤں ٹخنوں سمیت دھونا ،اس کے علاوہ وضو میں کوئی فرض نہیں ،اور کلی کرنا وضو میں سنت ہےلہذا  وضو میں حلق تک پانی پہنچانا فرض نہیں ہے ۔</p><p style=""text-align:justify;"">فتاوی ہندیہ میں ہے :</p><p class=""indent"" style=""text-align:justify;""><span class=""ar_writing"">""(الفصل الأول: في فرائض الوضوء)</span></p><p class=""indent"" style=""text-align:justify;""><span class=""ar_writing"">قال الله تبارك وتعالى {يا أيها الذين آمنوا إذا قمتم إلى الصلاة فاغسلوا وجوهكم وأيديكم إلى المرافق وامسحوا برءوسكم وأرجلكم إلى الكعبين} [المائدة: 6] (وهي أربع) . الأول: غسل الوجه۔۔۔۔(والثاني غسل اليدين) والمرفقان يدخلان في الغسل عند علمائنا الثلاثة. كذا في المحيط۔۔۔۔۔۔(والثالث غسل الرجلين) ويدخل الكعبان في الغسل عند علمائنا الثلاثة والكعب هو العظم الناتئ في الساق الذي يكون فوق القدم كذا في المحيط۔۔۔۔۔۔۔(والرباع مسح الرأس) والمفروض في مسح الرأس مقدار الناصية. كذا في الهداية والمختار في مقدار الناصية ربع الرأس. كذا في الاختيار شرح المختار.""</span></p><p class=""indent"" style=""text-align:left;"">(کتاب الطہارۃ،الفصل الاول فی فرائض الوضوء،ج:1،ص:3،دارالفکر)</p><p style=""text-align:justify;""><span class=""ar_writing"">وفيه أيضاّ:</span></p><p class=""indent"" style=""text-align:justify;""><span class=""ar_writing"">""(ومنها المضمضة والاستنشاق) والسنة أن يتمضمض ثلاثا أولا ثم يستنشق ثلاثا ويأخذ لكل واحد منهما ماء جديدا في كل مرة وكذا في محيط السرخسي.</span><span class=""ar_writing"">وحد المضمضة استيعاب الماء جميع الفم وحد الاستنشاق أن يصل الماء إلى المارن. كذا في الخلاصة.""</span></p><p class=""indent"" style=""text-align:left;"">(کتاب الطہارۃ،الفصل الثانی فی سنن الوضوء،ج:1،ص:7،دارالفکر)</p><p class=""indent"" style=""text-align:left;"">فقط واللہ اعلم</p></p>",144404102044,banuri,"('طہارت', 'taharat')","('وضو', 'wuzu')","('فرائض وضو', 'faraaez-e-wazu')"
21-01-2023,https://www.banuri.edu.pk/readquestion/jalsa-men-parhny-ki-dua-144406102133/21-01-2023,جلسہ میں پڑھنے کی دعا,نماز میں جلسے میں پڑھنے  کی دعا کیا ہے ؟,"<p><p style=""text-align:justify;"">نماز میں  جلسہ(دو سجدوں کی درمیان  بیٹھنے)  کی حالت میں پڑھنے کی مسنون دعا یہ ہے: <span class=""ar_writing"">""اللَّهُمَّ ‌اغْفِرْ ‌لِي، ‌وَارْحَمْنِي، وَعَافِنِي، وَاهْدِنِي، وَارْزُقْنِي.""</span>تاہم دو سجدوں کے درمیان یہ دعا نوافل میں پڑھنا مسنون ہے، امام اگر امامت کراوارہا ہو تو اس صورت میں  اگر مقتدیوں پر بوجھ نہیں ہورہا تو  امام  یہ دعا پڑھ سکتاہے،  اسی طرح اگر کوئی شخص منفرداً فرض نماز پڑھ رہا ہو تو وہ بھی یہ دعاپڑھ سکتاہے، اوراگر کوئی مقتدی ہو اور امام اتنی دیر تک جلسے میں ٹھہر جائے تو مقتدی بھی جلسے  میں یہ دعا پڑھ سکتاہے،  لیکن مقتدی کو اس بات کا خیال رہے کہ دعا پڑھنے کی وجہ سے امام کی متابعت فوت نہ ہو۔ </p><p style=""text-align:justify;"">سنن ابی داؤ میں ہے:</p><p class=""indent"" style=""text-align:justify;""><span class=""ar_writing"">""حدثنا محمد بن مسعود، حدثنا زيد بن الحباب، حدثنا كامل أبو العلاء، حدثني حبيب بن أبي ثابت، عن سعيد بن جبير، عن ابن عباس، أن النبي صلى الله عليه وسلم كان يقول بين السجدتين: «اللهم اغفر لي، وارحمني، وعافني، واهدني، وارزقني.""</span></p><p class=""indent"" style=""text-align:left;""><span class=""ar_writing"">(‌‌أبواب تفريع استفتاح الصلاة،باب الدعاء بين السجدتين،244/1،ط:المکتبة العصریة)</span></p><p style=""text-align:justify;"">خلاصۃ الاحکام میں ہے:</p><p class=""indent"" style=""text-align:justify;""><span class=""ar_writing"">""وعن ابن عباس رضي الله عنهما: أن النبي صلى الله عليه وسلم كان يقول بين السجدتين: "" اللهم اغفر لي، وارحمني، وعافني، واهدني، وارزقني "" رواه أبو داود، والترمذي، وآخرون بإسناد حسن.</span><span class=""ar_writing""> قال الحاكم: "" هو صحيح الإسناد.""</span></p><p class=""indent"" style=""text-align:left;""><span class=""ar_writing"">(كتاب مواضع الصلوةالخ،باب الجلوس بين السجدتين،415/1،ط:مؤسسة الرسالة)</span></p><p>فتاویٰ شامی میں ہے:</p><p class=""indent"" style=""text-align:justify;""><span class=""ar_writing"">'' (وليس بينهما ذكر مسنون، وكذا) ليس (بعد رفعه من الركوع) دعاء، وكذا لا يأتي في ركوعه وسجوده بغير التسبيح (على المذهب)، وما ورد محمول على النفل.</span></p><p class=""indent"" style=""text-align:justify;""><span class=""ar_writing"">و في الرد: ''(قوله: وليس بينهما ذكر مسنون).... وبين السجدتين: «اللهم اغفر لي وارحمني وعافني واهدني وارزقني» رواه أبو داود، وحسنه النووي وصححه الحاكم، كذا في الحلية.""</span></p><p class=""indent"" style=""text-align:left;""><span class=""ar_writing"">(كتاب الصلاة، باب صفة الصلاة، ج:1،ص:505،506، ط: سعيد)</span></p><p class=""indent"" style=""text-align:left;""><span class=""ar_writing"">فقط والله أعلم</span></p></p>",144406102133,banuri,"('نماز', 'salat')","('نماز کی شرائط', 'namaz-ki-sharait')","('نماز اور اس کی شرائط و ارکان ، سنن و آداب', 'namaz-or-us-ki-sharait-o-arkaan-sunan-o-aadab')"
23-11-2022,https://www.banuri.edu.pk/readquestion/jis-jaiy-namaz-me-ghair-mahram-namaz-pary-us-me-ghair-mahram-awrat-namaz-parskti-hy-144404102070/23-11-2022,جس جائے نماز میں غیر محرم نماز پڑھے اس میں غیرمحرم عورت نماز پڑسکتی ہے,جس جائے نماز پر غیر محرم مرد نماز پڑھے اس پر عورت نماز پڑھ سکتی ہے؟,"<p><p style=""text-align:justify;"">واضح رہے کہ نماز درست ہونے کے شرائط میں سے ایک شرط یہ ہے کہ جائےنماز نجاست سے پاک ہو ،لہذا صورتِ مسئولہ جس جائے نماز پر غیر محرم مرد نماز پڑھےاگر اس میں نجاست لگی ہوئی نہیں ہے تو   اس پر عورت کا نماز پڑھنا جائز ہے ۔</p><p style=""text-align:justify;"">العنایہ میں ہے :</p><p class=""indent"" style=""text-align:justify;""><span class=""ar_writing"">(تطهير النجاسة واجب من بدن المصلي وثوبه والمكان الذي يصلي عليه ..... وله: (تطهير النجاسة) أي تطهير محل النجاسة بإثبات الطهارة فيه .... واجب من بدن المصلي وثوبه والمكان الذي يصلي عليه لقوله تعالى {وثيابك فطهر} أمر بتطهير الثياب مطلقا وهو للوجوب.""</span></p><p class=""indent"" style=""text-align:left;""><span class=""ar_writing"">(كتاب الطهارة ،باب الأنجاس وتطهيرها، ج:1، ص:190، ط: دار الفكر لبنان)</span></p><p class=""indent"" style=""text-align:left;""><span class=""ar_writing"">فقط والله أعلم</span></p></p>",144404102070,banuri,"('نماز', 'salat')","('نماز کی شرائط', 'namaz-ki-sharait')","('نجاست سے پاکی', 'najasat-say-paaki')"
24-01-2023,https://www.banuri.edu.pk/readquestion/azlan-naam-rakhna-144407100191/24-01-2023,ازلان نام رکھنا,مسلمان بچے کا ازلان نام رکھناکیسا ہے؟,"<p><p style=""text-align:justify;"">اردو، عربی اور فارسی تینوں زبانوں کی لغت کی کتابوں میں تلاش کرنے کے باوجود ’’اذلان‘‘ یا ’’ازلان‘‘ کا معنی نہیں مل سکا، بظاہر یہ کسی اور زبان کا لفظ ہے۔</p><p style=""text-align:justify;"">اور اگر اس نام کا تلفظ ""عِضْلان""(عین پر کسرہ، ضاد پر سکون کے ساتھ) ہو تو  یہ ""عُضْل""(عین پر ضمہ، ضاد پر سکون کے  ساتھ) کی جمع ہے، جس کا معنی ہے: چوہے۔ اس تلفظ کے ساتھ یہ نام رکھنا ہر گز درست نہیں ۔</p><p style=""text-align:justify;"">ناموں کے سلسلے میں بہتر یہ ہے کہ بچوں کے نام حضرات انبیاءِ کرام علیہم السلام و التسلیمات اور صحابہ کرام رضوان اللہ علیہم اجمعین کے ناموں پر رکھے جائیں یا عربی کے اچھے معنی والے نام رکھے جائیں۔</p><p style=""text-align:justify;"">کتاب المحکم میں ہے:</p><p class=""indent""><span class=""ar_writing"">""والعضل: الجرذ، والجمع عضلان.""</span></p><p class=""indent""><span class=""ar_writing"">( كتاب المحكم والمحيط الأعظم، ج:1، ص408، العين والضاد واللام، الناشر: دار الكتب العلمية)</span></p><p class=""indent""><span class=""ar_writing"">وكذا في تاج العروس أيضا</span></p><p style=""text-align:justify;"">نیز اچھے ناموں کے لیے درج ذیل لنک ملاحظہ کریں:</p><p class=""indent""><span class=""ar_writing""><a href=""https://www.banuri.edu.pk/islamic-name"" title=""اسلامی نام"">اسلامی نام</a></span></p><p class=""indent"" style=""text-align:left;"">فقط واللہ اعلم </p></p>",144407100191,banuri,"('حظر و اباحت', 'mamnooaat-mubahat')","('نام، لقب، کنیت', 'asaami')","('ناموں کے معانی اور احکام', 'namoun-ke-mani-or-ahkaam')"
