issued_at,link,title,question,answer,fatwa_number,dar_ul_ifta,kitab,bab,fasal
14-10-2022,https://www.banuri.edu.pk/readquestion/shat-kard-k-zarye-ilaj-karwne-ka-hukum-144403101415/14-10-2022,صحت کارڈ کے ذریعے علاج کروانے کا حکم,آج کل ہما رے علاقے جنوبی پنجاب میں حکومت نے شناختی کارڈ کو صحت کارڈ بنا دیا ہے جس کے ذریے تمام لوگوں کو مفت علاج فراہم کیا جا رہا ہے ،حکومت نے ایک انشورنس کمپنی سے معاہدہ کیا ہے، جس کے تحت ضلع بھر میں کل جتنے بھی افراد ہیں ان میں ہر فرد کے حساب سے متعینہ رقم ( مثلا 2000 روپے فی فرد ) حکومت نے ایک سال کےلیے انشورنس کمپنی کو ادا کر دیےہیں، حکومت نے ضلع بھر میں کچھ ہسپتالوں کو رجسٹرڈ کیا ہے،جن میں ہر شخص اپنا شناختی کارڈ دکھا کر اپنا مفت علاج کرا سکتا ہے ، حکومت نے ہر آپریشن کے لیےایک رقم مختص کی ہے، جو انشورنس کمپنی اس ہسپتال کو ادا کرنے کی پابند ہو گی، انشورنس کمپنی ایک سال میں ایک خاندان کا ساڑھے سات لاکھ تک کا مفت علاج کرا سکتی ہے،حکومت نے یہ کام اس لیے کیا ہے تا کہ عوام کو اچھا علاج سہولت کے ساتھ مل جائےاور عوام کو اس سہولت سے فائدہ بھی بہت ہو رہا ہے۔اب پوچھنا یہ ہے کہ حكومت كا انشورنس كمپني سے معاہدہ کرنا كيساہے؟اور   مذکورہ ہسپتال سے علاج کرواکر فائدہ اٹھانا کیسا ہے؟,"<p><p style=""text-align:justify;"">صورتِ مسئولہ میں  انشورنس کمپنی کے ساتھ علاج کرانے کا معاہدہ کرنا شرعاً صحیح نہیں ہے ،کیوں کہ  انشورنس کی بنیاد سود اور جوے پر ہے ،اور مذکورہ معاہدہ میں سود اس اعتبار سے ہے کہ حکومت نے انشورنس کمپنی کو فی فرد کے علاج کے لیے صرف 2000 روپے دیے ہیں ،اگر ایک مریض کے علاج پر 2000 سے زائد خرچہ آتا ہے تو انشورنس کمپنی وہ زائد رقم ہسپتال کو دینے کی پابند ہوتی ہے،تو یہ زائد رقم دینا سود ہے، ،اور جوا اس اعتبار سے ہے کہ جن افراد کے لیے حکومت نے انشورنس کمپنی کو علاج کے لیے  رقم دی ہے،اگر اُن میں سے کسی کو علاج کی نوبت  نہ آئے ،تو علاج  نہ ہونے کی صورت میں جمع شدہ رقم واپس نہیں ملتی ،انشورنس کمپنی اس کی مالک بن جاتی ہے۔</p><p style=""text-align:justify;"">اگر علاج کرانے والا شخص مستحق زکوۃ نہیں ہے،تو اس کے لیے اس کارڈ کے ذریعہ صرف اُسی قدر رقم کی بقدر سہولیات حاصل کرنا جائز ہو گا  جتنی رقم اُس کی طرف سے  جمع کروائی گئی ہے، اس سے زائد  رقم سے استفادہ کرنا اور اس کے ذریعہ علاج کروانا جائز نہیں،البتہ اگر کوئی شخص مستحقِ زکوۃ ہو تو وہ اس کارڈ سے علاج کی سہولت حاصل کر سکتا ہے، کیوں کہ مالِ حرام کا مصرف بھی  غریب ہی ہیں ۔</p><p dir=""rtl"" style=""text-align:justify;"">قرآن کریم میں ہے:</p><p class=""indent"" dir=""rtl"" style=""text-align:justify;""><span class=""qr_writing"">""{يَا أَيُّهَا الَّذِينَ اٰمَنُوا اتَّقُوا اللَّهَ وَذَرُوا مَا بَقِيَ مِنَ الرِّبَا إِنْ كُنْتُمْ مُؤْمِنِينَ  فَإِنْ لَمْ تَفْعَلُوا فَأْذَنُوا بِحَرْبٍ مِنَ اللَّهِ وَرَسُولِهِ}.""[البقرة:278، 279]</span></p><p class=""indent"" dir=""rtl"" style=""text-align:justify;"">ترجمہ:""اے ایمان والو!  اللہ سے ڈرو ، اور جو کچھ سود کا بقایا ہے اس کو چھوڑدو،  اگر  تم ایمان والے ہو، پھر اگر تم (اس پر عمل  ) نہ کروگے تو اشتہار سن لو جنگ کا  اللہ کی طرف سے اور اس کے رسول  کی طرف  سے۔""(از بیان القرآن)</p><p style=""text-align:justify;"">حدیث پاک میں ہے:</p><p class=""indent"" style=""text-align:justify;""><span class=""ar_writing"">""عن جابر قال: لعن رسول اﷲ صلی اﷲ علیه وسلم آکل الربا، وموکله، وکاتبه، وشاهدیه، وقال: هم سواء"".</span></p><p class=""indent"" style=""text-align:left;""><span class=""ar_writing"">(الصحيح لمسلم، با ب لعن آکل الربا، ومؤکله، ج: 3، ص: 1219، ط: دار إحياء التراث العربي)</span></p><p class=""indent"" style=""text-align:justify;"">ترجمہ:"" حضرت جابر رضی اللہ عنہ سے روایت ہے کہ جناب رسول اللہ صلی اللہ علیہ و سلم نے سود لینے والے اور دینے والے اور لکھنے والے اور گواہی دینے والے پر لعنت کی ہے اور فرمایا: یہ سب لوگ اس میں برابر ہیں، یعنی اصل گناہ میں سب برابر ہیں اگرچہ مقدار اور کام میں مختلف ہیں۔""(از مظاہر حق)</p><p style=""text-align:justify;"">قرآن مجید میں ہے:</p><p class=""indent"" style=""text-align:justify;""><span class=""ar_writing qr_writing"">""يَا أَيُّهَا الَّذِينَ آمَنُوا إِنَّمَا الْخَمْرُ وَالْمَيْسِرُ وَالْأَنصَابُ وَالْأَزْلَامُ رِجْسٌ مِّنْ عَمَلِ الشَّيْطَانِ فَاجْتَنِبُوهُ لَعَلَّكُمْ تُفْلِحُونَ."" ﴿المائدة: ٩٠﴾</span></p><p class=""indent"" style=""text-align:justify;"">ترجمہ:"" اے ایمان والو :بات یہی ہے کہ شراب اور جوا اور بت وغیرہ اور قرعہ کے تیر یہ سب گندی باتیں شیطانی کام  ہیں ،سواس سے بالکل الگ رہو،تاکہ تم کو فلاح ہو""۔(بیان القرآن)</p><p style=""text-align:justify;"">حدیث شریف میں ہے:</p><p class=""indent"" style=""text-align:justify;""><span class=""ar_writing"">""وقال رسول الله صلي الله عليه وسلم:إن الله حرّم أمتي الخمر و الميسر.""</span></p><p class=""indent"" style=""text-align:left;""><span class=""ar_writing"">(المسند للامام احمد،2 /124،ط: مؤسسة الرسالة)</span></p><p style=""text-align:justify;"">فتاوی شامی میں ہے:</p><p class=""indent"" style=""text-align:justify;""><span class=""ar_writing"">""لأن القمار من القمر الذي يزداد تارة وينقص أخرى، وسمي القمار قمارا لأن كل واحد من المقامرين ممن يجوز أن يذهب ماله إلى صاحبه، ويجوز أن يستفيد مال صاحبه وهو حرام بالنص.""</span></p><p class=""indent"" style=""text-align:left;""><span class=""ar_writing"">(كتاب الحظر والإباحة، فصل في البيع، ج: 6، ص: 403،ط:سعيد)</span></p><p style=""text-align:justify;"">الاختيار لتعليل المختار  ميں ہے:</p><p class=""indent"" style=""text-align:justify;""><span class=""ar_writing"">""و الملك الخبيث سبيله التصدق به ، و لو صرفه في حاجة نفسه جاز، ثم إن كان غنيًّا تصدق بمثله، و إن كان فقيرًا لايتصدق.""</span></p><p class=""indent"" style=""text-align:left;""><span class=""ar_writing"">(كتاب الغصب، ج: 3، ص: 61، ط: دار الكتب العلمية)</span></p><p class=""indent"" style=""text-align:left;"">فقط واللہ اعلم</p></p>",144403101415,banuri,"('معاملات', 'muamlat')","('سود / بینکاری / انشورنس / شیئرز', 'sood-bankari-insurance-shares')","('بیمہ زندگی / انشورنس / تکافل', 'bima-zindagi-insurance-takaful')"
21-11-2022,https://www.banuri.edu.pk/readquestion/zair-e-taameer-building-pr-zakat-ka-hukum-144404101937/21-11-2022,زیر تعمیر بلڈنگ پر زکوة کا حکم,میرا  ایک  دوست  اسلام آباد میں ایک دس منزلہ بلڈنگ اپارٹمنٹ کی صورت میں تعمیر کررہا ہے،  تعمیر اب ابتدائی مراحل میں ہی ہے،  لیکن ساتھ ہی وہ ان اپارٹمنٹ کو قسطوں میں بیچنا چاہتا ہے،  اور کچھ اپارٹمنٹس کی بکنگ بھی ہوچکی ہے اور تعمیرات بھی جاری ہیں۔نیز وہ  اس بلڈنگ کا گراؤنڈ فلور اپنے پاس رکھ کر اس میں اپنا بزنس شروع کرے گا۔اپ پوچھنا یہ ہے ہےکہ اس پراجیکٹ پر زکوٰۃ کیسے ادا کی  جائے گی ؟کیا تعمیراتی اخراجات کو بھی زکوٰۃ  کے حساب میں شامل کیا جائے گا؟,"<p><p style=""text-align:justify;"">واضح رہے کہ از روئے شرع خرید و فروخت صحیح ہونے کے لیے فروخت کردہ چیز کا وجود میں آنا ضروری ہوتا ہے، لہذا زیر تعمیر عمارت کے وہ فلیٹ جن کا وجود نہ ہو، انہیں فروخت کرنا، شرعا جائز نہیں ہوتا، البتہ ایسے فلیٹ کی بکنگ  کرانا  جائز ہوتا ہے، جو کہ درحقیقت فریقین کے درمیان  وجود میں آنے کے بعد اس کی خرید و فروخت کا وعدہ  ہوتا ہے، اور وعدہ کی بنیاد پر قسطیں وصول کرنے کی اجازت ہوتی ہے، پس جیسے جیسے عمارت تعمیر ہوتی جاتی ہے، فریقین کے درمیان خرید و فروخت کا سودہ مکمل  ہوتا جاتا ہے،  اور فروخت کنندہ رقم کا مالک ہوجاتا ہے، جب کہ خریدار اپنے فلیٹ کا مالک بن جاتا ہے، اور تعمیرات نہ ہونے کی  صورت  میں   رقم   کا مالک بدستور بکنگ کرانے والا ہوتا ہے،  اور رقبہ پر ملکیت بلڈر کی باقی رہتی ہے، لہذا صورتِ  مسئولہ میں قسطوں کی مد میں جمع شدہ رقم کی زکوة  بکنگ کرانے والے افراد پر واجب ہوگی، اور رقبہ کی زکوة بلڈر پر واجب ہوگی۔</p><p style=""text-align:justify;"">زکات کا سال مکمل ہونے کی تاریخ   تک جو رقم تعمیرات میں صرف ہوچکی ہے وہ رقم  تو زکات کے حساب میں شمار نہیں ہوگی،  لیکن اس تاریخ  میں مذکورہ پروجیکٹ  کی موجودہ مالیت  پر زکات واجب ہوگی،   ہاں اس میں سے  اس تاریخ تک واجب الادا قرض منہا کیے جائیں گے، خواہ وہ تعمیرات  کی مد میں ہوں۔</p><p style=""text-align:justify;""><span class=""ar_writing"">بدائع الصنائع فی ترتیب الشرائع</span>میں ہے:</p><p class=""indent"" style=""text-align:justify;""><span class=""ar_writing"">""وأما الذي يرجع إلى المعقود عليه فأنواع (منها) : أن يكون موجودا فلا ينعقد بيع المعدوم الخ.""</span></p><p class=""indent"" style=""text-align:left;""><span class=""ar_writing"">(کتاب البیوع،فصل فی الشرائط اللذی یرجع الی المعقود علیہم، ٥/  ١٣٨، ط: سعيد)</span></p><p style=""text-align:justify;""><span class=""ar_writing"">رد المحتار علي الدر المختار </span> میں ہے:</p><p class=""indent"" style=""text-align:justify;""><span class=""ar_writing"">""ولو أعطاه الدراهم، وجعل يأخذ منه كل يوم خمسة أمنان ولم يقل في الابتداء اشتريت منك يجوز وهذا حلال وإن كان نيته وقت الدفع الشراء؛ لأنه بمجرد النية لاينعقد البيع، وإنما ينعقد البيع الآن بالتعاطي والآن المبيع معلوم فينعقد البيع صحيحاً. قلت: ووجهه أن ثمن الخبز معلوم فإذا انعقد بيعاً بالتعاطي وقت الأخذ مع دفع الثمن قبله، فكذا إذا تأخر دفع الثمن بالأولى.""</span></p><p class=""indent"" style=""text-align:left;""><span class=""ar_writing"">( كتاب البیوع، مطلب البیع بالتعاطى، ٤ / ٥١٦،  ط: سعید)</span></p><p style=""text-align:justify;""><span class=""ar_writing"">بدائع الصنائع في ترتيب الشرائع</span>میں ہے:</p><p class=""indent"" style=""text-align:justify;""><span class=""ar_writing"">"" وأما صفة الاستصناع: فهي أنه عقد غير لازم قبل العمل في الجانبين جميعا، بلا خلاف، حتى كان لكل واحد منهما خيار الامتناع قبل العمل، كالبيع المشروط فيه الخيار للمتبايعين: أن لكل واحد منهما الفسخ؛ لأن القياس يقتضي أن لا يجوز؛ لما قلنا.</span></p><p class=""indent"" style=""text-align:justify;""><span class=""ar_writing"">وإنما عرفنا جوازه استحسانا؛ لتعامل الناس، فبقي اللزوم على أصل القياس.""</span></p><p class=""indent"" style=""text-align:left;""><span class=""ar_writing"">( كتاب الاستصناع، فصل في صفة الاستصناع، ٥ / ٣، ط: دار الكتب العلمية بيروت )</span></p><p style=""text-align:justify;""><span class=""ar_writing"">بدائع الصنائع في ترتيب الشرائع</span>میں ہے:</p><p class=""indent"" style=""text-align:justify;""><span class=""ar_writing"">""</span><span class=""ar_writing"">وأما حكم الاستصناع: فهو ثبوت الملك للمستصنع في العين المبيعة في الذمة، وثبوت الملك للصانع في الثمن ملكا غير لازم.""</span></p><p class=""indent"" style=""text-align:left;""><span class=""ar_writing"">( كتاب الاستصناع، فصل في حكم الاستصناع، ٥ / ٣، ط: دار الكتب العلمية بيروت )</span></p><p class=""indent"" style=""text-align:left;"">فقط واللہ ا علم</p></p>",144404101937,banuri,"('زکات', 'zakat')","('وجوب زکوٰۃ', 'wujoob-zakat')","('مالِ تجارت', 'mal-e-tijarat')"
24-01-2023,https://www.banuri.edu.pk/readquestion/dramon-ke-zarye-pesa-kamana-144407100122/24-01-2023,ڈارموں کے ذریعہ پیسہ کمانا,ڈرامہ پر پیسا کمانا جائز ہے یا نہیں؟,"<p><p style=""text-align:justify;"">صورت مسئولہ میں عام طور پر  ڈرامہ چوں کہ  جاندار اور نامحرم کی تصاویر اور موسیقی پر مشتمل ہوتا ہے  لہذاان  ڈراموں کا بنانا اور ان  کے ذریعہ پیسہ کمانا ناجائز اور حرام ہے۔</p><p style=""text-align:justify;"">مشکاۃ المصابیح میں ہے:</p><p class=""indent"" style=""text-align:justify;""><span class=""ar_writing"">""وعن عبد الله بن مسعود قال: سمعت رسول الله صلى الله عليه وسلم يقول: «أشد الناس عذابا عند الله المصورون».""</span></p><p class=""indent"" style=""text-align:left;""><span class=""ar_writing"">(کتاب اللباس , باب التصاویر جلد 2 ص: 1274 ط: المکتب الاسلامي)</span></p><p style=""text-align:justify;"">در المختار میں ہے:</p><p class=""indent"" style=""text-align:justify;""><span class=""ar_writing"">""قال ابن مسعود صوت اللهو والغناء ينبت النفاق في القلب كما ينبت الماء النبات. قلت: وفي البزازية استماع صوت الملاهي كضرب قصب ونحوه حرام لقوله - عليه الصلاة والسلام - «استماع الملاهي معصية والجلوس عليها فسق والتلذذ بها كفر» أي بالنعمة.""</span></p><p class=""indent"" style=""text-align:left;""><span class=""ar_writing"">(کتاب الحظر و الاباحة جلد 6 ص: 348 , 349 ط: دارالفکر)</span></p><p class=""indent"" style=""text-align:left;"">فقط و اللہ اعلم </p></p>",144407100122,banuri,"('حظر و اباحت', 'mamnooaat-mubahat')","('تفریح / کھیل', 'tafreeh-khel')","('ٹی وی / وی سی آر / سینما / انٹرنیٹ/تصویر سازی', 'tv-vcr-cinema-internet-taswer-sazi')"
14-01-2023,https://www.banuri.edu.pk/readquestion/pasandidah-shaks-se-nikah-karna-144406101670/14-01-2023,پسندیدہ شخص سے نکاح کرنا,اگر کسی لڑکی لڑکے کا تعلق آپس میں رہا ہو اور پھر لڑکی دینی پڑھائی کی طرف آگئی ہو اور لڑکے کا نکاح و شادی وغیرہ ہوگئی اس کے بعد بھی کچھ عرصے بعد ان کا رابطہ ہوگیا ہو دوبارہ اور پھر بات چیت وغیرہ اس کے بعدکچھ عرصہ گزر جاۓ اور اب لڑکی کے گھر والوں کو شادی کی فکر ہے عمر بھی ہورہی  ہےتو اب اگر اس شادی شدہ مرد سے اس کی شادی ہو وہ ٹھیک ہے یا کہیں اور ہوجاۓ کیونکہ ان کا تعلق رہا اور ایک ہی خاندان ہے اس کے 3بچے ہیں تو اب آیا وہ مرد گھر والوں کو منانے کے باوجود ان کے نہ ماننے پر خود سے شادی کرلے لڑکی کے والد سے بات کرکے اور کچھ مسائل بھی ہوں گے تو وہ صحیح ہے یا لڑکی کہیں اور شادی کرلے؟,"<p><p style=""text-align:justify;"">شادی سے پہلے تو لڑکا لڑکی کا آپس میں رابطہ رکھنا اور بلا ضرورت بات چیت کرنا یا ملنا ملانا وغیرہ  شرعًا  جائز نہیں ہے، البتہ اگرلڑکا، لڑکی آپس  میں  نکاح  کرنا چاہتے ہیں تو لڑکا  اپنے گھر والوں  کو اعتماد میں لے کر لڑکی کے گھر والوں کو نکاح کا پیغام بھیج کر نکاح کرسکتا ہے ،یہی مہذب طریقہ ہے،باقی مرد کے لیے ایک وقت میں چار نکاح رکھنے کی شرعا  اجازت ہے،بشرط یہ ہے کہ دونوں بیویوں کے درمیان رہن سہن، نان و نفقہ اور  رات گزارنے میں عدل و انصاف اور برابری کرے،البتہ  اس کے لیے پہلی بیوی کی اجازت ضروری نہیں ہے ،لیکن کسی ایک بیوی کے ساتھ ترجیحی سلوک کرنا شرعاً ناجائز ہے اور احادیث میں اس کی بہت سخت وعید آئی ہے۔</p><p style=""text-align:justify;"">فتاوی شامی میں ہے:</p><p class=""indent"" style=""text-align:justify;""><span class=""ar_writing"">""والأصل أن كل من تصرف في ماله تصرف في نفسه وما لا فلا.</span></p><p class=""indent"" style=""text-align:justify;""><span class=""ar_writing"">يستحب للمرأة ‌تفويض ‌أمرها إلى وليها كي لا تنسب إلى الوقاحة بحر.""</span></p><p class=""indent"" style=""text-align:left;"">(کتاب النکاح،باب الولی،ج3،ص55۔56،ط؛سعید)</p><p style=""text-align:justify;"">الفقہ الاسلامی وادلتۃ میں ہے:</p><p class=""indent"" style=""text-align:justify;""><span class=""ar_writing"">""‌‌ثانيا ـ معنى الخطبة: الخطبة: هي إظهار الرغبة في الزواج بامرأة معينة، وإعلام المرأة وليها بذلك. وقد يتم هذا الإعلام مباشرة من الخاطب، أو بواسطة أهله.</span></p><p class=""indent"" style=""text-align:justify;""><span class=""ar_writing"">فإن وافقت المخطوبة أو أهلها، فقد تمت الخطبة بينهما، وترتبت عليها أحكامها وآثارها الشرعية التي سأذكرها.</span></p><p class=""indent"" style=""text-align:justify;""><span class=""ar_writing"">‌‌رابعا ـ أنواع الخطبة: الخطبة إما أن تكون بإبداء الرغبة فيه صراحة، كأن يقول الخاطب: أريد الزواج من فلانة، وإما أن تكون مفهومة ضمنا أو بالتعريض والقرائن، بمخاطبة المرأة مباشرة، كأن يقول لها: إنك جديرة بالزواج، أو يسعد بك صاحب الحظ، أو أبحث عن فتاة لائقة مثلك، ونحوها.""</span></p><p class=""indent"" style=""text-align:left;"">(‌‌القسم السادس: الأحوال الشخصية،‌‌الباب الأول: الزواج وآثاره،‌‌الفصل الأول: مقدمات الزواج،ج9،ص6492،دار الفکر)</p><p style=""text-align:justify;"">الدر المختار وحاشیہ ابن عابدین  میں ہے:</p><p class=""indent"" style=""text-align:justify;"">""<span class=""ar_writing"">(و) صح (نكاح أربع من الحرائر والإماء فقط للحر) لا أكثر.""</span></p><p class=""indent"" style=""text-align:left;"">(فصل فی المحرمات،ج3،ص48،سعید)</p><p class=""indent"" style=""text-align:left;"">فقط واللہ اعلم</p></p>",144406101670,banuri,"('نکاح', 'nikah')","('نکاح صحیح', 'nikah-e-sahih')","('نکاح کی شرائط/ ارکان/ آداب', 'nikah-ki-sharaait-arkaan-aadab')"
21-11-2022,https://www.banuri.edu.pk/readquestion/bev-ky-ly-sharm-ghah-mun-m-leny-ka-hukm-144404101948/21-11-2022,بیوی کے لیے شوہر کی شرمگاہ منہ میں لینے کا حکم,کیا بیوی اپنے شوہر کا نفس منہ میں لے سکتی ہے اگر اس دوران مذی یا منی منہ میں چلی جائے تو اس کے بارے میں کیا حکم ہے؟,"<p><p dir=""rtl"" style=""text-align:justify;"">صورتِ مسئولہ میں بیوی کے لئےشوہر کا نفس منہ میں لینا شرعاً مکروہ اور منع   ہے، جس پاکیزہ زبان سے اللہ تعالیٰ کا نام لیا جاتا ہے، قرآن کریم کی تلاوت کی جاتی ہے اسے ایسے کاموں میں استعمال کرنا مہذب انسان کا کام نہیں  بلکہ یہ جانوروں کا فعل ہے، اس سے بچنا چاہیے،  اور  شرم گاہ سے نکلنے والی مذی یا ودی کو نگلنا  ناپاک ہونے کی وجہ سے ناجائز اور حرام ہے۔</p><p dir=""rtl"" style=""text-align:justify;"">تفسير مفاتيح الغيب ( التفسير الكبير )  میں   ہے:</p><p class=""indent"" dir=""rtl"" style=""text-align:justify;""><span class=""ar_writing"">""ويحرم عليهم الخبائث [الأعراف: 157] وذلك يقتضي تحريم كل الخبائث والنجاسات خبائث فوجب القول بتحريمها. الثالث: أن الأمة مجمعة على حرمة تناول النجاسات فهب أنا التزمنا تخصيص هذه السورة بدلالة النقل المتواتر من دين محمد في باب النجاسات فوجب أن يبقى ما سواها على وفق الأصل تمسكا بعموم كتاب الله في الآية المكية والآية المدنية فهذا أصل مقرر كامل في باب ما يحل وما يحرم من المطعومات.""</span></p><p class=""indent"" dir=""rtl"" style=""text-align:left;""><span class=""ar_writing"">(سورة الأنعام، رقم الآیات : 145 الى 147، ج:13، ص:169، ط:داراحیاء التراث العربی)</span></p><p dir=""rtl"" style=""text-align:justify;"">المحيط البرهاني في الفقه النعماني میں ہے:</p><p class=""indent"" dir=""rtl"" style=""text-align:justify;""><span class=""ar_writing"">""إذا أدخل الرجل ذكره فم أمرأته فقد قيل: يكره؛ لأنه موضع قراءة القرآن، فلايليق به إدخال الذكر فيه، و قد قيل بخلافه.""</span></p><p class=""indent"" dir=""rtl"" style=""text-align:left;""><span class=""ar_writing"">(کتاب الاستحسان و الکراهیة، الفصل الثانی و الثلاثون في المتفرقات، ج:5، ص:408، ط:دارالکتب العلمیة)</span></p><p class=""indent"" dir=""rtl"" style=""text-align:left;""><span class=""ar_writing"">فقط واللہ اعلم</span></p></p>",144404101948,banuri,"('حظر و اباحت', 'mamnooaat-mubahat')","('مطعومات و مشروبات', 'matoomaat-o-mashroobaat')","('حرام اشیاء', 'haraam-ashya')"
