issued_at,link,title,question,answer,fatwa_number,dar_ul_ifta,kitab,bab,fasal
04-06-2024,https://www.banuri.edu.pk/readquestion/janabat-ke-halat-ma-umrea-karna-ka-hokam-144511102534/04-06-2024,جنابت کی حالت میں عمرہ کرنے کا حکم,ایک چودہ سالہ لڑکے کو یہ نہیں پتا تھا کہ مشت زنی کرنا حرام ہے اور یہ کہ اس سے غسل واجب ہو جاتا ہے،  اس نے اسی حالت میں تین عمرے کر لیے، اب اس سے متعلق تین سوال ہیں :(1) کیا اس کو ہر حالت میں دم دینا ہو گا یا کیا وہ ان عمروں کی قضاء کر سکتا ہے؟(2) کیا اس کو تین دم دینے ہوں گے؟(3)کیا ناپاکی کی حالت میں رکھے گئے روزوں کا اعادہ کرنا ہو گا؟,"<p><p style=""text-align:justify;"">(2/1)صورتِ مسئولہ میں اگر مذکوہ لڑکا مکہ مکرمہ میں موجود ہو تو    مذکورہ تینوں عمروں کا اعادہ لازم ہے ، اگر  ان تینوں عمروں کا اعادہ پاکی کے حالت میں کرلیاتو اس پر کوئی دم لازم نہیں ہوگا اور اگر مذکورہ لڑکا اپنے وطن واپس لوٹ آیا تو اس پر ہر عمرہ کا الگ الگ دم (تین بکریوں کا حدود حرم میں ذبح کرنا)اس پر لازم ہے۔ باقی ملحوظ رہے کہ مشت زنی کرنا حرام اور ناجائز فعل ہے، رسول اللہ صلی اللہ علیہ و سلم نے اس فعل کی سخت مذمت اور وعید بیان فرمائی ہے، حضرت انس رضی اللہ عنہ سے مروی ہے کہ قیامت کے دن مشت زنی کرنے والا اس حال میں آئے گا کہ اس کا ہاتھ حاملہ ہوگا، اسی طرح حدیث میں ہے کہ قیامت کے دن اللہ تعالی سات لوگوں کی طرف نظر رحمت سے نہیں دیکھں گے اور ان کو سب سے پہلے جہنم میں داخل کریں گے ان میں سے ایک م اس لیے مذکورہ لڑکے پر لازم ہے کہ وہ آئندہ   مذکورہ فعل ہرگز نہ کرے۔</p><p style=""text-align:justify;"">(3) روزے کے دوران مشت زنی نہ کی ہو،  البتہ جنابت کی حالت میں روزے رکھے ہوں تو جنابت کی حالت میں رکھے ہوئے روزوں کا اعادہ  لازم نہیں ہے۔ ہاں  جو  نمازیں جنابت کی حالت میں پڑھی گئی ہوں ان کی  قضا  لازم ہے۔</p><p style=""text-align:justify;"">شعب الاِیمان میں ہے:</p><p class=""indent"" style=""text-align:justify;""><span class=""ar_writing"">""عن أنس بن مالك عن النبي صلى الله عليه وسلم قال: ""سبعة لا ينظر الله عز وجل إليهم يوم القيامة ولا يزكيهم، ولا يجمعهم مع العالمين، يدخلهم النار أول الداخلين إلا أن يتوبوا إلا أن يتوبوا إلا أن يتوبوا، فمن تاب تاب الله عليه، الناكح يده، والفاعل والمفعول به، ومدمن الخمر، والضارب أبويه حتى يستغيثا، والمؤذي جيرانه حتى يلعنوا، والناكح حليلة جاره"". قال البخاري في ""التاريخ"" قال قتيبة عن حميد هو الرؤاسي عن مسلمة بن جعفر عن حسان بن حميد عن أنس بن مالك قال: يجيء الناكح يده يوم القيامة ويده حبلى.""</span></p><p class=""indent"" style=""text-align:left;""><span class=""ar_writing"">(السابع والثلاثون من شعب الإيمان وهو باب في تحريم الفروج وما يجب من التعفف عنها، ج:4، ص:378، دار الكتب العلمية، بيروت)</span></p><p class=""indent"" style=""text-align:justify;"">""ترجمہ:حضرت انس ابن مالک رضی اللہ سے مروی ہے کہ بنی کریم صلی اللہ علیہ وسلم نے فرمایا کہ سات لوگوں اللہ تعالی (نظر رحمت سے)نہیں دیکھیں گے اور نہ ان کا تزکیہ کریں گےاور نہ ان کو دیگر لوگوں کے ساتھ جمع کریں گے ان کو سب سے پہلے جہنم میں داخل کریں گے، مگر یہ کہ وہ توبہ کریں، مگریہ کہ وہ توبہ کریں، مگر یہ کہ وہ توبہ کریں، پس جو توبہ کرے اللہ تعالی اس پر مہربانی فرمائیں گے، (1) مشت زنی کرنے والا، (2/3) فاعل اور مفعول(یعنی قوم لوط کا عمل کرنے والے)، (4)شراب پر مداومت اختیار کرنے والا، (5)اپنے والدین کو مارنے والا یہاں تک کے وہ(والدین) اوروں کو مدد کے لیے پکارے،(6) اپنے پڑوسیوں کو ایذاء پہنچانے والا یہاں تک کے پڑوسی اس پر لعن طعن کرنے لگے، (7)اپنے پڑوسی کی بیوی سے زنا کرنے والا.اور۔۔۔۔۔۔۔۔۔۔۔۔۔۔۔حضرت انس رضی اللہ عنہ سے مروی ہے کہ مشت زنی کرنے والا قیامت کے دن اس حال میں آئے گا کہ اس کا ہاتھ حاملہ ہوگا۔""</p><p style=""text-align:justify;"">فتاوی عالمگیری میں ہے:</p><p class=""indent"" style=""text-align:justify;""><span class=""ar_writing"">""إذا طاف للعمرة محدثا أو جنبا فما دام بمكة يعيد الطواف فإن رجع إلى أهله ولم يعد ففي المحدث تلزمه الشاة وفي الجنب تكفيه الشاة استحسانا هكذا في المحيط.ومن طاف لعمرته وسعى على غير وضوء فما دام بمكة يعيدهما فإذا أعادهما لا شيء عليه فإن رجع إلى أهله قبل أن يعيد فعليه دم لترك الطهارة فيه ولا يؤمر بالعود لوقوع التحلل بأداء الركن وليس عليه في السعي شيء وكذا إذا أعاد الطواف ولم يعد السعي في الصحيح كذا في الهداية.""</span></p><p class=""indent"" style=""text-align:left;""><span class=""ar_writing"">(كتاب المناسك، الباب الثامن في الجنايات، الفصل الخامس في الطواف والسعي والرمل ورمي الجمار، ج:1، ص:247، ط:دارالفکر بیروت)</span></p><p style=""text-align:justify;"">وفیہ ایضاً:</p><p class=""indent"" style=""text-align:justify;""><span class=""ar_writing"">""ومن أصبح جنبا أو احتلم في النهار لم يضره كذا في محيط السرخسي.""</span></p><p class=""indent"" style=""text-align:left;""><span class=""ar_writing"">(كتاب الصوم، الباب الثالث فيما يكره للصائم وما لا يكره، ج:1، ص:200، ط:دارالفکر بیروت)</span></p><p style=""text-align:justify;"">وفیہ ایضاً:</p><p class=""indent"" style=""text-align:justify;""><span class=""ar_writing"">""وهي عندنا سبعة: الطهارة من الأحداث، والطهارة من الأنجاس، وستر العورة واستقبال القبلة والوقت والنية والتحريمة.""</span></p><p class=""indent"" style=""text-align:left;""><span class=""ar_writing"">(كتاب الصلاة، الباب الثالث في شروط الصلاة، ج:1، ص:58، ط:دارالفکر بیروت)</span></p><p class=""indent"" style=""text-align:left;"">فقط واللہ اعلم</p></p>",144511102534,banuri,"('حج', 'haj')","('حج / عمرہ', 'hajj-umrah')","('عمرہ ، فرائض ، واجبات اور سنن', 'umrah-faraidh-wajibat-or-sunan')"
03-06-2024,https://www.banuri.edu.pk/readquestion/umme-habeeba-nam-rakhna-144511102392/03-06-2024,ام حبیبہ نام رکھنا,ام حبیبہ نام رکھنا بیٹی کے لیے کیسا ہے اور تلفّظ کیسے ہو سکتا ہے ؟,"<p><p style=""text-align:justify;"">""ام حبیبہ"" رسول اللہ ﷺکی زوجہ مطہرہ کی کنیت ہے،ان کا نام ""رملہ"" تھا، یہ ابو سفیان رضی اللہ عنہ کی صاحبزادی ہیں ۔</p><p style=""text-align:justify;"">ام حبیبہ رضی اللہ عنہا کی صاحبزادی کا نام ""حبیبہ ""تھا جس کی طرف نسبت کرتے ہوئے ان کی کنیت ""ام حبیبہ ""ہے۔</p><p style=""text-align:justify;"">لہذا لڑکی کانام  اس نسبت سے <span class=""qr_writing"">""اُمّ حَبِیْبَه""</span>رکھا جاسکتاہے۔  حبیبہ   ‌ ح کے زبر   کے ساتھ  پڑھا جاتا ہے ۔ </p><p style=""text-align:justify;"">اسد الغابة ميں هے :</p><p class=""indent"" style=""text-align:justify;""><span class=""ar_writing"">""كانت ‌أم ‌حبيبة بنت أَبِي سفيان عند رَسُول اللَّهِ صَلَّى اللَّهُ عَلَيْهِ وَسَلَّمَ"".</span></p><p class=""indent"" style=""text-align:left;""><span class=""ar_writing""> (642/1 ، دار الکتب العلمیہ)</span></p><p style=""text-align:justify;"">اسد الغابۃ     میں ہے :</p><p class=""indent"" style=""text-align:justify;""><span class=""ar_writing"">""والأشهر أنها ‌أم ‌حبيبة مشهورة بكنيتها.""</span></p><p class=""indent"" style=""text-align:left;""><span class=""ar_writing"">(61/7، دار الکتب العلمیہ)</span></p><p style=""text-align:justify;"">تاج العروس میں ہے :</p><p class=""indent"" style=""text-align:justify;""><span class=""ar_writing"">""وَقَالَ غيرُه: القِطْعَةُ مِنْهَا رَمْلَةٌ، وَبهَا سُمِّيَتْ رَمْلَةُ ابْنةُ أبي سُفْيانَ أُمُّ المُؤْمِنين أُمُّ حَبِيبَةَ، زَوْجُ النَّبِيِّ صَلَّى اللهُ عَلَيه وسَلَّم، ورَضِيَ عَنْهَا"".</span></p><p class=""indent"" style=""text-align:left;""><span class=""ar_writing"">(97/29،دار الھدایہ)</span></p><p class=""indent"" style=""text-align:left;"">فقط واللہ اعلم </p></p>",144511102392,banuri,"('حقوق و آدابِ معاشرت', 'huqooq-muashret')","('حقوق', 'bahmi-huqooq')","('اولاد کے حقوق', 'olad-ky-hoqoq')"
07-07-2024,https://www.banuri.edu.pk/readquestion/dil-ke-lie-use-hone-wale-emoji-ka-hukum-144512101768/07-07-2024,دل کی تعبیر کے طور پر استعمال ہونے والی تصویر کا حکم,محترم مفتیان کرام رہنمائی فرمائیں:دل ❤️ کے اس ایموجی کا استعمال جائز ہے یا ناجائز ہے؟ یہ ہم جانتے ہیں کہ جاندار کے چہرے کے ایموجی کا استعمال منع ہے اور الحمداللہ ہم اس سےاجتناب بھی کرتےہیں.مگر آج کل سوشل میڈیا پر ایک تحریر گردش کررہی ہے جس میں کہا جارہا ہے کہ دل کے اس shape کے ایموجی کا استعمال منع ہے اور  وجہ یہ بتائی جارہی ہے کہ اس کا shape عورت کی سرین جیسی ہے،  اور یہ بھی کہا گیا ہے  اس پوسٹ میں ایک یونانی دیوی تھی ، اس کے سرین بہت خوبصورت تھے تو یہ اس کے سرین جیسی شکل ہے ۔مفتیان کرام! اگر واقعی یہ شکل حرام ہے دل کی، تو اتنے فن پارے ہوتے ہیں اللہ محمد کے نام کے اس شیپ میں، اور گھروں میں کتنی ہی چیزیں ہوتی ہیں ایسی ،ہم تو آج تک اسے محبت کا اظہار کاذریعہ سمجھتے آۓ ہیں۔ مگر اس پوسٹ نے تذبذب میں مبتلا کردیا ہے۔ تو رہنمائی فرمائیں اور یہ بھی بتائيں  کہ اگرحرام ہے تو ان اشیاء کا کیا حکم ہوگا؟,"<p><p style=""text-align:justify;"">صورتِ  مسئولہ میں مذکورہ ایموجی اور تصویر کا اطلاق اور استعمال دل اور دل کے افعال مثلاً: چاہت، محبت، پسندیدگی وغیرہ  کے طور پر کیا جانا متعارف ہے، اور اس سے متبادر مفہوم بھی یہی ہوتا ہے، اور معاشرے میں بھی یہی سمجھا جاتا ہے، لہٰذا اس تصویر اور ایموجی کو جائز مواقع میں استعمال کرنے میں کوئی مضائقہ نہیں۔</p><p style=""text-align:justify;"">باقی سائلہ نے جس تحریر کا ذکر کیا ہے، وہ تحریر  ارسال کردی جائے، اور اس تحریر کا جو مدعیٰ ہے اس پر  دلائل بھی  پیش کردیے جائیں، ان کا جائزہ لے کر ہی اس کےمتعلق مزید کوئی حکم ذکر کیا جاسکتا ہے۔</p><p style=""text-align:justify;"">غمز عيون البصائر في شرح الأشباه والنظائرمیں ہے:</p><p class=""indent"" style=""text-align:justify;""><span class=""ar_writing"">"" واعلم أن اعتبار العادة والعرف يرجع إليه في الفقه في مسائل كثيرة حتى جعلوا ذلك أصلا، فقالوا في الأصول في باب ما تترك به الحقيقة: تترك الحقيقة بدلالة الاستعمال والعادة، كذا ذكر فخر الإسلام فاختلف في عطف العادة على الاستعمال فقيل هما مترادفان، وقيل المراد من الاستعمال نقل اللفظ عن موضوعه الأصلي إلى معناه المجازي شرعا، وغلبة استعماله فيه، ومن العادة نقله إلى معناه المجازي عرفا، وتمامه في الكشف الكبير.""</span></p><p class=""indent"" style=""text-align:left;""><span class=""ar_writing"">( القاعدة السادسة العادة محكمة، ١ / ٢٩٥ - ٢٩٦، ط: دار الفكر )</span></p><p class=""indent"" style=""text-align:left;"">فقط واللہ اعلم</p></p>",144512101768,banuri,"('حظر و اباحت', 'mamnooaat-mubahat')","('تصویر اور دیگر لہو و لعب', 'soorat-o-malaahi')","('تصویر کے احکام / حدود', 'tasweer-ke-ahkaam-hudood')"
06-07-2024,https://www.banuri.edu.pk/readquestion/kya-morghi-ka-panja-khana-jaiz-ha-144512101726/06-07-2024,کیا مرغی کے پنجے کھانا جائز ہے؟,کیا مرغی کے پنجے کھانا جائز ہے ؟,"<p><p style=""text-align:justify;"">مرغی کے پنجے ان سات  چیزوں میں سے نہیں ہیں جنہیں کھانا جائز نہیں، لہذا مرغی کے پنجے کھانا جائز ہے۔ دیگر حلال جانوروں کے پائے کی طرح حلال و جائز ہیں۔</p><p style=""text-align:justify;"">فتاویٰ شامی میں ہے:</p><p class=""indent"" style=""text-align:justify;""><span class=""ar_writing"">""(كره تحريما) وقيل تنزيها والأول أوجه (من الشاة سبع الحياء والخصية والغدة والمثانة والمرارة والدم المسفوح والذكر).""</span></p><p class=""indent"" style=""text-align:left;""><span class=""ar_writing"">(‌‌كتاب الخنثى،‌‌مسائل شتى،ج:6ص: 749،ط:دار الفكر - بيروت)</span></p><p class=""indent"" style=""text-align:left;"">فقط واللہ اعلم</p></p>",144512101726,banuri,"('حظر و اباحت', 'mamnooaat-mubahat')","('ماکولات / مشروبات', 'makoolat-mashroobat')","('کھانے پینے کی حلال و حرام ، مکروہ و مباح اشیاء', 'khanay-penay-ki-halal-o-haram-makroh-o-mubah-ashya')"
08-07-2024,https://www.banuri.edu.pk/readquestion/profit-and-loss-sharing-account-kholna-144601100036/08-07-2024,پرافٹ اینڈ لاس شئیرنگ اکاونٹ کھولنا,حبیب بینک میں پرافٹ لاس شئیرنگ اکاؤنٹ کھولنا کیسا ہے ؟ بینک کی جانب سے مہیا کی گئی معلومات کے مطابق اس میں نفع نقصان دونوں ہو سکتے ہیں,"<p><p style=""text-align:justify;"">ہمارے علم کے مطابق تاحال کوئی بھی ایسا بینک نہیں ہے جس کے مالی معاملات میں تمام شرعی احکام  پر عمل کیا جاتا ہو، اس لیے فی الحال کسی بھی بینک میں نفع و نقصان کے احتمال پر مشتمل اکاؤنٹ کھولنابھی  جائز نہیں ہے۔ مزید غور کے لئے بنک کی معلوماتی تحریر / لڑیچر لاکر ملاحظہ کرلیں ۔فقط واللہ اعلم</p></p>",144601100036,banuri,"('معاملات', 'muamlat')","('سود / بینکاری / انشورنس / شیئرز', 'sood-bankari-insurance-shares')","('متفرقات سود', 'mutafarriqat-e-sood')"
15-11-2023,https://www.banuri.edu.pk/readquestion/halat-e-haiz-me-jima-karna-144505100124/15-11-2023,حالتِ حیض میں جماع کرنا,حالت حیض میں جماع کا گناہ 1978 میں ہوا تھا تو صدقہ اس وقت کے سونا کی قیمت سے ہوگا یا موجودہ قیمت سے ؟,"<p><p style=""text-align:justify;"">واضح رہے کہ حالتِ حیض میں جماع کرنا ناجائز اور حرام ہے،اگر زوجین کی رضامندی سے اس گناہ کا ارتکاب ہوا ہے تو دونوں گناہ گار ہوئے،دونوں استغفارکریں، اور حالتِ حیض میں جماع ہوجانے کی صورت میں مستحب یہ ہےکہ ایک دینار (4.374  گرام سونے کا سکہ) یا آدھا دینار (یا اس کی قیمت) صدقہ کریں،مارکیٹ میں جو سونے کی قیمت ہو اس کے حساب سے دینار کی قیمت معلوم کی جاسکتی ہےاور ادائیگی کے وقت کا اعتبار کرے۔</p><p style=""text-align:justify;"">فتاویٰ شامی میں ہے:</p><p class=""indent"" style=""text-align:justify;""><span class=""ar_writing"">""(قوله ويندب إلخ) لما رواه أحمد وأبو داود والترمذي والنسائي عن ابن عباس مرفوعاً «في الذي يأتي امرأته وهي حائض، قال: يتصدق بدينار أو نصف دينار»، ثم قيل: إن كان الوطء في أول الحيض فبدينار أو آخره فبنصفه، وقيل: بدينار لو الدم أسود وبنصفه لو أصفر. قال في البحر: ويدل له ما رواه أبو داود والحاكم وصححه: «إذا واقع الرجل أهله وهي حائض، إن كان دماً أحمر فليتصدق بدينار، وإن كان أصفر فليتصدق بنصف دينار.""</span></p><p class=""indent"" style=""text-align:left;""><span class=""ar_writing""> (‌‌كتاب الطهارة،‌‌باب الحيض،ج:1،ص:298،ط:سعيد)</span></p><p class=""indent"" style=""text-align:left;""><span class=""ar_writing"">فقط واللہ اعلم</span></p></p>",144505100124,banuri,"('طہارت', 'taharat')","('حیض، نفاس، استحاضہ', 'hayz-nifas-istihaza')","('حیض کی تعریف اور احکام', 'haiez-ki-tareef-aur-ahkaam')"
