issued_at,link,title,question,answer,fatwa_number,dar_ul_ifta,kitab,bab,fasal
25-02-2024,https://www.banuri.edu.pk/readquestion/web-site-pr-mojud-fatawa-jat-ki-video-bna-kr-share-krna-144508101251/25-02-2024,جامعہ کے فتاویٰ اور دیگر مواد کو کسی دوسرے فورم پر نشر کرنے کی اجازت نہیں,میں  آپ کی ویب سائٹ پر   سوالات دیکھتا ہوں، جو لوگوں نے پوچھے ہیں، پھر  سوال اور جواب کو کاپی کرکے ویڈیو بناتا ہوں، لکھائی والی ویڈیو،   جواب کا خلاصہ لکھتا ہوں، اکثر جوابات میں عربی بھی ہوتی ہے، اور میں ایک منٹ سے کم ویڈیو بناتا ہوں، اور ویڈیو اَپ لوڈ کرنے کے بعد کمنٹ میں سوال کا لنک پوسٹ کرتا ہوں، ویڈیو میں مینشن ہوتا ہےکہ یہ سوال و جواب دار الافتاء جامعہ بنوری ٹاؤن کی ویب سائٹ سے لیا گیا  ہے، اور سوال کا لنک کمنٹ میں موجود ہے۔تو حضرت اس کام کے لیے اجازت مانگنی تھی، کیا اس چیز کی آپ کسی کو اجازت دیتے ہیں؟ اگر دیتے ہیں  تو مجھے بھی فرمائیں۔,"<p><p style=""text-align:justify;"">الحمد للہ جامعہ سے جاری شدہ فتاویٰ اور مضامین ہماری ویب سائٹ پر  ہر خاص و عام  کی راہنمائی کے لیے حسبۃً للہ کسی دنیاوی مفاد کے بغیر نشر کیے جاتے ہیں جو ہمہ وقت دستیاب ہیں؛ لہٰذا کسی فرد یا ادارے کو  ویب سائٹ یا سوشل میڈیا کے کسی بھی پلیٹ فارم  پر جامعہ کے فتاویٰ یا مضامین  ویڈیو یا ٹیکسٹ کسی بھی صورت میں  نشر کرنے کی  بوجوہ اجازت نہیں ہے، ادارہ ایسی کسی نشر و اشاعت کا ذمہ دار نہیں ہوگا، نیز بوقتِ ضرورت قانونی چارہ جوئی بھی کی جاسکتی ہے۔ فقط</p></p>",144508101251,banuri,"('علوم و فنون', 'uloom-funoon')","('فقہ و فتویٰ', 'fiqah')","('فتویٰ کی تعریف، اصول اور آداب', 'fatwa-ki-tareef-usool-aur-aadaab')"
06-06-2024,https://www.banuri.edu.pk/readquestion/hulak-na-kaya-to-kya-hukum-ha-144511102693/06-06-2024,معتمر یا حاجی نے حلق نہ کیا تو کیا حکم؟,اگر کسی معتمر یا حاجی نے پورا سر نہ منڈوایا تو کیا اس پر دم لازم ہوگا یا نہیں؟,"<p><p style=""text-align:justify;"">حج اور عمرہ کے ارکان ادا کرنے کے بعد  حلق (سرمنڈوانا) یا قصر (کم از کم ایک چوتھائی سر کے بال کم از کم ایک پورے کے برابر کاٹنا)  ضروری ہے، لہذا اگر پورے سر کا حلق نہیں کرایا لیکن   چوتھائی سر کے بال  ایک پورے کے بقدر کٹوالیے ہیں یعنی  قصر کیا ہے  یا چوتھائی سر کا حلق کیا ہے تو بھی  حلال ہونے کے لیے کافی  ہے،  اس سے دم واجب نہیں ہوتا، تاہم اس طرح سر کے کچھ حصے کے بال کاٹنا اور کچھ حصے کے بال چھوڑدینا مکروہ ہے؛ لہٰذا حلق یا قصر پورے سر کے بالوں کا کرنا چاہیے۔  اور اگر معتمر یا حاجی نے احرام کھولنے کے لیے  قصر بھی نہیں کیا اور احرام کھول دیا تو پھر ایسی صورت میں دم واجب ہو گا۔</p><p style=""text-align:justify;"">حدیث شریف میں ہے: </p><p class=""indent"" style=""text-align:justify;""><span class=""ar_writing"">""حدثنا أبو بكر بن أبي شيبة، وزهير بن حرب، وابن نمير، وأبو كريب، جميعا عن ابن فضيل، قال زهير: حدثنا محمد بن فضيل، حدثنا عمارة، عن أبي زرعة، عن أبي هريرة، قال: قال رسول الله صلى الله عليه وسلم: «اللهم اغفر للمحلقين»، قالوا: يا رسول الله، وللمقصرين؟، قال: «اللهم اغفر للمحلقين» قالوا: يا رسول الله، وللمقصرين؟، قال: «اللهم اغفر للمحلقين»، قالوا: يا رسول الله، وللمقصرين؟ قال: «وللمقصرين.""</span></p><p class=""indent"" style=""text-align:left;""> (كتاب الحج، باب تفضيل الحلق على التقصير وجواز التقصير، ج: ۲، صفحہ: ۹۴۶، رقم الحدیث: ۱۳۰۲، ط: دار إحياء التراث العربي - بيروت)</p><p style=""text-align:right;"">فتاوی شامی میں ہے:</p><p class=""indent"" style=""text-align:justify;""><span class=""ar_writing"">""(أو حلق في حل بحج) في أيام النحر، فلو بعدها فدمان (أو عمرة) لاختصاص الحلق بالحرم.</span><span class=""ar_writing"">(قوله: أو حلق في حل بحج أو عمرة) أي يجب دم لو حلق للحج أو العمرة في الحل؛ لتوقته بالمكان، وهذا عندهما، خلافاً للثاني، (قوله: في أيام النحر) متعلق بحلق بقيد كونه للحج، ولذا قدمه على قوله أو عمرة، فيتقيد حلق الحاج بالزمان أيضاً، وخالف فيه محمد، وخالف أبو يوسف فيهما، وهذا الخلاف في التضمين بالدم لا في التحلل؛ فإنه يحصل بالحلق في أي زمان أو مكان، فتح. وأما حلق العمرة فلا يتوقت بالزمان إجماعاً، هداية. وكلام الدرر يوهم أن قوله: في أيام النحر قيد للحج والعمرة، وعزاه إلى الزيلعي، مع أنه لا إيهام في كلام الزيلعي كما يعلم بمراجعته، (قوله: فدمان) دم للمكان ودم للزمان، ط، (قوله: لاختصاص الحلق) أي لهما بالحرم وللحج في أيام النحر، ط"".</span></p><p class=""indent"" style=""text-align:left;"">(باب الجنایات، ج: ۲، صفحہ: ۵۵۴،  ط: ایچ، ایم،  سعید)</p><p class=""indent"" style=""text-align:left;"">فقط واللہ اعلم</p></p>",144511102693,banuri,"('حج', 'haj')","('حج / عمرہ', 'hajj-umrah')","('حج کی غلطیاں اور اس کے احکام', 'haj-ki-ghalatiyan-or-us-k-ahkam')"
20-06-2024,https://www.banuri.edu.pk/readquestion/ksi-dosrye-se-istkhara-karwanye-ka-hokm-144512100777/20-06-2024,کسی دوسرے سے استخارہ کروانے کا حکم,کیا کسی پیر سے استخارہ کروانا جائز ہے ؟ اور اگر وہ کہے کہ اس لڑکی سے آپ کے لیے نکاح کرنا مناسب نہیں ہے ، استخارہ ان کےحق میں صحیح نہیں ہےتوکیاکرناچاہیے؟,"<p><p style=""text-align:justify;"">استخارہ کسی سےکروانےکےبجائےخودکوکرناچاہیے، حضورﷺ نےہرمسلمان کواپنےمعاملےمیں استخارہ کرنےکی ترغیب دی ہیں، البتہ اگرکسی نیک بااعتماد آدمی سےاستخارہ کروایا جائےتواس کی بھی گنجائش ہےاورپھراسی کےمطابق عمل بھی کرناچاہیے، یہی اپنےحق میں بہترہے، لیکن یہ بھی واضح  رہےکہ اگراستخارہ میں آنےوالےجواب پرعمل نہ کیاجائےتواس میں کوئی گناہ نہیں ہوگا۔</p><p style=""text-align:justify;"">سنن ترمذی میں ہے:</p><p class=""indent"" style=""text-align:justify;""><span class=""ar_writing"">""عن جابر بن عبد الله، قال: كان رسول الله صلى الله عليه وسلم ‌يعلمنا ‌الاستخارة في الأمور كلها كما يعلمنا السورة من القرآن، يقول: "" إذا هم أحدكم بالأمر فليركع ركعتين من غير الفريضة، ثم ليقل: اللهم إني أستخيرك بعلمك، وأستقدرك بقدرتك، وأسألك من فضلك العظيم، فإنك تقدر ولا أقدر، وتعلم ولا أعلم، وأنت علام الغيوب، اللهم إن كنت تعلم أن هذا الأمر خير لي في ديني ومعيشتي وعاقبة أمري - أو قال: في عاجل أمري وآجله - فيسره لي، ثم بارك لي فيه، وإن كنت تعلم أن هذا الأمر شر لي في ديني ومعيشتي وعاقبة أمري - أو قال: في عاجل أمري وآجله - فاصرفه عني، واصرفني عنه، واقدر لي الخير حيث كان، ثم أرضني به۔""</span></p><p class=""indent"" style=""text-align:left;""><span class=""ar_writing"">(أبواب الوتر، ‌‌باب ما جاء في صلاة الاستخارة، 345/2، رقم:480، ط:شركة مكتبة ومطبعة مصطفى)</span></p><p>بہشتی زیور میں ہے:</p><p class=""indent"">""اگرایک دن میں کچھ معلوم نہ ہواوردل کاخلجان اورتردد نہ جاوےتودوسرےدن پھرایساہی کرے، اسی طرح سات دن تک کرےان شاء اللہ ضروراس کام کی اچھائی یابرائی معلوم ہوجاوےگی۔""</p><p class=""indent"" style=""text-align:left;"">(استخارہ کی نماز کابیان، ص:107، ط:اسلامک بک سروس)</p><p class=""indent"" style=""text-align:left;"">فقط واللہ اعلم</p></p>",144512100777,banuri,"('نماز', 'salat')","('سنن و نوافل', 'nawafil')","('سنن و نوافل', 'sunan-o-nawafi')"
28-06-2024,https://www.banuri.edu.pk/readquestion/goobar-or-degar-jyanwaroy-ka-fazlat-sa-kampast-taeyr-karne-ka-hukam-144512100881/28-06-2024,گوبر یا دیگر جانوروں کے فضلات سے کمپوسٹ تیارکرنے کا حکم,۱. گوبر کو خشک کرکے اُسے مٹی کے ساتھ ملا کے کمپوسٹ تیار کیا جاتا ہے، اُسے  organic compost کہا جاتا ہے، باقی kitchen waste بھی شامل ہوتا ہے اس میں ، کیا وہ پاک ہوتا ہے یا ناپاک؟۲۔ Organic Liquid Fertilizer کیا پاک ہوتا ہے یا ناپاک ، اُس میں organic matter ہوتا ہے، تو اس میں جانوروں کا فضلہ بھی شامل ہوتا ہے، اُسے ایک خاص process سے گزارا جاتا ہے، جس کے decomposition کے بعد ہی اُسی سے بنایا جاتا ہے۔۳۔ میں home gardening کرتا ہوں، تو اِن اشیاء کا استعمال کرتا ہوں، آپ بھی ان اشیاء کی تحقیق کرکے جواب فراہم  کیجیے۔۴۔ بعض دفعہ آرگینک فرٹیلائزر سپرے کرتے ہوئے ہاتھوں کو لگ جاتا ہے، ہاتھ د ھوتا ہوں تو چھینٹیں کپڑوں کو لگتی ہیں،  کیا اُن چھینٹوں سے کپڑے ناپاک ہوجاتے  ہیں؟,"<p><p style=""text-align:justify;""> واضح رہے کہ اگر گوبر یا اس جیسی  دیگر  ناپاک چیزوں کی حقیقت اور ماہیت  تبدیل ہوجائے تو ان کاحکم تبدیل ہوجاتاہے اور یہ چیزیں پاک ہوجاتی ہیں،جیسے گوبر راکھ بن گیا،یا شراب سے سرکہ بن گیا،لیکن اگر ان چیزوں کی ماہیت تبدیل نہ ہو تو   باقی چیزوں کے ساتھ خلط  ملط کرنے سے وہ پاک نہیں ہوں  گی۔</p><p style=""text-align:justify;"">لہذا صورتِ  مسئولہ  میں گوبر یادیگرجانوروں کے فضلات سے جو کھاد تیارکی جاتی ہے، اس میں گوبرکی حقیقت اور ماہیت  پراسس سے گزارنے کے بعد نہیں بدلتی ہے،اور  یہ  ناپاک ہی رہتاہے ، لہذا گوبروغیرہ سے تیار کردہ کھاد اگر  خشک  ہے  اور کسی کپڑے وغیرہ کو  لگ جائے تو  جھاڑنے سے دور ہوجاتی  ہے، اس لیے کپڑا ناپاک نہیں ہوگا، لیکن اگر  اس میں پانی ملنے کی وجہ سے وہ گیلی ہوجائے اور کسی چیز کو لگ جائے تو   جس چیز کو لگی گی اسے  بھی ناپاک کردیتی ہیں۔ اسی طرح  ""آرگینک لیکویڈ فرٹیلائزر "" جس میں جانور کے فضلات شامل ہوتے ہیں وہ بھی ناپاک ہے، بدن یا جسم پر لگنے کی صورت میں اس جگہ کو پاک کرنا ہوگا۔</p><p style=""text-align:justify;""> اور ""آرگینک فرٹیلائزر اسپرے""  اگر پاک اشیاء سے بنتی ہے  تو کپڑ وں کو لگنے سے کپڑے ناپاک نہیں ہوں گے ، اور  اگر اس کو بھی جانوروں کے فضلات    سے تیار کیاجاتاہے تو  کپڑے ناپاک ہوں گے۔</p><p style=""text-align:justify;"">فتاوی شامی میں ہے:</p><p class=""indent"" style=""text-align:justify;""><span class=""ar_writing"">""اعلم أن العلة عند محمد هي التغير وانقلاب الحقيقة وأنه يفتى به للبلوى كما علم مما مر، ومقتضاه عدم اختصاص ذلك الحكم بالصابون، فيدخل فيه كل ما كان فيه تغير وانقلاب حقيقة وكان فيه بلوى عامة، فيقال: كذلك في الدبس المطبوخ إذا كان زبيبه متنجسا ولا سيما أن الفأر يدخله فيبول ويبعر فيه وقد يموت فيه..بخلاف نحو خمر صار خلا وحمار وقع في مملحة فصار ملحا، وكذا دردي خمر صار طرطيرا وعذرة صارت رمادا أو حمأة، فإن ذلك كله انقلاب حقيقة إلى حقيقة أخرى لا مجرد انقلاب وصف كما سيأتي .""</span></p><p class=""indent"" style=""text-align:left;""><span class=""ar_writing"">(کتاب الطھارۃ ،باب الانجاس،316/1،ط،دار الفکر)</span></p><p style=""text-align:justify;"">فتاوی ہندیہ میں ہے:</p><p class=""indent"" style=""text-align:justify;""><span class=""ar_writing"">""ولو كانت النجاسة رطبة فألقى عليها ثوبا وصلى إن كان ثوبا يمكن أن يجعل من عرضه ثوبا كالنهالي يجوز عند محمد وإن كان لا يمكن لا يجوز إن كانت يابسة جازت إذا كان يصلح ساترا. كذا في الخلاصة.""</span></p><p class=""indent"" style=""text-align:left;""><span class=""ar_writing"">(کتاب الطھارۃ، الفصل الثاني في طهارة ما يستر به العورة وغيره ،62/1،ط،دارالفکر)</span></p><p style=""text-align:justify;"">کفایت المفتی میں ہے:</p><p class=""indent"" style=""text-align:justify;"">""واضح ہو کہ انقلاب حقیقت سے مراد  یہ ہے کہ وہ شے فی نفسہ اپنی حقیقت چھوڑکر کسی دوسری حقیقت  میں متبدل ہوجائے  جیسے شراب سرکہ ہوجائے یا خون  مشک بن جائے  یانطفہ  گوشت  کالو تھڑا وغیرہ وغیرہ کہ ان صورتوں میں شراب نے فی نفسہ اپنی حقیقت  خمریہ اور خون  نے اپنی حقیقت  دمویہ اور نطفہ  نے  اپنی  حقیقت  منویہ چھوڑدی  اور دوسری حقیقتوں  میں متبدل ہوگئے  حقیقت بدل جانے کا حکم  اسی وقت  دیا جاسکتا ہے کہ حقیقت  اولی منقلبہ  کے آثار  مختصہ  اس میں باقی نہ رہیں جیسا کہ امثلہ  مذکورہ  میں پایا جاتاہے کہ  سرکہ بن جانے کے بعد شراب کے آثار مختصہ بالکل زائل ہوجاتے ہیں ۔</p><p class=""indent"" style=""text-align:justify;"">بعض آثار کازائل ہوجانا بوجہ قلت آثار کامحسوس نہ ہونا موجب انقلاب نہیں جیسا کہ فقہاء نے تصریح کی ہے کہ اگر آٹے میں کچھ  شراب ملاکر گوندھ لیا جائے اور روٹی پکالی جائے تووہ روٹی  ناپاک ہے ،یا گھڑے دوگھڑے پانی میں تولہ دو تولہ شراب یاپیشاب ملادیاجائے تووہ پانی ناپاک ہےحالانکہ  روٹی یاپانی میں اس قلیل المقدار شراب کاکوئی اثر محسوس نہ ہوگا  لیکن شراب نے ان صورتوں میں فی نفسہ  اپنی حقیقت  نہیں چھوڑی ہے اس لیے ناپاکی  کا حکم  باقی ہے..پس انقلاب عین کی وجہ سے تبدل احکام کاحکم کرتے وقت بہت غور واحتیاط سے کام لینا ضروری ہے کیوں کہ بسااوقات انقلاب و اختلاط میں اشتباہ  پیش آجاتاہے اور انقلاب کو اختلاط یا اختلاط کوانقلاب سمجھ  لیا جاتا ہے.""</p><p class=""indent"" style=""text-align:left;"">(کتاب الطھارۃ،چوتھا باب :صابون،334/2،ط، دار الاشاعت)</p><p class=""indent"" style=""text-align:left;"">فقط واللہ اعلم</p></p>",144512100881,banuri,"('طہارت', 'taharat')","('نجاست اور اس سے پاکی', 'najasat-aur-us-ki-paki')","('نجاست حقیقیہ، اقسام و احکام', 'najaasat-e-haqiqyah-aqsaam-o-ahkaam')"
20-05-2024,https://www.banuri.edu.pk/readquestion/kya-har-hokam-ma-walidan-ke-farmanbardari-zarori-ha-144511101043/20-05-2024,کیا ہر حکم میں والدین کی فرمانبرداری ضروری ہے؟,والدین نے باقی بہن بھائیوں کے کہنے پر مجھے ایک بات سے منع فرمایا ہے، جو میرے لئے فرمانبرداری بہت مشکل ہے،میں اپنے والدین کی ہر بات ماننے کی بہت کوشش کرتا ہوں ،لیکن یہ مجھ سے نہیں ہوگا، میں اس معاملے میں کیا کروں، میں اس کے علاوہ ان کی ہر بات ماننے کی کوشش کرتا ہوں ۔,"<p><p style=""text-align:justify;"">والدین نے جس کام سے منع کیا ہے اس کی نشاندہی ہو جانے کے بعد کوئی تسلی بخش جواب دیا جا سکتا ہے ،تاہم ’’امداد الفتاوی‘‘ کا مندرجہ ذیل اقتباس ملاحظہ کرنا آپ کے لیے مفید ہوسکتا ہے:</p><p class=""indent"" style=""text-align:justify;"">’’جو امر شرعا نہ واجب اور نہ ممنوع ہو بلکہ مباح ہو بلکہ خواہ مستحب ہی ہو، اور ماں باپ اس کے کرنے یا نہ کرنے کو کہیں، تو اس میں تفصیل ہے، دیکھنا چاہیے کہ اس امر کی اس شخص کو ایسی ضرورت ہے کہ بدون اس کے تکلیف ہوگی، مثلا غریب آدمی ہے، پاس پیسہ نہیں، بستی میں کوئی صورت کمائی کی نہیں، مگر ماں باپ نہیں جانے دیتے، یا یہ کہ اس شخص کو ایسی ضرورت نہیں، اگر اس درجہ کی ضرورت ہے تب تو اس میں ماں باپ کی اطاعت ضروری نہیں، اور اگر اس درجہ کی ضرورت نہیں تو پھر دیکھنا چاہیے کہ اس کام کے کرنے میں کوئی خطرہ و اندیشہ ہلاک یا مرض کا ہے یا نہیں، اور یہ بھی دیکھنا چاہیے کہ اس شخص کے اس کام میں مشغول ہو جانے سے ان کو بوجہ کوئی خادم اور سامان نہ ہونے کے خود ان کے تکلیف اٹھانے کا احتمال قوی ہے یا نہیں، پس اگر اس کام میں خطرہ ہے،یا اس کے غائب ہو جانے سے ان کو بوجہ بےسروسامانی تکلیف ہوگی تب ان کی مخالفت جائز نہیں، مثلا غیر واجب لڑائی میں جاتا ہے،یا سمندر کا سفر کرتا ہے، یا پھر کوئی ان کا کوئی خبر گیر نہ رہے گا، اور اس کے پاس اتنا مال نہیں جس سے انتظام خادم و نفقہ کافیہ کا کر جاوے، اور وہ کام یا سفر بھی ضروری نہیں تو اس حالت میں ان کی اطاعت واجب ہوگی، اور ان دونوں باتوں میں سے کوئی بات نہیں یعنی نہ اس کام یا سفر میں اس کو کوئی خطرہ ہے، اور نہ ان کی مشقت اور تکلیف ظاہری کا کوئی احتمال ہے تو بلا ضرورت بھی وہ کام یا سفر باوجود ان کی ممانعت کے جائز ہے، گو مستحب یہی ہے کہ اس وقت بھی اطاعت کرے۔‘‘</p><p class=""indent"" style=""text-align:left;"">(امداد الفتاوی، رسالہ تعدیل حقوق الوالدین ،ج:4،ص:485،484،ط:مکتبہ دارالعلوم کراچی)</p><p class=""indent"" style=""text-align:left;"">فقط واللہ اعلم</p></p>",144511101043,banuri,"('حقوق و آدابِ معاشرت', 'huqooq-muashret')","('حقوق', 'bahmi-huqooq')","('والدین کے حقوق', 'walidayn-k-huqoq')"
03-07-2024,https://www.banuri.edu.pk/readquestion/khas-taqreebat-me-emamam-bandhna-144512101394/03-07-2024,تقریبات، مجالس اور خاص دنوں میں پگڑی باندھنا کیسا ہے؟,تقریبات، مجالس اور خاص دنوں میں پگڑی باندھنا کیسا ہے؟,"<p><p style=""text-align:justify;"">پگڑی/ عمامہ باندھنا ،  نبی کریم صلی اللہ علیہ وسلم سے ثابت ہے  اور سننِ عادیہ میں سے ہے؛  لہذا عمامہ اگر خاص تقریبات میں بھی باندھا جائے تو شرعًا درست ہے،   البتہ اسے  لازم نہ سمجھے  اور محض ثقافت کی پیروی میں نہ ہو، بلکہ رسول اللہ ﷺ کی سنت کی اتباع کی نیت ہو۔   چند روایات ملاحظہ فرمائیے: </p><ul><li style=""text-align:justify;"">   حضرت عمرو بن حُریث  رضی اللہ عنہ کی روایت ہے کہ حضورِ  اکرم صلی اللہ علیہ وسلم  نے لوگوں کو خطبہ دیا تو آپ کے (سر کے) اوپرکالا عمامہ تھا۔ (   سنن ابو داؤد)</li><li style=""text-align:justify;"">    نبی اکرم صلی اللہ علیہ وسلم   نے فرمايا كه همارے اور مشركين كے درميان فرق ٹوپيوں  پر عمامے باندھنا ہے۔  (ترمذی)</li><li style=""text-align:justify;"">حضرت عبد الرحمن بن عوف رﷺی اللہ عنہ فرماتے ہیں کہ : رسول اللہ ﷺ نے مجھے عمامہ باندھا۔  (سنن ابوداؤد )</li></ul><p style=""text-align:justify;""> سنن ابوداؤد  میں ہے:</p><p class=""indent"" style=""text-align:justify;""><span class=""ar_writing"">عن جابر رضي الله عنه : أن رسول الله صلى الله عليه وسلم دخل يوم فتح مكة وعليه عمامة سوداء.</span></p><p class=""indent"" style=""text-align:justify;""><span class=""ar_writing"">عن أبي سعيد عمرو بن حريث رضي الله عنه قال: كأني أنظر إلى رسول الله صلى الله عليه وسلم وعليه عمامة سوداء، قد أرخى طرفيها بين كتفيه.</span></p><p class=""indent"" style=""text-align:left;""><span class=""ar_writing"">(</span>سنن أبي داود ،  كتاب اللباس باب في العمائم ، 4077 )</p><p class=""indent"" style=""text-align:justify;""><span class=""ar_writing"">و في الترمذی  عن ركانة: ” إنَّ فرقَ ما بيننا و بين المشركين العمائم على القلانِس.‘‘ (ص:  2777 ، جزء 7، سنن الترمذی، بیروت )</span></p><p class=""indent"" style=""text-align:justify;""><span class=""ar_writing"">4079- عن عبد الرحمن بن عوف، يقول: «عممني رسول الله صلى الله عليه وسلم، فسدلها بين يدي، ومن خلفي( سنن أبي داود، كتاب اللباس، باب في العمائم، حديث رقم: 4079 )</span></p><p class=""indent"" dir=""ltr"" style=""text-align:justify;"">فقط واللہ اعلم</p></p>",144512101394,banuri,"('علوم و فنون', 'uloom-funoon')","('حدیث و سنت', 'hadees-sunnat')","('مختلف سنتیں', 'mukhtalif-sunnaten')"
