issued_at,link,title,question,answer,fatwa_number,dar_ul_ifta,kitab,bab,fasal
15-11-2022,https://www.banuri.edu.pk/readquestion/bewi-ka-lailmi-ki-waja-sy-shohr-ko-hambistri-na-karny-deny-or-us-se-alag-siny-ka-hukam-144404101417/15-11-2022,بیوی کا لاعلمی کی وجہ سے شوہر کو ہم بستری نہ کرنے اور اس سے الگ سونے کا حکم,ایک عورت جو کہ اب بیوہ ہوچکی ہے، اسے معلوم نہیں تھا کہ جوانی کا وقت گزرنےکے بعد بھی ہم بستری کرسکتے ہیں، اور وہ جوانی کے بعدسے الگ کمرے میں سوتی رہی ہے، لہذا لاعلمی میں اس سے جو غلطی ہوئی ہےتوکیا اللّٰہ تعالیٰ معاف کردیں گے؟,"<p><p style=""text-align:justify;"">صورتِ مسئولہ میں اگر مذکورہ بیوہ عورت کو اس کے شوہر نےہم بستری، یا اپنے پاس سونے  کے لیے بلایا ہواورلاعلمی کی وجہ سے بلا عذرِ شرعی اس نے اپنے شوہر کوہمبستری پر قدرت نہ دی ہو،اور شوہر سے الگ سوتی رہی ہے،تو اس صورت میں یہ عورت گناہ گار ہے، لہذا اب غلطی کے احساس کے بعداللہ کے حضور اپنے اس فعل پر معافی مانگے اورمرحوم شوہر کے حق میں کثرت کے ساتھ دعا کرے تو امید ہے اللہ تعالیٰ معاف فرمادیں گے۔</p><p style=""text-align:justify;"">اور اگر شوہر نے جوانی کا وقت گزرنے کے بعد ہمبستری کرنے کا تقاضانہ کیا ہو،یا پھرشوہر کی جانب سے تقاضہ تو کیا گیا ہولیکن عورت نے کسی بیماری اور عذرِ شرعی کی بنیاد پر  ہمبستری کرنے کی اجازت نہ دی ہوتو اس صورت میں وہ گناہ گار نہیں ہو گی۔ </p><p style=""text-align:justify;"">مشکوٰۃ المصابیح میں ہے:</p><p class=""indent"" style=""text-align:justify;""><span class=""ar_writing"">""وعن أبي هريرة قال: قال رسول الله صلى الله عليه وسلم: «إذا دعا الرجل امرأته إلى فراشه فأبت فبات غضبان لعنتها الملائكة حتى تصبح.""</span></p><p class=""indent"" style=""text-align:left;""><span class=""ar_writing"">(باب عشرة النساء،ج:2، ص:280، ط:قدیمی)</span></p><p class=""indent"" style=""text-align:justify;"">""ترجمہ:حضرت ابو ہریرہ رضی اللہ عنہ سے روایت ہے کہ: نبی کریم صلی اللہ علیہ وسلم نے ارشاد فرمایا کہ:  جب کسی مرد نےاپنی بیوی کو جماع کی طرف بلایا اور اس نے انکار کیا اور شوہر نے رات غصے میں گزاری تو فرشتے صبح تک اس بیوی پر لعنت بھیجتے ہیں۔"" </p><p style=""text-align:justify;"">مرقاۃ المفاتیح میں ہے:</p><p class=""indent"" style=""text-align:justify;""><span class=""ar_writing"">""(لعنتها الملائكة) : لأنها كانت مأمورة إلى طاعة زوجها في غير معصية قيل: والحيض ليس بعذر في الامتناع لأن له حقا في الاستمتاع بما فوق الإزار عند الجمهور.""</span></p><p class=""indent"" style=""text-align:left;""><span class=""ar_writing"">(باب عشرۃ النساء،ج:2، ص:2121، ط:دارالفكر)</span></p><p style=""text-align:justify;"">فتاوی شامی میں ہے:</p><p class=""indent"" style=""text-align:justify;""><span class=""ar_writing"">""وحقه عليها أن تطيعه ‌في ‌كل ‌مباح يأمرها به.</span></p><p class=""indent"" style=""text-align:justify;""><span class=""ar_writing"">(قوله ‌في ‌كل ‌مباح) ظاهره أنه عند الأمر به منه يكون واجبا عليها كأمر السلطان الرعية به.""</span></p><p class=""indent"" style=""text-align:left;""><span class=""ar_writing"">(كتاب النكاح، باب القسم في الزوجات، ج:3، ص:208، ط:سعيد)</span></p><p style=""text-align:justify;"">الموسوعۃ الفقہیۃ الکویتیۃ میں ہے:</p><p class=""indent"" style=""text-align:justify;""><span class=""ar_writing"">""من ‌حق ‌الزوج ‌على ‌زوجته أن تمكنه من الإستمتاع بها، فإذا كانت مطيقة للجماع وتسلمت معجل صداقها وطلب الزوج تسلمها وجب تسليمها إليه وتمكينه من الإستمتاع بها.""</span></p><p class=""indent"" style=""text-align:left;""><span class=""ar_writing"">(كتاب النكاح، باب آثار النكاح الصحيح،فصل الحقوق المشتركة بين الزوجين،ج:41، ص:310، ط:طبع الوزارة)</span></p><p style=""text-align:justify;"">مرقاۃ المفاتیح میں ہے:</p><p class=""indent"" style=""text-align:justify;""><span class=""ar_writing"">""(وعن أنس - رضي الله عنه - قال: قال رسول الله - صلى الله عليه وسلم - إن العبد ليموت والداه أو أحدهما وإنه لهما) أي: لأجلهما الصادق لهما، أو لأحدهما (لعاق) ، اللام فيه للتأكيد ولهما متعلق بعاق قدم عليه للاختصاص (فلا يزال) أي: العاق في حياتهما التائب بعد موتها (يدعو لهما) أي: بالرحمة ونحوها (ويستغفر لهما) أي: لذنوبهما (حتى يكتبه الله) أي: في ديوان عمله بأمر الحفظة (بارا) ، فإن الحسنات يذهبن السيئات، والتائب من الذنب كمن لا ذنب له، وإنما قيدنا بالتوبة، فإن العقوق من حقوق الله أيضا، فلا بد منها حتى يصير بارا.""</span></p><p class=""indent"" style=""text-align:left;""><span class=""ar_writing"">(كتاب الآداب ، باب البر والصلة،ج:7، ص:3097،ط:دارالفكر)</span></p><p style=""text-align:justify;"">فتاوی شامی میں ہے:</p><p class=""indent"" style=""text-align:justify;""><span class=""ar_writing"">""قال العلامي في فصوله: من فرائض الإسلام تعلمه ما يحتاج إليه العبد في إقامة دينه وإخلاص عمله لله تعالى ومعاشرة عباده. وفرض على كل مكلف ومكلفة بعد تعلمه علم الدين والهداية تعلم علم الوضوء والغسل والصلاة والصوم، وعلم الزكاة لمن له نصاب، والحج لمن وجب عليه والبيوع على التجار ليحترزوا عن الشبهات والمكروهات في سائر المعاملات. وكذا أهل الحرف، وكل من اشتغل بشيء يفرض عليه علمه وحكمه ليمتنع عن الحرام فيه.""</span></p><p class=""indent"" style=""text-align:left;""><span class=""ar_writing"">(مقدمة، ج:1، ص:42، ط:سعيد)</span></p><p style=""text-align:justify;"">البحرالرائق میں ہے:</p><p class=""indent"" style=""text-align:justify;""><span class=""ar_writing"">""‌الجهل ‌بالأحكام في دار الإسلام ليس بمعتبر.""</span></p><p class=""indent"" style=""text-align:left;""><span class=""ar_writing"">(كتاب الصوم،اقسام الصوم، ج:2، ص:282، ط:دارالفكر)</span></p><p class=""indent"" style=""text-align:left;""><span class=""ar_writing"">فقط والله اعلم</span></p></p>",144404101417,banuri,"('حقوق و آدابِ معاشرت', 'huqooq-muashret')","('حقوق', 'bahmi-huqooq')","('میاں ، بیوی کے حقوق', 'mian-biwi-k-huqooq')"
15-11-2022,https://www.banuri.edu.pk/readquestion/khwab-mein-allah-rabulezat-ka-dedar-krna-ur-us-ko-beyan-kene-ka-hukum-144404101424/15-11-2022,خواب میں اللہ رب العزت کا دیدار کرنا اور اس کو بیان کرنے کاحکم,اللہ تعالی کو خواب میں دیکھنا اور بات کرنا کیسا ہے، اگر آپ نے اللہ سے بات کی ہے تو کیا کسی کو وہ خواب سنانا چاہئے یا نہیں؟ اگر نہیں تو لا علمی میں سنا دینا کچھ غلط ہوگا؟,"<p><p style=""text-align:justify;"">اہل سنت والجماعت کے نزدیک خواب میں اللہ تعالیٰ کی زیارت ممکن ہے اورخواب میں باری تعالیٰ کی زیارت بکثرت بزرگان دین  سے ثابت بھی ہے، امام اعظم ابوحنیفہ ؒ  نے ننانوے مرتبہ خواب میں اللہ تعالیٰ کی زیارت کی، البتہ یہ زیارت جاگنے کی حالت میں  آنکھوں سے نہیں ہوتی، بلکہ قلبی طورپرایک نوع کامشاہدہ ہوتاہے اس لیے کہ دنیامیں اس آنکھ سے اللہ تعالیٰ کونہیں دیکھاجاسکتا، باقی  ایسے خواب کو بیان کرنے کوئی حرج نہیں ہے۔</p><p style=""text-align:justify;"">شرح العقیدہ  الطحاویہ میں ہے:</p><p class=""indent"" style=""text-align:justify;""><span class=""ar_writing"">""أن الرؤية بالعين ممتنعة في الدنيا، أما رؤية الفؤاد فإنها حصلت للنبي صلى الله عليه وسلم، وكذلك ‌الرؤية ‌في ‌المنام فقد حصلت له صلى الله عليه وعلى آله سلم.""</span></p><p class=""indent"" style=""text-align:left;""><span class=""ar_writing"">(الإعتقاد في رؤية الله جل وعلا،ج:8،ص:4،ط:الشبکة الإسلامية)</span></p><p style=""text-align:justify;"">روح البیان میں ہے:</p><p class=""indent"" style=""text-align:justify;""><span class=""ar_writing"">""ان ‌الرؤية ‌فى ‌المنام نوع مشاهدة يكون بالقلب دون العين.""</span></p><p class=""indent"" style=""text-align:left;""><span class=""ar_writing"">(سورة انعام اية 103،ج:3،ص:80،ط:دارالفكر)</span></p><p style=""text-align:justify;"">فتاوی شامی میں ہے:</p><p class=""indent"" style=""text-align:justify;""><span class=""ar_writing"">""( قوله : ولها ) أي لرؤيته ربه تعالى في المنام قصة مشهورة ذكرها الحافظ النجم الغيطي .</span></p><p class=""indent"" style=""text-align:justify;""><span class=""ar_writing"">وهي أن الإمام رضي الله عنه قال : رأيت رب العزة في المنام تسعا وتسعين مرة فقلت في نفسي إن رأيته تمام المائة لأسألنه : بم ينجو الخلائق من عذابه يوم القيامة؟</span></p><p class=""indent"" style=""text-align:left;""><span class=""ar_writing"">(مقدمة،ج:1،ص:51،ط:سعيد)</span></p><p class=""indent"" style=""text-align:left;""><span class=""ar_writing"">فقط والله اعلم</span></p></p>",144404101424,banuri,"('ایمان و عقائد', 'aqaed')","('اسلامی عقائد', 'islami-aqaed')","('ذات و صفات و اسماء باری تعالیٰ', 'zat-o-sifat-0-asmae-bari-taala')"
15-11-2022,https://www.banuri.edu.pk/readquestion/mard-kelye-sona-chandi-ke-zewrat-ka-hukam-144404101457/15-11-2022,مرد کے لیے سونا چاندی کے زیورات کا حکم,سوال یہ ہے کہ مردوں کے لیے سونا ،چاندی وغیرہ کے زیورات استعمال کرنا کیسا ہے؟,"<p><p style=""text-align:justify;"">واضح رہے کہ مرد کےلیے  سونا ،چاندی کےکسی بھی قسم کے زیورات استعمال کرنا شرعاً جائز نہیں ،مرد صرف چاندی کی انگوٹھی استعمال کرسکتا ہے اور ایک مثقال  سے کم  وزن چاندی کی انگوٹھی مردوں کے لیے حلال اور جائز ہے۔ایک مثقال  ساڑھے چار ماشے  یعنی۴گرام،۳۷۴ملی گرام (4.374 gm) ہوتا ہے۔ </p><p style=""text-align:justify;"">فتاوی شامی میں ہے :</p><p class=""indent"" style=""text-align:justify;""><span class=""ar_writing"">""(ولا يتحلى) الرجل (بذهب وفضة)  مطلقاً (إلا بخاتم ومنطقة وجلية سيف منها) أي الفضة ۔۔۔ (ولا يتختم) إلا بالفضة؛ لحصول الاستغناء بها، فيحرم (بغيرها كحجر) ۔۔۔ ولا يزيده على مثقال۔</span></p><p class=""indent"" style=""text-align:justify;""><span class=""ar_writing""> (قوله: ولا يتختم إلا بالفضة) هذه عبارة الإمام محمد في الجامع الصغير، أي بخلاف المنطقة، فلا يكره فيها حلقة حديد ونحاس كما قدمه، وهل حلية السيف كذلك؟ يراجع! قال الزيلعي: وقد وردت آثار في جواز التختم بالفضة وكان للنبي صلى الله تعالى عليه وسلم خاتم فضة، وكان في يده الكريمة، حتى توفي صلى الله تعالى عليه وسلم ، ثم في يد أبي بكر رضي الله تعالى عنه إلى أن توفي، ثم في يد عمر رضي الله تعالى عنه إلى أن توفي، ثم في يد عثمان رضي الله تعالى عنه إلى أن وقع من يده في البئر، فأنفق مالاً عظيماً في طلبه فلم يجده، ووقع الخلاف فيما بينهم والتشويش من ذلك الوقت إلى أن استشهد رضي الله تعالى عنه. (قوله: فيحرم بغيرها إلخ)؛ لما روى الطحاوي بإسناده إلى عمران بن حصين وأبي هريرة قال: «نهى رسول الله صلى الله تعالى عليه وسلم عن خاتم الذهب» ، وروى صاحب السنن بإسناده إلى عبد الله بن بريدة عن أبيه: «أن رجلاً جاء إلى النبي صلى الله تعالى عليه وسلم وعليه خاتم من شبه، فقال له: مالي أجد منك ريح الأصنام! فطرحه، ثم جاء وعليه خاتم من حديد، فقال: مالي أجد عليك حلية أهل النار! فطرحه، فقال: يا رسول الله من أي شيء أتخذه؟ قال: اتخذه من ورق ولا تتمه مثقالاً»۔ "" فعلم أن التختم بالذهب والحديد والصفر حرام ؛ فألحق اليشب بذلك؛ لأنه قد يتخذ منه الأصنام ، فأشبه الشبه الذي هو منصوص معلوم بالنص، إتقاني، والشبه محركاً: النحاس الأصفر، قاموس۔ وفي الجوهرة: والتختم بالحديد والصفر والنحاس والرصاص مكروه للرجل والنساء ۔۔۔ (قوله: ولا يزيده على مثقال)، وقيل: لا يبلغ به المثقال، ذخيرة. أقول: ويؤيده نص الحديث السابق من قوله عليه الصلاة والسلام : «ولا تتممه مثقالاً.""</span></p><p class=""indent"" style=""text-align:left;"">(کتاب الحظر والاباحۃ،فصل فی اللبس،ج؛6،ص:358،سعید)</p><p class=""indent"" style=""text-align:left;"">فقط واللہ اعلم</p></p>",144404101457,banuri,"('حظر و اباحت', 'mamnooaat-mubahat')","('زیب و زینت', 'zayb-o-zeenat')","('سونا چاندی کے زیورات', 'sona-chandy-ke-zewraat')"
15-11-2022,https://www.banuri.edu.pk/readquestion/namaz-main-gir-janay-ki-waja-say-namaz-ka-hukm-144404101474/15-11-2022,نماز میں گرجانے کی وجہ سے نماز کا حکم,اگر عورت نماز میں رکوع کرتے ہوئے گر گئی ،تو اس کی نماز کا کیا حکم ہے، ٹوٹ جائے گی؟,"<p><p style=""text-align:justify;"">واضح رہے کہ نماز میں قبلہ رخ ہونا شرط ہے،لہٰذا صورتِ مسئولہ میں اگر نماز  کے دوران گرنے کی وجہ سے نمازی کا سینہ قبلہ کے رخ سے مڑ گیا تو اس کی نماز فاسد ہوجائے گی،اور اگر گرجانے کی وجہ سے اس کا سینہ قبلہ کے رخ سے نہیں  مڑا ہے تو ایسی صورت میں نماز ہوجاتی ہے۔</p><p style=""text-align:justify;"">فتاویٰ عالمگیری میں ہے:</p><p class=""indent"" style=""text-align:justify;""><span class=""ar_writing"">""لا يجوز لأحد أداء فريضة ولا نافلة ولا سجدة تلاوة ولا صلاة جنازة إلا متوجها إلى القبلة. كذا في السراج الوهاج"".</span></p><p class=""indent"" style=""text-align:left;""><span class=""ar_writing"">‌‌(كتاب الصلاة،الفصل الثالث في استقبال القبلة(،ج:1،ص:63،ط:رشيديه)</span></p><p class=""indent"" style=""text-align:left;""><span class=""ar_writing"">فقط واللہ اعلم</span></p></p>",144404101474,banuri,"('نماز', 'salat')","('نماز کی شرائط', 'namaz-ki-sharait')","('استقبال قبلہ', 'istiqbaal-e-qibla')"
15-11-2022,https://www.banuri.edu.pk/readquestion/bachy-ke-kaan-me-azaan-takheer-se-dena-144404101476/15-11-2022,بچے کے کان میں تاخیر سے اذان دینا,بچے کی ولادت کے بعد اگر ازان دینا یاد نہ رہا اور اذان دینے میں تاخیر ہو جائے تو اس کا کوئی مسئلہ تو نہیں ہے کوئی کفارہ تو نہیں دینا ہو گا؟,"<p><p style=""text-align:justify;"">نومود کے کان میں اذان دینا سنت ہے، یہ عمل نبی کریم صلی اللہ علیہ وسلم سے ثابت ہے، اس بارے میں قولی وفعلی دونوں طرح کی احادیثِ مبارکہ موجودہیں۔ ترمذی شریف کی روایت میں ہے:</p><p style=""text-align:justify;"">''حضرت عبیداللہ بن ابی رافع اپنے والد سے نقل کرتے ہیں کہ میں نے رسول اللہ صلی اللہ علیہ وسلم کو حسن بن علی کی ولادت کے وقت ان کے کان میں اذان دیتے ہوئے دیکھا جس طرح نماز میں اذان دی جاتی ہے'', مسند ابویعلی موصلی میں حضرت حسین رضی اللہ تعالیٰ عنہ نے بطریقِ مرفوع (یعنی آں حضرت صلی اللہ علیہ وسلم کا ارشاد) نقل کیا ہے کہ   ""جس شخص کے ہاں بچہ پیدا ہو اور وہ اس کے دائیں کان میں اذان دے اور بائیں کان میں تکبیر کہے، تو اس کو ""ام الصبیان"" (سوکڑہ کی بیماری)سے ضرر نہیں پہنچے گا۔""اس حدیث سے معلوم ہوا کہ بچہ کی پیدائش کے بعد اس کے کان میں اذان دینا سنت ہے۔ البتہ اگر کسی وجہ سے پیدائش کے فوراً بعد بچے کے کان میں اذان نہ دی جاسکی تو بعد میں بھی اذان دے دینی چاہیے، چاہے جتنے دن گزر گئے ہوں؛ بچے کے کان میں اذان دینے کے لیے شریعت میں کوئی ایسا وقت مقرر نہیں ہے جس کے گزرنے سے اذان دینا فوت ہوجائے،اور نہ ہی تاخیر کی بنیاد پر کوئی کفارہ ادا کرنا لازم ہے، لیکن بہرحال بلا وجہ تاخیر نہیں کرنی چاہیے.</p><p style=""text-align:justify;"">مرقاة المفاتيح شرح مشكاة المصابيح میں ہے:</p><p class=""indent"" style=""text-align:justify;""><span class=""ar_writing"">""وعن أبي رافع - رضي الله عنه - قال: «رأيت رسول الله صلى الله عليه وسلم أذن في أذن الحسن بن علي - رضي الله عنهما - حين ولدته فاطمة بالصلاة» . رواه الترمذي، وأبو داود. وقال الترمذي: هذا حديث حسن صحيح.</span></p><p class=""indent"" style=""text-align:justify;""><span class=""ar_writing"">(وعن أبي رافع - رضي الله عنه -) أي مولى النبي صلى الله عليه وسلم قال: «رأيت رسول الله صلى الله عليه وسلم أذن في أذن الحسن بن علي» ) بضم الذال ويسكن (حين ولدته فاطمة) : يحتمل السابع وقبله (بالصلاة) . أي بأذانها وهو متعلق بأذن، والمعنى أذن بمثل أذان الصلاة وهذا يدل على سنية الأذان في أذن المولود وفي شرح السنة: روي أن عمر بن عبد العزيز - رضي الله عنه - كان يؤذن في اليمنى ويقيم في اليسرى إذا ولد الصبي. قلت: قد جاء في مسند أبي يعلى الموصلي، عن الحسين - رضي الله عنه - مرفوعا: «من ولد له ولد فأذن في أذنه اليمنى وأقام في أذنه اليسرى لم تضره أم الصبيان» "" كذا في الجامع الصغير للسيوطي رحمه الله. قال النووي في الروضة: ويستحب أن يقول في أذنه "" {وإني أعيذها بك وذريتها من الشيطان الرجيم} [آل عمران: 36] "" قال الطيبي ولعل مناسبة الآية بالأذان أن الأذان أيضا يطرد الشيطان لقوله صلى الله عليه وسلم: ""«إذا نودي للصلاة أدبر الشيطان له ضراط حتى لايسمع التأذين» "" وذكر الأذان والتسمية في باب العقيقة وارد على سبيل الاستطراد اهـ. والأظهر أن حكمة الأذان في الأذن أنه يطرق سمعه أول وهلة ذكر الله تعالى على وجه الدعاء إلى الإيمان والصلاة التي هي أم الأركان (رواه الترمذي، وأبو داود، وقال الترمذي: هذا حديث حسن صحيح)"".</span></p><p class=""indent"" style=""text-align:left;"">(کتاب الصید والذبائح، باب العقيقة، ج:7 / ص:2697، ط: دار الفکر)</p><p style=""text-align:justify;"">تقریرات رافعی علی رد المحتار میں ہے:</p><p class=""indent"" style=""text-align:justify;""><span class=""ar_writing"">""قال السندي: فیرفع المولود عند الولادة على یدیه مستقبل القبلة و یؤذ ن في أذنه الیمنیٰ و یقیم في الیسریٰ و یلتفت فیهما بالصلاة لجهة الیمین و بالفلاح لجهة الیسار.""</span></p><p class=""indent"" style=""text-align:left;""><span class=""ar_writing"">(تقریرات الرافعي الملحقة بالفتاویٰ الشامیة ، ج:1 / ص:45 ط: سعید)</span></p><p class=""indent"" style=""text-align:left;"">فقط واللہ اعلم</p></p>",144404101476,banuri,"('حقوق و آدابِ معاشرت', 'huqooq-muashret')","('حقوق', 'bahmi-huqooq')","('اولاد کے حقوق', 'olad-ky-hoqoq')"
16-11-2022,https://www.banuri.edu.pk/readquestion/ghazwa-badar-se-rh-jany-waly-shaba-144404101504/16-11-2022,حضرت رقیہ رضی اللہ عنہا کی تیمارداری کے لئے غزوہ بدر سے رہ جانے والے صحابہ,وہ کون سے  صحابی تھے جو جنگ بدر میں شریک نہ ہوئےتھے، بلکہ سیدہ رقیہ کو دفن کر رہے تھے؟,"<p><p style=""text-align:justify;"">جب حضرتِ رقیہ رضی اللہ عنہا بیمارتھی، تو حضورِ اکرم صلی اللہ علیہ وسلم نے ان کی تیمارداری  کےلیے ان کے شوہر حضرت عثمان رضی اللہ عنہ  اور حضرت اسامہ بن زید رضی اللہ عنہ کو رہنے کا فرمایاتھا۔</p><p style=""text-align:justify;"">التاريخ الصغير الأوسط لمحمد البخاري میں ہے:</p><p class=""indent"" style=""text-align:justify;""><span class=""ar_writing"">""حدثني عبيد ثنا أبو أسامة عن هشام عن أبيه عن عائشة خرج النبي صلى الله عليه وسلم إلى بدر وخلف عثمان على ابنة رسول الله صلى الله عليه وسلم وكانت مريضة وتخلف معه أسامة بن زيد فماتت ليلا فغدوا بها فدفنوها فسمعوا لجة التكبير فأرسل عثمان أسامة فإذا هو بأبيه زيد جاء بشير على ناقة النبي صلى الله عليه وسلم فما صدقوا حتى رأوهم أتي بهم"".</span></p><p class=""indent"" style=""text-align:left;""><span class=""ar_writing"">(حديث رقية بنت رسول الله صلى الله عليه و سلم وموتها، ج:1، ص:54، ط:دارالوعی)</span></p><p class=""indent"" style=""text-align:left;""><span class=""ar_writing"">فقط واللہ اعلم</span></p></p>",144404101504,banuri,"('ایمان و عقائد', 'aqaed')","('اسلامی عقائد', 'islami-aqaed')","('صحابہ کرام اور تابعین رضوان اللہ علیہم', 'sahaba-kiram-ridhwan-ullahi-alayhim-ajmaeen')"
