issued_at,link,title,question,answer,fatwa_number,dar_ul_ifta,kitab,bab,fasal
13-11-2022,https://www.banuri.edu.pk/readquestion/bai-or-mushtarai-me-se-kis-se-cameshon-liya-jae-144404101222/13-11-2022,بائع اور مشتری میں سے کس سے کمیشن لیا جائے؟,کمیشن لینے کے بارے میں کیا حکم ہے؟ آیا بائع اور مشتری دونوں سے لینا جائز ہے یا کسی ایک سے؟,"<p><p style=""text-align:justify;"">واضح رہے كہ  ایجنٹ یعنی دلال اگربائع اور مشتری میں سے کسی کاوکیل نہیں  ہے، اور اس نے بائع  اور مشتری کو آپس میں ملایا اور   ان کے درمیان  واسطے کا کردار ادا کیا، باقی معاملہ  (عقد) بائع اور مشتری نے  آپس میں خود کیا تو ایجنٹ کے لیے بائع اور مشتری دونوں  سے (یعنی جانبین سے) رابطہ کرانے کا متعینہ کمیشن لینا جائز ہے، تاہم اگر ایجنٹ  ان دونوں میں سے کسی ایک کی طرف سے وکیل بن کر معاملہ کرتا ہے تو   پھر جس کی  جانب سے وکیل ہے  صرف اسی سےکمیشن لینا جائز ہے،  دوسرے  سے  کمیشن  لینا جائز نہیں ہے،  کیوں کہ اگر سامان بائع خود نہ بیچے، بلکہ کمیشن ایجنٹ اس کی طرف سے وکیل بن کر سامان فروخت کرے تو ایسی صورت میں کمیشن ایجنٹ ""عاقد""  بن  جائے گا، اور عاقد  اس شخص  سے کمیشن نہیں لے سکتا جس سے وہ عقد کررہا ہو، کیوں کہ وہ اس کو کوئی اضافی خدمت فراہم نہیں کررہا، صرف سامان بیچ رہا ہے، لہٰذا اس صورت میں وہ مشتری سے صرف سامان کی قیمت وصول کرنے کا حق دار ہے، کمیشن کا حق دار نہیں۔</p><p style=""text-align:justify;"">فتاوی شامی میں ہے:</p><p class=""indent"" style=""text-align:justify;""><span class=""ar_writing"">""وأما الدلال فإن باع العين بنفسه بإذن ربها فأجرته على البائع وإن سعى بينهما وباع المالك بنفسه يعتبر العرف وتمامه في شرح الوهبانية.</span></p><p class=""indent"" style=""text-align:justify;""><span class=""ar_writing"">(قوله: فأجرته على البائع) وليس له أخذ شيء من المشتري؛ لأنه هو العاقد حقيقة شرح الوهبانية وظاهره أنه لا يعتبر العرف هنا؛ لأنه لا وجه له. (قوله: يعتبر العرف) فتجب الدلالة على البائع أو المشتري أو عليهما بحسب العرف جامع الفصولين."" </span></p><p class=""indent"" dir=""rtl"" style=""text-align:left;""><span class=""ar_writing"">(كتاب البيوع، فروع فى البيع، ج:4، ص:560، ط:سعيد)</span></p><p class=""indent"" dir=""rtl"" style=""text-align:left;""><span class=""ar_writing"">فقط والله أعلم</span></p></p>",144404101222,banuri,"('اجارہ', 'ijaarah')","('بروکری و دلالی', 'brokery-o-dalaaly')","('کمیشن ایجنٹ کے احکام', 'commission-agent-ke-ahkaam')"
13-11-2022,https://www.banuri.edu.pk/readquestion/mezaan-benk-mian-seweng-akaount-kholne-ka-hukum-144404101234/13-11-2022,میزان بینک میں سیونگ اکاؤنٹ کھولنے کا حکم,میزان یا ایسی دوسری بینک جن کو اسلامی بینک کہا جاتا ہے ، کیا ان میں سیونگ اکاؤنٹ کھول سکتے ہیں ، یہ سود ہوگا یا منافع ؟,"<p><p style=""text-align:justify;"">میزان بینک سمیت فی زمانہ تمام مروجہ اسلامی بینکنگ  کے  معاملات مکمل شرعی اصولوں کے مطابق نہیں ہیں، اور مروجہ غیر سودی بینک اور  روایتی بینک کےبہت سے  معاملات درحقیقت ایک جیسے ہیں؛ لہذا روایتی بینک کے جو معاملات ناجائز ہیں، (مثلاً:  سیونگ اکاونٹ وغیرہ) مروجہ اسلامی بینک  کے بھی وہ معاملات ناجائز ہیں اور جو  حیلے ان معاملات کو جواز کے دائرے میں لانے کے لیے اختیار کیے گئے ہیں،شرعی اور فقہی  اصولوں کی نظرمیں جائزنہیں ہے؛  لہذا مذکورہ مروجہ  اسلامی بینکوں میں سیونگ اکاؤنٹ کھلوانا یاان کے ساتھ کسی اورقسم کے کاروباری اورتمویلی معاملہ کرناجائزنہیں۔</p><p style=""text-align:justify;"">مزیدتفصیل کے لیے دیکھیے: مروجہ اسلامی بینکاری از رفقائے دارالافتاء جامعہ علوم اسلامیہ بنوری ٹاؤن ، مطبوعہ مکتبہ بینات۔</p><p class=""indent"" style=""text-align:left;"">فقط واللہ اعلم</p></p>",144404101234,banuri,"('معاملات', 'muamlat')","('سود / بینکاری / انشورنس / شیئرز', 'sood-bankari-insurance-shares')","('اسلامی بینکاری', 'islami-bankari')"
13-11-2022,https://www.banuri.edu.pk/readquestion/kan-men-pani-jany-sy-bimari-barhny-ka-andisha-ho-tu-ghusal-kisy-karen-144404101241/13-11-2022,کان میں پانی جانے سے بیماری بڑھنے کا اندیشہ ہو تو غسل کیسے کریں؟,میرے کان میں پانی کے وجہ سے بار بار انفیکشن ہوتا ہے، جس سے بیماری بڑھنے کا خطرہ ہے تو میرا سوال یہ ہے کہ حالتِ حیض اور جنابت میں وضو اور غسل کیسے کروں؟ کیوں کہ کان  کے اندرونی حصہ میں ذرا سا بھی پانی جانے سے پھر سے انفیکشن ہو جاتا ہے ۔,"<p><p style=""text-align:justify;"">صورتِ مسئولہ اگر  کان کے اندرونی حصہ  میں پانی پہنچنے سے مرض بڑھنے کا اندیشہ ہو تو  غسل کرتے وقت کان میں کوئی روئی وغیرہ رکھ کرغسل کیا جائے، پھر تر روئی سے اندرونی حصہ کو گیلا کردیا جائے۔</p><p style=""text-align:justify;"">فتاوٰی ہندیہ  میں ہے:</p><p class=""indent"" style=""text-align:justify;""><span class=""ar_writing"">""فإن كان الأكثر صحيحا والأقل جريحا يغسل الصحيح ويمسح على الجريح إن أمكنه وإن لم يمكنه المسح يمسح على الجبائر أو فوق الخرقة ولا يجمع بين الغسل والتيمم.""</span></p><p class=""indent"" style=""text-align:left;""><span class=""ar_writing"">(كتاب الطهارة، الباب الرابع في التیمم، الفصل الأول في أمور لابد منها في التيمم، 260/1، ط: رشيدية)</span></p><p class=""indent"" style=""text-align:left;"">فقط واللہ اعلم</p></p>",144404101241,banuri,"('طہارت', 'taharat')","('شرعی معذورین کے احکام', 'sharee-mazoreen-k-ahkam')","('معذورین کے احکام', 'ma-zoron-k-ahkam')"
13-11-2022,https://www.banuri.edu.pk/readquestion/nam-144404101302/13-11-2022,کیا میں اپنے بیٹے کا نام محمد افلح رکھ سکتی ہوں؟,کیا میں اپنے بیٹے کا نام محمد افلح رکھ سکتی ہوں ایک حدیث میں آج پڑھا کہ نبی پاک نے افلح نام رکھنے سےمنع فرمایا ہے؟,"<p><p style=""text-align:justify;"">  ""محمد""  کا معنی ہے :تعریف کیا ہوااور""افلح""كا  معنی ہے :كامياب ہوا،صورت مسئولہ میں محمد نام رکھنا درست ہے ،البتہ حدیث میں""افلح"" نام رکھنے سے  منع کیاگیاہے اورشراح حدیث نے وجہ یہ بیان کی ہےکہ بعض مرتبہ یہ بدفالی کا سبب بنتاہے مثال کے طورپراگر کسی شخص نے افلح نام رکھااورکسی وقت گھر والوں سے پوچھا کہ یہاں افلح ہے ؟ گھروالوں نے جواب دیا کہ گھر میں افلح  نہیں ہے تو اگر چہ اس صورت میں متعین ذات مراد ہوگی مگر لفظ افلح  کے حقیقی  معنی کے اعتبارسے مفہوم  یہ ہوگاکہ گھر میں کامیابی اورنجات  نہیں  ہے اوراس طرح کہنا برائی کی بات ہےلہذا بہتریہ ہے  کہ افلح نام کی جگہ کوئی دوسرااچھانام رکھاجائے۔</p><p style=""text-align:justify;"">نیزہماری ویب سائٹ پر اسلامی ناموں کے سیکشن میں بچوں اور بچیوں کے بہت سے منتخب اسلامی نام موجود ہیں، جنس اور حرف منتخب کرکے نام کا انتخاب کرسکتے ہیں۔</p><p style=""text-align:justify;"">مشكاة شريف ميں ہے:</p><p class=""indent"" style=""text-align:justify;""><span class=""ar_writing"">""وعن سمرة بن جندب قال: قال رسول الله صلى الله عليه وسلم: "" لا تسمين غلاما يسارا ولا رباحا ولانجيحا ولا ‌أفلح فإنك تقول: أثم هو؟ فلا يكون فيقول لا "" رواه مسلم. وفي رواية له قال: لا تسم غلاما رباحا ولا يسارا ولا ‌أفلح ولا نافعا.""</span></p><p class=""indent"" style=""text-align:left;""><span class=""ar_writing"">(الفصل الأول،ج:3،ص:1344،رقم الحديث:4753،ط:المكتب الإسلامي،بيروت)</span></p><p style=""text-align:justify;"">مظاہر حق میں ہے:</p><p class=""indent"" style=""text-align:justify;"">ترجمہ:""اورحضرت سمرہ ابن جندب رضی اللہ عنہ کہتے ہیں کہ رسول کریم صلی اللہ علیہ وسلم نے فرمایااپنے غلام کا نام یسار،رباح،نجیح اورافلح نہ رکھو کیوں کہ اگر کسی وقت تم نے کسی شخص سے پوچھاکہ کیا وہ ( مثلاً)یساریا رباح یہاں ہے اور( فرض کرو) وہ وہاں نہ ہوا تو جواب دینے والا کہے گا کہ وہ ( یعنی یسار یا رباح ) یہاں نہیں ہے ،اورمسلم ہی کی ایک اور روایت میں میں یوں ہے کہ آپ صلی اللہ علیہ وسلم نے فرمایااپنے غلام کا نام،رباح یسار،افلح اورنافع نہ رکھو""۔</p><p class=""indent"" style=""text-align:justify;"">تشریح:یسار ،یسر سے ہے جس کے معنی فراخی اورتونگری کے ہیں ،رباح،ربح سے ہے جس کے معنی فائدہ اورنفع کے ہیں،نجیح  ،نجح سے ہے  جس کے معنی فتحمندی یامطلب یابی کے ہیں،افلح ،فلاح سے ہے جس کے معنی کامیابی اورنجات کے ہیں ، اور نافع نفع سے ہے جس کے معنی فائدہ کے ہیں ۔</p><p class=""indent"" style=""text-align:justify;"">حدیث کا مطلب یہ ہے : کہ اس طرح کے نام رکھنے ممنوع ہیں کیو نکہ  مثال کے طورپراگر کسی شخص نے یسار نام رکھااورکسی وقت گھر والوں سے پوچھا کہ یہاں یسارہے ؟ گھروالوں نے جواب دیا کہ گھر میں یسار نہیں ہے تو اگر چہ اس صورت میں متعین ذات مراد ہوگی مگر لفظ یسار کے حقیقی  معنی کے اعتبارسے مفہوم  یہ ہوگاکہ گھر میں فراخی وتونگی  نہیں  ہے اوراس طرح کہنا برائی کی بات ہے اس پر دوسرے مذکورہ  بالاالفاظ کو بھی قیاس کیاجاسکتا ہے ۔</p><p class=""indent"" style=""text-align:justify;"">مسلم کی دوسری  روایت میں  نجیح  کے بجائے نافع کا ذکر ہے اس سے معلوم ہوا کہ مذکورہ ممانعت کا تعلق محض انہی  ناموں سے نہیں ہے بلکہ اوردوسرے نام بھی جو ان الفاظ کے معنی  میں ہوں، یہی حکم رکھتے ہیں ۔</p><p class=""indent"" style=""text-align:justify;"">امام نووی -رح-فرماتے ہیں کہ ہمارے علماء نے کہا ہے کہ اس طرح کے نام رکھنے مکروہ تنزیہی  ہیں نہ کہ مکروہ تحریمی ۔""</p><p class=""indent"" style=""text-align:left;"">(چند ممنوع نام،ج:4،ص:378،ط:دار الاشاعت) </p><p style=""text-align:justify;"">مرقاة المفاتيح ميں ہے :</p><p class=""indent"" style=""text-align:justify;""><span class=""ar_writing"">""(وعن سمرة بن جندب - رضي الله عنه - قال: قال رسول الله صلى الله عليه وسلم: لا تسمين) أي: ألبتة أيها المخاطب، بالخطاب العام (غلامك) أي: صبيك أو عبدك (يسارا) : من اليسر ضد العسر (ولا رباحا) : بفتح الراء من الربح ضد الخسارة (ولا نجيحا) : من النجح وهو الظفر (ولا أفلح) : من الفلاح وهو الفوز (فإنك تقول) أي: أحيانا (أثم) : بفتح المثلثة وتشديد الميم بتقدير استفهام أي: أهناك (هو؟) أي: المسمى بأحد هذه الأسماء المذكورة (فلا يكون) أي: فلا يوجد هو في ذلك المكان اتفاقا (فيقول) أي: المجيب (لا) أي: ليس هناك يسار، أو لا رباح عندنا، أو لا نجيح هناك، أو لا أفلح موجود، فلا يحسن مثل هذا في التفاؤل، أو فيكره لشناعة الجواب: في شرح السنة: معنى هذا: أن الناس يقصدون بهذه الأسماء التفاؤل بحسن ألفاظها أو معانيها، وربما ينقلب عليهم ما قصدوه إلى الضد إذا سألوا فقالوا: أثم يسار أو نجيح؟ فقيل: لا، فتطيروا بنفيه وأضمروا اليأس من اليسر وغيره، فنهاهم عن السبب الذي يجلب سوء الظن والإياس من الخير. قال حميد بن زنجويه: فإذا ابتلي رجل في نفسه أو أهله ببعض هذه الأسماء فليحوله إلى غيره، فإن لم يفعل وقيل: أثم يسار أو بركة؟ فإن من الأدب أن يقال: كل ما هنا يسر وبركة، والحمد لله، ويوشك أن يأتي الذي تريده، ولا يقال ليس هنا ولا خرج والله أعلم. (رواه مسلم. وفي رواية له) : أي: لمسلم (قال: لا تسم غلامك رباحا ولا يسارا ولا نافعا) : في شرح مسلم للنووي، قال أصحابنا: يكره التسمي بالأسماء المذكورة في الحديث، وما في معناها وهي كراهة تنزيه لا تحريم، والعلة فيه ما نبه - صلى الله عليه وسلم - بقوله: أثم هو؟ فيقول: لا، فكره لشناعة الجواب.""</span></p><p class=""indent"" style=""text-align:left;""><span class=""ar_writing"">(باب الأسامي،ج:7،ص:2997،رقم الحديث:2997،ط:دار الفكر، بيروت،لبنان)</span></p><p class=""indent"" style=""text-align:left;""><span class=""ar_writing"">فقط والله أعلم</span></p></p>",144404101302,banuri,"('حظر و اباحت', 'mamnooaat-mubahat')","('نام، لقب، کنیت', 'asaami')","('ناموں کے معانی اور احکام', 'namoun-ke-mani-or-ahkaam')"
15-10-2022,https://www.banuri.edu.pk/readquestion/sodi-qarza-lene-wali-compni-me-mulazimat-karne-ka-hukum-144403101468/15-10-2022,سودی قرضہ لینے والی کمپنی میں ملازمت کرنے کا حکم,میں ایک کمپنی میں ملازمت کا کام کرتا ہوں لیکن کمپنی نے سودی قرضہ لیا ہوا ہے اب سوال ہیکہ میں اس کمپنی میں نماز بھی پڑھاتاہو اور نماز جمعہ بھی ہوتی ہےتو ایسی جگہ پر میرا کام کرنا اور نماز جمعہ پڑھانا کیسا ہے جواب دیکر شکریہ کا موقع عنایت فرمائیں .,"<p><p dir=""rtl"" style=""text-align:justify;""><span lang=""ar-sa"" xml:lang=""ar-sa"">صورت مسئولہ میں  کمپنی کا سودی معاہدہ کرنا اور سود کی بنیاد پر قرضہ لینا ناجائز اور حرام ہے، لیکن اگر کمپنی کا کاروبار  (بزنس)  جائز اور حلال امور  پر مشتمل ہو اور آپ کے سپرد کام بھی جائز ہو تو آپ کے  لیے اس کمپنی میں ملازمت کرنا ، نماز جمعہ وغیرہ پڑھانااور اس کمپنی سے اپنے کام کی تنخواہ لینا جائز ہے۔</span></p><p dir=""rtl"" style=""text-align:justify;""><span lang=""er"" xml:lang=""er"">المحیط البرہانی  میں ہے:</span></p><p class=""indent"" dir=""rtl"" style=""text-align:justify;""><span class=""ar_writing""><span lang=""ar-sa"" xml:lang=""ar-sa"">""وفي «عيون المسائل» : رجل أهدى إلى إنسان أو أضافه إن كان غالب ماله من حرام لا ينبغي أن يقبل ويأكل من طعامه ما لم يخبر أن ذلك المال حلال استقرضه أو ورثه، وإن كان غالب ماله من حلال فلا بأس بأن يقبل ما لم يتبين له أن ذلك من الحرام؛ وهذا لأن أموال الناس لا تخلو عن قليل حرام وتخلو عن كثيره، فيعتبر الغالب ويبنى الحكم عليه.""</span></span></p><p class=""MsoNormal indent"" dir=""rtl"" style=""margin-bottom:0;text-align:left;""><span class=""ar_writing"" lang=""er"" xml:lang=""er"">( كتاب الاستحسان والکراهية ، الفصل السابع عشر في الهدايا والضيافات ۵/ ۳۶۷ ط:دارالکتب العلمیة)</span></p><p class=""MsoNormal indent"" dir=""rtl"" style=""margin-bottom:0;text-align:left;""><span lang=""ar-sa"" xml:lang=""ar-sa"">  فقط واللہ اعلم</span></p></p>",144403101468,banuri,"('اجارہ', 'ijaarah')","('اجارہ صحیحہ و اجارہ فاسدہ', 'ijaarah-sahiha-o-ijaarah-faaseda')","('اجارہ صحیحہ', 'ijaarah-sahiha-ka-bayan')"
