issued_at,link,title,question,answer,fatwa_number,dar_ul_ifta,kitab,bab,fasal
09-11-2022,https://www.banuri.edu.pk/readquestion/doran-e-iqaamt-namazi-ka-dil-hi-dil-men-duaa-karny-ka-hukam-144404100970/09-11-2022,دورانِ اقامت نمازی کا دل ہی دل میں دعا کرنے کا حکم,اقامت کے دوران  اقامت سننے والے دیگر مقتدیوں کا ہاتھ اٹھائے بغیر دل ہی دل میں دعائیں مانگنا کیسا ہے ؟,"<p><p style=""text-align:justify;"">صورتِ مسئولہ میں اگرکوئی شخص دورانِ اقامت ہاتھ اٹھائے بغیر دل ہی دل میں دعا کرے تو کوئی حرج نہیں ہے،البتہ صحیح احادیثِ  مبارکہ میں اذان اور اقامت کے درميانی وقت میں  دعا کرنےکی فضیلت بیان ہوئی ہے ،اس لیےدعا کے لیے اسی وقت کا انتخاب کرنا چاہیے،اور جب اقامت ہورہی ہو تو یکسوئی سے اسے سن کرجواب دینا چاہیے،کیوں کہ فقہائے کرام نے اقامت کے جواب دینے کومستحب کہا ہے،اور استحابی امر کو غیر استحابی امر پر فوقیت دینا اولی ہے۔</p><p style=""text-align:justify;"">مصنف ابن عبدالرزاق میں ہے:</p><p class=""indent"" style=""text-align:justify;""><span class=""ar_writing"">""عن أنس بن مالك قال: قال رسول الله - صلى الله عليه وسلم -: لا يرد ‌الدعاء ‌بين ‌الأذان والإقامة.""</span></p><p class=""indent"" style=""text-align:left;""><span class=""ar_writing"">( باب من سمع النداء،رقم الحديث:1975،ج:2، ص:196، ط:دار التاصيل)</span></p><p class=""indent"" style=""text-align:justify;""> ترجمہ:’’ حضرت انس بن مالک رضی اللہ عنہ سے روایت ہے کہ رسول اللہ صلي الله عليه وسلم نے فرمایا: اذان اور اقامت کے درمیان دعا رد نهيں هوتي هے۔""</p><p style=""text-align:justify;"">صحیح ابن خزیمہ میں ہے:</p><p class=""indent"" style=""text-align:justify;""><span class=""ar_writing"">""عن أنس بن مالك قال: قال رسول الله صلى الله عليه وسلم:الدعاء بين الأذان و الإقامة لايرد؛ فادعوا.""</span></p><p class=""indent"" dir=""rtl"" style=""text-align:left;""><span class=""ar_writing"">(باب استحباب الدعاء بين الأذان والإقامة،رقم الحديث:425، ج:1، ص:221، ط:المكتب الإسلامي)</span></p><p class=""indent"" style=""text-align:justify;""> ترجمہ:"" حضرت انس بن مالک رضی اللہ عنہ سے روایت ہے کہ رسول اللہ صلي الله عليه وسلم نے فرمایا: اذان اور اقامت کے درمیان دعا قبول ہوتی ہے پس اس وقت دعا کيا كرو۔""</p><p style=""text-align:justify;"">البحرالرائق میں ہے:</p><p class=""indent"" style=""text-align:justify;""><span class=""ar_writing"">""وفي فتح القدير إن ‌إجابة ‌الإقامة مستحبة.""</span></p><p class=""indent"" style=""text-align:left;""><span class=""ar_writing"">(كتاب الصلاة، باب الأذان، فصل إجابة المؤذن، ج:1، ص:273، ط:دارالكتاب الإسلامي)</span></p><p style=""text-align:justify;"">فتاوی شامی میں ہے:</p><p class=""indent"" style=""text-align:justify;""><span class=""ar_writing"">""(ويجيب الإقامة) ندبا إجماعا (كالأذان).</span></p><p class=""indent"" style=""text-align:justify;""><span class=""ar_writing"">وفي الرد:(قوله: إجماعا) قيد لقوله ندبا: أي إن القائلين بإجابتها أجمعوا على الندب ولم يقل أحد منهم بالوجوب كما قيل في الأذان، فلا ينافي قوله وقيل لا فافهم.""</span></p><p class=""indent"" style=""text-align:left;""><span class=""ar_writing"">(كتاب الصلاة، باب الأذان، ج:1، ص:400، ط:سعيد)</span></p><p class=""indent"" style=""text-align:left;""><span class=""ar_writing"">فقط والله اعلم</span></p></p>",144404100970,banuri,"('نماز', 'salat')","('اقامت', 'iqamat')","('اقامت کا جواب', 'iqamat-ka-jawab')"
08-11-2022,https://www.banuri.edu.pk/readquestion/credit-card-halal-hai-ya-harame-144404100895/08-11-2022,کریڈٹ کارڈ حلال ہے یا حرام ؟,کیا کریڈٹ کارڈ حلال ہے یا حرام ؟ اگر میں بینک کے ساتھ غیر سودی معاہدہ اس طرح کروں کہ وہ میرے ڈیبٹ اکاؤنٹ سے خود بخود پیسے کاٹ لے۔,"<p><p style=""text-align:justify;"">واضح رہےکہ کریڈٹ کارڈ  بنوانا اور اس کا استعمال کرنا ناجائز و حرام ہے کیوں کہ کسی چیز کے حلال وحرام ہونے کا مدار اس معاہدہ پر ہوتاہے جو فریقین کے درمیان طے پاتا ہے اور مذکورہ  کارڈ جاری کرنے والے بینک یا ادارے کارڈ جاری کرتے وقت کارڈ ہولڈر سےیہ معاہدہ کرتے ہیں کہ اگر مقررہ مدت میں  ادائیگی نہیں کی توپھرمتعین شرح کے ساتھ جرمانہ کے نام پر   سود  ادا کرنا ہوگا اور سود کا لینا اور دینا دونوں حرام ہیں اور اسی طرح سودی معاہدہ کرنا بھی حرام   ہے ،لہذا اگر بالفرض  کارڈ ہولڈر  اس میں وقت پر ادائیگی کر بھی دے اور سود ادا نہ کرے تب بھی صرف اس معاہدے کی وجہ سے اس کارڈ کا بنوانا اور استعمال کرنا ناجائز و حرام ہوگا اور اگر وہ وقت پر ادائیگی نہ کرنے کی وجہ سے سود ادا کردے تو پھر اس صورت میں اس کی حرمت میں کوئی شبہ نہیں ہوگا،لہذا یہ کارڈ بنانا اور استعمال کرنا ہر حال میں ناجائز اور حرام ہے، چاہے وقت پر ادائیگی کرکے سود ادا نہ کرے یا وقت پر ادائیگی نہ کرنے کی صورت میں سود ادا کرے۔</p><p style=""text-align:justify;"">سائل  نے جو بینک کے ساتھ غیر سودی معاہدہ کا ذکر کیا کہ سائل بینک کے ساتھ غیر سودی معاہدہ کرے گا اور بینک خود بخود سائل کے اکاؤنٹ سے رقم کاٹ لے گا ،تو اس معاہدہ کی پوری تفصیل(کہ کس طرح یہ معاہدہ ہوگا) لکھ کر سوال دوبارہ ارسال کریں ،اس کے بعد ان شاء اللہ اس کا جواب دے دیا جائے گا۔</p><p style=""text-align:justify;""><span lang=""er"" xml:lang=""er"">فتاوی شامی میں ہے:</span></p><p class=""indent"" style=""text-align:justify;""><span class=""ar_writing"">""[مطلب كل قرض جر نفعا حرام].</span></p><p class=""indent"" style=""text-align:justify;""><span class=""ar_writing"">(قوله: كل قرض جر نفعا حرام) أي ذا كان مشروطا كما علم مما نقله عن البحر، وعن الخلاصة وفي الذخيرةوإن لم يكن النفع مشروطا في القرض، فعلى قول الكرخيّ لا بأس به ويأتي تمامه.""</span></p><p class=""indent"" style=""text-align:left;""><span class=""ar_writing"">(كتاب البيوع،باب المرابحة و التولية، فصل في القرض،166/5،ط: سعید)</span></p><p style=""text-align:justify;"">الاشباہ والنظائر میں ہے:</p><p class=""indent"" style=""text-align:justify;""><span class=""ar_writing"">""‌‌القاعدة الرابعة عشرة: ما حرم أخذه حرم إعطاؤه ..ويقرب من هذا قاعدة: ما حرم فعله حرم طلبه.""</span></p><p class=""indent"" style=""text-align:left;""><span class=""ar_writing"">(القاعدة الرابعة عشر،ص:132،ط:دار الكتب العلمية)</span></p><p style=""text-align:justify;"">البحر الرائق میں ہے:</p><p class=""indent"" style=""text-align:justify;""><span class=""ar_writing"">""ولا يجوز قرض جر نفعا بأن أقرضه دراهم مكسرة بشرط رد صحيحة أو أقرضه طعاما في مكان بشرط رده في مكان آخر..وفي الخلاصة :القرض بالشرط حرام.""</span></p><p class=""indent"" style=""text-align:left;""><span class=""ar_writing"">(كتاب البيع،باب المرابحة  والتولية ،فصل في بيان التصرف في المبيع والثمن قبل القبض ،133/6،ط:دار الكتاب الإسلامي)</span></p><p class=""indent"" style=""text-align:left;""><span class=""ar_writing"">فقط والله أعلم</span></p></p>",144404100895,banuri,"('معاملات', 'muamlat')","('سود / بینکاری / انشورنس / شیئرز', 'sood-bankari-insurance-shares')","('سودی قرضہ کی لین دین', 'soodi-qarzay-ki-layn-dayn')"
09-11-2022,https://www.banuri.edu.pk/readquestion/sajda-tilawat-ki-majlis-kb-tabdeel-hoti-h-144404100952/09-11-2022,سجدہ تلاوت کی مجلس کب تبدیل ہوتی ہے ؟,سجدہ تلاوت کی مجلس کب  بدلتی ہے  جس سے دوسرا  سجدہ لازم ہو جاتا ہے؟,"<p><p style=""text-align:justify;"">ایک مجلس میں آیتِ سجدہ پڑھ کر سجدہ تلاوت کرنے کے بعد اسی مجلس میں دوبارہ اسی آیتِ سجدہ کو پڑھنے کی صورت میں دوبارہ سجدہ کرنا لازم نہیں ہوتا ، پہلے کیا ہوا سجدہ کافی ہو تاہے ،لیکن  اگر آیت سجدہ تلاوت کرنے کے بعد عمل کثیر کیا یا کوئی ایسا کام کیا جس کی وجہ سے عرف عام میں مجلس تبدیل ہوجاتی ہے  تو   سجدہ تلاوت دوبارہ کرنا لازم ہوگا ۔</p><p style=""text-align:justify;""> فقہاء کرام نے مجلس ایک ہونے اور مجلس تبدیل ہونے کی مختلف صورتیں بیان کی  ہیں ،چنانچہ  اگر آیت سجدہ تلاوت کرنے کے بعد کافی دیر تک اسی مجلس میں بیٹھا رہے یا  آیت سجدہ تلاوت کرنے کےبعد ایک لقمہ کھالے یا ایک گھوٹ پانی پی لے یا بیٹھا ہواتھا آیت سجدہ تلاوت کرنے  کے بعد کھڑا ہوجائے یا ایک دو قدم چل پڑے یا کمرے / مسجد کے ایک کونے سے دوسرے کونے چلاجائے  تو ان تمام صورتوں میں مجلس ایک ہی شمار ہوگی ،اسی طرح اگر آیت سجدہ تلاوت کرنے کے بعد ذکر و اذکار میں مشغول ہوگیایا  قاری صاحب بچوں کو قرآن مجید پڑھارہے ہوں   تب بھی مجلس تبدیل نہیں  ہوگی ۔</p><p style=""text-align:justify;"">البتہ اگر  گھر  بہت بڑا ہو  جیسا کہ بادشاہ کا گھر ہوتاہے تو اس میں ایک جگہ سے دوسری جگہ جانے کی وجہ سے مجلس مختلف شمار ہوگی ،اسی طرح اگر کوئی آدمی گھوڑے یا گاڑی وغیرہ میں سفر کررہا ہے اور وہ نماز کی حالت میں نہیں ہے تو گھوڑے یا گاڑی کے چلنے کے ساتھ ساتھ مجلس بھی تبدیل ہوتی رہے گی ،اسی طرح اگر کوئی آدمی پیدل چل رہا ہو ،یا کھانا کھائے (ایک دو لقمہ سے زیادہ )،یا کئی  گھوٹ پانی پی لے ، یا کسی سے زیادہ بات کرے ،یا لیٹ کر سوجائے ،یا خرید و فروخت کرے وغیرہ ان سب صورتوں میں مجلس تبدیل ہوجاتی ہے۔</p><p style=""text-align:justify;"">بہتر یہ ہے کہ  سائلہ کو جوصورت پیش آئی ہے اس کے بارے میں تفصیل لکھ کر حکم معلوم کرلے۔</p><p style=""text-align:justify;""><span class=""ar_writing"">وفي الفتاوى الهندية:</span></p><p class=""indent"" style=""text-align:justify;""><span class=""ar_writing"">""والمجلس واحد وإن طال أو أكل لقمة أو شرب شربة أو قام أو مشى خطوة أو خطوتين أو انتقل من زاوية البيت أو المسجد إلى زاوية إلا إذا كانت الدار كبيرة كدار السلطان وإن انتقل في المسجد الجامع من زاوية إلى زاوية لا يتكرر الوجوب وإن انتقل فيه من دار إلى دار ففي كل موضع يصح الاقتداء يجعل كمكان واحد وسير السفينة لا يقطع المجلس بخلاف سير الدابة إذا لم يكن راكبها في الصلاة، كذا في فتاوى قاضي خان.</span><span class=""ar_writing"">وإن اشتغل بالتسبيح أو التهليل أو القراءة لا ينقطع حكم المجلس ولو قرأها ثم ركب على الدابة ثم نزل قبل السير لم ينقطع أيضا ولو قرأها فسجد ثم قرأ القرآن بعد ذلك طويلا ثم أعاد تلك السجدة لا تجب عليه أخرى ولو قرأها في مكان ثم قام فركب الدابة ثم قرأها مرة أخرى قبل أن تسير فعليه سجدة واحدة يسجدها على الأرض ولو سارت ثم تلاها يلزمه سجدتان وكذا إذا قرأها راكبا ثم نزل قبل أن تسير فقرأها فعليه سجدة واحدة يسجدها على الأرض، كذا في الجوهرة النيرة.</span><span class=""ar_writing"">واعتبر تبدل المجلس دون الإعراض حتى لو قال: لا أقرأ ثانيا ثم قرأ في مجلسه كفته سجدة ويتكرر في تسدية الثوب والدياسة وكرب الأرض، هكذا في الكافي، وفي الانتقال من غصن إلى غصن في أصح الأقوال، هكذا في المضمرات.</span><span class=""ar_writing"">ولو قرأها وهو ماش يلزمه بكل قراءة سجدة وكذا إن كان يسبح في الماء في بحر أو نهر عظيم أما إذا كان يسبح في حوض أو غدير له حد معلوم فالصحيح أنه يتكرر وكذا لو قرأها حول الرحى في الطاحونة الصحيح أنه يتكرر، هكذا في الخلاصة.</span><span class=""ar_writing"">وإن عمل عملا كثيرا بأن أكل كثيرا أو نام مضطجعا أو باع أو نحوه تجب استحسانا؛ لأن المجلس تبدل بهذه الأعمال اسما فصار مضافا إليها عرفا، كذا في محيط السرخسي.""</span></p><p class=""indent"" style=""text-align:left;""><span class=""ar_writing""> (كتاب الصلاة,1/ 134ط:دار الفكر)</span></p><p style=""text-align:justify;""><span class=""ar_writing"">وفي الدر المختار وحاشية ابن عابدين:</span></p><p class=""indent"" style=""text-align:justify;""><span class=""ar_writing"">""(و) إسداء (الثوب) ذاهبا وآيبا (وانتقاله من غصن) شجرة (إلى آخر وسبحه في نهر أو حوض تبديل) للمجلس أو الآية.(فتجب) سجدة أو سجدات (أخرى) بخلاف زوايا مسجد وبيت وسفينة سائرة وفعل قليل كأكل لقمتين وقيام ورد سلام، وكذا دابة يصلي عليها لأن الصلاة تجمع الأماكن ولو لم يصل تتكرر (كما) تتكرر (لو تبدل مجلس سامع دون تال) حتى لو كررها راكبا يصلي وغلامه يمشي تتكرر على الغلام لا الراكب (لا) تتكرر (في عكسه) وهو تبدل مجلس التالي دون السامع على المفتى به.</span></p><p class=""indent"" style=""text-align:justify;""><span class=""ar_writing"">(قوله ذاهبا وآيبا) أما إذا كان يدير السداء على الدائرة وهو جالس في مكان واحد فلا يتكرر بحر عن الفتح بحثا وفيه نظر يأتي قريبا.</span><span class=""ar_writing"">(قوله وانتقاله من غصن إلى آخر) أي سواء كان قريبا أو بعيدا على الصحيح. وفي الواقعات الحسامية إن أمكنه الانتقال بدون نزول كفته واحدة لاتحاد المجلس وإلا فلا لاختلافه اهـ وهذا ما أفتى به شمس الأئمة الحلواني وغيره من الأئمة ط عن حاشية الزيلعي للشلبي.</span><span class=""ar_writing"">(قوله أو حوض) قال محمد: إن كان عرض الحوض وطوله مثل طول المسجد وعرضه لا يتكرر الوجوب والصحيح أنه يتكرر خانية.</span><span class=""ar_writing"">(قوله تبديل للمجلس) أي في حق التالي أو الآية أي في حق السامع كذا في شرحه على الملتقى.</span><span class=""ar_writing"">(قوله ورد سلام) أي وتشميت عاطس، بخلاف ما لو تكلم كلمات أو شرب جرعات أو عقد نكاحا أو بيعا فإنه لا يكفيه سجدة واحدة شرح المنية.""</span></p><p class=""indent"" style=""text-align:left;""><span class=""ar_writing"">(كتاب الصلاة,باب سجود التلاوة,2/ 115ط:سعيد)</span></p><p style=""text-align:justify;""><span class=""ar_writing"">وفي بدائع الصنائع في ترتيب الشرائع :</span></p><p class=""indent"" style=""text-align:justify;""><span class=""ar_writing"">""ثم تبدل المجلس قد يكون حقيقة وقد يكون حكما بأن تلا آية السجدة ثم أكل أو نام مضطجعا، أو أرضعت صبيا، أو أخذ في بيع أو شراء أو نكاح أو عمل يعرف أنه قطع لما كان قبل ذلك ثم أعادها فعليه سجدة أخرى؛ لأن المجلس يتبدل بهذه الأعمال.</span></p><p class=""indent"" style=""text-align:justify;""><span class=""ar_writing"">ألا ترى أن القوم يجلسون لدرس العلم فيكون مجلسهم مجلس الدرس، ثم يشتغلون بالنكاح فيصير مجلسهم مجلس النكاح، ثم بالبيع فيصير مجلسهم مجلس البيع، ثم بالأكل فيصير مجلسهم مجلس الأكل، ثم بالقتال فيصير مجلسهم مجلس القتال فصار تبدل المجلس بهذه الأعمال كتبدله بالذهاب والرجوع لما مر.</span></p><p class=""indent"" style=""text-align:justify;""><span class=""ar_writing"">ولو نام قاعدا أو أكل لقمة أو شرب شربة أو تكلم بكلمة أو عمل عملا يسيرا ثم أعادها فليس عليه أخرى؛ لأن بهذا القدر لا يتبدل المجلس والقياس فيهما سواء أنه لا يلزمه أخرى لاتحاد المكان حقيقة إلا أنا استحسنا إذا طال العمل اعتبارا بالمخيرة إذا عملت عملا كثيرا خرج الأمر عن يدها وكان قطعا للمجلس بخلاف ما إذا أكل لقمة أو شرب شربة.</span></p><p class=""indent"" style=""text-align:justify;""><span class=""ar_writing"">ولو قرأ آية السجدة فأطال القراءة بعدها أو أطال الجلوس ثم أعادها ليس عليه سجدة أخرى؛ لأن مجلسه لم يتبدل بقراءة القرآن وطول الجلوس، وكذا لو اشتغل بالتسبيح أو بالتهليل ثم أعادها لا يلزمه أخرى.""</span></p><p class=""indent"" style=""text-align:left;""><span class=""ar_writing"">(كتاب الصلاة,فصل سجدة التلاوة,1/ 183الناشر: دار الكتب العلمية) </span></p><p class=""indent"" style=""text-align:left;""><span class=""ar_writing"">فقط والله أعلم</span></p></p>",144404100952,banuri,"('نماز', 'salat')","('سجدہ تلاوت', 'sajda-tilawat')","('آیتِ سجدہ کا تکرار', 'aayat-e-sajda-ka-takrar')"
09-11-2022,https://www.banuri.edu.pk/readquestion/rumesa-name-rakhna-144404101011/09-11-2022,رومیسہ نام  رکھنا,رومیسہ نام کا کیا معنیٰ ہے اور رومیسہ نام رکھنا کیسا ہے ؟,"<p><p style=""text-align:justify;""><span class=""ar_writing"">'' رُمَیْسَه'' </span>(سین کے ساتھ ) یہ ”رمس “ کی تصغیر ہے،  اس کے معنی ہیں: نشان مٹانا۔ (القاموس الوحید، ص:547، ط:ادارۃ الاسلامیات)مذکورہ الفاظ کے ساتھ یعنی سین کے ساتھ  یہ نام صحابیات میں سے کسی کا نام تلاش کے باوجود نہیں مل سکا۔البتہ حرفِ  ثاء کے تلفظ کے ساتھ<span class=""ar_writing"">  "" رُمَیْثَه""</span>   نام کا معنی ہے:  بات درست کرنے والی۔  (القاموس الوحید، ص:546، ط:ادارۃ الاسلامیات) </p><p style=""text-align:justify;"">اور یہ مشہور  انصاریہ  صحابیہ حضرت رمیثہ بنت عمرو رضی اللہ عنہا کا نام ہے، مذکورہ صحابیہ سے مختلف کتبِ احادیث میں حدیث بھی منقول ہے، لہذا مذکورہ تلفظ کے اعتبار سے یہ نام بچی کے  لیے رکھنا نہ صرف افضل ہے بلکہ ایک باعث برکت عمل بھی ہے۔</p><p style=""text-align:justify;"">مذکورہ نام سے ملتا جلتا ایک نام  <span class=""ar_writing""> ""رُمَیْصَاء""</span>ہے ، یہ حضرت انس بن مالک رضی اللہ عنہ کی والدہ حضرت ام سلیم بنت ملحان رضی اللہ عنہا کا نام ہے ،لہذا یہ نام رکھنا بھی اچھا  اور باعث برکت ہے۔</p><p style=""text-align:justify;"">الإصابة في معرفة الصحابة میں ہے:</p><p class=""indent"" style=""text-align:justify;""><span class=""ar_writing"">""رميثة بمثلثة مصغرة بنت عمرو بن هاشم بن المطلب بن عبد مناف.</span></p><p class=""indent"" style=""text-align:justify;""><span class=""ar_writing"">قال بن سعد: أسلمت وبايعت. وقال البخاري: روى عنها القعقاع بن حكيم. وقال أبو عمر: هي جدة عاصم بن قتادة روى عنها.</span></p><p class=""indent"" style=""text-align:justify;""><span class=""ar_writing"">قلت: كذا قال والذي يظهر لي أنها غيرها وجدة عاصم هي التي بعدها وأما هي فلها حديثٌ في ترجمة محمد بن محمد التمار من المعجم الأوسط.</span></p><p class=""indent"" style=""text-align:justify;""><span class=""ar_writing"">رميثة الأنصارية جدة عاصم بن عمر بن قتادة الأنصاري التابعي المشهور.</span></p><p class=""indent"" style=""text-align:justify;""><span class=""ar_writing"">أخرج الترمذي من طريق يوسف الماجشون عن أبيه عن عاصم بن عمر عن جدته رميثة قالت: سمعت رسول الله صلى الله عليه وسلم ولو أشاء أن أقبل الخاتم الذي بين كتفيه من قربه لفعلت. يقول لسعد بن معاذ يوم مات: "" اهتز له عرش الرحمن "" .</span></p><p class=""indent"" dir=""ltr"" style=""text-align:justify;""><span class=""ar_writing"">(باب الکنی، حرف الراء، ج:7، ص:656، ط:دارالجیل)</span></p><p dir=""rtl"" style=""text-align:justify;""><span class=""ar_writing"">وفي أسد الغابة:</span></p><p class=""indent"" dir=""rtl"" style=""text-align:justify;""><span class=""ar_writing"">""الغميصاء الأنصارية وقيل الرميصاء وهي أم سليم بنت ملحان، أم أنس بن مالك وهي بكنيتها أشهر.""</span></p><p class=""indent"" dir=""rtl"" style=""text-align:left;""><span class=""ar_writing""> (7/ 207ط :العلمية )</span></p><p class=""indent"" dir=""rtl"" style=""text-align:left;""><span class=""ar_writing"">فقط واللہ اعلم</span></p></p>",144404101011,banuri,"('حظر و اباحت', 'mamnooaat-mubahat')","('نام، لقب، کنیت', 'asaami')","('ناموں کے معانی اور احکام', 'namoun-ke-mani-or-ahkaam')"
