issued_at,link,title,question,answer,fatwa_number,dar_ul_ifta,kitab,bab,fasal
16-05-2022,https://www.banuri.edu.pk/readquestion/aik-wuzu-se-kitni-namaz-parh-sakty-hyn-144310100480/16-05-2022,ایک وضو سے کتنی نمازیں پڑھ سکتے ہیں؟,کیا ہم ایک مرتبہ وضو کر لیں اور وضو  نہ ٹوٹے تو کتنی نماز پڑھ سکتے ہیں؟ راہ نمائی فرمائیں۔,"<p><p style=""text-align:justify;"">ایک مرتبہ وضو کر لینے کے بعد جب تک وضو نہ ٹوٹے(مکروہ اوقات کے علاوہ)، جتنی چاہے نمازیں (فرائض، نوافل، واجبات، قضاء نماز وغیرہ سب )پڑھ سکتے ہیں۔</p><p style=""text-align:justify;"">""<span class=""ar_writing"">شرح مختصر الطحاوي للجصاص</span>""  میں ہے:</p><p class=""indent"" style=""text-align:justify;""><span class=""ar_writing"">""مسألة: [يصلي المتطهر بطهوره ما شاء]</span></p><p class=""indent"" style=""text-align:justify;""><span class=""ar_writing"">قال أبو جعفر: (وللمتطهر أن يصلي بطهوره ما لم يحدث ‌ما ‌شاء ‌من ‌الفرائض ‌والنوافل)</span></p><p class=""indent"" style=""text-align:justify;""><span class=""ar_writing"">وذلك لما روى علقمة بن مرثد عن سليمان بن بريدة عن أبيه قال ""صلى رسول الله صلى الله عليه وسلم يوم الفتح خمس صلوات بوضوء واحد.</span></p><p class=""indent"" style=""text-align:justify;""><span class=""ar_writing"">ولأن الله تعالى قال: {إذا قمتم إلى الصلاة فاغسلوا وجوهكم}، فإذا فعله فقد أدى موجب اللفظ، والتكرار غير مذكور في اللفظ: فلم نوجبه، لأن قوله: {إذا}: لا يقتضي التكرار"".</span></p><p class=""indent"" style=""text-align:left;""><span class=""ar_writing"">(شرح مختصر الطحاوي للجصاص،‌‌‌‌كتاب الطهارة، باب السواك وسنة الوضوء، 1/ 311، الناشر: دار البشائر الإسلامية)</span></p><p class=""indent"" style=""text-align:left;"">فقط واللہ اعلم</p></p>",144310100480,banuri,"('نماز', 'salat')","('نماز کی شرائط', 'namaz-ki-sharait')","('نماز اور اس کی شرائط و ارکان ، سنن و آداب', 'namaz-or-us-ki-sharait-o-arkaan-sunan-o-aadab')"
23-05-2022,https://www.banuri.edu.pk/readquestion/sahibe-nisab-ki-biwi-ka-zakat-lena-144310100986/23-05-2022,صاحب نصاب شخص کی بیوی کا زکات لینا,صاحبِ نصاب شخص  کی بیوی زكوة لے سکتی ہے یا نہیں؟,"<p><p style=""text-align:justify;""> بیوی  اگر مستحق زکوٰۃ ہے یعنی  اس کی ملکیت میں ضرورتِ  اصلیہ سے زائد  نصاب   یعنی ساڑھے باون تولہ چاندی یا اس  کے برابر  رقم نہیں ہے ، اور نہ ہی  اس  قدر ضرورت سے زائد  سامان ہے کہ جس کی مالیت نصاب کے برابر بنتی ہے اور نہ  ہی اس کا تعلق ہاشمی/عباسی خاندان سے ہےتو وہ زکوٰۃ لے سکتی ہے،اگر چہ اس کا شوہر صاحبِ نصاب ہے،البتہ شوہر اپنی زکوٰۃ بیوی کو نہیں دے سکتا۔</p><p style=""text-align:justify;"">فتح القدیر میں ہے:</p><p class=""indent"" style=""text-align:justify;""><span class=""ar_writing"">""(ولا إلى ولد غني إذا كان صغيرا) لأنه يعد غنيا بيسار أبيه، بخلاف ما إذا كان كبيرا فقيرا لأنه لا يعد غنيا بيسار أبيه وإن كانت نفقته عليه، وبخلاف امرأة الغني لأنها إن كانت فقيرة لا تعد غنية بيسار زوجها، وبقدر النفقة لا تصير موسرة.</span></p><p class=""indent"" style=""text-align:justify;""><span class=""ar_writing"">(قوله وبخلاف امرأة إلخ) هذا ظاهر الرواية، وسواء فرض لها النفقة أو لا.""</span></p><p class=""indent"" style=""text-align:left;"">(کتاب الزکوٰۃ،باب من يجوز دفع الصدقة إليه ومن لا يجوز،ج2،ص272،ط:دار الفکر)</p><p style=""text-align:justify;"">وفیہ ایضاً:</p><p class=""indent"" style=""text-align:justify;""><span class=""ar_writing"">""(ولا إلى امرأته) للاشتراك في المنافع عادة.</span></p><p class=""indent"" style=""text-align:justify;""><span class=""ar_writing"">قوله ولا إلى امرأته للاشتراك في المنافع) قال الله تعالى {ووجدك عائلا فأغنى} [الضحى: 8] أي بمال خديجة. وإنما كان منها إدخاله - عليه الصلاة والسلام - في المنفعة على وجه الإباحة والتمليك أحيانا فكان الدافع إلى هؤلاء كالدافع لنفسه من وجه إذ كان ذلك الاشتراك ثابتا، وكذا لا يدفع إليهم صدقة فطره وكفارته وعشره، بخلاف خمس الركاز يجوز دفعه لهم لأنه لا يشترط فيه إلا الفقر.""</span></p><p class=""indent"" style=""text-align:left;"">(کتاب الزکوٰۃ،باب من يجوز دفع الصدقة إليه ومن لا يجوز،ج2،ص270،ط:دار الفکر)</p><p class=""indent"" style=""text-align:left;"">فقط واللہ اعلم</p></p>",144310100986,banuri,"('زکات', 'zakat')","('مصارف', 'masaaref')","('زکوٰۃ کے مصارف', 'zakat-ke-masaaref')"
17-05-2022,https://www.banuri.edu.pk/readquestion/baiy-awal-ko-registery-par-majboor-karna-144310100503/17-05-2022,بائع اول کو رجسٹری پر مجبور کرنا,زید نے زمین بیچی بکر کے ہاتھ قبضہ دےدیا، رجسٹری کے لئے زید نے کہا تو بکر نے انکار کر  دیا اور کہا ہمیں آپ سے کوئی خطرہ نہیں ہے، زید نے کہا اگر ابھی کرا لو 1یا2 مہینے میں پھر بعد میں ہم نہیں کرا پائیں گے، اب تقریاً15،20 سال کے بعد بکر نے اس زمین کو خالد کے ہاتھ بیچ دیا خالد نے اس پر قبضہ بھی کر لیا ہے اب خالد زید پر دباؤ ڈال رہا ہے کہ وہ اسکی رجسٹری کرائیں۔ حال یہ ہے کہ زید کے نام جو زمین ہے اس کو اب تک 15، 20 لوگوں نے  بغیر رجسٹری کے خرید کر اُس میں رہائش بھی کر  چکے ہیں۔ امر طلب یہ ہے کہ زید اور خالد کے لئے حُکم شرع کیا ہے اور خالد کا زید پر دباؤ ڈالنا کیسا ہے جبکہ زید کا خالد کے لین دین سے کوئی تعلق نہیں ہے جواب قرآن و حدیث کی روشنی میں عنایت فرمائیں؟,"<p><p style=""text-align:justify;"">واضح رہے کہ جب بائع کوئی چیز فروخت کردے تو شرعاً اس کی ذمہ داری ہے کہ وہ اس چیز کی رجسٹری مشتری کے نام کروائے ؛لہذا صورت ِ مسئولہ میں خالد بکر کے واسطہ سے زید سے اس کی رجسٹری کا مطالبہ کرے تو خالد اگر چہ زید کو رجسٹری پر مجبور نہیں کرسکتا ؛لیکن بکر کے توسط سے زید کو مجبور کیا جاسکتا ہے اور زید پر  اس کی رجسٹری خالد کے نام کروانا شرعاًلازم ہوگا۔</p><p style=""text-align:justify;"">محیط برہانی میں ہے :</p><p class=""indent"" style=""text-align:justify;""><span class=""ar_writing"">""لأن ‌حقوق ‌العقد في البيع ترجع إلى العاقد، وفي النكاح لا يرجع إليه.""</span></p><p class=""indent"" style=""text-align:left;""><span class=""ar_writing"">(</span>کتاب النکاح،الفصل السادس والعشرون فی المتفرقات،ج:۳،ص:۱۹۰،دارالکتب العلمیۃ)</p><p class=""indent"" style=""text-align:left;"">فقط واللہ اعلم</p></p>",144310100503,banuri,"('بیوع', 'buyoo')","('مبیع و ثمن پر قبضہ اور ادائیگی', 'mabee-ko-rokna-or-qabza-karna')","('ثمن و مبیع کی سپردگی کے اخراجات', 'saman-or-mabee-ke-supurdgi-ke-akhrajaat-kis-par-hen')"
06-06-2022,https://www.banuri.edu.pk/readquestion/domain-me-invest-karna-144311100435/06-06-2022,ڈومین میں انوسٹ کرنا,میراایک عزیزویب ڈومین کاکام وغیرہ کرتاہےاس نے مجھے پانچ لاکھ انویسٹمنٹ کرنےکابولاہے اور تفصیل اسطرح ہے کہ پانچ لاکھ انکو دوتووہ ایگریمنٹ کرتےہیں جس میں یہ لکھاہوتا ہے کہ آپکو جب بھی یہ پانچ لاکھ چاہیے ہونگے توآپ دودن پہلے بتا دیناہم آپکی رقم آپکو واپس کر دینگے لیکن جب تک وہ رقم ان کے پاس رہے گی تو وہ اس پرہرماہ بیس ہزارروپے  دینگے اور اگرکام اچھاہواتو پچیس سے تیس ہزاربھی مل سکتے ہیں اور اگرکام اچھانہ ہواتو پیسےبیس ہزار ہی ملیں گے آیااسطرح کے کام میں پیسہ لگانادرست ہے؟,"<p><p style=""text-align:justify;"">صورت مسئولہ میں  سائل کا اپنے عزیز کے ساتھ مذکورہ طریقہ  پر کاروبار کرنا سودی معاملہ ہے کیونکہ اس میں منافع فکس ہے، لہذا اس کام میں پیسے لگانا جائز نہیں ہے۔</p><p style=""text-align:justify;"">قرآن کریم میں باری تعالی کا ارشاد ہے:</p><p class=""indent"" style=""text-align:justify;""><span class=""qr_writing"">﴿ يَاأَيُّهَا الَّذِينَ آمَنُوا اتَّقُوا اللَّهَ وَذَرُوا مَا بَقِيَ مِنَ الرِّبَا إِنْ كُنْتُمْ مُؤْمِنِينَ (278) فَإِنْ لَمْ تَفْعَلُوا فَأْذَنُوا بِحَرْبٍ مِنَ اللَّهِ وَرَسُولِهِ وَإِنْ تُبْتُمْ فَلَكُمْ رُءُوسُ أَمْوَالِكُمْ لَا تَظْلِمُونَ وَلَا تُظْلَمُونَ ﴾ [البقرة: 278، 279]</span></p><p class=""indent"" style=""text-align:justify;"">ترجمہ: اے ایمان والو! اللہ سے ڈرو اور چھوڑ دو جو باقی رہ گیا سود میں سے اگر تم مؤمن ہو۔ سو اگر تم ایسا نہیں کروگے تو سن لو اعلانِ جنگ اللہ اور اس کے رسول کی طرف سے، اور اگر تم توبہ کرو تو تمہارے اصل اموال تمہارے لیے ہیں نہ تم ظلم کروگے کسی پر اور نہ تم پر ظلم کیا جائے گا۔</p><p>صحیح مسلم میں نبی علیہ الصلاۃ والسلام کا ارشاد ہے:</p><p class=""indent"" style=""text-align:justify;""><span class=""ar_writing"">""عن جابر قال: لعن رسول اﷲ صلی اﷲ علیه وسلم آکل الربا، وموکله، وکاتبه، وشاهدیه، وقال: هم سواء"".</span></p><p class=""indent"" style=""text-align:left;""><span class=""ar_writing"">(الصحيح لمسلم، با ب لعن آکل الربا، ومؤکله، النسخة الهندیة، ۲/۲۷)</span></p><p class=""indent"" style=""text-align:justify;"">ترجمہ:"" حضرت جابر رضی اللہ عنہ  روایت کرتے ہیں کہ رسول اللہ صلی اللہ علیہ وسلم نے سود کھانے والے، کھلانے والے، سودی معاملہ لکھنے والے اور اس کے گواہوں پر لعنت فرمائی ہے، اور ارشاد فرمایا: یہ سب (سود کے گناہ میں) برابر ہیں۔""</p><p class=""indent"" style=""text-align:left;"">فقط والله اعلم</p></p>",144311100435,banuri,"('معاملات', 'muamlat')","('بیع / تجارت', 'bay-tijarat')","('بیع صحیح ، فاسد اور باطل', 'bay-sahih-fasid-or-batil')"
04-07-2022,https://www.banuri.edu.pk/readquestion/kia-message-ke-zariye-talaaq-waqi-hojaati-he-144312100177/04-07-2022,کیا میسج کے ذریعہ طلاق واقع ہوجاتی ہے؟,"میرے داماد  نے میری بیٹی کو یہ الفاظ میسج کئے ""اور لے تیسرا طلاق بھی، تو اس ہی لائق ہے""، کیا ان الفاظ سے طلاق واقع ہوجاتی ہے یا نہیں؟ اور اس سے پہلے دو طلاقیں اس نے دی ہے،","<p><p align=""right"" style=""text-align:justify;""><span dir=""rtl"" lang=""ar-sa"" xml:lang=""ar-sa"">صورتِ مسئولہ میں </span> اگر سائل کا بیان واقعی درست ہو<span style=""background-color:#fff;color:#333;font-family:'Jameel Noori Nastaleeq',Nafees,'Helvetica Neue',Helvetica,Arial,sans-serif;font-size:17px;""> </span><span dir=""rtl"" lang=""ar-sa"" xml:lang=""ar-sa"">  اور سائل کے داماد نےسائل کی بیٹی کو میسج پر یہ الفاظ لکھ کر بھیجے  ""اور لے تیسرا طلاق بھی، تو اس ہی لائق ہے"" اور اس سے قبل دو طلاقیں بھی دے چکا تھا ،تو  شرعاً سائل کی بیٹی پر  تینوں طلاقیں واقع ہوگئیں، اور وہ  اپنے شوہر  پر حر مت مغلظہ کے ساتھ حرام ہوگئی،  نکاح ختم ہو گیا ، اب شوہر کا    رجوع یا  دوبارہ  نکاح کرنا جائز نہیں ہے،</span><span dir=""rtl"" lang=""er"" xml:lang=""er"">مطلقہ اپنی عدت (پوری تین ماہواریاں اگر حمل نہ ہو اور اگر حمل ہو تو بچے کی پیدائش تک)گزار کر دوسری جگہ  شرعاًنکاح کرسکتی ہے،</span>البتہ عدت گزارنے کے بعدمطلقہ  اگر کسی دوسرے شخص سے نکاح کرے اور وہ اس سے صحبت (ہم بستری ) کرے اس کے بعد وہ دوسرا شخص اس کو طلاق دے دے یا وہ طلاق لے لے یا  اس کے شوہر کا انتقال ہو جائے تو اس کی عدت گزار کر عورت  اپنے سابقہ شوہر سے دوبارہ شرعاً  نکاح کر سکتی ہے۔</p><p align=""right"" style=""text-align:justify;""><span dir=""rtl"" lang=""ar-sa"" xml:lang=""ar-sa"">فتاوی شامی میں ہے:</span></p><p align=""right"" class=""indent"" style=""text-align:justify;""><span class=""ar_writing""><span dir=""rtl"" lang=""ar-sa"" xml:lang=""ar-sa"">""(ويقع طلاق كل زوج بالغ عاقل) ولو تقديرا بدائع، ليدخل السكران (ولو عبدا أو مكرها).""</span></span></p><p align=""right"" class=""indent"" style=""text-align:left;""><span class=""ar_writing"">(کتاب الطلاق،ج:3،ص:235، ط:سعید) </span></p><p align=""right"" style=""text-align:justify;""><span dir=""rtl"" lang=""ar-sa"" xml:lang=""ar-sa""> </span><span dir=""rtl"" lang=""ar-sa"" xml:lang=""ar-sa"">فتاوی عالمگیری میں ہے</span>:</p><p align=""right"" class=""indent"" style=""text-align:justify;""><span class=""ar_writing"">""وإن كانت ‌مرسومة يقع الطلاق نوى أو لم ينو ثم المرسومة۔۔۔بأن كتب أما بعد فأنت طالق فكلما كتب هذا يقع الطلاق وتلزمها العدة من وقت الكتابة.""</span></p><p align=""right"" class=""indent"" style=""text-align:left;""><span class=""ar_writing""><span dir=""rtl"" lang=""ar-sa"" xml:lang=""ar-sa"">(کتاب الطلاق،باب الصریح،ج:1،ص:378،ط:دار الفکر)</span></span></p><p dir=""rtl"">وفیہ ایضاً:</p><p class=""indent"" dir=""rtl"" style=""text-align:justify;""><span class=""ar_writing"">""إذا كان الطلاق بائنا دون الثلاث فله أن يتزوجها في العدة وبعد انقضائها، وإن كان الطلاق ثلاثا في الحرة وثنتين في الأمة لم تحل له حتى تنكح زوجا غيره نكاحا صحيحا ويدخل بها ثم يطلقها أو يموت عنها كذا في الهداية.""</span></p><p class=""indent"" dir=""rtl"" style=""text-align:left;""><span class=""ar_writing"">( کتاب الطلاق، الباب السادس في الرجعة وفيما تحل به المطلقة وما يتصل به، ج: 1،ص:472، ط: دار الفکر)</span> </p><p align=""right"" class=""indent"" style=""text-align:left;""><span class=""ar_writing"">فقط واللہ اعلم</span></p></p>",144312100177,banuri,"('طلاق', 'talaaq')","('وقوع طلاق وعدم وقوع طلاق', 'wuqoo-e-talaq-o-adme-wuqoo-e-talaq')","('تین طلاق', 'teen-talaqayn')"
17-06-2022,https://www.banuri.edu.pk/readquestion/ramesh-naam-rakhna-kaisa-hai-144311101317/17-06-2022,ارمش نام رکھنا کیسا ہے؟,کیا ارمِش نام رکھنا درست ہے؟,"<p><p style=""text-align:justify;""><span class=""ur_writing""> "" ارمش"" کا لفظ ""رمش"" سے لیاگیا ہے جس کے  معنی آنکھ کے پپوٹوں کا سرخ ہو کر پانی جاری ہونا اور پلکوں کا چپک جانا۔ ( القاموس الوحید: 669) نیز اس لفظ کے ديگربھی معانی ہیں :  ان میں سے ایک معنی حسن خلق (عمدہ اخلاق) کے بھی ہیں، اس معنی کے اعتبار سے""ارمش"" نام رکھنا اگرچہ جائز ہے۔ تاہم دیگر معانی چوں کہ نام رکھنے کے اعتبار سے مناسب نہیں، لہذا معنی کے اشتباہ کی بنا پر ""ارمش"" نام رکھنا بہتر  نہیں ہے۔</span></p><p style=""text-align:justify;""><span class=""ur_writing"" lang=""ar-sa"" xml:lang=""ar-sa"">(معجم الرائد میں ہے:</span></p><p class=""indent"" dir=""rtl"" style=""text-align:justify;""><span class=""ar_writing""><span lang=""ar-sa"" xml:lang=""ar-sa"">""</span>أرْمَش: <span lang=""ar-sa"" xml:lang=""ar-sa"">رمش، مؤنث رمشاء،</span><span lang=""ar-sa"" xml:lang=""ar-sa"">«الرمش »، وهو حمرة في الجفن مع ماء يسيل،</span><span lang=""ar-sa"" xml:lang=""ar-sa"">حسن الخلق،</span><span dir=""ltr""> </span><span lang=""ar-sa"" xml:lang=""ar-sa"">مختلف الألوان</span><span dir=""ltr"">.""</span><span lang=""ar-sa"" xml:lang=""ar-sa"">وفیه أیضًا</span><span dir=""ltr"">:</span><span lang=""ar-sa"" xml:lang=""ar-sa"">أرْمَش: أرمش - إرماشا - (فعل)</span><span dir=""ltr""> </span><span lang=""ar-sa"" xml:lang=""ar-sa"">أرمش الشجر: أورق</span><span dir=""ltr""> </span><span lang=""ar-sa"" xml:lang=""ar-sa"">أرمش: حرك جفنيه بالنظر لضعف في عينيه،</span><span dir=""ltr""> </span><span lang=""ar-sa"" xml:lang=""ar-sa"">أرمش: فسدت عينه فلم يشف جفنه</span>"".</span></p><p class=""indent"" dir=""rtl"" style=""text-align:left;""><span class=""ar_writing""><span lang=""ar-sa"" xml:lang=""ar-sa"">(</span>معجم الرائد للجران مسعود، ص: 59، ط: دارالعلم)</span></p><p class=""indent"" dir=""rtl"" style=""text-align:left;""><span class=""ar_writing"">فقط واللہ اعلم</span></p></p>",144311101317,banuri,"('حظر و اباحت', 'mamnooaat-mubahat')","('نام، لقب، کنیت', 'asaami')","('ناموں کے معانی اور احکام', 'namoun-ke-mani-or-ahkaam')"
16-06-2022,https://www.banuri.edu.pk/readquestion/iddat-ke-doran-walida-ki-ayadat-ke-liy-nikalna-144311101163/16-06-2022,عدت کے دوران والدہ کی عیادت کے لیے نکلنا,میری بہن عدت میں ہے، میری والدہ 84 سال کی عمر میں بیمار اور کئی ہفتوں سے ذہنی بے ہوشی کی کیفیت میں ہیں،  میرے والد کا انتقال بھی 89 سال کی عمر میں 15  رمضان 17 اپریل 2022 ء کو ہوا، اور میرے برادر نسبتی  (سالا)14 شوال 16 مئی 2022 ء کو انتقال کر گئے، ہم جاننا چاہتے ہیں کہ میری بہن عدت کے دوران اپنی ماں سے ملنے آسکتی ہے؟ ہماری ماں کی حالت ٹھیک نہیں ہے، ہم ذہنی طور پر کسی بھی حالت کا سامنا کرنے کے لیے  تیار ہیں،  وہ اس قابل نہیں ہیں کہ انہیں منتقل کیا جائے،   لیکن زیادہ تر وقت  وہ  میری بہن  کو یاد کرتی رہتی ہیں ۔ براہِ کرم ہماری راہ نمائی کریں کہ ہم اس صورتِ حال میں کیا  کریں، ہم فقہ حنفی سے تعلق رکھتے ہیں، ہمارے  برادر نسبتی   امام شافعی رحمہ اللہ کے مقلد ہیں۔,"<p><p style=""text-align:justify;"">واضح  رہے  کہ شوہر کے انتقال کے بعد   نکاح کی نعمت کے ختم ہونے پر  افسوس کے اظہار  کے لیے  عورت پرشریعت  کے حکم کے مطابق  چار مہینہ دس دن عدت گزارنا لازم ہے اور اگر شوہر کا انتقال  چاند کی پہلی تاریخ کے بعد  ہوا مثلاً دوسری، تیسری وغیرہ تو ایسی صورت میں ایک سو تیس دن عدت گزارنا اور عدت کی تمام پابندیوں پر عمل کرنا ضروری ہے،عدت کے  دوران معتدہ عورت کے لیے  شدید ضرورت (مثلاً مکان منہدم ہوجائے یا مال و جان  یا  عزت آبرو کا خطرہ وغیرہ ) کے بغیر گھر سے نکلناجائز نہیں ہے۔ </p><p style=""text-align:justify;"">  صورت ِ مسئولہ میں  سائل   کی بہن کے لیے عدت کے دوران والدہ کی عیادت کے لیے گھر سے نکلنا جائز نہیں ہے، سائل کی بہن اپنے گھر ہی میں والدہ کے لیے دعاؤں کا اہتمام کرے، نیز موجودہ دور میں رابطے کے دیگر وسائل میسر ہیں، لہذا رابطہ کے لیے دیگر صوتی ذرائع (مثلا ٹیلی فون وغیرہ )    اختیار کیے  جاسکتے ہیں۔(تاہم اگر چلی گئی تو توبہ استغفار کرنا لازم ہوگا)۔</p><p style=""text-align:justify;"">فتاوی شامی میں ہے:</p><p class=""indent"" style=""text-align:justify;""><span class=""ar_writing"">""(وتعتدان) أي معتدة طلاق وموت (في بيت وجبت فيه) ولايخرجان منه (إلا أن تخرج أو يتهدم المنزل، أو تخاف) انهدامه، أو (تلف مالها، أو لاتجد كراء البيت) ونحو ذلك من الضرورات فتخرج لأقرب موضع إليه"".  </span></p><p class=""indent"" style=""text-align:left;""><span class=""ar_writing"">(3/ 536، كتاب الطلاق ، باب العدة، ط: سعيد)</span></p><p class=""indent"" dir=""rtl"" style=""text-align:left;""><span class=""ar_writing"">فقط والله اعلم</span></p></p>",144311101163,banuri,"('طلاق', 'talaaq')","('عدت', 'iddat')","('عدت میں گھر سے باہر نکلنا', 'iddat-men-ghar-se-baher-nikalna')"
17-06-2022,https://www.banuri.edu.pk/readquestion/aban-nam-rakahna-kaisa-hai-144311101319/17-06-2022,ابان نام رکھنا کیسا ہے؟,ابان نام رکھنا  کیسا ہے؟,"<p><p style=""text-align:justify;""><span class=""ur_writing"">""ابان""   کے معنی  صاف اور  واضح چیز  کے ہیں ،   ابان نام کےکئی صحابہ  کرام رضوان اللہ علیہم اجمعین بھی تھے، لہذا یہ نام رکھنا درست  ہے۔</span></p><p style=""text-align:justify;""><span class=""ur_writing"">الإصابة في تمييز الصحابة میں ہے:</span></p><p class=""indent"" style=""text-align:justify;""><span class=""ar_writing"">""أبان بن سعيد بن العاص بن أمية بن عبد مناف القرشي الأموي. قال البخاريّ، وأبو حاتم الرّازيّ، وابن حبّان: له صحبة، وكان أبوه من أكابر قريش، وله أولاد نجباء، أسلم منهم قديماً خالد، وعمرو"".</span></p><p class=""indent"" style=""text-align:left;""><span class=""ar_writing"">(باب الألف بعدها موحدة،ج: 1، صفحہ: 168، ط:  دارالكتب العلمية - بيروت)</span></p><p><span class=""ur_writing"">وفیہ ایضاً: </span></p><p class=""indent"" style=""text-align:justify;""><span class=""ar_writing"">""مات سنة ثمانين عام الجحاف، وهو سيل كان ببطن مكة جحف الحاجّ، وذهب بالإبل، وعليها الحمولة، وصلى عليه أبان بن عثمان وهو أمير المدينة حينئذٍ لعبد الملك بن مروان، هذا هو المشهور"".</span></p><p class=""indent"" style=""text-align:left;""><span class=""ar_writing"">(ج:4، صفہ: 37، ط: دارالكتب العلمية - بيروت)</span></p><p class=""indent"" style=""text-align:left;""><span class=""ar_writing"">فقط واللہ اعلم</span></p></p>",144311101319,banuri,"('حظر و اباحت', 'mamnooaat-mubahat')","('نام، لقب، کنیت', 'asaami')","('ناموں کے معانی اور احکام', 'namoun-ke-mani-or-ahkaam')"
