issued_at,link,title,question,answer,fatwa_number,dar_ul_ifta,kitab,bab,fasal
05-07-2022,https://www.banuri.edu.pk/readquestion/haalate-janabat-mein-namaz-parhny-se-islam-se-kharij-hony-ka-hukm-144312100303/05-07-2022,حالتِ جنابت میں نماز پڑھنے سے دائرہ اسلام سے خارج ہونے کا حکم,1۔ میں نے یہ مسئلہ سنا ہے کہ اگر کوئی شخص اپنے ہاتھ سے اپنے اوپر غسل فرض کرے اور اسی حالت میں نماز پڑھ لے تو اس سے وہ شخص دائرۂ اسلام سے خارج ہوجاتا ہے، اس کی وضاحت فرمادیں۔2۔اگر کوئی شخص اپنے اوپر غسل فرض کرے اور غسل کر بھی لے اور نماز پڑھنے کے بعد اسے پتہ چلے کہ اس کا غسل نہیں ہوا تو کیا حکم ہوگا؟,"<p><p style=""text-align:justify;"">1۔ اگر کوئی شخص حالتِ جنابت (یعنی غسل واجب ہونے کی حالت میں) نماز پڑھنے کو جائز اور درست سمجھتا ہے، یا دین یا نماز کے استخفاف، حقارت اور اہانت کی غرض سے غسل واجب ہونے کی صورت میں غسل کے بغیر نماز پڑھتا ہے،  تو  ایسا شخص حکمِ شرعی کی اہانت، استخفاف اور  فرض کے انکار کی وجہ سے دائرۂ اسلام سے خارج ہوجاتا ہے، اس پر تجدیدِ ایمان اور شادی شدہ ہونے کی صورت میں تجدیدِ نکاح کرنا بھی لازم ہوگا، لیکن اگر کوئی شخص غسل جنابت کیے بغیر  نماز پڑھنے کو جائز نہیں سمجھتا، اور نہ ہی شریعت کی اہانت کی غرض سے ایسا کرتا ہے، بلکہ لاعلمی میں یا غلطی سے یا سستی، کاہلی وغیرہ کی وجہ سے وضو یا غسل جنابت کیے بغیر نماز پڑھتا ہے تو  اس سے یہ شخص دائرۂ اسلام سے خارج نہیں ہوگا، اگر چہ سستی اور کاہلی وغیرہ کی وجہ سے ایسا کرنا  گناہ ہے، جس پر توبہ واستغفار کرنا لازم ہوگااور نماز کا اعادہ  لازم ہوگا۔</p><p style=""text-align:justify;"">2۔ اگر کوئی شخص غسل کرلے اور پھر نماز پڑھے، بعد میں پتہ چلے کہ اس کا غسل نہیں ہوا ہے، تو اس شخص پر اس نماز کو دوبارہ پاکی کے ساتھ پڑھنا واجب ہے، البتہ چوں کہ اس شخص نے ناپاکی کی حالت میں نماز جان بوجھ کر نہیں پڑھی، بلکہ بھول اور غلطی کی بنا پر ایسا کیا ہے، اس لیے امید ہے کہ اس کا گناہ تو   نہیں ہوگا، تاہم احتیاط یہ ہے کہ وہ  اس پر اللہ کے دربار میں توبہ و استغفار کر کے اس کی تلافی کرے۔</p><p style=""text-align:justify;"">فتاوی شامی میں ہے:</p><p class=""indent"" style=""text-align:justify;""><span class=""ar_writing"">""قلت: وبه ظهر أن تعمد الصلاة بلا طهر غير مكفر كصلاته لغير القبلة أو مع ثوب نجس، وهو ظاهر المذهب، كما في الخانية. </span><span class=""ar_writing"">(قوله: غير مكفر) أشار به إلى الرد على بعض المشايخ، حيث قال: المختار أنه يكفر بالصلاة بغير طهارة لا بالصلاة بالثوب النجس وإلى غير القبلة لجواز الأخيرتين حالة العذر بخلاف الأولى فإنه لايؤتى بها بحال فيكفر. قال الصدر الشهيد: وبه نأخذ، ذكره في الخلاصة والذخيرة، وبحث فيه في الحلية بوجهين: أحدهما ما أشار إليه الشارح. ثانيهما أن الجواز بعذر لايؤثر في عدم الإكفار بلا عذر؛ لأن الموجب للإكفار في هذه المسائل هو الاستهانة، فحيث ثبتت الاستهانة في الكل تساوى الكل في الإكفار، وحيث انتفت منها تساوت في عدمه، وذلك لأنه ليس حكم الفرض لزوم الكفر بتركه، وإلا كان كل تارك لفرض كافراً، وإنما حكمه لزوم الكفر بجحده بلا شبهة دارئة اهـ ملخصاً: أي والاستخفاف في حكم الجحود. </span><span class=""ar_writing"">(قوله: كما في الخانية) حيث قال بعد ذكره الخلاف في مسألة الصلاة بلا طهارة: وأن الإكفار رواية النوادر. وفي ظاهر الرواية: لايكون كفراً، وإنما اختلفوا إذا صلى لا على وجه الاستخفاف بالدين، فإن كان وجه الاستخفاف ينبغي أن يكون كفراً عند الكل. اهـ.</span><span class=""ar_writing"">أقول: وهذا مؤيد لما بحثه في الحلية لكن بعد اعتبار كونه مستخفا ومستهينا بالدين كما علمت من كلام الخانية، وهو بمعنى الاستهزاء والسخرية به، أما لو كان بمعنى عد ذلك الفعل خفيفا وهينا من غير استهزاء ولا سخرية، بل لمجرد الكسل أو الجهل فينبغي أن لايكون كفرا عند الكل، تأمل"".</span></p><p class=""indent"" style=""text-align:left;""><span class=""ar_writing"">(كتاب الطهارة، ج: 1، ص: 81، ط: دار الفكر بيروت)</span></p><p>فتاوی شامی میں ہے:</p><p class=""indent"" style=""text-align:justify;""><span class=""ar_writing"">""وحديث «رفع عن أمتي الخطأ» محمول على رفع الإثم.</span></p><p class=""indent"" style=""text-align:justify;""><span class=""ar_writing""> (قوله: «رفع عن أمتي الخطأ») قال في الفتح: ولم يوجد بهذا اللفظ في شيء من كتب الحديث، بل الموجود فيها "" «إن الله وضع عن أمتي الخطأ والنسيان وما استكرهوا عليه»، رواه ابن ماجه وابن حبان والحاكم، وقال: صحيح على شرطهما، ح.</span></p><p class=""indent"" style=""text-align:justify;""><span class=""ar_writing"">(قوله: على رفع الإثم) وهو الحكم الأخروي، فلا يراد الدنيوي وهو الفساد؛ لئلايلزم تعميم المقتضى، ح عن البحر""</span></p><p class=""indent"" style=""text-align:left;""><span class=""ar_writing"">(کتاب الصلاۃ، باب ما یفسد الصلاۃ و ما يكره فيها، ج: 1، ص: 615، ط: سعید)</span></p><p class=""indent"" style=""text-align:left;""><span class=""ar_writing"">فقط والله أعلم</span></p></p>",144312100303,banuri,"('طہارت', 'taharat')","('غسل', 'ghusl')","('جنابت کے احکام', 'jinabat-ke-ahkaam')"
06-07-2022,https://www.banuri.edu.pk/readquestion/qurbani-ka-nasab-144312100367/06-07-2022,مشترکہ بنجرزمین کے مالکان پر قربانی کا حکم,کیا بنجر مشترکہ زمین قربانی کے نصاب میں شامل ہے اس زمین میں بہت سے لوگ شریک ہوں؟,"<p><p style=""text-align:justify;"">واضح رہے کہ قربانی  ہر شخص کی اپنی ذاتی ملکیت کے اعتبار سے  واجب ہوتی ہے یعنی قربانی  میں ہر ایک کی اپنی ملکیت کا اعتبار ہے۔صورتِ  مسئولہ میں مشترکہ بنجر زمین میں سےجس شریک کی ملکیت میں  جو زمین ہو گی اگر وہ  بنجر زمین ضرورت میں استعمال نہ ہورہی ہو(مثلاً اس میں رہائش کا گھر بنانے کی نیت نہ ہو) تو اس کی قیمت اگر نصاب (ساڑھے باون تولہ چاندی) تک پہنچے تو ایسی بنجر زمین کے مالک پر قربانی واجب ہوگی اور اگر اس زمین کی قیمت نصاب سے کم ہے اور اس کے علاوہ اتنا سونا یا چاندی یا نقد رقم یا ضرورت سے زائد اشیاء بھی ملکیت میں نہ ہوں جن کی قیمت نصاب تک پہنچتی ہو تو پھر ایسی زمین کے مالک پر قربانی واجب نہیں ہوگی ۔</p><p style=""text-align:justify;"">فتاوی شامی میں ہے :</p><p class=""indent"" style=""text-align:justify;""><span class=""ar_writing"">""وشرائطها: الإسلام والإقامة واليسار الذي يتعلق به) وجوب (صدقة الفطر) (قوله: واليسار إلخ) بأن ملك مائتي درهم أو عرضاً يساويها غير مسكنه وثياب اللبس أو متاع يحتاجه إلى أن يذبح الأضحية، ولو له عقار يستغله فقيل: تلزم لو قيمته نصاباً، وقيل: لو يدخل منه قوت سنة تلزم، وقيل: قوت شهر، فمتى فضل نصاب تلزمه. ولو العقار وقفاً، فإن وجب له في أيامها نصاب تلزم.""</span></p><p class=""indent"" style=""text-align:left;"">(کتاب الاضحیۃ، ج: 6، صفحہ:  312،ط: ایچ، ایم،  سعید) </p><p class=""indent"" style=""text-align:left;"">فقط واللہ اعلم</p></p>",144312100367,banuri,"('قربانی', 'uzhiyah')","('قربانی کا وجوب', 'qurbani-ka-wujoob')","('وجوب قربانی کا نصاب', 'wujoob-e-qurbani-ka-nisaab')"
23-07-2021,https://www.banuri.edu.pk/readquestion/sajde-me-tasbeeh-reh-gai-wutr-me-qunoot-krna-reh-gaya-144212201070/23-07-2021,سجدہ میں تسبیح رہ گئی / وتر میں قنوت کرنا رہ گیا,1-  سجدہ میں تسبیح پڑھنا رہ جائے تو اس کا ازالہ کیسے ہوگا؟2- وتر میں دعاءِ  قنوت پڑھنا بھول جائے تو اس کا ازالہ کیسے ہوگا؟,"<p><p style=""text-align:justify;"">صورتِ  مسئولہ میں رکوع سجود کی تسبیحات رہ جانے کی وجہ سے سجدہ سہو لازم نہ ہوگا، اور نہ ہی اس کے ازالہ کی کوئی صورت ہے۔ البتہ وتر میں  بھول کر  قنوت رہ جائے تو اس صورت میں سجدہ سہو  لازم ہوگا، نہ کرنے کی صورت میں صبح صادق سے پہلے پہلے تک اعادہ واجب ہوگا، صبح صادق تک اعادہ نہ کرنے کی صورت میں وتر ناقص ادا ہوجائے گی۔</p><p>فتاوی بندیہ میں ہے:</p><p class=""indent"" style=""text-align:justify;""><span class=""ar_writing"">""وَ لَا يَجِبُ السُّجُودُ إلَّا بِتَرْكِ وَاجِبٍ أَوْ تَأْخِيرِهِ أَوْ تَأْخِيرِ رُكْنٍ أَوْ تَقْدِيمِهِ أَوْ تَكْرَارِهِ أَوْ تَغْيِيرِ وَاجِبٍ بِأَنْ يَجْهَرَ فِيمَا يُخَافَتُ وَفِي الْحَقِيقَةِ وُجُوبُهُ بِشَيْءٍ وَاحِدٍ وَهُوَ تَرْكُ الْوَاجِبِ، كَذَا فِي الْكَافِي.</span></p><p class=""indent"" style=""text-align:justify;""><span class=""ar_writing"">وَ لَايَجِبُ بِتَرْكِ التَّعَوُّذِ وَالْبَسْمَلَةِ فِي الْأُولَى وَالثَّنَاءِ وَتَكْبِيرَاتِ الِانْتِقَالَاتِ.""</span></p><p class=""indent"" style=""text-align:left;""><span class=""ar_writing"">(الْبَابُ الثَّانِي عَشَرَ فِي سُجُودِ السَّهْوِ، ١ / ١٢٦)</span></p><p>فتاوی ہندیہ میں ہے:</p><p class=""indent"" style=""text-align:justify;""><span class=""ar_writing"">(</span><span class=""ar_writing"">وَمِنْهَا الْقُنُوتُ) فَإِذَا تَرَكَهُ يَجِبُ عَلَيْهِ السَّهْوُ، وَتَرْكُهُ يَتَحَقَّقُ بِرَفْعِ رَأْسِهِ مِنْ الرُّكُوعِ وَلَوْ تَرَكَ التَّكْبِيرَةَ الَّتِي بَعْدَ الْقِرَاءَةِ قَبْلَ الْقُنُوتِ سَجَدَ لِلسَّهْوِ؛ وَلِأَنَّهَا بِمَنْزِلَةِ تَكْبِيرَاتِ الْعِيدِ، كَذَا فِي التَّبْيِينِ.</span></p><p class=""indent"" style=""text-align:left;""><span class=""ar_writing"">( كتاب الصلاة، الْبَابُ الثَّانِي عَشَرَ فِي سُجُودِ السَّهْوِ، ١ / ١٢٨، ط: دار الفكر)</span></p><p>حاشية الطحطاوي على مراقي الفلاح شرح نور الإيضاح میں ہے:</p><p class=""indent"" style=""text-align:justify;""><span class=""ar_writing"">""وإعادتها بتركه عمداً"" أي ما دام الوقت باقياً وكذا في السهو إن لم يسجد له وإن لم يعدها حتى خرج الوقت تسقط مع النقصان وكراهة التحريم ويكون فاسقاً آثماً، وكذا الحكم في كل صلاة أديت مع كراهة التحريم، والمختار أن المعادة لترك واجب نفل جابر، والفرض سقط بالأولى؛ لأن الفرض لايتكرر كما في الدر وغيره، ويندب إعادتها لترك السنة"".</span></p><p class=""indent"" style=""text-align:left;""><span class=""ar_writing"">(كتاب الصلاة، فصل في بيان واجب الصلاة،  ص: ٢٤٧ - ٢٤٨، ط: دار الكتب العلمية)</span></p><p class=""indent"" style=""text-align:left;""> فقط واللہ اعلم</p></p>",144212201070,banuri,"('نماز', 'salat')","('سجدہ سہو', 'sajda-sahv')","('سجدہ سہو کا وجوب و عدم وجوب', 'sajda-sahoo-ka-wujoob-o-adme-wujoob')"
23-07-2021,https://www.banuri.edu.pk/readquestion/namaz-ka-koi-masnoon-amal-reh-jae-tu-kya-hukum-he-144212201071/23-07-2021,نماز کا کوئی مسنون عمل رہ جائے تو کیا حکم ہے؟,نماز میں میں کوئی سنت رہ جائے تو اس کا ازالہ کیسے کیا جائے گا؟,"<p><p style=""text-align:justify;"">نماز کے مسنون اعمال میں سے کوئی عمل رہ جانے کی وجہ سے نماز نہ فاسد ہوتی ہے، اور نہ ہی سجدہ سہو لازم ہوتا ہے، اور نہ ہی اس کے ازالہ کی کوئی صورت ہے، البتہ جان بوجھ کر نماز کے مسنون اعمال میں سے کوئی عمل چھوڑنا باعثِ گناہ ہے۔</p><p>فتاوی ہندیہ میں ہے:</p><p class=""indent"" style=""text-align:justify;""><span class=""ar_writing"">""وَ لَايَجِبُ السُّجُودُ إلَّا بِتَرْكِ وَاجِبٍ أَوْ تَأْخِيرِهِ أَوْ تَأْخِيرِ رُكْنٍ أَوْ تَقْدِيمِهِ أَوْ تَكْرَارِهِ أَوْ تَغْيِيرِ وَاجِبٍ بِأَنْ يَجْهَرَ فِيمَا يُخَافَتُ وَفِي الْحَقِيقَةِ وُجُوبُهُ بِشَيْءٍ وَاحِدٍ وَهُوَ تَرْكُ الْوَاجِبِ، كَذَا فِي الْكَافِي.</span></p><p class=""indent"" style=""text-align:justify;""><span class=""ar_writing"">وَ لَايَجِبُ بِتَرْكِ التَّعَوُّذِ وَالْبَسْمَلَةِ فِي الْأُولَى وَالثَّنَاءِ وَتَكْبِيرَاتِ الِانْتِقَالَاتِ إلَّا فِي تَكْبِيرَةِ رُكُوعِ الرَّكْعَةِ الثَّانِيَةِ مِنْ صَلَاةِ الْعِيدِ وَ لَايَجِبُ بِتَرْكِ رَفْعِ الْيَدَيْنِ فِي الْعِيدَيْنِ وَغَيْرِهِمَا وَمِنْ ذَلِكَ مَا لَوْ سَلَّمَ عَنْ الشِّمَالِ أَوَّلًا سَاهِيًا وَلَوْ تَرَكَ الْقَوْمَةَ سَاهِيًا بِأَنْ انْحَطَّ مِنْ الرُّكُوعِ سَاجِدًا فَفِي فَتَاوَى قَاضِي خَانْ أَنَّ عَلَيْهِ السُّجُودَ عِنْدَ أَبِي حَنِيفَةَ وَمُحَمَّدٍ - رَحِمَهُمَا اللَّهُ تَعَالَى - هَكَذَا فِي فَتْحِ الْقَدِيرِ.""</span></p><p class=""indent"" style=""text-align:left;""><span class=""ar_writing"">(كتاب الصلاة، الْبَابُ الثَّانِي عَشَرَ فِي سُجُودِ السَّهْوِ، ١ / ١٢٦ ، ط: دار الفكر)</span></p><p class=""indent"" style=""text-align:left;""> فقط واللہ اعلم</p></p>",144212201071,banuri,"('نماز', 'salat')","('سجدہ سہو', 'sajda-sahv')","('سجدہ سہو کا وجوب و عدم وجوب', 'sajda-sahoo-ka-wujoob-o-adme-wujoob')"
23-07-2021,https://www.banuri.edu.pk/readquestion/makrooh-auqaat-mr-qurbani-krna-144212201072/23-07-2021,مکروہ اوقات میں قربانی کرنا,مکروہ اوقات میں قربانی کرنے کا کیا حکم ہے؟,"<p><p style=""text-align:justify;"">مکروہ اوقات  میں فرائض، نوافل، نمازہ جنازہ، سجدہ تلاوت ممنوع ہے، ان کے علاوہ دیگر عبادات، تلاوت قرآن مجید، طواف، قربانی ممنوع نہیں، لہذا صورتِ مسئولہ میں مکروہ اوقات قربانی کرنا جائز ہوگا۔</p><p><span class=""ar_writing"">مشكاة المصابيح</span>میں ہے:</p><p class=""indent"" style=""text-align:justify;""><span class=""ar_writing"">""و عن عقبة بن عامر قال: ثلاث ساعات كان رسول الله صلى الله عليه وسلم ينهانا أن نصلي فيهن أو نقبر فيهن موتانا: حين تطلع الشمس بازغة حتى ترتفع وحين يقوم قائم الظهيرة حتى تميل الشمس وحين تضيف الشمس للغروب حتى تغرب. رواه مسلم.""</span></p><p class=""indent"" style=""text-align:left;""><span class=""ar_writing"">( كتاب الصلاة، باب أوقات النهي، الفصل الأول، ١ / ٣٢٧، ط: المكتب الإسلامي - بيروت)</span></p><p><span class=""ar_writing"">مرقاة المفاتيح شرح مشكاة المصابيح</span> میں ہے:</p><p class=""indent"" style=""text-align:justify;""><span class=""ar_writing"">""و المذهب عندنا أن هذه الأوقات الثلاثة يحرم فيها الفرائض و النوافل، و صلاة الجنازة، و سجدة التلاوة إلا إذا حضرت الجنازة أو تليت آية السجدة حينئذ، فإنهما لايكرهان لكن الأولى تأخيرهما إلى خروج الأوقات.""</span></p><p class=""indent"" style=""text-align:left;""><span class=""ar_writing"">( كتاب الصلاة، باب أوقات النهي، ٢ / ٨٢١، ط: دار الفكر، بيروت - لبنان)</span></p><p class=""indent"" style=""text-align:left;""> فقط واللہ اعلم</p></p>",144212201072,banuri,"('قربانی', 'uzhiyah')","('قربانی کا وقت', 'waqt-e-udhiya')","('قربانی کے ایام اور وقت', 'qurbani-ke-ayyaam-or-waqt')"
23-07-2021,https://www.banuri.edu.pk/readquestion/janwar-zibah-krne-ki-video-bnana-144212201073/23-07-2021,جانور ذبح کرنے کی ویڈیو بنانا,قربانی کرتے وقت ویڈیو بنانے سے کیا جانور حرام ہو جاتاہے؟,"<p><p style=""text-align:justify;"">جاندار کی ویڈیو بنانا حرام ہے، جس کے سبب جانور کی قربانی کی ویڈیو بنانے کی شرعًا اجازت نہیں، البتہ اس عمل کی وجہ سے جانور حرام نہیں ہوتا۔ فقط واللہ اعلم</p></p>",144212201073,banuri,"('حظر و اباحت', 'mamnooaat-mubahat')","('ماکولات / مشروبات', 'makoolat-mashroobat')","('کھانے پینے کی حلال و حرام ، مکروہ و مباح اشیاء', 'khanay-penay-ki-halal-o-haram-makroh-o-mubah-ashya')"
