issued_at,link,title,question,answer,fatwa_number,dar_ul_ifta,kitab,bab,fasal
03-04-2022,https://www.banuri.edu.pk/readquestion/goagle-adsense-se-kamane-ka-hukm-144309100033/03-04-2022,گوگل ایڈسنس سے کمانے کا حکم,گوگل ایڈسنس سے کمانا کیسا ہے ؟وضاحت:دنیا کے سب سے بڑے سرچ انجن گوگل کا اشتہارات نشر کرنے کا پروگرام گوگل ایڈسینس کہلاتا ہے۔ اس پروگرام میں شمولیت کے لیے لازمی ہے کہ آپ کے پاس اپنی کوئی ذاتی ویب سائٹ ہو، جس پر اشتہارات نشر کرنے کی ذمہ داری آپ گوگل کے سپرد کر دیتے ہیں،گوگل اشتہارات دینے والوں سے سائیٹ پر اشتہارات دکھانے کے پیسے نہیں لیتا، بلکہ جب کوئی اس اشتہار کلک کرتا ہے، تب ان سے فی کلک کے حساب سے رقم وصول کی جاتی ہے اور حاصل ہونے والی آمدنی اس ویب سائٹ اور گوگل کے مابین تقسیم ہوتی ہے۔,"<p><p style=""text-align:justify;""><span class=""ur_writing"">واضح رہے کہ اگر ویب سائٹ پر اشتہارات نشر کرنے والا:</span></p><p class=""indent""><span class=""ur_writing"">1.جان د ار  کی تصویر والا اشتہار نشر کرے۔</span></p><p class=""indent""><span class=""ur_writing"">2.یا اس اشتہار میں میوزک  اور موسیقی ہو۔</span></p><p class=""indent""><span class=""ur_writing"">3.یا اشتہار  غیر شرعی ہو۔</span></p><p class=""indent""><span class=""ur_writing"">4.یا  کسی بھی غیر شرعی شے کا اشتہار ہو۔</span></p><p class=""indent""><span class=""ur_writing"">5.یا اس کے لیے کوئی غیر شرعی معاہدہ کرنا پڑتا ہو۔</span></p><p style=""text-align:justify;""><span class=""ur_writing"">تو اس کے ذریعے پیسے کمانا جائز نہیں ہے اور ایسی صورت میں ان اشتہارات سے اگر کوئی کمائی کی ہو تو اسے صدقہ کردے۔</span></p><p style=""text-align:justify;""><span class=""ur_writing"">عام طور پر اگر  اشتہار بنانے والے کی نشر کردہ اشتہار میں مذکورہ خرابیاں  نہ بھی ہوں تب بھی گوگل کی طرف سے لگائے جانے والے  اشتہار میں یہ خرابیاں پائی جاتی ہیں، اور ہماری معلومات کے مطابق  گوگل  پر ویب سائٹ بناتے وقت ہی معاہدہ کیا جاتاہے کہ  مخصوص مدت میں ویب سائٹ کے سبسکرائبرز اور  ویورز مخصوص تعداد تک پہنچیں گے تو گوگل  انتظامیہ اس ویب سائٹ پر مختلف لوگوں کے اشتہارات چلانے کی مجاز ہوگی، اور ویب سائٹ بنانے والا اس معاہدے کو تسلیم کرنے پر مجبور ہوتاہے، الا یہ کہ اشتہارات بند کرنے کے لیے وہ باقاعدہ فیس ادا کرے اور ویب سائٹ کو کمرشل بنیاد پر استعمال نہ کرے، اور ان اشتہارات کا انتخاب کسی بھی یوزر کی سرچنگ بیس یا لوکیشن یا مختلف لوگوں کے اعتبار سے مختلف ہوسکتاہے، ویب سائٹ  بناتے وقت چوں کہ اس معاہدے پر رضامندی پائی جاتی ہے، لہٰذا گوگل پر کمرشل بنیاد پر ویب سائٹ بنانا ہی درست نہیں ہے، اور ویب سائٹ بناتے وقت گوگل انتظامیہ کو جب ایڈ چلانے کی اجازت دی جائے تو اس کے بعد وہ  مختلف ڈیوائسز کی سرچنگ بیس یا لوکیشن یا ملکوں کے حساب سے مختلف ایڈ چلاتے ہیں، مثلاً اگر  پاکستان میں اسی ویڈیو پر وہ کوئی اشتہار چلاتے ہیں، مغربی ممالک میں اس پر وہ کسی اور قسم کا اشتہار چلاتے ہیں،  اور پاکستان میں ہی ایک شخص کی ڈیوائس پر الگ اشتہار  چلتاہے تو دوسرے شخص کی ڈیوائس پر دوسری نوعیت کا اشتہار چل سکتاہے، جس  میں بسااوقات حرام اور  ناجائز چیزوں کی تشہیر بھی کرتے ہیں، ان تمام مفاسد کے پیشِ نظر ویب سائٹ پر اشتہار نشر کرکے پیسے کمانے کی شرعًا اجازت نہیں ہے۔</span></p><p style=""text-align:justify;""><span class=""ur_writing"">علاوہ ازیں ویب سائٹ  کے ذریعے اگر آمدن مقصود ہو تو اس سلسلے میں انتظامیہ سے اجارے کا جو معاہدہ کیا جاتاہے  وہ بھی شرعی تقاضے پورے نہ ہونے  (مثلًا: اجرت کی جہالت) کی وجہ سے جائز نہیں ہوتا۔</span></p><p style=""text-align:justify;""><span class=""ur_writing"">تفصیل اس کی یہ ہے کہ ویب سائٹ  بنا کر اس پر اشتہار نشر کر کے  کمائی کی صورتیں  مندرجہ ذیل ہوتی  ہیں: </span></p><p style=""text-align:justify;""><span class=""ur_writing"">۱) ایڈورٹائزمنٹ کے ذریعہ کمائی: گوگل پر جب کوئی ویب سائٹ کھولتا ہے اور اس پر مواد ڈالتا ہے تو ویب سائٹ کھولنے والا گوگل کو اس بات کی اجازت دیتا ہے کہ گوگل مختلف قسم کے  ایڈز اس کے چینل  پر چلائے، گوگل ان ایڈز سے جو حاصل کرتاہے تو  حاصل ہونے والی آمدنی اس ویب سائٹ اور گوگل کے مابین تقسیم ہوتی ہے، گوگل   اشتہارات دینے والوں  سے لوگوں کے ہر کلک کے حساب سے رقم وصول کرتا ہے۔</span></p><p style=""text-align:justify;""><span class=""ur_writing"">۲) گوگل کے جو   کسٹمرز ہیں گوگل ان سے سبسکرپشن فیس لیتا ہے اور جب وہ لوگ کسی ویب سائٹ کو دیکھتے ہیں تو  گوگل  اس  ویب سائٹ  والے کو اس سبسکرپشن فیس میں سے کچھ دیتا ہے۔</span></p><p style=""text-align:justify;""><span class=""ur_writing"">اب ہر ایک کا حکم ترتیب وار ذکر ہے:</span></p><p style=""text-align:justify;""><span class=""ur_writing"">۱) ایڈ کے ذریعہ کمائی  کی صورت شرعًا اجارہ کا معاملہ ہے جو گوگل اور ویب سائٹ کے مالک کے درمیان ہوتا ہے۔ گوگل  ویب سائٹ کے مالک کو اس کے ویب سائٹ کے استعمال پر  (ایڈ نشر کرنے کی صورت میں)  اجرت دیتا ہے۔</span></p><p style=""text-align:justify;""><span class=""ur_writing"">یہ اجرت مندرجہ ذیل خرابیوں کی وجہ سے حلال نہیں ہے:</span></p><p style=""text-align:justify;""><span class=""ur_writing"">الف) گوگل کو اختیار ہوتا ہے کہ وہ کسی قسم كا بھی ایڈ چلائے، ان میں جائز ،ناجائز ہرقسم کی چیزوں کی تشہیر کی جاتی ہے ،نیز  اکثر ایڈ  ذی روح یعنی جاندار  کی تصاویر پر مبنی ہوتی ہیں اور سائل کو انہیں ایڈز کی اجرت ملتی ہے، لہذا یہ اجرت کا معاہدہ  تعاون على الاثم  ہونے کی وجہ سے ناجائز  ہوگا اور کمائی بھی حلال  نہیں ہوگی۔</span></p><p style=""text-align:justify;""><span class=""ur_writing"">ب)  اجرت مجہول ہوتی ہے؛ کیوں کہ گوگل ایک متعین اجرت نہیں طے کرتا،  بلکہ ایڈسنس اشتہار سے 68٪ رقم لیتے ہیں اور ویب سائٹ کے مالک کو 32٪ دیتے ہیں گوگل اسے اپنے پاس رکھتا ہے  اور گوگل کی کل اجرت مجہول ہوتی ہے تو  اس کا  32فیصد بھی مجہول ہوتا ہے۔ ویب سائٹ  کے استعمال کی اجرت کا تعلق وقت کے ساتھ ہونا چاہیے یعنی جتنی دیر اس پر ایڈ چلے اس حساب سے اجرت ملے؛ لہذا اگر وایب سائٹ پر چلنے والے ایڈز اگر سب کے سب  شرعی دائرہ کے اندر بھی ہوں تب بھی یہ معاملہ شرعًا اجارہ فاسد ہوگا اور اجرت حلال نہیں ہوگی۔</span></p><p style=""text-align:justify;""><span class=""ur_writing"">۲) گوگل ممبر  سے بعض سہولیات (جو اشتہار  دیکھنے اور ڈاون لوڈ کرنے سے متعلق ہوتی ہیں)کے بدلہ سبسکرپشن فیس  (اجرت)  لیتا ہے  اور  جب یہ    ممبر  کسی ویب سائٹ  کو دیکھتا ہے تو گوگل اس پر ویب سائٹ والے کو رقم دیتا ہے۔یہ رقم گوگل  ویب سائٹ  والے کو دیتا ہےویب سائٹ  استعمال کرنے کی اجرت ہے ۔یہ اجرت بھی مندرجہ ذیل وجوہ سے شرعًا جائز نہیں ہے:</span></p><p style=""text-align:justify;""><span class=""ur_writing"">الف)  ویب سائٹ پر موجود اشتہار اگر  جاندار  کی تصاویر پر مشتمل ہیں تو یہ  ""اجرت علی المعاصی""  ہونے کی وجہ سے حرام ہوگی۔ </span></p><p style=""text-align:justify;""><span class=""ur_writing"">ب)اگر اشتہار شرعی دائرہ کے مطابق ہو تب بھی اجرت مجہول ہونے کی وجہ سے ناجائز اور حرام ہوگی؛ کیوں کہ ویب سائٹ کے استعمال کی اجرت وقت کے ساتھ متعین ہونی چاہیے کہ اتنے وقت کی اتنی اجرت ہے یا پھر مکمل مہینہ یا سال کی اتنی اجرت ہے جب کہ مذکورہ صورت میں ہماری معلومات کے مطابق اس طرح ویب سائٹ والے کی اجرت متعین نہیں ہوتی۔</span></p><p style=""text-align:justify;""><span class=""ur_writing"">فتاوى هندية میں ہے:</span></p><p class=""indent"" style=""text-align:justify;""><span class=""ar_writing"">""و منها أن يكون مقدور الاستيفاء - حقيقة أو شرعًا فلايجوز استئجار الآبق و لا الاستئجار على المعاصي؛ لأنه استئجار على منفعة غير مقدورة الاستيفاء شرعا.... ومنها أن تكون المنفعة مقصودة معتادًا استيفاؤها بعقد الإجارة و لايجري بها التعامل بين الناس فلايجوز استئجار الأشجار لتجفيف الثياب عليها. .... ومنها أن تكون الأجرة معلومةً.""</span></p><p class=""indent"" style=""text-align:left;""><span class=""ur_writing"">(کتاب الاجارۃ ج نمرب ۴ ص نمبر ۴۱۱،دار الفکر)</span></p><p style=""text-align:justify;""><span class=""ur_writing"">فتاوی شامي ميں ہے:</span></p><p class=""indent"" style=""text-align:justify;""><span class=""ar_writing"">""(لا تصح الإجارة لعسب ‌التيس) وهو نزوه على الإناث (و) لا (لأجل المعاصي مثل الغناء والنوح والملاهي)"".</span></p><p class=""indent"" style=""text-align:left;""><span class=""ur_writing"">(کتاب الجارۃ ، باب الاجارۃ الفاسدۃ، ج:6،  ص:55،  ط:سعید)</span></p><p style=""text-align:justify;""><span class=""ur_writing"">وفیہ ایضاً:</span></p><p class=""indent"" style=""text-align:justify;""><span class=""ar_writing"">""لأن سبیل الکسب الخبیث التصدق إذا تعذر الرد علی صاحبه"".</span></p><p class=""indent"" style=""text-align:left;""><span class=""ur_writing"">(کتاب الحظر الاباحۃ، باب البیع، ج:6، ص:385، ط:سعید)</span></p><p>وفیہ ایضاً:</p><p class=""indent"" style=""text-align:justify;""><span class=""ar_writing"">""قال ابن مسعود: صوت اللهو و الغناء ينبت النفاق في القلب كما ينبت الماء النبات. قلت: و في البزازية: إستماع صوت الملاهي كضرب قصب و نحوه حرام ؛لقوله عليه الصلاة و السلام: استماع الملاهي معصية، و الجلوس عليها فسق، و التلذذ بها كفر؛ أي بالنعمة"".</span></p><p class=""indent"" style=""text-align:left;""><span class=""ur_writing"">( ٦/ ٣٤٨ - ٣٤٩، ط: سعيد)</span></p><p class=""indent"" style=""text-align:left;""><span class=""ur_writing"">فقط واللہ اعلم</span></p></p>",144309100033,banuri,"('حظر و اباحت', 'mamnooaat-mubahat')","('متفرقات', 'mutafarriqaat')","('متفرقات ممنوعات و مباحات', 'muatafarriqaat-e-mamnooaat-o-mubahaat')"
23-02-2022,https://www.banuri.edu.pk/readquestion/بائنینس-binance-نامی-ایپ-کے-ذریعے-کرپٹو-کرنسی-کے-کاروبار-میں-حصہ-لینا-144307101810/23-02-2022,بائنینس (binance) نامی ایپ کے ذریعے کرپٹو کرنسی کے کاروبار میں حصہ لینا,بائنینس (binance) نامی ایپ کے ذریعے کرپٹو کرنسی کے کاروبار میں حصہ لینا جائز ہے؟,"<p><p style=""text-align:justify;"">بائنینس (binance) نامی ایپ یا کسی بھی ذریعہ سے کرپٹو کرنسیز (crypto currencies) میں کاروبار جائز نہیں ہے اور اس سے حاصل ہونے والا نفع بھی حلال نہیں ہے۔</p><p style=""text-align:justify;"">ام المدارس ،دارالعلوم دیوبند کے دارالافتاء کا مؤقف بھی کرپٹو کرنسی کے ذریعہ کاروبار کی کسی صورت سے متعلق ناجائز ہونے کا ہے ۔چنانچہ  اسی نوعیت کے ایک سوال کے جواب میں دارالعلوم دیوبند سے جاری ہونے والے فتوی میں لکھا گیا ہے :</p><p class=""indent"">’’کریپٹو کرنسی (بٹ کوئن وغیرہ)کو آپ ڈیجیٹل کرنسی کہیں یا ڈیجیٹل تجارتی چیز، بہر صورت یہ ایک فرضی چیز ہے اور اس کا عنوان ہاتھی کے دانت کی طرح محض دکھانے کی چیز ہے۔بٹ کوئن یا کوئی بھی کریپٹو کرنسی فقہائے کرام کی تصریحات کی روشنی میں از روئے شرع مال نہیں ہے اور نہ ہی یہ ثمن عرفی ہے۔ نیز اس کاروبار میں حقیقت میں کوئی مبیع وغیرہ نہیں ہوتی اور نہ ہی اس میں بیع کے جواز کی شرعی شرطیں پائی جاتی ہیں؛ بلکہ در حقیقت یہ فاریکس ٹریڈنگ کی طرح سود اور جوے کی شکل ہے ؛ اس لیے کرپٹو کرنسی (:بٹ کوئن یا کسی بھی ڈیجیٹل کرنسی) کی خرید وفروخت کی شکل میں نیٹ پر چلنے والا کاروبار شرعاًحلال وجائز نہیں ہے؛ اس لیے کسی مسلمان کے لیے اس کاروبار میں پیسے انویسٹ کرنا بھی شرعاً جائز نہ ہوگا ‘‘۔</p><p class=""indent"" style=""text-align:left;"">(جواب نمبر: 158329۔فتوی:470-424/N=5/1439)</p><p class=""indent"" style=""text-align:left;"">فقط واللہ اعلم</p></p>",144307101810,banuri,"('بیوع', 'buyoo')","('بیع فاسد و باطل', 'bayee-faased-o-baatil')","('بیع باطل اور اس کا حکم', 'bayee-baatil')"
02-04-2022,https://www.banuri.edu.pk/readquestion/ramazan-men-bivi-k-sath-hambestari-krny-ka-hukam-144308102265/02-04-2022,رمضان میں بیوی کے ساتھ ہمبستری کرنے کا حکم,کوئی شخص رمضان میں بیوی کے ساتھ ہمبستری کر سکتا ہے یا نہیں؟,"<p><p style=""text-align:justify;"">رمضان المبارک میں طلوعِ فجر سے غروبِ آفتاب تک (یعنی روزے کی حالت میں)  بیوی کے ساتھ ہمبستری کرنا جائز نہیں ہے، اس کے علاوہ رات کو بیوی کے ساتھ ازدواجی تعلقات قائم کرنا جائز  ہے۔</p><p style=""text-align:justify;"">بدائع الصنائع میں ہے:</p><p class=""indent""><span class=""ar_writing"">""وأما ركنه: فالإمساك عن الأكل، والشرب، والجماع لأن الله تعالى أباح الأكل، والشرب، والجماع في ليالي رمضان لقوله تعالى {‌أحل ‌لكم ‌ليلة ‌الصيام الرفث} إلى قوله {فالآن باشروهن وابتغوا ما كتب الله لكم وكلوا واشربوا حتى يتبين لكم الخيط الأبيض من الخيط الأسود من الفجر} [البقرة: 187] أي: حتى يتبين لكم ضوء النهار من ظلمة الليل من الفجر، ثم أمر بالإمساك عن هذه الأشياء في النهار بقوله عز وجل {ثم أتموا الصيام إلى الليل} فدل أن ركن الصوم ما قلنا فلا يوجد الصوم بدونه.""</span></p><p class=""indent"" style=""text-align:left;""><span class=""ar_writing"">(کتاب الصوم، ج2، ص:90، ط: دار الکتب العلمیة)</span></p><p class=""indent"" style=""text-align:left;""><span class=""ar_writing"">فقط والله أعلم</span></p></p>",144308102265,banuri,"('روزہ', 'soum')","('روزہ توڑنے والی چیزیں', 'roza-torne-wali-chezen')","('ہم بستری وغیرہ', 'humbistari-wagera')"
09-04-2022,https://www.banuri.edu.pk/readquestion/kutta-agr-hala-janwr-ko-kat-lay-to-halal-janwr-kay-gosht-ka-kia-hukum-hay-144309100344/09-04-2022,کتا اگر حلال جانور کو کاٹ لے تو حلال جانور کے گوشت کا کیا حکم ہے؟,کتا اگر حلال جانور کو کاٹ لے حلال جانور کے گوشت کا کیا حکم ہے؟,"<p><p style=""text-align:justify;""><span class=""ur_writing"">کتا اگر حلال جانور کو کاٹ لے تو اس سے حلال جانور حرام نہیں ہوجاتا، البتہ اگر کتا باؤلا ہو اور طبی لحاظ سے کاٹے ہوئے حلال جانور کا گوشت  نقصان دہ ہو تو پھر ایسے جانور کا  گوشت نہیں کھانا چاہئے۔</span></p><p>شرح مختصر الطحاوی میں ہے:</p><p class=""indent"" style=""text-align:justify;""><span class=""ar_writing"">""وما أكل السبع إلا ما ذكيتم] فحرم جميع ما يأكل منه السبع إلا بشرط الذكاة، والكلب سبع"".</span></p><p class=""indent"" style=""text-align:left;""><span class=""ar_writing"">(شرح مختصر الطحاوي للجصاص: كتاب الصيد والذبائح (7/ 249)، ط. دار البشائر الإسلامية - ودار السراج، الطبعة الأولى: 1431 هـ = 2010 م)</span></p><p>العقود الدریۃ فی الفتاوی الحامدیۃ میں ہے:</p><p class=""indent"" style=""text-align:justify;""><span class=""ar_writing"">""والثاني أن الأصل في المضار التحريم، والمنع لقوله - عليه الصلاة والسلام - «لا ضرر ولا ضرار في الإسلام» وأيضا ضبط أهل الفقه حرمة التناول إما بالإسكار كالبنج وإما بالإضرار بالبدن كالتراب، والترياق أو بالاستقذار كالمخاط، والبزاق وهذا كله فيما كان طاهرا"".</span></p><p class=""indent"" style=""text-align:left;""><span class=""ar_writing"">(العقود الدرية في تنقيح الفتاوى الحامدية: مسائل وفوائد شتى من الحظر والإباحة وغير ذلك، مسألة أفتى أئمة أعلام بتحريم شرب الدخان  (2/ 332)، ط. دار المعرفة)</span></p><p class=""indent"" style=""text-align:left;""><span class=""ur_writing"">ف</span><span class=""ur_writing"">قط واللہ اعلم</span></p></p>",144309100344,banuri,"('ذبح و شکار', 'said-o-zabaeh')","('حلال و حرام حیوانات', 'halaal-o-haraam-hayiwanaat')","('حلال جانور', 'halaal-janwar')"
11-04-2022,https://www.banuri.edu.pk/readquestion/uswl-w-furoa-kw-khana-khilany-sy-kffara-ada-nhin-hwga-144309100543/11-04-2022,اصول و فروع اور بیوی کو کھانا کھلانے سے کفارہ ادا نہیں ہوگا,اگر روزے کا کفارہ اپنے گھر کے مستحق افراد کو سال میں کھلایا جائے، کیا کفارہ ادا ہو جائے گا ؟,"<p><p style=""text-align:justify;"">کفارہ میں اپنے اصول( یعنی والدین ، دادا  دادی وغیرہ)و فروع (یعنی اولاد، اولاد کی اولاد وغیرہ) اور بیوی کو کھانا کھلانے سے کفارہ ادا نہیں ہوگا، البتہ بہن بھائی اگر زکوۃ کے  مستحق ہوں تو ان کو کفارے کا کھانا کھلانے سے کفارہ ادا ہو جائے گا۔مناسب یہ ہے کہ مستحق ِ زکوۃ کو نقد رقم دے دی جائے تاکہ وہ اپنی سہولت کے مطابق استعمال کرے۔</p><p>فتاوی شامی میں ہے:</p><p class=""indent"" dir=""rtl"" style=""text-align:justify;""><span class=""ar_writing""><span lang=""ar-sa"" xml:lang=""ar-sa"">""والضابط أن ما شرع بلفظ إطعام وطعام جاز فيه الإباحة، وما شرع بلفظ إيتاء وأداء شرط فيه التمليك.</span><span lang=""ar-sa"" xml:lang=""ar-sa"">""</span></span></p><p class=""indent"" dir=""rtl"" style=""text-align:left;""><span lang=""ar-sa"" xml:lang=""ar-sa"">(باب کفارۃ الظہار/ج:3/ص:478/ط:سعید)</span></p><p style=""text-align:justify;"">الدر المختار و حاشیۃ ابن عابدین میں ہے:</p><p class=""indent"" style=""text-align:justify;""><span class=""ar_writing"">""(لا) يصرف (إلى بناء) نحو مسجد  ... (ولا) إلى (من بينهما ولاد) ولو مملوكا لفقير (أو) بينهما (زوجية) .</span></p><p class=""indent"" style=""text-align:justify;""><span class=""ar_writing"">قوله: وإلى من بينهما ولاد) أي بينه وبين المدفوع إليه؛ لأن منافع الأملاك بينهم متصلة فلا يتحقق التمليك على الكمال هداية والولاد بالكسر مصدر ولدت المرأة ولادة وولادا مغرب أي أصله وإن علا كأبويه وأجداده وجداته من قبلهما وفرعه وإن سفل بفتح الفاء من باب طلب والضم خطأ؛ لأنه من السفالة وهي الخساسة مغرب كأولاد الأولاد وشمل الولاد بالنكاح والسفاح فلا يدفع إلى ولده من الزنا ولا من نفاه كما سيأتي، وكذا كل صدقة واجبة كالفطرة والنذر والكفارات.""</span></p><p class=""indent"" style=""text-align:left;"">(کتاب الزکوۃ، باب العشر، باب مصرف الزکوۃ و العشر: 2 / 346، ط: سعید)</p><p class=""indent"" style=""text-align:left;"">فقط و اللہ اعلم</p></p>",144309100543,banuri,"('روزہ', 'soum')","('روزہ کی قضا، کفارہ اور فدیہ', 'roza-ki-qaza-kaffara-aur-fidya')","('روزہ کا کفارہ اور اس کے احکام', 'roza-ka-kaffara-aur-is-ke-ahkaam')"
