issued_at,link,title,question,answer,fatwa_number,dar_ul_ifta,kitab,bab,fasal
04-03-2022,https://www.banuri.edu.pk/readquestion/kamyab-pakistan-program-say-qarz-laina-kaisa-hay-144307102529/04-03-2022,کامیاب پاکستان پروگرام سےقرض لینا کیسا ہے؟,"گھر یا پلاٹ کیلئے""کامیاب پاکستان پروگرام"" سےقرض لینا کیسا ہے؟","<p><p style=""text-align:justify;""><span style=""font-family:Nafees;font-size:17px;"">p, s, x یعنی  پاکستان اسٹاک ایکسچینج لمیٹڈ (</span><span style=""font-family:Nafees;font-size:17px;""> </span><span style=""font-family:Nafees;font-size:17px;"">pakistan stock exchage limited)</span><span style=""font-family:Nafees;font-size:17px;"">ویب سائٹ پر</span>میسر معلومات کے مطابق   ""کامیاب پاکستان  پروگرام"" میں  دو فیصد سود  قرض لینے والا  ادا کرے گا اور بقیہ سود حکومت ادا کرے گی، چوں کہ یہ سودی لین دین سے پاک نہیں ہے ، لہذا اس پروگرام کے تحت  قرضہ کا لین دین شرعاً ناجائز  اور حرام ہے۔</p><p><span class=""ur_writing""> ارشاد باری تعالی ہے:</span></p><p class=""indent""><span class=""qr_writing"">﴿ أَحَلَّ اللّٰهُ الْبَیْْعَ وَحَرَّمَ الرِّبَا﴾ (البقرة:275)</span></p><p class=""indent"">ترجمہ:<span class=""ur_writing"">” اللہ  تعالیٰ نے بیع کو حلال اور سود کو حرام قرارا دیا ہے ۔“</span></p><p class=""indent""><span class=""qr_writing"">﴿ فَإِن لَّمْ تَفْعَلُواْ فَأْذَنُواْ بِحَرْبٍ مِّنَ اللّٰهِ وَرَسُولِه﴾ (البقرة:278)</span></p><p class=""indent""><span class=""ur_writing"">ترجمہ:” اگر تم سودی کاروبار سے باز نہیں آؤ گے تو  اللہ  تعالیٰ اور اس کے رسول کی طرف سے اعلان جنگ سن لو""۔</span></p><p>حدیث شریف میں ہے:</p><p class=""indent"" style=""text-align:justify;""><span class=""ar_writing"">""عن جابر قال: لعن رسول الله صلى الله عليه وسلم آكل الربا وموكله وكاتبه وشاهديه، وقال هم سواء"".</span></p><p class=""indent"" dir=""rtl"" style=""text-align:left;""><span class=""ar_writing"">(أخرجه الإمام مسلم في باب لعن آكل الربا وموكله (5/ 50) برقم (4177)، ط. دار الجيل بيروت، بيروت)</span></p><p class=""indent"" dir=""rtl"" style=""text-align:justify;""><span class=""ur_writing"">ترجمہ:""حضرت جابر بن عبداللہ رضی اللہ عنہ فرماتے ہیں کہ :رسول اللہ  صلی اللہ  علیہ وسلم نے سود کھانے اور سود دینے اور سودی حسابات یا تحریر لکھنے والے اور سودی لین دین پر گواہ بننے والوں پر لعنت فرمائی ہے، اور فرمایا کہ یہ سب لوگ گناہ میں برابر ہیں""۔</span></p><p class=""indent"" dir=""rtl"" style=""text-align:left;""><span class=""ur_writing"">فقط واللہ اعلم</span></p></p>",144307102529,banuri,"('معاملات', 'muamlat')","('سود / بینکاری / انشورنس / شیئرز', 'sood-bankari-insurance-shares')","('سودی قرضہ کی لین دین', 'soodi-qarzay-ki-layn-dayn')"
22-04-2022,https://www.banuri.edu.pk/readquestion/gobar-aur-murghi-ki-beet-bechna-144309101315/22-04-2022,گوبر اور مرغی کی بیٹ بیچنا,گوبر، مرغی کی بیٹ بیچنا جائز ہے؟,"<p><p style=""text-align:justify;"">گوبر   خالص بیچنا بھی جائز ہے، اور مٹی وغیرہ کے ساتھ ملا ہوا ہو یا کھاد کی صورت میں ہو تب بھی اس کی خرید و فروخت  جائز ہے اور اُس سے حاصل شدہ آمدنی کو استعمال کرنا بھی جائز ہے۔(تجارت کے مسائل کا انسائیکلوپیڈیا،5/418، ط: بیت العمار)۔ اور مرغی کی بیٹ (جو پولٹری فارم والے زمینداروں کو کھاد کے طور پر فروخت کرتے ہیں، اس) کے ساتھ بھی چونکہ مٹی وغیرہ ملی ہوتی ہے، لہٰذا اس کا بیچنا بھی جائز ہے۔(تجارت کے مسائل کا انسائیکلوپیڈیا،6/151، ط: بیت العمار)</p><p style=""text-align:justify;"">الفقہ الاسلامی و أدلتہ میں ہے:</p><p class=""indent"" style=""text-align:justify;""><span class=""ar_writing"">""ويكره بيع العَذِرة، ولا بأس ببيع السرقين أو السرجين: وهو (الزبل) وبيع البعر، لأنه منتفع به، لأنه يلقى في الأرض لاستكثار الريع، فكان مالاً، والمال محل للبيع بخلاف العذرة، لأنه لا ينتفع بها إلا مخلوطة، ويجوز بيع المخلوط كالزيت الذي خالطته النجاسة.""</span></p><p class=""indent"" style=""text-align:left;""><span class=""ar_writing"">(القسم الثالث، الفصل الأول، المبحث الرابع، المطلب الأول: أنواع البيع الباطل، بيع النجس والمتنجس، 5/ 3431، الناشر: دار الفكر- دمشق)</span></p><p style=""text-align:justify;"">المحیط البرہانی میں ہے:</p><p class=""indent"" style=""text-align:justify;""><span class=""ar_writing"">""ويجوز بيع ‌السرقين والبعر والانتفاع بها، وأما العذرة فلا يجوز الانتفاع بها ما لم يخلط بالتراب ويكون التراب غالبا، وهذا لأن محلية البيع بالمالية، والمالية بالانتفاع، والناس اعتادوا الانتفاع بالبعر والسرقين من حيث الإلقاء في الأرض لكثرة الريع، أما ما اعتادوا الانتفاع بالعذرة ما لم يكن مخلوطاً بالتراب، ويكون التراب هو الغالب""</span></p><p class=""indent"" style=""text-align:left;""><span class=""ar_writing"">(كتاب البيع،  ‌‌الفصل السادس: فيما يجوز وما لا يجوز بيعه، 6/ 350، الناشر: دار الكتب العلمية، بيروت)</span></p><p class=""indent"" style=""text-align:left;"">فقط واللہ اعلم</p></p>",144309101315,banuri,"('معاملات', 'muamlat')","('بیع / تجارت', 'bay-tijarat')","('بیع صحیح ، فاسد اور باطل', 'bay-sahih-fasid-or-batil')"
23-04-2022,https://www.banuri.edu.pk/readquestion/miyaan-bewi-aek-dosaray-ki-shramghah-ko-haath-lagana-ya-dekhna-144309101395/23-04-2022,میاں بیوی کا ایک دوسرے کی شرم گاہ کو ہاتھ  لگانا یا دیکھنا,کیامیاں بیوی ایک دوسرےکی شرم گاہ کوہاتھ لگاسکتےہیں یادیکھ سکتےہیں؟,"<p><p style=""text-align:justify;"">بصورتِ مسئولہ میاں بیوی کا ایک دوسرے کی شرم گاہ کو ہاتھ لگانا اوردیکھناشرعًا جائز ہے، شرعاً  ممانعت نہیں، البتہ شرم گاہ کی طرف دیکھنا خلافِ حیا اور خلافِ  ادب ہونے کی وجہ سے نامناسب ہے، جیسا کہ ام المؤمین حضرت عائشہ صدیقہ رضی اللہ عنہا فرماتی ہیں کہ  نہ تو آپ صلی اللہ علیہ وسلم  نے کبھی میرے ستر کی طرف دیکھا اور نہ ہی میں نے کبھی آپ صلی اللہ علیہ وسلم  کے ستر کی طرف دیکھا۔</p><p style=""text-align:justify;"">حدیث شریف میں ہے:</p><p class=""indent"" style=""text-align:justify;""><span class=""ar_writing"">""مانظرت أو مارأیت فرج رسول الله صلی الله علیه وسلم قط.""</span></p><p class=""indent"" style=""text-align:left;""><span class=""ar_writing"">(سنن ابن ماجه:138، أبواب النکاح، ط:قدیمی)</span></p><p class=""indent"" style=""text-align:justify;"">ترجمہ: ’’میں نے رسول اللہ صلی اللہ علیہ وسلم کے ستر کی طرف کبھی نظرنہیں اٹھائی، یایہ فرمایاکہ میں نے آپ صلی اللہ علیہ وسلم کاسترکبھی نہیں دیکھا۔‘‘</p><p style=""text-align:justify;"">اس حدیث کے ذیل میں صاحبِ ’’مظاہرحِق‘‘  علامہ قطب الدین دہلویؒ لکھتے ہیں:</p><p class=""indent"" style=""text-align:justify;"">’’ایک روایت میں حضرت عائشہ رضی اللہ عنہاکے یہ الفاظ ہیں کہ :نہ توآں حضرت صلی اللہ علیہ وسلم نے میراسترکبھی دیکھا اورنہ کبھی میں نے آں حضرت صلی اللہ علیہ وسلم کاستردیکھا۔ان روایتوں سے معلوم ہواکہ اگرچہ شوہراوربیوی ایک دوسرے کاستردیکھ سکتے ہیں، لیکن آدابِ زندگی اورشرم وحیا  کاانتہائی درجہ یہی ہے کہ شوہراوربیوی بھی آپس میں ایک دوسرے کاسترنہ دیکھیں‘‘۔</p><p class=""indent"" style=""text-align:left;"">(مظاہرحق، 3/262، ط: دارالاشاعت کراچی)</p><p style=""text-align:justify;"">فتاوی عالمگیری میں ہے:</p><p class=""indent"" style=""text-align:justify;""><span class=""ar_writing"">""(وأما أحكامه) فحل استمتاع كل منهما بالآخر على الوجه المأذون فيه شرعا، كذا في فتح القدير.""</span></p><p class=""indent"" style=""text-align:left;""><span class=""ar_writing"">(كتاب النكاح، الباب الأول في تفسير النكاح شرعا وصفته وركنه،ج:1، ص:270، ط: رشيدية)</span></p><p class=""indent"" style=""text-align:left;"">فقط والله اعلم</p></p>",144309101395,banuri,"('حقوق و آدابِ معاشرت', 'huqooq-muashret')","('حقوق', 'bahmi-huqooq')","('میاں ، بیوی کے حقوق', 'mian-biwi-k-huqooq')"
13-03-2022,https://www.banuri.edu.pk/readquestion/olad-ke-apne-mal-se-kharidi-hui-jaedad-pad-r-kis-ki-milkiyat-hogi-144308100641/13-03-2022,اولاد کی اپنے مال سے خریدی ہوئی جائیداد پر کس کی ملکیت ہوگی؟,میرے والدین زندہ ہیں، ہم 7 بھائی  اور 4 بہنیں ہیں ،ہم سب اکٹھے رہتے تھے 2010 میں، گھرکے اخراجات بھی  ہر بھائی پر تھوڑے تھوڑے تھے، مثلاً : میں گھر کا کرایہ دیتا تھا اس میں بڑا بھائی مستثنیٰ تھاکیوں کہ اس نے ہم سب  کی تعلیم کا خرچہ برداشت کیا تھا،تو اس وجہ  سےہم سب  اس کی قدر کرتے تھے،اُس وقت انھوں نے پلاٹس لئے، بڑے بھائی کا الگ 5مرلے،3 بھایئوں نے 2.5مرلے اکٹھا لیا، ٹوٹل 15 مرلے بنتے ہیں،اور وہ انسٹالمنٹ پر لیے تھے، میرے پاس اس وقت استطاعت نہیں تھی، اور میرا موقف یہ تھا کہ باقی بہن بھائی کیا کریں گے؟ لیکن اس نے لے لیے، اب میرا بھی 10 مرلے پلاٹ ہےلیکن گاؤں میں،باقیوں کے  شہر میں ہیں ، باپ دادا کی  اپنی  زمین ہے ، لیکن ہم اجتماعی رہتے تھے اور اخراجات بھی اکٹھے تھے۔ میراث میں اس زمین  کا حصہ سب کا ہوگا، یا جس نے لیا ہے اس کا ہوگا؟وضاحت:1) سب بھائی الگ الگ کماتے تھے اور کام بھی مشترک نہیں تھا،لیکن ہر  ایک بھائی پر اپنے حصے کا خرچہ ملانا لازم تھا،مطلب  گھر کا کرایہ ایک بھائی دیتا تھا ،باقی اخراجات الگ الگ کے سپرد تھے۔2) آمدن ایک جگہ جمع نہیں ہوتی تھی ،لیکن اخراجات گھر کے حساب کے مطابق ایک جیسا تھا ،اور پلاٹ الگ الگ کمائی سے لیے تھے۔3) والدین زندہ تھے ،بڑا بھائی سب کو اپنا اپنا حصہ گھر میں ڈالنے کو کہتا  اور سب ایک ساتھ رہتے تھے اور خرچہ بھی ایک جیسا تھا ،لیکن بڑا بھائی گھر کے اخراجات سے مستثنیٰ تھا۔4) 15 مرلے ایسے بنے کہ ہم سات بھائی ہیں ،دو دو بھائیوں نے مل کر 5،5 مرلے لیے تو 6 بھائیوں نے 15  مرلے لیے میرے علاوہ ۔,"<p><p style=""text-align:justify;"">صورتِ مسئولہ میں جو جائیداد سائل اور اس کے بھائیوں نے اپنی محنت اور کمائی سے خریدی ہے اور اسے اپنی ملکیت میں رکھا ہوا ہے وہ سائل اور اس کے بھائیوں کی ہی ملکیت  میں رہے گی ،والدین یا کسی اور بھائی بہن کا اس میں حصہ نہیں ہوگا اور نہ ہی وہ جائیداد والدین کے انتقال کے بعد ان کا ترکہ شمار ہو کر تمام ورثاء میں تقسیم ہوگی البتہ جو زمین والدین کی ذاتی ملکیت ہے وہ ان کے انتقال کے بعد تمام ورثاء کے درمیان ان کے شرعی حصوں کے مطابق تقسیم ہوگی ۔</p><p>العقود الدریۃ فی تنقیح الفتاوی الحامدیۃ میں ہے:</p><p class=""indent"" style=""text-align:justify;""><span class=""ar_writing"">""(أقول) وفي الفتاوى الخيرية سئل في ابن كبير ذي زوجة وعيال له كسب مستقل حصل بسببه أموالا ومات هل هي لوالده خاصة أم تقسم بين ورثته أجاب هي للابن تقسم بين ورثته على فرائض الله تعالى حيث كان له كسب مستقل بنفسه.</span></p><p class=""indent"" style=""text-align:justify;""><span class=""ar_writing"">وأما قول علمائنا أب وابن يكتسبان في صنعة واحدة ولم يكن لهما شيء ثم اجتمع لهما مال يكون كله للأب إذا كان الابن في عياله فهو مشروط كما يعلم من عباراتهم بشروط منها اتحاد الصنعة وعدم مال سابق لهما وكون الابن في عيال أبيه فإذا عدم واحد منها لا يكون كسب الابن للأب وانظر إلى ما عللوا به المسألة من قولهم؛ لأن الابن إذا كان في عيال الأب يكون معينا له فيما يضع فمدار الحكم على ثبوت كونه معينا له فيه فاعلم ذلك اهـ.</span></p><p class=""indent"" style=""text-align:justify;""><span class=""ar_writing"">وأجاب الخير الرملي عن سؤال آخر بقوله حيث كان من جملة عياله والمعينين له في أموره وأحواله فجميع ما حصله بكده وتعبه فهو ملك خاص لأبيه لا شيء له فيه حيث لم يكن له مال ولو اجتمع له بالكسب جملة أموال؛ لأنه في ذلك لأبيه معين حتى لو غرس شجرة في هذه الحالة فهي لأبيه نص عليه علماؤنا رحمهم الله تعالى فلا يجري فيه إرث عنه لكونه ليس من متروكاته اهـ.</span></p><p class=""indent"" style=""text-align:justify;""><span class=""ar_writing"">وأجاب أيضا عن سؤال آخر بقوله إن ثبت كون ابنه وأخويه عائلة عليه وأمرهم في جميع ما يفعلونه إليه وهم معينون له فالمال كله له والقول قوله فيما لديه بيمينه وليتق الله فالجزاء أمامه وبين يديه وإن لم يكونوا بهذا الوصف بل كان كل مستقلا بنفسه واشتركوا في الأعمال فهو بين الأربعة سوية بلا إشكال وإن كان ابنه فقط هو المعين والإخوة الثلاثة بأنفسهم مستقلين فهو بينهم أثلاثا بيقين والحكم دائر مع علته بإجماع أهل الدين الحاملين لحكمته"".</span></p><p class=""indent"" style=""text-align:left;""><span class=""ar_writing"">(کتاب الدعوی،ج:2،ص:18،ط:دار المعرفۃ)</span></p><p class=""indent"" style=""text-align:left;""><span class=""ar_writing"">فقط واللہ اعلم</span></p></p>",144308100641,banuri,"('معاملات', 'muamlat')","('حقوق / استحقاق', 'huqooq-istihqaq')","('مشترکہ حقوق اور اس کے احکام', 'mushtaraka-huqooq-or-us-kay-ahkam')"
18-03-2022,https://www.banuri.edu.pk/readquestion/mina-naam-ka-kya-mtlb-hy-144308101144/18-03-2022,منی نام رکھنا,منی نام کے کیا معنی ہیں؟ میں اپنی بیٹی کا نام رکھنا چاہتی ہوں۔,"<p><p style=""text-align:justify;"">منی""  اگر میم پرفتحہ (زبر) ہو تو اس کے معنی موت ، کےبھی آتے ہیں ،اگر  میم پر کسرہ(زیر)ہویعنی منِی تو اس کے معنی "" مکہ معظمہ سے قریب ایک مقام کا نام جہاں ایام تشریق میں حاجی حضرات قیام کرتے ہیں""، اگر میم پر پیش کے ساتھ ہو یعنی مُنی تو اس کےمعنی تمنی کے آتے ہیں ، لہذا معنی کے اعتبار سے نام رکھنے کےلئے یہ لفظ مناسب نہیں، باقی  صحابہ،صحابیات کے ناموں میں سے کوئی  نام رکھنا  بہتر ہے۔</p><p style=""text-align:justify;"">تاج العروس میں ہے:</p><p class=""indent"" style=""text-align:justify;""><span class=""ar_writing"">""وقد مَني الله له الموت يمني،ولأضلنهم ولأمنيهم،وهي المنية،بالضم والكسر،والأمنية بالضم،وفى الصحاح،موضع بمكة،مذكر يصرف.""</span></p><p class=""indent"" style=""text-align:left;""><span class=""ar_writing"">(باب و۔ي فصل م، ص:576،577، ج: 10 دار ابن جوزي)</span></p><p class=""indent"" style=""text-align:left;""><span class=""ar_writing"">فقط والله أعلم</span></p></p>",144308101144,banuri,"('حظر و اباحت', 'mamnooaat-mubahat')","('نام، لقب، کنیت', 'asaami')","('ناموں کے معانی اور احکام', 'namoun-ke-mani-or-ahkaam')"
26-03-2022,https://www.banuri.edu.pk/readquestion/adalati-khula-kay-bad-mian-bivi-ka-sath-rehna-144308101782/26-03-2022,عدالتی خلع کے بعد میاں بیوی کا ساتھ رہنا,اگر عدالت عورت کو خلع دے دے اور مرد اس کو طلاق نہ دے اور وہ دونوں دو ماہ میں شوہر ور بیوی کی طرح رہنا چاہیں تو شریعت کیا کہتی ہے؟,"<p><p style=""text-align:justify;""><span class=""ur_writing"">صورتِ  مسئولہ میں اگر خلع باہمی رضامندی سے شرعی شرائط کے مطابق واقع ہوا ہو، یعنی: عدالتی خلع کے فیصلہ کے بعد شوہر نے زبانی یا تحریری رضامندی کے ساتھ خلع کو قبول کیا ہو تو    شرعا چوں کہ خلع ایک طلاق بائن کے حکم میں ہے، اس لیے ایسی صورت میں نکاح ختم ہوچکا ہے، دونوں کا   میاں بیوی کی طرح رہنے کے لئے باہمی رضامندی سے نئے مہر اور شرعی گواہوں کی موجودگی میں نئے ایجاب وقبول کے ساتھ تجدیدِ   نکاح کرنا ضروری ہے، نکاح کے بغیر دونوں کا میاں بیوی کی طرح رہنا جائز نہیں۔ اور اگر عورت نے شوہر کی رضامندی کے بغیر عدالت سے خلع لی ہواور شوہر نے عدالتی خلع پر رضامندی ظاہر نہ کی ہو، نیز شوہر نے اس کو طلاق بھی نہیں دی ہو تو ایسی صورت میں   نکاح برقرار  ہے،  دونوں کا   میاں بیوی کی طرح رہنا جائز ہے۔</span></p><p style=""text-align:justify;""><span class=""ur_writing"">بدائع الصنائع میں ہے:</span></p><p class=""indent"" style=""text-align:justify;""><span class=""ar_writing"">""وأما ركنه فهو الإيجاب والقبول؛ لأنه عقد على الطلاق بعوض فلا تقع الفرقة، ولا يستحق العوض بدون القبول"".</span></p><p class=""indent"" style=""text-align:left;""><span class=""ar_writing"">(بدائع الصنائع: كتاب الطلاق، فصل وأما الذي يرجع إلى المرأة (3/ 145)، ط. دار الكتاب العربي، سنة النشر 1982، مكان النشر بيروت)</span></p><p><span class=""ur_writing"">مجمع الانہر میں ہے:</span></p><p class=""indent"" style=""text-align:justify;""><span class=""ar_writing"">""(والواقع به) أي: بالخلع (وبالطلاق على مال) بأن يقول الزوج: طلقتك أو أنت طالق على مال كذا أو تقول المرأة: طلقني على كذا، ويقول: هو طلقتك عليه (بائن)"".</span></p><p class=""indent"" style=""text-align:left;""><span class=""ar_writing"">(مجمع الأنهر: كتاب الطلاق، باب الخلع (1/ 759)، ط. دار إحياء التراث العربي)</span></p><p>فتاوی ہندیہ میں ہے:</p><p class=""indent"" style=""text-align:justify;""><span class=""ar_writing"">""إذا كان الطلاق بائنا دون الثلاث فله أن يتزوجها في العدة"".</span></p><p class=""indent"" style=""text-align:left;""><span class=""ar_writing"">(الفتاوى الهندية: كتاب الطلاق، الباب السادس في الرجعة وفيما تحل به المطلقة وما يتصل به، فصل فيما تحل به المطلقة وما يتصل به (1/ 472)، ط. رشيديه)</span></p><p class=""indent"" style=""text-align:left;""><span class=""ur_writing"">فقط واللہ اعلم</span></p></p>",144308101782,banuri,"('طلاق', 'talaaq')","('خلع', 'hulaa')","('خلع کی شرائط اور حکم', 'khla-ki-sharaet')"
