issued_at,link,title,question,answer,fatwa_number,dar_ul_ifta,kitab,bab,fasal
21-04-2022,https://www.banuri.edu.pk/readquestion/nazer-e-bad-see-mutaasser-shakhs-kay-elaaj-ka-aek-tareqa-144309101131/21-04-2022,نظرِِ بد سے متاثر شخص کے علاج کا ایک طریقہ,نظر بد کے بارے میں میں نے کچھ پڑھا ہے اگر کسی کونظر لگ گیا ہے تو اس کو والدین کے وضو اور غسل کے پانی سے غسل دیا جاۓ،  تو وہ اللہ پاک کے کرم سے ٹھیک ہو جائے گا مجھے تو یہ بالکل درست لگتا ہے اور کسی کے والدین میں سے ایک حیات ہو تو کیا صرف اس ہی کے وضو و غسل کے پانی سے غسل دیا جاۓ ادھر کوئی طریقہ لکھا پڑھاہے، لیکن ٹھیک سے سمجھ نہیں آیا ، برائے مہربانی  مجھے مکمل طریقہ بتا دیں۔,"<p><p style=""text-align:justify;"">واضح رہے کہ سوال میں مذکورہ طریقہ سے نظرِ بد دور کرنے کا تو کہیں ذکر نہیں ملا ، البتہ احادیث مبارکہ میں  نظرِ بد دور کرنے کا ایک طریقہ موجود ہے ،اس کا طریقہ یہ ہے کہ جس آدمی کے بارے میں معلوم ہوکہ اس کی نظر لگی ہے، اُسے وضو کرایا جائے اور اُس کے استعمال شدہ پانی کو کسی برتن میں جمع کرلیا جائے اور پھر  جسے نظر لگی ہے اُس پانی  سے  اُس کو غسل کرا یا جائے۔</p><p style=""text-align:justify;"">جیساکہ احادیثِ مبارکہ میں اس کا طریقہ مذکور ہے،ذیل میں مشکاۃ شریف سے وہ روایت اور اس کی تشریح نقل کی جاتی ہے:</p><p class=""indent"" style=""text-align:justify;"">’’حضرت ابن عباس رضی اللہ تعالیٰ عنہما نبی کریم صلی اللہ علیہ وسلم  سے نقل کرتے ہیں کہ آپ صلی اللہ علیہ وسلم  نے  فرمایا : نظر بد حق ہے، یعنی نظر لگنا ایک حقیقت ہے اگر تقدیر پر سبقت لے جانے والی کوئی چیز ہوتی تو وہ نظر ہی ہوتی اور جب تم سے دھونے کا مطالبہ کیا جائے تو تم دھو دو ۔ (مسلم )‘‘</p><p class=""indent"" style=""text-align:justify;"">’’ اور جب تم سے دھونے کا مطالبہ کیا جائے ‘‘ کا مطلب یہ ہے کہ اس وقت عرب میں یہ دستور تھا کہ جس شخص کو نظر لگتی تھی اس کے ہاتھ پاؤں اور زیر ناف حصے کو دھو کر وہ پانی اس شخص پر ڈالتے تھے جس کو نظر لگتی تھی اور اس چیز کو شفا کا ذریعہ سمجھتے تھے ،اس کا سب سے ادنیٰ فائدہ یہ ہوتا تھا کہ اس ذریعہ سے مریض کا وہم دور ہو جاتا تھا ، چناں چہ رسولِ کریم صلی اللہ علیہ وسلم نے اس کی اجازت دی اور فرمایا کہ اگر تمہاری نظر کسی کو لگ جائے اور تم سے تمہارے اعضاء دھو کر مریض پر ڈالنے کا مطالبہ کیا جائے تو اس کو منظور کر لو۔‘‘</p><p style=""text-align:justify;"">نیز دوسری روایت میں ہے:</p><p class=""indent"" style=""text-align:justify;"">’’  حضرت ابوامامہ رضی اللہ تعالیٰ عنہ بن سہل ابن حنیف کہتے ہیں کہ (ایک دن ) عامر بن ربیعہ رضی اللہ تعالیٰ عنہ نے (میرے والد ) سہل بن حنیف رضی اللہ تعالیٰ عنہ کو نہاتے ہوئے دیکھا (یعنی ستر چھپائے ہوئے) تو کہنے لگے کہ اللہ کی قسم (سہل کے جسم اور ان کے رنگ و روپ کے کیا کہنے ) میں نے تو آج کے دن کی طرح (کوئی خوب صورت بدن کبھی ) نہیں دیکھا ،  اور پردہ نشین کی بھی کھال (سہل کی کھال جیسی نازک وخوش رنگ ) نہیں دیکھی ،  ابوامامہ کہتے ہیں کہ (عامر کا ) یہ کہنا تھا کہ ایسا محسوس ہوا (جیسے ) سہل کو گرا دیا گیا (یعنی ان کو عامر کی ایسی نظر لگی کہ وہ فوراً غش کھا کر گر پڑے )، چناں چہ ان کو اٹھا کر رسولِ کریم صلی اللہ علیہ وسلم کی خدمت میں لایا گیا اور عرض کیا گیا کہ  یا رسول اللہ صلی اللہ علیہ وسلم ! آپ سہل کے علاج کے لیے کیا تجویز کرتے ہیں ؟ اللہ کی قسم یہ تو اپنا سر بھی اٹھانے کی قدرت نہیں رکھتے ،  آں حضرت صلی اللہ علیہ وسلم نے سہل کی حالت دیکھ کر فرمایا:’’ کہ کیا کسی شخص کے بارے میں تمہارا خیال ہے کہ اس نے ان کو نظر لگائی ہے ؟‘‘ لوگوں نے عرض کیا :’’کہ ( جی ہاں ) عامر بن ربیعہ رضی اللہ تعالیٰ عنہ کے بارے میں ہمارا گمان ہے کہ انہوں نے نظر لگائی ہے،‘‘ راوی کہتے ہیں کہ رسول کریم صلی اللہ علیہ وسلم نے ( یہ سن کر ) عامر کو بلایا اور ان کو سخت سست کہا اور فرمایا:’’ کہ تم میں سے کوئی اپنے بھائی کو کیوں مار ڈالنے کے درپے ہوتا ہے! تم نے سہل کو برکت کی دعا کیوں نہیں دی؟ ‘‘( یعنی اگر تمہاری نظر میں سہل کا بدن اور رنگ و روپ بھا گیا تھا تو تم نے یہ الفاظ کیوں نہ کہے<span class=""ar_writing"">""بَارَكَ اللهُ عَلَیْكَ""</span>  تاکہ ان پر تمہاری نظر کا اثر نہ ہوتا ) پھر آپ صلی اللہ علیہ وسلم نے عامر کو حکم دیا کہ ( تم سہل کے  لیے اپنے اعضاء کو ) دھوؤ اور اس پانی کو اس پر ڈال دو ، چناں چہ عامر نے ایک برتن میں اپنا منہ ہاتھ کہنیاں گھٹنے دونوں پاؤں کی انگلیوں کے پورے اور زیر ناف جسم ( یعنی ستر اور کولہوں ) کو دھویا اور پھر وہ پانی جس سے عامر نے یہ تمام اعضاء دھوئے تھے سہل پر ڈالا گیا ، اس کا اثر یہ ہوا کہ سہل فوراً اچھے ہو گئے اور اٹھ کر لوگوں کے ساتھ اس طرح چل پڑے، جیسے ان کو کچھ ہوا ہی نہیں تھا ( شرح السنتہ مؤطا امام مالک ) ‘‘</p><p style=""text-align:justify;"">امام نووی رحمہ اللہ کہتے ہیں کہ علماء کے نزدیک نظر لگانے والے کے وضو کی صورت یہ ہے کہ جس شخص کے بارے میں یہ تحقیق  ہو کہ اس نے نظر لگائی ہے کہ اس کے سامنے کسی برتن یعنی پیالہ وغیرہ میں پانی لایا جائے اس برتن کو زمین پر نہ رکھا جائے پھر نظر لگانے والا اس برتن میں سے ایک چلو پانی لے کر کلی کرے اور اس کلی کو اسی برتن میں ڈالے پھر اس سے پانی لے کر اپنا منہ دھوئے پھر بائیں ہاتھ میں پانی لے کر دائیں کہنی اور دائیں ہاتھ میں پانی لے کر بائیں کہنی دھوئے اور ہتھیلی و کہنی کے درمیان جو جگہ ہے اس کو نہ دھوئے پھر داہنا پیر اور پھر اس کے بعد بایاں پیر دھوئے، پھر اسی طرح پہلے داہنا گھٹنا اور بعد میں بایاں گھٹنا دھوئے اور پھر آخر میں تہبند کے اندر زیر ناف جسم کو دھوئے اور ان سب اعضاء کو اسی برتن میں دھویا جائے، ان سب کو دھونے کے بعد اس پانی کو نظر زدہ کے اوپر اس کی پشت کی طرف سے سر پر ڈال کر بہا دے ۔</p><p style=""text-align:justify;"">واضح رہے کہ اس طرح کا علاج اسرار و حکم سے تعلق رکھتا ہے جو عقل وسمجھ کی رسائی سے باہر کی چیز ہے ؛ لہذا اس بارے میں عقلی بحث کرنا لا حاصل ہے۔‘‘ (مشکاۃ المصابیح - مظاہر حق)</p><p class=""indent"" style=""text-align:left;"">فقط واللہ اعلم</p></p>",144309101131,banuri,"('علوم و فنون', 'uloom-funoon')","('دعائیں، اوراد اور وظائف', 'adeya-azkar')","('اوراد ووظائف', 'aurad-o-wzaif')"
22-04-2022,https://www.banuri.edu.pk/readquestion/ager-may-tumharay-sath-khana-khaun-to-meri-b-v-ko-teen-talaq-144309101237/22-04-2022,اگر میں تمہارے ساتھ یہاں پر کھانا کھاوں تو میری بیوی کو تین طلاق,"کیا فرماتے ہیں علماء کرام اس مسئلہ کے بارے میں کہ ایک شخص کسی سرکاری ادارے میں ملازم ہے، ایک مرتبہ غصہ میں اپنے ساتھیوں سے کہا کہ ""اگر میں تمہارے ساتھ یہاں پر کھانا کھاؤں تو میری بیوی کو تین طلاق""۔اب پوچھنا یہ  ہے کہ اگر اس سرکاری ملازم کا ٹرانسفر کسی دوسرے ادارے میں  ہوجائے پھر اس کے بعد  دوبارہ اسی ادارے میں اس کا ٹرانسفر ہوجائے،  تو ایسی صورت میں کیا اپنے ساتھیوں کے ساتھ  اس ادارے  میں کھانا کھانے سے بیوی کو طلاق ہوگی یا نہیں؟","<p><p style=""text-align:justify;""><span dir=""rtl"" lang=""ar-sa"" xml:lang=""ar-sa""> صورت مسئولہ میں  مذکورہ شخص جب بھی ان کےساتھ اس ادارے میں کھانا کھائے گا (اگرچہ دوسری جگہ سے تبادلہ ہوکر آنے کے بعد ہی کیوں نہ ہو)  تو اس کی بیوی کو تینوں طلاقیں واقع ہوجائیں گی اور بیوی حرمت مغلظہ کے ساتھ حرام ہوجائے گی۔</span></p><p style=""text-align:justify;""><span dir=""rtl"" lang=""ar-sa"" xml:lang=""ar-sa"">البتہ ان ساتھیوں کے ساتھ کھانا کھانے کی صورت میں   تین طلاقیں واقع ہونے سے بچنے کا حیلہ اور تدبیر یہ ہے کہ مذکورہ شخص اپنی بیوی کو صرف ایک طلاق دےدے اور دوران عدت کسی قسم کا رجوع نہ کرے، یہاں تک کہ عدت گزر جائے، عدت گزرجانے کے بعد نکاح ختم ہوجائے گا، اس کے بعد مذکورہ شخص ایک دن اپنے ان تمام ساتھیوں کے ساتھ ملکر کھانا کھالے تو شرط پوری ہوجائے گی، اس کے بعد مذکورہ شخص اپنی بیوی سے شرعی گواہوں کی موجودگی میں  نئے مہر اور نئے ایجاب و قبول کے ساتھ تجدید نکاح کرلے، تجدید نکاح کے بعد مذکورہ شخص آئندہ کبھی ان کے ساتھ کھانا کھائے گا تو ان کے ساتھ کھانا کھانے کی وجہ سے مزید کوئی طلاق واقع نہیں ہوگی۔اس طرح ایک طلاق کے نقصان کے ساتھ تین طلاق سے بچ کر کھانا کھاسکتا ہے۔</span></p><p><span dir=""rtl"" lang=""ar-sa"" xml:lang=""ar-sa"">فتاوی ہندیہ میں ہے: </span></p><p class=""indent"" style=""text-align:justify;""><span class=""ar_writing"" dir=""rtl"" lang=""ar-sa"" xml:lang=""ar-sa"">""(أما تفسيرها شرعا) فاليمين في الشريعة عبارة عن عقد قوي به عزم الحلف على الفعل أو الترك كذا في الكفاية.</span></p><p class=""indent"" style=""text-align:justify;""><span class=""ar_writing"" dir=""rtl"" lang=""ar-sa"" xml:lang=""ar-sa"">وهي نوعان: يمين بالله تعالى، أو صفته، ويمين بغيره، وهي تعليق الجزاء بالشرط كذا في الكافي"".</span></p><p class=""indent"" style=""text-align:left;""><span class=""ar_writing"" dir=""rtl"" lang=""ar-sa"" xml:lang=""ar-sa"">(‌‌كتاب الأيمان،الباب الأول في تفسير الأيمان شرعا وركنها وشرطها وحكمها،2/ 51،ط:رشدية)</span></p><p><span dir=""rtl"" lang=""ar-sa"" xml:lang=""ar-sa"">الدر المختار وحاشية ابن عابدين میں ہے:</span></p><p class=""indent"" style=""text-align:justify;""><span dir=""rtl"" lang=""ar-sa"" xml:lang=""ar-sa""><span class=""ar_writing"">""فحيلة من علق الثلاث بدخول الدار أن يطلقها واحدةً ثم بعد العدة تدخلها فتنحل اليمين فينكحها"".</span></span></p><p class=""indent"" style=""text-align:left;""><span dir=""rtl"" lang=""ar-sa"" xml:lang=""ar-sa"">(کتاب الطلاق، ج:3، ص:355، ط:سعید)</span></p><p class=""indent"" style=""text-align:left;""><span dir=""rtl"" lang=""ar-sa"" xml:lang=""ar-sa"">فقط واللہ اعلم</span></p></p>",144309101237,banuri,"('طلاق', 'talaaq')","('تعلیقِ طلاق (مشروط طلاق دینا)', 'talaq-ki-taleeq')","('طلاق کو معلق کرنا', 'talaq-ko-muallaq-karna')"
21-04-2022,https://www.banuri.edu.pk/readquestion/miqdaar-e-sadqah-e-fitar-144309101143/21-04-2022,مقدار صدقہ فطر 1443ھ/2022ء,اس سال صدقہ فطر کی رقم کتنی ادا کرنی ہے؟,"<p><p style=""text-align:justify;"">صدقہ فطر  میں چار  اجناس (گندم،جو،کھجور،کشمش)میں سے کسی ایک جنس  کا دینا یا اس کی قیمت کادینا ضروری ہے۔</p><p style=""text-align:justify;"">نوٹ:مذکورہ بالا پیمانوں کے اعتبار سے ہر ایک کی قیمت دار الافتاء  جامعہ علوم اسلامیہ علامہ محمد یوسف بنوری ٹاؤن کی طرف سے  جو مقرر کی گئی ،کراچی اور مضافات  کے لیے، وہ درج ذیل ہے،(گندم: 150،جو:425، کھجور:950، کشمش:2550،)ہے۔</p><p>فتاوی ہندیہ میں ہے :</p><p class=""indent""><span class=""ar_writing"">""وانما تجب صدقة الفطر من اربعة اشیاء من الحنطة و الشعیر والتمر و الزبیب  ،""</span></p><p class=""indent"" style=""text-align:left;""><span class=""ar_writing"">(باب صدقة الفطر، ج:1، ص:191، ط:مکتبة حقانیة)</span></p><p>وفیہ ایضا:</p><p class=""indent""><span class=""ar_writing"">""وھی نصف صاع من بر او صاع من شعیر او تمر""</span></p><p class=""indent"" dir=""rtl"" style=""text-align:left;""><span class=""ar_writing"">(باب صدقة الفطر، ج:1، ص:191، ط:مکتبة حقانیة)</span></p><p class=""indent"" dir=""rtl"" style=""text-align:left;""><span class=""ar_writing"">فقط واللہ أعلم</span></p></p>",144309101143,banuri,"('زکات', 'zakat')","('صدقہ فطر', 'sadqa-fitr')","('صدقہ فطر کا نصاب اور وجوب', 'sadaqa-fitr-ka-nisaab-aur-wujoob')"
22-04-2022,https://www.banuri.edu.pk/readquestion/bhai-ko-sadqae-fitr-dena-144309101271/22-04-2022,بھائی کو صدقہ فطر دینا,کیا بھائی کوفطرانے کی رقم دی جاسکتی ہے؟,"<p><p style=""text-align:justify;"">اگر سائل کا بھائی مستحق زکاۃ ہے(یعنی  نہ  وہ صاحب نصاب ہے اور نہ ہی اس کے پاس ضرورت و استعمال سے زائد اتنا مال یا سامان موجود ہے جس کی مالیت نصاب یعنی ساڑھے باون تولہ چاندی کی موجودہ قیمت  تک پہنچے،اوروہ بنی ہاشم (سید  یا عباسی وغیرہ) میں سے نہیں ہے)تو اسے صدقہ فطر دے سکتے ہیں،البتہ اگر بھائی کا کھانا پینا سائل کے ساتھ مشترکہ ہو  تو یہ رقم وہ اس کھانے پینے میں استعمال نہ کرے ۔</p><p>فتاوی ہندیہ میں ہے:</p><p class=""indent"" style=""text-align:justify;""><span class=""ar_writing"">""ومصرف هذه الصدقة ما هو مصرف الزكاة كذا في الخلاصة.""</span></p><p class=""indent"" style=""text-align:left;""><span class=""ar_writing"">(کتاب الزکاۃ،الباب الثامن فی صدقۃ الفطر،ج1،ص194،ط؛دار الفکر)</span></p><p class=""indent"" style=""text-align:left;""><span class=""ar_writing"">فقط واللہ أعلم</span></p></p>",144309101271,banuri,"('زکات', 'zakat')","('صدقہ فطر', 'sadqa-fitr')","('مصارف', 'masaaref')"
22-04-2022,https://www.banuri.edu.pk/readquestion/taraweeh-main-do-rakat-ky-bad-bouhol-kr-kahra-honay-kay-bad-baith-jana-144309101303/22-04-2022,تراویح میں دو رکعت کے بعد بھول کر کھڑا ہونے کے بعد بیٹھ جانا,امام تراویح میں دو رکعت میں بیٹھنا بھول گیا اور کھڑا ہو گیا، مقتدی کے لقمہ دینے کے بعد بیٹھ کر تشہد مکمل کیا اور سجدہ سہو کیا ۔ کیا نماز ہوگئی؟,"<p><p style=""text-align:justify;""><span class=""ur_writing"">جی ہاں نماز ہوگئی۔ </span></p><p>فتاوی ہندیہ میں ہے:</p><p class=""indent""><span class=""ar_writing"">""وعن أبي بكر الإسكاف أنه سئل عن رجل قام إلى الثالثة في التراويح ولم يقعد في الثانية قال: إن تذكر في القيام ينبغي أن يعود ويقعد ويسلم"".</span></p><p class=""indent"" style=""text-align:left;""><span class=""ar_writing"">(الفتاوى الهندية: كتاب  الصلاة،الباب التاسع في النوافل،  فصل في التراويح (1/ 118)، ط. رشيديه)</span></p><p>مجمع الانہر میں ہے:</p><p class=""indent""><span class=""ar_writing"">""(وإن سها عن) القعود (الأخير) حتى قام لركعة أخرى (عاد) إلى القعود لإصلاح صلاته (ما لم يسجد وسجد للسهو) لتأخيره فرضا وأراد بالأخير القعود المفروض ليشمل الثاني والثنائي ويمكن أن يقال: سمي أخيرا باعتبار أنه آخر الصلاة أو باعتبار المشاكلة"".</span></p><p class=""indent"" style=""text-align:left;""><span class=""ar_writing"">(مجمع الانهر: كتاب الصلاة، باب سجود السهو (1/ 150)، ط. دار إحياء التراث العربي)</span></p><p class=""indent"" style=""text-align:left;"">فقط واللہ اعلم</p></p>",144309101303,banuri,"('نماز', 'salat')","('سجدہ سہو', 'sajda-sahv')","('سجدہ سہو کا وجوب و عدم وجوب', 'sajda-sahoo-ka-wujoob-o-adme-wujoob')"
20-04-2022,https://www.banuri.edu.pk/readquestion/talaq-deni-he-ya-talaq-de-don-ga-se-talaq-ke-woqoh-ka-hukum-144309101014/20-04-2022,طلاق دینی ہے یا طلاق دے دوں گا سے طلاق کے وقوع کا حکم,"کسی سے بات کرتے ہوئے ایسا پوچھنا کہ : ""مجھے اسے طلاق دینا ہے"" یا "" میں اسے طلاق دے دوں گا "" کیا ان الفاظ سے طلاق واقع ہو جائے گی؟","<p><p style=""text-align:justify;"">صورتِ مسئولہ میں کسی شخص سے بات کرتے ہوئے یہ   جملہ : ”مجھے اسے طلاق دینا ہے“ یا ” میں اسے طلاق دے دوں گا“ کہنے سے بیوی پر طلاق واقع نہیں ہوگی؛ اس لیے  کہ  یہ الفاظ بالترتیب مستقبل میں طلاق دینے کی اطلاع اور  طلاق دینے کا وعدہ ہیں، لہذا اس سے طلاق واقع نہیں ہوتی۔</p><p style=""text-align:justify;"">العقود الدریہ فی تنقیح الفتاوی الحامدیۃ میں ہے:</p><p class=""indent"" style=""text-align:justify;""><span class=""ar_writing"">""صيغة المضارع لا يقع بها الطلاق إلا إذا غلب في الحال كما صرح به الكمال بن الهمام.""</span></p><p class=""indent"" style=""text-align:left;""><span class=""ar_writing"">(1/38،کتاب الطلاق، ط:دار المعرفة)</span></p><p class=""indent"" style=""text-align:left;""><span class=""ar_writing"">فقط والله اعلم</span></p></p>",144309101014,banuri,"('طلاق', 'talaaq')","('وقوع طلاق وعدم وقوع طلاق', 'wuqoo-e-talaq-o-adme-wuqoo-e-talaq')","('عدمِ وقوعِ طلاق', 'adme-wuqoo-e-talaq')"
19-04-2022,https://www.banuri.edu.pk/readquestion/roza-ki-halat-me-majboran-gharary-krna-144309100950/19-04-2022,روزہ کی  حالت میں مجبورا غرارے کرنا,اگر ہمارے گلے میں درد ہو تو کیا روزے کی حالت میں غرارے کر سکتے ہیں ؟,"<p><p style=""text-align:justify;"">صورتِ  مسئولہ میں   روزے کے دوران تکلیف زیادہ ہو اور غرارے کے علاوہ علاج کی سہولت نہ ہو، یا کوئی اور چیز مفید نہ ہو تو غرارے کرسکتاہے، البتہ اگر غرارے کرنے میں پانی حلق سے نیچے اتر جائے گا تو روزہ ٹوٹ جائے گا اور اس روزے کی قضا لازم ہوگی، کفارہ نہیں ۔</p><p style=""text-align:justify;"">فتاوی شامی میں ہے:</p><p class=""indent"" style=""text-align:justify;""><span class=""ar_writing"">"" (والمبالغة فيهما) بالغرغرة، ومجاوزة المارن (لغير الصائم) لاحتمال الفساد.""</span></p><p class=""indent"" style=""text-align:left;""><span class=""ar_writing"">(کتاب الطهارة، سنن الوضوء، ج:1، ص: 116 ط:  سعید)</span></p><p style=""text-align:justify;""><span class=""ar_writing"">وفیه أیضا:</span></p><p class=""indent"" style=""text-align:justify;""><span class=""ar_writing"">""(والمبالغة فيهما) بالغرغرة، ومجاوزة المارن (لغير الصائم) لاحتمال الفساد.  (قوله: فسبقه الماء) أي يفسد صومه إن كان ذاكرا له وإلا فلا.""</span></p><p class=""indent"" style=""text-align:left;""><span class=""ar_writing"">(کتاب الصوم ، باب ما یفسد الصوم وما لا یفسده ، ج:2، ص:401، ط: سعید)</span></p><p class=""indent"" style=""text-align:left;"">فقط واللہ اعلم </p></p>",144309100950,banuri,"('روزہ', 'soum')","('روزہ', 'roza')","('روزہ توڑنے والی اشیاء', 'roza-tornay-wali-ashya')"
