issued_at,link,title,question,answer,fatwa_number,dar_ul_ifta,kitab,bab,fasal
03-03-2022,https://www.banuri.edu.pk/readquestion/bager-halale-ke-mutallaqa-slasa-ke-sath-rehne-wale-se-qata-talluqi-karne-ka-hukum-144307102444/03-03-2022,دوسرے شوہر سے نکاح کیے بغیرمطلقہ ثلاثہ کے ساتھ رہنے والے سے قطع تعلقی کا حکم,میرے ماموں نے چار پانچ گواہوں کی موجودگی میں اپنی بیوی کو غصہ میں آ کے تین دفعہ کہا طلاق۔طلاق۔طلاق۔اسی رات انکی بیوی اپنے بھائی کے ساتھ اپنے آ بائی گاؤں چلی گئی۔اور پھر اپنے بیٹے کے ساتھ دوبارہ گھر واپس آ گئی۔لیکن ماموں اپنے دوسرے بھائی کے گھر چلے گئے۔اور وہاں رہنے لگے۔اس دوران انہوں نے ایک مفتی صاحب سے اس کےمتعلق رائے لی جنھوں نے گواہوں سے تصدیق کے بعد فرمایا کہ طلاق واقع ہو چکی ہے اور حلالہ کے بغیر دوبارہ نکاح نہیں کرسکتے۔پھر انہوں نے عدالت سے رجوع کیا اور عدالت کے حکم سے تجدید نکاح کر لیا۔اب ہم ان کا سوشل بائی کاٹ کر رہے ہیں تو کیا ہمارا یہ عمل درست ہے۔کیونکہ انہوں نے عدالت میں کوئی طلاق کا گواہ پیش نہیں کیا اور فیصلہ اپنے حق میں لے لیا ہے۔ان سے قطع تعلق کیسا ہے؟,"<p><p style=""text-align:justify;""> صورتِ مسؤلہ میں سائل کا بیان اگر واقعۃً  صحیح ہے تو ایسی صورت میں سائل کے ماموں کی بیوی پر تینوں طلاقیں واقع ہوگئیں، بیوی اپنے شوہر پر حرمتِ مغلظہ کے ساتھ حرام ہو گئی سائل کے ماموں کا تین طلاقیں دینے کے باوجودمطلقہ  بیوی کو ساتھ رکھناسخت گناہ اورحرام ہے اور چاروں مذاہب کے متفقہ فیصلہ کے  خلاف ہے۔مطلقہ ثلاثہ کو اپنے پاس رکھنے والاشخص حرام کاری کامرتکب ہے، ایسے شخص کوراہِ راست پر لانے کے لیے ہر ممکن طریقہ اختیارکرناچاہیے،سمجھانے کے باوجودایساشخص جب تک باز نہیں آتااور علیحدگی اختیا نہیں کرتا تو اس کے توبہ کرنے تک  اس سے میل جول  اور تعلقات ختم کردینےچاہیے۔</p><p style=""text-align:justify;"">ایسے لوگ جو علانیہ گناہوں کاارتکاب کرنے والے ہوں اوراپنے عمل سے باز نہ آتے ہوں ان سے میل جول،بات چیت ترک کردیناشریعت میں ثابت ہے،لہذا اصل ہمدردی یہی ہے کہ انہیں راہِ راست پرلانے اور دیگرلوگوں کی عبرت کے لیے ان سے قطع تعلق کیاجائے ،ایسے لوگوں کے ساتھ  تعلق قائم رکھ کر ہمدردی کرنا  گناہ اور غلط کاموں میں معاونت اوران کی حوصلہ افزائی ہے۔</p><p>فتح الباری میں ہے:</p><p class=""indent"" style=""text-align:justify;""><span class=""ar_writing"">''( قوله باب ما يجوز من الهجران لمن عصى ) أراد بهذه الترجمة بيان الهجران الجائز لأن عموم النهي مخصوص بمن لم يكن لهجره سبب مشروع فتبين هنا السبب المسوغ للهجر وهو لمن صدرت منه معصية فيسوغ لمن اطلع عليها منه هجره عليها ليكف عنها''.</span></p><p class=""indent"" style=""text-align:left;""><span class=""ar_writing"">(فتح الباری،ج:10،ص:497،ط:دارالمعرفۃ بیروت)</span></p><p>قرآن کریم میں اللہ رب العزت کا ارشاد ہے :</p><p class=""indent"" style=""margin:0 0 30px;color:#323232;line-height:36px;font-weight:bold;font-size:17px;font-family:Nafees,'Helvetica Neue',Helvetica,Arial,sans-serif;background-color:#fff;text-align:justify;""><span class=""qr_writing"">﴿وَاِذَا رَاَيْتَ الَّذِيْنَ يَخُوْضُوْنَ فِيْٓ اٰيٰتِنَا فَاَعْرِضْ عَنْهُمْ حَتّٰي يَخُوْضُوْا فِيْ حَدِيْثٍ غَيْرِہٖ ۭ وَاِمَّا يُنْسِيَنَّكَ الشَّيْطٰنُ فَلَا تَقْعُدْ بَعْدَ الذِّكْرٰي مَعَ الْقَوْمِ الظّٰلِـمِيْنَ﴾</span><span style=""font-size:12px;"">(۶- الانعام:۶۸)</span></p><p class=""indent"" style=""text-align:justify;"">ترجمہ:"" اور جب تو ان لوگوں کو دیکھے جو ہماری آیات میں عیب جوئی کررہے ہیں تو ان لوگوں سے کنارہ کش ہوجا؛ یہاں تک کہ وہ کوئی اور بات میں لگ جائیں اور اگر تجھ کو شیطان بھلادے، تو یاد آنے کے بعد پھر ایسے ظالم لوگوں کے پاس مت بیٹھ۔""(بیان القرآن، آیت نمبر:۶۸) </p><p class=""indent"" style=""text-align:left;"">فقط واللہ اعلم</p></p>",144307102444,banuri,"('حقوق و آدابِ معاشرت', 'huqooq-muashret')","('حقوق', 'bahmi-huqooq')","('فساق ، فجار کے ساتھ رہن سہن اور اس کے احکام', 'fussaq-fujjar-k-sath-rehn-sehn-or-us-k-ahkam')"
03-03-2022,https://www.banuri.edu.pk/readquestion/jabaroot-ya-jabaroti-name-rakhna-durust-nai-he-144307102440/03-03-2022,جبروت یا جبروتی نام رکھنا درست ہے یا نہیں؟,جبروت یا جبروتی نام رکھنا کیسا ہے؟,"<p><p style=""text-align:justify;""> لفظِ ""جبروت"" کے معنی قدرت ،بزرگی اور عظمت کے آتے ہیں، اور جبروتی کے معنی ہے عظمت، بزرگی اور قدرت والا ""</p><p class=""indent"" style=""text-align:left;""><span style=""text-align:left;"">(فیروز اللغات،ص276،ط:فیروز سنز)</span></p><p style=""text-align:justify;"">جبروت""صفاتِ الٰہیہ میں سے ہے اور عالم ارواح كے ايك درجہ كا نام بھی ہے، اسے  صوفیاء کی اصطلاح ميں ""عالمِ جبروت""    كہا جاتا ہے ،لہذا مناسب یہ  ہے کہ  کوئی دوسرا نام رکھا جائے، اگر لڑکے کا نام رکھنا ہے تو بہتر ہے کہ صحابہ و تابعین کے ناموں میں سے عبد الرحمن ، سلمان ، عمّار وغیرہ جیسے کوئی نام رکھا جائے۔اور لڑکی کا نام رکھنا ہے تو صحابیات کے ناموں میں سے کوئی نام رکھا جائے۔  جامعہ کی ویب سائٹ میں اسلامی ناموں کی فہرست موجود ہے، وہاں سے بھی نام لیا جاسکتا ہے۔</p><p style=""text-align:right;"">کشاف العلوم والفنون میں ہے:</p><p class=""indent"" style=""text-align:justify;""><span class=""ar_writing"">"" أما العالم في عرف الحكماء فقال العلّامة في نهاية الإدراك «1»: إنّ العالم اسم لكلّ ما وجوده ليس من ذاته من حيث هو كلّ وينقسم إلى روحاني وجسماني...وقسم صاحب القصيدة الفارضية الغيب على ثلاثة أقسام وعبّر عنها بالغيب والملكوت والجبروت.</span></p><p class=""indent"" style=""text-align:justify;""><span class=""ar_writing"">وفي بعض حواشي شرح العقائد النسفية في الخطبة في اصطلاح المشايخ عالم الجبروت عالم الكروبيين «3» وهو عالم المقربين من الملائكة وتحته عالم الأجساد وهو عالم الملك.</span></p><p class=""indent"" style=""text-align:justify;""><span class=""ar_writing"">والمراد من الجبروت الجبارية وهي عبارة من قهر الغير على وفق إرادته. والجبروت والعظمة بمعنى واحد لغة غير أنّ فيه معنى المبالغة لزيادة اللفظ. وفي اصطلاح أهل الكلام عبارة عن الصفات كما أنّ اللاهوت عبارة عن الذات، فالإضافة في نعوت الجبروت على هذا الاصطلاح إضافة المسمّى إلى اسمه انتهى كلامه. ويقول في كشف اللغات: الجبروت هو مرتبة الوحدة باصطلاح السّالكين، التي هي الحقيقة المحمديّة، ولها علاقة بمرتبة الصّفات.""</span></p><p class=""indent"" style=""text-align:left;""><span class=""ar_writing"">(حرف الجیم والعین : ج 1 ، 2 ص 550، 1159، ط : مکتبة لبنان ناشرون)</span></p><p dir=""rtl""><span lang=""er"" xml:lang=""er"">تاج العروس  میں ہے:</span></p><p class=""indent"" dir=""rtl"" style=""text-align:justify;""><span lang=""er"" xml:lang=""er""><span class=""ar_writing"">""(والجبروتا) ، على مثال رحموتا، نقله شراح الفصيح كالتدميري وغيره، و (الجبروت) ، الأربعة (محركات) ، وهاذا الأخير من أشهرها، وفي الحديث: (سبحان ذي الجبروت والملكوت) قال ابن لأثير، والفهري شارح الفصيح، وابن منظور، وغيرهم: هو فعلوت من الجبر والقهر والقسر، والتاء فيه زائدة للإلحاق بقبروس، ومثله ملكوت من الملك، ورهبوت من الرهبة، ورغبوت من الرغبة، ورحموت من الرحمة، قيل: ولا سادس لها، قال شيخنا: وفيه نظر، وفي العناية: الجبروت: القهر والكبرياء والعظمة، ويقابله الرأفة. (والجبرية) بسكون الموحدة وتشديد التحتية (والجبروة) ، هو مثل الذي تقدم؛ غير أن الموحدة هنا ساكنة، (والتجبار والجبورة) مثل الفروجة، (مفتوحات، والجبورة والجبروت، مضمومتين) فهالاء ثلاثة عشر مصادر، ذكرها أئمة الغريب، وهي مفرقة في الدواوين"".</span></span></p><p class=""MsoNormal indent"" dir=""rtl"" style=""text-align:left;""><span class=""ar_writing""><span lang=""er"" xml:lang=""er"">(ج10،ص357 ، ط : دار الهداية</span><span dir=""ltr"">(</span></span></p><p dir=""rtl""><span lang=""er"" xml:lang=""er"">المناهي اللفظية  میں ہے:</span></p><p class=""indent"" dir=""rtl"" style=""text-align:justify;""><span class=""ar_writing"" lang=""er"" xml:lang=""er"">""التسمي بأسماء الله - عز وجل - يكون على وجهين:</span></p><p class=""indent"" dir=""rtl"" style=""text-align:justify;""><span class=""ar_writing""><span lang=""er"" xml:lang=""er""> </span><span lang=""er"" xml:lang=""er"">الوجه الأول: وهو على قسمين:</span></span></p><p class=""indent"" dir=""rtl"" style=""text-align:justify;""><span class=""ar_writing""><span lang=""er"" xml:lang=""er""> </span><span lang=""er"" xml:lang=""er"">القسم الأول: أن يحلى ب</span><span lang=""er"" xml:lang=""er"">ـ</span><span lang=""er"" xml:lang=""er"">(ال) ففي هذه الحال لا يسمى به غير الله - عز وجل - (1) كما لو سميت أحداً بالعزيز، والسيد، والحكيم، وما أشبه ذلك فإن هذا لا يسمى به غير الله لان (ال) هذه تدل على لمح الأصل وهو المعنى الذي تضمنه هذا الاسم.</span></span></p><p class=""indent"" dir=""rtl"" style=""text-align:justify;""><span class=""ar_writing""><span lang=""er"" xml:lang=""er""> </span><span lang=""er"" xml:lang=""er"">القسم الثاني: إذا قصد بالاسم معنى الصفة وليس محلي ب</span><span lang=""er"" xml:lang=""er"">ـ</span><span lang=""er"" xml:lang=""er"">(ال) فإنه لا يسمى به ولهذا غير النبي صلى الله عليه وسلم كنية أبي الحكم التي تكنى بها؛ لأن أصحابه يتحاكمون إليه فقال النبي، صلى الله عليه وسلم "" إن الله هو الحكيم وإليه الحكم "" ثم كناه بأكبر أولاده شريح فدل ذلك على أنه إذا تسمى أحد باسم من أسماء الله ملاحظاً بذلك معنى الصفة التي تضمنها هذا الاسم فإنه يمنع لأن هذه التسمية تكون مطابقة تماماً لاسماء الله - سبحانه وتعالى - فإن أسماء الله - تعالى - أعلام وأوصاف لدلالتها على المعنى الذي تضمنه الاسم.</span></span></p><p class=""indent"" dir=""rtl"" style=""text-align:justify;""><span class=""ar_writing""><span lang=""er"" xml:lang=""er"">الوجه الثاني: أن يتسمى غير محلي ب</span><span lang=""er"" xml:lang=""er"">ـ</span><span lang=""er"" xml:lang=""er"">(ال) وليس المقصود به معنى الصفة فهذا لا بأس به مثل حكيم ومن الأسماء بعض الصحابة حكيم ابن حزام الذي قال له النبي صلى الله عليه وسلم، "" لا تبع ما ليس عندك "" وهذا دليل على أنه إذا لم يقصد بالاسم معنى الصفة فإنه لا بأس به.</span></span></p><p class=""indent"" dir=""rtl"" style=""text-align:justify;""><span lang=""er"" xml:lang=""er""><span class=""ar_writing"">لكن في مثل (جبار) لا ينبغي أن يتسمى وإن كان لم يلاحظ الصفة وذلك لأنه لا يؤثر في نفس المسمى فيكون معه جبروت وغلو واستكبار على الخلق فمثل هذه الأشياء التي قد تؤثر على صاحبها ينبغي للإنسان أن يتجنبها.""</span></span></p><p class=""indent"" dir=""rtl"" style=""text-align:left;""><span class=""ar_writing"" lang=""er"" xml:lang=""er"">(ص46،ط: دار الثریا)</span></p><p class=""indent"" dir=""rtl"" style=""text-align:left;""><span class=""ar_writing"">فقط واللہ أعلم</span></p></p>",144307102440,banuri,"('حظر و اباحت', 'mamnooaat-mubahat')","('نام، لقب، کنیت', 'asaami')","('ناموں کے معانی اور احکام', 'namoun-ke-mani-or-ahkaam')"
04-03-2022,https://www.banuri.edu.pk/readquestion/ajeer-e-khas-ka-hukum-malik-or-mulazim-ky-huqaq-144307102519/04-03-2022,ملازم سے ملازمت کے مقررہ وقت میں مزید کام لینے کا حکم/مالک اور ملازم کے حقوق,۱۔میں ڈسٹریبیوشن دفتر میں کمپیوٹر آپریٹر کی ملازمت کرتا ہوں ،مجھے ملازمت پر رکھنے سے پہلے مجھےجتناکام اور کام کی ٹائمنگ کا بتایا گیاتھا، میں نے اس کے حساب سے سیلری (تنخواہ) بتا دی تھی، اب مجھ سے اُس کام کے ساتھ کمپیوٹر کے دوسرے کام بھی یہ کہہ  کر کروارہے ہیں کہ یہ آپ کی فیلڈ  ہے،آپ ہی کرو گے، مجھے سیلری(تنخواہ) وہی دے رہے ہیں جو طے ہوئی  تھی ، کیا یہ جائز ہے؟۲۔۳۔ملازم پر اونر (سیٹھ) کے کیا حقوق ہیں؟ اور اونر (سیٹھ) پر ملازم کےکیا حقوق ہیں؟,"<p><p style=""text-align:justify;"">۱۔صورتِ مسئولہ میں سائل  کو ملا زمت  پررکھنے سے پہلے جوسائل اور ملازمت پر رکھنے  والے کے درمیان  معاہدہ ہوا تھا   اسی کے  حساب سے سائل نے سیلری(تنخواہ) بتائی تھی، البتہ معاہدہ کے وقت  یہ نہیں کہا  تھا کہ اس کے علاوہ مزید کوئی کام نہیں لیں گےتو ایسی صورت اب  اگر  ملازمت  کےمقرر وقت ہی میں سائل سے اسی کی فیلڈ میں مزید   کام لیا جارہا ہے تو یہ معاہدہ کی خلاف ورزی  شمار نہیں ہوگی او رسائل کو ملازم ہونے کی حیثیت سے اسے انجام دینا اس کی  ذمہ داری بنتی ہے ، تاہم  اگر سائل سے  اضافی وقت میں کام لیا جاتا ہےتو اضافی وقت میں کام کرنے    کے عوض سائل  تنخواہ سےالگ مزید  معاوضہ کا مطالبہ کرسکتا ہے۔</p><p style=""text-align:justify;"">۲۔ملازم کو دورنِ ملازمت درج امور کا خیال رکھنا چاہیے:</p><p style=""text-align:justify;"">۱۔ملازمت کے اوقات کی پابندی کرے۔۲۔مفوضہ امور کو بحسن وخوبی انجام دے۔۳۔سیٹھ اوراسی طرح متعلقہ افراد سے حسنِ سلوک کرے۔۴۔کوشش یہ ہوکہ دورانِ ملازمت حقوق اللہ یا حقوق العباد ضائع نہ ہوں۔</p><p style=""text-align:justify;"">۳۔مالک کو ملازم کےسلسلے میں درج امور کا خیال رکھنا چاہیے:</p><p style=""text-align:justify;"">۱۔ملازم کو ملازمت پر رکھنے سے پہلے کام کی نوعیت ، اوقاتِ کار، تنخواہ اور دیگرامور کے بارے میں تفصیل سے آگاہ کردیا جائے ۔۲۔ملازم کی صلاحیت، طاقت   اور استطاعت سے زیادہ اس سے کام نہ لیاجائے ۔۳۔طے شدہ کام اور اوقاتِ کار سے زیادہ کام نہ لیاجائے۔۴۔اضافی کام یا اضافی اوقاتِ کار پر   اس کی مرضی اور خواہش کی رعایت کرتےہوئے الگ معاوضہ طے کردیاجائے۔۵۔ملازم کی لغزشوں اور کوتاہیوں کو درگز رکیاجائے۔۶۔ناجائز سختی،تشدد یامارپیٹ سے  احتراز کیا جائے ۔۷۔نادانستگی میں ہونے والے نقصان پر اسے معاف کردیا جائے۔۸۔ملازم کی اجرت، طعام ،لباس وپوشاک وغیرہ دیگر ضروریات باقاعدہ وقت پر فراہم کی جائیں ۔۹۔ملازم کی صحت وآرام کا خیال رکھاجائے۔۱۰۔بیماری یاکسی پریشانی کی صورت میں اسے مدد،تعاون اور سہولت فراہم کی جائے۔</p><p style=""text-align:justify;"">مشکوۃ المصابیح میں ہے:</p><p class=""indent"" style=""text-align:justify;""><span class=""ar_writing"">""وعن أبي ذر قال: قال رسول الله صلى الله عليه وسلم: «إخوانكم، ‌جعلهم ‌الله تحت أيديكم، فمن جعل الله أخاه تحت يديه فليطعمه مما يأكل، وليلبسه مما يلبس، ولا يكلفه من العمل ما يغلبه، فإن كلفه ما يغلبه فليعنه عليه»"".</span></p><p class=""indent"" style=""text-align:left;"">(مشکوۃ المصابیح،کتاب النکاح،باب النفقات وحق المملوک،الفصل الاول،رقم الحدیث:۳۳۴۵،ج:۲،ص:۱۰۰۰،ط:المکتب الاسلامی)</p><p style=""text-align:justify;"">بدائع الصنائع میں ہے:</p><p class=""indent"" style=""text-align:justify;""><span class=""ar_writing"">""وأما في ‌الأجير ‌الخاص فلا يشترط بيان جنس المعمول فيه ونوعه وقدره وصفته، وإنما يشترط بيان المدّة فقط وبيان المدّة في استئجار الظئر شرط جوازه بمنزلة استئجار العبد للخدمة؛ لأن المعقود عليه هو الخدمة، فما جاز فيه جاز في الظئر وما لم يجز فيه لم يجز فيها، إلا أنّ أبا حنيفة استحسن في الظئر أن تستأجر بطعامها وكسوتها لما نذكره في موضعه إن شاء الله تعالى، ولو استأجر إنسانا ليبيع له ويشتري ولم يبيّن المدة لم يجز لجهالة قدر منفعة البيع والشراء، ولو بيّن المدة بأن استأجره شهرا ليبيع له ويشتري جاز؛ لأن قدر المنفعة صار معلوما ببيان المدّة"".</span></p><p class=""indent"" style=""text-align:left;"">(بدائع الصنائع،کتاب الاجارۃ، فصل فی انواع شرائط رکن الاجارۃ،ج:۴،ص:۱۸۴،ط:سعید)</p><p class=""indent"" style=""text-align:left;"">فقط واللہ اعلم</p></p>",144307102519,banuri,"('اجارہ', 'ijaarah')","('اجارہ صحیحہ و اجارہ فاسدہ', 'ijaarah-sahiha-o-ijaarah-faaseda')","('اجارہ صحیحہ', 'ijaarah-sahiha-ka-bayan')"
21-04-2022,https://www.banuri.edu.pk/readquestion/roze-ki-halat-men-kan-men-dawa-dalna-144309101146/21-04-2022,روزےکی حالت میں کان میں دواڈالنا,روزے كی حالت ميں كان ميں دوا ڈالناكيساہے؟,"<p><p style=""text-align:justify;"">واضح رہےکہ روزےکی حالت میں کان میں دواڈالنےسےروزہ فاسد ہوجاتاہے،اوربعدمیں ایک روزہ قضاء کرنالازم ہے۔</p><p style=""text-align:justify;"">المدونۃ الکبری ٰمیں ہے:</p><p class=""indent"" style=""text-align:justify;""><span class=""ar_writing"">""قال ابن وهب، وأخبرني الحارث بن نبهان عن يزيد بن أبي خالد عن أيوب عن أنس بن مالك: «أن رسول الله - صلى الله عليه وسلم - لم يكره الكحل للصائم وكره له السعوط أو شيئا يصبه في أذنيه.""</span></p><p class=""indent"" style=""text-align:left;"">(کتاب الصیام ،ج:1،ص:269،ط:دارلکتب العلمیۃ)</p><p style=""text-align:justify;"">فتاوی عالمگیری میں ہے:</p><p class=""indent"" style=""text-align:justify;""><span class=""ar_writing"">""ومن احتقن أو استعط أو أقطر في أذنه دهنا أفطر، ولا كفارة عليه هكذا في الهداية، ولو دخل الدهن بغير صنعه فطره كذا في محيط السرخسي.""</span></p><p class=""indent"" style=""text-align:left;"">(کتاب الصوم،النوع الاول مایوجب القضاءدون الکفارۃ،ج:1،ص:204،ط:المطبعۃ الکبریٰ)</p><p class=""indent"" style=""text-align:left;"">فقط واللہ اعلم</p></p>",144309101146,banuri,"('روزہ', 'soum')","('روزہ', 'roza')","('روزہ توڑنے والی اشیاء', 'roza-tornay-wali-ashya')"
