issued_at,link,title,question,answer,fatwa_number,dar_ul_ifta,kitab,bab,fasal
08-03-2022,https://www.banuri.edu.pk/readquestion/pregnant-aurat-ka-dhood-pilaane-ka-hukum-144308100195/08-03-2022,حاملہ عورت كا دودھ پلانے کا حکم,سوال  یہ ہے کہ ایک دوست کی بیوی حمل سے ہے، جب کہ ان کا 9 ماہ  کابچہ ہے، جو ماں کا  دودھ پیتا  ہے، تو کیا جب حمل تین ماہ کا ہوجائے تو  پہلے بچے  (جو دودھ پر ہے)کے لیے ماں کا دودھ پینا حرام ہوجاتا ہے؟براہِ مہربانی ہمیں بتائیں کہ کیا بچے کا دودھ بند کرنا چاہیے ؟اس لیے کہ پیٹ میں پل رہے بچے کی عمر تین ماہ ہوچکی ہے یااس كے بچے کو دودھ پلایا جا سکتا ہے؟,"<p><p style=""text-align:justify;"">صورتِ مسئولہ میں  شرعی اعتبار سے  سائل کی دوست کی حاملہ بیوی کے لیے  اپنے پہلے  9 ماہ کےبچے کو دودھ پلانے کی ممانعت نہیں ہے، اور یہ بات کہ جو بچہ حمل میں ہو اس کے تین ماہ کے ہوجانے تک پہلے بچے کو دودھ پلانا حرام ہے اس کی کوئی حقیقت نہیں ہے، البتہ اگر ماہر دین دار طبیب /ڈاکٹر حاملہ ہونے کی وجہ سے دودھ کے خراب ہونے اور دودھ پینے والے بچے کی صحت پر اثر پڑنےکے اندیشے کی وجہ سے اس حال میں دودھ پلانے سے منع کرے، تو اس کی رائے پر عمل کرنا درست ہوگا اور اس صورت میں دودھ نہ پلانے میں کوئی حرج نہیں، حاصل یہ ہے کہ حالتِ حمل میں بچے کو دودھ پلانا ناجائز نہیں، البتہ طبی اعتبار سے کسی نقصان کا اندیشہ ہوتو دودھ پلانے سے احتراز کرنا درست ہوگا۔</p><p>حضور اکرم صلی اللہ علیہ وسلم کا ارشاد مبارک ہے:</p><p class=""indent""><span class=""ar_writing"">""عن سعد بن ابی وقاص رضی اللہ عنہ : ان رجلا جاء الی رسول اللہ صلی اللہ علیہ وسلم فقال: انی اعزل عن إمرأتي ، فقال له رسول الله صلي الله عليه وسلم: لم تفعل ذلك؟ فقال الرجل : اشفق علي ولدها، فقال رسول الله صلي الله عليه وسلم : لو كان ضارا ضر</span><span class=""ar_writing"">فارس والروم.""</span></p><p class=""indent"" style=""text-align:left;""><span class=""ar_writing""><span style=""text-align:left;"">(مشکوۃ المصابیح،  کتاب النکاح ، باب المباشرۃ ، الفصل الأول ،ص/208، ط:مکتبة البشرٰی کراتشی)</span></span></p><p>مرقاة فی شرح المشكاة ميں ہے:</p><p class=""indent"" style=""text-align:justify;""><span class=""ar_writing"">""(فقال رجل : أشفق) أي أخاف (علي ولدها) أي الذي في البطن لئلايصير توأمين فيضعف كل منهما، أو علي ولدها الذي ترضعه لماسيأتي أن الجماع يضره۔ وقيل: أي أخاف إن لم أعزل عنهالحملت وحينئذ يضر الولد الإرضاع في حال الحمل (فقال رسول الله صلي الله عليه وسلم: لو كان ذلك ) أي الجماع حال الارضاع أو الحبل( ضارا ضر فارس والروم ) أي أولادهما، يعني ترضع نساء الفرس والروم أولادهن في حال الحمل، فلو كان الإرضاع في حال الحمل مضرا لأ ضر اولادهن .""</span></p><p class=""indent"" style=""text-align:left;""><span class=""ar_writing"">(کتاب النکاح،  ج:6، ص: 317، ط: دارالكتب العملية بيروت)</span></p><p>حضور اکرم صلی اللہ علیہ وسلم کا ارشاد مبارک ہے:</p><p class=""indent"" style=""text-align:justify;""><span class=""ar_writing""><span style=""font-family:Nafees,sans-serif;""><span style=""font-size:18px;font-weight:400;"">""</span></span>وعن جذامة بنت وهب قالت : حضرتُ</span><span class=""ar_writing"">رسول اللہ ﷺ في أناس وهو یقول : ’’ لقدهممتُ أن أنهی عن الغیلة، فنظرت في الروم وفارس ، فإذاهم یغیلون أولادهم ، فلا یضرّ أولادهم ذلك شیئًا.""</span></p><p class=""indent"" style=""text-align:left;""><span class=""ar_writing"">(مشکوۃ المصابیح،  کتاب النکاح ، باب المباشرۃ ، الفصل الأول ،ص/208، ط:مکتبة البشرٰی کراتشی)</span></p><p>مرقاة فی شرح المشكاة ميں ہے:</p><p class=""indent"" style=""text-align:justify;""><span class=""ar_writing"">""الغیلة: بكسر الغين المعجمة، أي الإرضاع حال الحمل."" </span></p><p class=""indent"" style=""text-align:left;""><span class=""ar_writing"">(مرقاة في شرح المشكاة، کتاب النکاح،  ج:6، ص: 317، ط: دارالكتب العملية بيروت)</span></p><p class=""indent"" style=""text-align:left;""><span class=""ar_writing"">فقط واللہ اعلم</span></p></p>",144308100195,banuri,"('حظر و اباحت', 'mamnooaat-mubahat')","('تداوی و معالجہ', 'tadaawi-o-mualija')","('حمل، اسقاطِ حمل اور موانعِ حمل', 'hamal-isqaat-e-hamal-or-mawaane-e-hamal')"
13-03-2022,https://www.banuri.edu.pk/readquestion/agar-koi-larki-bhaag-jae-or-us-ko-dhoond-lia-jaae-to-us-s-kaisa-sulook-kia-jaae-144308100666/13-03-2022,اگر کوئی لڑکی بھاگ جائے اور اس کو ڈھونڈ لیا جائے تو اس سے کیسا سلوک کیا جائے؟,اگر کوئی لڑکی کسی لڑکے کے ساتھ بھاگ جائے اور اس کو ڈھونڈ لیا جائے، پھر اس سے کیا سلوک کیا جائے؟,"<p><p style=""text-align:justify;"">کسی بھی لڑکی کا کسی لڑکے کے ساتھ بھاگ جانا بہت ہی بے حیائی، اور نہایت قابلِ مذمت فعل ہے، بہرحال! جب ایک مرتبہ بھاگ جانے کے بعد لڑکی کو ڈھونڈ لیا جائے تو اس کے بعد اگر گھر والے یہ سمجھتے ہوں کہ نرمی اور محبت سے اس کو بات سمجھائی جا سکتی ہے اور آئندہ وہ  ایسی کوئی حرکت نہ کرے گی تو نرمی سے اس کو سمجھایا جائے اور اگر گھر والے یہ سمجھتے ہوں کہ لڑکی کے لیے مناسب سختی کرنا ضروری ہے تو سختی بھی کی جا سکتی ہے؛ تاکہ وہ مستقبل میں ایسا کوئی واقعہ پیش نہ آئے، لیکن غیرت کے نام پر قتل کرنا جائز نہیں۔</p><p class=""indent"" style=""text-align:left;"">فقط واللہ اعلم</p></p>",144308100666,banuri,"('حظر و اباحت', 'mamnooaat-mubahat')","('معصیت اور توبہ', 'maasiyat-o-tooba')","('گناہوں کی حدود، صورتیں اور اقسام', 'gunahoon-ki-hudood-soorten')"
12-02-2022,https://www.banuri.edu.pk/readquestion/musafat-e-safar-zameeni-or-pahari-rastoon-main-144307100666/12-02-2022,مسافتِ سفر زمین اور پہاڑی راستوں میں,ہدایہ میں ہے کہ پانی اور پہاڑ کے راستہ میں اس کی حالت کا اعتبار ہوگا، لہذا اس فتوے کی دلیل مطلوب ہے: زمینی اور پہاڑی دونوں طرح کے علاقوں میں قصر کی مسافت اڑتالیس میل (تقریبا سوا ستتر کلو میٹر) ہے؟,"<p><p style=""text-align:justify;"">ہدایہ میں ذکر کردہ جزئیہ تقریباً فقہ کی ہر کتاب میں تعبیر کے اختلاف کے ساتھ مذکور ہے ،ان جزئیات کا حاصل یہ ہے کہ مسافتِ سفر (48 میل)کے تعین کی تفہیم دو طرح سے کی جاتی ہے ،ایک یہ کہ دن کے وقت اس ترتیب سے چلیں کہ چلتے ہوئے پچھلے پہر پڑاؤ کیا جائے ،اور پھر اگلے روز سفر شروع کیا جائے ،اس ترتیب سے تین دن کی مسافت اڑتالیس میل کی مسافت بنتی ہے،اسی کو اونٹ کی چال چلتے ہوئے تین دن کی مسافت سے تعبیر کیا جاتا ہے ،،اسی اڑتالیس میل کی دوسری تفہیم یوں کی جاتی ہے کہ فطری طور پر راستے کی سہولت اور دشواری کی وجہ سے مسافت قطع کرنے میں وقت کی کثرت کا لحاظ بھی  کیا جاتا ہے،اگر کوئی شخص ہموار راستے سے اپنے ایک مرحلہ کے پڑاؤ تک جلدی جلدی پہنچ جاتا ہے اور دشوار راستے والا تاخیر سے پہنچتا ہے تو اس فطری تفاوت پر مبنی  حالت کا اعتبار تو ہوگا مگر اس سے مسافتِ سفر (48 میل )میں کمی بیشی کا سوال نہیں ہوگا ،اس بات کی تائید اس امر سے ہوتی ہے کہ فقہاء نے مسافتِ سفر (48 میل)قطع کرنے کا اندازہ درمیانی سیر(چال)سے کیا ہے ،لہذا اگر کوئی زیادہ تیزی سے یہ مسافت قطع کرے گا ،بلا توقف منزل تک پہنچ جائے تو وہ بھی مسافر شمار ہوگا ،اور اگر کوئی سست رفتار شخص یہی مسافت تین سے زائد ایام میں طے کر کے منزل تک پہنچا ہو تو اس کی سست روی کی وجہ سے 48 میل کی مسافت کو آدھا شمار نہیں کیا جائے گا ۔</p><p style=""text-align:justify;"">الغرض سفر کی مسافت شرعی میل کے حساب سے 48 میل شرعی ہے  ،اس کا اندازہ لگانے کے لیے درمیانی چال چلنے والے مسافر اور سواری کے حساب سے مخصوص ترتیب کے ساتھ تین ایام کا وقت بتایا گیا ہے ،باقی سیر (چال)میں راستے کی سہولت اور دشواری(صحرائی ،پہاڑی،یا بری)کی حالت کے اعتبار کا تعلق ""سیر"" یعنی چال کے ساتھ ہے نہ کہ شرعی مسافت 48 میل کے ساتھ ،پس جس راستے سے بھی اڑتالیس میل کی مسافت طے ہو ،اسے سفر ِ شرعی کہا جائے گا ،گویا کہ سفر میں اصل مدار مسافت ہے ،مدت اور وقت کا بیان ایک اندازے اور تخمین کے طور پر بیان ہوتا ہے۔</p><p style=""text-align:justify;"">الدر المختار و حاشیہ ابن عابدین میں ہے:</p><p class=""indent"" style=""text-align:justify;""><span class=""ar_writing"">""وفي الدر المختار :(بالسير الوسط مع الاستراحات المعتادة) حتى لو أسرع فوصل في يومين قصر؛ ولو لموضع طريقان أحدهما مدة السفر والآخر أقل قصر في الأول لا الثاني.</span></p><p class=""indent"" style=""text-align:justify;""><span class=""ar_writing"">وفي الشامي :(قوله باليسير الوسط)ويعتبر ‌في ‌الجبل بما يناسبه من السير لأنه يكون صعودا وهبوطا ومضيقا ووعرا فيكون مشي الإبل والأقدام فيه دون سيرهما في السهل. وفي البحر يعتبر اعتدال الريح على المفتى به إمداد فيعتبر في كل ذلك السير المعتاد فيه وذلك معلوم عند الناس فيرجع إليهم عند الاشتباه بدائع، وخرج سير البقر بجر العجلة ونحوه لأنه أبطأ السير كما إن أسرعه سير الفرس والبريد بحر(قوله فوصل) أي إلى مكان مسافته ثلاثة أيام بالسير المعتاد بحر. وظاهره أنه كذلك لو وصل إليه في زمن يسير بكرامة.""</span></p><p class=""indent"" style=""text-align:left;"">(کتاب الصلاۃ ،باب صلاۃ المسافر ،ج:2،ص:123،ط:سعید)</p><p style=""text-align:justify;"">فتاوی عالمگیریہ میں ہے:</p><p class=""indent"" style=""text-align:justify;""><span class=""ar_writing"">""ولا يعتبر السير في البر بالسير في البحر ولا السير في البحر بالسير في البر وإنما يعتبر في كل موضع منهما ما يليق بحاله، كذا في الجوهرة النيرة.وتعتبر المدة ‌من ‌أي ‌طريق ‌أخذ ‌فيه، كذا في البحر الرائق فإذا قصد بلدة وإلى مقصده طريقان أحدهما مسيرة ثلاثة أيام ولياليها والآخر دونها فسلك الطريق الأبعد كان مسافرا عندنا، هكذا في فتاوى قاضي خان، وإن سلك الأقصر يتم، كذا في البحر الرائق.""</span></p><p class=""indent"" style=""text-align:left;"">(کتاب الصلاۃ ،باب فی صلاۃ المسافر ،ج:1،ص:138،ط:رشیدیہ)</p><p style=""text-align:justify;"">البحر الرائق میں ہے:</p><p class=""indent"" style=""text-align:justify;""><span class=""ar_writing"">""وأما السير في البحر فيعتبر ما يليق بحاله، وهو أن يكون مسافة ثلاثة فيه إذا كانت تلك الرياح معتدلة، وإن كانت تلك المسافة بحيث تقطع في البر في يوم كما في الجبل يعتبر كونها من طريق الجبل بالسير الوسط ثلاثة أيام، وإن كانت تقطع من طريق السهل بيوم، فالحاصل أن تعتبر المدة ‌من ‌أي ‌طريق ‌أخذ ‌فيه.""</span></p><p class=""indent"" style=""text-align:left;"">(کتاب الصلاۃ ،باب صلاۃ المسافر ،ج:2،ص:140،ط:دار الکتاب الاسلامی)</p><p class=""indent"" style=""text-align:left;"">فقط واللہ اعلم</p></p>",144307100666,banuri,"('نماز', 'salat')","('مسافر کی نماز', 'musafir-ki-namaz')","('سفر شرعی کی مقدار و احکام', 'safar-sharee-ki-miqdaar-o-ahkaam')"
14-03-2022,https://www.banuri.edu.pk/readquestion/ak-mafhum-se-mutaleq-wezahat-144308100755/14-03-2022,سورۃ النور آیت:32 کی تشریح,اللہ تعالیٰ نکاح   کی طاقت سے تمہیں غنی کردےگا، یہ آیت اگر قرآن  میں ہےیا حدیث ہے تو  بتادیجیے گا!,"<p><p style=""text-align:justify;"">نکاح کے فوائد اور منافع میں سے ایک فائدہ اہم  یہ بھی ہے کہ نکاح کے ذریعے اللہ تعالی انسان کو غنی کردیتا ہے۔</p><p style=""text-align:justify;"">جیسا کہ سورۃ النور میں ہے:</p><p class=""indent"" style=""text-align:justify;""><span class=""qr_writing"">""وَ اَنْکِحُوا الْاَیَامٰى مِنْکُمْ وَ الصّٰلِحِیْنَ مِنْ عِبَادِكُمْ وَ اِمَآئِکُمْ  اِنْ یَّكُوْنُوْا فُقَرَآءَ یُغْنِهِمُ اللّٰهُ مِنْ فَضْلِهٖ  وَ اللّٰهُ وَاسِعٌ عَلِیْمٌ""</span></p><p class=""indent"" style=""text-align:justify;""> ترجمہ:"" اور تم میں (یعنی احرار میں) جو بےنکاح ہوں تم ان کا نکاح کردیا کرو اور (اسی طرح) تمہارے غلام اور لونڈیوں میں سے جو (نکاح) کے لائق ہوں اس کا بھی․ اگر وہ لوگ مفلس ہوں گے تو خدا تعالیٰ (اگر چاہے گا) ان کو اپنے فضل سے غنی کر دے گا  اور اللہ تعالیٰ وسعت والا اور خوب جاننے والا ہے۔ ""</p><p class=""indent"" style=""text-align:left;"">(سورۃ النور : رقم الآیۃ:32، ترجمہ: بیان القرآن)</p><p style=""text-align:justify;""><span style=""font-family:quran_font;font-weight:600;"">اِنْ یَّكُوْنُوْا فُقَرَآءَ یُغْنِهِمُ اللّٰهُ مِنْ فَضْلِهٖ</span>:اس میں ان غریب فقیر مسلمانوں کے لیے بشارت ہے جو اپنے دین کی حفاظت کے لیے نکاح کرنا چاہتے ہیں مگر وسائل مالیہ ان کے پاس نہیں کہ جب وہ اپنے  دین کی حفاظت اور سنت رسول اللہ (صلی اللہ علیہ وآلہ وسلم) پر عمل کرنے کی نیت صالحہ سے نکاح کریں گے تو اللہ تعالیٰ ان کو مالی غنا بھی عطا فرما دیں گے اور اس میں ان لوگوں کو بھی ہدایت ہے جن کے پاس ایسے غریب لوگ نکاح کا رشتہ  لے کر جائیں تو وہ محض ان کے فی الحال تنگ دست ہونے کی وجہ سے رشتہ سے انکار نہ کردیں۔ مال آنے جانے والی چیز ہے اصل چیز صلاحیت عمل ہے اگر وہ ان میں موجود ہے تو ان کے نکاح سے انکار نہ کریں۔</p><p style=""text-align:justify;"">حضرت ابن عباس نے فرمایا کہ اس آیت میں حق تعالیٰ نے سب مسلمانوں کو نکاح کرنے کی ترغیب دی ہے اس میں آزاد اور غلام سب کو داخل فرمایا ہے اور نکاح کرنے پر ان سے غنا کا وعدہ فرمایا ہے۔ (ابن کثیر) اور ابن ابی حاتم نے حضرت صدیق اکبر سے نقل کیا ہے کہ انھوں نے مسلمانوں کو خطاب کر کے فرمایا کہ تم نکاح کرنے میں اللہ تعالیٰ کے حکم کی تعمیل کرو تو اللہ تعالیٰ نے جو وعدہ غناء عطا فرمانے کا کیا ہے وہ پورا فرما دیں گے پھر یہ آیت پڑھی۔<span class=""qr_writing"">اِنْ يَّكُوْنُوْا فُقَرَاء يُغْنِهِمُ اللّٰهُ مِنْ فَضْلِهٖ</span> اور حضرت عبداللہ بن مسعود نے فرمایا کہ تم غنی ہونا چاہتے ہو تو نکاح کرلو کیونکہ اللہ تعالیٰ نے فرمایا ہے  <span class=""qr_writing"">اِنْ يَّكُوْنُوْا فُقَرَاء يُغْنِهِمُ اللّٰهُ مِنْ فَضْلِهٖ</span> ۔(ماخوذ از معارف القرآن لمفتی شفیع العثمانیؒ)</p><p style=""text-align:justify;"">الجامع لاحکام القرآن (تفسیرالقرطبی) میں ہے:</p><p class=""indent"" style=""text-align:justify;""><span class=""ar_writing"">""قوله تعالى: (<span style=""font-family:quran_font;font-size:18px;"">اِنْ یَّکُوْنُوْا فُقَرَآءَ یُغْنِهِمُ اللّٰهُ مِنْ فَضْلِهٖ</span>) رجع الكلام إلى الأحرار، أي لا تمتنعوا عن التزويج بسبب فقر الرجل والمرأة،"" إن يكونوا فقراء يغنهم الله من فضله"". وهذا وعد بالغنى للمتزوجين طلب رضا الله واعتصاما من معاصيه. وقال ابن مسعود: التمسوا الغنى في النكاح، وتلا هذه الآية. وقال عمر رضي الله عنه: عجبي ممن لا يطلب الغنى في النكاح، وقد قال الله تعالى:"" إن يكونوا فقراء يغنهم الله من فضله"". وروي هذا المعنى عن ابن عباس رضي الله عنهما أيضا. ومن حديث أبي هريرة رضي الله عنه أن رسول الله صلى الله عليه وسلم قال: (ثلاثة كلهم حق على الله عونه المجاهد في سبيل الله والناكح يريد العفاف والمكاتب يريد الأداء). أخرجه ابن ماجه في سننه. فإن قيل: فقد نجد الناكح لا يستغني، قلنا: لا يلزم أن يكون هذا على الدوام، بل لو كان في لحظة واحدة لصدق الوعد. وقد قيل: يغنيه، أي يغني النفس. وفي الصحيح (ليس الغنى عن كثرة العرض «1» إنما الغنى غنى النفس). وقد قيل: ليس وعدا لا يقع فيه خلف، بل المعنى أن المال غاد ورائح، فارجوا الغنى. وقيل: المعنى يغنيهم الله من فضله إن شاء، كقوله تعالى:"" فيكشف ما تدعون إليه إن شاء""  [الانعام: 41]، وقال تعالى:"" يبسط الرزق لمن يشاء"" «2» [الشورى: 12]. وقيل: المعنى إن يكونوا فقراء إلى النكاح يغنهم الله بالحلال ليتعففوا عن الزنى. السابعة- هذه الآية دليل على تزويج الفقير، ولا يقول كيف أتزوج وليس لي مال، فإن رزقه على الله. وقد زوج النبي صلى الله عليه وسلم المرأة التي أتته تهب له نفسها لمن ليس له إلا إزار واحد، وليس لها بعد ذلك فسخ النكاح بالإعسار لأنها دخلت عليه، وإنما يكون ذلك إذا دخلت على اليسار فخرج معسرا، أو طرأ الإعسار بعد ذلك، لأن الجوع لا صبر عليه، قاله علماؤنا. وقال النقاش: هذه الآية حجة على من قال: إن القاضي يفرق بين الزوجين إذا كان الزوج فقيرا لا يقدر على النفقة، لأن الله تعالى قال:"" يغنهم الله"" ولم يقل يفرق. وهذا انتزاع ضعيف، وليس هذه الآية حكما فيمن عجز عن النفقة، وإنما هي وعد بالإغناء لمن تزوج فقيرا. فأما من تزوج موسرا وأعسر بالنفقة فإنه يفرق بينهما، قال الله تعالى:<span class=""qr_writing"">"" وإن يتفرقا يغن الله كلا من سعته""</span>  [النساء: 130]. ونفحات الله تعالى مأمولة في كل حال موعود بها"".</span></p><p class=""indent"" style=""text-align:left;""><span class=""ar_writing"">(سورۃ النور، رقم الآیۃ:32، ج:12، ص:242، ط:دارالفکر)</span></p><p class=""indent"" style=""text-align:left;"">فقط واللہ اعلم</p></p>",144308100755,banuri,"('علوم و فنون', 'uloom-funoon')","('متعلقات قرآن کریم', 'quran-kareem')","('ترجمہ و تفسیر ، تعارف اور اقسام', 'tarjama-o-tafseer-taaruf-aur-aqsaam')"
