issued_at,link,title,question,answer,fatwa_number,dar_ul_ifta,kitab,bab,fasal
17-03-2022,https://www.banuri.edu.pk/readquestion/konnect-branchless-banking-ka-hukum-144308101021/17-03-2022,کنیکٹ برانچ لیس بینکنگ کا حکم,کیا حبیب بینک کی درج ذیل سروس استعمال کرنا جائز ہے؟Konnect Branchless Banking,"<p><p style=""text-align:justify;"">''کنیکٹ برانچ لیس بینکنگ'' حبیب بینک لمیٹڈ کی جانب سے متعارف کرائی گئی ایک جدیدڈیجیٹل سروس ہے،  جس میں صارف  اپنے موبائل سےکنیکٹ ایپلیکیشن ڈاؤن لوڈ کرکے گھر بیٹھے اپنے موبائل نمبر پر شناختی کارڈ نمبر درج کر کے اکاؤنٹ کھلوا سکتا ہے،اس سروس میں صارف کسی بھی کنیکٹ  فرینچائزسے رقم کی ترسیل کرسکتا ہے،اس سروس کا مقصد صارف یا اکاؤنٹ ہولڈر کو رقم کی ترسیلات میں بینک کی طویل کاغذی کا رروائی سے بچاکر رقم کی منتقلی کو آسان بنانا ہے۔</p><p style=""text-align:justify;"">اس کے علاوہ اس سروس کے ذریعہ اکاؤنٹ ہولڈر مختلف قسم کے بلوں کی ادائیگی بھی کرسکتا ہے،ایچ بی ایل اپنی صواب دید پر مختلف بلوں کی ادائیگی اور رقم کی ترسیلات اور ٹرانزیکشنز پر اپنے اکاؤنٹ ہولڈرز کو کیش بیک بھی دیتاہے۔</p><p style=""text-align:justify;"">ایچ بی ایل نے اپنے اکاؤنٹ ہولڈرز کے لیےانویسٹمنٹ کے نام پر مختلف قیمتوں کے مختلف '' گلک ''متعارف کرائے ہیں،اکاؤنٹ ہولڈر اپنی مرضی سے گلک خریدتا ہے اور   اس گلک کی رقم ہی صارف کی جانب سے انویسٹمنٹ شمار کی جاتی ہے،اِس انویسٹمنٹ پر ایک خاص مدت کے بعد متعین اضافہ کے ساتھ مکمل رقم اضافہ کے ساتھ صارف کو دی جاتی ہے،متعین مدت سے پہلے اگر صارف اپنی رقم واپس لینا چاہے تو بلا اضافہ صرف اصل رقم لوٹادی جاتی ہے۔</p><p style=""text-align:justify;"">یہ سروس اپنے صارف کو مختلف قسم کی اشیاء کی خرید  وفروخت پر خاص ڈسکاؤنٹ بھی دیتی ہے۔</p><p style=""text-align:justify;"">مذکورہ تفصیل کے بعد ''کنیکٹ برانچ لیس بینکنگ''  کی سروس استعمال کرنے کی فقہی حیثیت یہ ہے کہ اس  کےاکاؤنٹ میں جمع کردہ رقم در اصل قرض ہےاور  شرعی اعتبار سے  قرض دے کر اس سے کسی بھی قسم کا نفع اٹھانا جائز نہیں ہے ،کیوں کہ مذکورہ بالاانعامات(کیش بیک کی صورت میں) اور رعایات اکاؤنٹ ہولڈر  کو اس قرض کی وجہ سے دی جاتی ہیں  جو اس نے اکاؤنٹ کی صورت میں  بینک میں رکھوایا ہے اور جو فائدہ قرض کی وجہ سے حاصل ہو وہ  سود کے زمرے میں آتا ہے،اس لیے اس قرض کے بدلے کمپنی کی طرف سے دیے جانے والے انعامات اور رعایات ،جیسے:رقوم کی ترسیلات  اور بلوں کی ادائیگی پر کیش بیک کا ملنا،مختلف قسم کی اشیاء کی خرید وفروخت پر خاص ڈسکاؤنٹ   وصول کرنا اور ان کا استعمال کرنا جائز نہیں ہے۔</p><p style=""text-align:justify;""> نیز   چوں کہ اس میں  مذکورہ اکاؤنٹ کھلوانا ناجائز معاملے کےساتھ مشروط ہے ؛ اس لیے یہ اکاؤنٹ کھلوانا یا کھولنا  بھی جائز نہیں ہے۔(دیکھیے؛شرائط وضوابط برائےکنیکٹ برانچ لیس بینکنگ ،حصہ ۱۷،صفحہ ۱۹۔۲۰)</p><p style=""text-align:justify;"">''گلک'' میں رقم رکھوانا اگر چہ اکاؤنٹ ہولڈر کی اپنی صوابدید پر ہے ،تاہم گلک میں رقم رکھواکر اضافہ کے ساتھ واپس لینابھی  سود ہے،اس لیے گلک استعمال کرنا بھی ناجائز اور حرام ہے۔</p><p style=""text-align:justify;"">لہذااگر کوئی ''کنیکٹ  بائے ایچ بی ایل'' میں اپنا اکاؤنٹ کھلواچکاہو تو اس کے لیے یہ حکم ہے کہ وہ جلد از جلد مذکورہ اکاؤنٹ ختم کروائے اور صرف اپنی جمع کردہ رقم واپس لے سکتاہے، یا صرف جمع کردہ رقم کے برابر استفادہ کرسکتاہے، اُس رقم پر ملنے والے اضافی فوائد حاصل کرنا اس کے لیے جائز نہیں ہوں گے۔ </p><p style=""text-align:justify;"">فتاوی شامی میں ہے:</p><p class=""indent"" style=""text-align:justify;""><span class=""ar_writing"">""وفي الأشباه: كل قرض جر نفعاًحرام، فكره للمرتهن سكنى المرهونة بإذن الراهن.""</span></p><p class=""indent"" style=""text-align:left;""><span class=""ur_writing"">( مطلب کل قرض جر نفعا،ج۵،ص۱۶۶، ط: سعید)</span></p><p>اعلاء السنن میں ہے:</p><p class=""indent"" style=""text-align:justify;""><span class=""ar_writing"">""قال ابن المنذر: أجمعوا على أن المسلف إذا شرط على المستسلف زیادة أو هدیة  فأسلف على ذلك إن أخذ الزیادة علی ذلك ربا.""</span></p><p class=""indent"" style=""text-align:left;"">( باب کل قرض جرّ منفعة،ج۱۴،ص۵۱۳ ط: إدارۃ القرآن)</p><p class=""indent"" style=""text-align:left;"">فقط واللہ اعلم</p></p>",144308101021,banuri,"('معاملات', 'muamlat')","('سود / بینکاری / انشورنس / شیئرز', 'sood-bankari-insurance-shares')","('قرض کے احکام', 'qarz-k-ahkam')"
20-02-2022,https://www.banuri.edu.pk/readquestion/bachon-ko-deeni-taleem-deny-ki-ibtida-kab-ki-jaye-144307101439/20-02-2022,بچوں کو دینی تعلیم دینے کی ابتدا کب کی جائے؟,دورِ حاضر میں بچوں کو دینی تعلیم کس عمر میں دینا شروع کرنا چاہیے؟,"<p><p style=""text-align:justify;"">واضح رہے کہ بچہ کی تعلیم وتربیت کی ذمہ داری انتہائی اہم اور بڑی ذمہ داری ہے،اس لیے کہ اس کی ابتدا اسی وقت سے ہوجاتی ہےجب بچہ پیدا ہوتا ہے اور پھر یہ ذمہ داری بچے کے ہوشیار ہونے،بالغ ہونے کے قریب کے زمانےاور یہاں تک کہ وہ عاقل ،بالغ اور مکلف ہوجائےاس وقت تک جاری رہتی ہے،یہی وجہ ہے کہ نومولود بچہ کے دائیں کان میں اذان اور بائیں کان میں اقامت کہنے کا حکم دیا گیا ہے،تاکہ ابتدا  سے ہی بچہ کو عقیدہ توحید ورسالت کی تلقین ہوجائے،اسی طرح حدیث شریف میں آتا ہے کہ رسول اللہ صلی اللہ علیہ وسلم نے فرمایا کہ:""جب تمہاری اولاد بولنے لگےتو ان کو  <span class=""qr_writing"">""لاإلٰه إلا اللّٰه""</span> سکھاؤ اور جب ان کے دودھ کے دانت گرنے لگیں تو ان کو نماز کاحکم دو۔""</p><p style=""text-align:justify;"">لہذا بچہ كو سب سے پهلے <span style=""font-family:quran_font;font-weight:600;"">""</span><span style=""font-family:quran_font;font-weight:600;"">لاإلٰه إلا اللّٰه""</span> کہنے کی تعلیم دی جائےاور اس کے ساتھ ساتھ مربیوں،معلموں اور والدین پر جو تعلیمی ذمہ داری اور فریضہ عائد ہوتا ہے وہ یہ ہے کہ انہیں چاہیےکہ بچہ جب سنِ شعور کو پہنچے تو بنیادی طور پر اس کو قرآن کریم پڑھنے اور سيرتِ نبویہ اور دوسرے علوم شرعیہ اور ادبی قصائد اور عرب کی ضرب الامثال کی تعلیم دی جائے اسی طرح اس کے ساتھ ساتھ بچہ کو  رسول اللہ صلی اللہ علیہ وسلم کے  غزوات(جنگوں)اور صحابہ کرام  رضی اللہ عنھم کی سیرت اور عظیم مسلمان قائدوں کی سوانح اور تاریخ میں رقم طراز بہادری کے عظیم  کارناموں کی بھی تعلیم دی جائے،نیز  بچہ کی عمرجب سات سال ہوجائے تواس کو عبادات یعنی نماز،روزہ وغیرہ کا حکم دیا جائے،چنانچہ حدیث شریف میں آتا ہے کہ""اپنی اولاد کو سات سال کا ہونے پر نماز کا حکم کرو اورجب وہ دس سال کے ہوجائیں تو نماز نہ پڑھنے پر ان کو مارو اور ان کے بستر الگ الگ کردو""۔اس کے ساتھ ساتھ اس کو حلال اور حرام کے تمام احکامات سکھائے جائیں۔</p><p class=""indent"" style=""text-align:left;"">(ماخوذاز""<span class=""ar_writing"">تربية الأولاد في الإسلام</span>""مؤلفہ :شیخ عبد اللہ ناصح علوانؒ،ج:1،ص:151،158،159،160،268،ط:دار السلام)</p><p style=""text-align:justify;"">مذکورہ تفصیل سے معلوم ہوتا ہے کہ بچوں کی دینی تعلیم کی ابتداء کرنے کی کم سے کم کوئی حد مقرر نہیں ہے،بلکہ وہ تو بچہ کے پیدا ہوتے ہی شروع ہوجاتی ہے،البتہ زیادہ سے زیادہ فقہاء کرام نے اتنی بات کی تصریح فرمائی ہے کہ بچوں کی عمر جب سات سال مکمل ہوجائے تو پھران کی دینی تعلیم کی ابتداء کرنا واجب ہے۔</p><p style=""text-align:justify;"">حدیث شریف میں ہے:</p><p class=""indent"" style=""text-align:justify;""><span class=""ar_writing"">""عن عمرو بن شعيب، قال: وجدت في كتاب جدي الذي حدثه عن رسول الله صلى الله عليه وسلم قال: «إذا أفصح أولادكم فعلموهم ‌لا ‌إله ‌إلا ‌الله، ثم لا تبالوا متى ماتوا، وإذا أثغروا فمروهم بالصلاة».""</span></p><p class=""indent"" style=""text-align:left;""><span class=""ar_writing"">(عمل اليوم والليلة لابن السني، باب ما يلقن الصبي إذا أفصح بالكلام، ص:373، ط:دار القبلة)</span></p><p style=""text-align:justify;"">حدیث شریف میں ہے:</p><p class=""indent"" style=""text-align:justify;""><span class=""ar_writing"">""قال رسول الله صلى الله عليه وسلم: "" مروا الصبيان ‌بالصلاة ‌لسبع سنين، واضربوهم عليها في عشر، وفرقوا بينهم في المضاجع. ""</span></p><p class=""indent"" style=""text-align:left;""><span class=""ar_writing"">(شعب الإيمان، ج:11، ص:128، ط:مكتبة الرشد)</span></p><p style=""text-align:justify;"">موسوعۃ الفقہیہ الکویتیہ میں ہے:</p><p class=""indent""><span class=""ar_writing"">""وقد صرح الفقهاء بأن وجوب تعليم الصغار يبدأ بعد استكمال سبع سنين، لحديث: مروا أولادكم بالصلاة وهم أبناء سبع سنين، واضربوهم عليها وهم أبناء عشر، وفرقوا بينهم في المضاجع. قال ابن عابدين: الظاهر أن الوجوب بعد استكمال السبع، وينبغي أن يؤمربجميع المأمورات وينهى عن جميع المنهيات.وقال زكريا الأنصاري نقلا عن النووي: يجب على الآباء والأمهات تعليم أولادهم الطهارة والصلاة والشرائع بعد سبع سنين.""</span></p><p class=""indent"" style=""text-align:left;""><span class=""ar_writing"">(حرف الطاء، طلب العلم، وقت طلب العلم، ج:29، ص:81، ط:دار الصفوة)</span></p><p style=""text-align:justify;"">الدر المختار میں ہے:</p><p class=""indent"" style=""text-align:justify;""><span class=""ar_writing"">""(وإن وجب ضرب ابن عشر عليها بيد لا بخشبة) لحديث «مروا أولادكم بالصلاة وهم أبناء سبع، واضربوهم عليها وهم أبناء عشر» قلت والصوم كالصلاة على الصحيح كما في صوم القهستاني معزيا للزاهدي وفي حظر الاختيار أنه يؤمر بالصوم والصلاة وينهى عن شرب الخمر ليألف الخير ويترك الشر.""</span></p><p style=""text-align:justify;""><span class=""ar_writing"">وفی الرد تحته:</span></p><p class=""indent"" style=""text-align:justify;""><span class=""ar_writing"">""والظاهر أن الوجوب ‌بعد ‌استكمال ‌السبع. (قوله: قلت إلخ) مراده من هذين النقلين بيان أن الصبي ينبغي أن يؤمر بجميع المأمورات وينهى عن جميع المنهيات.اهـ.ح.""</span></p><p class=""indent"" style=""text-align:left;""><span class=""ar_writing"">(كتاب الصلوة، ج:1، ص:325، ط:سعيد)</span></p><p class=""indent"" style=""text-align:left;""><span class=""ar_writing"" style=""text-align:left;"">فقط واللہ اعلم</span></p></p>",144307101439,banuri,"('حقوق و آدابِ معاشرت', 'huqooq-muashret')","('حقوق', 'bahmi-huqooq')","('اولاد کے حقوق', 'olad-ky-hoqoq')"
02-04-2022,https://www.banuri.edu.pk/readquestion/koi-quran-parha-hua-na-ho-to-nabhaligh-hafiz-ko-imam-bnana-144308102269/02-04-2022,کوئی قرآن پڑھا ہوا نہ ہو تو نابالغ حافظ کو امام بنانا,کیا نابالغ حافظِ  قرآن عوام کو  تراویح پڑھا سکتا ہے جب کہ عوام میں سے کوئی بھی قرآن درست نہ پڑھتا ہو؟,"<p><p style=""text-align:justify;"">واضح رہے کہ فقہائے کرام نے جہاں امامت کی شرائط کا ذکر فرمایا ہے وہاں منجملہ شرائط کے ایک شرط بلوغ کی بھی ذکر فرمائی ہے یعنی امامت کا اہل وہ شخص ہے جو بالغ ہو، نا بالغ بچہ بالغ لوگوں کی امامت کا اہل نہیں۔</p><p style=""text-align:justify;"">  لہذا صورتِ  مسئولہ میں  نا بالغ بچہ تراویح میں بالغ لوگوں کی امامت نہیں کرا سکتا، اگرچہ وہ عاقل ہی کیوں نہ ہو  ،اور بالغ آدمی کی تراویح نابالغ کے پیچھے درست نہیں؛ لہٰذا مذکورہ علاقے والوں کو  چاہیے کہ کسی بالغ حافظ صاحب کا انتظام کریں جو ان کو تراویح پڑھائے، اگر کسی حافظ (بالغ)کا انتطام نہ  ہوسکے تو کوئی بھی شخص جو قرآن درست طریقے سے پڑھتا ہو اس کو تراویح امامت  کے لیے آگے کردیا جائے، اور اس کو جو سورتیں یاد ہوں بیس رکعت تراویح میں ان ہی کو پڑھ لیا کرے۔ یا کسی قریبی علاقے میں جہاں تراویح ہوتی ہو، وہاں جا کر شریک ہو جائیں۔ نیز ہر مسلمان کو  چاہیے کہ قرآن کریم کو درست طریقے سے پڑھنا سیکھے۔</p><p>مرقات میں ہے:</p><p class=""indent"" style=""text-align:justify;""><span class=""ar_writing"">""1126 - «عن عمرو بن سلمة رضي الله عنهما، قال: كنا بماء ممر الناس، يمر بنا الركبان نسألهم: ما للناس؟ ما للناس؟ ما هذا الرجل؟ فيقولون: يزعم أن الله أرسله أوحى إليه، أوحى إليه كذا. فكنت أحفظ ذلك الكلام، فكأنما يغرى في صدري، وكانت العرب تلوم بإسلامهم الفتح. فيقولون: اتركوه وقومه ; فإنه إن ظهر عليهم فهو نبي صادق، فلما كانت وقعة الفتح، بادر كل قوم بإسلامهم، وبدر أبي قومي بإسلامهم، فلما قدم، قال: جئتكم والله من عند النبي حقا، فقال: "" صلوا صلاة كذا في حين كذا، وصلاة كذا في حين كذا، فإذا حضرت الصلاة فليؤذن أحدكم، ويؤمكم أكثركم قرآنا "". فنظروا فلم يكن أحد أكثر قرآنا مني، لما كنت أتلقى من الركبان، فقدموني بين أيديهم، وأنا ابن ست أو سبع سنين، وكانت علي بردة كنت إذا سجدت تقلصت عني. فقالت امرأة من الحي: ألا تغطون عنا است قارئكم؟ ! فاشتروا، فقطعوا لي قميصا. فما فرحت بشيء فرحي بذلك القميص» . رواه البخاري.</span></p><p class=""indent"" style=""text-align:justify;""><span class=""ar_writing"">«وفي الحديث دليل على جواز إمامة الصبي، وبه قال الشافعي، وعنه في الجمعة قولان، وقال مالك، وأحمد: لا يجوز. وكذا قال أبو حنيفة. واختلف أصحابه في النفل فجوزه مشايخ بلخ، وعليه العمل عندهم وبمصر والشام ومنعه غيرهم وعليه العمل بما وراء النهر، انتهى.</span></p><p class=""indent"" style=""text-align:justify;""><span class=""ar_writing"">قال الزيلعي في شرحه للكنز: استدل الشافعي على أن الاقتداء بالصبي جائز بقول عمرو بن سلمة: فقدموني إلخ. وعندنا لا يجوز ; لقول ابن مسعود: لا يؤم الغلام الذي لا يجب عليه الحدود، وقول ابن عباس: لا يؤم الغلام حتى يحتلم ولأنه متنفل، فلا يجوز أن يقتدي به المفترض على ما عرف في موضعه، وأما إمامة عمرو فليس بمسموع من النبي صلى الله عليه وسلم، وإنما قدموه باجتهاد منهم لما كان يتلقى من الركبان، فكيف يستدل بفعل الصبي على الجواز، وقد قال هو بنفسه وكانت علي بردة إلخ. والعجب من الشافعية أنهم لم يجعلوا قول أبي بكر الصديق وعمر الفاروق وغيرهم من كبار الصحابة حجة، واستدلوا بفعل صبي مثل هذا حاله.""</span></p><p class=""indent"" style=""text-align:left;""><span class=""ar_writing"">(مرقاة المفاتيح شرح مشكاة المصابيح،كتاب الصلاة،باب الإمامة، الفصل الثالث، 3/ 870، الناشر: دار الفكر، بيروت)</span></p><p>شامی میں ہے:</p><p class=""indent"" style=""text-align:justify;""><span class=""ar_writing"">""وأما شروط الإمامة فقد عدها في نور الإيضاح على حدة فقال: وشروط الإمامة للرجال الأصحاء ستة أشياء: الإسلام والبلوغ والعقل والذكورة والقراءة والسلامة من الأعذار كالرعاف والفأفأة والتمتمة واللثغ وفقد شرط كطهارة وستر عورة. اهـ"".</span></p><p class=""indent"" style=""text-align:left;""><span class=""ar_writing"">(الدر المختار وحاشية ابن عابدين (رد المحتار)، (1/ 550)، ط: سعید)</span></p><p class=""indent"" style=""text-align:left;"">فقط و الله أعلم</p></p>",144308102269,banuri,"('نماز', 'salat')","('امامت کا بیان', 'imamat')","('نابالغ کی امامت', 'nabaalig-ki-imamat')"
03-04-2022,https://www.banuri.edu.pk/readquestion/roze-ka-didya-144309100018/03-04-2022,روزے کا فدیہ,روزے کے فدیہ کی مقدار کتنی ہے؟,"<p><p style=""text-align:justify;""> ایک روزے کافدیہ ایک صدقہ فطریعنی   پونے دو کلو گندم  یا اس کا آٹا یا اس کی قیمت ہے۔</p><p dir=""rtl""><span lang=""er"" xml:lang=""er"">فتاوی شامی میں ہے:</span></p><p class=""indent"" dir=""rtl"" style=""text-align:justify;""><span class=""ar_writing"" dir=""rtl"">''(يعطى لكل صلاة نصف صاع من بر) كالفطرة(وكذا حكم الوتر) والصوم''.</span></p><p class=""indent"" dir=""rtl"" style=""text-align:left;""><span class=""ar_writing""><span lang=""er"" xml:lang=""er""> (رد المحتار على الدر المختار ، کتاب الصلاة ، باب قضاءالفوائت  ۲/ ۷۲</span></span><span lang=""er"" xml:lang=""er""><span class=""ar_writing""> ط: سعید)</span></span></p><p class=""indent"" dir=""rtl"" style=""text-align:left;""><span lang=""er"" xml:lang=""er""><span class=""ar_writing""><span style=""font-family:Nafees,sans-serif;font-size:18px;font-weight:400;"">فقط واللہ اعلم</span></span></span></p></p>",144309100018,banuri,"('روزہ', 'soum')","('روزہ', 'roza')","('کفارہ / فدیہ', 'kaffara-fidya')"
03-04-2022,https://www.banuri.edu.pk/readquestion/rozay-ki-halat-mai-sugar-test-karwanay-ka-hukum-144309100029/03-04-2022,روزہ کی حالت میں شوگر ٹیسٹ کروانے کا حکم,کیا روزہ کی حالت میں خون کے ذریعہ شوگر ٹیسٹ کروانا جائز ہے؟,"<p><p style=""text-align:justify;"">روزے کی حالت میں خون کے ذریعہ شوگر ٹیسٹ کروانا جائز ہے، اس سے روہ نہیں ٹوٹے گا۔</p><p style=""text-align:justify;"">الدر المختار مع رد المحتار میں ہے:</p><p class=""indent"" dir=""rtl"" style=""text-align:justify;""><span lang=""ar-sa"" xml:lang=""ar-sa""><span class=""ar_writing"">""(أو أدهن أو اكتحل أو احتجم) وإن وجد طعمه في حلقه۔۔۔۔۔۔۔۔۔(لم يفطر) جواب الشرط.""</span></span></p><p class=""indent"" style=""text-align:left;""><span class=""ar_writing"">(كتاب الصوم، ج:2، ص:395، ط:سعيد)</span></p><p class=""indent"" style=""text-align:left;""><span class=""ar_writing"">فقط واللہ أعلم</span></p></p>",144309100029,banuri,"('روزہ', 'soum')","('روزہ توڑنے والی چیزیں', 'roza-torne-wali-chezen')","('دوا کا استعمال', 'dawa-ka-istemal')"
31-03-2022,https://www.banuri.edu.pk/readquestion/afzaa-naam-ke-mana-or-is-ke-sath-koi-dosra-naam-mila-kar-rakhna-jis-se-dono-ke-mana-saheh-hon-144308102174/31-03-2022,افزا نام کے معنی اور اس کے ساتھ کوئی دوسرانام ملا کررکھنا جس سے دونوں کے معنی صحیح ہوں,لڑکی کے لیے افزاء نام رکھنا کیسا ہےاور اس کے معنی کیا ہے؟ اگر یہ   نام رکھنا صحیح ہے تو اس کےساتھ دوسرا نام کون سا ہونا  چاہیے؛ تاکہ دونوں کا معنی صحیح ہو؟,"<p><p style=""text-align:justify;"">لفظِ  ""افزا "" ترکیب میں جزو دوم کے طور پر  استعمال ہوتا ہے اور  ""افزا""  کے  معنی ہیں :بڑھانے والا ، اضافہ کرنے والا یا بالیدگی پیدا کرنے والا ۔(اردو لغت ، جلد ۱ ص:۶۱۱ ط:ترقی اردو بورڈ ، کراچی)</p><p style=""text-align:justify;"">اگر اس کے ساتھ نور ملا لیاجائے تو اس کا معنی ہوگا زیادہ روشنی کے لہذا   ""نور افزا ""  نام رکھنا صحیح ہے،  البتہ صحابیات رضی اللہ عنہن کے ناموں میں سے کوئی نام رکھا جائے تو زیادہ مناسب ہے۔</p><p class=""indent"" style=""text-align:left;"">فقط و اللہ اعلم </p></p>",144308102174,banuri,"('حظر و اباحت', 'mamnooaat-mubahat')","('نام، لقب، کنیت', 'asaami')","('ناموں کے معانی اور احکام', 'namoun-ke-mani-or-ahkaam')"
