issued_at,link,title,question,answer,fatwa_number,dar_ul_ifta,kitab,bab,fasal
18-03-2022,https://www.banuri.edu.pk/readquestion/shab-e-barat-ki-ebadat-144308101147/18-03-2022,شب برات کی عبادت,شبِ براءت  کی عبادت گھر میں ادا کرنی چاہیے    یا مسجد میں اور اگر مسجد میں انفرادی طور پر ادا کی جائے تو کیا حکم ہے؟,"<p><p style=""text-align:justify;"">وا ضح رہے کہ  نفلی عبادت  ادا کرنے میں بہتر  اور افضل یہ ہے کہ آدمی گھرمیں ادا کرے ،البتہ اگر گھر میں خشوع وخضوع میسر نہ آسکتا ہو تو  مسجد میں بھی  انفرادی طور پر نفلی عبادت  کی ادائیگی کی گنجائش ہے۔</p><p style=""text-align:justify;"">درمختارمیں ہے:</p><p class=""indent"" style=""text-align:justify;""><span class=""ar_writing"">""و الأفضل في النفل غير التراويح المنزل، إلا لخوف شغل عنها، و الأصح أفضلية ما كان أخشع و أخلص"".</span></p><p class=""indent"" style=""text-align:left;""><span class=""ar_writing"">(کتاب الصلاۃ، باب الوتر و النوافل، ج:2،ص:22،ط:سعید)</span></p><p class=""indent"" style=""text-align:left;""><span class=""ur_writing"">فقط واللہ اعلم</span></p></p>",144308101147,banuri,"('نماز', 'salat')","('سنن و نوافل', 'nawafil')","('عام نفل نمازیں اور ان کے احکام', 'aam-nafl-namazen-aur-unke-ahkaam')"
13-03-2022,https://www.banuri.edu.pk/readquestion/fajr-ki-namaz-m-masnoon-qirat-144308100667/13-03-2022,فجر کی نماز میں مسنون قراءت,فجر کی نماز میں قرآن مجید کتنا پڑھنا چاہیے؟,"<p><p style=""text-align:justify;"">رسول اللہ صلی اللہ علیہ وسلم عام طور پر فجر کی نماز میں ساٹھ  سے لے کر سو  آیات تک  تلاوت فرمایا کرتے تھے،  کبھی سورۂ واقعہ اور سورۂ  ق کی تلاوت فرماتے، جمعہ کے دن فجر  کی نماز میں  الم تنزیل اور سورۂ دھر  کی تلاوت بھی فرمائی ہے اور عذر کی بنا پر معوذتین کی قراءت بھی فرمائی ہے، جیسا کہ کسی خاتون کے بچے کی رونے کی آواز سنی تو  معوذتین پڑھی۔</p><p style=""text-align:justify;"">باقی   پنج وقتہ نمازوں میں حالتِ حضر میں تلاوت کی مسنون مقدار یہ ہے کہ فجر اور ظہر  میں طوالِ مفصل (سورہ  حجرات<span style=""background-color:#fff;color:#323232;font-family:Nafees,'Helvetica Neue',Helvetica,Arial,sans-serif;font-size:17px;font-weight:bold;""></span> سے لے کر سورہ بروج تک) میں سے کوئی سورت یا اتنی مقدار تلاوت کرے، اور عصر اور عشاء کی نماز میں اوساطِ مفصل (سورہ طارق سے سورہ بینہ تک) میں سے کوئی سورت یا اتنی مقدار پڑھے، اور مغرب کی نماز میں قصارِ مفصل (سورہ زلزال سے سورہ ناس تک) میں سے کوئی سورت یا اتنی مقدار پڑھے۔</p><p style=""text-align:justify;"">سنن ابن ماجہ میں ہے:</p><p class=""indent"" style=""text-align:justify;""><span class=""ar_writing"">""عن أبي برزة أن رسول الله صلى الله عليه وسلم «كان» ‌يقرأ ‌في ‌الفجر ‌ما ‌بين ‌الستين إلى المائة .""</span></p><p class=""indent"" style=""text-align:left;""><span class=""ar_writing"">(كتاب اقامة الصلاة والسنة فيها، باب القراءة في صلاة الفجر، 268/1/ دار إحياء الكتب العربية)</span></p><p style=""text-align:justify;"">الدر المختار میں ہے:</p><p class=""indent"" style=""text-align:justify;""><span class=""ar_writing"">""يكره تحريما (تطويل الصلاة) ‌على ‌القوم ‌زائدا ‌على ‌قدر السنة في قراءة وأذكار رضي القوم أو لا لإطلاق الأمر بالتخفيف نهر وفي الشرنبلالية ظاهر حديث معاذ أنه لا يزيد على صلاة أضعفهم مطلقا. ولذا قال الكمال إلا لضرورة، وصح «أنه - عليه الصلاة والسلام - قرأ بالمعوذتين في الفجر حين سمع بكاء صبي.""</span></p><p class=""indent"" style=""text-align:left;""><span class=""ar_writing"">(كتاب الصلاۃ، باب الامامة، 565/1 ط: سعید)</span></p><p>فتاوی شامی میں ہے:</p><p class=""indent""><span class=""ar_writing"">""ويسن فى الحضر لإمام ومنفرد، ذكره الحلبي، والناس عنه غافلون (طوال المفصل) من الحجرات إلى آخر البروج (في الفجر والظهر، و) منها إلى آخر - لم يكن - (أوساطه في العصر والعشاء، و) باقية (قصاره في المغرب) أي في كل ركعة سورة مما ذكره الحلبي.""</span></p><p class=""indent"" dir=""rtl"" style=""text-align:left;""><span class=""ar_writing"">(كتاب الصلوة، باب صفة الصلوة، ج:1، ص:540، ط: سعيد)</span></p><p class=""indent"" style=""text-align:left;"">فقط واللہ اعلم</p></p>",144308100667,banuri,"('نماز', 'salat')","('نماز کا طریقہ', 'namaz-ka-tariqah')","('نماز کی سنتیں', 'namaz-ki-sunnaten')"
23-03-2022,https://www.banuri.edu.pk/readquestion/kiaa-aawaan-qawm-par-zakaat-hay-144308101601/23-03-2022,کیا اعوان قوم پرزکوۃ ہے؟,1۔ہم لوگ ا عوان  ہیں کیاا عوانوں پر زکات ہوتی ہے؟2۔ میری بہن شادی شدہ ہے، شادی بھی ا عوان گھرانے میں ہوئی ہے، کیا میں اپنی بہن کو زکات دے سکتا ہوں؟,"<p><p style=""text-align:justify;"">صورتِ مسئولہ میں اگراعوان قوم حضرت علی رضی اللہ عنہ کی اولاد میں سے ہیں اور اس  کا شجرہ  نسب بھی محفوظ ہے  تو ان کو زکوۃ دینا اور ان کےلیےزکوۃ لینا جائز نہیں ہے ،ایسے لوگ اگر غریب ہیں امداد کے مستحق ہیں تو ان کو زکوۃ علاوہ باقی ساڑھے  ستانوے  فیصد سے عطیہ دیں ،اور اگر اعوان حضرت علی  رضی اللہ عنہ  کی اولاد میں سے نہیں ہے تو ان کے غریب مستحق لوگوں کو زکوۃ دینا جائز ہے ۔</p><p>    فتاوی شامی میں ہے:</p><p class=""indent"" style=""text-align:justify;""><span class=""ar_writing"">""و سببه، أي سبب افتراضها ملك نصاب حولي ّ تام  فارغ عن دين له مطالب من جهة العباد، و فارغ عن حاجته الأصلية، نام و لو تقديرًا.""</span></p><p class=""indent"" style=""text-align:left;""><span class=""ar_writing"">(کتاب الزکاۃ،ج:2،ص:259، 260،ط:سعید)</span></p><p style=""text-align:justify;"">مشکوۃ شریف میں ہے:</p><p class=""indent"" style=""text-align:justify;""><span class=""ar_writing"">""و عن عبد المطلب بن ربيعة قال : قال رسول الله صلى الله عليه و سلم: إن هذه الصدقات إنماهي أوساخ الناس وإنها  لا تحل لمحمد ولا لآل محمد.""</span></p><p class=""indent"" style=""text-align:left;""><span class=""ar_writing"">(کتاب الزکاۃ، باب من تحل لہ الصدقۃ،ص:161،ط:قدیمی)</span></p><p style=""text-align:justify;"">فتاوی عالمگیری میں ہے:</p><p class=""indent"" style=""text-align:justify;""><span class=""ar_writing"">""و لايدفع الي بني هاشم وهم آل علي وآل عباس وآل جعفر وآل عقيل وآل وآل الحارث بن عبد المطلب كذا في الهداىة"".</span></p><p class=""indent"" style=""text-align:left;""><span class=""ar_writing"">(کتاب الزکاۃ،الباب السابع فی المصرف،ج:1،ص:189،ط:رشیدیہ)</span></p><p style=""text-align:justify;"">بدائع الصنائع میں ہے:</p><p class=""indent"" style=""text-align:justify;""><span class=""ar_writing"">""و بنو هاشم الذين  تحرم عليهم الصدقات آل عباس و آل علي و آل جعفر ... الخ"".</span></p><p class=""indent"" style=""text-align:left;""><span class=""ar_writing"">(کتاب الزکاۃ، ج:2۔،ص:162،ط:المکتبۃ الوحیدیۃ پشاور)</span></p><p style=""text-align:justify;"">در مختار میں ہے</p><p class=""indent"" style=""text-align:justify;""><span class=""ar_writing"">""ويشترط أن يكون الصرف (تمليكا )لاإباحة ... لايصرف  إلی بناء ... و لا إلى بني هاشم.""</span></p><p class=""indent"" style=""text-align:left;""><span class=""ur_writing"">(کتاب الزکاۃ ،باب المصرف ،ج:3،ص:344، 350،ط:سعید)</span></p><p style=""text-align:justify;"">فتح القدیر میں ہے:</p><p class=""indent"" style=""text-align:justify;""><span class=""ar_writing"">""و لايجوز للشاهد أن يشهد لشئ  لم يعاينه الاالنسب فانه  يسعه  أن يشهد  بهذه الأشياء إذا أخبره بها من يثق به من رجلين عدلين"".</span></p><p class=""indent"" style=""text-align:left;""><span class=""ar_writing"">(کتاب الشہادات، ج:6،ص:460،ط:رشیدیہ)</span></p><p class=""indent"" style=""text-align:left;"">فقط واللہ اعلم</p></p>",144308101601,banuri,"('زکات', 'zakat')","('مصارف', 'masaaref')","('رشتہ داروں کو زکوٰۃ دینا', 'rishtedaron-ko-zakat-dena')"
17-03-2022,https://www.banuri.edu.pk/readquestion/bashayir-nam-144308100999/17-03-2022,بشائر نام رکھنا کیسا ہے؟,بَشَائِر نام کا کیا مطلب ہے؟ کیا لڑکی کا یہ نام رکھنا ٹھیک ہے؟,"<p><p style=""text-align:justify;"">بشائر کا لفظ بشارۃ کی جمع ہے جس کا معنی ہے خوشخبری، لڑکی کے لیے یہ نام درست ہے۔</p><p style=""text-align:justify;""><span class=""ar_writing"">معجم اللغة العربية المعاصرة</span>میں ہے:</p><p class=""indent"" style=""text-align:justify;""><span class=""ar_writing"">""بشارة/ بشارة [مفرد]: ج بشارات وبشائر:</span></p><p class=""indent"" style=""text-align:justify;""><span class=""ar_writing"">1 - خبر سار ومفرح لا يعلمه المخبر به ° بشائر الصبح/ بشائر الزرع/ بشائر الفاكهة: أوائله- بشائر الموسيقى: أصوات الدفوف ونحوها- بشائر الوجه: أماراته، محسناته.</span></p><p class=""indent"" style=""text-align:justify;""><span class=""ar_writing"">2 - ما يعطاه المبشر من هدايا ""فأعطيته ثوبي بشارة [حديث]: في حديث توبة كعب بن مالك رضي الله عنه"".</span></p><p class=""indent"" style=""text-align:left;""> (1/ 207، عالم الکتب)</p><p style=""text-align:justify;"">تاج العروس  میں ہے :</p><p class=""indent"" style=""text-align:justify;""><span class=""ar_writing"">""البشارة، بالكسر، والضم لغة، وإذا أطلقت اختصت بالخير، وفي الأساس: وتتابعت البشارات والبشائر.""</span></p><p class=""indent"" style=""text-align:left;"">(10/ 186،  دار الهداية)</p><p class=""indent"" style=""text-align:left;"">فقط واللہ اعلم</p></p>",144308100999,banuri,"('حظر و اباحت', 'mamnooaat-mubahat')","('نام، لقب، کنیت', 'asaami')","('ناموں کے معانی اور احکام', 'namoun-ke-mani-or-ahkaam')"
27-03-2022,https://www.banuri.edu.pk/readquestion/sonay-kay-liay-laitnay-ka-tareeqah-144308101889/27-03-2022,سونے کے لیے لیٹنے کا طریقہ,سونے کے لیے لیٹنے کا طریقہ؟,"<p><p dir=""rtl"" style=""text-align:justify;""><span lang=""ar-sa"" xml:lang=""ar-sa"">سونے کے لیے لیٹنے کا سنت طریقہ یہ ہے کہ دائیں کروٹ پر قبلہ کی طرف رخ کرکے </span><span lang=""er"" xml:lang=""er"">لیٹ جائےاور</span><span lang=""ar-sa"" xml:lang=""ar-sa""> دایاں ہاتھ رخسار کے نیچے رکھ کر سوجائے۔ اگر مکمل وقت اسی کیفیت سے سونا مشکل ہو توکم از کم سونے کے لیے لیٹتے وقت اس ہیئت پر لیٹ جائے۔</span></p><p class=""indent"" dir=""rtl"" style=""text-align:justify;""><span lang=""ar-sa"" xml:lang=""ar-sa""><span class=""ar_writing"">""عن البراء بن عازب قال: كان رسول الله صلى الله عليه و سلم إذا أوى إلى فراشه نام على شقه الأيمن"".</span></span></p><p class=""indent"" dir=""rtl"" style=""text-align:left;""><span class=""ar_writing"" lang=""ar-sa"" xml:lang=""ar-sa"">أخرجه البخاري في صحيحه في باب النوم على شقه الأيمن (5/ 2327) برقم (5956)، ط. دار ابن كثير ، اليمامة، الطبعة الثالثة:  1407هـ = 1987م)</span></p><p class=""indent"" dir=""rtl"" style=""text-align:justify;""><span class=""ar_writing"" lang=""ar-sa"" xml:lang=""ar-sa"">""عن حفصة، زوج النبي صلى الله عليه وسلم قالت: "" كان رسول الله صلى الله عليه وسلم إذا أخذ مضجعه، وضع يده اليمنى تحت خده الأيمن"".</span></p><p class=""indent"" dir=""rtl"" style=""text-align:left;""><span class=""ar_writing"">(أخرج أحمد في مسنده  في حديث حفصة أم المؤمنين (44/ 62) برقم (26461)، ط. مؤسسة الرسالة، الطبعة الأولى: 1421هـ =2001 م)</span></p><p class=""indent"" dir=""rtl"" style=""text-align:justify;""><span class=""ar_writing"" lang=""ar-sa"" xml:lang=""ar-sa"">""عن بعض آل أم سلمة، قال: كان فراش النبي -صلى الله عليه وسلم- نحوا مما يوضع الإنسان في قبره، وكان المسجد عند رأسه"".</span></p><p class=""indent"" dir=""rtl"" style=""text-align:left;""><span class=""ar_writing"" lang=""ar-sa"" xml:lang=""ar-sa""><span lang=""ar-sa"" xml:lang=""ar-sa"">وأخرج أبوداود في سننه في باب كيف يتوجه (7/ 387) برقم (5044)، ط. </span>دار الرسالة العالمية ، الطبعة الأولى: 1430 هـ = 2009 م</span></p><p dir=""rtl""><span style=""text-decoration:underline;""><span lang=""ar-sa"" xml:lang=""ar-sa"">وفي بذل المجهود في حل سنن أبي داود:</span></span></p><p class=""indent"" dir=""rtl"" style=""text-align:justify;""><span class=""ar_writing"" lang=""ar-sa"" xml:lang=""ar-sa"">"" وكتب مولانا محمد يحيى المرحوم في ""التقرير"": قوله: ""وكان المسجد عند رأسه"": أراد بالمسجد المسجد النبوي، فهو بيان لما كان عليه منامه من التوجه إلى القبلة مضطجعا على شقه الأيمن، وإن أريد به مسجد بيته فهو بيان لأمر زائد على المذكور قبله، فأفاد بقوله: ""نحوا مما يوضع الإنسان في قبره""، أن نومه كان على شقه الأيمن متوجها إلى القبلة"".</span></p><p class=""indent"" dir=""rtl"" style=""text-align:left;""><span class=""ar_writing"" lang=""ar-sa"" xml:lang=""ar-sa""><span lang=""ar-sa"" xml:lang=""ar-sa"">(بذل المجهود في حل سنن أبي داود:كتاب الآداب، باب كيف يتوجه عند النوم (13/ 440)، ط.</span>مركز الشيخ أبي الحسن الندوي للبحوث والدراسات الإسلامية، الهند، الطبعة الأولى: 1427هـ = 2006 م)</span></p><p class=""indent"" style=""text-align:left;""><span class=""ar_writing"">فقط والله أعلم</span></p></p>",144308101889,banuri,"('تاریخ و سیر', 'tareekh-o-siyar')","('سیرت', 'seerat')","('شمائل و صفات نبوی صلی اللہ علیہ وسلم', 'shamael-o-sifaat-nabwi-salla-allahu-alayhe-wasallam')"
18-03-2022,https://www.banuri.edu.pk/readquestion/do-rakat-salat-ut-tasbih-parhna-144308101179/18-03-2022,دو رکعات صلاۃ التسبیح پڑھنا,کیا صلاۃ التسبیح دو رکعت پڑھ سکتے ہیں؟,"<p><p style=""text-align:justify;"">حضور صلی اللہ علیہ وسلم سے جو روایات صلاۃ التسبیح کے متعلق مروی ہیں ان احادیث کے الفاظ کا ظاہر یہ ہے کہ صلاۃ التسبیح کی چار رکعت ایک سلام کے ساتھ ہیں لہذا بہتر تو یہ ہی ہے کہ ایک سلام کے ساتھ چار رکعت پڑھی جائیں، البتہ اگر کوئی چار رکعت دو  سلام کے ساتھ  (یعنی دو دورکعت الگ الگ پڑھتا ہے)ادا کرتا ہے تو اس کی بھی گنجائش ہے۔ صرف دو رکعت ادا کرنے سے صلاۃ التسبیح  ادا نہیں ہوگی۔</p><p>فتاوی شامی میں ہے:</p><p class=""indent"" style=""text-align:justify;""><span class=""ar_writing"">""وأربع صلاة التسبيح بثلاثمائة تسبيحة، وفضلها عظيم.</span></p><p class=""indent"" style=""text-align:justify;""><span class=""ar_writing"">(قوله وأربع صلاة التسبيح إلخ)....وهي أربع بتسليمة أو تسليمتين، يقول فيها ثلثمائة مرة «سبحان الله، والحمد لله ولا إله إلا الله، والله أكبر» وفي رواية زيادة «ولا حول ولا قوة إلا بالله» يقول ذلك في كل ركعة خمسة وسبعين مرة؛ فبعد الثناء خمسة عشر، ثم بعد القراءة وفي ركوعه، والرفع منه، وكل من السجدتين، وفي الجلسة بينهما عشرا عشرا بعد تسبيح الركوع والسجود، وهذه الكيفية هي التي رواها الترمذي في جامعه عن عبد الله بن المبارك أحد أصحاب أبي حنيفة الذي شاركه في العلم والزهد والورع، وعليها اقتصر في القنية وقال إنها المختار من الروايتين.""</span></p><p class=""indent"" style=""text-align:left;"">(کتاب الصلاۃ،باب الوتر و النوافل ج نمبر ۲ ص نمبر ۲۷،ایچ ایم سعید)</p><p>مرقاة المفاتيح  میں ہے:</p><p class=""indent"" style=""text-align:justify;""><span class=""ar_writing"">""عن ابن عباس - رضي الله عنهما - أن «النبي صلى الله عليه وسلم قال للعباس بن عبد المطلب: يا عباس! يا عماه! ألا أعطيك؟ ألا أمنحك؟ ألا أخبرك؟ ألا أفعل بك؟ عشر خصال إذا أنت فعلت ذلك، غفر الله لك ذنبك أوله وآخره، قديمه وحديثه، خطأه وعمده، صغيره وكبيره، سره وعلانيته: أن تصلي أربع ركعات، تقرأ في كل ركعة فاتحة الكتاب وسورة، فإذا فرغت من القراءة في أول ركعة وأنت قائم، قلت: سبحان الله، والحمد لله، ولا إله إلا الله، والله أكبر، خمس عشرة مرة، ثم تركع، فتقولها وأنت راكع عشرا، ثم ترفع رأسك من الركوع، فتقولها عشرا، ثم تهوي ساجدا، فتقولها وأنت ساجد عشرا، ثم ترفع رأسك من السجود فتقولها عشرا، ثم تسجد فتقولها عشرا، ثم ترفع رأسك فتقولها عشرا، فذلك خمس وسبعون في كل ركعة، تفعل ذلك في أربع ركعات، إن استطعت أن تصليها في كل يوم مرة فافعل، فإن لم تفعل، ففي كل جمعة مرة، فإن لم تفعل ففي كل شهر مرة، فإن لم تفعل ففي كل سنة مرة، فإن لم تفعل ففي عمرك مرة» "". رواه أبو داود، وابن ماجه، والبيهقي في ""الدعوات الكبير"".</span></p><p class=""indent"" style=""text-align:justify;""><span class=""ar_writing"">(أربع ركعات) : ظاهره أنه بتسليم واحد ليلا كان أو نهارا.""</span></p><p class=""indent"" style=""text-align:left;"">(کتاب الصلاۃ، باب صلاۃ التسبیح ج نمبر ۳ ص نمبر  ۱۳۲۸،دار الفکر)</p><p>معارف السنن میں ہے:</p><p class=""indent"" style=""text-align:justify;""><span class=""ar_writing"">""وهذه الاربع الظاهر المتبادر منه انها بتسليمة و كذلك يتبادر ذلك من تعليم رسول الله صلي الله عليه وسلم عليا الاربع لحفظ القران كما ياتي الخ"".</span></p><p class=""indent"" style=""text-align:left;"">(کتاب الصلاۃ ،باب ما جاء فی صلاۃ التسبیح ج نمبر ۴ ص نمبر ۲۸۶،ایچ ایم سعید)</p><p class=""indent"" style=""text-align:left;"">فقط واللہ اعلم</p></p>",144308101179,banuri,"('نماز', 'salat')","('سنن و نوافل', 'nawafil')","('صلوٰۃ التسبیح', 'salatut-tasbeeh')"
