issued_at,link,title,question,answer,fatwa_number,dar_ul_ifta,kitab,bab,fasal
08-04-2020,https://www.banuri.edu.pk/readquestion/moo-per-tareef-144108200875/08-04-2020,منہ پر تعریف کا حکم,منہ پر  تعریف کرنے کا شرعی حکم کیا ہے؟ بندہ نہایت ادب و احترام کے ساتھ عرض کرتا ہے کہ آپ مندرجہ بالا مسئلہ کا قرآن و احادیث کی روشنی میں مفصل و مدقق اس طرح جواب عنایت فرمائیں کہ جس میں مروجہ تحریر کردہ کتب پر چسپاں کی جانے والی مصنف کی تعریفات پر مشتمل تقریظات کا شرعی حکم بھی واضح ہو سکے اور جس سے سوشل میڈیا پر لکھے جانے والے دینی و دنیوی اصلاح کن مضامین و خبر رساں رسائل و تحریرات پر چسپاں کی جانے والی تعریفات کا بھی حکم شرعی واضح ہو سکے ۔,"<p><p style=""text-align:justify;"">منہ پر تعریف کرنا بری عادت ہے، نبی کریم ﷺ اس کی مذمت بیان کی ہے، تاہم اگر کوئی شخص کسی کی کتاب کی تقریظ کے لیے دعائیہ یا تعریفی کلمات لکھتا ہے تو اس کی غرض دوسروں کو اس کی اتباع کرنا ہوتا ہے، سوشل میڈیا کا استعمال کئی قباحتوں کی وجہ سے ناجائز ہے۔</p><p class=""indent"" style=""text-align:justify;""><span class=""ar_writing"">مرقاة المفاتيح شرح مشكاة المصابيح - (7 / 3031)<br/>(وعن المقداد بن الأسود - رضي الله عنه -) : قال المؤلف: هو المقداد بن عمرو الكندي، وذلك أن أباه خالف كندة فنسب إليها، وإنما سمي ابن الأسود لأنه كان حليفه، أو لأنه كان في حجره، وقيل: بل كان عبدا فتبناه. وكان سادسا في الإسلام، روى عنه علي وطارق بن شهاب وغيرهما، مات بالجرف على ثلاثة أميال من المدينة، فحمل على رقاب الناس ودفن بالبقيع سنة ثلاث وثلاثين وهو ابن سبعين سنة. (قال: قال رسول الله صلى الله عليه وسلم: إذا رأيتم المداحين) أي: المبالغين في المدح متوجهين إليكم طمعا سواء يكون نثرا أو نظما (فاحثوا) : بهمزة وصل وضم مثلثة أي: ارموا (في وجوههم) : وفي نسخة في أفواههم (التراب) : قيل: يؤخذ التراب ويرمى به في وجه المداح عملا بظاهر الحديث، وقيل: معناه الأمر بدفع المال إليهم، إذ المال حقير كالتراب بالنسبة إلى العرض في كل باب أي: أعطوهم إياه واقطعوا به ألسنتهم لئلا يهجوكم، وقيل: معناه أعطوهم عطاء قليلا فشبهه لقلته بالتراب، وقيل: المراد منه أن يخيب المادح ولا يعطيه شيئا لمدحه، والمراد زجر المادح والحث على منعه من المدح؛ لأنه يجعل الشخص مغرورا ومتكبرا. قال الخطابي: المداحون هم الذين اتخذوا مدح الناس عادة، وجعلوه بضاعة يستأكلون به الممدوح، <span style=""text-decoration:underline;""><strong>فأما من مدح الرجل على الفعل الحسن والأمر المحمود، يكون منه ترغيبا له في أمثاله، وتحريضا للناس على الاقتداء في أشباهه فليس بمداح،</strong></span> وفي شرح السنة: قد استعمل المقداد الحديث على ظاهره في تناول عين التراب وحثيه في وجه المادح، وقد يتأول على أن يكون معناه الخيبة والحرمان أي: من تعرض لكم بالثناء والمدح فلا تعطوه واحرموه، كنى بالتراب عن الحرمان كقولهم: ما في يده غير التراب، وكقوله صلى الله عليه وسلم: "" «إذا جاءك يطلب ثمن الكلب فاملأ كفه ترابا» ""، وفي الجملة المدح والثناء على الرجل مكروه؛ لأنه قلما يسلم المادح عن كذب يقوله في مدحه، وقلما يسلم الممدوح من عجب يدخله. (رواه مسلم) . ورواه أحمد في مسنده، والبخاري في الأدب، وأبو داود، والترمذي عن المقداد، والطبراني والبيهقي عن ابن عمر، والحاكم في الكنى عن أنس، ولفظ الجامع الصغير: "" «احثوا التراب في وجوه المداحين» "" رواه الترمذي عن أبي هريرة، وابن عدي في الكامل، وأبو نعيم في الحلية عن ابن عمر. وفي رواية ابن ماجه عن المقداد "" «احثوا في أفواه المداحين التراب» ""، وكذلك رواه ابن حبان عن ابن عمر، وكذا ابن عساكر عن عبادة بن الصامت.</span></p><p class=""indent"" style=""text-align:left;""><span class=""ar_writing"">فقط و اللہ اعلم</span></p></p>",144108200875,banuri,"('علوم و فنون', 'uloom-funoon')","('حدیث و سنت', 'hadees-sunnat')","('حدیث کا معنی، مفہوم اور اقسام', 'hadees-ka-mana-mafhom-aur-aqsaam')"
05-04-2020,https://www.banuri.edu.pk/readquestion/rukoo-or-sajdy-mai-tasbeehat-ki-jagah-suboohun-qudoos-parhna-144108200695/05-04-2020,رکوع اور سجدے میں تسبیحات کی جگہ سبوح قدوس پڑھنا,احادیث کی کتابوں میں رکوع اور سجدے میں پڑھنے کے لیے دوسرے کلماتسبوح قدوسوغیرہ بھی منقول ہیں۔کیا فرض ،سنت، واجب نمازوں میں ان کلمات کو تسبیحاتسبحان ربی الالعظیماورسبحان ربی الاعلیکی جگہ پڑھ سکتے ہیں؟,"<p><p style=""text-align:justify;"">رکوع میں <span class=""qr_writing"">""سبحان ربي العظيم""</span> اور سجدے میں<span class=""qr_writing"">""سبحان ربي الأعلى""</span>کہنا سنت ہے، البتہ مذکورہ تسبیحات کہنے کے بعد اکیلے نماز پڑھنے والے شخص کے لیے رکوع یا سجدے کی دیگردعائیں پڑھنا مستحب ہے۔</p><p class=""indent"" style=""text-align:justify;""><span class=""ar_writing"">الدر المختار وحاشية ابن عابدين (رد المحتار) - (1 / 494)<br/>السنة في تسبيح الركوع سبحان ربي العظيم إلا إن كان لا يحسن الظاء فيبدل به الكريم لئلا يجري على لسانه العزيم فتفسد به الصلاة كذا في شرح درر البحار، فليحفظ فإن العامة عنه غافلون حيث يأتون بدل الظاء بزاي مفخمة. </span></p><p class=""indent"" style=""text-align:justify;""><span class=""ar_writing"">الدر المختار وحاشية ابن عابدين (رد المحتار) - (2 / 107)<br/>فإن كانت السجدة في الصلاة فإن كانت فريضة قال: سبحان ربي الأعلى أو نفلا قال ما شاء مما ورد «كسجد وجهي للذي خلقه وصوره وشق سمعه وبصره بحوله وقوته فتبارك الله أحسن الخالقين» ، وقوله: «اللهم اكتب لي عندك بها أجرا وضع عني بها وزرا واجعلها لي عندك ذخرا وتقبلها مني كما تقبلتها من عبدك داود» ، وإن كان خارج الصلاة قال كل ما أثر من ذلك اهـ وأقره في الحلية والبحر والنهر وغيرها.</span></p><p class=""indent"" style=""text-align:left;"">فقط و اللہ اعلم</p></p>",144108200695,banuri,"('نماز', 'salat')","('نماز کی شرائط', 'namaz-ki-sharait')","('نماز اور اس کی شرائط و ارکان ، سنن و آداب', 'namaz-or-us-ki-sharait-o-arkaan-sunan-o-aadab')"
01-04-2020,https://www.banuri.edu.pk/readquestion/zibah-k-waqt-tasmiyyah-k-chand-masail-144108200480/01-04-2020,ذبح کے وقت تسمیہ کے چند مسائل,اللہ کا نام لےکر جانور ذبح کرنے کے مندرجۂ ذیل طریقوں کا شرعی حکم کیا ہے؟(١) کسی شخص نے اس طرح ذبح کیا کہ چھری چلانے اور تسمیہ یعنیبِسْمِ اللٰهِ اَللٰهُ اَكْبَرکہنے کی ابتداء ایک ساتھ کی، جس کا نتیجہ یہ ہوا کہ جب ذبح ختم ہوا تب جاکر تسمیہ پورا ہوا، یعنی تسمیہ کا کچھ حصہ پڑھنا ہوا، اتنے میں کچھ رگیں کٹ گئی۔(٢) تسمیہ پہلے ختم کر لیا اس کے بعد فوراً چھری چلائی۔(٣) تسمیہ پورا کیا اس کے بعد گالیاں وغیرہ دوسری بات بَکتے ہوئے ذبح کر دیا۔(٤) آدھا ذبح کرنے کے بعد تسمیہ شروع کیا۔امید ہے کہ ہر صورت کا حکم واضح طور پر اور بحوالہ بتائیں گے۔,"<p><p style=""margin-left:0;margin-right:0;text-align:justify;"">1۔ اگر کسی شخص نے اس طرح ذبح کیا کہ چھری چلانے اور تسمیہ کہنے کی ابتدا ایک ساتھ کی ، اگر اکثر رگیں کٹنے سے پہلے تسمیہ مکمل ہوچکی تھی تو ذبیحہ حلال ہے اور اگر اکثر رگیں کٹنے کے بعد تسمیہ مکمل ہوا تھا تو ذبیحہ حلال نہیں۔</p><p style=""margin-left:0;margin-right:0;text-align:justify;"">2۔ تسمیہ ختم ہونے کے فورًا بعد چھری چلا لی تو ذبیحہ حلال ہے۔</p><p style=""margin-left:0;margin-right:0;text-align:justify;"">3۔ تسمیہ پورا کرنے کے بعد گالیاں دیں یا کوئی اور بات کی اور ذبح کیا تو ذبیحہ حلال نہیں۔</p><p style=""margin-left:0;margin-right:0;text-align:justify;"">4۔ اگر قصدًا  آدھا ذبح  (اکثر رگیں کٹنے) کے بعد تسمیہ شروع کیا تو ذبیحہ حلال نہیں۔</p><p class=""indent"" style=""margin-left:0;margin-right:0;text-align:justify;""><span class=""ar_writing"">الدر المختار وحاشية ابن عابدين (رد المحتار) - (6 / 299)</span></p><p class=""indent"" style=""margin-left:0;margin-right:0;text-align:justify;""><span class=""ar_writing"">(وإن) (ذكر مع اسمه) تعالى (غيره) (، فإن وصل) بلا عطف </span><span class=""ar_writing""><span style=""color:#000;"">(كره) (كقوله بسم الله اللهم تقبل من فلان) أو مني، ومنه: بسم الله محمد رسول الله بالرفع لعدم العطف ويكون مبتدئا، لكن يكره للوصل صورة، ولو بالجر أو النصب حرم درر، قيل هذا إذا عرف النحو. والأوجه أن لا يعتبر الإعراب، بل يحرم مطلقا بالعطف لعدم العرف زيلعي كما أفاده بقوله (وإن عطف حرمت نحو باسم الله واسم فلان أو فلان) لأنه أهل به لغير الله، قال - عليه الصلاة والسلام - «موطنان لا أذكر فيهما: عند العطاس، وعند الذبح» ، (فإن فصل صورة ومعنى كالدعاء قبل الإضجاع و) الدعاء (قبل التسمية أو بعد الذبح  <strong><span style=""color:#000080;"">لا بأس به) لعدم القران أصلا.</span></strong></span></span></p><p class=""indent"" style=""margin-left:0;margin-right:0;text-align:justify;""><span class=""ar_writing""><span style=""color:#000;""><strong><span style=""color:#000080;"">و في الرد:</span></strong>وذكر الإمام التمرتاشي أن وصله بلا واو يحل في الأوجه كلها لأنه غير مذكور على سبيل العطف فيكون مبتدئا، لكن يكره لوجود الوصل صورة، وإن مع الواو، فإن خفضه لا يحل لأنه يصير ذابحا بهما، وإن رفعه يحل لأنه كلام مبتدأ، وإن نصبه اختلفوا فيه اهـ ومثله في الكفاية والمعراج، وجزم في البدائع بما قاله التمرتاشي ···</span></span></p><p class=""indent"" style=""margin-left:0;margin-right:0;text-align:justify;""><span class=""ar_writing""><span style=""color:#000;""><strong><span style=""color:#000;"">وقوله وقبل التسمية مثال للفصل معنى، فقط فإنه إذا أضجعها ثم دعا وأعقب الدعاء بالتسمية والذبح لم يحصل الفصل صورة أي حسا بل معنى: أي تقديرا لأن الواجب تجريد التسمية وقد حصل، بخلاف ما إذا دعا بعد التسمية قبل الذبح نحو بسم الله اللهم تقبل مني أو اغفر لي فإنه يكره لأنه لم يجرد التسمية كما نقله في الشرنبلالية عن الذخيرة وغيرها تأمل</span></strong></span></span></p><p class=""indent"" style=""margin-left:0;margin-right:0;text-align:justify;""><span class=""ar_writing""><span style=""color:#000;"">الدر المختار وحاشية ابن عابدين (رد المحتار) - (6 / 301)</span></span></p><p class=""indent"" style=""margin-left:0;margin-right:0;text-align:justify;""><span class=""ar_writing""><span style=""color:#000;"">(قوله لأنه يقطع فور التسمية) قال الأتقاني: وفيه نظر اهـ. ووجهه يظهر مما يأتي قريبا فيما يقطع الفور، والظاهر أن المراد كمال الفورية وإلا لزم أن تكون الذبيحة ميتة، وأن يكون الفصل حراما لا مكروها لكن فيه أنه لو اقتصر على قوله الله أكبر قاصدا به التسمية يكفي تأمل</span></span></p><p class=""indent"" style=""margin-left:0;margin-right:0;text-align:justify;""><span class=""ar_writing""><span style=""color:#000;"">الدر المختار وحاشية ابن عابدين (رد المحتار) - (6 / 302)</span></span></p><p class=""indent"" style=""margin-left:0;margin-right:0;text-align:justify;""><span class=""ar_writing""><span style=""color:#000;""> ولو سمى الذابح ثم اشتغل بأكل أو شرب ثم ذبح، إن طال وقطع الفور حرم وإلا لا، وحد الطول ما يستكثره الناظر، وإذا حد الشفرة ينقطع الفور بزازية.</span></span></p><p class=""indent"" style=""margin-left:0;margin-right:0;text-align:justify;""><span class=""ar_writing""><span style=""color:#000;"">و في الرد: <strong><span style=""color:#000;"">(قوله قبل تبدل المجلس) أي حقيقة أو حكما كالفاصل الطويل كما يأتي فافهم: قال الزيلعي: حتى إذا سمى واشتغل بعمل آخر من كلام قليل أو شرب ماء أو أكل لقمة أو تحديد شفرة ثم ذبح يحل، وإن كان كثيرا لا يحل لأن إيقاع الذبح متصلا بالتسمية بحيث لا يتخلل بينهما شيء لا يمكن إلا بحرج عظيم فأقيم المجلس مقام الاتصال، والعمل القليل لا يقطعه والكثير يقطع اهـ ··· (قوله وإذا حد الشفرة ينقطع الفور) مخالف لما قدمناه آنفا عن الزيلعي. ويمكن أن يقيد بما إذا كثر يدل عليه سياق كلام الزيلعي، وقوله في الجوهرة أو شحذ السكين قليلا أجزأه، لكن قال في التتارخانية: وفي أضاحي الزعفراني إذا حدد الشفرة تنقطع التسمية من غير فصل بين ما إذا قل أو كثر اهـ فليتأمل</span></strong></span></span></p><p class=""indent"" style=""margin-left:0;margin-right:0;text-align:justify;""><span class=""ar_writing""><span style=""color:#000;"">بدائع الصنائع في ترتيب الشرائع - (10 / 180)</span></span></p><p class=""indent"" style=""margin-left:0;margin-right:0;text-align:justify;""><span class=""ar_writing""><span style=""color:#000;"">( أما ) وقت التسمية فوقتها في الذكاة الاختيارية وقت الذبح لا يجوز تقديمها عليه إلا بزمان قليل لا يمكن التحرز عنه</span></span></p><p class=""indent"" style=""margin-left:0;margin-right:0;text-align:left;""><span class=""ar_writing""><span style=""color:#000;"">فقط و الله أعلم</span></span></p></p>",144108200480,banuri,"('عبادات', 'ebadat')","('ذبیحہ / قربانی', 'zabiha-qurbani')","('ذبح ، شرائط ، سنن ، آداب و مکروہات', 'zibah-sharait-sunan-aadab-o-makrohat')"
06-10-2024,https://www.banuri.edu.pk/readquestion/bivi-ki-ijazat-sai-us-ka-meher-istimaal-karna-144604100253/06-10-2024,بيوی کی اجازت سے اس کا مہر استعمال کرنا,میں نکاح نامہ کے مطابق بیوی کو دس مثقال سونا دیا تھا،میں باہرملک کمانے جارہا تھا،چوں کہ  ویزا لینے کے لیے مجھے پیسوں کی ضرورت تھی،لہذا  میں نے بیوی سے کہا کہ آپ کی اجازت سے میں تمہارا سونا بیچ کر ویزا خریدوں گا،اور باہر ملک کمانے چلاجاؤں گا،بیوی کی اجازت سے میں نے سونا بیچا ،لیکن مجھے ویزا نہیں ملا،میں نے وہ رقم گھر کے اخراجات میں استعمال کی،اب میں نے اپنی بیوی کو طلاق دی ہے ،اور وہ اپنامہر( دس مثقال سونا) مانگ رہی ہے،کیا یہ مہر مجھ پر دینا لازم ہے؟,"<p><p style=""text-align:justify;"">صورت مسئولہ میں بیوی کے مہر کا جو سونا (دس مثقال)سائل نے اپنی بیوی کی اجازت سے استعمال کیا تھا ،وہ سائل کے ذمہ قرض شمار ہوگا ، سائل پر اس کا لوٹانا ضروری ہے۔</p><p style=""text-align:justify;"">درر الحکام میں ہے:</p><p class=""indent"" style=""text-align:justify;""><span class=""ar_writing"">""فإذا كان لفظ يحتمل القرض والهبة معا فالتمليك الواقع باللفظ المذكور يصرف إلى القرض؛ لأن القرض الأقل والسبب في ذلك أن ملك المالك في القرض يزول في مقابل بدل بخلاف الهبة فإنه يزول بلا بدل.""</span></p><p class=""indent"" style=""text-align:left;""><span class=""ar_writing"">(كتاب الهبه، الباب الاول، الفصل الاول، المادة:404/2،838، ط:دار الجیل)</span></p><p><span class=""ar_writing"">وفيه ايضا:</span></p><p class=""indent"" style=""text-align:justify;""><span class=""ar_writing"">""قد اشترط لانعقاد الهبة بالتعاطي وجود قرينة دالة على التمليك.""</span></p><p class=""indent"" style=""text-align:left;""><span class=""ar_writing"">(كتاب الهبه، الباب الاول، الفصل الاول، المادة:405/2،840، ط:دار الجیل)</span></p><p class=""indent"" style=""text-align:left;""><span class=""ar_writing"">فقط والله اعلم</span></p><p style=""text-align:justify;""> </p></p>",144604100253,banuri,"('بیوع', 'buyoo')","('قرض', 'qarz')","('قرض کے احکام', 'qarz-ke-ahkaam')"
15-10-2024,https://www.banuri.edu.pk/readquestion/qarne-karem-ko-muktlef-ma-parna-srean-kasya-ha-144604101139/15-10-2024,قرآن کریم کو مختلف لہجوں میں پڑھنے کا حکم,قرآن کریم کو مشہور مقامات کے مطابق پڑھنا شرعاً کیسا ہے ؟ میری معلومات کے مطابق ان مشہور مقامات کی بنیاد Do re mi sol la si do پر ہے جسے گانوں میں استعمال کیا جاتا ہے ، کیا قرآن کریم کو مقامات کے مطابق پڑھنے کی لیے اس کی بنیاد Do re mi sol la si doسے مشق کرانا کیسا ہے؟,"<p><p style=""text-align:justify;""> قرآن کریم کی تلاوت  عموماً سات لہجات میں سے کسی ایک میں کی جاتی ہے، لہجات کے اس علم  کو’’علم النغمات ‘‘اور ’’علم المقامات ‘‘بھی کہا جاتا ہے، علم المقامات کا سیکھنا اور اس کے موافق قرآن کریم کی تلاوت کرنا نہ صرف جائز ہے،  بلکہ مستحسن ہے،البتہ قرآن کریم کی تلاوت میں صرف یہی لہجات مقصود نہیں، بلکہ تجوید کے اصول وقواعد کے مطابق قرآن مجید پڑھنا  ضروری ہے، یعنی اصل مقصود تجویدی قواعد کے مطابق قرآن کریم کی تلاوت ہے، اس لیے مختلف لہجات میں قرآن مجید پڑھتے ہوئے تجوید کے خلاف تلاوت کرنے  کی اجازت نہیں ہوگی۔</p><p style=""text-align:justify;""> نیز علم المقامات کی بنیاد  ہرگز  ""<span style=""text-align:justify;"">Do re mi sol la si do"" پر نہیں ہے، </span>تفصیل کے لیے جامعہ کی ویب سائٹ پر ملاحظہ ہو:</p><p><a href=""https://www.banuri.edu.pk/bayyinat-detail/"">علم النغمات یا قرآن کریم کے لہجات کا فن</a></p><p style=""text-align:justify;"">الإتقان في علوم القرآن میں ہے:</p><p class=""indent"" style=""text-align:justify;""><span class=""ar_writing"">’’وقال في جواب سؤال سأله ابن الجزري: القراءات السبع التي اقتصر عليها الشاطبي والثلاث التي هي قراءة أبي جعفر ويعقوب وخلف متواترة معلومة من الدين بالضرورة وكل حرف انفرد به واحد من العشرة معلوم من الدين بالضرورة أنه منزل على رسول الله صلى الله عليه وسلم لا يكابر في شيء من ذلك إلا جاهل.‘‘</span></p><p class=""indent"" style=""text-align:left;""><span class=""ar_writing"">(‌‌النوع الثاني والثالث والرابع والخامس والسادس والسابع والعشرون: معرفة المتواتر والمشهور والآحاد والشاذ والموضوع والمدرج، 277/1، ط: الهيئة المصرية العامة للكتاب)</span></p><p class=""indent"" style=""text-align:left;"">فقط واللہ اعلم</p></p>",144604101139,banuri,"('علوم و فنون', 'uloom-funoon')","('متعلقات قرآن کریم', 'quran-kareem')","('تجوید اور ترتیب قرآنی', 'tajweed-aur-tarteeb-e-quraani')"
