issued_at,link,title,question,answer,fatwa_number,dar_ul_ifta,kitab,bab,fasal
12-10-2024,https://www.banuri.edu.pk/readquestion/taqseem-wrast-do-baty-our-do-bateya-144604100824/12-10-2024,تقسیم وراثت/دوبیٹےاوردوبیٹیاں,ایک شخص کاانتقال ہوا،جب کہ اس کےورثاء میں دوبیٹےاوردوبیٹیاں ہیں،مرحوم کےترکہ میں ایک مکان ہے،جس کی مالیت 80لاکھ روپےہے،سوال یہ ہے کہ مذکورہ ترکہ ورثاءمیں کس طرح تقسیم ہوگی؟واضح رہے کہ مرحوم کےوالدین اوربیوہ کامرحوم کی زندگی میں انتقال ہواہے۔,"<p><p style=""text-align:justify;"">صورت مسئولہ میں مرحوم کےحقوق متقدمہ اداکرنےکےبعدمابقیہ کل ترکہ کو6حصوں میں تقسیم کرکے2،2حصےہرایک بیٹےکو،اورایک،ایک حصہ ہرایک بیٹی کوملےگا۔</p><p style=""text-align:justify;"">صورت تقسیم یہ ہے۔</p><p style=""text-align:justify;"">مرحوم (والد)6</p><table border=""1"" style=""border-collapse:collapse;width:100%;""><tbody><tr><td style=""width:23.8028%;text-align:center;"">بیٹا</td><td style=""width:23.8028%;text-align:center;"">بیٹا</td><td style=""width:23.8028%;text-align:center;"">بیٹی</td><td style=""width:23.8028%;text-align:center;"">بیٹی</td></tr><tr><td style=""width:23.8028%;text-align:center;"">2</td><td style=""width:23.8028%;text-align:center;"">2</td><td style=""width:23.8028%;text-align:center;"">1</td><td style=""width:23.8028%;text-align:center;"">1</td></tr></tbody></table><p style=""text-align:justify;"">یعنی 80لاکھ روپےمیں سے 2666666.66روپےہرایک بیٹےکو،اور1333333.33روپےہرایک بیٹی کوملیں گے۔</p><p class=""indent"" style=""text-align:left;"">فقط واللہ اعلم</p></p>",144604100824,banuri,"('فرائض', 'faraez')","('میراث کا بیان', 'meeraas-ka-bayan')","('میراث کا حکم', 'meeraas-ka-hukum')"
01-05-2020,https://www.banuri.edu.pk/readquestion/sotaili-maa-sy-parda-karna-144109200820/01-05-2020,سوتیلی ماں سے پردہ کرنا,سوتیلی ماں نے بچے کو فیڈ نہیں کرایا اور نہ ہی اس کی پرورش کی، سوال یہ ہے کہ بالغ ہونے کے بعد اس بچے سے پردہ جائز ہے یعنی وہ محرم ہوا یا نہیں؟,"<p><p style=""text-align:justify;"">بچے کے لیے باپ کی منکوحہ محرم ہے، لہذا اس سے پردہ کرنا ضروری نہیں۔  فقط و اللہ اعلم</p></p>",144109200820,banuri,"('نکاح', 'nikah')","('محرمات و غیر محرمات', 'muharramat-o-gher-muharramat')","('نسبی محرمات', 'muharramat')"
14-05-2020,https://www.banuri.edu.pk/readquestion/aam-halaq-or-corona-mai-gharo-mai-juma-or-eid-ka-farq-144109202254/14-05-2020,عام حالات اور کورونا میں گھروں میں جمعہ و عیدین کا فرق,عام حالات میں گھروں میں جمعہ وعیدین کے عدم جواز اور  کرونا وائرس  کے دوران جواز کے علل کیا ہیں اور ان کے درمیان کیا فرق ہے؟,"<p><p style=""text-align:justify;"">واضح رہے کہ عید کی نماز دین کے شعائر میں سے بنیادی شعار ہے،(1) اورعید کی نماز سے مقصود مسلمانوں کی شان و شوکت اور قوت کا اظہار ہے، یہی وجہ ہے کہ عید کی نماز عید گاہ میں پڑھنا مسنون ہے ، تاکہ زیادہ سے زیادہ مسلمان ایک جماعت میں شریک ہوسکیں۔(2)</p><p style=""text-align:justify;""> شہر، فنائے شہر اور بڑا گاؤں جہاں جمعہ قائم کرنے کی شرائط پائی جاتی ہیں وہاں عید کی نماز پڑھنا واجب ہے، تاہم جمعہ اور عید کی نماز کی شرائط میں فرق یہ ہے کہ جمعہ کے درست ہونے کے لیے خطبہ شرط ہے ، جب کہ عید کی نماز کے لیے خطبہ شرط نہیں، سنت ہے،(3) اسی طرح عید کی نماز کے لیے اذنِ عام کا ہونا بھی شرط نہیں، جمعہ اور عید کی نمازوں کے لیے جماعت کا ہونا شرط ہے، انفرادی طور پر جمعہ یا عید کی نماز ادا کرنا درست نہیں، جماعت کے ساتھ پڑھنا ضروری ہے، لیکن جمعہ اور عید کی جماعت کے لیے کتنے افراد ضروری ہیں؟ اس میں فرق ہے، جمعہ کی نماز درست ہونے کے لیے امام کے علاوہ تین مردوں کا ہونا ضروری ہے اور عید کی نماز کے لیے امام کے علاوہ ایک مرد کا ہونا کافی ہے۔(4)</p><p style=""text-align:justify;"">جن ممالک  میں حکومت کی طرف سے مساجد یا عید کی نمازوں پر پابندی نہ ہو وہاں گھروں میں عید کی نماز ادا کرنے کے بجائے عیدگاہ یا بڑےمجمع میں  یا مساجد میں ادا کرنے کا اہتمام ضروری ہے تاکہ مسلمانوں کی شان وشوکت اظہار ہو۔</p><p style=""text-align:justify;"">البتہ  اگر کسی ملک میں موجودہ حالات کی وجہ سے  حکومت نے عید گاہ یا مسجد میں عید کی نماز پڑھنے پر پابند ی لگائی ہو تو   شہر، فنائے شہر یا بڑے گاؤں کے رہنے والے مسلمان ممکنہ حد تک کوشش کریں کہ وہ عید کی نماز عید گاہ میں یا مسجد میں پڑھ سکیں، لیکن اگرعید کی نماز عید گاہ یا مسجد میں پڑھنا بالکل ممکن نہ ہو تو  گھر کی چھت، صحن یا بلڈنگ کی پارکنگ وغیرہ میں چند افراد جمع ہو کر عید کی نماز پڑھ لیں۔</p><p style=""text-align:justify;"">حوالہ جات:</p><p style=""text-align:justify;""><span class=""ar_writing"">(1)      بدائع الصنائع في ترتيب الشرائع  (3 / 84):</span></p><p class=""indent"" style=""text-align:justify;""><span class=""ar_writing"">""ولأنها من شعائر الإسلام فلو كانت سنةً فربما اجتمع الناس على تركها فيفوت ما هو من شعائر الإسلام؛ فكانت واجبةً؛ صيانةً لما هو من شعائر الإسلام عن الفوت"".</span></p><p style=""text-align:justify;""><span class=""ar_writing"">(2)      صحيح البخاري (2 / 22) ط: دار الشعب:</span></p><p class=""indent"" style=""text-align:justify;""><span class=""ar_writing"">""عن أبي سعيد الخدري ، قال: كان رسول الله صلى الله عليه وسلم يخرج يوم الفطر والأضحى إلى المصلى فأول شيء يبدأ به الصلاة ثم ينصرف"".</span></p><p style=""text-align:justify;""><span class=""ar_writing"">فتح الباري (2 / 450):</span></p><p class=""indent"" style=""text-align:justify;""><span class=""ar_writing"">""واستدل به على استحباب الخروج إلى الصحراء لصلاة العيد وأن ذلك أفضل من صلاتها في المسجد؛ لمواظبة النبي صلى الله عليه و سلم على ذلك مع فضل مسجده"".</span></p><p style=""text-align:justify;""><span class=""ar_writing"">الدر المختار وحاشية ابن عابدين (2 / 169):</span></p><p class=""indent"" style=""text-align:justify;""><span class=""ar_writing"">""وفي الخلاصة والخانية: السنة أن يخرج الإمام إلى الجبانة، ويستخلف غيره ليصلي في المصر بالضعفاء بناء على أن صلاة العيدين في موضعين جائزة بالاتفاق، وإن لم يستخلف فله ذلك. اهـ. نوح"".</span></p><p style=""text-align:justify;""><span class=""ar_writing"">الفتاوى الهندية - (1 / 150):</span></p><p class=""indent"" style=""text-align:justify;""><span class=""ar_writing"">""الخروج إلى الجبانة في صلاة العيد سنة وإن كان يسعهم المسجد الجامع، على هذا عامة المشايخ وهو الصحيح، هكذا في المضمرات"".</span></p><p style=""text-align:justify;""><span class=""ar_writing"">(3)      بدائع الصنائع في ترتيب الشرائع  (3 / 85):</span></p><p class=""indent"" style=""text-align:justify;""><span class=""ar_writing"">""وأما شرائط وجوبها وجوازها فكل ما هو شرط وجوب الجمعة وجوازها فهو شرط وجوب صلاة العيدين وجوازها من الإمام والمصر والجماعة والوقت إلا الخطبة فإنها سنة بعد الصلاة"".</span></p><p style=""text-align:justify;""><span class=""ar_writing"">الدر المختار وحاشية ابن عابدين (2 / 166):</span></p><p class=""indent"" style=""text-align:justify;""><span class=""ar_writing"">""(تجب صلاتهما) في الأصح (على من تجب عليه الجمعة بشرائطها) المتقدمة (سوى الخطبة) فإنها سنة بعدها"".</span></p><p style=""text-align:justify;""><span class=""ar_writing"">و في الرد:</span></p><p class=""indent"" style=""text-align:justify;""><span class=""ar_writing"">""(قوله: فإنها سنة بعدها) بيان للفرق وهو أنها فيها سنة لا شرط وأنها بعدها لا قبلها بخلاف الجمعة. قال في البحر: حتى لو لم يخطب أصلاً صحّ وأساء؛ لترك السنة، ولو قدمها على الصلاة صحت وأساء ولاتعاد الصلاة"".</span></p><p style=""text-align:justify;""><span class=""ar_writing"">بدائع الصنائع في ترتيب الشرائع - (3 / 89):</span></p><p class=""indent"" style=""text-align:justify;""><span class=""ar_writing"">""وأما الخطبة فليست بشرط؛ لأنها تؤدى بعد الصلاة وشرط الشيء يكون سابقًا عليه أو مقارنًا له، والدليل على أنها تؤدى بعد الصلاة ما روي عن ابن عمر أنه قال: { صليت خلف رسول الله صلى الله عليه وسلم وخلف أبي بكر وعمر رضي الله عنهما وكانوا يبدءون بالصلاة قبل الخطبة}، وكذا روي عن ابن عباس رضي الله عنهما أنه قال: { صليت خلف رسول الله صلى الله عليه وسلم وخلف أبي بكر وعمر وعثمان فبدءوا بالصلاة قبل الخطبة ولم يؤذنوا ولم يقيموا} ولأنها وجبت لتعليم ما يجب إقامته يوم العيد والوعظ والتكبير فكان التأخير أولى ليكون الامتثال أقرب إلى زمان التعليم"".</span></p><p style=""text-align:justify;""><span class=""ar_writing"">(4)    الدر المختار وحاشية ابن عابدين (2 / 166):</span></p><p class=""indent"" style=""text-align:justify;""><span class=""ar_writing"">""(تجب صلاتهما) في الأصح (على من تجب عليه الجمعة بشرائطها) المتقدمة (سوى الخطبة) فإنها سنة بعدها"".</span></p><p style=""text-align:justify;""><span class=""ar_writing"">و في الرد:</span></p><p class=""indent"" style=""text-align:justify;""><span class=""ar_writing"">""لكن اعترض ط ما ذكره المصنف بأن الجمعة من شرائطها الجماعة التي هي جمع والواحد هنا مع الإمام، كما في النهر"".</span></p><p style=""text-align:justify;""><span class=""ar_writing"">الفقه على المذاهب الأربعة  (1 / 531):</span></p><p class=""indent"" style=""text-align:justify;""><span class=""ar_writing"">""الحنفية قالوا: صلاة العيدين واجبة في الأصح على من تجب عليه الجمع بشرائطها سواء كانت شرائط وجوب أو شرائط صحة إلا أنه يستثنى من شرائط الصحة الخطبة فإنها تكون قبل الصلاة في الجمعة وبعدها في العيد ويستثنى أيضًا عدد الجماعة فإن الجماعة في صلاة العيد تتحقق بواحد مع إمام بخلاف الجمعة"".</span></p><p class=""indent"" style=""text-align:left;"">فقط واللہ اعلم</p></p>",144109202254,banuri,"('نماز', 'salat')","('جمعہ کی نماز', 'jumaa')","('جمعہ و عیدین', 'juma-o-eidayn')"
28-05-2020,https://www.banuri.edu.pk/readquestion/jazz-cash-ya-easy-paisa-account-ka-hukum-144110200327/28-05-2020,جاز کیش یا ایزی پیسہ اکاؤنٹ کا حکم,میں نے جازکیش اور ایزی پیسہ اکاونٹ سے متعلق بات پوچھنی ہے،  جازکیش اکاونٹ میں 1 ہزار روپے ہوں اور مہینہ میں ایک بار ٹرانزیکش کرنے پرروزانہ 30 منٹ اور 30 ایس ایم ایس ملتے ہیں، یہ منٹ اور ایس ایم ایس استعمال کرنا درست ہے یا سود ہے؟اسی طرح ایزی پیسہ اکاونٹ میں 2000 سے 10000 روپے ہوں اور ہفتے میں ایک ٹرانزیکش کرنے پر روزانہ 3 سے 15 روپے تک دیتے ہیں۔ کیا یہ دونوں سود میں آتے ہیں یا نہیں؟,"<p><p style=""text-align:justify;"">واضح رہے کہ موبائل فون میں کال کرنے کی سہولت فراہم کرنے والی مختلف کمپنیوں کی جانب سے مختلف ناموں سے اکاؤنٹ کھولنے کی سہولت فراہم کی جاتی ہے، (مثلاً جاز کیش اکاؤنٹ، ٹیلی نار ایزی پیسہ اکاؤنٹ وغیرہ)، جس میں طے شدہ بیلنس  رکھنے  کی شرط پر کمپنی کی طرف سے  مختلف سہولیات اکاؤنٹ ہولڈر  کو مہیا کی جاتی ہیں؛ جیسے: فری منٹ، فری ایس ایم ایس و غیرہ، تو ایسے اکاؤنٹ کھلوانے اور اس کے ذریعہ رقم بھیجنے اور وصول کرنے  کا حکم یہ ہے کہ اگر کمپنی سے مقررہ  رقم رکھنے کی شرط پر اضافی سہولیات فراہم ہی نہیں کی جائیں تو اس صورت میں ایسا اکاؤنٹ کھلوایا جا سکتا ہے، تاہم اگر کمپنی کی طرف سے مخصوص رقم جمع کرانے کی شرط پر مقررہ سہولیات فراہم کی جاتی ہوں، چاہے کوئی لینا چاہے یا نہ چاہے تو ایسی صورت میں ایسا اکاؤنٹ درحقیقت سودی ہوتا ہے، جسے کھلوانے کی شرعاً اجازت نہیں؛ کیوں کہ کمپنی میں اکاؤنٹ ہولڈر کی جانب سے جو  رقم جمع کرائی جاتی ہے وہ کمپنی کے ذمہ قرض ہوتی ہے اور اکاؤنٹ ہولڈر جب اپنی رقم واپس لینا چاہے کمپنی رقم واپس کرنے کی پابند ہوتی ہے، اور قرض پر کسی بھی قسم کا مشروط نفع از روئے شرع سود ہونے کی وجہ سے حرام ہوتا ہے؛ لہذا صورتِ مسئولہ میں ایسا اکاؤنٹ کھلوانا جائز نہیں، چاہے فری منٹ و دیگر فراہم کردہ سہولیات سے اکاؤنٹ ہولڈر فائدہ اٹھائے یا نہ اٹھائے ، اگر کسی نے ایسا اکاؤنٹ کھلوا رکھا ہے اسے فوری طور پر سچے دل سے توبہ و استغفار کرتے ہوئے مذکورہ اکاؤنٹ بند کروا دینا چاہیے۔ فقط واللہ اعلم</p></p>",144110200327,banuri,"('معاملات', 'muamlat')","('سود / بینکاری / انشورنس / شیئرز', 'sood-bankari-insurance-shares')","('سودی قرضہ کی لین دین', 'soodi-qarzay-ki-layn-dayn')"
03-10-2024,https://www.banuri.edu.pk/readquestion/sim-active-karne-par-compny-ki-taraf-se-milne-wale-free-mints-ka-hukum-144603103244/03-10-2024,سم ایکٹیو کرنے پر کمپنی کی طرف سے ملنے والے فری منٹس کا حکم,اکثر سم نیٹ ورک والے کچھ  دنوں بعد  منٹ ، انٹرنیٹ وغیرہ بغیر کسی وجہ کے دیتے ہیں، حالاں کہ ہماری سم  میں کوئی  روپیہ نہیں ہوتا ، کیا اس کا استعمال کرنا جائز ہے۔وضاحت: تقریبا ایک مہینہ  سم بند رکھنے  کے بعد سم کھولنے پر کمپنی کی طرف سے کوڈ ملانے کے بعد فری منٹس ملتے ہیں۔,"<p><p style=""text-align:justify;"">صورت ِ مسئولہ میں کچھ مدت بعد سم دوبارہ فعال (ایکٹیو) کرنے پر کمپنی کی طرف جو فری منٹس اور  انٹرنیٹ کی سہولت کی ملتی ہے وہ کمپنی کی طرف سے تبرّع اور انعام ہے، اس کا استعمال جائز ہے۔</p><p style=""text-align:justify;"">الموسوعۃ الفقہیۃ الکویتیۃ میں ہے:</p><p class=""indent"" style=""text-align:justify;""><span class=""ar_writing"">""فإن معنى التبرع عند الفقهاء كما يؤخذ من تعريفهم لهذه الأنواع، لا يخرج عن كون التبرع بذل المكلف مالا أو منفعة لغيره في الحال أو المآل بلا عوض بقصد البر والمعروف غالبا.""</span></p><p class=""indent"" style=""text-align:left;""><span class=""ar_writing"">(حرف التاء، تبرع، 10/65، ط: دار السلاسل)</span></p><p class=""indent"" style=""text-align:left;""><span class=""ar_writing"">فقط واللہ أعلم</span></p></p>",144603103244,banuri,"('ہبہ', 'hiba')","('ہبہ کی اشیاء', 'hiba-ki-ashya')","('جن اشیاء کا ہبہ درست ہے', 'jin-ashya-ka-hiba-durust-he')"
07-10-2024,https://www.banuri.edu.pk/readquestion/malikana-qabza-wikhtiyar-se-hiba-taam-hojata-he-144604100257/07-10-2024,مالکانہ قبضہ واختیار دینے سے ہبہ تام ہوجاتا ہے,ہمارے والد صاحب کے چار گھر تھے، اس میں سے ایک گھر انہوں نے نانا کے نام، ایک گھر نانی کے نام اور ایک گھر اپنے بھائی کے نام کر دیا تھا، نیز ان سب لوگوں کو ان گھروں پر قبضہ بھی دے دیا تھا، جب کہ ایک گھر اپنے بیوی بچوں کے لیے رکھا، جس میں انتقال تک وہ خود بھی رہتے تھے، تاہم وہ اپنی اہلیہ کو بار بار کہتے تھے کہ یہ گھر اپنے نام کرالو، مگر انہوں نے سستی کی وجہ سے نام نہیں کرایا۔سوال یہ ہے کہ جو گھر انہوں نے اپنی زندگی میں تقسیم کیے تھے، ان کا کیا حکم ہوگا؟,"<p><p style=""text-align:justify;"">صورتِ مسئولہ میں اگر واقعۃً آپ کے والد نے نانا، نانی اور اپنے بھائی کے نام پر ایک ایک گھر کر دیا تھا اور ان میں سے ہر ایک کو ان کے نامزد کردہ گھر پر مالکانہ قبضہ واختیاربھی دے دیا تھا، تو ہبہ تام ہونے کی وجہ سے مذکورہ افراد اپنے اپنے گھر کے شرعاً مالک بن گئے تھے، لہذا مرحوم کے ورثاء کا ان گھروں میں کوئی حق نہیں ہوگا، اور جس گھر میں والد مرحوم  ساری زندگی رہائش پذیر رہے، وہ گھر مرحوم کے ترکہ میں شامل ہے، جس میں مرحوم کے تمام شرعی ورثاء حصصِ شرعیہ کے تناسب سے شریک ہوں گے، وارثوں کی تفصیل لکھ کر دوبارہ تقسیم معلوم کر لیں۔</p><p>فتاوی شامی میں ہے:</p><p class=""indent"" style=""text-align:justify;""><span class=""ar_writing"">""(وتتم) الهبة (بالقبض) الكامل.""</span></p><p class=""indent"" style=""text-align:justify;""><span class=""ar_writing"">""(قوله: بالقبض) فيشترط القبض قبل الموت.""</span></p><p class=""indent"" style=""text-align:left;""><span class=""ar_writing"">(كتاب الهبة، ج: 5، ص: 590، ط: ايچ ايم سعيد)</span></p><p style=""text-align:justify;"">بدائع الصنائع في ترتيب الشرائع میں ہے:</p><p class=""indent"" style=""text-align:justify;""><span class=""ar_writing"">""لأن الإرث إنما يجري في المتروك من ملك أو حق للمورث على ما قال «- عليه الصلاة والسلام - من ترك مالا أو حقا فهو لورثته» ولم يوجد شيء من ذلك فلا يورث ولا يجري فيه التداخل؛ لما ذكرنا، والله - سبحانه وتعالى - أعلم.""</span></p><p class=""indent"" style=""text-align:left;""><span class=""ar_writing"">(كتاب الحدود، فصل في بيان صفات الحدود، ج: 7، ص: 57، ط: دار الكتب العلمية)</span></p><p>درر الحكام في شرح مجلة الأحكام میں ہے:</p><p class=""indent"" style=""text-align:justify;""><span class=""ar_writing"">""المادة (٢ ٩ ٠ ١) - (كما تكون أعيان المتوفى المتروكة مشتركة بين وارثيه على حسب حصصهم... الخ)</span></p><p class=""indent"" style=""text-align:justify;""><span class=""ar_writing"">أعيان المتوفى المتروكة مشتركة بين - وارثيه، على حسب حصصهم الإرثية بموجب علم الفرائض أو بين الموصى لهم بموجب أحكام المسائل المتعلقة بالوصية.""</span></p><p class=""indent"" style=""text-align:left;""><span class=""ar_writing"">(الكتاب العاشر الشركات، الباب الأول في بيان شركة الملك، الفصل الثالث في بيان الديون المشتركة، ج: 3، ص: 55، ط: دار الجيل)</span></p><p class=""indent"" style=""text-align:left;"">فقط واللہ اعلم </p></p>",144604100257,banuri,"('ہبہ', 'hiba')","('ہبہ کی تفسیر', 'hiba-ki-tafseer')","('ہبہ کی شرائط، ارکان اور احکام', 'hiba-ki-sharaet-arkaan-or-ahkaam')"
