issued_at,link,title,question,answer,fatwa_number,dar_ul_ifta,kitab,bab,fasal
05-10-2024,https://www.banuri.edu.pk/readquestion/miras-taqseem-karny-sy-agar-bahi-naraz-144604100118/05-10-2024,میراث تقسیم کرنے میں تاخیر کرنا,میرے والد صاحب کا انتقال  جنوری 2006 میں ہوا ،والد ہ   محترمہ   ماشاء اللہ حیات  ہیں ،  ہم تین بہنیں اور پانچ بھائی ہیں ، گھر  ابو  کا ہے،  ایک  پلاٹ بھی ابو  نے  کافی عرصہ سےلے کر رکھا ہوا تھا  لیکن پھر وہ ابو کے زندگی میں گم ہوگیا  تھا کا غذی طور پر تعیین  تھی لیکن  ظاہراً تعیین  نہیں  تھی، بعد میں جب معلومات   کی گئیں تو پتہ چلا  کہ قبر ستا ن  میں چلا گیا ہے، ابھی انتقا ل کےبعد تعیین ہو گئی ہے کہ قبرستا ن  میں  نہیں ہے، ابو  کی زندگی میں    تو یہی تھا کہ پلاٹ  پر پھر دوبارہ سے رقم خرچ کرنی پڑے گی،  لہٰذا یہی تھا کہ پلاٹ گم ہوگیا،والد صاحب کے انتقال کےبعد کسی نےکہا کہ مجھے فائل دو  معلومات کرنی  ہےمل گیا تو بیچ دیں گے ، اب پلاٹ تو مل گیا  کچھ  پیسے ابو کے رکھے تھے  وہ ا س پر تما م ورثاء کی رضامندی سے لگائے پھر  بھی مسئلہ کلئیر نہیں ہوا،   اب پھر اس کے پیچھے بھاگ دوڑ   کرنی ہے لیکن سب ایک دوسرے کے بھروسے پر بیٹھے ہوئے ہیں ۔ابو کی زندگی میں صرف بڑے بھائی جان کی شادی ہوئی، بعد میں جیسے جیسے سب کی شادی ہوتی گئی سب الگ الگ کرائے کے گھر میں شفٹ ہوتے گئے۔ اُس گھر  میں امی جان اور بڑے بھائی  جان کی فیملی ہے ابو کے ترکہ کے کچھ پیسےاتنے عرصہ سےرکھے ہوئے ہیں ۔امی کی طبیعت بہت خراب ہے، ان کا کہنا یہ ہے کہ آپس میں ہرگز نہ لڑنا ، بھائی جان کے چار بیٹے ایک بیٹی ہے ان کا خاص خیال رکھنا ،جب تک ان کے گھر کا سیٹ اپ نہ ہو جائے تب تک اس گھر کو نہ بیچنا ۔ ہم سب بھی بھائی جان کو پریشان نہیں کرناچاہتے، لیکن پوچھنا یہ ہے کہ ہمارا ایسا کرنا شرعی اعتبار سے کسی کی حق تلفی کا سبب تو نہیں بن رہا۔ ہمارا گھرانہ ایک دین دار علماء کا گھرانہ ہے۔ معاشرے میں ایک معزز گھرانہ ہے اس لیے سب خاموش رہتے ہیں، نہیں چاہتے کہ ایک چھوٹے سے گھر  کےسامان کی خاطر آپس کے تعلقات خراب ہوں بھائی جان بھابھی ناراض ہوں لوگ رشتہ دار تماشا بنائیں ۔لیکن آخرت کے فیصلے کا سوچ کر ڈر بھی لگتاہے کہ اگر سب لحاظ لحاظ میں خاموش رہے تو ایسا نہ ہو کہ کسی کی حق  تلفی ہورہی ہو جس کی وجہ سے اللہ پاک کی عدالت میں ہماری پکڑ ہوجائے ۔آپ ہماری رہنمائی فرمائیں شرعی مسئلہ کیاہے  ؟، کس طرح  ہم بہن بھائی آپس  میں ان  مسائل پر با ت  کریں   کہ کسی  کی حق تلفی  بھی نہ ہو اور آپس کے تعلقات بھی خراب نہ ہو ۔,"<p><p style=""text-align:justify;"">شریعت کاحکم یہ ہے کہ: مورِث کے انتقال کے بعد (اگر اس پر قرض وغیرہ ہو تو اسے ادا کرنے اور اگر اس نے جائز مالی وصیت کی ہو تو اسے ایک تہائی سے  نافذ کرنے کے بعد)ورثاء میں جلدازجلدمیراث تقسیم کردی جائے،بلاوجہ اور بغیر کسی      عذرکے تاخیر نہ کی جائے کیوں کہ مرحوم کے انتقال کے بعد اس کی تمام متروکہ جائیداد منقولہ و غیر منقولہ  سےتمام شرعی ورثاء کا حق متعلق ہوجاتاہے اور مشاہدہ  یہی ہے کہ بلاوجہ میراث کی تقسیم  میں تاخیر کرنا بہت سے مفاسد کا سبب بن جاتا ہے،الغرض بہتر اور مناسب یہی ہے کہ فی الوقت آپس کے تعلقات خواہ کتنے ہی اچھےکیوں نہ ہومیراث کی جلد تقسیم کردی جائے  اور ہر وارث کو اس کا شرعی حصہ  دیا جائے،البتہ اگر تمام عاقل بالغ ورثاء فی الوقت متروکہ جائیدادکی تقسیم نہ کرنے پر   متفق ہوں  تو ایساکرنا بھی جائزہے، تاہم اگر اس دوران کوئی شرعی وارث اپنے شرعی حصہ کا مطالبہ کرے  تو اس کا شرعی حصہ دینا ضروری ہے، کسی وارث کا دوسرے وارث کے مطالبہ پر ناراضگی کا اظہار غیر شرعی عمل ہے۔</p><p style=""text-align:justify;"">تبین الحقائق میں ہے:</p><p class=""indent"" style=""text-align:justify;""><span class=""ar_writing"">”قال رحمه الله (وقسم بطلب أحدهم لو انتفع كل بنصيبه) لأن فيها تكميل المنفعة إذا كان كل واحد منهم ينتفع بنصيبه بعد القسمة فكانت القسمة حقا لهم فوجب على القاضي إجابتهم قال رحمه الله (وإن تضرر الكل لم يقسم إلا برضاهم) وذلك مثل البئر والرحا والحائط والحمام؛ لأن القسمة لتكميل المنفعة وفي هذا تفويتها فيعود على موضوعه بالنقض وهذا لأن الطالب للقسمة متعنت وهو يريد إدخال الضرر على غيره مع ذلك فلا يجيبه الحاكم إليه لأنه اشتغال بما لا يفيد بل بما يضر ويجوز بالتراضي؛ لأن الحق لهم وهم أعرف بحاجتهم ولكن القاضي لا يباشر ذلك، وإن طلبوا منه؛ لأن القاضي لا يشتغل بما لا فائدة فيه ولا سيما إذا كان فيه إضرار أو إضاعة للمال لأن ذلك حرام ولا يمنعهم من ذلك؛ لأن القاضي لا يمنع من أقدم على إتلاف ماله في الحكم وهذا من جملته قال رحمه الله (وإن انتفع البعض وتضرر البعض لقلة حظه قسم بطلب ذي الكثير فقط).“</span></p><p class=""indent"" style=""text-align:left;""><span class=""ar_writing"">(کتاب القسمة ،فصل اجبار علی القسمة،ج:5،ص:268،ط:دار الکتاب الإسلامی)</span></p><p class=""indent"" style=""text-align:left;"">فقط واللہ اعلم</p></p>",144604100118,banuri,"('فرائض', 'faraez')","('میراث کا بیان', 'meeraas-ka-bayan')","('میراث کا حکم', 'meeraas-ka-hukum')"
18-05-2020,https://www.banuri.edu.pk/readquestion/15-din-k-baad-aadat-sy-pehly-khoon-nazar-aana-144109202799/18-05-2020,15 دن کے بعد عادت سے پہلے خون نظر آنا,جو عورتیں حمل روکنے کے لیے دوا لیتی ہیں تو دوا کا طریقہ یہ ہوتا ہے کہ پاک ہونے کے بعد ۲۵ دن تک دوا لینی ہوتی ہے، پھر ۲۵ دن کے ۲ دن بعد حیض آجاتا ہے اور اس کی دو سال سے یہی عادت ہے، اب اس رمضان میں یہ ہوا کہ اس کی پاکی کے ۱۸ دن ہوئے ہیں اور اس کو حیض آگیا تو اس کا کیا حکم ہے ؟حیض ہے یا استحاضہ؟,"<p><p style=""text-align:justify;"">حیض ختم ہونے کے  18 دن بعد  خون نظر آیا ہے اور وہ خون تین دن یا اس سے زائد عرصہ تک برقرار  رہا تو یہ حیض ہے۔ فقط و اللہ اعلم</p></p>",144109202799,banuri,"('طہارت', 'taharat')","('حیض، نفاس، استحاضہ', 'hayz-nifas-istihaza')","('جنابت ، حیض اور نفاس کے احکام', 'janabat-hayz-or-nifas-k-ahkam')"
17-05-2020,https://www.banuri.edu.pk/readquestion/khoon-k-purany-dhabbo-ki-wajah-sy-namaz-k-iaaday-ka-hukum-144109202639/17-05-2020,کپڑوں پر خون کے دھبوں کی وجہ سے نماز کے اعادہ کا حکم,مجھے جب قبض کی شکایت ہوتی ہے تو پاخانہ کے مقام پر زخم بن جا تا ہے، بسا اوقات خون نکلتا ہے، اس سال اعتکاف میں ہوں، اعتکاف کے تیسرے دن کپڑے بدلنے پر خون نظر آیا جو کہ ہتھیلی کے برابر تھا، اب جو میں نے نمازیں اور تراویح پڑھی ہیں،اس کے لیےکیا حکم ہے؟,"<p><p style=""text-align:justify;"">اگر سائل کو اعتکاف کے تیسرے دن کپڑے بدلتے ہوئے ہتھیلی کے برابر خون کے دھبے نظر آئے  اور یہ معلوم نہیں کہ خون کب لگا ہے تو گزشتہ نمازوں اور تراویح کے اعادہ کی ضرورت  نہیں۔</p><p class=""indent"" style=""text-align:justify;""><span class=""ar_writing"">[فرع] وجد في ثوبه منيا أو بولا أو دما أعاد من آخر احتلام وبول ورعاف.</span></p><p class=""indent"" style=""text-align:justify;""><span class=""ar_writing"">و في الرد : قد يصيبه فالظاهر أن الإصابة لم تتقدم زمان وجوده، بخلاف المني؛ لأن مني غيره لا يصيب ثوبه فالظاهر أنه منيه، فيعين وجوده من وقت وجود سبب خروجه حتى لو كان الثوب مما يلبسه هو وغيره يستوي فيه حكم المني والدم. واختار في المحيط ما رواه ابن رستم ذكره في البحر وقوله فالظاهر أن الإصابة إلخ لا يظهر في الجاف ط. وفي السراج: لو وجد في ثوبه نجاسة مغلظة أكثر من قدر الدرهم ولم يعلم بالإصابة لم يعد شيئا بالإجماع وهو الأصح. اهـ.</span></p><p class=""indent"" style=""text-align:justify;""><span class=""ar_writing"">قلت: وهذا يشمل الدم، فيقتضي أن الأصح عدم الإعادة مطلقا تأمل.""</span></p><p class=""indent"" style=""text-align:left;""><span class=""ar_writing"">(الدر المختار وحاشية ابن عابدين  (1/ 219) ط: سعيد)</span></p><p class=""indent"" style=""text-align:left;"">فقط واللہ اعلم</p></p>",144109202639,banuri,"('طہارت', 'taharat')","('نجاست اور اس سے پاکی', 'najasat-aur-us-ki-paki')","('نجاست سے پاکی', 'nijasat-aur-us-ki-paki')"
01-05-2020,https://www.banuri.edu.pk/readquestion/sehr-ka-asar-or-us-per-waideen-144109200810/01-05-2020,سحر کا اثر اور اس پر وعیدیں,سحر کا اثر ہوتا ہے یا نہیں؟ کرنے والے پر کیا وعید ہے؟ اور اس کا اثر کتنے دنوں تک رہتا ہے؟,"<p><p style=""text-align:justify;"">سحر ایک حقیقت ہے، یہ اثر رکھتا ہے، نبی کریم ﷺ پر بھی سحر کیا گیا اور اس نےوحی کے علاوہ دیگر معاملات میں اپنے اثرات دکھائے، سحر کرنا گناہِ کبیرہ ہے، سحر  کرنے والے کے لیے سخت وعیدیں ہیں،<span style=""color:#000;""><span style=""background-color:#fff;"">اللہ تعالی نے  جادوگر کو فلاح و کامیابی والا قرار نہیں دیا:</span></span></p><p class=""indent"" style=""margin-left:0;margin-right:0;text-align:justify;""><span class=""ar_writing""><span style=""color:#000;""><span style=""background-color:#fff;"">﴿ </span>وَلَا يُفْلِحُ السَّاحِرُ حَيْثُ أَتَى <span style=""background-color:#fff;"">﴾ [طـه: 69]</span></span></span></p><p class=""indent"" style=""margin-left:0;margin-right:0;text-align:justify;""><span style=""color:#000;""><span style=""background-color:#fff;"">ترجمہ: اور جادوگر کہیں جاوے کامیاب نہیں ہوتا۔ (بیان القرآن)</span></span></p><p style=""margin-left:0;margin-right:0;text-align:justify;""><span style=""color:#000;"">اللہ تعالی نے جادو کو کفریہ عمل قرار دیا ہے:</span></p><p class=""indent"" style=""margin-left:0;margin-right:0;text-align:justify;""><span class=""ar_writing""><span style=""color:#000;"">وَاتَّبَعُوا مَا تَتْلُو الشَّيَاطِينُ عَلَى مُلْكِ سُلَيْمَانَ وَمَا كَفَرَ سُلَيْمَانُ وَلَكِنَّ الشَّيَاطِينَ كَفَرُوا يُعَلِّمُونَ النَّاسَ السِّحْرَ وَمَا أُنْزِلَ عَلَى الْمَلَكَيْنِ بِبَابِلَ هَارُوتَ وَمَارُوتَ وَمَا يُعَلِّمَانِ مِنْ أَحَدٍ حَتَّى يَقُولَا إِنَّمَا نَحْنُ فِتْنَةٌ فَلَا تَكْفُرْ فَيَتَعَلَّمُونَ مِنْهُمَا مَا يُفَرِّقُونَ بِهِ بَيْنَ الْمَرْءِ وَزَوْجِهِ وَمَا هُمْ بِضَارِّينَ بِهِ مِنْ أَحَدٍ إِلَّا بِإِذْنِ اللَّهِ وَيَتَعَلَّمُونَ مَا يَضُرُّهُمْ وَلَا يَنْفَعُهُمْ وَلَقَدْ عَلِمُوا لَمَنِ اشْتَرَاهُ مَا لَهُ فِي الْآخِرَةِ مِنْ خَلَاقٍ وَلَبِئْسَ مَا شَرَوْا بِهِ أَنْفُسَهُمْ لَوْ كَانُوا يَعْلَمُونَ<span style=""background-color:#fff;""> ﴾</span><strong> </strong><span style=""background-color:#fff;"">[البقرة: 102]</span></span></span></p><p class=""indent"" style=""text-align:justify;"">ترجمہ:  اور انہوں نے ایسی چیز کا (یعنی سحر کا) اتباع کیا جس کا چرچا کیا کرتے تھے شیاطین (یعنی خبیث جن) حضرت سلیمان (علیہ السلام) کے عہد سلطنت میں اور حضرت سلیمان (علیہ السلام نے) کفر نہیں کیا،  مگر (ہاں) شیاطین کفر کیا کرتے تھے اور حالت یہ تھی کہ آدمیوں کو بھی (اس) سحر کی تعلیم کیا کرتے تھے اور اس (سحر) کا بھی جو کہ ان دونوں فرشتوں پر نازل کیا گیا تھا شہربابل میں جن کا نام ہاروت و ماروت تھا  اور وہ دونوں کسی کو نہ بتلاتے جب تک یہ (نہ) کہہ دیتے کہ ہمارا وجود بھی ایک امتحان ہے سو تو کہیں کافر مت بن جائیو (کہ اس میں پھنس جاوے) سو (بعضے) لوگ ان دونوں سے اس قسم کا سحر سیکھ لیتے تھے جس کے ذریعہ سے (عمل کر کے) کسی مرد اور اس کی بیوی میں تفریق پیدا کردیتے تھے اور یہ (ساحر) لوگ اس کے ذریعہ سے کسی کو بھی ضرر نہیں پہنچا سکتے، مگر خدا ہی کے (تقدیری) حکم سے اور ایسی چیزیں سیکھ لیتے ہیں جو (خود) ان کو ضرر رساں ہیں اور ضرور یہ (یہودی) بھی اتناجانتے ہیں کہ جو شخص اس کو اختیار کرے ایسے شخص کا آخرت میں کوئی حصہ (باقی) نہیں اور بیشک بری ہے ، وہ چیز (یعنی سحرو کفر) جس میں وہ لوگ اپنی جان دے رہے ہیں کاش ان کو (اتنی) عقل ہوتی۔ (بیان القرآن)</p><p style=""margin-left:0;margin-right:0;text-align:justify;""><span style=""color:#000;"">نبی کریم ﷺ نے سحر اور جادو کو  دنیا اور آخرت میں ہلاکت کا باعث قرار دیا ہے۔</span></p><p class=""indent"" style=""margin-left:0;margin-right:0;text-align:justify;""><span class=""ar_writing""><span style=""color:#000;""><span style=""background-color:#fff;"">عن أبي هريرة ، رضي الله عنه ، عن النبي صلى الله عليه وسلم قال : اجتنبوا السبع الموبقات قالوا : يا رسول الله وما هن قال الشرك بالله والسحر وقتل النفس التي حرم الله إلا بالحق وأكل الربا وأكل مال اليتيم والتولي يوم الزحف وقذف المحصنات المؤمنات الغافلات.</span></span></span></p><p class=""indent"" style=""margin-left:0;margin-right:0;text-align:left;""><span class=""ar_writing""><span style=""color:#000;""><span style=""background-color:#fff;"">(صحيح البخاري 4 / 12 ط: )</span></span></span></p><p class=""indent"" style=""margin-left:0;margin-right:0;text-align:justify;""><span class=""ar_writing""><span style=""color:#000;""><span style=""background-color:#fff;""> قال النووي عمل السحر حرام وهو من الكبائر بالإجماع وقد عده النبي صلى الله عليه و سلم من السبع الموبقات ومنه ما يكون كفرا ومنه ما لا يكون كفرا بل معصية كبيرة فإن كان فيه قول أو فعل يقتضي الكفر فهو كفر وإلا فلا</span></span></span></p><p class=""indent"" style=""margin-left:0;margin-right:0;text-align:left;""><span class=""ar_writing""><span style=""color:#000;""><span style=""background-color:#fff;"">(</span></span><span style=""color:#000;""><span style=""background-color:#fff;"">فتح الباري  10 / 224)</span></span></span><br/><span class=""ar_writing"">فقط و الله اعلم</span></p></p>",144109200810,banuri,"('حظر و اباحت', 'mamnooaat-mubahat')","('تعویذات / عملیات', 'taweezat-amlyat')","('سحر / جادو کی حقیقت و احکام', 'sehr-jado-ki-haqiqat-o-ahkam')"
