issued_at,link,title,question,answer,fatwa_number,dar_ul_ifta,kitab,bab,fasal
12-03-2022,https://www.banuri.edu.pk/readquestion/tnqeeh-144308100494/12-03-2022,پیسوں کے بدلہ پیسہ ادھار پر لینا,اگر کوئی ایرانی تومان  (یعنی ایرانی کرنسی) کیش پر  لینا  چاہتاہے تو1تومان کا ریٹ کیش پر 140 روپے اور  اگر کوئی آدھا پیسہ کیش اور آدھا ادھار پر  دے گا یا تیسرا حصہ ادھار مانگے  تو  پھر تومان کا ریٹ  140 کی بجائے 139 کردیتے ہیں، یہ کیسا ہے؟  ریٹ کو دنوں کے حساب سے تبدیل کردیتے ہیں کیش پر 1 تومان 140روپے  کا ملے گا دس دن ادھار پر 139روپے پر  ملے گا،1تومان کاریٹ بیس دن ادھار پر  138  میں ملے گا، 1 تومان کا ریٹ اس طرح سے فرق  کرتے رہیں گے؟,"<p><p style=""text-align:justify;"">صورت مسئولہ میں دو مختلف الجنس کرنسیوں  کے لین دین نقد  میں کمی بیشی کے ساتھ کریں تو جائز ہے لیکن ادھار  پر جائز نہیں،  اس لئے کہ یہ بیع صرف ہے کرنسی کی خرید وفروخت ادھار پر کرنے سے بیع فاسد ہو جاتی ہے لہذا ادھا ر کا معاملہ کرنا جائز نہیں ہے ،اسی طرح ایرانی کرنسی کے بدلہ ایرانی کرنسی  ہی کی خرید وفروخت ہے تو اس میں یہ بھی ضروری ہے کہ برابر سرابر  ہو کمی زیا دتی جائز نہیں ہے ۔  </p><p>الدر المختار وحاشية ابن عابدين (رد المحتار) (5/ 257):</p><p class=""indent"" style=""margin:0 0 30px;color:#323232;line-height:36px;font-weight:bold;font-size:17px;font-family:Nafees,'Helvetica Neue',Helvetica,Arial,sans-serif;background-color:#fff;text-align:justify;""><span class=""ar_writing"">''(هو) لغةً: الزيادة. وشرعاً: (بيع الثمن بالثمن) أي ما خلق للثمنية ومنه المصوغ (جنساً بجنس أو بغير جنس) كذهب بفضة، (ويشترط) عدم التأجيل والخيار و (التماثل) أي التساوي وزناً، (والتقابض) بالبراجم لا بالتخلية (قبل الافتراق)، وهو شرط بقائه صحيحاً على الصحيح، (إن اتحد جنساً وإن) وصلية (اختلفا جودةً وصياغةً) ؛ لما مر في الربا (وإلا) بأن لم يتجانسا (شرط التقابض) لحرمة النساء، (فلو باع) النقدين (أحدهما بالآخر جزافاً أو بفضل وتقابضا فيه) أي المجلس (صح).""</span></p><p class=""indent"" style=""text-align:left;""> فقط واللہ اعلم</p></p>",144308100494,banuri,"('معاملات', 'muamlat')","('سود / بینکاری / انشورنس / شیئرز', 'sood-bankari-insurance-shares')","('سود کی تعریف اور احکام', 'sood-ki-tareef-or-ahkam')"
29-11-2020,https://www.banuri.edu.pk/readquestion/bevi-ka-shohar-ke-walden-ke-ghar-se-dor-alag-ghar-main-rehaish-ka-mutalba-144204200534/29-11-2020,بیوی کا شوہر کے والدین کے گھر سے دور الگ گھر میں رہائش کا مطالبہ کرنا,بیوی شوہر سے ایسے الگ گھر کا مطالبہ کرے جو اس کے شہر سے دور دوسرےاجنبی شہر ہو، جہاں شوہر والدین سے دوری کی وجہ سے ملاقات اور خود ان کی خدمت نہ کر سکے، جب کہ والدین بوڑھے اور اکیلے ہیں ، اس کے علاوہ اس شہر میں کوئی عزیز اقارب نہ ہو کہ ضرورت کے وقت کام آسکیں ، دوسرا ان کے بچے بھی دادا دادی سے دور ہو جائیں تو کیا بیوی کا ایسا مطالبہ جائز ہے؟ جب کہ شوہر اسے اپنی گھر کی دوسری منزل جس کا داخل ہونے کا دروازہ، کچن ، بیت الخلاء سب مکمل طور پہ الگ ہے اس میں رہنے کاانتظام کرے. جس میں بیوی سے ساس سسر کی خدمت کا مطالبہ بھی نہ ہو، اور شوہر اپنے والدین کی خود خدمت بھی آسانی سے کرسکے اور بچے بھی اپنے ددھیال سے محروم نہ ہوں تو بیوی کو اس پہ اعتراض کرنا چاہیے؟,"<p><p style=""text-align:justify;""><span style=""text-align:justify;"">صورتِ  مسئولہ  میں   جس گھر  میں  شوہر اپنے والدین کے  ساتھ  رہ  رہا ہے،  اگر اسی گھر  کی دوسری منزل پر  بیوی  کو  رہائش دے دے، جس کا دروازہ، بیت الخلاء، باورچی خانہ وغیرہ الگ ہو  اور اس میں میاں بیوی کے علاوہ کسی تیسرے شخص کا عمل دخل نہ ہو تو اس سے شوہر کی ذمہ داری پوری ہوجائے گی، اس سے زیادہ بیوی کو مطالبہ کا حق نہیں ہے؛  لہذا بیوی کا شوہر سے والدین سے دور الگ شہر میں رہائش دینے کا مطالبہ درست نہیں ہے۔</span></p><p class=""indent"" style=""text-align:justify;"">فتاویٰ ہندیہ میں ہے:</p><p class=""indent"" style=""text-align:justify;""><span class=""ar_writing"">""تجب السكنى لها عليه في بيت خال عن أهله وأهلها إلا أن تختار ذلك""</span>.</p><p class=""indent"" style=""text-align:left;""> (الباب السابع عشر في النفقات 1/556، ط: ماجدية)</p><p class=""indent"" style=""text-align:justify;"">فتاوى شامي میں ہے:</p><p class=""indent"" style=""text-align:justify;""><span class=""ar_writing"">""إن أمكنه أن يجعل لها بيتًا على حدة في داره ليس لها غير ذلك""</span>. </p><p class=""indent"" style=""text-align:left;"">(مطلب في مسكن الزوجة 3/601، ط: سعيد)</p><p class=""indent"" dir=""ltr"" style=""text-align:justify;"">فقط واللہ اعلم</p></p>",144204200534,banuri,"('حقوق و آدابِ معاشرت', 'huqooq-muashret')","('حقوق', 'bahmi-huqooq')","('میاں ، بیوی کے حقوق', 'mian-biwi-k-huqooq')"
17-03-2022,https://www.banuri.edu.pk/readquestion/narazgi-ki-waja-se-kya-talaq-hojati-hy-144308101060/17-03-2022,کیا ناراضگی کی وجہ سے طلاق ہوجاتی ہے؟,سات سال پہلے میری بیوی گھر سے چلی گئی ، اس دوران ہر طرح کے جتن کئے،جرگے بھیجے ،مصالحتی کمیٹی کے ذریعے کوشش کی مگر اس نے واپسی سے صاف انکار کر دیا، بلکہ بزریعہ کورٹ اپنا تمام جھیز بھی لے گئی اور چھوٹے دو بیٹے،میں نے آج تک طلاق نہیں دی ،اور نہ ہی ایسا کوئی ارادہ ہے ، ان حالات اور اتنا عرصہ گزرنے کے بعد ہماری ازدواجی زندگی کی کیا حیثیت ہے؟ کیا اتنا عرصہ ناراضگی کے بعدہمارا نکاح باطل تو  نہیں ہو گیا؟,"<p><p style=""text-align:justify;"">میاں بیوی  علیحدہ رہنے  سے خواہ وہ طویل عرصہ ہی کیوں نہ ہو ، دونوں کا نکاح ختم نہیں ہوتا، بلکہ نکاح ختم ہونے  کے لیے شوہر  کی طرف سے طلاق، یا باہمی رضامندی سے خلع، یا نکاح فسخ ہونے کے اسباب کی موجودگی میں فسخ نکاح کا پایا جانا ضروری ہے،جب تک شوہر زبانی یا تحریری طلاق نہ دے  اس وقت تک طلاق واقع نہیں   ہوتی۔<span class=""ur_writing"">لهذا صورتِ مسئولہ ميں اگر سائل نے واقعۃً طلاق نہیں دی تو محض ناراضگی  اور طویل عرصہ جدا رہنے کی وجہ سے نکاح شرعاً ختم نہیں ہوا۔</span></p><p style=""text-align:justify;"">فتاوی شامی میں ہے:</p><p class=""indent"" style=""text-align:justify;""><span class=""ar_writing"">""قوله وركنه لفظ مخصوص) هو ما جعل دلالة على معنى الطلاق من صريح أو كناية فخرج الفسوخ على ما مر، وأراد اللفظ ولو حكما ليدخل الكتابة المستبينة وإشارة الأخرس والإشارة إلى العدد بالأصابع في قوله أنت طالق هكذا كما سيأتي.""</span></p><p class=""indent"" style=""text-align:left;""><span class=""ar_writing"">(كتاب الطلاق،ركن الطلاق،ص:230،ج:3،ط:سعيد)</span></p><p class=""indent"" style=""text-align:left;"">فقط واللہ اعلم</p></p>",144308101060,banuri,"('طلاق', 'talaaq')","('وقوع طلاق وعدم وقوع طلاق', 'wuqoo-e-talaq-o-adme-wuqoo-e-talaq')","('طلاق - وقوع اور عدم وقوع', 'talaq-wuqo-or-adm-e-wuqo')"
21-12-2021,https://www.banuri.edu.pk/readquestion/qatl-e-khata-ki-diyat-maqtool-ki-meeras-hai-char-batan-ka-munaskhah-144305100481/21-12-2021,قتلِ خطاء کی دیت مقتول کی میراث ہے ، چار بطن کا مناسخہ,میرے والد کا ایکسیڈنٹ  حادثہ میں انتقال ہوا ، جس محکمہ میں  والد صاحب  کا م کرتے تھے ، انہو ں نے اس کار والے کو پکڑا ، جس نے والد صاحب کو مارا تھا  اور اس سے دیت میں ہمیں  عزیز آباد میں  ایک مکان دلوایا ، مکان دو بھائیوں کے  نام الاٹ ہو گیا ، باقی دو بھائی چوں کہ چھوٹے تھے ، اس لیے کاغذات میں ان کا نام نہیں آسکا ۔پوچھنا یہ ہے کہ اس مکان  میں دیگر ورثاء کا کوئی حق ہے؟ یا یہ مکان صرف انہیں دو بھائیوں کا ہے ، جن کے نام پر ہے ؟ ان بھائیوں کی بیویوں میں سے ایک کی بیوی نے ہم پر کیس کردیا، ان کا دعوی ہے کہ یہ مکان صرف انہیں دونوں بھائیوں کا ہے ، کیا ان کا یہ دعوی شرعاً درست ہے ؟مرحوم کے ورثاء میں بیوہ ، چار بیٹے تھے ۔پھر ایک بیٹے   زید  کا انتقال ہوا ، ورثا ء میں بیوہ ، ایک بیٹا  بکر  اور دو بیٹیاں   تھیں ۔پھر  زید کے بیٹے    بکر  کا انتقال ہوا ، ورثاء میں والدہ  ، دو بہنیں ، تین چچا تھے ۔پھر اس کے بعد  عمرو کی بیوہ کا انتقال ہوا ، ورثا ء میں تین بیٹے ہیں ۔اگر مکان میں تمام ورثا ء کا حق ہے تو اس کی تقسیم کا طریقہ بتادیں ۔,"<p><div><div><div><p style=""text-align:justify;"">صورتِ مسئولہ میں مذکورہ مکان جو کہ محکمہ نے کار والے سے سائل کے   والد کی  دیت میں لیا تھا ، پھر وہ مکان  سائل کے دو بڑے بھائیوں کے نام  ان کے بڑے ہو نے کی وجہ سے الاٹ ہو گیا  تو  اس سے شرعاً وہ مکان ان دو بھائیوں کی ملکیت نہیں ہوا ، بلکہ  وہ سائل کے والد کی میراث ہے اور اس  میں  مرحوم کے تمام ورثا ء کا حق ہے  ؛ لہذا وہ مکان تمام ور ثا ء میں ان کے شرعی حصوں کے اعتبار سے  تقسیم ہوگا ، سائل کے بھائی کی بیوی  کا یہ دعوی کرنا کہ  یہ مکان دونوں بھائیوں کا ہے ،  درست نہیں ، نیز بھائی کی بیوی کا   سائل اور دیگر ورثاء  کے خلاف کیس دائر کرنا بھی  شرعاً غلط ہے ۔</p><p style=""text-align:justify;"">  سائل  کے والد<span lang=""er"" xml:lang=""er"">کےترکہ کی  شرعی تقسیم کا طریقہ یہ ہے کہ   سائل کے والد مرحوم کے ترکہ  میں سے حقوقِ متقدمہ یعنی تجہیز وتکفین کا خرچ نکالنے  کے بعد ، اگر مرحوم پر کوئی قرض   ہو تو اسے ادا کرنے کے بعد، اور   اگر مرحوم نے کوئی جائز وصیت کی ہو تو باقی مال  کے ایک تہائی </span><span lang=""er"" xml:lang=""er"">میں اسے نافذ کرنے کے بعد ،باقی متروکہ جائیداد منقولہ و غیر منقولہ  کے کل  27648 حصے کئے جائیں گے  ، جس میں سےمرحوم کے ہر زندہ بیٹے کو 7655  حصے ، مرحوم  بیٹے علاؤالدین کی بیوہ کو 1113 حصے اور  ہر بیٹی کو1785  حصےملیں گے ۔  </span></p><p style=""text-align:justify;"">میت : (والد) ، مسئلہ : 8 / 32 / 3072 / 27648</p><table border=""1""><tbody><tr><td style=""text-align:center;"">بیوہ</td><td style=""text-align:center;"">بیٹا (زید)</td><td style=""text-align:center;"">بیٹا</td><td style=""text-align:center;"">بیٹا</td><td style=""text-align:center;"">بیٹا</td></tr><tr><td style=""text-align:center;"">1</td><td colspan=""4"" style=""text-align:center;"">7</td></tr><tr><td style=""text-align:center;"">4</td><td style=""text-align:center;"">7</td><td style=""text-align:center;"">7</td><td style=""text-align:center;"">7</td><td style=""text-align:center;"">7</td></tr><tr><td style=""text-align:center;"">384</td><td style=""text-align:center;"">فوت شد</td><td style=""text-align:center;"">672</td><td style=""text-align:center;"">672</td><td style=""text-align:center;"">672</td></tr><tr><td style=""text-align:center;"">3456</td><td style=""text-align:center;"">-</td><td style=""text-align:center;"">6048</td><td style=""text-align:center;"">6048</td><td style=""text-align:center;"">6048</td></tr><tr><td style=""text-align:center;"">فوت شد</td><td style=""text-align:center;"">-</td><td style=""text-align:center;"">-</td><td style=""text-align:center;"">-</td><td style=""text-align:center;"">-</td></tr></tbody></table><p style=""text-align:justify;"">میت : (زید) ، مسئلہ : 24 / 96  ، مافی الید : 7</p><table border=""1""><tbody><tr><td style=""text-align:center;"">والدہ </td><td style=""text-align:center;"">بیوہ</td><td style=""text-align:center;"">بیٹا  (بکر)</td><td style=""text-align:center;"">بیٹی </td><td style=""text-align:center;"">بیٹی </td></tr><tr><td style=""text-align:center;"">4</td><td style=""text-align:center;"">3</td><td colspan=""3"" style=""text-align:center;"">17</td></tr><tr><td style=""text-align:center;"">16</td><td style=""text-align:center;"">12</td><td style=""text-align:center;"">34</td><td style=""text-align:center;"">17</td><td style=""text-align:center;"">17</td></tr><tr><td style=""text-align:center;"">112</td><td style=""text-align:center;"">84</td><td style=""text-align:center;"">238</td><td style=""text-align:center;"">119</td><td style=""text-align:center;"">119</td></tr><tr><td style=""text-align:center;"">1008</td><td style=""text-align:center;"">756</td><td style=""text-align:center;"">فوت شد</td><td style=""text-align:center;"">1071</td><td style=""text-align:center;"">1071</td></tr><tr><td style=""text-align:center;"">فوت شد</td><td style=""text-align:center;"">-</td><td style=""text-align:center;"">-</td><td style=""text-align:center;"">-</td><td style=""text-align:center;"">-</td></tr></tbody></table><p style=""text-align:justify;"">میت : (بکر)  ، 6 / 18 / 9 ، مافی الید : 238 / 119</p><table border=""1""><tbody><tr><td style=""text-align:center;"">والدہ </td><td style=""text-align:center;"">بہن</td><td style=""text-align:center;"">بہن</td><td style=""text-align:center;"">چچا</td><td style=""text-align:center;"">چچا</td><td style=""text-align:center;"">چچا</td></tr><tr><td style=""text-align:center;"">1</td><td style=""text-align:center;"">4</td><td style=""text-align:center;"">4</td><td colspan=""3"" style=""text-align:center;"">1</td></tr><tr><td style=""text-align:center;"">3</td><td style=""text-align:center;"">6</td><td style=""text-align:center;"">6</td><td style=""text-align:center;"">1</td><td style=""text-align:center;"">1</td><td style=""text-align:center;"">1</td></tr><tr><td style=""text-align:center;"">357</td><td style=""text-align:center;"">714</td><td style=""text-align:center;"">714</td><td style=""text-align:center;"">119</td><td style=""text-align:center;"">119</td><td style=""text-align:center;"">119</td></tr></tbody></table><p style=""text-align:justify;"">میت : (والدہ) ، مسئلہ : 3 / 1  ، مافی الید : 4464 / 1488 </p><table border=""1"" style=""width:16.841%;""><tbody><tr><td style=""width:24.6334%;text-align:center;"">بیٹا</td><td style=""width:24.6334%;text-align:center;"">بیٹا</td><td style=""width:24.6334%;text-align:center;"">بیٹا</td></tr><tr><td style=""width:24.6334%;text-align:center;"">1</td><td style=""width:24.6334%;text-align:center;"">1</td><td style=""width:24.6334%;text-align:center;"">1</td></tr><tr><td style=""width:24.6334%;text-align:center;"">1488</td><td style=""width:24.6334%;text-align:center;"">1488</td><td style=""width:24.6334%;text-align:center;"">1488</td></tr></tbody></table><p style=""text-align:justify;"">یعنی سو روپے میں سے مرحوم کے ہر زندہ بیٹے کو 27.6873روپے ، مرحوم کے بیٹے مرحوم  زید کی بیوہ کو 4.0256روپے اور  ہر بیٹی کو6.456  روپے  ملیں گے ۔</p><p dir=""rtl"" style=""text-align:justify;""><span lang=""ar-sa"" xml:lang=""ar-sa"">سنن ابی داؤد میں ہے:</span></p><p class=""indent"" dir=""rtl"" style=""text-align:justify;""><span class=""ar_writing""><span lang=""ar-sa"" xml:lang=""ar-sa"">""عن عمرو بن شعيب، عن أبيه، عن جده، قال: كان رسول الله صلى الله عليه وسلم يقوم دية الخطأ على أهل القرى ...</span><span lang=""ar-sa"" xml:lang=""ar-sa"">قال رسول الله صلى الله عليه وسلم: «إن العقل ميراث بين ورثة القتيل على قرابتهم، فما فضل فللعصبة.""</span></span></p><p align=""right"" class=""indent"" dir=""rtl"" style=""text-align:left;""><span class=""ar_writing"" lang=""ar-sa"" xml:lang=""ar-sa"">( کتاب الدیات، باب دیة الأعضاء : 4 ، 189 ، ط : المکتبة العصریة)</span></p><p align=""right"" dir=""rtl"" style=""text-align:justify;"">المبسوط للسرخسی میں ہے:</p><p align=""right"" class=""indent"" dir=""rtl"" style=""text-align:justify;""><span class=""ar_writing"">""ثمّ ‌دية ‌المقتول تكون ميراثًا عنه لجميع ورثته كسائر أمواله عندنا.""</span></p><p align=""right"" class=""indent"" dir=""rtl"" style=""text-align:left;""><span class=""ar_writing"">(كتاب الفرائض، باب ميراث القاتل: 30 / 49، ط: دار المعرفة)</span></p><p align=""right"" class=""indent"" dir=""rtl"" style=""text-align:left;""><span lang=""ar-sa"" xml:lang=""ar-sa"">فقط و اللہ  اعلم</span></p></div></div></div></p>",144305100481,banuri,"('جنایات', 'jinayaat')","('دیات', 'diyyaat')","('دیت کی اقسام / احکام', 'diyyat-ki-qasaam-ahkaam')"
15-03-2022,https://www.banuri.edu.pk/readquestion/ghar-ke-saman-or-kaprhon-par-zakat-lazim-nahi-144308100873/15-03-2022,گھر کے سامان اور کپڑوں پر زکوۃ لازم نہیں,میں تقریباً پانچ سال سے باہر ملک میں ہوں، میرے گھر میں ڈبل بیڈ، الماری، بیوی کی شادی والے کپڑے جو وہ سال میں ایک سے دو بار پہنتی بھی ہے اور برتن وغیرہ ہیں تو کیا ان چیزوں پر زکوٰۃ بنتی ہے؟واضح رہے کہ 2015 میں جس وقت یہ کپڑے لیے تھے تو اس وقت تین جوڑوں کی قیمت تقریباً ستر یا اسی ہزار روپے بنی تھی۔,"<p><p style=""text-align:justify;"">صورتِ مسئولہ میں سائل کے گھر کے سامان ڈبل بیڈ وغیرہ اور اس کی بیوی کے شادی والے کپڑوں پر سال گزرنے کی صورت میں زکوۃ لازم نہیں ہوگی، کیونکہ یہ سامان مال زکوٰۃ میں داخل نہیں ہے۔</p><p style=""text-align:justify;"">فتاوی شامی میں ہے:</p><p class=""indent"" style=""text-align:justify;""><span class=""ar_writing"">""(وسببه) أي سبب افتراضها (ملك نصاب حولي) نسبة للحول، لحولانه عليه، (تام) ... (فارغ عن دين له مطالب من جهة العباد) ... (و) فارغ (عن حاجته الأصلية)، لأن المشغول بها كالمعدوم ... (نام ولو تقديرا) بالقدرة على الاستنماء ولو بنائبه.""</span></p><p class=""indent"" style=""text-align:left;""><span class=""ar_writing"">(ج:2، ص:259، کتاب الزکوۃ، ط:سعید)</span></p><p class=""indent"" style=""text-align:left;""><span class=""ar_writing"">فقط واللہ أعلم</span></p></p>",144308100873,banuri,"('زکات', 'zakat')","('وجوب زکوٰۃ', 'wujoob-zakat')","('وجوبِ زکوٰۃ کی شرائط', 'wujoob-e-zakat-ki-sharaet')"
