issued_at,link,title,question,answer,fatwa_number,dar_ul_ifta,kitab,bab,fasal
15-03-2022,https://www.banuri.edu.pk/readquestion/wazni-chez-baichtey-waqt-dobara-wazan-karney-ka-hukm-144308100877/15-03-2022,وزنی چیزبیچتے وقت دوبارہ وزن کرنے کا حکم,میں نے کمپنی سےایک چیز لی ہے  ،اس کا وزن ہوا ہے ،میں اس کو  بیچوں گا تو  کیا دوبارہ وزن کرنا لازمی ہے؟,"<p><p style=""text-align:justify;""> صورتِ مسئولہ میں اگر کمپنی خریدار  یا اس کے وکیل کے سامنے وزن  کرکے فروخت کرے، یا کمپنی  کسی  مخصوص تھیلے یا برتن یا پیکٹ میں کوئی چیز فروخت کرے تو  سائل پربیچتے وقت دوبارہ اس کا  وزن کرنا لازم  نہیں ہے ، بصورتِ دیگر  دوبارہ وزن کرنا لازمی ہے۔</p><p>تنویر الابصار  میں ہے :</p><p class=""indent""><span class=""ar_writing"">""اشترى مكيلًا بشرط الكيل حرم بيعه و أكله حتى يكيله و مثله الموزون و المعدود.""</span></p><p>بدائع الصنائع میں ہے:</p><p class=""indent"" style=""text-align:justify;""><span class=""ar_writing"">""و لو كاله البائع، أو وزنه بحضرة المشتري كان ذلك كافيا، ولا يحتاج إلى إعادة الكيل؛ لأن المقصود يحصل بكيله مرة واحدة بحضرة المشتري، وما روي عن رسول الله صلى الله عليه وسلم أنه ""نهى عن بيع الطعام حتى يجري فيه صاعان صاع البائع، وصاع المشتري"" محمول على موضع مخصوص، وهو ما إذا ‌اشترى ‌مكيلًا مكايلة فاكتاله ثم باعه من غيره مكايلة لم يجز لهذا المشتري التصرف فيه حتى يكيله، و إن كان هو حاضرًا عند اكتيال بائعه فلايكتفى بذلك.""</span></p><p class=""indent"" style=""text-align:left;""><span class=""ar_writing"">(فصل فی حکم البیع،245/5،ط:دار الکتب العلمیۃ)</span></p><p>العنایۃ بشرح الہدایۃ میں ہے:</p><p class=""indent"" style=""text-align:justify;""><span class=""ar_writing"">""قال: (ومن ‌اشترى ‌مكيلًا مكايلةً أو موزونًا موازنة إلخ) إذا اشترى المكيل والموزون كالحنطة والشعير والسمن والحديد وأراد التصرف فذلك على أربعة أقسام: اشترى مكايلة وباع مكايلة، أو اشترى مجازفة وباع كذلك، أو اشترى مكايلة وباع مجازفة، أو بالعكس من ذلك. ففي الأول لم يجز للمشتري من المشتري الأول أن يبيعه حتى يعيد الكيل لنفسه كما كان الحكم في حق المشتري الأول كذلك لأن النبي صلى الله عليه وسلم ""نهى عن بيع الطعام حتى يجري به صاعان صاع البائع، وصاع المشتري"" ولأنه يحتمل أن يزيد على المشروط وذلك للبائع. والتصرف في مال الغير حرام فيجب التحرز عنه و هو بترك التصرف، وهذه العلة موجودة في الموزون فكان مثله.""</span></p><p class=""indent"" style=""text-align:left;""><span class=""ar_writing"">(العنایۃ ،515/6،ط:دارالفکر ،لبنان)</span></p><p class=""indent"" style=""text-align:left;"">فقط واللہ اعلم</p></p>",144308100877,banuri,"('معاملات', 'muamlat')","('بیع / تجارت', 'bay-tijarat')","('بیع صحیح ، فاسد اور باطل', 'bay-sahih-fasid-or-batil')"
17-03-2022,https://www.banuri.edu.pk/readquestion/shaheed-masjid-ki-lakrri-khareed-kar-ghar-bnane-ka-hukum-144308101057/17-03-2022,شہید مسجد کی لکڑی خرید کر گھربنانے میں استعمال کرنے کا حکم,اگر کسی جگہ مسجد شہید کی گئی تو کیا مسجد کے چھت کی لکڑی خرید کر اپنا گھر بنانے میں استعمال کر سکتے ہیں؟,"<p><p style=""text-align:justify;"">واضح رہے کہ کسی مسجد کےتعمیراتی ساز و  سامان  کو  اسی مسجد کی دوبارہ تعمیر  میں استعمال کیا جانا ضروری ہے،اگر تعمیر کے لیے استعمال فی الحال ممکن نہ ہو تو اسی حالت میں مسجد کے لیے محفوظ کر دیا جائے،  البتہ اگر اب اس چیز کی ضرورت نہ رہے اور ویسے  رکھنے کی صورت میں اس کے ضائع ہونے کا اندیشہ ہو تومسجدکی انتظامیہ باہمی مشورے اور اتفاق سے اس سامان کو بازاری قیمت کے مطابق فروخت کرکے اس کی رقم اسی مسجد کی ضروریات میں خرچ کر سکتی ہے،فروخت کی صورت میں کوئی بھی خرید سکتاہےاور خریدنے کے بعداس کو گھر میں یا کہیں اور  استعمال کرنا درست ہے ۔</p><p style=""text-align:justify;"">فتاوی شامی میں ہے:</p><p class=""indent"" style=""text-align:justify;""><span class=""ar_writing"">""ثم رأيت الآن في الذخيرة قال وفي فتاوى النسفي: سئل شيخ الإسلام عن أهل قرية رحلوا وتداعى مسجدها إلى الخراب، وبعض المتغلبة يستولون على خشبه، وينقلونه إلى دورهم هل لواحد من أهل المحلة أن يبيع الخشب بأمر القاضي، ويمسك الثمن ليصرفه إلى بعض المساجد أو إلى هذا المسجد؟   قال: نعم.""</span></p><p class=""indent"" style=""text-align:left;""><span class=""ar_writing"">(کتاب الوقف، مطلب في نقل أنقاض المسجد و نحوه، ج:4، ص: 360، ط: ايچ ايم سعيد)</span></p><p style=""text-align:justify;"">فتاوی عالمگیری میں ہے:</p><p class=""indent"" style=""text-align:justify;""><span class=""ar_writing"">""أهل المسجد لو باعوا غلة المسجد أو ‌نقض ‌المسجد بغير إذن القاضي الأصح أنه لا يجوز، كذا في السراجية.""</span></p><p class=""indent"" style=""text-align:justify;""><span class=""ar_writing"">(كتاب الوقف، الباب الحادي عشر في المسجد و ما يتعلق به، الفصل الثاني في الوقف و تصرف القيم و غيره في مال الوقف عليه، ج:2، ص: 463، ط: دار الفكر، بيروت)</span></p><p class=""indent"" style=""text-align:left;"">فقط واللہ اعلم</p></p>",144308101057,banuri,"('وقف', 'waqf')","('مساجد کے احکام', 'masaajid-ke-ahkaam')","('اشیاء و سامانِ مسجد', 'ashyaa-o-saamaan-e-masjid')"
18-03-2022,https://www.banuri.edu.pk/readquestion/jumme-ki-urdu-taqreer-k-doraan-infiradi-zikr-u-azkaar-ka-hukam-144308101143/18-03-2022,جمعہ کی اردو تقریر کے دوران انفرادی ذکر و اذکار کا حکم,خطبہ جمعہ سے قبل جب امام صاحب وعظ فرمارہے ہوں تو دوران وعظ اکثر لوگ اپنی تسبیحات بھی جاری رکھے ہوئے ہوتے ہیں،  اس کے بارے میں وضاحت فرمائیں !,"<p><p style=""text-align:justify;"">واضح رہے   کہ خطبہ جمعہ سے قبل وعظ و نصیحت کے طور پر کی جانے  والی تقریر جمعہ کی نماز کا باقاعدہ حصہ نہیں ہے اور  نہ ہی اس کے  لیے شرعًا  خطبہ جمعہ کی مانند  کوئی خاص شرائط و قیودات لازم ہیں؛  لہذا اگر کوئی شخص دوران وعظ تسبیحات اور ذکر و اذکار میں مشغول رہے تو یہ فی نفسہ  جائز تو  ہے ،لیکن وعظ کے آداب کے خلاف ہے ، ان سامعین کو   چاہیے کہ دوران وعظ  ذکر و اذکار کو موقوف کرکے اجتماعی وعظ میں یک سوئی سے شریک ہوں   ۔</p><p>فتاوی محمودیہ میں ہے : </p><p class=""indent"" style=""text-align:justify;"">""سوال :ہمارے یہاں جامع مسجد میں امام صاحب اذان کے بعد فورًا سنتوں سے پہلے وعظ و تعلیمی تقریر شروع کردیتے ہیں جس میں ضروری مسائل کی تعلیم ہوتی ہے ، یہ جائز ہے یا  نہیں ؟</p><p class=""indent"" style=""text-align:justify;""><span class=""ar_writing"">الجواب حامدا ومصلیا :</span>""امام صاحب جب تعلیمی تقریر اور دینی مسائل سمجھاتے ہیں تو اس وقت سب کو خاموش رہ کر سننا  چاہیے، یہ طریقہ حدیث شریف سے ثابت ہے ، حضرت تمیم داری رضی اللہ تعالی عنہ اور حضرت ابوہریرہ رضی اللہ عنہ کا بھی یہی معمول تھا ملا علی قاری نے اس کو نقل کیا ہے ...۔""</p><p class=""indent"" style=""text-align:left;"">(فتاوی محمودیہ  ، ج:8 ،ص:256 ،ط:مکتبہ فاروقیہ )</p><p class=""indent"" style=""text-align:left;"">فقط واللہ اعلم</p></p>",144308101143,banuri,"('نماز', 'salat')","('جمعہ کی نماز', 'jumaa')","('خطبہ', 'khutba')"
18-03-2022,https://www.banuri.edu.pk/readquestion/ghair-muslim-je-tehwaaron-pr-musalman-ka-mubarak-baad-dena-pesh-krne-ka-sharee-hukm-144308101160/18-03-2022,غیر مسلم کے تہواروں پر مسلمان کا مبارک باد پیش کرنے کا شرعی حکم,غیر مسلم کے تہواروں پر مسلمان مبارک باد پیش کرے تو شرعی حکم کیا ہو گا؟,"<p><p style=""text-align:justify;""><span class=""ur_writing"">غیرمسلموں کے مذہبی تہواروں کے موقع پران کو مبارک باد دینے  کے  بارے میں شرعی حکم یہ ہے کہ چوں کہ یہ تہوار مشرکانہ اعتقادات پرمبنی ہوتے ہیں اورمسلمان ہونے کی حیثیت سے ہمارے لیے شرک سے برأت اوربے تعلقی کااظہارضرروی ہے،ان کے تہوار وں پر مبارک باد  دینا گویا ان کے نقطۂ نظرکی تائید ہے؛ اس لیےان کے تہواروں پر مبارک باد  دینا جائزنہیں۔اگر اس سے ان کی دین کی تعظیم مقصود ہو تو کفر کا اندیشہ ہے۔ اور اگرمبارک بادی کے موقع پر صراحتاً  کوئی شرکیہ جملہ بول دے تو اس کے شرک ہونے میں تو کوئی شک نہیں ہوگا۔  اگر ان کے دین کی تعظیم بھی نہ ہو، اور کوئی شرکیہ جملہ نہ ہو تب بھی غیر مسلم کے تہواروں پر مبارک باد ی دینا جائز نہیں ہے۔</span></p><p style=""text-align:justify;""><span class=""ur_writing"">سنن ابی داؤد میں ہے:</span></p><p class=""indent"" style=""text-align:justify;""><span class=""ar_writing"">""قال رسول الله صلى الله عليه وسلم: «من تشبه بقوم فهو منهم.""</span></p><p class=""indent"" style=""text-align:left;""><span class=""ar_writing"">(203/2، کتاب اللباس، باب فی لبس الشہرۃ،ط:رحمانیۃ)</span></p><p style=""text-align:justify;""><span class=""ur_writing"">امام بیہقی کی سننِ کبریٰ میں ہے:</span></p><p class=""indent"" style=""text-align:justify;""><span class=""ar_writing"">""وأخبرنا أبو عبد الله الحافظ، ثنا أبو العباس محمد بن يعقوب، ثنا الحسن بن علي بن عفان، ثنا أبو أسامة، ثنا عوف، عن أبي المغيرة، عن عبد الله بن عمرو، قال: "" من بنى في بلاد الأعاجم فصنع نيروزهم ومهرجانهم وتشبه بهم حتى يموت وهو كذلك حشر معهم يوم القيامة"". وهكذا رواه يحيى بن سعيد، وابن أبي عدي، وغندر، وعبد الوهاب، عن عوف، عن أبي المغيرة، عن عبد الله بن عمرو من قوله.""</span></p><p class=""indent"" style=""text-align:left;""><span class=""ar_writing"">(392/9،باب كراهية الدخول على أهل الذمة في كنائسهم والتشبه بهم يوم نيروزهم ومهرجانهم، ط: دار الکتب العلمیۃ)</span></p><p style=""text-align:justify;""><span class=""ur_writing"">فتاویٰ شامی میں ہے: </span></p><p class=""indent"" style=""text-align:justify;""><span class=""ar_writing"">""(والإعطاء باسم النيروز والمهرجان لا يجوز) أي الهدايا باسم هذين اليومين حرام (وإن قصد تعظيمه) كما يعظمه المشركون (يكفر) قال أبو حفص الكبير: لو أن رجلا عبد الله خمسين سنة ثم أهدى لمشرك يوم النيروز بيضة يريد تعظيم اليوم فقد كفر وحبط عمله اهـ ولو أهدى لمسلم ولم يرد تعظيم اليوم بل جرى على عادة الناس لا يكفر وينبغي أن يفعله قبله أو بعده نفيا للشبهة .""</span></p><p class=""indent"" style=""text-align:left;""><span class=""ar_writing"">(754/6، مسائل شتیٰ،ط: سعید)</span></p><p style=""text-align:justify;""><span class=""ur_writing"">فتاویٰ ہندیہ میں ہے:</span></p><p class=""indent"" style=""text-align:justify;""><span class=""ar_writing"">""إذا أطلق الرجل كلمة الكفر عمدا لكنه لم يعتقد الكفر قال بعض أصحابنا لا يكفر وقال بعضهم: يكفر، وهو الصحيح عندي كذا في البحر الرائق  ،ومن أتى بلفظة الكفر، وهو لم يعلم أنها كفر إلا أنه أتى بها عن اختيار يكفر عند عامة العلماء خلافا للبعض، ولا يعذر بالجهل .""</span></p><p class=""indent"" style=""text-align:left;""><span class=""ar_writing"">(257/2، کتاب السیر، الباب التاسع في أحكام المرتدين،ط: رشیدیۃ)</span></p><p style=""text-align:justify;""><span class=""ur_writing"">فتاویٰ تاترخانیہ میں ہے:</span></p><p class=""indent"" style=""text-align:justify;""><span class=""ar_writing"">""اجتمع المجوس يوم النيروز فقال مسلم خوب رسمي نهاد اند أو قال نيك آئين نهاده اند يخاف عليه الكفر.""</span></p><p class=""indent"" style=""text-align:left;""><span class=""ar_writing"">(348/7,کتاب احکام المرتدین،ط:رشیدیۃ)</span></p><p class=""indent"" style=""text-align:left;"">فقط واللہ اعلم</p></p>",144308101160,banuri,"('ایمان و عقائد', 'aqaed')","('کفر و شرک اور ان کے احکام', 'kufr-o-shirk-aur-un-k-ahkam')","('کفریہ و شرکیہ الفاظ', 'kufriya-o-shirkiya-alfaaz')"
18-03-2022,https://www.banuri.edu.pk/readquestion/sirri-namzon-muqtadi-ameen-kihh-sakta-hay-ya-nahin-144308101175/18-03-2022,سری نمازوں میں مقتدی آمین کہہ سکتا ہے یا نہیں؟,جہری نماز میں تو امام کے پیچھے مقتدی’’آمین‘‘کہہ سکتا ہے،  مطلب جب امام{ولا الضالین}کہے اور مقتدی سنے تو مقتدی’’آمین‘‘کہے گا ، مگر جب سری نماز میں امام قراءت خفی طور پر کرے اور مقتدی قراءت نہ سنے تو مقتدی آمین کہے گا یا نہیں؟ مطلب سری نماز میں مقتدی آمین کس وقت کہے یا نہیں؟  اور  اگر  اس پر کوئی  دلیل  وغیرہ  دی  جائے۔ احناف مسلک کی ہو تو زیادہ بہتر ہو گا۔,"<p><p style=""text-align:justify;"">مقتدی اگر سری نماز میں امام سے <span class=""qr_writing"">{ولا الضالین}</span><span class=""ur_writing""> </span>  نہ سنے تو    <span class=""qr_writing"">’’آمین‘‘</span><span class=""ur_writing""> </span> نہ کہے،اور سری نماز میں چوں کہ تلاوت سرًا  کی  جاتی  ہے، لہذا  مقتدی  خاموش  رہے گا   اور  اگر  امام سے  <span class=""qr_writing"">{ولا الضالین}</span><span class=""ur_writing"">  </span> سن لیا تو پھر بعض فقہاءکے نزدیک آمین کہنا چاہیے اور بعض کہتے ہیں کہ"" آمین"" نہیں کہے گا ؛  کیوں کہ امام کی یہ جہر بے محل ہے۔</p><p class=""indent"" style=""text-align:justify;""><span class=""ar_writing"">""وإذا سمع المقتدي من الإمام  {ولا الضالين} في صلاة المخافتة هل يؤمّن؟ قال بعضهم: نعم؛ لظاهر قوله عليه السلام: { إذا قال الإمام: ولا الضالين فقولوا: آمين} ولم يفصل، وقال بعضهم لا يؤمّن؛ لأن ذلك الجهر لغو فلا يتبع"".</span></p><p class=""indent"" style=""text-align:left;""><span class=""ar_writing"">(الجوهرة النيرة: كتاب الصلاة، باب صفة الصلاة (1/ 52)، ط. المطبعة الخيرية، الطبعة  الأولى: 1322هـ)</span></p><p class=""indent"" style=""text-align:left;"">فقط واللہ اعلم</p></p>",144308101175,banuri,"('نماز', 'salat')","('نماز کا طریقہ', 'namaz-ka-tariqah')","('آمین بالجہر', 'aameen-bil-jahar')"
19-03-2022,https://www.banuri.edu.pk/readquestion/muhammad-ur-rehman-144308101228/19-03-2022,محمد الرحمٰن نام رکھنا جائز ہے,محمد الرحمٰن نام رکھنا کیسا ہے؟,"<p><p style=""text-align:justify;""><span class=""ur_writing"">واضح رہے کہ  جس طرح حضور صلی اللہ علیہ وسلم کے دیگر نامِ گرامی کی نسبت اللہ کے ذاتی اور صفاتی نام کے ساتھ کرنا اور نام رکھنا جائز ہے ، جیساکہ احمداللہ ، احمدالرحمٰن وغیرہ ، اسی طرح  محمد الرحمٰن  نام رکھنا بھی درست ہے، اس کا مطلب ہے: رحمٰن کا تعریف کیا ہوا،لہٰذا""محمد الرحمٰن  ""رکھنے میں کوئی قباحت نہیں۔ </span><span class=""ur_writing"">فقط والله اعلم</span></p><p><br/></p></p>",144308101228,banuri,"('حظر و اباحت', 'mamnooaat-mubahat')","('نام، لقب، کنیت', 'asaami')","('ناموں کے معانی اور احکام', 'namoun-ke-mani-or-ahkaam')"
18-03-2022,https://www.banuri.edu.pk/readquestion/nekah-men-aurat-ke-wakeel-banny-ka-hukam-144308101202/18-03-2022,نکاح میں عورت کے وکیل بننے کا حکم,کیا نکاح میں عورت وکیل بن سکتی ہے؟,"<p><p style=""text-align:justify;"">واضح رہے کہ نکاح میں وکیل کی حیثیت محض ایک سفیر اور ترجمان کی ہوتی ہے ،نکاح میں عقد کے حقوق مؤکل کی طرف راجع ہوتے ہیں ؛اس لیے  وکیل  پر عقد کی نسبت مؤکل کی طر ف کرنا لازم ہوتا ہے،  اگر وہ عقد کی نسبت اپنی طرف کرے تو  نکاح اس پر ہی منعقد ہوجاتا ہے ؛ اس لیے  اگر عورت کو  نکاح میں  وکیل مقرر   کیا گیا تو نکاح درست ہوگا اور حقوق مؤکل کی طرف راجع ہوں گے ۔البتہ  گواہان ،شوہر  اورنکاح خواں  اگر عورت کے نامحرم ہوں تو عورت کا ان سے شرعی پردہ  چوں کہ لازم ہے، نیز شرعی پردہ ہونے کے باوجود عورت کی آواز ان مردوں کو سنائے بغیر نکاح کا عمل مکمل نہیں ہوسکتا؛  لہذا بغیر شرعی مجبوری کے عورت کو نکاح میں وکیل نہیں بنانا  چاہیے۔</p><p>فتاوی شامی میں  ہے :</p><p class=""indent"" style=""text-align:justify;""><span class=""ar_writing"">""(قوله: أمر الأب رجلا) أي وكله والضمير البارز في صغيرته للأب والمستتر في زوجها للرجل المأمور، وكونه رجلا مثال، فلو كان امرأة صح لكن اشترط أن يكون معها رجل أو رجل وامرأة كما أفاد في البحر (قوله:؛ لأنه يجعل عاقدا حكما) لأن الوكيل في النكاح سفيرومعبر، ينقل عبارة الموكل.""</span></p><p class=""indent"" style=""text-align:left;""><span class=""ar_writing"">(کتاب النکاح، مطلب فی عطف الخاص علی العام،ج:24/3،ط: ایچ ایم سعید )</span></p><p class=""indent"" style=""text-align:left;"">فقط واللہ اعلم </p></p>",144308101202,banuri,"('وکالت', 'wakalat')","('وکالت کے احکام', 'wakalat-k-ahkam')","('بیوعات و نکاح وغیرہ میں وکالت', 'buoaat-o-nikah-waghera-may-wakalat')"
