issued_at,link,title,question,answer,fatwa_number,dar_ul_ifta,kitab,bab,fasal
29-05-2021,https://www.banuri.edu.pk/readquestion/haiz-ki-halat-main-talaq-dainay-aur-ruju-karnay-ka-hukum-144210200782/29-05-2021,حیض کی حالت میں طلاق دینے اور رجوع کرنے کا حکم,میرے شوہر نے مجھے حیض کی حالت میں غصے میں دو طلاقیں ایک  ساتھ دے دی ہیں، وہ اب بے حد شرمندہ ہے، ہم دونوں ساتھ ہی رہنا چاہتے ہیں، میں یہ جاننا چاہتی ہوں کہ حیض کی حالت میں طلاق ہوجاتی ہے؟ میرا اب اس کے ساتھ رہنا جائز ہے یا نہیں؟ میں بہت پریشان ہوں، براہ مہربانی مجھے کوئی حل بتائیں۔,"<p><p style=""text-align:justify;"">اگر کوئی حالتِ حیض میں طلاق دے دے تو طلاق واقع ہو جائے گی اگرچہ وہ حدیث کی خلاف ورزی کرنے کی وجہ سے  گناہ گار ہوگا،  حالتِ حیض میں طلاق دینا مکروہِ تحریمی اور ناجائز ہے، فقہ حنفی میں اس کو ’’طلاقِ بدعی‘‘  کہا جاتا ہے، یعنی وہ طلاق جو سنت کے خلاف ہے؛ کیوں کہ رسول اللہ ﷺ نے حالتِ حیض میں طلاق دینے سے منع فرمایا ہے، حضرت ابن عمر رضی اللہ عنہ نے جب لاعلمی میں اپنی بیوی کو حالتِ حیض میں طلاق دے دی تھی تو  آپ ﷺ نے انہیں حکم دیا تھا کہ وہ رجوع کر لیں اور پھر اگر چاہیں تو دوبارہ طہر کی حالت میں طلاق دیں،  رجوع کا حکم دینے سے معلوم ہوا کہ حالتِ حیض میں اگرچہ طلاق دیناجائز نہیں، لیکن اگر طلاق دے دی تو طلاق بہرحال واقع ہوجاتی ہے۔ اور اگر ایک یا دو طلاقِ رجعی دی ہوں تو گناہ کی تلافی کے لیے رجوع کرنا چاہیے۔ اور اگر رجوع نہیں کیا تو جس حیض میں طلاق دی گئی ہے وہ حیض عدت میں شمار نہیں ہوگا، اس کے بعد کامل تین حیض عدت ہوں گے۔</p><p style=""text-align:justify;"">لہٰذا صورتِ  مسئولہ میں اگر آپ کے شوہر نے آپ کو دو بار لفظ طلاق کہہ کر طلاق دی ہے تو آپ کے اوپر دو طلاق رجعی واقع ہوگئی ہیں، اب آپ کے شوہر کو  چاہیے کہ عدت کے اندر اندر آپ سے رجوع کرلیں، رجوع کرنے کی صورت میں نکاح برقرار رہے گا، دوبارہ نئے سرے سے نکاح کرنے کی ضرورت نہیں ہوگی، لیکن اگر شوہر عدت گزرنے سے پہلے رجوع نہیں کرتا ہے تو  عدت پوری ہوتے ہی   نکاح ٹوٹ جائے گا،پھر اگر آپ  دونوں ساتھ رہنا چاہیں تو دوبارہ نئے سرے سے دو گواہوں کی موجودگی میں نئے مہر کے ساتھ نکاح کرنا پڑے گا، البتہ آئندہ کے لیے شوہر کے پاس صرف ایک طلاق کا اختیار باقی رہ جائے گا۔</p><p style=""text-align:justify;"">رجوع کا طریقہ یہ ہے کہ شوہر بیوی سے کہے کہ میں آپ سے رجوع کرتا ہوں، یہ رجوعِ قولی کہلاتا ہے، یا شوہر بیوی کے ساتھ زوجین والے تعلقات قائم کرلے ، یہ رجوع فعلی کہلاتا ہے، لیکن رجوعِ  فعلی کرنے کو  (یعنی زبان سے رجوع کیے بغیر، میاں بیوی کا تعلق قائم کرنے کو) فقہاء نے مکروہ  قرار  دیا ہے، حیض کے دوران تو ازدواجی تعلق قائم کرنا جائز ہی نہیں ہے۔</p><p style=""text-align:justify;"">اگر آپ کے شوہر نے طلاق کے علاوہ کوئی دوسرا لفظ استعمال کیا ہو تو وہ بتاکر حکم معلوم  کرلیجیے گا۔</p><p style=""text-align:justify;""><span class=""ar_writing"">الدر المختار وحاشية ابن عابدين (رد المحتار) (3/ 232):</span></p><p class=""indent"" style=""text-align:justify;""><span class=""ar_writing"">""(والبدعي ثلاث متفرقة أو ثنتان بمرة أو مرتين) في طهر واحد (لا رجعة فيه، أو واحدة في طهر وطئت فيه، أو) واحدة في (حيض موطوءة) لو قال: والبدعي ما خالفهما لكان أوجز وأفيد (وتجب رجعتها) على الأصح (فيه) أي في الحيض رفعاً للمعصية.</span></p><p class=""indent"" style=""text-align:justify;""><span class=""ar_writing"">(قوله: وتجب رجعتها) أي الموطوءة المطلقة في الحيض (قوله: على الأصح) مقابله قول القدوري: إنها مستحبة ؛ لأن المعصية وقعت فتعذر ارتفاعها، ووجه الأصح قوله صلى الله عليه وسلم لعمر في حديث ابن عمر في الصحيحين: «مر ابنك فليراجعها»، حين طلّقها في حالة الحيض، فإنّه يشتمل على وجوبين: صريح وهو الوجوب على عمر أن يأمر، وضمني وهو ما يتعلق بابنه عند توجيه الصيغة إليه، فإن عمر نائب فيه عن النبي صلى الله عليه وسلم  فهو كالمبلغ، وتعذر ارتفاع المعصية لا يصلح صارفاً للصيغة عن الوجوب لجواز إيجاب رفع أثرها وهو العدة وتطويلها ؛ إذ بقاء الشيء بقاء ما هو أثره من وجه فلا تترك الحقيقة، وتمامه في الفتح. (قوله: رفعاً للمعصية) بالراء، وهي أولى من نسخة الدال، ط أي لأن الدفع بالدال لما لم يقع والرفع بالراء للواقع والمعصية هنا وقعت، والمراد رفع أثرها وهو العدة وتطويلها كما علمت؛ لأن رفع الطلاق بعد وقوعه غير ممكن"".</span></p><p style=""text-align:justify;""><span class=""ar_writing"">الفتاوى الهندية (1 / 527):</span></p><p class=""indent"" style=""text-align:justify;""><span class=""ar_writing"">""إذا طلق امرأته في حالة الحيض كان عليها الاعتداد بثلاث حيض كوامل ولاتحتسب هذه الحيضة من العدة، كذا في الظهيرية"".</span></p><p style=""text-align:justify;""><span class=""ar_writing"">الدر المختار وحاشية ابن عابدين (رد المحتار) (3/ 397):</span></p><p class=""indent"" style=""text-align:justify;""><span class=""ar_writing"">""(هي استدامة الملك القائم) بلا عوض ما دامت (في العدة) ... (بنحو) متعلق باستدامة (رجعتك) ورددتك ومسكتك بلا نية لأنه صريح (و) بالفعل مع الكراهة (بكل ما يوجب حرمة المصاهرة) كمس.</span></p><p class=""indent"" style=""text-align:justify;""><span class=""ar_writing"">(قوله: بنحو راجعتك) الأولى أن يقول بالقول نحو راجعتك ليعطف عليه قوله الآتي وبالفعل ط، وهذا بيان لركنها وهو قول، أو فعل... (قوله: مع الكراهة) الظاهر أنها تنزيه كما يشير إليه كلام البحر في شرح قوله والطلاق الرجعي لا يحرم الوطء رملي، ويؤيده قوله في الفتح - عند الكلام على قول الشافعي بحرمة الوطء -: إنه عندنا يحل لقيام ملك النكاح من كل وجه، وإنما يزول عند انقضاء العدة فيكون الحل قائماً قبل انقضائها. اهـ. ... (قوله: كمس) أي بشهوة، كما في المنح"".</span></p><p style=""text-align:justify;""><span class=""ar_writing"">الدر المختار وحاشية ابن عابدين (رد المحتار) (3/ 409):</span></p><p class=""indent"" style=""text-align:justify;""><span class=""ar_writing"">""(وينكح مبانته بما دون الثلاث في العدة وبعدها بالإجماع) ومنع غيره فيها لاشتباه النسب"".</span></p><p class=""indent"" dir=""rtl"" style=""text-align:left;"">فقط واللہ اعلم</p></p>",144210200782,banuri,"('طلاق', 'talaaq')","('طلاق کی ضرورت و مشروعیت', 'talaaq-ki-zaroorat-o-mashrooiyat')","('طلاقِ بدعت', 'talaq-e-bidat')"
15-04-2021,https://www.banuri.edu.pk/readquestion/qasam-hukum-144209200176/15-04-2021,آپ کو میری قسم ہے سچ بولو سے قسم کا حکم,میں اور میرے شوہر بات بات میں قسمیں کھاتے تھے کہ آپ کو میری قسم  ہے سچ بولو،  جب کہ ہم کو پتہ نہیں تھا کہ قسم کا مطلب الله كو شريك كرنا هوتا هے تو کیا اس کا کفارہ ادا کرنا ہوگا؟,"<p><p style=""text-align:justify;"">صورتِ مسئولہ  میں آپ یا آپ کے شوہر  کے یہ جملہ "" آپ کو میری قسم  ہے سچ بولو "" کہنے سے  کوئی قسم منعقد نہیں  ہوئی اور  اس پر کفارہ ادا کرنا بھی لازم نہیں ہے۔  البتہ اس قسم کا جملہ کہنا  لغواور بے کار  اور گناہ ہے، لہذا اس قسم کے جملے کہنے سے بچنا چاہیےاور گزشتہ پر توبہ کرنا  چاہیے ۔حضرت عبد اللہ بن عمر رضی اللہ عنہ سے مروی ہے کہ رسول اللہ صلی اللہ علیہ وسلم نے فرمایا :</p><p class=""indent"" style=""text-align:justify;""><span class=""ar_writing""> ""من کان حالفاً فلیحلف بالله أو لیصمت"".</span></p><p class=""indent"" style=""text-align:justify;"">(جو قسم کھانا چاہے تو وہ اللہ کی قسم کھائے یا خاموش رہے) ( بخاری ومسلم)</p><p class=""indent"" style=""text-align:justify;""><span class=""ar_writing"">""عن ابن عمر رضي الله عنه قال : قال رسول الله ﷺ :  من حلف بغیر الله فقد أشرك"".( الترمذی)</span></p><p class=""indent"" style=""text-align:justify;"">ترجمہ: ابن عمر رضی اللہ عنہ سے مروی ہے رسول اللہ ﷺ نے فرمایا :  جس نے اللہ کے علاوہ کی قسم کھائی اس نے شرک کیا۔</p><p class=""indent"" style=""text-align:left;""> فقط واللہ اعلم</p></p>",144209200176,banuri,"('اَیمان و نذور', 'ayman-o-nuzoor')","('قسم کے احکام', 'qasam-ke-ahkaam')","('قسم کے الفاظ و شرائط', 'qasam-ke-alfaaz-o-sharaet')"
13-04-2021,https://www.banuri.edu.pk/readquestion/ghunah-karny-ky-zmany-m-ky-gy-ebadat-ka-hukm-144209200072/13-04-2021,گناہ کرنے کے زمانے میں کی گئی عبادات کا حکم,اگر بیوی کی اپنے کزن سے بات چیت ہو، اور  شوہر نے سختی کے ساتھ بات چیت کرنے یا کسی بھی قسم کا کوئی بھی تعلق رکھنے کا منع کیا ہو ۔ اور بیوی نےشوہر کو بتائے بغیر اور اس کی غیر موجودگی میں بات چیت کی ہے،  audio اور video کالز ، تقریباً ایک سے ڈیڑھ سال تک،  بعد میں شوہر کو پتہ لگ گیا، اس کے بعد بیوی نے معافی مانگی اور شوہر نے معاف کر دیا، اس ایک سے ڈیڑھ سال کے درمیان بیوی نے جو عبادات کی، نماز روزے وغیرہ اس پر کیا شرعی حکم ہے؟,"<p><p style=""text-align:justify;"">بصورتِ مسئولہ جب مذکورہ خاتون نے اپنی نافرمانی اور سرزد ہونے والے گناہوں پر  پشیمان ہوکر شوہر سے معافی مانگنے کے ساتھ ساتھ صدقِ دل سے توبہ واستغفار کرکےآئندہ مذکورہ گناہوں سے مکمل اجتناب کا عزم کیا ہے،تو شوہر کے معاف کرنے کے ساتھ ساتھ  امید ہے کہ اللہ تعالیٰ  معاف فرمائیں گے، باقی گزشتہ عبادات   شرائط کا لحاظ رکھتے ہوئے ادا کیں تو وہ درست ہیں۔</p><p style=""text-align:justify;"">تفسير روح المعاني میں ہے:</p><p class=""indent"" style=""text-align:justify;""><span class=""qr_writing"">""يَاأَيُّهَا الَّذِينَ آمَنُوا تُوبُوا إِلَى اللَّهِ تَوْبَةً نَصُوحًا عَسَى رَبُّكُمْ أَنْ يُكَفِّرَ عَنْكُمْ سَيِّئَاتِكُمْ وَيُدْخِلَكُمْ جَنَّاتٍ تَجْرِي مِنْ تَحْتِهَا الْأَنْهَارُ...</span></p><p class=""indent"" style=""text-align:justify;""><span class=""ar_writing"">أخرجه ابن مردويه عن ابن عباس قال: «قال معاذ بن جبل: يا رسول الله ما التوبة النصوح؟ قال: أن يندم العبد على الذنب الذي أصاب فيعتذر إلى الله تعالى ثم لا يعود إليه كما لا يعود اللبن إلى الضرع»...</span></p><p class=""indent"" style=""text-align:justify;""><span class=""ar_writing"">وقال الإمام النووي: التوبة ما استجمعت ثلاثة أمور: أن يقلع عن المعصية وأن يندم على فعلها وأن يعزم عزما جازما على أن لا يعود إلى مثلها أبدا فإن كانت تتعلق بآدمي لزم رد الظلامة إلى صاحبها أو وارثه أو تحصيل البراءة منه، و ركنها الأعظم الندم.</span></p><p class=""indent"" style=""text-align:justify;""><span class=""ar_writing"">و في شرح المقاصد قالوا: إن كانت المعصية في خالص حق الله تعالى فقد يكفي الندم كما في ارتكاب الفرار من الزحف وترك الأمر بالمعروف، وقد تفتقر إلى أمر زائد كتسليم النفس للحد في الشرب وتسليم ما وجب في ترك الزكاة، ومثله في ترك الصلاة وإن تعلقت بحقوق العباد لزم مع الندم، والعزم إيصال حق العبد أو بدله إليه إن كان الذنب ظلما كما في الغصب والقتل العمد، ولزم إرشاده إن كان الذنب إضلالا له، والاعتذار إليه إن كان إيذاء كما في الغيبة إذا بلغته و لايلزم تفصيل ما اغتابه به إلا إذا بلغه على وجه أفحش."" </span></p><p class=""indent"" dir=""rtl"" style=""text-align:left;""><span class=""ar_writing"">(سورة التحريم، رقم الآية:08، ج:14، ص:352، ط:داراحىاء التراث العربى)</span></p><p class=""indent"" dir=""rtl"" style=""text-align:left;""><span class=""ar_writing"">فقط والله أعلم </span></p></p>",144209200072,banuri,"('حقوق و آدابِ معاشرت', 'huqooq-muashret')","('حقوق', 'bahmi-huqooq')","('میاں ، بیوی کے حقوق', 'mian-biwi-k-huqooq')"
12-04-2021,https://www.banuri.edu.pk/readquestion/ramzan-ka-chand-nzar-aany-ky-bad-sura-fath-pharny-ka-hukm-144208201530/12-04-2021,رمضان کا چاند نظر آنے کے بعد سورہ فتح یا کوئی بھی خاص عمل کرنے کا حکم,میرا سوال دو حصوں پر مشتمل ہے، جو مندرجہ ذیل ہے:1: یہ ہے کہ میں نے بہت سے لوگوں سے سنا اور پڑھا بھی ہے کہ رمضان کا چاند نظر آنے کے بعد قرآن پاک کی سورۃ فتح کی تلاوت کی جائے تو سارا سال الله پاک آپ کے رزق کا بندوبست کر دیتے ہیں اور سارا سال امن رہے گا وغیرہ وغیرہ کیا کسی کتاب و حدیث سے یہ ثابت ہے یا نہیں؟2:  ویسے تو ہم سب جانتے ہیں کہ بلا شبہ قرآن کی تلاوت کے لامحدود فضائل و برکات ہیں مگر سوال یہ ہے کہ ایک خاص دن  ایسا خاص عمل کرنا کیسا ہے؟,"<p><p style=""text-align:justify;"">1: ممکن ہے کہ مذکورہ  وظیفہ (یعنی چاند دیکھ کر سورہ فتح پڑھنا)  کسی بزرگ کے مجربات میں سے ہو، اس لیے پڑھنے میں حرج نہیں، البتہ  یہ کسی حدیث سے ثابت نہیں ہے، اور نہ ہی اس طرح رمضان میں کسی خاص عمل کو کرنے کا  شرعی حکم ہے کہ اس کی پابندی کی جائے، لہٰذا اس کے پڑھنے کو لازم نہ سمجھا جائے۔</p><p style=""text-align:justify;"">2:  احادیثِ  مبارکہ میں جہاں خاص دن قرآن مجید کا خاص حصہ پڑھنے پر فضائل مذکور  ہیں تو  اس دن وہ خاص حصہ پڑھنا چاہے،  جیسے جمعہ کے دن سورہ کہف پڑھنے کے بارے میں مختلف فضائل کا ذکر احادیثِ مبارکہ میں آیا ہے، البتہ رمضان المبارک کا مکمل مہینہ برکتوں والا ہے، مکمل مہینے میں قرآن کی زیادہ سے زیادہ تلاوت کرنی چاہے، خود آپﷺ رمضان کے مہینے میں قرآن کریم پڑھنے کا زیادہ اہتمام فرماتے تھے، جیسا کہ حدیث شریف میں ہے:</p><p class=""indent"" style=""text-align:justify;""><span class=""ar_writing"">""عَنْ ابْنِ عَبَّاسٍ رَضِيَ اللَّهُ عَنْهُمَا قَالَ کَانَ رَسُولُ اللَّهِ صَلَّی اللَّهُ عَلَيْهِ وَسَلَّمَ أَجْوَدَ النَّاسِ وَکَانَ أَجْوَدُ مَا يَکُونُ فِي رَمَضَانَ حِينَ يَلْقَاهُ جِبْرِيلُ وَکَانَ يَلْقَاهُ فِي کُلِّ لَيْلَةٍ مِنْ رَمَضَانَ فَيُدَارِسُهُ الْقُرْآنَ فَلَرَسُولُ اللَّهِ صَلَّی اللَّهُ عَلَيْهِ وَسَلَّمَ أَجْوَدُ بِالْخَيْرِ مِنْ الرِّيحِ الْمُرْسَلَةِ.""</span></p><p class=""indent"" style=""text-align:justify;""><span class=""ar_writing""><span style=""font-family:Nafees,sans-serif;font-size:18px;font-weight:400;"">ترجمہ: حضرت ابن عباس (رض) روایت کرتے ہیں، فرمایا کہ رسول اللہ (صلی اللہ علیہ وآلہ وسلم) سب سے زیادہ سخی تھے اور خاص طور پر رمضان میں جب جبرائیل آپ (صلی اللہ علیہ وآلہ وسلم) سے ملتے تو آپ (صلی اللہ علیہ وآلہ وسلم) سب لوگوں سے زیادہ سخی ہوتے تھے اور جبرائیل آپ سے رمضان کی ہر رات میں ملتے اور قرآن کا دور کرتے، نبی (صلی اللہ علیہ وآلہ وسلم) بھلائی پہنچانے میں ٹھنڈی ہوا سے بھی زیادہ سخی تھے۔</span></span></p><p class=""indent"" style=""text-align:left;""><span class=""ar_writing""><span style=""font-family:Nafees,sans-serif;font-size:18px;font-weight:400;"">(صحیح البخاری،  کتاب المناقب، باب صفۃ النبی ﷺ، ج:1، ص:502، ط:نورمحمد کتب خانہ)</span></span></p><p class=""indent"" dir=""rtl"" style=""text-align:left;"">فقط واللہ اعلم</p></p>",144208201530,banuri,"('علوم و فنون', 'uloom-funoon')","('دعائیں، اوراد اور وظائف', 'adeya-azkar')","('اوراد ووظائف', 'aurad-o-wzaif')"
25-12-2021,https://www.banuri.edu.pk/readquestion/ghussah-ki-halat-main-talaq-data-hn-talaq-talaq-kahnay-ka-hukum-144305100589/25-12-2021,غصہ کی حالت میں طلاق دیتا ہوں طلاق طلاق کہنے کا حکم,"میرے بھائی کا اپنی اہلیہ سے چند روز قبل کسی بات پر لڑائی جھگڑا ہوا ،چار دنوں سے اس کی طبیعت بہت خراب تھی،  جس  کی  وجہ  سے  وہ  کام  سے  جلدی  گھر آجاتا  تھا لڑائی  کے  دوران بات بہت بڑھ گئی، وہ بلڈ پریشر کا مریض ہے کہ جب غصہ آتا ہے تو کبھی اپنے ہوش و حواس میں نہیں رہتا، اس نے گھر والی پرہاتھ اٹھایا تو بیوی نے  کہا کہ "" اگر مرد کے بچے ہو تو مجھے طلاق دو ""اس پر وہ بے قابو ہوگیا اور  کہا کہ ""میں تجھے طلاق دیتا ہوں طلاق طلاق""  اب پوچھنا یہ ہے کہ: کتنی طلاقیں واقع ہوئی ہیں؟ مذکورہ بھائی نے  ایک فتوی کسی اور دارالافتاء سے لیا تھا وہ بھی ساتھ منسلک ہے۔","<p><p dir=""rtl"" style=""text-align:justify;""><span lang=""er"" xml:lang=""er"">صورتِ  مسئولہ میں سائل کے بھائی کا غصہ اور لڑائی جھگڑے کی حالت میں ( طلاق کے الفاظ کہتے وقت اس قدرہوش وحواس تھاکہ اسے معلوم تھاکہ وہ زبان سے طلاق کےالفاظ نکال رہاہے)اپنی</span>بیوی کو یہ کہنا کہ ""میں تجھے طلاق دیتا ہوں طلاق طلاق""سے شرعاً اس  کی بیوی پر تینوں طلاقیں واقع ہوگئیں ہیں، بیوی شوہر پر حر مت مغلظہ کے ساتھ حرام ہوگئی، اور نکاح ختم ہو گیا ، اب  رجوع یا  دوبارہ نکاح کرنا بھی جائز نہیں ۔</p><p dir=""rtl"" style=""text-align:justify;""><span lang=""er"" xml:lang=""er"">مطلقہ  عدت (پوری تین ماہواریاں اگر حمل نہ ہو اور اگر حمل ہو تو بچے کی پیدائش تک)گزار کر دوسری جگہ نکاح کرسکتی ہے۔</span></p><p>بدائع الصنائع میں ہے:</p><p class=""indent""><span class=""ar_writing"">""وأما الطلقات الثلاث فحكمها الأصلي هو زوال الملك، وزوال حل المحلية أيضاً حتى لايجوز له نكاحها قبل التزوج بزوج آخر؛ لقوله - عز وجل - ﴿فَاِنْ طَلَّقَهَا فَلَا تَحِلُّ لَه مِنْ بَعْدُ حَتّٰى تَنْكِحَ زَوْجاً غَيْرَه﴾[البقرة: 230] ، وسواء طلقها ثلاثاً متفرقاً أو جملةً واحدةً"" .</span></p><p class=""indent"" style=""text-align:left;""><span class=""ar_writing"">(3/187، فصل في حكم الطلاق البائن، کتاب الطلاق، ط؛ سعید)</span></p><p class=""indent"" dir=""rtl"" style=""text-align:left;""><span class=""ur_writing"" lang=""er"" xml:lang=""er"">فقط واللہ اعلم</span></p></p>",144305100589,banuri,"('طلاق', 'talaaq')","('وقوع طلاق وعدم وقوع طلاق', 'wuqoo-e-talaq-o-adme-wuqoo-e-talaq')","('غصہ/حمل کی حالت میں طلاق', 'talaq-e-gazbaan')"
