issued_at,link,title,question,answer,fatwa_number,dar_ul_ifta,kitab,bab,fasal
27-04-2021,https://www.banuri.edu.pk/readquestion/qatron-ki-mariz-ky-ly-jmat-se-nmaz-chorny-ka-hukm-144209201148/27-04-2021,قطروں کی بیماری والے شخص کے لیے جماعت سے نماز چھوڑنے کا حکم,مجھے  پیشاب کے بعد قطرے بہت دیر تک آتے ہیں ۔ میں ٹشو پیپر رکھ دیتا ہوں، لیکن بعض دفعہ تین تین چار چار گھنٹے بعد بھی پیشاب یا ودی کے قطرے آتے ہیں اور ان کے آنے کا احساس بھی بہت کم ہوتا ہے ۔ جب میں نماز پڑھ کر دیکھتا ہوں توٹشوو پیپر پر قطرے جذب نظر آتے ہیں۔ ایسے میں پھر نماز کے آخری وقت کا انتظار کرتا ہوں اور آخری وقت میں نماز ادا کرتا ہوں اور میں جانتا ہوں کہ میں معذور نہیں؛ اس لیے  کہ مجھے چار رکعات فرض ادا کرنے کا وقت مل جاتا ہے،  لیکن وہ وقت کون سا ہوگا یہ مجھے نہیں پتا چلتا؛ کیوں کہ قطرے کسی بھی وقت بغیر احساس ہوئے آجاتے ہیں اور کبھی نہیں آتے، اب سوال یہ ہے کہ میں اسی قطرے آنے کی حالت میں نماز با جماعت پڑھوں اور پھر گھر آکر چیک کروں یا آخری وقت میں تسلی کرکے اکیلے میں نماز ادا کروں؛ کیوں کہ اتنا تو مجھے معلوم  ہے کہ تقاضے کے 3 سے 4 گھنٹے بعد تک تو مجھے عضومیں قطرے محسوس ہوتے ہیں اور نماز کی حرکت میں وہ اکثر نکل آتے ہیں اور پھر مجھے دہرانی پڑھتی ہے نماز گھر آ کر دوبارہ، اب ایسی حالت میں مجھے کیا پیشاب کا تقاضا روک کر نماز ادا کرنی چاہیے ؟ یا مجھے قضاءِ  حاجت کے بعد اطمینان کی حالت میں نماز پڑھنی چاہیے اور جماعت چھوڑ دینی چاہیے ؟ میں اس وجہ سے بہت پریشان ہوں ۔,"<p><p style=""text-align:justify;"">بصورتِ  مسئولہ  جب آپ کو قطروں میں مقدارِ نماز کے برابر تسلسل نہیں ہے یعنی کچھ دیر تک پیشاب کے قطرے آنے کے بعد بند ہوجاتے ہیں یا درمیان میں اتنا وقفہ ہوجاتا ہے کہ جس میں فرض نماز ادا کی جاسکتی ہے  تو  آپ شرعاً معذورین میں شامل نہیں ہیں، جس کا حکم یہ ہے کہ  اِن قطروں سے وضو ٹوٹ جائے گا اور کپڑے بھی ناپاک ہوجائیں گے اور ان کا دھونا (جب کہ وہ مقدار درہم سے تجاوز کرجائیں) واجب ہوگا،  اس صورت میں  نماز سے کافی پہلے ہی پیشاب کر کے فارغ ہوجانا چاہیے اور اس کے بعد پیشاب کے قطروں کے خارج ہونے تک انتظار کریں، جب قطرے بند ہوجائیں اور  اطمینان حاصل ہوجائے پھر اس کے بعد وضو کرکے اگر جماعت کا وقت ہے تو جماعت سے نماز ادا کریں اگر نہیں ہے تو انفرادی نماز پڑھے، بہتر یہ ہوگا کہ  نماز کے وقت کے لیے الگ کپڑا رکھاجائے اور دیگر اوقات کے لیے الگ کپڑا رکھاجائے، پھر بھی اگر نماز کے وقت پہنے ہوئے کپڑوں میں قطرے نکل آئیں تو اس کو پاک کرلیاجائے۔</p><p style=""text-align:justify;"">خلاصہ یہ ہے کہ آپ مستقل طور پر جماعت نہ چھوڑیں، بلکہ جماعت کے اوقات ملحوظ رکھتے ہوئے نماز کے اوقات سے کافی پہلے استنجا کا اہتمام کریں، اور جماعت سے ہی  نماز ادا کریں، البتہ اگر کبھی دورانِ نماز قطرے آگئے تو پاکی حاصل کرکے اس  نماز کا اعادہ کرلیجیے۔ </p><p style=""text-align:justify;"">فتاوی ہندیہ میں ہے:</p><p class=""indent"" dir=""rtl"" style=""text-align:justify;""><span class=""ar_writing"">""شرط ثبوت العذر ابتداء أن يستوعب استمراره وقت الصلاة كاملا وهو الأظهر كالانقطاع لا يثبت ما لم يستوعب الوقت كله حتى لو سال دمها في بعض وقت صلاة فتوضأت وصلت ثم خرج الوقت ودخل وقت صلاة أخرى وانقطع دمها فيه أعادت تلك الصلاة لعدم الاستيعاب.</span></p><p class=""indent"" dir=""rtl"" style=""text-align:justify;""><span class=""ar_writing"">وإن لم ينقطع في وقت الصلاة الثانية حتى خرج لا تعيدها لوجود استيعاب الوقت.</span></p><p class=""indent"" dir=""rtl"" style=""text-align:justify;""><span class=""ar_writing"">وشرط بقائه أن لا يمضي عليه وقت فرض إلا والحدث الذي ابتلي به يوجد فيه هكذا في التبيين.""</span></p><p class=""indent"" dir=""rtl"" style=""text-align:left;""><span class=""ar_writing"">(کتاب الطهارۃ، ج:1، ص:40، ط:مکتبہ رشیدیہ)</span></p><p class=""indent"" dir=""rtl"" style=""text-align:left;"">فقط واللہ اعلم</p></p>",144209201148,banuri,"('نماز', 'salat')","('نماز توڑنے والی چیزیں', 'namaz-torney-wali-chezen')","('حدث کا لاحق ہونا', 'hadas-ka-laheq-hona')"
29-04-2021,https://www.banuri.edu.pk/readquestion/ayat-e-sajda-tark-kr-k-baqe-surat-parhna-144209201357/29-04-2021,آیت سجدہ ترک کر کے باقی سورت پڑھنا,آج کل  بعض ائمہ نماز میں سورۃ العلق کی تلاوت کرتے ہیں، مگرسجدے سے بچنے کے لیے آخری دویاتین آیات کو ہمیشہ چھوڑ دیتے ہیں ۔کیا یہ جائز ہے؟,"<p><p style=""text-align:justify;"">نماز  یا غیر نماز میں دورانِ تلاوت، صرف آیتِ سجدہ  ترک کرکے بقیہ آیات تلاوت کرنا مکروہِ تحریمی ہے، کیوں کہ  ایسا کرنا سجدہ سے فرار اختیار کرنا ہے، جو کہ ایک مسلمان کے شایانِ شان نہیں،  نیز نظم قرآنی میں بھی خلل کا باعث ہے، اس لیے ایسا کرنے سے احتراز کرنا ضروری ہے، ہاں! اگر  صرف آیتِ سجدہ نہ چھوڑی جائے، بلکہ اس کے ساتھ چند آیات  ترک  کردی جائیں تو جائز ہے۔</p><p style=""text-align:justify;""><span class=""ar_writing"">الدر المختار شرح تنوير الأبصار وجامع البحار (ص: 104):</span></p><p class=""indent"" style=""text-align:justify;""><span class=""ar_writing"">""(و كره ترك آية سجدة وقراءة باقي السورة)؛ لأنّ فيه قطع نظم القرآن و تغيير تأليفه، و اتباع النظم والتأليف مأمور به، بدائع. </span><span class=""ar_writing"">و مفاده أن الكراهة تحريمية.""</span></p><p class=""indent"" style=""text-align:left;"">فقط واللہ اعلم</p></p>",144209201357,banuri,"('نماز', 'salat')","('قراءت کا بیان', 'qiraat')","('قراءت کے آداب و مستحبات', 'qiraat-ke-aadab-o-mustahabbaat')"
03-01-2022,https://www.banuri.edu.pk/readquestion/2bhai-or-5bano-me-trka-ki-taqsem-144305100822/03-01-2022,2 بھائی اور 5 بہنوں میں ترکہ کی تقسیم,میرے والدین کا انتقال ہوگیا ہے، ورثاء میں ہم 5 بہنیں اور 2 بھائی ہیں، والدین کے والدین ان کی زندگی میں انتقال کرگئے تھے، والد کے ترکہ کا مکان جسے بھائیوں نے فروخت کردیا ہے، اس میں شرعی لحاظ سے ہم بہن بھائیوں کا کتنا حصہ بنتا ہے؟ اسی طرح والد کے انتقال کے بعد متروکہ گھر کا کرایہ والدہ اور چھوٹا بھائی اور والدہ کے انتقال کے بعد دونوں بھائی استعمال کرتے رہے، اس میں ہم بہنوں کا حصہ بنتا ہے یا نہیں؟,"<p><p style=""text-align:justify;"">صورتِ مسئولہ میں سائلہ کے مرحوم والدین کے ترکہ کی تقسیم کا شرعی طریقہ یہ ہےکہ سب سے پہلے ان کے ترکہ میں سے ان کے حقوقِ متقدمہ یعنی تجہیز و تکفین کے اخراجات نکالنے کے بعد، ان پر اگر کوئی قرض ہو تو اسے ادا کرنے کے بعد، انہوں نے اگر  کوئی جائز وصیت کی ہو تو باقی ترکہ کےایک تہائی میں اسے نافذ کرنے کےبعد، باقی متروکہ جائیداد منقولہ وغیر منقولہ کے 9 حصے کرکے مرحومین کے دو بیٹوں میں سے ہر ایک کو 2 حصے اور پانچ بیٹیوں میں سے ہر ایک کو ایک حصہ ملے گا۔</p><p style=""text-align:justify;"">صورتِ تقسیم یہ ہے:</p><p style=""text-align:justify;"">میت: 9</p><table border=""1"" style=""height:109px;width:26.0239%;""><tbody><tr><td style=""width:8.61679%;"">بیٹا</td><td style=""width:8.61679%;"">بیٹا</td><td style=""width:10.1588%;"">بیٹی</td><td style=""width:10.1588%;"">بیٹی</td><td style=""width:10.1588%;"">بیٹی</td><td style=""width:10.1588%;"">بیٹی</td><td style=""width:10.1742%;"">بیٹی</td></tr><tr><td style=""width:8.61679%;"">2</td><td style=""width:8.61679%;"">2</td><td style=""width:10.1588%;"">1</td><td style=""width:10.1588%;"">1</td><td style=""width:10.1588%;"">1</td><td style=""width:10.1588%;"">1</td><td style=""width:10.1742%;"">1</td></tr></tbody></table><p style=""text-align:justify;"">یعنی 100 روپے میں سے مرحومین کے دو بیٹوں میں سے ہر ایک کو 22.222 روپے اور پانچ بیٹیوں میں سے ہر ایک کو 11.111 روپے ملیں گے۔</p><p style=""text-align:justify;"">تقسیم سے قبل متروکہ گھر کا کرایہ جو ورثاء استعمال کرتے رہے، اس میں بھی بہنوں کا اسی ذکر کردہ تناسب سے حق و حصہ ہے، لہٰذا جن ورثاء نے وہ کرایہ اپنے ذاتی استعمال میں خرچ کیا ہے، ان پر لازم ہے کہ اس کرایہ میں ہر وارث کا جو حصہ بنتا ہے، وہ اسے واپس کریں،</p><p class=""indent"" style=""text-align:left;"">فقط واللہ اعلم۔</p></p>",144305100822,banuri,"('فرائض', 'faraez')","('ترکہ کی تقسیم', 'taraka-ki-taqseem')","('ترکہ کی تقسیم کا طریقہ', 'taraka-ki-taqseem-ka-tareqa')"
02-01-2022,https://www.banuri.edu.pk/readquestion/talaq-muallaq-karny-ka-hukum-144305100803/02-01-2022,طلاق معلق کرنے کا حکم,ایک شخص نے اپنی بیوی کو ایک طلاقِ رجعی دی تھی،پھر بعدمیں رجوع کرلیا تھا،اس کے بعد اس نے اپنی  بیوی یہ کہ کر معلق طلاق دی کہ اگر یہ باتیں آپ نے بھائیوں کو بتائی تو تمہیں طلاق ہے،بیوی نے ابھی تک وہ باتیں بھائیوں کو نہیں بتائی، اب پوچھنا یہ ہے کہ اگر ابھی بیوی وہ باتیں بھائیوں کو بتائے تو شرط پوری ہونے کی وجہ سے دوسری  طلاق واقع ہوگی؟,"<p><p style=""text-align:justify;"">صورت مسئولہ میں بیوی نے اگر وہ باتیں بھائیوں کو بتائی تو شرط پوری ہونے کی وجہ سے اس پر دوسری طلاقِ رجعی واقع ہوجائے گی، پھر شوہر نے دورانِ عدت(تین ماہواریاں گزرنے سے پہلے اگر  بیوی حاملہ نہ ہو وگرنہ بچہ جننے سے پہلے) رجوع کرلیا تو نکاح برقرار رہے گا۔</p><p>ہندیہ میں ہے:</p><p class=""indent""><span class=""ar_writing"">وإذا أضافه إلى الشرط ‌وقع ‌عقيب الشرط اتفاقا مثل أن يقول لامرأته: إن دخلت الدار فأنت طالق</span></p><p class=""indent"" style=""text-align:left;"">(کتاب الطلاق،الباب الرابع فی الطلاق بالشرط،الفصل الثالث فی تعلیق الطلاق،ج1،ص420،ط:ماجدیہ)</p><p style=""text-align:right;"">الدر مع الرد میں ہے:</p><p class=""MsoNormal indent"" dir=""rtl""><span class=""MsoBookTitle""><span lang=""er"" style=""font-size:14pt;"" xml:lang=""er""><span class=""ar_writing"">(</span></span></span><span class=""ar_writing"" lang=""er"" xml:lang=""er"">ھی استدامۃ الملک القائم فی العدۃ بنحو راجعتک ورددتک ومسکتک بلا نیۃ لانہ صریح)</span></p><p class=""indent"" dir=""rtl"" style=""text-align:left;""><span lang=""er"" xml:lang=""er""><span lang=""er"" xml:lang=""er"">(</span><span lang=""er"" xml:lang=""er"">باب الرجعۃ، ج3،ص398،397:سعید)</span></span></p><p class=""indent"" dir=""rtl"" style=""text-align:left;""><span lang=""er"" xml:lang=""er"">فقط واللہ اعلم</span></p></p>",144305100803,banuri,"('طلاق', 'talaaq')","('تعلیقِ طلاق (مشروط طلاق دینا)', 'talaq-ki-taleeq')","('طلاق کو معلق کرنا', 'talaq-ko-muallaq-karna')"
27-12-2021,https://www.banuri.edu.pk/readquestion/miras-man-bahnwn-ka-bhi-hak-hay-tarka-kay-mal-say-hasel-shuda-manafea-tamam-wursa-man-taksim-hwn-gy-144305100653/27-12-2021,میراث میں بہنوں کا بھی حق ہے، ترکہ کے مال سے حاصل شدہ منافع تمام ورثا میں تقسیم ہوں گے,"میرے سسر کا کپڑے کا کاروبار تھا، ان کے پاس ایک مکان اور ایک دوکان تھی، دکان پگڑی کی تھی، سسر   کا انتقال ہوا ، ورثاء میں چار بیٹے اور تین بیٹیاں تھیں،  سسر كے انتقال کے   وقت میرے شوہر  اور  ان کے بڑے بھائی  شادی شدہ  تھے، دو بھائی چھوٹے تھے، ان کی شادی نہیں ہوئی تھی، سسر  کے انتقال کے بعد بھائیوں نے  میرا اور میری جیٹھانی (شوہر کے بڑے بھائی کی بیوی) کا زیور لیا اور اس سے دوسری دکان پگڑی پر لی،  ایک دکان میرے شوہر اور ان  کے بڑے بھائی دونوں کے نام پر تھی اور دوسری دکان دو چھوٹے بھائیوں کے نام پر تھی، اس کے بعد میرے شوہر نے وہ دکان چھوڑ دی،  جب میری بیٹی کی شادی ہوئی تو میرا زیور مجھے واپس دے دیا  اور شوہر نے اپنا الگ کاروبار شروع کردیا،  آج سے گیارہ سال پہلے شوہر کا بھی انتقال ہو گیا ، ورثاء میں  بیوہ،  ایک بیٹا اور دو بیٹیاں ہیں۔میرے شوہر کے تین بھائیوں نے سسر کے کاروبار کو سنبھالا اور سسر کے انتقال کے بعد اس مشترکہ  کاروبار سے نفع کمایا، اس میں سے نہ   میرے شوہر کو حصہ دیا اور نہ ہی   تین بہنوں کو ، اور اسی   کاروبار سے مزید تین گھر بنائےہیں،   ابھی تک ان کو تقسیم بھی نہیں کیا ہے،   پگڑی کی دونوں دکانیں چار کروڑ روپے میں  فروخت کی ہیں،( دونوں کانوں میں میں کچھ کا م  بھی  کروایا  تھا) ،  اس میں سے ہر ایک بھائی نے ایک ایک کروڑ روپے لیے اور میرے شوہر کے ایک کروڑ روپے مجھے  دیے، جس میں ان کی بہنوں کا بھی حصہ تھااور  مجھ سے اورمیرے بیٹوں سے کہا کہ :""اب تم جانو اور پھوپھیاں جانیں""، ان میں سے 1250000 شوہر نے بھائیوں سے قرضہ لیا تھا، اس کی مد میں واپس کردیے ،پھر  تین بھائیوں نے  بہنوں کو اپنے اپنے حصوں میں سے ان کا  شرعی حصہ دے  دیا ، لیکن میں نے شوہر کی بہنوں کو ایک کروڑ میں سے حصہ نہیں دیا۔اب سوال یہ ہے کہ :کیا میرے شوہر کے حصے میں سے بھی ان کی بہنوں کو حصہ دینا لازمی ہے ؟ان تین بھائیوں نے اس کاروبار سے مزید تین گھر بنائے ، اس میں میرا اور میرے بچوں کا کوئی حق بنتا ہے یا نہیں ؟","<p><p style=""text-align:justify;"">1۔صورتِ مسئولہ میں   چوں کہ سائلہ کے سسر  کی دکانوں میں بیٹوں کے ساتھ بیٹیوں کا بھی حق تھا، لیکن بیٹوں نے دکانیں فروخت کرکے رقم آپس میں تقسیم کردی تھی ، پھر بقیہ بیٹوں نے اپنے اپنے حصوں میں سے بہنوں کو حصہ دے دیا ، لیکن سائلہ کے شوہر  کے حصے میں جو  رقم سائلہ کو دی گئی ، اس میں  چوں کہ سائلہ کے شوہر کی بہنوں کا بھی حق تھا؛ لہذا سائلہ  پر سب سے پہلے شوہر کی بہنوں کو  اس رقم سے ان کا حصہ دینا لازم ہے، پھر بقیہ رقم شوہر کے  ورثاء میں تقسیم  ہو گی۔</p><p style=""text-align:justify;"">2۔اگر سائلہ کا بیان حقیقت پر مبنی ہے کہ سائلہ کے سسر کے کاروبار کو سائلہ کے دیوروں نے بڑھایا اور اس سے نفع کمایااور اس کمائی سے تین گھر بنائے تو والد(سائلہ کےسسر) کے کاروبار سےبیٹوں نے   جتنا کچھ کمایا ، اس  میں سائلہ کے سسر کے   تمام ورثاء کا حق ہے، جن میں سائلہ کا شوہر بھی داخل ہے ،اب اس کی وفات کے بعد  اس کا حق ان کے ورثاء کو ملے گا۔</p><p align=""left"" dir=""rtl"" style=""text-align:justify;""><span lang=""ar-sa"" xml:lang=""ar-sa"">مشکوٰۃ شریف میں ہے:</span></p><p align=""left"" class=""indent"" dir=""rtl"" style=""text-align:justify;""><span class=""ar_writing"" lang=""ar-sa"" xml:lang=""ar-sa"">عن أنس قال: قال رسول الله صلى الله عليه وسلم: «من قطع ميراث وارثه قطع الله ميراثه من الجنة يوم القيامة» .</span></p><p align=""left"" class=""indent"" dir=""rtl"" style=""text-align:left;""><span class=""ar_writing"" lang=""ar-sa"" xml:lang=""ar-sa"">(کتاب الفرائض ، باب الوصایا ، الفصل الثالث/1/462/ط،البشرٰی).</span></p><p dir=""rtl"" style=""text-align:justify;""><span lang=""ar-sa"" xml:lang=""ar-sa"">ترجمہ:</span><span lang=""ar-sa"" xml:lang=""ar-sa"">       </span><span lang=""ar-sa"" xml:lang=""ar-sa"">حضرت انس رضی اللہ عنہ کہتے ہیں کہ رسول کریم  صلیٰ  اللہ علیہ وسلم نے فرمایا  :کہ جو شخص اپنے وارث کی میراث کاٹے گا اللہ تعالیٰ قیامت کے دن اس کی جنت کی میراث کاٹ لے گا۔</span></p><p class=""indent"" dir=""rtl"" style=""text-align:left;""><span lang=""ar-sa"" xml:lang=""ar-sa"">(مظاہر حق: 3/236،ط: دارالاشاعت )</span></p><p dir=""rtl"" style=""text-align:justify;""><span lang=""ar-sa"" xml:lang=""ar-sa"">فتاویٰ شامی میں ہے:</span></p><p class=""indent"" dir=""rtl"" style=""text-align:justify;""><span class=""ar_writing"" lang=""ar-sa"" xml:lang=""ar-sa"">""شركة ملك ، وهي أن يملك متعدد) اثنان فأكثر (عينا) أو حفظا كثوب هبه الريح في دارهما فإنهما شريكان في الحفظ قهستاني (أو دينا) على ما هو الحق؛ فلو دفع المديون لأحدهما فللآخر الرجوع بنصف ما أخذ۔""</span></p><p align=""right"" class=""indent"" dir=""rtl"" style=""text-align:left;""><span class=""ar_writing"" lang=""ar-sa"" xml:lang=""ar-sa"">(کتاب الشرکۃ : 4 / 299 ، ط : سعید)</span></p><p align=""right"" dir=""rtl"" style=""text-align:justify;""><span lang=""ar-sa"" xml:lang=""ar-sa"">وفیہ ایضاً:</span></p><p class=""indent"" dir=""rtl"" style=""text-align:justify;""><span class=""ar_writing"" lang=""ar-sa"" xml:lang=""ar-sa"">""والربح في شركة الملك على قدر المال۔""</span></p><p align=""right"" class=""indent"" dir=""rtl"" style=""text-align:left;""><span class=""ar_writing"" lang=""ar-sa"" xml:lang=""ar-sa"">(مطلب فیما یبطل الشرکۃ : 4 / 316 ، ط : سعید)</span></p><p dir=""rtl""><span lang=""ar-sa"" xml:lang=""ar-sa"">درر الحكام شرح مجلة الأحكام میں ہے  :</span></p><p class=""indent"" dir=""rtl""><span class=""ar_writing"" lang=""er"" xml:lang=""er"">( المادة 1073 ) ( تقسيم حاصلات الأموال المشتركة في شركة الملك بين أصحابهم بنسبة حصصهم.</span></p><p class=""indent"" dir=""rtl"" style=""text-align:left;""><span lang=""er"" xml:lang=""er""><span class=""ar_writing"">(القواعد الکلیة / 3 / 22 / ط: دار الکتب العلمیة)</span></span></p><p class=""indent"" dir=""rtl"" style=""text-align:left;""><span lang=""ar-sa"" xml:lang=""ar-sa""><span lang=""er"" xml:lang=""er"">فقط و الله اعلم</span></span></p></p>",144305100653,banuri,"('فرائض', 'faraez')","('ترکہ اور اس کا استحقاق', 'tarka-or-is-ka-istehaqaaq')","('ترکہ کے مال میں اضافہ', 'taraka-ke-maal-men-izafaa')"
05-01-2022,https://www.banuri.edu.pk/readquestion/bewa-3betian-aek-bhai-or-aek-bhien-me-tarka-ki-taqsem-144306100003/05-01-2022,بیوہ، 3 بیٹیاں، ایک بھائی اور ایک بہن میں ترکہ کی تقسیم,میرے والد کا انتقال ہوگیا ہے، ورثاء میں بیوہ، 3 بیٹیاں، ایک بھائی اور ایک بہن ہے، مرحوم کا ایک اور بھائی تھا، جس کا انتقال مرحوم کی زندگی میں ہوگیا تھا، مرحوم بھائی کے 2 بیٹے ہیں، والد نے اپنی زندگی میں بھی ورثاء بیوہ، بیٹی، بھائی اور بہن کو اپنی جائیداد میں سے گفٹ کرکے ہر ایک کو اس پر قبضہ و تصرف دے دیا تھا اور کچھ اپنے لیے رکھا تھا، جو حصہ والد نے اپنے لیے رکھا تھا اور اسے اب ترکہ میں چھوڑ گئے ہیں، اسے ورثاء میں کیسے تقسیم کیا جائے گا اور ہر وارث کا کتنا حصہ ہوگا؟,"<p><p style=""text-align:justify;"">صورتِ مسئولہ میں مرحوم  والد کے ترکہ کی تقسیم کا شرعی طریقہ یہ ہےکہ سب سے پہلے ان کے ترکہ میں سے ان کے حقوقِ متقدمہ یعنی تجہیز و تکفین کے اخراجات نکالنے کے بعد، ان پر اگر کوئی قرض ہو تو اسے ادا کرنے کے بعد، انہوں نے اگر  کوئی جائز وصیت کی ہو تو باقی ترکہ کےایک تہائی میں اسے نافذ کرنے کےبعد، باقی متروکہ جائیداد منقولہ وغیر منقولہ کے 72 حصے کرکے مرحوم کی بیوہ کو 9 حصے، تین بیٹیوں میں سے ہر ایک کو 16 حصے، بھائی کو 10 حصے اور بہن کو 5 حصے ملیں گے۔</p><p style=""text-align:justify;"">صورتِ تقسیم یہ ہے:</p><p style=""text-align:justify;"">میت: 24/ 72</p><table border=""1"" style=""height:170px;width:28.0717%;""><tbody><tr><td style=""width:11.6689%;text-align:center;"">بیوہ</td><td style=""width:12.386%;text-align:center;"">بیٹی</td><td style=""width:12.386%;text-align:center;"">بیٹی</td><td style=""width:12.386%;text-align:center;"">بیٹی</td><td style=""width:13.7823%;text-align:center;"">بھائی</td><td style=""width:11.9538%;text-align:center;"">بہن</td></tr><tr style=""text-align:center;""><td style=""width:11.6689%;"">3</td><td colspan=""3"" style=""width:37.1581%;"">16</td><td colspan=""2"" style=""width:25.7361%;"">5</td></tr><tr style=""text-align:center;""><td style=""width:11.6689%;"">9</td><td style=""width:12.386%;"">16</td><td style=""width:12.386%;"">16</td><td style=""width:12.386%;"">16</td><td style=""width:13.7823%;"">10</td><td style=""width:11.9538%;"">5</td></tr></tbody></table><p style=""text-align:justify;"">یعنی 100 روپے میں سے مرحوم کی بیوہ کو 12.50 روپے، تین بیٹیوں میں سے ہر ایک کو 22.222 روپے، بھائی کو 13.888 روپے اور بہن کو 6.944 روپے ملیں گے۔</p><p class=""indent"" style=""text-align:left;"">فقط واللہ اعلم</p></p>",144306100003,banuri,"('فرائض', 'faraez')","('ترکہ کی تقسیم', 'taraka-ki-taqseem')","('ترکہ کی تقسیم کا طریقہ', 'taraka-ki-taqseem-ka-tareqa')"
