issued_at,link,title,question,answer,fatwa_number,dar_ul_ifta,kitab,bab,fasal
30-03-2020,https://www.banuri.edu.pk/readquestion/corona-say-bachnay-k-liay-alcohol-wala-hand-sanitizer-use-krna-144108200282/30-03-2020,کرونا وائرس سے بچنے کے لیے الکحل پر مشتمل Hand sanitizer  استعمال کرنا,"کرونا وائرس سے بچاؤ کے لیے ""الکحل آمیز سینیٹائزر"" کا ہاتھ دھونے کے لیے استعمال کرنا جائز ہوگا یا نہیں ؟","<p><p style=""text-align:justify;"">الکحل کی دو قسمیں ہیں:</p><p class=""indent"" style=""text-align:justify;"">(1) ایک وہ جو منقیٰ، انگور، یا کھجور کی شراب سےحاصل کی گئی ہو،  یہ بالاتفاق ناپاک  وحرام ہے، اس کا استعمال اور اس کی خریدوفروخت ناجائز ہے۔</p><p class=""indent"" style=""text-align:justify;"">(2) دوسری  وہ جو مذکورہ  بالا اشیاء کے علاوہ کسی اور چیز مثلاً جو، آلو، شہد، گنا، سبزی وغیرہ سے حاصل کی گئی ہو، اس کا استعمال اور اس کی خرید و فروخت جائز ہے،  بشر ط یہ کہ نشہ آور نہ ہو۔</p><p style=""text-align:justify;"">عام طور پر ادویات ، پرفیوم اور دیگر مرکبات  میں جو الکحل استعمال ہوتی ہے وہ انگوریا کھجور وغیرہ سے حاصل نہیں کی جاتی، بلکہ  دیگر اشیاء سے بنائی جاتی ہے، لہذا  کسی چیز  کے بارے میں جب تک  تحقیق سے ثابت  نہ ہوجائے کہ اس  میں  پہلی قسم (منقیٰ، انگور، یا کھجور کی شراب )سے حاصل شدہ الکحل ہے ، اس وقت تک اس کے استعمال کو  ناجائز اور حرام نہیں کہہ سکتے،  تاہم اگر احتیاط پر عمل کرتے ہوئے اس سے بھی اجتناب کیا جائے تو یہ زیادہ بہتر ہے۔</p><p style=""text-align:justify;""> انگوراور کھجور  کے علاوہ  دیگر ذرائع سےحاصل شدہ  ایتھائل الکحل کا استعمال ذاتی استعمال کی اشیاء میں سے خارجی استعمال کی مصنوعات   میں جائز ہے ،  مثلاً ٹوتھ پیسٹ، خوشبویات  ہاتھ صاف  کرنے کی چیزیں، اور ذاتی استعمال کی دیگر اشیاء وغیرہ ، جب کہ ان ہی مصنوعات میں اگر انگور  یا کھجور سے حاصل شدہ  ایتھائل الکحل استعمال ہو تو ان کا استعمال جائز نہیں ہے۔</p><p style=""text-align:justify;"">لہذا صورتِ مسئولہ میں کرونا وائرس یا کسی بھی بیماری  سے بچاؤ کے لیےایسے HAND  SANITIZER""  کا استعمال جس میں  انگور اور کھجور سے حاصل شدہ  ایتھائل الکحل کا استعمال  کیا گیا ہو جائز نہیں، البتہ اگر اس HAND  SANITIZER""  میں انگوراور کھجور  کے علاوہ  دیگر ذرائع سےحاصل شدہ  ایتھائل الکحل کا استعمال  کیا جاتاہے تو اس کا استعمال جائز ہوگا۔فقط واللہ اعلم</p></p>",144108200282,banuri,"('حظر و اباحت', 'mamnooaat-mubahat')","('علاج / معالجہ', 'ilaj-mualaja')","('حرام اشیاء سے علاج و دوا', 'haram-ashya-say-ilaj-o-dawa')"
25-04-2020,https://www.banuri.edu.pk/readquestion/roze-ki-halat-main-nzale-ki-waja-se-vicks-inhilar-ka-istemal-karna-144109200170/25-04-2020,روزہ کی حالت میں نزلہ کی وجہ سے وکس انہیلر کا استعمال کر نا,روزے کے دوران اگر نزلہ ہوجائے اور چھینکیں آنے لگیں تو کیا سونگھنے والا انہیلر جیسا کہ وکس کا آتا ہے اور صرف سونگھنے سے بند ناک کھل جاتی ہے اور نزلہ میں آرام آجاتا ہے،  استعمال کرسکتے ہیں؟,"<p><p style=""text-align:justify;"">انہیلر  کے استعمال سے دوائی کے ذرات جسم میں داخل ہوتے ہیں، اس لیے روزے کی حالت میں اس کا استعمال درست نہیں،  اس کے استعمال سے روزہ ٹوٹ جائے گا اور  قضا لازم ہو گی۔</p><p style=""text-align:justify;"">البتہ  روزہ کی حالت میں ناک کے اوپر یا اس کے اطراف میں وکس بام لگانا یا وکس بام اس طرح سونگھنا کہ اس کے ذرات ناک کے اندر نہ جائیں، جائز ہے،  اس سے روزہ فاسد نہیں ہوتا۔</p><p style=""text-align:justify;""><span class=""ar_writing"">الدر المختار وحاشية ابن عابدين (رد المحتار) (2/ 395):<br/></span></p><p class=""indent"" style=""text-align:justify;""><span class=""ar_writing"">"" ولايتوهم أنه كشم الورد ومائه والمسك لوضوح الفرق بين هواء تطيب بريح المسك وشبهه وبين جوهر دخان وصل إلى جوفه بفعله، إمداد""</span>.</p><p class=""indent"" style=""text-align:left;""> فقط واللہ اعلم</p></p>",144109200170,banuri,"('روزہ', 'soum')","('روزہ', 'roza')","('روزہ توڑنے والی اشیاء', 'roza-tornay-wali-ashya')"
28-03-2020,https://www.banuri.edu.pk/readquestion/ghar-main-bajamat-namaz-ki-sorat-main-azan-ka-hukum-144108200203/28-03-2020,گھر میں باجماعت نماز کی صورت میں اذان کا حکم,اگر  ہم  نماز گھر میں جماعت کے ساتھ پڑھا رہے ہوں تو اذان دینا ضروری ہے جب کہ جس گھر میں نماز ہو رہی ہے وہاں اذان کی آواز آتی ہو ؟,"<p><p style=""text-align:justify;"">اگر محلہ  کی مسجد میں اذان ہوتی ہو اور گھر میں اس کی آواز آرتی ہو تو  گھر  میں جماعت کرواتے وقت اذان و اقامت دینا ضروری نہیں ہے،  بلکہ محلہ کی اذان کافی ہے، البتہ افضل طریقہ یہ ہے کہ گھر میں بھی اذان اور اقامت دونوں یا کم از کم اقامت کے ساتھ ہی جماعت کروائی جائے۔</p><p style=""text-align:justify;""><span class=""ar_writing"">الدر المختار وحاشية ابن عابدين (رد المحتار) (1/ 395):</span></p><p class=""indent"" style=""text-align:justify;""><span class=""ar_writing"">(وكره تركهما) معًا (لمسافر) ولو منفردًا (وكذا تركها) لا تركه لحضور الرفقة (بخلاف مصل) ولو بجماعة (وفي بيته بمصر) أو قرية لها مسجد؛ فلايكره تركهما إذ أذان الحي يكفيه"".</span></p><p class=""indent"" style=""text-align:justify;""><span class=""ar_writing"">""(قوله: في بيته) أي فيما يتعلق بالبلد من الدار والكرم وغيرهما، قهستاني. وفي التفاريق: وإن كان في كرم أو ضيعة يكتفي بأذان القرية أو البلدة إن كان قريبًا وإلا فلا. وحد القرب أن يبلغ الأذان إليه منها اهـ إسماعيل. والظاهر أنه لايشترط سماعه بالفعل، تأمل.<br/>(قوله: لها مسجد) أي فيه أذان وإقامة، وإلا فحكمه كالمسافر صدر الشريعة.<br/>(قوله: إذ أذان الحي يكفيه) لأن أذان المحلة وإقامتها كأذانه وإقامته؛ لأن المؤذن نائب أهل المصر كلهم كما يشير إليه ابن مسعود حين صلى بعلقمة والأسود بغير أذان ولا إقامة، حيث قال: أذان الحي يكفينا، وممن رواه سبط ابن الجوزي فتح: أي فيكون قد صلى بهما حكما، بخلاف المسافر فإنه صلى بدونهما حقيقةً وحكمًا؛ لأن المكان الذي هو فيه لم يؤذن فيه أصلا لتلك الصلاة كافي. وظاهره أنه يكفيه أذان الحي وإقامته وإن كانت صلاته فيه آخر الوقت تأمل، وقد علمت تصريح الكنز بندبه للمسافر وللمصلي في بيته في المصر، فالمقصود من كفاية أذان الحي نفي الكراهة المؤثمة. قال في البحر: ومفهومه أنه لو لم يؤذنوا في الحي يكره تركهما للمصلي في بيته، وبه صرح في المجتبى، وأنه لو أذن بعض المسافرين سقط عن الباقين كما لايخفى""</span>.</p><p class=""indent"" style=""text-align:left;""> فقط و الله أعلم</p></p>",144108200203,banuri,"('نماز', 'salat')","('اذان', 'azan')","('اذان و اقامت', 'azan-o-iqamat')"
01-05-2020,https://www.banuri.edu.pk/readquestion/haiz-kay-bad-ghusal-say-pehlay-hambistari-karna-144109200866/01-05-2020,حیض کے بعد غسل سے پہلے ہم بستری کرنا,حیض کے دوران غسل سے پہلے خون بند ہونے کے بعد ہم بستری جائز ہے کہ نہیں؟,"<p><p style=""text-align:justify;"">عورت کے ماہواری سے پاک ہونے میں تفصیل  یہ ہے کہ:</p><p style=""text-align:justify;"">اگر حیض اپنی پوری مدت یعنی دس دن  میں ختم ہو اہے توخون منقطع ہوتے ہی   غسل سے قبل  عورت  سے مجامعت درست ہے،اگرچہ بہتر یہ ہے کہ غسل کے بعدہم بستری کرے۔</p><p style=""text-align:justify;"">اور اگر دس دن سے پہلے ماہواری ختم ہو گئی ، مثلاً: چھ، سات روز میں اور عورت کی عادت بھی چھ یا سات روز کی تھی تو خون کے موقوف ہوتے ہی  ہم بستری درست نہیں، بلکہ حیض ختم ہونے کے بعد جب عورت غسل کر لے یا ایک نماز کا وقت گزر جائے (جس میں غسل کرکے کپڑے پہن کر نماز شروع کرسکے)  اس کے بعد مجامعت درست ہو گی۔</p><p style=""text-align:justify;"">اور اگر عادت کے ایام سے پہلے ہی خون بند ہوگیا ہو اس صورت میں عادت کے ایام مکمل ہونے سے پہلے ہم بستری جائز نہیں، ممکن ہے کہ وقتی طور پر خون بند ہواہو اور دوبارہ لوٹ کر آجائے۔</p><p style=""text-align:justify;"">فتاوی شامی میں ہے:</p><p class=""indent"" style=""text-align:justify;""><span class=""ar_writing"">''(ويحل وطؤها إذا انقطع حيضها لاكثره) بلا غسل وجوبابل ندبا.(وإن) انقطع لدون أقله تتوضأ وتصلي في آخر الوقت، وإن (لاقله) فإن لدون عادتها لم يحل، أي الوطء وإن اغتسلت؛ لأن العود في العادة غالب بحر، وتغتسل وتصلي وتصوم احتياطا، وإن لعادتها، فإن كتابية حل في الحال وإلا (لا) يحل (حتى تغتسل) أو تتيمم بشرطه(أو يمضي عليها زمن يسع الغسل) ولبس الثياب.''</span></p><p class=""indent"" style=""text-align:left;""><span class=""ar_writing"">(1/294،ط:دارالفکر)</span></p><p class=""indent"" style=""text-align:left;"">فقط واللہ اعلم</p></p>",144109200866,banuri,"('طہارت', 'taharat')","('حیض، نفاس، استحاضہ', 'hayz-nifas-istihaza')","('حیض کی تعریف اور احکام', 'haiez-ki-tareef-aur-ahkaam')"
05-04-2020,https://www.banuri.edu.pk/readquestion/gher-mustahiq-zakat-ko-zakat-dena-144108200712/05-04-2020,غیر مستحق زکوۃ کو زکوۃ دینا,کیا زکوۃ کی رقم سے کسی مقروض  کا قرضہ ادا کیا جاسکتا ہے؟ مگر وہ زکوۃکا مستحق نہیں ہے۔,"<p><p style=""text-align:justify;"">صورتِ مسئولہ میں چوں کہ مذکورہ شخص زکوۃ کا مستحق نہیں ہے، جب کہ   زکوۃ کی ادائیگی  صحیح ہونے کے لیے ضروری ہے کہ جس شخص کو زکوۃ دی جائے وہ زکوۃ کا مستحق ہو ، لہذا مذکورہ مقروض شخص کو زکوۃ کی رقم دینے سے زکوۃ ادا نہیں ہوگی۔فقط واللہ اعلم</p></p>",144108200712,banuri,"('زکات', 'zakat')","('زکوٰۃ / صدقات', 'zakat-sadaqat')","('ادائے زکوٰۃ', 'adaye-zakat')"
01-05-2020,https://www.banuri.edu.pk/readquestion/teen-mardon-or-teen-oorto-ka-juma-ki-namaz-parhna-144109200819/01-05-2020,تین مردوں اور تین عورتوں کا جمعہ کی نماز پڑھنا,ہم نے صرف تین مرد،تین عورتوں  نے گھر میں جمعہ  پڑھ  لی تھی، اب کیا کرنا ہوگا؟,"<p><p style=""text-align:justify;"">واضح  رہے کہ جمعہ کے صحیح ہونے کے لیے شرط یہ  ہے کہ امام سمیت چار بالغ مرد ہوں، لہذا صورتِ مسئولہ میں اگر آپ لوگ امام سمیت صرف تین مرد تھے تو جمعہ درست نہیں ہوا، آپ لوگوں پر ظہر کی قضا  لازم  ہے۔</p><p style=""margin-left:0;margin-right:0;text-align:right;""><span class=""ar_writing""><span style=""color:#000;"">الدر المختار وحاشية ابن عابدين  (2 / 151) :</span></span></p><p class=""indent"" style=""margin-left:0;margin-right:0;text-align:justify;""><span class=""ar_writing""><span style=""color:#000;"">""(و) السادس: (الجماعة) وأقلها ثلاثة رجال.""</span></span></p><p style=""margin-left:0;margin-right:0;text-align:right;""><span style=""color:#000;""><span class=""ar_writing"">و في الرد:</span></span></p><p class=""indent"" style=""margin-left:0;margin-right:0;text-align:justify;""><span style=""color:#000;""><span style=""color:#000;""><span class=""ar_writing"">""و احترز بالرجال عن النساء و الصبيان فإن الجمعة لاتصح بهم وحدهم لعدم صلاحيتهم للإمامة فيها بحال، بحر عن المحيط.""</span></span></span></p><p class=""indent"" style=""margin-left:0;margin-right:0;text-align:left;""><span style=""color:#000;""><span style=""color:#000;"">فقط و اللہ اعلم</span></span></p></p>",144109200819,banuri,"('نماز', 'salat')","('جمعہ کی نماز', 'jumaa')","('جمعہ و عیدین', 'juma-o-eidayn')"
11-08-2021,https://www.banuri.edu.pk/readquestion/kia-hazrt-hasan-or-hazrt-husaen-razia-allah-anhuma-kay-wasilah-say-dua-mangn-saktay-hain-144301200126/11-08-2021,کیا حضرت حسن اور حسین رضی اللہ عنہما کے وسیلہ سے دعا مانگ سکتے  ہیں؟,کیا امام حسن اور حسین رضی اللہ عنہما کے وسیلے  سے دعا مانگ سکتے  ہیں؟,"<p><p style=""text-align:justify;""><span class=""ur_writing""><span lang=""ar-sa"" xml:lang=""ar-sa"">اللہ تعالی سے حضرت حسن اور حضرت حسین رضی اللہ عنہما کے وسیلہ سے دعا مانگنا جائز ہے، البتہ وسیلے کو ضروری سمجھنا یا یہ عقیدہ رکھنا کہ وسیلہ کے بغیر اللہ تعالی دعا قبول نہیں کرتا،</span>  یہ غلط ہے،  اور یاد رہے کہ کسی پیغمبر  یا صحابی یا ولی  سے دعا مانگنایا اپنی حاجت کا سوال کرنا  وسیلہ نہیں، بلکہ شرک ہے، اس سے بچنا ضروری ہے۔</span></p><p><span class=""ur_writing"" lang=""ar-sa"" xml:lang=""ar-sa"">فتاوی شامی میں ہے: </span></p><p class=""indent"" dir=""rtl"" style=""text-align:justify;""><span class=""ar_writing"" lang=""ar-sa"" xml:lang=""ar-sa"">""وقال السبكي: يحسن التوسل بالنبي إلى ربه، ولم ينكره أحد من السلف و لا الخلف إلا ابن تيمية؛ فابتدع ما لم يقله عالم قبله.""</span></p><p class=""indent"" dir=""rtl"" style=""text-align:left;""><span class=""ar_writing""><span lang=""ar-sa"" xml:lang=""ar-sa"">(</span><span lang=""ar-sa"" xml:lang=""ar-sa"">كتاب الحظر والإباحة، (6/ 397)، ط. سعيد)</span></span></p><p dir=""rtl"" style=""margin:0 0 30px;color:#323232;line-height:36px;font-weight:bold;font-size:17px;font-family:Nafees,'Helvetica Neue',Helvetica,Arial,sans-serif;background-color:#fff;text-align:justify;""><span class=""ur_writing""><span lang=""ar-sa"" xml:lang=""ar-sa"">حجة الله البالغة</span><span dir=""ltr""> </span><span lang=""ar-sa"" xml:lang=""ar-sa"">میں ہے</span><span dir=""ltr"">:</span></span></p><p class=""indent"" dir=""rtl"" style=""text-align:justify;""><span class=""ar_writing"">""ومن آداب الدعاء تقديم الثناء على الله والتوسل بنبي الله، ليستجاب الدعاء.""</span></p><p class=""indent"" style=""text-align:left;""><span class=""ar_writing"">(ابواب الصلاة، الأمور التي لا بد منها في الصلاة (2/ 10)،ط. دار الجيل، بيروت)</span></p><p class=""indent"" style=""margin:0 0 30px;color:#323232;line-height:36px;font-weight:bold;font-size:17px;font-family:Nafees,'Helvetica Neue',Helvetica,Arial,sans-serif;background-color:#fff;text-align:left;"">فقط واللہ اعلم</p></p>",144301200126,banuri,"('ایمان و عقائد', 'aqaed')","('اسلامی عقائد', 'islami-aqaed')","('وسیلہ', 'wasila')"
26-03-2020,https://www.banuri.edu.pk/readquestion/maghrib-ki-azan-sy-pehly-ghar-ki-khirhki-or-darwazy-band-karny-ka-hukum-144108200064/26-03-2020,مغرب کی اذان سے پہلے گھر کے دروازے اور کھڑکیاں بند کرنے کا حکم,کیا مغرب کی اذان سے پہلے گھر کے دروازے اور کھڑکیاں بند کرنے کا حکم آیا ہے؟ برائے مہربانی قرآن اور حدیث کی روشنی میں راہ نمائی  فرمایئے۔,"<p><p style=""text-align:justify;"">حدیث شریف میں رات کی تاریکی چھانے کے وقت دروازے بند کرنے کا ذکر ہے؛ غروبِ آفتاب سے لے کر عشاء کا وقت داخل ہونے تک شیاطین وجنات کا گزر ہوتا ہے، جس کی وجہ سے رسولِ اکرم صلی اللہ علیہ وسلم نے اس وقت بچوں کو باہر چھوڑنے سے بھی منع فرمایا ہے اور  اس کے بعد دروازے بند کرنے اور برتن وغیرہ ڈھانکنے کا بھی ارشاد فرمایا ہے، جیساکہ صحیح بخاری میں ہے:</p><p class=""indent"" style=""text-align:justify;""><span class=""ar_writing"">حدثنا يحيى بن جعفر قال حدثنا محمد بن عبد الله الأنصاري حدثنا ابن جريج قال أخبرني عطاء عن جابر رضي الله تعالى عنه عن النبي صلى الله عليه وسلم قال: إذا استجنح الليل أو كان جنح الليل فكفوا صبيانكم فإن الشياطين تنتشر حينئذ فإذا ذهب ساعة من العشاء فخلوهم وأغلق بابك واذكر اسم الله وأطفىء مصباحك واذكر اسم الله وأوك سقاءك واذكر اسم الله وخمر إناءك واذكر اسم الله ولو تعرض عليه شيئًا. </span></p><p class=""indent"" style=""text-align:justify;""><span class=""ar_writing"">ذكر معناه: قوله: (إذا استجنح) أي: إذا أظلم، ومادته: جيم ونون وحاء، وقال ابن سيده: جنح الليل يجنح جنوحا وجنحا إذا أظلم، ويقال: إذا أقبل ظلامه، والجنح، بضم الجيم وكسرها لغتان: وهو ظلام الليل، وأصل الجنح الميل. وقيل: جنح الليل أول ما يظلم. قوله: (أو كان جنح الليل) وفي رواية الكشميهني: أو قال: كان جنح الليل، وحكى عياض أنه وقع في رواية أبي ذر: استجنع، بالعين المهملة بدل الحاء، وهو تصحيف، وعند الأصيلي: وأول الليل بدل: قوله: إذا كان جنح الليل، وكان هذه تامة بمعنى وجد أو حصل.</span></p><p class=""indent"" style=""text-align:justify;""><span class=""ar_writing"">قال أبو حميد: إنما أمر بالأسقية إن توكأ ليلا، وبالأبواب أن تغلق ليلا انتهى. فهذا أبو حميد قيد الإيكاء والإغلاق بالليل. قلت: قال النووي: ليس في الحديث ما يدل عليه، والمختار عند الأصوليين، وهو مذهب الشافعي، رضي الله تعالى عنه، أن تفسير الصحابي إذا كان خلاف ظاهر اللفظ ليس بحجة، ولا يلزم غيره من المجتهدين موافقته على تفسيره. وأما إذا كان في ظاهر الحديث ما يخالفه فإن كان مجملا يرجع إلى تأويله، ويجب الحمل عليه لأنه إذا كان مجملا لا يحل له حمله على شيء إلا بتوقيف، وكذا لا يجوز تخصيص العموم بمذهب الراوي عندنا، بل يتمسك بالعموم، وقد يقال: أبو حميد قال: أمرنا، وهذا رواية لا تفسير، وهو مرفوع على المختار، ولا تنافي بين رواية أبي حميد والرواية الأخرى في يوم، إذ ليس في أحدهما نفي للآخر وهما ثابتان. فإن قلت: ما حكم أوامر هذا الباب؟ قلت: جميعها من باب الإرشاد إلى المصلحة الدنيوية، كقوله تعالى: {واشهدوا إذا تبايعتم} و ليس على الإيجاب، وغايته أن يكون من باب الندب، بل قد جعله كثير من الأصوليين قسما منفردا بنفسه عن الوجوب والندب، وينبغي للمرء أن يمتثل أمره، فمن امتثل أمره سلم من الضرر بحول الله وقوته، ومتى والعياذ بالله خالف إن كان عنادا خلد فاعله في النار، وإن كان عن خطأ أو غلط فلا يحرم شرب ما في الإناء أو أكله، والله أعلم.</span></p><p class=""indent"" style=""text-align:left;""><span class=""ar_writing"">(عمدة القاري شرح صحيح البخاري،كتاب بدء الخلق، باب صفة إبليس وجنوده 15 / 173 ط:دار إحياء التراث العربي)</span></p><p class=""indent"" style=""text-align:left;""><span class=""ar_writing""> </span>فقط و اللہ اعلم</p></p>",144108200064,banuri,"('حقوق و آدابِ معاشرت', 'huqooq-muashret')","('آدابِ معاشرت', 'akhlaq-aadab')","('اٹھنے، بیٹھنے، سونے، چلنے پھرنے کے آداب', 'uthnay-bethnay-chalnay-phirnay-k-aadab')"
