issued_at,link,title,question,answer,fatwa_number,dar_ul_ifta,kitab,bab,fasal
06-03-2021,https://www.banuri.edu.pk/readquestion/ges-campresar-istmal-karny-ka-hukm-144207201208/06-03-2021,گیس کمپریسر استعمال کرنے کا حکم,آج کل ہمارے علاقے میں ہر گھر میں گیس کمپریسر موجود ہے جو گیس کی قلت کی وجہ سے استعمال کیا جاتا ہے۔اس کا استعمال شرعی طور پر کیسا ہے؟میں نے اپنے گاؤں کے قاری صاحب سے پوچھا تو انہوں نے کہا گیس کمپریسر استعمال کر سکتے ہیں ؛ کیوں کہ جو گیس استعمال کی جاتی ہے اس کا بل ادا کیا جاتا ہے۔ مزید یہ کہ ہمارے ہم سایوں نے بھی اپنے اپنے گھروں میں گیس کمپریسر  لگائے ہوئے ہیں!,"<p><p style=""text-align:justify;"">بصورتِ مسئولہ گیس کی قلت کی وجہ سے زیادہ گیس کھینچنے کے لیے گیس کمپریسر یا اس طرح کے دوسرے آلات لگاناشرعاً جائز نہیں ہے، نیز مذکورہ عمل کرنے کی صورت میں بل اگرچہ پورا ادا کردیا جاتا ہے تاہم یہ عمل مندرجہ ذیل  کئی  مفاسد پر مشتمل ہے جس سے ہر مسلمان کو احتراز کرنا چاہیے:</p><p class=""indent"" style=""text-align:justify;"">1:مذکورہ عمل سے دوسرے لوگوں کو تکلیف اور ضرر لاحق ہوتا ہے،ظاہر ہے کہ جب گیس کا پریشر کم ہوگااور گیس کمپریسر کے ذریعہ گیس کھینچ لی جائے تو  آس پاس کے لوگوں کو گیس کی سپلائی متاثر ہوگی اور وہ اس معمولی گیس سے بھی محروم ہوجائیں گے،اور جو چیز عام لوگوں کی تکلیف کا ذریعہ بنے اس کا استعمال شرعاً جائز نہیں ہوتا ہے۔<br/>2: مذکورہ عمل یعنی گیس کھینچنے کے لیے گیس کمپریسر کا استعمال  خطرے اور حادثے (گیس دھماکے  جیسے واقعات)کا باعث بھی بن سکتاہے۔</p><p class=""indent"" style=""text-align:justify;"">3:  گیس کا استعمال کمپریسر کے ذریعہ  قانوناً بھی جرم ہے،اور مفادِ عامہ کے خاطر حکومتی پابندی کی پاس داری کرنا ہر مسلمان کا شیوہ ہے۔</p><p>تاہم جن علاقوں میں گیس کی کمی ہے تو وہاں کے باشندگاں بجائے اس عمل کےاپنی ضروریات ایسے اوقات میں پوری  کریں کہ جن اوقات میں  گیس معمول کے مطابق ہو  یا جس قدر گیس مہیا ہواسی پر اکتفا کرلیاجائے، اس صورت میں وقت کاخرچ اور مشقت ضرور ہوگی،  تاہم دوسروں کو ان کے حق سے محروم کرنے اور قانون شکنی جیسے گناہ سے آدمی محفوظ رہے گا۔</p><p style=""text-align:justify;"">فيض القدير شرح الجامع الصغیر میں ہے:</p><p class=""indent"" style=""text-align:justify;""><span class=""ar_writing"">""( لا ضرر ) أي لايضر الرجل أخاه فينقصه شيئا من حقه ( ولا ضرار ) فعال بكسر أوله أي لا يجازي من ضره بإدخال الضرر عليه بل يعفو فالضرر فعل واحد والضرار فعل اثنين أو الضرر ابتداء الفعل والضرار الجزاء عليه والأول إلحاق مفسدة بالغير مطلقا والثاني إلحاقها به على وجه المقابلة أي كل منهما يقصد ضرر صاحبه بغير جهة الاعتداء بالمثل وقال الحرالي : الضر بالفتح والضم ما يؤلم الظاهر من الجسم وما يتصل بمحسوسه في مقابلة الأذى وهو إيلام النفس وما يتصل بأحوالها وتشعر الضمة في الضر بأنه عن قهر وعلو والفتحة بأنه ما يكون من مماثل أو نحوه اه . وفيه تحريم سائر أنواع الضرر إلا بدليل لأن النكرة في سياق النفي تعم وفيه حذف أصله لا لحوق أو إلحاق أو لا فعل ضرر أو ضرار بأحد في ديننا أي لايجوز شرعًا إلا لموجب خاص وقيد النفي بالشرع لأنه بحكم القدر الإلهي لاينبغي وأخذ منه الشافعية أن للجار منع جاره من وضع جذعه على جداره وإن احتاج وخالف أحمد تمسكا بخبر لا يمنع أحد جاره أن يضع خشبته على جداره ومنعه الشافعية بأن فيه جابر الجعفي ضعفوه وبفرض صحته [ ص 432 ] فقد قال ابن جرير : هو وإن كان ظاهره الأمر لكن معناه الإباحة والإطلاق بدليل هذا الخبر وخبر إن دماءكم وأموالكم عليكم حرام .""</span></p><p class=""indent"" dir=""ltr"" style=""text-align:justify;""><span class=""ar_writing""> (باب حرف "" لا ""، رقم الحديث:9899، ج:6، ص:431، ط:داراحياء التراث العربى)</span></p><p style=""text-align:justify;"">فتاوی شامی میں ہے:</p><p class=""indent"" style=""text-align:justify;""><span class=""ar_writing"">""(و) كره (احتكار قوت البشر) كتبن وعنب ولوز (والبهائم) كتبن وقت (في بلد يضر بأهله) لحديث «الجالب مرزوق والمحتكر ملعون» فإن لم يضر لم يكره</span></p><p class=""indent"" style=""text-align:justify;""><span class=""ar_writing"">(قوله وكره احتكار قوت البشر) الاحتكار لغة: احتباس الشيء انتظارا لغلائه والاسم الحكرة بالضم والسكون كما في القاموس، وشرعا: اشتراء طعام ونحوه وحبسه إلى الغلاء أربعين يوما لقوله - عليه الصلاة والسلام - «من احتكر على المسلمين أربعين يوما ضربه الله بالجذام والإفلاس» وفي رواية «فقد برئ من الله وبرئ الله منه» قال في الكفاية: أي خذله والخذلان ترك النصرة عند الحاجة اهـ وفي أخرى «فعليه لعنة الله والملائكة والناس أجمعين لا يقبل الله منه صرفا ولا عدلا» الصرف: النفل، والعدل الفرض شرنبلالية عن الكافي وغيره وقيل شهرا وقيل أكثر وهذا التقدير للمعاقبة في الدنيا بنحو البيع وللتعزير لا للإثم لحصوله وإن قلت المدة وتفاوته بين تربصه لعزته أو للقحط والعياذ بالله تعالى در منتقى مزيدا، والتقييد بقوت البشر قول أبي حنيفة ومحمد وعليه الفتوى كذا في الكافي، وعن أبي يوسف كل ما أضر بالعامة حبسه، فهو احتكار وعن محمد الاحتكار في الثياب ابن كمال.</span></p><p class=""indent"" style=""text-align:justify;""><span class=""ar_writing"">(قوله في بلد) أو ما في حكمه كالرستاق والقرية قهستاني (قوله يضر بأهله) بأن كان البلد صغيرا هداية (قوله والمحتكر ملعون) أي مبعد عن درجة الأبرار، ولا يراد المعنى الثاني للعن وهو.""</span></p><p class=""indent"" dir=""rtl"" style=""text-align:left;""><span class=""ar_writing"">(كتاب الحظر والاباحة،ج:6، ص:398، ط:ايج ايم سعيد)</span></p><p class=""indent"" dir=""rtl"" style=""text-align:left;"">فقط والله اعلم </p></p>",144207201208,banuri,"('حظر و اباحت', 'mamnooaat-mubahat')","('متفرقات', 'mutafarriqaat')","('متفرقات ممنوعات و مباحات', 'muatafarriqaat-e-mamnooaat-o-mubahaat')"
04-03-2021,https://www.banuri.edu.pk/readquestion/emam-sy-pehly-salam-pherny-ki-sorat-me-muqtadi-ki-namaz-ka-hukum-144207201153/04-03-2021,امام سے پہلے سلام پھیرنے کی صورت میں مقتدی کی نماز کاحکم,کیا فرماتے ہیں علمائے دین و مفتیانِ کرام اس مسئلہ میں کہ اگر مقتدی بغیر کسی عذر کے امام سے قبل ہی سلام پھیر دے تو اس کی نماز کا کیا حکم ہے؟ یعنی ایسا کرنا مکروہِ تحریمی ہے؟ اور دوسرا امام کی اقتدا شرائط نماز میں سےہے تو کیا ان افعال کے مرتکب کی نماز واجب الاعادہ ہوگی یا نہیں؟,"<p><p style=""text-align:justify;""><span class=""ur_writing"">اگر کسی مقتدی نے امام سے پہلے سلام پھیر دیا، اس کے بعد امام نے سلام پھیرا  تو مقتدی کی نماز تو ہوگئی، البتہ مقتدی کے لیے ایسا کرنا مکروہِ تحریمی ہے، تاہم نماز کا اعادہ واجب نہیں ہے،  ہاں اگر سہواً یا کسی عذر  کی وجہ سے  یا وضو ٹوٹ  جانے کا خوف ہو یا سخت مجبوری کی وجہ سے سلام پھیرا تو نماز مکروہ نہیں ہوگی۔</span></p><p style=""text-align:justify;""><span class=""ar_writing"">وفي الدر المختار وحاشية ابن عابدين:</span></p><p class=""indent"" style=""text-align:justify;""><span class=""ar_writing"">""ولو أتمه قبل إمامه فتكلم جاز وكره.</span></p><p class=""indent"" style=""text-align:justify;""><span class=""ar_writing"">(قوله: لو أتمه إلخ) أي لو أتمّ المؤتم التشهد، بأن أسرع فيه وفرغ منه قبل إتمام إمامه فأتى بما يخرجه من الصلاة كسلام أو كلام أو قيام جاز: أي صحت صلاته؛ لحصوله بعد تمام الأركان؛ لأن الإمام وإن لم يكن أتم التشهد لكنه قعد قدره؛ لأن المفروض من القعدة قدر أسرع ما يكون من قراءة التشهد وقد حصل، وإنما كره للمؤتم ذلك؛ لتركه متابعة الإمام بلا عذر، فلو به كخوف حدث أو خروج وقت جمعة أو مرور مار بين يديه فلا كراهة، كما سيأتي قبيل باب الاستخلاف (قوله: فلو عرض مناف) أي بغير صنعه كالمسائل الاثني عشرية وإلا بأن قهقه أو أحدث عمداً فلاتفسد صلاة الإمام أيضاً كما مر.""</span><span style=""font-family:arabic_font;font-size:23px;font-weight:600;""> </span><span style=""font-family:arabic_font;font-size:23px;font-weight:600;"">(رد المحتار1/ 525ط:سعيد)</span><span style=""font-family:arabic_font;font-size:23px;font-weight:600;""> </span></p><p class=""indent"" style=""text-align:left;"">فقط واللہ اعلم</p></p>",144207201153,banuri,"('نماز', 'salat')","('امامت کا بیان', 'imamat')","('امام کی اتباع اور مخالفت', 'imam-ki-itteba-aur-mukhalifat')"
01-03-2021,https://www.banuri.edu.pk/readquestion/yumna-name-rakhne-par-aik-ishkal-ka-jawab-144207201007/01-03-2021,یمنی نام رکھنے پر ایک اشکال کا جواب,"میں نے اپنی بیٹی کا نام ""یمنی""  رکھا ہے۔ آپ کے بتائے ہوئے فتوی نمبر: 144110200029 میں اس کے معنی برکت والی کے ہیں، جب کہ  قرآنِ مجید کی سورۂ  قیامہ  میں آیت نمبر 37 میں لفظِ ""یمنی""  آیا ہے جس کے معنی ہیں ٹپکی۔  برائے مہربانی دوبارہ سے اسے دیکھ کے بتائیں کہ  یہ نام بچی کا رکھا جائے یا نہيں ؟","<p><p style=""text-align:justify;"">عربی زبان میں ظاہری طور پر ایک جیسے نظر آنے  والے الفاظ کے معنی  ایک  جیسے ہوں ،یہ ضروری نہیں ہے،بسا اوقات  ان کے حروف اصلیہ مختلف ہوتے ہیں اور اس  وجہ سے دونوں کے معنی  بھی الگ  ہوتے ہیں، بسا اوقات ایک فعل (Verb) ہوتا ہے اور ایک اسم (noun) ہوتا ہے،  اور کبھی ایک ہی لفظ مختلف معانی میں بھی استعمال ہوتا ہے۔</p><p style=""text-align:justify;""> سابقہ جواب میں <span style=""background-color:#fff;color:#333;font-family:'Jameel Noori Nastaleeq';font-size:20px;"">’’یمنیٰ‘‘  (<span class=""ar_writing qr_writing"">یُمْنیٰ</span>)  کا جو معنی آپ  کو بتایا گیا تھا  وہ بالکل درست ہے،  یہ  <span class=""qr_writing"">""</span></span><span class=""qr_writing"" style=""background-color:#fff;color:#333;font-family:arabic_font;font-size:23px;font-weight:600;"">یُمْنیٰ</span><span style=""background-color:#fff;color:#333;font-family:'Jameel Noori Nastaleeq';font-size:20px;""><span class=""qr_writing"">""</span> اسم ہے، اور اس کے حروف اصلی <span class=""ar_writing"">""ی، م، ن""</span>   ہیں، اس کے    مختلف معانی آتے ہیں، برکت والا ہونا، طاقت ، دائیں طرف وغیرہ، اور لڑکیوں کا نام اسی معنی کے اعتبار سے ہے۔</span></p><p style=""text-align:justify;""><span style=""background-color:#fff;color:#333;font-family:'Jameel Noori Nastaleeq';font-size:20px;"">اور جو آپ نے  سورۂ قیامہ  کی آیت کا ذکر کیا ہے ، وہ آیت یہ ہے<span class=""qr_writing"">""</span></span><span class=""qr_writing"">{ أَلَمْ يَكُ نُطْفَةً مِنْ مَنِيٍّ يُمْنٰى} [القيامة:</span>37<span class=""qr_writing"">]</span><span style=""background-color:#fff;color:#333;font-family:'Jameel Noori Nastaleeq';font-size:20px;"">"" یہاں جو ""یمنی""  مذکور ہے، یہ اسم نہیں ہے، بلکہ فعل ہے،  اور اس کے حروف اصلی بھی الگ ہیں،     یہ<span class=""ar_writing"">""م، ن، ی""</span>  سے بنا  ہے،  جس کے معنی پانی کا ٹپکنا، اترنا، منی کا نکلنا، اور قرآن مجید میں اسی کا ذکر ہے۔</span></p><p style=""text-align:justify;""><span style=""background-color:#fff;color:#333;font-family:'Jameel Noori Nastaleeq';font-size:20px;"">لہذا آپ اپنی بیٹی کا نام </span><span style=""background-color:#fff;color:#333;font-family:'Jameel Noori Nastaleeq';font-size:20px;"">’’یمنیٰ‘‘ (<span class=""ar_writing"">یُمْنیٰ</span>) رکھ سکتے ہیں، اس کا معنی ""برکت والی"" ہے۔</span></p><p style=""text-align:justify;""><span class=""ar_writing"">تاج العروس (36 / 302):</span></p><p class=""indent"" style=""text-align:justify;""><span class=""ar_writing"">""يمن</span><span class=""ar_writing"">: ( {اليُمْنُ، بالضَّمِّ: البَرَكَةُ) ؛) وَقد تَكَرَّرَ ذِكْرُه فِي الحدِيثِ، وَهُوَ ضِدُّ الشُّؤْمِ؛ (} كالمَيْمَنَةِ) ؛) وَبِه فسِّرَ قَوْلُه تَعَالَى: <span class=""qr_writing"">{أُولَئِكَ أَصْحابُ {المَيْمِنَةِ}</span>، أَي كَانُوا} مَيامِينَ على أَنْفُسِهم غَير مَشَائِيم، وجَمْعُ {المَيْمَنَةِ} مَيَامِنُ، وَقد ( {يَمِنَ) الرَّجُلُ، (كعَلِمَ وعُنِيَ وجَعَلَ وكَرُمَ) ،} يُمْناً، (فَهُوَ {مَيْمونٌ} وأَيْمَنُ {ويامِنٌ} ويمينٌ) . </span><span class=""ar_writing"">(وَفِي الصِّحاحِ: {يُمِنَ فلانٌ على قوْمِه فَهُوَ} مَيْمونٌ إِذا صارَ مُبارَكاً عَلَيْهِم، ويَمَنَهُم، فَهُوَ {يامِنٌ، مِثْلُ شُئِمَ وشَأَمَ.</span><span class=""ar_writing"">وَفِي المُحْكَم: يَمَنَه اللَّهُ يُمْناً، فَهُوَ مَيْمُونٌ، واللَّهُ} اليَامِنُ؛ {واليَمِينُ} واليَامِنُ، كالقَدِيرِ والقَادِرِ؛ قالَ:</span></p><p class=""indent"" style=""text-align:justify;""><span class=""ar_writing"">بَيْتُكَ فِي {اليامِنِ بَيْتُ} الأيْمَنِ  (ج {أَيامِنُ) جَمْعُ} أَيْمَن، (و) جَمْعُ {المَيْمونِ (} مَيامِينُ. </span><span class=""ar_writing"">( {وتَيَمَّنَ بِهِ) وبرأْيِه (} واسْتَيْمَنَ) :) أَي تَبَرَّكَ بِهِ. </span><span class=""ar_writing"">(وقَدِمَ على {أَيْمَنِ} اليَمِينِ: أَي {اليُمْنِ)؛) كَمَا فِي الصِّحاحِ.</span><span class=""ar_writing"">وَفِي المُحْكَم: قَدِمَ على أَيْمَنِ اليُمْنِ: أَي على اليُمْنِ. </span><span class=""ar_writing"">(} واليَمِينُ: ضِدُّ اليَسارِ، ج {أَيْمُنٌ) بضمِّ الميمِ وفتحِها، (} وأَيْمانٌ {وأَيامِنُ) جَمْعُ أَيْمَنَ، (} وأَيامِينُ) جَمْعُ أَيْمانٍ. </span><span class=""ar_writing"">(و) {اليَمِينُ: (البَرَكَةُ.""</span></p><p style=""text-align:justify;""><span class=""ar_writing"">القاموس المحيط (1 / 1336):</span></p><p class=""indent"" style=""text-align:justify;""><span class=""ar_writing"">""والمَنِيُّ، كَغَنِيٍّ وكإلى، </span><span class=""ar_writing"">والمَنْيَةُ، كَرَميَةٍ: ماءُ الرَّجلِ والمرأةِ </span><span class=""ar_writing"">ج: مُنْيٌ، كقُفْلٍ، </span><span class=""ar_writing"">ومَنَى وأمْنَى ومَنَّى: بمعنًى.</span><span class=""ar_writing"">واسْتَمْنَى: طَلَبَ خُرُوجَه. </span><span class=""ar_writing"">ومِنَى، كإلى: ة بمكةَ، وتُصْرَفُ، سُمِّيَتْ لِما يُمْنَى بها من الدِّماءِ. </span><span class=""ar_writing"">ابنُ عباسٍ: لأنَّ جبريلَ، عليه السلامُ، لَمَّا أرادَ أن يُفارِقَ آدمَ، قال له: تَمَنَّ. قال: أَتَمَنَّى الجَنَّةَ، فَسُمِّيَتْ </span><span class=""ar_writing"">مِنًى، لأُمْنِيَّةِ آدمَ، وع آخَرُ بنَجْدٍ، وماءٌ قُرْبَ ضَرِيَّةَ. </span><span class=""ar_writing"">وأمْنَى وامْتَنَى: أتَى مِنَى، أو نَزَلَها.""</span></p><p class=""indent"" dir=""rtl"" style=""text-align:left;"">فقط واللہ اعلم</p></p>",144207201007,banuri,"('حظر و اباحت', 'mamnooaat-mubahat')","('نام، لقب، کنیت', 'asaami')","('ناموں کے معانی اور احکام', 'namoun-ke-mani-or-ahkaam')"
26-02-2021,https://www.banuri.edu.pk/readquestion/tambaco-ki-fasal-kasht-karna-144207200811/26-02-2021,تمباکو کی فصل کاشت کرنا,کیا ہم تمباکو کی فصل کاشت کرسکتے ہیں؟,"<p><p style=""text-align:justify;"">تمباکو کی فصل کاشت کرنا اور اس کو فروخت کرنا جائز ہے۔</p><p>فتاویٰ محمودیہ (۱۸ ؍ ۳۹۷ ) میں ہے:</p><p class=""indent"">""تمباکو کی کاشت بھی جائز ہے اور تجارت بھی جائز ہے، استعمال بھی جائز ہے، الا یہ کہ وہ نشہ آور ہو، تب منع کیا جائے گا، مسجد میں جانے کے لیے منہ صاف کر کے اس کی  بدبو کو  زائل کر نے کا اہتمام کیا جائے‘‘۔</p><p style=""text-align:justify;""><span class=""ar_writing"">الدر المختار وحاشية ابن عابدين (رد المحتار) (6/ 460):</span></p><p class=""indent"" style=""text-align:justify;""><span class=""ar_writing"">""وفي الأشباه في قاعدة: الأصل الإباحة أو التوقف، ويظهر أثره فيما أشكل حاله كالحيوان المشكل أمره والنبات المجهول سمته اهـ قلت: فيفهم منه حكم النبات الذي شاع في زماننا المسمى بالتتن فتنبه. (قوله: ربما أضر بالبدن) الواقع أنه يختلف باختلاف المستعملين ط (قوله: الأصل الإباحة أو التوقف) المختار الأول عند الجمهور من الحنفية والشافعية كما صرح به المحقق ابن الهمام في تحرير الأصول (قوله: فيفهم منه حكم النبات) وهو الإباحة على المختار أو التوقف. وفيه إشارة إلى عدم تسليم إسكاره وتفتيره وإضراره، وإلا لم يصح إدخاله تحت القاعدة المذكورة ولذا أمر بالتنبه"".</span></p><p class=""indent"" dir=""rtl"" style=""text-align:left;"">فقط والله اعلم</p></p>",144207200811,banuri,"('بیوع', 'buyoo')","('بیع کی تعریف، ارکان اور شرائط', 'bayee-ki-tareef-arkaan-sharaet-or-ahkaam')","('بیع کی تعریف اور ارکان', 'bayee-ki-tareef-or-arkaan')"
05-03-2021,https://www.banuri.edu.pk/readquestion/muhammad-mustfa-ahmad-nam-rakhny-ka-hukm-144207201189/05-03-2021,محمد مصطفی احمد نام رکھنے کا حکم,"میں نے اپنے بیٹے کا نام ""محمد مصطفیٰ احمد خان"" رکھا ہے۔ کیا اس میں کوئی شرعی قباحت ہے؟","<p><p style=""text-align:justify;"">""محمد""  کا معنی ہے: جس کی اچھی خصلتوں کی بنا  پر تعریف کی جائے۔</p><p style=""text-align:justify;"">""مصطفی"" کا معنی ہے: چنا ہوا، پسندیدہ۔</p><p style=""text-align:justify;"">""احمد "" کا معنی ہے: جو اپنی رب کی زیادہ تعریفیں کرنے والا ہو۔</p><p style=""text-align:justify;"">مذکورہ تینوں نام حضوراکرمﷺ کے اسمائے گرامی میں سے ہیں ، اور اپنے بچے کا نام انبیاء کے نام پر رکھنا مستحب ہے، آپﷺ نے  بچوں کے نام انبیاءِ  کرام  علیہم السلام کے نام پر رکھنے  کی ترغیب دی ہے۔</p><p style=""text-align:justify;"">فیض القدیر  شرح الجامع الصغیر میں ہے:</p><p class=""indent"" style=""text-align:justify;""><span class=""ar_writing"">""قال رسول الله صلى الله عليه وسلم: سموا بأسماء الأنبياء.""</span></p><p class=""indent"" dir=""rtl"" style=""text-align:left;""><span class=""ar_writing"">(باب حرف السين،رقم الحدیث:4717، ج:4، ص:113، ط:المكتبة التجارية)</span></p><p style=""text-align:justify;"">الروض الأنف فی شرح السیرۃ النبویۃ لابن ہشام میں ہے:</p><p class=""indent"" style=""text-align:justify;""><span class=""ar_writing"">""وَقَالَ عَبْدُ اللهِ بْنُ الزّبَعْرَى أَيْضًا حِينَ أَسْلَمَ</span></p><p class=""indent"" style=""text-align:justify;""><span class=""ar_writing"">وَلَقَدْ شَهِدْت بِأَنّ دِينَك صَادِقٌ ... حَقّ وَأَنّك فِي الْعِبَادِ جَسِيمُ</span></p><p class=""indent"" style=""text-align:justify;""><span class=""ar_writing"">وَاَللهُ يَشْهَدُ أَنّ أَحْمَدَ مُصْطَفًى ... مُسْتَقْبَلٌ فِي الصّالِحِينَ كَرِيمُ.""</span></p><p class=""indent"" dir=""rtl"" style=""text-align:left;""><span class=""ar_writing"">(باب ذكر الاسباب الموجبة الى مكة، ج:7، ص:247، ط:داراحياء التراث العربى)</span></p><p class=""indent"" dir=""rtl"" style=""text-align:left;"">فقط والله اعلم </p></p>",144207201189,banuri,"('حظر و اباحت', 'mamnooaat-mubahat')","('نام، لقب، کنیت', 'asaami')","('ناموں کے معانی اور احکام', 'namoun-ke-mani-or-ahkaam')"
