issued_at,link,title,question,answer,fatwa_number,dar_ul_ifta,kitab,bab,fasal
26-02-2021,https://www.banuri.edu.pk/readquestion/uorat-ke-ley-tadfeen-aur-qabar-par-mati-dalne-ka-hukum-144207200791/26-02-2021,عورت کے لیے تدفین اور قبر پر مٹی ڈالنے کا حکم,کیا عورت دفن کرسکتی ہے  اور قبر پر مٹی ڈال سکتی  ہے؟,"<p><p style=""text-align:justify;""> عام حالات میں   عورتوں کا جنازہ کے ساتھ جانا مکروہِ تحریمی ہے، لہذا  عام حالات میں  مَردوں کے ہوتے ہوئے،  عورتوں کے لیے قبرستان جاکر تدفین میں حصہ  لینے  اور قبر پر مٹی ڈالنے سے اجتناب کرنا ضروری ہے۔البتہ اگر کسی جگہ تدفین کے لیے مرد  موجود نہ ہوں تو مجبوری کی صورت میں عورت تدفین کرسکتی ہے ۔</p><p><span class=""ar_writing"">الدر المختار وحاشية ابن عابدين (رد المحتار) (2 / 242):</span></p><p class=""indent""><span class=""ar_writing"">""وبزيارة القبور ولو للنساء لحديث «كنت نهيتكم عن زيارة القبور ألا فزوروها».</span></p><p class=""indent"" style=""text-align:justify;""><span class=""ar_writing"">(قوله: ولو للنساء) وقيل: تحرم عليهن. والأصح أن الرخصة ثابتة لهن بحر، وجزم في شرح المنية بالكراهة لما مر في اتباعهن الجنازة. وقال الخير الرملي: إن كان ذلك لتجديد الحزن والبكاء والندب على ما جرت به عادتهن فلا تجوز، وعليه حمل حديث «لعن الله زائرات القبور» وإن كان للاعتبار والترحم من غير بكاء والتبرك بزيارة قبور الصالحين فلا بأس إذا كن عجائز. ويكره إذا كن شواب كحضور الجماعة في المساجد اهـ وهو توفيق حسن.""</span></p><p><span style=""font-family:arabic_font;""><span style=""font-size:23px;""><strong>حاشية الطحطاوي على مراقي الفلاح شرح نور الإيضاح (1 / 607):</strong></span></span></p><p class=""indent"" style=""text-align:justify;""><span style=""font-family:arabic_font;""><span style=""font-size:23px;""><strong>""قوله: ""ويكره اتباع النساء الجنائز"" أي تحريما كما في الدر قوله: ""وإن لم تنزجر نائحة الخ"" قال في السراج وقد أجمعت الأمة على تحريم النوح والدعوى بدعوى الجاهلية وفي البحر عن المجتبى إذا استمع باكية ليرق قلبه ويبكي فلا بأس به إذا أمن الوقوع في الفتنة لاستماعه صلى الله عليه وسلم لبواكي حمزة اهـ قوله: ""فلا بأس بالمشي معها"" أفاد أنه خلاف الأولى.""</strong></span></span></p><p><span style=""font-family:arabic_font;""><span style=""font-size:23px;""><strong>وفيه ايضا</strong></span></span><strong style=""font-family:arabic_font;font-size:23px;"">(1 / 603)</strong><strong style=""font-size:23px;font-family:arabic_font;"">:</strong></p><p class=""indent"" style=""text-align:justify;""><span style=""font-family:arabic_font;""><span style=""font-size:23px;""><strong>""واعلم أن أصل الحمل والدفن فرض كفاية ولذا لا يجوز أخذ الأجرة على ذلك إذا تعينوا قهستاني وحمل الجنازة عبادة فينبغي لكل أحد أن يبادر إليها فقد حمل الجنازة سيد المرسلين فإنه حمل جنازة سعد بن عبادة نقله السيد عن الجوهرة قوله: ""لحملها"" اللام بمعنى في وحمل نائب فاعل يسن والمعنى أن السنة في حملها أن يحملها رجال أربعة قوله: ""أربعة رجال"" أخرج به النساء وذلك لما أخرجه أبو يعلى عن أنس رضي الله عنه قال خرجنا مع رسول الله صلى الله عليه وسلم في جنازة فرأى نسوة فقال: أتحملنه قلن لا قال أتدفنه قلن لا قال فارجعن مأزورات غير مأجورات ولأن الرجال أقوى على ذلك والنساء ضعيفات ومظنه الفتنة والانكشاف إلا إذا لم يوجد رجال كذا في شرح البدر العيني على البخاري.""</strong></span></span></p><p><span style=""font-family:arabic_font;""><span style=""font-size:23px;""><strong>الفقه الإسلامي وأدلته(2/659):</strong></span></span></p><p class=""indent"" style=""text-align:justify;""><span style=""font-family:arabic_font;""><span style=""font-size:23px;""><strong>""اتباع النساء الجنائز، الكراهةعند الجمهور تنزيهية، لما روي عن أم عطية قالت: «نهينا عن اتباع الجنائز ولم يعزم علينا»  أي أنه نهي تنزيه، وعند الحنفية الكراهة تحريمية، لحديث «ارجعن مأزورات غير مأجورات»  ويعضده المعنى الحادث باختلاف الزمان الذي أشارت إليه عائشة بقولها: «لو أن رسول الله صلى الله عليه وسلم رأى ما أحدث النساء بعده، لمنعهن كما منعت نساء بني إسرائيل».""</strong></span></span></p><p class=""indent"" dir=""rtl"" style=""text-align:left;"">فقط واللہ اعلم</p></p>",144207200791,banuri,"('جنائز', 'janaiz')","('تدفین', 'tadfeen')","('میت دفن کرنے کے احکام', 'mayyat-dafan-karne-ke-ahkaam')"
25-02-2021,https://www.banuri.edu.pk/readquestion/uorto-ka-roza-kin-chezon-se-tot-ta-he-144207200769/25-02-2021,عورتوں کا روزہ کن چیزوں سے ٹوٹتا ہے؟,عورتوں کا روزہ کس وجہ سے ٹوٹتا ہے؟,"<p><p style=""text-align:justify;"">جن چیزوں سے مردوں کا روزہ ٹوٹ جاتا ہے، ان ہی چیزوں سے عورتوں کا روزہ بھی ٹوٹ جاتا ہے یعنی ہر وہ چیز جو معتاد راستوں (منہ ، ناک ، کان وغیرہ) سے  انسان کے بدن  میں داخل ہوجائے، اور جماع یا ہر وہ فعل جس میں جماع کا معنی پایا جائے روزے کی حالت میں صادر ہوجائے تو روزہ ٹوٹ جاتا ہے خواہ غلطی سے ہو یا زبردستی سے۔</p><p style=""text-align:justify;"">اسی طرح عورتوں کو اگر روزے کے دوران ماہواری شروع ہوجائے   یا ولادت کے بعد خون جاری ہوجائے  تو اس سےبھی روزہ ٹوٹ جاتا ہے۔ </p><p style=""text-align:justify;"">باقی  روزہ توڑنے والی چیزوں کی  جزئیات بہت زیادہ ہیں، لہذا یہاں ان سب کا لکھنا مشکل ہے، جس مسئلے کے بارے میں حکم معلوم کرنا ہو، وہ متعینہ طور پر لکھ کر معلوم کرلیجیے، یا اس کی تفصیل کے لیے مفتی انعام الحق قاسمی صاحب مدظلہم کی کتاب ”روزہ کے مسائل کا انسائیکلوپیڈیا“ کا مطالعہ کیجیے۔فقط واللہ اعلم</p></p>",144207200769,banuri,"('روزہ', 'soum')","('روزہ توڑنے والی چیزیں', 'roza-torne-wali-chezen')","('کھانا پینا وغیرہ', 'khana-peena-wagera')"
27-02-2021,https://www.banuri.edu.pk/readquestion/uorat-ke-janaze-ko-namehram-ka-kandha-dena-144207200874/27-02-2021,عورت کے جنازے کو نامحرم کا کندھا دینا,کیا عورت کے جنازے کو ہر کوئی کندھا دے سکتا  ہے یا محرم کی کوئی شرط ہے؟,"<p><p style=""text-align:justify;"">عورت کے جنازہ کے ہر شخص کندھا دے سکتا ہے، اس میں محرم کی شرط نہیں ہے، البتہ قبر میں صرف محرم مردوں کو اتارنا چاہیے، اگر محرم نہ ہوں یا کافی نہ ہوں تو غیر محرم نیک لوگ شامل ہوسکتے ہیں۔</p><p style=""text-align:justify;""><span class=""ar_writing"">حاشية الطحطاوي على مراقي الفلاح شرح نور الإيضاح (1 / 603):</span></p><p class=""indent"" style=""text-align:justify;""><span class=""ar_writing"">""يسن لحملها"" حمل ""أربعة رجال"" تكريما له وتخفيفا وتحاشيا عن تشبيهه بحمل الأمتعة ... </span><span class=""ar_writing"">واعلم أن أصل الحمل والدفن فرض كفاية ولذا لا يجوز أخذ الأجرة على ذلك إذا تعينوا قهستاني وحمل الجنازة عبادة فينبغي لكل أحد أن يبادر إليها.""</span></p><p class=""indent"" dir=""ltr"" style=""text-align:justify;"">فقط واللہ اعلم</p></p>",144207200874,banuri,"('جنائز', 'janaiz')","('تدفین', 'tadfeen')","('میت دفن کرنے کے احکام', 'mayyat-dafan-karne-ke-ahkaam')"
01-03-2021,https://www.banuri.edu.pk/readquestion/mobail-ki-tasveer-par-subha-nallah-ka-hny-ka-hukm-144207200986/01-03-2021,موبائل کی تصویر پر سبحان اللہ کہنے کا حکم,ایک بندہ تصویر کھینچتا ہے موبائل پر،  اور اسے پھر فیس بک پر یا وٹس ایپ پر سٹیٹس لگاتا ہے،  اور اس پر لوگ ماشااللہ سبحان اللہ کہتے ہیں صرف اپنی تصویر لگاتا  ہے اس کا کیا حکم ہے ؟جے ٹی آر میڈیا پر مفتی اسد اللہ شہباز صاحب اس مسئلہ کے بارے میں بیان کرتے ہیں کہ ڈیجیٹل تصویر پر سبحان اللہ کہنا جائز ہے۔,"<p><p style=""text-align:justify;"">ملحوظ رہے کہ موبائل  کیمرے سےجان دار  کی تصویر بنانے کا وہی حکم ہےجو عام کیمرے سے تصویر بنانے  کا ہے یعنی سوائے ضرورتِ شدیدہ کے جان دار کی تصویر بنانا ناجائز ہے اور اور فیس بک،ٹوئیٹر ، واٹس ایپ وغیرہ پر تصویر لگانا چوں کہ کوئی شرعی مجبوری یا دینی ضرورت نہیں اس لیے جو لوگ لگاتے ہیں وہ جان دار  کی تصویر کو بلاضرورتِ  شدیدہ اور کسی قابلِ اعتبار دینی مصلحت کے بغیر استعمال کرتے ہیں؛ اس لیے ان کے اس عمل کو   اہلِ  علم  کی بڑی جماعت  تصویر کا تسلسسل سمجھنے کی بنا پر ناجائز  اور حرام کہتی ہے۔</p><p style=""text-align:justify;"">بصورتِ مسئولہ موبائل سے تصویر کھینچنا ہی شرعاً جائز نہیں ہے،اس وجہ سے تصویر کھینچ کر فیس بک پر یا واٹس ایپ پر لگانے کے بعد ""سبحان اللہ""  کہنے سے ہر مسلمان کے  لیے اجتناب ضروری ہے۔</p><p style=""text-align:justify;"">فتاوی شامی میں ہے:</p><p class=""indent"" style=""text-align:justify;""><span class=""ar_writing"">""وظاهر كلام النووي في شرح مسلم الإجماع على تحريم تصوير الحيوان، وقال: وسواء صنعه لما يمتهن أو لغيره، فصنعته حرام بكل حال لأن فيه مضاهاة لخلق الله تعالى، وسواء كان في ثوب أو بساط أو درهم وإناء وحائط وغيرها اهـ فينبغي أن يكون حرامًا لا مكروهًا إن ثبت الإجماع أو قطعية الدليل بتواتره اهـ كلام البحر ملخصًا.""</span></p><p class=""indent"" dir=""rtl"" style=""text-align:left;""><span class=""ar_writing"">(كتاب الصلوة، مكروهات الصلوة، ج:1، ص:647، ط:ايج ايم سعيد)</span></p><p class=""indent"" dir=""rtl"" style=""text-align:left;"">فقط والله اعلم </p></p>",144207200986,banuri,"('حظر و اباحت', 'mamnooaat-mubahat')","('تفریح / کھیل', 'tafreeh-khel')","('ٹی وی / وی سی آر / سینما / انٹرنیٹ/تصویر سازی', 'tv-vcr-cinema-internet-taswer-sazi')"
28-02-2021,https://www.banuri.edu.pk/readquestion/larki-ka-name-mehrab-rakhna-144207200921/28-02-2021,محراب کا معنی اور لڑکی کا نام محراب رکھنا,"میں اپنی بیٹی کا نام ""محراب""  رکھنا چاہتا ہوں، کیا یہ نام رکھنا درست ہے؟  لڑکی کا نام محراب رکھ سکتے ہیں ؟","<p><p style=""text-align:justify;"">""محراب""  کے  متعدد معنی آتے ہیں، جیسے: مسجد میں امام کے کھڑے ہونے کی جگہ، مسجد کا بلند مقام، گھر کے سامنے کا حصہ، گھر کا بلند حصہ، قبلہ ، گھر میں مہمانوں کے لیے بیٹھنے کی عمدہ  جگہ، ان متعدد معانی میں سے ایک معنی بہادر  و  شجاع و جنگ کا ماہر کے بھی آتے ہیں۔ اس معنی کے اعتبار سے لڑکے کا نام ""محراب""  رکھا جا سکتا ہے۔</p><p style=""text-align:justify;"">ليكن لڑکیوں کے ناموں کے لیے یہ نام  مستعمل نہیں ہے، اس لیے لڑکی کانام ""محراب"" نہ رکھا جائے، بلکہ بچی کے لیے صحابیات رضی اللہ عنہن میں سے کسی کا نام یا اچھا بامعنی نام منتخب کریں۔</p><p style=""text-align:justify;""><span class=""ar_writing"">لسان العرب (1/ 305):</span></p><p class=""indent"" style=""text-align:justify;""><span class=""ar_writing"">’’والمِحْرابُ: صَدْرُ البَيْتِ، وأَكْرَمُ مَوْضِعٍ فِيهِ، وَالْجَمْعُ المَحارِيبُ، وَهُوَ أَيضاً الغُرْفةُ. قَالَ وضَّاحُ اليَمَنِ:</span><br/><span class=""ar_writing"">رَبَّةُ مِحْرابٍ، إِذَا جِئْتُها، ... لَمْ أَلْقَها، أَو أَرْتَقي سُلَّما</span><br/><span class=""ar_writing"">وأَنشد الأَزهري قَوْلَ امْرِئِ الْقَيْسِ:</span><br/><span class=""ar_writing"">كَغِزلانِ رَمْلٍ فِي مَحارِيبِ أَقْوال</span><br/><span class=""ar_writing"">قَالَ: والمِحْرابُ عِنْدَ الْعَامَّةِ: الَّذِي يُقِيمُه النَّاسُ اليَوْمَ مَقام الإِمامِ فِي المَسْجد، وَقَالَ الزَّجَّاجُ فِي قَوْلِهِ تَعَالَى: وَهَلْ أَتاكَ نَبَأُ الْخَصْمِ إِذْ تَسَوَّرُوا الْمِحْرابَ</span><br/><span class=""ar_writing"">؛ قَالَ: المِحْرابُ أَرْفَعُ بَيْتٍ فِي الدَّارِ، وأَرْفَعُ مَكانٍ فِي المَسْجِد. قَالَ: والمِحْرابُ هَاهُنَا كالغُرْفةِ، وأَنشد بَيْتَ وضَّاحِ اليَمَنِ. وَفِي الْحَدِيثِ:</span><br/><span class=""ar_writing"">أَنّ النَّبِيَّ، صَلَّى اللَّهُ عَلَيْهِ وَسَلَّمَ، بَعَثَ عُروة بْنُ مَسْعودٍ، رَضِيَ اللَّهُ عَنْهُ، إِلَى قومِه بالطَّائِف، فأَتاهم ودَخَل مِحْراباً لَهُ، فأَشْرَفَ عَلَيْهِمْ عندَ الفَجْر، ثُمَّ أَذَّن للصَّلاةِ.</span><br/><span class=""ar_writing"">قَالَ: وَهَذَا يَدُلُّ عَلَى أَنه غُرْفةٌ يُرْتَقَى إِلَيْهَا. والمَحارِيب: صُدُور المَجالِس، وَمِنْهُ سُمّي مِحْرابُ المَسْجِد، وَمِنْهُ مَحارِيبُ غُمْدانَ باليَمَنِ. والمِحْرابُ: القِبْلةُ. ومِحْرابُ المَسْجِد أَيضاً: صَدْرُه وأَشْرَفُ مَوْضِعٍ فِيهِ. ومَحارِيبُ بَنِي إسرائيلَ: مَسَاجِدُهم الَّتِي كَانُوا يَجلسون فِيهَا؛ وَفِي التَّهْذِيبِ: الَّتِي يَجْتَمِعُون فِيهَا لِلصَّلَاةِ‘‘. </span></p><p class=""indent"" style=""text-align:justify;""><span class=""ar_writing"">’’(حرب) الحاء والراء والباء أصول ثلاثة: أحدها السلب، والآخر دويبة، والثالث بعض المجالس. </span><br/><span class=""ar_writing"">فالأول: الحرب، واشتقاقها من الحرب وهو السلب. يقال حربته ماله، وقد حرب ماله، أي سلبه، حربا. والحريب: المحروب. ورجل محراب: شجاع قؤوم بأمر الحرب مباشر لها. وحريبة الرجل: ماله الذي يعيش به، فإذا سلبه لم يقم بعده. ويقال أسد حرب، أي من شدة غضبه كأنه حرب شيئًا أي سلبه. وكذلك الرجل الحرب.""</span></p><p class=""indent"" dir=""rtl"" style=""text-align:left;"">فقط واللہ اعلم</p></p>",144207200921,banuri,"('حظر و اباحت', 'mamnooaat-mubahat')","('نام، لقب، کنیت', 'asaami')","('ناموں کے معانی اور احکام', 'namoun-ke-mani-or-ahkaam')"
28-02-2021,https://www.banuri.edu.pk/readquestion/atika-name-rakhna-144207200886/28-02-2021,عاتکہ نام رکھنا اور اس کے لکھنے کا طریقہ,"""عاتکہ کلیم""  ایسا ٹھیک ہے  یا  ایسا ""عاتکھ کلیم""   کیسا ٹھیک ہے  اور  معنی کیا ہے؟","<p><p style=""text-align:justify;"">مذکورہ نام لکھنے کا درست طریقہ ""عاتِکَہ""  (<span class=""qr_writing"">عَاتِكَه</span>)ہے۔ اور ""عاتکہ""   رسول  اللہ ﷺ  کی پھوپھی اور کئی صحابیات رضی تعالی عنہن کا نام ہے، اس کے معنی  بہت خوش بو   مَلنے والی، خالص سرخ جس میں کسی دوسرے رنگ کی آمیزش نہ ہو یا گہرا سرخ،  بہت خوش بو  ملنے والی جس سے جلد کی سطح سرخ ہو جائے، شریف ذات والی۔</p><p style=""text-align:justify;"">یہ نام اچھا ہے اور رکھنا جائز ہے۔</p><p style=""text-align:justify;""><span class=""ar_writing"">لسان العرب (10/ 463):</span></p><p class=""indent"" style=""text-align:justify;""><span class=""ar_writing"">""وعَتَكَتِ القَوْسُ تَعْتِك عَتْكاً وعُتوكاً، وَهِيَ عاتِك: احْمَرَّت مِنَ القِدَم وَطُولِ الْعَهْدِ. والعاتِكة: الْقَوْسُ إِذَا قَدُمَتْ واحْمَرَّت. وَامْرَأَةٌ عَاتِكَةٌ: مُحْمَرَّة مِنَ الطِّيب، وَقِيلَ: بِهَا رَدْعُ طِيبٍ،  وَسُمِّيَتِ المرأَة عَاتِكَةً لِصَفَائِهَا وحُمْرتها. وَفِي الْحَدِيثِ:  قَالَ صَلَّى اللَّهُ عَلَيْهِ وَسَلَّمَ يَوْمَ حُنَيْنٍ: أَنا ابْنُ العَواتك مِنْ سُلَيْم؛ الْعَوَاتِكُ: جَمْعُ عَاتِكَةٍ، وأَصل الْعَاتِكَةِ المُتَضَمِّخة بِالطِّيبِ.""</span></p><p class=""indent"" dir=""rtl"" style=""text-align:left;"">فقط والله اعلم</p></p>",144207200886,banuri,"('حظر و اباحت', 'mamnooaat-mubahat')","('نام، لقب، کنیت', 'asaami')","('ناموں کے معانی اور احکام', 'namoun-ke-mani-or-ahkaam')"
07-03-2021,https://www.banuri.edu.pk/readquestion/kala-libas-pahanna-chahiy-ya-nahe-144207201261/07-03-2021,کالا لباس پہننا چاہیے یا نہیں؟,کالا لباس پہننا چاہیے یا نہیں؟,"<p><p style=""text-align:justify;"">نبی کریم صلی اللہ علیہ وسلم سے  کالے رنگ کی چادر  اوڑھنا  اور  سیاہ عمامہ باندھنا ثابت ہے، البتہ مکمل کالا لباس پہننا ثابت نہیں، تاہم سیاہ لباس پہننے کی ممانعت کے حوالہ سے کوئی روایت بھی نہیں ملی، اس لیے فی نفسہ کالا لباس پہننا مرد و عورت دونوں کے لیے جائز ہے، لیکن اس زمانے میں خاص طور پر محرم کے مہینے میں کالے رنگ کا لباس پہننا روافض کا شعار بن چکا ہے، اس لیے جن ایام میں یہ لوگ سیاہ لباس پہنتے ہیں اس دوران اس طبقے کے ساتھ مشابہت سے بچنے کے لیے سیاہ لباس سے اجتناب لازم ہے، نیز فوتگی یا کسی غم کے موقع پر اظہارِ غم کے طور پر سیاہ لباس زیب تن کرنا بے اصل و بدعت ہے، جس سے اجتناب کرنا ضروری ہے۔</p><p style=""text-align:justify;""><span class=""ar_writing"">سنن الترمذي ت بشار (4/ 416):</span></p><p class=""indent"" style=""text-align:justify;""><span class=""ar_writing"">"" باب ما جاء في الثوب الأسود</span></p><p class=""indent"" style=""text-align:justify;""><span class=""ar_writing"">حدثنا أحمد بن منيع، قال: حدثنا يحيى بن زكريا بن أبي زائدة قال: أخبرني أبي، عن مصعب بن شيبة، عن صفية بنت شيبة، عن عائشة، قالت: خرج النبي صلى الله عليه وسلم ذات غداة وعليه مرط من شعر أسود.هذا حديث حسن غريب صحيح"".</span></p><p style=""text-align:justify;""><span class=""ar_writing"">سنن أبي داود (4/ 54):</span></p><p class=""indent"" style=""text-align:justify;""><span class=""ar_writing"">""باب في السواد</span></p><p class=""indent"" style=""text-align:justify;""><span class=""ar_writing"">حدثنا محمد بن كثير، أخبرنا همام، عن قتادة، عن مطرف، عن عائشة، رضي الله عنها، قالت: "" صنعت لرسول الله صلى الله عليه وسلم بردة سوداء، فلبسها، فلما عرق فيها وجد ريح الصوف، فقذفها - قال: وأحسبه قال: - وكان تعجبه الريح الطيبة"".وفي الحدیث جواز لبس السواد وهو متفق علیه.""</span></p><p class=""indent"" style=""text-align:left;""><span class=""ar_writing"">(بذل المجهود، باب في السواد، دار البشائر الإسلامیة۱۲/۱۰۱، تحت رقم الحدیث۴۰۷۴، سهارنپور قدیم۵/۵۱)</span></p><p style=""text-align:justify;""><span class=""ar_writing"">الدر المختار وحاشية ابن عابدين (رد المحتار) (6/ 755):</span></p><p class=""indent"" style=""text-align:justify;""><span class=""ar_writing"">""(وندب لبس السواد)</span></p><p class=""indent"" style=""text-align:justify;""><span class=""ar_writing""> (قوله: وندب لبس السواد)؛ لأن محمداً ذكر في السير الكبير في باب الغنائم حديثاً يدل على أن لبس السواد مستحب"".</span></p><p style=""text-align:justify;""><span class=""ar_writing"">الدر المختار وحاشية ابن عابدين (رد المحتار) (3/ 533):</span></p><p class=""indent"" style=""text-align:justify;""><span class=""ar_writing"">""وفي التتارخانية: ولاتعذر في لبس السواد، وهي آثمة إلا الزوجة في حق زوجها فتعذر إلى ثلاثة أيام. قال في البحر: وظاهره منعها من السواد تأسفاً على موت زوجها فوق الثلاثة"".</span></p><p class=""indent"" style=""text-align:left;""> فقط واللہ اعلم</p></p>",144207201261,banuri,"('حظر و اباحت', 'mamnooaat-mubahat')","('لباس', 'libaas')","('جائز لباس', 'jaaez-libaas')"
