issued_at,link,title,question,answer,fatwa_number,dar_ul_ifta,kitab,bab,fasal
18-12-2019,https://www.banuri.edu.pk/readquestion/یو-ٹیوب-پر-پیسہ-کمانے-سے-متعلق-ایک-اشکال-144104200684/18-12-2019,یو ٹیوب پر پیسہ کمانے سے متعلق ایک اشکال,میرا سوال یوٹیوب پر  پیسے کمانے سے متعلق ہے، اس سے متعلق میں نے آپ کی  ویب سائٹ پر ایک سوال دیکھا بھی تھا، لیکن چوں کہ  اس سوال میں یوٹیوب اور  ایڈسینس  سے  متعلق پوری  وضاحت اور تفصیل نہیں تھی،  اس لیے آپ کا جواب بھی سوال کے مطابق مختصر تھا، مختصر سے میرا مطلب یہ ہے کہ جواب میں اصل عقد کے بارے میں وضاحت مذکور نہیں تھی؛ اس لیے  اس سوال میں میں یوٹیوب اور ایڈسینس کے ساتھ اصل عقد کی شرعی حیثیت کے بارے میں پوچھنا چاہتا ہو ں ۔  سوال کی وضاحت  کے لیے یوٹیوب سے پیسے کمانے کا  طریقہ کار بھی مختصراً عرض کرتا ہوں ۔یوٹیوب  (You Tube)  جوکہ گوگل کمپنی  کی ایک ویب سائٹ ہے اور اس ویب سائٹ سے اشتہارات کے ذریعہ پیسے کمائے جاتے ہیں،  پیسے کمانے کا طریقہ وہی ہے جو ”گوگل ایڈسینس،(Google Adsense)  کا ہے  اور گوگل ایڈسینس کے ہی سارے قوانین کا اطلاق یوٹیوب پر بھی ہوتا ہے ، اس لیے یوٹیوب سے پہلے ایڈسینس کا مختصر تعارف اور اصولوں کے بارے میں مختصراً ضروری وضاحت کرتا ہوں ؛ تاکہ آپ  کے لیے بھی آسانی ہو اور عوام کے ذہنوں میں بھی کوئی سوال نہ رہے۔گوگل اپنے صارفین کو ایک سروس مہیا کرتا ہے، جس میں اگر کوئی شخص اپنے کاروبار، کمپنی یا ادارے کی انٹرنیٹ پر تشہیر کرانا چاہتا ہے تو گوگل اس معاملے میں اس کی اس ضرورت کو پورا کرتا ہے اور انٹرنیٹ پر مختلف ویب سائٹس پر اس کی تشہیر کرواتا ہے۔ مذکورہ صورت میں تین لوگ بنیادی حیثیت کے حامل ہوتے ہیں:اول: وہ جو اپنے ادارے، کاروبار یا کمپنی کی تشہیر کرانا چاہتے ہیں۔دوم: گوگل۔سوم: ویب پبلشر ، یعنی وہ شخص جس کی ویب سائٹ پر اشتہار چلتے ہیں۔اب جو شخص اپنا اشتہار چلوانا چاہتا ہے، وہ گوگل سے رابطہ کرتا ہے اور گوگل اس سے ایک مخصوص رقم کے عوض ایک متعین مدت تک کا معاہدہ کرتا ہے، پھر گوگل وہ اشتہار ویب پبلشر کی ویب سائٹ پر چلاتا ہے اور اسے فی کلک (اشتہار پر جتنی بار کلک ہو گا) یا بعض صورتوں میں امپریشن ( ویب سائٹ پر رش اور اس پر لوگوں کی آمد) کے حساب سے پیسے دیتا ہے۔اب سوال یہ ہے کہ ایڈسینس پر  چوں کہ ویب پبلشر کی اجرت مجہول ہے، یہاں اجرت اس بات پر ہے کہ ویب پبلشر اپنی ویب سائٹ پر اشتہار لگائے گا اور اس پر اسے پیسے ملیں گے، لیکن وہ پیسے متعین نہیں، بلکہ معلق ہیں اور وہ معلق اس بات پر ہیں کہ جتنے کلک ہوں گے، اتنے پیسے ملیں گے، لہٰذا اجرت مجہول ہوئی، تو کیا عقد جائز ہے ؟ یعنی اس عقد کی شرعی حیثیت کیا ہے؟یہاں یہ بات ذہن میں رکھیں کہ گوگل اگر ویب پبلشر کی ویب سائٹ ایک متعین وقت کے لیے اجرت پر لے لیتا، مثلاً ایک ماہ کے لیے اور اس پر اشتہار چلاتا، تو اجرت متعین ہو جاتی اور عقد کے عدِم جواز کی یہ وجہ نہ بنتی، لیکن یہاں ایسا نہیں، بلکہ گوگل نے اجرت کو معلق کیا ہے کلک کے ساتھ اور وہ مجہول ہے۔دوسری بات یہ بھی ہے بسا اوقات اجرت متعین نہیں ہوتی، بلکہ فی صد کے اعتبار سے مقرر ہوتی ہے، جو کہ دلالی کی صورت ہے کہ جتنے گاہک لاؤ گے، اتنے فی صد کے حق دار ہوگے، لہٰذا اگر دلالی کی صورت یہاں بھی ہو تو عقد جائز ہو سکتا ہے ، لیکن یہاں دلالی کی صورت بھی ممکن نہیں، کیوں کہ گوگل نے دلالی سے بھی منع کیا ہے کہ ویب پبلشر کسی کو اپنی ویب سائٹ پر لگے اشتہار پر کلک کرنے کا کہہ نہیں سکتا کہ تم میری ویب سائٹ پر لگے اشتہار کو کلک کرو، لہٰذا دلالی کی صورت بھی یہاں نہیں ہو سکتی۔ اجرت کے  معاملے میں بھی گوگل نے  یہ  پابندی لگائی ہے کہ ویب پبلشر کو اجرت اس وقت دی جائے گی جب اس کی اجرت سو (100)  ڈالر سے تجاوز کر گئی ہو، اس سے کم پر گوگل اسے اجرت نہیں دیتا، یعنی اجرت پانے کے لیے یہ ضروری ہے کہ ویب پبلشر نے کم ازکم سو ڈالر تک کا کام کیا ہے، اگر نوے ڈالر کا کام کیا ہو گا تو گوگل اسے اس وقت تک پیسے نہیں دے گا، جب تک اس کے سو ڈالر مکمل نہیں ہو جاتے، تو کیا یہ شرط عقد کے منافی نہیں ہے؟ اور کیا اس قسم کی شرط کے ساتھ کیا جانے والا عقد درست ہے؟,"<p><p style=""text-align:justify;"">آپ نے  لکھا کہ گوگل اور  ویب  پبلشر کے درمیان جو معاملہ ہےاس میں اجرت مجہول ہوتی ہے، اس کے لیے عرض یہ ہے کہ یہ اجرت مجہول نہیں ہے؛ کیوں کہ اس معاملہ میں ہر کلک کے  لیے ایک متعین رقم طے کر دی جاتی ہے جس کی وجہ سے جہالت جاتی رہی اور  تنازع کا امکان باقی نہ رہا، لہذا جب اس معاملہ میں جہالت نہیں تو  اس حد تک معاملہ  درست ہوا،  اور  دلالی والی صورت اختیار کرنے  کی بھی حاجت نہیں۔</p><p style=""text-align:justify;"">نیز آپ نے لکھا کہ اس معاملہ میں یہ شرط لگائی جاتی ہے کہ اجرت جب سو (100)  ڈالر سے تجاوز کر جائے اس کے بعد گوگل اجرت ادا کرے گا تو اس کی مثال ایسے سمجھیں جیسے عام اداروں میں تنخواہ ماہانہ ادا کی جاتی ہے ورنہ اجرت کا استحقاق عمل کے فوراً بعد  ہوجاتا ہے، اس  لیے گوگل والوں کا ایسی شرط لگانا انتظامی سہولت کے  لیے ہے، اس  شرط کے ہوتے ہوئے بھی معاملہ درست ہوسکتاہے۔</p><p style=""text-align:justify;"">تاہم یوٹیوب پر چینل بناکر کمانےکے بارے میں تفصیلی حکم درج ذیل ہے:</p><p style=""text-align:justify;"">یوٹیوب پر چینل بناکر ویڈیو اَپ لوڈ کرنے کی صورت میں اگر اس چینل کے فالوورز زیادہ ہوں تو یوٹیوب،  چینل ہولڈر کی اجازت سے اس میں اپنے مختلف کسٹمر کے اشتہار چلاتا ہے، اور اس کی ایڈورٹائزمنٹ اور مارکیٹنگ کرنے پر ویڈو اَپ لوڈ کرنے والے کو بھی پیسے دیتا ہے۔ اس کا شرعی حکم یہ ہے کہ اگر چینل پر ویڈیو اَپ لوڈ کرنے والا:</p><p class=""indent"" style=""text-align:justify;"">1۔ جان د ار کی تصویر والی ویڈیو اَپ لوڈ کرے، یا اس ویڈیو میں جان دار کی تصویر ہو۔</p><p class=""indent"" style=""text-align:justify;"">2۔ یا اس ویڈیو میں میوزک اور موسیقی ہو۔</p><p class=""indent"" style=""text-align:justify;"">3۔  یا اشتہار غیر شرعی ہو ۔</p><p class=""indent"" style=""text-align:justify;"">4۔ یا کسی بھی غیر شرعی شے کا اشتہار ہو۔</p><p class=""indent"" style=""text-align:justify;"">5۔  یا اس کے لیے کوئی غیر شرعی معاہدہ کرنا پڑتا ہو۔</p><p style=""text-align:justify;"">تو اس کے ذریعے پیسے کمانا جائز نہیں ہے۔</p><p style=""text-align:justify;"">عام طور پر اگر ویڈیو میں مذکورہ خرابیاں نہ پائی جاتی  ہوں تب بھی یوٹیوب کی طرف سے لگائے جانے والے اشتہارات  میں مذکورہ خرابیاں پائی جاتی ہیں، اور ہماری معلومات کے مطابق یوٹیوب کو اگر اَیڈ چلانے کی اجازت دی جائے تو  یو ٹیوب انتظامیہ ملکوں کے حساب سے مختلف ایڈ چلاتی ہے، مثلاً اگر پاکستان میں ایک ویڈیو پر  کوئی اشتہار چللایا جاتا ہو، تو اسی ویڈیو پر پاکستان کے علاوہ دیگر ممالک  میں  اور قسم کا اشتہار چلایا جاتا ہے، جس میں بسا اوقات حرام اور ناجائز چیزوں کی تشہیر بھی شامل ہوتی ہے، نیز  اشتہاری ویڈیوز میں عمومًا جان دار کا عکس و موسیقی موجود ہوتی ہے ان تمام مفاسد کے پیشِ نظر یوٹیوب پر ویڈیو اَپ لوڈ کرکے پیسے کمانے کی شرعاً اجازت نہیں ہے۔ فقط واللہ اعلم</p></p>",144104200684,banuri,"('معاملات', 'muamlat')","('بیع / تجارت', 'bay-tijarat')","('بیع صحیح ، فاسد اور باطل', 'bay-sahih-fasid-or-batil')"
10-12-2020,https://www.banuri.edu.pk/readquestion/muhammad-yazdan-naam-rakhna-144204201063/10-12-2020,محمد یزدان نام رکھنا,"کیا ""محمد یزدان""  نام رکھا جا سکتا ہے؟","<p><p style=""text-align:justify;"">فارسی زبان میں  ""یزدان ""  کے  متعدد   معانی آتے ہیں،  جیسے:  آتش  پرستوں کا معبود  ( آتش پرستوں  کے عقیدہ کے مطابق  دنیا میں دو معبود ہیں، ایک خیرکا خالق ہے جو کہ "" یزدان""  ہے،  دوسرا  شر کا خالق ہے جو کہ ""اہرمن""  یعنی شیطان ہے)   ، خدا، رب، معبود۔</p><p class=""indent"" style=""text-align:justify;"">""ایزد یا یزدان واژه‌ای اوستایی و یک مفهوم زرتشتی با طیف گسترده‌ای از معانی است اما به‌طور کلی به‌مفهوم الوهیّت یا خدایی است. این اصطلاح در معنای واقعی کلمه، به‌معنی «شایستهٔ پرستش و ستایش» است. ایزد به رب‌النوع‌ها، الهگان، فرشتگان، خدای‌گان و اربابان طبیعی نیز گفته می‌شود۔""</p><p style=""text-align:justify;"">مفاتيح العلوم للخوارزمي   میں ہے:</p><p class=""indent"" style=""text-align:justify;""><span class=""ar_writing"">""الهرابذة هم عبدة النيران وأحدهم: هربذ.</span></p><p class=""indent"" style=""text-align:justify;""><span class=""ar_writing"">يزدان: خالق الخير بزعم المجوس.</span></p><p class=""indent"" style=""text-align:justify;""><span class=""ar_writing"">أهرمن: خالق الشر بزعمهم.""</span></p><p class=""indent"" style=""text-align:left;""><span class=""ar_writing"">( المقالة الأولى،   في الكلام،   الفصل الخامس: في أسامي أرباب الملل والنحل المختلفة، ص: ٥٦، ط: دار الكتاب الاسلامي)</span></p><p style=""text-align:justify;"">مرقاة المفاتيح شرح مشكاة المصابيح میں ہے:</p><p class=""indent"" style=""text-align:justify;""><span class=""ar_writing"">""عن ابن عمر رضي الله عنه قال: قال رسول الله صلى الله عليه وسلم: («القدرية مجوس هذه الأمة»)، أي: أمة الإجابة؛ لأن قولهم: أفعال العباد مخلوقة بقدرهم يشبه قول المجوس القائلين بأن للعالم إلهين: خالق الخير، وهو يزدان، وخالق الشر، وهو أهرمن؛ أي: الشيطان.""</span></p><p class=""indent"" style=""text-align:left;""><span class=""ar_writing"">(كتاب الإيمان، باب الإيمان بالقدر، ١ / ١٨٢، ط: دار الفكر)</span></p><p style=""text-align:justify;"">لہذا صورتِ  مسئولہ میں  ""محمد یزدان""  نام رکھنا درست نہیں،  پس کسی لاحقہ کے بغیر صرف ""محمد""  نام رکھ لیا جائے۔ فقط واللہ اعلم</p></p>",144204201063,banuri,"('حقوق و آدابِ معاشرت', 'huqooq-muashret')","('حقوق', 'bahmi-huqooq')","('اولاد کے حقوق', 'olad-ky-hoqoq')"
10-07-2020,https://www.banuri.edu.pk/readquestion/meher-bhul-jae-144111201077/10-07-2020,اگر مہر کی رقم بھول جائے تو کیا کرے؟,اگر مہر کی رقم بھول جائے تو کتنا ادا کیا جائے؟,"<p><p style=""text-align:justify;"">اگر مہر کی رقم بھول جائے تو  بیوی سے پوچھ لے کہ کیا طے ہوا تھا، یا نکاح نامے پر دیکھ  لے، اگر کہیں بھی نہ ملے تو جو یاد ہو اور بیوی کا مطالبہ بھی اس سے زیادہ کا نہ ہو اتنا ادا کردے، اور باقی کے بارے میں بیوی سے معاف کروالے۔</p><p style=""text-align:justify;"">الدر المختار وحاشية ابن عابدين (رد المحتار) (3/ 113):</p><p class=""indent"" style=""text-align:justify;""><span class=""ar_writing"">""(وصح حطها) لكله أو بعضه (عنه) قبل أو لا، ويرتد بالرد كما في البحر.</span></p><p class=""indent"" style=""text-align:left;"">فقط واللہ اعلم</p></p>",144111201077,banuri,"('نکاح', 'nikah')","('مہر', 'meher')","('مہر کا حکم', 'mehr-jehez-barat')"
10-07-2020,https://www.banuri.edu.pk/readquestion/زلفیں-رکھنے-کے-متعلق/10-07-2020,زلفیں رکھنے کے متعلق,زلفیں  رکھنے  کے  متعلق  کیا حکم  ہے ؟  اور  زلفیں کتنی ہونی چاہییں؟,"<p><p style=""text-align:justify;"">احادیث کی روشنی میں مردوں کے لیے بال رکھنا اور کاٹنا دونوں ہی ثابت ہے، بال رکھنے کی صورت میں تین طریقے مسنون ہیں:</p><p class=""indent"" style=""text-align:justify;"">1: کانوں کی لو تک، 2: کانوں کی لو اور کندھوں کے درمیان تک اور 3: کندھو ں تک۔</p><p style=""text-align:justify;""> حج وعمرہ کے موقع پر آپ صلی اللہ علیہ وسلم سے بال منڈوانا بھی ثابت ہے، اور صحابہ کرام رضی اللہ عنہم سے مستقل بال منڈوانا اور بال رکھنا بھی ثابت ہے۔</p><p style=""text-align:justify;"">بہرحال بال  بڑھ  جائیں تو  مذکورہ تین  طریقوں  میں سے کسی طریقہ کے مطابق بال رکھ  لینے  چاہییں، اگر اس کے مطابق کوئی نہ رکھے توبال کتروانے میں بہرحال اس بات کا اہتمام لازم ہے کہ ہر طرف سے برابر کتروائے جائیں ، آپ علیہ الصلاۃ و السلام نے اس طرح بال کتروانے سے منع فرمایا ہے کہ کہیں سے چھوٹے اور کہیں سے بڑے ہوں، نیز غیروں جیسی وضع قطع اختیار کرنا، ا ن جیسے بال بنوانا بھی ناجائز ہے۔ فقط واللہ  اعلم</p><p style=""text-align:justify;"">مزید تفصیل کے لیے درج ذیل لنک پر فتاویٰ دیکھیے:</p><p class=""indent"" style=""text-align:justify;""><a href=""https://www.banuri.edu.pk/readquestion/balon-ko-jangli-bal-kihna-144202200659/03-10-2020"">مسنون مقدار میں رکھے گئے بالوں کو جنگلی بال کہنا</a></p><p class=""indent"" style=""text-align:justify;""><a href=""https://www.banuri.edu.pk/readquestion/mard-ky-lie-sar-ky-balon-ki-poni-banan-144206200444/22-01-2021"">مرد کے لیے سر کے بالوں کی پونی بنانا</a></p><p class=""indent"" style=""text-align:justify;""><a href=""https://www.banuri.edu.pk/readquestion/%D8%B3%D8%B1-%DA%A9%DB%92-%D8%A8%D8%A7%D9%84%D9%88%DA%BA-%DA%A9%D8%A7-%DA%A9%DA%86%DA%BE-%D8%AD%D8%B5%DB%81-%DA%A9%D8%A7%D9%B9%D9%86%D8%A7-%DA%A9%DA%86%DA%BE-%DA%86%DA%BE%D9%88%DA%91-%D8%AF%DB%8C%D9%86%D8%A7-144102200357/28-10-2019"">سر کے بالوں کا کچھ حصہ کاٹنا کچھ چھوڑ دینا</a></p></p>",144111201075,banuri,"('حقوق و آدابِ معاشرت', 'huqooq-muashret')","('لباس / وضع قطع', 'libass-waza-qata')","('بالوں کے احکام و آداب', 'baloon-k-ahkam-o-aadab')"
10-07-2020,https://www.banuri.edu.pk/readquestion/ek-masjid-mai-mutaddid-juma-karna-ka-hukum-144111201079/10-07-2020,ایک مسجد میں متعدد جمعے کرانے کا حکم,ہمارے  یہاں  لاک  ڈاؤن  میں شدت آجانے کی وجہ سے آج ایک ہی مسجد میں ایک ہی مصلے  پر جمعہ کی پانچ سے چھ جماعتیں ہوئیں،کیا لوگوں کا ایسا کرنا درست ہے؟اور نماز ادا ہوئی یا نہیں ہوئی؟اور اگر حالات ایسے ہی رہے تو اگلے جمعہ کو کس طرح نماز ادا کی جائے؟,"<p><p style=""text-align:justify;"">بصورتِ مسئولہ ایک مسجد میں ایک مرتبہ جمعہ کی نماز کے قیام کے بعد دوسری مرتبہ اُسی مسجد میں جمعہ قائم کرنا مکروہ ہے، اگر  مسجد  کی تنگی کی وجہ سے یا کسی اور وجہ سے  ایک جماعت کی صورت میں مسجد میں تمام افراد نہ سماسکتے ہوں تو اس کی یہ صورت بھی اختیار کی جا سکتی ہے کہ مسجد کے علاوہ کسی بڑے اور کھلے میدان میں جمعہ کی نماز ادا کر لی جائے؛ تا کہ تمام افراد ایک ساتھ جمعہ کی نماز ادا کر سکیں یا حکومت کی طرف سے ایک جگہ زیادہ افراد کے اجتماع پر پابندی ہو تو  کسی بھی جگہ  کم سے کم  امام کے علاوہ تین افراد کے  ساتھ بھی جمعہ ہوجاتا ہے؛ کیوں کہ جمعہ کی نماز قائم کرنے کے لیے مسجد کی شرط نہیں، بلکہ  شہر یا بستی میں کسی بھی جگہ جمعہ کی نماز پڑھی جا سکتی ہے، ایک مسجد میں کئی جماعتیں کرانے میں شرعًا قباحت ہے ،لیکن  ایک شہر کے کئی مقامات پر الگ الگ جمعہ ہو اس میں کوئی قباحت نہیں؛ اس  لیے ایک مسجد میں متعدد جماعت کرانا شرعًا درست نہیں۔</p><p class=""indent"" style=""text-align:justify;""><span class=""ar_writing"">’’عن الحسن قال: کان أصحاب رسول الله ﷺ  إذا دخلوا المسجد، وقد صلي فیه صلوا فرادی‘‘.</span></p><p class=""indent"" style=""text-align:left;""><span class=""ar_writing"">(المصنف لابن أبي شیبة، کتاب الصلاة، باب من قال: یصلون فرادی، ولایجمعون. مؤسسة علوم القرآن جدید ۵/۵۵، رقم:۷۱۸۸)</span></p><p class=""indent"" style=""text-align:justify;"">ترجمہ: حسن بصری رحمہ اللہ سے منقول ہے کہ صحابہ کرام جب مسجد میں آتے کہ وہاں نماز ہوچکی ہوتی تو وہ انفرادی نماز ادا کرتے تھے۔</p><p class=""indent"" style=""text-align:justify;""><span class=""ar_writing"">""ولنا أنه علیه الصلاة والسلام کان خرج لیصلح بین قوم، فعاد إلی المسجد وقد صلی أهل المسجد، فرجع إلی منزله فجمع أهله وصلی"".</span></p><p class=""indent"" style=""text-align:left;""><span class=""ar_writing"">( ردالمحتار، کتاب الصلاة، باب الإمامة، ج۱ ص۸ ۵۱ ۔ط:س ۔ج۱ص۵۵۳۔۱۲)</span></p><p style=""text-align:justify;"">فتاوی رحیمیہ میں ہے:</p><p class=""indent"" style=""text-align:justify;"">’’نمازِ  جمعہ کسی بھی طرح (چاہے  مالی نقصان برداشت کرنا پڑے) اس کی اصل جگہ یعنی مسجد میں اور اگر یہ نہ ہوسکے توعبادت خانہ میں جم غفیرکے ساتھ ادا کرے ، اگر وہاں کبھی کبھار پہنچ نہ سکے توایک امام اور کم از کم تین مقتدیوں کے ساتھ کسی اور جگہ یا کارخانہ میں باجماعت ادا کرے، جہاں امام اور مؤذن مقرر ہو اور پنجگانہ نماز بروقت باجماعت ہوتی ہو وہاں جماعتِ ثانیہ مکروہ ہے ، مبسوط سرخسی میں ہے:</p><p class=""indent"" style=""text-align:justify;""><span class=""ar_writing"">""قال: (وإذا دخل القوم مسجداً قد صلی فیه أهله کرهت لهم أن یصلوا جماعةً بأذان وإقامة، ولکنهم یصلون وحداناً بغیر أذان وإقامة)؛ لحدیث الحسن: قال: کانت الصحابة إذا فاتتهم الجماعة فمنهم من اتبع الجماعات، ومنهم من صلی في مسجده بغیر أذان ولا إقامة"".</span></p><p class=""indent"" style=""text-align:left;""><span class=""ar_writing"">(مبسوط سرخسی ج۱ ص ۱۳۵) (شامی ج۱ ص۳۶۷ باب الاذان)</span></p><p class=""indent"" style=""text-align:justify;"">نیز جماعتِ ثانیہ کرنے  سے جماعتِ اولیٰ کی اہمیت ختم ہوجاتی ہے، اصل تو جماعتِ اولیٰ ہی ہے لوگ سمجھتے ہیں پہلی جماعت ملے تو ٹھیک ہے،  ورنہ دوسری جماعت کر لیں گے، یہ طریقہ غلط ہے۔‘‘</p><p class=""indent"" style=""text-align:left;"">  فقط واللہ  اعلم</p></p>",144111201079,banuri,"('نماز', 'salat')","('جمعہ کی نماز', 'jumaa')","('جمعہ و عیدین', 'juma-o-eidayn')"
10-07-2020,https://www.banuri.edu.pk/readquestion/arabic-sikhana-144111201074/10-07-2020,یوٹیوب پرعربی سکھانا,میں یوٹیوب  پر چینل بنا کر  عربی زبان سکھا رہا ہوں، میں ویڈیو میں کوئی میوزک یا فحش تصویر ایڈ نہیں کرتا، بس میری اپنی ہی تصویر آ تی ہے ویڈیو میں، اور میں نے وہ اشتہارات جو یوٹیوب لگاتا ہے، بند کیے ہوۓ ہیں، یعنی یوٹیوب کوئی اشتہار نہیں لگا سکتا، اب اس صورت میں چینل سے پیسے کمانا میرے لیے جائز ہے؟,"<p><p style=""text-align:justify;"">عربی زبان سکھا نا اچھا عمل ہے، لیکن تصویر اور ویڈیو کی اجازت اس میں بھی نہیں ۔ آپ ویڈیو میں اپنی  یا کسی بھی جان دار کی تصویر  نہ دکھائیں، اور یوٹیوب سے  پیسے کمانے میں اس کے علاوہ  کوئی  بھی ناجائز  امر  شامل نہ ہو  اور اس معاملے میں کوئی عقد فاسد بھی نہ ہو تو  کمانا جائز ہوگا۔</p><p class=""indent"" style=""text-align:justify;""><span class=""ar_writing"">""وظاهر كلام النووي في شرح مسلم: الإجماع علي تحريم تصوير الحيوان؛ و قال: وسواء لما يمتهن أو لغيره فصنعه حرام لكل حال؛ لأن فيه مضاهاة لخلق الله"".</span></p><p class=""indent"" style=""text-align:left;""><span class=""ar_writing"">(١/ ٦٤٧، ط: سعيد)</span></p><p style=""text-align:justify;""><span class=""ar_writing"">فقہ السیرہ </span> میں ہے:</p><p class=""indent"" style=""text-align:justify;""><span class=""ar_writing"">""و الحق أنه لاينبغي تكلف أي فرق بين أنواع التصوير المختلفة ... نظراً لإطلاق الحديث"". (٤/ ٩٧)</span></p><p class=""indent"" style=""text-align:left;"">فقط واللہ اعلم</p></p>",144111201074,banuri,"('حظر و اباحت', 'mamnooaat-mubahat')","('تفریح / کھیل', 'tafreeh-khel')","('ٹی وی / وی سی آر / سینما / انٹرنیٹ/تصویر سازی', 'tv-vcr-cinema-internet-taswer-sazi')"
