issued_at,link,title,question,answer,fatwa_number,dar_ul_ifta,kitab,bab,fasal
24-06-2020,https://www.banuri.edu.pk/readquestion/bevi-ka-shohar-ki-ejazt-ky-begher-meky-jana-or-wha-rahny-ka-hukam-144111200169/24-06-2020,بیوی کا شوہر کی اجازت کے بغیر میکے جانے اور وہاں رہنے کا حکم,کیا بیوی شوہر  کی اجازت کے بغیر اپنی میکے جا سکتی ہے؟ اور شوہر  کی اجازت کے بغیر بیوی میکے میں شوہر کے اجازت دیے ہوئے دنوں سے زیادہ رک سکتی ہے ؟,"<p><p style=""text-align:justify;"">بیوی کے لیے شوہر کی اجازت کے بغیر گھر سے نکلنا جائز نہیں ہے، ایسی خاتون کےبارےمیں حدیث میں وعید آئی ہے، حدیث شریف میں ہے کہ  ایک خاتون  نبی کریم ﷺ کے پاس آئی اور عرض کیا: یا رسول اللہ : شوہر کا بیوی پر کیا حق ہے؟ تو آپ ﷺ نے فرمایا : شوہر کا حق  اس پر یہ ہے کہ وہ اس کی اجازت کے بغیر اپنے گھر سے نہ نکلے، اگر وہ ایسا کرے گی تو آسمان کے فرشتہ اور رحمت وعذاب کے فرشتہ  اس پر لعنت بھیجیں گے یہاں تک کہ وہ لوٹ آئے۔</p><p style=""text-align:justify;"">بصورتِ مسئولہ بیوی کا شوہر کی اجازت کے بغیر  گھر سےنکلنا اور اپنےمیکے جانا جائز نہیں، اور  اپنے میکےمیں شوہر کے بتائے ہوئے دنوں سے زیادہ رکنا بھی جائز نہیں، اگر  اپنے شوہر کےبتائے ہوئے دنوں سے زیادہ دن شوہر  کی اجازت کے بغیر رکے گی تو  از روئے شرع نافرمان ہوگی اور شوہر کے ذمہ نفقہ بھی نہیں ہوگا۔ البتہ شوہر کی ذمہ داری ہے کہ وہ ہفتے میں ایک مرتبہ بیوی کے والدین سے اور سال میں کم از کم ایک مرتبہ اس کے محارم سے اس کی ملاقات کی اجازت دے، خواہ خود لے جاکر ملاقات کرائے یا اپنی اجازت سے بھیجے یا بیوی کے والدین کو اپنے گھر ملاقات کا موقع دے۔ میاں بیوی کا رشتہ قانون سے زیادہ اخلاق سے چلتا اور پائیدار رہتاہے، رسول اللہ ﷺ نے ارشاد فرمایا کہ تم میں سے بہترین وہ ہے جو اپنے گھروالوں (بیوی) کے ساتھ اچھا ہو، اور میں اپنے گھر والوں کے ساتھ تم سب سے زیادہ اچھا (سلوک کرنے والا) ہوں۔</p><p style=""text-align:justify;""><strong>حدیث شریف میں ہے:</strong><br/><span class=""ar_writing"">""وروي عن ابن عباس رضي الله عنهما أن امرأة من خثعم أتت رسول الله صلى الله عليه وسلم، فقالت: يا رسول الله! أخبرني ما حق الزوج على الزوجة؟؛ فإني امرأة أيم فإن استطعت وإلا جلست أيماً! قال: فإن حق الزوج على زوجته إن سألها نفسها وهي على ظهر قتب أن لا تمنعه نفسها، ومن حق الزوج على الزوجة أن لا تصوم تطوعاً إلا بإذنه فإن فعلت جاعت وعطشت ولا يقبل منها، ولا تخرج من بيتها إلا بإذنه فإن فعلت لعنتها ملائكة السماء وملائكة الرحمة وملائكة العذاب حتى ترجع، قالت: لا جرم ولا أتزوج أبداً"". رواه الطبراني"". (الترغيب والترهيب للمنذري (3/ 37)</span></p><p style=""text-align:justify;""><strong>فتاوی شامی میں ہے:</strong></p><p style=""text-align:justify;""><span class=""ar_writing"">""ولیس لها أن تخرج بلا إذنه أصلًا"". (ردالمحتار علی الدرالمختار، ج:3، ص:146، ط:ایچ ایم سعید)</span></p><p style=""text-align:justify;""><strong>فتاوی شامی میں ہے:</strong></p><p style=""text-align:justify;""><span class=""ar_writing"">""لانفقة لأحد عشر ... وخارجة من بیته بغیر حق و هي الناشزة حتی تعود"". (ردالمحتار علی الدر المختار، ج:3، ص:575، ط:ایچ ایم سعید) فقط والله أعلم </span></p></p>",144111200169,banuri,"('حقوق و آدابِ معاشرت', 'huqooq-muashret')","('حقوق', 'bahmi-huqooq')","('میاں ، بیوی کے حقوق', 'mian-biwi-k-huqooq')"
20-06-2020,https://www.banuri.edu.pk/readquestion/eddat-e-wfat-ki-muddat-144110201745/20-06-2020,عدتِ وفات کی مدت,مجھے ماہواری آتی ہے ہر ماہ۔ میرے شوہر وفات پا گئے ہیں 19 رمضان کو ۔تو کیا میری عدت 4 ماہ دس دن ہوگی یا 4 ماہواریاں اور 10 دن؟ چاہے وہ ساڑھے تین ماہ میں پوری ہوجائیں!,"<p><p style=""text-align:justify;"">شوہر  کی وفات کی عدت مہینوں کے اعتبار سے ہی ہے جو کہ چار ماہ دس دن  ہے، خواہ عورت کو ماہواری آتی ہو یا نہیں، البتہ عورت اگر حاملہ ہو تو اس کی عدت بچہ جننے تک ہوتی ہے۔  چوں کہ آپ کے شوہر کا انتقال انیس رمضان کو  ہوا ہے تو پورے  130 دن عدت گزارنا ضروری ہے۔</p><p style=""text-align:justify;""><strong>الجوھرۃ النیرۃ میں ہے:</strong></p><p style=""text-align:justify;""><span class=""ar_writing"">""وإذا مات الرجل عن امرأة الحرة فعدتها أربعة أشهر و عشرة و هذه العدة لاتجب إلا في نكاح صحيح"". (الجوهرة النيرة، ج:2، ص:154، ط:مكتبة حقانية) فقط والله أعلم</span></p></p>",144110201745,banuri,"('طلاق', 'talaaq')","('عدت', 'iddat')","('عدت', 'iddat')"
20-06-2020,https://www.banuri.edu.pk/readquestion/dsop-fund-may-milne-wale-interest-ka-hukum-144110201732/20-06-2020,ڈی ایس او پی فنڈ میں ملنے والے انٹرسٹ کا حکم,میں آرمی میں ملازمت کرتا ہوں، ہم ہر مہینہ ڈی ایس او پی فنڈ (DSOP fund) جمع کراتے ہیں جو کہ ہمیں ریٹائر ہونے کے بعد یکمشت مل جاتا ہے، اس رقم پر سالانہ انٹرسٹ لگتا ہے لیکن یہ انٹرسٹ فکس نہیں ہوتا، کسی سال زیادہ ہوتا ہے اور  کسی سال کم ہوتاہے۔ کیا یہ انٹرسٹ حلال ہے، یا سود کے زمرے میں آکے حرام ہوجاتا ہے؟ جو فنڈ ہم جمع کرتے ہیں وہ 200 روپے لازمی جمع کرانا ہوتاہے جو ہر مہینہ خود بخود تنخواہ میں کاٹ دیا جاتا ہے جب کہ اپنی مرضی سے اس کو بڑھا بھی سکتے ہیں، مزید یہ کہ اگر وہ کسی سال انٹرسٹ نہ بھی لگائیں تو ہم کو کوئی اختیار نہیں کہ ہم ان سے پوچھ سکیں۔ براۓ مہربانی رہنمائی فرمائیں۔,"<p><p style=""text-align:justify;"">صورتِ مسئولہ میں جتنی کٹوتی جبراً (غیر اختیاری) ہوتی ہے اس پر ملنے والی زائد رقم (انٹرسٹ) ملازم کے لیے لینا شرعاً جائز ہے اور جتنی رقم ملازم اپنی مرضی سے کٹواتا ہے اس پر ملنے والی زائد رقم (انٹرسٹ) لینا جائز نہیں ہے۔ فقط واللہ اعلم</p><p style=""text-align:justify;"">مزید تفصیل کے لیے درج ذیل لنک ملاحظہ فرمائیں:</p><p style=""text-align:justify;""><a href=""https://www.banuri.edu.pk/readquestion/%DA%88%DB%8C-%D8%A7%DB%8C%D8%B3-%D9%BE%DB%8C-%D9%81%D9%86%DA%88-%DA%A9%D8%A7-%D8%AD%DA%A9%D9%85-144107200558/09-03-2020"">ڈی ایس پی فنڈ کا حکم</a></p><p style=""text-align:justify;""><a href=""https://www.banuri.edu.pk/readquestion/%D8%AC%DB%8C-%D9%BE%DB%8C-%D9%81%D9%86%DA%88-144105200795/18-01-2020"">جی پی فنڈ</a></p><p style=""text-align:justify;""><a href=""https://www.banuri.edu.pk/readquestion/%D8%AC%DB%8C-%D9%BE%DB%8C-%D9%81%D9%86%DA%88-gp-fund-%DA%A9%DB%8C-%D9%85%D8%AF-%D9%85%DB%8C%DA%BA-%D8%B3%D8%B1%DA%A9%D8%A7%D8%B1%DB%8C-%D8%A7%D8%AF%D8%A7%D8%B1%DB%92-%DA%A9%DB%8C-%D8%AC%D8%A7%D9%86%D8%A8-%D8%B3%DB%92-%D9%85%D9%84%D9%86%DB%92-%D9%88%D8%A7%D9%84%DB%8C-%D8%A7%D8%B6%D8%A7%D9%81%DB%8C-%D8%B1%D9%82%D9%85-%DA%A9%D8%A7-%D8%AD%DA%A9%D9%85/02-06-2019"">جی پی فنڈ (GP Fund) کی مد میں سرکاری ادارے کی جانب سے ملنے والی اضافی رقم کا حکم</a></p></p>",144110201732,banuri,"('معاملات', 'muamlat')","('سود / بینکاری / انشورنس / شیئرز', 'sood-bankari-insurance-shares')","('پراویڈنٹ فنڈ', 'provident-fund')"
20-06-2020,https://www.banuri.edu.pk/readquestion/bank-ka-khaty-daron-ki-ejazat-ky-beghar-jma-shuda-raqam-se-zkat-ada-karny-ka-hukam-144110201750/20-06-2020,بینک والوں کا کھاتےداروں کی اجازت کے بغیر جمع شدہ رقم سے زکوۃ ادا کرنےکا حکم,کیا فرماتے ہیں مفتیان کرام کہ اگر بینک کسی کی رقم بغیر اس کی رضامندی کے کاٹ لے تو کیا اس کی زکوٰۃ ادا ہو جائے گی؟,"<p><p style=""text-align:justify;"">بصورت مسئولہ اگر بینک والے کھاتے داروں کی اجازت کےبغیر   زکوۃ ادا کرتےہیں خواہ وہ اصل رقم سے ہو یا اصل رقم سے نہ ہو بلکہ نفع کے نام سے جمع ہونے والی سود کی رقم سے ہو  تو  زکوۃ ادا نہیں ہوگی، ایسی صورت میں کھاتے داروں پر لازم ہے کہ وہ اپنی زکوۃ خود ادا کریں۔</p><p style=""text-align:justify;"">واضح رہے کہ بوقتِ ضرورت بینک میں غیر سودی کھاتہ کھولنے کی اجازت ہے، اور بینک غیر سودی اکاؤنٹ سے زکات بھی نہیں کاٹتے، لہذا اپنا اکاؤنٹ تبدیل کرکے کرنٹ اکاؤنٹ بنادیجیے۔ اور اگر اپنے اختیار سے سودی اکاؤنٹ کھولا ہو تو توبہ و استغفار بھی کیجیے۔</p><p><strong>بدائع الصنائع میں ہے:</strong></p><p style=""text-align:justify;""><span class=""ar_writing"">ان الزکوة عبادة عندنا و العبادة لاتتادی الا باختیار من علیه اما بمباشرته بنفسه او بامره وانابتة غیره فیقوم النائب مقامه فیصیر  هو مؤدیا بید النائب. (بدائع الصنائع فی ترتیب الشرائع، ج:2، ص:53، ط:ایچ ایم سعید)</span></p><p><strong>فتاوی شامی میں ہے:</strong></p><p style=""text-align:justify;""><span class=""ar_writing"">ان الساعی لو اخزها منه کرها لایسقط الفرض عنه فی الاموال الباطنة. (ردالمحتار علی الدرالمختار، ج:2، ص:268،ط:ایچ سعید) </span><strong style=""font-family:arabic,serif;font-size:19px;font-weight:bold;""> فقط والله اعلم</strong></p></p>",144110201750,banuri,"('زکات', 'zakat')","('زکوٰۃ / صدقات', 'zakat-sadaqat')","('ادائے زکوٰۃ', 'adaye-zakat')"
24-04-2020,https://www.banuri.edu.pk/readquestion/maa-ka-mary-huway-bacchyko-ghusal-daina-144109200057/24-04-2020,ماں کا مرے ہوئے بچے کو غسل دینا,ماں اپنے چند ماہ کے مرے ہوئے بچہ کو غسل دے سکتی ہے ?,"<p><p style=""text-align:justify;"">ماں اپنے چند ماہ کے مرے ہوئے بچے کو غسل دے سکتی ہے۔ فقط و اللہ اعلم</p></p>",144109200057,banuri,"('جنائز', 'janaiz')","('نماز جنازہ', 'namaz-e-jinazah')","('جنازہ اور نماز جنازہ کے احکام (فرائض، سنن، مستحبات، مکروہات)', 'janaza-or-namaz-e-janaza')"
28-12-2019,https://www.banuri.edu.pk/readquestion/زاویار-نام-رکھنا-144105200017/28-12-2019,زاویار نام رکھنا,زاویار نام  رکھنا جائز ہے ؟ اس نام کے معنی کیاہیں ؟,"<p><p style=""text-align:justify;"">زاویار لفظ ہمارے ہاں متداول زبانوں ( عربی ،اردو اور فارسی ) میں نہیں مل سکا ، البتہ 'زوار'('زا' پر زبر 'واو'  پر تشدید کے ساتھ) نام رکھنا جائز ہے، اس کے معنی عربی زبان میں 'بہت ملاقات کرنے والا/ بہت اسفار اور دورے کرنے والا۔(قاموس الوحید ص 727، ط ادارہ اسلامیات)فقط واللہ اعلم</p></p>",144105200017,banuri,"('حقوق و آدابِ معاشرت', 'huqooq-muashret')","('حقوق', 'bahmi-huqooq')","('اولاد کے حقوق', 'olad-ky-hoqoq')"
30-04-2020,https://www.banuri.edu.pk/readquestion/shohar-ko-baba-kah-kar-pukarnay-ka-hukum-144109200759/30-04-2020,شوہر کو ’’بابا‘‘ کہہ کر پکارنے کا حکم,بیوی کا اپنے شوہر کا نام لینے  کے بجائے (بابا ) کہہ کر پکارنا کیسا ہے ؟,"<p><p style=""text-align:justify;"">بیوی کے لیے ادب کی بات یہی ہے کہ وہ شوہر کو اس کے اصلی نام سے نہ پکارے، بلکہ کسی لقب یا کنیت وغیرہ سے پکارے، لیکن ہمارے عرف میں  چوں کہ لفظ ’’بابا‘‘ (سیاق سباق سے صرفِ نظر کر کے)  عام طور سے والد یا دادا وغیرہ کے لیے استعمال ہوتا ہے اس لیے شوہر کو ’’بابا‘‘ کہہ کر پکارنا مناسب نہیں ہے، اس کے بجائے کسی دوسرے لفظ سے پکارنا مناسب رہے گا۔</p><p style=""text-align:justify;"">تاہم شوہر کو بابا کہنے سے نکاح پر اثر نہیں پڑا۔ فقط واللہ اعلم</p></p>",144109200759,banuri,"('حقوق و آدابِ معاشرت', 'huqooq-muashret')","('حقوق', 'bahmi-huqooq')","('میاں ، بیوی کے حقوق', 'mian-biwi-k-huqooq')"
23-04-2020,https://www.banuri.edu.pk/readquestion/ramazan-sy-pehly-sadaqa-ada-karna-144108201976/23-04-2020,رمضان المبارک سے پہلے صدقہ فطر ادا کرنا,موجودہ حالات کے پیشِ نظر قبل از رمضان صدقہ فطر فقراء کو دیناجائز ہے؟,"<p><p style=""text-align:justify;"">عید کے دن سے پہلے صدقہ فطر  کی ادائیگی کی صورت میں فقہاءِ کرام کے دو طرح کے اقوال کتبِ فقہ میں ملتے ہیں، ایک قول  یہ ہے کہ صدقۂ فطر رمضان المبارک کے مہینے میں کسی بھی دن دینا جائز ہے؛ البتہ رمضان المبارک سے قبل ادا کرنا درست نہ ہوگا، جب کہ دوسرا قول یہ ہے کہ صدقہ فطر کا حکم بھی زکاۃ  کی طرح ہے یعنی چاہے رمضان میں ادا کیا جائے یا رمضان سے بھی پہلے ادا کیا جائے دونوں صورتوں میں صدقہ فطر ادا ہوجائے گا۔</p><p style=""text-align:justify;"">عبادات میں چوں کہ احتیاط کو پیشِ نظر رکھنا شریعت میں مطلوب ہے؛ اس لیے پہلے والے قول پر عمل کرنا چاہیے، چناں چہ صدقہ فطر عید سے پہلے رمضان میں جس وقت چاہے ادا کرلیا جائے،  البتہ رمضان سے پہلے ادا نہیں کرنا چاہیے۔</p><p style=""text-align:justify;""><span class=""ar_writing"">البحر الرائق شرح كنز الدقائق (6 / 121)<br/>
( قوله : وصح لو قدم أو أخر ) أي صح أداؤها إذا قدمه على يوم الفطر أو أخره أما التقديم فلكونه بعد السبب ؛ إذ هو الرأس ، وأما الفطر فشرط الوجوب كما قدمناه ··· فصار كتقديم الزكاة على الحول بعد ملك النصاب بمعنى أنه لا فارق لا أنه قياس فاندفع به ما في فتح القدير من أن حكم الأصل على خلاف القياس فلا يقاس لكنه وجد فيه دليل ، وهو حديث البخاري وكانوا يعطون قبل الفطر بيوم أو بيومين وأطلق في التقديم فشمل ما إذا دخل رمضان وقبله وصححه المصنف في الكافي ، وفي الهداية والتبيين وشروح الهداية ، وفي فتاوى قاضي خان وقال خلف بن أيوب : يجوز التعجيل إذا دخل رمضان ، وهكذا ذكره الإمام محمد بن الفضل ، وهو الصحيح في فتاوى الظهيرية والصحيح أنه يجوز تعجيلها إذا دخل شهر رمضان ، وهو اختيار الشيخ الإمام أبي بكر محمد بن الفضل وعليه الفتوى ا هـ ، فقد اختلف التصحيح كما ترى لكن تأيد التقييد بدخول رمضان بأن الفتوى عليه فليكن العمل عليه </span></p><p><span class=""ar_writing"">تاتارخانیة (۳ : ۴۵۲)</span></p><p style=""text-align:justify;""><span class=""ar_writing"">""والمختار إذا دخل شهر رمضان یجوز وقبله لایجوز، وفي الظهيرية : وعلیه الفتویٰ"". فقط والله أعلم</span></p></p>",144108201976,banuri,"('زکات', 'zakat')","('زکوٰۃ / صدقات', 'zakat-sadaqat')","('صدقۃ الفطر', 'sadaqa-tul-fitr')"
