issued_at,link,title,question,answer,fatwa_number,dar_ul_ifta,kitab,bab,fasal
07-05-2020,https://www.banuri.edu.pk/readquestion/ludo-khailnay-ka-hukum-144109201475/07-05-2020,لوڈو (Ludo) کھیلنے کا حکم,لوڈو کھیلنا جائز ہے یا نہیں ؟,"<p><p style=""text-align:justify;"">واضح رہے کہ  دین اسلام کھیل اور تفریح سے مطلقاً  منع نہیں کرتا، بلکہ اچھی اور صحت مند تفریح کی حوصلہ افزائی کرتا ہے، چناچہ بعض کھیل ایسے ہیں  جن کی اجازت خود نبی کریم ﷺ سے ثابت ہے،  جیساکہ سنن ابی داؤد میں ہے:</p><p style=""text-align:justify;""><span class=""ar_writing"">""عن عقبة بن عامر قال: سمعت رسول الله صلى الله عليه وسلم يقول: إن الله عز وجل يدخل بالسهم الواحد ثلاثة نفر الجنة، صانعه يحتسب في صنعته الخير، والرامي به، ومنبله. وارموا، واركبوا، وأن ترموا أحب إلي من أن تركبوا. ليس من اللهو إلا ثلاث: تأديب الرجل فرسه، وملاعبته أهله، ورميه بقوسه ونبله، ومن ترك الرمي بعد ما علمه رغبة عنه، فإنها نعمة تركها «، أو قال:» كفرها"". </span>(1/363، کتاب الجہاد، ط؛ رحمانیہ)</p><p style=""text-align:justify;"">ترجمہ:   حضرت عقبہ بن عامر سے روایت ہے کہ میں نے جناب رسول اللہ ﷺ کو یہ فرماتے ہوئے سنا کہ اللہ تعالیٰ ایک تیر کے سبب تین آدمیوں کو جنت میں داخل کرے گا: ایک اس کے بنانے والے کو جو کہ اپنے پیشہ میں ثواب کی امید رکھے گا۔ دوسرا تیر پھینکنے والے کو (یعنی جو دوران جنگ تیر استعمال کرے گا) تیسرے اس شخص کو جو تیر انداز کو تیر اٹھا کر دیتا ہے,  پس تیر اندازی کرو اور سواری کرو (یعنی تیر اندازی اور گھوڑ سواری سیکھو) لیکن میرے نزدیک سواری کی نسبت تیر اندازی زیادہ پسندیدہ ہے (کیوں کہ تیر اندازی پیادہ بھی کر سکتا ہے)۔  (ہمارے دین میں) کوئی کھیل نہیں ہے مگر تین چیزیں: ایک اپنے گھوڑے کی تربیت کرنا۔ دوسرے بیوی کے ساتھ چھیڑ چھاڑ۔ تیسرے اپنے تیر کمان سے تیر اندازی کرنا۔ اور جو شخص تیر اندازی سیکھنے کے بعد اس کو غیر اہم سمجھ کر چھوڑ دے تو اس کو جان لینا چاہیے کہ تیر اندازی ایک نعمت تھی جو اس نے چھوڑ دی یا یہ فرمایا اس نے نعمت کی ناقدری کی۔</p><p style=""text-align:justify;"">  مذکورہ حدیث میں تین کھیلوں کو لہو لعب سے مستثنیٰ کیا گیا ہے، کیوں کہ  ”لہو “   اس  کام کو کہا جاتا ہے جس میں کوئی دینی یا دنیوی فائدہ نہ ہو ، جب کہ یہ تینوں  مفید کام ہیں جن سے بہت سے دینی اور دنیوی فوائد وابستہ ہیں ، تیراندازی اور گھوڑے کو سدہانا تو جہاد کی تیاری میں داخل ہے اور بیوی کے ساتھ  ملاعبت  توالد و تناسل کے مقصد کی تکمیل ہے، چناچہ فقہاء کرام نے  ذخیرہ احادیث کو سامنے رکھ کر   چند اصول مرتب کیے ہیں،  جن پر غور کرنے سے موجودہ زمانے کے تمام کھیلوں کا حکم معلوم ہوجاتا ہے، وہ اصول درج ذیل ہیں:</p><p style=""text-align:justify;""><strong>1۔۔</strong>  وہ کھیل بذاتِ خود جائز ہو، اس میں کوئی ناجائز   بات نہ ہو۔</p><p style=""text-align:justify;""><strong>2۔۔</strong>اس کھیل میں کوئی دینی یا دنیوی منفعت مثلاً جسمانی  ورزش وغیرہ ہو، محض لہو لعب یا وقت گزاری کے لیے نہ کھیلا جائے۔</p><p style=""text-align:justify;""><strong>3۔۔</strong> کھیل میں غیر شرعی امور کا ارتکاب نہ کیا جاتا  ہو۔</p><p style=""text-align:justify;""><strong>4۔۔</strong>کھیل میں اتنا غلو نہ کیا جائے  کہ جس سے شرعی فرائض میں کوتاہی یا غفلت پیدا ہو۔</p><p style=""text-align:justify;"">لہذا ’’لوڈو‘  میں اگر خلافِ شرع امور کا ارتکاب  ہو ، حقوق اللہ (نماز و غیرہ) اور  حقوق العباد میں کوتاہی ہو، فرائض و واجبات کا ترک لازم  آتا ہو  اور گناہ کا ارتکاب (مثلاً شرط لگا کر کھیلنا یا جوا لگانا )  ہو تو یہ بالکل ناجائز ہے، اگر  تفریحِ طبع کے لیے ہو تو بھی وقت کا ضیاع ہے  جو کہ جائز نہیں ہے،  نیز اس طرح کے کھیلوں میں عموماً انہماک اس درجہ کا ہوتا ہے  کہ نماز و دیگر امور میں غفلت ہوجاتی ہے، اور اس بے مقصد کھیل میں قیمتی وقت کا ضیاع ہوتا ہی ہے، نیز ایسے کھیلوں میں انہماک کی وجہ سے دل ودماغ اکثر اوقات ان ہی چیزوں کی طرف متوجہ رہتاہے اور خدا کی یاد سے غافل رہتاہے، لایعنی امور میں ایسا انہماک شرعاً ناپسندیدہ ہے، مسلمان کا دل ودماغ ہر وقت یادِ خدا  اور آخرت کی تیاری میں مشغول رہنا چاہیے، اور وقت کو با مقصد کاموں میں  لگانا چاہیے جن میں دینی و دنیوی یا کم از کم دنیوی فائدہ ہو ، لہذا  ایسے بے مقصد اور لایعنی کھیلوں سے بہرصورت اجتناب کرناچاہیے،   اپنے قیمتی وقت کو اچھے اور نیک کاموں میں خرچ کرنا چاہیے۔</p><p style=""text-align:justify;"">فتاویٰ مفتی محمود میں ہے:</p><p style=""text-align:justify;"">’’تاش کھیلنا یا لڈو کھیلنا بہت برا ہے، اور اگر اس پر ہار  جیت کی ہو تو جوا ہے اور بالکل حرام ہے، گناہِ کبیرہ سے بچنا ہر مسلمان پر فرض ہے، ایک گناہ سے بچنے کے لیے دوسرے گناہ کو اختیار کرنا بھی جائز نہیں ہے، کامیاب مؤمنین کی شان اللہ تبارک وتعالیٰ نے قرآنِ مجید میں یوں بیان کی ہے۔ <span class=""ar_writing"">{وَالَّذِیْنَ هُمْ عَنِ اللَّغْوِ مُعْرِضُوْنَ} </span> کامیاب مؤمنین وہ ہیں جو لہو ولعب سے اعراض کرتے ہیں۔</p><p style=""text-align:justify;"">حضرت شیخ الہندؒ لکھتے ہیں کہ: ’’خود تو لہو ولعب میں مصروف نہیں ہوئے، بلکہ اگر کوئی اور شخص بھی لہو ولعب میں مصروف ہو تو اس سے بھی اعراض کرتے ہیں‘‘۔  (ماخوذ از فتاویٰ مفتی محمود ج: 11، ص: 259، باب الحظر والاباحۃ، ط: اشتیاق پریس لاہور)</p><p style=""text-align:justify;"">نیز حدیث شریف میں رسول کریم صلی اللہ علیہ وسلم کا ارشاد گرامی ہے: ’’ انسان کے اسلام کی خوبی یہ ہے کہ وہ اس چیز کو چھوڑ دے جو بے فائدہ ہے ‘‘۔ [مالک، احمد]</p><p style=""text-align:justify;"">ایک اور حدیث شریف میں نبی کریم صلی اللہ علیہ وسلم کا ارشاد گرامی ہے: ’’۔۔۔ یاد رکھو! انسان جس چیز کو لہو ولعب (یعنی محض کھیل اور تفریح) کے طور پر اختیار کرے وہ باطل اور ناروا ہے، مگر اپنی کمان سے تیر اندازی کرنا، اپنے گھوڑے کو سدھارنا اور اپنی بیوی کے ساتھ کھیل وتفریح کرنا، یہ سب چیزیں حق ہیں‘‘۔(ترمذی، ابن ماجہ)</p><p style=""text-align:justify;"">لہذا صورتِ مسئولہ میں بے مقصد کھیل و تفریح میں وقت ضائع نہ کیا جائے، بلکہ فارغ اوقات اللہ کی یاد  تلاوت قرآن مجید  و دیگر با مقصد کاموں میں صرف کرنے کی عادت بنائی جائے۔ فقط واللہ اعلم</p></p>",144109201475,banuri,"('حظر و اباحت', 'mamnooaat-mubahat')","('تفریح / کھیل', 'tafreeh-khel')","('مختلف قسم کے کھیل', 'mukhtalif-qism-k-khel')"
07-05-2020,https://www.banuri.edu.pk/readquestion/hafiza-bevi-ka-taraweeh-main-luqma-dena-144109201479/07-05-2020,حافظہ بیوی کا تراویح میں لقمہ دینا,اگر گھر میں کوئی تراویح کی نماز میں ختم سنا رہا ہو اور بیوی حافظہ ہو اور امام کو فتحہ دینے کی حاجت ہو تو کیا بیوی فتحہ دے سکتی ہے جب کہ کوئی غیر محرم بھی جماعت میں شامل نہ ہو؟ امام مالک رح کے مذہب میں تو اس کی مطلقاً اجازت ہے۔ اگر مذہبِ حنفی اس کی اجازت نہیں دیتا تو کیا اس مخصوص مسئلے میں مالکیہ کے مذہب کو لینے میں کوئی حرج ہے؟ خاص طور پر لاک ڈاون کے زمانے میں جہاں مرد سامع ملنا مشکل ہے۔,"<p><p style=""text-align:justify;"">اگر عورت نماز میں شامل ہو اور  غلطی آنے پر اپنے امام کولقمہ  دے دے  اور امام لقمہ لے لے تو اس سے نماز فاسد نہیں ہوگی۔ تاہم عورت کے لیے لقمہ دینے کا طریقہ یہ ہے کہ غلطی آنے پر  بائیں ہاتھ   کی  پشت پر دائیں ہاتھ سے مار کر امام کو متوجہ کردے اور امام غلطی کی اصلاح نہ کرسکے تو اسے چاہیے کہ رکوع کرلے، اور پھر بعد میں اصلاح کرلے۔ عورت کے لیے دورانِ نماز تلاوت کرکے غلطی بتائے بغیر بھی غلطی کی نشان دہی اور اصلاح ہوسکتی ہے، اس لیے عورت کو زبان سے لقمہ دینے کی حاجت نہیں ہے۔</p><p style=""text-align:justify;"">’’فتاوی شامی‘‘ میں ہے:</p><p style=""text-align:justify;""><span class=""ar_writing"">"" تكره إمامة الرجل لهن في بيت ليس معهن رجل غيره ولا محرم منه) كأخته (أو زوجته أو أمته، أما إذا كان معهن واحد ممن ذكر أو أمهن في المسجد لا) يكره، بحر"".  (1/ 566، باب الإمامة، ط: سعید)</span></p><p style=""text-align:justify;""><span class=""ar_writing"">وفیه أیضًا:</span></p><p style=""text-align:justify;""><span class=""ar_writing"">""(قوله: وصوتها) معطوف على المستثنى يعني أنه ليس بعورة ح (قوله: على الراجح) عبارة البحر عن الحلية: أنه الأشبه. وفي النهر: وهو الذي ينبغي اعتماده. ومقابله ما في النوازل: نغمة المرأة عورة، وتعلمها القرآن من المرأة أحب. قال عليه الصلاة والسلام: «التسبيح للرجال، والتصفيق للنساء»، فلايحسن أن يسمعها الرجل. اهـ. وفي الكافي: ولاتلبي جهراً؛ لأن صوتها عورة، ومشى عليه في المحيط في باب الأذان، بحر. قال في الفتح: وعلى هذا لو قيل: إذا جهرت بالقراءة في الصلاة فسدت كان متجهاً، ولهذا منعها عليه الصلاة والسلام  من التسبيح بالصوت لإعلام الإمام بسهوه إلى التصفيق اهـ وأقره البرهان الحلبي في شرح المنية الكبير، وكذا في الإمداد؛ ثم نقل عن خط العلامة المقدسي: ذكر الإمام أبوالعباس القرطبي في كتابه في السماع: ولايظن من لا فطنة عنده أنا إذا قلنا: صوت المرأة عورة أنا نريد بذلك كلامها؛ لأن ذلك ليس بصحيح، فإذا نجيز الكلام مع النساء للأجانب ومحاورتهن عند الحاجة إلى ذلك، ولانجيز لهن رفع أصواتهن ولا تمطيطها ولا تليينها وتقطيعها لما في ذلك من استمالة الرجال إليهن وتحريك الشهوات منهم، ومن هذا لم يجز أن تؤذن المرأة. اهـ. قلت: ويشير إلى هذا تعبير النوازل بالنغمة"". (1/ 406)</span></p><p style=""text-align:justify;""><span class=""ar_writing"">حاشية الطحطاوي على مراقي الفلاح  (ص: 199):<br/>
""قوله: ""لأنه عورة"" ضعيف، والمعتمد أنه فتنة فلاتفسد برفع صوتها صلاتها"".</span></p><p style=""text-align:justify;""><span class=""ar_writing"">البحر الرائق شرح كنز الدقائق (1/ 285):</span></p><p style=""text-align:justify;""><span class=""ar_writing"">""وفي شرح المنية: الأشبه أن صوتها ليس بعورة، وإنما يؤدي إلى الفتنة كما علل به صاحب الهداية وغيره في مسألة التلبية، ولعلهن إنما منعن من رفع الصوت بالتسبيح في الصلاة لهذا المعنى، ولايلزم من حرمة رفع صوتها بحضرة الأجانب أن يكون عورةً"".</span></p><p style=""text-align:justify;""><span class=""ar_writing"">غمز عيون البصائر – (3 / 383):</span></p><p style=""text-align:justify;""><span class=""ar_writing"">""وصوتها عورة في قول. في شرح المنية: الأشبه أن صوتها ليس بعورة وإنما يؤدي إلى الفتنة. وفي النوازل: نغمة المرأة عورة، وبنى عليه أن تعلمها القرآن من المرأة أحب إلي من تعلمها من الأعمى، ولذا قال عليه الصلاة والسلام: التسبيح للرجال والتصفيق للنساء، فلايجوز أن يسمعها الرجل، كذا في الفتح</span>"".  فقط واللہ اعلم</p></p>",144109201479,banuri,"('نماز', 'salat')","('تراویح', 'taraweeh')","('تراویح', 'taraweeh')"
07-05-2020,https://www.banuri.edu.pk/readquestion/ghuzishta-sal-aur-is-saal-ki-zakat-ada-krna-144109201480/07-05-2020,گزشتہ سال اور اس سال کی زکات ادا کرنا,اگر کسی پر  پچھلے سال زکات واجب ہوگئی تھی اس نے لا علمی میں نہیں نکالی تو اس سال دو سال کی زکات اکٹھی ہوگئی ہے تو  کس طرح سے نکالی جائے گی؟,"<p><p style=""text-align:justify;"">اگر کسی شخص نے زکات واجب ہونے کے باجود لاعلمی میں ایک سال کی زکات ادا نہیں کی تو اس پر گزشتہ سال کی زکوٰۃ ادا کرنا بھی واجب ہے، گزشتہ سال کی زکوٰۃ کا حساب کرکے اس کا چالیسواں حصہ (ڈھائی فیصد) زکوٰۃ میں نکالیں،  اگر سونایا چاندی ہے تو  اس میں موجودہ قیمت کے حساب سے اس کے چالیسویں حصہ کی قیمت ادا کرنا ہوگی،  اور اس مقدار کو  اس سال کی زکاۃ  نکالتے وقت منہا کرکے پھر اس سال جو رقم بنے اس کی ڈھائی فیصد  زکوٰۃ ادا کریں۔</p><p style=""text-align:justify;"">مثلاً: کل موجودہ رقم اور سونا وغیرہ سب ملاکر ایک لاکھ روپے ہے تو گزشتہ سال کی زکاۃ ڈھائی ہزار روپے ہوگی، پھر اسے منہا کرکے اس سال <span class=""eng_writing"">97,500</span> روپے کی زکات نکالنی ہوگی، جو  <span class=""eng_writing"">2,437.5</span>روپے ہوگی، یعنی ایک لاکھ میں دو سال کی زکات <span class=""eng_writing"">4,937.5</span>روپے ہوگی۔</p><p style=""text-align:justify;"">        <strong>بدائع الصنائع  میں ہے:</strong></p><p style=""text-align:justify;""><span class=""ar_writing"">""وأما وجوب الزكاة فمتعلق بالنصاب إذ الواجب جزء من النصاب، واستحقاق جزء من النصاب يوجب النصاب إذ المستحق كالمصروف … وبيان ذلك أنه إذا كان لرجل مائتا درهم أو عشرين مثقال ذهب فلم يؤد زكاته سنتين يزكي السنة الأولى، وليس عليه للسنة الثانية شيء عند أصحابنا الثلاثة، وعند زفر يؤدي زكاة سنتين، وكذا هذا في مال التجارة، وكذا في السوائم إذا كان له خمس من الإبل السائمة مضى عليها سنتان ولم يؤد زكاتها أنه يؤدي زكاة السنة الأولى وذلك شاة ولا شيء عليه للسنة الثانية، ولو كانت عشراً وحال عليها حولان يجب للسنة الأولى شاتان وللثانية شاة، ولو كانت الإبل خمساً وعشرين يجب للسنة الأولى بنت مخاض وللسنة الثانية أربع شياه. ولو كان له ثلاثون من البقر السوائم يجب للسنة الأولى تبيع أو تبيعة ولا شيء للسنة الثانية وإن كانت أربعين يجب للسنة الأولى مسنة وللثانية تبيع أو تبيعة"".</span> (2/7، کتاب الزکاۃ، ط: سعید)  فقط واللہ اعلم</p></p>",144109201480,banuri,"('زکات', 'zakat')","('زکوٰۃ / صدقات', 'zakat-sadaqat')","('وجوب زکوٰۃ کی تفصیل', 'wujob-e-zakat-ki-tafseel')"
05-09-2019,https://www.banuri.edu.pk/readquestion/ایک-ہی-شخص-کا-بیک-وقت-بائع-اور-مشتری-بننا-144012200959/05-09-2019,ایک ہی شخص کا بیک وقت بائع اور مشتری بننا,زید نے عمر کو پانچ لاکھ روپے کاروبار کے لیے دیے، عمر کا مرغی اور انڈے کابہت بڑا کام ہے،  اس نے ہزاروں دیسی مرغیوں کافارم لگایا ہواہے، عمر نے کہا کہ بھائی  میں آپ کے ساتھ اس طرح کا کام کروں گا کہ چوں کہ میری مرغیوں کے روزانہ  انڈے آتے ہیں اوراس کاروزانہ الگ مارکیٹ ریٹ نکلتا ہے تو جس قیمت پر میں مارکیٹ کو دیتا ہوں اس سے کچھ کم قیمت پر آپ کے پیسے کے مطابق انڈوں کی مقدار کو پہلے آپ کے نام کروں گا، یہ تصور کرتے ہوئے  کہ یہ مقدار میں نے عمر بھائی  کے دیے ہوئے پیسے کے عوض اس کے ہاتھ بیچ دیا، اس کے بعد پھر آپ کی طرف سے وکیل کے طور پر میں بیچوں گا تو جو نفع یا نقصان ہوگااس بیچنے میں وہ آپ کا ہوگا؟,"<p><p style=""margin-left:0;margin-right:0;text-align:justify;"">زید اور عمر کے درمیان شرکت کی مذکورہ بالا صورت چوں کہ شرعی اصولوں کے مطابق نہیں، اس لیے یہ صورت جائز نہیں ہے، البتہ جواز کی صورت یہ ہے کہ :</p><p style=""margin-left:0;margin-right:0;text-align:justify;"">زید ٗعمر کے کاروبار میں نفع ونقصان دونوں کی بنیاد پر شراکت داری اختیار کرے، چوں کہ عمر کا سرمایہ پہلے سے موجود ہے؛ لہذا اب زید ،عمر کے ساتھ اس کے کاروبار میں جب شریک ہوگا تو نفع ونقصان دونوں میں شراکت داری کرے گا۔</p><p style=""margin-left:0;margin-right:0;text-align:justify;"">باہمی طور پر سرمایہ اور عمل کے بقدر ہرایک کے لیے کاروبار میں سے نفع کے حصص متعین کردیے جائیں، کسی ایک فریق کے لیے نفع زیادہ اور دوسرے کے لیے کم بھی مقرر کرسکتے ہیں (مثلاً کسی ایک کے لیے نفع کا ساٹھ  فیصد دوسرے کے لیے چالیس فیصد وغیرہ)، البتہ متعین نفع(مثلاً ہر مہینے  پانچ یا دس ہزار روپے ) مقرر کر کے شراکت داری کرنا شرعاً ممنوع ہے۔ نیز نقصان میں بھی سرمایہ کے بقدرشریک ہوں،  پھر کاروبار میں جو نفع ہو وہ طے شدہ حصص کے مطابق آپس میں تقسیم کرلیں تو جائز ہوگا۔ لیکن مذکورہ بالا صورت میں ایک ہی فرد یعنی عمر خود بائع بھی بن رہاہے اور خود مشتری بھی،جب کہ سامان پر زید کا قبضہ موجود ہی نہیں، اس لیے یہ صورت جائز نہیں ہے۔</p><p style=""margin-left:0;margin-right:0;text-align:justify;"">نیز شراکت داری میں یہ صورت بھی اختیار کی جاسکتی ہے کہ عمر اپنے چلتے کاروبار اور سابقہ لگے ہوئے سرمائے میں ہی زید کا سرمایہ بھی شامل کرکے باہم معاہدہ کرلے۔ اور یہ صورت بھی اختیار کی جاسکتی ہے کہ زید کے سرمائے کے ساتھ  عمر اپنا سرمایہ شامل کیے بغیر خالص زید کے سرمائے سے الگ سودا کرے، اور اس کا حساب الگ رکھے، اور مضاربت کے اصول پر اس سودے کے نفع میں فیصدی تناسب سے دونوں کی شرکت کا معاہدہ ہوجائے۔ فقط واللہ اعلم</p></p>",144012200959,banuri,"('معاملات', 'muamlat')","('بیع / تجارت', 'bay-tijarat')","('بیع صحیح ، فاسد اور باطل', 'bay-sahih-fasid-or-batil')"
