issued_at,link,title,question,answer,fatwa_number,dar_ul_ifta,kitab,bab,fasal
19-04-2020,https://www.banuri.edu.pk/readquestion/chera-miti-hoi-tsveer-144108201723/19-04-2020,چہرہ مٹی ہوئی تصویر کا حکم,مرد و عورت کی ایسی تصویر بنانا جس میں چہرہ مٹا ہوا ہو،  کیا حکم ہے؟  در اصل میرا کپڑوں کا کام ہے، ایسی تصویر بنانے کا مقصد کپڑوں کی نمائش ہے؟,"<p><p style=""margin-left:0;margin-right:0;text-align:justify;"">جان دار کی  تصویر میں  اگر  اس طرح کا تصرف کردیا جائے کہ  دیکھنے کے بعد جان دار کی تصویر معلوم نہ ہوتی  ہو تو وہ حرام تصویر کے زمرے سے نکل جاتی ہے، لیکن اگر اس تصویر کو دیکھنے سے جان دار کی حکایت ہورہی ہو تو وہ پھر بھی حرام تصویر ہی رہتی ہے۔ لہذا اگر تصویر سے محض ناک کان ہونٹ  ہٹادیے جائیں تب بھی ناک، کان اور ہونٹ نہ ہونے کے باجودجان دار کی حکایت ہوتی ہے؛ اس لیے ایسی تصویر جائز نہ ہوگی۔البتہ اگر چہرہ (یعنی سر) مکمل کاٹ دیاجائے اس صورت میں چوں کہ جاندار کی حکایت نہیں ہوتی، یہ صورت درست ہوگی۔</p><p style=""margin-left:0;margin-right:0;text-align:justify;"">البحر الرائق میں ہے:</p><p style=""margin-left:0;margin-right:0;text-align:justify;""><span class=""ar_writing"">""(قوله: أو مقطوع الرأس) أي سواء كان من الأصل أو كان لها رأس ومحي وسواء كان القطع بخيط خيط على جميع الرأس حتى لم يبق لها أثر أو يطليه بمغرة ونحوها أو بنحته أو بغسله وإنما لم يكره؛ لأنها لاتعبد بدون الرأس عادةً؛ ولما رواه أحمد عن علي قال «كان رسول الله صلى الله عليه وسلم في جنازة فقال: أيكم ينطلق إلى المدينة فلايدع بها وثناً إلا كسره ولا قبراً إلا سواه ولا صورةً إلا لطخها» اهـ.</span></p><p style=""margin-left:0;margin-right:0;text-align:justify;""><span class=""ar_writing"">وأما قطع الرأس عن الجسد مع بقاء الرأس على حاله فلاينفي الكراهة؛ لأن من الطيور ما هو مطوق فلايتحقق القطع بذلك ولهذا فسر في الهداية المقطوع بمحو الرأس كذا في النهاية. قيد بالرأس لأنه لا اعتبار بإزالة الحاجبين أو العينين؛ لأنها تعبد بدونها وكذا لا اعتبار بقطع اليدين أو الرجلين. وفي الخلاصة: وكذا لو محى وجه الصورة فهو كقطع الرأس"". (2/ 30،کتاب الصلاة، باب ما یفسد الصلاة وما یکره فيها، ط: دار الکتاب الإسلامي)</span></p><p style=""margin-left:0;margin-right:0;text-align:justify;"">خلاصۃ الفتاوی میں ہے:</p><p style=""margin-left:0;margin-right:0;text-align:justify;""><span class=""ar_writing"">""وإن کانت مقطوع الرأس لا بأس به، وکذا لو محی وجه الصورة فهو کقطع الرأس"".  (1/58، کتاب الصلاة، ط: رشیدیة)</span></p><p style=""margin-left:0;margin-right:0;text-align:justify;"">فتاوی شامی  میں ہے:</p><p style=""margin-left:0;margin-right:0;text-align:justify;""><span class=""ar_writing"">""أو مقطوعة الرأس أو الوجه)  أو ممحوة عضو لاتعيش بدونه (أو لغير ذي روح لا) يكره؛ لأنها لاتعبد وخبر جبريل مخصوص بغير المهانة كما بسطه ابن الكمال.</span></p><p style=""text-align:justify;""><span class=""ar_writing"">(قوله: أو مقطوعة الرأس) أي سواء كان من الأصل أو كان لها رأس ومحي، وسواء كان القطع بخيط خيط على جميع الرأس حتى لم يبق له أثر، أو بطليه بمغرة أو بنحته، أو بغسله لأنها لاتعبد بدون الرأس عادة وأما قطع الرأس عن الجسد بخيط مع بقاء الرأس على حاله فلاينفي الكراهة لأن من الطيور ما هو مطوق فلايتحقق القطع بذلك، وقيد بالرأس لأنه لا اعتبار بإزالة الحاجبين أو العينين لأنها تعبد بدونها وكذا لا اعتبار بقطع اليدين أو الرجلين بحر (قوله: أو ممحوة عضو إلخ) تعميم بعد تخصيص، وهل مثل ذلك ما لو كانت مثقوبة البطن مثلاً. والظاهر أنه لو كان الثقب كبيراً يظهر به نقصها فنعم وإلا فلا؛ كما لو كان الثقب لوضع عصا تمسك بها كمثل صور الخيال التي يلعب بها لأنها تبقى معه صورة تامة تأمل (قوله: أو لغير ذي روح) لقول ابن عباس للسائل: ""فإن كنت لا بد فاعلاً فاصنع الشجر وما لا نفس له"" رواه الشيخان، ولا فرق في الشجر بين المثمر وغيره خلافاً لمجاهد، بحر"". (1/ 648،  کتاب الصلاة، باب مایفسدالصلاة وما یکره فیها، ط: سعید)فقط والله أعلم </span></p></p>",144108201723,banuri,"('حظر و اباحت', 'mamnooaat-mubahat')","('تفریح / کھیل', 'tafreeh-khel')","('ٹی وی / وی سی آر / سینما / انٹرنیٹ/تصویر سازی', 'tv-vcr-cinema-internet-taswer-sazi')"
18-04-2020,https://www.banuri.edu.pk/readquestion/setary-dekh-kr-name-rkhna-144108201637/18-04-2020,ستارے دیکھ کر نام رکھنا,کہتے ہیں کہ بچے کا نام رکھتے وقت ستاروں کا اتار چڑھاؤ  دیکھ  کر  نام رکھنا چاہیے،  ورنہ بچے میں نقائص پیدا ہو جاتے ہیں، کیا یہ عمل درست ہے؟ اگر ہاں تو اس کی کسی شرعی دلیل سے وضاحت فرما دیں!,"<p><p style=""text-align:justify;"">شریعتِ مطہرہ نے مسلمانوں کو اپنے بچوں کے اچھے نام رکھنے کا حکم دیا اور اس کو والدین پر اولاد کا حق قرار دیا، اور جن ناموں کے معنی اچھے نہیں ہیں ان کو رکھنے سے منع کیا، خود آپ ﷺ نے بہت سے لوگوں کے ایسے نام جن کے معنی اچھے نہیں ہوتے ان کو تبدیل کرکے اچھے معنی والے نام رکھ  دیے۔  نام کے اچھا اور بامعنی ہونے کا انسان کی شخصیت پر  اثر پڑتا ہے،  یہی وجہ ہے کہ اچھے نام رکھنے کا حکم دیا گیا ہے۔</p><p style=""text-align:justify;"">  لیکن پیدائش کے دن اور تاریخ کا حساب کرکے یا ستاروں کی مناسبت سے نام رکھنے کا اہتمام کرنا اور اس سے نام کا انسانی شخصیت پر بھاری ہونا یا اس کے اچھا اثر ہونے کا عقیدہ رکھنا شرعاً درست نہیں ہے۔</p><p style=""text-align:justify;""> نام رکھنے کا ادب یہ ہے کہ اس میں نیک لوگوں کی نسبت ملحوظ ہو، مثلاً انبیاءِ کرام علیہم السلام یا صحابہ کرام رضی اللہ عنہم یا نیک مسلمانوں کے نام پر ہو، یا وہ اچھا بامعنی لفظ ہو۔</p><p style=""text-align:justify;"">حضرت ابو الدرداء رضی اللہ عنہ سے روایت ہے کہ رسول اللہ ﷺ نے ارشاد فرمایا: تم لوگوں کو قیامت کے دن تمہارے اور تمہارے باپ کے نام سے پکارا جائے گا، لہٰذا اپنے نام اچھے رکھو۔ (یعنی والدین اولاد کے نام اچھے رکھیں)۔ رواہ احمد و ابوادؤد۔ (مشکاۃ المصابیح، باب الاسامی، الفصل الثانی، ص: 408۔ ط: قدیمی)</p><p style=""text-align:justify;"">اور حضرت ابو وہب جشمی رضی اللہ عنہ سے روایت ہے کہ رسول اللہ ﷺ نے ارشاد فرمایا: انبیاء کے ناموں پر نام رکھو۔ اور اللہ کے ہاں سب سے پسندیدہ ناموں میں سے ’’عبداللہ‘‘ اور ’’عبدالرحمٰن‘‘ ہے، اور مصداق کے اعتبار سے سب سے سچے نام ’’حارث‘‘ اور ’’ہمام‘‘ ہیں۔ اور سب سے برے نام ’’حرب‘‘ اور ’’مرہ‘‘ ہیں۔ رواہ ابوداؤد۔ (مشکاۃ المصابیح، باب الاسامی، الفصل الثالث، ص:409۔ط: قدیمی) فقط واللہ اعلم</p></p>",144108201637,banuri,"('ایمان و عقائد', 'aqaed')","('بدعات اور رسوم', 'bidaat-rasoomat')","('رسومات، تعارف اور بعض رسمیں', 'rusomat-taaruf-aur-baaz-rasmayn')"
17-04-2020,https://www.banuri.edu.pk/readquestion/yom-e-paidaish-mana-kesa-he-144108201528/17-04-2020,یوم پیدائش منانا کیسا ہے؟,یومِ پیدائش منانا کیسا ہے؟,"<p><p style=""text-align:justify;"">یوم پیدائش (سال گرہ) منانے کا شرعاً   کوئی ثبوت نہیں ہے، بلکہ یہ موجودہ زمانہ  میں اغیار کی طرف سے آئی ہوئی ایک رسم ہے، جس میں عموماً  طرح طرح کی خرافات شامل ہوتی ہیں، مثلاً: مخصوص لباس پہنا جاتا ہے، موم بتیاں لگاکر کیک  کاٹا  جاتا ہے، موسیقی  اور مرد وزن کی مخلوط محفلیں ہوتی ہیں ، تصویر کشی ہوتی اور پھر ان میں غیر اقوام کی نقالی بھی ہوتی ہے، اور یہ سب امور ناجائز ہیں،  لہذا مروجہ طریقہ پر سال گرہ منانا شرعاً جائز نہیں ہے۔</p><p style=""text-align:justify;"">ہاں اگر اس طرح کوئی خرافات نہ ہوں اور نہ ہی کفار کی مشابہت مقصود ہو ، بلکہ  گھر والے اس مقصد کے لیے اس دن کو یاد رکھیں کہ  رب کے حضور اس بات کا شکرادا ہو کہ اللہ تعالیٰ نے عافیت وصحت اور عبادات کی توفیق کے ساتھ زندگی کا ایک سال مکمل فرمایا ہے  تو اس کی گنجائش ہوگی، تاہم احتیاط بہتر ہے۔</p><p style=""text-align:justify;"">مزید تفصیل کے لیے منسلکہ لنک پر موجود فتوی کا ملاحظہ کریں: </p><p style=""text-align:justify;""><a href=""https://www.banuri.edu.pk/web/readquestion/%D8%B3%D8%A7%D9%84%DA%AF%D8%B1%DB%81-%D9%85%D9%86%D8%A7%D9%86%D8%A7-%D8%A7%D9%88%D8%B1-%D8%AA%D8%B4%D8%A8%DB%81-%D8%A8%D8%A7%D9%84%DA%A9%D9%81%D8%A7%D8%B1-%DA%A9%DB%8C-%D8%AD%D9%82%DB%8C%D9%82%D8%AA-2/22-08-2017"">سالگرہ منانا اور تشبہ بالکفار کی حقیقت</a></p><p style=""text-align:justify;"">اور اگر کسی نیک یا بزرگ شخصیت کا یومِ پیدائش دین کا حصہ یا عبادت سمجھ کر منایا جائے تو یہ بدعت ہونے کی وجہ سے ناجائز ہوگا۔ اور اگر کسی دنیاوی شخصیت کا یومِ پیدائش دنیاوی رسم کے طور پر منایا جائے تو رسم ہونے کی وجہ سے واجب الترک ہوگا۔  فقط واللہ اعلم</p></p>",144108201528,banuri,"('ایمان و عقائد', 'aqaed')","('بدعات اور رسوم', 'bidaat-rasoomat')","('رسومات، تعارف اور بعض رسمیں', 'rusomat-taaruf-aur-baaz-rasmayn')"
17-04-2020,https://www.banuri.edu.pk/readquestion/jummay-kay-din-bajamat-zuhr-144108201491/17-04-2020,جمعہ کے دن باجماعت ظہر,جمعہ کے دن لوگوں نے گھروں میں یا دفتر میں جماعت کے ساتھ ظہر  کی نماز ادا کرلی تو کیا اعادہ واجب ہوگا؟,"<p><p style=""text-align:justify;""> <a href=""https://www.banuri.edu.pk/readquestion/%D8%AC%D9%85%D8%B9%DB%81-%DA%A9%DB%92-%D8%B5%D8%AD%DB%8C%D8%AD-%DB%81%D9%88%D9%86%DB%92-%DA%A9%DB%8C-%D8%B4%D8%B1%D8%A7%D8%A6%D8%B7-144107200432/07-03-2020"">جمعہ کے صحیح ہونے کی شرائط</a>  موجود ہونے کی صورت میں بغیر عذر کے جمعہ چھوڑ  کر ظہر کی نماز پڑھنا گناہ ہے، نیز جمعہ کے دن باجماعت ظہر  کی نماز پڑھنا مکروہِ تحریمی ہے؛ لہذا اگر کسی نے جمعہ کے دن ظہر  کی نماز باجماعت پڑھ ہی لی تو اس سے وقت کا فریضہ تو ساقط ہوجائےگا، اور اب اعادہ بھی واجب نہیں ہوگا، البتہ اسے توبہ و استغفار کرنا چاہیے۔</p><p style=""text-align:justify;""><span class=""ar_writing"">المبسوط للسرخسي (2 / 25):</span></p><p style=""text-align:justify;""><span class=""ar_writing"">""وأما الإساءة فلتركهم أداء الجمعة بعد ما استجمعوا شرائطها، وفي حديث ابن عمر قال رسول الله صلى الله عليه وسلم: «من ترك ثلاث جمع تهاونًا بها طبع على قلبه»"".</span></p><p style=""text-align:justify;""><span class=""ar_writing"">الدر المختار وحاشية ابن عابدين (رد المحتار) (2 / 157):<br/>
""(وكره) تحريمًا (لمعذور ومسجون) ومسافر (أداء ظهر بجماعة في مصر) قبل الجمعة وبعدها لتقليل الجماعة وصورة المعارضة"". فقط و الله أعلم</span></p></p>",144108201491,banuri,"('نماز', 'salat')","('نماز کی جماعت', 'namaz-ki-jamat')","('جماعت / امامت', 'jamat-imamat')"
17-04-2020,https://www.banuri.edu.pk/readquestion/zer-e-naf-kahan-tk-saf-krna-144108201492/17-04-2020,زیر ناف کہاں تک صاف کرنا لازم ہے؟,زیرناف بالوں میں مقعد کے علاوہ پچھلی شرم گاہ  پر جو بال ہوتے ہیں  وہ کہاں تک صاف کرنا ضروری ہے؟,"<p><p style=""text-align:justify;"">زیرِِ ناف بال کاٹنے کی حد یہ ہے کہ اگر آدمی اکڑو بیٹھے  تو ناف سے تھوڑا نیچے، جہاں پیٹ میں بل پڑتا ہے وہاں سے  رانوں کی جڑوں تک، اورپیشاب پاخانہ کی جگہ کے اردگرد جہاں تک نجاست لگنے کا امکان ہو, وہاں تک بال صاف کرنے چاہییں۔</p><p style=""text-align:justify;"">اس وضاحت میں آپ کے سوال کا جواب بھی ہوگیا کہ مقعد کے گرد جہاں تک نجاست لگنے کا امکان ہو وہاں تک بال کاٹنے چاہییں۔</p><p style=""text-align:justify;"">ہر ہفتے میں غیر ضروری بالوں کی صفائی مستحب ہے، ہفتے میں نہ ہوسکے تو پندرہ دن میں کرلیے جائیں، چالیس دن سے زیادہ چھوڑنا جائز نہیں. فقط واللہ اعلم </p></p>",144108201492,banuri,"('حقوق و آدابِ معاشرت', 'huqooq-muashret')","('لباس / وضع قطع', 'libass-waza-qata')","('بالوں کے احکام و آداب', 'baloon-k-ahkam-o-aadab')"
17-04-2020,https://www.banuri.edu.pk/readquestion/qaza-namazo-main-quran-parhna-144108201493/17-04-2020,قضا نمازوں میں قرآن پڑھنا,میں نفل میں قرآن شریف پڑھتا ہوں تو کیا میں یہ قرآن قضاءِ عمری میں پڑھ سکتا ہوں؟,"<p><p style=""text-align:justify;"">جی ہاں، آپ قضا  نمازوں میں ترتیب سے قرآن پڑھ سکتے ہیں۔فقط واللہ اعلم</p></p>",144108201493,banuri,"('نماز', 'salat')","('فوت شدہ نمازوں کی قضا', 'fout-shuda-namazon-ki-qaza')","('قضاء نمازوں کا بیان', 'qaza-namazon-ka-bayan')"
17-04-2020,https://www.banuri.edu.pk/readquestion/marhoom-ki-bewa-ka-marhoom-ki-walida-kay-ghar-main-hissa-144108201479/17-04-2020,مرحوم کی بیوہ کا مرحوم کی والدہ کے گھر میں حصہ,ایک آدمی مر گیا اس کی دو بیویاں ہیں، اس آدمی کی والدہ ابھی زندہ ہے، اب وہ بیویاں اس کی والدہ سے گھر میں حصہ کا مطالبہ کر رہی ہیں، حال آں کہ یہ گھر اس کی والدہ کا ہے یعنی اس کی ملکیت ہے. آیا شرعاً ان کا مطالبہ ٹھیک ہے یا نہیں؟ اور اس کی ان بیویوں کا کیا ہوگا؟,"<p><p style=""text-align:justify;"">صورتِ  مسئولہ میں مرحوم کی والدہ کے گھر میں مرحوم کی دونوں بیواؤں کا شرعی حصہ نہیں ہے، اس لیے مذکورہ گھر میں سے حصہ مانگنے کا مطالبہ درست نہیں ہے۔ شوہر کے انتقال کے بعد بیوہ کی کفالت کی ذمہ داری اس کے ولی (مثلاً بالغ بیٹا، وہ نہ ہو تو باپ، وہ نہ ہو تو بھائی، وہ نہ ہو تو چچا) پر ہے۔ البتہ مرحوم نے جو جائیداد چھوڑی ہے، اس میں سے تجہیز و تکفین کے اخراجات اور قرض ہوں تو ان کی ادائیگی کے بعد، اگر اس نے کوئی جائز وصیت کی ہو تو اسے ایک تہائی ترکے میں سے نافذ کرنے کے بعد  اگر مرحوم کی اولاد ہو تو  مابقیہ ترکہ میں سے آٹھواں حصہ <span class=""eng_writing"">(12.5%)</span>د اور اگر مرحوم کی اولاد نہ ہو تو <span class=""eng_writing"">(25%)</span>دونوں بیواؤں کے درمیان برابر برابر تقسیم ہوگا۔ فقط واللہ اعلم</p></p>",144108201479,banuri,"('معاملات', 'muamlat')","('وراثت / وصیت', 'wirasat-wasyat')","('ورثاء اور ان کے حصص', 'wurasa-or-un-k-hisas')"
17-04-2020,https://www.banuri.edu.pk/readquestion/4b28c35b05d159237b502306160f31f7-144108201478/17-04-2020,مغرب کی تیسری رکعت میں فاتحہ کے بعد سورت ملالی تو کیا حکم ہے؟,میں مغرب کی تین رکعتوں میں سورتیں پڑھتی رہی ہوں،  جب کہ آخری رکعت میں صرف الحمد شریف پڑھنا ہوتی ہے،  کیا مجھے ساری نمازیں دھرانا پڑیں گی؟,"<p><p style=""text-align:justify;"">مغرب کی تیسری رکعت میں  صرف سورۂ فاتحہ پڑھنا سنت ہے، اور سورۂ فاتحہ کے بعد سورت ملانا سنت نہیں ہے، البتہ اگر سورت ملادی تو سجدۂ سہو واجب نہیں ہوتا اور نہ ہی نماز فاسد ہوتی ہے، لہذا ان نمازوں کے لوٹانے کی ضرورت نہیں۔ فقط واللہ اعلم</p></p>",144108201478,banuri,"('نماز', 'salat')","('سجدہ سہو', 'sajda-sahv')","('سجدہ تلاوت / سجدہ سہو', 'sajda-tilawat-sajda-sahw')"
16-04-2020,https://www.banuri.edu.pk/readquestion/kursi-par-beth-kar-namaz-ka-sajda-karne-wale-ki-baith-kar-namaz-parhne-wali-ki-imamt-144108201474/16-04-2020,کرسی پر بیٹھ کر سجدہ کرنے والے کی بیٹھ کر نماز پڑھنے والی کی امامت کا حکم,ایک شخص گھٹنوں کی تکلیف کی وجہ قیام ورکوع تو کھڑے ہوکر کرتا ہے مگر سجدہ کرسی پر بیٹھ کر کرتا ہے، کیا وہ اپنی طرح کرسی پر بیٹھ کر یا زمین پر بیٹھ کر نماز پڑھنے والوں کی امامت کراسکتا ہے؟,"<p><p style=""text-align:justify;"">صورتِ مسئولہ میں گھٹنوں میں تکلیف کی وجہ سے اگر مذکورہ شخص باقاعدہ زمین پر بیٹھ کر رکوع سجدہ نہیں  کرسکتا  تو  رکوع اور سجدہ پر قادر مقتدیوں کے لیے اس کا امام بننا درست نہیں ہے، البتہ جو لوگ رکوع اور سجدہ پر قادر نہ ہوں اور وہ بھی اشارے سے رکوع اور سجدہ کرتے ہوں تو ایسے مقتدیوں کا مذکورہ امام کی اقتدا میں نماز ادا کرنا درست ہوگا۔</p><p style=""text-align:justify;"">        <strong>فتاوی شامی میں ہے:</strong><br/><span class=""ar_writing"">""(وصح اقتداء متوضئ) لا ماء معه (بمتيمم) ولو مع متوضئ بسؤر حمار مجتبى (وغاسل بماسح) ولو على جبيرة (وقائم بقاعد) يركع ويسجد؛ «لأنه صلى الله عليه وسلم  صلى آخر صلاته قاعدا وهم قيام وأبو بكر يبلغهم  تكبيره» (قوله وقائم بقاعد) أي قائم راكع ساجد أو موم، وهذا عندهما خلافا لمحمد. وقيد القاعد بكونه يركع ويسجد لأنه لو كان موميا لم يجز اتفاقاً""  (1/588، باب الإمامة،  ط: سعید)</span></p><p style=""text-align:justify;""><span class=""ar_writing""><strong>        </strong><strong>وفیه أیضًا</strong><strong>:</strong></span></p><p style=""text-align:justify;""><span class=""ar_writing""><strong>""</strong>(و) لا (قادر على ركوع وسجود بعاجز عنهما) ؛ لبناء القوي على الضعيف (قوله: بعاجز عنهما) أي بمن يومئ بهما قائماً أو قاعداً، بخلاف ما لو أمكناه قاعداً فصحيح كما سيأتي. قال ط: والعبرة للعجز عن السجود، حتى لو عجز عنه وقدر على الركوع أومأ"". (1/579، باب الإمامة، ط: سعید) فقط والله أعلم</span></p></p>",144108201474,banuri,"('نماز', 'salat')","('نماز کی جماعت', 'namaz-ki-jamat')","('جماعت / امامت', 'jamat-imamat')"
16-04-2020,https://www.banuri.edu.pk/readquestion/aik-rakat-witr-144108201476/16-04-2020,ایک رکعت وتر/ بلا وضو قرآن پڑھنا,1- عشاء کی نماز میں 3 وتر پڑھنے ہیں یا صرف 1 وتر پڑھی جاسکتی ہے؟2- وضو کے بغیر قرآن پاک پڑھ سکتے ہیں؟,"<p><p style=""text-align:justify;"">1 : سب سے پہلے یہ نکتہ واضح رہنا چاہیے کہ نصوص سے اَحکام کے استنباط کے لیے فقہاءِ کرام میں سے ہر ایک  کے اپنے اصول ہیں، جب کسی مسئلے کے متعلق دلائل مختلف ہوں تو ہر فقیہ اپنے اصول کی بنا پر کسی دلیل کو ترجیح دیتا ہے، وتر پڑھنے کی کیفیت کے متعلق وارد  احادیثِ مبارکہ چوں کہ  مختلف   ہیں  اور ائمہ فقہاء نے اپنے اپنے اصولوں کے مطابق دلائل کو ترجیح دے کر کسی ایک طریقے کو اختیار کیا ہے، لہٰذا ہمارے  فقہائے حنفیہ کے نزدیک  تین رکعتیں ایک سلام کے ساتھ پڑھنا سنت ہے، اور ایک رکعت الگ سے ادا کرنے کی اجازت نہیں ہے، جیساکہ بعض روایات میں ایک رکعت الگ ادا کرنے کی ممانعت منقول ہے۔</p><p style=""text-align:justify;""> اس حوالے سے امام نسائی رحمہ اللہ  نے  ”سننِ نسائی“  میں سند کے ساتھ حضرت ابی بن کعب  رضی اللہ عنہ کی روایت درج کی ہے : ”رسول اللہ صلی اللہ علیہ وسلم وتر کی پہلی رکعت میں <span class=""ar_writing"">”سبح اسم ربک الأعلی“</span>، دوسری رکعت میں <span class=""ar_writing"">”قل یا ایها الکافرون“</span> اور تیسری رکعت میں <span class=""ar_writing"">”قل هو الله احد“</span>پڑھتے تھے اور تینوں رکعتوں کے آخر میں سلام فرماتے تھے“ ۔ اسی پر صحابہ رضی اللہ عنہم میں سے حضرت عمر،حضرت عبداللہ بن مسعود اور حضرت انس رضی اللہ عنہم اور دیگر حضرات کا عمل رہا ہے۔</p><p style=""text-align:justify;"">2: قرآنِ کریم کو بلاوضو ہاتھ لگانا منع ہے، بے وضو ہونے کی حالت میں بغیر ہاتھ لگائے تلاوت کرنامنع نہیں، صحابہ کرام رضوان اللہ علیہم اجمعین سے بلاوضو قرآنِ کریم کی زبانی تلاوت کرنا ثابت ہے۔</p><p style=""text-align:justify;"">’’البحر الرائق‘‘   میں ہے:</p><p style=""text-align:justify;""><span class=""ar_writing"">""ومنع المحدث المس أي عن القرآن ومنعهما أي المس وقراءة القرآن الجنابة والنفاس"". (203/1) فقط و الله أعلم</span></p></p>",144108201476,banuri,"('نماز', 'salat')","('نماز کی شرائط', 'namaz-ki-sharait')","('نماز اور اس کی شرائط و ارکان ، سنن و آداب', 'namaz-or-us-ki-sharait-o-arkaan-sunan-o-aadab')"
