issued_at,link,title,question,answer,fatwa_number,dar_ul_ifta,kitab,bab,fasal
16-04-2020,https://www.banuri.edu.pk/readquestion/bank-ka-nafa-istemal-karlia-ab-kia-karun-144108201475/16-04-2020,بینک کا نفع استعمال کرلیا، اب کیا کروں؟,کچھ سال پہلے میں نے میزان بینک میں سیونگ اکاؤنٹ کھلوایا تھا، اب میں اس کا ناجائز ہونا مانتا ہوں۔میں نے جو نفع کمایا وہ حلال تھا یا حرام؟ اگر حرام تھا تو جو پیسے میں مختلف جگہوں پر استعمال کر چکا ہوں، اس کا کیا حکم ہے؟ آنے والے نفع کو صدقہ کرنا درست ہے؟ اگر میں نے ان پیسوں کو استعمال کرکے حرام پیسے استعمال کیے، تو اب میں کیا کروں؟,"<p><p style=""text-align:justify;"">صورتِ  مسئّلہ میں حاصل ہونے والا نفع ناجائز تھا؛ لہذا جو حلال پیسے آپ نے اکاؤنٹ میں رکھوائے، اس کے بقدر بینک سے ملنے والے پیسوں کا استعمال آپ کے لیے جائز تھا اور اگر اس سے زائد  پیسے آپ نے استعمال کرلیے ہوں، تو  بغیر ثواب کی نیت کے، حرام پیسوں کے برے اثرات اور وبال سے جان چھڑانے کی نیت سے، استعمال شدہ پیسوں کے بقدر رقم صدقہ کردیں اور جلد از جلد اپنا اکاؤنٹ بند  یا کرنٹ اکاؤنٹ میں تبدیل کردیں۔ فقط واللہ اعلم</p></p>",144108201475,banuri,"('معاملات', 'muamlat')","('سود / بینکاری / انشورنس / شیئرز', 'sood-bankari-insurance-shares')","('متفرقات سود', 'mutafarriqat-e-sood')"
16-04-2020,https://www.banuri.edu.pk/readquestion/0799d014b091e4b708b4f837249055c9-144108201472/16-04-2020,فدیۂ صوم سے عاجز کا حکم,ایک خاتون ہے جو کہ بہت بوڑھی ہے اور بیمار بھی سخت ہے اور غریب بھی ہے۔ بس اُس کی اتنی آمدن ہے کہ دوائیاں وغیرہ آتی ہیں اور گزارا ہو رہا ہے، وہ روزے تو نہیں رکھ سکتی تو کفارہ ادا کرے گی یا نہیں کرے گی؟ کیوں کہ  وہ غریب بھی ہے، بوڑھی بھی ہے، بیمار بھی ہے تو روزوں کے کفارے کے بارے میں اُس کا کیا حکم ہے؟,"<p><p style=""text-align:justify;"">صورتِ  مسئولہ میں مذکورہ بوڑھی اور بیمار خاتون کی آمدن میں سے اگر  اتنی رقم نہ بچتی ہو کہ وہ چھوٹے ہوئے روزوں کا فدیہ ادا کرسکے تو اسے چاہیے کہ وہ وسعت کا انتظار کرے، اور اللہ تعالیٰ سے وسعت کی دعا اور روزے چھوٹنے پر توبہ و استغفار کرتی رہے۔</p><p style=""text-align:justify;""><span class=""ar_writing"">الفتاوى الهندية (5 / 357):<br/>
""وَلَوْ أَخَّرَ الْقَضَاءَ حَتَّى صَارَ شَيْخًا فَانِيًا أَوْ كَانَ النَّذْرُ بِصِيَامِ الْأَبَدِ فَعَجَزَ لِذَلِكَ أَوْ بِاشْتِغَالِهِ بِالْمَعِيشَةِ؛ لِكَوْنِ صِنَاعَتِهِ شَاقَّةً فَلَهُ أَنْ يُفْطِرَ وَيُطْعِمَ لِكُلِّ يَوْمٍ مِسْكِينًا عَلَى مَا تَقَدَّمَ ، وَإِنْ لَمْ يَقْدِرْ عَلَى ذَلِكَ لِعُسْرَتِهِ يَسْتَغْفِرُ اللَّهَ إنَّهُ هُوَ الْغَفُورُ الرَّحِيمُ"". فقط والله اعلم</span></p></p>",144108201472,banuri,"('روزہ', 'soum')","('روزہ', 'roza')","('کفارہ / فدیہ', 'kaffara-fidya')"
16-04-2020,https://www.banuri.edu.pk/readquestion/darhi-katne-wale-shakhs-ki-iqteda-main-taraweeh-ada-karna-144108201471/16-04-2020,ڈاڑھی کاٹنے والے شخص کی اقتدا میں تراویح ادا کرنا,جو داڑھی کاٹتا  ہو اس کے پیچھے تراویح پڑ ھنے کا کیا حکم ہے؟,"<p><p style=""text-align:justify;"">ڈاڑھی منڈانا یا ایک مشت سے کم کرنا حرام  ہے اور ایسا شخص از روئے شرع فاسق ہے، اور فاسق کی امامت مکروہ ہے، جس کی وجہ سے ڈاڑھی منڈانے والے یا کترواکر ایک مشت سے کم کرانے والے کو نماز یا تراویح کا امام بنانا جائز نہیں ہے، اور ایسے امام کے پیچھے نماز مکروہِ تحریمی ہے۔ایسے شخص  کی اقتدا کی بجائے دین دار باشرع ائمہ کی اقتدا میں تراویح کی نماز ادا کی جائے۔ اگر داڑھی کاٹنے والا  شخص رمضان المبارک میں داڑھی بڑھانے کا ارادہ ظاہر کرے تو جب تک اس کی داڑھی مشت بھر نہ ہوجائے اس کے پیچھے تراویح نہ پڑھی جائے۔</p><p style=""text-align:justify;""> ڈاڑھی منڈوانا بہت بڑا گناہ ہے، ایسے لوگوں پر لازم ہے کہ وہ صدقِ دل سے توبہ واستغفار کریں اور آئندہ کے لیے ڈاڑھی رکھنے کا مکمل اہتمام کریں۔</p><p style=""text-align:justify;"">’’فتاوی شامی‘‘  میں ہے:</p><p style=""text-align:justify;""><span class=""ar_writing"">""و أما الأخذ منها أي من اللحية و هي دون ذالك: أي دون القبضة، كما يفعله بعض المغاربة و مخنثة الرجال فلم يبحه أحد، و أخذ كلها فعل اليهود... و مجوس الأعاجم"". (كتاب الصوم، مطلب في الاخذ من اللحية ٢/ ٤١٨، ط: سعيد)</span></p><p style=""text-align:justify;"">’’حلبی کبیر ‘‘ میں ہے:</p><p style=""text-align:justify;""><span class=""ar_writing"">""و لو قدّموا فاسقاً  يأثمون بناء علي أن كراهة تقديمه كراهة تحريم ؛ لعدم اعتنائه بأمور دينه، و تساهله في الإتيان بلوازمه...""الخ ( كتاب الصلوة، الأولی بالإمامة، ص: ٥١٣، ٥١٤ ط: سهيل اكيدمي)</span> <span class=""ar_writing"">فقط والله أعلم</span></p></p>",144108201471,banuri,"('نماز', 'salat')","('تراویح', 'taraweeh')","('تراویح', 'taraweeh')"
16-04-2020,https://www.banuri.edu.pk/readquestion/crypto-currency-hkm-144108201459/16-04-2020,کرپٹو کرنسی کا حکم,کرپٹو کرنسی، بٹ کوائن،  ایتیریم وغیرہ کی اسلام میں کیا حیثیت ہے؟  اگر یہ حرام ہے تو  وجوہات تفصیل سے بیان کیجیے،  اگر حلال ہے تو اس کی بھی وضاحت فرمائیے!,"<p><p style=""text-align:justify;""> کرپٹو کرنسی کا معاملہ تاحال مشتبہ  اور زیرِِ تحقیق ہے، نیز پاکستان میں اسے قانونی کرنسی کی حیثیت بھی حاصل نہیں ہے؛ اس لیے اس کی خریدوفروخت سے اجتناب کیا جائے۔فقط واللہ اعلم</p><p style=""text-align:justify;"">تفصیل کے لیے درج ذیل لنک ملاحظہ کیجیے:</p><p><a href=""https://www.banuri.edu.pk/bayyinat-detail/%DA%88%DB%8C%D8%AC%DB%8C%D9%B9%D9%84-%DA%A9%D8%B1%D9%86%D8%B3%DB%8C-%D8%A7%D9%88%D8%B1-%D9%88%D9%86-%DA%A9%D9%88%D8%A7%D8%A6%D9%86-onecoin-%DA%A9%D9%85%D9%BE%D9%86%DB%8C-%DA%A9%D8%A7-%DA%A9%D8%A7%D8%B1%D9%88%D8%A8%D8%A7%D8%B1"">ڈیجیٹل کرنسی اور ون کوائن (Onecoin) کمپنی کا کاروبار!</a></p></p>",144108201459,banuri,"('معاملات', 'muamlat')","('بیع / تجارت', 'bay-tijarat')","('بیع صحیح ، فاسد اور باطل', 'bay-sahih-fasid-or-batil')"
16-04-2020,https://www.banuri.edu.pk/readquestion/corona-me-sudi-qrz-lena-144108201458/16-04-2020,کرونا وائرس سے پیدا صورتِ حال میں ملازمین کی تنخواہوں کی ادائیگی کے لیے حکومت سے سودی قرض لینا,آج کل کرونا وائرس حالات میں حکومت نے اداروں کو ملازمین کی تنخواہوں کی ادائیگی کے لیے جو قرضہ سکیم متعارف کرائی ہے، اس قرضے کو ملازمین کی تنخواہیں ادا کرنے کے لیے لینا جائز ہے یا نہیں ؟,"<p><p style=""text-align:justify;"">مذکورہ صورت میں جو  قرضہ دیا جارہا ہے،  اگر اس میں سودی شقیں شامل ہیں،  یعنی کہ مثلاً دس لاکھ کا قرضہ لیں اور اس سے زائد ادا کرنا لازم ہو تو اس قرض کا لینا جائز نہیں۔ ملازمین کی تنخواہوں کی ادائیگی کے لیے کہیں سے بلا سود قرض کی سبیل تلاش کریں۔ حکومت کا عوامی ضروریات و مسائل حل کرنے کے لیے سودی معاملہ اللہ  تعالیٰ کی مزید ناراضی کو دعوت دینا ہے، حکومت کو  چاہیے کہ بلا سود قرض فراہم کرے، یا شرعی حدود کا لحاظ رکھ کر  مضاربہ یا مشارکہ کے طریقے سے عوام کو رقم دینی چاہیے۔ فقط واللہ اعلم</p></p>",144108201458,banuri,"('معاملات', 'muamlat')","('سود / بینکاری / انشورنس / شیئرز', 'sood-bankari-insurance-shares')","('سود کی تعریف اور احکام', 'sood-ki-tareef-or-ahkam')"
16-04-2020,https://www.banuri.edu.pk/readquestion/maqrooz-shohar-ka-bv-say-zakat-wusool-karna-144108201448/16-04-2020,مقروض شوہر کا بیوی سے زکاۃ وصول کرنا,شوہر اگر مالی طور پر بیوی بچوں کے گھریلو اخراجات اپنے ذریعہ آمدن سے پورے  نہ کر سکتا ہو اور اُس پر قرض بھی ہو تو کیا اُس صورت میں بیوی اپنے شوہر کو زکاۃ دے سکتی ہے؟ اگر ہاں تو کیا وہ زکاۃ کی رقم شوہر بیوی بچوں پر خرچ کر سکتا ہے?,"<p><p style=""text-align:justify;"">میاں بیوی آپس میں ایک دوسرے کو  اپنے مال کی زکاۃ نہیں دے سکتے،  نیز اپنی اولاد کو بھی زکاۃ دینا جائز نہیں ہے۔ ہاں اگر شوہر مستحقِ زکاۃ ہو تو کسی دوسرے شخص سے زکاۃ کی رقم وصول کر سکتا ہے۔</p><p style=""text-align:justify;"">زکاۃ کا مستحق وہ مسلمان ہے  جس کے پاس اس کی بنیادی ضرورت  و استعمال ( یعنی رہنے کا مکان ، گھریلوبرتن ، کپڑے وغیرہ)سے زائد،  نصاب کے بقدر  (یعنی صرف سونا ہو تو ساڑھے سات تولہ سونا یا ساڑھے باون تولہ چاندی یا اس کی موجودہ قیمت  کے برابر) مال یا سامان موجود نہ ہو  اور وہ سید/ عباسی نہ ہو۔</p><p style=""text-align:justify;"">لہذا اگر مذکورہ شخص زکاۃ کا مستحق ہو تو وہ بیوی کے علاوہ کسی دوسرے شخص سے زکاۃ وصول کر سکتا ہے۔</p><p style=""text-align:justify;""><span class=""ar_writing"">الفتاوى الهندية (1/ 189):<br/>
""ولايدفع إلى امرأته للاشتراك في المنافع عادة، ولاتدفع المرأة إلى زوجها عند أبي حنيفة - رحمه الله تعالى -، كذا في الهداية"". فقط والله أعلم</span></p></p>",144108201448,banuri,"('زکات', 'zakat')","('زکوٰۃ / صدقات', 'zakat-sadaqat')","('مصارف زکوٰۃ', 'masarif-e-zakat')"
20-04-2020,https://www.banuri.edu.pk/readquestion/qimti-patthar-ke-har-par-zakat-ka-hukum-144108201797/20-04-2020,قیمتی پتھر کے ہار پر زکاۃ کا حکم,اگر کسی عورت کے پاس قیمتی  پتھروں کا ہار ہو، اور تجارت کے لیے نہ ہو تو اس پر زکاۃ لازم ہوگی  یا نہیں؟,"<p><p style=""text-align:justify;"">زکاۃ سونا، چاندی، نقدی اور مالِ تجارت پر لازم ہوتی ہے،لہذا اگر مذکورہ عورت کے پاس قیمتی پتھروں کا ہار تجارت کے لیے نہ ہو تو اس ہار پر زکاۃ لازم نہیں ہوگی ۔</p><p style=""text-align:justify;"">فتاوی ہندیہ میں ہے :</p><p style=""text-align:justify;""><span class=""ar_writing"">""وأما اليواقيت واللآلئ والجواهر فلا زكاة فيها، وإن كانت حليًا إلا أن تكون للتجارة، كذا في الجوهرة"". (180/1ط: رشیدیه) فقط والله أعلم</span></p></p>",144108201797,banuri,"('زکات', 'zakat')","('زکوٰۃ / صدقات', 'zakat-sadaqat')","('وجوب زکوٰۃ کی تفصیل', 'wujob-e-zakat-ki-tafseel')"
20-04-2020,https://www.banuri.edu.pk/readquestion/islamic-finance-certificate-zakat-144108201821/20-04-2020,Islamic Finance Certificate پر زکاۃ,میں نے میزان بینک سے Islamic Finance Certificate خریدے ہیں۔ جن کی میعاد ایک سال چھ  ماہ ہے۔ اور میں نے 16 لاکھ روپے دیے ہیں۔ اور مدت پورے ہونے کے بعد مجھے میرے پیسے واپس ملیں گے۔  اب میرا سوال یہ ہے کیا میں ان 16  لاکھ پر زکاۃ ادا کروں گا اس سال کہ نہیں؟ کیا میں اس وقت صاحبِ نصاب ہوں یا نہیں؟,"<p><p style=""text-align:justify;"">مذکورہ سرٹیفیکیٹ اگر مشارکہ یا مضاربہ کی بنیاد پر  لیے گئے ہوں تو  آپ کا سرمایہ ان کے پاس بطورِ امانت ہے جس کی زکاۃ آپ پر لازم ہے۔اور مذکورہ رقم کا مالک صاحبِ نصاب ہے، لہذا جب آپ کی زکاۃ ادا کرنے کی تاریخ آئے جس پر آپ کا صاحبِ نصاب بننے کے بعد سے سال مکمل ہوتا ہو ، اس سال آپ مذکورہ رقم کی ڈھائی فیصد زکاۃ ادا کریں گے۔</p><p style=""text-align:justify;"">باقی دیگر بینکوں کی طرح مروجہ اسلامی بینکوں سے تمویلی معاملات کرنا بھی ناجائزہے، لہٰذا اگر آپ کو اس سے نفع حاصل ہو تو اس کا استعمال جائز نہیں ہوگا، زکاۃ اصل رقم پر لازم ہوگی، نفع کی مد سے پیسے وصول کرنا درست نہیں ہوگا۔ فقط واللہ اعلم</p></p>",144108201821,banuri,"('زکات', 'zakat')","('زکوٰۃ / صدقات', 'zakat-sadaqat')","('وجوب زکوٰۃ کی تفصیل', 'wujob-e-zakat-ki-tafseel')"
21-04-2020,https://www.banuri.edu.pk/readquestion/mayyit-kamiti-fnd-pr-zkat-144108201829/21-04-2020,میت کمیٹی فنڈ پر زکاۃ,ایک خاندان نےکچھ پیسے جمع کیے ہیں؛  تاکہ اس سے فوتگی کے اخراجات مکمل کیے جائیں جیسا کہ گاؤں میں لوگ اس طرح کی کمیٹی ڈالتے ہیں، اب اس پر سال گزر گیا ہے، 150000 کی رقم ہے۔ اس پر زکاۃ  ہے کیا؟,"<p><p style=""text-align:justify;"">اگر مذکورہ رقم  سب نے مل کر کسی ادارے  یا شخص کو  اپنی ملکیت سے نکال کر دے دی ہے تو رقم دینے والوں پر اس رقم کی زکاۃ واجب نہیں، اور اگر سب نے امانتاً دی ہے یا بطورِ قرض دی ہے جو  کہ ان کی فوتگی کے وقت واپس مل جائے گی، تو اس صورت میں ہر دینے والے پر اس کے حصے کے بقدر زکاۃ واجب ہوگی۔</p><p style=""text-align:justify;"">واضح رہے کہ مروجہ میت کمیٹی فنڈ کا اجرا بہت سی خامیوں کی وجہ سے شرعاً درست نہیں ہے۔ تفصیل کے لیے درج ذیل لنک ملاحظہ کیجیے:</p><p style=""text-align:justify;""><a href=""https://www.banuri.edu.pk/readquestion/%D9%85%DB%8C%D8%AA-%DA%A9%D9%85%DB%8C%D9%B9%DB%8C-%DA%A9%DB%8C-%D8%B4%D8%B1%D8%B9%DB%8C-%D8%AD%DB%8C%D8%AB%DB%8C%D8%AA-144105201115/26-01-2020"">میت کمیٹی کی شرعی حیثیت</a></p><p style=""text-align:justify;"">فقط واللہ اعلم</p></p>",144108201829,banuri,"('زکات', 'zakat')","('زکوٰۃ / صدقات', 'zakat-sadaqat')","('ادائے زکوٰۃ', 'adaye-zakat')"
20-04-2020,https://www.banuri.edu.pk/readquestion/tabeerurruya-144108201819/20-04-2020,شادی اور رشتے کے لیے وظیفہ,جلد از جلد شادی اور اچھے رشتے کے لیے مجرب وظیفہ بتا دیں، رشتے آتے نہیں، اگر آتے ہیں تو بات نہیں بنتی ہے .اگر بندش ہے تو اس کا بھی وظیفہ بتا دیں .,"<p><p style=""text-align:justify;"">عشاء کی نماز کے بعد روزانہ چالیس دن تک 41 مرتبہ درج ذیل آیت پڑھیں: </p><p style=""text-align:justify;""> {<span class=""ar_writing"">وَمَن يَتَّقِ اللَّهَ يَجْعَل لَّهُ مَخْرَجًا وَيَرْزُقْهُ مِنْ حَيْثُ لَا يَحْتَسِبُ ۚ وَمَن يَتَوَكَّلْ عَلَى اللَّهِ فَهُوَ حَسْبُهُ ۚ إِنَّ اللَّهَ بَالِغُ أَمْرِهِ ۚ } [الطلاق: 2،3]</span></p><p style=""text-align:justify;"">اور    <span class=""ar_writing"">یا عَزِیزُ </span> کا ورد کثرت سے رکھیے۔ فقط واللہ اعلم</p></p>",144108201819,banuri,"('علوم و فنون', 'uloom-funoon')","('تعبیر الرؤیا', 'mutafarriq-deeni-uloom')","('بعض خوابوں کی تعبیر', 'baaz-khuwabon-ki-taabeer')"
21-04-2020,https://www.banuri.edu.pk/readquestion/tabeerurruya-144108201866/21-04-2020,اپنے آپ کو بیت الخلا میں دیکھنے کی تعبیر,اکثر خواب میں بیت الخلا دیکھتا ہوں، یعنی میں اپنے آپ کو بیت الخلا میں دیکھتا ہوں.,"<p><p style=""text-align:justify;"">خواب دیکھنے والا حرام آمدنی سے پیسہ حاصل کررہا ہے۔ فقط واللہ اعلم</p></p>",144108201866,banuri,"('علوم و فنون', 'uloom-funoon')","('تعبیر الرؤیا', 'mutafarriq-deeni-uloom')","('بعض خوابوں کی تعبیر', 'baaz-khuwabon-ki-taabeer')"
17-04-2020,https://www.banuri.edu.pk/readquestion/nabalig-ki-imamt-ka-hukum-144108201548/17-04-2020,بالغ اور نابالغ مقتدیوں کے لیے نابالغ کی امامت کا حکم,نابالغ کے پیچھے نماز پڑھنا جائز یا نہیں؟,"<p><p style=""text-align:justify;"">فرض  اور نفل نماز (تراویح وغیرہ) میں بالغ مقتدیوں کی امامت کے لیے امام کا بالغ ہونا ضروری ہے، نابالغ امام کی اقتدا  میں بالغ مقتدیوں کی  نماز  ادا نہیں ہوگی، ہاں نابالغ  لڑکا اپنے جیسے نابالغ بچوں کی امامت کرلے تو اس میں مضائقہ نہیں۔</p><p style=""text-align:justify;""><span class=""ar_writing"">الاختيار لتعليل المختار (1/ 58):<br/>
""قال: (ولاتجوز إمامة النساء والصبيان للرجال) أما النساء فلقوله عليه الصلاة والسلام: «أخروهنّ من حيث أخرهنّ الله»، وإنه نهي عن التقديم. وأما الصبيّ فلأنّ صلاته تقع نفلاً فلايجوز الاقتداء به، وقيل: يجوز في التراويح؛ لأنها ليست بفرض، والصحيح الأول؛ لأنّ نفله أضعف من نفل البالغ فلايبتنى عليه"".</span><br/><span class=""ar_writing"">الفتاوى الهندية (1/ 85) :</span><br/><span class=""ar_writing"">""وإمامة الصبي المراهق لصبيان مثله يجوز، كذا في الخلاصة ... المختار أنه لايجوز في الصلوات كلها، كذا في الهداية وهو الأصح. هكذا في المحيط وهو قول العامة وهو ظاهر الرواية. هكذا في البحر الرائق"". فقط والله أعلم</span></p></p>",144108201548,banuri,"('نماز', 'salat')","('نماز کی جماعت', 'namaz-ki-jamat')","('جماعت / امامت', 'jamat-imamat')"
17-04-2020,https://www.banuri.edu.pk/readquestion/hazrat-ali-ko-karrm-allah-u-wajhahu-kehne-ki-waja-144108201539/17-04-2020,حضرت علی ؓ کو ”کرم اللہ وجہہ“ کہنے کی وجہ,حضرت علی کو کرم اللہ وجہہ کہنے کی وجہ؟,"<p><p style=""text-align:justify;"">خوارج حضرت علی رضی اللہ عنہ کے نام مبارک کے ساتھ بددعا کے گندے الفاظ استعمال کرتے کہ ’’سوداللہ وجہہ‘‘ (اللہ ان کے چہرے کو سیاہ کرے)، ان کے جواب میں اہلِ سنت والجماعت حضرت علی رضی اللہ عنہ کے ساتھ ’’کرم اللہ وجہہ‘‘ لگاتے ہیں۔ جس کا ترجمہ یہ ہے کہ: ’’اللہ تعالیٰ آپ کے چہرے کو معزز فرمائیں‘‘۔  (آپ کے مسائل اور ان کا حل1 /337۔ فتاویٰ رشیدیہ ۱۰۹)</p><p style=""text-align:justify;"">نیز  امداد الفتاوی میں مذکورہ توجیہ کے ذکر کے ساتھ  حضرت تھانوی رحمہ اللہ نے یہ بھی   تحریر فرماتے ہیں : </p><p style=""text-align:justify;"">”ایک بزرگ سے سنا تھا کہ  چوں کہ آپ رضی اللہ عنہ عہدِ طفلی میں اسلام لے آئے ، آپ کا وجہ (چہرہ) مبارک کبھی بت کے سامنے جھکا نہیں اس لیے بھی یہ کہا جاتا ہے“۔  (امداد الفتاوہ  3/374)</p><p style=""text-align:justify;"">تاہم اس وجہ کے ذکر کرنے سے یہ لازم نہیں آتا کہ حضرت علی رضی اللہ عنہ کے علاوہ تمام صحابہ نے اسلام سے پہلے بت کے آگے سر جھکایا، بلکہ بہت سے صحابہ کرام رضی اللہ عنہم  کے بارے میں منقول ہے کہ انہوں نے جاہلیت میں بھی کبھی بت پرستی نہیں کی، اور شراب نوشی وغیرہ جیسے دیگر امور سے بھی اجتناب کرتے تھے۔ فقط واللہ اعلم</p></p>",144108201539,banuri,"('ایمان و عقائد', 'aqaed')","('اسلامی عقائد', 'islami-aqaed')","('صحابہ کرام اور تابعین رضوان اللہ علیہم', 'sahaba-kiram-ridhwan-ullahi-alayhim-ajmaeen')"
17-04-2020,https://www.banuri.edu.pk/readquestion/jummay-main-khuhtba-nikal-gaya-144108201511/17-04-2020,جمعہ میں خطبہ نکل گیا,ہم ایک دوست کے گھر جمعہ پڑھنے جا رہے تھے تو دوسرے نے کہا کہ مسجد میں ہورہا ہے تو ہم اس کے ساتھ مسجد چلے گئے، لیکن وہاں خطبہ ہوچکا تھا اور پہلی رکعت چل رہی تھی۔ وہاں نماز پڑھ کر دوست کے گھر گئے تو وہاں بھی جمعہ ہورہا تھا، وہاں ہم نے خطبہ سن لیا اور جمعہ پڑھ لیا۔ میرا جمعہ ادا ہوا یا ظہر؟,"<p><p style=""text-align:justify;"">واضح رہے کہ  اگرکسی سے جمعے کا خطبہ رہ جائے اور وہ جمعے کی نماز میں شامل ہوجائے، خواہ دوسری رکعت یا قعدہ میں شامل ہو، تو اس کے ذمہ سے جمعے کا فریضہ ساقط ہوجائے گا، لیکن اگر جان بوجھ کر، یا اپنی کوتاہی کی وجہ سے خطبہ چھوڑا تو جمعہ کے ثواب میں کمی کاباعث ضرورہوگا۔</p><p style=""text-align:justify;"">صورتِ مسئولہ میں مسجد میں ادا کی گئی نماز  آپ کی جمعہ کی نماز ہوئی اور دوست کے گھڑ پڑھی گئی نماز نفل شمار ہوئی۔ آپ پر اس نماز کو لوٹانا لازم نہیں ہے،  تاہم آئندہ خطبہ سے پہلے مسجد جانے کا اہتمام کریں۔ یہ بھی واضح رہے کہ جمعے کا خطبہ نماز سے پہلے ہوتاہے، نماز کے بعد نہیں، لہٰذا نمازِ جمعہ ادا کرلینے کے بعد دوسری جگہ خطبہ سننے سے پہلے چھوٹ جانے والا خطبہ سننا شمار نہیں ہوگا۔  فقط واللہ اعلم</p></p>",144108201511,banuri,"('نماز', 'salat')","('جمعہ کی نماز', 'jumaa')","('جمعہ و عیدین', 'juma-o-eidayn')"
