issued_at,link,title,question,answer,fatwa_number,dar_ul_ifta,kitab,bab,fasal
13-12-2019,https://www.banuri.edu.pk/readquestion/پریکٹیکل-جرنل-میں-تصاویر-بنانا-144104200519/13-12-2019,پریکٹیکل جرنل میں تصاویر بنانا,میں zoology پڑھ رہی ہوں، اس میں پریکٹیکل جرنل میں تصاویر بنانی ہوتی ہیں، جو ضروری ہے،  اس کے بارے میں کیا حکم ہے؟,"<p><p style=""text-align:justify;"">آپ کو جن تصاویر بنانے کی ضرورت پڑتی ہے، اگر وہ سر کے علاوہ مختلف  اعضاء کی ہیں جیسا کہ صرف ہاتھ  کی یا صرف کان کی یا جان دار کے کئی متفرق اعضاء کی، اور اس میں اس جانور  کی مکمل تصویر  یا سر مکمل نہیں ہے، تو  ایسی تصویر بنانا جائز ہے، لیکن مکمل جان دار یا اس کے سر کی مکمل تصویر بنانا جائز نہیں ہے۔البتہ سر  کے اجزاء  کی علیحدہ علیحدہ تصاویر بنانی پڑے، مثلاً: صرف ناک کی تصویر تو  اس کی گنجائش ہوگی۔</p><p style=""text-align:justify;"">شیخ الحدیث حضرت مولانا محمد زکریا کاندھلویؒ نے علامہ نوویؒ کی پوری عبارت نقل کرنے کے بعد زرقانیؒ کے حوالے سے ابن العربیؒ کا یہ قول نقل کیا ہے:<br/><span class=""ar_writing""> ’’فإن کانت ثابتة الهیئة قائمة الشکل حرم، وإن قطعت الرأس وتفرقت الأجزاء جاز، هذا هو الأصح‘‘.  (أوجز المسالك، ج:۶، ص:۳۹۱)</span><br/>
ترجمہ:…’’اگر تصویر کی ہیئت اور شکل درست ہو تو حرام ہے اور اگر اس کا سر کاٹا گیا ہو اور بدن کے اجزاء کو الگ الگ کردیا گیا ہو، پھر جائز ہے، یہ سب سے صحیح مسلک ہے‘‘۔</p><p style=""text-align:justify;""><span class=""ar_writing"">’’أو مقطوعة الرأس أو الوجه أو ممحوّة عضو لاتعیش بدونه ... وقید بالرأس لأنه لا اعتبار بإزالة الحاجبین أو العینین لأنها تعبد بدونها‘‘. (در مع رد المحتار: ج۲ ص۴۱۸،)</span></p><p style=""text-align:justify;""><span class=""ar_writing"">’’أو کانت صغیرةً لاتتبین تفاصیل أعضائها للناظر قائمًا وهي علی الأرض ... قال: بحیث لاتبدو للناظر إلا بتبصر بلیغ ... أو لاتبدو له من بعید ثم قال: لکن في الخزانة إن کانت الصورة مقدار طیر یکره وإن کانت أصغر فلا"". (در مع رد المحتار: ج۲ ص۴۱۸)</span> فقط واللہ اعلم</p></p>",144104200519,banuri,"('حظر و اباحت', 'mamnooaat-mubahat')","('تفریح / کھیل', 'tafreeh-khel')","('ٹی وی / وی سی آر / سینما / انٹرنیٹ/تصویر سازی', 'tv-vcr-cinema-internet-taswer-sazi')"
15-12-2019,https://www.banuri.edu.pk/readquestion/کیا-آپ-صلی-اللہ-علیہ-و-سلم-ہر-جمعہ-کی-فرض-نماز-میں-سجدہ-تلاوت-کیا-کرتے-تھے-144104200582/15-12-2019,کیا آپ صلی اللہ علیہ و سلم ہر جمعہ کی فرض نماز میں سجدہ تلاوت کیا کرتے تھے؟,کیا نبی کریمﷺ سے یہ عمل ثابت ہے کہ آپ ﷺ ہرجمعہ کی فرض نماز میں سجدۂ تلاوت ادا کیا کرتے تھے؟,"<p><p style=""text-align:justify;"">رسول اللہ ﷺ کا ہر جمعہ کی نماز میں سجدہ تلاوت کرنا تو ثابت نہیں ہے، البتہ جمعہ کے دن کی فجر کی نماز میں آپ ﷺ کا سورہ الم سجدہ پڑھنا اور نماز میں سجدۂ  تلاوت کرنا روایات سے ثابت ہے۔ فقط واللہ اعلم</p></p>",144104200582,banuri,"('نماز', 'salat')","('سجدہ سہو', 'sajda-sahv')","('سجدہ تلاوت / سجدہ سہو', 'sajda-tilawat-sajda-sahw')"
28-02-2020,https://www.banuri.edu.pk/readquestion/عمرے-کے-فرائض-144107200126/28-02-2020,عمرے کے فرائض,عمرہ کے فرائض کتنے ہیں اور کون سے ہیں؟,"<p><p style=""text-align:justify;"">عمرہ میں احرام باندھنا اور طواف کرنا فرض ہے، جب کہ  سعی کرنا اورحلق (سر منڈوانا) یا( کم ازکم چوتھائی سر ، ایک پورے کے برابر) بال چھوٹے کرانا واجب ہے۔  فقط واللہ اعلم</p></p>",144107200126,banuri,"('حج', 'haj')","('حج / عمرہ', 'hajj-umrah')","('فرضیت وشرائط حج', 'fardhiyat-o-sharaait-haj')"
15-12-2019,https://www.banuri.edu.pk/readquestion/علاج-کی-غرض-سے-فرج-میں-ہاتھ-داخل-کرنے-کی-صورت-میں-غسل-کا-حکم-144104200585/15-12-2019,علاج کی غرض سے فرج میں ہاتھ داخل کرنے کی صورت میں غسل کا حکم,جب عورت اپنا گائنا کولوجی اندرونی معائنہ کرواتی  ہے تو  اس صورت میں اخراج ہوتاہے۔ اس صورت میں غسل ضروری ہوگا یا نہیں؟,"<p><p style=""text-align:justify;"">بصورتِ مسئولہ علاج کی غرض سے اگر دائی یا قابلہ انگلی یا ہاتھ  داخل کرے  تو صرف انگلی یا دوا وغیرہ  کے دخول سے غسل فرض نہیں ہوگا۔ لیکن اگر انگلی کے دخول کے ساتھ  ساتھ   شہوت کے ساتھ انزال ہوجائے اور  شرم گاہ سے باہر مادے کا اخراج بھی ہو تو غسل فرض ہوجائے گا۔  اور اگر بغرضِ علاج انگلی وغیرہ داخل کی اور لذت محسوس ہونے کے ساتھ تسکین بھی ہوگئی، لیکن شرم گاہ سے کچھ  باہر مادہ نہیں نکلا تو غسل فرض نہیں ہوگا، البتہ اگر ان اشیاء کا دخول اندرونی شرم گاہ تک ہو  اور شہوت کے ساتھ تسکین ہوجائے تو  احتیاطاً غسل کرلینا چاہیے۔</p><p style=""text-align:justify;"">امداد الاحکام میں ہے:</p><p style=""text-align:justify;"">’’عورت کافرج میں دوارکھنا موجبِ غسل ہے یا نہیں؟<br/>
سوال: قابلہ جودوا رکھتی ہے اس دوا کے رکھنے سے غسل تو واجب نہیں ہے یا ہے؟<br/>
الجواب: قول مختار میں تو مطلقاً غسل نہیں اور صاحبِ منیہ نے بحثاً کہا ہے کہ احتیاط وجوب غسل میں ہے ، بشرطیکہ مقصود استمتاع  واستلذاذ ہو اور جو مقصود محض تداوی ہو  جیسا سوال میں مذکور ہے تو ان کے نزدیک بھی غسل نہیں۔ </p><p style=""text-align:justify;""><span class=""ar_writing"">قال في الدر:</span></p><p style=""text-align:justify;""><span class=""ar_writing"">""ولاعند إدخال أصبع ونحوه في الدبر أو القبل علی المختاراهـ ونقل الشامي من کلام نوح آفندي علی التجنیس: أن المختار وجوب الغسل في القبل إذا قصدت الاستمتاع؛ لأن الشهوة فیهنّ غالبة، فیقام السبب مقام المسبب، قال: وقوله: لأن المختار وجوب الغسل ... الخ بحث منه سبقه إلیه شارح المنیة حیث قال: والأولی أن یجب في القبل ... الخ وقد نبه في الإمداد أیضاً علی أنه بحث من شارح المنیة، فافهم"". </span> واللہ اعلم، ۸ ذی الحجہ ۴۴ھ‘‘.</p><p style=""text-align:justify;"">فقط واللہ اعلم</p></p>",144104200585,banuri,"('طہارت', 'taharat')","('غسل', 'ghusl')","('غسل،فرائض،سنن،آداب اور غسل واجب کرنے والی اشیاء', 'ghusl-faraidh-sunan-aadab-or-ghusl-wajib-karne-wali-ashya')"
17-12-2019,https://www.banuri.edu.pk/readquestion/ماحی-محمد-نام-رکھنا-144104200662/17-12-2019,ماحی محمد نام رکھنا,’’ماحی محمد‘‘  نام رکھنا کیسا ہے؟ اور کیامعنی ہیں؟ ’’ماح‘‘  آپ صلی اللہ علیہ وسلم کا ایک نام ہے۔,"<p><p style=""text-align:justify;"">’’ ماحی‘‘  (یا کے ساتھ) آپ ﷺ کے ناموں میں سے ہے،  اس کا معنی ہے: مٹانے والا(یعنی کفر وشرک کو مٹانے والا)، یہ نام رکھنا  مناسب نہیں،  اسے  آپ ﷺ کے ساتھ خاص رکھا جائے تو بہتر ہے خصوصاً جب’’محمد‘‘  بعد میں آئے تو  اضافت کی وجہ سے غلط معنی کا شبہ ہوتاہے۔</p><p class=""indent"" style=""text-align:justify;""><span class=""ar_writing"">عن جبیر بن مطعم قال: سمعت النبي صلی الله علیه وسلم یقول: إن لي أسماء، أنا محمد، وأنا أحمد، ”وأنا الماحي الذي یمحو الله بي الکفر“ وأنا الحاشر الذي یحشر الناس علی قدمي وأنا العاقب والعاقب الذي لیس بعده نبي. متفق علیه.</span></p><p class=""indent"" dir=""rtl"" style=""text-align:left;"">(مشکاة المصابیح، باب أسماء النبي صلی الله علیه وسلم وصفاته، الفصل الأول، ص ۵۱۵، ط: المکتبة الأشرفیة دیوبند)</p><p style=""text-align:justify;"">مزید دیکھیے:</p><p class=""indent"" style=""text-align:justify;""><a href=""https://www.banuri.edu.pk/readquestion/muhammad-mahi-nam-rakhna-q-mana-hay-144201201013/09-09-2020"">محمد ماحی نام رکھنا کیوں منع ہے؟</a></p><p class=""indent"" style=""text-align:left;"">  <strong>فقط واللہ  اعلم</strong></p></p>",144104200662,banuri,"('حقوق و آدابِ معاشرت', 'huqooq-muashret')","('حقوق', 'bahmi-huqooq')","('اولاد کے حقوق', 'olad-ky-hoqoq')"
21-12-2019,https://www.banuri.edu.pk/readquestion/رمضان-میں-مشت-زنی-اور-فارغ-ہونے-کا-کفارہ-144104200787/21-12-2019,رمضان میں جلق کے ذریعہ روزہ فاسد کرنے کا کفارہ,شاید رمضان میں میں نے ایک دو بار مشت زنی  کی ہے مجھے یاد نہیں، اور شاید کچھ  بار میں خود سے لذت حاصل کرتے ہوئے فارغ بھی ہوا ہوں،  کیا مجھے کوئی کفارہ دینا ہوگا ؟,"<p><p style=""text-align:justify;"">مذکورہ فعل ناجائز اور گناہ ہے، خصوصاً رمضان المبارک میں روزے کی حالت میں اس کا گناہ اور سختی بڑھ جاتی ہے، لہٰذا اولاً صدقِ دل سے توبہ و استغفار کیجیے، پھر اچھی طرح غور وفکر کرکے یہ بات متعین  کرلیں کہ کتنے روزوں میں مشت زنی وغیرہ کی وجہ سے فارغ ہوئے ہیں، ان روزوں کی قضا کر لیں ،اور آئندہ ایسا نہ کریں مزید کوئی کفارہ لازم نہیں ہے۔ فقط واللہ اعلم</p></p>",144104200787,banuri,"('روزہ', 'soum')","('روزہ', 'roza')","('کفارہ / فدیہ', 'kaffara-fidya')"
28-02-2020,https://www.banuri.edu.pk/readquestion/خودکشی-کے-بعد-توبہ-کرنا-144107200153/28-02-2020,خودکشی کے بعد توبہ کرنا,اگر کسی نے خود کشی کی دوائی کھائی ہو  یعنی ایسی گولیاں استعمال کی ہوں کہ ان گولیوں کے کھانے سے اکثر انسان مر ہی جاتا ہے، لیکن بہت سارے لوگ بچ بھی گئے، تو کیا ایسی گولیوں کے استعمال کے بعد اگر کوئی آدمی  30  گھنٹے زندہ رہا ہو تو وہ شخص خودکشی کی موت مرے گا یا اپنی؟ مذکورہ شخص نے جب گولیاں استععمال کیں تو فوراً کہنے لگا کہ مجھے بچاؤ،خود بھاگ کر کسی کے پاس گیا کہ مجھے ڈاکٹر کے پاس لے جاؤ، بعد ازاں اسے دوبارہ ڈاکٹر کے پاس بھی لے جایا گیا اور خوب دوائی وعلاج بھی چلتا رہا، لیکن وہ شخس زندہ نہیں بچا، جب یہ آدمی ہسپتال میں تھا  تو  اس سے کہا گیا کہ بھائی توبہ کرو، کہیں تمہاری موت واقع نہ ہوجائے تو  اس شخص نے خوب توبہ کی، الفاظ یہ تھے کہ یا اللہ مجھے معاف کردے،  مجھ سے غلطی ہوگئی، میں نے سب کچھ نادانی میں کیا ہے۔ آئندہ نہیں کروں گا، اس کے بعد یہ شخص تقریباً  18  گھنٹے زندہ رہا، پھر فوت ہوگیا، اب کیا اس شخص کی توبہ کا اعتبار ہے یا نہیں ؟ نیز کیا یہ اس شخص کی موت خود کشی والی کہلائے گی یا طبعی ؟,"<p><p style=""text-align:justify;"">خودکشی کرنا کبیرہ گناہ  ہے، مذکورہ شخص کا اقدامِ خود کشی بلاشبہ کبیرہ گناہ تھا، لیکن آثارِ موت اور نزع کی حالت سے پہلے پہلے تک توبہ قبول ہونا حدیث میں مذکور ہے، موت سے پہلے انسان توبہ کرلے تو باری تعالیٰ  معاف کرنے والے ہیں،  جو  لوگ دنیا سے جاچکے ان کے بارے میں اچھا گمان رکھنا چاہیے، یقیناً اللہ بخشنے والا مہربان ہے، بلکہ دعائے مغفرت بھی کی جائے ۔ لہٰذا مذکورہ شخص کے بارے میں یہی امید رکھنی چاہیے کہ اللہ تعالیٰ اس کی توبہ قبول فرمائیں گے، کیوں کہ (بظاہر) عین آثارِ موت سے پہلے اس نے توبہ کی ہے، اور اس کے لیے دعائے مغفرت بھی کرنی چاہیے۔ باقی اس کی موت کو مطلقاً طبعی موت تو نہیں کہا جاسکتا؛ کیوں کہ ظاہری سبب اقدامِ خود کشی ہی بنا ہے، اور بعد از توبہ اسے خود کشی بھی نہیں کہا جائے گا۔</p><p style=""text-align:justify;"">امدادالفتاویٰ میں ہے:</p><p style=""text-align:justify;"">’’خودکشی کرنے والے کے لیے دعاءِ مغفرت کرنا جائز ہے‘‘۔ (امداد الفتاوی 4/ 607) <span class=""ar_writing"">فقط والله اعلم</span></p></p>",144107200153,banuri,"('جنائز', 'janaiz')","('نماز جنازہ', 'namaz-e-jinazah')","('جنازہ اور نماز جنازہ کے احکام (فرائض، سنن، مستحبات، مکروہات)', 'janaza-or-namaz-e-janaza')"
15-12-2019,https://www.banuri.edu.pk/readquestion/آغا-خانی-لوگوں-سے-میل-جول-رکھنا-144104200588/15-12-2019,آغا خانی لوگوں سے میل جول رکھنا,کیاآغا خانی دائرۂ اسلام سے خارج ہے؟ ان کے ساتھ تعلقات قائم کرنا اوراٹھنابیٹھنا کیسا ہے؟  اگر وہ خود آتے ہو ں اور آپ کے ساتھ اٹھتے بیٹھتے ہوں تو کیسا ہے؟,"<p><p style=""text-align:justify;"">آغا خانی فرقہ اپنے کفریہ عقائد کی وجہ سے دائرۂ  اسلام سے خارج ہے، اگر ان کے ساتھ میل جول رکھنے سے اپنے عقائد کے خراب ہونے کا اندیشہ ہو تو ان کے ساتھ  بیٹھک ترک کرنا ضروری ہے اور اگر اس نیت سے ان کے ساتھ میل جول رکھا جائے کہ ان کو راہِ حق دکھائی جائے تو اس نیت سے ضرورت کے مطابق تعلقات رکھنے میں کوئی حرج نہیں۔</p><p style=""text-align:justify;"">ارشاد باری تعالیٰ ہے:</p><p style=""text-align:justify;""><span class=""ar_writing"">﴿ لَايَتَّخِذِ الْمُؤْمِنُونَ الْكٰفِرِينَ أَوْلِيَآءَ مِنْ دُونِ الْمُؤْمِنِينَ وَمَنْ يَفْعَلْ ذٰلِكَ فَلَيْسَ مِنَ اللّٰهِ فِي شَيْءٍ إِلَّا أَنْ تَتَّقُوْا مِنْهُمْ تُقَاةً وَّيُحَذِّرُكُمُ اللّٰهُ نَفْسَهُ وَإِلَى اللّٰهِ الْمَصِيرُ﴾ [آل عمران:28]</span><br/>
ترجمہ: مسلمانوں کو چاہیے کہ کفار کو (ظاہراً یا باطناً) دوست نہ بناویں  مسلمانوں (کی دوستی) سے تجاوز کرکے ، اور جو شخص ایسا (کام) کرے گا سو وہ شخص اللہ کے ساتھ (دوستی رکھنے کے) کسی شمار میں نہیں، مگر ایسی صورت میں کہ تم ان سے کسی قسم کا (قوی) اندیشہ رکھتے ہو۔ اور اللہ تعالیٰ تم کو اپنی ذات سے ڈراتا ہے اور خدا ہی کی طرف لوٹ کر جانا ہے۔ </p><p style=""text-align:justify;"">حکیم الامت حضرت مولانا اشرف علی تھانوی صاحب رحمہ اللہ  فرماتے ہیں:</p><p style=""text-align:justify;""> کفار کے ساتھ تین قسم کے معاملے ہوتے ہیں: موالات یعنی دوستی۔ مدارات: یعنی ظاہری خوش خلقی۔ مواساۃ:  یعنی احسان و نفع رسانی۔</p><p style=""text-align:justify;"">موالات تو کسی حال میں جائز نہیں۔ اور مدرات تین حالتوں میں درست ہے:  ایک دفعِ ضرر کے واسطے، دوسرے اس کافر کی مصلحتِ دینی یعنی توقعِ ہدایت کے واسطے، تیسرے اکرامِ ضیف کے لیے، اور اپنی مصلحت و منفعتِ مال و جان کے لیے درست نہیں۔ اور مواسات کا حکم یہ ہے کہ اہلِ حرب کے ساتھ ناجائز ہے اور غیر اہلِ حرب کے ساتھ جائز۔ (بیان القرآن) فقط واللہ اعلم</p></p>",144104200588,banuri,"('ایمان و عقائد', 'aqaed')","('باطل مذاہب اور فرقے', 'mazahib-masalik')","('آغاخانی، ذکری، بوہری، مہدویہ', 'agha-khaniyat')"
28-02-2020,https://www.banuri.edu.pk/readquestion/سیر-وتفریح-کے-لیے-گرونانک-گردوارہ-جانا-144107200152/28-02-2020,سیر وتفریح کے لیے گرونانک گردوارہ جانا,سیر وتفریح کے لیے گرونانک جانا کیسا ہے؟,"<p><p style=""text-align:justify;"">وہ مقامات جہاں غیر اللہ کی عبادت کی جاتی ہے، یا کفار اپنے عقیدے کے مطابق عبادت کرتے ہیں، چوں کہ یہ مقامات معصیت کا گڑھ اور شیطان کی آماج گاہ ہوتے ہیں، اس وجہ سے ان مقامات پر جانے کی شرعاً اجازت نہیں ہے، فقہاءِ  کرام نے ایسے شخص کو تعزیری سزا کا مستحق قرار دیا ہے جو کفار کی عبادت گاہ  مستقل جاتاہو۔</p><p style=""text-align:justify;"">حاصل یہ ہے کہ مسلمانوں کا مندروں،  چرچ ، گردوارہ اورکفار کی دیگر عبادت گاہوں میں جانا جائز نہیں ہے، لہذا سیر وسیاحت کے لیے گرونانک جانا جائز نہیں ہے۔</p><p style=""text-align:justify;"">امداد الفتاوی میں ہے :</p><p style=""text-align:justify;"">”میلۂ پرستش گاہِ ہنود میں عموماً مسلمانوں کا جانا اور خصوصاً علماء کا جانا  اور  یہ بھی نہیں کہ کوئی ضرورتِ شدیدہ دنیاوی ہی ہو، محض سیر وتماشے کے لیے، سخت ممنوع و قبیح ہے ۔۔۔  ممانعت ایسی جگہ جانے سے دوسری آیت سے ثابت ہے: <span class=""ar_writing"">{فلاتقعد بعد الذكرى مع القوم الظالمين}</span>  یعنی بعد نصیحت کے قومِ ظالمین کے پاس مت بیٹھ ، یعنی کفار سے اختلاط مت کر، اور حدیث میں ہے: <span class=""ar_writing"">”من كثر سواد قوم فهو منهم“. </span>(جو کسی جماعت کی تعداد بڑھائے اس کا شمار اُن ہی میں سے ہے) اور حدیثِ صحیح میں آیا ہے کہ قربِ قیامت میں ایک لشکر کعبہ معظمہ کے ارادہ سے چلے گا، جب قریب پہنچیں گے تو سب زمین میں دھنس جائیں گے، ازواجِ مطہرات میں سے ایک بی بی نے عرض کیا کہ یارسول اللہ  اس میں تو بازاری دکان دار لوگ بھی ہوں گے کہ ارادہ لڑنے کا نہ رکھتے ہوں گے،  ان کا کیا قصور ؟ آپ ﷺ نے فرمایا  کہ اللہ تعالیٰ کا عذاب  عام آتا ہے، اس وقت دھنس جائیں گے، پھر قیامت کے روز اپنی اپنی نیت کے موافق محشور (جمع) ہوں گے۔انتہیٰ۔</p><p style=""text-align:justify;"">پس جب یہ لوگ باوجودیکہ ضرورتِ تجارت کے بسبب ان کے ساتھ شامل ہوں گے، عذابِ الٰہی سے نہ بچ سکیں گے تو جس کو یہ بھی ضرورت نہ ہو وہ کیوں کر اس غضب وعتاب سے جو مجمعِ کفار میں من اللہ نازل ہواکرتا ہے محفوظ رہے گا“۔(4/270، ط: مکتبہ دارالعلوم کراچی)</p><p style=""text-align:justify;"">البحر الرائق میں ہے:</p><p style=""text-align:justify;""><span class=""ar_writing"">""(قَوْلُهُ: وَلَايَحْلِفُونَ فِي بُيُوتِ عِبَادَتِهِمْ)؛ لِأَنَّ الْقَاضِيَ لَايَحْضُرُهَا بَلْ هُوَ مَمْنُوعٌ عَنْ ذَلِكَ، كَذَا فِي الْهِدَايَةِ، وَلَوْ قَالَ: الْمُسْلِمُ لَايَحْضُرُهَا لَكَانَ أَوْلَى؛ لِمَا فِي التَّتَارْخَانِيَّة: يُكْرَهُ لِلْمُسْلِمِ الدُّخُولُ فِي الْبِيعَةِ وَالْكَنِيسَةِ، وَإِنَّمَا يُكْرَهُ مِنْ حَيْثُ إنَّهُ مَجْمَعُ الشَّيَاطِينِ، لَا مِنْ حَيْثُ إنَّهُ لَيْسَ لَهُ حَقُّ الدُّخُولِ، وَالظَّاهِرُ أَنَّهَا تَحْرِيمِيَّةٌ؛ لِأَنَّهَا الْمُرَادَةُ عِنْدَ إطْلَاقِهِمْ، وَقَدْ أَفْتَيْت بِتَعْزِيرِ مُسْلِمٍ لَازَمَ الْكَنِيسَةَ مَعَ الْيَهُودِ"". ( ٧ / ٢١٤،ط: دار الكتاب الاسلامي)</span></p><p style=""text-align:justify;""><span class=""ar_writing"">مجمع الأنهر في شرح ملتقی الأبحر</span>میں ہے:</p><p style=""text-align:justify;""><span class=""ar_writing"">""(وَلَا يَحْلِفُونَ) أَيْ الْكُفَّارُ (فِي مَعَابِدِهِمْ) ؛ لِأَنَّ فِيهِ تَعْظِيمًا لَهَا وَالْقَاضِي مَمْنُوعٌ عَنْ أَنْ يَحْضُرَهَا وَكَذَا أَمِينُهُ؛ لِأَنَّهَا مَجْمَعُ الشَّيَاطِينِ لَا أَنَّهُ لَيْسَ لَهُ حَقُّ الدُّخُولِ. وَفِي الْبَحْرِ وَقَدْ أَفْتَيْتُ بِتَعْزِيرِ مُسْلِمٍ لَازَمَ الْكَنِيسَةَ مَعَ الْيَهُودِ وَالنَّصَارَى"". ( ٢ / ٢٦٠، ط: دار احياء التراث العربي)</span>  فقط واللہ اعلم</p></p>",144107200152,banuri,"('ایمان و عقائد', 'aqaed')","('کفر و شرک اور ان کے احکام', 'kufr-o-shirk-aur-un-k-ahkam')","('کفر و شرک اور ان کی اقسام', 'kufr-o-shirk-aur-un-ki-aqsaam')"
