issued_at,link,title,question,answer,fatwa_number,dar_ul_ifta,kitab,bab,fasal
28-02-2020,https://www.banuri.edu.pk/readquestion/کلام-نفسی-اور-کلام-لفظی-میں-فرق-144107200147/28-02-2020,کلامِ نفسی اور کلامِ لفظی میں فرق,کلامِ نفسی اور کلامِ لفظی میں فرق  بیان کریں!,"<p><p style=""text-align:justify;"">کلامِ نفسی سے مراد وہ معنی، مدلول اور موضوع لہ ہے کہ جس کے لیے لفظ وضع کیا جاتا ہے،  یعنی نفس (دل)  میں جو بات اور معنی پوشیدہ ہے وہ کلامِ نفسی ہے، جس کا اظہار کبھی عبارت یعنی الفاظ کے ذریعے  کبھی کتابت کے ذریعے  اور کبھی اشارے کے ذریعے کیا جاتا ہے  جسے کلامِ لفظی کہتے ہیں۔</p><p style=""text-align:justify;"">جو کلام اللہ تعالیٰ کی صفت ہے وہ کلامِ نفسی ہے، جو قدیم ہے، ہمیشہ سے ہے، ہمیشہ رہے گا، اور کلامِ لفظی حادث ہے۔</p><p style=""text-align:justify;"">یہاں اسی قدر وضاحت کافی ہے،  تفصیل  عقائد اور علمِ کلام کی کتابوں کی طرف مراجعت کرکے معلوم کرلی جائے۔ فقط واللہ اعلم</p></p>",144107200147,banuri,"('ایمان و عقائد', 'aqaed')","('اسلامی عقائد', 'islami-aqaed')","('ذات و صفات و اسماء باری تعالیٰ', 'zat-o-sifat-0-asmae-bari-taala')"
28-02-2020,https://www.banuri.edu.pk/readquestion/نکاح-کے-بعد-رخصتی-سے-پہلے-بیوی-کو-حج-پر-لے-جانا-144107200139/28-02-2020,نکاح کے بعد رخصتی سے پہلے بیوی کو حج پر لے جانا,کیا رخصتی سے پہلے اہلیہ کو حج پر لے جاسکتے ہیں؟,"<p><p style=""text-align:justify;"">صورتِ مسئولہ میں نکاح ہوجانے کے بعد  لڑکا اور لڑکی دونوں آپس میں شرعاً میاں بیوی ہیں، اور ایک دوسرے کے لیے حلال ہیں،  اگرچہ رخصتی نہ ہوئی ہو، اس لیے اگر لڑکا نکاح ہوجانے کے بعد اپنی بیوی کو حج پر لے جائے تو شرعاً اس میں ممانعت نہیں ہے، دونوں کا حج ادا ہوجائے گا، البتہ ہمارے عرف اور معاشرے میں باقاعدہ  رخصتی سے قبل تنہائی کی ملاقاتوں کو معیوب سمجھا جاتا ہے، اور بسا اوقات یہ بہت بڑے مفاسد کا ذریعہ بن جاتا ہے، اس لیے بہتر یہ ہے کہ  سادگی سے رخصتی کرکے پھر حج پر ساتھ  چلے جائیں۔فقط واللہ اعلم</p></p>",144107200139,banuri,"('نکاح', 'nikah')","('نکاح کی اہمیت اور حکم', 'nikah-ki-ahmiyat-aur-hukum')","('نکاح کے فضائل و مقاصد', 'nikah-haqiqat-o-masaleh')"
28-02-2020,https://www.banuri.edu.pk/readquestion/اجنبی-مرد-عورت-کا-ایک-دوسرے-سے-تلذذ-حاصل-کرنا-144107200128/28-02-2020,اجنبی مرد عورت کا ایک دوسرے سے تلذذ حاصل کرنا,کیا لڑکا اور لڑکی دونوں بستر پر ایک دوسرے سے تلذذ(مزہ)حاصل کریں، یہ درست ہے ؟,"<p><p style=""margin-left:0;margin-right:0;text-align:justify;"">اجنبی مرد اور عورت کا تنہائی میں اکٹھا ہونا ہی جائز نہیں، چہ جائیکہ وہ ایک دوسرے کے جسم کو چھوئیں،  حضرت عمر رضی اللہ عنہ نبی کریم صلی اللہ علیہ وسلم سے نقل کرتے ہیں کہ آپ صلی اللہ علیہ وسلم نے فرمایا :جب بھی کوئی مرد کسی اجنبی عورت کے ساتھ تنہائی میں یک جا ہوتا ہے تو وہاں ان میں تیسرا شیطان ہوتا ہے ""۔(مشکوۃ )</p><p style=""margin-left:0;margin-right:0;text-align:justify;"">یعنی  جب دو اجنبی مرد و عورت کہیں خلوت میں جمع ہوتے ہیں تو وہاں شیطان فورًا پہنچ جاتا ہے،  جو ان دونوں کے جنسی جذبات کو برانگیختہ کرتا رہتا ہے، یہاں تک کہ ان پر جنسی ہیجان کا غلبہ ہو جاتا ہے اور وہ بدرکای میں مبتلا ہو جاتے ہیں۔</p><p style=""margin-left:0;margin-right:0;text-align:justify;"">اس  حدیث کا حاصل یہ ہے کہ تم کسی اجنبی عورت کے ساتھ خلوت میں یک جا ہونے کا کوئی موقع ہی نہ آنے دو کہ شیطان تمہارے درمیان آ جائے اور تمہیں برائی کے راستہ پر لگا دے۔(مظاہر حق)</p><p style=""text-align:justify;"">لہذا کسی بھی مرد اور عورت کا یوں اکٹھے ہوناایک دوسرے کے جسم کو چھونا اور  ایک دوسرے سےتلذذ حاصل کرناحرام اور  سخت گناہ کبیرہ ہے، اپنے اس فعل پر توبہ واستغفار کرنا چاہیے اور اپنے آپ کو اس سے دور رکھنا لازم ہے۔فقط واللہ اعلم</p></p>",144107200128,banuri,"('حقوق و آدابِ معاشرت', 'huqooq-muashret')","('اَخلاقیات', 'akhlaaqiyaat')","('شرم و حیاء', 'sharm-o-haya')"
22-12-2019,https://www.banuri.edu.pk/readquestion/زلیخا-نام-کا-ثبوت-قرآن-و-حدیث-سے-ہے-یا-نہیں-144104200798/22-12-2019,زلیخا نام کا ثبوت قرآن و حدیث سے ہے یا نہیں؟,کیا زلیخا کے نام کا قرآن اور حدیث کی روشنی میں کوئی ثبوت موجود ہے؟,"<p><p style=""text-align:justify;"">عزیز مصر کی بیوی جس نے یوسف علیہ السلام کو بہکانے کی کوشش کی تھی اس کا تذکرہ قرآن و حدیث میں <span class=""ar_writing"">’’امرأة عزیز‘‘</span> کے الفاظ سے کیا گیا ہے، قرآن و حدیث میں زلیخا نام سے اس خاتون کا تذکرہ ہمیں نہیں ملا، البتہ مفسرین نے تاریخی روایات کے حوالے سے اس کا تذکرہ ’’زلیخا‘‘ کے نام سے کیا ہے۔ فقط واللہ اعلم</p></p>",144104200798,banuri,"('تاریخ و سیر', 'tareekh-o-siyar')","('تاریخ', 'tareekh')","('تاریخِ اسلام', 'tareekh-e-Islam')"
18-12-2019,https://www.banuri.edu.pk/readquestion/آیت-درود-سن-کر-حق-یا-نبی-کہنا-144104200681/18-12-2019,آیتِ درود سن کر ’’حق یا نبی‘‘  کہنا,سورت الاحزاب کی آیت نمبر 56 میں  اکثر  لوگ{علی النبي}کے بعد  ’’حق یا نبی ‘‘  کہتے ہیں،  کیا یہ ٹھیک ہے؟,"<p><p style=""text-align:justify;"">سورۃ احزاب کی آیت نمبر 56 یہ ہے:</p><p style=""text-align:justify;""><span class=""ar_writing"">{إن الله وملائكته يصلون على النبي ياأيها الذين آمنوا صلوا عليه وسلموا تسليمًا} [56]</span></p><p style=""text-align:justify;"">اس آیت کے سننے پر  ’’حق یا نبی‘‘  کہنا روایات اور سلفِ صالحین سے ثابت نہیں ہے، لہٰذا یہ نہیں کہنا چاہیے۔</p><p style=""text-align:justify;"">البتہ اس  آیت میں دیے گئے حکم کی وجہ سے  ہر مسلمان پر زندگی میں ایک مرتبہ درود شریف پڑھنا فرض ہے،  پھر جس مجلس میں بھی آپ  صلی اللہ علیہ وسلم کا ذکرِ مبارک آئے اس مجلس میں کم از کم ایک مرتبہ درود پڑھنا لازم ہے، لیکن جب مذکورہ آیت  کی تلاوت کی جائے تو اس آیت کے سننے کی وجہ سے درود پڑھنا واجب نہ ہو گا،  نیز جو شخص خود تلاوت کر  رہا ہو اس پر بھی درود پڑھنا واجب نہیں،  البتہ تلاوت سے فارغ ہو کر  درود پڑھ  لے تو بہتر ہے۔</p><p style=""text-align:justify;"">واضح رہے کہ جمعہ کے خطبہ کے دوران جب خطیب مذکورہ آیت پڑھتا ہے، اس وقت سننے والے کے لیے حکم یہ ہے کہ وہ یہ آیت سن کر زبان سے درود نہ پڑھے، بلکہ صرف دل ہی دل میں درود پڑھ لے،  اسی طرح  اگر نماز میں مذکورہ آیت تلاوت کی گئی تو نہ پڑھنے والے پر درود واجب ہو گا اور نہ ہی سننے والے پر۔ بہرحال سنت طریقہ یہ ہے کہ نماز یا خطبہ جمعہ میں یہ آیت پڑھنے یا سننے کے بعد  زبان سے درود نہ پڑھا جائے۔</p><p style=""text-align:justify;""><span class=""ar_writing"">الدر المختار وحاشية ابن عابدين (رد المحتار) (1/ 518):<br/>
""ثم قال: فتكون فرضاً في العمر، وواجباً كلما ذكر على الصحيح"".</span></p><p style=""text-align:justify;""><span class=""ar_writing"">الدر المختار وحاشية ابن عابدين (رد المحتار) (2/ 158):<br/>
""وكذلك إذا ذكر النبي صلى الله عليه وسلم لا يجوز أن يصلوا عليه بالجهر بل بالقلب، وعليه الفتوى، رملي"".</span></p><p style=""text-align:justify;""><span class=""ar_writing"">الفتاوى الهندية (5/ 316):<br/>
""ولو قرأ القرآن فمر على اسم النبي صلى الله عليه وآله وأصحابه فقراءة القرآن على تأليفه ونظمه أفضل من الصلاة على النبي صلى الله عليه وآله وأصحابه في ذلك الوقت، فإن فرغ ففعل فهو أفضل، وإن لم يفعل فلا شيء عليه، كذا في الملتقط"".</span>فقط واللہ اعلم</p></p>",144104200681,banuri,"('علوم و فنون', 'uloom-funoon')","('دعائیں، اوراد اور وظائف', 'adeya-azkar')","('درود و سلام', 'durood-o-salam')"
03-03-2020,https://www.banuri.edu.pk/readquestion/ایلفی-لگے-رہنے-کی-صورت-میں-وضو-کا-حکم-144107200284/03-03-2020,ایلفی لگے رہنے کی صورت میں وضو کا حکم,اعضاءِ وضو میں سے اگرکسی عضوپر ایلفی لگ جائے اوراس کاہٹانا مشکل ہو  کیا اس پر پانی بہانےسےوضوہوجائے گا؟,"<p><p style=""text-align:justify;"">اگر اعضائے وضو میں سے کسی عضو پر ایلفی  لگی رہ جائے تو چوں کہ اس صورت میں جلد  تک پانی نہیں پہنچ پاتا؛ اس لیے ایلفی لگی رہنے کی صورت میں  پانی بہادینے سے وضو نہیں ہوگا ۔ وضو سے قبل اس کو اتارنا لازم ہے ۔  البتہ اگرجلد پر  ایلفی اس حد تک لگی ہو کہ پوری کوشش کے بعد بھی مکمل طور پر نہ چھوٹے، اور زیادہ کوشش کے نتیجے میں کھال اترنے یا زخم بننے کا اندیشہ ہو تو جس قدر ہٹ سکے اس کا چھڑانا ضروری ہوگا۔ (آپ کے مسائل اور ان کا حل 3/96)فقط واللہ اعلم</p></p>",144107200284,banuri,"('طہارت', 'taharat')","('وضو', 'wuzu')","('وضو،فرائض،سنن،آداب اور وضو توڑنے والی اشیاء', 'wuzo-faraidh-sunan-aadab-or-wuzo-tornay-wali-ashya')"
03-03-2020,https://www.banuri.edu.pk/readquestion/پہلی-بیوی-کے-دباو-میں-طلاق-دینا-144107200278/03-03-2020,پہلی بیوی کے دباؤ میں طلاق دینا,"6 دسمبر 2019 کو میرے شوہر نے مجھے میسنجر پر ایک بار کہا کہ ""میں نے تم کو طلاق دی"" دو دن بعد مولوی صاحب سے مشورہ لیا تو انہوں نے کہا کہ ایک طلاق واقع ہوگئی ہے، رجوع کرلیں تو انہوں نے رجوع کرلیا۔ پھر 4 جنوری 2020 کو میرے شوہر نے اپنی پہلی بیوی کے دباؤ  میں آکر مجھے لکھا اور وائس میسج کیا کہ میں عدنان شاہد آفریدی سمار کو طلاق دیتا ہوں، تین بار لکھا۔ میرے شوہر کا کہنا ہے کہ میں نے پہلی بیوی کے دباؤ  میں آکر دی ہے، میری نیت نہیں تھی۔ پہلی بیوی صبا زہر لے آئی تھی کہ خود بھی کھا لوں گی اور دونوں بیٹیوں کو بھی کھلا دےگی۔ صبا پہلے بھی خودکشی کرنے کی کوشش کر چکی ہے۔ پہلی بیوی کے دباؤ پر طلاق کے کاغذات بھی بنوائے، لیکن اس میں گواہ نہیں تھا۔ میرے شوہر عدنان نے ایک اور کاغذ بھجوایا جس میں ان کا بیان تھا کہ پہلی بیوی کے دباؤ  میں کاغذات بنوائے ہیں، میری طلاق کی نیت نہیں تھی۔","<p><p style=""text-align:justify;"">واضح رہے کہ بغیر گواہوں کے طلاق کے کاغذات پر دستخط کردینے سے اور اسی طرح کسی کے دباؤ  میں آکر طلاق کے الفاظ کہہ دینے سے طلاق واقع ہوجاتی ہے؛  لہذا صورتِ مسئولہ میں 6 دسمبر 2019 کو طلاق دینے سے ایک طلاق واقع ہوگئی تھی، پھر دو دن بعد رجوع کرنے سے رجوع ثابت ہوگیا، اس کے بعد 4 جنوری 2020 کو دوبارہ لکھ کر تین مرتبہ طلاق دی اور وائس میسج بھی کیا اس سے مجموعی طور پر آپ پر تینوں طلاقیں واقع ہوچکی ہیں۔  </p><p style=""text-align:justify;"">فتاوی دار العلوم دیوبند میں ہے :</p><p style=""text-align:justify;"">’’اگر زید کو مجبور کرکے زبردستی اس سے لفظ طلاق کا کہلا لیا ہے اور اس نے مجبور ہوکر اپنی زوجہ کو طلاق دے دی ہے، تب تو اس کی زوجہ پر طلاق واقع ہوگئی ہے، اب کچھ نہیں ہوسکتا۔۔۔‘‘الخ (۹ / ۵۴، دار الاشاعت) فقط واللہ اعلم</p></p>",144107200278,banuri,"('طلاق', 'talaaq')","('وقوع طلاق وعدم وقوع طلاق', 'wuqoo-e-talaq-o-adme-wuqoo-e-talaq')","('طلاق - وقوع اور عدم وقوع', 'talaq-wuqo-or-adm-e-wuqo')"
03-03-2020,https://www.banuri.edu.pk/readquestion/جزاک-اللہ-خیرا-کے-جواب-میں-کیا-کہا-جائے-144107200296/03-03-2020,جزاک اللہ خیرا کے جواب میں کیا کہا جائے ؟,’’جزاك الله‘‘کے جواب میں کیا کہنا چاہیے؟,"<p><p style=""text-align:justify;""><span class=""ar_writing"">”جزاك الله خیرًا“ </span> ایک دعائیہ جملہ ہے، محسن اور منعم سے اظہارِ تشکر اور اس کے احسان کے اچھے بدلے  کی ادائیگی کے لیے اس دعا  کی ترغیب حدیث میں وارد ہوئی ہے،  حضرت اسامہ بن زید رضی اللہ تعالیٰ عنہ فرماتے ہیں کہ کہ رسول کریم ﷺ نے فرمایا:  جس شخص کے ساتھ کوئی احسان کیا جائے اور وہ احسان کرنے والے کے حق میں یہ دعا کرے  <span class=""ar_writing"">”جزاك الله خیرًا“</span> (یعنی اللہ تعالیٰ تجھے اس کا بہتربدلہ دے) تو اس نے اپنے محسن کی کامل تعریف کی ۔</p><p style=""text-align:justify;""><span class=""ar_writing"">""وعن أسامة بن زيد قال : قال رسول الله صلى الله عليه و سلم: ""من صنع إليه معروف فقال لفاعله: جزاك الله خيرا فقد أبلغ في الثناء"". رواه الترمذي"". </span>(مشکوۃ المصابیح)</p><p style=""text-align:justify;"">اور اس جملہ کا جواب دینا واجب نہیں ہے، البتہ دعا  پر ”آمین“ کہہ لیا جائے اور ساتھ میں دعا  دینے والے کو بھی  کوئی دعا  یا یہی دعا  دے  دی جائے تو  یہ زیادہ بہتر ہے، جیسے <span class=""ar_writing"">”آمین! وَإِیَّاکُمْ“</span> یا <span class=""ar_writing"">”آمین! بَارَكَ الله“</span> یا <span class=""ar_writing"">”آمین! فَجَزَاكَ الله خَیْرًا“</span> وغیرہ۔ فقط واللہ اعلم</p></p>",144107200296,banuri,"('علوم و فنون', 'uloom-funoon')","('دعائیں، اوراد اور وظائف', 'adeya-azkar')","('مسنون دعائیں', 'musnoon-duayen')"
03-03-2020,https://www.banuri.edu.pk/readquestion/سونا-خرید-کر-اگلے-دن-وصول-کرنا-144107200264/03-03-2020,سونا خرید کر اگلے دن وصول کرنا,سونا کی آج خرید کرنا اور وصول اگلے دن کرنا کیسا ہے؟,"<p><p style=""text-align:justify;"">سونے چاندی کی روپیہ پیسے کے بدلے  خرید وفروخت شرعاً ""بیعِ صرف""  کہلاتی ہے، اور بیعِ صرف کا حکم یہ ہے کہ اس میں دونوں طرف سے نقد ادائیگی ضروری ہے، اس لیےسونے چاندی کے معاملات میں لین دین،  نقد  اور ہاتھوں ہاتھ ہونا ضروری ہے، یعنی ایک ہی مجلس میں قیمت کی رقم دینا اور سونا  چاندی وصول کرنا  ضروری ہے اور کسی بھی جانب سے ادھار، ربوا (سود) کے دائرے میں آنے کی بنا پر ناجائز وحرام ہے، لہذاسونے  کی رقم ادا کرکے  اگلے روز وصول کرنا جائز نہیں، البتہ اگر خریداری کا معاملہ نہ کیا جائے، بلکہ سونا بنوانے کے لیے آرڈر دیا جائے اور جب وہ بن کر آجائے تو اس وقت اس کا سودا کرکے ہاتھ در ہاتھ معاملہ کرلیا جائےتو یہ جائز ہوگا۔</p><p style=""text-align:justify;""><span class=""ar_writing"">""(وَيُشْتَرَطُ) عَدَمُ التَّأْجِيلِ وَالْخِيَارِ وَ (التَّمَاثُلُ) - أَيْ التَّسَاوِي وَزْنًا (وَالتَّقَابُضُ) بِالْبَرَاجِمِ لَا بِالتَّخْلِيَةِ (قَبْلَ الِافْتِرَاقِ) وَهُوَ شَرْطُ بَقَائِهِ صَحِيحًا عَلَى الصَّحِيحِ (إنْ اتَّحَدَ جِنْسًا وَإِنْ) وَصْلِيَّةٌ (اخْتَلَفَا جَوْدَةً وَصِيَاغَةً) لِمَا مَرَّ فِي الرِّبَا (وَإِلَّا) بِأَنْ لَمْ يَتَجَانَسَا  (شُرِطَ التَّقَابُضُ) لِحُرْمَةِ النَّسَاءِ"" . [الدر مع الرد : ٥/ ٢٥٧-٢٥٩]</span> <span class=""ar_writing"">فقط والله أعلم</span></p></p>",144107200264,banuri,"('معاملات', 'muamlat')","('بیع / تجارت', 'bay-tijarat')","('نقدی کی بیع کا بیان', 'naqdi-ki-bay-ka-bayan')"
02-03-2020,https://www.banuri.edu.pk/readquestion/ٹوپی-یا-رومال-ہوتے-ہوئے-ننگے-سر-نماز-پڑھنا-144107200263/02-03-2020,ٹوپی یا رومال ہوتے ہوئے ننگے سر نماز پڑھنا,باجود اس کے کہ ٹوپی یارومال میسر ہو  ننگے سر نماز پڑھنا کیا جائز ہے؟,"<p><p style=""text-align:justify;"">کاہلی، سستی اور لاپرواہی کی بنا پر ٹوپی کے بغیر ننگے سر نماز پڑھنا مکروہ ہے،  تاہم نماز ادا ہوجائے گی۔ البتہ اگر کبھی ٹوپی پاس نہ ہو اور فوری طور پر کسی جگہ سے میسر بھی نہ ہو سکتی ہو تو اس صورت میں ننگے سر نماز پڑھنے کی وجہ سے کراہت نہیں ہوگی۔</p><p style=""text-align:justify;"">واضح رہے کہ نماز کے علاوہ بھی ننگے سر نہیں رہنا چاہیے، اس لیے اتنی غفلت و لاپرواہی کرنی ہی نہیں چاہیے کہ نماز سے باہر ننگے سر رہنا  نماز میں ننگے سر رہنے کا سبب بنے۔ </p><p style=""text-align:justify;""><span class=""ar_writing"">الدر المختار وحاشية ابن عابدين (رد المحتار)</span>(1/ 641):<br/><span class=""ar_writing"">""(وصلاته حاسراً) أي كاشفاً (رأسه للتكاسل) ولا بأس به للتذلل، وأما للإهانة بها فكفر .</span></p><p style=""text-align:justify;""><span class=""ar_writing"">(قوله: للتكاسل) أي لأجل الكسل، بأن استثقل تغطيته ولم يرها أمراً مهماً في الصلاة فتركها لذلك، وهذا معنى قولهم تهاوناً بالصلاة، وليس معناه الاستخفاف بها والاحتقار؛ لأنه كفر. شرح المنية. قال في الحلية: وأصل الكسل ترك العمل لعدم الإرادة، فلو لعدم القدرة فهو العجز"".</span> فقط واللہ اعلم</p></p>",144107200263,banuri,"('نماز', 'salat')","('مکروہاتِ نماز', 'makrohat-e-namaz')","('مکروہات نماز', 'makrohat-e-namaz')"
