issued_at,link,title,question,answer,fatwa_number,dar_ul_ifta,kitab,bab,fasal
24-12-2019,https://www.banuri.edu.pk/readquestion/ایزی-پیسہ-موبائل-اکاونٹ-میں-پیسہ-deposit-کرانے-پر-extra-charge-لینا-144104200896/24-12-2019,ایزی پیسہ موبائل اکاونٹ میں پیسہ deposit کرانے پر Extra charge لینا,ہم ایزی پیسہ موبائل اکاؤنٹ میں پیسہ deposit کرانے پر Extra charge کرتے ہیں جو کہ کمپنی کے طرف سے Allowed نہیں ہے،  لیکن انتہائی کم کمیشن ملنے کے وجہ سے دکان دار یہ کام کرتے ہیں، مسئلہ یہ ہے کہ اگر deposit کرانے والا بندہ کوئی سرکاری ملازم ہو یا پولیس یا رینجرز والا یا ویسے ہی کوئی پڑھا لکھا ہو تو دکان دار ان سے Extra Charges نہیں لیتے ہیں، اس ڈر سے وہ شکایت نہ کردیں، لیکن زیادہ تر اس کا شکار عام عوام یا ناسمجھ یا مجبور لوگ ہی ہوتےہیں؛ لہٰذا پوچھنا یہ ہے کہ ان حالات میں یہ Extra Charges لینا کہاں تک درست ہے؟  کیا یہ سود کے زمرے میں آتا ہے یا ظلم؟  قرآن وہ حدیث کے روشنی میں راہ نمائی فرمائیں!,"<p><p style=""text-align:justify;"">اگر آپ نے کمپنی سے یہ معاہدہ کر رکھا ہے کہ آپ مقررہ کمیشن کے علاوہ مزید کچھ نہیں لیں گے (جیساکہ عموماً کمپنی یہ معاہدہ کرتی ہے، اور سوال سے بھی ظاہر ہے) تو اس سے زائد وصول کرنا وعدے کی خلاف ورزی ہے جو کہ جائز نہیں۔اگر آپ کے لیے یہ کمیشن کم ہے تو معاہدہ ختم کردیں۔ البتہ بالفرض  ایسا کوئی معاہدہ نہ ہوتا  تو یہ باہمی رضامندی پر تھاکہ جس سے جتنا بھی کمیشن لیا جائے۔</p><p style=""text-align:justify;""><span class=""ar_writing"">""عن عبد الله بن عمرورضي الله عنهما عن النبي صلى الله عليه وسلم قال: «أربع من كن فيه كان منافقاً، أو كانت فيه خصلة من أَربعة كانت فيه خصلة من النفاق حتى يدعها: إذا حدث كذب، وإذا وعد أخلف، وإذا عاهد غدر، وإذا خاصم فجر»"".</span>فقط واللہ اعلم</p></p>",144104200896,banuri,"('معاملات', 'muamlat')","('بیع / تجارت', 'bay-tijarat')","('اجارہ اور کرایہ کے احکام', 'ijara-or-kiraya-k-ahkam')"
31-12-2019,https://www.banuri.edu.pk/readquestion/لقمہ-دینے-کا-شرعی-حکم-144105200111/31-12-2019,لقمہ دینے کا شرعی حکم,لقمہ دینے کا شرعی حکم کیا ہے؟,"<p><p style=""text-align:justify;"">مقتدی کے لیے امام کو لقمہ دینے (غلطی بتانے)  میں جلدی کرنا مکروہ ہے ، اسی طرح امام کے لیے مقتدی کی راہ نمائی اور لقمہ کا انتظار کرنا بھی مکروہ ہے، ایسی صورت میں امام کو چاہیے کہ وہ دوسری جگہ سے ضروری قراء ت کر لے، یا کوئی اور سورت پڑھ لے، یا اگر واجب قراء ت کی مقدار پڑھ لی ہو تو رکوع کرلے۔</p><p style=""text-align:justify;"">لیکن ضرورت پڑنے پر لقمہ دینا جائز ہے یعنی  اگر امام نماز کے دوران قراءت کرتے ہوئے کوئی آیت بھول جائے اور کوشش کے باوجود صحیح نہ کرسکے، مثلاً پڑھتے پڑھتے اٹک گیا یا پس وپیش میں پڑگیا تو مقتدی کے لیے  امام کو لقمہ دینا جائز ہے، لیکن صرف غلطی بتانا مقصود ہو،  اپنی قراء ت مقصود نہ ہو ؛ کیوں کہ امام کے پیچھے تلاوت کرنا مکروہِ تحریمی ہے۔ فقط واللہ اعلم</p></p>",144105200111,banuri,"('نماز', 'salat')","('نماز کی شرائط', 'namaz-ki-sharait')","('نماز اور اس کی شرائط و ارکان ، سنن و آداب', 'namaz-or-us-ki-sharait-o-arkaan-sunan-o-aadab')"
30-12-2019,https://www.banuri.edu.pk/readquestion/سوال-کے-جواب-میں-ا-زاد-بولنا-144105200081/30-12-2019,سوال کے جواب میں آزاد بولنا,کیا لفظ آزاد بولنے سے طلاق ہوجاتی ہے کہ بیوی پوچھے کہ میں یہ کام کروں اگر آپ کی اجازت ہو؟ تو شوہر جواب میں بولے کہ میری طرف سے آزاد ہو تم کرسکتی ہو کوئی مسئلہ نہیں۔,"<p><p style=""text-align:justify;"">صورتِ مسئولہ میں چوں کہ یہ قرینہ موجود ہے کہ شوہر نے بیوی کے سوال  ’’میں فلاں کام کرلوں‘‘  کے جواب میں کہا ہے کہ ’’ آپ فلاں کام کرنے میں آزاد ہو، کوئی مسئلہ نہیں‘‘, لہذا اس سے کوئی طلاق واقع نہیں ہوئی۔ فقط واللہ اعلم</p></p>",144105200081,banuri,"('طلاق', 'talaaq')","('وقوع طلاق وعدم وقوع طلاق', 'wuqoo-e-talaq-o-adme-wuqoo-e-talaq')","('طلاق - وقوع اور عدم وقوع', 'talaq-wuqo-or-adm-e-wuqo')"
01-12-2019,https://www.banuri.edu.pk/readquestion/رمضان-میں-لیکوریا-والی-عورت-صفائی-کرے-144104200096/01-12-2019,رمضان میں لیکوریا والی عورت صفائی کرے؟,میری بیوی کو لیکوریا کا مسئلہ رہتا ہے، وہ رمضان میں مجھے کہہ رہی تھی کہ جب تک میں اپنے فرج کو اندر سے انگلی کے ذریعے صحیح صفائی نہ کردوں تو وضو کے بعد دوبارہ رطوبت باہر نکلتی ہے اور وضو ٹوٹ جاتا ہے، مسئلہ یہ دریافت کرناہے  کہ میں نے سنا ہےکہ بار بار انگلی داخل اور خروج سے روزہ ٹوٹتا ہے، رمضان میں میری بیوی کیا کرے؟اگر انگلی سے اس طرح صفائی کرےجس سے روزہ ٹوٹتا ہے تو روزہ ٹوٹنے کا ڈر اور اگر نہ کرے تو وضو ٹوٹنے کا ڈراور بغیر وضو نماز نہیں ہوتی، تو ایسی حالت میں کیا کیا جائے؟,"<p><p style=""margin-left:0;margin-right:0;text-align:justify;"">صورت مسئولہ میں اگرروزہ کی حالت میں خاتون  کی شرم گاہ میں خشک انگلی داخل کی جائے تو اس سے روزہ نہیں ٹوٹتا اور اگر پانی یا تیل وغیرہ سے تر انگلی شرم گاہ میں داخل کی جائے (یا شرم گاہ میں خشک انگلی داخل کرے اور وہ تر ہوجائے پھر اسے نکال کر دوبارہ داخل کرے)  تو روزہ ٹوٹ جائے گا، لہذا روزہ کی حالت میں شرم گاہ کی صفائی نہ جائے ۔</p><p style=""margin-left:0;margin-right:0;text-align:justify;"">اگر لیکوریا کی رطوبت کسی ایک نماز کے مکمل وقت میں رہی اور اتنی مہلت بھی نہیں ملی کہ فرض نماز وضو کے ساتھ اس کے بغیر پڑھ سکے  تو یہ خاتون معذور ہے، اس کے لیے حکم یہ ہے کہ وہ  وضو کرکے اس وقت میں نماز پڑھ لے، نماز ادا ہوجائے گی،  لیکوریا کی رطوبت نکلنے کے باوجود اس کا وضو نہیں ٹوٹے گا، جب نماز کا وقت ختم ہوجائے گا تو وضو ٹوٹ جائےگا، اگلی نماز کے وقت کے لیے الگ وضو کرنا ہوگا۔ اور اگر لیکوریا کچھ دیر تک جاری رہتاہے، پھر رک جاتاہے، یعنی نماز کا مکمل وقت اس حالت میں نہیں گزرتا، بلکہ وقت کے اندر پاکی حاصل کرکے باوضو ہوکر وقتی فرض نماز ادا کی جاسکتی ہے تو یہ عورت شرعی معذور نہیں ہوگی، ایسی صورت میں بجائے انگلی اندر داخل کرنے کے وہ پیڈ وغیرہ کا استعمال کرے، چلنے پھرنے سے تری خارج ہوجائے گی، پھر کچھ دیر بعد جب تری ختم ہوجائے تو پاکی اور وضو کے بعد نماز ادا کرے۔</p><p style=""margin-left:0;margin-right:0;text-align:justify;""><span class=""ar_writing"">""(وصاحب عذر من به سلس) بول لا يمكنه إمساكه (أو استطلاق بطن أو انفلات ريح أو استحاضة) أو بعينه رمد أو عمش أو غرب، وكذا كل ما يخرج بوجع ولو من أذن وثدي وسرة (إن استوعب عذره تمام وقت صلاة مفروضة) بأن لا يجد في جميع وقتها زمنا يتوضأ ويصلي فيه خاليا عن الحدث (ولو حكما) لأن الانقطاع اليسير ملحق بالعدم (وهذا شرط) العذر (في حق الابتداء، وفي) حق (البقاء كفى وجوده في جزء من الوقت) ولو مرة (وفي) حق الزوال يشترط (استيعاب الانقطاع) تمام الوقت (حقيقة) لأنه الانقطاع الكامل، <strong>(وحكمه الوضوء) لا غسل ثوبه ونحوه (لكل فرض) اللام للوقت كما في {لدلوك الشمس} (ثم يصلي) به (فيه فرضا ونفلا) فدخل الواجب بالأولى (فإذا خرج الوقت بطل) أي: ظهر حدثه السابق"". </strong></span><span class=""ar_writing""> (رد المحتار، کتاب الطهارة، باب الحيض 1 / 305 ط:سعيد)</span>فقط و اللہ اعلم</p></p>",144104200096,banuri,"('طہارت', 'taharat')","('شرعی معذورین کے احکام', 'sharee-mazoreen-k-ahkam')","('معذورین کے احکام', 'ma-zoron-k-ahkam')"
20-11-2019,https://www.banuri.edu.pk/readquestion/دو-سال-میں-قسطوں-کی-صورت-میں-ادائیگی-کی-شرط-پر-مارکیٹ-ریٹ-سے-زیادہ-قیمت-پر-گاڑی-خریدنا-جائز-ہے-یا-نہیں-144103200502/20-11-2019,دو سال میں قسطوں کی صورت میں ادائیگی کی شرط پر مارکیٹ ریٹ سے زیادہ قیمت پر گاڑی خریدنا جائز ہے یا نہیں؟,بندہ کمپنی سے ایک گاڑی نقد پر خریدتا ہے 78000 میں۔ اگر یہی گاڑی ماہانہ اقساط پر لیتاہےتو بندہ ایک سال قسطیں ادا کرےگا اور ایڈوانس میں صرف15600 دیناہوگا باقی ماہانہ 5200 اداکرنا ہوگا۔ اگر اس سے بھی آسان قسطوں پر لینا ہو تو پھر اس حالت میں بندہ کو وہی 15600 ایڈوانس دیناہوگا اور پھر ماہانہ 2700 دیناہوگا تو اس حالت میں 1 سال کی جگہ 2 سال کا دورانیہ ہوا جو آسان ہے، لیکن اس حالت میں پھر گاڑی کی کل قیمت 78000 نہیں ہوگی، بلکہ 3000 زیادہ دیناہوگا یعنی 81000۔ کیا ایسی ترتیب جائز ہے جو  2 سال کا وقت بھی دیتاہے اور ماہانہ قسط بھی کم ہوتی ہے، لیکن گاڑی کی کل قیمت میں اضافہ صرف 3000 کاہوتاہےجو ادا کرنا آسان ہے۔کیا یہ تو سود نہیں یا حرام تو نہیں؟,"<p><p style=""text-align:justify;"">قسطوں میں ادائیگی کی صورت متعین کرکے گاڑی خریدنا جائز ہے، چاہے وہ عام قیمت سے کچھ مہنگی ہی کیوں نہ پڑے، یہ اضافہ سود یا حرام نہیں ہے، البتہ یہ ضروری ہے کہ سودا کرتے وقت گاڑی کی حتمی قیمت اور ادائیگی کی مدت طے کرلی جائے، اور مقررہ مدت سے پہلے ادائیگی کی صورت میں قیمت میں کمی کی شرط یا ادائیگی میں مقررہ مدت سے زیادہ تاخیر کرنے کی صورت میں قیمت میں کسی قسم کے کسی بھی نام سے اضافہ کی شرط نہ رکھی جائے۔ فقط واللہ اعلم</p></p>",144103200502,banuri,"('معاملات', 'muamlat')","('بیع / تجارت', 'bay-tijarat')","('نقد اور ادھار خرید و فروخت کے احکام', 'naqd-o-udhar-khareed-o-farokht-k-ahkam')"
21-11-2019,https://www.banuri.edu.pk/readquestion/کاروبار-میں-ترقی-کا-وظیفہ-144103200546/21-11-2019,کاروبار میں ترقی کا وظیفہ,میرے روزگار کے مسائل چل رہے ہیں، جو بھی کاروبار یا ملازمت کروں وہ زیادہ عرصے نہیں چلتا، ابھی بھی میں ایک کاروبار کر رہا ہوں اس میں بھی کوئی واضح صورتِ حال نظر نہیں آرہی، برائے مہربانی میرے مسئلے کا حل بتائیں۔,"<p><p style=""margin-left:0;margin-right:0;text-align:justify;""><span style=""background-color:#fff;""><span style=""background-color:#fff;""><span style=""color:#323232;"">رزق کے معاملہ کا تعلق اللہ تعالی کی تقسیم کے ساتھ ہے، وہ جسے چاہے جب چاہے، جتنا چاہے اور جیسے چاہے رزق دیتا ہے، اس کے فیصلے کے سامنے کوئی منصوبہ نہیں چلتا، لہذا ایک مسلمان کو اس بارے میں اللہ تعالی کے فیصلوں پر ہمیشہ راضی رہنا چاہیے، آپ اول تو پانچوں نمازیں مسجد میں باجماعت ادائیگی کا اہتمام کریں، اس لیے نماز کے اہتمام کے ساتھ وسعتِ رزق کا وعدہ ہے،  نیز درج ذیل اعمال کا اہتمام کیجیے:</span></span></span></p><p style=""margin-left:0;margin-right:0;text-align:justify;""><span style=""background-color:#fff;""><span style=""background-color:#fff;""><span style=""color:#323232;"">1-  ہر نماز کے بعد کم از کم تین بار یہ دعا پڑھیں</span></span> <span style=""background-color:#fff;""><span style=""color:#323232;"">: <span class=""ar_writing"">""</span></span></span><span class=""ar_writing""><span style=""background-color:#fff;""><span style=""color:#323232;"">اَللّٰهُمَّ اکْفِنِيْ بِحَلاَلِكَ عَنْ حَرَامِكَ وَأَغْنِنِيْ بِفَضْلِكَ عَمَّنْ سِوَاكَ"".</span></span></span></span></p><p style=""margin-left:0;margin-right:0;text-align:justify;""><span style=""background-color:#fff;""><span style=""background-color:#fff;""><span style=""color:#323232;""><span style=""background-color:#fff;""><span style=""color:#323232;"">2- ’’منزل‘‘ (حضرت شیخ الحدیث مولانا محمد زکریا کاندہلوی رحمہ اللہ کا مرتب کردہ قرآنی آیات کا مجموعہ)  پڑھتے رہیں۔</span></span></span></span></span></p><p style=""margin-left:0;margin-right:0;text-align:justify;""><span style=""background-color:#fff;""><span style=""background-color:#fff;""><span style=""color:#323232;""><span style=""background-color:#fff;""><span style=""color:#323232;"">3- صبح شام سورہ اخلاص اور معوذتین (سورہ فلق اور سورہ ناس) اور کثرت سے استغفار کا معمول بنائیں۔</span></span></span></span></span></p><p style=""margin-left:0;margin-right:0;text-align:justify;""><span style=""background-color:#fff;""><span style=""background-color:#fff;""><span style=""color:#323232;""><span style=""background-color:#fff;""><span style=""color:#323232;"">4- حسبِ حیثیت صدقہ کا معمول بنالیجیے۔</span></span></span></span></span></p><p style=""margin-left:0;margin-right:0;text-align:justify;""><span style=""background-color:#fff;""><span style=""background-color:#fff;""><span style=""color:#323232;""><span style=""background-color:#fff;""><span style=""color:#323232;"">اللہ تعالی پر یقین رکھیں کہ ان شاء اللہ آپ کے حالات درست ہوجائیں گے اور کاروبار بھی سنبھل جائے گا. فقط واللہ اعلم</span></span></span></span></span></p></p>",144103200546,banuri,"('علوم و فنون', 'uloom-funoon')","('دعائیں، اوراد اور وظائف', 'adeya-azkar')","('اوراد ووظائف', 'aurad-o-wzaif')"
05-12-2019,https://www.banuri.edu.pk/readquestion/رزق-میں-برکت-اور-قرض-سے-نجات-کے-لیے-وظیفہ-144104200256/05-12-2019,رزق میں برکت اور قرض سے نجات کے لیے وظیفہ,میں 6 یا 7 سال سے اپنا کاروبار کرہاہوں پرنٹنگ کا، کچھ سالوں سے میرے اوپر قرضہ چڑھا  ہوا ہے  جو کہ کچھ میری کوتاہی تھی اور کچھ چیزوں میں نقصان ہوا۔کافی روحانی عاملوں سے مل چکا ہوں اور کافی عمل بھی کیے  ہیں ۔کاروبار چل رہا ہے، لیکن آمدن اتنی ہی ہوتی ہے  جس سے میرے گھر کی ضروریات پوری ہوتی ہیں، لیکن قرض وہیں کے وہیں ہیں، کم ہونے کا نام نہیں لے رہے، کچھ وقت سے کافی تنگ کررہے ہیں قرض دار۔کوئی راہ نمائی فرمادیجیے!,"<p><p style=""text-align:justify;""> اللہ تعالیٰ کی ذات سے مایوس نہ ہوں،  ہر تکلیف و آزمائش اور سہولت وخوشی اللہ تعالیٰ کی طرف سے ہے،  اس لیے پریشانیوں اورمصائب کا حل  اللہ تعالیٰ کی طرف متوجہ ہونا، اللہ تعالیٰ کی طرف توبہ و استغفار کے ذریعے بھی متوجہ ہوں اور اپنے مسائل کا حل اللہ تعالیٰ کے حوالے کردیجیے،  اور اللہ تعالیٰ کو اپنے مسائل کے حل کا وکیل بنادیجیے، اللہ تعالیٰ کبھی آپ کا سہارا نہیں چھوڑیں گے۔ عاملوں کے پاس جانے کی ضرورت نہیں ہے، اس سے اللہ تعالیٰ کی ذات پر ایمان اور یقین و توکل میں بھی کمی آتی ہے، اس کےبجائے درج ذیل ہدایات پر عمل کیجیے:</p><p style=""text-align:justify;"">   اللہ تعالیٰ سے تعلق قائم کرنے اور اسے مضبوط کرنے کی ہر انسان کو ضرورت ہے، اگر نمازوں کی پابندی نہیں ہے تو پنج وقتہ نماز باجماعت کا اہتمام کیجیے،   نمازوں کے بعد دعائیں بھی کیجیے اور استغفارکی کثرت کریں،  نیز درج ذیل اعمال کا اہتمام کریں:</p><p style=""text-align:justify;"">1۔   سورہ واقعہ اور سورہ طارق فجر اور مغرب کے بعد ایک ایک مرتبہ پڑھنےکا اہتمام کریں۔</p><p style=""text-align:justify;"">2۔   فجر  کی نماز کے بعد ستر مرتبہ پابندی سے یہ آیت پڑھا کریں، ان شاءاللہ رزق کی تنگی سے محفوظ رہیں  گے:</p><p style=""text-align:justify;""><span class=""ar_writing""> اَللَّهُ لَطِيفٌ بِعِبَادِهِ يَرْزُقُ مَن يَشَاء وَهُوَ الْقَوِيُّ العَزِيزُ ( الشوری: ۱۹)</span></p><p style=""text-align:justify;"">3۔۔   ہر نماز کے بعد سات مرتبہ اور چلتے پھرتے درج ذیل دعا کا اہتمام کریں:</p><p style=""text-align:justify;""><span class=""ar_writing"">""اَللّٰهُمَّ اكْفِنِيْ بِحَلاَلِكَ عَنْ حَرَامِكَ وَ أَغْنِنِيْ بِفَضْلِكَ عَنْ مَنْ سِوَاكَ"".</span></p><p style=""text-align:justify;"">نیز  حسبِ توفیق صدقہ نکالنے کا معمول بنالیجیے، اگر پہلے سے معمول ہے تو اسے جاری رکھیے، اور بہتر یہ ہے کہ صدقہ یا تو دینی طلبہ پر خرچ کیجیے، یا اپنی ضرورت مند بہنوں پر,ان شاء اللہ اللہ رب العزت آپ کے مسائل حل فرمادیں گے۔<strong>  </strong>فقط واللہ اعلم</p></p>",144104200256,banuri,"('علوم و فنون', 'uloom-funoon')","('دعائیں، اوراد اور وظائف', 'adeya-azkar')","('اوراد ووظائف', 'aurad-o-wzaif')"
11-12-2019,https://www.banuri.edu.pk/readquestion/طلاق-بائن-كے-بعد-دوباره-نكاح-ميں-بهائي-راضي-نه-هو-تو-لڑكي-اپنا-نكاح-خود-كراسكتي-هے-144104200460/11-12-2019,طلاقِ بائن كے بعد تجدیدِ نكاح میں بھائی راضی نہ ہو تو لڑکی اپنا نکاح خود کراسکتی ہے,مجھے فتویٰ نکلوانے کے بعد معلوم ہوا کہ میرے اور میری بیوی کے در میان 2 طلاق بائن واجب ہوچکی ہیں، لیکن اب میں اور میری بیوی دوبارہ نکاح کرنا چاہتے ہیں، مگر میری بیوی کے گھر والے نکاح کرنے پر راضی نہیں ہیں، لیکن میرے گھر والے اور میں اور میری بیوی نکاح کرنے پر راضی ہیں تو  کیا میری بیوی اپنے گھر والوں کی اجازت کے بغیر مجھ سے نکاح کرسکتی ہے یا نہیں؟ میری بیوی کی والدہ تیار ہیں نکاح کے لیے تمام بھائی بھی تیار ہیں،  بس ایک بھائی راضی نہیں ہے۔,"<p><p style=""text-align:justify;"">اگر عورت دوطلاق کے بعد دوبارہ اپنے سابقہ شوہر سے نکاح کرنا چاہتی ہے تو بھائی کو چاہیے کہ اس میں بلا کسی معقول  عذر کے رکاوٹ نہ ڈالے، اگر بھائی رضامند نہ ہو اور عورت اپنا نکاح سابقہ شوہر سے کرالیتی ہے تو نکاح منعقد ہوجائے گا،بحیثیت میاں بیوی ساتھ رہ سکتے ہیں اورآئندہ کے لیے شوہر کو صرف ایک طلاق کا حق ہوگا ۔</p><p style=""text-align:justify;"">قرآنِ مجید میں ہے:</p><p style=""text-align:justify;""><span class=""ar_writing"">{بُعُولَتُهُنَّ أَحَقُّ بِرَدِّهِنَّ فِي ذَٰلِكَ إِنْ أَرَادُوا إِصْلَاحًا}[البقرة: 228]</span></p><p style=""text-align:justify;"">ترجمہ: اور ان (مطلقہ عورتوں) کے شوہر انہیں واپس (اپنے نکاح میں) لوٹانے کے زیادہ حق دار ہیں اگر وہ اصلاح چاہیں۔</p><p style=""text-align:justify;"">دوسری جگہ ہے:</p><p style=""text-align:justify;""><span class=""ar_writing"">{وَإِذَا طَلَّقْتُمُ النِّسَاءَ فَبَلَغْنَ أَجَلَهُنَّ فَلَا تَعْضُلُوهُنَّ أَن يَنكِحْنَ أَزْوَاجَهُنَّ إِذَا تَرَاضَوْا بَيْنَهُم بِالْمَعْرُوفِ ۗ ذَٰلِكَ يُوعَظُ بِهِ مَن كَانَ مِنكُمْ يُؤْمِنُ بِاللَّهِ وَالْيَوْمِ الْآخِرِ ۗ ذَٰلِكُمْ أَزْكَىٰ لَكُمْ وَأَطْهَرُ ۗ وَاللَّهُ يَعْلَمُ وَأَنتُمْ لَا تَعْلَمُونَ} [البقرة: 232]</span></p><p style=""text-align:justify;"">ترجمہ: اور جب تم عورتوں کو طلاق دو، اور وہ اپنی عدت پوری کرلیں تو انہیں نہ روکو اپنے شوہروں سے نکاح کرنے سے جب کہ وہ آپس میں راضی ہوں دستور کے موافق، اس بات کی نصیحت کی جاتی تم میں سے ہر اس شخص کو جو اللہ تعالیٰ اور آخرت کے دن پر ایمان رکھتاہو، یہ تمہارے لیے (معاشرتی اور انفرادی زندگی میں ظاہری اور باطنی طور پر) زیادہ پاکی اور طہارت کا ذریعہ ہے، اور اللہ تعالیٰ جانتے ہیں تم نہیں جانتے۔</p><p style=""text-align:justify;"">مذکورہ آیاتِ مبارکہ اسی طرح کے موقع پر نازل ہوئیں جب ایک صحابی رضی اللہ عنہ نے اپنی اہلیہ کو طلاق دے دی، اور بعد میں ندامت ہوئی تو شوہر اور مطلقہ دونوں نکاح پر راضی تھے، لیکن اہلیہ کے بھائی نے انکار کردیا، اس موقع پر یہ آیات نازل ہوئیں اور انہیں نصیحت کی گئی، چناں چہ انہوں نے فوراً نصیحت قبول کرتے ہوئے اپنی ہم شیرہ کا نکاح ان کے سابقہ شوہر سے کروادیا۔</p><p style=""text-align:justify;""><span class=""ar_writing"">"" ولوقالت المبانة رددت نفسي اليك فقال الزوج قبلت بحضرة الشاهدين يكون نكاحا كذا في محيط السرخسي"". (271ْ1ط: رشيديه)</span> فقط واللہ اعلم</p></p>",144104200460,banuri,"('طلاق', 'talaaq')","('وقوع طلاق وعدم وقوع طلاق', 'wuqoo-e-talaq-o-adme-wuqoo-e-talaq')","('طلاق صریح اور کنائی', 'talaq-e-sarih-or-kinai')"
