issued_at,link,title,question,answer,fatwa_number,dar_ul_ifta,kitab,bab,fasal
10-02-2020,https://www.banuri.edu.pk/readquestion/فاسق-اور-فاجر-کی-تعریف-144106200601/10-02-2020,فاسق اور فاجر کی تعریف,فاسق اور فاجر میں کیا فرق ہے؟,"<p><p style=""text-align:justify;"">""فاسق""  اس شخص کو کہتے ہیں جو ایمان  لانے کے بعد اللہ تعالیٰ کی نافرمانیوں میں ملوث رہے، شریعت کے بعض یا تمام احکامات کو پس پشت ڈال کر عملی کوتاہی کرے، اور  جو کبائر (بڑے گناہوں) کا مرتکب ہو یا صغائر پر اصرار کرتا ہو۔</p><p style=""text-align:justify;"">اور فاجر سے مراد یہ ہے کہ وہ خلافِ شرع کاموں میں مبتلا ہوکر توبہ کا ارادہ کرتے ہوئے بھی توبہ نہ کرے۔ </p><p style=""text-align:justify;"">انجام کے اعتبار سے فاسق وفاجر  معنی میں قریب قریب ہیں۔</p><p style=""text-align:justify;""><span class=""ar_writing"">المفردات في غريب القرآن (1 / 626):<br/>
""وقوله: ﴿</span><span class=""ar_writing"">بَلْ يُرِيدُ الْإِنْسانُ لِيَفْجُرَ أَمامَهُ﴾</span><span class=""ar_writing"">[القيامة/ 5]، أي: يريد الحياة ليتعاطى الفجور فيها. وقيل: معناه ليذنب فيها. وقيل: معناه يذنب ويقول غدا أتوب، ثم لايفعل فيكون ذلك فجورًا لبذله عهدا لايفي به. وسمّي الكاذب فاجرًا، لكون الكذب بعض الفجور"".</span></p><p style=""text-align:justify;""><span class=""ar_writing"">حاشية الطحطاوي على مراقي الفلاح  (1 / 303):<br/>
""والفسق لغةً: خروج عن الاستقامة وهو معنى قولهم: خروج الشيء عن الشيء على وجه الفساد. وشرعًا: خروج عن طاعة الله تعالى بارتكاب كبيرة. قال القهستاني أي أو إصرار على صغيرة"". </span> فقط واللہ اعلم</p></p>",144106200601,banuri,"('متفرق کتب', 'mutafarriq-kutub')","('متفرق ابواب', 'mutafarriq-abwab')","('متفرق فصول', 'mutafarriq-fusool')"
23-01-2020,https://www.banuri.edu.pk/readquestion/ایزی-پیسہ-اکاؤنٹ-144105201015/23-01-2020,ایزی پیسہ اکاؤنٹ,کیا ایزی پیسہ اکاؤنٹ کھولنا جائز ہے یا ناجائز؟,"<p><p style=""margin-left:0;margin-right:0;text-align:justify;""><span style=""color:#000;"">جواب سے پہلے بطورِ تمہید یہ بات واضح رہے کہ ہماری معلومات کے مطابق ""ایزی پیسہ موبائل اکاؤنٹ"" بینک اکاؤنٹ کی طرح ایک اکاؤنٹ ہے، جس کے اکاؤنٹ ہولڈر کو لمپنی کی طرف سے اپنے اکاؤنٹ کی بنیاد پر مختلف سہولیات اور خدمات کے حصول کا استحقاق ہوتا ہے، جو درج ذیل ہے:</span></p><p style=""margin-left:0;margin-right:0;text-align:justify;""><span style=""color:#000;"">1۔ بیمہ (انشورنش) اسی کا نام ""خوش حال بیمہ اکاؤنٹ"" ہے، (اس کے لیے عام حالات میں کوئی رقم متعین نہیں ہے، البتہ موت کے وقت اکاؤنٹ میں دو ہزار روپے موجود ہونا ضروری ہیں، نیز انشورنس کی یہ سہولت عمومی طور پر آدم جی انشورنس کمپنی کے ذریعے حاصل کی جائے گی)۔</span></p><p style=""margin-left:0;margin-right:0;text-align:justify;""><span style=""color:#000;"">2۔ بیمہ پالیسی لینے کی صورت میں اکاؤنٹ میں دو ہزار روپے برقرار رکھنے کی شرط پر متعین منٹ، متعین میسجز، اور انٹر نیٹ کی متعین مقدار مفت فراہم کی جائے گی۔</span></p><p style=""margin-left:0;margin-right:0;text-align:justify;""><span style=""color:#000;"">اس تمہید کے بعد صورتِ مسئولہ کا جواب یہ ہے کہ درج بالا پہلی صورت کے مطابق چوں کہ بیمہ پایا جارہا ہے، جو کہ ظاہر ہے سود، قمار اور غرر پر مشتمل ہونے کی وجہ سے ناجائز ہے۔</span></p><p style=""margin-left:0;margin-right:0;text-align:justify;""><span style=""color:#000;"">اور درج بالا دوسری صورت میں سہولت سے فائدہ حاصل کرنا بھی شرعاً جائز نہیں، کیوں کہ اکاؤنٹ میں جمع کی جانے والی مخصوص رقم قرض کے حکم میں ہے، گویا بطور قرض رقم جمع کروانے پر کمپنی اپنے تحت اکاؤنٹ کھولتی ہے، اور اس رقم پر موبائل کمپنی اکاؤنٹ میں دی جانے والی مخصوص رقم ظاہر کرتی ہے، جو کہ قرض کی رسید کی مانند ہے، لہٰذ امخصوص رقم اکاؤنٹ میں رکھے رہنے کی شرط کے ساتھ کمپنی کا اکاؤنٹ ہولڈر کو سہولیات مفت مہیا کرنا قرض پر مشروط نفع ہے، اور قرض پر نفع شریعت اسلامیہ کی نگاہ میں سود اور ناجائز ہے۔ لہٰذا ایزی پیسہ اکاؤنٹ سے مکمل اجتناب لازم ہے۔</span></p><p style=""margin-left:0;margin-right:0;text-align:justify;""><span style=""color:#000;"">ارشاد باری تعالیٰ ہے:</span></p><p style=""margin-left:0;margin-right:0;text-align:justify;""><span class=""ar_writing""><span style=""color:#000;"">﴿وأحل الله البيع وحرم الربوا﴾ [البقرة: 275]</span></span></p><p style=""margin-left:0;margin-right:0;text-align:justify;""><span style=""color:#000;"">فتاویٰ شامی میں ہے:</span></p><p style=""margin-left:0;margin-right:0;text-align:justify;""><span class=""ar_writing""><span style=""color:#000;"">""وفي الأشباه: كل قرض جر نفعًا فهو حرام"". (ج5/ص166 ط: سعيد) (اعلاء السنن: 13/6446)</span></span></p><p style=""margin-left:0;margin-right:0;text-align:justify;""><span style=""color:#000;"">البحر الرائق میں ہے:</span></p><p style=""margin-left:0;margin-right:0;text-align:justify;""><span class=""ar_writing""><span style=""color:#000;"">""ولايجوز قرض جر نفعًا"". (6/122) فقط </span></span><span class=""ar_writing""><span style=""color:#000;"">والله أعلم</span></span></p></p>",144105201015,banuri,"('معاملات', 'muamlat')","('سود / بینکاری / انشورنس / شیئرز', 'sood-bankari-insurance-shares')","('متفرقات سود', 'mutafarriqat-e-sood')"
29-01-2020,https://www.banuri.edu.pk/readquestion/تجارت-میں-ایک-لاکھ-لگا-کر-ایک-لاکھ-صدقہ-کردیے-144106200117/29-01-2020,حرام تجارت میں ایک لاکھ لگا کر ایک لاکھ صدقہ کردیے,ہم نے ایک لاکھ روپے کسی حرام تجارت میں لگایا، پھر اس سے ایک لاکھ روپے کمایا اور اسے صدقہ کردیا تو کیا وہ تجارت درست ہے اور اس کی کمائی درست ہے؟,"<p><p style=""text-align:justify;"">حرام تجارت میں جب تک حرمت کی وجہ ختم نہ کی جائے، اس کی آمدنی حلال نہیں ہوگی؛ لہذا اپنی تجارت کی تفصیل کسی عالمِ دین کے سامنے رکھ کر اس سے راہ نمائی لیں۔  نیز اس سے جو نفع ہوا، اس سب کو بغیر ثواب کی نیت کے صدقہ کرنا واجب ہے، اس کا استعمال جائز نہیں ہے۔ فقط واللہ اعلم</p></p>",144106200117,banuri,"('معاملات', 'muamlat')","('بیع / تجارت', 'bay-tijarat')","('بیع صحیح ، فاسد اور باطل', 'bay-sahih-fasid-or-batil')"
09-02-2020,https://www.banuri.edu.pk/readquestion/طلاق-معلق-کا-وقوع-شرط-کے-پائے-جانے-کے-ساتھ-ہوجاتا-ہے-144106200546/09-02-2020,طلاق معلق کا وقوع شرط کے پائے جانے کے ساتھ ہوجاتا ہے,ایک شخص نے طلاق کو شرط کے ساتھ معلق کیا، پھر وہ شرط پائی گئی، تو اب کیا حکم ہے؟ ملحوظ رہے کہ صریح الفاظ کے ساتھ معلق کیا تھا۔,"<p><p style=""text-align:justify;"">صورتِ مسئولہ میں شرط پائی جانے کے ساتھ ہی معلق طلاق واقع ہوجائے گی، اور جتنی طلاقیں معلق کی ہوں اتنی ہی واقع ہوں گی،  پس اگر ایک معلق کی تھی تو ایک، دو کی تھیں تو دو، اور اگر تین کی تھیں تو تینوں واقع ہوجائیں گی، اور اس صورت میں بیوی حرمتِ مغلظہ کے ساتھ اپنے شوہر پر حرام ہو جائے گی، نہ رجوع  جائز ہو گا اور نہ ہی تجدیدِ نکاح کی اجازت ہوگی۔</p><p style=""text-align:justify;"">فتاوی ہندیہ میں ہے:</p><p style=""text-align:justify;""><span class=""ar_writing"">""وإذا أضافه الی الشرط وقع عقيب الشرط اتفاقاً "". ( ١/٤٢٠ ط : رشیدیه)</span>فقط واللہ اعلم</p></p>",144106200546,banuri,"('طلاق', 'talaaq')","('تعلیقِ طلاق (مشروط طلاق دینا)', 'talaq-ki-taleeq')","('طلاق کو معلق کرنا', 'talaq-ko-muallaq-karna')"
09-02-2020,https://www.banuri.edu.pk/readquestion/ادارے-کے-قوانین-کی-شرعی-حیثیت-144106200539/09-02-2020,ادارے کے قوانین کی شرعی حیثیت,ادارے کے قوانین کی شرعی حیثیت کیا ہے؟ مثلاً ادارے کی طرف سے آنے جانے کا طے شدہ وقت۔  اور ان قوانین میں کمی کی صورت میں کیا حکم ہے؟,"<p><p style=""text-align:justify;"">کسی ملازم کے لیے اس کے ادارے کے قوانین جن کو وہ تسلیم کرکے ملازم بنا ہے، اس کے لیے معاہدے کا درجہ رکھتے ہیں، جیسا کہ اوقاتِ کار وغیرہ۔ جن کی پابندی اس پر  شرعاً لازم ہے،بشرطیکہ ان قواعد میں سے کوئی قرآن و حدیث کے مخالف نہ ہو، ایسی صورت میں ملازم پر اس کی پابندی لازم نہ ہوگی۔</p><p style=""text-align:justify;""><span class=""ar_writing"">""المسلمون على شروطهم"". (رواه الترمذي في (الأحكام) باب ما ذكر عن رسول الله صلى الله عليه وسلم في الصلح برقم(1352)</span> فقط واللہ اعلم</p></p>",144106200539,banuri,"('معاملات', 'muamlat')","('ملازمت', 'ملازمت')","('اوقات ملازمت', 'owqat-e-mulazimat')"
11-02-2020,https://www.banuri.edu.pk/readquestion/انجیکشن-لگوانے-سے-وضو-اور-روزے-کا-حکم-144106200618/11-02-2020,انجیکشن لگوانے سے وضو اور روزے کا حکم,رگ یا گوشت میں انجکشن لگانے سے (1)  وضو اور  (2) روزہ ٹوٹتا ہے یا نہیں؟,"<p><p style=""text-align:justify;"">1۔ جو انجیکشن رگ میں لگایا جاتا ہے، اس سے وضو ٹوٹ جاتا ہے، اس لیے کہ رگ میں سوئی پہنچنے کا تحقق اس وقت ہوتا ہے، جب کہ خون سرنج میں آجائے،  اور جب تک خون سرنج میں نہیں آتا اس وقت تک دوا جسم میں داخل نہیں کی جاتی۔</p><p style=""text-align:justify;"">البتہ جلد / گوشت میں لگائے جانے والے انجیکشن سے وضو ٹوٹنے کا مدار خون نکلنے پر ہے،  پس اگر جسم میں سوئی داخل کرتے  یا نکالتے  وقت قطرہ بھر یا اس سے زیادہ خون نکل آئے، تو وضو ٹوٹ جائے گا، وگرنہ نہیں ٹوٹے گا۔</p><p style=""text-align:justify;"">کبیری میں ہے :</p><p style=""text-align:justify;""><span class=""ar_writing"">""امام العلق إذا مصت العضو حتی امتلأت قلیلاً بحیث لو سقطت وشقت لسال منها الدم انتقض الوضوء وإن مصت قلیلاً بحیث لو شقت لم یسل لاینتفض"". (ص: ۱۳٤)</span></p><p style=""text-align:justify;"">کبیری میں ہے:</p><p style=""text-align:justify;""><span class=""ar_writing"">""إذا فصد و خرج منه دم کثیر ولم یتلطخ رأس الجرح فإنه ینقض"". (فصل في نواقض الوضوء ص: ۱۲۹)</span></p><p style=""text-align:justify;"">2۔ روزے کی حالت میں انجیکشن ( خواہ رگ میں لگوایا جائے، یا جلد / گوشت میں) لگوانے سے  روزہ فاسد نہیں ہوتا۔ </p><p style=""text-align:justify;"">فتاوی شامی میں ہے:</p><p style=""text-align:justify;""><span class=""ar_writing""><strong>""لأنه أثر داخل من المسام الذي هو خلل البدن، و المفطر إنما هو الداخل من المنافذ للإتفاق على أن من اغتسل في ماء فوجد برده في باطنه أنه لايفطر، و إنما كره الإمام"". ( ٢ / ٣٩٥)</strong></span></p><p style=""text-align:justify;"">فتاوی ہندیہ میں ہے:</p><p style=""text-align:justify;""><span class=""ar_writing"">""و ما يدخل من مسام البدن من الدهن لايفطر"". ( ١ / ٢٠٣)<span class=""eng_writing""> </span></span>فقط واللہ اعلم</p></p>",144106200618,banuri,"('طہارت', 'taharat')","('وضو', 'wuzu')","('وضو،فرائض،سنن،آداب اور وضو توڑنے والی اشیاء', 'wuzo-faraidh-sunan-aadab-or-wuzo-tornay-wali-ashya')"
11-02-2020,https://www.banuri.edu.pk/readquestion/منگنی-کے-بعد-ساتھ-گھومنا-پھرنا-144106200607/11-02-2020,منگنی کے بعد ساتھ گھومنا پھرنا,"ایک مسلم بالغ لڑکی (عمر 26 سال )کا ایک مسلم بالغ لڑکے(عمر 34 سال) سے رشتہ طے ہوتا ہے, لڑکی صوم وصلوۃ اور مکمل شرعی پردے کی پابند ہے, اب یہ دونوں فون پر گفتگو بھی کرتے,ملتے جلتے,اکٹھے سفر کرتے ہیں,ساتھ آتے جاتےایک سال سے ایسا ہی چل رہا ہے,مزید یہ کہ نکاح شادی اور رخصتی ایک سال بعد ہوگی, لڑکی کے ماں باپ اور بھائی منع نہیں کرتے, شریعت میں اس کا کیا حکم ہے؟","<p><p>منگنی   کے وقت اگر شرعی طور پر نکاح نہ ہو تو منگنی کی حیثیت ایک وعدہ ہی  کی  ہے  کہ  دوخاندان والوں نے آپس میں وعدہ کر لیا ہے کہ اس لڑکی کا اس لڑکے سے مستقبل میں نکاح ہوگا۔</p><p style=""text-align:justify;"">وعدہ کرنے سے  لڑکا لڑکی ایک دوسرے کے لیے حلال نہیں ہوتے؛ لہذا  منگنی کے بعد نکاح ہونے تک لڑکا اور لڑکی آپس میں ایک دوسرے کے لیے  نامحرم اور اجنبی ہی رہتے ہیں ، اور</p><p style=""text-align:justify;"">نا محرم لڑکاو لڑکی کا آپس میں فون  پر بات چیت کرنا یا  ساتھ  گھومنا پھرنا اور ساتھ سفر کرنا ممنوع اور معصیت ہے،لہذا  حرام عمل  سے  بچنا ضروری ہے۔ فقط واللہ اعلم</p></p>",144106200607,banuri,"('نکاح', 'nikah')","('منگنی', 'mangni')","('منگنی کی شرعی حیثیت', 'mangni')"
10-02-2020,https://www.banuri.edu.pk/readquestion/شوہر-نے-دھمکی-پر-طلاق-دے-دی-144106200581/10-02-2020,شوہر نے دھمکی پر طلاق دے دی,ایک شخص نے کہا کہ اپنی بیوی کو طلاق دو، وگرنہ میں تھانے بھجوا دوں گا۔ اگر وہ ایسا کرلے تو طلاق ہوگی یا نہیں؟,"<p><p style=""text-align:justify;"">صورتِ مسئولہ میں اگر مذکورہ شخص نے محض زبانی دھمکی پر اپنی بیوی کو طلاق دے دی تو  طلاق ہو جائے گی۔ فقط واللہ اعلم</p></p>",144106200581,banuri,"('طلاق', 'talaaq')","('وقوع طلاق وعدم وقوع طلاق', 'wuqoo-e-talaq-o-adme-wuqoo-e-talaq')","('طلاق - وقوع اور عدم وقوع', 'talaq-wuqo-or-adm-e-wuqo')"
10-02-2020,https://www.banuri.edu.pk/readquestion/جمشید-نامی-بادشاہ-کس-نبی-کے-زمانے-میں-تھا-144106200605/10-02-2020,جمشید نامی بادشاہ کس نبی کے زمانے میں تھا؟,جمشید نامی بادشاہ کون سے نبی کے زمانے میں تھا؟,<p><p>تلاش و تتبع کے باوجود جمشید نامی کسی بادشاہ کا کسی نبی کے زمانے میں ہونے کا تذکرہ ہمیں نہیں ملا۔</p></p>,144106200605,banuri,"('تاریخ و سیر', 'tareekh-o-siyar')","('تاریخ', 'tareekh')","('تاریخِ اسلام', 'tareekh-e-Islam')"
11-02-2020,https://www.banuri.edu.pk/readquestion/شناختی-کارڈ-میں-شوہر-کی-جگہ-بھائی-کا-نام-لکھوانا-144106200615/11-02-2020,شناختی کارڈ میں شوہر کی جگہ بھائی کا نام لکھوانا,ایک عورت کا شوہر وفات پاگیا ہو اور وہ اپنا شناختی کارڈ بنوانے کے لیے اپنے سگے بھائی کو شوہرقراردے نادرا کے ریکارڈ میں،  اور بھائی بھی دستخط کرے اس بات پر کہ یہ واقعی میری بیوی ہے اور اپنےشناختی کارڈ پر اس بہن کاکارڈ بنوائے تو ایسا کرنا شریعت کی رو سے کیساہے؟ اور اگر ایساکسی نے کیا ہو تو اس کےلیےکیاحکم ہے؟,"<p><p style=""text-align:justify;"">شوہر  کی وفات کے بعد شناختی کارڈ میں شوہر کے خانے میں بھائی کا نام درج کرانا جھوٹ، دھوکا دہی کے علاوہ اخلاقی وشرعی طور پر بھی انتہائی بری بات ہے، دونوں بھائی بہن اس پر توبہ واستغفار کریں اور اس غلطی کی فوراً اصلاح کرائیں۔فقط واللہ اعلم</p></p>",144106200615,banuri,"('حقوق و آدابِ معاشرت', 'huqooq-muashret')","('حقوق', 'bahmi-huqooq')","('میاں ، بیوی کے حقوق', 'mian-biwi-k-huqooq')"
08-02-2020,https://www.banuri.edu.pk/readquestion/قبرستان-پر-مدرسہ-بنانا-144106200487/08-02-2020,قبرستان پر مدرسہ بنانا,میرے باپ دادا کا قبرستان سڑک کے کنارے ہے،  جو رقبے میں دس مرلے کے برابر ہے،  میں چاہتا ہوں کہ اس قبرستان کے اوپر لینٹر ڈال کر اس کے اوپر کوئی دینی مدرسہ یا مکتبہ بنا لوں ۔ جہاں پر کتابوں اور قرآن کے پڑھنے پڑھانے کا سلسلہ ہو جائے ۔ یہ کام کرنا دین کی نظر میں کیساہے؟,"<p><p style=""text-align:justify;"">اگر قبرستان   وقف ہے  تو اس  پر چھت ڈال کر مدرسہ بنانا جائز نہیں ہے۔ اگر قبرستان وقف شدہ نہیں  ہے، بلکہ مملوکہ زمین ہے تو اجازت ہے۔</p><p style=""text-align:justify;""><span class=""ar_writing"">قال في التبیین:</span></p><p style=""text-align:justify;""><span class=""ar_writing"">""ولو بلي المیت وصار تراباً، جاز دفن غیره في قبره، وزرعه، والبناء علیه"". (تبیین الحقائق: ۲۴۶/۱)</span></p><p style=""text-align:justify;""><span class=""ar_writing""> عینی شرح بخاری</span>میں ہے:</p><p style=""text-align:justify;""><span class=""ar_writing"">""قال ابن القاسم: لو أن مقبرةً من مقابر المسلمین عفت فبنی فیها مسجدًا لم أر بذلك بأسًا"". (إمداد الفتاوی: ۲/۶۰۰) </span>فقط واللہ اعلم</p></p>",144106200487,banuri,"('متفرق کتب', 'mutafarriq-kutub')","('متفرق ابواب', 'mutafarriq-abwab')","('متفرق فصول', 'mutafarriq-fusool')"
08-02-2020,https://www.banuri.edu.pk/readquestion/مقروض-کو-زکوۃ-دینا-144106200490/08-02-2020,مقروض کو زکاۃ دینا,ایک شخص مقروض ہے ایک لاکھ روپے کا اور قرض خواہ اس سے مطالبہ بھی کرتا ہے ۔ مذکورہ شخص کے والد کا ترکہ ابھی تقسیم نہیں ہوا اور دوسرے وارثین تقسیم کرنے پر ابھی راضی بھی نہیں اور مذکورہ شخص ان کو مجبور بھی نہیں کر سکتا تو دریافت طلب یہ ہے کہ مذکورہ شخص کو زکاۃ دینا قرض کی ادائیگی کے لیے جائز ہے یا نہیں؟,"<p><p style=""text-align:justify;"">مذکورہ صورت میں یہ مقروض  شخص زکاۃ وصول کرسکتا ہے، اس لیے کہ میراث کا اس کا حصہ اس کے قبضے میں نہیں ہے، بشرطیکہ قرض کی رقم منہا کرنے کے بعد اس کی ملکیت میں ضرورت سے زائد اتنا مال یا سامان موجود نہ ہو جس کی مالیت نصاب (ساڑھے باون تولہ چاندی کی قیمت) تک پہنچتی ہو۔</p><p style=""text-align:justify;""><span class=""ar_writing"">""وکره إعطاء فقیر نصابًا أو أکثر إلا إذا کان المدفوع إلیه مدیوناً، أو کان صاحب عیال بحیث لو فرقه علیهم لایخص کلاً، أو لایفضل بعد دینه نصاب فلایکره"". (الدر المختار مع الشامي / باب المصرف ۳؍۳۰۳ زکریا، مجمع الأنهر، الزکاة، في بیان أحکام المصارف ۱؍۳۳۳ بیروت)<br/>
""قوله: والمدیون أطلقه القدوري، وقیده في الکافي بأن لایملك نصابًا فاضلاً عن دینه؛ لأنه المراد بالغارم في الآیة، وهو في اللغة: من علیه دین ولایجد قضاءً کما ذکره القُتَیبي … وفي الفتاویٰ الظهیریة: الدفع إلی من علیه الدین أولی من الدفع إلی الفقیر"". (البحر الرائق / باب المصرف ۲؍۲۴۲ کراچی) </span>فقط واللہ تعالیٰ اعلم</p></p>",144106200490,banuri,"('زکات', 'zakat')","('زکوٰۃ / صدقات', 'zakat-sadaqat')","('قرض اور اس کے متعلقہ احکام', 'qarz-or-us-k-mutalliqa-ahkam')"
01-02-2020,https://www.banuri.edu.pk/readquestion/قرض-دے-کر-ہر-مہینہ-نفع-لینا-144106200219/01-02-2020,قرض دے کر ہر مہینہ نفع لینا,کسی نے کسی شخص کو قرض دیاہے اور جس نے قرض لیا  ہے وہ کہہ رہاہے کہ میں ان پیسوں سے تجارت کروں گا اور آپ کو میں ان میں نفع ہو یانہ ہو،  آپ کو اتنی رقم دوں گا مہینے میں، تو کیا ایسا کرنا جائز  ہے؟,"<p><p style=""text-align:justify;"">واضح رہے کہ قرض دے کر اس پر اضافی رقم وصول کرنا سود کہلاتا ہے، یعنی   اگر ایک شخص دوسرے شخص کو قرض دے اور قرض لینے والا ہر ماہ قرض دینے والے کو منافع کے عنوان سے ایک متعین رقم ادا کرے تو یہ سود ہے اور ایسا معاملہ کرنا ناجائز ہو گا۔</p><p style=""text-align:justify;"">اس کی درست صورت یہ ہے کہ پیسہ دینے والا بطورِ مضاربت وہ رقم دوسرے شخص کو دے دے، پھر دوسرا شخص اس رقم سے کاروبار کرے اور منافع کو ایک تناسب سے آپس میں تقسیم کیا جائے، مثلاً منافع کا آدھا آدھا حصہ دونوں کا ہو گا یا چالیس اور ساٹھ وغیرہ، منافع کا ایک خاص حصہ (ایک متعین رقم) کسی ایک کے لیے مقرر کر لینا جائز نہیں، اور نقصان کی صورت میں ابتداءً اس نقصان کی تلافی نفع سے کی جائےگی، اگر نقصان نفع سے بھی زیادہ ہو تو پھر نفع کے بعد باقی نقصان کی تلافی سرمائے سے کی جائے گی۔ فقط واللہ اعلم</p></p>",144106200219,banuri,"('معاملات', 'muamlat')","('سود / بینکاری / انشورنس / شیئرز', 'sood-bankari-insurance-shares')","('قرض کے احکام', 'qarz-k-ahkam')"
