issued_at,link,title,question,answer,fatwa_number,dar_ul_ifta,kitab,bab,fasal
14-12-2019,https://www.banuri.edu.pk/readquestion/نکاح-کے-بعد-ہم-بستری-نہ-کرنے-کی-صورت-میں-نکاح-کا-حکم-144104200571/14-12-2019,نکاح کے بعد ہم بستری نہ کرنے کی صورت میں نکاح کا حکم,"میرے دوست نے شادی کی, لیکن اپنی بیوی کے ساتھ ہم بستری نہیں کی,  کچھ عرصے بعد بیوی کو صرف ایک طلاق دی, مطلب تین مرتبہ طلاق نہیں دی۔ لیکن بعد میں ایک مہینہ سے زیادہ عرصہ گزرنے کے بعد دوبارہ نکاح کر لیا۔ میرے دوست نے دوبارہ نکاح کرنے کے بعد بھی بیوی کے ساتھ ہم بستری نہیں کی تو نکاح ٹوٹ گیا یا ابھی بھی نکاح قائم ہے?","<p><p style=""text-align:justify;"">صورتِ مسئولہ میں اگر  شوہر نے دوبارہ شرعی نکاح کرلینے کے بعد  اپنی بیوی کے لیے طلاق کے الفاظ استعمال نہیں کیے ہیں اور نہ ہی دونوں کے درمیان خلع کا کوئی معاملہ ہوا ہے  تو  ہم بستری نہ کرنے  کی وجہ سے نکاح پر کوئی اثر نہیں پڑا، دونوں کا نکاح بدستور قائم ہے, تاہم کسی معتبر عذر کے بغیر  بیوی سے بالکل ہم بستری نہ کرنا، یا طویل عرصہ ہم بستری نہ کرنا درست نہیں ہے۔ فقط واللہ اعلم</p></p>",144104200571,banuri,"('طلاق', 'talaaq')","('وقوع طلاق وعدم وقوع طلاق', 'wuqoo-e-talaq-o-adme-wuqoo-e-talaq')","('طلاق - وقوع اور عدم وقوع', 'talaq-wuqo-or-adm-e-wuqo')"
05-01-2020,https://www.banuri.edu.pk/readquestion/دفع-وساوس-کا-وظیفہ-144105200267/05-01-2020,دفع وساوس کا وظیفہ,اگر دل و دماغ میں اللہ تعالٰی یا رسول اللہ صلی اللہ علیہ وسلم یا قرآنِ پاک یا کسی بھی عظیم ہستی کے متعلق برے خیالات آتے ہوں یا کسی انسان کی موت کے متعلق خیالات آتے ہوں تو کیا کرنا چاہیے، کوئی آسان عمل یا وظیفہ بتائیں کہ جس سے یہ خیالات آنا ختم ہو جائیں۔,"<p><p style=""text-align:justify;"">غیر اختیاری وسوسہ آنا اور  اسے برا سمجھنا ایمان کی علامت ہے، حدیثِ مبارک میں آتا ہے: "" حضرت ابوہریرہ   رضی اللہ عنہ سے روایت ہے کہ صحابہ کرام رضی اللہ تعالیٰ عنہم میں سے کچھ لوگ نبی ﷺ کی خدمت میں حاضر ہو کر عرض کرنے لگے کہ ہم اپنے دلوں میں کچھ خیالات ایسے پاتے ہیں کہ ہم میں سے کوئی ان کو بیان نہیں کر سکتا، آپ ﷺ نے فرمایا کیا واقعی تم اسی طرح پاتے ہو؟ (یعنی گناہ سمجھتے ہو) صحابہ کرام رضی اللہ تعالیٰ عنہم نے عرض کیا جی ہاں! آپ ﷺ نے فرمایا یہ تو واضح ایمان ہے۔<br/>
""<span class=""ar_writing"">عَنْ أَبِي هُرَيْرَةَ رَضِيَ اللَّهُ عَنْهُ قَالَ: جَاءَ نَاسٌ مِنْ أَصْحَابِ رَسُولِ اللَّهِ صَلَّى اللَّهُ عَلَيْهِ وَسَلَّمَ إِلَى النَّبِيِّ صَلَّى اللَّهُ عَلَيْهِ وَسَلَّمَ فَسَأَلُوهُ: إِنَّا نَجِدُ فِي أَنْفُسِنَا مَا يَتَعَاظَمُ أَحَدُنَا أَنْ يَتَكَلَّمَ بِهِ، قَالَ: «أَو قد وجدتموه»؟ قَالُوا: نعم. قَالَ: «ذَاك صَرِيح الْإِيمَان» . رَوَاهُ مُسلم"". (مشكاة المصابيح (1/ 26)</span></p><p style=""text-align:justify;"">ملاعلی قاری رحمہ اللہ فرماتے ہیں: صحابہ کے اس جملہ  ’’ہم اپنے دلوں میں کچھ خیالات ایسے پاتے ہیں کہ ہم میں سے کوئی ان کو بیان نہیں کر سکتا‘‘  کا مطلب یہ ہے کہ ”ہم اپنے دلوں میں بری چیزیں پاتے ہیں، مثلاً:  اللہ کو کس نے پیدا کیا؟ اور وہ کیسا ہے؟ اور کس چیز سے ہے؟ اور اس طرح کی اور چیزیں کہ جن کا بیان کرنا بھی مشکل ہے، اس لیے کہ ہمیں معلوم ہے کہ یہ قبیح باتیں ہیں اور ان میں سے کوئی چیز بھی ایسی نہیں ہے کہ ہم اس پر اعتقاد رکھیں، بلکہ ہم جانتے ہیں اللہ قدیم ہے ازل سے ہے، ہر چیز کا خالق ہے، مخلوق نہیں ہے، تو ایسے خیالات جو ہمارے دل میں آتے ہیں ان کا کیا حکم ہے؟ تو آپ ﷺ نے یہ جواب دیا کہ یہ تو صریح ایمان ہے، اس لیے تم اس وساوس کو دل میں پانے کے بعد جھڑک دیتے ہو، اور اس کو برا سمجھتے ہو،تو یہ تمہارے ایمان کی علامت ہے۔</p><p style=""text-align:justify;""><span class=""ar_writing"">مرقاة المفاتيح شرح مشكاة المصابيح (1/ 136):<br/>
""( «في أنفسنا ما يتعاظم أحدنا أن يتكلم به» ) أي: نجد في قلوبنا أشياء قبيحة نحو: من خلق الله؟ وكيف هو؟ ومن أي شيء؟ وما أشبه ذلك مما يتعاظم النطق به لعلمنا أنه قبيح لايليق شيء منها أن نعتقده، ونعلم أنه قديم، خالق الأشياء، غير مخلوق، فما حكم جريان ذلك في خواطرنا؟ ... (صريح الإيمان) أي: خالصه يعني أنه أمارته الدالة صريحاً على رسوخه في قلوبكم، وخلوصها من التشبيه، والتعطيل؛ لأن الكافر يصر على ما في قلبه من تشبيه الله سبحانه بالمخلوقات، ويعتقده حسنا، ومن استقبحها، وتعاظمها لعلمه بقبحها، وأنها لاتليق به تعالى كان مؤمناً حقاً، وموقناً صدقاً فلا تزعزعه شبهة، وإن قويت، ولا تحل عقد قلبه ريبة، وإن موهت، ولأن من كان إيمانه مشوباً يقبل الوسوسة، ولايردها"".</span></p><p style=""text-align:justify;"">لہذا ان خیالات اور وسوسوں سے پریشان نہ ہوں ، اور ان کا علاج یہ ہے کہ ان کی طرف بالکل دھیان نہ دیا جائے،   بعض علماء  نے وساوس میں مبتلا اشخاص کی تسلی و تسکین کے لیے کہا ہے کہ جس طرح  چور اُس گھر میں جاتا ہے جہاں کچھ مال ومتاع ہوتا ہے، اسی طرح جس دل میں ایمان ہوتا ہے شیطان وہاں آکر وساوس ڈالتا ہے۔</p><p style=""text-align:justify;""><span class=""ar_writing"">""وقيل: المعنى أن الوسوسة أمارة الإيمان؛ لأن اللص لايدخل البيت الخالي"". (مرقاة المفاتيح 1/ 137)</span></p><p style=""text-align:justify;"">اس لیے ان وساوس کو دل میں جگہ نہ دی جائے، ان کے مقتضی پر عمل یا لوگوں کے سامنے ان کا اظہار نہ ہو، بلکہ ان کا خیال جھڑک کر ذکر  اللہ کی کثرت کا اہتمام کرنا چاہیے۔</p><p style=""text-align:justify;"">خود ایک اور حدیثِ مبارک میں آپ ﷺ نے اس کا علاج بتایا ہے، ملاحظہ ہو:</p><p style=""text-align:justify;""> ""حضرت ابوہریرہ  رضی اللہ عنہ فرماتے ہیں کہ رسول اللہ ﷺ نے فرمایا کہ شیطان تم میں سے کسی کے پاس آتا ہے تو کہتا ہے کہ اس طرح کس نے پیدا کیا؟ اس طرح کس نے پیدا کیا؟  یہاں تک کہ وہ کہتا ہے کہ تیرے رب کو کس نے پیدا کیا؟ تو جب وہ یہاں تک پہنچے تو اللہ سے پناہ مانگو اور اس وسوسہ سے اپنے آپ کو روک لو۔<br/>
ایک اورحدیث میں ہے کہ ابو ہریرہ رضی اللہ عنہ سے روایت کہ  رسول اللہ ﷺ نے فرمایا کہ لوگ ہمیشہ ایک دوسرے سے پوچھتے رہیں گے یہاں تک کہ یہ کہا جائے گا کہ مخلوق کو اللہ نے پیدا کیا؟ تو اللہ کو کس نے پیدا کیا؟ تو جو آدمی اس طرح کا کوئی وسوسہ اپنے دل میں پائے تو وہ کہے : <span class=""ar_writing"">""آمَنت بِاللَّه وَرُسُله"" (</span>میں اللہ اور اس کے رسولوں پر ایمان لایا)۔<br/><span class=""ar_writing"">""وَعَنْ أَبِي هُرَيْرَةَ رَضِيَ اللَّهُ عَنْهُ قَالَ: قَالَ رَسُولُ اللَّهِ صَلَّى اللَّهُ عَلَيْهِ وَسَلَّمَ: "" يَأْتِي الشَّيْطَانُ أَحَدَكُمْ فَيَقُولُ: مَنْ خلق كَذَا؟ مَنْ خَلَقَ كَذَا؟ حَتَّى يَقُولَ: مَنْ خَلَقَ رَبَّكَ؟ فَإِذَا بَلَغَهُ فَلْيَسْتَعِذْ بِاللَّهِ وَلْيَنْتَهِ"".</span></p><p style=""text-align:justify;""><span class=""ar_writing"">""وَعَنْ أَبِي هُرَيْرَةَ رَضِيَ اللَّهُ عَنْهُ قَالَ: قَالَ رَسُولُ اللَّهِ صَلَّى اللَّهُ عَلَيْهِ وَسَلَّمَ: "" لَا يَزَالُ النَّاسُ يَتَسَاءَلُونَ حَتَّى يُقَالَ: هَذَا خَلَقَ اللَّهُ الْخَلْقَ فَمَنْ خَلَقَ اللَّهَ؟ فَمَنْ وَجَدَ مِنْ ذَلِكَ شَيْئًا فَلْيَقُلْ: آمَنت بِاللَّه وَرُسُله"".(مشكاة المصابيح (1/ 26)</span></p><p style=""text-align:justify;"">لہذا ان وسوسوں کے علاج کے لیے مذکورہ نسخہ نبوی ﷺ پر عمل کیا جائے، اور ساتھ ساتھ  یہ  اعمال کریں:</p><p style=""text-align:justify;""><span class=""ar_writing"">(1)  أعُوذُ بِالله (2) اٰمَنْتُ بِاللّٰهِ وَرَسُوْلِه </span>کا  ورد کرے۔<span class=""ar_writing"">(3)  هُوَ الْاَوَّلُ وَالْاٰخِرُ وَالظَّاهِرُ وَالْبَاطِنُ وَهُوَ بِكُلِّ شَيْءٍ عَلِيْم  (4) نیز  رَّبِّ اَعُوْذُبِكَ مِنْ هَمَزٰتِ الشَّیٰطِیْنِ وَاَعُوْذُ بِكَ رَبِّ اَنْ یَّحْضُرُوْنِ </span>کا کثرت سے ورد بھی ہر طرح کے شیطانی شکوک ووساوس کے دور کرنے میں مفید ہے۔فقط واللہ اعلم</p></p>",144105200267,banuri,"('علوم و فنون', 'uloom-funoon')","('دعائیں، اوراد اور وظائف', 'adeya-azkar')","('اوراد ووظائف', 'aurad-o-wzaif')"
19-12-2019,https://www.banuri.edu.pk/readquestion/بیوی-سے-شوقیہ-باتیں-کرتے-وقت-نکلنے-والے-پانی-کا-علاج-144104200722/19-12-2019,بیوی سے شوقیہ باتیں کرتے وقت نکلنے والے پانی کا علاج,بیوی سے شوقیہ باتیں کرتے وقت کچھ پانی جیسا سفید اور تیل کی طرح گاڑا پانی عضو سے نکلتا ہے۔اس کا کوئی علاج ممکن ہے؟,"<p><p style=""text-align:justify;"">بیوی کے ساتھ شوقیہ باتیں کرتے وقت جو پانی نکلتا ہے اسے مذی کہتے ہیں، بیوی کے ساتھ شوقیہ باتیں وغیرہ کرتے وقت مذی کا نکلنا کوئی بیماری نہیں ہے، بلکہ ایک فطری عمل اور مردانہ صحت کی نشانی ہے، اس لیے اس سے پریشان ہونے کی ضرورت نہیں ہے اور نہ ہی اس کا علاج کروانے کی ضرورت ہے، البتہ چوں کہ مذی ناپاک ہوتی ہے؛ اس لیے ایسے وقت میں وہ کپڑے پہننے چاہییں جس میں نماز نہیں پڑھی جاتی ہے اور اگر نماز والے کپڑوں میں مذی نکل کر کپڑوں میں لگ جائے تو ان کپڑوں کو دھو کر پاک کرلینا چاہیے۔ فقط واللہ اعلم</p></p>",144104200722,banuri,"('طہارت', 'taharat')","('نجاست اور اس سے پاکی', 'najasat-aur-us-ki-paki')","('نجاست سے پاکی', 'nijasat-aur-us-ki-paki')"
29-12-2019,https://www.banuri.edu.pk/readquestion/کتے-کو-گھر-سے-باہر-اسٹور-یا-چھت-پر-شوقیہ-طور-پر-پالنے-کے-لئے-رکھنے-کا-حکم-144105200069/29-12-2019,کتے کو گھر سے باہر اسٹور یا چھت پر شوقیہ طور پر پالنے کے لیے رکھنے کا حکم,کیا کتے کو گھر کے اندر رکھنے کے بجائے گھر کے پچھلے حصے (اسٹور یا لانڈری وغیرہ ) میں یا چھت پر شوقیہ طور پر پالنے کے لیے رکھ سکتے ہیں؟,"<p><p style=""text-align:justify;"">محض شوقیہ طور پر ’’کتا‘‘ پالنا جائز نہیں ہے، خواہ اس کو گھر سے باہر رکھا جائے، حدیثِ مبارک  میں ہے:</p><p style=""text-align:justify;""> </p><p style=""text-align:justify;""><span class=""ar_writing"">""لاتدخل الملائکة بیتًا فیه صورة ولا کلب"". (البخاري، رقم: ۴۰۰۲، ۵/۱۸، بیروت) </span></p><p style=""text-align:justify;"">ترجمہ : رحمت کے فرشتے ایسے گھر میں داخل نہیں ہوتے جس میں تصویر ہو یا کتا۔</p><p style=""text-align:justify;""> ایک اور حدیثِ پاک میں ہے:</p><p style=""text-align:justify;""><span class=""ar_writing"">""عن أبي هريرة، أن النبي صلى الله عليه وسلم قال: «من اتخذ كلباً إلا كلب ماشية، أو صيد، أو زرع، انتقص من أجره كل يوم قيراط». هذا حديث صحيح"". (سنن الترمذي (4 / 80)</span></p><p style=""text-align:justify;""> یعنی جس شخص نے جانور اور کھیتی وغیرہ کی حفاظت یا شکار کے علاوہ کسی اور مقصد سے کتا پالا، اس کے ثواب میں ہرروز ایک قیراط کم ہوگا۔ (ایک روایت میں دو قیراط کا ذکر ہے.)</p><p style=""text-align:justify;""><span class=""ar_writing"">""عن ابن عمر قال: قال رسول الله صلى الله عليه وسلم: «من اقتنى كلباً أو اتخذ كلباً ليس بضارع ولا كلب ماشية نقص من أجره كل يوم قيراطان»"". (ایضاً 4/79)</span><br/>
ان دو حدیثوں سے معلوم ہوا کہ شکار اور واقعی حفاظتی اغراض کے علاوہ محض شوقیہ کتا پالنا شرعاً ممنوع ہے، جس گھر میں اس طرح کا کتا ہوگا اس میں رحمت کے فرشتے داخل نہ ہوں گے، اور اس کے ثواب میں کمی ہوگی، اور اگر کھیت وغیرہ کی حفاظت یا شکار کے لیے کتا رکھا ہو تو اسے پالنا اور بقدرِ ضرورت ایسی جگہ جانا اور رہنا بھی جائز ہے۔<br/>
یہ اللہ تعالیٰ کا حکم ہے جو اس کے پیغمبر محمد صلی اللہ علیہ وسلم سے قابلِ اعتماد ذریعہ سے ہم تک پہنچا ہے، ایک مؤمن کی شان یہ ہے کہ اس پر عمل کرے، اس حکم کی علت  کیا ہے اس کے درپے نہ ہو، اللہ تعالیٰ احکم الحاکمین ہے، احکام کی حقیقی علتیں اللہ ہی کو معلوم ہیں، مؤمن کی شان احکام پر عمل کرنا ہے۔</p><p style=""text-align:justify;""> </p><p style=""text-align:justify;"">باقی علماء نے قرآن وحدیث اور شریعت کے مزاج کی روشنی میں کتے کے حرام ہونے اور اس کے ساتھ اختلاط کے عدمِ جواز کی شرعی مصلحتیں بھی بیان کی ہیں؛ لیکن ان مصلحتوں کو ”ظن“ کے درجے میں رکھنا چاہیے، واقعی مصلحت کیا ہے، اسے اللہ کے حوالے کرنا چاہیے۔</p><p style=""text-align:justify;"">”احکامِ اسلام عقل کی نظر میں“ میں ہے:</p><p style=""text-align:justify;"">’’کتا باعتبارِ اوصافِ مذمومہ کے شیطان ہوتا ہے، چناں چہ اس کو آں حضرت صلی اللہ علیہ وسلم نے شیطان فرمایا ہے ․․․․ وہ اوصافِ ذمیمہ یہ ہیں کہ جتنا کتا خبیث ترین وذلیل ترین وخسیس ترین حیوانات سے ہے اس کی محبت پیٹ سے آگے نہیں گزرتی، اس کی شدتِ حرص میں ایک بات یہ ہے کہ جب وہ چلتا ہے تو شدتِ حرص کی وجہ سے ناک زمین پر رکھ کر زمین سونگھتا جاتا ہے اور اپنے جسم کے سارے اعضاء چھوڑکر ہمیشہ اپنی دبر (پاخانہ کی جگہ) سونگھتا ہے، اور جب اس کی طرف پتھر پھینکو تو وہ فرطِ حرص وغصہ کی وجہ سے اس کو کاٹتا ہے، الغرض یہ جانور بڑا حریص وذلیل ودنی ہمت ہوتا ہے، گندے مردار کو بہ نسبت تازے گوشت کے زیادہ پسند کرتا اور نجاست بہ نسبت حلوا کے بڑی رغبت سے کھاتا ہے، اور جب کسی ایسے مردار پر پہنچے جو صدہا کتوں کے لیے کافی ہو تو شدتِ حرص وبخل کی وجہ سے اس مردار سے دوسرے کتے کو ذرہ برابر کھانے نہیں دیتا ․․․ پس جب کتے کے ایسے اوصافِ مذمومہ ہیں تو جو شخص اس کو کھاتا ہے وہ بھی ان ہی اوصاف سے متصل ہوتا ہے؛ لہٰذا یہ جانور حرام ٹھہرایا گیا، اور چوں کہ کتا پالنے میں اس کے ساتھ زیادہ تلبس ہوتا ہے جیسا کہ مشاہدہ ہے؛ اس لیے بلاخاص ضرورت کی صورتوں میں اس کا پالنا بھی ممنوع قرار دیا گیا کہ ان کی صفاتِ خبیثہ اس شخص میں اثر کریں گی اور چوں کہ ان صفاتِ خبیثہ سے ملائکہ کو نفرت ہے تو اس شخص سے ملائکہ بعد اختیار کرتے ہیں، چناں چہ وہ ایسے گھر میں بھی نہیں آتے جہاں کتا ہوتا ہے، اور سیاست کے ملائکہ (انتظامِ عالم اسی طرح حفاظت اور عذاب وسزا والے فرشتے) اس سے مستثنیٰ ہیں‘‘۔ (احکامِ اسلام عقل کی نظر میں“ مولفہ حضرت تھانوی رحمہ اللہ ص: ۲۸۵، ۲۸۶، ط: مکتبہ دارالعلوم) فقط واللہ اعلم</p></p>",144105200069,banuri,"('حظر و اباحت', 'mamnooaat-mubahat')","('تفریح / کھیل', 'tafreeh-khel')","('مختلف قسم کے کھیل', 'mukhtalif-qism-k-khel')"
30-12-2019,https://www.banuri.edu.pk/readquestion/زیر-ناف-بال-کاٹنے-کی-حد-144105200092/30-12-2019,زیرِ ناف بال کاٹنے  کی حد,زیر ناف بال کتنے دنوں تک اور کہاں تک کاٹنے چاہییں؟,"<p><p style=""text-align:justify;"">زیرِ ناف بال کاٹنا واجب ہے، اس کا مقصد نجاست سے اچھی طرح پاکی حاصل کرنا اور پاکیزگی ہے۔  چالیس دن تک یا اس سے زائد بلاوجہ چھوڑنا مکروہِ تحریمی  ہے۔ اس کی حد ناف کے نیچے پیڑوکی ہڈی سے لے کر شرم گاہ اور اس کے آس پاس کا حصہ، خصیتین، اسی طرح پاخانہ کے مقام کے ارد گرد کاحصہ اور رانوں کا صرف وہ حصہ جہاں نجاست ٹھہرنے یا لگنے کا خطرہ ہو،یہ تمام بال کاٹنے کی حد ہے۔ان تمام بالوں کی صفائی مسنون ہے۔فقط واللہ اعلم</p></p>",144105200092,banuri,"('حقوق و آدابِ معاشرت', 'huqooq-muashret')","('لباس / وضع قطع', 'libass-waza-qata')","('بالوں کے احکام و آداب', 'baloon-k-ahkam-o-aadab')"
24-12-2019,https://www.banuri.edu.pk/readquestion/خیبر-بینک-میں-پیسے-رکھوانا-144104200876/24-12-2019,خیبر بینک میں پیسے رکھوانا,بینک آف خیبر  بطور( اسلامی بینکاری) حضرت تقی عثمانی صاحب مدظلہ العالی جیسے جید علمائے کرام کا حوالہ دیتاہے۔ سوال یہ ہے کہ1- خیبر بینک میں رقم جمع کرنا ٹھیک ہے؟2-اگر ٹھیک تو کون سے اکاؤنٹ میں؟3- زکاۃ ادائیگی کیسے ہوگی؟4-سود سے کیسے بچا جا سکتا ہے؟,"<p><p style=""text-align:justify;"">کسی بھی بینک میں بامرِ مجبوری کرنٹ اکاؤنٹ میں پیسے رکھوانے کی گنجائش ہے، اس کے علاوہ کسی اور اکاؤنٹ میں رکھوانا جائز نہیں، اسلامی و غیر اسلامی کی تفریق درست نہیں۔ نیز کرنٹ اکاؤنٹ میں رکھوائی گئی رقم تنہا یا دوسرے قابلِ زکاۃ اموال (سونا چاندی، مالِ تجارت) کے ساتھ مل کر نصاب (ساڑھے باون تولہ چاندی کی قیمت) کے برابر  یا اس سے زیادہ ہو تو سال پورا ہونے پر اس کی زکات ادا کرنا لازم ہوگا۔ کرنٹ اکاؤنٹ میں بینک زکات کٹوتی خود نہیں کرتا، اس لیے خود زکات ادا کریں۔ فقط واللہ اعلم</p></p>",144104200876,banuri,"('معاملات', 'muamlat')","('سود / بینکاری / انشورنس / شیئرز', 'sood-bankari-insurance-shares')","('اسلامی بینکاری', 'islami-bankari')"
28-12-2019,https://www.banuri.edu.pk/readquestion/تعبیر-الرؤیا-144105200022/28-12-2019,میت کوزندہ دیکھنے کی تعبیر,میری بیوی اپنے مرحوم بھائی کو اکثر خواب میں دیکھتی ہے کہ وہ زندہ ہوکر واپس آگئے ہیں اور پہلے کی طرح بالکل ٹھیک ہو گئے ہیں یعنی جس بیماری میں ان کا انتقال ہوا ہے اب وہ بیماری بھی نہیں ہے۔ اس خواب کی تعبیر  بتادیجیے!,"<p><p style=""text-align:justify;"">میت کو زندہ دیکھناایمان پر خاتمے کی علامت ہے۔ فقط واللہ اعلم</p></p>",144105200022,banuri,"('علوم و فنون', 'uloom-funoon')","('تعبیر الرؤیا', 'mutafarriq-deeni-uloom')","('بعض خوابوں کی تعبیر', 'baaz-khuwabon-ki-taabeer')"
31-12-2019,https://www.banuri.edu.pk/readquestion/شادی-شدہ-کا-یوں-کہنا-کہ-میں-شادی-شدہ-نہیں-ہوں-144105200119/31-12-2019,شادی شدہ کا یوں کہنا کہ میں شادی شدہ نہیں ہوں,اگر کوئی شخص شادی شدہ ہو اور وہ لوگوں سے جھوٹ کہے  کہ  وہ شادی شدہ نہیں تو اس سے اس کا نکاح قائم ہے یا نہیں ؟,"<p><p style=""text-align:justify;"">مذکورہ شخص کے اس جملے سے اس کے نکاح پر اثر نہیں پڑے گا،  نکاح قائم رہے گا،  لیکن جھوٹ  بولنے کی وجہ سے گناہ گار ہو گا،  لہٰذا توبہ کرے۔ فقط واللہ اعلم</p></p>",144105200119,banuri,"('طلاق', 'talaaq')","('وقوع طلاق وعدم وقوع طلاق', 'wuqoo-e-talaq-o-adme-wuqoo-e-talaq')","('طلاق - وقوع اور عدم وقوع', 'talaq-wuqo-or-adm-e-wuqo')"
