issued_at,link,title,question,answer,fatwa_number,dar_ul_ifta,kitab,bab,fasal
21-12-2019,https://www.banuri.edu.pk/readquestion/ریگولر-شیئرز-regular-shares-اور-فیوچر-شیئرز-future-shares-/21-12-2019,ریگولر شیئرز(regular shares) اور فیوچر شیئرز (future shares),ڈیلی ٹریڈ شیئر مارکیٹ میں جائز ہے؟ سٹاک مارکٹ میں آج شیئر خرید کے آج ہی بیچ سکتے ہیں؟ ریگولر شیئر اور فیوچر شیئر دونوں کے مطابق بتائیے!,"<p><p style=""text-align:justify;"">شیئرز کے کاروبارسے اجتناب بہتر ہے؛ کیوں کہ اس میں اکثر جواز کی شرائط کی رعایت نہیں رکھی جاتی۔</p><p style=""text-align:justify;"">جواز کی شرائط یہ ہیں : </p><p style=""text-align:justify;"">1- جس کمپنی کے شیئرز کی خرید و فروخت کی جارہی ہو، خارج میں اس کمپنی کا وجود ہو، صرف کاغذی طور پر رجسٹرڈ نہ ہو اور نہ ہی اس کمپنی کے کل اثاثے نقد کی شکل میں ہوں، بلکہ اس کمپنی کی ملکیت میں جامد اثاثے بھی موجود ہوں۔</p><p style=""text-align:justify;"">2- کمپنی کا کل یا کم از کم اکثر سرمایہ حلال ہو۔</p><p style=""text-align:justify;"">3- کمپنی کا اصل کاروبار جائز ہو، حرام اشیاء کے کاروبار پر مشتمل نہ ہو۔</p><p style=""text-align:justify;"">4- شیئرز کی خرید و فروخت میں، خرید و فروخت کی تمام شرائط کی پابندی ہو۔</p><p style=""text-align:justify;"">5- حاصل شدہ منافع کل کا کل شیئرز ہولڈرز میں تقسیم کیا جاتا ہو، (احتیاطی) ریزرو کے طور پر نفع کا کچھ حصہ محفوظ نہ کیا جاتا ہو۔</p><p style=""text-align:justify;"">6- شیئرز کی خرید و فروخت کے دوران بالواسطہ یا بلاواسطہ سود اور جوے کے کسی معاہدے کا حصہ بننے سے احتراز کیا جاتا ہو۔</p><p style=""text-align:justify;"">7- شیئرز خریدنے کے بعد شرعی طور پر ان پر قبضہ اور ملکیت حاصل ہونے کے بعد انہیں آگے بیچا جائے۔</p><p style=""text-align:justify;"">اگر شیئرز کے کاروبار میں ان شرائط کی رعایت رکھی جائے تو یہ کاروبار جائز ہے، ورنہ نہیں۔</p><p style=""text-align:justify;"">فیوچر شیئرز جوے کی ایک قسم ہے لہذا وہ ناجائز ہے۔ فقط واللہ اعلم</p></p>",144104200755,banuri,"('معاملات', 'muamlat')","('سود / بینکاری / انشورنس / شیئرز', 'sood-bankari-insurance-shares')","('حصص / شیئرز', 'hisas-shares')"
07-01-2020,https://www.banuri.edu.pk/readquestion/ٹی-وی-والے-کمرے-سے-ہٹ-کر-نماز-پڑھنا-144105200368/07-01-2020,ٹی وی والے کمرے سے ہٹ کر نماز پڑھنا,میرے گھر کے ایک کمرے میں ٹیلی وژن ہے، کیا  دوسرے کمرے میں بلاجھجک نماز ہو جائے گی؟,"<p><p style=""text-align:justify;"">’’ٹی وی‘‘  رکھنا اور دیکھنا ناجائز ہے، البتہ جس کمرے میں ٹی وی رکھا ہوا وہ اور وہ بند ہو  اور اس کمرے میں جان دار کی تصاویر نہ ہوں تو  اس کمرے میں نماز  (کراہت کے بغیر) ادا ہو جاتی ہے۔  اور جس کمرے میں ٹی وی نہ ہو  اس میں بدرجہ اولیٰ جائز ہو گی۔ فقط واللہ اعلم</p></p>",144105200368,banuri,"('نماز', 'salat')","('مکروہاتِ نماز', 'makrohat-e-namaz')","('مکروہات نماز', 'makrohat-e-namaz')"
10-01-2020,https://www.banuri.edu.pk/readquestion/دیو-بندی-مذہب-کی-مسجد-میں-اہل-تشیع-فرد-اپنی-انفرادی-نماز-ادا-کرسکتا-ہے-144105200468/10-01-2020,دیو بندی مسلک کی مسجد میں اہلِ تشیع فرد اپنی انفرادی نماز ادا کرسکتا ہے؟,دیو بندی مذہب کی مسجد میں اہلِ تشیع فرد اپنی انفرادی نماز ادا کرسکتا ہے؟,"<p><p style=""text-align:justify;"">پڑھ سکتا ہے۔ فقط واللہ اعلم</p></p>",144105200468,banuri,"('نماز', 'salat')","('مسجد کے آداب و احکام', 'masjid-k-aadab-o-ahkaam')","('مسجد کے آداب و احکام', 'masjid-k-aadab-o-ahkam')"
11-01-2020,https://www.banuri.edu.pk/readquestion/سر-سے-دوپٹہ-اترنے-اور-نا-محرم-کے-دیکھنے-سے-وضو-ٹوٹنے-کا-حکم-144105200511/11-01-2020,سر سے دوپٹہ اترنے اور نا محرم کے دیکھنے سے وضو ٹوٹنے کا حکم,کیا سر سے دوپٹا اتر جاۓ تو وضو ٹوٹ جاتا ہے؟  کوئی نا محرم بھی دیکھ لے اس حالت میں تو؟,"<p><p style=""text-align:justify;"">سر سے دوپٹہ ہٹ جانے سے وضو نہیں ٹوٹتا، اور نہ ہی اس حالت میں نا محرم کے دیکھ لینے سے وضو ٹوٹتا ہے،  لیکن حتی الامکان کوشش کرنی چاہیے کہ عورت پر کسی نا محرم کی نظر نہ پڑے۔</p><p style=""text-align:justify;"">وضو کو توڑنے والی چیزیں مندرجہ ذیل ہیں:</p><p style=""text-align:justify;"">* آگے یا پیچھے کی شرم گاہ سے کسی چیز کا نکلنا</p><p style=""text-align:justify;"">* بدن کے کسی بھی حصے سے نجاست کا نکل کر بہہ جانا</p><p style=""text-align:justify;"">* منہ بھر کر قے ہو جانا</p><p style=""text-align:justify;"">*ٹیک لگا کر سو جانا</p><p style=""text-align:justify;"">* بے ہوش یا پاگل ہو جانا</p><p style=""text-align:justify;"">* رکوع و سجدے والی نماز میں قہقہہ مارنا</p><p style=""text-align:justify;"">* شرم گاہوں کا بغیر حائل آپس میں ملنا۔ فقط واللہ اعلم</p></p>",144105200511,banuri,"('طہارت', 'taharat')","('وضو', 'wuzu')","('وضو،فرائض،سنن،آداب اور وضو توڑنے والی اشیاء', 'wuzo-faraidh-sunan-aadab-or-wuzo-tornay-wali-ashya')"
02-01-2020,https://www.banuri.edu.pk/readquestion/ارفعہ-نام-رکھنے-کا-حکم-144105200185/02-01-2020,ارفعہ نام رکھنے کا حکم,’’ارفعہ‘‘  نام کیسا ہے؟ رکھنا چاہے یا نہیں؟,"<p><p style=""text-align:justify;"">’’ارفعہ‘‘  کا مادہ ”رفع“ ہے، اس کے معنی بلند  ہونے کے ہیں، اس سے <span class=""ar_writing"">”اَرْفَع“</span> (مذکر) استعمال ہوتا ہے،  جس کے معنی ’’بلند تر‘‘ کے ہیں،  لڑکی کانام اسی مادہ سے رکھنا ہو تو  <span class=""ar_writing"">”رَافِعَهْ“</span> رکھ لیا جائے۔ ’’ارفعہ‘‘  عربی لغت کے اعتبار سے مکمل جملہ ہے، یہ نام رکھنا درست نہیں ہے۔ فقط واللہ اعلم</p></p>",144105200185,banuri,"('حقوق و آدابِ معاشرت', 'huqooq-muashret')","('حقوق', 'bahmi-huqooq')","('اولاد کے حقوق', 'olad-ky-hoqoq')"
10-01-2020,https://www.banuri.edu.pk/readquestion/حاملہ-پر-چاند-گرہن-کے-اثرات-144105200469/10-01-2020,حاملہ پر چاند گرہن کے اثرات,حاملہ عورت کے بارے میں کیا حکم ہے؟  حاملہ عورت کو  چاند گرہن  میں کیا کرنا چاہیے؟,"<p><p style=""text-align:justify;"">سورج اورچاند گرہن اللہ رب العزت کی قدرت کی نشانیوں میں سےایک نشانی ہے، جس سے اللہ پاک اپنے بندوں کوتنبیہ فرماتےہیں، باقی انسانی جسم پراس کے  اثرات ظاہرہونے کی شرعاً  کوئی حقیقت نہیں ہے۔ فقط واللہ اعلم</p></p>",144105200469,banuri,"('حظر و اباحت', 'mamnooaat-mubahat')","('تعویذات / عملیات', 'taweezat-amlyat')","('سحر / جادو کی حقیقت و احکام', 'sehr-jado-ki-haqiqat-o-ahkam')"
12-01-2020,https://www.banuri.edu.pk/readquestion/پتنگ-کا-کاروبار-کرنا-144105200536/12-01-2020,پتنگ کا کاروبار کرنا,پتنگ کا کاروبار کرنا کیسا ہے؟,"<p><p style=""text-align:justify;"">پتنگ بازی میں پیسوں اور وقت کا ضیاع ہےاور مختلف مواقع پر کئی انسانی جانوں کے ضیاع کی نوبت بھی آچکی ہے،لہذا پتنگ بازی  سے اجتناب چاہیے، اور ایسے کاروبار سے بھی اجتناب کرنا چاہیے، جو پیسوں اور وقت کے ضیاع کا سبب ہو۔</p><p style=""text-align:justify;""><span class=""ar_writing"">""ما قامت المعصیة بعینه یکره بیعه تحریمًا، وإلا فتنزیهًا"". (الشامية، الحظر والإباحة، باب الاستبراء، فصل في البیع ) </span>فقط واللہ اعلم</p></p>",144105200536,banuri,"('معاملات', 'muamlat')","('بیع / تجارت', 'bay-tijarat')","('بیع صحیح ، فاسد اور باطل', 'bay-sahih-fasid-or-batil')"
10-01-2020,https://www.banuri.edu.pk/readquestion/مرد-اور-عورت-کے-لیے-چہرے-کے-زائد-بال-صاف-کرنا-144105200463/10-01-2020,مرد اور عورت کے لیے چہرے کے زائد بال صاف کرنا,چہرے کے غیر ضروری بال کو صاف کرنا کیسا ہے؟,"<p><h3 style=""text-align:justify;""><span style=""color:#16a085;"">خواتین کے لیے چہرے کے بالوں سے متعلق حکم:</span></h3><p style=""text-align:justify;"">خواتین کے لیے اپنے چہرے کے خلافِ عادت آنے والے بال مثلاً داڑھی، مونچھ،  پیشانی وغیرہ کے بال یا کلائیوں اور پنڈلیوں کے بال یا جسم کے دیگر بال (سر کے علاوہ) صاف کرنا جائز ہے، البتہ ان بالوں کو نوچ کرنکالنا مناسب نہیں، کیوں کہ اس میں بلاوجہ اپنے جسم کو اذیت دیناہے،  کسی پاؤڈر وغیرہ سے کے ذریعہ یا کسی ایسے طریقہ سے جس سے تکلیف نہ ہو ، یہ بال صاف کر لیے جائیں تو زیادہ بہتر ہے۔</p><p style=""text-align:justify;"">عورت کے لیےبھنویں بنانا (دھاگا یا کسی اور چیز سے)یا اَبرو کے اطراف سے بال اکھاڑ کر باریک دھاری بنانا جائز نہیں، اس پر حدیث میں لعنت وارد ہوئی ہے،  اسی طرح  دونوں ابرؤں کے درمیان کے بال زیب وزینت کے حصول کے لیے کتروانا جائز نہیں،  البتہ اگر  اَبرو بہت زیادہ پھیلے ہوئے ہوں تو ان کو درست کرکے  عام  حالت کے مطابق   (ازالۂ عیب کے لیے )معتدل کرنے کی گنجائش ہے۔</p><h3 style=""text-align:justify;""><span style=""color:#16a085;"">مردوں کے لیے چہرے کے زائد بالوں سے متعلق حکم:</span></h3><p style=""text-align:justify;"">اسی طرح مردوں کے داڑھی کے بال ایک مشت سے زائد ہوجائیں تو ان کا کاٹنا  جائز ہے۔ اور ڈاڑھی کے علاوہ  مثلاً  جبڑوں کی ہڈی سے اوپر  گال پر آنے والے بال کاٹنا بھی جائز ہے۔</p><p style=""text-align:justify;""><span class=""ar_writing"">حاشية رد المحتار على الدر المختار (6/ 373):<br/>
""( والنامصة إلخ ) ذكره في الاختيار أيضاً، وفي المغرب: النمص نتف الشعر ومنه المنماص المنقاش اهـ ولعله محمول على ما إذا فعلته لتتزين للأجانب، وإلا فلو كان في وجهها شعر ينفر زوجها عنها بسببه ففي تحريم إزالته بعد؛ لأن الزينة للنساء مطلوبة للتحسين، إلا أن يحمل على ما لا ضرورة إليه؛ لما في نتفه بالمنماص من الإيذاء.  وفي تبيين المحارم: إزالة الشعر من الوجه حرام إلا إذا نبت للمرأة لحية أو شوارب فلا تحرم إزالته بل تستحب"". </span>  فقط واللہ اعلم</p></p>",144105200463,banuri,"('حقوق و آدابِ معاشرت', 'huqooq-muashret')","('لباس / وضع قطع', 'libass-waza-qata')","('بالوں کے احکام و آداب', 'baloon-k-ahkam-o-aadab')"
17-11-2019,https://www.banuri.edu.pk/readquestion/زنا-کاری-سے-عادت-ختم-کرنے-کے-لیے-کیا-کیا-جائے-144012201976/17-11-2019,بد کاری کی عادت ختم کرنے کے لیے کیا کیا جائے؟,ایک شخص نماز بھی پڑھتا ہے، تہجد بھی پڑھتا ہے، لیکن زنا بھی کرتا ہے، اس سے  بچنے کی تدبیر بتائیں؟,"<p><p style=""text-align:justify;"">’’زنا‘‘   انتہائی قبیح فعل اور  بدترین گناہ ہے، ’’کنز العمال‘‘  میں ایک حدیث ہے کہ ”شرک کرنے کے بعد اللہ کے نزدیک کوئی گناہ اس نطفہ سے بڑا نہیں جس کو آدمی اُس شرم گاہ میں رکھتا ہے جو  اس کے لیے حلال نہیں ہے“.   مسلمان کے لیے اللہ تعالیٰ کے اَحکامات بجالانے کے ساتھ   جن چیزوں سے اللہ تعالیٰ نے روکا ہے ان سے بچنا ضروری ہے، جس طرح نماز پڑھنا فرض ہے، اسی طرح زنا حرام ہے، اس سے بچنا فرض ہے، اس لیے مذکورہ شخص کو چاہیے کہ جس طرح وہ نماز کا اہتمام کرتاہے؛ کیوں کہ یہ اللہ پاک کا حکم ہے، اور اس کے چھوڑنے پر باز پرس ہوگی، اسی طرح بدکاری بھی بڑا گناہ اور جرم ہے، جس کے بارے میں حساب ہوگا، قیامت کے دن اللہ تعالیٰ کی بار گاہ میں اَعمال کے حساب و کتاب کے منظر کو ذہن میں رکھے، نیز درج ذیل روایت کے مضمون کو بھی ذہن نشین رکھے، امید ہے کہ اس سے بھی اسے اس گناہ سے نجات حاصل کرنے میں مدد ملے گی۔</p><p style=""text-align:justify;"">حضرت ابو امامہ رضی اللہ عنہ سے مروی ہے کہ ایک نوجوان نبی کریم ﷺ کی خدمت میں حاضر ہوا اور کہنے لگا: یا رسول اللہ! ﷺ مجھے زنا کرنے کی اجازت دے  دیجیے!   لوگ اس کی طرف متوجہ ہو کر اُسے ڈانٹنے لگے اور اسے پیچھے ہٹانے لگے، لیکن نبی ﷺ نے اسے فرمایا: میرے قریب آجاؤ!  وہ نبی ﷺ کے قریب جا کر بیٹھ گیا، نبی ﷺ نے اس سے پوچھا:  کیا تم اپنی والدہ کے حق میں بدکاری کو پسند کروگے؟ اس نے کہا: اللہ کی قسم! کبھی نہیں، میں آپ پر قربان جاؤں!  نبی ﷺ نے فرمایا:  لوگ بھی اسے اپنی ماں کے لیے پسند نہیں کرتے۔  پھر دریافت فرمایا: کیا تم اپنی بیٹی کے حق میں بدکاری کو پسند کرو گے؟ اس نے کہا: اللہ کی قسم! کبھی نہیں، میں آپ پر قربان جاؤں!  نبی ﷺ نے فرمایا: لوگ بھی اسے اپنی بیٹی کے لیے پسند نہیں کرتے۔ پھر پوچھا: کیا تم اپنی بہن کے حق میں بدکاری کو پسند کرو گے؟ اس نے کہا:  اللہ کی قسم! کبھی نہیں، میں آپ پر قربان جاؤں!  نبی ﷺ نے فرمایا: لوگ بھی اسے اپنی بہن کے لے پسند نہیں کرتے۔  پھر پوچھا: کیا تم اپنی پھوپھی کے حق میں بدکاری کو پسند کرو گے؟ اس نے کہا: اللہ کی قسم! کبھی نہیں، میں آپ پر قربان جاؤں!  نبی ﷺ نے فرمایا: لوگ بھی اسے اپنی پھوپھی کے لیے پسند نہیں کرتے۔  پھر پوچھا: کیا تم اپنی خالہ کے حق میں بدکاری کو پسند کرو گے؟اس نے کہا: اللہ کی قسم کبھی نہیں، میں آپ پر قربان جاؤں!  نبی ﷺ نے فرمایا: لوگ بھی اسے اپنی خالہ کے لیے پسند نہیں کرتے۔</p><p style=""text-align:justify;""> پھر نبی ﷺ نے اپنا دستِ مبارک اس کے جسم پر رکھا اور دعا کی کہ:  ”اے اللہ! اس کے گناہ معاف فرما، اس کے دل کو پاک فرما اور اس کی شرم گاہ کی حفاظت فرما!“ ، راوی کہتے ہیں: اس کے بعد اس نوجوان نے کبھی کسی کی طرف توجہ بھی نہیں کی۔(مسند احمد)</p><p style=""text-align:justify;""> لہٰذا مذکورہ شخص کو  چاہیے وہ نماز اور تہجد خشوع وخضوع سے جاری رکھے،  نماز  کے  تمام فرائض، واجبات، سنن ومستحبات کا خیال رکھے،   اس لیے نماز بے حیائی اور بُری باتوں سے روکتی ہے؛ یقیناً جب تمام آداب اور نماز کے حقوق کی رعایت رکھتے ہوئے ادا کی جائے گی تو اسے گناہوں سے روکنے پر آمادہ کرے گی۔</p><p style=""text-align:justify;"">گناہ سے بچنے کے لیے مضبوط ہمت اور پختہ ارادہ چاہیے، اور اس کے ساتھ ساتھ کسی اللہ والے کی صحبت اختیار کی جائے، اللہ والوں کی صحبت میں رہنے سے ایسے موذی امراض سے جلد خلاصی نصیب ہوتی ہے، نیز اس کے ساتھ چند اعمال کا اہتمام کیا جائے:</p><p style=""text-align:justify;"">(1) شادی شدہ نہیں تو جلد از جلد نکاح کرلے۔ (2) ورنہ کثرت سے روزے رکھے۔ (3)  ہمیشہ باوضو رہنے کی عادت بنائے۔ (4) تنہائی میں وقت نہ گزاریں۔ (5) جب تک یہ عادت نہ چھوٹے روزانہ دو  رکعت صلاۃ الحاجۃ پڑھ کر اللہ سے اس قبیح فعل سے چھٹکارے کی دعا مانگی جائے (6) کثرت سے اس دعا  کا ورد کیا جائے: <span class=""ar_writing""> ""اَللّٰهُمَّ إِنِّيْ أَسْئَلُكَ الْهُدٰی وَالتُّقٰی وَالْعَفَافَ وَالْغِنٰی""</span>(7)  کثرت  کے ساتھ   سید الاستغفار پڑھنے کا اہتمام کیا جائے ، ان شاء اللہ یہ عادت جلد ہی چھوٹ جائے گی۔    سید الاستغفار یہ ہے: </p><p style=""text-align:justify;""><span class=""ar_writing"">""اللَّهُمَّ أَنْتَ رَبِّي لاَ إِلَهَ إِلَّا أَنْتَ، خَلَقْتَنِي وَأَنَا عَبْدُكَ، وَأَنَا عَلَى عَهْدِكَ وَوَعْدِكَ مَا اسْتَطَعْتُ، أَعُوذُ بِكَ مِنْ شَرِّ مَا صَنَعْتُ، أَبُوءُ لَكَ بِنِعْمَتِكَ عَلَيَّ، وَأَبُوءُ لَكَ بِذَنْبِي فَاغْفِرْ لِي، فَإِنَّهُ لاَيَغْفِرُ الذُّنُوبَ إِلَّا أَنْتَ"".</span> (صحیح بخاری)</p><p style=""text-align:justify;""><span class=""ar_writing"">مجمع الزوائد ومنبع الفوائد (1/ 129):<br/>
""543 - وعن أبي أمامة: «أن فتى من قريش أتى النبي صلى الله عليه وسلم فقال: يا رسول الله، ائذن لي في الزنا! فأقبل القوم عليه وزجروه، فقالوا: مه مه، فقال: "" ادنه ""، فدنا منه قريبًا، فقال: "" أتحبه لأمك؟ "" قال: لا والله، جعلني الله فداك! قال: ""ولا الناس يحبونه لأمهاتهم"". قال: "" أفتحبه لابنتك؟ "". قال: لا والله يا رسول الله، جعلني الله فداك! قال: ""ولا الناس يحبونه لبناتهم"". قال: ""أفتحبه لأختك؟"" قال: لا والله يا رسول الله، جعلني الله فداك! قال: ""ولا الناس يحبونه لأخواتهم"". قال: "" أتحبه لعمتك؟"". قال: لا والله يا رسول، جعلني الله فداك! قال: ""ولا الناس يحبونه لعماتهم"". قال: "" أتحبه لخالتك؟"". قال: لا والله يا رسول الله جعلني الله فداك! قال: ""ولا الناس يحبونه لخالاتهم"". قال: فوضع يده عليه، وقال: ""اللهم اغفر ذنبه، وطهر قلبه، وحصن فرجه"". قال: فلم يكن بعد ذلك الفتى يلتفت إلى شيء»"". رواه أحمد والطبراني في الكبير، ورجاله رجال الصحيح"". </span>فقط واللہ اعلم</p></p>",144012201976,banuri,"('علوم و فنون', 'uloom-funoon')","('دعائیں، اوراد اور وظائف', 'adeya-azkar')","('اوراد ووظائف', 'aurad-o-wzaif')"
11-01-2020,https://www.banuri.edu.pk/readquestion/بیوی-کا-بوسہ-لینے-سے-وضو-کا-حکم-144105200518/11-01-2020,بیوی کا بوسہ لینے سے وضو کا حکم,کیا بیوی کو  بوسہ دینے سے وضو ٹوٹ جاتا ہے؟,"<p><p style=""text-align:justify;"">بیوی کا بوسہ لینے یا اسے بوسہ دینے سے اگر شرم گاہ سے مذی وغیرہ نہ نکلے تو اس سے وضو نہیں ٹوٹتا،  ایک روایت میں آتا ہے حضرت عروہ بن زبیر  ؓ  حضرت عائشہ   ؓ   سے روایت کرتے ہیں کہ نبی ﷺ نے اپنی ایک اہلیہ کا بوسہ لیا، پھر نماز کے  لیے تشریف لے گئے اور وضو نہ کیا۔ (عروہ  جو حضرت عائشہ رضی اللہ عنہا کے بھانجے ہیں، کہتے ہیں) میں نے کہا: وہ آپ ہی ہوں گی؟ تو وہ مسکرا دیں ۔</p><p style=""text-align:justify;""><span class=""ar_writing"">سنن ابن ماجه (1/ 168):<br/>
""عن عروة بن الزبير، عن عائشة أن رسول الله صلى الله عليه وسلم: «قبّل بعض نسائه، ثم خرج إلى الصلاة، ولم يتوضأ». قلت: ما هي إلا أنت! «فضحكت»"". </span> فقط واللہ اعلم</p></p>",144105200518,banuri,"('طہارت', 'taharat')","('وضو', 'wuzu')","('وضو،فرائض،سنن،آداب اور وضو توڑنے والی اشیاء', 'wuzo-faraidh-sunan-aadab-or-wuzo-tornay-wali-ashya')"
