issued_at,link,title,question,answer,fatwa_number,dar_ul_ifta,kitab,bab,fasal
10-01-2020,https://www.banuri.edu.pk/readquestion/اگر-شوہر-زبان-سے-بیوی-کو-یہ-کہے-کہ-میں-نے-تجھے-طلاق-دی-مگر-دل-میں-تین-طلاق-کی-نیت-کرے-تو-کیا-حکم-ہے-144105200467/10-01-2020,اگر شوہر زبان سے بیوی کو یہ کہے کہ میں نے  تجھے طلاق دی،  مگر دل میں تین طلاق کی نیت کرے تو کیا حکم ہے؟,اگر شوہر زبان سے بیوی کو یہ کہے کہ ’’میں نے  تجھے طلاق دی‘‘،  مگر دل میں تین طلاق کی نیت کرے تو کیا حکم ہے؟,"<p><p style=""text-align:justify;"">اگر شوہر زبان سے بیوی کو یہ کہے کہ میں نے  تجھے طلاق دی،  مگر دل میں تین طلاق کی نیت کرے تو  اس سے ایک ہی طلاق واقع ہو گی، تین طلاقیں واقع نہیں ہوں گی۔</p><p style=""text-align:justify;""><span class=""ar_writing"">المبسوط للسرخسي (6/ 76):<br/>
""ولو نوى بقوله: ""أنت طالق""، ثلاثًا أو اثنتين، لاتعمل نيته عندنا، ولايقع عليها إلا واحدة رجعية"".</span></p><p style=""text-align:justify;""><span class=""ar_writing"">تحفة الفقهاء (2/ 176):<br/>
""فَإِن نوى بقوله: ""أَنْت طَالِق""، ونظائره ثَلَاث تَطْلِيقَات أَو طَلْقَتَيْنِ لَايَصح عندنَا"".</span> فقط واللہ اعلم</p></p>",144105200467,banuri,"('طلاق', 'talaaq')","('وقوع طلاق وعدم وقوع طلاق', 'wuqoo-e-talaq-o-adme-wuqoo-e-talaq')","('طلاق - وقوع اور عدم وقوع', 'talaq-wuqo-or-adm-e-wuqo')"
02-10-2019,https://www.banuri.edu.pk/readquestion/فاسق-کا-مطلب-144012201462/02-10-2019,فاسق کا مطلب,فاسق کا کیا مطلب ہے؟ اور کون سا شخص فاسق کہلاتا ہے؟,"<p><p style=""margin-left:0;margin-right:0;text-align:justify;"">ہر وہ آدمی جو اطاعتِ خداوندی کو چھوڑ کر گناہ میں مبتلا ہو جائے اس کو ’’فاسق‘‘ کہتے ہیں، اگر کوئی شخص گناہِ کبیرہ کا مرتکب ہو تو ایسے شخص کو ’’فاسق‘‘ کہیں گے اور جو شخص  چھوٹے گناہوں پر اصرار کرے اور مستقل کرتا رہے تو ایسے آدمی کو بھی ’’فاسق‘‘  کہا جائے گا۔</p><p style=""margin-left:0;margin-right:0;text-align:justify;""><span class=""ar_writing"">الموسوعة الفقهية الكويتية (32/ 140):<br/>
""الفسق في اللغة: الخروج عن الطاعة، وعن الدين، وعن الاستقامة.<br/>
والفسق في الأصل خروج الشيء من الشيء على وجه الفساد، ومنه قولهم: فسق الرطب: إذا خرج عن قشره. وفي الاصطلاح قال الشوكاني: هو الخروج عن الطاعة وتجاوز الحد بالمعصية.<br/>
والفسق يقع بالقليل من الذنوب إذا كانت كبائر ، وبالكثير"".</span> فقط واللہ اعلم</p></p>",144012201462,banuri,"('علوم و فنون', 'uloom-funoon')","('فقہ و فتویٰ', 'fiqah')","('فتویٰ کی تعریف، اصول اور آداب', 'fatwa-ki-tareef-usool-aur-aadaab')"
12-11-2019,https://www.banuri.edu.pk/readquestion/نام-رکھنا-2/12-11-2019,حاویہ نام رکھنا,بھتیجی کے لیے ’’حاویہ‘‘  نام پسند آیا ہے.  والد کا نام مبشر ہے،  حاویہ کے ساتھ دوسرا نام کون سا لگایا جائے ’’حاویہ نور‘‘،  ’’حاویہ مبشر‘‘  یا کوئی اور ?,"<p><p style=""text-align:justify;"">’’حاویہ‘‘  کے مختلف معانی ہیں، ان میں سے ایک معنیٰ ہے:  "" سانپ کا منتر کرنے والی""۔  اس معنیٰ کے لحاظ سے یہ نام مناسب نہیں۔</p><p style=""text-align:justify;"">لہذا مذکورہ نام کے بجائے صحابیات کے ناموں میں کسی نام کا انتخاب کرکے رکھنا زیادہ بہتر ہے، ہماری ویب سائٹ اور ایپلی کیشن میں ""اسلامی ناموں"" کےعنوان سے ایک آپشن موجود ہے، وہاں  سے بھی  آپ نام کا انتخاب کرسکتے ہیں۔</p><p style=""text-align:justify;"">جو بھی نام منتخب کریں، اس کے ساتھ والد کا نام ’’مبشر‘‘ لگانا زیادہ مناسب ہے۔ فقط واللہ اعلم</p></p>",144103200308,banuri,"('حقوق و آدابِ معاشرت', 'huqooq-muashret')","('حقوق', 'bahmi-huqooq')","('اولاد کے حقوق', 'olad-ky-hoqoq')"
04-01-2020,https://www.banuri.edu.pk/readquestion/اگر-کسی-مسجد-میں-امام-پابندی-سے-نماز-پڑھنے-نہ-آتے-ہوں-اس-مسجد-میں-جمعہ-پڑھنے-کا-حکم-144105200236/04-01-2020,اگر کسی مسجد میں امام پابندی سے نماز پڑھنے نہ آتے ہوں اس مسجد میں جمعہ پڑھنے کا حکم,اگر ایک مسجد میں امامِ مسجد  پابندی سے نماز پڑھنے نہیں آتا اور مجبوراً کبھی ایک کے پیچھے اور کبھی دوسرے کے پیچھے نماز پڑھنا ہوتی ہے۔ کیا اس مسجد میں نمازِ جمعہ ہوتاہے؟ اور اس امام کے پیچھے نماز پڑھنا کیسا  ہے؟,"<p><p style=""text-align:justify;"">جمعہ کی نماز صحیح ہونے کی شرائط میں یہ شرط نہیں ہے کہ اس مسجد میں پابندی سے ایک امام نماز پڑھاتے ہوں؛  اس لیے اگر آپ کی مسجد میں امام صاحب پابندی سے نماز پڑھانے نہیں آ پاتے اور لوگ امام صاحب کے علاوہ دیگر ائمہ کی اقتدا  میں نماز پڑھتے ہیں تو اس کی وجہ سے جمعہ کی نماز کی صحت پر کوئی اثر نہیں پڑے گا، اس مسجد میں ان ہی  امام صاحب کی اقتدا میں جمعہ کی نماز ادا کرنا بالکل درست ہے. فقط واللہ اعلم</p></p>",144105200236,banuri,"('نماز', 'salat')","('جمعہ کی نماز', 'jumaa')","('جمعہ و عیدین', 'juma-o-eidayn')"
02-12-2019,https://www.banuri.edu.pk/readquestion/کار-ڈرائیور-کسی-کو-غلطی-سے-کچل-دے-تو-دیت-کا-حکم-144104200104/02-12-2019,کار ڈرائیور کسی کو غلطی سے کچل دے تو دیت کا حکم,قصاص کا تناسب کیا ہے؟  یہ سوال امریکا سے ہے، ایک مسلمان عورت اپنی کار باہر لے جا رہی تھی اور ایک اور مسلمان عورت (جو 60 سال کی تھی)گزر رہی تھی، اس نے پیچھے نہیں دیکھا اور کار اس پر چڑھ گئی اور ڈرائیور خاتون ( جب وہ کار لے جارہی تھی)کے موبائل میں بات کرنے کی وجہ سے وہ موقع پر ہی دم توڑ گئی، اب معاملہ یہ ہے کہ  کتنا قصاص دیا جائے گا؟(دونوں فریقوں نے اتفاق کیا) براہِ کرم جلد سے جلد جواب دیں ، یہ معاملہ بہت ضروری ہے!,"<p><p style=""text-align:justify;"">صورتِ مسئولہ میں اگر  ڈرائیور  غلطی  سے غیر عمدی طور پر ایکسیڈنٹ کے ذریعہ اپنی سواری کے علاوہ کسی دوسرے کو قتل کردے تو یہ قتلِ خطا ہے، اس میں قصاص (یعنی بدلے میں قتل) لازم نہیں ہوتا، البتہ  کفارہ اور دیت دونوں لازم ہوں گے،  کفارے  کے طور پر اس ڈرائیور خاتون کو مسلسل ساٹھ روزے رکھنے پڑیں گے۔</p><p style=""text-align:justify;"">اور دیت کی ادائیگی اس ڈرائیور کی ""عاقلہ"" کے ذمہ ہے، عاقلہ سے مراد وہ جماعت، تنظیم یا کمیونٹی ہے جس کے ساتھ اس ڈرائیور کا تناصر (یعنی باہمی تعاون) کا تعلق ہو، یہ دیت تین سال میں ادا کی جائے گی، سونے کی صورت میں اگر دیت ادا کی جائے تو دیت کی مقدار ایک ہزار دینار اور درہم  کے اعتبار سے دس ہزار (۱۰،۰۰۰ ) درھم جس کا اندازا  جدید پیمانے سے 30.618 کلوگرام چاندی یا اس کی قیمت ہے۔</p><p style=""text-align:justify;"">البتہ اگر مرحوم کے اولیاء دیت کے بجائے اس سے کم پر  باہمی رضامندی سے صلح کرلیں تو یہ بھی جائز ہے۔</p><p style=""text-align:justify;""><span class=""ar_writing"">فتح القدير للكمال ابن الهمام (10/ 330):</span></p><p style=""text-align:justify;""><span class=""ar_writing"">""(قال:ومن قاد قطاراً فهو ضامن لما أوطأ)، فإن وطئ بعير إنساناً ضمن به القائد والدية على العاقلة؛ لأن القائد عليه حفظ القطار كالسائق وقد أمكنه ذلك وقد صار متعدياً بالتقصير فيه، والتسبب بوصف التعدي سبب للضمان، إلا أن ضمان النفس على العاقلة فيه وضمان المال في ماله (وإن كان معه سائق فالضمان عليهما) لأن قائد الواحد قائد للكل، وكذا سائقه لاتصال الأزمة، وهذا إذا كان السائق في جانب من الإبل، أما إذا كان توسطها وأخذ بزمام واحد يضمن ما عطب بما هو خلفه، ويضمنان ما تلف بما بين يديه لأن القائد لا يقود ما خلف السائق لانفصام الزمام، والسائق يسوق ما يكون قدامه"".</span></p><p style=""text-align:justify;""><span class=""ar_writing"">تکملة فتح الملهم (۲ ؍ ۵۲۳ ):</span></p><p style=""text-align:justify;""><span class=""ar_writing"">""ثم لم یذکر الفقهاء حکم السیارة لعدم وجودها في عصرهم. والظاهر أن سائق السیارة ضامن لما أتلفته في الطریق ، سواء أتلفته من القدام أو من الخلف. و وجه الفرق بینها و بین الدابة علی قول الحنفیة أن الدابة متحرکة بإرادتها، فلاتنسب نفحتها إلی راکبها، بخلاف السیارة، فإنها لاتتحرك بإرادتها ، فتنسب جمیع حرکاتها إلی سائقها، فیضمن جمیع ذلك، والله سبحانه و تعالیٰ أعلم"".</span></p><p style=""text-align:justify;""><span class=""ar_writing"">الدر المختار وحاشية ابن عابدين (رد المحتار) (6/ 530):</span></p><p style=""text-align:justify;""><span class=""ar_writing"">""(و) الثالث (خطأ وهو) نوعان: لأنه إما خطأ في ظن الفاعل ك (أن يرمي شخصا ظنه صيداً أو حربياً) أو مرتداً (فإذا هو مسلم أو) خطأ في نفس الفعل كأن يرمي (غرضاً) أو صيدا (فأصاب آدمياً) أو رمى غرضاً فأصابه ثم رجع عنه أو تجاوز عنه إلى ما وراءه فأصاب رجلاً أو قصد رجلاً فأصاب غيره أو أراد يد رجل فأصاب عنق غيره، ولو عنقه فعمد قطعاً أو أراد رجلاً فأصاب حائطاً ثم رجع السهم فأصاب الرجل فهو خطأ؛ لأنه أخطأ في إصابة الحائط ورجوعه سبب آخر والحكم يضاف لآخر أسبابه، ابن كمال عن المحيط. قال: وكذا لو سقط من يده خشبة أو لبنة فقتل رجلاً يتحقق الخطأ في الفعل ولا قصد فيه، فكلام صدر الشريعة فيه ما فيه. وفي الوهبانية: وقاصد شخص إن أصاب خلافه ... فذا خطأ والقتل فيه معذر</span></p><p style=""text-align:justify;""><span class=""ar_writing"">وقاصد شخص حالة النوم إن يمن ... فيقتص إن أبقى دما منه ينهر</span></p><p style=""text-align:justify;""><span class=""ar_writing"">(و) الرابع (ما جرى مجراه) مجرى الخطأ (كنائم انقلب على رجل فقتله) ؛ لأنه معذور كالمخطئ (وموجبه) أي موجب هذا النوع من الفعل وهو الخطأ وما جرى مجراه (الكفارة والدية على العاقلة) والإثم دون إثم القاتل إذ الكفارة تؤذن بالإثم لترك العزيمة"".</span></p><p style=""text-align:justify;""><span class=""ar_writing"">الفتاوى الهندية (4 / 260):<br/>
جوز الصلح عن جناية العمد والخطأ في النفس وما دونها إلا أنه لو صالح في العمد على أكثر من الدية جاز، كذا في الاختيار شرح المختار ويكون المال حالا على الجاني في ماله دون العاقلة، كذا في الحاوي.وفي الخطأ لو صالح على أكثر من الدية لايجوز، كذا في الاختيار شرح المختار"". </span> فقط واللہ اعلم</p></p>",144104200104,banuri,"('معاملات', 'muamlat')","('حدود / قصاص', 'hudood-qisas')","('قصاص و دیت', 'qisas-o-diyat')"
06-01-2020,https://www.banuri.edu.pk/readquestion/شیطان-نے-آدم-کی-قبر-کو-سجدہ-کیا-ھے-144105200288/06-01-2020,شیطان نے آدم علیہ السلام کی قبر کو سجدہ کیا ہے؟,شیطان نے آدم کی قبر کو سجدہ کیا ہے؟,"<p><p style=""text-align:justify;"">شیطان کا حضرت آدم علیہ السلام کی قبر کوسجدہ کرنا ثابت نہیں ہے۔ فقط واللہ اعلم</p></p>",144105200288,banuri,"('ایمان و عقائد', 'aqaed')","('اسلامی عقائد', 'islami-aqaed')","('انبیاء و رسل علیہم السلام', 'anbiya-o-rusul-alayhim-us-salam')"
30-11-2019,https://www.banuri.edu.pk/readquestion/دن-میں-لاٹھی-سے-حملہ-کرنے-والے-سے-قصاص-لینا-144104200062/30-11-2019,دن میں لاٹھی سے حملہ کرنے والے سے قصاص لینا,اگرایک شخص نے دوسر ے شخص پر شہر کے اندر دن میں لاٹھی سے حملہ کردیا اور مدِّمقابل نے اپنا دفاع کرتے ہوئے حملہ آور کو قتل کردیا ، تو فقہی عبارات سے معلوم ہوتا ہے کہ اس سے قصاص لیا جائے گا؛ کیوں کہ دن کے وقت مدد ملنے کی امیدہوتی ہے،لیکن موجودہ حالات میں بجائے اس کے کہ کوئی کسی کی مدد کو آئے ،لوگ اس کی ویڈیو بنانے میں مشغول ہوجاتے ہیں، اس مسئلہ میں غالباً صاحبین رحمہما اللہ کا موقف عدمِ قصاص کا ہے تو کیا صاحبین رحمہما اللہ کے مسلک پر عمل کیا جاسکتا ہے؟,"<p><p style=""margin-left:0;margin-right:0;text-align:justify;"">صورتِ مسئولہ میں اگرکوئی شخص دوسرے شخص  پر شہر کے اندر بڑی  لاٹھی سے حملہ کرتا ہے اور مدِّمقابل کو مدد ملنے کی امید نہ ہو اور اس نے اپنا دفاع  کرتے ہوئے حملہ آور کو قتل کردیا تو اسے قصاصاً قتل نہیں کیا جائے گا، بشرطیکہ حملہ آور کا مقصد اسے مارنا ہو اور وہ لاٹھی ایسی ہو جس سے  موت واقع ہوسکتی ہو۔</p><p style=""margin-left:0;margin-right:0;text-align:justify;""><span class=""ar_writing"">""(ويجب قتل من شهر سيفًا على المسلمين) يعني في الحال، كما نص عليه ابن الكمال حيث غيّر عبارة الوقاية فقال: ويجب دفع من شهر سيفًا على المسلمين ولو بقتله إن لم يمكن دفع ضرره إلا به، صرح به في الكفاية: أي <strong>لأنه من باب دفع الصائل، صرح به الشمني وغيره، ويأتي ما يؤيده (ولا شيء بقتله) بخلاف الحمل الصائل. (ولا) يقتل (من شهر سلاحًا على رجل ليلًا أو نهارًا في مصر أو غيره، أو شهر عليه عصًا ليلًا في مصر أو نهارًا في غيره فقتله المشهور عليه)، وإن شهر المجنون على غيره سلاحًا فقتله المشهور عليه (عمدًا تجب الدية) في ماله"".</strong> (رد المحتار، کتاب الجنايات، فصل فيما يوجب القود 6 / 545 ط:سعيد)</span></p><p style=""margin-left:0;margin-right:0;text-align:justify;""><span class=""ar_writing"">""(ومن شهر عصًا نهارًا في مصر فقتله المشهور عليه قتل به)؛ لأن العصا خفيفة، والغوث غير منقطع في المصر، فكان بالقتل معتديًا، وهذا عند أبي حنيفة رحمه الله تعالى ظاهر؛ لأنه ليس كالسلاح عنده، وقيل: عندهما يحتمل أن يكون على الخلاف المذكور في العمد؛ لأنه كالسلاح عندهما حتى يجب القصاص بالقتل به، وقد بيناه، وقيل: هذا في الزمان المتقدم، أما اليوم إذا شهر عليه العصا في مصر وقتله لا شيء عليه؛ لأن الناس تركوا الإغاثة والغوث"". (البحر الرائق، كتاب الجنايات، باب ما يوجب القصاص 8 / 344 ط: دار المعرفة)</span></p><p style=""margin-left:0;margin-right:0;text-align:justify;""><span class=""ar_writing"">""( ويجب القصاص على قاتل من شهر عصًا ) نهارًا في مصر؛ لأنه يلبث، فيمكن أن يلحقه الغوث، ويفرق بين العصا التي تلبث والتي لاتلبث بالصغر والكبر، فعند الإمامين العصا التي لاتلبث مثل السلاح في الحكم حيث لم يفرق فيها بين الليل والنهار والمصر وغيره"". (مجمع الأنهر، كتاب الجنايات، باب ما يوجب القصاص، 8 / 434 ط:<strong><span style=""color:#000;"">دار الكتب العلمية) </span></strong>فقط و الله أعلم</span></p></p>",144104200062,banuri,"('معاملات', 'muamlat')","('حدود / قصاص', 'hudood-qisas')","('قصاص و دیت', 'qisas-o-diyat')"
05-01-2020,https://www.banuri.edu.pk/readquestion/دبیر-نام-رکھنا-کیسا-ہے-144105200256/05-01-2020,دبیر نام رکھنا کیسا ہے؟,’’دبیر‘‘  نام رکھنا کیسا ہے؟  اور اس کے معنی کیا ہیں؟,"<p><p style=""text-align:justify;"">لغتِ عرب میں <span class=""ar_writing"">’’دَبِیْر‘‘ </span> کے کئی معانی ہو سکتے ہیں، اصلاً  پیچھے چھوڑی جانے والی چیز کو  دبیر کہا جاتا ہے،  اس لفظ کا ایک معنی اللہ تعالی کی نا فرمانی کرنے کے ہیں، کان کے اوپر والے حصے کے لیے بھی دبیر کا لفظ استعمال کیا جاتا ہے۔</p><p style=""text-align:justify;"">بہتر یہ ہے کہ یہ نام نہ رکھا جائے، بلکہ اس کی بجائے انبیاءِ کرام علیہم السلام یا صحابہ رضوان اللہ علیہم اجمعین کے اسماءِ گرامی میں سے کوئی نام رکھ لیا جائے، ایسے نام رکھنا باعثِ برکت ہے۔</p><p style=""text-align:justify;""><span class=""ar_writing"">لسان العرب (11/ 539):<br/>
""وما يعرف قبيلًا من دبير: يريد القبل والدبر، وقيل: القبيل طاعة الرب تعالى، والدبير معصيته، وقيل: معناه لايعرف الأمر مقبلًا ولا مدبرًا، وقيل: هو ما أقبلت به المرأة من غزلها حين تفتله وأدبرت، وقيل: القبيل من الفتل ما أقبل به على الصدر والدبير ما أدبر به عنه، وقيل: القبيل باطن الفتل والدبير ظاهره، وقيل: القبيل والدبير في فتل الحبل، فالقبيل الفتل الأول الذي عليه العامة، والدبير الفتل الآخر، وبعضهم يقول: القبيل في قوى الحبل كل قوة على قوة، وجهها الداخل قبيل والخارج دبير، وقيل: القبيل ما أقبل به الفاتل إلى حقوه، والدبير ما أدبر به الفاتل إلى ركبته، وقال المفضل: القبيل فوز القدح في القمار، والدبير خيبة القدح، وقال جماعة من الأعراب: القبيل أن يكون رأس ضمن النعل إلى الإبهام، والدبير أن يكون رأس الضمن إلى الخنصر، المحكم، وقيل: القبيل أسفل الأذن والدبير أعلاها، وقيل: القبيل القطن والدبير الكتان، وقيل: ما يعرف من يقبل عليه"".</span> فقط واللہ اعلم</p></p>",144105200256,banuri,"('حقوق و آدابِ معاشرت', 'huqooq-muashret')","('حقوق', 'bahmi-huqooq')","('اولاد کے حقوق', 'olad-ky-hoqoq')"
