issued_at,link,title,question,answer,fatwa_number,dar_ul_ifta,kitab,bab,fasal
12-11-2019,https://www.banuri.edu.pk/readquestion/عورت-کے-لیے-دوران-عدت-آفس-جانے-کا-حکم-144103200320/12-11-2019,عورت کے لیے دورانِ عدت آفس جانے کا حکم,طلاق یافتہ عورت دورانِ عدت ، نوکری کرنے کے لیے آفس جاسکتی ہے یا نہیں؟,"<p><p style=""text-align:justify;"">عدت کے دوران عورت کو بغیر شدیدجانی ومالی نقصان کے اندیشے کے گھر سے باہر جانے کی اجازت نہیں ہے؛ لہذا اگر مذکورہ خاتون اپنی ملازمت سے رخصت لے کر عدت کے ایام گھر پر گزارسکتی ہیں تو عدت میں ملازمت کے لیے جاناجائزنہیں، اور اگر خرچ کاکوئی انتظام نہ ہو ، صرف ملازمت ہی کی صورت میں خرچ چل سکتاہو تو اس صورت میں دن کے وقت میں بقدرِ ضرورت جانے کی اجازت ہوگی اور رات سے پہلے پہلے واپس اپنے گھر پر پہنچناضروری ہوگا۔</p><p style=""text-align:justify;""><span class=""ar_writing""><strong>""(قوله: ومعتدة الموت تخرج يوماً وبعض الليل ) لتكتسب لأجل قيام المعيشة؛ لأنه لا نفقة لها، حتى لو كان عندها</strong><strong>كفايتها صارت</strong><strong>كالمطلقة؛ فلايحل لها أن تخرج لزيارة ولا لغيرها ليلاً ولا نهاراً. والحاصل: أن مدار الحل كون خروجها بسبب قيام شغل المعيشة، فيتقدر بقدره، فمتى انقضت حاجتها لايحل لها بعد ذلك صرف الزمان خارج بيتها، كذا في فتح القدير"". </strong>(البحر الرائق : ٤/ ١٦٦، دارالمعرفة) فقط والله أعلم </span></p></p>",144103200320,banuri,"('طلاق', 'talaaq')","('عدت', 'iddat')","('عدت', 'iddat')"
12-11-2019,https://www.banuri.edu.pk/readquestion/عورتوں-کے-لیے-زیر-ناف-بالوں-کی-صفائی-میں-بلیڈ-قینچی-استعمال-کرنے-کا-حکم-144103200321/12-11-2019,عورتوں کے لیے زیرِ ناف بالوں کی صفائی میں بلیڈ / قینچی استعمال کرنے کا حکم,خواتین کے لیے زیرِ  ناف غیر ضروری بالوں  کی  صفائی بلیڈ سے یا قینچی سے  کرنا جائز ہے یا نا جائز؟,"<p><p style=""text-align:justify;"">مردوں کے لیے زیرِ  ناف بال استرے/ بلیڈ  وغیرہ سے صاف کرنا اور عورتوں کے لیے اکھاڑنا بہتر ہے،  عورتوں کے لیے  استرے/ بلیڈ   یاقینچی کا استعمال بھی درست ہے،  لیکن بہتر نہیں،  البتہ عورت ، عذر (جلد کی کسی بیماری، خارش یا بال اکھاڑنے میں تکلیف ) کی صورت میں بلیڈ / قینچی استعمال کرسکتی ہے۔ </p><p style=""text-align:justify;""><span class=""ar_writing"">""ويبتدئ في حلق العانة من تحت السرة، ولو عالج بالنورة في العانة يجوز، كذا في الغرائب"". (الفتاوی الهندیة، کتاب الکراهیة، الباب التاسع عشر في الختان والخصاء وحلق المرأة شعرها ووصلها شعر غيرها (5/358)<br/>
""وأما الاستحداد فهو حلق العانة سمي استحداداً؛ لاستعمال الحديدة وهي الموسى، وهو سنة، والمراد به نظافة ذلك الموضع، والأفضل فيه الحلق، ويجوز بالقص والنتف والنورة، والمراد بالعانة: الشعر الذي فوق ذكر الرجل وحواليه وكذاك الشعر الذي حوالي فرج المرأة"". (شرح النووي علی مسلم، کتاب الطهارة، باب خصال الفطرة (3/148) ط: دار إحياء التراث العربي - بيروت) فقط والله أعلم </span></p></p>",144103200321,banuri,"('حقوق و آدابِ معاشرت', 'huqooq-muashret')","('لباس / وضع قطع', 'libass-waza-qata')","('بالوں کے احکام و آداب', 'baloon-k-ahkam-o-aadab')"
12-11-2019,https://www.banuri.edu.pk/readquestion/حالت-جنابت-میں-قرآن-کریم-یا-درود-پڑھنا-144103200326/12-11-2019,حالتِ جنابت میں قرآنِ کریم یا درود پڑھنا,بیوی سے ہم بستری کے بعد اگر غسل نہیں کیا ہو تو کیا قرآنِ کریم کی کوئی سورت یا کوئی درود شریف جو زبانی یاد ہو،  پڑھ سکتے ہیں یا نہیں؟,"<p><p style=""margin-right:0;text-align:justify;"">حالتِ  جنابت میں قرآنِ  کریم چھوئے  بغیر  زبانی تلاوت بھی جائز نہیں۔   البتہ قرآنِ پاک کی وہ آیات جو دعا کے معنیٰ پر مشتمل ہوں (مثلاً: آیۃ الکرسی یا قرآنی دعائیں وغیرہ) انہیں دعا یا وِرد کی نیت سے پڑھنے کی،  اسی طرح درود شریف پڑھنے کی گنجائش ہے، تاہم اس کے لیے بھی مستحب ہے ان اَذکار سے پہلے وضو کرلیا جائے۔</p><p><span class=""ar_writing"">الفتاوى الهندية (2 / 44):</span></p><p><span class=""ar_writing"">""( ومنها) حرمة قراءة القرآن، لاتقرأ الحائض والنفساء والجنب شيئاً من القرآن، والآية وما دونها سواء في التحريم على الأصح، إلا أن لايقصد بما دون الآية القراءة مثل أن يقول: الحمد لله يريد الشكر أو بسم الله عند الأكل أو غيره فإنه لا بأس به"".</span></p><p><span class=""ar_writing"">الدر المختار وحاشية ابن عابدين (1 / 293):</span></p><p><span class=""ar_writing"">""(ولا بأس) لحائض وجنب (بقراءة أدعية ومسها وحملها وذكر الله تعالى، وتسبيح)"".</span></p><p><span class=""ar_writing""><strong>و في الرد:</strong></span></p><p><span class=""ar_writing""><strong>""(قوله: ولا بأس) يشير إلى أن وضوء الجنب لهذه الأشياء مستحب، كوضوء المحدث"".</strong></span> فقط واللہ اعلم</p></p>",144103200326,banuri,"('طہارت', 'taharat')","('حیض، نفاس، استحاضہ', 'hayz-nifas-istihaza')","('جنابت ، حیض اور نفاس کے احکام', 'janabat-hayz-or-nifas-k-ahkam')"
29-10-2019,https://www.banuri.edu.pk/readquestion/جس-گوشت-کے-شرعی-طور-پر-ذبح-ہونے-کا-یقین-نہ-ہو-اس-کے-کھانے-کا-حکم-144102200376/29-10-2019,جس گوشت کے شرعی طور پر ذبح ہونے کا یقین نہ ہو اس کے کھانے کا حکم,جس گوشت کے بارے میں یقین نہ ہو کہ یہ حلال ہے یا نہیں؟ ( مثلاً اس پر تکبیر پڑھی گئی ہے یا نہیں؟ ) تو اس کو کھانا چاہیے  یا نہیں؟,"<p><p style=""text-align:justify;"">اسلامی ملک کا ذبیحہ ہو یا جس جگہ یقینی طور پر معلوم ہوکہ ذبح کرنے والے مسلمان ہیں، وہاں بلادلیل شک و شبہ نہیں کرنا چاہیے، ایسا گوشت کھانا حلال ہوگا۔ البتہ اگر یقین سے معلوم ہوجائے کہ مسلمان نے شرعی طریقے پر ذبح نہیں کیاتو وہ گوشت حلال نہیں ہوگا۔</p><p style=""text-align:justify;"">اور اگر غیر مسلم ملک ہو یا ایسا علاقہ ہو جہاں غیر مسلم کے ذبیحہ کا بھی احتمال ہو  تو جب تک یقینی طور پر یہ معلوم نہ ہوجائے کہ یہ جانور شرعی طور پر ذبح کیا گیا ہے، اس کا کھانا جائز نہیں ہے۔  جہاں معتمد اور دین دار مسلمان ذبیحے کے حلال اور شرعی ہونے کی شہادت  دیں تو ان کی خبر پر اعتماد کر کے کھالینا چاہیے، اور بلاوجہ شکوک وشبہات اوروہم کا شکار رہنا مناسب نہیں۔</p><p style=""text-align:justify;""><span class=""ar_writing"">الفتاوى الهندية (3/ 210):<br/>
""رجل اشترى من التاجر شيئاً، هل يلزمه السؤال أنه حلال أم حرام؟ قالوا: ينظر إن كان في بلد و زمان كان الغالب فيه هو الحلال في أسواقهم ليس على المشتري أن يسأل أنه حلال أم حرام، ويبنى الحكم على الظاهر، وإن كان الغالب هو الحرام أو كان البائع رجلاً يبيع الحلال والحرام يحتاط ويسأل أنه حلال أم حرام"".</span></p><p style=""text-align:justify;""><span class=""ar_writing"">غمز عيون البصائر - (1 / 384):<br/>
""اعلم أن الشك على ثلاثة أضرب: شك طرأ على أصل حرام، وشك طرأ على أصل مباح، وشك لايعرف أصله، فالأول، مثل: أن يجد شاةً مذبوحةً في بلد فيها مسلمون ومجوس؛ فلاتحل، حتى يعلم أنها ذكاة مسلم؛ لأن أصلها حرام، وشككنا في الذكاة المبيحة، فلو كان الغالب فيها المسلمين جاز الأكل عملًا بالغالب المفيد"".</span>فقط واللہ اعلم </p></p>",144102200376,banuri,"('حظر و اباحت', 'mamnooaat-mubahat')","('ماکولات / مشروبات', 'makoolat-mashroobat')","('کھانے پینے کی حلال و حرام ، مکروہ و مباح اشیاء', 'khanay-penay-ki-halal-o-haram-makroh-o-mubah-ashya')"
15-04-2018,https://www.banuri.edu.pk/readquestion/کیا-لا-رهبانية-في-الإسلام-حدیث-ہے-2/15-04-2018,کیا لارھبانیۃ فی الاسلام حدیث ہے؟,حدیث’’لا رهبانیة في الإسلام‘‘حدیث  کی کس کتاب میں ہے؟  اور اس کا درجہ کیاہے؟  نیز علامہ ابن حجر عسقلانی  رحمہ اللہ کا یہ فرمان کہ : یہ روایت مجھ  تک ان الفاظ سے نہیں پہنچی، کا کیا مطلب ہے؟,"<p><p style=""text-align:justify;""><span class=""ar_writing"">""لا رهبانية في الإسلام""</span> کے الفاظ حدیث کی کسی بھی معتمد  کتاب سے ثابت نہیں۔  حافظ ابن حجر رحمہ اللہ کے کلام کا بھی یہی مطلب ہے کہ بعینہ ان الفاظ کے ساتھ  میں نے کوئی روایت نہیں دیکھی۔  اس لیے بعینہ ان الفاظ کو  حدیث کہہ کر بیان کرنا جائز نہیں۔</p><p style=""text-align:justify;"">البتہ دیگر ثابت شدہ روایات  کی روشنی میں معنوی اعتبار سے یہ بات درست ہے کہ اسلام میں رہبانیت نہیں ہے، یعنی اس کا مضمون ثابت ہے، یہ الفاظ بطورِ حدیث ثابت نہیں ہیں، اس لیے اگر کسی نے رسول اللہ ﷺ کی طرف نسبت کیے بغیر یہ بات کہی یا روایت بالمعنیٰ کہہ کر بیان کیا تو یہ ممانعت میں داخل نہیں ہوگا۔</p><p style=""text-align:justify;""><span class=""ar_writing"">""وَأَمَّا حَدِيثُ لَا رَهْبَانِيَّةَ فِي الْإِسْلَامِ فَلَمْ أَرَهُ بِهَذَا اللَّفْظِ، لَكِنْ فِي حَدِيثِ سَعْدِ بْنِ أَبِي وَقَّاصٍ عِنْدَ الطَّبَرَانِيِّ: إِنَّ اللَّهَ أَبْدَلَنَا بِالرَّهْبَانِيَّةِ الْحَنِيفِيَّةَ السمحة. وَعَن ابن عَبَّاسٍ رَفَعَهُ: لَا صَرُورَةَ فِي الْإِسْلَامِ. أَخْرَجَهُ أَحْمَدُ وَأَبُو دَاوُدَ وَصَحَّحَهُ الْحَاكِمُ . وَفِي الْبَابِ حَدِيثُ النَّهْيِ عَنِ التَّبَتُّلِ، وَسَيَأْتِي فِي بَابٍ مُفْرَدٍ"" . (فتح الباري : ٩/ ١١١) فقط والله أعلم</span></p></p>",143907200141,banuri,"('علوم و فنون', 'uloom-funoon')","('حدیث و سنت', 'hadees-sunnat')","('حدیث کا معنی، مفہوم اور اقسام', 'hadees-ka-mana-mafhom-aur-aqsaam')"
11-09-2019,https://www.banuri.edu.pk/readquestion/ڈی-ایکس-این-کمپنی-کا-حکم-144012201134/11-09-2019,ڈی ایکس این کمپنی کا حکم,آج کل ایک ملٹی نیشنل کمپنی ’’ڈی ایکش این‘‘  کے نام سے خاصی مشہور ہے جو کہ مختلف طبی ادویہ بیچتی ہے اور یہ ادویہ کے اجزاء حلال ہوتے ہیں، لیکن اپنے پراڈکٹس کی سیل بڑھانے کے لیے وہ مختلف لوگوں کو اپنا ممبر شپ دیتی ہے اور ہر ممبر کا ایک اپنا الگ سا کوڈ ہوتا ہے، اب یہ ممبر مریض ڈھونڈ کر اس مریض کو اپنے اس کوڈ کا حوالہ دے کر کمپنی کی ادویہ جس ڈاکٹر یا حکیم کے پاس ہو ادھر بھیج کر علاج کروا کر اس پر ادویہ فروخت کرتا ہے، چنانچہ جتنی ادویہ وہ مریض خریدتا ہے اسی تناسب یعنی فیصدی سے اس ممبر کو کمپنی اپنی طرف سے بونس دیتی ہے ،جب کہ یہ بونسز اگر ماہانہ سیل بڑھے تو اور بھی بڑھتا ہے، کیا اس طرح سے کمپنی کی ممبر شپ حاصل کرکے کمانا درست ہے یا نہیں ؟,"<p><p style=""margin-left:0;margin-right:0;text-align:justify;"">ہماری معلومات کے مطابق ’’ڈی ایکس این‘‘ (DXN) کمپنی ملٹی لیول مارکیٹنگ کے اصول پر کمیشن دیتی ہے،  یعنی اگر ایک ممبر کسی شخص کو  کمپنی کی  پروڈکٹس کا خریدار بنائے  اور وہ کسٹمر بھی اس کمپنی کا ممبر بن جائے تو اسے اولاً اس مریض کا کمیشن ملے گا، اس کے بعد یہ نیا ممبر جب آگے کسی تیسرے شخص کو کمپنی کے پروڈکٹ کا خریدار بنائے تو اس پہلے شخص کو بھی اس کا کمیشن ملے گا۔اور اسی طرح دیگر بونس بھی پہلے شخص کو اس بنا  پر ملتے ہیں کہ اس نے اور اس کے ماتحت کسٹمرز نے کتنا کام کیا ہے، پس اس طرح کی مارکیٹنگ کا حکم یہ ہے کہ پہلے شخص نے براہِ راست جس شخص کو کمپنی کا خریدار بنایا ہے اس کی بنا پر کمیشن لینا جائز ہے، باقی وہ جس کو آگے خریدار بنائے گا اس کے اس عمل کا کمیشن  پہلے شخص کے لیے لینا جائز نہیں، کیوں کہ کمیشن اپنے کام کی اجرت لینا ہے،  جس شخص کو آپ نے خریدار بنا ہے اس کا کمیشن لینا تو جائز ہے، لیکن اس نے آگے جس کو خریدار بنایا ہے اس کا کمیشن لینا آپ کے لیے جائز نہیں، کیوں کہ اس میں آپ کی محنت نہیں پائی جارہی۔</p><p style=""margin-left:0;margin-right:0;text-align:justify;""><span class=""ar_writing"">الدر المختار وحاشية ابن عابدين (رد المحتار) (6/ 63):</span></p><p style=""margin-left:0;margin-right:0;text-align:justify;""><span class=""ar_writing"">""وفي الحاوي: سئل محمد بن سلمة عن أجرة السمسار، فقال: أرجو أنه لا بأس به وإن كان في الأصل فاسداً؛ لكثرة التعامل وكثير من هذا غير جائز، فجوزوه لحاجة الناس إليه كدخول الحمام"". </span> فقط واللہ اعلم</p></p>",144012201134,banuri,"('معاملات', 'muamlat')","('بیع / تجارت', 'bay-tijarat')","('اجارہ اور کرایہ کے احکام', 'ijara-or-kiraya-k-ahkam')"
09-11-2019,https://www.banuri.edu.pk/readquestion/نکاح-میں-شوہر-کی-فجر-کی-نماز-کی-پابندی-کو-مہر-بنانا-144103200248/09-11-2019,نکاح میں شوہر کی فجر کی نماز کی پابندی کو مہر بنانا,ایک خاتون نے اپنے نکاح میں مہر  شوہر سے فجر کی پابندی مانگی ہے،  تو کیا ایسا کرنا کہاں تک صحیح ہے ؟,"<p><p style=""text-align:justify;"">مہر کے لیے مالِ متقوم (یعنی وہ چیز جس کا قیمت والا مال ہونا شرع اور عرف میں مسلم ہو) کا ہونا ضروری ہے،  اور اس کی کم از کم مقدار دس درہم  ہے، قرآن مجید میں ہے :</p><p style=""text-align:justify;""><span class=""ar_writing"">{وَأُحِلَّ لَكُمْ مَا وَرَاءَ ذَلِكُمْ أَنْ تَبْتَغُوا بِأَمْوَالِكُمْ } [النساء: 24]</span></p><p style=""text-align:justify;"">ترجمہ : اور ان (عورتوں) کے سوا ( اور عورتیں) تمہارے  لیے حلال کی گئیں ہیں (یعنی یہ) کہ تم ان کو اپنے مالوں کے ذریعہ سے چاہو ۔  (از بیان القرآن)</p><p style=""text-align:justify;"">جب کہ نماز کی پابندی شرعاً مال نہیں ہے، لہذا اس میں مہر بننے کی صلاحیت نہیں ہے،  اگر نکاح میں اس کو مہر رکھ دیا تو نکاح تو ہوجائے گا،  لیکن شوہر پر عورت کا مہر مثل لازم ہوگا، (یعنی اس لڑکی کے باپ کے خاندان کی وہ لڑکیاں جو مال، جمال، دین، عمر، عقل، زمانہ، شہر، بکارت، ثیبہ وغیرہ  ہونے میں اس کے برابر ہوں، ان کا جتنا مہر  تھا اس کا بھی اتنا مہر  ہوگا)۔</p><p style=""text-align:justify;"">البتہ مہر کے تقرر کے ساتھ ساتھ  نکاح کے لیے شوہر سے نمازِ فجر کی پابندی کا وعدہ لیا جاسکتا ہے، اور مرد پر ویسے بھی فجر کی نماز فرض ہے،  بیوی کہے یا نہ کہے بہر صورت اس کا پڑھنا ضروری ہے، ورنہ اللہ تعالیٰ کے یہاں اس کی باز پرس ہوگی۔</p><p style=""text-align:justify;""><span class=""ar_writing"">الدر المختار وحاشية ابن عابدين (رد المحتار) (3 / 101):<br/>
""(أقله عشرة دراهم)؛ لحديث البيهقي وغيره: «لا مهر أقل من عشرة دراهم»، ورواية الأقل تحمل على المعجل. </span></p><p style=""text-align:justify;""><span class=""ar_writing"">(قوله: لحديث البيهقي وغيره) رواه البيهقي بسند ضعيف، رواه ابن أبي حاتم، وقال الحافظ ابن حجر: إنه بهذا الإسناد حسن، كما في فتح القدير في باب الكفاءة (قوله: ورواية الأقل إلخ) أي ما يدل بحسب الظاهر من الأحاديث المروية على مجاز التقدير بأقل على عشرة، وكلها مضعفة إلا حديث: «التمس ولو خاتماً من حديد»، يجب حملها على أنه المعجل، وذلك لأن العادة عندهم تعجيل بعض المهر قبل الدخول، حتى ذهب بعض العلماء إلى أنه لايدخل بها حتى يقدم شيئاً لها تمسكاً «بمنعه صلى الله عليه وسلم علياً أن يدخل بفاطمة - رضي الله عنها - حتى يعطيها شيئاً، فقال: يا رسول الله ليس لي شيء، فقال أعطها درعك، فأعطاها درعه». رواه أبو داود والنسائي، ومعلوم أن الصداق كان أربعمائة درهم وهي فضة، لكن المختار الجواز قبله؛ لما روت «عائشة -رضي الله تعالى عنها- قالت: أمرني رسول الله صلى الله عليه وسلم أن أدخل امرأةً على زوجها قبل أن يعطيها شيئاً» رواه أبو داود؛ فيحمل المنع المذكور على الندب: أي ندب تقديم شيء إدخالاً للمسرة عليها تألفاً لقلبها، وإذا كان ذلك معهوداً وجب حمل ما خالف ما رويناه عليه جمعاً بين الأحاديث.<br/>
وهذا وإن قيل: إنه خلاف الظاهر في حديث: «التمس ولو خاتماً من حديد»، لكن يجب المصير إليه؛ لأنه قال فيه بعده: زوجتكها بما معك من القرآن، فإن حمل على تعليمه إياها ما معه أو نفي المهر بالكلية عارض كتاب الله تعالى وهو قوله تعالى: أن تبتغوا بأموالكم} [النساء: 24]،  فقيد الإحلال بالابتغاء بالمال، فوجب كون الخبر غير مخالف له وإلا لم يقبل لأنه خبر واحد، وهو لاينسخ القطعي في الدلالة، وتمام ذلك مبسوط في الفتح"". </span> فقط واللہ اعلم</p></p>",144103200248,banuri,"('نکاح', 'nikah')","('مہر', 'meher')","('مہر کا حکم', 'mehr-jehez-barat')"
