issued_at,link,title,question,answer,fatwa_number,dar_ul_ifta,kitab,bab,fasal
19-10-2019,https://www.banuri.edu.pk/readquestion/جہیز-لینے-کے-متعلق-سوچ-رکھنا-144102200072/19-10-2019,جہیز لینے کے متعلق سوچ رکھنا,میں نے دسمبر میں اپنی شادی پکی کرلی، میرے حالات ایسے ہیں کہ میں اپنی بیوی کو خوش رکھ سکتا ہوں، لیکن میرے گھر والے اور خاندان والے چاہتے ہیں کہ میں جہیز لوں تو میں چاہتا ہوں کہ مجھے کوئی ایسی بات بتائیں کہ میں اپنے گھر والوں کو سمجھا سکوں،  میں ماہانہ 25000 کماتا ہوں،  مجھے زور اس بات کا دیا جارہا ہے کہ ان کے گھر سے اچھا سامان آئے گا۔,"<p><p style=""margin-left:0;margin-right:0;text-align:justify;"">دلہن کو اس کے گھر والوں کی طرف سے جو سامان تحفہ میں دیا جاتا ہے وہ ""جہیز""  ہے،  اور دلہن کو اس کے گھر والے جو کچھ خوشی سے دینا چاہیں وہ ان کی صواب دید پر ہے، اور بطورِ تحفہ لڑکی کو دیا گیا یہ سامان لڑکی کی ملکیت ہوتاہے۔  اس سلسلے میں لڑکے والوں کی طرف سے ""جہیز""  دینے کادباؤ یا جہیز کا مطالبہ یاجہیز کا سامان ملنے کی لالچ رکھنا انتہائی قبیح اور غیر اخلاقی سوچ ہے، شریعت نے اس کی حوصلہ شکنی کی ہے؛ لہذا آپ اپنے گھر والوں کو یہ بتائیں کہ اللہ کی دی ہوئی نعمتوں پر شکر کرتے ہوئے قناعت سے زندگی گزارنا اللہ کو پسند ہے، اور دوسروں کے مال پر طمع بھری نظر جمائے رکھنا بہت نامناسب عمل ہے،  جس سے اجتناب کرنا چاہیے۔</p><p style=""margin-left:0;margin-right:0;text-align:justify;""><span class=""ar_writing"">الفتاوى الهندية (1 / 327):</span></p><p style=""margin-left:0;margin-right:0;text-align:justify;""><span class=""ar_writing"">""لو جهز ابنته وسلمه إليها ليس له في الاستحسان استرداد منها، وعليه الفتوى"".</span> فقط واللہ اعلم</p></p>",144102200072,banuri,"('نکاح', 'nikah')","('نکاح کی رسومات', 'nikah-ki-rusomaat')","('شادی سے متعلق متفرق رسوم', 'nikah-ki-taqreeb-sunnatayn-or-rusomat')"
11-11-2019,https://www.banuri.edu.pk/readquestion/مسجد-میں-صدقات-خیرات-اور-عطیات-کی-رقم-دینا-144103200287/11-11-2019,مسجد میں صدقات، خیرات اور عطیات  کی رقم دینا,مساجد کی تعمیر میں (زکات) کے علاوہ صدقہ-خیرات-نفلی-رقم کا استعمال درست ہے ؟ اور حلال آمدنی میں سے کس طرح کی نیت کرنے سے مساجد کے لیے قابل استعمال ہے؟,"<p><p style=""text-align:justify;"">زکات اور صدقاتِ واجبہ (کفارہ، فطرہ، نذر وغیرہ )  کے علاوہ نفلی صدقات، عطیات کی رقم مسجد میں دی جاسکتی ہے، اور جو حلال اور پاکیزہ آمدنی مسجد میں دی جائے وہ قابلِ استعمال ہے، قابلِ استعمال بنانے کے لیے کسی خاص نیت کی ضرورت نہیں ہوتی، البتہ اس کی قبولیت کے لیے یہ ضرور خیال رکھنا چاہیے کہ وہ خالص اللہ کی رضا کے لیے دی جائے اور اس میں ریا، اور دکھاوے کا کوئی شائبہ نہ ہو۔فقط واللہ اعلم</p></p>",144103200287,banuri,"('زکات', 'zakat')","('زکوٰۃ / صدقات', 'zakat-sadaqat')","('نفلی صدقات', 'nafli-sadaqat')"
11-11-2019,https://www.banuri.edu.pk/readquestion/آزاد-ہے-تو-کہنے-سے-طلاق-کا-حکم-144012201955/11-11-2019,شادی میں جانے کے لیے اصرار کرنے پر بیوی کو آزاد کہنا,زید  کی بیوی اپنی سہیلی کی شادی میں جانے کے لیے  ضد کر رہی تھی جب کہ زید منع کر رہا تھا، جب وہ نہیں مانی تو زید نے کہہ دیا کہ تیری مرضی،  آزاد ہے تو ، میں کچھ نہیں کہوں گا، جب کہ زید کی نیت طلاق کی بالکل نہیں تھی  تو کیا مذکورہ صورت میں طلاق ہوگی یا نہیں؟,"<p><p style=""text-align:justify;"">واضح رہے کہ لفظِ "" آزاد"" ہمارے عرف میں وقوعِ طلاق کے اعتبار سے صریح ہے، یعنی اگر کوئی شخص اپنی بیوی کو ""آزاد""  کہتا ہے تو اس سے اس کی بیوی پر ایک طلاقِ  بائن واقع ہوجائے گی اور نکاح ٹوٹ جائے گا،  لیکن لفظِ آزاد  سے طلاق کا وقوع اس شرط کے ساتھ مشروط ہے کہ کوئی ایسا لفظی یا معنوی قرینہ موجود نہ ہو جو طلاق کے عدمِ وقوع پر دلالت کرتا ہو ، مثلا :’’تم آزاد ہو جو چاہو پہنو،جو چاہو پہنو ‘‘عدمِ وقوع طلاق کا قرینہ ہے، اس لیے طلاق واقع نہیں ہو گی۔</p><p style=""text-align:justify;"">لہذا صورتِ مسئولہ میں شوہر نے جب یہ کہا: "" تیری مرضی، آزاد ہے تو ،  میں کچھ نہیں کہوں گا""، اس سے مراد  چوں کہ شادی میں جانے کی اجازت دینا تھا،  اس لیے طلاق واقع نہیں ہوئی۔فقط واللہ اعلم</p></p>",144012201955,banuri,"('طلاق', 'talaaq')","('وقوع طلاق وعدم وقوع طلاق', 'wuqoo-e-talaq-o-adme-wuqoo-e-talaq')","('طلاق صریح اور کنائی', 'talaq-e-sarih-or-kinai')"
11-11-2019,https://www.banuri.edu.pk/readquestion/محرم-کی-عدم-موجودگی-میں-عورت-کو-دفنانے-کے-لیے-قبر-میں-کون-اتارے-گا-144012201952/11-11-2019,محرم کی عدم موجودگی میں عورت کو دفنانے کے لیے قبر میں کون اتارے گا؟,جس عورت کا کوئی محرم نہ ہو،  اس کی وفات کے بعد اس کو قبر میں کون اتارے گا?,"<p><p style=""text-align:justify;"">صورتِ  مسئولہ میں اگر عورت کی میت کو قبر میں دفنانے کے لیے اس کا کوئی نسبی، رضاعی، یا سسرالی محرم موجود نہ ہو تو  محرم کے علاوہ دیگر رشتہ داروں میں جو  نیک بزرگ لوگ موجود ہوں وہ عورت کو قبر میں اتارسکتے ہیں،  اور اگر وہ بھی نہ ہو  یا  کافی نہ ہوں تو پھر نیک جوان افراد بھی عورت کو قبر میں اتارسکتے ہیں، اگر کوئی غیر محرم رشتہ دار بھی نہ ہو  تو پھر اجنبی نیک لوگ عورت کو قبر میں اتارسکتے ہیں۔</p><p style=""text-align:justify;""><span class=""ar_writing"">خلاصة الفتاوي (1/225):</span></p><p style=""text-align:justify;""><span class=""ar_writing"">""المرأة إذا ماتت، وليس لها محرم فأهل الصلاح من جيرانها يلي دفنها ... فان كان من المحارم من النسب او الرضاع او من جهة المصاهرة مثل ابن زوجها نزل قبرها، وان لم يكن نزل المشايخ فان لم يكن فالشبان الصلحاء"".</span></p><p style=""text-align:justify;""><span class=""ar_writing"">تبيين الحقائق شرح كنز الدقائق  (1/ 245):<br/>
""فرع: قال الولوالجي: المرأة إذا ماتت، وليس لها محرم فأهل الصلاح من جيرانها يلي دفنها، ولايدخل أحد من النساء القبر؛ لأن مس الأجنبي إياها فوق الثوب يجوز عند الضرورة في حال الحياة فكذا بعد الوفاة. اهـ"".</span></p><p style=""text-align:justify;""><span class=""ar_writing"">الفتاوى الهندية (1/ 166):<br/>
""ويستحب أن يكونوا أقوياء أمناء وصلحاء، كذا في التتارخانية. وذو الرحم المحرم أولى بإدخال المرأة من غيرهم، كذا في الجوهرة النيرة. وكذا ذو الرحم غير المحرم أولى من الأجنبي، فإن لم يكن فلا بأس للأجانب وضعها، كذا في البحر الرائق. ولايدخل أحد من النساء القبر، كذا في محيط السرخسي"". </span> فقط واللہ اعلم</p></p>",144012201952,banuri,"('جنائز', 'janaiz')","('نماز جنازہ', 'namaz-e-jinazah')","('جنازہ اور نماز جنازہ کے احکام (فرائض، سنن، مستحبات، مکروہات)', 'janaza-or-namaz-e-janaza')"
11-11-2019,https://www.banuri.edu.pk/readquestion/ڈیری-فارم-کی-زکو-ۃ-کا-حکم-144012201954/11-11-2019,ڈیری فارم کی زکاۃ کا حکم,میں ایک ڈیری فارمر ہوں،  میرے پاس 60 چھوٹے بڑے جانور ہیں،  ان پر زکاۃ کا کیا حکم ہے؟,"<p><p style=""text-align:justify;"">جانوروں پر زکاۃ واجب ہونے کی من جملہ شرائط میں سے ایک شرط  ان کا  ’’سائمہ‘‘ ہونا بھی ہے، ڈیری فارم میں جو گائیں دودھ کے حصول کے لیے پالی جاتی ہیں، ان کو چوں کہ چارہ خود خرید کر کھلایا جاتا ہے؛  اس لیے وہ ’’سائمہ‘‘ جانور نہیں ہیں؛  لہٰذا  ڈیری فارم کی گائے پر  زکاۃ واجب نہیں ہے،  البتہ ڈیری فارم کی گائے سے جو دودھ حاصل ہوگا اس کی آمدنی اگر نصاب کے برابر یا اس سے زیادہ ہو  یا دیگر اموالِ زکاۃ کے ساتھ مل کر نصاب سے زیادہ ہو یا پہلے سے صاحبِ نصاب ہو  تو  سال گزرنے کی صورت میں  اس مال میں سے ڈھائی  فی صد  زکاۃ واجب ہوگی۔</p><p style=""text-align:justify;""><span class=""ar_writing"">الدر المختار وحاشية ابن عابدين (رد المحتار) (2/ 275):</span></p><p style=""text-align:justify;""><span class=""ar_writing"">""باب السائمة (هي) الراعية، وشرعاً (المكتفية بالرعي) المباح، ذكره الشمني (في أكثر العام لقصد الدر والنسل) ذكره الزيلعي، وزاد في المحيط (والزيادة والسمن) ليعم الذكور فقط، لكن في البدائع لو أسامها للحم فلا زكاة فيها كما لو أسامها للحمل والركوب ولو للتجارة ففيها زكاة التجارة ولعلهم تركوا ذلك لتصريحهم بالحكمين (فلو علفها نصفه لاتكون سائمةً) فلا زكاة فيها للشك في الموجب.</span></p><p style=""text-align:justify;""><span class=""ar_writing""> (قوله: ولعلهم تركوا ذلك) أي ترك أصحاب المتون من تعريف السائمة ما زاده المصنف تبعاً للزيلعي والمحيط؛ لتصريحهم أي تصريح التاركين لذلك بالحكمين: أي بحكم ما نوى به التجارة من العروض الشاملة للحيوانات وبحكم المسامة للحمل والركوب، وهو وجوب زكاة التجارة في الأول، وعدمه في الثاني، فلايرد على تعريفهم بأنها المكتفية بالرعي في أكثر العام أنه تعريف بالأعم، أفاده في البحر. وحاصله: أن القيدين المذكورين في الزيلعي والمحيط ملحوظان في التعريف المذكور بقرينة التصريح المزبور، فلايكون تعريفاً بالأعم، على أن التعريف بالأعم إنما لايصح على رأي المتأخرين من علماء الميزان، وإلا فالمتقدمون وأهل اللغة على جوازه، وبه اندفع قول النهر: إن هذا غير دافع؛ إذ التعريف بالأعم لايصح ولاينفع فيه ذكر الحكمين بعده اهـ تأمل""</span>. فقط واللہ اعلم</p><p style=""text-align:justify;"">جانوروں میں زکوٰۃ واجب ہونے کی تفصیل کے لیے درج ذیل لنک پر جامعہ کا فتویٰ ملاحظہ کیا جاسکتا ہے :</p><p style=""text-align:justify;""><a href=""https://www.banuri.edu.pk/readquestion/%DA%AF%D8%A7%D8%A6%DB%92-%D8%A8%DA%BE%DB%8C%D9%86%D8%B3-%DA%A9%DB%8C-%D8%B2%DA%A9%D8%A7%D8%AA-2/21-05-2018"">گائے ، بھینس کی زکات</a></p></p>",144012201954,banuri,"('زکات', 'zakat')","('زکوٰۃ / صدقات', 'zakat-sadaqat')","('جانوروں کی زکوٰۃ', 'janwaron-ki-zakat')"
09-10-2019,https://www.banuri.edu.pk/readquestion/ایک-رات-میں-بیوی-سے-دو-دفعہ-ہم-بستری-کے-بعد-ایک-دفعہ-غسل-کرنا-واجب-ہے-144012201718/09-10-2019,ایک رات میں بیوی سے دو دفعہ ہم بستری کے بعد ایک دفعہ غسل کرنا واجب ہے,بیوی کے ساتھ ایک ہی رات میں دو دفعہ ہم بستری کرنے پر دو دفعہ غسل کرنا پڑتا ہے  یا نہیں؟,"<p><p style=""margin-left:0;margin-right:0;text-align:justify;"">بیوی کے ساتھ ایک ہی رات میں دو دفعہ ہم بستری کرنے پر ایک ہی غسل کرلینا کافی ہے۔</p><p style=""margin-left:0;margin-right:0;text-align:justify;""><span class=""ar_writing"">مرقاة المفاتيح شرح مشكاة المصابيح (2 / 435):</span></p><p style=""margin-left:0;margin-right:0;text-align:justify;""><span class=""ar_writing"">""(وعن أنس قال: كان النبي صلى الله عليه وسلم) : أي: أحيانا ("" يطوف "") : أي: يدور (على نسائه) حين يجامعهن (بغسل واحد)"". </span>فقط وا للہ اعلم</p></p>",144012201718,banuri,"('طہارت', 'taharat')","('حیض، نفاس، استحاضہ', 'hayz-nifas-istihaza')","('جنابت ، حیض اور نفاس کے احکام', 'janabat-hayz-or-nifas-k-ahkam')"
11-11-2019,https://www.banuri.edu.pk/readquestion/غصہ-میں-کفریہ-الفاظ-کہنے-سے-تجدید-ایمان-ونکاح-کا-حکم-144012201958/11-11-2019,غصہ میں کفریہ الفاظ کہنے سے تجدیدِ ایمان ونکاح کا حکم,کل میں نے غصہ میں کفر یہ الفاظ بول د یے ہیں،  میری بیوی اور میری بہن مجھے نماز پڑھنے کے لیے  بول رہی تھیں،  میں نماز پڑھتا ہوں اور اس وقت بھی میں خود بھی نماز  کے لیے جانے والا تھا،  لیکن میری بیوی اور بہن نے اتنا تنگ کیا کہ میں نے غصہ میں یہ کفریہ الفاظ بول دیے کہ ’’میں کافر ہوں، میں ہندو ہوں،  میں نماز نہیں پڑھوں گا‘‘  کیا مجھے ایمان اور نکاح کی تجدید  کی ضرورت ہے؟,"<p><p style=""text-align:justify;"">صورتِ  مسئولہ میں اگر آپ نے غصہ کی وجہ سے اپنے اختیار سے سوال میں ذکر کردہ جملے کہے ہیں تو  اب آپ کے لیے توبہ واستغفار کے ساتھ ساتھ  تجدیدِ ایمان اور (دو گواہوں کی موجودگی میں مہر کے تقرر کے ساتھ) تجدیدِ نکاح کرنا بھی ضروری ہے، اور آئندہ کے لیے اس قسم کے الفاظ سے اجتناب کرنا ضروری ہے۔</p><p style=""text-align:justify;""><span class=""ar_writing"">الدر المختار وحاشية ابن عابدين (رد المحتار) (4/ 222):<br/>
""وفي الفتح: من هزل بلفظ كفر ارتد وإن لم يعتقده للاستخفاف فهو ككفر العناد.<br/>
(قوله: من هزل بلفظ كفر) أي تكلم به باختياره غير قاصد معناه، وهذا لاينافي ما مر من أن الإيمان هو التصديق فقط أو مع الإقرار لأن التصديق، وإن كان موجوداً حقيقةً لكنه زائل حكماً؛ لأن الشارع جعل بعض المعاصي أمارة على عدم وجوده كالهزل المذكور، وكما لو سجد لصنم أو وضع مصحفاً في قاذورة فإنه يكفر، وإن كان مصدقاً لأن ذلك في حكم التكذيب، كما أفاده في شرح العقائد، وأشار إلى ذلك بقوله: للاستخفاف، فإن فعل ذلك استخفافاً واستهانةً بالدين فهو أمارة عدم التصديق، ولذا قال في المسايرة: وبالجملة فقد ضم إلى التصديق بالقلب، أو بالقلب واللسان في تحقيق الإيمان أمور الإخلال بها إخلال بالإيمان اتفاقا، كترك السجود لصنم، وقتل نبي والاستخفاف به، وبالمصحف والكعبة.<br/>
وكذا مخالفة أو إنكار ما أجمع عليه بعد العلم به لأن ذلك دليل على أن التصديق مفقود، ثم حقق أن عدم الإخلال بهذه الأمور أحد أجزاء مفهوم الإيمان فهو حينئذ التصديق والإقرار وعدم الإخلال بما ذكر بدليل أن بعض هذه الأمور، تكون مع تحقق التصديق والإقرار، ثم قال ولاعتبار التعظيم المنافي للاستخفاف كفر الحنفية بألفاظ كثيرة، وأفعال تصدر من المنتهكين لدلالتها على الاستخفاف بالدين كالصلاة بلا وضوء عمدا بل بالمواظبة على ترك سنة استخفافا بها بسبب أنه فعلها النبي صلى الله عليه وسلم زيادة أو استقباحها كمن استقبح من آخر جعل بعض العمامة تحت حلقه أو إحفاء شاربه اهـ. قلت: ويظهر من هذا أن ما كان دليل الاستخفاف يكفر به، وإن لم يقصد الاستخفاف لأنه لو توقف على قصده لما احتاج إلى زيادة عدم الإخلال بما مر لأن قصد الاستخفاف مناف للتصديق (قوله: فهو ككفر العناد) أي ككفر من صدق بقلبه وامتنع عن الإقرار بالشهادتين عنادا ومخالفة فإنه أمارة عدم التصديق"".</span></p><p style=""text-align:justify;""><span class=""ar_writing"">الفتاوى الهندية (2/ 283):<br/>
""رجل كفر بلسانه طائعاً، وقلبه مطمئن بالإيمان يكون كافراً، ولايكون عند الله مؤمناً، كذا في فتاوى قاضي خان"". </span>فقط واللہ اعلم</p></p>",144012201958,banuri,"('ایمان و عقائد', 'aqaed')","('کفر و شرک اور ان کے احکام', 'kufr-o-shirk-aur-un-k-ahkam')","('کفر و شرک اور ان کی اقسام', 'kufr-o-shirk-aur-un-ki-aqsaam')"
25-10-2019,https://www.banuri.edu.pk/readquestion/فون-پر-نکاح-کرنا-144102200258/25-10-2019,فون پر نکاح کرنا,اگر کوئی  شخص بغیر وکیل کے دو گواہ کی موجودگی میں فون پر نکاح کرے اور نکاح کے بعد خلوتِ  صحیحہ ہو جائے تو کیا نکاح ہو  جائے  گا؟ اور اگر نہیں تو ایسے نکاح میں دی گئی  طلاق کی کیا اہمیت ہوگی؟   کیا  انہیں بھی دوبارہ رجوع کے لیے حلالہ  کرنا پڑے گا؟,"<p><p style=""text-align:justify;"">واضح رہے کہ نکاح کے درست ہونے کے لیے ضروری ہے کہ ایجاب اور قبول(لڑکے اور لڑکی کی طرف سے نکاح کے  الفاظ) ایک  مجلس میں ادا کیے جائیں، اور فون پر ایجاب و قبول کی صورت میں چوں کہ مجلس ایک نہیں ہوتی، اس  لیے فون پر کیا گیا نکاح درست ہی نہیں ہوتا۔</p><p style=""text-align:justify;"">لہذا صورتِ مسئولہ میں چوں کہ نکاح فون پر کیا گیا ہے؛ اس لیے یہ نکاح منعقد ہی نہیں ہوا،  اور جب نکاح ہی نہیں ہوا تھا تو  اس کے بعد  دی ہوئی طلاق بھی واقع نہیں ہوئی،  دونوں ایک دوسرے کے  لیے اجنبی ہیں،  از سرِ نو نکاح کرنا چاہیں تو کر سکتے ہیں۔  لیکن نکاح کے بغیر جو خلوتِ صحیحہ میں ساتھ رہے ہیں وہ ناجائز تھا،  اس پر سچے دل سے خوب توبہ و استغفار کریں۔ فقط واللہ اعلم</p></p>",144102200258,banuri,"('نکاح', 'nikah')","('نکاح فاسد و باطل', 'nikah-e-fasid-o-batil')","('دوسرے کی بیوی سے نکاح', 'nikah-sahih-o-fasid')"
07-11-2019,https://www.banuri.edu.pk/readquestion/میڈیکل-اسٹور-پر-کسٹمر-بھیجنے-کے-بدلہ-کمیشن-معاوضہ-لینے-کا-حکم-144103200204/07-11-2019,میڈیکل اسٹور پر کسٹمر بھیجنے کے بدلہ کمیشن (معاوضہ) لینے کا حکم,کیا یہ جائز ہے کہ کسی مخصوص میڈیکل اسٹور پہ اس ارادہ  سے کسٹمر بھیجنا کہ میڈیکل اسٹور والے کسٹمر  بھیجنے والے کو معاوضہ دیں؟,"<p><p style=""text-align:justify;"">اگر کوئی شخص میڈیکل اسٹور والے سے یہ معاہدہ کرے کہ میں آپ کے پاس گاہک لے کر آؤں گا اور اتنا (متعینہ) کمیشن لوں گا، اور میڈیکل اسٹور والا اس بات پر راضی ہوجائے، تو پھر اس شخص کے لیے گاہک لے کر آنے کے بدلہ کمیشن (معاوضہ) لینا جائز ہوگا،  لیکن صرف کسی کو اس میڈیکل اسٹور کا پتا بتاکر وہاں سے دوائی خریدنے کا مشورہ دینے یا تاکید کرنے سے اگر وہ کسٹمر اس میڈیکل اسٹور پر جاکر خریداری کربھی لے تب بھی یہ بھیجنے والا شخص اجرت یا معاوضہ کا حق دار نہیں ہوگا، کیوں کہ اجرت کسی عمل کے بدلہ میں ہوتی ہے، اور اپنی جگہ بیٹھے بیٹھے صرف کسی کو میڈیکل اسٹور کا پتا بتا کر بھیجنے میں کوئی عمل نہیں پایا جارہا ہے۔ </p><p style=""text-align:justify;"">البتہ اگر خود اپنے ساتھ لے کر جائے تو چوں کہ خود چل کر جانا ایک عمل ہے، اس  لیے اس صورت میں اجرت لینے کا حق ہوگا۔ فقط واللہ اعلم</p></p>",144103200204,banuri,"('معاملات', 'muamlat')","('بیع / تجارت', 'bay-tijarat')","('اجارہ اور کرایہ کے احکام', 'ijara-or-kiraya-k-ahkam')"
