issued_at,link,title,question,answer,fatwa_number,dar_ul_ifta,kitab,bab,fasal
23-10-2019,https://www.banuri.edu.pk/readquestion/تبلیغی-جماعت-چلہ-میں-قصر-کریں-گے-یا-اتمام-144102200193/23-10-2019,تبلیغی جماعت والے چلہ میں قصر کریں گے یا اتمام؟,تبلیغی جماعت اپنے شہرسے دوسرے شہر آئی جہاں وہ پورا چلہ لگاتی ہے،  اور کبھی پاس کے گاؤں یا شہر کے دیگر محلوں میں جاتی ہے تو وہ قصر نماز پڑیں گے؟,"<p><p style=""text-align:justify;""> اگر تشکیل ایسے علاقہ میں ہو جو اپنےعلاقہ سے سوا ستتر کلو میٹر یا اس سے زیادہ فاصلے پر ہو  اور ایک ہی شہر /گاؤں  میں تشکیل  پندرہ دن یا اس سے زائد کی ہو تو یہ مقیم ہوں گے اور پوری نمازیں اداکریں گے۔ ایسی صورت میں اگر  گشت یا کسی اور ضرورت کے تحت قریب کے کسی دوسرے علاقہ میں جائیں جو اس تشکیل والے علاقہ سے سوا ستتر کلو میٹر سے کم فاصلے پر ہو تو یہ وہاں بھی مقیم ہوں گے۔ البتہ اس صورت میں اپنے شہر  کی آبادی سے نکلنے سے لے کر مطلوبہ شہر کی آبادی میں داخل ہونے تک دورانِ سفر (یعنی جب تک سفر جاری رہے) نماز میں قصر کریں گے۔</p><p style=""text-align:justify;""> اور اگر کسی ایک علاقہ میں تشکیل پندرہ دن سے کم ہو،  یعنی چلے کی تشکیل مختلف شہروں یا مختلف گاؤں میں ہو  اور کسی جگہ پندرہ دن قیام کی نیت نہ ہو تو یہ مسافر  ہوں گے اور قصر کریں گے۔فقط واللہ اعلم</p></p>",144102200193,banuri,"('نماز', 'salat')","('مسافر کی نماز', 'musafir-ki-namaz')","('مسافر کی نماز', 'musafir-ki-namaz')"
02-11-2019,https://www.banuri.edu.pk/readquestion/چھوٹا-درود-شریف-پڑھنا-کرسی-پر-بیٹھ-کر-نماز-پڑھنا-جمعہ-کی-دوسری-اذان-امام-کے-سامنے-کھڑے-ہوکر-دینا-144103200059/02-11-2019,مختصر درود شریف پڑھنا، کرسی پر بیٹھ کر نماز پڑھنا، جمعہ کی دوسری اذان امام کے سامنے کھڑے ہوکر دینا,"(1) معلوم کرنا ہے کہ کیا ""صلی اللہ علیہ وسلم "" چھوٹے دردو شریف کے طور پر پڑھنا صحیح ہے یانہیں؟(2) صف کے درمیان کرسی پر بیٹھ کر نماز پڑھنا صحیح  ہے جب کہ سجدہ رکنِ اعظم ہے، سجدہ زمین پر پیشانی رکھے بغیر نماز ہوجائے گی؟(3) جمعہ کی دوسری اذان خطبہ کے لیے جو دی جاتی ہے، اس میں مؤذن امام کے سامنے کھڑے ہو کر اذان کیوں دیتاہے، اس کی کیا فضیلت ہے، کسی اور جگہ سے دوسری اذان کیوں نہیں دی جاسکتی؟  آپ سے التماس ہے کہ تمام جواب حدیث کی روشنی میں حوالے کے ساتھ دیں!","<p><p style=""text-align:justify;"">1) ’’صلی اللہ علیہ وسلم‘‘   کو بطور مختصر درود شریف کے پڑھنا صحیح ہے۔ احادیثِ مبارکہ میں مطلقاً درود شریف کے فضائل بھی منقول ہیں، اور خاص صیغوں کے مستقل فضائل بھی منقول ہیں، اس لیے درود شریف کے کوئی بھی ثابت شدہ یا درست معنیٰ والے الفاظ پڑھنے سے درود شریف کی فضیلت حاصل ہوجائے گی،  ’’صلی اللہ علیہ وسلم‘‘  کے الفاظ صحابہ، تابعین اور تبعِ تابعین سے روایتِ حدیث کے دوران بے شمار احادیث میں منقول ہیں، کتبِ احادیث کا سلسلہ سند اس درودِ پاک کی کثرت سے بھر پور ہے۔</p><p style=""text-align:justify;"">2) جو شخص باقاعدہ زمین پر ماتھا ٹیک کر سجدہ کرنے پر قدرت رکھتا ہو اس کے لیے کرسی پر بیٹھ کر نماز پڑھنا اور اشارہ سے سجدہ کرنا درست نہیں ہے، سجدہ پر قدرت ہونے کے باوجود کرسی پر بیٹھ کر اشارہ سے سجدہ کرنے کی صورت میں نماز نہیں ہوگی۔  البتہ جو شخص باقاعدہ زمین پر ماتھا (پیشانی) ٹیک کر سجدہ کرنے پر قادر نہ ہو تو وہ کرسی پر بیٹھ کر نماز پڑھ سکتا ہے، اس کی نماز ہوجائے گی۔</p><p style=""text-align:justify;"">جو شخص مریض اور معذور ہو، سجدے پر قدرت نہ رکھتاہو اس کے لیے بیٹھ کر اشارے سے سجدہ کرنے کی اجازت بہت سی احادیث میں منقول ہے، اسی طرح اگر بیٹھ کر نہ پڑھ سکتاہو تو لیٹ کر اشارے سے نماز پڑھنے کا ذکر بھی روایات میں موجود ہے۔</p><p style=""text-align:justify;"">3) جمعہ کی دوسری اذان منبر (امام) کے سامنے کھڑے ہوکر دینا ہی سنت سے ثابت ہے، رسول اللہ ﷺ کے دور میں بھی ایسا ہی ہوتا تھا اور آپ ﷺ کے بعد خلفائے راشدین نے بھی اسی طریقہ پر عمل کیا تھا اور آج تک یہی طریقہ دنیا بھر کے  مسلمانوں میں رائج ہے۔ اسی لیے جمعہ کی دوسری اذان منبر (امام) کے سامنے کھڑے ہوکر دی جاتی ہے اور اس کی فضیلت یہ ہے کہ یہی طریقہ رسول اللہ ﷺ اور صحابہ کرام رضوان اللہ علیہم اجمعین سے ثابت ہے۔ ابو داؤد شریف کی روایت میں ہے کہ جمعہ کے دن جب رسول اللہ ﷺ منبر پر تشریف فرما ہوجاتے تھے تو آپ کے سامنے اذان دی جاتی تھی،  اور اسی طرح کا عمل حضرت ابو بکر رضی اللہ عنہ اور حضرت عمر رضی اللہ عنہ کا بھی تھا۔</p><p style=""margin-left:0;margin-right:0;text-align:justify;""><span class=""ar_writing"">سنن أبي داود (1/ 285):</span></p><p style=""margin-left:0;margin-right:0;text-align:justify;""><span class=""ar_writing"">""حدثنا النفيلي، حدثنا محمد بن سلمة، عن محمد بن إسحاق، عن الزهري، عن السائب بن يزيد، قال: كان يؤذن بين يدي رسول الله صلى الله عليه وسلم إذا جلس على المنبر يوم الجمعة على باب المسجد، وأبي بكر، وعمر"".</span></p><p style=""margin-left:0;margin-right:0;text-align:justify;""><span class=""ar_writing"">الدر المختار وحاشية ابن عابدين (رد المحتار) (2/ 161):</span></p><p style=""margin-left:0;margin-right:0;text-align:justify;""><span class=""ar_writing"">""(ويؤذن) ثانياً (بين يديه) أي الخطيب"".</span> فقط واللہ اعلم</p></p>",144103200059,banuri,"('نماز', 'salat')","('نماز کی شرائط', 'namaz-ki-sharait')","('نماز اور اس کی شرائط و ارکان ، سنن و آداب', 'namaz-or-us-ki-sharait-o-arkaan-sunan-o-aadab')"
11-11-2019,https://www.banuri.edu.pk/readquestion/اٹیچڈ-باتھروم-attached-bathroom-144012201961/11-11-2019,اٹیچڈ باتھ روم (attached bathroom),باتھ روم اور ٹائلٹ ایک ساتھ ہونا کیسا ہے؟,"<p><p style=""text-align:justify;"">بہتر یہ ہے کہ قضائے حاجت کی جگہ اور وضو وغسل کی جگہ مستقل طور پر جدا جدا ہوں، لیکن چوں کہ موجودہ زمانہ میں جگہ کی تنگی ہوسکتی ہے، لہذا قضائے حاجت کی نشست اور غسل خانہ ایک ہی چار دیواری میں بنانے کی گنجائش ہے، تاہم ایک جگہ بنانے کی صورت میں بھی اولاً کوشش کی جائے کہ دونوں کے درمیان کوئی فاصل/ آڑ  ہو، اگر کسی بھی ذریعہ سے فاصل ممکن نہ ہو تو  کم از کم اتنا اہتمام کیا جائے کہ وضو اور غسل کے پانی کی نکاسی کی لائن  اور بیت الخلا کے پانی کی نکاسی کی لائن جدا جدا ہو، اور دونوں کی جگہ کے درمیان کچھ فاصلہ ہو؛  ناپاک جگہ پر وضو کرنے کو فقہاءِ کرام نے مکروہ لکھا ہے؛ اس لیے کہ وضو کے پانی کو ایک گونہ حرمت حاصل ہے، اسے براہِ راست بیت الخلا کے نجس پانی میں گرانا مناسب نہیں ہے۔</p><p style=""text-align:justify;"">واضح رہے کہ اگر بیت الخلا اور غسل خانہ ایک چار دیواری میں ہوں اور درمیان میں کوئی آڑ نہ ہو تو دورانِ وضو زبان سے ذکر کرنے کی اجازت نہیں ہوگی۔</p><p style=""text-align:justify;""><span class=""ar_writing"">الدر المختار وحاشية ابن عابدين (رد المحتار) (1/ 133):</span></p><p style=""text-align:justify;""><span class=""ar_writing"">""ومن منهياته: التوضؤ بفضل ماء المرأة وفي موضع نجس؛ لأن لماء الوضوء حرمة"".</span></p><p style=""text-align:justify;""><span class=""ar_writing"">الدر المختار وحاشية ابن عابدين (رد المحتار) (1/ 344):</span></p><p style=""text-align:justify;""><span class=""ar_writing"">""(وأن يبول قائماً أو مضطجعاً أو مجرداً من ثوبه بلا عذر أو) يبول (في موضع يتوضأ) هو (أو يغتسل فيه)؛ لحديث: «لا يبولن أحدكم في مستحمه فإن عامة الوسواس منه».</span></p><p style=""text-align:justify;""><span class=""ar_writing"">و في الرد: ""(قوله: لحديث إلخ) لفظه كما في البرهان عن أبي داود: «لايبولن أحدكم في مستحمه ثم يغتسل أو يتوضأ فيه، فإن عامة الوسواس منه». والمعنى موضعه الذي يغتسل فيه بالحميم، وهو في الأصل الماء الحار، ثم قيل للاغتسال بأي مكان استحمام؛ وإنما نهي عن ذلك إذا لم يكن له مسلك يذهب فيه البول أو كان المكان صلباً فيوهم المغتسل أنه أصابه منه شيء فيحصل به الوسواس، كما في نهاية ابن الأثير. اهـ. مدني"".</span></p><p style=""text-align:justify;""><span class=""ar_writing"">حاشية الطحطاوي على مراقي الفلاح شرح نور الإيضاح (ص: 54):</span></p><p style=""text-align:justify;""><span class=""ar_writing"">""قوله: "" ويكره في محل التوضؤ"" لقوله صلى الله عليه وسلم: ""لايبولن أحدكم في مستحمه ثم يغتسل فيه أو يتوضأ فإن عامة الوسواس منه"" قال ابن ملك: لأن ذلك الموضع يصير نجساً فيقع في قلبه وسوسة بأنه هل أصابه منه رشاش أم لا اهـ حتى لو كان بحيث لايعود منه رشاش أو كان فيه منفذ بحيث لايثبت فيه شيء من البول لم يكره البول فيه؛ إذ لايجره إلى الوسوسة حينئذٍ؛ لأمنه من عود الرشاش إليه في الأول؛ ولطهر أرضه في الثاني بأدنى ماء طهور يمر عليها، كذا في شرح المشكاة"".  </span>فقط واللہ اعلم</p></p>",144012201961,banuri,"('طہارت', 'taharat')","('نجاست اور اس سے پاکی', 'najasat-aur-us-ki-paki')","('استنجاء، آداب و احکام', 'istinja-or-us-kay-aadab-o-ahkam')"
17-10-2019,https://www.banuri.edu.pk/readquestion/ناپاک-قالین-پاک-کرنے-کا-طریقہ-144012201856/17-10-2019,ناپاک قالین پاک کرنے کا طریقہ,ناپاک قالین وغیرہ کو پاک کرنے طریقہ کیا ہے؟ صرف 3 مرتبہ پوچا لگانے سے پاک ہوجائے گا?,"<p><p style=""text-align:justify;"">قالین پاک کرنے کا اصل طریقہ تو یہ ہے کہ ناپاک حصہ پر خوب پانی بہا کر قالین کو لٹکا دیا جائے یہاں تک کہ پانی کے قطرے گرنا بند ہوجائیں، اور یہ عمل تین مرتبہ دھرایا  جائے، پس صورتِ مسئولہ میں اگر قالین کو  ہٹاکر مذکورہ طریقے سے پاک کردیا جائے تو زیادہ بہتر یہی ہے۔</p><p style=""text-align:justify;"">البتہ اگر اسے زمین پر چپکا  دیا گیا ہے اور ہٹانا ممکن نہیں ہے  تو  پھر اسے پاک کرنے کی یہ صورت ہوسکتی ہے کہ کسی مائع کیمیکل/ پیٹرول وغیرہ سے اس ناپاک جگہ کو اتنی مرتبہ اچھی طرح صاف کیا جائے اور خشک کیا جائے کہ نجاست کا زائل ہونا یقینی ہوجائے تو بھی قالین پاک ہوجائے گا۔</p><p style=""text-align:justify;"">اور اگر یہ بھی ممکن نہ ہو تو نجاست خشگ ہوجانے کے بعد صرف اس حصے کو صاف کردیں، اس صورت میں قالین صاف تو ہوجائے گا، لیکن پاک نہیں ہوگا، اس کے اوپر  پاک مصلی یا کوئی پاک کپڑا بچھا کر نماز ادا کی جاسکتی ہے۔فقط واللہ اعلم</p></p>",144012201856,banuri,"('طہارت', 'taharat')","('نجاست اور اس سے پاکی', 'najasat-aur-us-ki-paki')","('نجاست سے پاکی', 'nijasat-aur-us-ki-paki')"
23-10-2019,https://www.banuri.edu.pk/readquestion/قسط-وار-قرض-کی-وصولی-میں-زیادہ-رقم-وصول-کرنا-144102200178/23-10-2019,قسط وار قرض کی وصولی میں زیادہ رقم وصول کرنا,آج کل لوگ قسط  پر جو چیز بیچتے  ہیں  تو 30% زیادہ منافع کرتے  ہیں اور یہ  جائز ہے،  لیکن اگر کسی پر قر ض ہو  اور وہ قر ض نہیں دےسکتا تو اگر کوئی  اس کا قر ض ختم کرے،  پھر وہ بندہ اس قر ض کو  ہر مہینہ قسط وار تھوڑا تھوڑا ادا کرے تو کیا یہ جائز ہے؟,"<p><p style=""text-align:justify;"">اگر آپ کے سوال کا مطلب یہ ہے کہ مقروض کی طرف سے اگر کوئی شخص قرض ادا کر دے  تو  کیا مقروض، قرض ادا کرنے والے کو ہر مہینے تھوڑی تھوڑی رقم ادا کر سکتا ہے تو اس کا جواب یہ ہے کہ قرض کی جتنی رقم تھی اتنی ہی رقم تھوڑی تھوڑی کرکے قسط وار ادا کرنا جائز ہے،  یعنی مثلاً زید پر قرضہ تھا اور زید  یک مشت قرض کی رقم ادا کرنے پر قادر نہیں تھا تو عمر نے زید کی طرف سے قرض ادا کر دیا، اب زید ہرمہینے عمر کو  کچھ پیسے دے کر اپنا قرضہ ادا کر سکتا ہے، اس میں شرعاً  کوئی حرج نہیں۔</p><p style=""text-align:justify;"">اور اگر سوال کا  منشا  یہ ہے کہ قرض ادا کرنے والا مقروض سے ادا شدہ رقم کی بنسبت زیادہ رقم وصول کرے گا،  جیسے قسط  پر کوئی چیز خریدنے کی صورت میں  زیادہ رقم وصول کی جاتی ہے تو اس کا جواب یہ ہے کہ ایسا کرنا جائز نہیں۔ فقط واللہ اعلم</p></p>",144102200178,banuri,"('معاملات', 'muamlat')","('سود / بینکاری / انشورنس / شیئرز', 'sood-bankari-insurance-shares')","('قرض کے احکام', 'qarz-k-ahkam')"
11-11-2019,https://www.banuri.edu.pk/readquestion/آب-زمزم-کھڑے-ہو-کر-پینے-میں-حکمت-144103200304/11-11-2019,آبِ زمزم  کھڑے ہو کر پینے میں حکمت,آبِ  زم زم کھڑے ہو کر پینے میں کیا حکمت ہے?,"<p><p style=""margin-left:0;margin-right:0;text-align:justify;"">ملا علی قاری رحمہ اللہ  مشکاۃ المصابیح کی شرح مرقاۃ المفاتیح میں لکھتے ہیں کہ: آب زمزم  کھڑے ہوکر پینےکی وجہ یہ ہے کہ زمزم کے پانی میں مطلوب یہ ہے کہ خوب سیر ہو کر پانی پیا جائے اور اس پانی کی برکت جسم کے تمام اعضاء تک پہنچ جائے، اور یہ دونوں مقصد کھڑے ہوکر پانی پینے سے حاصل ہوں گے۔</p><p style=""margin-left:0;margin-right:0;text-align:justify;"">آبِ زمزم پیٹ بھر کر پینے کے متعلق مستدرک حاکم میں روایت ہےکہ: ایک شخص حضرت عبد اللہ بن عباس کے پاس آئے تو حضرت نے ان سےدریافت کیا: کہاں سے آرہے ہو؟ انہوں نے جواب دیا: میں زمزم پی کر آرہا ہوں، حضرت عبد اللہ بن عباس رضی اللہ عنہما نے پوچھا:  کیا تم نے اس طریقہ پر زمزم پیا ہے جیسا کہ پینا چاہیے تھا؟ انہوں نے سوال کیا کہ وہ طریقہ کیا ہے؟ تو حضرت عبد اللہ بن عباس رضی اللہ عنہما نے جواب دیا :جب تم زمزم پیو تو قبلہ رخ ہو جاؤ، اللہ کا نام لو، اور تین سانسوں میں پانی پیو اور پیٹ بھر کر  زمزم پیو، جب پانی پینے سے فارغ ہوجاؤ تو اللہ کی تعریف کرو ،اس لیے کہ رسول اللہ ﷺ نے فرمایا کہ: ہمارے اور منافقین کے درمیان فرق کرنے والی چیز یہ ہے کہ وہ زمزم سے پیٹ بھر کر پی نہیں سکتے۔</p><p style=""margin-left:0;margin-right:0;text-align:justify;""><span class=""ar_writing"">مرقاة المفاتيح شرح مشكاة المصابيح (7 / 2747):</span></p><p style=""margin-left:0;margin-right:0;text-align:justify;""><span class=""ar_writing"">"" أو النهي عنده ليس على إطلاقه فإنه مخصص بماء زمزم، وشرب فضل الوضوء كما ذكره بعض علمائنا. وجعلوا القيام فيهما مستحباً وكرهوه في غيرهما، إلا إذا كان ضرورةً، ولعل وجه تخصيصهما أن المطلوب في ماء زمزم التضلع ووصول بركته إلى جميع الأعضاء، وكذا فضل الوضوء مع إفادة الجمع بين طهارة الظاهر والباطن، وكلاهما حال القيام أعم، وبالنفع أتم، ففي شرح الهداية لابن الهمام: ومن الأدب أن يشرب فضل ماء وضوئه مستقبلاً قائماً، وإن شاء قاعداً اهـ، وظاهر سياق كلام علي -رضي الله تعالى عنه- أن القيام مستحب في ذلك المقام؛ لأنه رخصة"".</span></p><p style=""margin-left:0;margin-right:0;text-align:justify;""><span class=""ar_writing"">المستدرك على الصحيحين للحاكم (1 / 645):</span></p><p style=""margin-left:0;margin-right:0;text-align:justify;""><span class=""ar_writing"">""عن عثمان بن الأسود قال: جاء رجل إلى ابن عباس فقال: من أين جئت؟ فقال: شربت من زمزم فقال له ابن عباس: أشربت منها كما ينبغي؟ قال: و كيف ذاك يا أبا عباس؟ قال: إذا شربت منها فاستقبل القبلة و اذكر اسم الله و تنفس ثلاثاً و تضلع منها، فإذا فرغت منها فاحمد الله؛ فإن رسول الله صلى الله عليه و سلم قال: آية بيننا و بين المنافقين أنهم لايتضلعون من زمزم.</span></p><p style=""margin-left:0;margin-right:0;text-align:justify;""><span class=""ar_writing""> هذا حديث صحيح على شرط الشيخين و لم يخرجاه  إن كان عثمان بن الأسود سمع من ابن عباس"".</span> فقط واللہ اعلم</p></p>",144103200304,banuri,"('متفرق کتب', 'mutafarriq-kutub')","('متفرق ابواب', 'mutafarriq-abwab')","('متفرق فصول', 'mutafarriq-fusool')"
12-11-2019,https://www.banuri.edu.pk/readquestion/حضرت-جبریل-علیہ-السلام-کا-حضرت-حسین-سے-کلام-144012201963/12-11-2019,حضرت جبریل علیہ السلام کا حضرت حسین سے کلام,حضرت جبریل علیہ السلام حضرت حسین کو نظرآتے تھے،  یا بات کرتے تھے؟,"<p><p style=""text-align:justify;"">حضرت جبریل علیہ السلام کے حضرت حسین کو نظر آنے یا  بات کرنے کے حوالے سے ہمیں کوئی روایت  نہیں ملی، اس لیے ایسی باتیں نہ بیان کی جائیں۔ اگر یہ بات صحیح سند سے ثابت ہوتی تو مستند کتابوں میں ضرور ہوتی۔  حضرت حسین اور اہلِ بیتِ کرام رضی اللہ عنہم کے بہت سے فضائل صحیح احادیث کی روشنی میں ثابت ہیں، اُن ہی پر اکتفا کیا جائے۔</p><p style=""text-align:justify;"">نبی کے علاوہ کسی کے پاس فرشتے کا آنا یا اس سے ہم کلام ہونا اگر ثابت ہوجائے تو یہ بعض احوال میں فضیلت تو ہوسکتاہے، لیکن اس سے نبوت یا اصطلاحی وحی کا ثبوت نہیں ہوتا۔ رسول اللہ ﷺ کی حیاتِ مبارکہ میں بہت سے صحابہ کرام رضی اللہ عنہم کا مختلف فرشتوں کو مختلف کیفیات میں دیکھنا منقول ہے، لیکن صحابہ کرام رضی اللہ عنہم نے اسے خصوصیت کے ساتھ اسی شخص کی فضیلت کے بجائے اس عمل کی فضیلت کے طور پر بیان کیا، جس سے متعلق فرشتہ آیا۔ فقط واللہ اعلم</p></p>",144012201963,banuri,"('تاریخ و سیر', 'tareekh-o-siyar')","('تاریخ', 'tareekh')","('تاریخِ اسلام', 'tareekh-e-Islam')"
12-11-2019,https://www.banuri.edu.pk/readquestion/بریلویوں-کے-پیچھے-نماز-پڑھنا-144103200311/12-11-2019,بریلویوں کے پیچھے نماز پڑھنا,بریلویوں کے پیچھے نماز پڑھنے کا کیا حکم ہے؟,"<p><p style=""text-align:justify;"">کسی شخص کی اقتدا میں نماز کے جوازاورعدمِ جواز کا تعلق اس شخص کے عقیدے اور نظریہ سے ہے، نہ کہ اس کے کسی علاقے یا جماعت کی طرف منسوب ہونے سے؛ لہٰذا اگر کسی شخص کا عقید ہ حدِکفر تک  پہنچتا ہو تو اس کی اقتدامیں نماز جائز نہیں ہے، اور اگر عقیدہ حدِکفر تک نہیں پہنچتا تو  اس کی اقتدا میں نماز جائز ہوگی۔بریلوی حضرات کے بعض عقائد کی بنا پر ان کے بدعتی اور گم راہ  ہونے کا فتویٰ دیا گیا ہے؛ لہذاگراتفاقاً ایسی نوبت آجائے کہ بریلوی مکتبہ فکر کے امام کی اقتدا میں نماز پڑھنی پڑے تو جماعت ترک نہ کی جائے،جماعت کا ثواب مل جائے گا،البتہ  مستقل طور پرایسے امام کی اقتدا میں نماز ادا کرنا مکروہِ تحریمی ہے، کسی صحیح العقیدہ نیک امام کی اقتدا میں نمازپڑھنےکا اہتمام کیا جائے ۔فقط واللہ اعلم</p><p style=""text-align:justify;"">مزید تفصیل کے لیے درج ذیل لنک ملاحظہ کیجیے:</p><p style=""text-align:justify;""><a href=""https://www.banuri.edu.pk/readquestion/%D8%A8%D8%B1%DB%8C%D9%84%D9%88%DB%8C-%D8%A7%D9%85%D8%A7%D9%85-%DA%A9%DB%8C-%D8%A7%D9%82%D8%AA%D8%AF%D8%A7-%DA%A9%D8%A7-%D8%AD%DA%A9%D9%85-144102200006/16-10-2019"">بریلوی امام کی اقتدا کا حکم</a></p></p>",144103200311,banuri,"('نماز', 'salat')","('نماز کی جماعت', 'namaz-ki-jamat')","('جماعت / امامت', 'jamat-imamat')"
