issued_at,link,title,question,answer,fatwa_number,dar_ul_ifta,kitab,bab,fasal
14-11-2019,https://www.banuri.edu.pk/readquestion/کبوتر-پالنا-144103200358/14-11-2019,کبوتر پالنا,میں بیرونِ ملک مقیم ہوں، ہر سال جب پاکستان جاتا ہوں تو گھر کی چھت پر میرے چھوٹے بھائی نے پالتو سفید کبوتر رکھے ہوئے ہیں تو مجھے بھی کبوتروں کا بہت شوق ہے، سو ہم دونوں بھائی اپنے شوق اور خوشی کے لیے کبوتر اڑاتے ہیں، ان کا بہت خیال رکھتے ہیں اور کبوتروں کا دانا پانی دوائی ہر چیز کا خیال رکھتے ہیں۔کیا ہم کبوتر پال سکتے ہیں؟ اسلام میں کبوتر پالنا کیسا ہے؟,"<p><p style=""text-align:justify;"">اگر پرندوں کی خوراک اور ضروریات وغیرہ کا خیال رکھا جاتا ہے تو انہیں پالنا اور ان  کی خرید وفروخت درست ہےاور آمدنی حلال ہے۔</p><p style=""text-align:justify;"">البتہ کبوتر یا دیگر پرندے اڑانےکو مشغلہ بنانا، ہر وقت ان ہی کے ساتھ شوقیہ مصروف رہنا اور پرندے لڑانادرست نہیں ہے، احادیث سے اس کی ممانعت ثابت ہے۔ اسی طرح گھر کی چھت پر چڑھ کر کبوتر اڑانا  جس سے دوسروں کے گھروں میں نظر پڑتی ہو، یہ بھی شرعاً درست نہیں ہے، اس سے اجتناب ضروری ہے۔  فقط واللہ اعلم</p></p>",144103200358,banuri,"('متفرق کتب', 'mutafarriq-kutub')","('متفرق ابواب', 'mutafarriq-abwab')","('متفرق فصول', 'mutafarriq-fusool')"
23-08-2019,https://www.banuri.edu.pk/readquestion/وضو-سے-پہلے-کلمہ-پڑھنے-والی-روایت-سے-متعلق-سوال/23-08-2019,وضو سے پہلے کلمہ پڑھنے والی روایت سے متعلق سوال,"ایک حدیث بہت زیادہ وائرل ہو رہی ہے، اس کی تحقیق مطلوب ہے، الفاظ کچھ اس طرح ہیں کہ ""فرمانِ  رسول ہے جس شخص نے وضو  سے پہلے کلمہ پڑھ لیا تو اللہ تعالی وضو  کے ہر قطرے پر ایک فرشتہ کھڑا کر دے گا جو قیامت تک کلمہ پڑھتا رہے گا جس کا ثواب کلمہ پڑھنے والے کو اور سب کو بتانے والے کو قیامت تک ملتا رہے گا.","<p><p style=""text-align:justify;"">اس قسم کی کوئی روایت تلاش کے باوجود ہمیں نہ مل سکی۔ اس لیے بلاتحقیق اسے رسول اللہ ﷺ کی طرف منسوب کرکے نہ بیان کیا جائے۔ فقط واللہ اعلم</p></p>",144012200624,banuri,"('علوم و فنون', 'uloom-funoon')","('حدیث و سنت', 'hadees-sunnat')","('حدیث کا معنی، مفہوم اور اقسام', 'hadees-ka-mana-mafhom-aur-aqsaam')"
23-04-2018,https://www.banuri.edu.pk/readquestion/اصول-حدیث-کی-اصطلاحات-کے-متعلق-ایک-وضاحت-2/23-04-2018,اصولِ حدیث کی اصطلاحات کے متعلق ایک وضاحت,میرے علم کے مطابق حدیث کی صحت سے متعلق اصطلاحات،  جیسے:  صحیح،  حسن،  ضعیف وغیرہ کے استعمال کا آغاز دوسری صدی ہجری کے بعد ہوا۔ تو اس سے پہلے، پہلی اور دوسری صدی ہجری میں حدیث کی صحت سے متعلق کیا کیا اصطلاحات استعمال کی جاتی تھیں؟,"<p><p style=""text-align:justify;"">تمہیداً یہ اصولی نکتہ  ذہن میں رہنا چاہیے کہ علمی وفنی اصطلاحات  کے متعلق اختلاف کوئی اچھنبے کی بات نہیں، ایک ہی اصطلاح مختلف ادوار میں مختلف مفاہیم میں استعمال ہوتی رہی ہے،  مثلا: حسن کی اصطلاح کو امام ترمذی نے زیادہ ترویج دی ہے، ان سے قبل عموماً حدیث کو صحیح یا ضعیف ہی کہا جاتا تھا، ""حسن""  کا لفظ امام ترمذی کے متعین کردہ مفہوم میں استعمال نہ ہوتا تھا، نیز امام ترمذی کے بعد متاخرین کے ہاں اس اصطلاح کا وہ مفہوم نہیں جو امام ترمذی کے ہاں تھا، خلاصہ یہ کہ علمی   وفنی اصطلاحات کے استعمال میں اہلِ علم کے ہاں توسع رہا ہے، البتہ خالص دینی وشرعی اصطلاحات میں تبدیلی مختلف مفاسد کی بنا پر جائز نہیں۔</p><p style=""text-align:justify;"">اب سمجھیے کہ اصولِ حدیث کا اصل ہدف ومقصد  ذخیرہ حدیث کی حفاظت ہے، اس کے لیے دورِ نبوی اور پھر دورِ صحابہ سے مختلف اصول  پیشِ نگاہ رہے، مرورِ زمانہ کے ساتھ ان میں اضافہ ہوتا رہا، ابتدا ئی  دست یاب ذخیرے میں امام شافعی کی ""الرسالہ""  کے بعض مباحث ، مقدمہ صحیح مسلم والتمییز اور امام ترمذی کی ""العلل الصغیر"" وغیرہ میں فن جس حالت میں نظر آتا ہے، بعد کی صدیوں میں تدوین کے بعد اس کی صورت الگ ہوگئی، فن کی طرح اصطلاحات بھی ارتقائی ادوار سے گزر کر پختہ ہوتی ہیں، بہرکیف ابتدائی دور میں ان ہی  اصطلاحات  میں سے بعض استعمال ہوتی رہی ہیں۔  اصول وجرح تعدیل کی بعض اصطلاحات مختلف اہلِ علم کے ہاں مختلف مفاہیم میں بھی مستعمل رہی ہیں،  مثلاً: امام بخاری کی اصطلاح  ""فیہ نظر""  اور یحی بن معین کی ""لیس بشیء"" کے حوالے سے اہلِ علم نے کافی بحث کی ہے۔ (دیکھیے: الرفع والتکمیل مع تعلیقات شیخ ابوغدہ رحمہما اللہ)</p><p style=""text-align:justify;"">ویب سائٹ کا جواب اتنی تفصیل کا متحمل نہیں، مزید تفصیلات تدوینِ علومِ حدیث کی تاریخ  اور جرح وتعدیل سے متعلق کتب میں مراجعت کرکے ملاحظہ کی جاسکتی ہیں۔ واللہ اعلم </p></p>",143908200025,banuri,"('علوم و فنون', 'uloom-funoon')","('حدیث و سنت', 'hadees-sunnat')","('حدیث کا معنی، مفہوم اور اقسام', 'hadees-ka-mana-mafhom-aur-aqsaam')"
08-04-2019,https://www.banuri.edu.pk/readquestion/کیا-المتقي-من-يتقي-الشبهات-حدیث-کے-الفاظ-ہیں/08-04-2019,کیا المتقی من یتقی الشبہات حدیث کے الفاظ ہیں؟,اس روایت کی تحقیق مطلوب ہے: ’’المتقی من یتقی الشبھات‘‘۔  کیا یہ حدیث ہے؟ حدیث کی کس کتاب میں اس کا حوالہ ہے؟ اور اگر یہ حدیث نہیں تو کیا کسی بزرگ کا قول ہے؟ کسی مستند کتاب میں اس کا حوالہ موجود ہے کیا؟,"<p><p style=""margin-left:0;margin-right:0;text-align:justify;"">تلاشِ بسیار کے باوجود سوال میں ذکر کردہ الفاظ  بعینہ کسی مستند کتاب میں حدیث یا کسی بزرگ کے قول کے طور پر نہیں مل سکے۔  تاہم ان الفاظ سے ملتے جلتے احادیث اور بزگوں کے اقوال ثابت ہیں جو ان الفاظ کے معنی کی تایید کرتے ہیں۔</p><p style=""margin-left:0;margin-right:0;text-align:justify;""><strong>ملاحظہ ہو:</strong></p><p style=""text-align:justify;""><span class=""ar_writing"">""عن عطية السعدى وكان من أصحاب النبي صلى الله عليه وسلم قال: قال النبي صلى الله عليه وسلم: "" لايبلغ العبد أن يكون من المتقين حتى يدع ما لا بأس به حذراً لما به البأس"". هذا حديث حسن غريب لا نعرفه إلا من هذا الوجه"". (سنن الترمذي: ،کتاب صفۃ القیامۃ:۴۔۶۳۴، دار إحياء التراث العربي)</span></p><p style=""margin-left:0;margin-right:0;text-align:justify;"">اسی طرح حضرت واثلہ بن الأسقع رضی اللہ عنہ کی روایت کردہ ایک حدیث ہے جس میں انہوں نے رسول اللہ ﷺ سے تقوی کے متعلق سوال کیا تو آپ ﷺ نے انہیں جواب میں ارشاد فرمایا : جو شبہات کو ترک کردے  (وہ متقی کہلاتا ہے)۔</p><p style=""margin-left:0;margin-right:0;text-align:justify;""><strong>ملاحظہ ہو:</strong></p><p style=""text-align:justify;""><span class=""ar_writing"">(۱)  أخبرنا أبو طاهر محمد بن عبد الوهاب بن محمد بن الشاطر الكاتب، قراءةً عليه، قال: أخبرنا أبو الحسن علي بن عمر بن محمد بن الحسن الختلي الجربي، قال: حدثني حاتم يعني الحسن الشاشي، قال: حدثنا أحمد بن الحسن يعني الترمذي، قال: حدثنا سليمان بن أحمد، قال: وحدثنا العلاء بن ثعلبة، عن أبي المليح بن أسامة الهذلي، عن واثلة بن الأسقع، قال: قلت: يا رسول الله، أفتني في أمر لا أسأل عنه أحداً بعدك؟ قال: "" استفت نفسك وإن أفتاك المفتون، قال: فكيف لي أن أعلم ذلك يا رسول الله؟ قال: تضم يدك إلى صدرك فإن القلب يسكن إلى الحلال، ولايسكن إلى الحرام، وإن الورع المسلم يدع الصغير مخافة أن يقع في الكبير، قال: قلت: يا رسول الله، فمن الورع؟ قال: من ترك الشبهات، قال: قلت: يا رسول الله: فما المعصية؟ قال: أن يعين الرجل قومه على الظلم، قلت: يا رسول الله، فمن المؤمن؟ قال: من أمنه المؤمنون على دمائهم وأموالهم، قلت: يا رسول الله، وأي الجهاد أفضل؟ قال: كلمة حق عند إمام جائر"". </span>(ترتيب الأمالي الخميسيۃ للشجري (المتوفى 499 ہجری)، 2/316/ 2582، دار الكتب العلميۃ)</p><p style=""margin-left:0;margin-right:0;text-align:justify;"">سند کے رجال:</p><p style=""margin-left:0;margin-right:0;text-align:justify;""><span class=""ar_writing"">(1) محمد بن عبد الوهاب بن محمد، أبو طاهر ابن الشاطر العلوي الكاتب، [المتوفى: 452 هـ]</span></p><p style=""margin-left:0;margin-right:0;text-align:justify;"">علامہ ذھبیؒ ان کے متعلق لکھتے ہیں:</p><p style=""text-align:justify;""><span class=""ar_writing"">""نقيب الطالبيين ببغداد. سمع أبا حفص بن شاهين، وأبا الحسن الحربيّ، وابن المنتاب. قال الخطيب: كتبنا عنه، وكان صدوقا، توفي في ربيع الأوّل"". (تاريخ الإسلام للذھبی: 10/32، دار الغرب الإسلامي)</span></p><p style=""margin-left:0;margin-right:0;text-align:justify;""><span class=""ar_writing"">(2) عَلِيّ بْن عُمَر بْن مُحَمَّد بْن الْحَسَن بْن شاذان، أَبُو الْحَسَن الحِمْيَري البغدادي الحربي، يعرف بالسكري وبالختلي وبالصيرفي وبالكيّال. [المتوفى: 386 هـ]</span></p><p style=""text-align:justify;""><span class=""ar_writing"">""قَالَ التنوخي: سَمِعْتُ الحربي يَقُولُ: وُلِدت سنة ستٍ وتسعين ومائتين، وأول سماعي سنة ثلاث وثلاثمائة من الصوفي.</span></p><p style=""text-align:justify;""><span class=""ar_writing"">وقال الخطيب: قال لي البَرْقَاني عَنِ الحربي: لا يساوي شيئًا، فسألت الْأزهري عَنْهُ، فَقَالَ: صدوق، وكان سماعه فِي كتب أخيه، لكن بعض المحدثين قرأ عليه منها شيئاً لم يكن سماعه وألحق فيه السماع، فجاء آخرون فحكوا الإلحاق وأنكروه، وأما الشَّيْخ فكان فِي نفسه ثقة.</span></p><p style=""text-align:justify;""><span class=""ar_writing"">وقَالَ الْأزجي: كَانَ صحيح السَّماع.</span></p><p style=""text-align:justify;""><span class=""ar_writing"">وقَالَ العتيقي: كَانَ ثقة ذهب بصره فِي آخر عمره، وتُوُفِّيَ فِي شوال"". </span>(تاریخ الاسلام للذھبی: 8/596، دار الغرب الاسلامی)</p><p style=""margin-left:0;margin-right:0;text-align:justify;""><span class=""ar_writing"">(3) حاتم بْن الْحَسَن بْن الفتح بْن هاشم بْن حازم بْن رزق أَبُو سعيد الشاشي.</span></p><p style=""text-align:justify;""><span class=""ar_writing""> قدم بَغْدَاد حاجاً فِي سنة ثلاث وَثلاث مائة، وَحدث بها عَنْ علي بْن خشرم، وَعن جده الفتح بْن هاشم، وَإسحاق بْن منصور الكوسج، وَسليمان بْن معبد السنجي، وَأبي الدرداء عَبْد العزيز بْن منيب، وَغيرهم.</span></p><p style=""text-align:justify;""><span class=""ar_writing"">روى عنه أَبُو بكر الشَّافِعِيّ، وَعبد العزيز بْن مُحَمَّد بْن الواثق الهاشمي، وَعلي بْن عُمَر السكري. وَما علمت ما حاله إِلا خيراً"".</span> (تاریخ الاسلام للذھبی: 9/156، دار الغرب الاسلامی)</p><p style=""margin-left:0;margin-right:0;text-align:justify;""><span class=""ar_writing"">(4) أَحْمَدُ بنُ الحَسَنِ بنِ جُنَيْدِبٍ التِّرْمِذِيُّ.</span></p><p style=""text-align:justify;""><span class=""ar_writing"">الإِمَامُ، الحَافِظُ، المُجَوِّدُ، الفَقِيْهُ، أَبُو الحَسَنِ التِّرْمِذِيُّ. سَمِعَ: يَعْلَى بنَ عُبَيْدٍ، وَأَبَا النَّضْرِ، وَعُبَيْدَ اللهِ بنَ مُوْسَى، وَسَعِيْدَ بنَ أَبِي مَرْيَمَ، وَأَبَا نُعَيْمٍ، وَأَبَا صَالِحٍ الكَاتِبَ، وَطَبَقَتَهُم. وَتَفَقَّهَ بِأَحْمَدَ بنِ حَنْبَلٍ، وَكَانَ بَصِيْراً بِالعِلَلِ وَالرِّجَالِ. حَدَّثَ عَنْهُ: البُخَارِيُّ، وَالتِّرْمِذِيُّ، وَأَبُو بَكْرٍ بنُ خُزَيْمَةَ، وَجَمَاعَةٌ"".</span> (سیر أعلام النبلاء:12/156، مؤسسۃ الرسالۃ)</p><p style=""margin-left:0;margin-right:0;text-align:justify;""><span class=""ar_writing"">(6) ""العلاء بْن ثعلبة.</span></p><p style=""text-align:justify;""><span class=""ar_writing"">ذكره ابن حبان في الثقات بقوله: «يَرْوِي عن: عائشة، رَوَى عَنْهُ: جامع بْن عمرو»"".</span>(الثقات لابن حبان: 2/ 406، دار الکتب العلمیہ )</p><p style=""margin-left:0;margin-right:0;text-align:justify;""><span class=""ar_writing"">(7) ""محمد بن أبي المليح بن أسامة الهذلي أخو مبشر.</span></p><p style=""text-align:justify;""><span class=""ar_writing"">قال محمد بن المثنى: ما سمعت يحيى، وَلا عبد الرحمن يحدثان عنه بشيء قط. روى عنه عبد الصمد بن عبد الوارث. انتهى. وذكره ابنُ حِبَّان في الثقات. وذكره الساجي والعقيلي في الضعفاء"".</span>(لسان المیزان : ۷/۵۲۱، دار البشائر الاسلامیہ)</p><p style=""text-align:justify;""><span class=""ar_writing"">""قال ابن حجر: هذا حديث حسن غريب، أخرجه أبويعلى في مسنده هكذا، ورجاله رجال الصحيح إلا العلاء بن ثعلبة فقال أبوحاتم الرازي إنه مجهول، وإنما حسنته لأن لجميع ما تضمنه المتن شواهد مفرقة، والله أعلم"". (الإيماء إلى زوائد الأمالي والأجزاء:  6/87، نبيل سعد الدين سَليم جَرَّار،  أضواء السلف)</span></p><p style=""text-align:justify;""><span class=""ar_writing"">""العلاء بن ثعلبة مجهول- قاله أبو حاتم، لكن للمتن شواهد مفرّقة"". (المطَالبُ العَاليَةُ:7/210،  دار العاصمة للنشر والتوزيع - دار الغيث للنشر والتوزيع)</span></p><p style=""margin-left:0;margin-right:0;text-align:justify;"">(2) مسند فردوس دیلمی میں حضرت أنس رضی اللہ عنہ کی روایت  ان الفاظ میں منقول ہے:</p><p style=""text-align:justify;""> ""<span class=""ar_writing"">المؤمن ملحم"".</span> (الفردوس بمأثور الخطاب: 6542، دار الکتب العلمیۃ)</p><p style=""margin-left:0;margin-right:0;text-align:justify;"">یہی روایت کنز العمال میں بھی بحوالہ مسند فردوس دیلمی منقول ہے اور حاشیہ میں اس کی مندرجہ ذیل تشریح بیان کی گئی ہے:</p><p style=""text-align:justify;""><span class=""ar_writing"">""قوله: المؤمن ملحم: بضم الميم وسكون اللام وكسر الحاء المهملة وآخره ميم أي وقاف عند الشبهات . انتهى"". (كنز العمال في سنن الأقوال والأفعال: رقم: 817،</span> مؤسسۃ الرسالۃ<span class=""ar_writing"">)</span></p><p style=""margin-left:0;margin-right:0;text-align:justify;"">(3) اسی طرح مسلم شریف کی روایت میں ہے:</p><p style=""margin-left:0;margin-right:0;text-align:justify;""><span class=""ar_writing"">"" عن النعمان بن بشير، قال: سمعته يقول: سمعت رسول الله صلى الله عليه وسلم، يقول: - وأهوى النعمان بإصبعيه إلى أذنيه - «إن الحلال بين، وإن الحرام بين، وبينهما مشتبهات لايعلمهن كثير من الناس، فمن اتقى الشبهات استبرأ لدينه، وعرضه، ومن وقع في الشبهات وقع في الحرام، كالراعي يرعى حول الحمى، يوشك أن يرتع فيه، ألا وإن لكل ملك حمى، ألا وإن حمى الله محارمه، ألا وإن في الجسد مضغة، إذا صلحت، صلح الجسد كله، وإذا فسدت، فسد الجسد كله، ألا وهي القلب»"".(باب أخذ الحلال وترك الشبهات، رقم الحدیث: 1599)</span></p><p style=""margin-left:0;margin-right:0;text-align:justify;"">اس کے علاوہ علماء کے ایسے اقوال بھی منقول ہیں جومذکورہ  الفاظ کی معنوی طور پر  تایید کرتے ہیں، ملاحظہ ہو:</p><p style=""text-align:justify;""><span class=""ar_writing"">""(۴) أخبرنا محمد بن الحسين بن محمد قال : سمعت محمد بن أحمد بن حمدان ، ومحمد بن أحمد الشبهي ، يقولان : سمعنا محفوظاً يقول : « التقوى في الحرام، ثم في الشبهات، ثم في الفضول »"". (الزهد الكبير للبيہقي: رقم الحدیث: 929)</span></p><p style=""text-align:justify;""><span class=""ar_writing"">(۵) ""قال النووي : والورع اجتناب الشبهات خوفاً من الله تعالى"". (فيض القديرللمناوي: 6/72، دار الكتب العلميۃ)</span></p><p style=""text-align:justify;""><span class=""ar_writing"">(۶) ""قال إبراهيم بن أدهم : الزهد ثلاثة أصناف : زهد فرض و زهد فضل و زهد سلامة فالزهد الفرض الزهد في الحرام و الزهد الفضل الزهد في الحلال و الزهد السلامة الزهد في الشبهات"". (شعب الإيمان للبيہقي: 7/406/ 10777، دار الكتب العلميۃ)</span></p><p style=""margin-left:0;margin-right:0;text-align:justify;"">خلاصہ یہ کہ اگر چہ مذکورہ الفاظ کا بعینہ کسی حدیث میں ثبوت نہیں ملتا،  تاہم ان الفاظ کی اصل دیگراحادیث اور محدثین علماء کے اقوال سے  تایید شدہ ہے، لہذا اس کا بیان کرنا درست ہے ۔ فقط واللہ اعلم</p></p>",144008200029,banuri,"('علوم و فنون', 'uloom-funoon')","('حدیث و سنت', 'hadees-sunnat')","('حدیث کا معنی، مفہوم اور اقسام', 'hadees-ka-mana-mafhom-aur-aqsaam')"
28-03-2019,https://www.banuri.edu.pk/readquestion/کیا-حضرت-عیسی-و-حضرت-یحی-علیہما-السلام-نے-شادی-نہیں-کی-تھی/28-03-2019,کیا حضرت عیسی و حضرت یحی علیہما السلام نے شادی نہیں کی تھی؟,کیا حضرت یحی و حضرت عیسی علیہما السلام نے شادی نہیں کی تھی؟  روایات میں کیا ملتا ہے؟,"<p><p style=""text-align:justify;"">حضرت یحیٰ علیہ السلام کے نکاح کرنے یا نہ کرنے سے متعلق روایات میں ہمیں کوئی صراحت نہیں ملی، البتہ مستدرک حاکم میں حضرت کعب رضی اللہ عنہ کی ایک روایت ہے، جس پر علامہ ذہبی رحمہ اللہ نے سکوت اختیار کیا ہے،  (بعض نے اس کی سند کو ""واہ""کہا ہے)اس میں ہے کہ</p><p class=""indent"" style=""text-align:justify;""><span class=""ar_writing"">""کان یحیی بن زکریا سیدًا و حصورًا، و کان لایقرب النساء و لایشتھیھنّ و کان شابًّا حسن الوجه و الصورۃ ... الخ"" </span></p><p style=""text-align:justify;""> یہاں بھی  ان کے نکاح نہ کرنے پر کوئی صراحت نہیں ہے۔</p><p style=""text-align:justify;"">تاہم اللہ تعالیٰ نے قرآن مجید میں ان کی ایک اعزازی صفت ""حصور"" کا ذکر کیا ہے، لفظ ""حصور"" کو راجح قول کے مطابق مفسرین نے مبالغہ کا صیغہ قرار دیا ہے ، جس کے معنیٰ ""حد درجہ عورتوں سے خود کو روکنے والا "" کے ہیں، اس سے ان کی شادی نہ کرنے کا اشارہ ملتا ہے۔ لیکن صریح طور پر ان کا نکاح کرنا یا نہ کرنا ہمیں تلاش کے باوجود معلوم نہ ہوسکا۔</p><p style=""text-align:justify;"">اورحضرت عیسی علی نبینا وعلیہ السلام کے شادی کرنے یا نہ کرنے سے متعلق بھی کوئی ثابت شدہ روایت نہیں ملی ، البتہ ان کے دوبارہ نزول کے بعد  نکاح کرنے سے متعلق نعیم بن حماد رحمہ اللہ نے ""کتاب الفتن"" میں ایک روایت نقل کی ہے :</p><p class=""indent"" style=""text-align:justify;""><span class=""ar_writing"">""قال: بلغني أنّ عیسیٰ ابن مریم، إذا قتل الدجال رجع إلی بیت المقدس، فیتزوّج إلی قوم شعیب ختن موسیٰ، و هم جذام، فیولد له فیهم، و تقیم تسع عشرة سنة لایکون أمیر و لا شرطي، و لا ملك.""</span></p><p style=""text-align:justify;"">اس کے ایک راوی یحیی بن سعید العطار ہیں جو کہ ضعیف ہیں۔ بہرحال اس روایت سے ان کے نزول دنیا کے بعد نکاح کرنے کا ذکر ملتا ہے ۔  فقط واللہ سبحانہ وتعالیٰ اعلم </p></p>",144007200394,banuri,"('ایمان و عقائد', 'aqaed')","('اسلامی عقائد', 'islami-aqaed')","('انبیاء و رسل علیہم السلام', 'anbiya-o-rusul-alayhim-us-salam')"
