issued_at,link,title,question,answer,fatwa_number,dar_ul_ifta,kitab,bab,fasal
29-02-2024,https://www.banuri.edu.pk/readquestion/marhoom-ki-magfirat-ky-liy-70-hazar-martaba-kalmy-ka-khatam-karna-144508101638/29-02-2024,مرحوم کی مغفرت کے لیے ستر ہزار مرتبہ کلمہ کا ختم کرنا,کیا 70 ہزار مرتبہ کلمہ پڑھنا اور والد یا والدہ یا کوئی بھی ہو اس کے پیچھے بخش کرنے سے واقعۃ مرحوم کی بخشش ہو جاتی ہے؟,"<p><p style=""text-align:justify;"">تلاش کے باوجود رسول اللہ ﷺ سے سندًا منقول ایسی روایت نہیں مل سکی جس میں ستر ہزار مرتبہ کلمہ طیبہ پڑھنے سے مغفرت کی بشارت کا ذکر ہو۔ البتہ ملا علی قاری رحمہ اللہ نے مرقاة المفاتیح میں ابن عربی رحمہ اللہ کی حوالہ سے نقل کی ہے، جس کی کوئی سند نہیں، اور اس کی صحت کے لیے خود ابن عربی رحمہ اللہ کےپاس موجود کسی نوجوان کے کشف کا تذکرہ کیا ہے،تاہم احادیثِ مبارکہ کی تصحیح وتضعیف کشف وغیرہ کی وجہ سے نہیں ہوسکتی ہے، اس لیے اس روایت کو حضور صلی اللہ علیہ وسلم کی طرف منسوب کرکے بیان کرنا درست نہیں ہے۔</p><p style=""text-align:justify;"">البتہ کلمۂ طیبہ کے دیگر بہت سے فضائل احادیثِ مبارکہ سے ثابت ہیں، اور احادیثِ مبارکہ سے معلوم ہوتاہے کہ یہ کلمہ ایک مرتبہ بھی اِخلاص کے ساتھ کہہ دیا جائے تو انسان کی اَبدی کامیابی اور کامل مغفرت کا، یا بالآخر مغفرت کا ذریعہ بن جاتاہے، لہذا اس کی نسبت آپ ﷺ کی طرف کیے بغیر اگر مغفرت کی امید پر ستر ہزار مرتبہ کلمہ طیبہ پڑھ لیا جائے تو اجر و ثواب سے خالی نہ ہوگا، اور اگر بیان کرنا ہے ملاعلی قاری کے حوالے سے ایک بزرگ کے کشف کے طور پر ذکر کرے، واضح رہے کہ کشف شرعی دلیل نہیں ہے۔</p><p style=""text-align:justify;"">مرقاۃ المفاتیح میں ہے:</p><p class=""indent"" style=""text-align:justify;""><span class=""ar_writing"">""قال الشيخ محيي الدين بن العربي: أنه بلغني «عن النبي صلى الله عليه وسلم أن من قال: لا إله إلا الله سبعين ألفا غفر له، ومن قيل له غفر له أيضا»، فكنت ذكرت التهليلة بالعدد المروي من غير أن أنوي لأحد بالخصوص، بل على الوجه الإجمالي، فحضرت طعاما مع بعض الأصحاب، وفيهم شاب مشهور بالكشف، فإذا هو في أثناء الأكل أظهر البكاء فسألته عن السبب فقال: أرى أمي في العذاب فوهبت في باطني ثواب التهليلة المذكورة لها فضحك وقال: إني أراها الآن في حسن المآب، قال الشيخ: فعرفت صحة الحديث بصحة كشفه، ‌وصحة ‌كشفه بصحة الحديث.""</span></p><p class=""indent"" style=""text-align:left;"">(مرقاة المفاتيح شرح مشكاة المصابيح،ج3، ص879، ط: دار الفكر، بيروت – لبنان)</p><p class=""indent"" style=""text-align:justify;"">’’ شیخ محی الدین ابن عربی رحمۃ اللہ علیہ فرماتے ہیں کہ یہ حدیث ہم تک پہنچی ہے کہ جو ستر ہزار مرتبہ لَاۤ اِلٰه اِلَّا الله پڑھے یا پڑھ کر کسی کو بخش بھی دے تو جس کو ثواب بخشا جائے گا اس کی مغفرت ہوجائے گی اور پڑھنے والے کو بھی بخش دیا جائے گا۔ تو میں اس کے بہت سے مجموعہ اپنے پاس پڑھ کر رکھ لیے، ایک مرتبہ ایک دعوت میں بعض ساتھیوں کے ساتھ جمع ہوا تو وہاں دسترخوان پر ایک نوجوان آیا جس کا کشف مشہور تھا، اس نے کھانا شروع کردیا، اتنے میں کھاتے کھاتے زور سے رونے لگا، وہ رویا تو میں نے پوچھا تم رو کیوں رہے ہو حالاں کہ دسترخوان پر اتنے عمدہ عمدہ کھانے کھا رہے ہو؟اس نے کہا: میں اپنی ماں کو عذاب میں دیکھ رہاہوں، میں نے اس کی ماں کو ستر ہزار لااِلٰه اِلَّا الله کا ثواب بخش دیا۔ تو وہ نوجوان زور سے ہنسا تو میں نے پوچھا تم کیوں ہنسے؟ اس نے کہا: میں اپنی ماں کو جنت میں دیکھ رہا ہوں۔ شیخ فرماتے ہیں کہ اس کے کشف سے میرا اس حدیث کی صحت پر یقین اور بڑھ گیا اور حدیث کی صحت سے اس کے کشف پر یقین اور بڑھ گیا کہ یہ واقعی ولی اللہ اور صاحبِ کشف ہے۔‘‘</p><p class=""indent"" style=""text-align:left;""> فقط واللہ اعلم</p></p>",144508101638,banuri,"('جنائز', 'janaiz')","('ایصالِ ثواب', 'ieesaal-e-sawaab')","('میت کے سوئم، چہلم اور قرآن خوانی وغیرہ کے احکام', 'mayyat-ke-soem-chehlum-aur-quran-khuwani-wagera-ke-ahkaam')"
26-09-2023,https://www.banuri.edu.pk/readquestion/wlatfrqo-ki-tfseer-144503101054/26-09-2023,’’ولاتفرقوا‘‘ کی تفسیر,آج کل کچھ سوشل میڈیا سکالرز یہ دعویٰ کرتے ہیں کہ جب قرآن کی اتنی واضح آیت ہے :وَٱعۡتَصِمُواْ  بِحَبۡلِ ٱللَّهِ جَمِيعٗا وَلَا تَفَرَّقُواْۚتو پھر مسلمانوں نے دین میں تفرقے کیوں بنائے ہیں کوئی کہتا ہے میں دیوبندی ہوں، کوئی کہتا ہے میں بریلوی ہوں، کوئی کہتا ہے میں اہلحدیث ہوں ، کوئی کہتا ہے کہ میں شیعہ ہو اور ہر فرقے کے علیحدہ علیحدہ علماء بھی ہیں ۔ جبکہ میرا تعلق خود بھی مسلک دیوبند سے ہے ۔ براہ کرم میری رہنمائی فرمائیں کہ جب قرآن میں واضح حکم موجود ہے کہ فرقے بنانا جائز نہیں ہے تو پھر ہم لوگوں نے دین میں فرقے کیوں بنائے ہوئے ہیں ۔,"<p><p style=""text-align:justify;"">قرآنی آیا ت کا مدعا بھی  یہ ہے کہ امت کو فرقوں میں  نہیں بٹنا چاہیے،ظاہر ہے کہ امت کے بٹنے کا امکا ن تھا  جبہی  تو عدم تفریق کا حکم نازل ہو ا ہے چنانچہ  اس امت میں فرقہ بندی ہو نا خود حضور ﷺ کی زبان اطھر سے بیان ہو ئی ہے  اس لیے امت کا مختلف  فرقوں میں بٹنا  امر واقعی ہے البتہ ان  میں سے راہ حق کا معیار   پیرو کا ر اور طریق نبوی کا متبع  کو ن ہے؟  تو  اس کا معیا ر  خود نبی اکرم ﷺ نے متعین  فرمادیا ہے  وہ معیار یہ ہے: حضور اقدسﷺ کا ارشاد ہے کہ بلا شبہ میری امت پر ایسا زمانہ آئے گا جیسا بنی اسرائیل پر آیا تھا یعنی    بنی اسرائیل بہتر فرقوں میں تقسیم ہو گئے تھے،میری امت تہتر فرقوں میں تقسیم ہو جائے گی  اور  ان میں سے 72 فرقے دوزخی ہو ں گے  ان میں سے صرف ایک فرقہ جنت میں جائے گا ، صحابہ نے عرض کیا کہ یا رسو ل اللہ  وہ  جنتی فرقہ کون سا ہو گا؟ آپ ﷺ نے فرمایا کہ  جو   اس راستے پر ہو گا  جو میرا اور میرے صحابہ  کا ہے ، اور اسی ناجی فرقہ کانام  اہل سنت والجماعت ہے اور حضور ﷺ کی سنت کو اپنا نے  والے اور صحابہ کرام رضوا ن اللہ عنھم اجمعین کے طریقے کو لازم پکڑنے والے ہیں ،  اسی طرح ایک حدیث میں رسو ل اللہ ﷺ نے ارشاد فرمایا کہ بڑی جماعت کی پیروی کرو،اسی طرح حضرت   انس رضی اللہ عنہ فرماتے ہیں  نبی ﷺ نے فرمایا کہ جس  نے میری سنت کو محبوب رکھا اس نے مجھ کو محبوب رکھا جس نے مجھ کو محبوب رکھا تو  وہ جنت میں میرے ساتھ ہو گا ، لہذا اس  سے معلوم ہو اکہ اس امت میں فرقے پیدا ہوں مگر ایک  ہی فرقہ ناجی ہو گا، لہذا یہ دیکھا جائے جو  فرقہ حضور ﷺ کے راستے پر اور صحابہ کرام رضوان اللہ عنہم اجمعین کے راستے  پر ہے  افراط اور تفریط کا شکار نہ  ہو ، سنت کا پیرو کا ر ہو ، بدعت کا مرتکب نہ وہ ہی حق پر ہیں اور  ان ہی کی اتباع کی جائے ،  جو ا س  پر پو را اتر رہا ہو  وہ فرقہ صحیح ہے  باقی غلط ہیں ،اگر   انصاف سے جائز ہ لیا جائے تو اس معیار  پر  علمائے دیوبند  اور ان کے پیرو کار  پورے اتر  تے ہیں ، اور ہمارے ممالک میں علماء دیوبند ہی اہل سنت والجماعت کے ترجمان ہیں۔</p><p style=""text-align:justify;"">مشکوۃ المصابیح میں ہے :</p><p class=""indent"" style=""text-align:justify;""><span class=""ar_writing"">""وَعَنْ عَبْدِ اللَّهِ بْنِ عَمْرٍو قَالَ قَالَ رَسُولُ اللَّهِ صَلَّى اللَّهُ عَلَيْهِ وَسَلَّمَ: «لَيَأْتِيَنَّ عَلَى أُمَّتِي مَا أَتَى عَلَى بَنِي إِسْرَائِيلَ حَذْوَ النَّعْلِ بِالنَّعْلِ حَتَّى إِنَّ كَانَ مِنْهُمْ مَنْ أَتَى أُمَّهُ عَلَانِيَةً لَكَانَ فِي أُمَّتِي مَنْ يَصْنَعُ ذَلِكَ وَإِنَّ بَنِي إِسْرَائِيلَ تَفَرَّقَتْ عَلَى ثِنْتَيْنِ وَسَبْعِينَ مِلَّةً وَتَفْتَرِقُ أُمَّتِي عَلَى ثَلَاثٍ وَسَبْعِينَ مِلَّةً كُلُّهُمْ فِي النَّارِ إِلَّا مِلَّةً وَاحِدَةً قَالُوا وَمن هِيَ يَا رَسُولَ اللَّهِ قَالَ مَا أَنَا عَلَيْهِ وأصحابي» . رَوَاهُ التِّرْمِذِيّ""</span></p><p class=""indent"" style=""text-align:left;""><span class=""ar_writing"">(کتاب الإیمان، باب الاعتصام والسنة،الفصل الثاني،61/1،ط: المكتب الإسلامي)</span></p><p style=""text-align:justify;"">مشكوة المصابيح  میں ہے:</p><p class=""indent"" style=""text-align:justify;""><span class=""ar_writing"">""وَعَن أنس قَالَ: قَالَ لِي رَسُولُ اللَّهِ صَلَّى اللَّهُ عَلَيْهِ وَسَلَّمَ: «يَا بُنَيَّ إِنْ قَدَرْتَ أَنْ تصبح وتمسي لَيْسَ فِي قَلْبِكَ غِشٌّ لِأَحَدٍ فَافْعَلْ» ثُمَّ قَالَ: «يَا بني وَذَلِكَ من ‌سنتي وَمن أَحْيَا ‌سُنَّتِي فَقَدْ أَحَبَّنِي وَمَنْ أَحَبَّنِي كَانَ مَعِي فِي الْجنَّة» . رَوَاهُ التِّرْمِذِيّ""</span></p><p class=""indent"" style=""text-align:left;""><span class=""ar_writing"">(کتاب الإیمان، باب الاعتصام والسنة،الفصل الثاني،62/1،ط: المكتب الإسلامي)</span></p><p style=""text-align:justify;"">سنن ابن ماجہ ميں ہے :</p><p class=""indent"" style=""text-align:justify;""><span class=""ar_writing"">حَدَّثَنَا الْعَبَّاسُ بْنُ عُثْمَانَ الدِّمَشْقِيُّ قَالَ: حَدَّثَنَا الْوَلِيدُ بْنُ مُسْلِمٍ قَالَ: حَدَّثَنَا مُعَانُ بْنُ رِفَاعَةَ السَّلَامِيُّ قَالَ: حَدَّثَنِي أَبُو خَلَفٍ الْأَعْمَى، قَالَ: سَمِعْتُ أَنَسَ بْنَ مَالِكٍ، يَقُولُ: سَمِعْتُ رَسُولَ اللَّهِ صَلَّى اللهُ عَلَيْهِ وَسَلَّمَ، يَقُولُ: «إِنَّ أُمَّتِي لَا تَجْتَمِعُ عَلَى ‌ضَلَالَةٍ، فَإِذَا رَأَيْتُمُ اخْتِلَافًا فَعَلَيْكُمْ بِالسَّوَادِ الْأَعْظَمِ».</span></p><p class=""indent"" style=""text-align:left;""><span class=""ar_writing"">(كتاب الفتن، باب سواد الأعظم،1303/2،دار إحياء الكتب العربية)</span></p><p style=""text-align:justify;"">سنن ابن ماجہ ميں ہے :</p><p class=""indent"" style=""text-align:justify;""><span class=""ar_writing"">""وَسَتَرَوْنَ مِنْ بَعْدِي اخْتِلَافًا شَدِيدًا، ‌فَعَلَيْكُمْ بِسُنَّتِي، وَسُنَّةِ الْخُلَفَاءِ الرَّاشِدِينَ الْمَهْدِيِّينَ، عَضُّوا عَلَيْهَا بِالنَّوَاجِذِ، وَإِيَّاكُمْ وَالْأُمُورَ الْمُحْدَثَاتِ، فَإِنَّ كُلَّ بِدْعَةٍ ضَلَالَةٌ»""</span></p><p class=""indent"" style=""text-align:left;""><span class=""ar_writing"">(کتاب الفتن ، باب اتباع سنة الخلفاء الراشدین المھدیین،15/1،</span><span style=""font-family:arabic_font;font-size:23px;font-weight:600;text-align:left;"">دار إحياء الكتب العربية)</span></p><p style=""text-align:justify;"">واضح رہے کہ فرقہ کا تعلق عقائد سے ہے، مسائل سے نہیں، اور مسائل میں جو اختلاف ہوتا ہے اس سے فرقہ نہیں بنتا مسلک بنتا ہے، اس لیے ائمۂ اربعہ میں اختلاف ہے، اس کو فرقہ واریت نہیں کہتے اس کو مسلک کا اختلاف کہتے ہیں اور مسلک کے اختلاف پر وعید نہیں ہے۔</p><p class=""indent"" style=""text-align:left;"">فقط واللہ اعلم </p></p>",144503101054,banuri,"('علوم و فنون', 'uloom-funoon')","('متعلقات قرآن کریم', 'quran-kareem')","('ترجمہ و تفسیر ، تعارف اور اقسام', 'tarjama-o-tafseer-taaruf-aur-aqsaam')"
29-01-2024,https://www.banuri.edu.pk/readquestion/ali-yar-ahmad-naam-rakhne-ka-hukm-144507101561/29-01-2024,علی یار احمد نام رکھنے کا حکم,میں نے اپنے بیٹے کا نام علی یار احمد رکھا ہے؟ یہ نام اسلام کے حوالے سے درست ہے؟,"<p><p style=""text-align:justify;"">صورتِ مسئولہ میں ""علی یار احمد "" نام رکھنا درست ہے، تاہم بہتر یہ ہے کہ صرف علی احمد نام رکھا جائے۔</p><p style=""text-align:justify;"">أسد الغابة  میں ہے:</p><p class=""indent"" style=""text-align:justify;""><span class=""ar_writing"">""عليّ بْن أَبِي طَالِب بْن عَبْد المطلب بْن هاشم بْن عَبْد مناف بْن قصي بْن كلاب بْن مرة بْن كعب بْن لؤي الْقُرَشِيّ الهاشمي ابْن عم رَسُول اللَّه صَلَّى اللَّهُ عَلَيْهِ وَسَلَّمَ واسم أَبِي طَالِب عَبْد مناف، وقيل: اسمه كنيته، واسم هاشم: عَمْرو، وأم عليّ فاطمة بِنْت أسد بْن هاشم، وكنيته: أَبُو الْحَسَن أخو رَسُول اللَّه صَلَّى اللَّهُ عَلَيْهِ وَسَلَّمَ وصهره عَلَى ابنته فاطمة سيدة نساء العالمين، وَأَبُو السبطين، وهو أول هاشمي والد بين هاشميين، وأول خليفة من بني هاشم، وكان عليّ أصغر من جَعْفَر، وعقيل، وطالب.""</span></p><p class=""indent"" style=""text-align:left;""><span class=""ar_writing"">(حرف العین، باب العین و اللام ،ج :4،ص:87، ط:دار الکتب العلمية)</span></p><p style=""text-align:justify;"">عمدة القاري شرح صحيح البخاري"" میں ہے:</p><p class=""indent"" style=""text-align:justify;""><span class=""ar_writing"">""عن محمد بن جبير بن مطعم عن أبيه رضي الله عنه قال قال رسول الله صلى الله عليه وسلم - لي خمسة أسماء أنا محمد وأحمد وأنا الماحي الذي يمحو الله به الكفر وأنا الحاشر الذي يحشر الناس على قدمي وأنا العاقب.."" أنا محمد "" هذا هو الأول من الخمسة وقال السهيلي في الروض لا يعرف في العرب من تسمى محمدا قبل النبي صلى الله عليه وسلم..وأنا أسمي محمد، كثير الخصال الحميدة، وألهم الله أهله أن يسموه به لما علم من حميد صفاته، وفي المثل المشهور: الألقاب تنزل من السماء.""</span></p><p class=""indent"" style=""text-align:left;""><span class=""ar_writing"">(باب ما جاء في أسماء النبي صلى الله عليه وسلم، ج:16، ص:96، 97، ط:دار إحياء التراث العربي)</span></p><p style=""text-align:justify;"">معجم اللغۃ العربیۃ المعاصرۃ میں ہے:</p><p class=""indent"" style=""text-align:justify;""><span class=""ar_writing"">""أحمد [مفرد]: ‌من ‌أسماء ‌النبي صلى الله عليه وسلم "" {ومبشرا برسول يأتي من بعدي اسمه أحمد}.""</span></p><p class=""indent"" style=""text-align:left;""><span class=""ar_writing"">(مادة:حمد، ج:1، ص: 556، ط: عالم الکتب)</span></p><p style=""text-align:justify;"">فیروز اللغات میں ہے:</p><p class=""indent"" style=""text-align:justify;"">""یار ؛دوست، مددگار، معشوق، محبوب۔""</p><p class=""indent"" style=""text-align:left;"">(مادۃ:یار، ص:725، ط:فیروز سنز)</p><p class=""indent"" style=""text-align:left;"">فقط واللہ اعلم</p></p>",144507101561,banuri,"('حظر و اباحت', 'mamnooaat-mubahat')","('نام، لقب، کنیت', 'asaami')","('ناموں کے معانی اور احکام', 'namoun-ke-mani-or-ahkaam')"
11-11-2023,https://www.banuri.edu.pk/readquestion/iskat-e-hamall-kay-jawaz-ki-surat-144504102490/11-11-2023,اسقاط حمل کے جواز کی صورت,میری تین مہینے پہلے ایک بچی پیداہوئی ہے، اور ابھی پھر سے بیوی حاملہ ہوگئی ہے، تقریبا ڈیڑھ مہینہ ہواہے، کیااب حمل کااسقاط جائزہے ؟,"<p><p style=""text-align:justify;"">واضح رہے کہ حمل ضائع کرنے کے بارے میں شرعی اصول یہ ہے  کہ اگر  حمل  چار  ماہ  سے  کم کا ہو،  اور  ماہر ڈاکٹر  یہ   کہہ دے کہ بچہ کی پیدائش کی وجہ سے  ماں کی جان کو یقینی یا غالب گمان کے مطابق خطرہ ہے یا ماں کی صحت اس حمل کاتحمل نہیں کرپاۓ گی،  تو ان  جیسےاعذار کی بنا پر  حمل میں روح پڑجانے سے پہلے    پہلے  (جس کی مدت تقریباً چار ماہ ہے)    اسے ساقط کرنے کی گنجائش ہوگی، البتہ چار ماہ کے بعد کسی صورت میں اسقاط حمل جائزنہیں ہے،لہذا صورتِ مسئولہ میں اگر کسی خاتون کے بہت زیادہ کمزور ہونے کی وجہ سےماں یابچےکی جان جانے کا اندیشہ ہو، اور ڈاکٹر کی رائے کے مطابق اسقاطِ حمل ضروری ہو، تو مذکورہ  اعذار کی بناء پر   حمل  میں روح پڑجانے سے پہلے پہلے (جس کی مدت تقریباً چار ماہ ہے)  حمل  کو ساقط کرناجائزہے۔</p><p>فتاوی شامی میں ہے:</p><p class=""indent"" style=""text-align:justify;""><span class=""ar_writing"">""ویکره أن تسعی لإسقاط حملها، وجاز لعذر حیث لایتصور.... (قوله: ویکره الخ) أي مطلقًا قبل التصور و بعد علی ما اختاره في الخانیة کما قد مناه قبیل الا ستبراء، وقال: إلا أنّها لاتأثم إثم القتل. (قوله: وجاز لعذر) کالمرضعة إذا ظهربه الحبل وانقطع لبنها ولیس لأب الصبي ما یستأجر به الظئر وخاف هلاك الولد، قالوا: یباح لها أن تعالج في استنزال الدم مادام الحمل مضغة أو علقة ولم یخلق له عضو، وقدروا تلك المدة بمائة وعشرین یوماً، وجاز؛ لأنّه لیس بآدمي، وفیه صیانة الآدمي، خانیة.""</span></p><p class=""indent"" style=""text-align:left;""><span class=""ar_writing"">(كتاب الحظر والإباحة، باب الاستبراء وغيره، فصل في البيع، فرع يكره إعطاء سائل المسجد إلا إذا لم يتخط رقاب الناس، ج:6  ص:429 ط: سعید)</span></p><p class=""indent"" style=""text-align:left;""><span class=""ar_writing"">فقط واللہ اعلم</span></p></p>",144504102490,banuri,"('حظر و اباحت', 'mamnooaat-mubahat')","('علاج / معالجہ', 'ilaj-mualaja')","('اسقاط حمل', 'isqat-e-hamal')"
