issued_at,link,title,question,answer,fatwa_number,dar_ul_ifta,kitab,bab,fasal
07-03-2024,https://www.banuri.edu.pk/readquestion/youtube-se-earning-ka-hukam-144508102348/07-03-2024,یوٹیوب سے ارننگ کا حکم,آج کل بہت سارے نوجوان یوٹیوب سے کمائی کررہے ہیں ،اسلام میں یوٹیوب چینل مونیٹائز کرکے ارننگ کرنے کا کیا حکم ہے ؟,"<p><p style=""text-align:justify;"">یو ٹیوب پر جو پیسہ کمایا جاتا ہے اس میں درحقیقت صارف اپنا مواد  ویڈیو  کی شکل میں بنا کر یوٹیوب کو دیتا ہے اور یوٹیوب کے صارفین اس مواد کو زیادہ دیکھتے ہیں،  یا پسند کرتے ہیں تو اس پر ""یوٹیوب"" صارف کو طے شدہ رقم ادا کرتا ہے۔اس ادائیگی کے لیے وہ گوگل ایڈ سینس کا اکاؤنٹ استعمال کرتا ہے۔لہذا اپنی ویڈیوز کے ذریعے پیسے کمانے کے لیے ان شرائط کا لحاظ ضروری ہے:</p><p style=""text-align:justify;"">1-ویڈیوز میں کسی جان دار کی  تصویر نہ ہو۔</p><p style=""text-align:justify;"">2-ویڈیو میں کسی غیر شرعی اور ناجائز امر کی ترویج نہ   کی گئی ہو۔</p><p style=""text-align:justify;"">3- ویڈیو میں موسیقی نہ ہو۔</p><p style=""text-align:justify;"">4- پیسوں کی وصولی یا ادائیگی  کرنے مٰیں  کوئی سودی معاملہ  یا فاسد عقد نہ کرنا پڑتا ہو۔</p><p style=""text-align:justify;"">5-  جان دار کی تصاویر والے یا کسی طور پر بھی غیر شرعی اشتہارات اس چینل پر نہ چلتے ہوں۔</p><p style=""text-align:justify;"">اگر ان شرائط کا لحاظ رکھ کر چینل چلایا جاسکتاہے تو اس کی کمائی جائز ہوگی۔</p><p style=""text-align:justify;"">ہماری معلومات کے مطابق یوٹیوب پر ایسا چینل چلانا موجودہ دور میں تقریباً  ناممکن ہے، کیوں کہ اپنے تئیں اگر ان شرائط کا لحاظ رکھ بھی لیا جائے تو یوٹیوب انتظامیہ کی طرف سے چینل پر اپنی مرضی سے اشتہارات چلائے جاتے ہیں، جو مختلف ممالک اور علاقوں کے اعتبار سے تبدیل بھی ہوتے ہیں، جن میں بہت سے غیر شرعی امور پر مشتمل اشتہارات ہوتے ہیں، لہٰذا یوٹیوب پر چینل بناکر اس کے ذریعے کمانے سے اجتناب کیا جائے۔</p><p style=""text-align:justify;"">البحر الرائق میں ہے :</p><p class=""indent"" style=""text-align:justify;""><span class=""ar_writing"">""وظاهر كلام النووي في شرح مسلم الإجماع على تحريم تصويره صورة الحيوان وأنه قال: قال أصحابنا وغيرهم من العلماء: ‌تصوير ‌صور ‌الحيوان حرام شديد التحريم وهو من الكبائر لأنه متوعد عليه بهذا الوعيد الشديد المذكور في الأحاديث يعني مثل ما في الصحيحين عنه - صلى الله عليه وسلم - «أشد الناس عذابا يوم القيامة المصورون يقال لهم أحيوا ما خلقتم» ثم قال وسواء صنعه لما يمتهن أو لغيره فصنعته حرام على كل حال لأن فيه مضاهاة لخلق الله تعالى وسواء كان في ثوب أو بساط أو درهم ودينار وفلس وإناء وحائط وغيرها اهـ. فينبغي أن يكون حراما لا مكروها إن ثبت الإجماع أو قطعية الدليل لتواتره.""</span></p><p class=""indent"" style=""text-align:left;"">(باب مایفسد الصلاۃ وما یکرہ فیہا ،ج:2،ص:29،دارالکتاب الاسلامی)</p><p class=""indent"" style=""text-align:left;"">فقط واللہ اعلم</p></p>",144508102348,banuri,"('حظر و اباحت', 'mamnooaat-mubahat')","('متفرقات', 'mutafarriqaat')","('متفرقات ممنوعات و مباحات', 'muatafarriqaat-e-mamnooaat-o-mubahaat')"
29-02-2024,https://www.banuri.edu.pk/readquestion/jaedad-me-hissa-144508101661/29-02-2024,والد کی حیات میں جائیداد میں حصہ طلب کرنا,میرے والد صاحب نے دو شادیاں کی تھیں میری والدہ کو طلاق ہوئی ہے، میں اپنے ماں سے ایک بیٹا ہوں میں اپنے ماں کے ساتھ اپنے ماموں کے گھر رہ رہا ہوں میری دوسری سو تیلی ماں سے میرے 7 بھائی 2 بہنیں ہیں، میرے والد صاحب مجھے جائیداد میں حصہ نہیں دے رہا کہ میں اپنا گھر بنالوں شریعت میں اس کا کیا حکم ہے میرا جائیداد میں حصہ ہے اگر ہے تو کتنا؟,"<p><p style=""text-align:justify;"">صورتِ  مسئولہ میں سائل کے  والد اگر اپنی زندگی میں جائیداد تقسیم کر رہے ہیں تو سب اولاد کو برابر حصہ دینا چاہیے، بعض کو دینا اور بعض کو محروم کرناشرعًا جائز نہیں ،تاہم سائل کو والد کی حیات میں ان سے جائیداد مانگنے کا اختیار نہیں۔</p><p style=""text-align:justify;"">البحرالرائق ميں هے:</p><p class=""indent"" style=""text-align:justify;""><span class=""ar_writing"">""و في الخلاصة: المختار التسوية بين الذكر و الأنثى في الهبة.""</span></p><p class=""indent"" style=""text-align:left;""><span class=""ar_writing"">(كتاب الهبة، هبة الأب لطفلة: 7/ 288، ط: دار الكتب الإسلامي)</span></p><p class=""indent"" style=""text-align:left;"">فقط واللہ اعلم</p></p>",144508101661,banuri,"('فرائض', 'faraez')","('میراث کا بیان', 'meeraas-ka-bayan')","('وارث کو محروم کرنا', 'waaris-ko-mahroom-karna')"
06-01-2024,https://www.banuri.edu.pk/readquestion/muhammad-zaram-dawood-nam-144506102144/06-01-2024,محمد زارم داؤد نام,محمد زارم داؤد نام رکھنا درست ہے یا نہیں؟,"<p><p style=""text-align:justify;"">''زارم ''،''  زرم''  سے  ہے  لغت میں  اس کے معنی: ذلیل و رسوا، کنجوس، تنگ دست،   معنی مناسب نہ ہونے کی وجہ سے یہ  نام  رکھنا درست نہیں ہے۔</p><p style=""text-align:justify;"">بہتر ہے کہ صرف  ـ’محمد داؤد’ نام رکھ لیا جائے۔</p><p style=""text-align:justify;"">المعجم الوسیط میں  ہے :</p><p class=""indent"" style=""text-align:justify;""><span class=""ar_writing"">""(‌زرم) زرما ولى وَانْقطع يُقَال ‌زرم الدمع وزرم الْبَوْل وزرم الْكَلَام وزرم البيع وبخل وذل وضيق عَلَيْهِ فَهُوَ ‌زرم وَهِي زرمة"".</span></p><p class=""indent"" style=""text-align:left;"">(393/1،دار الدعوة)</p><p class=""indent"" style=""text-align:left;"">فقط والله أعلم</p></p>",144506102144,banuri,"('حظر و اباحت', 'mamnooaat-mubahat')","('نام، لقب، کنیت', 'asaami')","('ناموں کے معانی اور احکام', 'namoun-ke-mani-or-ahkaam')"
25-02-2024,https://www.banuri.edu.pk/readquestion/sadqa-fitar-ki-miqdar-sal-1445-144508101187/25-02-2024,صدقہ فطر کی مقدار,صدقہ  فطرمقدار سال 2024 کی بتادیں ۔,"<p><p style=""text-align:justify;"">صدقہ فطر  میں چار  اجناس (گندم،جو،کھجور،کشمش)میں سے کسی ایک جنس  کا دینا یا اس کی بازاری قیمت کادینا ضروری ہے، تفصیل مندرجہ ذیل ہے:</p><p class=""indent"" style=""text-align:justify;"">1۔گندم: نصف صاع یعنی پونے دو کلو   تاہم احتیاطًا دو کلو یا اس کی  بازاری قیمت دینی  چاہیے۔</p><p class=""indent"" style=""text-align:justify;"">2۔ جو :ایک صاع یعنی تقریبًا ساڑھے تین کلو یا اس کی  بازاری قیمت ہے۔</p><p class=""indent"" style=""text-align:justify;"">3۔کھجور:  ایک صاع یعنی تقریبًا  ساڑھے تین کلو یا اس کی  بازاری قیمت ہے۔</p><p class=""indent"" style=""text-align:justify;"">4۔کشمش: ایک  صاع یعنی تقریبًا  ساڑھے تین کلو یا اس کی  بازاری قیمت ہے۔</p><p style=""text-align:justify;"">لہذا   مذکورہ چار اجناس میں سے جس قسم سےصدقہ فطر ادا کرنا چاہیں تو اس کی بازاری قیمت معلوم کرکے اس کا حساب کرلیں،باقی جامعہ کی طرف سے   صدقہ فطر کی رقم کا تعین  شروع رمضان میں کیا جاتا ہے جو جامعہ کی ویب سائٹ پر   بھی جاری کیاجاتا ہے ۔</p><p style=""text-align:justify;"">صحیح بخاری میں ہے :</p><p class=""indent"" style=""text-align:justify;""><span class=""ar_writing"">""عن ‌عياض بن عبد الله بن سعد بن أبي سرح العامري : أنه سمع ‌أبا سعيد الخدري رضي الله عنه يقول:""كنا نخرج زكاة الفطر، صاعا من طعام، أو صاعا من شعير، أو صاعا من تمر، أو صاعا من أقط،أو صاعا من ‌زبيب.""</span></p><p class=""indent"" style=""text-align:left;"">(کتاب الصوم،باب صدقة الفطر صاع من طعام،ج:2،ص:131،ط: دارالفكر)</p><p style=""text-align:justify;"">سننِ نسائی میں ہے :</p><p class=""indent"" style=""text-align:justify;""><span class=""ar_writing"">""عن ‌ابن عباس قال:ذكرفي صدقة‌الفطرقال:صاعامن برأوصاعامن تمرأوصاعامن شعيرأوصاعامن سلت.""</span></p><p class=""indent"" style=""text-align:left;"">(كتاب الزكاة،باب مكيلةصدقة الفطر،ج:5،ص:51،ط: المكتبة النجارية بالقاهره)</p><p style=""text-align:justify;"">فتاوی ہندیہ میں ہے :</p><p class=""indent"" style=""text-align:justify;""><span class=""ar_writing"">""وانما تجب صدقة الفطر من اربعة اشیاء من الحنطة و الشعیر والتمر و الزبیب.""</span></p><p class=""indent"" dir=""ltr"" style=""text-align:justify;"">(باب صدقة الفطر، ج:1، ص:191، ط: مکتبة حقانیة)</p><p style=""text-align:justify;"">فتاوی ہندیہ میں ہے:</p><p class=""indent"" style=""text-align:justify;""><span class=""ar_writing"">""وھی نصف صاع من بر او صاع من شعیر او تمر.""</span></p><p class=""indent"" dir=""ltr"" style=""text-align:justify;"">(باب صدقة الفطر، ج:1، ص:191، ط: مکتبة حقانیة)</p><p style=""text-align:justify;"">فتاوی شامی میں ہے:</p><p class=""indent"" style=""text-align:justify;""><span class=""ar_writing"">""ودفع القیمة أي الدراھم أفضل من دفع العین علی المذھب المفتی به،لأن العلة فی أفضلیة القيمة کونھا أعون علی دفع حاجة الفقیر.""</span></p><p class=""indent"" dir=""ltr"" style=""text-align:justify;"">(باب صدقة الفطر،ج:2،ص:366،ط: سعید)</p><p class=""indent"" style=""text-align:left;"">  فقط والله أعلم</p></p>",144508101187,banuri,"('زکات', 'zakat')","('صدقہ فطر', 'sadqa-fitr')","('صدقہ فطر کی مقدار اور ثبوت', 'sadaqa-fitr-ki-miqdaar-aur-suboot')"
02-03-2024,https://www.banuri.edu.pk/readquestion/isqav-e-hamal-144508101790/02-03-2024,اسقاطِ حمل,حضراتِ مفتیانِ کرام سے درجِ ذَیل مسئلے میں راہ نمائی کی درخواست ہے۔ در اصل ایک خاتون کو پانچ مہینے کا حمل ہے، مگر متعدد ماہر ڈاکٹروں کی طبی جانچ سے معلوم ہوا ہے کہ خاتون کا حمل بڑی حد تک ناقص الخلقت ہے، مثلاً اس کے دل کا ایک چوتھائی حصّہ مفقود ہے، بایاں ہاتھ کُہنی سے موجود نہیں ہے۔ اسی طرح اس کا بایاں پیر اس قدر تیڑھا ہے کہ پِنڈلی سے مل گیا ہے، اس کا دماغ بھی اِعتدال پر نہیں ہے۔ نیز ایک گردہ تقریباً ختم ہو چکا ہے، حتیٰ کہ بچے کا پیٹ بھی نظر نہیں آ رہا ہے، اس کے علاوہ بہت سی خرابیاں ہیں۔ ڈاکٹروں کا کہنا ہے کہ بچے کی کسی بھی وقت موت واقع ہو سکتی ہے اور اگر زندہ رہ گیا تو مذکورہ تفصیلات کے مطابق وہ بالکل ناقص ہوگا، یعنی اس کے بعض اعضائے جسمانی ہی موجود نہیں ہوں گے۔ میں نے فتاویٰ بینات اور دارالعلوم دیوبند کے بے شمار فتاویٰ جات دیکھ ڈالے، مگر موجودہ صورتِ حال سے متعلق کوئی حکم مجھے نہ ملا۔ الحمدللہ مجھے اس بات کا علم ہے کہ چار ماہ کے بعد حمل کو ساقط کرنا جائز نہیں ہے، کیوں کہ اس میں روح پھونکی جا چکی ہوتی ہے، مگر میری بیان کردہ صورتِ حال انتہائی پیچیدہ ہے اور آپ حضرات کی از سرِ نو توجہ کی متقاضی ہے؟,"<p><p style=""text-align:justify;"">واضح رہے کہ اگر حمل سے عورت کی جان کو خطرہ  ہو یا کسی شدید نقصان کا اندیشہ ہو  اور کوئی  تجربہ کار مستند مسلمان ڈاکٹر اس کی تصدیق کردے  تو ایسے اعذار کی بنا پر  حمل میں روح پڑجانے سے پہلے   پہلے (جس کی مدت تقریباً چار ماہ ہے)    اسے ساقط کرنے کی گنجائش ہوگی، اور چار ماہ کے بعد کسی صورت میں اسقاطِ حمل جائزنہیں ہے۔</p><p style=""text-align:justify;"">لہذا صورتِ مسئولہ میں کسی مشین کی اسکیننگ کے ذریعہ  ماں کے پیٹ میں موجود بچے کا  ناقص الخلقت ہونا، اس کے دل کا ایک چوتھائی حصّے کا  مفقود ہونا، بایاں ہاتھ کُہنی سے موجود نہ ہونا، اس کا بایاں پیر اس قدر ٹیڑھا ہونا کہ پِنڈلی سے مل جانا، دماغ کا  اِعتدال پر نہ ہونا، گردے کا  تقریباً ختم ہو جانا،حتیٰ کہ بچے کا پیٹ بھی نظر  نہ آنا،یا ان سب صورتوں میں  بچے کی کسی بیماری اور اس سے پیدا ہونے والے خطرہ  کا علم یقینی نہیں، بل کہ گمان کے درجے میں ہوتا ہے،جوکہ اکثر غلط بھی ثابت ہوتا ہے اور اگربالفرض  یقینی بھی ہو تو خالقِ کائنات باقی کسی بھی دن اس مرض سے نجات دینے پر قدرت رکھتا ہے، اس صورت میں حمل کااسقاط کراوانااللہ کی قدرت پریقین نہ ہونے کی دلیل بھی ہے، اور اگربالفرض آخر وقت تک بھی بچہ مذکورہ مرض میں مبتلا رہے، پھر بھی اس کا اسقاط جائز نہیں؛ کیوں کہ بیمار انسان کو جان سے  مارنا جائز نہیں۔</p><p style=""text-align:justify;""><span class=""ur_writing"">فتاویٰ ھندیہ میں ہے:</span></p><p class=""indent"" style=""text-align:justify;""><span class=""ar_writing"">""‌وكذلك ‌المرأة ‌يسعها ‌أن ‌تعالج لإسقاط الحبل ما لم يستبن شيء من خلقه وذلك ما لم يتم له مائة وعشرون يوما ثم إذا عزل وظهر بها حبل هل يجوز نفيه؟ قالوا إن لم يعد إلى وطئها أو عاد بعد البول ولم ينزل جاز له نفيه وإلا فلا كذا في التبيين.""</span></p><p class=""indent"" style=""text-align:left;""><span class=""ar_writing"">( كتاب النكاح، الباب التاسع في نكاح الرقيق، فصول في خيار العتق، ج:1، ص:335، ط: دار الفکر- بیروت)</span></p><p style=""text-align:justify;""><span class=""ur_writing"">و فیہ ایضاً:</span></p><p class=""indent"" style=""text-align:justify;""><span class=""ar_writing"">""وإن أسقطت بعد ما استبان خلقه وجبت الغرة كذا في فتاوى قاضي خان.</span></p><p class=""indent"" style=""text-align:justify;""><span class=""ar_writing"">العلاج لإسقاط الولد إذا استبان خلقه كالشعر والظفر ونحوهما لا يجوز وإن كان غير مستبين الخلق يجوز وأما في زماننا يجوز على كل حال وعليه الفتوى كذا في جواهر الأخلاطي.</span></p><p class=""indent"" style=""text-align:justify;""><span class=""ar_writing"">وفي اليتيمة سألت علي بن أحمد عن إسقاط الولد قبل أن يصور فقال أما في الحرة فلا يجوز قولا واحدا وأما في الأمة فقد اختلفوا فيه والصحيح هو المنع كذا في التتارخانية.""</span></p><p class=""indent"" style=""text-align:left;""><span class=""ar_writing"">(کتاب الکراهیة، الباب الثامن عشر في التداوي والمعالجات وفیه العزل وإسقاط الولد، ج:5، ص:356، ط: دار الفکر-بیروت)</span></p><p class=""indent"" style=""text-align:left;""><span class=""ar_writing"">فقط واللہ اعلم</span></p></p>",144508101790,banuri,"('جنایات', 'jinayaat')","('جنین', 'janeen')","('جنین کے احکام', 'janeen-ke-ahkaam')"
04-03-2024,https://www.banuri.edu.pk/readquestion/sotele-walda-ki-tarka-me-meras-ka-hukam-144508102046/04-03-2024,سوتیلی والدہ کے ترکہ میں میراث کا حکم,میرے والد صاحب محکمہ پولیس میں آفیسر تھے، 2011 میں میری والدہ کا انتقال ہوا تو والد صاحب نے 2012 میں دوسری شادی کی، 2021 میں میرے والد صاحب کا بھی انتقال ہوا، والد کی پہلی بیوی سے ہم چار بھائی اور چار بہنیں ہیں، اور دوسری بیوی سے کوئی اولاد نہیں ہے، والد صاحب نے جب جائیداد تقسیم کی تو والد کی دوسری بیوی یعنی ہماری سوتیلی ماں کے حصے میں ایک دکان آئی، اب 2023 میں ہماری سوتیلی ماں کا بھی انتقال ہوا ،سوتیلی ماں کی کوئی اولاد نہیں ہے،لیکن ان کی بیوہ والدہ، دو بھائی اور دو بہنیں ہیں،میرا سوال یہ ہے کہ سوتیلی ماں کو جو دکان ملی تھی، اب ان کے انتقال کے بعد یہ دکان کس کی ملکیت ہے؟,"<p><p style=""text-align:justify;"">صورتِ مسئولہ میں  سائل کی سوتیلی والدہ مرحومہ  کا ترکہ ان کے شرعی ورثاء   یعنی   مرحومہ کی والدہ اور حقیقی بہن بھائیوں  میں  ان کے شرعی حصوں کے تناسب سے تقسیم  ہوگا ،سائل اور سائل کے بہن بھائیوں کا ان  کے ترکہ میں کوئی حق وحصہ نہیں  ہے۔</p><p style=""text-align:justify;""><span lang=""ar-sa"" xml:lang=""ar-sa"">اور مرحومہ کے ترکہ کی تقسیم کا    طریقہ یہ ہے کہ </span><span lang=""er"" xml:lang=""er"">سب سے پہلےمرحومہ کے حقوقِ متقدمہ یعنی تجہیز و تکفین کا خرچہ نکالنے کے بعد، اگر مرحومہ کے ذمہ کسی کا کوئی قرض ہو تو  اسے ادا کرنے کے بعد، اگر مرحومہ نے کوئی جائز وصیت کی ہو تو اسے ایک تہائی ترکہ میں سے نافذ کرنے کے بعد، باقی کل جائیداد منقولہ وغیر منقو لہ  کو36حصوں</span><span lang=""ar-sa"" xml:lang=""ar-sa""> میں تقسیم کر  کے6</span><span lang=""ar-sa"" xml:lang=""ar-sa"">حصے  مرحومہ </span>کی   والدہ کو،10<span lang=""ar-sa"" xml:lang=""ar-sa""> حصےکر کے    مرحومہ      </span>کےہر ایک  بھائی کو اور5 <span lang=""ar-sa"" xml:lang=""ar-sa"">حصے کر کے  مرحومہ  کی</span>  ہر ایک <span lang=""ar-sa"" xml:lang=""ar-sa""> بہن</span> کو  ملیں گے۔</p><p dir=""rtl"" style=""text-align:justify;"">صورتِ تقسیم یہ ہے:</p><p dir=""rtl"" style=""text-align:justify;"">میت: 6/ 36</p><table border=""1"" style=""border-collapse:collapse;width:100%;""><tbody><tr><td style=""text-align:center;"">والدہ</td><td style=""text-align:center;"">بھائی</td><td style=""text-align:center;"">بھائی</td><td style=""text-align:center;"">بہن</td><td style=""text-align:center;"">بہن</td></tr><tr><td style=""text-align:center;"">1</td><td colspan=""4"" style=""text-align:center;"">5</td></tr><tr><td style=""text-align:center;"">6</td><td style=""text-align:center;"">10</td><td style=""text-align:center;"">10</td><td style=""text-align:center;"">5</td><td style=""text-align:center;"">5</td></tr></tbody></table><p dir=""rtl"" style=""text-align:justify;""><span lang=""ar-sa"" xml:lang=""ar-sa"">یعنی فیصد کے اعتبار سے </span><span lang=""ar-sa"" xml:lang=""ar-sa"">16<span lang=""ar-sa"" xml:lang=""ar-sa""><span lang=""ar-sa"" xml:lang=""ar-sa"">.66</span></span>فیصد  مرحومہ کی والدہ</span> کو،27<span lang=""ar-sa"" xml:lang=""ar-sa""><span lang=""ar-sa"" xml:lang=""ar-sa"">.77</span> فیصد  مرحومہ کے </span>  ہر ایک بھائی کو،13<span lang=""ar-sa"" xml:lang=""ar-sa"">.88فیصد  مرحومہ کی</span>  ہر ایک بہن    کو ملیں گے۔ </p><p style=""text-align:justify;"">بدائع الصنائع میں ہے:</p><p class=""indent"" style=""text-align:justify;""><span class=""ar_writing"">""‌لأن ‌الإرث ‌إنما ‌يجري في المتروك من ملك أو حق للمورث على ما قال «- عليه الصلاة والسلام - من ترك مالا أو حقا فهو لورثته».""</span></p><p class=""indent"" style=""text-align:left;""><span class=""ar_writing"">(كتاب الحدود، فصل في شرائط جواز إقامة الحدود، ج:7، ص:57، ط: دار الكتب العلمية)</span></p><p style=""text-align:justify;"">تبیین الحقائق میں ہے:</p><p class=""indent"" style=""text-align:justify;""><span class=""ar_writing"">""(والأخوات لأب وأم كبنات الصلب عند عدمهن) أي عند عدم البنات وبنات الابن حتى يكون للواحدة النصف، وللثنتين الثلثان، ومع الإخوة لأب وأم للذكر مثل حظ الأنثيين لقوله تعالى {قل الله يفتيكم في الكلالة إن امرؤ هلك ليس له ولد وله أخت فلها نصف ما ترك وهو يرثها إن لم يكن لها ولد فإن كانتا اثنتين فلهما الثلثان مما ترك وإن كانوا إخوة رجالا ونساء فللذكر مثل حظ الأنثيين} [النساء: 176].""</span></p><p class=""indent"" style=""text-align:left;""><span class=""ar_writing"">(كتاب الفرائض، أحوال الأم في الميراث، الأخوات لأب وأم أحوالهن في الميراث، ج:6، ص:233،236، ط: دار الكتاب الإسلامي)</span></p><div><p class=""indent"" style=""text-align:left;""><span class=""ar_writing"">فقط والله أعلم</span></p></div></p>",144508102046,banuri,"('فرائض', 'faraez')","('میراث کا بیان', 'meeraas-ka-bayan')","('میراث کا حکم', 'meeraas-ka-hukum')"
