issued_at,link,title,question,answer,fatwa_number,dar_ul_ifta,kitab,bab,fasal
16-09-2019,https://www.banuri.edu.pk/readquestion/قرآنی-آیات-والی-انگوٹھی-پہن-کر-بیت-الخلاء-جانا-144012201290/16-09-2019,قرآنی آیات والی انگوٹھی پہن کر بیت الخلا جانا,منقش انگوٹھی جس پر حروفِ  مقطعات یا آیاتِ  قرآنیہ مکتوب ہوں اوراس پرشیشہ چڑھاہواہو تو کیا اس کو پہن کر بیت الخلا جاسکتے ہیں?,"<p><p style=""text-align:justify;"">صورتِ  مسئولہ میں اگر مذکورہ انگوٹھی میں  قرآن کی آیات اور اللہ کا نام نظر آتا ہو،  تو اس کو پہن کر بیت الخلا میں جانا مکروہ ہے، حدیثِ  مبارک  میں آتا ہے کہ آپ ﷺ جب قضائے حاجت کے لیے تشریف لے جاتے تو اپنی انگوٹھی اتار لیتے تھے، اس لیے اس کا نقش ’’محمد رسول اللہ‘‘  تھا۔ لہذا مذکورہ انگوٹھی اتار کر بیت الخلا  میں جائیں یا اس کو  جیب میں یا کپڑے وغیرہ میں چھپاکر جائیں۔ </p><p style=""text-align:justify;""><span class=""ar_writing"">"" (قوله: ويكره الدخول للخلاء ومعه شيء مكتوب الخ)؛ لما روى أبو داود والترمذي عن أنس قال: كان رسول الله صلى الله عليه وسلم إذا دخل الخلاء نزع خاتمه: أي؛ لأن نقشه محمد رسول الله. قال الطيبي: فيه دليل على وجوب تنحية المستنجي اسم الله تعالى واسم رسوله والقرآن اهـ وقال الأبهري: وكذا سائر الرسل اهـ وقال ابن حجر: استفيد منه أنه يندب لمريد التبرز أن ينحى كل ما عليه معظم من اسم الله تعالى أو نبي أو ملك، فإن خالف كره؛ لترك التعظيم اهـ وهو الموافق لمذهبنا كما في شرح المشكاة. قال بعض الحذاق: ومنه يعلم كراهة استعمال نحو إبريق في خلاء مكتوب عليه شيء من ذلك اهـ وطشت تغسل فيه الأيدي، ثم محل الكراهة إن لم يكن مستوراً، فإن كان في جيبه؛ فإنه حينئذٍ لا بأس به. وفي القهستاني عن المنية: الأفضل أن لا يدخل الخلاء وفي كمه مصحف إلا إذا اضطر، ونرجو أن لا يأثم بلا اضطرار اهـ وأقره الحموي. وفي الحلبي: الخاتم المكتوب فيه شيء من ذلك إذا جعل فصه إلى باطن كفه، قيل: لا يكره، والتحرز أولى"". ( حاشية الطحطاوي على مراقي الفلاح شرح نور الإيضاح (ص: 54) </span>فقط واللہ اعلم</p></p>",144012201290,banuri,"('طہارت', 'taharat')","('نجاست اور اس سے پاکی', 'najasat-aur-us-ki-paki')","('استنجاء، آداب و احکام', 'istinja-or-us-kay-aadab-o-ahkam')"
28-07-2019,https://www.banuri.edu.pk/readquestion/شوہر-کی-غیر-موجودگی-میں-کیا-بیوی-کا-ساس-سسر-کے-ساتھ-رہنا-ضروری-یے/28-07-2019,شوہر کی غیر موجودگی میں کیا بیوی کا ساس سسر کے ساتھ رہنا ضروری یے؟,1- میں دوبئی میں ہوں اور ابھی شادی کو ایک سال اور 4ماہ ہوئے ہیں،  مالی حالات کی وجہ سے واپس دوبئی آنا پڑا ہے،  اب چوں کہ میں دوبئی میں ہوں  تو کیا میری غیر موجودگی میں میری بیوی کو اپنے سسرال میں رہنا چاہیے یا اپنے والدین کے پاس؟  میرا اصرار یہ ہے کہ میرے گھر میں ھی رہے۔2- کیا میں اپنی بیوی کو اپنی ماں اور اپنی بہن کے ساتھ تعلقات کو اچھا یا بہتر کرنے کے لیے اصرار کر سکتا ہوں، خدمت کا نہیں صرف تعلقات گھر کے اچھے ماحول کے لیے؛  کیوں کہ ہم شیرہ شادی شدہ ہیں اور اپنے گھر والی ہیں،  گھر میں اس وقت والدہ اور چھوٹا بھائی ہے، میری بیوی اپنی ماں کے گھر میں رہنا چاہتی ہے،  اور جب میں اپنی ماں اور بہن کے ساتھ تعلقات بہتر بنانے کا بولتا ہوں تو محترمہ بولتی ہیں کہ آپ اپنے رشتوں کو خود دیکھیں۔  براہِ  مہربانی راہ نمائی فرمائیں!,"<p><p style=""text-align:justify;"">1۔  صورتِ مسئولہ میں بیوی کو شوہر کی غیر موجودگی میں شوہر کے گھر میں ہی رہنا چاہیے ( بشرطیکہ اس کو اپنی عزت  یا جان کا خطرہ نہ ہو)،  کیوں کہ شادی کے بعد یہی اس کا گھر ہے، تاہم اگر وہ اپنے ماں باپ کے گھر میں رہنا چاہتی ہو تو شوہر کی اجازت سے رہ سکتی ہے، اخلاقی اعتبار سے ساتھ سسر کی خدمت کرنی چاہیے، اور حسن سلوک کرنا چاہیے۔</p><p style=""text-align:justify;"">2۔ ساس سسر کے ساتھ حسنِ  سلوک معاشرتی احکامات میں سے ہے، لہذا بیوی کو بھی اپنے ساس سسر کو ماں باپ کا درجہ دینا چاہیے، اور ساس سسر کی بھی اخلاقی ذمہ داری ہے کہ وہ اپنی بہو کو بیٹی کا درجہ دیں، پس جس طرح  شوہر کی اخلاقی ذمہ داری ہے کہ وہ بیوی کے رشتہ داروں کے ساتھ حسنِ سلوک کرے، بالکل اسی طرح سے بیوی کی بھی ذمہ داری ہے کہ وہ شوہر  کے رشتہ داروں خصوصاً ماں باپ کے ساتھ حسن سلوک کا رویہ رکھے ۔ فقط واللہ اعلم</p></p>",144010201191,banuri,"('حقوق و آدابِ معاشرت', 'huqooq-muashret')","('حقوق', 'bahmi-huqooq')","('میاں ، بیوی کے حقوق', 'mian-biwi-k-huqooq')"
07-09-2019,https://www.banuri.edu.pk/readquestion/ادا-اور-قضاء-نماز-144012201065/07-09-2019,ادا اور قضا نماز,آج  کل نمازظہر کاوقت 12:21 سے شروع ہوتا ہے اور نماز عصر4:50پر شروع ہوتا ہے تو نمازِ  ظہر کس وقت تک دا ہوگی؟  اور کس وقت سے قضا شمار ہوگی؟,"<p><p style=""text-align:justify;"">اگر کسی مستند جدید نقشہ کے مطابق نمازِ  ظہر کا وقت  4:50 پر ختم ہوتا ہے تو  جو شخص اس سے پہلے پہلے اپنی ظہر کی نماز مکمل کرلے تو اس کی نماز ادا شمار ہوگی اور جو اس کے بعد ظہر کی نماز  پڑھے اس کی نماز  قضا  شمار ہوگی۔ فقط واللہ اعلم</p></p>",144012201065,banuri,"('نماز', 'salat')","('فوت شدہ نمازوں کی قضا', 'fout-shuda-namazon-ki-qaza')","('قضاء نمازوں کا بیان', 'qaza-namazon-ka-bayan')"
22-08-2019,https://www.banuri.edu.pk/readquestion/خطبہ-میں-خلفاء-کے-اسماء-گرامی/22-08-2019,خطبہ میں خلفاء اربعہ کے تذکرہ کا آغاز کب سے ہوا؟,جمعہ کے دن خطبے میں ائمہ کرام جو خلفاءراشدین  رض کے اسماء لیتے ہیں یہ کب سے ہے؟ صحابہ کرام کے دور سے ہے یا تابعین کے دور سے ؟,"<p><p style=""text-align:justify;"">جمعہ کے خطبے میں  خلفاءِ راشدین رضی اللہ عنہم کا تذکرہ تابعی جلیل حضرت عمر بن عبد العزیز رحمہ اللہ کے دور (یعنی دورِ تابعین)سے چلا آرہا ہے، حضرت عمر بن عبدا لعزیز رحمہ اللہ جمعہ کے خطبے میں چاروں خلفاء کے نام لیتے تھے، اور اس کی وجہ یہ تھی کہ اس دور میں روافض کی جانب سے حضرات شیخین وحضرت عثمان رضی اللہ عنہم  پر طعن وتشنیع کا سسلسلہ شروع ہوگیا تھا،  اس کے ازالے کے لیے خلیفہ راشد حضرت عمر بن عبدالعزیز رحمہ اللہ نے مسلمانوں کے بڑے اجتماع میں خلفاء  کی عظمت دلوں میں بٹھانے کے لیے ان کا تذکرہ خیر شروع فرمایا تھا۔ اس موضوع پر علامہ ابن تیمیہ رحمہ اللہ نے اپنی کتاب منہاج السنہ النبویہ میں  کلام فرمایا ہے، نیز علامہ ابن امیر الحاج مالکی رحمہ اللہ نےبھی المدخل میں اختصار کے ساتھ  یہی بات ذکر فرمائی ہے، تفصیل کے لیے ان کتب کا مطالعہ فرمائیے۔ فقط واللہ اعلم </p></p>",144012200603,banuri,"('تاریخ و سیر', 'tareekh-o-siyar')","('تاریخ', 'tareekh')","('تاریخِ اسلام', 'tareekh-e-Islam')"
24-05-2019,https://www.banuri.edu.pk/readquestion/سوال-نامکمل-5/24-05-2019,الکحل ڈینٹ کا حکم,الکوحل ڈینٹ حرام یا حلال؟,"<p><p style=""text-align:justify;"">ہمیں دست یاب معلومات کے مطابق ڈینٹ سے مراد  ایک کیمیکل ہے جو الکوحل میں  ملاتے ہیں ، اس میں ایک خاص بو ہوتی ہے، اس کی وجہ سے وہ پینے کے قابل نہیں رہتا، اور یہ کیمیل کاسمیٹیکس وغیرہ کے آئٹم میں استعمال ہوتاہے۔نیزجلانے کے لیے بھی استعمال ہوتاہے، اور زیادہ بدبو دار اور زہریلا قسم کا ہوتاہے۔</p><p style=""text-align:justify;"">نیزالکحل کی دو قسمیں ہیں: (1) ایک وہ جو منقیٰ، انگور، یا کھجور کی شراب سےحاصل کی گئی ہو،  یہ بالاتفاق ناپاک  وحرام ہے،لہذا اس قسم کے الکحل میں ڈینٹ کا شامل  ہو تو اس کا استعمال اور اس کی خرید و فروخت ناجائز ہے.<br/>
(2) دوسری قسم الکحل کی  وہ ہے جو مذکورہ  بالا اشیاء کے علاوہ کسی اور چیز مثلاً جو، آلو، شہد، گنا، سبزی وغیرہ سے حاصل کی گئی ہو، اس قسم کے الکحل میں ڈینٹ شامل ہو بشرطیکہ ڈینٹ حلال اشیاء سے حاصل شدہ ہوتو اس کا استعمال اور اس کی خریدوفروخت جائز ہے بشر ط یہ کہ نشہ آور نہ ہو۔</p><p style=""text-align:justify;"">اگر سوال کا مقصد اس کے علاوہ ہےتو تفصیل اور جن اجزاء سے الکحل ڈینٹ کشید کیاجاتاہے ان کی تفصیل لکھ کر دبارہ دریافت کرلیں۔یاکسی حلال تصدیقی مستند ادارے سے اس سلسلہ میں رابطہ کرلیں۔فقط واللہ اعلم</p></p>",144008201447,banuri,"('حظر و اباحت', 'mamnooaat-mubahat')","('ماکولات / مشروبات', 'makoolat-mashroobat')","('کھانے پینے کی حلال و حرام ، مکروہ و مباح اشیاء', 'khanay-penay-ki-halal-o-haram-makroh-o-mubah-ashya')"
12-10-2019,https://www.banuri.edu.pk/readquestion/چشمہ-پہن-کر-نماز-ادا-کرنا-144012201812/12-10-2019,چشمہ پہن کر نماز ادا کرنا,چشمہ پہن کر نماز پڑھنا کیسا ہے؟  مع دلائل وجزئیات جواب عنایت  فرمائیں!,"<p><p style=""text-align:justify;"">چشمہ پہن کر نماز ادا کرنا بلا کراہت جائز ہے، تاہم سجدہ کرتے ہوئے ناک زمین پر لگانی ہوگی، چشمہ کی وجہ سے اٹھائے رکھنے کی اجازت نہیں۔</p><p style=""text-align:justify;"">امداد الفتاوی میں ہے:</p><p style=""text-align:justify;"">’’نماز میں عینک لگانے کا حکم:</p><p style=""text-align:justify;"">سوال<span class=""ar_writing"">(۳٦۱):</span> قدیم <span class=""ar_writing"">۱/٤۳۹</span>- حالت نماز میں عینک لگائے رکھنا جائز ہے یا نہیں؟  تقدیرِ  ثانی کراہتِ  تنزیہی ہے یا تحریمی؟  فقہائے متقدمین میں سے کسی نے اس مسئلہ کی تصریح کی ہے یا نہیں؟  بینواتوجروا؟</p><p style=""text-align:justify;"">الجواب : عینک لگانے کی عادت مستحدث (نئی) ہے؛ اس لیے امید نہیں کہ کسی کے کلام میں اس کی تصریح ملے،  مگر قواعد سے یہ جواب ہے کہ فی نفسہ جائز ہے،  لیکن فعلِ  عبث ہے، اور عبث نماز میں مکروہ ہے،  اس عارض کے سبب یہ فعل مکروہ ہوگا‘‘۔</p><p style=""text-align:justify;"">  حاشیہ میں مفتی سعید احمد پالن پوری صاحب تحریر کنندہ ہیں:</p><p style=""text-align:justify;"">’’البتہ جو لوگ عینک کے عادی ہیں، یعنی بینائی کی کم زوری کی وجہ سے ’’نمبری عینک‘‘ لگاتے ہیں ؛ چوں کہ انہیں بغیر عینک کے طمانینت و سکون نہیں رہتا؛ اس  لیے ان کے  لیے یہ فعل عبث نہیں ہے، اور مکروہ نہ ہوگا۔ ۱۲ سعید احمد پالن پوری‘‘.</p><p style=""text-align:justify;"">نیز حاشیہ میں مفتی شبیر احمد قاسمی صاحب لکھتے ہیں:</p><p style=""text-align:justify;"">’’نظر والا چشمہ اور عینک کو علی الاطلاق فعلِ عبث نہیں کہاجاسکتا؛ کیوں کہ جن لوگوں کی نگاہ کم زور ہیں،  ان کے  لیے فعلِ  عبث کہنا مشکل ہے؛ اس  لیے کہ بہت سے لوگ عینک اور چشمہ لگائے بغیر کچھ بھی نہیں کرسکتے؛ لہٰذا حضرتِ  والا تھانوی علیہ الرحمہ نے قواعد کے پیش نظر جو حکم تحریر فرمایا ہے، وہی اصل اور وہی زیادہ صحیح ہے کہ فی نفسہ جائز ہے، ہاں البتہ اگر شوقیہ طور پر محض زینت کے  لیے عینک لگا رکھاہے، جس میں نظر کی کمی کوئی پر یشانی نہیں ہے تو اگرچہ قواعد سے فی نفسہ جائز ہے؛ لیکن اس کی وجہ سے اگر سجدہ صحیح طور پر نہیں ہوتا ہے، تو کراہت آجائے گی اور اگر سجدہ میں کسی قسم کی پریشانی نہیں ہے تو اس کے ساتھ نماز بلا کراہت جائز ہے۔ <span class=""ar_writing"">""وکمال السنة في السجود وضع الجبهة والأنف جمیعًا ولو وضع أحدهما إن کان من عذر لایکره"". (الهندیة، کتاب الصلاة، الباب الرابع في صفة الصلاة، قدیم زکریا ۱/۷۰</span>، جدید زکریا ۱/۱۲۷)</p><p style=""text-align:justify;""><span class=""ar_writing"">""ویسجد علی أنفه وجبهته هذا هو السنة وإن وضع جبهته وحدها دون الأنف جاز وکذا لو وضع أنفه و بالجبهة عذر فإنه یجوز ولایکره"". (الجوهرة النیرة، کتاب الصلاة، باب صفة الصلاة، مکتبه دار الکتاب دیوبند ۱ / ٦۳) شبیر أحمد قاسمي عفا اﷲ عنه"". </span>( امداد الفتاوی جدید مطول حاشیہ، ٢ / ٢٦٥ - ٢٦٦، ط: زکریا بک ڈپو انڈیا) فقط واللہ اعلم</p></p>",144012201812,banuri,"('نماز', 'salat')","('مکروہاتِ نماز', 'makrohat-e-namaz')","('مکروہات نماز', 'makrohat-e-namaz')"
15-06-2019,https://www.banuri.edu.pk/readquestion/مردوں-کو-سرخ-رنگ-پہننا-144010200105/15-06-2019,مردوں کو سرخ رنگ پہننا,مردوں کا سرخ رنگ  پہننا جائز ہے؟  اس کے ساتھ اور کوئی رنگ منع ہے؟,"<p><p style=""text-align:justify;"">مردوں کے لیے لباس سے متعلق ضابطہ یہ ہے کہ وہ ایسا لباس پہنیں جس لباس میں فاسقوں اور کافروں سے مشابہت نہ  ہو، اور نہ وہ زنانہ لباس کی طرح ہو، اسی طرح وہ کسم یا زعفران سے رنگا ہوا بھی نہ ہو۔  مردوں کے  لیے خالص سرخ رنگ کا لباس  (جس میں دوسرا بالکل نہ ہو) پہننے کی ممانعت بعض روایات میں آئی ہے، اس ممانعت کی حیثیت کے حوالے سے فقہاءِ کرام کے مختلف اقوال ہیں؛ بہرحال خالص سرخ رنگ میں عورتوں سے مشابہت بھی ہے،  اس  لیے اس کا مکروہ ہونا راجح ہے، لہٰذا مردوں کو  خالص سرخ رنگ کا لباس  استعمال کرنے سے اجتناب کرنا چاہیے۔ البتہ اگر اس میں کسی اور رنگ کی آمیزش ہو یا وہ دھاری دھار ہو تو مضائقہ نہیں ہے۔ نیز بہت زیادہ شوخ رنگ  اور اعتدال سے زیادہ کڑھائی اور سنگھار والے کپڑے ، ایسے ہی تمام شوخ رنگ جو خاص کر عورتیں ہی استعمال کرتی ہیں مردوں  کے لیے مکمل لباس اس رنگ کا پہننا درست نہیں ۔ </p><p style=""text-align:justify;""> </p><p style=""text-align:justify;""><span class=""ar_writing"">الدر المختار وحاشية ابن عابدين (رد المحتار) (6/ 358):<br/>
""(وكره لبس المعصفر والمزعفر الأحمر والأصفر للرجال) مفاده أنه لايكره للنساء (ولا بأس بسائر الألوان) وفي المجتبى والقهستاني وشرح النقاية لأبي المكارم: لا بأس بلبس الثوب الأحمر اهـ.<br/>
ومفاده أن الكراهة تنزيهية، لكن صرح في التحفة بالحرمة؛ فأفاد أنها تحريمية وهي المحمل عند الإطلاق قاله المصنف. قلت: وللشرنبلالي فيه رسالة نقل فيها ثمانية أقوال منها: أنه مستحب.</span></p><p style=""text-align:justify;""><span class=""ar_writing"">(قوله: لا بأس بلبس الثوب الأحمر) وقد روي ذلك عن الإمام كما في الملتقط اهـ ط (قوله: ومفاده أن الكراهة تنزيهية)؛ لأن كلمة ""لا بأس"" تستعمل غالباً فيما تركه أولى، منح .(قوله: في التحفة) أي تحفة الملوك، منح. (قوله: فأفاد أنها تحريم إلخ) هذا مسلم لو لم يعارضه تصريح غيره بخلافه، ففي جامع الفتاوى: قال أبو حنيفة والشافعي ومالك: يجوز لبس المعصفر، وقال جماعة من العلماء: مكروه بكراهة التنزيه، وفي منتخب الفتاوى: قال صاحب الروضة: يجوز للرجال والنساء لبس الثوب الأحمر والأخضر بلا كراهة. وفي الحاوي الزاهدي: يكره للرجال لبس المعصفر والمزعفر والمورس والمحمر: أي الأحمر حريراً كان أو غيره إذا كان في صبغه دم وإلا فلا، ونقله عن عدة كتب، وفي مجمع الفتاوى: لبس الأحمر مكروه، وعند البعض لايكره، وقيل: يكره إذا صبغ بالأحمر القاني؛ لأنه خلط بالنجس. وفي الواقعات مثله. ولو صبغ بالشجر البقم لايكره. ولو صبغ بقشر الجوز عسلياً لايكره لبسه إجماعاً اهـ فهذه النقول مع ما ذكره عن المجتبى والقهستاني وشرح أبي المكارم تعارض القول بكراهة التحريم إن لم يدع التوفيق بحمل التحريم على المصبوغ أو بالنجس أو نحو ذلك، (قوله: وللشرنبلالي فيه رسالة) سماها ""تحفة الأكمل والهمام المصدر لبيان جواز لبس الأحمر""، وقد ذكر فيها كثيراً من النقول، منها ما قدمناه، وقال: لم نجد نصاً قطعياً لإثبات الحرمة، ووجدنا النهي عن لبسه لعلة قامت بالفاعل من تشبه بالنساء أو بالأعاجم أو التكبر، وبانتفاء العلة تزول الكراهة بإخلاص النية لإظهار نعمة الله تعالى، وعروض الكراهة للصبغ بالنجس تزول بغسله، ووجدنا نص الإمام الأعظم على الجواز ودليلاً قطعياً على الإباحة، وهو إطلاق الأمر بأخذ الزينة، ووجدنا في الصحيحين موجبه، وبه تنتفي الحرمة والكراهة بل يثبت الاستحباب اقتداءً بالنبي صلى الله عليه وسلم اهـ ومن أراد الزيادة على ذلك فعليه بها. أقول: ولكن جل الكتب على الكراهة كالسراج والمحيط والاختيار والمنتقى والذخيرة وغيرها، وبه أفتى العلامة قاسم. وفي الحاوي الزاهدي: ولايكره في الرأس إجماعاً، (قوله: ثمانية أقوال) نقلها عن القسطلاني، (قوله: منها أنه مستحب) هذا ذكره الشرنبلالي بحثاً كما قدمناه، وليس من الثمانية"". </span> فقط واللہ اعلم</p></p>",144010200105,banuri,"('متفرق کتب', 'mutafarriq-kutub')","('متفرق ابواب', 'mutafarriq-abwab')","('متفرق فصول', 'mutafarriq-fusool')"
