issued_at,link,title,question,answer,fatwa_number,dar_ul_ifta,kitab,bab,fasal
31-07-2019,https://www.banuri.edu.pk/readquestion/حرز-ابی-دجانہ-کی-تعویذ-پہنے-بیت-الخلاء-جانا/31-07-2019,حرز ابی دجانہ کا تعویذ پہنے بیت الخلا جانا,جو خط جنات کے شر سے محفوظ رہنے کے لیے مُحَمَّد ﷺ نے ابودجانہ رضی اللہ عنہ کے لیے لکھوایا تھا،  اس کو اپنے پاس کیا ہر وقت رکھ سکتا ہے، چاہے واش روم میں بھی کسی تعویذ کی شکل میں بھی؟,"<p><p style=""text-align:justify;"">اگر دینی کلمات  تعویذ کی شکل میں (موم جامہ کیے ہوئے) محفوظ ہوں تو اس صورت بیت الخلا  جانے میں حرج نہیں۔<span class=""ar_writing"">مجمع الأنهر في شرح ملتقي الأبحر</span>میں ہے:</p><p style=""text-align:justify;""><span class=""ar_writing"">""وَكَذَا دُخُولُ الْخَلَاءِ وَفِي إصْبَعِهِ خَاتَمٌ فِيهِ شَيْءٌ مِنْ الْقُرْآنِ أَوْ مِنْ أَسْمَاءِ اللَّهِ تَعَالَى؛ لِمَا فِيهِ مِنْ تَرْكِ التَّعْظِيمِ، وَقِيلَ: لَا تُكْرَهُ إنْ جَعَلَ فَصَّهُ إلَى بَاطِنِ الْكَفِّ، وَلَوْ كَانَ مَا فِيهِ شَيْءٌ مِنْ الْقُرْآنِ أَوْ مِنْ أَسْمَاءِ اللَّهِ تَعَالَى فِي جَيْبِهِ لَا بَأْسَ بِهِ، وَكَذَا لَوْ كَانَ مَلْفُوفًا فِي شَيْءٍ لَكِنَّ التَّحَرُّزَ أَوْلَى"". ( ١ / ٢٦)</span></p><p style=""text-align:justify;""><span class=""ar_writing"">مراقي الفلاح</span> میں ہے:</p><p style=""text-align:justify;""><span class=""ar_writing"">""ويكره الدخول للخلاء ومعه شيء مكتوب فيه اسم الله أو قرآن ونهي عن كشف"".</span></p><p style=""text-align:justify;""><span class=""ar_writing"">حاشية الطحطاوي على المراقي</span> میں ہے:</p><p style=""text-align:justify;""><span class=""ar_writing"">""ويكره الدخول للخلاء ومعه شيء مكتوب الخ""؛ لما روى أبو داود والترمذي عن أنس قال: كان رسول الله صلى الله عليه وسلم إذا دخل الخلاء نزع خاتمه أي لأن نقشه محمد رسول الله، قال الطيبي: فيه دليل على وجوب تنحية المستنجي اسم الله تعالى واسم رسوله والقرآن اهـ وقال الأبهري: وكذا سائر الرسل اهـ وقال ابن حجر: استفيد منه أنه يندب لمريد التبرز أن ينحي كل ما عليه معظم من اسم الله تعالى أو نبي أو ملك، فإن خالف كره؛ لترك التعظيم اهـ وهو الموافق لمذهبنا كما في شرح المشكاة، قال بعض الحذاق: ومنه يعلم كراهة استعمال نحو ابريق في خلاء مكتوب عليه شيء من ذلك اهـ وطشت تغسل فيه الأيدي، ثم محل الكراهة إن لم يكن مستوراً، فإن كان في جيبه فإنه حينئذ لا بأس به، وفي القهستاني عن المنية: الأفضل أن لايدخل الخلاء وفي كمه مصحف إلا إذا اضطر، ونرجو أن لايأثم بلا اضطرار اهـ"". ( ١ / ٥٤) </span>فقط واللہ اعلم</p></p>",144010201266,banuri,"('طہارت', 'taharat')","('نجاست اور اس سے پاکی', 'najasat-aur-us-ki-paki')","('استنجاء، آداب و احکام', 'istinja-or-us-kay-aadab-o-ahkam')"
22-12-2018,https://www.banuri.edu.pk/readquestion/رضاعی-بیٹے-کا-میراث-میں-سے-حصہ/22-12-2018,رضاعی بیٹے کا میراث میں سے حصہ,میرے بیٹے نے مدت  رضاعت میں میری  والدہ  کا دودھ  پیا، اب وہ میرا بیٹا اور میرا رضاعی بھائی  بھی ہوا،  معلوم یہ کرنا تھا کہ  کیاحقیقی بیٹوں کے ہوتے ہوئے وہ  میرےوالدین کی جائیدادکاوارث ہوگا؟ اگرہوگا تو اس کا کیاحصہ ہوگا؟,"<p><p style=""text-align:justify;"">میراث کا حق نسبی رشتہ میں ہوتا ہے، رضاعی رشتہ سے کوئی شخص میراث کا حق دار نہیں ہوتا،  لہذا آپ کے بیٹے کے لیے اپنی رضاعی ماں (یعنی آپ والدہ اور اس  کی دادی) کی میراث میں کوئی حق وحصہ نہیں ہوگا۔ فقط واللہ اعلم</p></p>",144004200223,banuri,"('معاملات', 'muamlat')","('وراثت / وصیت', 'wirasat-wasyat')","('استحقاق اور عدم استحقاق وراثت', 'istehqaq-or-adm-istehqaq-wirasat')"
29-11-2018,https://www.banuri.edu.pk/readquestion/مسجدکی-پرانی-دریاں-صفیں-مدرسہ-میں-دینا-2/29-11-2018,مسجد کی پرانی دریاں (صفیں) مدرسے میں دینا,مسجدکی پرانی دریاں( صفیں )مدرسہ میں دےسکتےہیں،  جب کہ نہ کسی مسجدکوضرورت ہے اورنہ کوئی خریدتاہے؟  جواب باحوالہ چاہیے!,"<p><p style=""text-align:justify;"">مسجدکے مملوکہ آلات اگر شکستہ یا پرانےہوکر ناقابلِ  انتفاع ہوجائیں یا مسجد کی ضرورت سے زیادہ ہوں تو انہیں فروخت کرکے اسی مسجد کے مصارف میں استعمال کیا جائے گا،اگر اس مسجد کو فی الحال یا مستقبل قریب میں ضرورت نہ ہو تو قریب ترین مسجد میں رقم خرچ کی جائےگی، مسجد کمیٹی کے لیے بذاتِ  خود مدرسہ میں دینا جائز نہ ہوگا، البتہ اگر ان اشیاء کا فروخت ہونا ممکن نہ ہو اور ان اشیاء کے ضائع ہوجانے کا قوی امکان ہو تو ایسی صورت میں امام محمد رحمہ اللہ کے قول کے مطابق وہ واقف کی ملکیت میں دے دی جائیں اور واقف اپنی ملکیت میں لینے کے بعد وہ چاہے تو مدرسہ میں دے دے ۔</p><p style=""text-align:justify;""> توضیح:مسجد کے مملوکہ آلات وہ ہیں جو مسجد کی آمدنی سے خریدے گئے ہوں یا بطور عطیہ وچندہ کسی نے مسجد کےلیے دیے ہوں جیسے دریاں،لوٹے،کرسیاں وغیرہ۔</p><p style=""text-align:justify;""><span class=""ar_writing"">حاشية رد المحتار على الدر المختار - (4 / 359):<br/>
"" (قوله: ومثله حشيش المسجد الخ ) أي الحشيش الذي يفرش بدل الحصر كما يفعل في بعض البلاد كبلاد الصعيد كما أخبرني به بعضهم، قال الزيلعي: وعلى هذا حصير المسجد وحشيشه إذا استغنى عنهما يرجع إلى مالكه عند محمد، وعند أبي يوسف ينقل إلى مسجد آخر، وعلى هذا الخلاف الرباط والبئر إذا لم ينتفع بهما ا هـ وصرح في الخانية بأن الفتوى على قول محمد، قال في البحر: وبه علم أن الفتوى على قول محمد في آلات المسجد، وعلى قول أبي يوسف في تأبيد المسجد ا هـ والمراد بآلات المسجد نحو القنديل والحصير بخلاف أنقاضه لما قدمنا عنه قريباً من أن الفتوى على أن المسجد لايعود ميراثاً ولايجوز نقله ونقل ماله إلى مسجد آخر"". (شامي ٤/ ٣٥٩)  فقط والله اعلم</span></p></p>",144003200304,banuri,"('نماز', 'salat')","('مسجد کے آداب و احکام', 'masjid-k-aadab-o-ahkaam')","('مسجد کے آداب و احکام', 'masjid-k-aadab-o-ahkam')"
05-07-2019,https://www.banuri.edu.pk/readquestion/بازان-کے-معنی/05-07-2019,بازان کا معنی,’’بازان‘‘  کے کیا معنی ہیں؟ کچھ  علماء کہتے ہیں کہ ’’بازان‘‘  ایک صحابی تھے، آپ  کیا کہتے ہیں؟,"<p><p style=""margin-left:0;margin-right:0;text-align:justify;"">’’باز‘‘ (ز کے ساتھ)  ایک پرندے کا نام ہے، اسی سے ’’بازان‘‘ ہے، نیز بعض حضرات کے بقول یہ فارسی زبان کا لفظ ہے، بہرکیف!کسی صحابی کانام ہونا تلاش بسیار کے باوجود ہمیں نہیں مل سکا۔</p><p style=""margin-left:0;margin-right:0;text-align:justify;""><span class=""ar_writing"">مغني المحتاج إلى معرفة ألفاظ المنهاج</span> میں ہے :</p><p style=""margin-left:0;margin-right:0;text-align:justify;""><span class=""ar_writing"">""نَحْوِ ( بَازٍ ) مِنْ أَشَدِّ الْحَيَوَانِ وَأَضْيَقِهِ خَلْقًا ، وَهُوَ مُذَكَّرٌ ، وَيُقَالُ فِي التَّثْنِيَةِ بَازَانِ ، وَفِي الْجَمْعِ بُزَاةٌ"". (18/183)</span></p><p style=""margin-left:0;margin-right:0;text-align:justify;"">البتہ ’’باذان‘‘  حرف ’’ذ‘‘ کے ساتھ ، ایک تابعی کا نام ہے،  نیز سیرت کی کتب میں  ہے کہ  فارس کے بادشاہ کسریٰ کی جانب سے یمن کے  جوگورنر مقرر تھے ان کانام بھی ’’باذان‘‘  تھا،اور رسول اللہ ﷺکے خط مبارک کے ملنے پر یہ اسلام لے آئے تھے،  اور اپنے اسلام کی اطلاع بھی رسول کریم ﷺکو بھجوائی تھی، لیکن  ان کارسول اللہ ﷺکی زیارت کرنا ثابت نہیں ہے۔</p><p style=""margin-left:0;margin-right:0;text-align:justify;"">تفسیرقرطبی میں ہے :</p><p style=""margin-left:0;margin-right:0;text-align:justify;""><span class=""ar_writing"">""اسمه باذام، وقيل: باذان، بمعجمة بين ألفين. يروي عن علي وابن عباس ومولاته ام هاني، كما في تهذيب التهذيب."" (1/36)</span></p><p style=""margin-left:0;margin-right:0;text-align:justify;"">سنن ترمذی میں ایک روایت کی سندکے تحت امام ترمذی رحمہ اللہ لکھتے ہیں :</p><p style=""margin-left:0;margin-right:0;text-align:justify;""><span class=""ar_writing"">""و أبو صالح هذا هو مولى أم هانئ بنت أبي طالب واسمه باذان ويقال باذام أيضاً"". (2/136)</span></p><p style=""margin-left:0;margin-right:0;text-align:justify;"">الاصابہ فی تمییزالصحابہ میں ہے :</p><p style=""margin-left:0;margin-right:0;text-align:justify;""><span class=""ar_writing"">""بعث النبي صلى الله عليه و سلم عبد الله بن حذافة إلى كسرى بكتابه يدعوه إلى الإسلام فلما قراه شقق كتابه ثم كتب إلى عامله على اليمن باذان أن ابعث إلى هذا الرجل برجلين جلدين فليأتياني به فبعث باذان قهرمانة بأبويه وكان كاتباً حاسباً وبعث معه رجلاً من الفرس يقال له: خسرة إلى النبي صلى الله عليه و سلم يأمره أن ينصرف معهما إلى كسرى وقال لبابويه: ويلك انظر إلى الرجل ما هو وائتني بخبره فقدما الطائف ثم قدما المدينة فكلمه بأبويه إن شاهنشاه كسرى كتب إلى الملك باذان يأمره أن يبعث إليه من يأتيه بك فإن اجبت كتبت معك ما ينفعك عنده وإن أبيت فإنه مهلكك ومهلك قومك ومخرب بلادك فقال لهما ارجعا حتى تأتياني غدا فأوحي إلى النبي صلى الله عليه و سلم أن الله سلط على كسرى ولده فقتله في ساعة كذا من ليلة كذا من شهر كذا فلما اصبحا أخبرهما بذلك فقالا: نكتب بذلك عنك إلى باذان قال: نعم وقولا له: إن أسلمت أقرك على ملكك ثم أعطي خسرة منطقة فيها ذهب وفضة فرجعا إلى باذان فأخبراه الخبر فقال: ما هذا بكلام ملك ولئن كان ما قال حقاً فإنه لنبي مرسل فلم يلبث أن قدم عليه كتاب شيرويه يخبره بقتل كسرى ويامره بأخذ الطاعة ممن قبله ولايتعرض للرجل الذي كتب إليك كسرى في أمره قال: فأسلم باذان وأسلمت الأبناء من فارس ممن كان منهم باليمن وكان بأبويه قد قال لباذان ما علمت أحدا كان أهيب عندي منه.... باذان آخره نون ويقال ميم الفارسي من الأبناء الذي بعثهم كسرى إلى اليمن وكان ملك اليمن في زمانه وأسلم باذان لما هلك كسرى وبعث بإسلامه إلى النبي صلى الله عليه و سلم فاستعمله على بلاده ثم مات فاستعمل ابنه شهر بن باذان على بعض عمله ذكر ذلك بن إسحاق وابن هشام والواقدي والطبري وذكره في الصحابة الباوردي وغيره وسيأتي له ذكر في ترجمة جد جميرة في حرف الجيم واخباره مذكورة في التاريخ والسير قال الثعلبي: هو أول من أسلم من ملوك العجم وأول من أمر في الإسلام على اليمن وقال الفاكهي: حدثنا يحيى بن أبي طالب حدثنا علي بن عاصم حدثنا داود عن الشعبي قال: كتب النبي صلى الله عليه و سلم إلى كسرى فمزق كتابه وكتب إلى باذان أرسل إليه من يأمره بالرجوع إلى دين قومه فإن أبي فقاتله فذكر الحديث وفيه قال: فخرج باذان من اليمن إلى النبي صلى الله عليه و سلم فلحقه العنسي الكذاب فقتله"". (1/338)</span></p><p style=""margin-left:0;margin-right:0;text-align:justify;"">البدایہ والنھایہ میں ہے :</p><p style=""margin-left:0;margin-right:0;text-align:justify;""><span class=""ar_writing"">""وفي بعض الروايات: أن رسول الله صلى الله عليه وسلم قال لرسول باذان: إن ربي قد قتل الليلة ربك فكان كما قال رسول الله صلى الله عليه وسلم قتل تلك الليلة بعينها، قتله بنوه لظلمه بعد عدله بعدما خلعوه وولوا ابنه شيرويه فلم يعش بعد قتله أباه إلا ستة أشهر أو دونها. وفي هذا يقول خالد بن حق الشيباني:</span></p><p style=""margin-left:0;margin-right:0;text-align:justify;""><span class=""ar_writing"">وكسرى إذ تقسمه بنوه * بأسياف كما اقتسم اللحام تمخضت المنون له بيوم * ألا ولكل حاملة تمام</span></p><p style=""margin-left:0;margin-right:0;text-align:justify;""><span class=""ar_writing"">قال الزهري: فلما بلغ ذلك باذان بعث بإسلامه وإسلام من معه من الفرس إلى رسول الله صلى الله عليه وسلم"". (2/226)</span> فقط واللہ اعلم</p></p>",144010200599,banuri,"('حقوق و آدابِ معاشرت', 'huqooq-muashret')","('حقوق', 'bahmi-huqooq')","('اولاد کے حقوق', 'olad-ky-hoqoq')"
25-12-2018,https://www.banuri.edu.pk/readquestion/وتر-میں-دعائے-قنوت-کے-بجائے-اللہم-اغفرلی-پڑھنا-2/25-12-2018,وتر میں دعائے قنوت کے بجائے اللہم اغفرلی  پڑھنا,اگر کسی کو پوری دعائے قنوت یاد ہو،  لیکن پھر بھی وہ نمازِ  وتر میں دعائے قنوت کے بجائے 3 مرتبہ’’اللهم اغفرلي‘‘پڑھتا ہو تو اس کا واجب ادا ہو جائے گا یانہیں؟,"<p><p style=""text-align:justify;"">دعائے قنوت متعین طور پر اس دعا کا نام نہیں ہے جو مشہور ہے؛ بلکہ وتر کی تیسری رکعت میں جو بھی دعا پڑھی جائے اس کو دعائے قنوت کہا جائے گا؛ البتہ <span class=""ar_writing"">’’اللهم إنا نستعینک...‘‘ الخ</span>پڑھنا زیادہ بہتر اور اولیٰ ہے، تاہم  <span class=""ar_writing"">’’اللهم اغفرلي‘‘ </span> پڑھنے سے بھی واجب ادا ہوجائےگا۔ جیساکہ فتاوی ہندیہ میں ہے:</p><p style=""text-align:justify;""><span class=""ar_writing"">’’وليس في القنوت دعاء مؤقت، كذا في التبيين. و الأولي أن يقرأ : اللّهم إنا نستعينك و يقرأ بعده اللّهم اهدنا فيمن هديت. و من لم يحسن القنوت يقول: ""ربنا آتنا في الدنيا حسنة وفي الآخرة حسنة و قنا غذاب النار""، كذا في المحيط. أو يقول: اللّهم اغفرلنا، و يكرر ذلك ثلاثاً، وهو اختيار أبي الليث، كذا في السراجية‘‘. (الباب الثامن في صلاة الوتر، ١/ ١١١، ط: رشيدية) </span> فقط واللہ اعلم </p></p>",144004200274,banuri,"('نماز', 'salat')","('سنن و نوافل', 'nawafil')","('سنن و نوافل', 'sunan-o-nawafi')"
04-11-2018,https://www.banuri.edu.pk/readquestion/طلاق-بائن-کے-بعد-نیا-نکاح/04-11-2018,طلاق بائن کے بعد نیا نکاح,میری بیوی کے بار بار طلاق کے مطالبے پر میں نے ایک طلاقِ  بائن دے دی ہے۔ کیا اس صورت میں وہ اپنی عدت پوری کر کے دوسری شادی کر سکتی ہے؟ اگر میری بیوی کو میرے ساتھ دوبارہ رہنا ہے تو کس صورت میں میرے ساتھ حلال طریقے سے دوبارہ رہ سکتی ہے؟,"<p><p style=""text-align:justify;"">ایک طلاقِ  بائن کے بعد مطلقہ اپنی عدت گزار کر کسی اور سے نکاح کرسکتی ہے، اور اگر دوبارہ  آ پ  کے ساتھ رہنا چاہے تو نئے مہر کے ساتھ نیا نکاح کرکے ساتھ رہ سکتی ہے، اس صورت میں آپ کو دو طلاقوں کا اختیار باقی ہوگا۔ فقط واللہ اعلم</p></p>",144001200853,banuri,"('طلاق', 'talaaq')","('رجوع', 'rujoo')","('رجوع', 'rujoo')"
24-07-2019,https://www.banuri.edu.pk/readquestion/زانی-کا-مزنیہ-سے-بچہ-ہونے-کے-بعد-نکاح-کرنے-سے-کیا-ولد-الزنا-کا-نسب-اس-سے-ثابت-ہوجائے-گا-144010201070/24-07-2019,زانی کا مزنیہ سے بچہ ہونے کے بعد نکاح کرنے سے کیا ولد الزنا کا نسب اس سے ثابت ہوجائے گا؟,زید نے ہندہ   (جو کہ بکر کے نکاح میں تھی) سے زنا کیا،  جس سے ثریا  پیدا ہوئی اور کسی وجہ سے یقین ہو گیا کہ  وہ زید ہی کی بیٹی ہے۔ اس کے  کچھ  ماہ  بعد  فرقان  نے ماریہ کو طلاق دے دی۔ پھر ماریہ نے عدت کے بعد زید سے شادی کرلی، جب کہ ابھی ثریا چند ماہ کی تھی، تو کیا اب:1-  زیدثریا  کو اپنا نام دے سکتا ہے؟ مطلب بے فارم وغیرہ میں باپ کی جگہ اپنا نام ڈلوا کر ثریا  کو اپنی شناخت دے سکتا ہے؟2- کیا ثریا  زید کی بیٹی کے طور پر وارث بن سکتی ہے؟3- کیا ثریا  کے لیے زید محرم ہے؟,"<p><p style=""margin-left:0;margin-right:0;text-align:justify;"">1) چوں کہ ثریا  کی پیدائش کے وقت ثریا  کی ماں (ہندہ) زید کے نکاح میں نہیں تھی، اس لیے ثریا  کا نسب زید سے ثابت نہیں ہوا،  لہٰذا اب زید کے لیے ثریا کو کسی بھی قسم کے کاغذات میں اپنا نام بطورِ  والد کے دینا یا لکھوانا جائز نہیں ہے، البتہ زید ثریا  کے کاغذات میں اپنا نام بطورِ  سرپرست لکھوا سکتا ہے۔</p><p style=""margin-left:0;margin-right:0;text-align:justify;"">۲)ثریا  کا نسب چوں کہ زید سے ثابت نہیں ہے؛  اس لیے ثریا زید کی وارث نہیں بن سکتی ہے۔</p><p style=""margin-left:0;margin-right:0;text-align:justify;"">۳) زید  چوں کہ ثریا  کی والدہ کا شوہر بن چکا ہے،  اس  لیے اب زید ثریا  کے  لیے محرم ہے۔ فقط واللہ اعلم</p></p>",144010201070,banuri,"('طلاق', 'talaaq')","('ثبوت النسب', 'suboot-e-nasab')","('ثبوت نسب', 'subot-e-nasab')"
12-10-2019,https://www.banuri.edu.pk/readquestion/بڑی-عمر-والے-شخص-کو-نماز-کی-دعوت-دینا-144012201810/12-10-2019,بڑی عمر والے شخص کو نماز کی دعوت دینا,ہم اپنے والدین، بڑے بھائی یا اپنے سے کسی بڑے کو نماز کی دعوت کس طرح اور کس انداز میں دیں؟,"<p><p style=""margin-left:0;margin-right:0;text-align:justify;"">والدین، بڑے بھائی یا کسی بڑے شخص  کے بارے میں اگر یقین ہو کہ یہ نماز نہیں پڑھتے تو انہیں نماز کی دعوت دی جائے، لیکن موقع محل دیکھ کر دعوت دی جائے ، کسی کے سامنے انہیں نماز کا کہنا مناسب نہیں،  اسی طرح   دعوت میں حکمت و بصیرت  اور نرم الفاظ سے کام لیا جائے۔ انہیں حضرت شیخ الحدیث مولانا محمد زکریا کاندہلوی رحمہ اللہ کی کتاب  ’’فضائلِ اعمال‘‘ کے مطالعہ کی ترغیب دی جائے، یا گھر میں اس کی تعلیم کا سلسلہ شروع کردیا جائے۔ فقط واللہ اعلم</p></p>",144012201810,banuri,"('علوم و فنون', 'uloom-funoon')","('امر بالمعروف و نہی عن المنکر', 'tableegh-tadrees')","('مروجہ تبلیغ کا حکم', 'murawwaja-tabligh-ka-hukum')"
02-10-2019,https://www.banuri.edu.pk/readquestion/علم-حاصل-کرو-خواہ-چین-جانا-پڑے-کی-تحقیق-144012201456/02-10-2019,علم حاصل کرو اگرچہ چین تک جانا پڑے,علم حاصل کروچاہے چین جاناپڑے۔ یہ الفاظ واقعی حدیث کے ہیں؟ اگر ہیں تو مہربانی کرکے پوری تفصیل سے آگاہ کریں!,"<p><p style=""margin-left:0;margin-right:0;text-align:justify;"">یہ روایت ان الفاظ کے ساتھ  کتابوں میں ملتی ہے: <span class=""ar_writing"">""اطلبوا العلم ولو بالصین"".</span>  یعنی ""علم حاصل کرو اگرچہ تمہیں چین جانا پڑے"". اور اسے امام بیہقی رحمہ اللہ نے ""شعب الایمان"" میں اور خطیب بغدادی رحمہ اللہ نے ""کتاب الرحلۃ"" میں اپنی سندوں کے ساتھ حضرت انس رضی اللہ عنہ سے مرفوعاّ ذکر کیا ہے، لیکن اکابر محدثین نے ان سندوں کو ضعیف قرار دیا ہے، چنانچہ امام ابن حبان رحمہ اللہ نے اس کو باطل قرار دیا ہے  اور امام ابنِ  جوزی رحمہما اللہ نے موضوع روایات سے متعلق اپنی کتاب میں اس روایت کو بھی ذکر کیا ہے، اس لیے محدثین کے بیان کردہ قواعد کی روشنی میں اس حدیث کو بیان کرنا درست نہیں. یاد رہے کہ بعض اہلِ علم نے تاریخی واقعات وقرائن سے اس روایت کی تائید پیش کرکے اسے حدیث ثابت کرنے کی کوشش کی ہے، لیکن محدثین کے ہاں جب سنداً روایت کا ثبوت نہ ہو تو خارجی قرائن سے وہ ثابت قرار نہیں پاتی. مزید تفصیل کے لیے دیکھیں:</p><p style=""margin-left:0;margin-right:0;text-align:justify;""><span class=""ar_writing"">1- المقاصد الحسنة للسخاوي</span></p><p style=""margin-left:0;margin-right:0;text-align:justify;""><span class=""ar_writing"">2- کشف الخفاء للعجلوني</span></p><p style=""margin-left:0;margin-right:0;text-align:justify;""><span class=""ar_writing"">3- الموضوعات لابن الجوزي.</span> فقط واللہ اعلم</p></p>",144012201456,banuri,"('علوم و فنون', 'uloom-funoon')","('حدیث و سنت', 'hadees-sunnat')","('حدیث کا معنی، مفہوم اور اقسام', 'hadees-ka-mana-mafhom-aur-aqsaam')"
