link,title,question_html,answer_html,issued_at,fatwa_number,dar_ul_ifta,category_lvl_1,category_lvl_2,category_lvl_3,html_container
https://www.banuri.edu.pk/readquestion/kufria-alfaz-pr-mushtamil-gana-sunna-tujh-me-apna-rab-dikhta-hy-keh-na-144505101062/02-12-2023,کفریہ الفاظ پر مشتمل گانا سننا / تجھ میں اپنا رب دکھتا ہے کہنا,"<p><p style=""text-align:justify;"">ایک گانا ہے جس میں محبوب اپنی محبوبہ کی تعریف کرتے ہوئے اپنا سب کچھ اپنی محبوبہ کو ہی مان لیتا ہے، حتیٰ کہ اپنی جنت بھی اپنی محبوبہ کو ہی مان لیتا ہےاور پھر اس کے بعد کچھ الفاظ بولتا ہے جو کہ مندرجہ ذیل ہیں: ""تجھ میں رب دکھتا ہے"" تو میرا سوال یہ ہے کہ کیا اس طرح کے الفاظ سننے سے انسان کافر ہو جاتا ہے اور اگر یہ الفاظ بولے جائیں تو کیا بندہ کافر ہو جائے گا جب کہ یہ نیت نہ ہو ۔ براہ کرم وضاحت فرما دیں۔</p></p>","<hr class=""big-hr""/>",02-12-2023,144505101062,banuri.edu.pk,ایمان و عقائد,کفر و شرک اور ان کے احکام,کفریہ و شرکیہ الفاظ,"<div class=""col-md-12 sawal-jawab""><h3 class=""question_heading"">سوال</h3><p><p style=""text-align:justify;"">ایک گانا ہے جس میں محبوب اپنی محبوبہ کی تعریف کرتے ہوئے اپنا سب کچھ اپنی محبوبہ کو ہی مان لیتا ہے، حتیٰ کہ اپنی جنت بھی اپنی محبوبہ کو ہی مان لیتا ہےاور پھر اس کے بعد کچھ الفاظ بولتا ہے جو کہ مندرجہ ذیل ہیں: ""تجھ میں رب دکھتا ہے"" تو میرا سوال یہ ہے کہ کیا اس طرح کے الفاظ سننے سے انسان کافر ہو جاتا ہے اور اگر یہ الفاظ بولے جائیں تو کیا بندہ کافر ہو جائے گا جب کہ یہ نیت نہ ہو ۔ براہ کرم وضاحت فرما دیں۔</p></p><h4 class=""question_heading"">جواب</h4><p><p style=""text-align:justify;"">واضح رہے کہ گانا گانا اور اس کو سننا دونوں  حرام ہیں ،ایک حدیث میں اللہ کے نبی صلی اللہ علیہ و سلم کا ارشاد ہے،جس کا مفہوم یہ ہے کہ  گانا نفاق کو اس طرح پیدا کرتا ہے جس طرح پانی کھیتی کو،چہ جائیکہ ایسے گانے گانا یا سننا جو شرکیہ یا موہم شرک ہوں ،لہذا اس گناہ سے توبہ کرنی چاہئے۔</p><p style=""text-align:justify;"">صورت مسئولہ میں سوال میں ذکر کردہ شعر میں اگر چہ تاویل ہوسکتی ہے ،اس لیے کہ رب عربی   زبان کا لفظ ہے ،اس کے معنی مالک اور صاحب کے بھی   آتے ہیں ،اور  اس میں اس معنی  کا بھی احتمال ہے  کہ تجھ میں رب کی صنعت اور کاریگری دکھتی ہے، اس لیے اس کے گانے یا سننے سے کوئی کافر نہیں ہوگا ۔</p><p style=""text-align:justify;"">باقی  الفاظ کا ظاہر  چونکہ  موہم ِ کفر ہے ،اس لئے  کہ رب  جب بھی مطلق بولا جاتا ہے تو اس کا اطلاق باری تعالی پر ہی ہوتا ہے،مزید یہ کہ  اس میں مذہبی اصطلاحات کو عشق بازی کے لیے استعمال کیا گیا ہے،لہذا اس قسم کے اشعار پڑھنے   سے  اجتناب کرنا لازم ہے۔</p><p dir=""rtl"" style=""text-align:justify;""><span lang=""ar-sa"" xml:lang=""ar-sa"">مشکاۃ المصابیح میں ہے:</span></p><p class=""indent"" dir=""rtl"" style=""text-align:justify;""><span class=""ar_writing"">"" و عن جابر قال: قال رسول الله صلى الله عليه وسلم: «الغناء ينبت النفاق في القلب كما ينبت الماء الزرع» . رواه البيهقي في «شعب الإيمان.""</span></p><p class=""indent"" dir=""rtl"" style=""text-align:left;"">(کتاب الاداب ،باب البیان و الشعر الفصل الثالث جلد۳ ص: ۱۳۵۵  ط: المکتب الاسلامی ،بیروت) </p><p style=""text-align:justify;"">فتاوی شامی میں ہے :</p><p class=""indent"" style=""text-align:justify;""><span class=""ar_writing"">""قلت: وفي البزازية: استماع صوت الملاهي كضرب قصب ونحوه حرام لقوله - عليه الصلاة والسلام - «استماع الملاهي معصية والجلوس عليها فسق والتلذذ بها كفر» أي بالنعمة فصرف الجوارح إلى غير ما خلق لأجله كفر بالنعمة لا شكر فالواجب كل الواجب أن يجتنب كي لا يسمع</span></p><p class=""indent"" style=""text-align:justify;""><span class=""ar_writing"">(قوله فسق) أي خروج عن الطاعة ولا يخفى أن في الجلوس عليها استماعا لها والاستماع معصية فهما معصيتان"".</span></p><p class=""indent"" style=""text-align:left;"">(کتاب الحظر والاباحۃ،ج:6،ص:349،سعید)</p><p style=""text-align:justify;"">البحر الرائق شرح کنز الدقائق میں ہے :</p><p class=""indent"" style=""text-align:justify;""><span class=""ar_writing"">""وفي الخلاصة وغيرها إذا كان في المسألة وجوه توجب التكفير ووجه واحد يمنع التكفير فعلى المفتي أن يميل إلى الوجه الذي يمنع التكفير تحسينا للظن بالمسلم زاد في البزازية إلا إذا صرح بإرادة موجب الكفر فلا ينفعه التأويل حينئذ وفي التتارخانية لا يكفر بالمحتمل لأن الكفر نهاية في العقوبة فيستدعي نهاية في الجناية ومع الاحتمال لا نهاية اهـ.</span></p><p class=""indent"" style=""text-align:justify;""><span class=""ar_writing"">والحاصل أن من تكلم بكلمة الكفر هازلا أو لاعبا كفر عند الكل ولا اعتبار باعتقاده كما صرح به قاضي خان في فتاويه ومن تكلم بها مخطئا أو مكرها لا يكفر عند الكل ومن تكلم بها عالما عامدا كفر عند الكل ومن تكلم بها اختيارا جاهلا بأنها كفر ففيه اختلاف والذي تحرر أنه لا يفتى بتكفير مسلم أمكن حمل كلامه على محمل حسن أو كان في كفره اختلاف ولو رواية ضعيفة فعلى هذا فأكثر ألفاظ التكفير المذكورة لا يفتى بالتكفير بها ولقد ألزمت نفسي أن لا أفتي بشيء منها.""</span></p><p class=""indent"" style=""text-align:left;"">(کتاب السیر،باب احکام المرتدین،ج5،ص134،المکتب الاسلامی)</p><p>کفایت المفتی میں  ایک سوال کے جواب میں ہے:</p><p class=""indent"" style=""text-align:justify;"">’’شعراء کے کلام میں اس قسم کی باتیں بکثرت ہوتی ہیں اور یہ مبالغہ میں ہمیشہ حدود و اعتدال سے گزرجاتے ہیں ۔۔پیغمبر اسرار کہنے سے کفر عائد نہیں کیا جائے گاکیونکہ اسرار سے اسرار الہیہ مراد نہیں ہیں بلکہ اسرار کلام یا اسرار عشق و محبت یا اسرار فصاحت  وبلاغت مراد ہوسکتے ہیں ۔اسی طرح تہذیب کا پروردگار یعنی رب التہذیب با الاضافۃ ایسا ہے جیسے رب الغنم  رب المال وغیرہ۔ساقی کوثر بدوش ان تمام الفاظ میں زیادہ سخت ہےمگر شاعر کے لئے<span class=""qr_writing"">وَٱلشُّعَرَآءُ يَتَّبِعُهُمُ ٱلۡغَاوُۥنَ  أَلَمۡ تَرَ أَنَّهُمۡ فِي كُلِّ وَادٖ يَهِيمُونَ وَأَنَّهُمۡ يَقُولُونَ مَا لَا يَفۡعَلُونَ</span> کے تمغے رکھنے کے بعد یہ باتیں مستبعد نہیں۔‘‘</p><p class=""indent"" style=""text-align:left;"">(ج:1،ص:370 ،ط:دار الاشاعت کراچی)</p><p class=""indent"" style=""text-align:left;"">فقط واللہ اعلم</p></p><hr class=""big-hr""/><div class=""col-sm-6 col-md-6""><p class=""question_heading"" style=""color:#73161f"">فتوی نمبر : <a id=""fatwa_number"">144505101062</a></p></div><div class=""col-sm-6 col-md-6""><p style=""color:#73161f"">دارالافتاء :
                                جامعہ علوم اسلامیہ علامہ محمد یوسف بنوری ٹاؤن</p></div><hr class=""big-hr""/><div class=""col-sm-4 col-md-4""><div class=""tag""><a href=""https://www.banuri.edu.pk/questions/kitab/aqaed""><i class=""icon-docs-bold""></i> ایمان و عقائد</a></div></div><div class=""col-sm-4 col-md-4""><div class=""tag""><a href=""https://www.banuri.edu.pk/questions/bab/kufr-o-shirk-aur-un-k-ahkam""><i class=""icon-docs-bold""></i> کفر و شرک اور ان کے احکام</a></div></div><div class=""col-sm-4 col-md-4""><div class=""tag""><a href=""https://www.banuri.edu.pk/questions/fasal/kufriya-o-shirkiya-alfaaz""><i class=""icon-docs-bold""></i> کفریہ و شرکیہ الفاظ</a></div></div></div>"
https://www.banuri.edu.pk/readquestion/urat-ka-nikah-quran-majeed-say-karana-144505101131/03-12-2023,عورت کا نکاح  قرآن مجید سے کرانا,"<p><p style=""text-align:justify;"">پاکستان کے گاؤں دیہات وغیرہ، علاقوں میں اگر لڑکی کی عمر زیادہ ہو جائے، اور اس کی شادی نہ ہوتی ہو ،اور شادی کی امید بھی باقی نہ رہے ،تو اس لڑکی کی شادی قرآن مجید سے کر دی جاتی ہے ، اس کی کیا حقیقت ہے ؟ کیا اس طرح کرنا قرآن مجید کی بے حرمتی نہیں ہے ؟ کیا اس طرح کرنے سے لڑکی شادی شدہ بن جائے گی ؟ </p></p>","<p><p style=""text-align:justify;"">واضح رہے کہ لڑکی کی عمر زیادہ ہونے کی صورت میں اور  نکاح سے مایوس ہونے کی صورت میں لڑکی کا نکاح قرآن پاک سے کرانا،ایک ناجائز اور جہالت پر مبنی عمل ہے،اس کی کوئی حقیقت نہیں ،اس سے اجتناب ضروری ہے، نکاح ایک بندھن کا نام ہے ،جس میں لڑکا لڑکی ایجاب وقبول کرتے ہیں،اور قرآن پاک اللہ جل شانہ  کاپاک کلام ہے،وہ نکاح وغیرہ کا متحمل نہیں،او ر اس میں قرآن مجید  کی بے حرمتی بھی ہے،نیز اس طرح نکاح سے لڑکی قرآن مجید کی منکوحہ نہیں بنتی ،اور لڑکی نکاح کرنے میں آزاد ہے ۔فقط واللہ اعلم</p></p><hr class=""big-hr""/>",03-12-2023,144505101131,banuri.edu.pk,حظر و اباحت,متفرقات,متفرقات ممنوعات و مباحات,"<div class=""col-md-12 sawal-jawab""><h3 class=""question_heading"">سوال</h3><p><p style=""text-align:justify;"">پاکستان کے گاؤں دیہات وغیرہ، علاقوں میں اگر لڑکی کی عمر زیادہ ہو جائے، اور اس کی شادی نہ ہوتی ہو ،اور شادی کی امید بھی باقی نہ رہے ،تو اس لڑکی کی شادی قرآن مجید سے کر دی جاتی ہے ، اس کی کیا حقیقت ہے ؟ کیا اس طرح کرنا قرآن مجید کی بے حرمتی نہیں ہے ؟ کیا اس طرح کرنے سے لڑکی شادی شدہ بن جائے گی ؟ </p></p><h4 class=""question_heading"">جواب</h4><p><p style=""text-align:justify;"">واضح رہے کہ لڑکی کی عمر زیادہ ہونے کی صورت میں اور  نکاح سے مایوس ہونے کی صورت میں لڑکی کا نکاح قرآن پاک سے کرانا،ایک ناجائز اور جہالت پر مبنی عمل ہے،اس کی کوئی حقیقت نہیں ،اس سے اجتناب ضروری ہے، نکاح ایک بندھن کا نام ہے ،جس میں لڑکا لڑکی ایجاب وقبول کرتے ہیں،اور قرآن پاک اللہ جل شانہ  کاپاک کلام ہے،وہ نکاح وغیرہ کا متحمل نہیں،او ر اس میں قرآن مجید  کی بے حرمتی بھی ہے،نیز اس طرح نکاح سے لڑکی قرآن مجید کی منکوحہ نہیں بنتی ،اور لڑکی نکاح کرنے میں آزاد ہے ۔فقط واللہ اعلم</p></p><hr class=""big-hr""/><div class=""col-sm-6 col-md-6""><p class=""question_heading"" style=""color:#73161f"">فتوی نمبر : <a id=""fatwa_number"">144505101131</a></p></div><div class=""col-sm-6 col-md-6""><p style=""color:#73161f"">دارالافتاء :
                                جامعہ علوم اسلامیہ علامہ محمد یوسف بنوری ٹاؤن</p></div><hr class=""big-hr""/><div class=""col-sm-4 col-md-4""><div class=""tag""><a href=""https://www.banuri.edu.pk/questions/kitab/mamnooaat-mubahat""><i class=""icon-docs-bold""></i> حظر و اباحت</a></div></div><div class=""col-sm-4 col-md-4""><div class=""tag""><a href=""https://www.banuri.edu.pk/questions/bab/mutafarriqaat""><i class=""icon-docs-bold""></i> متفرقات</a></div></div><div class=""col-sm-4 col-md-4""><div class=""tag""><a href=""https://www.banuri.edu.pk/questions/fasal/muatafarriqaat-e-mamnooaat-o-mubahaat""><i class=""icon-docs-bold""></i> متفرقات ممنوعات و مباحات</a></div></div></div>"
