link,title,question_html,answer_html,issued_at,fatwa_number,dar_ul_ifta,category_lvl_1,category_lvl_2,category_lvl_3,html_container
https://www.banuri.edu.pk/readquestion/kaya-chakoor-ka-goshat-aur-indee-halal-hain-144511100285/12-05-2024,کیا چکورکا گوشت اور انڈے حلال ہیں؟,"<p><p style=""text-align:justify;"">چکور کا گوشت اور انڈے حلال ہیں یا حرام ہیں؟</p></p>","<p><p style=""text-align:justify;"">چکور کا گوشت اور انڈے حلال ہیں۔</p><p><span class=""ar_writing"">بذل المجهود في حل سنن أبي داود</span> میں ہے:</p><p class=""indent"" style=""text-align:justify;""><span class=""ar_writing"">1849- حدثنا محمد بن كثير، حدثنا سليمان بن كثير، عن حميد الطويل، عن إسحاق بن عبد الله بن الحارث، عن أبيه - وكان الحارث خليفة عثمان رضي الله عنه على الطائف - فصنع لعثمان طعاما فيه من الحجل واليعاقيب ولحم الوحش ، فبعث إلى على رضي الله عنه فجاءه الرسول وهو يخبط لأباعر له، فجاء وهو ينفض الخبط عن يده، فقالوا له: كل، فقال: أطعموه قوما حلالا فإنا حرم.فقال على - رضى الله عنه -: أنشد الله من كان ها هنا من أشجع، أتعلمون أن رسول الله صلى الله عليه وسلم أهدى إليه رجل حمار وحش، وهو محرم، فأبى أن يأكله؟ قالوا: نعم"". </span></p><p class=""indent"" style=""text-align:justify;""><span class=""ar_writing"">(فيه) أي في الطعام (من الحجل) وهو طائر معروف (واليعاقيب) جمع يعقوب، وهو ذكر الحجل، يقال له بالفارسية: كبك، وفي الهندية: جكور.""</span></p><p class=""indent"" style=""text-align:left;""><span class=""ar_writing"">(کتاب المناسک، باب لحم الصيد للمحرم، ج:5، ص:51، ط:دار الفکر)</span></p><p class=""indent"" style=""text-align:left;""><span class=""ar_writing"">فقط واللہ أعلم</span></p></p><hr class=""big-hr""/>",12-05-2024,144511100285,banuri.edu.pk,حظر و اباحت,ماکولات / مشروبات,کھانے پینے کی حلال و حرام ، مکروہ و مباح اشیاء,"<div class=""col-md-12 sawal-jawab""><h3 class=""question_heading"">سوال</h3><p><p style=""text-align:justify;"">چکور کا گوشت اور انڈے حلال ہیں یا حرام ہیں؟</p></p><h4 class=""question_heading"">جواب</h4><p><p style=""text-align:justify;"">چکور کا گوشت اور انڈے حلال ہیں۔</p><p><span class=""ar_writing"">بذل المجهود في حل سنن أبي داود</span> میں ہے:</p><p class=""indent"" style=""text-align:justify;""><span class=""ar_writing"">1849- حدثنا محمد بن كثير، حدثنا سليمان بن كثير، عن حميد الطويل، عن إسحاق بن عبد الله بن الحارث، عن أبيه - وكان الحارث خليفة عثمان رضي الله عنه على الطائف - فصنع لعثمان طعاما فيه من الحجل واليعاقيب ولحم الوحش ، فبعث إلى على رضي الله عنه فجاءه الرسول وهو يخبط لأباعر له، فجاء وهو ينفض الخبط عن يده، فقالوا له: كل، فقال: أطعموه قوما حلالا فإنا حرم.فقال على - رضى الله عنه -: أنشد الله من كان ها هنا من أشجع، أتعلمون أن رسول الله صلى الله عليه وسلم أهدى إليه رجل حمار وحش، وهو محرم، فأبى أن يأكله؟ قالوا: نعم"". </span></p><p class=""indent"" style=""text-align:justify;""><span class=""ar_writing"">(فيه) أي في الطعام (من الحجل) وهو طائر معروف (واليعاقيب) جمع يعقوب، وهو ذكر الحجل، يقال له بالفارسية: كبك، وفي الهندية: جكور.""</span></p><p class=""indent"" style=""text-align:left;""><span class=""ar_writing"">(کتاب المناسک، باب لحم الصيد للمحرم، ج:5، ص:51، ط:دار الفکر)</span></p><p class=""indent"" style=""text-align:left;""><span class=""ar_writing"">فقط واللہ أعلم</span></p></p><hr class=""big-hr""/><div class=""col-sm-6 col-md-6""><p class=""question_heading"" style=""color:#73161f"">فتوی نمبر : <a id=""fatwa_number"">144511100285</a></p></div><div class=""col-sm-6 col-md-6""><p style=""color:#73161f"">دارالافتاء :
                                جامعہ علوم اسلامیہ علامہ محمد یوسف بنوری ٹاؤن</p></div><hr class=""big-hr""/><div class=""col-sm-4 col-md-4""><div class=""tag""><a href=""https://www.banuri.edu.pk/questions/kitab/mamnooaat-mubahat""><i class=""icon-docs-bold""></i> حظر و اباحت</a></div></div><div class=""col-sm-4 col-md-4""><div class=""tag""><a href=""https://www.banuri.edu.pk/questions/bab/makoolat-mashroobat""><i class=""icon-docs-bold""></i> ماکولات / مشروبات</a></div></div><div class=""col-sm-4 col-md-4""><div class=""tag""><a href=""https://www.banuri.edu.pk/questions/fasal/khanay-penay-ki-halal-o-haram-makroh-o-mubah-ashya""><i class=""icon-docs-bold""></i> کھانے پینے کی حلال و حرام ، مکروہ و مباح اشیاء</a></div></div></div>"
https://www.banuri.edu.pk/readquestion/al-kul-wali-musnat-ka-istamal-ka-hukum-144510101554/01-05-2024,الکحل والی مصنوعات کا بیرونی جلد پر استعمال کا حکم,"<p><p style=""text-align:justify;"">کیا ایسے سیرم اور لوشن چہرے یا ہاتھوں پر لگانا جائز ہے جن کے بارے میں آپ کو شک ہو کہ اس میں گلسرین یا الکوحل پر مبنی اجزاء شامل ہیں۔ کیا ان اجزا ءوالی مصنوعات کا بیرونی جلد پر بھی استعمال جائز نہیں؟ </p></p>","<p><p style=""text-align:justify;"">واضح رہے کہ الکحل کی تین قسمیں ہیں:</p><p class=""indent"" style=""text-align:justify;"">(1) ایک وہ الکحل جو منقیٰ، انگور،کشمش یا کھجور  سےحاصل کی گیا ہو،  یہ بالاتفاق ناپاک  وحرام ہے، اور اس کا داخلی وخارجی استعمال اور اس کی خرید و فروخت ناجائز ہے۔</p><p class=""indent"" style=""text-align:justify;"">(2) دوسرا وہ الکحل جو مذکورہ  بالا اشیاء کے علاوہ کسی اور چیز مثلاً جَو، آلو، شہد، گنا، سبزی وغیرہ سے حاصل کی گئی ہو۔</p><p class=""indent"" style=""text-align:justify;"">(3) تیسری قسم وہ الکحل ہے جو کیمیکل سے بنتا ہے،آخری دونوں قسموں کا استعمال اور اس کی خریدوفروخت جائز ہے بشر ط یہ کہ نشہ آور نہ ہواور یہ پاک ہے ۔</p><p style=""text-align:justify;"">لہذا صورت ِ مسئولہ میں اگر ہاتھ، چہرے اور جسم  پر استعمال کی جانے والی مصنوعات (face products)  میں پہلی قسم کی الکحل شامل ہو جوکہ حرام ہے، تو اس صورت میں ایسی مصنوعات کا استعمال جائز نہیں ہوگا، اور اگر ان مصنوعات میں دوسری اور تیسری قسم کی الکحل شامل ہوں ، تو ایسی مصنوعات کا خارجی استعمال جائز ہوگا۔ </p><p style=""text-align:justify;"">البتہ عام طور پر فیس واش،   باڈی اسپرے اور پرفیوم وغیرہ میں جو الکحل استعمال ہوتی ہے وہ عام طور پر  انگوریا کھجور وغیرہ سے حاصل نہیں کی جاتی، بلکہ  دیگر اشیاء سے بنائی جاتی ہے، لہذا  کسی چیز  کے بارے میں جب تک  تحقیق سے ثابت  نہ ہوجائے کہ اس  میں  پہلی قسم (منقیٰ، انگور، یا کھجور کی شراب )سے حاصل شدہ الکحل ہے ، اس وقت تک اس کے استعمال کو  ناجائز اور حرام نہیں کہا جائے گا، تاہم اگر احتیاط پر عمل کرتے ہوئے اس سے بھی اجتناب کیا جائے تو یہ زیادہ بہتر ہے۔</p><p style=""text-align:right;"">تکملہ فتح الملہم میں ہے:</p><p class=""indent"" style=""text-align:justify;""><span class=""ar_writing"">""و أما غير الأشربة الأربعة، فليست نجسة عند الإمام ابي حنيفة رحمه الله تعالي. و بهذا يتبين حكم الكحول المسكرة (Alcohals) التي عمت بها البلوي اليوم، فإنها تستعمل في كثير من الأدوية و العطور و المركبات الأخري، فإنها إن اتخذت من العنب أو التمر فلا سبيل الي حلتها أو طهارتها، و إن اتخذت من غيرهما فالأمر فيها سهل علي مذهب أبي حنيفة رحمه الله تعالي، و لايحرم استعمالها للتداوي أو لأغراض مباحة أخري ما لم تبلغ حد الإسكار، لأنها إنما تستعمل مركبةً مع المواد الأخري، ولايحكم بنجاستها أخذًا بقول أبي حنيفة رحمه الله.</span></p><p class=""indent"" style=""text-align:justify;""><span class=""ar_writing"">و إن معظم الحكول التي تستعمل اليوم في الأودية و العطور و غيرهما لاتتخذ من العنب أو التمر، إنما تتخذ من الحبوب أو القشور أو البترول و غيره، كما ذكرنا في باب بيوع الخمر من كتاب البيوع.""</span></p><p class=""indent"" style=""text-align:left;"">(كتاب الأشربة، حکم الکحول المسکرة، ج: ۳، صفحہ: ۵۰۶، ط: دارالعلوم كراتشي)</p><p style=""text-align:right;"">وفيه أيضاً:</p><p class=""indent"" style=""text-align:justify;""><span class=""ar_writing"">""وإنما نبهت علی هذا لأن الکحول المسکرة الیوم صارت تستعمل في معظم الأدوية ولأغراض کیمیاوية أخری ولاتستغنی عنها کثیر من الصناعات الحدیثة، وقد عمت بها البلوی واشتدت إليها الحاجة، والحکم فيها علی قول أبي حنیفة سهل؛ لأنها إن لم تکن مصنوعةً من النئي من ماء العنب فلا یحرم بیعها عنده، والذي یظهر لي أن معظم هذه الکحول لاتصنع من العنب، بل تصنع من غیرها، وراجعت له دائرة  المعارف البریطانیة المطبوعة 1950م (1/544) فوجدت فیها جدولاً للمواد التي تصنع منها هذه الکحول، فذکر في جملتها العسل، والدبس، والحب، والشعیر، والجودار،وعصیرأناناس (التفاح الصوبری)، والسلفات، والکبریتات، ولم یذکر فیه العنب والتمر، فالحاصل أن هذه الکحول لو لم تکن مصنوعةً من العنب والتمر فبیعها للأغراض الکیمیاویة جائز باتفاق بین أبي حنیفة وصاحبیه، وإن کانت مصنوعةً من التمر أو من المطبوخ من عصیر العنب فکذلک عند أبي حنیفة، خلافاً لصاحبیه، ولو کانت مصنوعةً من العنب النئي فبیعها حرام عندهم جمیعاً، والظاهر أن معظم الکحول لا تصنع من عنب ولا تمر، فینبغي أن یجوز بیعها لأغراض مشروعة في قول علماء الحنفیة جمیعاً.""</span></p><p class=""indent"" style=""text-align:left;"">(كتاب الأشربة، حکم الکحول المسکرة، ج: ۱، صفحہ: ۵۵۱، ط: دارالعلوم كراتشي)</p><p style=""text-align:right;"">فتاویٰ شامی میں ہے:</p><p class=""indent"" style=""text-align:justify;""><span class=""ar_writing"">""‌الأصل ‌في ‌الأشياء ‌الإباحة وأن فرض إضراره للبعض لا يلزم منه تحريمه على كل أحد، فإن العسل يضر بأصحاب الصفراء الغالبة وربما أمرضهم مع أنه شفاء بالنص القطعي، وليس الاحتياط في الافتراء على الله تعالى بإثبات الحرمة أو الكراهة اللذين لا بد لهما من دليل بل في القول بالإباحة التي هي الأصل.""</span></p><p class=""indent"" style=""text-align:left;"">(كتاب الأشربة، ج: ۶، صفحہ: ۴۵۹، ط: ایچ، ایم، سعيد)</p><p class=""indent"" style=""text-align:left;"">فقط واللہ اعلم</p></p><hr class=""big-hr""/>",01-05-2024,144510101554,banuri.edu.pk,حظر و اباحت,زیب و زینت,حلال و حرام کریم و لوشن وغیرہ / میک اپ وغیرہ,"<div class=""col-md-12 sawal-jawab""><h3 class=""question_heading"">سوال</h3><p><p style=""text-align:justify;"">کیا ایسے سیرم اور لوشن چہرے یا ہاتھوں پر لگانا جائز ہے جن کے بارے میں آپ کو شک ہو کہ اس میں گلسرین یا الکوحل پر مبنی اجزاء شامل ہیں۔ کیا ان اجزا ءوالی مصنوعات کا بیرونی جلد پر بھی استعمال جائز نہیں؟ </p></p><h4 class=""question_heading"">جواب</h4><p><p style=""text-align:justify;"">واضح رہے کہ الکحل کی تین قسمیں ہیں:</p><p class=""indent"" style=""text-align:justify;"">(1) ایک وہ الکحل جو منقیٰ، انگور،کشمش یا کھجور  سےحاصل کی گیا ہو،  یہ بالاتفاق ناپاک  وحرام ہے، اور اس کا داخلی وخارجی استعمال اور اس کی خرید و فروخت ناجائز ہے۔</p><p class=""indent"" style=""text-align:justify;"">(2) دوسرا وہ الکحل جو مذکورہ  بالا اشیاء کے علاوہ کسی اور چیز مثلاً جَو، آلو، شہد، گنا، سبزی وغیرہ سے حاصل کی گئی ہو۔</p><p class=""indent"" style=""text-align:justify;"">(3) تیسری قسم وہ الکحل ہے جو کیمیکل سے بنتا ہے،آخری دونوں قسموں کا استعمال اور اس کی خریدوفروخت جائز ہے بشر ط یہ کہ نشہ آور نہ ہواور یہ پاک ہے ۔</p><p style=""text-align:justify;"">لہذا صورت ِ مسئولہ میں اگر ہاتھ، چہرے اور جسم  پر استعمال کی جانے والی مصنوعات (face products)  میں پہلی قسم کی الکحل شامل ہو جوکہ حرام ہے، تو اس صورت میں ایسی مصنوعات کا استعمال جائز نہیں ہوگا، اور اگر ان مصنوعات میں دوسری اور تیسری قسم کی الکحل شامل ہوں ، تو ایسی مصنوعات کا خارجی استعمال جائز ہوگا۔ </p><p style=""text-align:justify;"">البتہ عام طور پر فیس واش،   باڈی اسپرے اور پرفیوم وغیرہ میں جو الکحل استعمال ہوتی ہے وہ عام طور پر  انگوریا کھجور وغیرہ سے حاصل نہیں کی جاتی، بلکہ  دیگر اشیاء سے بنائی جاتی ہے، لہذا  کسی چیز  کے بارے میں جب تک  تحقیق سے ثابت  نہ ہوجائے کہ اس  میں  پہلی قسم (منقیٰ، انگور، یا کھجور کی شراب )سے حاصل شدہ الکحل ہے ، اس وقت تک اس کے استعمال کو  ناجائز اور حرام نہیں کہا جائے گا، تاہم اگر احتیاط پر عمل کرتے ہوئے اس سے بھی اجتناب کیا جائے تو یہ زیادہ بہتر ہے۔</p><p style=""text-align:right;"">تکملہ فتح الملہم میں ہے:</p><p class=""indent"" style=""text-align:justify;""><span class=""ar_writing"">""و أما غير الأشربة الأربعة، فليست نجسة عند الإمام ابي حنيفة رحمه الله تعالي. و بهذا يتبين حكم الكحول المسكرة (Alcohals) التي عمت بها البلوي اليوم، فإنها تستعمل في كثير من الأدوية و العطور و المركبات الأخري، فإنها إن اتخذت من العنب أو التمر فلا سبيل الي حلتها أو طهارتها، و إن اتخذت من غيرهما فالأمر فيها سهل علي مذهب أبي حنيفة رحمه الله تعالي، و لايحرم استعمالها للتداوي أو لأغراض مباحة أخري ما لم تبلغ حد الإسكار، لأنها إنما تستعمل مركبةً مع المواد الأخري، ولايحكم بنجاستها أخذًا بقول أبي حنيفة رحمه الله.</span></p><p class=""indent"" style=""text-align:justify;""><span class=""ar_writing"">و إن معظم الحكول التي تستعمل اليوم في الأودية و العطور و غيرهما لاتتخذ من العنب أو التمر، إنما تتخذ من الحبوب أو القشور أو البترول و غيره، كما ذكرنا في باب بيوع الخمر من كتاب البيوع.""</span></p><p class=""indent"" style=""text-align:left;"">(كتاب الأشربة، حکم الکحول المسکرة، ج: ۳، صفحہ: ۵۰۶، ط: دارالعلوم كراتشي)</p><p style=""text-align:right;"">وفيه أيضاً:</p><p class=""indent"" style=""text-align:justify;""><span class=""ar_writing"">""وإنما نبهت علی هذا لأن الکحول المسکرة الیوم صارت تستعمل في معظم الأدوية ولأغراض کیمیاوية أخری ولاتستغنی عنها کثیر من الصناعات الحدیثة، وقد عمت بها البلوی واشتدت إليها الحاجة، والحکم فيها علی قول أبي حنیفة سهل؛ لأنها إن لم تکن مصنوعةً من النئي من ماء العنب فلا یحرم بیعها عنده، والذي یظهر لي أن معظم هذه الکحول لاتصنع من العنب، بل تصنع من غیرها، وراجعت له دائرة  المعارف البریطانیة المطبوعة 1950م (1/544) فوجدت فیها جدولاً للمواد التي تصنع منها هذه الکحول، فذکر في جملتها العسل، والدبس، والحب، والشعیر، والجودار،وعصیرأناناس (التفاح الصوبری)، والسلفات، والکبریتات، ولم یذکر فیه العنب والتمر، فالحاصل أن هذه الکحول لو لم تکن مصنوعةً من العنب والتمر فبیعها للأغراض الکیمیاویة جائز باتفاق بین أبي حنیفة وصاحبیه، وإن کانت مصنوعةً من التمر أو من المطبوخ من عصیر العنب فکذلک عند أبي حنیفة، خلافاً لصاحبیه، ولو کانت مصنوعةً من العنب النئي فبیعها حرام عندهم جمیعاً، والظاهر أن معظم الکحول لا تصنع من عنب ولا تمر، فینبغي أن یجوز بیعها لأغراض مشروعة في قول علماء الحنفیة جمیعاً.""</span></p><p class=""indent"" style=""text-align:left;"">(كتاب الأشربة، حکم الکحول المسکرة، ج: ۱، صفحہ: ۵۵۱، ط: دارالعلوم كراتشي)</p><p style=""text-align:right;"">فتاویٰ شامی میں ہے:</p><p class=""indent"" style=""text-align:justify;""><span class=""ar_writing"">""‌الأصل ‌في ‌الأشياء ‌الإباحة وأن فرض إضراره للبعض لا يلزم منه تحريمه على كل أحد، فإن العسل يضر بأصحاب الصفراء الغالبة وربما أمرضهم مع أنه شفاء بالنص القطعي، وليس الاحتياط في الافتراء على الله تعالى بإثبات الحرمة أو الكراهة اللذين لا بد لهما من دليل بل في القول بالإباحة التي هي الأصل.""</span></p><p class=""indent"" style=""text-align:left;"">(كتاب الأشربة، ج: ۶، صفحہ: ۴۵۹، ط: ایچ، ایم، سعيد)</p><p class=""indent"" style=""text-align:left;"">فقط واللہ اعلم</p></p><hr class=""big-hr""/><div class=""col-sm-6 col-md-6""><p class=""question_heading"" style=""color:#73161f"">فتوی نمبر : <a id=""fatwa_number"">144510101554</a></p></div><div class=""col-sm-6 col-md-6""><p style=""color:#73161f"">دارالافتاء :
                                جامعہ علوم اسلامیہ علامہ محمد یوسف بنوری ٹاؤن</p></div><hr class=""big-hr""/><div class=""col-sm-4 col-md-4""><div class=""tag""><a href=""https://www.banuri.edu.pk/questions/kitab/mamnooaat-mubahat""><i class=""icon-docs-bold""></i> حظر و اباحت</a></div></div><div class=""col-sm-4 col-md-4""><div class=""tag""><a href=""https://www.banuri.edu.pk/questions/bab/zayb-o-zeenat""><i class=""icon-docs-bold""></i> زیب و زینت</a></div></div><div class=""col-sm-4 col-md-4""><div class=""tag""><a href=""https://www.banuri.edu.pk/questions/fasal/halaal-o-haraam-cream-o-lotion-wagera-makeup-wagera""><i class=""icon-docs-bold""></i> حلال و حرام کریم و لوشن وغیرہ / میک اپ وغیرہ</a></div></div></div>"
